results/cuda_gtx1650/bert/xgb/cpu.log_layer_0.log
{"input": ["cuda -keys=cuda,gpu -arch=sm_75 -max_num_threads=1024 -thread_warp_size=32", "batch_matmul.cuda", [["TENSOR", [1, 128, 768], "float32"], ["TENSOR", [1, 768, 768], "float32"], [1, 128, 768], "float32", 0, 0], {}], "config": {"index": 37051, "code_hash": null, "entity": [["tile_y", "sp", [-1, 128, 1]], ["tile_x", "sp", [-1, 1, 16]], ["tile_k", "sp", [-1, 16]], ["auto_unroll_max_step", "ot", 8], ["unroll_explicit", "ot", 0]]}, "result": [[0.0006668505343915344, 0.000668145275132275, 0.0008614400170940171], 0, 4.803060531616211, 1688609459.7148626], "version": 0.2, "tvm_version": "0.13.dev0"}
{"input": ["cuda -keys=cuda,gpu -arch=sm_75 -max_num_threads=1024 -thread_warp_size=32", "batch_matmul.cuda", [["TENSOR", [1, 128, 768], "float32"], ["TENSOR", [1, 768, 768], "float32"], [1, 128, 768], "float32", 0, 0], {}], "config": {"index": 274986, "code_hash": null, "entity": [["tile_y", "sp", [-1, 8, 4]], ["tile_x", "sp", [-1, 2, 12]], ["tile_k", "sp", [-1, 3]], ["auto_unroll_max_step", "ot", 64], ["unroll_explicit", "ot", 0]]}, "result": [[0.0004229666084656085, 0.00042316521428571426, 0.0004232759417989418], 0, 2.0770387649536133, 1688609461.083759], "version": 0.2, "tvm_version": "0.13.dev0"}
{"input": ["cuda -keys=cuda,gpu -arch=sm_75 -max_num_threads=1024 -thread_warp_size=32", "batch_matmul.cuda", [["TENSOR", [1, 128, 768], "float32"], ["TENSOR", [1, 768, 768], "float32"], [1, 128, 768], "float32", 0, 0], {}], "config": {"index": 404724, "code_hash": null, "entity": [["tile_y", "sp", [-1, 16, 2]], ["tile_x", "sp", [-1, 8, 3]], ["tile_k", "sp", [-1, 64]], ["auto_unroll_max_step", "ot", 8], ["unroll_explicit", "ot", 1]]}, "result": [[0.00031404951771653544, 0.00031405146850393707, 0.0003151011122047244], 0, 1.9114224910736084, 1688609462.4494727], "version": 0.2, "tvm_version": "0.13.dev0"}
{"input": ["cuda -keys=cuda,gpu -arch=sm_75 -max_num_threads=1024 -thread_warp_size=32", "batch_matmul.cuda", [["TENSOR", [1, 128, 768], "float32"], ["TENSOR", [1, 768, 768], "float32"], [1, 128, 768], "float32", 0, 0], {}], "config": {"index": 90802, "code_hash": null, "entity": [["tile_y", "sp", [-1, 4, 2]], ["tile_x", "sp", [-1, 24, 16]], ["tile_k", "sp", [-1, 1]], ["auto_unroll_max_step", "ot", 16], ["unroll_explicit", "ot", 0]]}, "result": [[0.001024114593548387, 0.0010245285483870968, 0.0010246612516129033], 0, 1.9021492004394531, 1688609463.809502], "version": 0.2, "tvm_version": "0.13.dev0"}
{"input": ["cuda -keys=cuda,gpu -arch=sm_75 -max_num_threads=1024 -thread_warp_size=32", "batch_matmul.cuda", [["TENSOR", [1, 128, 768], "float32"], ["TENSOR", [1, 768, 768], "float32"], [1, 128, 768], "float32", 0, 0], {}], "config": {"index": 36267, "code_hash": null, "entity": [["tile_y", "sp", [-1, 1, 4]], ["tile_x", "sp", [-1, 32, 6]], ["tile_k", "sp", [-1, 16]], ["auto_unroll_max_step", "ot", 8], ["unroll_explicit", "ot", 0]]}, "result": [[0.00031699050912778904, 0.000317053401622718, 0.00031713124340770785], 0, 1.9359560012817383, 1688609465.1643643], "version": 0.2, "tvm_version": "0.13.dev0"}
{"input": ["cuda -keys=cuda,gpu -arch=sm_75 -max_num_threads=1024 -thread_warp_size=32", "batch_matmul.cuda", [["TENSOR", [1, 128, 768], "float32"], ["TENSOR", [1, 768, 768], "float32"], [1, 128, 768], "float32", 0, 0], {}], "config": {"index": 116016, "code_hash": null, "entity": [["tile_y", "sp", [-1, 8, 8]], ["tile_x", "sp", [-1, 6, 64]], ["tile_k", "sp", [-1, 8]], ["auto_unroll_max_step", "ot", 16], ["unroll_explicit", "ot", 0]]}, "result": [[0.0034174887608695655, 0.003418018173913044, 0.0034225782173913045], 0, 2.286684274673462, 1688609466.5321133], "version": 0.2, "tvm_version": "0.13.dev0"}
{"input": ["cuda -keys=cuda,gpu -arch=sm_75 -max_num_threads=1024 -thread_warp_size=32", "batch_matmul.cuda", [["TENSOR", [1, 128, 768], "float32"], ["TENSOR", [1, 768, 768], "float32"], [1, 128, 768], "float32", 0, 0], {}], "config": {"index": 488469, "code_hash": null, "entity": [["tile_y", "sp", [-1, 1, 8]], ["tile_x", "sp", [-1, 4, 8]], ["tile_k", "sp", [-1, 48]], ["auto_unroll_max_step", "ot", 16], ["unroll_explicit", "ot", 1]]}, "result": [[0.0007917648078817733, 0.0007918692857142856, 0.0007920400640394088], 0, 1.9652462005615234, 1688609467.8375895], "version": 0.2, "tvm_version": "0.13.dev0"}
{"input": ["cuda -keys=cuda,gpu -arch=sm_75 -max_num_threads=1024 -thread_warp_size=32", "batch_matmul.cuda", [["TENSOR", [1, 128, 768], "float32"], ["TENSOR", [1, 768, 768], "float32"], [1, 128, 768], "float32", 0, 0], {}], "config": {"index": 108761, "code_hash": null, "entity": [["tile_y", "sp", [-1, 32, 1]], ["tile_x", "sp", [-1, 24, 4]], ["tile_k", "sp", [-1, 6]], ["auto_unroll_max_step", "ot", 16], ["unroll_explicit", "ot", 0]]}, "result": [[0.0004261212788203754, 0.0004261322412868633, 0.0004268295630026809], 0, 1.838979721069336, 1688609469.2005796], "version": 0.2, "tvm_version": "0.13.dev0"}
{"input": ["cuda -keys=cuda,gpu -arch=sm_75 -max_num_threads=1024 -thread_warp_size=32", "batch_matmul.cuda", [["TENSOR", [1, 128, 768], "float32"], ["TENSOR", [1, 768, 768], "float32"], [1, 128, 768], "float32", 0, 0], {}], "config": {"index": 266946, "code_hash": null, "entity": [["tile_y", "sp", [-1, 64, 1]], ["tile_x", "sp", [-1, 3, 128]], ["tile_k", "sp", [-1, 1]], ["auto_unroll_max_step", "ot", 64], ["unroll_explicit", "ot", 0]]}, "result": [[0.0034788457931034483, 0.0034995166896551726, 0.003507251862068965], 0, 1.7430109977722168, 1688609471.3816075], "version": 0.2, "tvm_version": "0.13.dev0"}
{"input": ["cuda -keys=cuda,gpu -arch=sm_75 -max_num_threads=1024 -thread_warp_size=32", "batch_matmul.cuda", [["TENSOR", [1, 128, 768], "float32"], ["TENSOR", [1, 768, 768], "float32"], [1, 128, 768], "float32", 0, 0], {}], "config": {"index": 136809, "code_hash": null, "entity": [["tile_y", "sp", [-1, 2, 2]], ["tile_x", "sp", [-1, 3, 2]], ["tile_k", "sp", [-1, 48]], ["auto_unroll_max_step", "ot", 16], ["unroll_explicit", "ot", 0]]}, "result": [[0.0027932444444444446, 0.002793954611111111, 0.0027968720277777776], 0, 1.738170862197876, 1688609472.3851235], "version": 0.2, "tvm_version": "0.13.dev0"}
{"input": ["cuda -keys=cuda,gpu -arch=sm_75 -max_num_threads=1024 -thread_warp_size=32", "batch_matmul.cuda", [["TENSOR", [1, 128, 768], "float32"], ["TENSOR", [1, 768, 768], "float32"], [1, 128, 768], "float32", 0, 0], {}], "config": {"index": 370893, "code_hash": null, "entity": [["tile_y", "sp", [-1, 1, 8]], ["tile_x", "sp", [-1, 256, 3]], ["tile_k", "sp", [-1, 6]], ["auto_unroll_max_step", "ot", 8], ["unroll_explicit", "ot", 1]]}, "result": [[0.0002636417590759076, 0.00026368000660066004, 0.0002636885429042904], 0, 2.084510564804077, 1688609473.7675562], "version": 0.2, "tvm_version": "0.13.dev0"}
{"input": ["cuda -keys=cuda,gpu -arch=sm_75 -max_num_threads=1024 -thread_warp_size=32", "batch_matmul.cuda", [["TENSOR", [1, 128, 768], "float32"], ["TENSOR", [1, 768, 768], "float32"], [1, 128, 768], "float32", 0, 0], {}], "config": {"index": 598083, "code_hash": null, "entity": [["tile_y", "sp", [-1, 1, 4]], ["tile_x", "sp", [-1, 24, 1]], ["tile_k", "sp", [-1, 256]], ["auto_unroll_max_step", "ot", 32], ["unroll_explicit", "ot", 1]]}, "result": [[0.0006892213076923076, 0.0006907581655172414, 0.0006923228758620688], 0, 2.0469017028808594, 1688609474.9784424], "version": 0.2, "tvm_version": "0.13.dev0"}
{"input": ["cuda -keys=cuda,gpu -arch=sm_75 -max_num_threads=1024 -thread_warp_size=32", "batch_matmul.cuda", [["TENSOR", [1, 128, 768], "float32"], ["TENSOR", [1, 768, 768], "float32"], [1, 128, 768], "float32", 0, 0], {}], "config": {"index": 549951, "code_hash": null, "entity": [["tile_y", "sp", [-1, 1, 4]], ["tile_x", "sp", [-1, 4, 2]], ["tile_k", "sp", [-1, 8]], ["auto_unroll_max_step", "ot", 32], ["unroll_explicit", "ot", 1]]}, "result": [[0.0015243427272727274, 0.0015243636515151517, 0.001524971121212121], 0, 1.7434966564178467, 1688609475.980226], "version": 0.2, "tvm_version": "0.13.dev0"}
{"input": ["cuda -keys=cuda,gpu -arch=sm_75 -max_num_threads=1024 -thread_warp_size=32", "batch_matmul.cuda", [["TENSOR", [1, 128, 768], "float32"], ["TENSOR", [1, 768, 768], "float32"], [1, 128, 768], "float32", 0, 0], {}], "config": {"index": 186475, "code_hash": null, "entity": [["tile_y", "sp", [-1, 2, 32]], ["tile_x", "sp", [-1, 12, 4]], ["tile_k", "sp", [-1, 3]], ["auto_unroll_max_step", "ot", 32], ["unroll_explicit", "ot", 0]]}, "result": [[0.0003183734791252485, 0.00031839210536779324, 0.0003184049681908549], 0, 2.1676888465881348, 1688609477.3630486], "version": 0.2, "tvm_version": "0.13.dev0"}
{"input": ["cuda -keys=cuda,gpu -arch=sm_75 -max_num_threads=1024 -thread_warp_size=32", "batch_matmul.cuda", [["TENSOR", [1, 128, 768], "float32"], ["TENSOR", [1, 768, 768], "float32"], [1, 128, 768], "float32", 0, 0], {}], "config": {"index": 95008, "code_hash": null, "entity": [["tile_y", "sp", [-1, 16, 1]], ["tile_x", "sp", [-1, 32, 8]], ["tile_k", "sp", [-1, 2]], ["auto_unroll_max_step", "ot", 16], ["unroll_explicit", "ot", 0]]}, "result": [[0.0007866855073891626, 0.0007875357931034483, 0.0007878089458128079], 0, 2.075035810470581, 1688609478.7464736], "version": 0.2, "tvm_version": "0.13.dev0"}
{"input": ["cuda -keys=cuda,gpu -arch=sm_75 -max_num_threads=1024 -thread_warp_size=32", "batch_matmul.cuda", [["TENSOR", [1, 128, 768], "float32"], ["TENSOR", [1, 768, 768], "float32"], [1, 128, 768], "float32", 0, 0], {}], "config": {"index": 619534, "code_hash": null, "entity": [["tile_y", "sp", [-1, 4, 2]], ["tile_x", "sp", [-1, 128, 6]], ["tile_k", "sp", [-1, 2]], ["auto_unroll_max_step", "ot", 64], ["unroll_explicit", "ot", 1]]}, "result": [[0.0004628669825581396, 0.0004628998953488372, 0.0004629387063953488], 0, 2.123722553253174, 1688609480.1342947], "version": 0.2, "tvm_version": "0.13.dev0"}
{"input": ["cuda -keys=cuda,gpu -arch=sm_75 -max_num_threads=1024 -thread_warp_size=32", "batch_matmul.cuda", [["TENSOR", [1, 128, 768], "float32"], ["TENSOR", [1, 768, 768], "float32"], [1, 128, 768], "float32", 0, 0], {}], "config": {"index": 663501, "code_hash": null, "entity": [["tile_y", "sp", [-1, 1, 8]], ["tile_x", "sp", [-1, 8, 8]], ["tile_k", "sp", [-1, 48]], ["auto_unroll_max_step", "ot", 64], ["unroll_explicit", "ot", 1]]}, "result": [[0.0006131068441064637, 0.0006131930038022813, 0.0006132069847908745], 0, 2.1805484294891357, 1688609481.4823394], "version": 0.2, "tvm_version": "0.13.dev0"}
{"input": ["cuda -keys=cuda,gpu -arch=sm_75 -max_num_threads=1024 -thread_warp_size=32", "batch_matmul.cuda", [["TENSOR", [1, 128, 768], "float32"], ["TENSOR", [1, 768, 768], "float32"], [1, 128, 768], "float32", 0, 0], {}], "config": {"index": 369581, "code_hash": null, "entity": [["tile_y", "sp", [-1, 32, 1]], ["tile_x", "sp", [-1, 12, 1]], ["tile_k", "sp", [-1, 6]], ["auto_unroll_max_step", "ot", 8], ["unroll_explicit", "ot", 1]]}, "result": [[0.0005961761472868216, 0.0005962140542635659, 0.0005962408488372093], 0, 1.9799127578735352, 1688609482.821105], "version": 0.2, "tvm_version": "0.13.dev0"}
{"input": ["cuda -keys=cuda,gpu -arch=sm_75 -max_num_threads=1024 -thread_warp_size=32", "batch_matmul.cuda", [["TENSOR", [1, 128, 768], "float32"], ["TENSOR", [1, 768, 768], "float32"], [1, 128, 768], "float32", 0, 0], {}], "config": {"index": 403604, "code_hash": null, "entity": [["tile_y", "sp", [-1, 1, 2]], ["tile_x", "sp", [-1, 12, 1]], ["tile_k", "sp", [-1, 64]], ["auto_unroll_max_step", "ot", 8], ["unroll_explicit", "ot", 1]]}, "result": [[0.0013782932162162162, 0.0013795493783783784, 0.001380020756756757], 0, 2.084685802459717, 1688609483.8212664], "version": 0.2, "tvm_version": "0.13.dev0"}
{"input": ["cuda -keys=cuda,gpu -arch=sm_75 -max_num_threads=1024 -thread_warp_size=32", "batch_matmul.cuda", [["TENSOR", [1, 128, 768], "float32"], ["TENSOR", [1, 768, 768], "float32"], [1, 128, 768], "float32", 0, 0], {}], "config": {"index": 386393, "code_hash": null, "entity": [["tile_y", "sp", [-1, 32, 1]], ["tile_x", "sp", [-1, 4, 8]], ["tile_k", "sp", [-1, 16]], ["auto_unroll_max_step", "ot", 8], ["unroll_explicit", "ot", 1]]}, "result": [[0.0003737447164179104, 0.00037384932587064676, 0.00037385688059701495], 0, 2.00184965133667, 1688609485.1434045], "version": 0.2, "tvm_version": "0.13.dev0"}
{"input": ["cuda -keys=cuda,gpu -arch=sm_75 -max_num_threads=1024 -thread_warp_size=32", "batch_matmul.cuda", [["TENSOR", [1, 128, 768], "float32"], ["TENSOR", [1, 768, 768], "float32"], [1, 128, 768], "float32", 0, 0], {}], "config": {"index": 580690, "code_hash": null, "entity": [["tile_y", "sp", [-1, 4, 2]], ["tile_x", "sp", [-1, 1, 8]], ["tile_k", "sp", [-1, 64]], ["auto_unroll_max_step", "ot", 32], ["unroll_explicit", "ot", 1]]}, "result": [[0.0023455077674418606, 0.00234682711627907, 0.002347345023255814], 0, 1.834313154220581, 1688609487.0979495], "version": 0.2, "tvm_version": "0.13.dev0"}
{"input": ["cuda -keys=cuda,gpu -arch=sm_75 -max_num_threads=1024 -thread_warp_size=32", "batch_matmul.cuda", [["TENSOR", [1, 128, 768], "float32"], ["TENSOR", [1, 768, 768], "float32"], [1, 128, 768], "float32", 0, 0], {}], "config": {"index": 445933, "code_hash": null, "entity": [["tile_y", "sp", [-1, 2, 1]], ["tile_x", "sp", [-1, 3, 32]], ["tile_k", "sp", [-1, 2]], ["auto_unroll_max_step", "ot", 16], ["unroll_explicit", "ot", 1]]}, "result": [[0.004884292571428571, 0.004893350142857143, 0.004895198619047619], 0, 1.6274633407592773, 1688609488.119665], "version": 0.2, "tvm_version": "0.13.dev0"}
{"input": ["cuda -keys=cuda,gpu -arch=sm_75 -max_num_threads=1024 -thread_warp_size=32", "batch_matmul.cuda", [["TENSOR", [1, 128, 768], "float32"], ["TENSOR", [1, 768, 768], "float32"], [1, 128, 768], "float32", 0, 0], {}], "config": {"index": 450628, "code_hash": null, "entity": [["tile_y", "sp", [-1, 2, 4]], ["tile_x", "sp", [-1, 8, 24]], ["tile_k", "sp", [-1, 3]], ["auto_unroll_max_step", "ot", 16], ["unroll_explicit", "ot", 1]]}, "result": [[0.0005818388720930232, 0.0005821006686046511, 0.0005822172790697675], 0, 1.7140660285949707, 1688609489.1136065], "version": 0.2, "tvm_version": "0.13.dev0"}
{"input": ["cuda -keys=cuda,gpu -arch=sm_75 -max_num_threads=1024 -thread_warp_size=32", "batch_matmul.cuda", [["TENSOR", [1, 128, 768], "float32"], ["TENSOR", [1, 768, 768], "float32"], [1, 128, 768], "float32", 0, 0], {}], "config": {"index": 144141, "code_hash": null, "entity": [["tile_y", "sp", [-1, 1, 64]], ["tile_x", "sp", [-1, 6, 16]], ["tile_k", "sp", [-1, 64]], ["auto_unroll_max_step", "ot", 16], ["unroll_explicit", "ot", 0]]}, "result": [[0.016906282999999998, 0.016907263333333332, 0.016924395166666665], 0, 1.7787220478057861, 1688609490.1600604], "version": 0.2, "tvm_version": "0.13.dev0"}
{"input": ["cuda -keys=cuda,gpu -arch=sm_75 -max_num_threads=1024 -thread_warp_size=32", "batch_matmul.cuda", [["TENSOR", [1, 128, 768], "float32"], ["TENSOR", [1, 768, 768], "float32"], [1, 128, 768], "float32", 0, 0], {}], "config": {"index": 265443, "code_hash": null, "entity": [["tile_y", "sp", [-1, 1, 4]], ["tile_x", "sp", [-1, 64, 12]], ["tile_k", "sp", [-1, 1]], ["auto_unroll_max_step", "ot", 64], ["unroll_explicit", "ot", 0]]}, "result": [[0.0005377703044982699, 0.0005378378339100347, 0.0005379990830449826], 0, 1.9944860935211182, 1688609491.536093], "version": 0.2, "tvm_version": "0.13.dev0"}
{"input": ["cuda -keys=cuda,gpu -arch=sm_75 -max_num_threads=1024 -thread_warp_size=32", "batch_matmul.cuda", [["TENSOR", [1, 128, 768], "float32"], ["TENSOR", [1, 768, 768], "float32"], [1, 128, 768], "float32", 0, 0], {}], "config": {"index": 40683, "code_hash": null, "entity": [["tile_y", "sp", [-1, 8, 1]], ["tile_x", "sp", [-1, 16, 4]], ["tile_k", "sp", [-1, 24]], ["auto_unroll_max_step", "ot", 8], ["unroll_explicit", "ot", 0]]}, "result": [[0.0003640739282407407, 0.00036407933333333333, 0.00036412207175925927], 0, 2.0509192943573, 1688609492.9226873], "version": 0.2, "tvm_version": "0.13.dev0"}
{"input": ["cuda -keys=cuda,gpu -arch=sm_75 -max_num_threads=1024 -thread_warp_size=32", "batch_matmul.cuda", [["TENSOR", [1, 128, 768], "float32"], ["TENSOR", [1, 768, 768], "float32"], [1, 128, 768], "float32", 0, 0], {}], "config": {"index": 313492, "code_hash": null, "entity": [["tile_y", "sp", [-1, 16, 1]], ["tile_x", "sp", [-1, 4, 8]], ["tile_k", "sp", [-1, 48]], ["auto_unroll_max_step", "ot", 64], ["unroll_explicit", "ot", 0]]}, "result": [[0.00043717960714285714, 0.00043728738186813186, 0.00043743074725274725], 0, 2.0997087955474854, 1688609494.3297172], "version": 0.2, "tvm_version": "0.13.dev0"}
{"input": ["cuda -keys=cuda,gpu -arch=sm_75 -max_num_threads=1024 -thread_warp_size=32", "batch_matmul.cuda", [["TENSOR", [1, 128, 768], "float32"], ["TENSOR", [1, 768, 768], "float32"], [1, 128, 768], "float32", 0, 0], {}], "config": {"index": 31619, "code_hash": null, "entity": [["tile_y", "sp", [-1, 8, 2]], ["tile_x", "sp", [-1, 4, 8]], ["tile_k", "sp", [-1, 12]], ["auto_unroll_max_step", "ot", 8], ["unroll_explicit", "ot", 0]]}, "result": [[0.0003494810262582057, 0.00034966483369803066, 0.0003497951509846827], 0, 1.9575629234313965, 1688609495.7280276], "version": 0.2, "tvm_version": "0.13.dev0"}
{"input": ["cuda -keys=cuda,gpu -arch=sm_75 -max_num_threads=1024 -thread_warp_size=32", "batch_matmul.cuda", [["TENSOR", [1, 128, 768], "float32"], ["TENSOR", [1, 768, 768], "float32"], [1, 128, 768], "float32", 0, 0], {}], "config": {"index": 201137, "code_hash": null, "entity": [["tile_y", "sp", [-1, 32, 1]], ["tile_x", "sp", [-1, 32, 4]], ["tile_k", "sp", [-1, 8]], ["auto_unroll_max_step", "ot", 32], ["unroll_explicit", "ot", 0]]}, "result": [[0.00036047902525252525, 0.00036047902525252525, 0.0003605145909090909], 0, 1.9190781116485596, 1688609497.0244675], "version": 0.2, "tvm_version": "0.13.dev0"}
{"input": ["cuda -keys=cuda,gpu -arch=sm_75 -max_num_threads=1024 -thread_warp_size=32", "batch_matmul.cuda", [["TENSOR", [1, 128, 768], "float32"], ["TENSOR", [1, 768, 768], "float32"], [1, 128, 768], "float32", 0, 0], {}], "config": {"index": 430461, "code_hash": null, "entity": [["tile_y", "sp", [-1, 2, 2]], ["tile_x", "sp", [-1, 1, 12]], ["tile_k", "sp", [-1, 384]], ["auto_unroll_max_step", "ot", 8], ["unroll_explicit", "ot", 1]]}, "result": [[0.008437365166666667, 0.008442583666666666, 0.008453290916666667], 0, 1.720081090927124, 1688609498.048744], "version": 0.2, "tvm_version": "0.13.dev0"}
{"input": ["cuda -keys=cuda,gpu -arch=sm_75 -max_num_threads=1024 -thread_warp_size=32", "batch_matmul.cuda", [["TENSOR", [1, 128, 768], "float32"], ["TENSOR", [1, 768, 768], "float32"], [1, 128, 768], "float32", 0, 0], {}], "config": {"index": 571110, "code_hash": null, "entity": [["tile_y", "sp", [-1, 64, 1]], ["tile_x", "sp", [-1, 6, 8]], ["tile_k", "sp", [-1, 32]], ["auto_unroll_max_step", "ot", 32], ["unroll_explicit", "ot", 1]]}, "result": [[0.0006002232851851851, 0.0006013434371257484, 0.0006014292814371258], 0, 1.9077422618865967, 1688609499.2672787], "version": 0.2, "tvm_version": "0.13.dev0"}
{"input": ["cuda -keys=cuda,gpu -arch=sm_75 -max_num_threads=1024 -thread_warp_size=32", "batch_matmul.cuda", [["TENSOR", [1, 128, 768], "float32"], ["TENSOR", [1, 768, 768], "float32"], [1, 128, 768], "float32", 0, 0], {}], "config": {"index": 124289, "code_hash": null, "entity": [["tile_y", "sp", [-1, 4, 4]], ["tile_x", "sp", [-1, 1, 12]], ["tile_k", "sp", [-1, 16]], ["auto_unroll_max_step", "ot", 16], ["unroll_explicit", "ot", 0]]}, "result": [[0.0013700803972602738, 0.001370307917808219, 0.001371021109589041], 0, 1.4593799114227295, 1688609500.9948447], "version": 0.2, "tvm_version": "0.13.dev0"}
{"input": ["cuda -keys=cuda,gpu -arch=sm_75 -max_num_threads=1024 -thread_warp_size=32", "batch_matmul.cuda", [["TENSOR", [1, 128, 768], "float32"], ["TENSOR", [1, 768, 768], "float32"], [1, 128, 768], "float32", 0, 0], {}], "config": {"index": 318259, "code_hash": null, "entity": [["tile_y", "sp", [-1, 16, 4]], ["tile_x", "sp", [-1, 1, 8]], ["tile_k", "sp", [-1, 64]], ["auto_unroll_max_step", "ot", 64], ["unroll_explicit", "ot", 0]]}, "result": [[0.0013275451652892563, 0.0013275721487603308, 0.0013278751818181819], 0, 2.0413432121276855, 1688609502.3948188], "version": 0.2, "tvm_version": "0.13.dev0"}
{"input": ["cuda -keys=cuda,gpu -arch=sm_75 -max_num_threads=1024 -thread_warp_size=32", "batch_matmul.cuda", [["TENSOR", [1, 128, 768], "float32"], ["TENSOR", [1, 768, 768], "float32"], [1, 128, 768], "float32", 0, 0], {}], "config": {"index": 455098, "code_hash": null, "entity": [["tile_y", "sp", [-1, 2, 8]], ["tile_x", "sp", [-1, 3, 16]], ["tile_k", "sp", [-1, 4]], ["auto_unroll_max_step", "ot", 16], ["unroll_explicit", "ot", 1]]}, "result": [[0.0007382842870370369, 0.0007386642731481481, 0.0007389108148148148], 0, 1.916452407836914, 1688609503.793588], "version": 0.2, "tvm_version": "0.13.dev0"}
{"input": ["cuda -keys=cuda,gpu -arch=sm_75 -max_num_threads=1024 -thread_warp_size=32", "batch_matmul.cuda", [["TENSOR", [1, 128, 768], "float32"], ["TENSOR", [1, 768, 768], "float32"], [1, 128, 768], "float32", 0, 0], {}], "config": {"index": 97762, "code_hash": null, "entity": [["tile_y", "sp", [-1, 2, 8]], ["tile_x", "sp", [-1, 256, 1]], ["tile_k", "sp", [-1, 3]], ["auto_unroll_max_step", "ot", 16], ["unroll_explicit", "ot", 0]]}, "result": [[0.00036499359999999997, 0.0003649949333333333, 0.0003652294620689655], 0, 1.7980470657348633, 1688609505.174389], "version": 0.2, "tvm_version": "0.13.dev0"}
{"input": ["cuda -keys=cuda,gpu -arch=sm_75 -max_num_threads=1024 -thread_warp_size=32", "batch_matmul.cuda", [["TENSOR", [1, 128, 768], "float32"], ["TENSOR", [1, 768, 768], "float32"], [1, 128, 768], "float32", 0, 0], {}], "config": {"index": 30585, "code_hash": null, "entity": [["tile_y", "sp", [-1, 1, 8]], ["tile_x", "sp", [-1, 32, 3]], ["tile_k", "sp", [-1, 12]], ["auto_unroll_max_step", "ot", 8], ["unroll_explicit", "ot", 0]]}, "result": [[0.00016006887711864407, 0.0001604163601694915, 0.000164306209039548], 0, 2.286942481994629, 1688609599.547958], "version": 0.2, "tvm_version": "0.13.dev0"}
{"input": ["cuda -keys=cuda,gpu -arch=sm_75 -max_num_threads=1024 -thread_warp_size=32", "batch_matmul.cuda", [["TENSOR", [1, 128, 768], "float32"], ["TENSOR", [1, 768, 768], "float32"], [1, 128, 768], "float32", 0, 0], {}], "config": {"index": 118065, "code_hash": null, "entity": [["tile_y", "sp", [-1, 1, 8]], ["tile_x", "sp", [-1, 32, 3]], ["tile_k", "sp", [-1, 12]], ["auto_unroll_max_step", "ot", 16], ["unroll_explicit", "ot", 0]]}, "result": [[0.00016049035317460317, 0.00016070435515873016, 0.0001612063511904762], 0, 2.4984893798828125, 1688609600.9472063], "version": 0.2, "tvm_version": "0.13.dev0"}
{"input": ["cuda -keys=cuda,gpu -arch=sm_75 -max_num_threads=1024 -thread_warp_size=32", "batch_matmul.cuda", [["TENSOR", [1, 128, 768], "float32"], ["TENSOR", [1, 768, 768], "float32"], [1, 128, 768], "float32", 0, 0], {}], "config": {"index": 380505, "code_hash": null, "entity": [["tile_y", "sp", [-1, 1, 8]], ["tile_x", "sp", [-1, 32, 3]], ["tile_k", "sp", [-1, 12]], ["auto_unroll_max_step", "ot", 8], ["unroll_explicit", "ot", 1]]}, "result": [[0.00016044495535714285, 0.0001604551130952381, 0.00016051605753968252], 0, 2.5119035243988037, 1688609602.3548584], "version": 0.2, "tvm_version": "0.13.dev0"}
{"input": ["cuda -keys=cuda,gpu -arch=sm_75 -max_num_threads=1024 -thread_warp_size=32", "batch_matmul.cuda", [["TENSOR", [1, 128, 768], "float32"], ["TENSOR", [1, 768, 768], "float32"], [1, 128, 768], "float32", 0, 0], {}], "config": {"index": 467985, "code_hash": null, "entity": [["tile_y", "sp", [-1, 1, 8]], ["tile_x", "sp", [-1, 32, 3]], ["tile_k", "sp", [-1, 12]], ["auto_unroll_max_step", "ot", 16], ["unroll_explicit", "ot", 1]]}, "result": [[0.00016013480218687873, 0.00016060169681908547, 0.000160640541749503], 0, 2.4428248405456543, 1688609603.7524762], "version": 0.2, "tvm_version": "0.13.dev0"}
{"input": ["cuda -keys=cuda,gpu -arch=sm_75 -max_num_threads=1024 -thread_warp_size=32", "batch_matmul.cuda", [["TENSOR", [1, 128, 768], "float32"], ["TENSOR", [1, 768, 768], "float32"], [1, 128, 768], "float32", 0, 0], {}], "config": {"index": 20901, "code_hash": null, "entity": [["tile_y", "sp", [-1, 1, 8]], ["tile_x", "sp", [-1, 64, 3]], ["tile_k", "sp", [-1, 6]], ["auto_unroll_max_step", "ot", 8], ["unroll_explicit", "ot", 0]]}, "result": [[0.0001829277314814815, 0.00018294966550925926, 0.0001829762280092593], 0, 2.4057223796844482, 1688609605.1199126], "version": 0.2, "tvm_version": "0.13.dev0"}
{"input": ["cuda -keys=cuda,gpu -arch=sm_75 -max_num_threads=1024 -thread_warp_size=32", "batch_matmul.cuda", [["TENSOR", [1, 128, 768], "float32"], ["TENSOR", [1, 768, 768], "float32"], [1, 128, 768], "float32", 0, 0], {}], "config": {"index": 25725, "code_hash": null, "entity": [["tile_y", "sp", [-1, 1, 8]], ["tile_x", "sp", [-1, 32, 3]], ["tile_k", "sp", [-1, 8]], ["auto_unroll_max_step", "ot", 8], ["unroll_explicit", "ot", 0]]}, "result": [[0.00016903749734325187, 0.00016906991179596172, 0.00016909796493092455], 0, 2.3915798664093018, 1688609606.5072405], "version": 0.2, "tvm_version": "0.13.dev0"}
{"input": ["cuda -keys=cuda,gpu -arch=sm_75 -max_num_threads=1024 -thread_warp_size=32", "batch_matmul.cuda", [["TENSOR", [1, 128, 768], "float32"], ["TENSOR", [1, 768, 768], "float32"], [1, 128, 768], "float32", 0, 0], {}], "config": {"index": 25761, "code_hash": null, "entity": [["tile_y", "sp", [-1, 1, 8]], ["tile_x", "sp", [-1, 64, 3]], ["tile_k", "sp", [-1, 8]], ["auto_unroll_max_step", "ot", 8], ["unroll_explicit", "ot", 0]]}, "result": [[0.00017223525134843582, 0.00017223745738942825, 0.00017224198381877022], 0, 2.439443826675415, 1688609607.8902817], "version": 0.2, "tvm_version": "0.13.dev0"}
{"input": ["cuda -keys=cuda,gpu -arch=sm_75 -max_num_threads=1024 -thread_warp_size=32", "batch_matmul.cuda", [["TENSOR", [1, 128, 768], "float32"], ["TENSOR", [1, 768, 768], "float32"], [1, 128, 768], "float32", 0, 0], {}], "config": {"index": 108381, "code_hash": null, "entity": [["tile_y", "sp", [-1, 1, 8]], ["tile_x", "sp", [-1, 64, 3]], ["tile_k", "sp", [-1, 6]], ["auto_unroll_max_step", "ot", 16], ["unroll_explicit", "ot", 0]]}, "result": [[0.00018369498953488373, 0.00018369562790697673, 0.00018370322209302324], 0, 2.3956995010375977, 1688609609.2603438], "version": 0.2, "tvm_version": "0.13.dev0"}
{"input": ["cuda -keys=cuda,gpu -arch=sm_75 -max_num_threads=1024 -thread_warp_size=32", "batch_matmul.cuda", [["TENSOR", [1, 128, 768], "float32"], ["TENSOR", [1, 768, 768], "float32"], [1, 128, 768], "float32", 0, 0], {}], "config": {"index": 113205, "code_hash": null, "entity": [["tile_y", "sp", [-1, 1, 8]], ["tile_x", "sp", [-1, 32, 3]], ["tile_k", "sp", [-1, 8]], ["auto_unroll_max_step", "ot", 16], ["unroll_explicit", "ot", 0]]}, "result": [[0.00016878311497890296, 0.00016883254535864979, 0.0001688718670886076], 0, 2.44844651222229, 1688609610.6429453], "version": 0.2, "tvm_version": "0.13.dev0"}
{"input": ["cuda -keys=cuda,gpu -arch=sm_75 -max_num_threads=1024 -thread_warp_size=32", "batch_matmul.cuda", [["TENSOR", [1, 128, 768], "float32"], ["TENSOR", [1, 768, 768], "float32"], [1, 128, 768], "float32", 0, 0], {}], "config": {"index": 20865, "code_hash": null, "entity": [["tile_y", "sp", [-1, 1, 8]], ["tile_x", "sp", [-1, 32, 3]], ["tile_k", "sp", [-1, 6]], ["auto_unroll_max_step", "ot", 8], ["unroll_explicit", "ot", 0]]}, "result": [[0.00018100160824742272, 0.00018108045360824742, 0.00018110394501718216], 0, 2.430755853652954, 1688609612.0104575], "version": 0.2, "tvm_version": "0.13.dev0"}
{"input": ["cuda -keys=cuda,gpu -arch=sm_75 -max_num_threads=1024 -thread_warp_size=32", "batch_matmul.cuda", [["TENSOR", [1, 128, 768], "float32"], ["TENSOR", [1, 768, 768], "float32"], [1, 128, 768], "float32", 0, 0], {}], "config": {"index": 113241, "code_hash": null, "entity": [["tile_y", "sp", [-1, 1, 8]], ["tile_x", "sp", [-1, 64, 3]], ["tile_k", "sp", [-1, 8]], ["auto_unroll_max_step", "ot", 16], ["unroll_explicit", "ot", 0]]}, "result": [[0.00017289313929784824, 0.00017289370894677238, 0.00017289918686296717], 0, 2.429689645767212, 1688609613.3479528], "version": 0.2, "tvm_version": "0.13.dev0"}
{"input": ["cuda -keys=cuda,gpu -arch=sm_75 -max_num_threads=1024 -thread_warp_size=32", "batch_matmul.cuda", [["TENSOR", [1, 128, 768], "float32"], ["TENSOR", [1, 768, 768], "float32"], [1, 128, 768], "float32", 0, 0], {}], "config": {"index": 370821, "code_hash": null, "entity": [["tile_y", "sp", [-1, 1, 8]], ["tile_x", "sp", [-1, 64, 3]], ["tile_k", "sp", [-1, 6]], ["auto_unroll_max_step", "ot", 8], ["unroll_explicit", "ot", 1]]}, "result": [[0.00018349613365735114, 0.00018353349331713244, 0.00018355568529769138], 0, 2.417729616165161, 1688609614.7010138], "version": 0.2, "tvm_version": "0.13.dev0"}
{"input": ["cuda -keys=cuda,gpu -arch=sm_75 -max_num_threads=1024 -thread_warp_size=32", "batch_matmul.cuda", [["TENSOR", [1, 128, 768], "float32"], ["TENSOR", [1, 768, 768], "float32"], [1, 128, 768], "float32", 0, 0], {}], "config": {"index": 375645, "code_hash": null, "entity": [["tile_y", "sp", [-1, 1, 8]], ["tile_x", "sp", [-1, 32, 3]], ["tile_k", "sp", [-1, 8]], ["auto_unroll_max_step", "ot", 8], ["unroll_explicit", "ot", 1]]}, "result": [[0.00016862372727272727, 0.00016864741866028706, 0.0001687113923444976], 0, 2.318953275680542, 1688609615.968456], "version": 0.2, "tvm_version": "0.13.dev0"}
{"input": ["cuda -keys=cuda,gpu -arch=sm_75 -max_num_threads=1024 -thread_warp_size=32", "batch_matmul.cuda", [["TENSOR", [1, 128, 768], "float32"], ["TENSOR", [1, 768, 768], "float32"], [1, 128, 768], "float32", 0, 0], {}], "config": {"index": 108345, "code_hash": null, "entity": [["tile_y", "sp", [-1, 1, 8]], ["tile_x", "sp", [-1, 32, 3]], ["tile_k", "sp", [-1, 6]], ["auto_unroll_max_step", "ot", 16], ["unroll_explicit", "ot", 0]]}, "result": [[0.00017929024943052392, 0.00017930005125284737, 0.0001794091742596811], 0, 2.4376680850982666, 1688609617.3375032], "version": 0.2, "tvm_version": "0.13.dev0"}
{"input": ["cuda -keys=cuda,gpu -arch=sm_75 -max_num_threads=1024 -thread_warp_size=32", "batch_matmul.cuda", [["TENSOR", [1, 128, 768], "float32"], ["TENSOR", [1, 768, 768], "float32"], [1, 128, 768], "float32", 0, 0], {}], "config": {"index": 25797, "code_hash": null, "entity": [["tile_y", "sp", [-1, 1, 8]], ["tile_x", "sp", [-1, 128, 3]], ["tile_k", "sp", [-1, 8]], ["auto_unroll_max_step", "ot", 8], ["unroll_explicit", "ot", 0]]}, "result": [[0.00019051767749699158, 0.00019058475330926595, 0.00019059029843561975], 0, 2.414681911468506, 1688609618.7206264], "version": 0.2, "tvm_version": "0.13.dev0"}
{"input": ["cuda -keys=cuda,gpu -arch=sm_75 -max_num_threads=1024 -thread_warp_size=32", "batch_matmul.cuda", [["TENSOR", [1, 128, 768], "float32"], ["TENSOR", [1, 768, 768], "float32"], [1, 128, 768], "float32", 0, 0], {}], "config": {"index": 375681, "code_hash": null, "entity": [["tile_y", "sp", [-1, 1, 8]], ["tile_x", "sp", [-1, 64, 3]], ["tile_k", "sp", [-1, 8]], ["auto_unroll_max_step", "ot", 8], ["unroll_explicit", "ot", 1]]}, "result": [[0.00017236849316770188, 0.0001724053801242236, 0.0001724110658385093], 0, 2.337991714477539, 1688609619.9866796], "version": 0.2, "tvm_version": "0.13.dev0"}
{"input": ["cuda -keys=cuda,gpu -arch=sm_75 -max_num_threads=1024 -thread_warp_size=32", "batch_matmul.cuda", [["TENSOR", [1, 128, 768], "float32"], ["TENSOR", [1, 768, 768], "float32"], [1, 128, 768], "float32", 0, 0], {}], "config": {"index": 458301, "code_hash": null, "entity": [["tile_y", "sp", [-1, 1, 8]], ["tile_x", "sp", [-1, 64, 3]], ["tile_k", "sp", [-1, 6]], ["auto_unroll_max_step", "ot", 16], ["unroll_explicit", "ot", 1]]}, "result": [[0.0001831457790849673, 0.00018319015947712417, 0.0001831929320261438], 0, 2.089622735977173, 1688609622.289832], "version": 0.2, "tvm_version": "0.13.dev0"}
{"input": ["cuda -keys=cuda,gpu -arch=sm_75 -max_num_threads=1024 -thread_warp_size=32", "batch_matmul.cuda", [["TENSOR", [1, 128, 768], "float32"], ["TENSOR", [1, 768, 768], "float32"], [1, 128, 768], "float32", 0, 0], {}], "config": {"index": 463125, "code_hash": null, "entity": [["tile_y", "sp", [-1, 1, 8]], ["tile_x", "sp", [-1, 32, 3]], ["tile_k", "sp", [-1, 8]], ["auto_unroll_max_step", "ot", 16], ["unroll_explicit", "ot", 1]]}, "result": [[0.0001685477913135593, 0.000168580781779661, 0.00016861931673728815], 0, 2.3130621910095215, 1688609623.6875165], "version": 0.2, "tvm_version": "0.13.dev0"}
{"input": ["cuda -keys=cuda,gpu -arch=sm_75 -max_num_threads=1024 -thread_warp_size=32", "batch_matmul.cuda", [["TENSOR", [1, 128, 768], "float32"], ["TENSOR", [1, 768, 768], "float32"], [1, 128, 768], "float32", 0, 0], {}], "config": {"index": 370785, "code_hash": null, "entity": [["tile_y", "sp", [-1, 1, 8]], ["tile_x", "sp", [-1, 32, 3]], ["tile_k", "sp", [-1, 6]], ["auto_unroll_max_step", "ot", 8], ["unroll_explicit", "ot", 1]]}, "result": [[0.00017955258495460443, 0.00017955462256809336, 0.00017962899740596629], 0, 2.1856231689453125, 1688609624.9638364], "version": 0.2, "tvm_version": "0.13.dev0"}
{"input": ["cuda -keys=cuda,gpu -arch=sm_75 -max_num_threads=1024 -thread_warp_size=32", "batch_matmul.cuda", [["TENSOR", [1, 128, 768], "float32"], ["TENSOR", [1, 768, 768], "float32"], [1, 128, 768], "float32", 0, 0], {}], "config": {"index": 113277, "code_hash": null, "entity": [["tile_y", "sp", [-1, 1, 8]], ["tile_x", "sp", [-1, 128, 3]], ["tile_k", "sp", [-1, 8]], ["auto_unroll_max_step", "ot", 16], ["unroll_explicit", "ot", 0]]}, "result": [[0.00019142628220858893, 0.00019152946134969325, 0.00019157477055214725], 0, 2.204148054122925, 1688609626.334183], "version": 0.2, "tvm_version": "0.13.dev0"}
{"input": ["cuda -keys=cuda,gpu -arch=sm_75 -max_num_threads=1024 -thread_warp_size=32", "batch_matmul.cuda", [["TENSOR", [1, 128, 768], "float32"], ["TENSOR", [1, 768, 768], "float32"], [1, 128, 768], "float32", 0, 0], {}], "config": {"index": 293025, "code_hash": null, "entity": [["tile_y", "sp", [-1, 1, 8]], ["tile_x", "sp", [-1, 32, 3]], ["tile_k", "sp", [-1, 12]], ["auto_unroll_max_step", "ot", 64], ["unroll_explicit", "ot", 0]]}, "result": [[0.00016098107883817425, 0.00016104068983402488, 0.00016111641390041494], 0, 2.2084083557128906, 1688609627.6927347], "version": 0.2, "tvm_version": "0.13.dev0"}
{"input": ["cuda -keys=cuda,gpu -arch=sm_75 -max_num_threads=1024 -thread_warp_size=32", "batch_matmul.cuda", [["TENSOR", [1, 128, 768], "float32"], ["TENSOR", [1, 768, 768], "float32"], [1, 128, 768], "float32", 0, 0], {}], "config": {"index": 463161, "code_hash": null, "entity": [["tile_y", "sp", [-1, 1, 8]], ["tile_x", "sp", [-1, 64, 3]], ["tile_k", "sp", [-1, 8]], ["auto_unroll_max_step", "ot", 16], ["unroll_explicit", "ot", 1]]}, "result": [[0.00017225756706652128, 0.00017226810032715378, 0.00017226873282442747], 0, 2.2555668354034424, 1688609629.0768886], "version": 0.2, "tvm_version": "0.13.dev0"}
{"input": ["cuda -keys=cuda,gpu -arch=sm_75 -max_num_threads=1024 -thread_warp_size=32", "batch_matmul.cuda", [["TENSOR", [1, 128, 768], "float32"], ["TENSOR", [1, 768, 768], "float32"], [1, 128, 768], "float32", 0, 0], {}], "config": {"index": 35445, "code_hash": null, "entity": [["tile_y", "sp", [-1, 1, 8]], ["tile_x", "sp", [-1, 32, 3]], ["tile_k", "sp", [-1, 16]], ["auto_unroll_max_step", "ot", 8], ["unroll_explicit", "ot", 0]]}, "result": [[0.00016661854545454543, 0.0001666319237199582, 0.00016669107732497388], 0, 2.3154377937316895, 1688609630.4711518], "version": 0.2, "tvm_version": "0.13.dev0"}
{"input": ["cuda -keys=cuda,gpu -arch=sm_75 -max_num_threads=1024 -thread_warp_size=32", "batch_matmul.cuda", [["TENSOR", [1, 128, 768], "float32"], ["TENSOR", [1, 768, 768], "float32"], [1, 128, 768], "float32", 0, 0], {}], "config": {"index": 20937, "code_hash": null, "entity": [["tile_y", "sp", [-1, 1, 8]], ["tile_x", "sp", [-1, 128, 3]], ["tile_k", "sp", [-1, 6]], ["auto_unroll_max_step", "ot", 8], ["unroll_explicit", "ot", 0]]}, "result": [[0.00020264518591549298, 0.00020266906197183098, 0.00020280280281690142], 0, 2.154585599899292, 1688609631.7642372], "version": 0.2, "tvm_version": "0.13.dev0"}
{"input": ["cuda -keys=cuda,gpu -arch=sm_75 -max_num_threads=1024 -thread_warp_size=32", "batch_matmul.cuda", [["TENSOR", [1, 128, 768], "float32"], ["TENSOR", [1, 768, 768], "float32"], [1, 128, 768], "float32", 0, 0], {}], "config": {"index": 205545, "code_hash": null, "entity": [["tile_y", "sp", [-1, 1, 8]], ["tile_x", "sp", [-1, 32, 3]], ["tile_k", "sp", [-1, 12]], ["auto_unroll_max_step", "ot", 32], ["unroll_explicit", "ot", 0]]}, "result": [[0.00016114198568507155, 0.00016144020347648262, 0.00016160354089979548], 0, 2.2602269649505615, 1688609633.1374304], "version": 0.2, "tvm_version": "0.13.dev0"}
{"input": ["cuda -keys=cuda,gpu -arch=sm_75 -max_num_threads=1024 -thread_warp_size=32", "batch_matmul.cuda", [["TENSOR", [1, 128, 768], "float32"], ["TENSOR", [1, 768, 768], "float32"], [1, 128, 768], "float32", 0, 0], {}], "config": {"index": 458265, "code_hash": null, "entity": [["tile_y", "sp", [-1, 1, 8]], ["tile_x", "sp", [-1, 32, 3]], ["tile_k", "sp", [-1, 6]], ["auto_unroll_max_step", "ot", 16], ["unroll_explicit", "ot", 1]]}, "result": [[0.00018077410173410405, 0.00018080580115606936, 0.00018081509710982658], 0, 2.270226001739502, 1688609634.5010297], "version": 0.2, "tvm_version": "0.13.dev0"}
{"input": ["cuda -keys=cuda,gpu -arch=sm_75 -max_num_threads=1024 -thread_warp_size=32", "batch_matmul.cuda", [["TENSOR", [1, 128, 768], "float32"], ["TENSOR", [1, 768, 768], "float32"], [1, 128, 768], "float32", 0, 0], {}], "config": {"index": 30621, "code_hash": null, "entity": [["tile_y", "sp", [-1, 1, 8]], ["tile_x", "sp", [-1, 64, 3]], ["tile_k", "sp", [-1, 12]], ["auto_unroll_max_step", "ot", 8], ["unroll_explicit", "ot", 0]]}, "result": [[0.00016171196232179222, 0.00016175481771894094, 0.0001617580804480652], 0, 2.2754650115966797, 1688609635.8767312], "version": 0.2, "tvm_version": "0.13.dev0"}
{"input": ["cuda -keys=cuda,gpu -arch=sm_75 -max_num_threads=1024 -thread_warp_size=32", "batch_matmul.cuda", [["TENSOR", [1, 128, 768], "float32"], ["TENSOR", [1, 768, 768], "float32"], [1, 128, 768], "float32", 0, 0], {}], "config": {"index": 375717, "code_hash": null, "entity": [["tile_y", "sp", [-1, 1, 8]], ["tile_x", "sp", [-1, 128, 3]], ["tile_k", "sp", [-1, 8]], ["auto_unroll_max_step", "ot", 8], ["unroll_explicit", "ot", 1]]}, "result": [[0.00018915701466992664, 0.00018916546454767724, 0.00018917949266503668], 0, 2.228396415710449, 1688609637.2365777], "version": 0.2, "tvm_version": "0.13.dev0"}
{"input": ["cuda -keys=cuda,gpu -arch=sm_75 -max_num_threads=1024 -thread_warp_size=32", "batch_matmul.cuda", [["TENSOR", [1, 128, 768], "float32"], ["TENSOR", [1, 768, 768], "float32"], [1, 128, 768], "float32", 0, 0], {}], "config": {"index": 118070, "code_hash": null, "entity": [["tile_y", "sp", [-1, 1, 16]], ["tile_x", "sp", [-1, 32, 3]], ["tile_k", "sp", [-1, 12]], ["auto_unroll_max_step", "ot", 16], ["unroll_explicit", "ot", 0]]}, "result": [[0.00013964743478260867, 0.0001396492493345164, 0.00013965234960070983], 0, 2.2892556190490723, 1688609638.6123214], "version": 0.2, "tvm_version": "0.13.dev0"}
{"input": ["cuda -keys=cuda,gpu -arch=sm_75 -max_num_threads=1024 -thread_warp_size=32", "batch_matmul.cuda", [["TENSOR", [1, 128, 768], "float32"], ["TENSOR", [1, 768, 768], "float32"], [1, 128, 768], "float32", 0, 0], {}], "config": {"index": 30590, "code_hash": null, "entity": [["tile_y", "sp", [-1, 1, 16]], ["tile_x", "sp", [-1, 32, 3]], ["tile_k", "sp", [-1, 12]], ["auto_unroll_max_step", "ot", 8], ["unroll_explicit", "ot", 0]]}, "result": [[0.0001395542183600713, 0.0001395919037433155, 0.00013963271568627453], 0, 2.283308506011963, 1688609639.972126], "version": 0.2, "tvm_version": "0.13.dev0"}
{"input": ["cuda -keys=cuda,gpu -arch=sm_75 -max_num_threads=1024 -thread_warp_size=32", "batch_matmul.cuda", [["TENSOR", [1, 128, 768], "float32"], ["TENSOR", [1, 768, 768], "float32"], [1, 128, 768], "float32", 0, 0], {}], "config": {"index": 122925, "code_hash": null, "entity": [["tile_y", "sp", [-1, 1, 8]], ["tile_x", "sp", [-1, 32, 3]], ["tile_k", "sp", [-1, 16]], ["auto_unroll_max_step", "ot", 16], ["unroll_explicit", "ot", 0]]}, "result": [[0.00016587651303441087, 0.00016594995933263813, 0.00016599774035453598], 0, 2.2828617095947266, 1688609641.349404], "version": 0.2, "tvm_version": "0.13.dev0"}
{"input": ["cuda -keys=cuda,gpu -arch=sm_75 -max_num_threads=1024 -thread_warp_size=32", "batch_matmul.cuda", [["TENSOR", [1, 128, 768], "float32"], ["TENSOR", [1, 768, 768], "float32"], [1, 128, 768], "float32", 0, 0], {}], "config": {"index": 467990, "code_hash": null, "entity": [["tile_y", "sp", [-1, 1, 16]], ["tile_x", "sp", [-1, 32, 3]], ["tile_k", "sp", [-1, 12]], ["auto_unroll_max_step", "ot", 16], ["unroll_explicit", "ot", 1]]}, "result": [[0.00013946039313984167, 0.0001394657343887423, 0.0001394819454705365], 0, 2.2958314418792725, 1688609642.7242239], "version": 0.2, "tvm_version": "0.13.dev0"}
{"input": ["cuda -keys=cuda,gpu -arch=sm_75 -max_num_threads=1024 -thread_warp_size=32", "batch_matmul.cuda", [["TENSOR", [1, 128, 768], "float32"], ["TENSOR", [1, 768, 768], "float32"], [1, 128, 768], "float32", 0, 0], {}], "config": {"index": 380510, "code_hash": null, "entity": [["tile_y", "sp", [-1, 1, 16]], ["tile_x", "sp", [-1, 32, 3]], ["tile_k", "sp", [-1, 12]], ["auto_unroll_max_step", "ot", 8], ["unroll_explicit", "ot", 1]]}, "result": [[0.0001393897908438061, 0.00013941629533213644, 0.00013944600448833035], 0, 2.2509193420410156, 1688609645.157845], "version": 0.2, "tvm_version": "0.13.dev0"}
{"input": ["cuda -keys=cuda,gpu -arch=sm_75 -max_num_threads=1024 -thread_warp_size=32", "batch_matmul.cuda", [["TENSOR", [1, 128, 768], "float32"], ["TENSOR", [1, 768, 768], "float32"], [1, 128, 768], "float32", 0, 0], {}], "config": {"index": 108386, "code_hash": null, "entity": [["tile_y", "sp", [-1, 1, 16]], ["tile_x", "sp", [-1, 64, 3]], ["tile_k", "sp", [-1, 6]], ["auto_unroll_max_step", "ot", 16], ["unroll_explicit", "ot", 0]]}, "result": [[0.00015351648349514567, 0.00015358169611650484, 0.0001536496504854369], 0, 2.2905468940734863, 1688609646.5474823], "version": 0.2, "tvm_version": "0.13.dev0"}
{"input": ["cuda -keys=cuda,gpu -arch=sm_75 -max_num_threads=1024 -thread_warp_size=32", "batch_matmul.cuda", [["TENSOR", [1, 128, 768], "float32"], ["TENSOR", [1, 768, 768], "float32"], [1, 128, 768], "float32", 0, 0], {}], "config": {"index": 20906, "code_hash": null, "entity": [["tile_y", "sp", [-1, 1, 16]], ["tile_x", "sp", [-1, 64, 3]], ["tile_k", "sp", [-1, 6]], ["auto_unroll_max_step", "ot", 8], ["unroll_explicit", "ot", 0]]}, "result": [[0.00015326774852071008, 0.00015327482149901382, 0.00015329299999999998], 0, 2.2428252696990967, 1688609647.9194307], "version": 0.2, "tvm_version": "0.13.dev0"}
{"input": ["cuda -keys=cuda,gpu -arch=sm_75 -max_num_threads=1024 -thread_warp_size=32", "batch_matmul.cuda", [["TENSOR", [1, 128, 768], "float32"], ["TENSOR", [1, 768, 768], "float32"], [1, 128, 768], "float32", 0, 0], {}], "config": {"index": 108417, "code_hash": null, "entity": [["tile_y", "sp", [-1, 1, 8]], ["tile_x", "sp", [-1, 128, 3]], ["tile_k", "sp", [-1, 6]], ["auto_unroll_max_step", "ot", 16], ["unroll_explicit", "ot", 0]]}, "result": [[0.00020094349431099874, 0.0002009776384323641, 0.0002011129608091024], 0, 2.2252557277679443, 1688609649.3063774], "version": 0.2, "tvm_version": "0.13.dev0"}
{"input": ["cuda -keys=cuda,gpu -arch=sm_75 -max_num_threads=1024 -thread_warp_size=32", "batch_matmul.cuda", [["TENSOR", [1, 128, 768], "float32"], ["TENSOR", [1, 768, 768], "float32"], [1, 128, 768], "float32", 0, 0], {}], "config": {"index": 118101, "code_hash": null, "entity": [["tile_y", "sp", [-1, 1, 8]], ["tile_x", "sp", [-1, 64, 3]], ["tile_k", "sp", [-1, 12]], ["auto_unroll_max_step", "ot", 16], ["unroll_explicit", "ot", 0]]}, "result": [[0.00016197037204301073, 0.00016201734623655912, 0.0001620385440860215], 0, 2.2442283630371094, 1688609650.6520736], "version": 0.2, "tvm_version": "0.13.dev0"}
{"input": ["cuda -keys=cuda,gpu -arch=sm_75 -max_num_threads=1024 -thread_warp_size=32", "batch_matmul.cuda", [["TENSOR", [1, 128, 768], "float32"], ["TENSOR", [1, 768, 768], "float32"], [1, 128, 768], "float32", 0, 0], {}], "config": {"index": 463197, "code_hash": null, "entity": [["tile_y", "sp", [-1, 1, 8]], ["tile_x", "sp", [-1, 128, 3]], ["tile_k", "sp", [-1, 8]], ["auto_unroll_max_step", "ot", 16], ["unroll_explicit", "ot", 1]]}, "result": [[0.00019022292271105823, 0.00019025701426872768, 0.00019031289655172415], 0, 2.2650063037872314, 1688609652.053723], "version": 0.2, "tvm_version": "0.13.dev0"}
{"input": ["cuda -keys=cuda,gpu -arch=sm_75 -max_num_threads=1024 -thread_warp_size=32", "batch_matmul.cuda", [["TENSOR", [1, 128, 768], "float32"], ["TENSOR", [1, 768, 768], "float32"], [1, 128, 768], "float32", 0, 0], {}], "config": {"index": 642945, "code_hash": null, "entity": [["tile_y", "sp", [-1, 1, 8]], ["tile_x", "sp", [-1, 32, 3]], ["tile_k", "sp", [-1, 12]], ["auto_unroll_max_step", "ot", 64], ["unroll_explicit", "ot", 1]]}, "result": [[0.0001611683447236181, 0.00016155768140703515, 0.00016166483015075375], 0, 2.3210434913635254, 1688609653.442812], "version": 0.2, "tvm_version": "0.13.dev0"}
{"input": ["cuda -keys=cuda,gpu -arch=sm_75 -max_num_threads=1024 -thread_warp_size=32", "batch_matmul.cuda", [["TENSOR", [1, 128, 768], "float32"], ["TENSOR", [1, 768, 768], "float32"], [1, 128, 768], "float32", 0, 0], {}], "config": {"index": 458306, "code_hash": null, "entity": [["tile_y", "sp", [-1, 1, 16]], ["tile_x", "sp", [-1, 64, 3]], ["tile_k", "sp", [-1, 6]], ["auto_unroll_max_step", "ot", 16], ["unroll_explicit", "ot", 1]]}, "result": [[0.00015330345189504374, 0.00015333927793974734, 0.00015337108551992227], 0, 2.333766222000122, 1688609654.8119173], "version": 0.2, "tvm_version": "0.13.dev0"}
{"input": ["cuda -keys=cuda,gpu -arch=sm_75 -max_num_threads=1024 -thread_warp_size=32", "batch_matmul.cuda", [["TENSOR", [1, 128, 768], "float32"], ["TENSOR", [1, 768, 768], "float32"], [1, 128, 768], "float32", 0, 0], {}], "config": {"index": 370826, "code_hash": null, "entity": [["tile_y", "sp", [-1, 1, 16]], ["tile_x", "sp", [-1, 64, 3]], ["tile_k", "sp", [-1, 6]], ["auto_unroll_max_step", "ot", 8], ["unroll_explicit", "ot", 1]]}, "result": [[0.00015295191481122942, 0.0001529715169409487, 0.0001529919303000968], 0, 2.300048589706421, 1688609656.203286], "version": 0.2, "tvm_version": "0.13.dev0"}
{"input": ["cuda -keys=cuda,gpu -arch=sm_75 -max_num_threads=1024 -thread_warp_size=32", "batch_matmul.cuda", [["TENSOR", [1, 128, 768], "float32"], ["TENSOR", [1, 768, 768], "float32"], [1, 128, 768], "float32", 0, 0], {}], "config": {"index": 385365, "code_hash": null, "entity": [["tile_y", "sp", [-1, 1, 8]], ["tile_x", "sp", [-1, 32, 3]], ["tile_k", "sp", [-1, 16]], ["auto_unroll_max_step", "ot", 8], ["unroll_explicit", "ot", 1]]}, "result": [[0.00016650244169246647, 0.00016660665428276574, 0.00016736121671826626], 0, 2.337769031524658, 1688609657.6058147], "version": 0.2, "tvm_version": "0.13.dev0"}
{"input": ["cuda -keys=cuda,gpu -arch=sm_75 -max_num_threads=1024 -thread_warp_size=32", "batch_matmul.cuda", [["TENSOR", [1, 128, 768], "float32"], ["TENSOR", [1, 768, 768], "float32"], [1, 128, 768], "float32", 0, 0], {}], "config": {"index": 20825, "code_hash": null, "entity": [["tile_y", "sp", [-1, 4, 4]], ["tile_x", "sp", [-1, 16, 3]], ["tile_k", "sp", [-1, 6]], ["auto_unroll_max_step", "ot", 8], ["unroll_explicit", "ot", 0]]}, "result": [[0.00020785482967741934, 0.00020792183096774195, 0.00020794496516129033], 0, 2.2566514015197754, 1688609659.005553], "version": 0.2, "tvm_version": "0.13.dev0"}
{"input": ["cuda -keys=cuda,gpu -arch=sm_75 -max_num_threads=1024 -thread_warp_size=32", "batch_matmul.cuda", [["TENSOR", [1, 128, 768], "float32"], ["TENSOR", [1, 768, 768], "float32"], [1, 128, 768], "float32", 0, 0], {}], "config": {"index": 108305, "code_hash": null, "entity": [["tile_y", "sp", [-1, 4, 4]], ["tile_x", "sp", [-1, 16, 3]], ["tile_k", "sp", [-1, 6]], ["auto_unroll_max_step", "ot", 16], ["unroll_explicit", "ot", 0]]}, "result": [[0.00020249868684210528, 0.00020255759342105263, 0.00020256134736842106], 0, 2.2159223556518555, 1688609660.3691843], "version": 0.2, "tvm_version": "0.13.dev0"}
{"input": ["cuda -keys=cuda,gpu -arch=sm_75 -max_num_threads=1024 -thread_warp_size=32", "batch_matmul.cuda", [["TENSOR", [1, 128, 768], "float32"], ["TENSOR", [1, 768, 768], "float32"], [1, 128, 768], "float32", 0, 0], {}], "config": {"index": 370857, "code_hash": null, "entity": [["tile_y", "sp", [-1, 1, 8]], ["tile_x", "sp", [-1, 128, 3]], ["tile_k", "sp", [-1, 6]], ["auto_unroll_max_step", "ot", 8], ["unroll_explicit", "ot", 1]]}, "result": [[0.00020189564367816093, 0.00020194116730523626, 0.00020194902043422732], 0, 2.2646758556365967, 1688609661.7383354], "version": 0.2, "tvm_version": "0.13.dev0"}
{"input": ["cuda -keys=cuda,gpu -arch=sm_75 -max_num_threads=1024 -thread_warp_size=32", "batch_matmul.cuda", [["TENSOR", [1, 128, 768], "float32"], ["TENSOR", [1, 768, 768], "float32"], [1, 128, 768], "float32", 0, 0], {}], "config": {"index": 555465, "code_hash": null, "entity": [["tile_y", "sp", [-1, 1, 8]], ["tile_x", "sp", [-1, 32, 3]], ["tile_k", "sp", [-1, 12]], ["auto_unroll_max_step", "ot", 32], ["unroll_explicit", "ot", 1]]}, "result": [[0.000161274076765609, 0.00016159010747185263, 0.00016165551484135105], 0, 2.3170411586761475, 1688609663.139716], "version": 0.2, "tvm_version": "0.13.dev0"}
{"input": ["cuda -keys=cuda,gpu -arch=sm_75 -max_num_threads=1024 -thread_warp_size=32", "batch_matmul.cuda", [["TENSOR", [1, 128, 768], "float32"], ["TENSOR", [1, 768, 768], "float32"], [1, 128, 768], "float32", 0, 0], {}], "config": {"index": 380541, "code_hash": null, "entity": [["tile_y", "sp", [-1, 1, 8]], ["tile_x", "sp", [-1, 64, 3]], ["tile_k", "sp", [-1, 12]], ["auto_unroll_max_step", "ot", 8], ["unroll_explicit", "ot", 1]]}, "result": [[0.0001617895564803805, 0.00016178982877526754, 0.00016181109274673012], 0, 2.1203246116638184, 1688609664.3958926], "version": 0.2, "tvm_version": "0.13.dev0"}
{"input": ["cuda -keys=cuda,gpu -arch=sm_75 -max_num_threads=1024 -thread_warp_size=32", "batch_matmul.cuda", [["TENSOR", [1, 128, 768], "float32"], ["TENSOR", [1, 768, 768], "float32"], [1, 128, 768], "float32", 0, 0], {}], "config": {"index": 20870, "code_hash": null, "entity": [["tile_y", "sp", [-1, 1, 16]], ["tile_x", "sp", [-1, 32, 3]], ["tile_k", "sp", [-1, 6]], ["auto_unroll_max_step", "ot", 8], ["unroll_explicit", "ot", 0]]}, "result": [[0.00016262548350515465, 0.00016263408762886598, 0.00016267978556701033], 0, 2.2943007946014404, 1688609665.7902963], "version": 0.2, "tvm_version": "0.13.dev0"}
{"input": ["cuda -keys=cuda,gpu -arch=sm_75 -max_num_threads=1024 -thread_warp_size=32", "batch_matmul.cuda", [["TENSOR", [1, 128, 768], "float32"], ["TENSOR", [1, 768, 768], "float32"], [1, 128, 768], "float32", 0, 0], {}], "config": {"index": 108350, "code_hash": null, "entity": [["tile_y", "sp", [-1, 1, 16]], ["tile_x", "sp", [-1, 32, 3]], ["tile_k", "sp", [-1, 6]], ["auto_unroll_max_step", "ot", 16], ["unroll_explicit", "ot", 0]]}, "result": [[0.00016217212631578948, 0.00016220261315789473, 0.00016292648289473684], 0, 2.063403367996216, 1688609668.6795073], "version": 0.2, "tvm_version": "0.13.dev0"}
{"input": ["cuda -keys=cuda,gpu -arch=sm_75 -max_num_threads=1024 -thread_warp_size=32", "batch_matmul.cuda", [["TENSOR", [1, 128, 768], "float32"], ["TENSOR", [1, 768, 768], "float32"], [1, 128, 768], "float32", 0, 0], {}], "config": {"index": 472845, "code_hash": null, "entity": [["tile_y", "sp", [-1, 1, 8]], ["tile_x", "sp", [-1, 32, 3]], ["tile_k", "sp", [-1, 16]], ["auto_unroll_max_step", "ot", 16], ["unroll_explicit", "ot", 1]]}, "result": [[0.00016667632978723405, 0.00016667764468085105, 0.00016668861808510639], 0, 2.260476589202881, 1688609670.0586498], "version": 0.2, "tvm_version": "0.13.dev0"}
{"input": ["cuda -keys=cuda,gpu -arch=sm_75 -max_num_threads=1024 -thread_warp_size=32", "batch_matmul.cuda", [["TENSOR", [1, 128, 768], "float32"], ["TENSOR", [1, 768, 768], "float32"], [1, 128, 768], "float32", 0, 0], {}], "config": {"index": 103526, "code_hash": null, "entity": [["tile_y", "sp", [-1, 1, 16]], ["tile_x", "sp", [-1, 64, 3]], ["tile_k", "sp", [-1, 4]], ["auto_unroll_max_step", "ot", 16], ["unroll_explicit", "ot", 0]]}, "result": [[0.0001856219670975323, 0.00018562304230317273, 0.00018565253819036428], 0, 2.215636730194092, 1688609671.4464867], "version": 0.2, "tvm_version": "0.13.dev0"}
{"input": ["cuda -keys=cuda,gpu -arch=sm_75 -max_num_threads=1024 -thread_warp_size=32", "batch_matmul.cuda", [["TENSOR", [1, 128, 768], "float32"], ["TENSOR", [1, 768, 768], "float32"], [1, 128, 768], "float32", 0, 0], {}], "config": {"index": 16046, "code_hash": null, "entity": [["tile_y", "sp", [-1, 1, 16]], ["tile_x", "sp", [-1, 64, 3]], ["tile_k", "sp", [-1, 4]], ["auto_unroll_max_step", "ot", 8], ["unroll_explicit", "ot", 0]]}, "result": [[0.00018516160302677534, 0.00018516913504074505, 0.00018518306169965077], 0, 2.2442972660064697, 1688609672.8399494], "version": 0.2, "tvm_version": "0.13.dev0"}
{"input": ["cuda -keys=cuda,gpu -arch=sm_75 -max_num_threads=1024 -thread_warp_size=32", "batch_matmul.cuda", [["TENSOR", [1, 128, 768], "float32"], ["TENSOR", [1, 768, 768], "float32"], [1, 128, 768], "float32", 0, 0], {}], "config": {"index": 99702, "code_hash": null, "entity": [["tile_y", "sp", [-1, 8, 4]], ["tile_x", "sp", [-1, 6, 8]], ["tile_k", "sp", [-1, 3]], ["auto_unroll_max_step", "ot", 16], ["unroll_explicit", "ot", 0]]}, "result": [[0.0003187537718940937, 0.0003187712362525458, 0.00031883314256619147], 0, 2.185176134109497, 1688609674.2106123], "version": 0.2, "tvm_version": "0.13.dev0"}
{"input": ["cuda -keys=cuda,gpu -arch=sm_75 -max_num_threads=1024 -thread_warp_size=32", "batch_matmul.cuda", [["TENSOR", [1, 128, 768], "float32"], ["TENSOR", [1, 768, 768], "float32"], [1, 128, 768], "float32", 0, 0], {}], "config": {"index": 12222, "code_hash": null, "entity": [["tile_y", "sp", [-1, 8, 4]], ["tile_x", "sp", [-1, 6, 8]], ["tile_k", "sp", [-1, 3]], ["auto_unroll_max_step", "ot", 8], ["unroll_explicit", "ot", 0]]}, "result": [[0.000318609117764471, 0.00031865358483033933, 0.00031874087425149696], 0, 2.2025556564331055, 1688609675.5898092], "version": 0.2, "tvm_version": "0.13.dev0"}
{"input": ["cuda -keys=cuda,gpu -arch=sm_75 -max_num_threads=1024 -thread_warp_size=32", "batch_matmul.cuda", [["TENSOR", [1, 128, 768], "float32"], ["TENSOR", [1, 768, 768], "float32"], [1, 128, 768], "float32", 0, 0], {}], "config": {"index": 458337, "code_hash": null, "entity": [["tile_y", "sp", [-1, 1, 8]], ["tile_x", "sp", [-1, 128, 3]], ["tile_k", "sp", [-1, 6]], ["auto_unroll_max_step", "ot", 16], ["unroll_explicit", "ot", 1]]}, "result": [[0.00020216127191867854, 0.00020220522617534942, 0.0002022193799237611], 0, 2.2089192867279053, 1688609676.9749138], "version": 0.2, "tvm_version": "0.13.dev0"}
{"input": ["cuda -keys=cuda,gpu -arch=sm_75 -max_num_threads=1024 -thread_warp_size=32", "batch_matmul.cuda", [["TENSOR", [1, 128, 768], "float32"], ["TENSOR", [1, 768, 768], "float32"], [1, 128, 768], "float32", 0, 0], {}], "config": {"index": 468021, "code_hash": null, "entity": [["tile_y", "sp", [-1, 1, 8]], ["tile_x", "sp", [-1, 64, 3]], ["tile_k", "sp", [-1, 12]], ["auto_unroll_max_step", "ot", 16], ["unroll_explicit", "ot", 1]]}, "result": [[0.00016260505515088453, 0.00016261048491155046, 0.00016263349219562955], 0, 2.2535929679870605, 1688609678.356516], "version": 0.2, "tvm_version": "0.13.dev0"}
{"input": ["cuda -keys=cuda,gpu -arch=sm_75 -max_num_threads=1024 -thread_warp_size=32", "batch_matmul.cuda", [["TENSOR", [1, 128, 768], "float32"], ["TENSOR", [1, 768, 768], "float32"], [1, 128, 768], "float32", 0, 0], {}], "config": {"index": 458270, "code_hash": null, "entity": [["tile_y", "sp", [-1, 1, 16]], ["tile_x", "sp", [-1, 32, 3]], ["tile_k", "sp", [-1, 6]], ["auto_unroll_max_step", "ot", 16], ["unroll_explicit", "ot", 1]]}, "result": [[0.0001643456717948718, 0.0001643853753846154, 0.00016442820923076926], 0, 2.2743241786956787, 1688609679.753154], "version": 0.2, "tvm_version": "0.13.dev0"}
{"input": ["cuda -keys=cuda,gpu -arch=sm_75 -max_num_threads=1024 -thread_warp_size=32", "batch_matmul.cuda", [["TENSOR", [1, 128, 768], "float32"], ["TENSOR", [1, 768, 768], "float32"], [1, 128, 768], "float32", 0, 0], {}], "config": {"index": 370790, "code_hash": null, "entity": [["tile_y", "sp", [-1, 1, 16]], ["tile_x", "sp", [-1, 32, 3]], ["tile_k", "sp", [-1, 6]], ["auto_unroll_max_step", "ot", 8], ["unroll_explicit", "ot", 1]]}, "result": [[0.0001641357224576271, 0.0001641527754237288, 0.0001641725434322034], 0, 2.257528781890869, 1688609681.1227784], "version": 0.2, "tvm_version": "0.13.dev0"}
{"input": ["cuda -keys=cuda,gpu -arch=sm_75 -max_num_threads=1024 -thread_warp_size=32", "batch_matmul.cuda", [["TENSOR", [1, 128, 768], "float32"], ["TENSOR", [1, 768, 768], "float32"], [1, 128, 768], "float32", 0, 0], {}], "config": {"index": 453446, "code_hash": null, "entity": [["tile_y", "sp", [-1, 1, 16]], ["tile_x", "sp", [-1, 64, 3]], ["tile_k", "sp", [-1, 4]], ["auto_unroll_max_step", "ot", 16], ["unroll_explicit", "ot", 1]]}, "result": [[0.00018402079859484777, 0.00018403221662763466, 0.00018403645081967212], 0, 2.24657940864563, 1688609682.4909463], "version": 0.2, "tvm_version": "0.13.dev0"}
{"input": ["cuda -keys=cuda,gpu -arch=sm_75 -max_num_threads=1024 -thread_warp_size=32", "batch_matmul.cuda", [["TENSOR", [1, 128, 768], "float32"], ["TENSOR", [1, 768, 768], "float32"], [1, 128, 768], "float32", 0, 0], {}], "config": {"index": 365966, "code_hash": null, "entity": [["tile_y", "sp", [-1, 1, 16]], ["tile_x", "sp", [-1, 64, 3]], ["tile_k", "sp", [-1, 4]], ["auto_unroll_max_step", "ot", 8], ["unroll_explicit", "ot", 1]]}, "result": [[0.00018447548253557568, 0.00018451075679172055, 0.00018452939197930143], 0, 2.115635633468628, 1688609683.7817721], "version": 0.2, "tvm_version": "0.13.dev0"}
{"input": ["cuda -keys=cuda,gpu -arch=sm_75 -max_num_threads=1024 -thread_warp_size=32", "batch_matmul.cuda", [["TENSOR", [1, 128, 768], "float32"], ["TENSOR", [1, 768, 768], "float32"], [1, 128, 768], "float32", 0, 0], {}], "config": {"index": 108311, "code_hash": null, "entity": [["tile_y", "sp", [-1, 4, 8]], ["tile_x", "sp", [-1, 16, 3]], ["tile_k", "sp", [-1, 6]], ["auto_unroll_max_step", "ot", 16], ["unroll_explicit", "ot", 0]]}, "result": [[0.000156875865877712, 0.00015697959270216964, 0.00015700929684418145], 0, 2.1900742053985596, 1688609685.1601381], "version": 0.2, "tvm_version": "0.13.dev0"}
{"input": ["cuda -keys=cuda,gpu -arch=sm_75 -max_num_threads=1024 -thread_warp_size=32", "batch_matmul.cuda", [["TENSOR", [1, 128, 768], "float32"], ["TENSOR", [1, 768, 768], "float32"], [1, 128, 768], "float32", 0, 0], {}], "config": {"index": 628446, "code_hash": null, "entity": [["tile_y", "sp", [-1, 1, 32]], ["tile_x", "sp", [-1, 128, 3]], ["tile_k", "sp", [-1, 4]], ["auto_unroll_max_step", "ot", 64], ["unroll_explicit", "ot", 1]]}, "result": [[0.000270467906779661, 0.0002704763118644068, 0.00027048179491525427], 0, 2.311173915863037, 1688609686.5472193], "version": 0.2, "tvm_version": "0.13.dev0"}
{"input": ["cuda -keys=cuda,gpu -arch=sm_75 -max_num_threads=1024 -thread_warp_size=32", "batch_matmul.cuda", [["TENSOR", [1, 128, 768], "float32"], ["TENSOR", [1, 768, 768], "float32"], [1, 128, 768], "float32", 0, 0], {}], "config": {"index": 449922, "code_hash": null, "entity": [["tile_y", "sp", [-1, 1, 32]], ["tile_x", "sp", [-1, 1, 12]], ["tile_k", "sp", [-1, 3]], ["auto_unroll_max_step", "ot", 16], ["unroll_explicit", "ot", 1]]}, "result": [[0.03724941733333333, 0.03729339833333333, 0.037301183], 0, 2.691499948501587, 1688609687.7066176], "version": 0.2, "tvm_version": "0.13.dev0"}
{"input": ["cuda -keys=cuda,gpu -arch=sm_75 -max_num_threads=1024 -thread_warp_size=32", "batch_matmul.cuda", [["TENSOR", [1, 128, 768], "float32"], ["TENSOR", [1, 768, 768], "float32"], [1, 128, 768], "float32", 0, 0], {}], "config": {"index": 555470, "code_hash": null, "entity": [["tile_y", "sp", [-1, 1, 16]], ["tile_x", "sp", [-1, 32, 3]], ["tile_k", "sp", [-1, 12]], ["auto_unroll_max_step", "ot", 32], ["unroll_explicit", "ot", 1]]}, "result": [[0.00013937523986486485, 0.0001394324684684685, 0.00013978752702702702], 0, 2.2182400226593018, 1688609761.4073818], "version": 0.2, "tvm_version": "0.13.dev0"}
{"input": ["cuda -keys=cuda,gpu -arch=sm_75 -max_num_threads=1024 -thread_warp_size=32", "batch_matmul.cuda", [["TENSOR", [1, 128, 768], "float32"], ["TENSOR", [1, 768, 768], "float32"], [1, 128, 768], "float32", 0, 0], {}], "config": {"index": 642950, "code_hash": null, "entity": [["tile_y", "sp", [-1, 1, 16]], ["tile_x", "sp", [-1, 32, 3]], ["tile_k", "sp", [-1, 12]], ["auto_unroll_max_step", "ot", 64], ["unroll_explicit", "ot", 1]]}, "result": [[0.0001396192843224092, 0.00013964658547387072, 0.0001397537750221435], 0, 2.423227071762085, 1688609762.7967877], "version": 0.2, "tvm_version": "0.13.dev0"}
{"input": ["cuda -keys=cuda,gpu -arch=sm_75 -max_num_threads=1024 -thread_warp_size=32", "batch_matmul.cuda", [["TENSOR", [1, 128, 768], "float32"], ["TENSOR", [1, 768, 768], "float32"], [1, 128, 768], "float32", 0, 0], {}], "config": {"index": 205550, "code_hash": null, "entity": [["tile_y", "sp", [-1, 1, 16]], ["tile_x", "sp", [-1, 32, 3]], ["tile_k", "sp", [-1, 12]], ["auto_unroll_max_step", "ot", 32], ["unroll_explicit", "ot", 0]]}, "result": [[0.0001395705643478261, 0.00013962373130434782, 0.00013962649130434785], 0, 2.3576548099517822, 1688609764.1952589], "version": 0.2, "tvm_version": "0.13.dev0"}
{"input": ["cuda -keys=cuda,gpu -arch=sm_75 -max_num_threads=1024 -thread_warp_size=32", "batch_matmul.cuda", [["TENSOR", [1, 128, 768], "float32"], ["TENSOR", [1, 768, 768], "float32"], [1, 128, 768], "float32", 0, 0], {}], "config": {"index": 293030, "code_hash": null, "entity": [["tile_y", "sp", [-1, 1, 16]], ["tile_x", "sp", [-1, 32, 3]], ["tile_k", "sp", [-1, 12]], ["auto_unroll_max_step", "ot", 64], ["unroll_explicit", "ot", 0]]}, "result": [[0.00013959892925764195, 0.00013960364716157205, 0.0001396235170305677], 0, 2.317100763320923, 1688609765.5801272], "version": 0.2, "tvm_version": "0.13.dev0"}
{"input": ["cuda -keys=cuda,gpu -arch=sm_75 -max_num_threads=1024 -thread_warp_size=32", "batch_matmul.cuda", [["TENSOR", [1, 128, 768], "float32"], ["TENSOR", [1, 768, 768], "float32"], [1, 128, 768], "float32", 0, 0], {}], "config": {"index": 195866, "code_hash": null, "entity": [["tile_y", "sp", [-1, 1, 16]], ["tile_x", "sp", [-1, 64, 3]], ["tile_k", "sp", [-1, 6]], ["auto_unroll_max_step", "ot", 32], ["unroll_explicit", "ot", 0]]}, "result": [[0.00015254837069813177, 0.00015266964503441496, 0.00015275359095378565], 0, 2.265345573425293, 1688609766.9335341], "version": 0.2, "tvm_version": "0.13.dev0"}
{"input": ["cuda -keys=cuda,gpu -arch=sm_75 -max_num_threads=1024 -thread_warp_size=32", "batch_matmul.cuda", [["TENSOR", [1, 128, 768], "float32"], ["TENSOR", [1, 768, 768], "float32"], [1, 128, 768], "float32", 0, 0], {}], "config": {"index": 283346, "code_hash": null, "entity": [["tile_y", "sp", [-1, 1, 16]], ["tile_x", "sp", [-1, 64, 3]], ["tile_k", "sp", [-1, 6]], ["auto_unroll_max_step", "ot", 64], ["unroll_explicit", "ot", 0]]}, "result": [[0.00015298083333333332, 0.0001530582364341085, 0.00015308560465116279], 0, 2.2817435264587402, 1688609768.2950904], "version": 0.2, "tvm_version": "0.13.dev0"}
