src/tvm/results/mm/gogh-gpu-small/XGBTuner_gpu_mm.log
{"input": ["cuda -keys=cuda,gpu -arch=sm_86 -max_num_threads=1024 -thread_warp_size=32", "template_matmul", [1024, 1024, 1024, [1, 8, 16, 24, 32, 40, 48, 56, 64, 72, 80, 88, 96, 104, 112, 120, 128], "float32"], {}], "config": {"index": 85, "code_hash": null, "entity": [["tile_x", "ot", 1], ["tile_y", "ot", 40], ["order", "ot", 0]]}, "result": [[0.038053375, 0.038326270999999995, 0.042126335], 0, 1.0491328239440918, 1675692257.8748634], "version": 0.2, "tvm_version": "0.10.0"}
{"input": ["cuda -keys=cuda,gpu -arch=sm_86 -max_num_threads=1024 -thread_warp_size=32", "template_matmul", [1024, 1024, 1024, [1, 8, 16, 24, 32, 40, 48, 56, 64, 72, 80, 88, 96, 104, 112, 120, 128], "float32"], {}], "config": {"index": 343, "code_hash": null, "entity": [["tile_x", "ot", 24], ["tile_y", "ot", 24], ["order", "ot", 1]]}, "result": [[0.0023152635, 0.0023173119999999998, 0.0023224], 0, 0.6282453536987305, 1675692258.248739], "version": 0.2, "tvm_version": "0.10.0"}
{"input": ["cuda -keys=cuda,gpu -arch=sm_86 -max_num_threads=1024 -thread_warp_size=32", "template_matmul", [1024, 1024, 1024, [1, 8, 16, 24, 32, 40, 48, 56, 64, 72, 80, 88, 96, 104, 112, 120, 128], "float32"], {}], "config": {"index": 1459, "code_hash": null, "entity": [["tile_x", "ot", 112], ["tile_y", "ot", 1], ["order", "ot", 5]]}, "result": [[0.0083322875, 0.008452608, 0.00852472], 0, 0.6802723407745361, 1675692258.6802475], "version": 0.2, "tvm_version": "0.10.0"}
{"input": ["cuda -keys=cuda,gpu -arch=sm_86 -max_num_threads=1024 -thread_warp_size=32", "template_matmul", [1024, 1024, 1024, [1, 8, 16, 24, 32, 40, 48, 56, 64, 72, 80, 88, 96, 104, 112, 120, 128], "float32"], {}], "config": {"index": 1583, "code_hash": null, "entity": [["tile_x", "ot", 16], ["tile_y", "ot", 64], ["order", "ot", 5]]}, "result": [[0.0087080955, 0.008871888, 0.008936448], 0, 0.7341418266296387, 1675692259.1314712], "version": 0.2, "tvm_version": "0.10.0"}
{"input": ["cuda -keys=cuda,gpu -arch=sm_86 -max_num_threads=1024 -thread_warp_size=32", "template_matmul", [1024, 1024, 1024, [1, 8, 16, 24, 32, 40, 48, 56, 64, 72, 80, 88, 96, 104, 112, 120, 128], "float32"], {}], "config": {"index": 600, "code_hash": null, "entity": [["tile_x", "ot", 40], ["tile_y", "ot", 8], ["order", "ot", 2]]}, "result": [[0.0022384315, 0.0022415355, 0.0022435835], 0, 0.5933630466461182, 1675692259.8667054], "version": 0.2, "tvm_version": "0.10.0"}
{"input": ["cuda -keys=cuda,gpu -arch=sm_86 -max_num_threads=1024 -thread_warp_size=32", "template_matmul", [1024, 1024, 1024, [1, 8, 16, 24, 32, 40, 48, 56, 64, 72, 80, 88, 96, 104, 112, 120, 128], "float32"], {}], "config": {"index": 1547, "code_hash": null, "entity": [["tile_x", "ot", 1], ["tile_y", "ot", 48], ["order", "ot", 5]]}, "result": [[0.052696575, 0.052732414, 0.052753406499999995], 0, 1.1489450931549072, 1675692260.7933547], "version": 0.2, "tvm_version": "0.10.0"}
{"input": ["cuda -keys=cuda,gpu -arch=sm_86 -max_num_threads=1024 -thread_warp_size=32", "template_matmul", [1024, 1024, 1024, [1, 8, 16, 24, 32, 40, 48, 56, 64, 72, 80, 88, 96, 104, 112, 120, 128], "float32"], {}], "config": {"index": 886, "code_hash": null, "entity": [["tile_x", "ot", 16], ["tile_y", "ot", 8], ["order", "ot", 3]]}, "result": [[0.0009681915, 0.0009686715, 0.0009687035000000001], 0, 0.583690881729126, 1675692261.1527975], "version": 0.2, "tvm_version": "0.10.0"}
{"input": ["cuda -keys=cuda,gpu -arch=sm_86 -max_num_threads=1024 -thread_warp_size=32", "template_matmul", [1024, 1024, 1024, [1, 8, 16, 24, 32, 40, 48, 56, 64, 72, 80, 88, 96, 104, 112, 120, 128], "float32"], {}], "config": {"index": 634, "code_hash": null, "entity": [["tile_x", "ot", 40], ["tile_y", "ot", 24], ["order", "ot", 2]]}, "result": [[0.0023869440000000002, 0.002388992, 0.002388992], 0, 0.6247518062591553, 1675692261.5291874], "version": 0.2, "tvm_version": "0.10.0"}
{"input": ["cuda -keys=cuda,gpu -arch=sm_86 -max_num_threads=1024 -thread_warp_size=32", "template_matmul", [1024, 1024, 1024, [1, 8, 16, 24, 32, 40, 48, 56, 64, 72, 80, 88, 96, 104, 112, 120, 128], "float32"], {}], "config": {"index": 898, "code_hash": null, "entity": [["tile_x", "ot", 112], ["tile_y", "ot", 8], ["order", "ot", 3]]}, "result": [[0.002593696, 0.002599936, 0.0026035195], 0, 0.615196943283081, 1675692261.9038014], "version": 0.2, "tvm_version": "0.10.0"}
{"input": ["cuda -keys=cuda,gpu -arch=sm_86 -max_num_threads=1024 -thread_warp_size=32", "template_matmul", [1024, 1024, 1024, [1, 8, 16, 24, 32, 40, 48, 56, 64, 72, 80, 88, 96, 104, 112, 120, 128], "float32"], {}], "config": {"index": 765, "code_hash": null, "entity": [["tile_x", "ot", 1], ["tile_y", "ot", 88], ["order", "ot", 2]]}, "result": [[0.038764545, 0.0389207035, 0.042918910500000004], 0, 1.0382978916168213, 1675692263.0779743], "version": 0.2, "tvm_version": "0.10.0"}
{"input": ["cuda -keys=cuda,gpu -arch=sm_86 -max_num_threads=1024 -thread_warp_size=32", "template_matmul", [1024, 1024, 1024, [1, 8, 16, 24, 32, 40, 48, 56, 64, 72, 80, 88, 96, 104, 112, 120, 128], "float32"], {}], "config": {"index": 904, "code_hash": null, "entity": [["tile_x", "ot", 24], ["tile_y", "ot", 16], ["order", "ot", 3]]}, "result": [[0.0022103039999999997, 0.0022128155, 0.0022163995], 0, 0.6073312759399414, 1675692263.4505186], "version": 0.2, "tvm_version": "0.10.0"}
{"input": ["cuda -keys=cuda,gpu -arch=sm_86 -max_num_threads=1024 -thread_warp_size=32", "template_matmul", [1024, 1024, 1024, [1, 8, 16, 24, 32, 40, 48, 56, 64, 72, 80, 88, 96, 104, 112, 120, 128], "float32"], {}], "config": {"index": 851, "code_hash": null, "entity": [["tile_x", "ot", 8], ["tile_y", "ot", 128], ["order", "ot", 2]]}, "result": [[0.001241088, 0.001241088, 0.0012414875], 0, 0.5825340747833252, 1675692263.813849], "version": 0.2, "tvm_version": "0.10.0"}
{"input": ["cuda -keys=cuda,gpu -arch=sm_86 -max_num_threads=1024 -thread_warp_size=32", "template_matmul", [1024, 1024, 1024, [1, 8, 16, 24, 32, 40, 48, 56, 64, 72, 80, 88, 96, 104, 112, 120, 128], "float32"], {}], "config": {"index": 205, "code_hash": null, "entity": [["tile_x", "ot", 8], ["tile_y", "ot", 96], ["order", "ot", 0]]}, "result": [[0.0036208155, 0.003624416, 0.0036746235], 0, 0.62799072265625, 1675692264.2059906], "version": 0.2, "tvm_version": "0.10.0"}
{"input": ["cuda -keys=cuda,gpu -arch=sm_86 -max_num_threads=1024 -thread_warp_size=32", "template_matmul", [1024, 1024, 1024, [1, 8, 16, 24, 32, 40, 48, 56, 64, 72, 80, 88, 96, 104, 112, 120, 128], "float32"], {}], "config": {"index": 222, "code_hash": null, "entity": [["tile_x", "ot", 8], ["tile_y", "ot", 104], ["order", "ot", 0]]}, "result": [[0.004267968, 0.0042690555000000005, 0.0042808314999999994], 0, 0.6342868804931641, 1675692264.9687693], "version": 0.2, "tvm_version": "0.10.0"}
{"input": ["cuda -keys=cuda,gpu -arch=sm_86 -max_num_threads=1024 -thread_warp_size=32", "template_matmul", [1024, 1024, 1024, [1, 8, 16, 24, 32, 40, 48, 56, 64, 72, 80, 88, 96, 104, 112, 120, 128], "float32"], {}], "config": {"index": 1460, "code_hash": null, "entity": [["tile_x", "ot", 120], ["tile_y", "ot", 1], ["order", "ot", 5]]}, "result": [[0.0088202235, 0.0088207195, 0.00882176], 0, 0.6932768821716309, 1675692265.4146001], "version": 0.2, "tvm_version": "0.10.0"}
{"input": ["cuda -keys=cuda,gpu -arch=sm_86 -max_num_threads=1024 -thread_warp_size=32", "template_matmul", [1024, 1024, 1024, [1, 8, 16, 24, 32, 40, 48, 56, 64, 72, 80, 88, 96, 104, 112, 120, 128], "float32"], {}], "config": {"index": 663, "code_hash": null, "entity": [["tile_x", "ot", 1], ["tile_y", "ot", 40], ["order", "ot", 2]]}, "result": [[0.038318080500000004, 0.0388745115, 0.039057406999999995], 0, 1.016066074371338, 1675692266.1878018], "version": 0.2, "tvm_version": "0.10.0"}
{"input": ["cuda -keys=cuda,gpu -arch=sm_86 -max_num_threads=1024 -thread_warp_size=32", "template_matmul", [1024, 1024, 1024, [1, 8, 16, 24, 32, 40, 48, 56, 64, 72, 80, 88, 96, 104, 112, 120, 128], "float32"], {}], "config": {"index": 38, "code_hash": null, "entity": [["tile_x", "ot", 32], ["tile_y", "ot", 16], ["order", "ot", 0]]}, "result": [[0.000980992, 0.000981504, 0.000982016], 0, 0.5863544940948486, 1675692266.5259473], "version": 0.2, "tvm_version": "0.10.0"}
{"input": ["cuda -keys=cuda,gpu -arch=sm_86 -max_num_threads=1024 -thread_warp_size=32", "template_matmul", [1024, 1024, 1024, [1, 8, 16, 24, 32, 40, 48, 56, 64, 72, 80, 88, 96, 104, 112, 120, 128], "float32"], {}], "config": {"index": 1198, "code_hash": null, "entity": [["tile_x", "ot", 64], ["tile_y", "ot", 16], ["order", "ot", 4]]}, "result": [[0.008441856, 0.008580095999999999, 0.008637904], 0, 0.6836667060852051, 1675692266.96604], "version": 0.2, "tvm_version": "0.10.0"}
{"input": ["cuda -keys=cuda,gpu -arch=sm_86 -max_num_threads=1024 -thread_warp_size=32", "template_matmul", [1024, 1024, 1024, [1, 8, 16, 24, 32, 40, 48, 56, 64, 72, 80, 88, 96, 104, 112, 120, 128], "float32"], {}], "config": {"index": 1477, "code_hash": null, "entity": [["tile_x", "ot", 120], ["tile_y", "ot", 8], ["order", "ot", 5]]}, "result": [[0.009230335999999999, 0.009321984, 0.009354736], 0, 0.6730914115905762, 1675692267.3982747], "version": 0.2, "tvm_version": "0.10.0"}
{"input": ["cuda -keys=cuda,gpu -arch=sm_86 -max_num_threads=1024 -thread_warp_size=32", "template_matmul", [1024, 1024, 1024, [1, 8, 16, 24, 32, 40, 48, 56, 64, 72, 80, 88, 96, 104, 112, 120, 128], "float32"], {}], "config": {"index": 1197, "code_hash": null, "entity": [["tile_x", "ot", 56], ["tile_y", "ot", 16], ["order", "ot", 4]]}, "result": [[0.009609215499999999, 0.0096823355, 0.009682432000000001], 0, 0.6710412502288818, 1675692267.8270555], "version": 0.2, "tvm_version": "0.10.0"}
{"input": ["cuda -keys=cuda,gpu -arch=sm_86 -max_num_threads=1024 -thread_warp_size=32", "template_matmul", [1024, 1024, 1024, [1, 8, 16, 24, 32, 40, 48, 56, 64, 72, 80, 88, 96, 104, 112, 120, 128], "float32"], {}], "config": {"index": 1196, "code_hash": null, "entity": [["tile_x", "ot", 48], ["tile_y", "ot", 16], ["order", "ot", 4]]}, "result": [[0.0067082235, 0.0070927355, 0.007286784], 0, 0.6665928363800049, 1675692268.2501292], "version": 0.2, "tvm_version": "0.10.0"}
{"input": ["cuda -keys=cuda,gpu -arch=sm_86 -max_num_threads=1024 -thread_warp_size=32", "template_matmul", [1024, 1024, 1024, [1, 8, 16, 24, 32, 40, 48, 56, 64, 72, 80, 88, 96, 104, 112, 120, 128], "float32"], {}], "config": {"index": 596, "code_hash": null, "entity": [["tile_x", "ot", 8], ["tile_y", "ot", 8], ["order", "ot", 2]]}, "result": [[0.0014079680000000001, 0.001410048, 0.001412544], 0, 0.7850329875946045, 1675692271.4134738], "version": 0.2, "tvm_version": "0.10.0"}
{"input": ["cuda -keys=cuda,gpu -arch=sm_86 -max_num_threads=1024 -thread_warp_size=32", "template_matmul", [1024, 1024, 1024, [1, 8, 16, 24, 32, 40, 48, 56, 64, 72, 80, 88, 96, 104, 112, 120, 128], "float32"], {}], "config": {"index": 613, "code_hash": null, "entity": [["tile_x", "ot", 8], ["tile_y", "ot", 16], ["order", "ot", 2]]}, "result": [[0.0014310400000000002, 0.0014335995, 0.0014335995], 0, 0.817246675491333, 1675692271.7736385], "version": 0.2, "tvm_version": "0.10.0"}
{"input": ["cuda -keys=cuda,gpu -arch=sm_86 -max_num_threads=1024 -thread_warp_size=32", "template_matmul", [1024, 1024, 1024, [1, 8, 16, 24, 32, 40, 48, 56, 64, 72, 80, 88, 96, 104, 112, 120, 128], "float32"], {}], "config": {"index": 579, "code_hash": null, "entity": [["tile_x", "ot", 8], ["tile_y", "ot", 1], ["order", "ot", 2]]}, "result": [[0.004446208, 0.004446208, 0.00444672], 0, 0.8437199592590332, 1675692272.1665425], "version": 0.2, "tvm_version": "0.10.0"}
{"input": ["cuda -keys=cuda,gpu -arch=sm_86 -max_num_threads=1024 -thread_warp_size=32", "template_matmul", [1024, 1024, 1024, [1, 8, 16, 24, 32, 40, 48, 56, 64, 72, 80, 88, 96, 104, 112, 120, 128], "float32"], {}], "config": {"index": 597, "code_hash": null, "entity": [["tile_x", "ot", 16], ["tile_y", "ot", 8], ["order", "ot", 2]]}, "result": [[0.0011269115000000001, 0.0011269115000000001, 0.001127424], 0, 0.8066022396087646, 1675692272.5347633], "version": 0.2, "tvm_version": "0.10.0"}
{"input": ["cuda -keys=cuda,gpu -arch=sm_86 -max_num_threads=1024 -thread_warp_size=32", "template_matmul", [1024, 1024, 1024, [1, 8, 16, 24, 32, 40, 48, 56, 64, 72, 80, 88, 96, 104, 112, 120, 128], "float32"], {}], "config": {"index": 580, "code_hash": null, "entity": [["tile_x", "ot", 16], ["tile_y", "ot", 1], ["order", "ot", 2]]}, "result": [[0.002233328, 0.0022333440000000004, 0.0022338395000000002], 0, 0.811988115310669, 1675692272.89195], "version": 0.2, "tvm_version": "0.10.0"}
{"input": ["cuda -keys=cuda,gpu -arch=sm_86 -max_num_threads=1024 -thread_warp_size=32", "template_matmul", [1024, 1024, 1024, [1, 8, 16, 24, 32, 40, 48, 56, 64, 72, 80, 88, 96, 104, 112, 120, 128], "float32"], {}], "config": {"index": 614, "code_hash": null, "entity": [["tile_x", "ot", 16], ["tile_y", "ot", 16], ["order", "ot", 2]]}, "result": [[0.001129472, 0.0011299840000000001, 0.0011299840000000001], 0, 0.8124949932098389, 1675692273.2551022], "version": 0.2, "tvm_version": "0.10.0"}
{"input": ["cuda -keys=cuda,gpu -arch=sm_86 -max_num_threads=1024 -thread_warp_size=32", "template_matmul", [1024, 1024, 1024, [1, 8, 16, 24, 32, 40, 48, 56, 64, 72, 80, 88, 96, 104, 112, 120, 128], "float32"], {}], "config": {"index": 598, "code_hash": null, "entity": [["tile_x", "ot", 24], ["tile_y", "ot", 8], ["order", "ot", 2]]}, "result": [[0.0025937915, 0.0026014715000000003, 0.0026055674999999998], 0, 0.8376970291137695, 1675692273.6408162], "version": 0.2, "tvm_version": "0.10.0"}
{"input": ["cuda -keys=cuda,gpu -arch=sm_86 -max_num_threads=1024 -thread_warp_size=32", "template_matmul", [1024, 1024, 1024, [1, 8, 16, 24, 32, 40, 48, 56, 64, 72, 80, 88, 96, 104, 112, 120, 128], "float32"], {}], "config": {"index": 599, "code_hash": null, "entity": [["tile_x", "ot", 32], ["tile_y", "ot", 8], ["order", "ot", 2]]}, "result": [[0.0011269115000000001, 0.0011269115000000001, 0.001127424], 0, 0.816845178604126, 1675692274.0032759], "version": 0.2, "tvm_version": "0.10.0"}
{"input": ["cuda -keys=cuda,gpu -arch=sm_86 -max_num_threads=1024 -thread_warp_size=32", "template_matmul", [1024, 1024, 1024, [1, 8, 16, 24, 32, 40, 48, 56, 64, 72, 80, 88, 96, 104, 112, 120, 128], "float32"], {}], "config": {"index": 324, "code_hash": null, "entity": [["tile_x", "ot", 8], ["tile_y", "ot", 16], ["order", "ot", 1]]}, "result": [[0.001425408, 0.001429504, 0.001432016], 0, 0.8158459663391113, 1675692274.3669963], "version": 0.2, "tvm_version": "0.10.0"}
{"input": ["cuda -keys=cuda,gpu -arch=sm_86 -max_num_threads=1024 -thread_warp_size=32", "template_matmul", [1024, 1024, 1024, [1, 8, 16, 24, 32, 40, 48, 56, 64, 72, 80, 88, 96, 104, 112, 120, 128], "float32"], {}], "config": {"index": 887, "code_hash": null, "entity": [["tile_x", "ot", 24], ["tile_y", "ot", 8], ["order", "ot", 3]]}, "result": [[0.0026060799999999998, 0.002609152, 0.002610176], 0, 0.8389263153076172, 1675692274.7472339], "version": 0.2, "tvm_version": "0.10.0"}
{"input": ["cuda -keys=cuda,gpu -arch=sm_86 -max_num_threads=1024 -thread_warp_size=32", "template_matmul", [1024, 1024, 1024, [1, 8, 16, 24, 32, 40, 48, 56, 64, 72, 80, 88, 96, 104, 112, 120, 128], "float32"], {}], "config": {"index": 581, "code_hash": null, "entity": [["tile_x", "ot", 24], ["tile_y", "ot", 1], ["order", "ot", 2]]}, "result": [[0.005671936, 0.0056770555, 0.005685232], 0, 0.8610649108886719, 1675692275.1595051], "version": 0.2, "tvm_version": "0.10.0"}
{"input": ["cuda -keys=cuda,gpu -arch=sm_86 -max_num_threads=1024 -thread_warp_size=32", "template_matmul", [1024, 1024, 1024, [1, 8, 16, 24, 32, 40, 48, 56, 64, 72, 80, 88, 96, 104, 112, 120, 128], "float32"], {}], "config": {"index": 582, "code_hash": null, "entity": [["tile_x", "ot", 32], ["tile_y", "ot", 1], ["order", "ot", 2]]}, "result": [[0.0018242555, 0.0018267995, 0.0018273275], 0, 0.7987523078918457, 1675692275.508099], "version": 0.2, "tvm_version": "0.10.0"}
{"input": ["cuda -keys=cuda,gpu -arch=sm_86 -max_num_threads=1024 -thread_warp_size=32", "template_matmul", [1024, 1024, 1024, [1, 8, 16, 24, 32, 40, 48, 56, 64, 72, 80, 88, 96, 104, 112, 120, 128], "float32"], {}], "config": {"index": 595, "code_hash": null, "entity": [["tile_x", "ot", 1], ["tile_y", "ot", 8], ["order", "ot", 2]]}, "result": [[0.009968128, 0.009974783499999999, 0.0099772955], 0, 0.8843941688537598, 1675692275.9439456], "version": 0.2, "tvm_version": "0.10.0"}
{"input": ["cuda -keys=cuda,gpu -arch=sm_86 -max_num_threads=1024 -thread_warp_size=32", "template_matmul", [1024, 1024, 1024, [1, 8, 16, 24, 32, 40, 48, 56, 64, 72, 80, 88, 96, 104, 112, 120, 128], "float32"], {}], "config": {"index": 870, "code_hash": null, "entity": [["tile_x", "ot", 24], ["tile_y", "ot", 1], ["order", "ot", 3]]}, "result": [[0.0048824315, 0.004896768, 0.004918272], 0, 0.845625638961792, 1675692276.3431673], "version": 0.2, "tvm_version": "0.10.0"}
{"input": ["cuda -keys=cuda,gpu -arch=sm_86 -max_num_threads=1024 -thread_warp_size=32", "template_matmul", [1024, 1024, 1024, [1, 8, 16, 24, 32, 40, 48, 56, 64, 72, 80, 88, 96, 104, 112, 120, 128], "float32"], {}], "config": {"index": 612, "code_hash": null, "entity": [["tile_x", "ot", 1], ["tile_y", "ot", 16], ["order", "ot", 2]]}, "result": [[0.008102399500000001, 0.008104448, 0.0081070075], 0, 0.8811295032501221, 1675692276.7820365], "version": 0.2, "tvm_version": "0.10.0"}
{"input": ["cuda -keys=cuda,gpu -arch=sm_86 -max_num_threads=1024 -thread_warp_size=32", "template_matmul", [1024, 1024, 1024, [1, 8, 16, 24, 32, 40, 48, 56, 64, 72, 80, 88, 96, 104, 112, 120, 128], "float32"], {}], "config": {"index": 885, "code_hash": null, "entity": [["tile_x", "ot", 8], ["tile_y", "ot", 8], ["order", "ot", 3]]}, "result": [[0.001209856, 0.001210368, 0.001210368], 0, 0.808021068572998, 1675692277.1415489], "version": 0.2, "tvm_version": "0.10.0"}
{"input": ["cuda -keys=cuda,gpu -arch=sm_86 -max_num_threads=1024 -thread_warp_size=32", "template_matmul", [1024, 1024, 1024, [1, 8, 16, 24, 32, 40, 48, 56, 64, 72, 80, 88, 96, 104, 112, 120, 128], "float32"], {}], "config": {"index": 578, "code_hash": null, "entity": [["tile_x", "ot", 1], ["tile_y", "ot", 1], ["order", "ot", 2]]}, "result": [[0.030377983, 0.030378495999999998, 0.0303794555], 0, 1.1223411560058594, 1675692278.3977594], "version": 0.2, "tvm_version": "0.10.0"}
{"input": ["cuda -keys=cuda,gpu -arch=sm_86 -max_num_threads=1024 -thread_warp_size=32", "template_matmul", [1024, 1024, 1024, [1, 8, 16, 24, 32, 40, 48, 56, 64, 72, 80, 88, 96, 104, 112, 120, 128], "float32"], {}], "config": {"index": 583, "code_hash": null, "entity": [["tile_x", "ot", 40], ["tile_y", "ot", 1], ["order", "ot", 2]]}, "result": [[0.0033551354999999997, 0.0033560315, 0.003357696], 0, 0.8391678333282471, 1675692278.7870286], "version": 0.2, "tvm_version": "0.10.0"}
{"input": ["cuda -keys=cuda,gpu -arch=sm_86 -max_num_threads=1024 -thread_warp_size=32", "template_matmul", [1024, 1024, 1024, [1, 8, 16, 24, 32, 40, 48, 56, 64, 72, 80, 88, 96, 104, 112, 120, 128], "float32"], {}], "config": {"index": 869, "code_hash": null, "entity": [["tile_x", "ot", 16], ["tile_y", "ot", 1], ["order", "ot", 3]]}, "result": [[0.001948672, 0.0019491835, 0.0019491835], 0, 0.8071267604827881, 1675692279.159249], "version": 0.2, "tvm_version": "0.10.0"}
{"input": ["cuda -keys=cuda,gpu -arch=sm_86 -max_num_threads=1024 -thread_warp_size=32", "template_matmul", [1024, 1024, 1024, [1, 8, 16, 24, 32, 40, 48, 56, 64, 72, 80, 88, 96, 104, 112, 120, 128], "float32"], {}], "config": {"index": 615, "code_hash": null, "entity": [["tile_x", "ot", 24], ["tile_y", "ot", 16], ["order", "ot", 2]]}, "result": [[0.0022060795, 0.00220928, 0.0022122875], 0, 0.7947535514831543, 1675692279.5066402], "version": 0.2, "tvm_version": "0.10.0"}
{"input": ["cuda -keys=cuda,gpu -arch=sm_86 -max_num_threads=1024 -thread_warp_size=32", "template_matmul", [1024, 1024, 1024, [1, 8, 16, 24, 32, 40, 48, 56, 64, 72, 80, 88, 96, 104, 112, 120, 128], "float32"], {}], "config": {"index": 903, "code_hash": null, "entity": [["tile_x", "ot", 16], ["tile_y", "ot", 16], ["order", "ot", 3]]}, "result": [[0.0009676795, 0.0009687035000000001, 0.0009687035000000001], 0, 0.7903168201446533, 1675692279.8646595], "version": 0.2, "tvm_version": "0.10.0"}
{"input": ["cuda -keys=cuda,gpu -arch=sm_86 -max_num_threads=1024 -thread_warp_size=32", "template_matmul", [1024, 1024, 1024, [1, 8, 16, 24, 32, 40, 48, 56, 64, 72, 80, 88, 96, 104, 112, 120, 128], "float32"], {}], "config": {"index": 307, "code_hash": null, "entity": [["tile_x", "ot", 8], ["tile_y", "ot", 8], ["order", "ot", 1]]}, "result": [[0.0014013115, 0.0014039035, 0.0014039035], 0, 0.80568528175354, 1675692280.2277303], "version": 0.2, "tvm_version": "0.10.0"}
{"input": ["cuda -keys=cuda,gpu -arch=sm_86 -max_num_threads=1024 -thread_warp_size=32", "template_matmul", [1024, 1024, 1024, [1, 8, 16, 24, 32, 40, 48, 56, 64, 72, 80, 88, 96, 104, 112, 120, 128], "float32"], {}], "config": {"index": 290, "code_hash": null, "entity": [["tile_x", "ot", 8], ["tile_y", "ot", 1], ["order", "ot", 1]]}, "result": [[0.004444671999999999, 0.004446208, 0.0044462395], 0, 0.833092451095581, 1675692280.6089683], "version": 0.2, "tvm_version": "0.10.0"}
{"input": ["cuda -keys=cuda,gpu -arch=sm_86 -max_num_threads=1024 -thread_warp_size=32", "template_matmul", [1024, 1024, 1024, [1, 8, 16, 24, 32, 40, 48, 56, 64, 72, 80, 88, 96, 104, 112, 120, 128], "float32"], {}], "config": {"index": 616, "code_hash": null, "entity": [["tile_x", "ot", 32], ["tile_y", "ot", 16], ["order", "ot", 2]]}, "result": [[0.0011381755, 0.0011386875000000002, 0.0011386875000000002], 0, 0.8156144618988037, 1675692280.9750044], "version": 0.2, "tvm_version": "0.10.0"}
{"input": ["cuda -keys=cuda,gpu -arch=sm_86 -max_num_threads=1024 -thread_warp_size=32", "template_matmul", [1024, 1024, 1024, [1, 8, 16, 24, 32, 40, 48, 56, 64, 72, 80, 88, 96, 104, 112, 120, 128], "float32"], {}], "config": {"index": 325, "code_hash": null, "entity": [["tile_x", "ot", 16], ["tile_y", "ot", 16], ["order", "ot", 1]]}, "result": [[0.001129472, 0.001129472, 0.001129472], 0, 0.7867696285247803, 1675692281.3245244], "version": 0.2, "tvm_version": "0.10.0"}
{"input": ["cuda -keys=cuda,gpu -arch=sm_86 -max_num_threads=1024 -thread_warp_size=32", "template_matmul", [1024, 1024, 1024, [1, 8, 16, 24, 32, 40, 48, 56, 64, 72, 80, 88, 96, 104, 112, 120, 128], "float32"], {}], "config": {"index": 884, "code_hash": null, "entity": [["tile_x", "ot", 1], ["tile_y", "ot", 8], ["order", "ot", 3]]}, "result": [[0.009978832, 0.009984, 0.0099855355], 0, 0.9171769618988037, 1675692281.7955978], "version": 0.2, "tvm_version": "0.10.0"}
{"input": ["cuda -keys=cuda,gpu -arch=sm_86 -max_num_threads=1024 -thread_warp_size=32", "template_matmul", [1024, 1024, 1024, [1, 8, 16, 24, 32, 40, 48, 56, 64, 72, 80, 88, 96, 104, 112, 120, 128], "float32"], {}], "config": {"index": 584, "code_hash": null, "entity": [["tile_x", "ot", 48], ["tile_y", "ot", 1], ["order", "ot", 2]]}, "result": [[0.0029685755, 0.002974208, 0.002985984], 0, 0.8256881237030029, 1675692282.1785934], "version": 0.2, "tvm_version": "0.10.0"}
{"input": ["cuda -keys=cuda,gpu -arch=sm_86 -max_num_threads=1024 -thread_warp_size=32", "template_matmul", [1024, 1024, 1024, [1, 8, 16, 24, 32, 40, 48, 56, 64, 72, 80, 88, 96, 104, 112, 120, 128], "float32"], {}], "config": {"index": 1, "code_hash": null, "entity": [["tile_x", "ot", 8], ["tile_y", "ot", 1], ["order", "ot", 0]]}, "result": [[0.0038123515, 0.003812864, 0.0038133439999999998], 0, 0.8366270065307617, 1675692282.570046], "version": 0.2, "tvm_version": "0.10.0"}
{"input": ["cuda -keys=cuda,gpu -arch=sm_86 -max_num_threads=1024 -thread_warp_size=32", "template_matmul", [1024, 1024, 1024, [1, 8, 16, 24, 32, 40, 48, 56, 64, 72, 80, 88, 96, 104, 112, 120, 128], "float32"], {}], "config": {"index": 18, "code_hash": null, "entity": [["tile_x", "ot", 8], ["tile_y", "ot", 8], ["order", "ot", 0]]}, "result": [[0.0012083200000000001, 0.001208832, 0.001209344], 0, 0.8073770999908447, 1675692282.9279773], "version": 0.2, "tvm_version": "0.10.0"}
{"input": ["cuda -keys=cuda,gpu -arch=sm_86 -max_num_threads=1024 -thread_warp_size=32", "template_matmul", [1024, 1024, 1024, [1, 8, 16, 24, 32, 40, 48, 56, 64, 72, 80, 88, 96, 104, 112, 120, 128], "float32"], {}], "config": {"index": 868, "code_hash": null, "entity": [["tile_x", "ot", 8], ["tile_y", "ot", 1], ["order", "ot", 3]]}, "result": [[0.0038117595, 0.00381184, 0.003812864], 0, 0.8425159454345703, 1675692283.3272758], "version": 0.2, "tvm_version": "0.10.0"}
{"input": ["cuda -keys=cuda,gpu -arch=sm_86 -max_num_threads=1024 -thread_warp_size=32", "template_matmul", [1024, 1024, 1024, [1, 8, 16, 24, 32, 40, 48, 56, 64, 72, 80, 88, 96, 104, 112, 120, 128], "float32"], {}], "config": {"index": 902, "code_hash": null, "entity": [["tile_x", "ot", 8], ["tile_y", "ot", 16], ["order", "ot", 3]]}, "result": [[0.001419664, 0.0014207994999999999, 0.0014213115000000001], 0, 0.8207645416259766, 1675692283.693352], "version": 0.2, "tvm_version": "0.10.0"}
{"input": ["cuda -keys=cuda,gpu -arch=sm_86 -max_num_threads=1024 -thread_warp_size=32", "template_matmul", [1024, 1024, 1024, [1, 8, 16, 24, 32, 40, 48, 56, 64, 72, 80, 88, 96, 104, 112, 120, 128], "float32"], {}], "config": {"index": 35, "code_hash": null, "entity": [["tile_x", "ot", 8], ["tile_y", "ot", 16], ["order", "ot", 0]]}, "result": [[0.001428992, 0.001429504, 0.001430528], 0, 0.8086256980895996, 1675692284.0562265], "version": 0.2, "tvm_version": "0.10.0"}
{"input": ["cuda -keys=cuda,gpu -arch=sm_86 -max_num_threads=1024 -thread_warp_size=32", "template_matmul", [1024, 1024, 1024, [1, 8, 16, 24, 32, 40, 48, 56, 64, 72, 80, 88, 96, 104, 112, 120, 128], "float32"], {}], "config": {"index": 889, "code_hash": null, "entity": [["tile_x", "ot", 40], ["tile_y", "ot", 8], ["order", "ot", 3]]}, "result": [[0.00258048, 0.0025809915, 0.0025815039999999997], 0, 0.7993204593658447, 1675692285.0014896], "version": 0.2, "tvm_version": "0.10.0"}
{"input": ["cuda -keys=cuda,gpu -arch=sm_86 -max_num_threads=1024 -thread_warp_size=32", "template_matmul", [1024, 1024, 1024, [1, 8, 16, 24, 32, 40, 48, 56, 64, 72, 80, 88, 96, 104, 112, 120, 128], "float32"], {}], "config": {"index": 630, "code_hash": null, "entity": [["tile_x", "ot", 8], ["tile_y", "ot", 24], ["order", "ot", 2]]}, "result": [[0.004008959499999999, 0.0040105115, 0.004012544], 0, 0.8506913185119629, 1675692285.4031227], "version": 0.2, "tvm_version": "0.10.0"}
{"input": ["cuda -keys=cuda,gpu -arch=sm_86 -max_num_threads=1024 -thread_warp_size=32", "template_matmul", [1024, 1024, 1024, [1, 8, 16, 24, 32, 40, 48, 56, 64, 72, 80, 88, 96, 104, 112, 120, 128], "float32"], {}], "config": {"index": 326, "code_hash": null, "entity": [["tile_x", "ot", 24], ["tile_y", "ot", 16], ["order", "ot", 1]]}, "result": [[0.002516992, 0.0025190399999999997, 0.0025195515], 0, 0.8344311714172363, 1675692285.783347], "version": 0.2, "tvm_version": "0.10.0"}
{"input": ["cuda -keys=cuda,gpu -arch=sm_86 -max_num_threads=1024 -thread_warp_size=32", "template_matmul", [1024, 1024, 1024, [1, 8, 16, 24, 32, 40, 48, 56, 64, 72, 80, 88, 96, 104, 112, 120, 128], "float32"], {}], "config": {"index": 3, "code_hash": null, "entity": [["tile_x", "ot", 24], ["tile_y", "ot", 1], ["order", "ot", 0]]}, "result": [[0.005652991499999999, 0.0056698880000000005, 0.005676032], 0, 0.8770408630371094, 1675692286.2018664], "version": 0.2, "tvm_version": "0.10.0"}
{"input": ["cuda -keys=cuda,gpu -arch=sm_86 -max_num_threads=1024 -thread_warp_size=32", "template_matmul", [1024, 1024, 1024, [1, 8, 16, 24, 32, 40, 48, 56, 64, 72, 80, 88, 96, 104, 112, 120, 128], "float32"], {}], "config": {"index": 601, "code_hash": null, "entity": [["tile_x", "ot", 48], ["tile_y", "ot", 8], ["order", "ot", 2]]}, "result": [[0.0025871360000000003, 0.0025876475, 0.0025984], 0, 0.7871084213256836, 1675692286.5573072], "version": 0.2, "tvm_version": "0.10.0"}
{"input": ["cuda -keys=cuda,gpu -arch=sm_86 -max_num_threads=1024 -thread_warp_size=32", "template_matmul", [1024, 1024, 1024, [1, 8, 16, 24, 32, 40, 48, 56, 64, 72, 80, 88, 96, 104, 112, 120, 128], "float32"], {}], "config": {"index": 872, "code_hash": null, "entity": [["tile_x", "ot", 40], ["tile_y", "ot", 1], ["order", "ot", 3]]}, "result": [[0.0038497279999999997, 0.0038522075, 0.003853312], 0, 0.83085036277771, 1675692286.949145], "version": 0.2, "tvm_version": "0.10.0"}
{"input": ["cuda -keys=cuda,gpu -arch=sm_86 -max_num_threads=1024 -thread_warp_size=32", "template_matmul", [1024, 1024, 1024, [1, 8, 16, 24, 32, 40, 48, 56, 64, 72, 80, 88, 96, 104, 112, 120, 128], "float32"], {}], "config": {"index": 20, "code_hash": null, "entity": [["tile_x", "ot", 24], ["tile_y", "ot", 8], ["order", "ot", 0]]}, "result": [[0.002604032, 0.0026045435, 0.0026065915], 0, 0.8178055286407471, 1675692287.3272696], "version": 0.2, "tvm_version": "0.10.0"}
{"input": ["cuda -keys=cuda,gpu -arch=sm_86 -max_num_threads=1024 -thread_warp_size=32", "template_matmul", [1024, 1024, 1024, [1, 8, 16, 24, 32, 40, 48, 56, 64, 72, 80, 88, 96, 104, 112, 120, 128], "float32"], {}], "config": {"index": 617, "code_hash": null, "entity": [["tile_x", "ot", 40], ["tile_y", "ot", 16], ["order", "ot", 2]]}, "result": [[0.002503168, 0.002503168, 0.002504192], 0, 0.8156096935272217, 1675692287.7004647], "version": 0.2, "tvm_version": "0.10.0"}
{"input": ["cuda -keys=cuda,gpu -arch=sm_86 -max_num_threads=1024 -thread_warp_size=32", "template_matmul", [1024, 1024, 1024, [1, 8, 16, 24, 32, 40, 48, 56, 64, 72, 80, 88, 96, 104, 112, 120, 128], "float32"], {}], "config": {"index": 867, "code_hash": null, "entity": [["tile_x", "ot", 1], ["tile_y", "ot", 1], ["order", "ot", 3]]}, "result": [[0.0303841285, 0.030475696500000003, 0.0342855375], 0, 1.1493523120880127, 1675692288.40312], "version": 0.2, "tvm_version": "0.10.0"}
{"input": ["cuda -keys=cuda,gpu -arch=sm_86 -max_num_threads=1024 -thread_warp_size=32", "template_matmul", [1024, 1024, 1024, [1, 8, 16, 24, 32, 40, 48, 56, 64, 72, 80, 88, 96, 104, 112, 120, 128], "float32"], {}], "config": {"index": 874, "code_hash": null, "entity": [["tile_x", "ot", 56], ["tile_y", "ot", 1], ["order", "ot", 3]]}, "result": [[0.0028390399999999997, 0.0028405755, 0.0028445594999999997], 0, 0.827629566192627, 1675692288.78377], "version": 0.2, "tvm_version": "0.10.0"}
{"input": ["cuda -keys=cuda,gpu -arch=sm_86 -max_num_threads=1024 -thread_warp_size=32", "template_matmul", [1024, 1024, 1024, [1, 8, 16, 24, 32, 40, 48, 56, 64, 72, 80, 88, 96, 104, 112, 120, 128], "float32"], {}], "config": {"index": 901, "code_hash": null, "entity": [["tile_x", "ot", 1], ["tile_y", "ot", 16], ["order", "ot", 3]]}, "result": [[0.008105471500000001, 0.0081070075, 0.008108032], 0, 0.8928027153015137, 1675692289.2233999], "version": 0.2, "tvm_version": "0.10.0"}
{"input": ["cuda -keys=cuda,gpu -arch=sm_86 -max_num_threads=1024 -thread_warp_size=32", "template_matmul", [1024, 1024, 1024, [1, 8, 16, 24, 32, 40, 48, 56, 64, 72, 80, 88, 96, 104, 112, 120, 128], "float32"], {}], "config": {"index": 323, "code_hash": null, "entity": [["tile_x", "ot", 1], ["tile_y", "ot", 16], ["order", "ot", 1]]}, "result": [[0.008102911499999999, 0.0081064955, 0.00810688], 0, 0.8799896240234375, 1675692289.6587415], "version": 0.2, "tvm_version": "0.10.0"}
{"input": ["cuda -keys=cuda,gpu -arch=sm_86 -max_num_threads=1024 -thread_warp_size=32", "template_matmul", [1024, 1024, 1024, [1, 8, 16, 24, 32, 40, 48, 56, 64, 72, 80, 88, 96, 104, 112, 120, 128], "float32"], {}], "config": {"index": 291, "code_hash": null, "entity": [["tile_x", "ot", 16], ["tile_y", "ot", 1], ["order", "ot", 1]]}, "result": [[0.00194816, 0.00194816, 0.0019491835], 0, 0.8060195446014404, 1675692290.0248456], "version": 0.2, "tvm_version": "0.10.0"}
{"input": ["cuda -keys=cuda,gpu -arch=sm_86 -max_num_threads=1024 -thread_warp_size=32", "template_matmul", [1024, 1024, 1024, [1, 8, 16, 24, 32, 40, 48, 56, 64, 72, 80, 88, 96, 104, 112, 120, 128], "float32"], {}], "config": {"index": 308, "code_hash": null, "entity": [["tile_x", "ot", 16], ["tile_y", "ot", 8], ["order", "ot", 1]]}, "result": [[0.0011269115000000001, 0.0011273755, 0.001127424], 0, 0.8034853935241699, 1675692290.3856559], "version": 0.2, "tvm_version": "0.10.0"}
{"input": ["cuda -keys=cuda,gpu -arch=sm_86 -max_num_threads=1024 -thread_warp_size=32", "template_matmul", [1024, 1024, 1024, [1, 8, 16, 24, 32, 40, 48, 56, 64, 72, 80, 88, 96, 104, 112, 120, 128], "float32"], {}], "config": {"index": 873, "code_hash": null, "entity": [["tile_x", "ot", 48], ["tile_y", "ot", 1], ["order", "ot", 3]]}, "result": [[0.0033889275, 0.0033899515, 0.003392512], 0, 0.805988073348999, 1675692290.752877], "version": 0.2, "tvm_version": "0.10.0"}
{"input": ["cuda -keys=cuda,gpu -arch=sm_86 -max_num_threads=1024 -thread_warp_size=32", "template_matmul", [1024, 1024, 1024, [1, 8, 16, 24, 32, 40, 48, 56, 64, 72, 80, 88, 96, 104, 112, 120, 128], "float32"], {}], "config": {"index": 2, "code_hash": null, "entity": [["tile_x", "ot", 16], ["tile_y", "ot", 1], ["order", "ot", 0]]}, "result": [[0.0022333440000000004, 0.0022333440000000004, 0.0022333599999999998], 0, 0.8204045295715332, 1675692291.1299725], "version": 0.2, "tvm_version": "0.10.0"}
{"input": ["cuda -keys=cuda,gpu -arch=sm_86 -max_num_threads=1024 -thread_warp_size=32", "template_matmul", [1024, 1024, 1024, [1, 8, 16, 24, 32, 40, 48, 56, 64, 72, 80, 88, 96, 104, 112, 120, 128], "float32"], {}], "config": {"index": 19, "code_hash": null, "entity": [["tile_x", "ot", 16], ["tile_y", "ot", 8], ["order", "ot", 0]]}, "result": [[0.0011269115000000001, 0.001127424, 0.001127936], 0, 0.7825486660003662, 1675692292.0463278], "version": 0.2, "tvm_version": "0.10.0"}
{"input": ["cuda -keys=cuda,gpu -arch=sm_86 -max_num_threads=1024 -thread_warp_size=32", "template_matmul", [1024, 1024, 1024, [1, 8, 16, 24, 32, 40, 48, 56, 64, 72, 80, 88, 96, 104, 112, 120, 128], "float32"], {}], "config": {"index": 888, "code_hash": null, "entity": [["tile_x", "ot", 32], ["tile_y", "ot", 8], ["order", "ot", 3]]}, "result": [[0.001126816, 0.0011269115000000001, 0.001127936], 0, 0.8042960166931152, 1675692292.410541], "version": 0.2, "tvm_version": "0.10.0"}
{"input": ["cuda -keys=cuda,gpu -arch=sm_86 -max_num_threads=1024 -thread_warp_size=32", "template_matmul", [1024, 1024, 1024, [1, 8, 16, 24, 32, 40, 48, 56, 64, 72, 80, 88, 96, 104, 112, 120, 128], "float32"], {}], "config": {"index": 629, "code_hash": null, "entity": [["tile_x", "ot", 1], ["tile_y", "ot", 24], ["order", "ot", 2]]}, "result": [[0.0296576, 0.033170383, 0.0331965445], 0, 1.1180450916290283, 1675692293.1079004], "version": 0.2, "tvm_version": "0.10.0"}
{"input": ["cuda -keys=cuda,gpu -arch=sm_86 -max_num_threads=1024 -thread_warp_size=32", "template_matmul", [1024, 1024, 1024, [1, 8, 16, 24, 32, 40, 48, 56, 64, 72, 80, 88, 96, 104, 112, 120, 128], "float32"], {}], "config": {"index": 309, "code_hash": null, "entity": [["tile_x", "ot", 24], ["tile_y", "ot", 8], ["order", "ot", 1]]}, "result": [[0.0022645754999999997, 0.0022666235000000003, 0.002269184], 0, 0.8304054737091064, 1675692293.4905427], "version": 0.2, "tvm_version": "0.10.0"}
{"input": ["cuda -keys=cuda,gpu -arch=sm_86 -max_num_threads=1024 -thread_warp_size=32", "template_matmul", [1024, 1024, 1024, [1, 8, 16, 24, 32, 40, 48, 56, 64, 72, 80, 88, 96, 104, 112, 120, 128], "float32"], {}], "config": {"index": 292, "code_hash": null, "entity": [["tile_x", "ot", 24], ["tile_y", "ot", 1], ["order", "ot", 1]]}, "result": [[0.0048885759999999995, 0.0049172475, 0.004944896], 0, 0.8266899585723877, 1675692293.8890722], "version": 0.2, "tvm_version": "0.10.0"}
{"input": ["cuda -keys=cuda,gpu -arch=sm_86 -max_num_threads=1024 -thread_warp_size=32", "template_matmul", [1024, 1024, 1024, [1, 8, 16, 24, 32, 40, 48, 56, 64, 72, 80, 88, 96, 104, 112, 120, 128], "float32"], {}], "config": {"index": 37, "code_hash": null, "entity": [["tile_x", "ot", 24], ["tile_y", "ot", 16], ["order", "ot", 0]]}, "result": [[0.0022041595, 0.0022067199999999997, 0.002213376], 0, 0.7921676635742188, 1675692294.2412233], "version": 0.2, "tvm_version": "0.10.0"}
{"input": ["cuda -keys=cuda,gpu -arch=sm_86 -max_num_threads=1024 -thread_warp_size=32", "template_matmul", [1024, 1024, 1024, [1, 8, 16, 24, 32, 40, 48, 56, 64, 72, 80, 88, 96, 104, 112, 120, 128], "float32"], {}], "config": {"index": 4, "code_hash": null, "entity": [["tile_x", "ot", 32], ["tile_y", "ot", 1], ["order", "ot", 0]]}, "result": [[0.001555968, 0.0015569919999999999, 0.001557504], 0, 0.7959754467010498, 1675692294.5873115], "version": 0.2, "tvm_version": "0.10.0"}
{"input": ["cuda -keys=cuda,gpu -arch=sm_86 -max_num_threads=1024 -thread_warp_size=32", "template_matmul", [1024, 1024, 1024, [1, 8, 16, 24, 32, 40, 48, 56, 64, 72, 80, 88, 96, 104, 112, 120, 128], "float32"], {}], "config": {"index": 21, "code_hash": null, "entity": [["tile_x", "ot", 32], ["tile_y", "ot", 8], ["order", "ot", 0]]}, "result": [[0.000966144, 0.000966656, 0.000966656], 0, 0.7842450141906738, 1675692294.9362688], "version": 0.2, "tvm_version": "0.10.0"}
{"input": ["cuda -keys=cuda,gpu -arch=sm_86 -max_num_threads=1024 -thread_warp_size=32", "template_matmul", [1024, 1024, 1024, [1, 8, 16, 24, 32, 40, 48, 56, 64, 72, 80, 88, 96, 104, 112, 120, 128], "float32"], {}], "config": {"index": 341, "code_hash": null, "entity": [["tile_x", "ot", 8], ["tile_y", "ot", 24], ["order", "ot", 1]]}, "result": [[0.0040084479999999995, 0.004009984, 0.0040110075], 0, 0.6888594627380371, 1675692295.3350503], "version": 0.2, "tvm_version": "0.10.0"}
{"input": ["cuda -keys=cuda,gpu -arch=sm_86 -max_num_threads=1024 -thread_warp_size=32", "template_matmul", [1024, 1024, 1024, [1, 8, 16, 24, 32, 40, 48, 56, 64, 72, 80, 88, 96, 104, 112, 120, 128], "float32"], {}], "config": {"index": 906, "code_hash": null, "entity": [["tile_x", "ot", 40], ["tile_y", "ot", 16], ["order", "ot", 3]]}, "result": [[0.0025036795, 0.0025052154999999996, 0.0025052154999999996], 0, 0.8120250701904297, 1675692295.718309], "version": 0.2, "tvm_version": "0.10.0"}
{"input": ["cuda -keys=cuda,gpu -arch=sm_86 -max_num_threads=1024 -thread_warp_size=32", "template_matmul", [1024, 1024, 1024, [1, 8, 16, 24, 32, 40, 48, 56, 64, 72, 80, 88, 96, 104, 112, 120, 128], "float32"], {}], "config": {"index": 631, "code_hash": null, "entity": [["tile_x", "ot", 16], ["tile_y", "ot", 24], ["order", "ot", 2]]}, "result": [[0.0026146715, 0.00261888, 0.00261888], 0, 0.8210489749908447, 1675692296.112182], "version": 0.2, "tvm_version": "0.10.0"}
{"input": ["cuda -keys=cuda,gpu -arch=sm_86 -max_num_threads=1024 -thread_warp_size=32", "template_matmul", [1024, 1024, 1024, [1, 8, 16, 24, 32, 40, 48, 56, 64, 72, 80, 88, 96, 104, 112, 120, 128], "float32"], {}], "config": {"index": 871, "code_hash": null, "entity": [["tile_x", "ot", 32], ["tile_y", "ot", 1], ["order", "ot", 3]]}, "result": [[0.0018242555, 0.0018247675, 0.0018298874999999998], 0, 0.7465298175811768, 1675692296.4795551], "version": 0.2, "tvm_version": "0.10.0"}
{"input": ["cuda -keys=cuda,gpu -arch=sm_86 -max_num_threads=1024 -thread_warp_size=32", "template_matmul", [1024, 1024, 1024, [1, 8, 16, 24, 32, 40, 48, 56, 64, 72, 80, 88, 96, 104, 112, 120, 128], "float32"], {}], "config": {"index": 36, "code_hash": null, "entity": [["tile_x", "ot", 16], ["tile_y", "ot", 16], ["order", "ot", 0]]}, "result": [[0.0011299515, 0.0011299840000000001, 0.0011299840000000001], 0, 0.7883946895599365, 1675692296.8413181], "version": 0.2, "tvm_version": "0.10.0"}
{"input": ["cuda -keys=cuda,gpu -arch=sm_86 -max_num_threads=1024 -thread_warp_size=32", "template_matmul", [1024, 1024, 1024, [1, 8, 16, 24, 32, 40, 48, 56, 64, 72, 80, 88, 96, 104, 112, 120, 128], "float32"], {}], "config": {"index": 799, "code_hash": null, "entity": [["tile_x", "ot", 1], ["tile_y", "ot", 104], ["order", "ot", 2]]}, "result": [[0.040110481, 0.0409062385, 0.0466589775], 0, 1.2331438064575195, 1675692297.644858], "version": 0.2, "tvm_version": "0.10.0"}
{"input": ["cuda -keys=cuda,gpu -arch=sm_86 -max_num_threads=1024 -thread_warp_size=32", "template_matmul", [1024, 1024, 1024, [1, 8, 16, 24, 32, 40, 48, 56, 64, 72, 80, 88, 96, 104, 112, 120, 128], "float32"], {}], "config": {"index": 408, "code_hash": null, "entity": [["tile_x", "ot", 1], ["tile_y", "ot", 56], ["order", "ot", 1]]}, "result": [[0.0341923215, 0.034217982999999993, 0.034388992], 0, 1.1555571556091309, 1675692298.371039], "version": 0.2, "tvm_version": "0.10.0"}
{"input": ["cuda -keys=cuda,gpu -arch=sm_86 -max_num_threads=1024 -thread_warp_size=32", "template_matmul", [1024, 1024, 1024, [1, 8, 16, 24, 32, 40, 48, 56, 64, 72, 80, 88, 96, 104, 112, 120, 128], "float32"], {}], "config": {"index": 905, "code_hash": null, "entity": [["tile_x", "ot", 32], ["tile_y", "ot", 16], ["order", "ot", 3]]}, "result": [[0.0011391995, 0.0011391995, 0.0011391995], 0, 0.7799129486083984, 1675692301.6246903], "version": 0.2, "tvm_version": "0.10.0"}
{"input": ["cuda -keys=cuda,gpu -arch=sm_86 -max_num_threads=1024 -thread_warp_size=32", "template_matmul", [1024, 1024, 1024, [1, 8, 16, 24, 32, 40, 48, 56, 64, 72, 80, 88, 96, 104, 112, 120, 128], "float32"], {}], "config": {"index": 310, "code_hash": null, "entity": [["tile_x", "ot", 32], ["tile_y", "ot", 8], ["order", "ot", 1]]}, "result": [[0.001124256, 0.0011242715, 0.00112432], 0, 0.7724432945251465, 1675692301.981668], "version": 0.2, "tvm_version": "0.10.0"}
{"input": ["cuda -keys=cuda,gpu -arch=sm_86 -max_num_threads=1024 -thread_warp_size=32", "template_matmul", [1024, 1024, 1024, [1, 8, 16, 24, 32, 40, 48, 56, 64, 72, 80, 88, 96, 104, 112, 120, 128], "float32"], {}], "config": {"index": 327, "code_hash": null, "entity": [["tile_x", "ot", 32], ["tile_y", "ot", 16], ["order", "ot", 1]]}, "result": [[0.0011356155000000001, 0.0011361275, 0.0011365595], 0, 0.7766931056976318, 1675692302.3431547], "version": 0.2, "tvm_version": "0.10.0"}
{"input": ["cuda -keys=cuda,gpu -arch=sm_86 -max_num_threads=1024 -thread_warp_size=32", "template_matmul", [1024, 1024, 1024, [1, 8, 16, 24, 32, 40, 48, 56, 64, 72, 80, 88, 96, 104, 112, 120, 128], "float32"], {}], "config": {"index": 890, "code_hash": null, "entity": [["tile_x", "ot", 48], ["tile_y", "ot", 8], ["order", "ot", 3]]}, "result": [[0.0025670874999999998, 0.002571264, 0.0025758714999999997], 0, 0.7868731021881104, 1675692302.7133927], "version": 0.2, "tvm_version": "0.10.0"}
{"input": ["cuda -keys=cuda,gpu -arch=sm_86 -max_num_threads=1024 -thread_warp_size=32", "template_matmul", [1024, 1024, 1024, [1, 8, 16, 24, 32, 40, 48, 56, 64, 72, 80, 88, 96, 104, 112, 120, 128], "float32"], {}], "config": {"index": 611, "code_hash": null, "entity": [["tile_x", "ot", 128], ["tile_y", "ot", 8], ["order", "ot", 2]]}, "result": [[0.0011412475, 0.0011412475, 0.0011417595], 0, 0.7965569496154785, 1675692303.0787566], "version": 0.2, "tvm_version": "0.10.0"}
{"input": ["cuda -keys=cuda,gpu -arch=sm_86 -max_num_threads=1024 -thread_warp_size=32", "template_matmul", [1024, 1024, 1024, [1, 8, 16, 24, 32, 40, 48, 56, 64, 72, 80, 88, 96, 104, 112, 120, 128], "float32"], {}], "config": {"index": 33, "code_hash": null, "entity": [["tile_x", "ot", 128], ["tile_y", "ot", 8], ["order", "ot", 0]]}, "result": [[0.0011412475, 0.0011412635, 0.001141744], 0, 0.7821884155273438, 1675692303.439427], "version": 0.2, "tvm_version": "0.10.0"}
{"input": ["cuda -keys=cuda,gpu -arch=sm_86 -max_num_threads=1024 -thread_warp_size=32", "template_matmul", [1024, 1024, 1024, [1, 8, 16, 24, 32, 40, 48, 56, 64, 72, 80, 88, 96, 104, 112, 120, 128], "float32"], {}], "config": {"index": 907, "code_hash": null, "entity": [["tile_x", "ot", 48], ["tile_y", "ot", 16], ["order", "ot", 3]]}, "result": [[0.002539472, 0.002540544, 0.0025415679999999997], 0, 0.7870404720306396, 1675692303.7975688], "version": 0.2, "tvm_version": "0.10.0"}
{"input": ["cuda -keys=cuda,gpu -arch=sm_86 -max_num_threads=1024 -thread_warp_size=32", "template_matmul", [1024, 1024, 1024, [1, 8, 16, 24, 32, 40, 48, 56, 64, 72, 80, 88, 96, 104, 112, 120, 128], "float32"], {}], "config": {"index": 603, "code_hash": null, "entity": [["tile_x", "ot", 64], ["tile_y", "ot", 8], ["order", "ot", 2]]}, "result": [[0.0011366235, 0.0011366395, 0.0011367035000000001], 0, 0.6597976684570312, 1675692304.1614285], "version": 0.2, "tvm_version": "0.10.0"}
{"input": ["cuda -keys=cuda,gpu -arch=sm_86 -max_num_threads=1024 -thread_warp_size=32", "template_matmul", [1024, 1024, 1024, [1, 8, 16, 24, 32, 40, 48, 56, 64, 72, 80, 88, 96, 104, 112, 120, 128], "float32"], {}], "config": {"index": 892, "code_hash": null, "entity": [["tile_x", "ot", 64], ["tile_y", "ot", 8], ["order", "ot", 3]]}, "result": [[0.0011366395, 0.0011366395, 0.001137104], 0, 0.7402667999267578, 1675692304.523162], "version": 0.2, "tvm_version": "0.10.0"}
{"input": ["cuda -keys=cuda,gpu -arch=sm_86 -max_num_threads=1024 -thread_warp_size=32", "template_matmul", [1024, 1024, 1024, [1, 8, 16, 24, 32, 40, 48, 56, 64, 72, 80, 88, 96, 104, 112, 120, 128], "float32"], {}], "config": {"index": 891, "code_hash": null, "entity": [["tile_x", "ot", 56], ["tile_y", "ot", 8], ["order", "ot", 3]]}, "result": [[0.0026213760000000003, 0.0026280635, 0.0026286075000000004], 0, 0.8044679164886475, 1675692304.9106853], "version": 0.2, "tvm_version": "0.10.0"}
{"input": ["cuda -keys=cuda,gpu -arch=sm_86 -max_num_threads=1024 -thread_warp_size=32", "template_matmul", [1024, 1024, 1024, [1, 8, 16, 24, 32, 40, 48, 56, 64, 72, 80, 88, 96, 104, 112, 120, 128], "float32"], {}], "config": {"index": 909, "code_hash": null, "entity": [["tile_x", "ot", 64], ["tile_y", "ot", 16], ["order", "ot", 3]]}, "result": [[0.0011417595, 0.0011422715000000002, 0.0011422715000000002], 0, 0.7761566638946533, 1675692305.2673051], "version": 0.2, "tvm_version": "0.10.0"}
{"input": ["cuda -keys=cuda,gpu -arch=sm_86 -max_num_threads=1024 -thread_warp_size=32", "template_matmul", [1024, 1024, 1024, [1, 8, 16, 24, 32, 40, 48, 56, 64, 72, 80, 88, 96, 104, 112, 120, 128], "float32"], {}], "config": {"index": 647, "code_hash": null, "entity": [["tile_x", "ot", 8], ["tile_y", "ot", 32], ["order", "ot", 2]]}, "result": [[0.001463296, 0.0014638074999999999, 0.0014643195], 0, 0.7936520576477051, 1675692305.6361666], "version": 0.2, "tvm_version": "0.10.0"}
{"input": ["cuda -keys=cuda,gpu -arch=sm_86 -max_num_threads=1024 -thread_warp_size=32", "template_matmul", [1024, 1024, 1024, [1, 8, 16, 24, 32, 40, 48, 56, 64, 72, 80, 88, 96, 104, 112, 120, 128], "float32"], {}], "config": {"index": 900, "code_hash": null, "entity": [["tile_x", "ot", 128], ["tile_y", "ot", 8], ["order", "ot", 3]]}, "result": [[0.0011412475, 0.0011412475, 0.001141664], 0, 0.6592025756835938, 1675692306.0038116], "version": 0.2, "tvm_version": "0.10.0"}
{"input": ["cuda -keys=cuda,gpu -arch=sm_86 -max_num_threads=1024 -thread_warp_size=32", "template_matmul", [1024, 1024, 1024, [1, 8, 16, 24, 32, 40, 48, 56, 64, 72, 80, 88, 96, 104, 112, 120, 128], "float32"], {}], "config": {"index": 39, "code_hash": null, "entity": [["tile_x", "ot", 40], ["tile_y", "ot", 16], ["order", "ot", 0]]}, "result": [[0.0024913915, 0.002491904, 0.002492928], 0, 0.7954182624816895, 1675692306.3885865], "version": 0.2, "tvm_version": "0.10.0"}
{"input": ["cuda -keys=cuda,gpu -arch=sm_86 -max_num_threads=1024 -thread_warp_size=32", "template_matmul", [1024, 1024, 1024, [1, 8, 16, 24, 32, 40, 48, 56, 64, 72, 80, 88, 96, 104, 112, 120, 128], "float32"], {}], "config": {"index": 22, "code_hash": null, "entity": [["tile_x", "ot", 40], ["tile_y", "ot", 8], ["order", "ot", 0]]}, "result": [[0.002565632, 0.0025707515, 0.0025721755], 0, 0.790745735168457, 1675692307.3181694], "version": 0.2, "tvm_version": "0.10.0"}
{"input": ["cuda -keys=cuda,gpu -arch=sm_86 -max_num_threads=1024 -thread_warp_size=32", "template_matmul", [1024, 1024, 1024, [1, 8, 16, 24, 32, 40, 48, 56, 64, 72, 80, 88, 96, 104, 112, 120, 128], "float32"], {}], "config": {"index": 25, "code_hash": null, "entity": [["tile_x", "ot", 64], ["tile_y", "ot", 8], ["order", "ot", 0]]}, "result": [[0.0011366235, 0.0011366395, 0.0011371515], 0, 0.7793960571289062, 1675692307.682164], "version": 0.2, "tvm_version": "0.10.0"}
{"input": ["cuda -keys=cuda,gpu -arch=sm_86 -max_num_threads=1024 -thread_warp_size=32", "template_matmul", [1024, 1024, 1024, [1, 8, 16, 24, 32, 40, 48, 56, 64, 72, 80, 88, 96, 104, 112, 120, 128], "float32"], {}], "config": {"index": 620, "code_hash": null, "entity": [["tile_x", "ot", 64], ["tile_y", "ot", 16], ["order", "ot", 2]]}, "result": [[0.0011417595, 0.0011417595, 0.0011422715000000002], 0, 0.7621030807495117, 1675692308.0258942], "version": 0.2, "tvm_version": "0.10.0"}
{"input": ["cuda -keys=cuda,gpu -arch=sm_86 -max_num_threads=1024 -thread_warp_size=32", "template_matmul", [1024, 1024, 1024, [1, 8, 16, 24, 32, 40, 48, 56, 64, 72, 80, 88, 96, 104, 112, 120, 128], "float32"], {}], "config": {"index": 273, "code_hash": null, "entity": [["tile_x", "ot", 8], ["tile_y", "ot", 128], ["order", "ot", 0]]}, "result": [[0.0014376955, 0.0014376955, 0.0014382075000000001], 0, 0.6778151988983154, 1675692308.3954647], "version": 0.2, "tvm_version": "0.10.0"}
{"input": ["cuda -keys=cuda,gpu -arch=sm_86 -max_num_threads=1024 -thread_warp_size=32", "template_matmul", [1024, 1024, 1024, [1, 8, 16, 24, 32, 40, 48, 56, 64, 72, 80, 88, 96, 104, 112, 120, 128], "float32"], {}], "config": {"index": 715, "code_hash": null, "entity": [["tile_x", "ot", 8], ["tile_y", "ot", 64], ["order", "ot", 2]]}, "result": [[0.0014689275, 0.0014689275, 0.0014694395], 0, 0.7835395336151123, 1675692308.7568176], "version": 0.2, "tvm_version": "0.10.0"}
{"input": ["cuda -keys=cuda,gpu -arch=sm_86 -max_num_threads=1024 -thread_warp_size=32", "template_matmul", [1024, 1024, 1024, [1, 8, 16, 24, 32, 40, 48, 56, 64, 72, 80, 88, 96, 104, 112, 120, 128], "float32"], {}], "config": {"index": 311, "code_hash": null, "entity": [["tile_x", "ot", 40], ["tile_y", "ot", 8], ["order", "ot", 1]]}, "result": [[0.0025640955, 0.0025676795, 0.002571264], 0, 0.7612123489379883, 1675692309.1367836], "version": 0.2, "tvm_version": "0.10.0"}
{"input": ["cuda -keys=cuda,gpu -arch=sm_86 -max_num_threads=1024 -thread_warp_size=32", "template_matmul", [1024, 1024, 1024, [1, 8, 16, 24, 32, 40, 48, 56, 64, 72, 80, 88, 96, 104, 112, 120, 128], "float32"], {}], "config": {"index": 908, "code_hash": null, "entity": [["tile_x", "ot", 56], ["tile_y", "ot", 16], ["order", "ot", 3]]}, "result": [[0.002832384, 0.0028349440000000003, 0.0028375035], 0, 0.6793255805969238, 1675692309.5124414], "version": 0.2, "tvm_version": "0.10.0"}
{"input": ["cuda -keys=cuda,gpu -arch=sm_86 -max_num_threads=1024 -thread_warp_size=32", "template_matmul", [1024, 1024, 1024, [1, 8, 16, 24, 32, 40, 48, 56, 64, 72, 80, 88, 96, 104, 112, 120, 128], "float32"], {}], "config": {"index": 69, "code_hash": null, "entity": [["tile_x", "ot", 8], ["tile_y", "ot", 32], ["order", "ot", 0]]}, "result": [[0.0014617599999999999, 0.001462272, 0.0014642235], 0, 0.787745475769043, 1675692309.8795328], "version": 0.2, "tvm_version": "0.10.0"}
{"input": ["cuda -keys=cuda,gpu -arch=sm_86 -max_num_threads=1024 -thread_warp_size=32", "template_matmul", [1024, 1024, 1024, [1, 8, 16, 24, 32, 40, 48, 56, 64, 72, 80, 88, 96, 104, 112, 120, 128], "float32"], {}], "config": {"index": 42, "code_hash": null, "entity": [["tile_x", "ot", 64], ["tile_y", "ot", 16], ["order", "ot", 0]]}, "result": [[0.0011417595, 0.0011422715000000002, 0.0011422715000000002], 0, 0.7933859825134277, 1675692310.255424], "version": 0.2, "tvm_version": "0.10.0"}
{"input": ["cuda -keys=cuda,gpu -arch=sm_86 -max_num_threads=1024 -thread_warp_size=32", "template_matmul", [1024, 1024, 1024, [1, 8, 16, 24, 32, 40, 48, 56, 64, 72, 80, 88, 96, 104, 112, 120, 128], "float32"], {}], "config": {"index": 328, "code_hash": null, "entity": [["tile_x", "ot", 40], ["tile_y", "ot", 16], ["order", "ot", 1]]}, "result": [[0.0024924154999999997, 0.002492928, 0.0024954875], 0, 0.7485616207122803, 1675692310.6117692], "version": 0.2, "tvm_version": "0.10.0"}
{"input": ["cuda -keys=cuda,gpu -arch=sm_86 -max_num_threads=1024 -thread_warp_size=32", "template_matmul", [1024, 1024, 1024, [1, 8, 16, 24, 32, 40, 48, 56, 64, 72, 80, 88, 96, 104, 112, 120, 128], "float32"], {}], "config": {"index": 594, "code_hash": null, "entity": [["tile_x", "ot", 128], ["tile_y", "ot", 1], ["order", "ot", 2]]}, "result": [[0.0017848319999999999, 0.0017853440000000001, 0.001785408], 0, 0.795163631439209, 1675692310.9854987], "version": 0.2, "tvm_version": "0.10.0"}
{"input": ["cuda -keys=cuda,gpu -arch=sm_86 -max_num_threads=1024 -thread_warp_size=32", "template_matmul", [1024, 1024, 1024, [1, 8, 16, 24, 32, 40, 48, 56, 64, 72, 80, 88, 96, 104, 112, 120, 128], "float32"], {}], "config": {"index": 70, "code_hash": null, "entity": [["tile_x", "ot", 16], ["tile_y", "ot", 32], ["order", "ot", 0]]}, "result": [[0.0011376634999999999, 0.0011376634999999999, 0.00113808], 0, 0.7847487926483154, 1675692311.344646], "version": 0.2, "tvm_version": "0.10.0"}
{"input": ["cuda -keys=cuda,gpu -arch=sm_86 -max_num_threads=1024 -thread_warp_size=32", "template_matmul", [1024, 1024, 1024, [1, 8, 16, 24, 32, 40, 48, 56, 64, 72, 80, 88, 96, 104, 112, 120, 128], "float32"], {}], "config": {"index": 632, "code_hash": null, "entity": [["tile_x", "ot", 24], ["tile_y", "ot", 24], ["order", "ot", 2]]}, "result": [[0.0026501115, 0.0026501115, 0.0026511355], 0, 0.639014482498169, 1675692311.71883], "version": 0.2, "tvm_version": "0.10.0"}
{"input": ["cuda -keys=cuda,gpu -arch=sm_86 -max_num_threads=1024 -thread_warp_size=32", "template_matmul", [1024, 1024, 1024, [1, 8, 16, 24, 32, 40, 48, 56, 64, 72, 80, 88, 96, 104, 112, 120, 128], "float32"], {}], "config": {"index": 896, "code_hash": null, "entity": [["tile_x", "ot", 96], ["tile_y", "ot", 8], ["order", "ot", 3]]}, "result": [[0.0025052154999999996, 0.0025087679999999998, 0.002516992], 0, 0.8060579299926758, 1675692312.6550431], "version": 0.2, "tvm_version": "0.10.0"}
{"input": ["cuda -keys=cuda,gpu -arch=sm_86 -max_num_threads=1024 -thread_warp_size=32", "template_matmul", [1024, 1024, 1024, [1, 8, 16, 24, 32, 40, 48, 56, 64, 72, 80, 88, 96, 104, 112, 120, 128], "float32"], {}], "config": {"index": 895, "code_hash": null, "entity": [["tile_x", "ot", 88], ["tile_y", "ot", 8], ["order", "ot", 3]]}, "result": [[0.0025834875, 0.0025835515, 0.0025880955], 0, 0.800652265548706, 1675692313.0306325], "version": 0.2, "tvm_version": "0.10.0"}
{"input": ["cuda -keys=cuda,gpu -arch=sm_86 -max_num_threads=1024 -thread_warp_size=32", "template_matmul", [1024, 1024, 1024, [1, 8, 16, 24, 32, 40, 48, 56, 64, 72, 80, 88, 96, 104, 112, 120, 128], "float32"], {}], "config": {"index": 293, "code_hash": null, "entity": [["tile_x", "ot", 32], ["tile_y", "ot", 1], ["order", "ot", 1]]}, "result": [[0.0018248, 0.0018252634999999999, 0.0018273275], 0, 0.7989108562469482, 1675692313.3988776], "version": 0.2, "tvm_version": "0.10.0"}
{"input": ["cuda -keys=cuda,gpu -arch=sm_86 -max_num_threads=1024 -thread_warp_size=32", "template_matmul", [1024, 1024, 1024, [1, 8, 16, 24, 32, 40, 48, 56, 64, 72, 80, 88, 96, 104, 112, 120, 128], "float32"], {}], "config": {"index": 52, "code_hash": null, "entity": [["tile_x", "ot", 8], ["tile_y", "ot", 24], ["order", "ot", 0]]}, "result": [[0.003994112, 0.0039956475, 0.00399616], 0, 0.8280980587005615, 1675692313.7947965], "version": 0.2, "tvm_version": "0.10.0"}
{"input": ["cuda -keys=cuda,gpu -arch=sm_86 -max_num_threads=1024 -thread_warp_size=32", "template_matmul", [1024, 1024, 1024, [1, 8, 16, 24, 32, 40, 48, 56, 64, 72, 80, 88, 96, 104, 112, 120, 128], "float32"], {}], "config": {"index": 920, "code_hash": null, "entity": [["tile_x", "ot", 16], ["tile_y", "ot", 24], ["order", "ot", 3]]}, "result": [[0.002604032, 0.0026040480000000003, 0.0026076155], 0, 0.800870418548584, 1675692314.167366], "version": 0.2, "tvm_version": "0.10.0"}
{"input": ["cuda -keys=cuda,gpu -arch=sm_86 -max_num_threads=1024 -thread_warp_size=32", "template_matmul", [1024, 1024, 1024, [1, 8, 16, 24, 32, 40, 48, 56, 64, 72, 80, 88, 96, 104, 112, 120, 128], "float32"], {}], "config": {"index": 648, "code_hash": null, "entity": [["tile_x", "ot", 16], ["tile_y", "ot", 32], ["order", "ot", 2]]}, "result": [[0.0011376634999999999, 0.0011376634999999999, 0.001138064], 0, 0.7997195720672607, 1675692314.5304186], "version": 0.2, "tvm_version": "0.10.0"}
{"input": ["cuda -keys=cuda,gpu -arch=sm_86 -max_num_threads=1024 -thread_warp_size=32", "template_matmul", [1024, 1024, 1024, [1, 8, 16, 24, 32, 40, 48, 56, 64, 72, 80, 88, 96, 104, 112, 120, 128], "float32"], {}], "config": {"index": 1174, "code_hash": null, "entity": [["tile_x", "ot", 8], ["tile_y", "ot", 8], ["order", "ot", 4]]}, "result": [[0.0134963195, 0.013608447999999999, 0.01360896], 0, 0.9153645038604736, 1675692315.0245113], "version": 0.2, "tvm_version": "0.10.0"}
{"input": ["cuda -keys=cuda,gpu -arch=sm_86 -max_num_threads=1024 -thread_warp_size=32", "template_matmul", [1024, 1024, 1024, [1, 8, 16, 24, 32, 40, 48, 56, 64, 72, 80, 88, 96, 104, 112, 120, 128], "float32"], {}], "config": {"index": 899, "code_hash": null, "entity": [["tile_x", "ot", 120], ["tile_y", "ot", 8], ["order", "ot", 3]]}, "result": [[0.0023910399999999997, 0.0023925755, 0.0023930880000000002], 0, 0.8198270797729492, 1675692315.4060311], "version": 0.2, "tvm_version": "0.10.0"}
{"input": ["cuda -keys=cuda,gpu -arch=sm_86 -max_num_threads=1024 -thread_warp_size=32", "template_matmul", [1024, 1024, 1024, [1, 8, 16, 24, 32, 40, 48, 56, 64, 72, 80, 88, 96, 104, 112, 120, 128], "float32"], {}], "config": {"index": 1191, "code_hash": null, "entity": [["tile_x", "ot", 8], ["tile_y", "ot", 16], ["order", "ot", 4]]}, "result": [[0.007700992, 0.007857664, 0.0079283195], 0, 0.8525481224060059, 1675692315.8350148], "version": 0.2, "tvm_version": "0.10.0"}
{"input": ["cuda -keys=cuda,gpu -arch=sm_86 -max_num_threads=1024 -thread_warp_size=32", "template_matmul", [1024, 1024, 1024, [1, 8, 16, 24, 32, 40, 48, 56, 64, 72, 80, 88, 96, 104, 112, 120, 128], "float32"], {}], "config": {"index": 586, "code_hash": null, "entity": [["tile_x", "ot", 64], ["tile_y", "ot", 1], ["order", "ot", 2]]}, "result": [[0.001567744, 0.001568256, 0.0015687355], 0, 0.8080413341522217, 1675692316.1987605], "version": 0.2, "tvm_version": "0.10.0"}
{"input": ["cuda -keys=cuda,gpu -arch=sm_86 -max_num_threads=1024 -thread_warp_size=32", "template_matmul", [1024, 1024, 1024, [1, 8, 16, 24, 32, 40, 48, 56, 64, 72, 80, 88, 96, 104, 112, 120, 128], "float32"], {}], "config": {"index": 137, "code_hash": null, "entity": [["tile_x", "ot", 8], ["tile_y", "ot", 64], ["order", "ot", 0]]}, "result": [[0.0012631035, 0.0012636155, 0.0012636155], 0, 0.7999293804168701, 1675692316.558696], "version": 0.2, "tvm_version": "0.10.0"}
{"input": ["cuda -keys=cuda,gpu -arch=sm_86 -max_num_threads=1024 -thread_warp_size=32", "template_matmul", [1024, 1024, 1024, [1, 8, 16, 24, 32, 40, 48, 56, 64, 72, 80, 88, 96, 104, 112, 120, 128], "float32"], {}], "config": {"index": 1177, "code_hash": null, "entity": [["tile_x", "ot", 32], ["tile_y", "ot", 8], ["order", "ot", 4]]}, "result": [[0.006857728, 0.0068592635, 0.006866943499999999], 0, 0.8523180484771729, 1675692316.979969], "version": 0.2, "tvm_version": "0.10.0"}
{"input": ["cuda -keys=cuda,gpu -arch=sm_86 -max_num_threads=1024 -thread_warp_size=32", "template_matmul", [1024, 1024, 1024, [1, 8, 16, 24, 32, 40, 48, 56, 64, 72, 80, 88, 96, 104, 112, 120, 128], "float32"], {}], "config": {"index": 1447, "code_hash": null, "entity": [["tile_x", "ot", 16], ["tile_y", "ot", 1], ["order", "ot", 5]]}, "result": [[0.041321983, 0.043871742, 0.048115711], 0, 1.1190481185913086, 1675692317.8158877], "version": 0.2, "tvm_version": "0.10.0"}
{"input": ["cuda -keys=cuda,gpu -arch=sm_86 -max_num_threads=1024 -thread_warp_size=32", "template_matmul", [1024, 1024, 1024, [1, 8, 16, 24, 32, 40, 48, 56, 64, 72, 80, 88, 96, 104, 112, 120, 128], "float32"], {}], "config": {"index": 893, "code_hash": null, "entity": [["tile_x", "ot", 72], ["tile_y", "ot", 8], ["order", "ot", 3]]}, "result": [[0.002320384, 0.002326528, 0.0023270395], 0, 0.8045017719268799, 1675692318.1941621], "version": 0.2, "tvm_version": "0.10.0"}
{"input": ["cuda -keys=cuda,gpu -arch=sm_86 -max_num_threads=1024 -thread_warp_size=32", "template_matmul", [1024, 1024, 1024, [1, 8, 16, 24, 32, 40, 48, 56, 64, 72, 80, 88, 96, 104, 112, 120, 128], "float32"], {}], "config": {"index": 921, "code_hash": null, "entity": [["tile_x", "ot", 24], ["tile_y", "ot", 24], ["order", "ot", 3]]}, "result": [[0.0023050235, 0.0023070715, 0.002312704], 0, 0.769474983215332, 1675692318.5732038], "version": 0.2, "tvm_version": "0.10.0"}
{"input": ["cuda -keys=cuda,gpu -arch=sm_86 -max_num_threads=1024 -thread_warp_size=32", "template_matmul", [1024, 1024, 1024, [1, 8, 16, 24, 32, 40, 48, 56, 64, 72, 80, 88, 96, 104, 112, 120, 128], "float32"], {}], "config": {"index": 138, "code_hash": null, "entity": [["tile_x", "ot", 16], ["tile_y", "ot", 64], ["order", "ot", 0]]}, "result": [[0.0009850875000000001, 0.0009855995, 0.0009855995], 0, 0.7307274341583252, 1675692319.4406338], "version": 0.2, "tvm_version": "0.10.0"}
{"input": ["cuda -keys=cuda,gpu -arch=sm_86 -max_num_threads=1024 -thread_warp_size=32", "template_matmul", [1024, 1024, 1024, [1, 8, 16, 24, 32, 40, 48, 56, 64, 72, 80, 88, 96, 104, 112, 120, 128], "float32"], {}], "config": {"index": 1194, "code_hash": null, "entity": [["tile_x", "ot", 32], ["tile_y", "ot", 16], ["order", "ot", 4]]}, "result": [[0.007135231499999999, 0.0071362560000000005, 0.00713776], 0, 0.6586673259735107, 1675692319.848586], "version": 0.2, "tvm_version": "0.10.0"}
{"input": ["cuda -keys=cuda,gpu -arch=sm_86 -max_num_threads=1024 -thread_warp_size=32", "template_matmul", [1024, 1024, 1024, [1, 8, 16, 24, 32, 40, 48, 56, 64, 72, 80, 88, 96, 104, 112, 120, 128], "float32"], {}], "config": {"index": 608, "code_hash": null, "entity": [["tile_x", "ot", 104], ["tile_y", "ot", 8], ["order", "ot", 2]]}, "result": [[0.002953216, 0.0029557755, 0.002964992], 0, 0.7809357643127441, 1675692320.2367115], "version": 0.2, "tvm_version": "0.10.0"}
{"input": ["cuda -keys=cuda,gpu -arch=sm_86 -max_num_threads=1024 -thread_warp_size=32", "template_matmul", [1024, 1024, 1024, [1, 8, 16, 24, 32, 40, 48, 56, 64, 72, 80, 88, 96, 104, 112, 120, 128], "float32"], {}], "config": {"index": 40, "code_hash": null, "entity": [["tile_x", "ot", 48], ["tile_y", "ot", 16], ["order", "ot", 0]]}, "result": [[0.0025307835, 0.002534912, 0.002538496], 0, 0.7632677555084229, 1675692320.6101046], "version": 0.2, "tvm_version": "0.10.0"}
{"input": ["cuda -keys=cuda,gpu -arch=sm_86 -max_num_threads=1024 -thread_warp_size=32", "template_matmul", [1024, 1024, 1024, [1, 8, 16, 24, 32, 40, 48, 56, 64, 72, 80, 88, 96, 104, 112, 120, 128], "float32"], {}], "config": {"index": 312, "code_hash": null, "entity": [["tile_x", "ot", 48], ["tile_y", "ot", 8], ["order", "ot", 1]]}, "result": [[0.002572288, 0.002572736, 0.0025742715], 0, 0.78598952293396, 1675692320.9873679], "version": 0.2, "tvm_version": "0.10.0"}
{"input": ["cuda -keys=cuda,gpu -arch=sm_86 -max_num_threads=1024 -thread_warp_size=32", "template_matmul", [1024, 1024, 1024, [1, 8, 16, 24, 32, 40, 48, 56, 64, 72, 80, 88, 96, 104, 112, 120, 128], "float32"], {}], "config": {"index": 23, "code_hash": null, "entity": [["tile_x", "ot", 48], ["tile_y", "ot", 8], ["order", "ot", 0]]}, "result": [[0.0025671675, 0.0025686715000000004, 0.0025789435], 0, 0.6315546035766602, 1675692321.3676243], "version": 0.2, "tvm_version": "0.10.0"}
