results/cuda_gtx1650/bert/random/cpu.log_layer_5.log
{"input": ["cuda -keys=cuda,gpu -arch=sm_75 -max_num_threads=1024 -thread_warp_size=32", "dense_small_batch.gpu", [["TENSOR", [1, 768], "float32"], ["TENSOR", [768, 768], "float32"], null, "float32"], {}], "config": {"index": 13, "code_hash": null, "entity": [["tile_k", "sp", [-1, 128]]]}, "result": [[1.5442727321181108e-05, 1.582560558575845e-05, 1.5933594712717194e-05], 0, 2.0897305011749268, 1688598352.0565014], "version": 0.2, "tvm_version": "0.13.dev0"}
{"input": ["cuda -keys=cuda,gpu -arch=sm_75 -max_num_threads=1024 -thread_warp_size=32", "dense_small_batch.gpu", [["TENSOR", [1, 768], "float32"], ["TENSOR", [768, 768], "float32"], null, "float32"], {}], "config": {"index": 3, "code_hash": null, "entity": [["tile_k", "sp", [-1, 4]]]}, "result": [[3.3754073857483215e-05, 3.375751765215508e-05, 3.37628683127572e-05], 0, 2.1460254192352295, 1688598353.440902], "version": 0.2, "tvm_version": "0.13.dev0"}
{"input": ["cuda -keys=cuda,gpu -arch=sm_75 -max_num_threads=1024 -thread_warp_size=32", "dense_small_batch.gpu", [["TENSOR", [1, 768], "float32"], ["TENSOR", [768, 768], "float32"], null, "float32"], {}], "config": {"index": 8, "code_hash": null, "entity": [["tile_k", "sp", [-1, 24]]]}, "result": [[1.54781976384904e-05, 1.5545545464577357e-05, 1.5545590929154714e-05], 0, 2.0406219959259033, 1688598354.7074788], "version": 0.2, "tvm_version": "0.13.dev0"}
{"input": ["cuda -keys=cuda,gpu -arch=sm_75 -max_num_threads=1024 -thread_warp_size=32", "dense_small_batch.gpu", [["TENSOR", [1, 768], "float32"], ["TENSOR", [768, 768], "float32"], null, "float32"], {}], "config": {"index": 1, "code_hash": null, "entity": [["tile_k", "sp", [-1, 2]]]}, "result": [[6.389278836189717e-05, 6.389425428457553e-05, 6.38970761259466e-05], 0, 2.177588939666748, 1688598356.1198747], "version": 0.2, "tvm_version": "0.13.dev0"}
{"input": ["cuda -keys=cuda,gpu -arch=sm_75 -max_num_threads=1024 -thread_warp_size=32", "dense_small_batch.gpu", [["TENSOR", [1, 768], "float32"], ["TENSOR", [768, 768], "float32"], null, "float32"], {}], "config": {"index": 4, "code_hash": null, "entity": [["tile_k", "sp", [-1, 6]]]}, "result": [[2.3907663933108215e-05, 2.3929885994532885e-05, 2.4038231066087795e-05], 0, 2.0979979038238525, 1688598357.4507546], "version": 0.2, "tvm_version": "0.13.dev0"}
{"input": ["cuda -keys=cuda,gpu -arch=sm_75 -max_num_threads=1024 -thread_warp_size=32", "dense_small_batch.gpu", [["TENSOR", [1, 768], "float32"], ["TENSOR", [768, 768], "float32"], null, "float32"], {}], "config": {"index": 11, "code_hash": null, "entity": [["tile_k", "sp", [-1, 64]]]}, "result": [[1.553256890801506e-05, 1.5614216245293166e-05, 1.56325283485745e-05], 0, 2.047891139984131, 1688598358.766037], "version": 0.2, "tvm_version": "0.13.dev0"}
{"input": ["cuda -keys=cuda,gpu -arch=sm_75 -max_num_threads=1024 -thread_warp_size=32", "dense_small_batch.gpu", [["TENSOR", [1, 768], "float32"], ["TENSOR", [768, 768], "float32"], null, "float32"], {}], "config": {"index": 5, "code_hash": null, "entity": [["tile_k", "sp", [-1, 8]]]}, "result": [[1.909202670886076e-05, 1.9123183544303796e-05, 1.9141326075949365e-05], 0, 2.106574296951294, 1688598360.1110246], "version": 0.2, "tvm_version": "0.13.dev0"}
{"input": ["cuda -keys=cuda,gpu -arch=sm_75 -max_num_threads=1024 -thread_warp_size=32", "dense_small_batch.gpu", [["TENSOR", [1, 768], "float32"], ["TENSOR", [768, 768], "float32"], null, "float32"], {}], "config": {"index": 2, "code_hash": null, "entity": [["tile_k", "sp", [-1, 3]]]}, "result": [[4.4272644450883804e-05, 4.428566154737757e-05, 4.429222776006954e-05], 0, 2.1100192070007324, 1688598361.4630299], "version": 0.2, "tvm_version": "0.13.dev0"}
{"input": ["cuda -keys=cuda,gpu -arch=sm_75 -max_num_threads=1024 -thread_warp_size=32", "dense_small_batch.gpu", [["TENSOR", [1, 768], "float32"], ["TENSOR", [768, 768], "float32"], null, "float32"], {}], "config": {"index": 10, "code_hash": null, "entity": [["tile_k", "sp", [-1, 48]]]}, "result": [[1.5620275129300652e-05, 1.567242669215201e-05, 1.5685335169777376e-05], 0, 2.020475149154663, 1688598362.7381277], "version": 0.2, "tvm_version": "0.13.dev0"}
{"input": ["cuda -keys=cuda,gpu -arch=sm_75 -max_num_threads=1024 -thread_warp_size=32", "dense_small_batch.gpu", [["TENSOR", [1, 768], "float32"], ["TENSOR", [768, 768], "float32"], null, "float32"], {}], "config": {"index": 12, "code_hash": null, "entity": [["tile_k", "sp", [-1, 96]]]}, "result": [[1.563684305204649e-05, 1.5641234866093985e-05, 1.6007930065689745e-05], 0, 2.113729476928711, 1688598364.1083548], "version": 0.2, "tvm_version": "0.13.dev0"}
{"input": ["cuda -keys=cuda,gpu -arch=sm_75 -max_num_threads=1024 -thread_warp_size=32", "dense_small_batch.gpu", [["TENSOR", [1, 768], "float32"], ["TENSOR", [768, 768], "float32"], null, "float32"], {}], "config": {"index": 0, "code_hash": null, "entity": [["tile_k", "sp", [-1, 1]]]}, "result": [[0.0001280127192, 0.00012802900320000002, 0.000128029492], 0, 2.1820826530456543, 1688598365.5045264], "version": 0.2, "tvm_version": "0.13.dev0"}
{"input": ["cuda -keys=cuda,gpu -arch=sm_75 -max_num_threads=1024 -thread_warp_size=32", "dense_small_batch.gpu", [["TENSOR", [1, 768], "float32"], ["TENSOR", [768, 768], "float32"], null, "float32"], {}], "config": {"index": 6, "code_hash": null, "entity": [["tile_k", "sp", [-1, 12]]]}, "result": [[1.5702706729196205e-05, 1.5799428400043625e-05, 1.5881167520994658e-05], 0, 2.093156576156616, 1688598366.8316188], "version": 0.2, "tvm_version": "0.13.dev0"}
{"input": ["cuda -keys=cuda,gpu -arch=sm_75 -max_num_threads=1024 -thread_warp_size=32", "dense_small_batch.gpu", [["TENSOR", [1, 768], "float32"], ["TENSOR", [768, 768], "float32"], null, "float32"], {}], "config": {"index": 7, "code_hash": null, "entity": [["tile_k", "sp", [-1, 16]]]}, "result": [[1.547667942486837e-05, 1.5570770656136086e-05, 1.559419653705954e-05], 0, 2.135993242263794, 1688598368.1924167], "version": 0.2, "tvm_version": "0.13.dev0"}
{"input": ["cuda -keys=cuda,gpu -arch=sm_75 -max_num_threads=1024 -thread_warp_size=32", "dense_small_batch.gpu", [["TENSOR", [1, 768], "float32"], ["TENSOR", [768, 768], "float32"], null, "float32"], {}], "config": {"index": 14, "code_hash": null, "entity": [["tile_k", "sp", [-1, 192]]]}, "result": [[1.5735609825638776e-05, 1.6151142888474617e-05, 1.6231282048470226e-05], 0, 2.057771682739258, 1688598369.5088632], "version": 0.2, "tvm_version": "0.13.dev0"}
{"input": ["cuda -keys=cuda,gpu -arch=sm_75 -max_num_threads=1024 -thread_warp_size=32", "dense_small_batch.gpu", [["TENSOR", [1, 768], "float32"], ["TENSOR", [768, 768], "float32"], null, "float32"], {}], "config": {"index": 16, "code_hash": null, "entity": [["tile_k", "sp", [-1, 384]]]}, "result": [[3.139427257663629e-05, 3.1395432477216237e-05, 3.139821043910522e-05], 0, 2.0967965126037598, 1688598370.8569028], "version": 0.2, "tvm_version": "0.13.dev0"}
{"input": ["cuda -keys=cuda,gpu -arch=sm_75 -max_num_threads=1024 -thread_warp_size=32", "dense_small_batch.gpu", [["TENSOR", [1, 768], "float32"], ["TENSOR", [768, 768], "float32"], null, "float32"], {}], "config": {"index": 15, "code_hash": null, "entity": [["tile_k", "sp", [-1, 256]]]}, "result": [[3.4401951958610496e-05, 3.4543882483370285e-05, 3.4559485218034e-05], 0, 2.1631240844726562, 1688598372.268966], "version": 0.2, "tvm_version": "0.13.dev0"}
{"input": ["cuda -keys=cuda,gpu -arch=sm_75 -max_num_threads=1024 -thread_warp_size=32", "dense_small_batch.gpu", [["TENSOR", [1, 768], "float32"], ["TENSOR", [768, 768], "float32"], null, "float32"], {}], "config": {"index": 17, "code_hash": null, "entity": [["tile_k", "sp", [-1, 768]]]}, "result": [[7.013533063791556e-05, 7.015488050314465e-05, 7.015642273135668e-05], 0, 1.6823999881744385, 1688598374.072986], "version": 0.2, "tvm_version": "0.13.dev0"}
{"input": ["cuda -keys=cuda,gpu -arch=sm_75 -max_num_threads=1024 -thread_warp_size=32", "dense_small_batch.gpu", [["TENSOR", [1, 768], "float32"], ["TENSOR", [768, 768], "float32"], null, "float32"], {}], "config": {"index": 9, "code_hash": null, "entity": [["tile_k", "sp", [-1, 32]]]}, "result": [[1.5500066316260345e-05, 1.5500177141579065e-05, 1.5503277790203533e-05], 0, 1.613478422164917, 1688598375.353209], "version": 0.2, "tvm_version": "0.13.dev0"}
