results/cuda_rtx3080/bert/xgb/cpu.log_layer_3.log
{"input": ["cuda -keys=cuda,gpu -arch=sm_86 -max_num_threads=1024 -thread_warp_size=32", "batch_matmul.cuda", [["TENSOR", [1, 128, 768], "float32"], ["TENSOR", [1, 768, 3072], "float32"], [1, 128, 3072], "float32", 0, 0], {}], "config": {"index": 316844, "code_hash": null, "entity": [["tile_y", "sp", [-1, 1, 2]], ["tile_x", "sp", [-1, 24, 8]], ["tile_k", "sp", [-1, 24]], ["auto_unroll_max_step", "ot", 32], ["unroll_explicit", "ot", 0]]}, "result": [[0.0006661629336492892, 0.0006669248578199053, 0.0006670228483412322], 0, 1.553032636642456, 1688838969.5332103], "version": 0.2, "tvm_version": "0.13.dev0"}
{"input": ["cuda -keys=cuda,gpu -arch=sm_86 -max_num_threads=1024 -thread_warp_size=32", "batch_matmul.cuda", [["TENSOR", [1, 128, 768], "float32"], ["TENSOR", [1, 768, 3072], "float32"], [1, 128, 3072], "float32", 0, 0], {}], "config": {"index": 277748, "code_hash": null, "entity": [["tile_y", "sp", [-1, 1, 2]], ["tile_x", "sp", [-1, 2, 768]], ["tile_k", "sp", [-1, 3]], ["auto_unroll_max_step", "ot", 32], ["unroll_explicit", "ot", 0]]}, "result": [[0.0729584655, 0.0729846875, 0.0730711055], 0, 2.697066068649292, 1688838970.7853796], "version": 0.2, "tvm_version": "0.13.dev0"}
{"input": ["cuda -keys=cuda,gpu -arch=sm_86 -max_num_threads=1024 -thread_warp_size=32", "batch_matmul.cuda", [["TENSOR", [1, 128, 768], "float32"], ["TENSOR", [1, 768, 3072], "float32"], [1, 128, 3072], "float32", 0, 0], {}], "config": {"index": 548151, "code_hash": null, "entity": [["tile_y", "sp", [-1, 1, 4]], ["tile_x", "sp", [-1, 3, 256]], ["tile_k", "sp", [-1, 6]], ["auto_unroll_max_step", "ot", 8], ["unroll_explicit", "ot", 1]]}, "result": [[0.028550144, 0.02855654325, 0.0285580805], 0, 2.63193941116333, 1688838971.9001231], "version": 0.2, "tvm_version": "0.13.dev0"}
{"input": ["cuda -keys=cuda,gpu -arch=sm_86 -max_num_threads=1024 -thread_warp_size=32", "batch_matmul.cuda", [["TENSOR", [1, 128, 768], "float32"], ["TENSOR", [1, 768, 3072], "float32"], [1, 128, 3072], "float32", 0, 0], {}], "config": {"index": 35261, "code_hash": null, "entity": [["tile_y", "sp", [-1, 4, 4]], ["tile_x", "sp", [-1, 2, 512]], ["tile_k", "sp", [-1, 6]], ["auto_unroll_max_step", "ot", 8], ["unroll_explicit", "ot", 0]]}, "result": [[0.085854721, 0.0858654705, 0.08756889300000001], 0, 2.4314682483673096, 1688838973.3158736], "version": 0.2, "tvm_version": "0.13.dev0"}
{"input": ["cuda -keys=cuda,gpu -arch=sm_86 -max_num_threads=1024 -thread_warp_size=32", "batch_matmul.cuda", [["TENSOR", [1, 128, 768], "float32"], ["TENSOR", [1, 768, 3072], "float32"], [1, 128, 3072], "float32", 0, 0], {}], "config": {"index": 671014, "code_hash": null, "entity": [["tile_y", "sp", [-1, 4, 2]], ["tile_x", "sp", [-1, 8, 2]], ["tile_k", "sp", [-1, 6]], ["auto_unroll_max_step", "ot", 16], ["unroll_explicit", "ot", 1]]}, "result": [[0.0001909125709156194, 0.00019094199281867146, 0.0001910173698384201], 0, 1.220658779144287, 1688838974.3240056], "version": 0.2, "tvm_version": "0.13.dev0"}
{"input": ["cuda -keys=cuda,gpu -arch=sm_86 -max_num_threads=1024 -thread_warp_size=32", "batch_matmul.cuda", [["TENSOR", [1, 128, 768], "float32"], ["TENSOR", [1, 768, 3072], "float32"], [1, 128, 3072], "float32", 0, 0], {}], "config": {"index": 290544, "code_hash": null, "entity": [["tile_y", "sp", [-1, 8, 8]], ["tile_x", "sp", [-1, 4, 64]], ["tile_k", "sp", [-1, 6]], ["auto_unroll_max_step", "ot", 32], ["unroll_explicit", "ot", 0]]}, "result": [[0.00364606175, 0.00364609825, 0.00364609825], 0, 1.5029528141021729, 1688838975.3056593], "version": 0.2, "tvm_version": "0.13.dev0"}
{"input": ["cuda -keys=cuda,gpu -arch=sm_86 -max_num_threads=1024 -thread_warp_size=32", "batch_matmul.cuda", [["TENSOR", [1, 128, 768], "float32"], ["TENSOR", [1, 768, 3072], "float32"], [1, 128, 3072], "float32", 0, 0], {}], "config": {"index": 592093, "code_hash": null, "entity": [["tile_y", "sp", [-1, 2, 1]], ["tile_x", "sp", [-1, 128, 1]], ["tile_k", "sp", [-1, 64]], ["auto_unroll_max_step", "ot", 8], ["unroll_explicit", "ot", 1]]}, "result": [[0.0004081129448529412, 0.00040883953308823526, 0.00041130539705882353], 0, 1.2230286598205566, 1688838976.3020358], "version": 0.2, "tvm_version": "0.13.dev0"}
{"input": ["cuda -keys=cuda,gpu -arch=sm_86 -max_num_threads=1024 -thread_warp_size=32", "batch_matmul.cuda", [["TENSOR", [1, 128, 768], "float32"], ["TENSOR", [1, 768, 3072], "float32"], [1, 128, 3072], "float32", 0, 0], {}], "config": {"index": 970247, "code_hash": null, "entity": [["tile_y", "sp", [-1, 8, 2]], ["tile_x", "sp", [-1, 2, 2]], ["tile_k", "sp", [-1, 48]], ["auto_unroll_max_step", "ot", 64], ["unroll_explicit", "ot", 1]]}, "result": [[0.0010370231987179488, 0.0010370363076923077, 0.0010370557692307692], 0, 1.6340160369873047, 1688838978.4181695], "version": 0.2, "tvm_version": "0.13.dev0"}
{"input": ["cuda -keys=cuda,gpu -arch=sm_86 -max_num_threads=1024 -thread_warp_size=32", "batch_matmul.cuda", [["TENSOR", [1, 128, 768], "float32"], ["TENSOR", [1, 768, 3072], "float32"], [1, 128, 3072], "float32", 0, 0], {}], "config": {"index": 659187, "code_hash": null, "entity": [["tile_y", "sp", [-1, 2, 16]], ["tile_x", "sp", [-1, 128, 8]], ["tile_k", "sp", [-1, 3]], ["auto_unroll_max_step", "ot", 16], ["unroll_explicit", "ot", 1]]}, "result": [[0.0004685812209302325, 0.0004685871627906977, 0.00046859843023255816], 0, 1.7219994068145752, 1688838979.8148825], "version": 0.2, "tvm_version": "0.13.dev0"}
{"input": ["cuda -keys=cuda,gpu -arch=sm_86 -max_num_threads=1024 -thread_warp_size=32", "batch_matmul.cuda", [["TENSOR", [1, 128, 768], "float32"], ["TENSOR", [1, 768, 3072], "float32"], [1, 128, 3072], "float32", 0, 0], {}], "config": {"index": 302953, "code_hash": null, "entity": [["tile_y", "sp", [-1, 32, 2]], ["tile_x", "sp", [-1, 4, 12]], ["tile_k", "sp", [-1, 12]], ["auto_unroll_max_step", "ot", 32], ["unroll_explicit", "ot", 0]]}, "result": [[0.0001328761109298532, 0.0001332167079934747, 0.0001333112479608483], 0, 1.5994842052459717, 1688838981.1818], "version": 0.2, "tvm_version": "0.13.dev0"}
{"input": ["cuda -keys=cuda,gpu -arch=sm_86 -max_num_threads=1024 -thread_warp_size=32", "batch_matmul.cuda", [["TENSOR", [1, 128, 768], "float32"], ["TENSOR", [1, 768, 3072], "float32"], [1, 128, 3072], "float32", 0, 0], {}], "config": {"index": 274564, "code_hash": null, "entity": [["tile_y", "sp", [-1, 4, 16]], ["tile_x", "sp", [-1, 32, 12]], ["tile_k", "sp", [-1, 3]], ["auto_unroll_max_step", "ot", 32], ["unroll_explicit", "ot", 0]]}, "result": [[0.00037891371764705884, 0.0003789281858823529, 0.00037894225882352935], 0, 1.698552131652832, 1688838982.5392451], "version": 0.2, "tvm_version": "0.13.dev0"}
{"input": ["cuda -keys=cuda,gpu -arch=sm_86 -max_num_threads=1024 -thread_warp_size=32", "batch_matmul.cuda", [["TENSOR", [1, 128, 768], "float32"], ["TENSOR", [1, 768, 3072], "float32"], [1, 128, 3072], "float32", 0, 0], {}], "config": {"index": 184073, "code_hash": null, "entity": [["tile_y", "sp", [-1, 32, 1]], ["tile_x", "sp", [-1, 1, 128]], ["tile_k", "sp", [-1, 16]], ["auto_unroll_max_step", "ot", 16], ["unroll_explicit", "ot", 0]]}, "result": [[0.00038070000472813237, 0.0003807052718676123, 0.0003807072553191489], 0, 1.9871654510498047, 1688838983.9011617], "version": 0.2, "tvm_version": "0.13.dev0"}
{"input": ["cuda -keys=cuda,gpu -arch=sm_86 -max_num_threads=1024 -thread_warp_size=32", "batch_matmul.cuda", [["TENSOR", [1, 128, 768], "float32"], ["TENSOR", [1, 768, 3072], "float32"], [1, 128, 3072], "float32", 0, 0], {}], "config": {"index": 537712, "code_hash": null, "entity": [["tile_y", "sp", [-1, 2, 4]], ["tile_x", "sp", [-1, 8, 8]], ["tile_k", "sp", [-1, 4]], ["auto_unroll_max_step", "ot", 8], ["unroll_explicit", "ot", 1]]}, "result": [[0.00016231406666666667, 0.00016315887131782946, 0.00016428928682170544], 0, 1.1976113319396973, 1688838984.8725271], "version": 0.2, "tvm_version": "0.13.dev0"}
{"input": ["cuda -keys=cuda,gpu -arch=sm_86 -max_num_threads=1024 -thread_warp_size=32", "batch_matmul.cuda", [["TENSOR", [1, 128, 768], "float32"], ["TENSOR", [1, 768, 3072], "float32"], [1, 128, 3072], "float32", 0, 0], {}], "config": {"index": 328390, "code_hash": null, "entity": [["tile_y", "sp", [-1, 2, 64]], ["tile_x", "sp", [-1, 128, 1]], ["tile_k", "sp", [-1, 48]], ["auto_unroll_max_step", "ot", 32], ["unroll_explicit", "ot", 0]]}, "result": [[0.0004414207906249999, 0.00044146241875000006, 0.0005058611818181818], 0, 1.681971788406372, 1688838987.7853053], "version": 0.2, "tvm_version": "0.13.dev0"}
{"input": ["cuda -keys=cuda,gpu -arch=sm_86 -max_num_threads=1024 -thread_warp_size=32", "batch_matmul.cuda", [["TENSOR", [1, 128, 768], "float32"], ["TENSOR", [1, 768, 3072], "float32"], [1, 128, 3072], "float32", 0, 0], {}], "config": {"index": 72860, "code_hash": null, "entity": [["tile_y", "sp", [-1, 4, 32]], ["tile_x", "sp", [-1, 2, 3]], ["tile_k", "sp", [-1, 48]], ["auto_unroll_max_step", "ot", 8], ["unroll_explicit", "ot", 0]]}, "result": [[0.0009023469729729731, 0.0009023824414414414, 0.0009023930990990991], 0, 1.2926549911499023, 1688838988.7384622], "version": 0.2, "tvm_version": "0.13.dev0"}
{"input": ["cuda -keys=cuda,gpu -arch=sm_86 -max_num_threads=1024 -thread_warp_size=32", "batch_matmul.cuda", [["TENSOR", [1, 128, 768], "float32"], ["TENSOR", [1, 768, 3072], "float32"], [1, 128, 3072], "float32", 0, 0], {}], "config": {"index": 54371, "code_hash": null, "entity": [["tile_y", "sp", [-1, 8, 2]], ["tile_x", "sp", [-1, 16, 24]], ["tile_k", "sp", [-1, 16]], ["auto_unroll_max_step", "ot", 8], ["unroll_explicit", "ot", 0]]}, "result": [[0.0001751117657266811, 0.00017512065292841648, 0.0001751226388286334], 0, 1.7573540210723877, 1688838990.0954425], "version": 0.2, "tvm_version": "0.13.dev0"}
{"input": ["cuda -keys=cuda,gpu -arch=sm_86 -max_num_threads=1024 -thread_warp_size=32", "batch_matmul.cuda", [["TENSOR", [1, 128, 768], "float32"], ["TENSOR", [1, 768, 3072], "float32"], [1, 128, 3072], "float32", 0, 0], {}], "config": {"index": 914080, "code_hash": null, "entity": [["tile_y", "sp", [-1, 16, 1]], ["tile_x", "sp", [-1, 32, 3]], ["tile_k", "sp", [-1, 3]], ["auto_unroll_max_step", "ot", 64], ["unroll_explicit", "ot", 1]]}, "result": [[0.00036864696818181817, 0.00036899840454545453, 0.0003690332931818182], 0, 1.5641274452209473, 1688838991.4504745], "version": 0.2, "tvm_version": "0.13.dev0"}
{"input": ["cuda -keys=cuda,gpu -arch=sm_86 -max_num_threads=1024 -thread_warp_size=32", "batch_matmul.cuda", [["TENSOR", [1, 128, 768], "float32"], ["TENSOR", [1, 768, 3072], "float32"], [1, 128, 3072], "float32", 0, 0], {}], "config": {"index": 311592, "code_hash": null, "entity": [["tile_y", "sp", [-1, 16, 2]], ["tile_x", "sp", [-1, 2, 48]], ["tile_k", "sp", [-1, 16]], ["auto_unroll_max_step", "ot", 32], ["unroll_explicit", "ot", 0]]}, "result": [[0.0001631590647773279, 0.00016323264068825914, 0.00016324806983805668], 0, 1.872758388519287, 1688838992.8451688], "version": 0.2, "tvm_version": "0.13.dev0"}
{"input": ["cuda -keys=cuda,gpu -arch=sm_86 -max_num_threads=1024 -thread_warp_size=32", "batch_matmul.cuda", [["TENSOR", [1, 128, 768], "float32"], ["TENSOR", [1, 768, 3072], "float32"], [1, 128, 3072], "float32", 0, 0], {}], "config": {"index": 67424, "code_hash": null, "entity": [["tile_y", "sp", [-1, 4, 32]], ["tile_x", "sp", [-1, 32, 8]], ["tile_k", "sp", [-1, 32]], ["auto_unroll_max_step", "ot", 8], ["unroll_explicit", "ot", 0]]}, "result": [[0.0006188997283950617, 0.0006189448024691358, 0.0006189562469135802], 0, 1.3811640739440918, 1688838993.8274167], "version": 0.2, "tvm_version": "0.13.dev0"}
{"input": ["cuda -keys=cuda,gpu -arch=sm_86 -max_num_threads=1024 -thread_warp_size=32", "batch_matmul.cuda", [["TENSOR", [1, 128, 768], "float32"], ["TENSOR", [1, 768, 3072], "float32"], [1, 128, 3072], "float32", 0, 0], {}], "config": {"index": 440737, "code_hash": null, "entity": [["tile_y", "sp", [-1, 16, 8]], ["tile_x", "sp", [-1, 2, 128]], ["tile_k", "sp", [-1, 16]], ["auto_unroll_max_step", "ot", 64], ["unroll_explicit", "ot", 0]]}, "result": [[0.004535616171428572, 0.004537044828571428, 0.004538305657142857], 0, 2.2313976287841797, 1688838995.1938758], "version": 0.2, "tvm_version": "0.13.dev0"}
{"input": ["cuda -keys=cuda,gpu -arch=sm_86 -max_num_threads=1024 -thread_warp_size=32", "batch_matmul.cuda", [["TENSOR", [1, 128, 768], "float32"], ["TENSOR", [1, 768, 3072], "float32"], [1, 128, 3072], "float32", 0, 0], {}], "config": {"index": 9346, "code_hash": null, "entity": [["tile_y", "sp", [-1, 2, 8]], ["tile_x", "sp", [-1, 24, 4]], ["tile_k", "sp", [-1, 2]], ["auto_unroll_max_step", "ot", 8], ["unroll_explicit", "ot", 0]]}, "result": [[0.00017786017477876105, 0.0001778612389380531, 0.00017786788938053096], 0, 1.5883798599243164, 1688838996.5494199], "version": 0.2, "tvm_version": "0.13.dev0"}
{"input": ["cuda -keys=cuda,gpu -arch=sm_86 -max_num_threads=1024 -thread_warp_size=32", "batch_matmul.cuda", [["TENSOR", [1, 128, 768], "float32"], ["TENSOR", [1, 768, 3072], "float32"], [1, 128, 3072], "float32", 0, 0], {}], "config": {"index": 403121, "code_hash": null, "entity": [["tile_y", "sp", [-1, 8, 16]], ["tile_x", "sp", [-1, 4, 16]], ["tile_k", "sp", [-1, 3]], ["auto_unroll_max_step", "ot", 64], ["unroll_explicit", "ot", 0]]}, "result": [[0.0006893795683760684, 0.0006894102136752137, 0.0006894451666666668], 0, 1.893681287765503, 1688838997.9562602], "version": 0.2, "tvm_version": "0.13.dev0"}
{"input": ["cuda -keys=cuda,gpu -arch=sm_86 -max_num_threads=1024 -thread_warp_size=32", "batch_matmul.cuda", [["TENSOR", [1, 128, 768], "float32"], ["TENSOR", [1, 768, 3072], "float32"], [1, 128, 3072], "float32", 0, 0], {}], "config": {"index": 676429, "code_hash": null, "entity": [["tile_y", "sp", [-1, 16, 8]], ["tile_x", "sp", [-1, 2, 256]], ["tile_k", "sp", [-1, 6]], ["auto_unroll_max_step", "ot", 16], ["unroll_explicit", "ot", 1]]}, "result": [[0.02613936025, 0.026141183749999998, 0.026142208], 0, 2.5782787799835205, 1688838999.0196817], "version": 0.2, "tvm_version": "0.13.dev0"}
{"input": ["cuda -keys=cuda,gpu -arch=sm_86 -max_num_threads=1024 -thread_warp_size=32", "batch_matmul.cuda", [["TENSOR", [1, 128, 768], "float32"], ["TENSOR", [1, 768, 3072], "float32"], [1, 128, 3072], "float32", 0, 0], {}], "config": {"index": 415538, "code_hash": null, "entity": [["tile_y", "sp", [-1, 1, 16]], ["tile_x", "sp", [-1, 8, 4]], ["tile_k", "sp", [-1, 6]], ["auto_unroll_max_step", "ot", 64], ["unroll_explicit", "ot", 0]]}, "result": [[0.00020683301900584794, 0.00020765491812865499, 0.0002076833611111111], 0, 1.6441864967346191, 1688839001.7974904], "version": 0.2, "tvm_version": "0.13.dev0"}
{"input": ["cuda -keys=cuda,gpu -arch=sm_86 -max_num_threads=1024 -thread_warp_size=32", "batch_matmul.cuda", [["TENSOR", [1, 128, 768], "float32"], ["TENSOR", [1, 768, 3072], "float32"], [1, 128, 3072], "float32", 0, 0], {}], "config": {"index": 405626, "code_hash": null, "entity": [["tile_y", "sp", [-1, 64, 2]], ["tile_x", "sp", [-1, 4, 256]], ["tile_k", "sp", [-1, 3]], ["auto_unroll_max_step", "ot", 64], ["unroll_explicit", "ot", 0]]}, "result": [[0.014484479571428571, 0.014485064857142857, 0.014485358000000002], 0, 2.423414468765259, 1688839002.801872], "version": 0.2, "tvm_version": "0.13.dev0"}
{"input": ["cuda -keys=cuda,gpu -arch=sm_86 -max_num_threads=1024 -thread_warp_size=32", "batch_matmul.cuda", [["TENSOR", [1, 128, 768], "float32"], ["TENSOR", [1, 768, 3072], "float32"], [1, 128, 3072], "float32", 0, 0], {}], "config": {"index": 388856, "code_hash": null, "entity": [["tile_y", "sp", [-1, 32, 4]], ["tile_x", "sp", [-1, 4, 16]], ["tile_k", "sp", [-1, 1]], ["auto_unroll_max_step", "ot", 64], ["unroll_explicit", "ot", 0]]}, "result": [[0.0004613277926267281, 0.00046133323963133644, 0.000461385133640553], 0, 1.279299020767212, 1688839003.753106], "version": 0.2, "tvm_version": "0.13.dev0"}
{"input": ["cuda -keys=cuda,gpu -arch=sm_86 -max_num_threads=1024 -thread_warp_size=32", "batch_matmul.cuda", [["TENSOR", [1, 128, 768], "float32"], ["TENSOR", [1, 768, 3072], "float32"], [1, 128, 3072], "float32", 0, 0], {}], "config": {"index": 672156, "code_hash": null, "entity": [["tile_y", "sp", [-1, 1, 1]], ["tile_x", "sp", [-1, 12, 4]], ["tile_k", "sp", [-1, 6]], ["auto_unroll_max_step", "ot", 16], ["unroll_explicit", "ot", 1]]}, "result": [[0.0009788136545454545, 0.000979046418181818, 0.0009805917181818181], 0, 1.3295681476593018, 1688839004.7487955], "version": 0.2, "tvm_version": "0.13.dev0"}
{"input": ["cuda -keys=cuda,gpu -arch=sm_86 -max_num_threads=1024 -thread_warp_size=32", "batch_matmul.cuda", [["TENSOR", [1, 128, 768], "float32"], ["TENSOR", [1, 768, 3072], "float32"], [1, 128, 3072], "float32", 0, 0], {}], "config": {"index": 784203, "code_hash": null, "entity": [["tile_y", "sp", [-1, 1, 4]], ["tile_x", "sp", [-1, 4, 1]], ["tile_k", "sp", [-1, 3]], ["auto_unroll_max_step", "ot", 32], ["unroll_explicit", "ot", 1]]}, "result": [[0.00202401794, 0.00202793272, 0.00203222854], 0, 1.2802221775054932, 1688839005.7125406], "version": 0.2, "tvm_version": "0.13.dev0"}
{"input": ["cuda -keys=cuda,gpu -arch=sm_86 -max_num_threads=1024 -thread_warp_size=32", "batch_matmul.cuda", [["TENSOR", [1, 128, 768], "float32"], ["TENSOR", [1, 768, 3072], "float32"], [1, 128, 3072], "float32", 0, 0], {}], "config": {"index": 792939, "code_hash": null, "entity": [["tile_y", "sp", [-1, 8, 1]], ["tile_x", "sp", [-1, 64, 3]], ["tile_k", "sp", [-1, 4]], ["auto_unroll_max_step", "ot", 32], ["unroll_explicit", "ot", 1]]}, "result": [[0.00029147180500894456, 0.00029183094633273703, 0.0002919955992844365], 0, 1.6706011295318604, 1688839007.0544815], "version": 0.2, "tvm_version": "0.13.dev0"}
{"input": ["cuda -keys=cuda,gpu -arch=sm_86 -max_num_threads=1024 -thread_warp_size=32", "batch_matmul.cuda", [["TENSOR", [1, 128, 768], "float32"], ["TENSOR", [1, 768, 3072], "float32"], [1, 128, 3072], "float32", 0, 0], {}], "config": {"index": 394013, "code_hash": null, "entity": [["tile_y", "sp", [-1, 8, 16]], ["tile_x", "sp", [-1, 2, 4]], ["tile_k", "sp", [-1, 2]], ["auto_unroll_max_step", "ot", 64], ["unroll_explicit", "ot", 0]]}, "result": [[0.0006551886081632653, 0.0006552220530612246, 0.0006552347591836734], 0, 1.6211357116699219, 1688839008.4076204], "version": 0.2, "tvm_version": "0.13.dev0"}
{"input": ["cuda -keys=cuda,gpu -arch=sm_86 -max_num_threads=1024 -thread_warp_size=32", "batch_matmul.cuda", [["TENSOR", [1, 128, 768], "float32"], ["TENSOR", [1, 768, 3072], "float32"], [1, 128, 3072], "float32", 0, 0], {}], "config": {"index": 395799, "code_hash": null, "entity": [["tile_y", "sp", [-1, 1, 4]], ["tile_x", "sp", [-1, 128, 12]], ["tile_k", "sp", [-1, 2]], ["auto_unroll_max_step", "ot", 64], ["unroll_explicit", "ot", 0]]}, "result": [[0.0003058939226415095, 0.00030591131132075473, 0.0003059132396226415], 0, 1.6601614952087402, 1688839009.7688975], "version": 0.2, "tvm_version": "0.13.dev0"}
{"input": ["cuda -keys=cuda,gpu -arch=sm_86 -max_num_threads=1024 -thread_warp_size=32", "batch_matmul.cuda", [["TENSOR", [1, 128, 768], "float32"], ["TENSOR", [1, 768, 3072], "float32"], [1, 128, 3072], "float32", 0, 0], {}], "config": {"index": 428605, "code_hash": null, "entity": [["tile_y", "sp", [-1, 16, 8]], ["tile_x", "sp", [-1, 4, 2]], ["tile_k", "sp", [-1, 12]], ["auto_unroll_max_step", "ot", 64], ["unroll_explicit", "ot", 0]]}, "result": [[0.0003269327491856677, 0.00032785677524429965, 0.0003279068013029316], 0, 1.3592472076416016, 1688839010.7700348], "version": 0.2, "tvm_version": "0.13.dev0"}
{"input": ["cuda -keys=cuda,gpu -arch=sm_86 -max_num_threads=1024 -thread_warp_size=32", "batch_matmul.cuda", [["TENSOR", [1, 128, 768], "float32"], ["TENSOR", [1, 768, 3072], "float32"], [1, 128, 3072], "float32", 0, 0], {}], "config": {"index": 28788, "code_hash": null, "entity": [["tile_y", "sp", [-1, 8, 8]], ["tile_x", "sp", [-1, 16, 1]], ["tile_k", "sp", [-1, 6]], ["auto_unroll_max_step", "ot", 8], ["unroll_explicit", "ot", 0]]}, "result": [[0.00013938742119205298, 0.00013957323443708608, 0.00014004497350993377], 0, 1.2835910320281982, 1688839011.793543], "version": 0.2, "tvm_version": "0.13.dev0"}
{"input": ["cuda -keys=cuda,gpu -arch=sm_86 -max_num_threads=1024 -thread_warp_size=32", "batch_matmul.cuda", [["TENSOR", [1, 128, 768], "float32"], ["TENSOR", [1, 768, 3072], "float32"], [1, 128, 3072], "float32", 0, 0], {}], "config": {"index": 698663, "code_hash": null, "entity": [["tile_y", "sp", [-1, 8, 2]], ["tile_x", "sp", [-1, 4, 1]], ["tile_k", "sp", [-1, 24]], ["auto_unroll_max_step", "ot", 16], ["unroll_explicit", "ot", 1]]}, "result": [[0.0003570346700680272, 0.0003592672517006803, 0.00035947558163265306], 0, 1.3432137966156006, 1688839012.7945356], "version": 0.2, "tvm_version": "0.13.dev0"}
{"input": ["cuda -keys=cuda,gpu -arch=sm_86 -max_num_threads=1024 -thread_warp_size=32", "batch_matmul.cuda", [["TENSOR", [1, 128, 768], "float32"], ["TENSOR", [1, 768, 3072], "float32"], [1, 128, 3072], "float32", 0, 0], {}], "config": {"index": 573814, "code_hash": null, "entity": [["tile_y", "sp", [-1, 4, 2]], ["tile_x", "sp", [-1, 4, 12]], ["tile_k", "sp", [-1, 24]], ["auto_unroll_max_step", "ot", 8], ["unroll_explicit", "ot", 1]]}, "result": [[0.00019176425760286225, 0.00019177925760286224, 0.00019179941502683363], 0, 1.376298427581787, 1688839013.779792], "version": 0.2, "tvm_version": "0.13.dev0"}
{"input": ["cuda -keys=cuda,gpu -arch=sm_86 -max_num_threads=1024 -thread_warp_size=32", "batch_matmul.cuda", [["TENSOR", [1, 128, 768], "float32"], ["TENSOR", [1, 768, 3072], "float32"], [1, 128, 3072], "float32", 0, 0], {}], "config": {"index": 544770, "code_hash": null, "entity": [["tile_y", "sp", [-1, 8, 4]], ["tile_x", "sp", [-1, 4, 8]], ["tile_k", "sp", [-1, 6]], ["auto_unroll_max_step", "ot", 8], ["unroll_explicit", "ot", 1]]}, "result": [[9.025960185185186e-05, 9.066598875661376e-05, 9.067005555555554e-05], 0, 1.7539699077606201, 1688839075.6555614], "version": 0.2, "tvm_version": "0.13.dev0"}
{"input": ["cuda -keys=cuda,gpu -arch=sm_86 -max_num_threads=1024 -thread_warp_size=32", "batch_matmul.cuda", [["TENSOR", [1, 128, 768], "float32"], ["TENSOR", [1, 768, 3072], "float32"], [1, 128, 3072], "float32", 0, 0], {}], "config": {"index": 545310, "code_hash": null, "entity": [["tile_y", "sp", [-1, 8, 4]], ["tile_x", "sp", [-1, 4, 12]], ["tile_k", "sp", [-1, 6]], ["auto_unroll_max_step", "ot", 8], ["unroll_explicit", "ot", 1]]}, "result": [[0.0001557530774443369, 0.00015575589835430784, 0.00015576100968054212], 0, 1.755976676940918, 1688839077.0128627], "version": 0.2, "tvm_version": "0.13.dev0"}
{"input": ["cuda -keys=cuda,gpu -arch=sm_86 -max_num_threads=1024 -thread_warp_size=32", "batch_matmul.cuda", [["TENSOR", [1, 128, 768], "float32"], ["TENSOR", [1, 768, 3072], "float32"], [1, 128, 3072], "float32", 0, 0], {}], "config": {"index": 32094, "code_hash": null, "entity": [["tile_y", "sp", [-1, 8, 4]], ["tile_x", "sp", [-1, 4, 12]], ["tile_k", "sp", [-1, 6]], ["auto_unroll_max_step", "ot", 8], ["unroll_explicit", "ot", 0]]}, "result": [[0.0001557845988315482, 0.0001558035423563778, 0.00015623627069133396], 0, 1.762096881866455, 1688839078.3650286], "version": 0.2, "tvm_version": "0.13.dev0"}
{"input": ["cuda -keys=cuda,gpu -arch=sm_86 -max_num_threads=1024 -thread_warp_size=32", "batch_matmul.cuda", [["TENSOR", [1, 128, 768], "float32"], ["TENSOR", [1, 768, 3072], "float32"], [1, 128, 3072], "float32", 0, 0], {}], "config": {"index": 46345, "code_hash": null, "entity": [["tile_y", "sp", [-1, 32, 2]], ["tile_x", "sp", [-1, 4, 12]], ["tile_k", "sp", [-1, 12]], ["auto_unroll_max_step", "ot", 8], ["unroll_explicit", "ot", 0]]}, "result": [[0.0001304191606133979, 0.0001311480355125101, 0.00013125878773204196], 0, 1.7580373287200928, 1688839079.725514], "version": 0.2, "tvm_version": "0.13.dev0"}
{"input": ["cuda -keys=cuda,gpu -arch=sm_86 -max_num_threads=1024 -thread_warp_size=32", "batch_matmul.cuda", [["TENSOR", [1, 128, 768], "float32"], ["TENSOR", [1, 768, 3072], "float32"], [1, 128, 3072], "float32", 0, 0], {}], "config": {"index": 31554, "code_hash": null, "entity": [["tile_y", "sp", [-1, 8, 4]], ["tile_x", "sp", [-1, 4, 8]], ["tile_k", "sp", [-1, 6]], ["auto_unroll_max_step", "ot", 8], ["unroll_explicit", "ot", 0]]}, "result": [[9.079678210806024e-05, 9.127295305580159e-05, 9.136728343666961e-05], 0, 1.4004409313201904, 1688839080.6994696], "version": 0.2, "tvm_version": "0.13.dev0"}
{"input": ["cuda -keys=cuda,gpu -arch=sm_86 -max_num_threads=1024 -thread_warp_size=32", "batch_matmul.cuda", [["TENSOR", [1, 128, 768], "float32"], ["TENSOR", [1, 768, 3072], "float32"], [1, 128, 3072], "float32", 0, 0], {}], "config": {"index": 558660, "code_hash": null, "entity": [["tile_y", "sp", [-1, 16, 2]], ["tile_x", "sp", [-1, 8, 6]], ["tile_k", "sp", [-1, 12]], ["auto_unroll_max_step", "ot", 8], ["unroll_explicit", "ot", 1]]}, "result": [[9.229875240594925e-05, 9.232920997375329e-05, 9.234813298337708e-05], 0, 1.3396949768066406, 1688839081.6495311], "version": 0.2, "tvm_version": "0.13.dev0"}
{"input": ["cuda -keys=cuda,gpu -arch=sm_86 -max_num_threads=1024 -thread_warp_size=32", "batch_matmul.cuda", [["TENSOR", [1, 128, 768], "float32"], ["TENSOR", [1, 768, 3072], "float32"], [1, 128, 3072], "float32", 0, 0], {}], "config": {"index": 45444, "code_hash": null, "entity": [["tile_y", "sp", [-1, 16, 2]], ["tile_x", "sp", [-1, 8, 6]], ["tile_k", "sp", [-1, 12]], ["auto_unroll_max_step", "ot", 8], ["unroll_explicit", "ot", 0]]}, "result": [[9.213222747156606e-05, 9.229079615048119e-05, 9.235339982502186e-05], 0, 1.3601443767547607, 1688839082.6336632], "version": 0.2, "tvm_version": "0.13.dev0"}
{"input": ["cuda -keys=cuda,gpu -arch=sm_86 -max_num_threads=1024 -thread_warp_size=32", "batch_matmul.cuda", [["TENSOR", [1, 128, 768], "float32"], ["TENSOR", [1, 768, 3072], "float32"], [1, 128, 3072], "float32", 0, 0], {}], "config": {"index": 46669, "code_hash": null, "entity": [["tile_y", "sp", [-1, 32, 2]], ["tile_x", "sp", [-1, 3, 16]], ["tile_k", "sp", [-1, 12]], ["auto_unroll_max_step", "ot", 8], ["unroll_explicit", "ot", 0]]}, "result": [[0.00015392595302013423, 0.0001539475465004794, 0.00015394835091083413], 0, 1.7271010875701904, 1688839083.9868448], "version": 0.2, "tvm_version": "0.13.dev0"}
{"input": ["cuda -keys=cuda,gpu -arch=sm_86 -max_num_threads=1024 -thread_warp_size=32", "batch_matmul.cuda", [["TENSOR", [1, 128, 768], "float32"], ["TENSOR", [1, 768, 3072], "float32"], [1, 128, 3072], "float32", 0, 0], {}], "config": {"index": 45804, "code_hash": null, "entity": [["tile_y", "sp", [-1, 16, 2]], ["tile_x", "sp", [-1, 4, 8]], ["tile_k", "sp", [-1, 12]], ["auto_unroll_max_step", "ot", 8], ["unroll_explicit", "ot", 0]]}, "result": [[0.00011538533936651584, 0.00011594367533936651, 0.00011594689479638009], 0, 1.3529133796691895, 1688839084.9567811], "version": 0.2, "tvm_version": "0.13.dev0"}
{"input": ["cuda -keys=cuda,gpu -arch=sm_86 -max_num_threads=1024 -thread_warp_size=32", "batch_matmul.cuda", [["TENSOR", [1, 128, 768], "float32"], ["TENSOR", [1, 768, 3072], "float32"], [1, 128, 3072], "float32", 0, 0], {}], "config": {"index": 559020, "code_hash": null, "entity": [["tile_y", "sp", [-1, 16, 2]], ["tile_x", "sp", [-1, 4, 8]], ["tile_k", "sp", [-1, 12]], ["auto_unroll_max_step", "ot", 8], ["unroll_explicit", "ot", 1]]}, "result": [[0.00011511202724177071, 0.00011558414869466515, 0.00011558762996594778], 0, 1.393078327178955, 1688839085.9450636], "version": 0.2, "tvm_version": "0.13.dev0"}
{"input": ["cuda -keys=cuda,gpu -arch=sm_86 -max_num_threads=1024 -thread_warp_size=32", "batch_matmul.cuda", [["TENSOR", [1, 128, 768], "float32"], ["TENSOR", [1, 768, 3072], "float32"], [1, 128, 3072], "float32", 0, 0], {}], "config": {"index": 551532, "code_hash": null, "entity": [["tile_y", "sp", [-1, 16, 2]], ["tile_x", "sp", [-1, 8, 6]], ["tile_k", "sp", [-1, 8]], ["auto_unroll_max_step", "ot", 8], ["unroll_explicit", "ot", 1]]}, "result": [[0.0001143964159192825, 0.0001148039461883408, 0.00011482461098654709], 0, 1.365844488143921, 1688839086.9165692], "version": 0.2, "tvm_version": "0.13.dev0"}
{"input": ["cuda -keys=cuda,gpu -arch=sm_86 -max_num_threads=1024 -thread_warp_size=32", "batch_matmul.cuda", [["TENSOR", [1, 128, 768], "float32"], ["TENSOR", [1, 768, 3072], "float32"], [1, 128, 3072], "float32", 0, 0], {}], "config": {"index": 537323, "code_hash": null, "entity": [["tile_y", "sp", [-1, 4, 8]], ["tile_x", "sp", [-1, 16, 6]], ["tile_k", "sp", [-1, 4]], ["auto_unroll_max_step", "ot", 8], ["unroll_explicit", "ot", 1]]}, "result": [[0.00014743793634686348, 0.00014765154520295204, 0.00014802562453874538], 0, 1.7901406288146973, 1688839088.2896786], "version": 0.2, "tvm_version": "0.13.dev0"}
{"input": ["cuda -keys=cuda,gpu -arch=sm_86 -max_num_threads=1024 -thread_warp_size=32", "batch_matmul.cuda", [["TENSOR", [1, 128, 768], "float32"], ["TENSOR", [1, 768, 3072], "float32"], [1, 128, 3072], "float32", 0, 0], {}], "config": {"index": 544806, "code_hash": null, "entity": [["tile_y", "sp", [-1, 8, 4]], ["tile_x", "sp", [-1, 6, 8]], ["tile_k", "sp", [-1, 6]], ["auto_unroll_max_step", "ot", 8], ["unroll_explicit", "ot", 1]]}, "result": [[0.00010498793174767321, 0.0001054465873836608, 0.0001054476442605998], 0, 1.3645069599151611, 1688839089.249288], "version": 0.2, "tvm_version": "0.13.dev0"}
{"input": ["cuda -keys=cuda,gpu -arch=sm_86 -max_num_threads=1024 -thread_warp_size=32", "batch_matmul.cuda", [["TENSOR", [1, 128, 768], "float32"], ["TENSOR", [1, 768, 3072], "float32"], [1, 128, 3072], "float32", 0, 0], {}], "config": {"index": 551928, "code_hash": null, "entity": [["tile_y", "sp", [-1, 16, 2]], ["tile_x", "sp", [-1, 6, 8]], ["tile_k", "sp", [-1, 8]], ["auto_unroll_max_step", "ot", 8], ["unroll_explicit", "ot", 1]]}, "result": [[0.00014032603022452503, 0.00014084509240069084, 0.00014121011744386874], 0, 1.7822554111480713, 1688839090.6228516], "version": 0.2, "tvm_version": "0.13.dev0"}
{"input": ["cuda -keys=cuda,gpu -arch=sm_86 -max_num_threads=1024 -thread_warp_size=32", "batch_matmul.cuda", [["TENSOR", [1, 128, 768], "float32"], ["TENSOR", [1, 768, 3072], "float32"], [1, 128, 3072], "float32", 0, 0], {}], "config": {"index": 38712, "code_hash": null, "entity": [["tile_y", "sp", [-1, 16, 2]], ["tile_x", "sp", [-1, 6, 8]], ["tile_k", "sp", [-1, 8]], ["auto_unroll_max_step", "ot", 8], ["unroll_explicit", "ot", 0]]}, "result": [[0.00014068157652173913, 0.0001412701547826087, 0.00014172693652173912], 0, 1.7492179870605469, 1688839091.983124], "version": 0.2, "tvm_version": "0.13.dev0"}
{"input": ["cuda -keys=cuda,gpu -arch=sm_86 -max_num_threads=1024 -thread_warp_size=32", "batch_matmul.cuda", [["TENSOR", [1, 128, 768], "float32"], ["TENSOR", [1, 768, 3072], "float32"], [1, 128, 3072], "float32", 0, 0], {}], "config": {"index": 557621, "code_hash": null, "entity": [["tile_y", "sp", [-1, 4, 4]], ["tile_x", "sp", [-1, 8, 3]], ["tile_k", "sp", [-1, 12]], ["auto_unroll_max_step", "ot", 8], ["unroll_explicit", "ot", 1]]}, "result": [[0.00010553241102514506, 0.0001055413249516441, 0.00010557598162475822], 0, 1.4487276077270508, 1688839093.0252085], "version": 0.2, "tvm_version": "0.13.dev0"}
{"input": ["cuda -keys=cuda,gpu -arch=sm_86 -max_num_threads=1024 -thread_warp_size=32", "batch_matmul.cuda", [["TENSOR", [1, 128, 768], "float32"], ["TENSOR", [1, 768, 3072], "float32"], [1, 128, 3072], "float32", 0, 0], {}], "config": {"index": 38682, "code_hash": null, "entity": [["tile_y", "sp", [-1, 8, 4]], ["tile_x", "sp", [-1, 4, 8]], ["tile_k", "sp", [-1, 8]], ["auto_unroll_max_step", "ot", 8], ["unroll_explicit", "ot", 0]]}, "result": [[0.00010141708224674022, 0.0001020064663991976, 0.00010209803410230693], 0, 1.3493778705596924, 1688839094.5282574], "version": 0.2, "tvm_version": "0.13.dev0"}
{"input": ["cuda -keys=cuda,gpu -arch=sm_86 -max_num_threads=1024 -thread_warp_size=32", "batch_matmul.cuda", [["TENSOR", [1, 128, 768], "float32"], ["TENSOR", [1, 768, 3072], "float32"], [1, 128, 3072], "float32", 0, 0], {}], "config": {"index": 551898, "code_hash": null, "entity": [["tile_y", "sp", [-1, 8, 4]], ["tile_x", "sp", [-1, 4, 8]], ["tile_k", "sp", [-1, 8]], ["auto_unroll_max_step", "ot", 8], ["unroll_explicit", "ot", 1]]}, "result": [[0.00010196566966067864, 0.00010212522455089821, 0.00010213429341317365], 0, 1.4050567150115967, 1688839095.5185626], "version": 0.2, "tvm_version": "0.13.dev0"}
{"input": ["cuda -keys=cuda,gpu -arch=sm_86 -max_num_threads=1024 -thread_warp_size=32", "batch_matmul.cuda", [["TENSOR", [1, 128, 768], "float32"], ["TENSOR", [1, 768, 3072], "float32"], [1, 128, 3072], "float32", 0, 0], {}], "config": {"index": 559561, "code_hash": null, "entity": [["tile_y", "sp", [-1, 32, 2]], ["tile_x", "sp", [-1, 4, 12]], ["tile_k", "sp", [-1, 12]], ["auto_unroll_max_step", "ot", 8], ["unroll_explicit", "ot", 1]]}, "result": [[0.00013135237925445705, 0.00013137322690437602, 0.00013137819854132902], 0, 1.740379810333252, 1688839096.8743913], "version": 0.2, "tvm_version": "0.13.dev0"}
{"input": ["cuda -keys=cuda,gpu -arch=sm_86 -max_num_threads=1024 -thread_warp_size=32", "batch_matmul.cuda", [["TENSOR", [1, 128, 768], "float32"], ["TENSOR", [1, 768, 3072], "float32"], [1, 128, 3072], "float32", 0, 0], {}], "config": {"index": 52932, "code_hash": null, "entity": [["tile_y", "sp", [-1, 16, 2]], ["tile_x", "sp", [-1, 4, 8]], ["tile_k", "sp", [-1, 16]], ["auto_unroll_max_step", "ot", 8], ["unroll_explicit", "ot", 0]]}, "result": [[0.0001634281099796334, 0.00016343019246435847, 0.00016343539714867617], 0, 1.7226498126983643, 1688839098.219369], "version": 0.2, "tvm_version": "0.13.dev0"}
{"input": ["cuda -keys=cuda,gpu -arch=sm_86 -max_num_threads=1024 -thread_warp_size=32", "batch_matmul.cuda", [["TENSOR", [1, 128, 768], "float32"], ["TENSOR", [1, 768, 3072], "float32"], [1, 128, 3072], "float32", 0, 0], {}], "config": {"index": 566148, "code_hash": null, "entity": [["tile_y", "sp", [-1, 16, 2]], ["tile_x", "sp", [-1, 4, 8]], ["tile_k", "sp", [-1, 16]], ["auto_unroll_max_step", "ot", 8], ["unroll_explicit", "ot", 1]]}, "result": [[0.0001634044040609137, 0.00016341479898477156, 0.000163418083248731], 0, 1.7661221027374268, 1688839099.5759547], "version": 0.2, "tvm_version": "0.13.dev0"}
{"input": ["cuda -keys=cuda,gpu -arch=sm_86 -max_num_threads=1024 -thread_warp_size=32", "batch_matmul.cuda", [["TENSOR", [1, 128, 768], "float32"], ["TENSOR", [1, 768, 3072], "float32"], [1, 128, 3072], "float32", 0, 0], {}], "config": {"index": 550493, "code_hash": null, "entity": [["tile_y", "sp", [-1, 4, 4]], ["tile_x", "sp", [-1, 8, 3]], ["tile_k", "sp", [-1, 8]], ["auto_unroll_max_step", "ot", 8], ["unroll_explicit", "ot", 1]]}, "result": [[0.00011978695433789955, 0.00011978786872146119, 0.00011983718949771689], 0, 1.3468363285064697, 1688839100.5369256], "version": 0.2, "tvm_version": "0.13.dev0"}
{"input": ["cuda -keys=cuda,gpu -arch=sm_86 -max_num_threads=1024 -thread_warp_size=32", "batch_matmul.cuda", [["TENSOR", [1, 128, 768], "float32"], ["TENSOR", [1, 768, 3072], "float32"], [1, 128, 3072], "float32", 0, 0], {}], "config": {"index": 544800, "code_hash": null, "entity": [["tile_y", "sp", [-1, 16, 2]], ["tile_x", "sp", [-1, 6, 8]], ["tile_k", "sp", [-1, 6]], ["auto_unroll_max_step", "ot", 8], ["unroll_explicit", "ot", 1]]}, "result": [[0.00013537674101921473, 0.00013541095572263992, 0.00013610985129490393], 0, 1.788175344467163, 1688839101.9053247], "version": 0.2, "tvm_version": "0.13.dev0"}
{"input": ["cuda -keys=cuda,gpu -arch=sm_86 -max_num_threads=1024 -thread_warp_size=32", "batch_matmul.cuda", [["TENSOR", [1, 128, 768], "float32"], ["TENSOR", [1, 768, 3072], "float32"], [1, 128, 3072], "float32", 0, 0], {}], "config": {"index": 558053, "code_hash": null, "entity": [["tile_y", "sp", [-1, 4, 4]], ["tile_x", "sp", [-1, 6, 4]], ["tile_k", "sp", [-1, 12]], ["auto_unroll_max_step", "ot", 8], ["unroll_explicit", "ot", 1]]}, "result": [[0.00010880683550651956, 0.00010881617853560681, 0.00010882933299899697], 0, 1.4297385215759277, 1688839102.9375901], "version": 0.2, "tvm_version": "0.13.dev0"}
{"input": ["cuda -keys=cuda,gpu -arch=sm_86 -max_num_threads=1024 -thread_warp_size=32", "batch_matmul.cuda", [["TENSOR", [1, 128, 768], "float32"], ["TENSOR", [1, 768, 3072], "float32"], [1, 128, 3072], "float32", 0, 0], {}], "config": {"index": 551927, "code_hash": null, "entity": [["tile_y", "sp", [-1, 8, 2]], ["tile_x", "sp", [-1, 6, 8]], ["tile_k", "sp", [-1, 8]], ["auto_unroll_max_step", "ot", 8], ["unroll_explicit", "ot", 1]]}, "result": [[0.00019190198810939356, 0.00019190563495838288, 0.00019191156718192628], 0, 1.7680153846740723, 1688839104.3014193], "version": 0.2, "tvm_version": "0.13.dev0"}
{"input": ["cuda -keys=cuda,gpu -arch=sm_86 -max_num_threads=1024 -thread_warp_size=32", "batch_matmul.cuda", [["TENSOR", [1, 128, 768], "float32"], ["TENSOR", [1, 768, 3072], "float32"], [1, 128, 3072], "float32", 0, 0], {}], "config": {"index": 38711, "code_hash": null, "entity": [["tile_y", "sp", [-1, 8, 2]], ["tile_x", "sp", [-1, 6, 8]], ["tile_k", "sp", [-1, 8]], ["auto_unroll_max_step", "ot", 8], ["unroll_explicit", "ot", 0]]}, "result": [[0.0001917753448275862, 0.00019190195124851368, 0.00019191173127229487], 0, 1.750492811203003, 1688839105.6544917], "version": 0.2, "tvm_version": "0.13.dev0"}
{"input": ["cuda -keys=cuda,gpu -arch=sm_86 -max_num_threads=1024 -thread_warp_size=32", "batch_matmul.cuda", [["TENSOR", [1, 128, 768], "float32"], ["TENSOR", [1, 768, 3072], "float32"], [1, 128, 3072], "float32", 0, 0], {}], "config": {"index": 558011, "code_hash": null, "entity": [["tile_y", "sp", [-1, 8, 2]], ["tile_x", "sp", [-1, 4, 4]], ["tile_k", "sp", [-1, 12]], ["auto_unroll_max_step", "ot", 8], ["unroll_explicit", "ot", 1]]}, "result": [[0.00015746258942307692, 0.00015764873173076922, 0.00015768319615384616], 0, 1.8263120651245117, 1688839107.067], "version": 0.2, "tvm_version": "0.13.dev0"}
{"input": ["cuda -keys=cuda,gpu -arch=sm_86 -max_num_threads=1024 -thread_warp_size=32", "batch_matmul.cuda", [["TENSOR", [1, 128, 768], "float32"], ["TENSOR", [1, 768, 3072], "float32"], [1, 128, 3072], "float32", 0, 0], {}], "config": {"index": 558083, "code_hash": null, "entity": [["tile_y", "sp", [-1, 8, 2]], ["tile_x", "sp", [-1, 8, 4]], ["tile_k", "sp", [-1, 12]], ["auto_unroll_max_step", "ot", 8], ["unroll_explicit", "ot", 1]]}, "result": [[0.000102235337773549, 0.00010268157373929592, 0.0001026835271170314], 0, 1.3936986923217773, 1688839108.051572], "version": 0.2, "tvm_version": "0.13.dev0"}
{"input": ["cuda -keys=cuda,gpu -arch=sm_86 -max_num_threads=1024 -thread_warp_size=32", "batch_matmul.cuda", [["TENSOR", [1, 128, 768], "float32"], ["TENSOR", [1, 768, 3072], "float32"], [1, 128, 3072], "float32", 0, 0], {}], "config": {"index": 558047, "code_hash": null, "entity": [["tile_y", "sp", [-1, 8, 2]], ["tile_x", "sp", [-1, 6, 4]], ["tile_k", "sp", [-1, 12]], ["auto_unroll_max_step", "ot", 8], ["unroll_explicit", "ot", 1]]}, "result": [[0.00012351357420091325, 0.00012351357420091325, 0.00012369132305936075], 0, 1.3920643329620361, 1688839109.0420434], "version": 0.2, "tvm_version": "0.13.dev0"}
{"input": ["cuda -keys=cuda,gpu -arch=sm_86 -max_num_threads=1024 -thread_warp_size=32", "batch_matmul.cuda", [["TENSOR", [1, 128, 768], "float32"], ["TENSOR", [1, 768, 3072], "float32"], [1, 128, 3072], "float32", 0, 0], {}], "config": {"index": 543797, "code_hash": null, "entity": [["tile_y", "sp", [-1, 4, 4]], ["tile_x", "sp", [-1, 6, 4]], ["tile_k", "sp", [-1, 6]], ["auto_unroll_max_step", "ot", 8], ["unroll_explicit", "ot", 1]]}, "result": [[0.00010936258882235531, 0.00010967224151696607, 0.00010968960878243513], 0, 1.4252753257751465, 1688839110.0497851], "version": 0.2, "tvm_version": "0.13.dev0"}
{"input": ["cuda -keys=cuda,gpu -arch=sm_86 -max_num_threads=1024 -thread_warp_size=32", "batch_matmul.cuda", [["TENSOR", [1, 128, 768], "float32"], ["TENSOR", [1, 768, 3072], "float32"], [1, 128, 3072], "float32", 0, 0], {}], "config": {"index": 544410, "code_hash": null, "entity": [["tile_y", "sp", [-1, 8, 4]], ["tile_x", "sp", [-1, 8, 6]], ["tile_k", "sp", [-1, 6]], ["auto_unroll_max_step", "ot", 8], ["unroll_explicit", "ot", 1]]}, "result": [[8.302293012048193e-05, 8.34037686746988e-05, 8.345969879518073e-05], 0, 1.3808693885803223, 1688839111.033554], "version": 0.2, "tvm_version": "0.13.dev0"}
{"input": ["cuda -keys=cuda,gpu -arch=sm_86 -max_num_threads=1024 -thread_warp_size=32", "batch_matmul.cuda", [["TENSOR", [1, 128, 768], "float32"], ["TENSOR", [1, 768, 3072], "float32"], [1, 128, 3072], "float32", 0, 0], {}], "config": {"index": 38316, "code_hash": null, "entity": [["tile_y", "sp", [-1, 16, 2]], ["tile_x", "sp", [-1, 8, 6]], ["tile_k", "sp", [-1, 8]], ["auto_unroll_max_step", "ot", 8], ["unroll_explicit", "ot", 0]]}, "result": [[0.00011569914592760182, 0.00011610120814479637, 0.00011661089366515836], 0, 1.317662000656128, 1688839111.98269], "version": 0.2, "tvm_version": "0.13.dev0"}
{"input": ["cuda -keys=cuda,gpu -arch=sm_86 -max_num_threads=1024 -thread_warp_size=32", "batch_matmul.cuda", [["TENSOR", [1, 128, 768], "float32"], ["TENSOR", [1, 768, 3072], "float32"], [1, 128, 3072], "float32", 0, 0], {}], "config": {"index": 24107, "code_hash": null, "entity": [["tile_y", "sp", [-1, 4, 8]], ["tile_x", "sp", [-1, 16, 6]], ["tile_k", "sp", [-1, 4]], ["auto_unroll_max_step", "ot", 8], ["unroll_explicit", "ot", 0]]}, "result": [[0.00014734621441774492, 0.00014735852587800368, 0.00014750048059149722], 0, 1.7563095092773438, 1688839113.8709106], "version": 0.2, "tvm_version": "0.13.dev0"}
{"input": ["cuda -keys=cuda,gpu -arch=sm_86 -max_num_threads=1024 -thread_warp_size=32", "batch_matmul.cuda", [["TENSOR", [1, 128, 768], "float32"], ["TENSOR", [1, 768, 3072], "float32"], [1, 128, 3072], "float32", 0, 0], {}], "config": {"index": 559885, "code_hash": null, "entity": [["tile_y", "sp", [-1, 32, 2]], ["tile_x", "sp", [-1, 3, 16]], ["tile_k", "sp", [-1, 12]], ["auto_unroll_max_step", "ot", 8], ["unroll_explicit", "ot", 1]]}, "result": [[0.0001549469576923077, 0.00015497845865384614, 0.00015500406057692307], 0, 1.763054370880127, 1688839115.2226834], "version": 0.2, "tvm_version": "0.13.dev0"}
{"input": ["cuda -keys=cuda,gpu -arch=sm_86 -max_num_threads=1024 -thread_warp_size=32", "batch_matmul.cuda", [["TENSOR", [1, 128, 768], "float32"], ["TENSOR", [1, 768, 3072], "float32"], [1, 128, 3072], "float32", 0, 0], {}], "config": {"index": 543431, "code_hash": null, "entity": [["tile_y", "sp", [-1, 8, 2]], ["tile_x", "sp", [-1, 32, 3]], ["tile_k", "sp", [-1, 6]], ["auto_unroll_max_step", "ot", 8], ["unroll_explicit", "ot", 1]]}, "result": [[0.00015546031039755353, 0.00015596271865443424, 0.00015602847859327217], 0, 1.3016529083251953, 1688839116.1778321], "version": 0.2, "tvm_version": "0.13.dev0"}
{"input": ["cuda -keys=cuda,gpu -arch=sm_86 -max_num_threads=1024 -thread_warp_size=32", "batch_matmul.cuda", [["TENSOR", [1, 128, 768], "float32"], ["TENSOR", [1, 768, 3072], "float32"], [1, 128, 3072], "float32", 0, 0], {}], "config": {"index": 31590, "code_hash": null, "entity": [["tile_y", "sp", [-1, 8, 4]], ["tile_x", "sp", [-1, 6, 8]], ["tile_k", "sp", [-1, 6]], ["auto_unroll_max_step", "ot", 8], ["unroll_explicit", "ot", 0]]}, "result": [[0.00010624481315240085, 0.00010672039979123172, 0.00010678780688935282], 0, 1.3477911949157715, 1688839117.147137], "version": 0.2, "tvm_version": "0.13.dev0"}
{"input": ["cuda -keys=cuda,gpu -arch=sm_86 -max_num_threads=1024 -thread_warp_size=32", "batch_matmul.cuda", [["TENSOR", [1, 128, 768], "float32"], ["TENSOR", [1, 768, 3072], "float32"], [1, 128, 3072], "float32", 0, 0], {}], "config": {"index": 550925, "code_hash": null, "entity": [["tile_y", "sp", [-1, 4, 4]], ["tile_x", "sp", [-1, 6, 4]], ["tile_k", "sp", [-1, 8]], ["auto_unroll_max_step", "ot", 8], ["unroll_explicit", "ot", 1]]}, "result": [[0.00013222529545454546, 0.00013265559595959596, 0.00013265712752525254], 0, 1.4093530178070068, 1688839118.1454773], "version": 0.2, "tvm_version": "0.13.dev0"}
{"input": ["cuda -keys=cuda,gpu -arch=sm_86 -max_num_threads=1024 -thread_warp_size=32", "batch_matmul.cuda", [["TENSOR", [1, 128, 768], "float32"], ["TENSOR", [1, 768, 3072], "float32"], [1, 128, 3072], "float32", 0, 0], {}], "config": {"index": 550961, "code_hash": null, "entity": [["tile_y", "sp", [-1, 4, 4]], ["tile_x", "sp", [-1, 8, 4]], ["tile_k", "sp", [-1, 8]], ["auto_unroll_max_step", "ot", 8], ["unroll_explicit", "ot", 1]]}, "result": [[8.900551586655818e-05, 8.90080113913751e-05, 8.903300976403581e-05], 0, 1.4397637844085693, 1688839119.1794903], "version": 0.2, "tvm_version": "0.13.dev0"}
{"input": ["cuda -keys=cuda,gpu -arch=sm_86 -max_num_threads=1024 -thread_warp_size=32", "batch_matmul.cuda", [["TENSOR", [1, 128, 768], "float32"], ["TENSOR", [1, 768, 3072], "float32"], [1, 128, 3072], "float32", 0, 0], {}], "config": {"index": 559560, "code_hash": null, "entity": [["tile_y", "sp", [-1, 16, 2]], ["tile_x", "sp", [-1, 4, 12]], ["tile_k", "sp", [-1, 12]], ["auto_unroll_max_step", "ot", 8], ["unroll_explicit", "ot", 1]]}, "result": [[0.00013548689185580775, 0.00013591446461949265, 0.00013621113484646195], 0, 1.3558449745178223, 1688839120.1402326], "version": 0.2, "tvm_version": "0.13.dev0"}
{"input": ["cuda -keys=cuda,gpu -arch=sm_86 -max_num_threads=1024 -thread_warp_size=32", "batch_matmul.cuda", [["TENSOR", [1, 128, 768], "float32"], ["TENSOR", [1, 768, 3072], "float32"], [1, 128, 3072], "float32", 0, 0], {}], "config": {"index": 46344, "code_hash": null, "entity": [["tile_y", "sp", [-1, 16, 2]], ["tile_x", "sp", [-1, 4, 12]], ["tile_k", "sp", [-1, 12]], ["auto_unroll_max_step", "ot", 8], ["unroll_explicit", "ot", 0]]}, "result": [[0.0001354205656836461, 0.0001357815710455764, 0.00013627131501340483], 0, 1.35792875289917, 1688839121.093662], "version": 0.2, "tvm_version": "0.13.dev0"}
{"input": ["cuda -keys=cuda,gpu -arch=sm_86 -max_num_threads=1024 -thread_warp_size=32", "batch_matmul.cuda", [["TENSOR", [1, 128, 768], "float32"], ["TENSOR", [1, 768, 3072], "float32"], [1, 128, 3072], "float32", 0, 0], {}], "config": {"index": 551502, "code_hash": null, "entity": [["tile_y", "sp", [-1, 8, 4]], ["tile_x", "sp", [-1, 4, 6]], ["tile_k", "sp", [-1, 8]], ["auto_unroll_max_step", "ot", 8], ["unroll_explicit", "ot", 1]]}, "result": [[0.00011440444730941704, 0.00011475458632286995, 0.0001147705470852018], 0, 1.3627064228057861, 1688839122.0561802], "version": 0.2, "tvm_version": "0.13.dev0"}
{"input": ["cuda -keys=cuda,gpu -arch=sm_86 -max_num_threads=1024 -thread_warp_size=32", "batch_matmul.cuda", [["TENSOR", [1, 128, 768], "float32"], ["TENSOR", [1, 768, 3072], "float32"], [1, 128, 3072], "float32", 0, 0], {}], "config": {"index": 44405, "code_hash": null, "entity": [["tile_y", "sp", [-1, 4, 4]], ["tile_x", "sp", [-1, 8, 3]], ["tile_k", "sp", [-1, 12]], ["auto_unroll_max_step", "ot", 8], ["unroll_explicit", "ot", 0]]}, "result": [[0.00010694026556420235, 0.0001076743939688716, 0.00010772818579766536], 0, 1.365224838256836, 1688839123.0811522], "version": 0.2, "tvm_version": "0.13.dev0"}
{"input": ["cuda -keys=cuda,gpu -arch=sm_86 -max_num_threads=1024 -thread_warp_size=32", "batch_matmul.cuda", [["TENSOR", [1, 128, 768], "float32"], ["TENSOR", [1, 768, 3072], "float32"], [1, 128, 3072], "float32", 0, 0], {}], "config": {"index": 46668, "code_hash": null, "entity": [["tile_y", "sp", [-1, 16, 2]], ["tile_x", "sp", [-1, 3, 16]], ["tile_k", "sp", [-1, 12]], ["auto_unroll_max_step", "ot", 8], ["unroll_explicit", "ot", 0]]}, "result": [[0.0001705459004237288, 0.00017055999576271185, 0.00017056542690677967], 0, 1.7545557022094727, 1688839124.4359472], "version": 0.2, "tvm_version": "0.13.dev0"}
{"input": ["cuda -keys=cuda,gpu -arch=sm_86 -max_num_threads=1024 -thread_warp_size=32", "batch_matmul.cuda", [["TENSOR", [1, 128, 768], "float32"], ["TENSOR", [1, 768, 3072], "float32"], [1, 128, 3072], "float32", 0, 0], {}], "config": {"index": 537755, "code_hash": null, "entity": [["tile_y", "sp", [-1, 4, 8]], ["tile_x", "sp", [-1, 12, 8]], ["tile_k", "sp", [-1, 4]], ["auto_unroll_max_step", "ot", 8], ["unroll_explicit", "ot", 1]]}, "result": [[0.00018686575058004642, 0.00018687405220417633, 0.00018719122969837584], 0, 1.7979495525360107, 1688839125.8086042], "version": 0.2, "tvm_version": "0.13.dev0"}
{"input": ["cuda -keys=cuda,gpu -arch=sm_86 -max_num_threads=1024 -thread_warp_size=32", "batch_matmul.cuda", [["TENSOR", [1, 128, 768], "float32"], ["TENSOR", [1, 768, 3072], "float32"], [1, 128, 3072], "float32", 0, 0], {}], "config": {"index": 537647, "code_hash": null, "entity": [["tile_y", "sp", [-1, 4, 8]], ["tile_x", "sp", [-1, 4, 8]], ["tile_k", "sp", [-1, 4]], ["auto_unroll_max_step", "ot", 8], ["unroll_explicit", "ot", 1]]}, "result": [[0.00013743740793918918, 0.0001377513471283784, 0.0001383551385135135], 0, 1.7856788635253906, 1688839127.1688123], "version": 0.2, "tvm_version": "0.13.dev0"}
{"input": ["cuda -keys=cuda,gpu -arch=sm_86 -max_num_threads=1024 -thread_warp_size=32", "batch_matmul.cuda", [["TENSOR", [1, 128, 768], "float32"], ["TENSOR", [1, 768, 3072], "float32"], [1, 128, 3072], "float32", 0, 0], {}], "config": {"index": 47137, "code_hash": null, "entity": [["tile_y", "sp", [-1, 32, 2]], ["tile_x", "sp", [-1, 2, 24]], ["tile_k", "sp", [-1, 12]], ["auto_unroll_max_step", "ot", 8], ["unroll_explicit", "ot", 0]]}, "result": [[0.0001862181728110599, 0.00018706756797235024, 0.00018709353225806452], 0, 1.797201156616211, 1688839128.5548215], "version": 0.2, "tvm_version": "0.13.dev0"}
{"input": ["cuda -keys=cuda,gpu -arch=sm_86 -max_num_threads=1024 -thread_warp_size=32", "batch_matmul.cuda", [["TENSOR", [1, 128, 768], "float32"], ["TENSOR", [1, 768, 3072], "float32"], [1, 128, 3072], "float32", 0, 0], {}], "config": {"index": 537251, "code_hash": null, "entity": [["tile_y", "sp", [-1, 4, 8]], ["tile_x", "sp", [-1, 4, 6]], ["tile_k", "sp", [-1, 4]], ["auto_unroll_max_step", "ot", 8], ["unroll_explicit", "ot", 1]]}, "result": [[0.00013416705562913908, 0.00013432459470198675, 0.00013434473377483443], 0, 1.3722429275512695, 1688839129.5248427], "version": 0.2, "tvm_version": "0.13.dev0"}
{"input": ["cuda -keys=cuda,gpu -arch=sm_86 -max_num_threads=1024 -thread_warp_size=32", "batch_matmul.cuda", [["TENSOR", [1, 128, 768], "float32"], ["TENSOR", [1, 768, 3072], "float32"], [1, 128, 3072], "float32", 0, 0], {}], "config": {"index": 52536, "code_hash": null, "entity": [["tile_y", "sp", [-1, 16, 2]], ["tile_x", "sp", [-1, 4, 6]], ["tile_k", "sp", [-1, 16]], ["auto_unroll_max_step", "ot", 8], ["unroll_explicit", "ot", 0]]}, "result": [[0.00019853036319018402, 0.00019854028588957054, 0.00019854919754601228], 0, 1.7473130226135254, 1688839130.8949482], "version": 0.2, "tvm_version": "0.13.dev0"}
{"input": ["cuda -keys=cuda,gpu -arch=sm_86 -max_num_threads=1024 -thread_warp_size=32", "batch_matmul.cuda", [["TENSOR", [1, 128, 768], "float32"], ["TENSOR", [1, 768, 3072], "float32"], [1, 128, 3072], "float32", 0, 0], {}], "config": {"index": 565752, "code_hash": null, "entity": [["tile_y", "sp", [-1, 16, 2]], ["tile_x", "sp", [-1, 4, 6]], ["tile_k", "sp", [-1, 16]], ["auto_unroll_max_step", "ot", 8], ["unroll_explicit", "ot", 1]]}, "result": [[0.00019852281717791412, 0.0001985316171779141, 0.00019853275950920245], 0, 1.7315177917480469, 1688839133.0146546], "version": 0.2, "tvm_version": "0.13.dev0"}
{"input": ["cuda -keys=cuda,gpu -arch=sm_86 -max_num_threads=1024 -thread_warp_size=32", "batch_matmul.cuda", [["TENSOR", [1, 128, 768], "float32"], ["TENSOR", [1, 768, 3072], "float32"], [1, 128, 3072], "float32", 0, 0], {}], "config": {"index": 45443, "code_hash": null, "entity": [["tile_y", "sp", [-1, 8, 2]], ["tile_x", "sp", [-1, 8, 6]], ["tile_k", "sp", [-1, 12]], ["auto_unroll_max_step", "ot", 8], ["unroll_explicit", "ot", 0]]}, "result": [[0.0001239449609929078, 0.00012419086879432624, 0.00012419801063829787], 0, 1.3807709217071533, 1688839134.0175076], "version": 0.2, "tvm_version": "0.13.dev0"}
{"input": ["cuda -keys=cuda,gpu -arch=sm_86 -max_num_threads=1024 -thread_warp_size=32", "batch_matmul.cuda", [["TENSOR", [1, 128, 768], "float32"], ["TENSOR", [1, 768, 3072], "float32"], [1, 128, 3072], "float32", 0, 0], {}], "config": {"index": 558659, "code_hash": null, "entity": [["tile_y", "sp", [-1, 8, 2]], ["tile_x", "sp", [-1, 8, 6]], ["tile_k", "sp", [-1, 12]], ["auto_unroll_max_step", "ot", 8], ["unroll_explicit", "ot", 1]]}, "result": [[0.00012438921513002364, 0.00012440627777777778, 0.00012440843262411346], 0, 1.3748741149902344, 1688839134.9865284], "version": 0.2, "tvm_version": "0.13.dev0"}
{"input": ["cuda -keys=cuda,gpu -arch=sm_86 -max_num_threads=1024 -thread_warp_size=32", "batch_matmul.cuda", [["TENSOR", [1, 128, 768], "float32"], ["TENSOR", [1, 768, 3072], "float32"], [1, 128, 3072], "float32", 0, 0], {}], "config": {"index": 37277, "code_hash": null, "entity": [["tile_y", "sp", [-1, 4, 4]], ["tile_x", "sp", [-1, 8, 3]], ["tile_k", "sp", [-1, 8]], ["auto_unroll_max_step", "ot", 8], ["unroll_explicit", "ot", 0]]}, "result": [[0.00012193635260115607, 0.00012194586011560694, 0.00012199450289017342], 0, 1.3493387699127197, 1688839135.968335], "version": 0.2, "tvm_version": "0.13.dev0"}
{"input": ["cuda -keys=cuda,gpu -arch=sm_86 -max_num_threads=1024 -thread_warp_size=32", "batch_matmul.cuda", [["TENSOR", [1, 128, 768], "float32"], ["TENSOR", [1, 768, 3072], "float32"], [1, 128, 3072], "float32", 0, 0], {}], "config": {"index": 543935, "code_hash": null, "entity": [["tile_y", "sp", [-1, 8, 2]], ["tile_x", "sp", [-1, 24, 4]], ["tile_k", "sp", [-1, 6]], ["auto_unroll_max_step", "ot", 8], ["unroll_explicit", "ot", 1]]}, "result": [[0.00010807266496945011, 0.00010834482892057026, 0.00010853262729124236], 0, 1.389312505722046, 1688839136.960039], "version": 0.2, "tvm_version": "0.13.dev0"}
{"input": ["cuda -keys=cuda,gpu -arch=sm_86 -max_num_threads=1024 -thread_warp_size=32", "batch_matmul.cuda", [["TENSOR", [1, 128, 768], "float32"], ["TENSOR", [1, 768, 3072], "float32"], [1, 128, 3072], "float32", 0, 0], {}], "config": {"index": 544451, "code_hash": null, "entity": [["tile_y", "sp", [-1, 4, 8]], ["tile_x", "sp", [-1, 16, 6]], ["tile_k", "sp", [-1, 6]], ["auto_unroll_max_step", "ot", 8], ["unroll_explicit", "ot", 1]]}, "result": [[0.00015021033645735708, 0.00015033216307403936, 0.00015036004967197749], 0, 1.7827816009521484, 1688839138.3268695], "version": 0.2, "tvm_version": "0.13.dev0"}
{"input": ["cuda -keys=cuda,gpu -arch=sm_86 -max_num_threads=1024 -thread_warp_size=32", "batch_matmul.cuda", [["TENSOR", [1, 128, 768], "float32"], ["TENSOR", [1, 768, 3072], "float32"], [1, 128, 3072], "float32", 0, 0], {}], "config": {"index": 537642, "code_hash": null, "entity": [["tile_y", "sp", [-1, 8, 4]], ["tile_x", "sp", [-1, 4, 8]], ["tile_k", "sp", [-1, 4]], ["auto_unroll_max_step", "ot", 8], ["unroll_explicit", "ot", 1]]}, "result": [[0.0001089001435246996, 0.00010893431842456608, 0.000109405303070761], 0, 1.765995740890503, 1688839139.6834214], "version": 0.2, "tvm_version": "0.13.dev0"}
{"input": ["cuda -keys=cuda,gpu -arch=sm_86 -max_num_threads=1024 -thread_warp_size=32", "batch_matmul.cuda", [["TENSOR", [1, 128, 768], "float32"], ["TENSOR", [1, 768, 3072], "float32"], [1, 128, 3072], "float32", 0, 0], {}], "config": {"index": 558119, "code_hash": null, "entity": [["tile_y", "sp", [-1, 8, 2]], ["tile_x", "sp", [-1, 12, 4]], ["tile_k", "sp", [-1, 12]], ["auto_unroll_max_step", "ot", 8], ["unroll_explicit", "ot", 1]]}, "result": [[0.00011406924468085106, 0.0001140964744680851, 0.00011410192021276596], 0, 1.3970305919647217, 1688839140.6781402], "version": 0.2, "tvm_version": "0.13.dev0"}
{"input": ["cuda -keys=cuda,gpu -arch=sm_86 -max_num_threads=1024 -thread_warp_size=32", "batch_matmul.cuda", [["TENSOR", [1, 128, 768], "float32"], ["TENSOR", [1, 768, 3072], "float32"], [1, 128, 3072], "float32", 0, 0], {}], "config": {"index": 31584, "code_hash": null, "entity": [["tile_y", "sp", [-1, 16, 2]], ["tile_x", "sp", [-1, 6, 8]], ["tile_k", "sp", [-1, 6]], ["auto_unroll_max_step", "ot", 8], ["unroll_explicit", "ot", 0]]}, "result": [[0.00014330143447669304, 0.00014359776605101142, 0.0001446307739665787], 0, 1.735241413116455, 1688839142.054292], "version": 0.2, "tvm_version": "0.13.dev0"}
{"input": ["cuda -keys=cuda,gpu -arch=sm_86 -max_num_threads=1024 -thread_warp_size=32", "batch_matmul.cuda", [["TENSOR", [1, 128, 768], "float32"], ["TENSOR", [1, 768, 3072], "float32"], [1, 128, 3072], "float32", 0, 0], {}], "config": {"index": 44837, "code_hash": null, "entity": [["tile_y", "sp", [-1, 4, 4]], ["tile_x", "sp", [-1, 6, 4]], ["tile_k", "sp", [-1, 12]], ["auto_unroll_max_step", "ot", 8], ["unroll_explicit", "ot", 0]]}, "result": [[0.00010973746840521564, 0.00010974465396188566, 0.00010984222868605818], 0, 1.4375178813934326, 1688839143.0954432], "version": 0.2, "tvm_version": "0.13.dev0"}
{"input": ["cuda -keys=cuda,gpu -arch=sm_86 -max_num_threads=1024 -thread_warp_size=32", "batch_matmul.cuda", [["TENSOR", [1, 128, 768], "float32"], ["TENSOR", [1, 768, 3072], "float32"], [1, 128, 3072], "float32", 0, 0], {}], "config": {"index": 538182, "code_hash": null, "entity": [["tile_y", "sp", [-1, 8, 4]], ["tile_x", "sp", [-1, 4, 12]], ["tile_k", "sp", [-1, 4]], ["auto_unroll_max_step", "ot", 8], ["unroll_explicit", "ot", 1]]}, "result": [[0.00015317218833652008, 0.00015340417686424474, 0.000153413017208413], 0, 1.780780553817749, 1688839144.4652078], "version": 0.2, "tvm_version": "0.13.dev0"}
{"input": ["cuda -keys=cuda,gpu -arch=sm_86 -max_num_threads=1024 -thread_warp_size=32", "batch_matmul.cuda", [["TENSOR", [1, 128, 768], "float32"], ["TENSOR", [1, 768, 3072], "float32"], [1, 128, 3072], "float32", 0, 0], {}], "config": {"index": 44795, "code_hash": null, "entity": [["tile_y", "sp", [-1, 8, 2]], ["tile_x", "sp", [-1, 4, 4]], ["tile_k", "sp", [-1, 12]], ["auto_unroll_max_step", "ot", 8], ["unroll_explicit", "ot", 0]]}, "result": [[0.00018662167395264116, 0.0001869592714025501, 0.00018825372495446266], 0, 1.4210915565490723, 1688839145.4835486], "version": 0.2, "tvm_version": "0.13.dev0"}
{"input": ["cuda -keys=cuda,gpu -arch=sm_86 -max_num_threads=1024 -thread_warp_size=32", "batch_matmul.cuda", [["TENSOR", [1, 128, 768], "float32"], ["TENSOR", [1, 768, 3072], "float32"], [1, 128, 3072], "float32", 0, 0], {}], "config": {"index": 551531, "code_hash": null, "entity": [["tile_y", "sp", [-1, 8, 2]], ["tile_x", "sp", [-1, 8, 6]], ["tile_k", "sp", [-1, 8]], ["auto_unroll_max_step", "ot", 8], ["unroll_explicit", "ot", 1]]}, "result": [[0.00012089409059633027, 0.00012104102637614679, 0.00012152484518348624], 0, 1.3749749660491943, 1688839146.4681184], "version": 0.2, "tvm_version": "0.13.dev0"}
{"input": ["cuda -keys=cuda,gpu -arch=sm_86 -max_num_threads=1024 -thread_warp_size=32", "batch_matmul.cuda", [["TENSOR", [1, 128, 768], "float32"], ["TENSOR", [1, 768, 3072], "float32"], [1, 128, 3072], "float32", 0, 0], {}], "config": {"index": 810838, "code_hash": null, "entity": [["tile_y", "sp", [-1, 4, 2]], ["tile_x", "sp", [-1, 3, 64]], ["tile_k", "sp", [-1, 8]], ["auto_unroll_max_step", "ot", 32], ["unroll_explicit", "ot", 1]]}, "result": [[0.000557598124567474, 0.0005593520415224913, 0.0005594760657439446], 0, 2.0197887420654297, 1688839147.8353717], "version": 0.2, "tvm_version": "0.13.dev0"}
{"input": ["cuda -keys=cuda,gpu -arch=sm_86 -max_num_threads=1024 -thread_warp_size=32", "batch_matmul.cuda", [["TENSOR", [1, 128, 768], "float32"], ["TENSOR", [1, 768, 3072], "float32"], [1, 128, 3072], "float32", 0, 0], {}], "config": {"index": 302332, "code_hash": null, "entity": [["tile_y", "sp", [-1, 16, 1]], ["tile_x", "sp", [-1, 2, 8]], ["tile_k", "sp", [-1, 12]], ["auto_unroll_max_step", "ot", 32], ["unroll_explicit", "ot", 0]]}, "result": [[0.00024596864133738603, 0.0002467233024316109, 0.00024711703951367785], 0, 1.7432513236999512, 1688839149.1944547], "version": 0.2, "tvm_version": "0.13.dev0"}
{"input": ["cuda -keys=cuda,gpu -arch=sm_86 -max_num_threads=1024 -thread_warp_size=32", "batch_matmul.cuda", [["TENSOR", [1, 128, 768], "float32"], ["TENSOR", [1, 768, 3072], "float32"], [1, 128, 3072], "float32", 0, 0], {}], "config": {"index": 269438, "code_hash": null, "entity": [["tile_y", "sp", [-1, 64, 2]], ["tile_x", "sp", [-1, 2, 96]], ["tile_k", "sp", [-1, 2]], ["auto_unroll_max_step", "ot", 32], ["unroll_explicit", "ot", 0]]}, "result": [[0.001179840705882353, 0.0011799009411764705, 0.001179970588235294], 0, 1.5427124500274658, 1688839150.150485], "version": 0.2, "tvm_version": "0.13.dev0"}
{"input": ["cuda -keys=cuda,gpu -arch=sm_86 -max_num_threads=1024 -thread_warp_size=32", "batch_matmul.cuda", [["TENSOR", [1, 128, 768], "float32"], ["TENSOR", [1, 768, 3072], "float32"], [1, 128, 3072], "float32", 0, 0], {}], "config": {"index": 929322, "code_hash": null, "entity": [["tile_y", "sp", [-1, 8, 4]], ["tile_x", "sp", [-1, 8, 6]], ["tile_k", "sp", [-1, 6]], ["auto_unroll_max_step", "ot", 64], ["unroll_explicit", "ot", 1]]}, "result": [[8.359662284122562e-05, 8.359719275766015e-05, 8.416652813370472e-05], 0, 1.8461661338806152, 1688839177.616283], "version": 0.2, "tvm_version": "0.13.dev0"}
{"input": ["cuda -keys=cuda,gpu -arch=sm_86 -max_num_threads=1024 -thread_warp_size=32", "batch_matmul.cuda", [["TENSOR", [1, 128, 768], "float32"], ["TENSOR", [1, 768, 3072], "float32"], [1, 128, 3072], "float32", 0, 0], {}], "config": {"index": 801018, "code_hash": null, "entity": [["tile_y", "sp", [-1, 8, 4]], ["tile_x", "sp", [-1, 8, 6]], ["tile_k", "sp", [-1, 6]], ["auto_unroll_max_step", "ot", 32], ["unroll_explicit", "ot", 1]]}, "result": [[8.356337408906883e-05, 8.35700089068826e-05, 8.362053603238866e-05], 0, 1.3950068950653076, 1688839178.5823941], "version": 0.2, "tvm_version": "0.13.dev0"}
{"input": ["cuda -keys=cuda,gpu -arch=sm_86 -max_num_threads=1024 -thread_warp_size=32", "batch_matmul.cuda", [["TENSOR", [1, 128, 768], "float32"], ["TENSOR", [1, 768, 3072], "float32"], [1, 128, 3072], "float32", 0, 0], {}], "config": {"index": 672714, "code_hash": null, "entity": [["tile_y", "sp", [-1, 8, 4]], ["tile_x", "sp", [-1, 8, 6]], ["tile_k", "sp", [-1, 6]], ["auto_unroll_max_step", "ot", 16], ["unroll_explicit", "ot", 1]]}, "result": [[8.309191967871485e-05, 8.311178634538153e-05, 8.315375742971886e-05], 0, 1.3669710159301758, 1688839179.5500982], "version": 0.2, "tvm_version": "0.13.dev0"}
{"input": ["cuda -keys=cuda,gpu -arch=sm_86 -max_num_threads=1024 -thread_warp_size=32", "batch_matmul.cuda", [["TENSOR", [1, 128, 768], "float32"], ["TENSOR", [1, 768, 3072], "float32"], [1, 128, 3072], "float32", 0, 0], {}], "config": {"index": 543870, "code_hash": null, "entity": [["tile_y", "sp", [-1, 8, 4]], ["tile_x", "sp", [-1, 12, 4]], ["tile_k", "sp", [-1, 6]], ["auto_unroll_max_step", "ot", 8], ["unroll_explicit", "ot", 1]]}, "result": [[8.391156629392971e-05, 8.405551357827476e-05, 8.421909424920127e-05], 0, 1.3609459400177002, 1688839180.511322], "version": 0.2, "tvm_version": "0.13.dev0"}
{"input": ["cuda -keys=cuda,gpu -arch=sm_86 -max_num_threads=1024 -thread_warp_size=32", "batch_matmul.cuda", [["TENSOR", [1, 128, 768], "float32"], ["TENSOR", [1, 768, 3072], "float32"], [1, 128, 3072], "float32", 0, 0], {}], "config": {"index": 543834, "code_hash": null, "entity": [["tile_y", "sp", [-1, 8, 4]], ["tile_x", "sp", [-1, 8, 4]], ["tile_k", "sp", [-1, 6]], ["auto_unroll_max_step", "ot", 8], ["unroll_explicit", "ot", 1]]}, "result": [[7.564855150214592e-05, 7.58660929899857e-05, 7.586902360515023e-05], 0, 1.3941349983215332, 1688839181.5018425], "version": 0.2, "tvm_version": "0.13.dev0"}
