results/cuda_rtx3080/mobilenet/gridsearch/cpu.log_layer_13.log
{"input": ["cuda -keys=cuda,gpu -arch=sm_86 -max_num_threads=1024 -thread_warp_size=32", "depthwise_conv2d_nchw.cuda", [["TENSOR", [1, 512, 14, 14], "float32"], ["TENSOR", [512, 1, 3, 3], "float32"], [1, 1], [1, 1, 1, 1], [1, 1], "float32"], {}], "config": {"index": 0, "code_hash": null, "entity": [["tile_f", "sp", [-1, 1, 1, 1]], ["tile_y", "sp", [-1, 1, 1, 1]], ["tile_x", "sp", [-1, 1, 1, 1]], ["auto_unroll_max_step", "ot", 0], ["unroll_explicit", "ot", 0]]}, "result": [[6.092800179694519e-05, 6.0937632973944285e-05, 6.093996361185984e-05], 0, 1.4609169960021973, 1678500177.0544071], "version": 0.2, "tvm_version": "0.10.0"}
{"input": ["cuda -keys=cuda,gpu -arch=sm_86 -max_num_threads=1024 -thread_warp_size=32", "depthwise_conv2d_nchw.cuda", [["TENSOR", [1, 512, 14, 14], "float32"], ["TENSOR", [512, 1, 3, 3], "float32"], [1, 1], [1, 1, 1, 1], [1, 1], "float32"], {}], "config": {"index": 1, "code_hash": null, "entity": [["tile_f", "sp", [-1, 2, 1, 1]], ["tile_y", "sp", [-1, 1, 1, 1]], ["tile_x", "sp", [-1, 1, 1, 1]], ["auto_unroll_max_step", "ot", 0], ["unroll_explicit", "ot", 0]]}, "result": [[5.4579181502086236e-05, 5.4579627260083454e-05, 5.4580337969401945e-05], 0, 1.574340581893921, 1678500178.255909], "version": 0.2, "tvm_version": "0.10.0"}
{"input": ["cuda -keys=cuda,gpu -arch=sm_86 -max_num_threads=1024 -thread_warp_size=32", "depthwise_conv2d_nchw.cuda", [["TENSOR", [1, 512, 14, 14], "float32"], ["TENSOR", [512, 1, 3, 3], "float32"], [1, 1], [1, 1, 1, 1], [1, 1], "float32"], {}], "config": {"index": 2, "code_hash": null, "entity": [["tile_f", "sp", [-1, 4, 1, 1]], ["tile_y", "sp", [-1, 1, 1, 1]], ["tile_x", "sp", [-1, 1, 1, 1]], ["auto_unroll_max_step", "ot", 0], ["unroll_explicit", "ot", 0]]}, "result": [[5.350309227614491e-05, 5.350382262474368e-05, 5.3504875939849627e-05], 0, 1.6057863235473633, 1678500179.4612877], "version": 0.2, "tvm_version": "0.10.0"}
{"input": ["cuda -keys=cuda,gpu -arch=sm_86 -max_num_threads=1024 -thread_warp_size=32", "depthwise_conv2d_nchw.cuda", [["TENSOR", [1, 512, 14, 14], "float32"], ["TENSOR", [512, 1, 3, 3], "float32"], [1, 1], [1, 1, 1, 1], [1, 1], "float32"], {}], "config": {"index": 3, "code_hash": null, "entity": [["tile_f", "sp", [-1, 8, 1, 1]], ["tile_y", "sp", [-1, 1, 1, 1]], ["tile_x", "sp", [-1, 1, 1, 1]], ["auto_unroll_max_step", "ot", 0], ["unroll_explicit", "ot", 0]]}, "result": [[7.422964168618268e-05, 7.423448758782203e-05, 7.423491615925059e-05], 0, 1.6932001113891602, 1678500180.674963], "version": 0.2, "tvm_version": "0.10.0"}
{"input": ["cuda -keys=cuda,gpu -arch=sm_86 -max_num_threads=1024 -thread_warp_size=32", "depthwise_conv2d_nchw.cuda", [["TENSOR", [1, 512, 14, 14], "float32"], ["TENSOR", [512, 1, 3, 3], "float32"], [1, 1], [1, 1, 1, 1], [1, 1], "float32"], {}], "config": {"index": 4, "code_hash": null, "entity": [["tile_f", "sp", [-1, 16, 1, 1]], ["tile_y", "sp", [-1, 1, 1, 1]], ["tile_x", "sp", [-1, 1, 1, 1]], ["auto_unroll_max_step", "ot", 0], ["unroll_explicit", "ot", 0]]}, "result": [[7.452315558698727e-05, 7.45275011786893e-05, 7.45298533710514e-05], 0, 1.8069334030151367, 1678500181.877377], "version": 0.2, "tvm_version": "0.10.0"}
{"input": ["cuda -keys=cuda,gpu -arch=sm_86 -max_num_threads=1024 -thread_warp_size=32", "depthwise_conv2d_nchw.cuda", [["TENSOR", [1, 512, 14, 14], "float32"], ["TENSOR", [512, 1, 3, 3], "float32"], [1, 1], [1, 1, 1, 1], [1, 1], "float32"], {}], "config": {"index": 5, "code_hash": null, "entity": [["tile_f", "sp", [-1, 32, 1, 1]], ["tile_y", "sp", [-1, 1, 1, 1]], ["tile_x", "sp", [-1, 1, 1, 1]], ["auto_unroll_max_step", "ot", 0], ["unroll_explicit", "ot", 0]]}, "result": [[0.00019503022168087698, 0.00019508268818514007, 0.0001950925761266748], 0, 1.9876985549926758, 1678500183.1061435], "version": 0.2, "tvm_version": "0.10.0"}
{"input": ["cuda -keys=cuda,gpu -arch=sm_86 -max_num_threads=1024 -thread_warp_size=32", "depthwise_conv2d_nchw.cuda", [["TENSOR", [1, 512, 14, 14], "float32"], ["TENSOR", [512, 1, 3, 3], "float32"], [1, 1], [1, 1, 1, 1], [1, 1], "float32"], {}], "config": {"index": 6, "code_hash": null, "entity": [["tile_f", "sp", [-1, 64, 1, 1]], ["tile_y", "sp", [-1, 1, 1, 1]], ["tile_x", "sp", [-1, 1, 1, 1]], ["auto_unroll_max_step", "ot", 0], ["unroll_explicit", "ot", 0]]}, "result": [[0.0007118039641255605, 0.0007119823497757847, 0.0007121473901345291], 0, 2.6777920722961426, 1678500184.3256671], "version": 0.2, "tvm_version": "0.10.0"}
{"input": ["cuda -keys=cuda,gpu -arch=sm_86 -max_num_threads=1024 -thread_warp_size=32", "depthwise_conv2d_nchw.cuda", [["TENSOR", [1, 512, 14, 14], "float32"], ["TENSOR", [512, 1, 3, 3], "float32"], [1, 1], [1, 1, 1, 1], [1, 1], "float32"], {}], "config": {"index": 7, "code_hash": null, "entity": [["tile_f", "sp", [-1, 128, 1, 1]], ["tile_y", "sp", [-1, 1, 1, 1]], ["tile_x", "sp", [-1, 1, 1, 1]], ["auto_unroll_max_step", "ot", 0], ["unroll_explicit", "ot", 0]]}, "result": [[0.0007888348267326733, 0.0007888450198019803, 0.0007889311336633664], 0, 4.99101185798645, 1678500185.545166], "version": 0.2, "tvm_version": "0.10.0"}
{"input": ["cuda -keys=cuda,gpu -arch=sm_86 -max_num_threads=1024 -thread_warp_size=32", "depthwise_conv2d_nchw.cuda", [["TENSOR", [1, 512, 14, 14], "float32"], ["TENSOR", [512, 1, 3, 3], "float32"], [1, 1], [1, 1, 1, 1], [1, 1], "float32"], {}], "config": {"index": 8, "code_hash": null, "entity": [["tile_f", "sp", [-1, 256, 1, 1]], ["tile_y", "sp", [-1, 1, 1, 1]], ["tile_x", "sp", [-1, 1, 1, 1]], ["auto_unroll_max_step", "ot", 0], ["unroll_explicit", "ot", 0]]}, "result": [[0.0014053973055555553, 0.001405980847222222, 0.001405994625], 0, 4.147439956665039, 1678500186.3836546], "version": 0.2, "tvm_version": "0.10.0"}
{"input": ["cuda -keys=cuda,gpu -arch=sm_86 -max_num_threads=1024 -thread_warp_size=32", "depthwise_conv2d_nchw.cuda", [["TENSOR", [1, 512, 14, 14], "float32"], ["TENSOR", [512, 1, 3, 3], "float32"], [1, 1], [1, 1, 1, 1], [1, 1], "float32"], {}], "config": {"index": 9, "code_hash": null, "entity": [["tile_f", "sp", [-1, 512, 1, 1]], ["tile_y", "sp", [-1, 1, 1, 1]], ["tile_x", "sp", [-1, 1, 1, 1]], ["auto_unroll_max_step", "ot", 0], ["unroll_explicit", "ot", 0]]}, "result": [[0.0022525724444444443, 0.002252684866666667, 0.0022535281555555553], 0, 3.674872636795044, 1678500187.219949], "version": 0.2, "tvm_version": "0.10.0"}
{"input": ["cuda -keys=cuda,gpu -arch=sm_86 -max_num_threads=1024 -thread_warp_size=32", "depthwise_conv2d_nchw.cuda", [["TENSOR", [1, 512, 14, 14], "float32"], ["TENSOR", [512, 1, 3, 3], "float32"], [1, 1], [1, 1, 1, 1], [1, 1], "float32"], {}], "config": {"index": 10, "code_hash": null, "entity": [["tile_f", "sp", [-1, 1, 2, 1]], ["tile_y", "sp", [-1, 1, 1, 1]], ["tile_x", "sp", [-1, 1, 1, 1]], ["auto_unroll_max_step", "ot", 0], ["unroll_explicit", "ot", 0]]}, "result": [[7.132946451033244e-05, 7.132992362982928e-05, 7.133212398921832e-05], 0, 1.582160472869873, 1678500188.414042], "version": 0.2, "tvm_version": "0.10.0"}
{"input": ["cuda -keys=cuda,gpu -arch=sm_86 -max_num_threads=1024 -thread_warp_size=32", "depthwise_conv2d_nchw.cuda", [["TENSOR", [1, 512, 14, 14], "float32"], ["TENSOR", [512, 1, 3, 3], "float32"], [1, 1], [1, 1, 1, 1], [1, 1], "float32"], {}], "config": {"index": 11, "code_hash": null, "entity": [["tile_f", "sp", [-1, 2, 2, 1]], ["tile_y", "sp", [-1, 1, 1, 1]], ["tile_x", "sp", [-1, 1, 1, 1]], ["auto_unroll_max_step", "ot", 0], ["unroll_explicit", "ot", 0]]}, "result": [[6.903443843447669e-05, 6.903489489885664e-05, 6.903534432717678e-05], 0, 1.6289231777191162, 1678500189.6260748], "version": 0.2, "tvm_version": "0.10.0"}
{"input": ["cuda -keys=cuda,gpu -arch=sm_86 -max_num_threads=1024 -thread_warp_size=32", "depthwise_conv2d_nchw.cuda", [["TENSOR", [1, 512, 14, 14], "float32"], ["TENSOR", [512, 1, 3, 3], "float32"], [1, 1], [1, 1, 1, 1], [1, 1], "float32"], {}], "config": {"index": 12, "code_hash": null, "entity": [["tile_f", "sp", [-1, 4, 2, 1]], ["tile_y", "sp", [-1, 1, 1, 1]], ["tile_x", "sp", [-1, 1, 1, 1]], ["auto_unroll_max_step", "ot", 0], ["unroll_explicit", "ot", 0]]}, "result": [[7.518040085388994e-05, 7.51804444971537e-05, 7.518530882352942e-05], 0, 1.628206729888916, 1678500190.8374023], "version": 0.2, "tvm_version": "0.10.0"}
{"input": ["cuda -keys=cuda,gpu -arch=sm_86 -max_num_threads=1024 -thread_warp_size=32", "depthwise_conv2d_nchw.cuda", [["TENSOR", [1, 512, 14, 14], "float32"], ["TENSOR", [512, 1, 3, 3], "float32"], [1, 1], [1, 1, 1, 1], [1, 1], "float32"], {}], "config": {"index": 13, "code_hash": null, "entity": [["tile_f", "sp", [-1, 8, 2, 1]], ["tile_y", "sp", [-1, 1, 1, 1]], ["tile_x", "sp", [-1, 1, 1, 1]], ["auto_unroll_max_step", "ot", 0], ["unroll_explicit", "ot", 0]]}, "result": [[8.225105827746262e-05, 8.225376534296029e-05, 8.225481949458484e-05], 0, 1.7293026447296143, 1678500192.0593152], "version": 0.2, "tvm_version": "0.10.0"}
{"input": ["cuda -keys=cuda,gpu -arch=sm_86 -max_num_threads=1024 -thread_warp_size=32", "depthwise_conv2d_nchw.cuda", [["TENSOR", [1, 512, 14, 14], "float32"], ["TENSOR", [512, 1, 3, 3], "float32"], [1, 1], [1, 1, 1, 1], [1, 1], "float32"], {}], "config": {"index": 14, "code_hash": null, "entity": [["tile_f", "sp", [-1, 16, 2, 1]], ["tile_y", "sp", [-1, 1, 1, 1]], ["tile_x", "sp", [-1, 1, 1, 1]], ["auto_unroll_max_step", "ot", 0], ["unroll_explicit", "ot", 0]]}, "result": [[8.628570362358032e-05, 8.629290805840995e-05, 8.62973396430503e-05], 0, 1.794137716293335, 1678500193.2790163], "version": 0.2, "tvm_version": "0.10.0"}
{"input": ["cuda -keys=cuda,gpu -arch=sm_86 -max_num_threads=1024 -thread_warp_size=32", "depthwise_conv2d_nchw.cuda", [["TENSOR", [1, 512, 14, 14], "float32"], ["TENSOR", [512, 1, 3, 3], "float32"], [1, 1], [1, 1, 1, 1], [1, 1], "float32"], {}], "config": {"index": 15, "code_hash": null, "entity": [["tile_f", "sp", [-1, 32, 2, 1]], ["tile_y", "sp", [-1, 1, 1, 1]], ["tile_x", "sp", [-1, 1, 1, 1]], ["auto_unroll_max_step", "ot", 0], ["unroll_explicit", "ot", 0]]}, "result": [[0.00010460894171578258, 0.00010461621611001964, 0.0001046317249508841], 0, 2.108994245529175, 1678500194.4996436], "version": 0.2, "tvm_version": "0.10.0"}
{"input": ["cuda -keys=cuda,gpu -arch=sm_86 -max_num_threads=1024 -thread_warp_size=32", "depthwise_conv2d_nchw.cuda", [["TENSOR", [1, 512, 14, 14], "float32"], ["TENSOR", [512, 1, 3, 3], "float32"], [1, 1], [1, 1, 1, 1], [1, 1], "float32"], {}], "config": {"index": 16, "code_hash": null, "entity": [["tile_f", "sp", [-1, 64, 2, 1]], ["tile_y", "sp", [-1, 1, 1, 1]], ["tile_x", "sp", [-1, 1, 1, 1]], ["auto_unroll_max_step", "ot", 0], ["unroll_explicit", "ot", 0]]}, "result": [[0.0004267650084745763, 0.00042678238135593214, 0.0004274650169491526], 0, 2.6825480461120605, 1678500199.387279], "version": 0.2, "tvm_version": "0.10.0"}
{"input": ["cuda -keys=cuda,gpu -arch=sm_86 -max_num_threads=1024 -thread_warp_size=32", "depthwise_conv2d_nchw.cuda", [["TENSOR", [1, 512, 14, 14], "float32"], ["TENSOR", [512, 1, 3, 3], "float32"], [1, 1], [1, 1, 1, 1], [1, 1], "float32"], {}], "config": {"index": 17, "code_hash": null, "entity": [["tile_f", "sp", [-1, 128, 2, 1]], ["tile_y", "sp", [-1, 1, 1, 1]], ["tile_x", "sp", [-1, 1, 1, 1]], ["auto_unroll_max_step", "ot", 0], ["unroll_explicit", "ot", 0]]}, "result": [[0.0006025409018867924, 0.0006028268452830188, 0.000602838479245283], 0, 4.818301677703857, 1678500200.6023777], "version": 0.2, "tvm_version": "0.10.0"}
{"input": ["cuda -keys=cuda,gpu -arch=sm_86 -max_num_threads=1024 -thread_warp_size=32", "depthwise_conv2d_nchw.cuda", [["TENSOR", [1, 512, 14, 14], "float32"], ["TENSOR", [512, 1, 3, 3], "float32"], [1, 1], [1, 1, 1, 1], [1, 1], "float32"], {}], "config": {"index": 18, "code_hash": null, "entity": [["tile_f", "sp", [-1, 256, 2, 1]], ["tile_y", "sp", [-1, 1, 1, 1]], ["tile_x", "sp", [-1, 1, 1, 1]], ["auto_unroll_max_step", "ot", 0], ["unroll_explicit", "ot", 0]]}, "result": [[0.0013263629078947368, 0.0013265380789473685, 0.0013280875526315789], 0, 3.855254888534546, 1678500201.4317617], "version": 0.2, "tvm_version": "0.10.0"}
{"input": ["cuda -keys=cuda,gpu -arch=sm_86 -max_num_threads=1024 -thread_warp_size=32", "depthwise_conv2d_nchw.cuda", [["TENSOR", [1, 512, 14, 14], "float32"], ["TENSOR", [512, 1, 3, 3], "float32"], [1, 1], [1, 1, 1, 1], [1, 1], "float32"], {}], "config": {"index": 19, "code_hash": null, "entity": [["tile_f", "sp", [-1, 1, 4, 1]], ["tile_y", "sp", [-1, 1, 1, 1]], ["tile_x", "sp", [-1, 1, 1, 1]], ["auto_unroll_max_step", "ot", 0], ["unroll_explicit", "ot", 0]]}, "result": [[4.331397410192147e-05, 4.3316540517961576e-05, 4.3316825396825395e-05], 0, 1.5996241569519043, 1678500202.6342583], "version": 0.2, "tvm_version": "0.10.0"}
{"input": ["cuda -keys=cuda,gpu -arch=sm_86 -max_num_threads=1024 -thread_warp_size=32", "depthwise_conv2d_nchw.cuda", [["TENSOR", [1, 512, 14, 14], "float32"], ["TENSOR", [512, 1, 3, 3], "float32"], [1, 1], [1, 1, 1, 1], [1, 1], "float32"], {}], "config": {"index": 20, "code_hash": null, "entity": [["tile_f", "sp", [-1, 2, 4, 1]], ["tile_y", "sp", [-1, 1, 1, 1]], ["tile_x", "sp", [-1, 1, 1, 1]], ["auto_unroll_max_step", "ot", 0], ["unroll_explicit", "ot", 0]]}, "result": [[4.392042503556188e-05, 4.392391977240398e-05, 4.39245012802276e-05], 0, 1.624535322189331, 1678500203.826567], "version": 0.2, "tvm_version": "0.10.0"}
{"input": ["cuda -keys=cuda,gpu -arch=sm_86 -max_num_threads=1024 -thread_warp_size=32", "depthwise_conv2d_nchw.cuda", [["TENSOR", [1, 512, 14, 14], "float32"], ["TENSOR", [512, 1, 3, 3], "float32"], [1, 1], [1, 1, 1, 1], [1, 1], "float32"], {}], "config": {"index": 21, "code_hash": null, "entity": [["tile_f", "sp", [-1, 4, 4, 1]], ["tile_y", "sp", [-1, 1, 1, 1]], ["tile_x", "sp", [-1, 1, 1, 1]], ["auto_unroll_max_step", "ot", 0], ["unroll_explicit", "ot", 0]]}, "result": [[4.842859022556391e-05, 4.8429555764411034e-05, 4.8429555764411034e-05], 0, 1.6065516471862793, 1678500205.010011], "version": 0.2, "tvm_version": "0.10.0"}
{"input": ["cuda -keys=cuda,gpu -arch=sm_86 -max_num_threads=1024 -thread_warp_size=32", "depthwise_conv2d_nchw.cuda", [["TENSOR", [1, 512, 14, 14], "float32"], ["TENSOR", [512, 1, 3, 3], "float32"], [1, 1], [1, 1, 1, 1], [1, 1], "float32"], {}], "config": {"index": 22, "code_hash": null, "entity": [["tile_f", "sp", [-1, 8, 4, 1]], ["tile_y", "sp", [-1, 1, 1, 1]], ["tile_x", "sp", [-1, 1, 1, 1]], ["auto_unroll_max_step", "ot", 0], ["unroll_explicit", "ot", 0]]}, "result": [[5.152297763157894e-05, 5.1523685197368416e-05, 5.15237052631579e-05], 0, 1.696282148361206, 1678500206.2184336], "version": 0.2, "tvm_version": "0.10.0"}
{"input": ["cuda -keys=cuda,gpu -arch=sm_86 -max_num_threads=1024 -thread_warp_size=32", "depthwise_conv2d_nchw.cuda", [["TENSOR", [1, 512, 14, 14], "float32"], ["TENSOR", [512, 1, 3, 3], "float32"], [1, 1], [1, 1, 1, 1], [1, 1], "float32"], {}], "config": {"index": 23, "code_hash": null, "entity": [["tile_f", "sp", [-1, 16, 4, 1]], ["tile_y", "sp", [-1, 1, 1, 1]], ["tile_x", "sp", [-1, 1, 1, 1]], ["auto_unroll_max_step", "ot", 0], ["unroll_explicit", "ot", 0]]}, "result": [[6.373145646010531e-05, 6.373725961927905e-05, 6.374223450789794e-05], 0, 1.7731010913848877, 1678500207.419989], "version": 0.2, "tvm_version": "0.10.0"}
{"input": ["cuda -keys=cuda,gpu -arch=sm_86 -max_num_threads=1024 -thread_warp_size=32", "depthwise_conv2d_nchw.cuda", [["TENSOR", [1, 512, 14, 14], "float32"], ["TENSOR", [512, 1, 3, 3], "float32"], [1, 1], [1, 1, 1, 1], [1, 1], "float32"], {}], "config": {"index": 24, "code_hash": null, "entity": [["tile_f", "sp", [-1, 32, 4, 1]], ["tile_y", "sp", [-1, 1, 1, 1]], ["tile_x", "sp", [-1, 1, 1, 1]], ["auto_unroll_max_step", "ot", 0], ["unroll_explicit", "ot", 0]]}, "result": [[0.000110633297635605, 0.00011063970723226704, 0.00011064398331015299], 0, 2.202564001083374, 1678500208.6348495], "version": 0.2, "tvm_version": "0.10.0"}
{"input": ["cuda -keys=cuda,gpu -arch=sm_86 -max_num_threads=1024 -thread_warp_size=32", "depthwise_conv2d_nchw.cuda", [["TENSOR", [1, 512, 14, 14], "float32"], ["TENSOR", [512, 1, 3, 3], "float32"], [1, 1], [1, 1, 1, 1], [1, 1], "float32"], {}], "config": {"index": 25, "code_hash": null, "entity": [["tile_f", "sp", [-1, 64, 4, 1]], ["tile_y", "sp", [-1, 1, 1, 1]], ["tile_x", "sp", [-1, 1, 1, 1]], ["auto_unroll_max_step", "ot", 0], ["unroll_explicit", "ot", 0]]}, "result": [[0.0003958845236907731, 0.0003958998603491272, 0.0003960122269326683], 0, 2.721707344055176, 1678500209.8528392], "version": 0.2, "tvm_version": "0.10.0"}
{"input": ["cuda -keys=cuda,gpu -arch=sm_86 -max_num_threads=1024 -thread_warp_size=32", "depthwise_conv2d_nchw.cuda", [["TENSOR", [1, 512, 14, 14], "float32"], ["TENSOR", [512, 1, 3, 3], "float32"], [1, 1], [1, 1, 1, 1], [1, 1], "float32"], {}], "config": {"index": 26, "code_hash": null, "entity": [["tile_f", "sp", [-1, 128, 4, 1]], ["tile_y", "sp", [-1, 1, 1, 1]], ["tile_x", "sp", [-1, 1, 1, 1]], ["auto_unroll_max_step", "ot", 0], ["unroll_explicit", "ot", 0]]}, "result": [[0.0006731398158995816, 0.0006732135564853557, 0.0006732521213389122], 0, 4.804280519485474, 1678500211.0856144], "version": 0.2, "tvm_version": "0.10.0"}
{"input": ["cuda -keys=cuda,gpu -arch=sm_86 -max_num_threads=1024 -thread_warp_size=32", "depthwise_conv2d_nchw.cuda", [["TENSOR", [1, 512, 14, 14], "float32"], ["TENSOR", [512, 1, 3, 3], "float32"], [1, 1], [1, 1, 1, 1], [1, 1], "float32"], {}], "config": {"index": 27, "code_hash": null, "entity": [["tile_f", "sp", [-1, 1, 8, 1]], ["tile_y", "sp", [-1, 1, 1, 1]], ["tile_x", "sp", [-1, 1, 1, 1]], ["auto_unroll_max_step", "ot", 0], ["unroll_explicit", "ot", 0]]}, "result": [[2.4868810957551826e-05, 2.4869822639025993e-05, 2.4870666173083247e-05], 0, 1.555070161819458, 1678500212.2474053], "version": 0.2, "tvm_version": "0.10.0"}
{"input": ["cuda -keys=cuda,gpu -arch=sm_86 -max_num_threads=1024 -thread_warp_size=32", "depthwise_conv2d_nchw.cuda", [["TENSOR", [1, 512, 14, 14], "float32"], ["TENSOR", [512, 1, 3, 3], "float32"], [1, 1], [1, 1, 1, 1], [1, 1], "float32"], {}], "config": {"index": 28, "code_hash": null, "entity": [["tile_f", "sp", [-1, 2, 8, 1]], ["tile_y", "sp", [-1, 1, 1, 1]], ["tile_x", "sp", [-1, 1, 1, 1]], ["auto_unroll_max_step", "ot", 0], ["unroll_explicit", "ot", 0]]}, "result": [[2.57035440214657e-05, 2.570355156800268e-05, 2.570423746436358e-05], 0, 1.598846197128296, 1678500213.423133], "version": 0.2, "tvm_version": "0.10.0"}
{"input": ["cuda -keys=cuda,gpu -arch=sm_86 -max_num_threads=1024 -thread_warp_size=32", "depthwise_conv2d_nchw.cuda", [["TENSOR", [1, 512, 14, 14], "float32"], ["TENSOR", [512, 1, 3, 3], "float32"], [1, 1], [1, 1, 1, 1], [1, 1], "float32"], {}], "config": {"index": 29, "code_hash": null, "entity": [["tile_f", "sp", [-1, 4, 8, 1]], ["tile_y", "sp", [-1, 1, 1, 1]], ["tile_x", "sp", [-1, 1, 1, 1]], ["auto_unroll_max_step", "ot", 0], ["unroll_explicit", "ot", 0]]}, "result": [[2.747865146345843e-05, 2.7481961213862452e-05, 2.7483249057281378e-05], 0, 1.6286118030548096, 1678500214.6181657], "version": 0.2, "tvm_version": "0.10.0"}
{"input": ["cuda -keys=cuda,gpu -arch=sm_86 -max_num_threads=1024 -thread_warp_size=32", "depthwise_conv2d_nchw.cuda", [["TENSOR", [1, 512, 14, 14], "float32"], ["TENSOR", [512, 1, 3, 3], "float32"], [1, 1], [1, 1, 1, 1], [1, 1], "float32"], {}], "config": {"index": 30, "code_hash": null, "entity": [["tile_f", "sp", [-1, 8, 8, 1]], ["tile_y", "sp", [-1, 1, 1, 1]], ["tile_x", "sp", [-1, 1, 1, 1]], ["auto_unroll_max_step", "ot", 0], ["unroll_explicit", "ot", 0]]}, "result": [[3.477412857791913e-05, 3.477412857791913e-05, 3.47783157655611e-05], 0, 1.690737247467041, 1678500215.8008122], "version": 0.2, "tvm_version": "0.10.0"}
{"input": ["cuda -keys=cuda,gpu -arch=sm_86 -max_num_threads=1024 -thread_warp_size=32", "depthwise_conv2d_nchw.cuda", [["TENSOR", [1, 512, 14, 14], "float32"], ["TENSOR", [512, 1, 3, 3], "float32"], [1, 1], [1, 1, 1, 1], [1, 1], "float32"], {}], "config": {"index": 31, "code_hash": null, "entity": [["tile_f", "sp", [-1, 16, 8, 1]], ["tile_y", "sp", [-1, 1, 1, 1]], ["tile_x", "sp", [-1, 1, 1, 1]], ["auto_unroll_max_step", "ot", 0], ["unroll_explicit", "ot", 0]]}, "result": [[5.9004717431877564e-05, 5.9004797312430006e-05, 5.9008619260918255e-05], 0, 1.7939767837524414, 1678500217.000891], "version": 0.2, "tvm_version": "0.10.0"}
{"input": ["cuda -keys=cuda,gpu -arch=sm_86 -max_num_threads=1024 -thread_warp_size=32", "depthwise_conv2d_nchw.cuda", [["TENSOR", [1, 512, 14, 14], "float32"], ["TENSOR", [512, 1, 3, 3], "float32"], [1, 1], [1, 1, 1, 1], [1, 1], "float32"], {}], "config": {"index": 32, "code_hash": null, "entity": [["tile_f", "sp", [-1, 32, 8, 1]], ["tile_y", "sp", [-1, 1, 1, 1]], ["tile_x", "sp", [-1, 1, 1, 1]], ["auto_unroll_max_step", "ot", 0], ["unroll_explicit", "ot", 0]]}, "result": [[0.00010853692862045299, 0.00010855438709677421, 0.00010856367604667125], 0, 2.062321901321411, 1678500219.6639771], "version": 0.2, "tvm_version": "0.10.0"}
{"input": ["cuda -keys=cuda,gpu -arch=sm_86 -max_num_threads=1024 -thread_warp_size=32", "depthwise_conv2d_nchw.cuda", [["TENSOR", [1, 512, 14, 14], "float32"], ["TENSOR", [512, 1, 3, 3], "float32"], [1, 1], [1, 1, 1, 1], [1, 1], "float32"], {}], "config": {"index": 33, "code_hash": null, "entity": [["tile_f", "sp", [-1, 64, 8, 1]], ["tile_y", "sp", [-1, 1, 1, 1]], ["tile_x", "sp", [-1, 1, 1, 1]], ["auto_unroll_max_step", "ot", 0], ["unroll_explicit", "ot", 0]]}, "result": [[0.0004101212909090909, 0.00041012664155844154, 0.0004101984571428571], 0, 2.572767496109009, 1678500220.8724604], "version": 0.2, "tvm_version": "0.10.0"}
{"input": ["cuda -keys=cuda,gpu -arch=sm_86 -max_num_threads=1024 -thread_warp_size=32", "depthwise_conv2d_nchw.cuda", [["TENSOR", [1, 512, 14, 14], "float32"], ["TENSOR", [512, 1, 3, 3], "float32"], [1, 1], [1, 1, 1, 1], [1, 1], "float32"], {}], "config": {"index": 34, "code_hash": null, "entity": [["tile_f", "sp", [-1, 1, 16, 1]], ["tile_y", "sp", [-1, 1, 1, 1]], ["tile_x", "sp", [-1, 1, 1, 1]], ["auto_unroll_max_step", "ot", 0], ["unroll_explicit", "ot", 0]]}, "result": [[1.532802715121136e-05, 1.5356149853801172e-05, 1.535741342940685e-05], 0, 1.4971818923950195, 1678500222.0160294], "version": 0.2, "tvm_version": "0.10.0"}
{"input": ["cuda -keys=cuda,gpu -arch=sm_86 -max_num_threads=1024 -thread_warp_size=32", "depthwise_conv2d_nchw.cuda", [["TENSOR", [1, 512, 14, 14], "float32"], ["TENSOR", [512, 1, 3, 3], "float32"], [1, 1], [1, 1, 1, 1], [1, 1], "float32"], {}], "config": {"index": 35, "code_hash": null, "entity": [["tile_f", "sp", [-1, 2, 16, 1]], ["tile_y", "sp", [-1, 1, 1, 1]], ["tile_x", "sp", [-1, 1, 1, 1]], ["auto_unroll_max_step", "ot", 0], ["unroll_explicit", "ot", 0]]}, "result": [[1.591066877076412e-05, 1.5912143964562567e-05, 1.5912596899224807e-05], 0, 1.5837795734405518, 1678500223.168348], "version": 0.2, "tvm_version": "0.10.0"}
{"input": ["cuda -keys=cuda,gpu -arch=sm_86 -max_num_threads=1024 -thread_warp_size=32", "depthwise_conv2d_nchw.cuda", [["TENSOR", [1, 512, 14, 14], "float32"], ["TENSOR", [512, 1, 3, 3], "float32"], [1, 1], [1, 1, 1, 1], [1, 1], "float32"], {}], "config": {"index": 36, "code_hash": null, "entity": [["tile_f", "sp", [-1, 4, 16, 1]], ["tile_y", "sp", [-1, 1, 1, 1]], ["tile_x", "sp", [-1, 1, 1, 1]], ["auto_unroll_max_step", "ot", 0], ["unroll_explicit", "ot", 0]]}, "result": [[1.998575906976744e-05, 1.9987391362126246e-05, 1.998793488372093e-05], 0, 1.5985791683197021, 1678500224.3376148], "version": 0.2, "tvm_version": "0.10.0"}
{"input": ["cuda -keys=cuda,gpu -arch=sm_86 -max_num_threads=1024 -thread_warp_size=32", "depthwise_conv2d_nchw.cuda", [["TENSOR", [1, 512, 14, 14], "float32"], ["TENSOR", [512, 1, 3, 3], "float32"], [1, 1], [1, 1, 1, 1], [1, 1], "float32"], {}], "config": {"index": 37, "code_hash": null, "entity": [["tile_f", "sp", [-1, 8, 16, 1]], ["tile_y", "sp", [-1, 1, 1, 1]], ["tile_x", "sp", [-1, 1, 1, 1]], ["auto_unroll_max_step", "ot", 0], ["unroll_explicit", "ot", 0]]}, "result": [[3.3351067039106145e-05, 3.3355027503223035e-05, 3.336030941125913e-05], 0, 1.7305667400360107, 1678500225.5437589], "version": 0.2, "tvm_version": "0.10.0"}
{"input": ["cuda -keys=cuda,gpu -arch=sm_86 -max_num_threads=1024 -thread_warp_size=32", "depthwise_conv2d_nchw.cuda", [["TENSOR", [1, 512, 14, 14], "float32"], ["TENSOR", [512, 1, 3, 3], "float32"], [1, 1], [1, 1, 1, 1], [1, 1], "float32"], {}], "config": {"index": 38, "code_hash": null, "entity": [["tile_f", "sp", [-1, 16, 16, 1]], ["tile_y", "sp", [-1, 1, 1, 1]], ["tile_x", "sp", [-1, 1, 1, 1]], ["auto_unroll_max_step", "ot", 0], ["unroll_explicit", "ot", 0]]}, "result": [[6.060729233164655e-05, 6.0618090307512656e-05, 6.0620882055274434e-05], 0, 1.7518134117126465, 1678500226.7339637], "version": 0.2, "tvm_version": "0.10.0"}
{"input": ["cuda -keys=cuda,gpu -arch=sm_86 -max_num_threads=1024 -thread_warp_size=32", "depthwise_conv2d_nchw.cuda", [["TENSOR", [1, 512, 14, 14], "float32"], ["TENSOR", [512, 1, 3, 3], "float32"], [1, 1], [1, 1, 1, 1], [1, 1], "float32"], {}], "config": {"index": 39, "code_hash": null, "entity": [["tile_f", "sp", [-1, 32, 16, 1]], ["tile_y", "sp", [-1, 1, 1, 1]], ["tile_x", "sp", [-1, 1, 1, 1]], ["auto_unroll_max_step", "ot", 0], ["unroll_explicit", "ot", 0]]}, "result": [[0.00011620023477622891, 0.0001162040858400587, 0.0001162198708730741], 0, 2.109224319458008, 1678500227.9396353], "version": 0.2, "tvm_version": "0.10.0"}
{"input": ["cuda -keys=cuda,gpu -arch=sm_86 -max_num_threads=1024 -thread_warp_size=32", "depthwise_conv2d_nchw.cuda", [["TENSOR", [1, 512, 14, 14], "float32"], ["TENSOR", [512, 1, 3, 3], "float32"], [1, 1], [1, 1, 1, 1], [1, 1], "float32"], {}], "config": {"index": 40, "code_hash": null, "entity": [["tile_f", "sp", [-1, 1, 32, 1]], ["tile_y", "sp", [-1, 1, 1, 1]], ["tile_x", "sp", [-1, 1, 1, 1]], ["auto_unroll_max_step", "ot", 0], ["unroll_explicit", "ot", 0]]}, "result": [[1.1129471454425797e-05, 1.1130566057913786e-05, 1.113073552155314e-05], 0, 1.4678592681884766, 1678500229.0164108], "version": 0.2, "tvm_version": "0.10.0"}
{"input": ["cuda -keys=cuda,gpu -arch=sm_86 -max_num_threads=1024 -thread_warp_size=32", "depthwise_conv2d_nchw.cuda", [["TENSOR", [1, 512, 14, 14], "float32"], ["TENSOR", [512, 1, 3, 3], "float32"], [1, 1], [1, 1, 1, 1], [1, 1], "float32"], {}], "config": {"index": 41, "code_hash": null, "entity": [["tile_f", "sp", [-1, 2, 32, 1]], ["tile_y", "sp", [-1, 1, 1, 1]], ["tile_x", "sp", [-1, 1, 1, 1]], ["auto_unroll_max_step", "ot", 0], ["unroll_explicit", "ot", 0]]}, "result": [[1.2759921079196109e-05, 1.2761237404790308e-05, 1.2762270808479398e-05], 0, 1.5278961658477783, 1678500230.112107], "version": 0.2, "tvm_version": "0.10.0"}
{"input": ["cuda -keys=cuda,gpu -arch=sm_86 -max_num_threads=1024 -thread_warp_size=32", "depthwise_conv2d_nchw.cuda", [["TENSOR", [1, 512, 14, 14], "float32"], ["TENSOR", [512, 1, 3, 3], "float32"], [1, 1], [1, 1, 1, 1], [1, 1], "float32"], {}], "config": {"index": 42, "code_hash": null, "entity": [["tile_f", "sp", [-1, 4, 32, 1]], ["tile_y", "sp", [-1, 1, 1, 1]], ["tile_x", "sp", [-1, 1, 1, 1]], ["auto_unroll_max_step", "ot", 0], ["unroll_explicit", "ot", 0]]}, "result": [[1.9682772833419824e-05, 1.9683172677737416e-05, 1.9684366372599895e-05], 0, 1.6055164337158203, 1678500231.2818406], "version": 0.2, "tvm_version": "0.10.0"}
{"input": ["cuda -keys=cuda,gpu -arch=sm_86 -max_num_threads=1024 -thread_warp_size=32", "depthwise_conv2d_nchw.cuda", [["TENSOR", [1, 512, 14, 14], "float32"], ["TENSOR", [512, 1, 3, 3], "float32"], [1, 1], [1, 1, 1, 1], [1, 1], "float32"], {}], "config": {"index": 43, "code_hash": null, "entity": [["tile_f", "sp", [-1, 8, 32, 1]], ["tile_y", "sp", [-1, 1, 1, 1]], ["tile_x", "sp", [-1, 1, 1, 1]], ["auto_unroll_max_step", "ot", 0], ["unroll_explicit", "ot", 0]]}, "result": [[3.3769041255605385e-05, 3.377317399103139e-05, 3.3775011210762334e-05], 0, 1.6563892364501953, 1678500232.4432468], "version": 0.2, "tvm_version": "0.10.0"}
{"input": ["cuda -keys=cuda,gpu -arch=sm_86 -max_num_threads=1024 -thread_warp_size=32", "depthwise_conv2d_nchw.cuda", [["TENSOR", [1, 512, 14, 14], "float32"], ["TENSOR", [512, 1, 3, 3], "float32"], [1, 1], [1, 1, 1, 1], [1, 1], "float32"], {}], "config": {"index": 44, "code_hash": null, "entity": [["tile_f", "sp", [-1, 16, 32, 1]], ["tile_y", "sp", [-1, 1, 1, 1]], ["tile_x", "sp", [-1, 1, 1, 1]], ["auto_unroll_max_step", "ot", 0], ["unroll_explicit", "ot", 0]]}, "result": [[6.29213184335443e-05, 6.292212737341773e-05, 6.292293631329115e-05], 0, 1.7703819274902344, 1678500233.6505213], "version": 0.2, "tvm_version": "0.10.0"}
{"input": ["cuda -keys=cuda,gpu -arch=sm_86 -max_num_threads=1024 -thread_warp_size=32", "depthwise_conv2d_nchw.cuda", [["TENSOR", [1, 512, 14, 14], "float32"], ["TENSOR", [512, 1, 3, 3], "float32"], [1, 1], [1, 1, 1, 1], [1, 1], "float32"], {}], "config": {"index": 45, "code_hash": null, "entity": [["tile_f", "sp", [-1, 1, 64, 1]], ["tile_y", "sp", [-1, 1, 1, 1]], ["tile_x", "sp", [-1, 1, 1, 1]], ["auto_unroll_max_step", "ot", 0], ["unroll_explicit", "ot", 0]]}, "result": [[1.0156977426145025e-05, 1.0167294258546853e-05, 1.01674570661247e-05], 0, 1.499342441558838, 1678500234.75375], "version": 0.2, "tvm_version": "0.10.0"}
{"input": ["cuda -keys=cuda,gpu -arch=sm_86 -max_num_threads=1024 -thread_warp_size=32", "depthwise_conv2d_nchw.cuda", [["TENSOR", [1, 512, 14, 14], "float32"], ["TENSOR", [512, 1, 3, 3], "float32"], [1, 1], [1, 1, 1, 1], [1, 1], "float32"], {}], "config": {"index": 46, "code_hash": null, "entity": [["tile_f", "sp", [-1, 2, 64, 1]], ["tile_y", "sp", [-1, 1, 1, 1]], ["tile_x", "sp", [-1, 1, 1, 1]], ["auto_unroll_max_step", "ot", 0], ["unroll_explicit", "ot", 0]]}, "result": [[1.3237011379278703e-05, 1.3237292832889785e-05, 1.3237950995686885e-05], 0, 1.5469532012939453, 1678500235.8840284], "version": 0.2, "tvm_version": "0.10.0"}
{"input": ["cuda -keys=cuda,gpu -arch=sm_86 -max_num_threads=1024 -thread_warp_size=32", "depthwise_conv2d_nchw.cuda", [["TENSOR", [1, 512, 14, 14], "float32"], ["TENSOR", [512, 1, 3, 3], "float32"], [1, 1], [1, 1, 1, 1], [1, 1], "float32"], {}], "config": {"index": 47, "code_hash": null, "entity": [["tile_f", "sp", [-1, 4, 64, 1]], ["tile_y", "sp", [-1, 1, 1, 1]], ["tile_x", "sp", [-1, 1, 1, 1]], ["auto_unroll_max_step", "ot", 0], ["unroll_explicit", "ot", 0]]}, "result": [[1.9684886112956814e-05, 1.9685839202657807e-05, 1.9685975016611298e-05], 0, 1.5488853454589844, 1678500237.0283475], "version": 0.2, "tvm_version": "0.10.0"}
{"input": ["cuda -keys=cuda,gpu -arch=sm_86 -max_num_threads=1024 -thread_warp_size=32", "depthwise_conv2d_nchw.cuda", [["TENSOR", [1, 512, 14, 14], "float32"], ["TENSOR", [512, 1, 3, 3], "float32"], [1, 1], [1, 1, 1, 1], [1, 1], "float32"], {}], "config": {"index": 48, "code_hash": null, "entity": [["tile_f", "sp", [-1, 8, 64, 1]], ["tile_y", "sp", [-1, 1, 1, 1]], ["tile_x", "sp", [-1, 1, 1, 1]], ["auto_unroll_max_step", "ot", 0], ["unroll_explicit", "ot", 0]]}, "result": [[3.400894450076026e-05, 3.419240572731881e-05, 3.421155828687278e-05], 0, 1.4302372932434082, 1678500241.84982], "version": 0.2, "tvm_version": "0.10.0"}
{"input": ["cuda -keys=cuda,gpu -arch=sm_86 -max_num_threads=1024 -thread_warp_size=32", "depthwise_conv2d_nchw.cuda", [["TENSOR", [1, 512, 14, 14], "float32"], ["TENSOR", [512, 1, 3, 3], "float32"], [1, 1], [1, 1, 1, 1], [1, 1], "float32"], {}], "config": {"index": 55, "code_hash": null, "entity": [["tile_f", "sp", [-1, 1, 1, 2]], ["tile_y", "sp", [-1, 1, 1, 1]], ["tile_x", "sp", [-1, 1, 1, 1]], ["auto_unroll_max_step", "ot", 0], ["unroll_explicit", "ot", 0]]}, "result": [[5.445227096996894e-05, 5.445227096996894e-05, 5.445291888160166e-05], 0, 1.4296550750732422, 1678500243.051078], "version": 0.2, "tvm_version": "0.10.0"}
{"input": ["cuda -keys=cuda,gpu -arch=sm_86 -max_num_threads=1024 -thread_warp_size=32", "depthwise_conv2d_nchw.cuda", [["TENSOR", [1, 512, 14, 14], "float32"], ["TENSOR", [512, 1, 3, 3], "float32"], [1, 1], [1, 1, 1, 1], [1, 1], "float32"], {}], "config": {"index": 56, "code_hash": null, "entity": [["tile_f", "sp", [-1, 2, 1, 2]], ["tile_y", "sp", [-1, 1, 1, 1]], ["tile_x", "sp", [-1, 1, 1, 1]], ["auto_unroll_max_step", "ot", 0], ["unroll_explicit", "ot", 0]]}, "result": [[5.351284157075152e-05, 5.351353385240352e-05, 5.35138798239675e-05], 0, 1.4881982803344727, 1678500244.2596264], "version": 0.2, "tvm_version": "0.10.0"}
{"input": ["cuda -keys=cuda,gpu -arch=sm_86 -max_num_threads=1024 -thread_warp_size=32", "depthwise_conv2d_nchw.cuda", [["TENSOR", [1, 512, 14, 14], "float32"], ["TENSOR", [512, 1, 3, 3], "float32"], [1, 1], [1, 1, 1, 1], [1, 1], "float32"], {}], "config": {"index": 57, "code_hash": null, "entity": [["tile_f", "sp", [-1, 4, 1, 2]], ["tile_y", "sp", [-1, 1, 1, 1]], ["tile_x", "sp", [-1, 1, 1, 1]], ["auto_unroll_max_step", "ot", 0], ["unroll_explicit", "ot", 0]]}, "result": [[7.413856065573771e-05, 7.413903934426228e-05, 7.414181264637002e-05], 0, 1.5531864166259766, 1678500245.4746196], "version": 0.2, "tvm_version": "0.10.0"}
{"input": ["cuda -keys=cuda,gpu -arch=sm_86 -max_num_threads=1024 -thread_warp_size=32", "depthwise_conv2d_nchw.cuda", [["TENSOR", [1, 512, 14, 14], "float32"], ["TENSOR", [512, 1, 3, 3], "float32"], [1, 1], [1, 1, 1, 1], [1, 1], "float32"], {}], "config": {"index": 58, "code_hash": null, "entity": [["tile_f", "sp", [-1, 8, 1, 2]], ["tile_y", "sp", [-1, 1, 1, 1]], ["tile_x", "sp", [-1, 1, 1, 1]], ["auto_unroll_max_step", "ot", 0], ["unroll_explicit", "ot", 0]]}, "result": [[7.566572865275142e-05, 7.566719117647059e-05, 7.567592789373813e-05], 0, 1.7395191192626953, 1678500246.6853392], "version": 0.2, "tvm_version": "0.10.0"}
{"input": ["cuda -keys=cuda,gpu -arch=sm_86 -max_num_threads=1024 -thread_warp_size=32", "depthwise_conv2d_nchw.cuda", [["TENSOR", [1, 512, 14, 14], "float32"], ["TENSOR", [512, 1, 3, 3], "float32"], [1, 1], [1, 1, 1, 1], [1, 1], "float32"], {}], "config": {"index": 59, "code_hash": null, "entity": [["tile_f", "sp", [-1, 16, 1, 2]], ["tile_y", "sp", [-1, 1, 1, 1]], ["tile_x", "sp", [-1, 1, 1, 1]], ["auto_unroll_max_step", "ot", 0], ["unroll_explicit", "ot", 0]]}, "result": [[0.0005496380446735396, 0.0005496451752577319, 0.0005496733333333332], 0, 2.2121095657348633, 1678500247.9078948], "version": 0.2, "tvm_version": "0.10.0"}
{"input": ["cuda -keys=cuda,gpu -arch=sm_86 -max_num_threads=1024 -thread_warp_size=32", "depthwise_conv2d_nchw.cuda", [["TENSOR", [1, 512, 14, 14], "float32"], ["TENSOR", [512, 1, 3, 3], "float32"], [1, 1], [1, 1, 1, 1], [1, 1], "float32"], {}], "config": {"index": 60, "code_hash": null, "entity": [["tile_f", "sp", [-1, 32, 1, 2]], ["tile_y", "sp", [-1, 1, 1, 1]], ["tile_x", "sp", [-1, 1, 1, 1]], ["auto_unroll_max_step", "ot", 0], ["unroll_explicit", "ot", 0]]}, "result": [[0.0002040041280409731, 0.00020405527784891165, 0.00020405789500640205], 0, 3.832092761993408, 1678500249.1200545], "version": 0.2, "tvm_version": "0.10.0"}
{"input": ["cuda -keys=cuda,gpu -arch=sm_86 -max_num_threads=1024 -thread_warp_size=32", "depthwise_conv2d_nchw.cuda", [["TENSOR", [1, 512, 14, 14], "float32"], ["TENSOR", [512, 1, 3, 3], "float32"], [1, 1], [1, 1, 1, 1], [1, 1], "float32"], {}], "config": {"index": 61, "code_hash": null, "entity": [["tile_f", "sp", [-1, 64, 1, 2]], ["tile_y", "sp", [-1, 1, 1, 1]], ["tile_x", "sp", [-1, 1, 1, 1]], ["auto_unroll_max_step", "ot", 0], ["unroll_explicit", "ot", 0]]}, "result": [[0.0008782994175824177, 0.0008783669065934065, 0.0008788167087912088], 0, 3.50498366355896, 1678500250.3464248], "version": 0.2, "tvm_version": "0.10.0"}
{"input": ["cuda -keys=cuda,gpu -arch=sm_86 -max_num_threads=1024 -thread_warp_size=32", "depthwise_conv2d_nchw.cuda", [["TENSOR", [1, 512, 14, 14], "float32"], ["TENSOR", [512, 1, 3, 3], "float32"], [1, 1], [1, 1, 1, 1], [1, 1], "float32"], {}], "config": {"index": 62, "code_hash": null, "entity": [["tile_f", "sp", [-1, 128, 1, 2]], ["tile_y", "sp", [-1, 1, 1, 1]], ["tile_x", "sp", [-1, 1, 1, 1]], ["auto_unroll_max_step", "ot", 0], ["unroll_explicit", "ot", 0]]}, "result": [[0.00106303325, 0.0010633214605263158, 0.0010635452236842106], 0, 4.746907711029053, 1678500251.522098], "version": 0.2, "tvm_version": "0.10.0"}
{"input": ["cuda -keys=cuda,gpu -arch=sm_86 -max_num_threads=1024 -thread_warp_size=32", "depthwise_conv2d_nchw.cuda", [["TENSOR", [1, 512, 14, 14], "float32"], ["TENSOR", [512, 1, 3, 3], "float32"], [1, 1], [1, 1, 1, 1], [1, 1], "float32"], {}], "config": {"index": 63, "code_hash": null, "entity": [["tile_f", "sp", [-1, 256, 1, 2]], ["tile_y", "sp", [-1, 1, 1, 1]], ["tile_x", "sp", [-1, 1, 1, 1]], ["auto_unroll_max_step", "ot", 0], ["unroll_explicit", "ot", 0]]}, "result": [[0.0039953151499999996, 0.003996845625, 0.003997180925], 0, 4.386408805847168, 1678500252.7574615], "version": 0.2, "tvm_version": "0.10.0"}
{"input": ["cuda -keys=cuda,gpu -arch=sm_86 -max_num_threads=1024 -thread_warp_size=32", "depthwise_conv2d_nchw.cuda", [["TENSOR", [1, 512, 14, 14], "float32"], ["TENSOR", [512, 1, 3, 3], "float32"], [1, 1], [1, 1, 1, 1], [1, 1], "float32"], {}], "config": {"index": 64, "code_hash": null, "entity": [["tile_f", "sp", [-1, 1, 2, 2]], ["tile_y", "sp", [-1, 1, 1, 1]], ["tile_x", "sp", [-1, 1, 1, 1]], ["auto_unroll_max_step", "ot", 0], ["unroll_explicit", "ot", 0]]}, "result": [[6.646766364503817e-05, 6.646903959923664e-05, 6.64696145038168e-05], 0, 1.5870094299316406, 1678500257.7502124], "version": 0.2, "tvm_version": "0.10.0"}
{"input": ["cuda -keys=cuda,gpu -arch=sm_86 -max_num_threads=1024 -thread_warp_size=32", "depthwise_conv2d_nchw.cuda", [["TENSOR", [1, 512, 14, 14], "float32"], ["TENSOR", [512, 1, 3, 3], "float32"], [1, 1], [1, 1, 1, 1], [1, 1], "float32"], {}], "config": {"index": 65, "code_hash": null, "entity": [["tile_f", "sp", [-1, 2, 2, 2]], ["tile_y", "sp", [-1, 1, 1, 1]], ["tile_x", "sp", [-1, 1, 1, 1]], ["auto_unroll_max_step", "ot", 0], ["unroll_explicit", "ot", 0]]}, "result": [[7.082087867975022e-05, 7.082133496877787e-05, 7.08222537912578e-05], 0, 1.6071264743804932, 1678500258.9624205], "version": 0.2, "tvm_version": "0.10.0"}
{"input": ["cuda -keys=cuda,gpu -arch=sm_86 -max_num_threads=1024 -thread_warp_size=32", "depthwise_conv2d_nchw.cuda", [["TENSOR", [1, 512, 14, 14], "float32"], ["TENSOR", [512, 1, 3, 3], "float32"], [1, 1], [1, 1, 1, 1], [1, 1], "float32"], {}], "config": {"index": 66, "code_hash": null, "entity": [["tile_f", "sp", [-1, 4, 2, 2]], ["tile_y", "sp", [-1, 1, 1, 1]], ["tile_x", "sp", [-1, 1, 1, 1]], ["auto_unroll_max_step", "ot", 0], ["unroll_explicit", "ot", 0]]}, "result": [[7.671325895450146e-05, 7.672560793804453e-05, 7.673060793804454e-05], 0, 1.7190794944763184, 1678500260.168782], "version": 0.2, "tvm_version": "0.10.0"}
{"input": ["cuda -keys=cuda,gpu -arch=sm_86 -max_num_threads=1024 -thread_warp_size=32", "depthwise_conv2d_nchw.cuda", [["TENSOR", [1, 512, 14, 14], "float32"], ["TENSOR", [512, 1, 3, 3], "float32"], [1, 1], [1, 1, 1, 1], [1, 1], "float32"], {}], "config": {"index": 67, "code_hash": null, "entity": [["tile_f", "sp", [-1, 8, 2, 2]], ["tile_y", "sp", [-1, 1, 1, 1]], ["tile_x", "sp", [-1, 1, 1, 1]], ["auto_unroll_max_step", "ot", 0], ["unroll_explicit", "ot", 0]]}, "result": [[8.052742723004696e-05, 8.053596817944706e-05, 8.053596817944706e-05], 0, 1.7775952816009521, 1678500261.3566658], "version": 0.2, "tvm_version": "0.10.0"}
{"input": ["cuda -keys=cuda,gpu -arch=sm_86 -max_num_threads=1024 -thread_warp_size=32", "depthwise_conv2d_nchw.cuda", [["TENSOR", [1, 512, 14, 14], "float32"], ["TENSOR", [512, 1, 3, 3], "float32"], [1, 1], [1, 1, 1, 1], [1, 1], "float32"], {}], "config": {"index": 68, "code_hash": null, "entity": [["tile_f", "sp", [-1, 16, 2, 2]], ["tile_y", "sp", [-1, 1, 1, 1]], ["tile_x", "sp", [-1, 1, 1, 1]], ["auto_unroll_max_step", "ot", 0], ["unroll_explicit", "ot", 0]]}, "result": [[0.000307478009765625, 0.000307612, 0.0003076358125], 0, 2.627746105194092, 1678500262.5684881], "version": 0.2, "tvm_version": "0.10.0"}
{"input": ["cuda -keys=cuda,gpu -arch=sm_86 -max_num_threads=1024 -thread_warp_size=32", "depthwise_conv2d_nchw.cuda", [["TENSOR", [1, 512, 14, 14], "float32"], ["TENSOR", [512, 1, 3, 3], "float32"], [1, 1], [1, 1, 1, 1], [1, 1], "float32"], {}], "config": {"index": 69, "code_hash": null, "entity": [["tile_f", "sp", [-1, 32, 2, 2]], ["tile_y", "sp", [-1, 1, 1, 1]], ["tile_x", "sp", [-1, 1, 1, 1]], ["auto_unroll_max_step", "ot", 0], ["unroll_explicit", "ot", 0]]}, "result": [[0.0003823922560386473, 0.00038244164492753625, 0.00038259994444444443], 0, 4.305260181427002, 1678500263.7777674], "version": 0.2, "tvm_version": "0.10.0"}
{"input": ["cuda -keys=cuda,gpu -arch=sm_86 -max_num_threads=1024 -thread_warp_size=32", "depthwise_conv2d_nchw.cuda", [["TENSOR", [1, 512, 14, 14], "float32"], ["TENSOR", [512, 1, 3, 3], "float32"], [1, 1], [1, 1, 1, 1], [1, 1], "float32"], {}], "config": {"index": 70, "code_hash": null, "entity": [["tile_f", "sp", [-1, 64, 2, 2]], ["tile_y", "sp", [-1, 1, 1, 1]], ["tile_x", "sp", [-1, 1, 1, 1]], ["auto_unroll_max_step", "ot", 0], ["unroll_explicit", "ot", 0]]}, "result": [[0.0006148220954198474, 0.0006149315267175572, 0.0006150323969465649], 0, 3.6229331493377686, 1678500265.0071623], "version": 0.2, "tvm_version": "0.10.0"}
{"input": ["cuda -keys=cuda,gpu -arch=sm_86 -max_num_threads=1024 -thread_warp_size=32", "depthwise_conv2d_nchw.cuda", [["TENSOR", [1, 512, 14, 14], "float32"], ["TENSOR", [512, 1, 3, 3], "float32"], [1, 1], [1, 1, 1, 1], [1, 1], "float32"], {}], "config": {"index": 71, "code_hash": null, "entity": [["tile_f", "sp", [-1, 128, 2, 2]], ["tile_y", "sp", [-1, 1, 1, 1]], ["tile_x", "sp", [-1, 1, 1, 1]], ["auto_unroll_max_step", "ot", 0], ["unroll_explicit", "ot", 0]]}, "result": [[0.00100572795625, 0.0010059583625, 0.00100620755625], 0, 4.92557168006897, 1678500266.2311594], "version": 0.2, "tvm_version": "0.10.0"}
{"input": ["cuda -keys=cuda,gpu -arch=sm_86 -max_num_threads=1024 -thread_warp_size=32", "depthwise_conv2d_nchw.cuda", [["TENSOR", [1, 512, 14, 14], "float32"], ["TENSOR", [512, 1, 3, 3], "float32"], [1, 1], [1, 1, 1, 1], [1, 1], "float32"], {}], "config": {"index": 72, "code_hash": null, "entity": [["tile_f", "sp", [-1, 1, 4, 2]], ["tile_y", "sp", [-1, 1, 1, 1]], ["tile_x", "sp", [-1, 1, 1, 1]], ["auto_unroll_max_step", "ot", 0], ["unroll_explicit", "ot", 0]]}, "result": [[4.2041013851167845e-05, 4.2043487778381316e-05, 4.204462764801738e-05], 0, 1.6173784732818604, 1678500267.4287295], "version": 0.2, "tvm_version": "0.10.0"}
{"input": ["cuda -keys=cuda,gpu -arch=sm_86 -max_num_threads=1024 -thread_warp_size=32", "depthwise_conv2d_nchw.cuda", [["TENSOR", [1, 512, 14, 14], "float32"], ["TENSOR", [512, 1, 3, 3], "float32"], [1, 1], [1, 1, 1, 1], [1, 1], "float32"], {}], "config": {"index": 73, "code_hash": null, "entity": [["tile_f", "sp", [-1, 2, 4, 2]], ["tile_y", "sp", [-1, 1, 1, 1]], ["tile_x", "sp", [-1, 1, 1, 1]], ["auto_unroll_max_step", "ot", 0], ["unroll_explicit", "ot", 0]]}, "result": [[4.576427302147691e-05, 4.5764556045895855e-05, 4.576753221535746e-05], 0, 1.6360745429992676, 1678500268.6334772], "version": 0.2, "tvm_version": "0.10.0"}
{"input": ["cuda -keys=cuda,gpu -arch=sm_86 -max_num_threads=1024 -thread_warp_size=32", "depthwise_conv2d_nchw.cuda", [["TENSOR", [1, 512, 14, 14], "float32"], ["TENSOR", [512, 1, 3, 3], "float32"], [1, 1], [1, 1, 1, 1], [1, 1], "float32"], {}], "config": {"index": 74, "code_hash": null, "entity": [["tile_f", "sp", [-1, 4, 4, 2]], ["tile_y", "sp", [-1, 1, 1, 1]], ["tile_x", "sp", [-1, 1, 1, 1]], ["auto_unroll_max_step", "ot", 0], ["unroll_explicit", "ot", 0]]}, "result": [[4.852953781773093e-05, 4.85308056416615e-05, 4.8533028518288904e-05], 0, 1.7176296710968018, 1678500269.8381193], "version": 0.2, "tvm_version": "0.10.0"}
{"input": ["cuda -keys=cuda,gpu -arch=sm_86 -max_num_threads=1024 -thread_warp_size=32", "depthwise_conv2d_nchw.cuda", [["TENSOR", [1, 512, 14, 14], "float32"], ["TENSOR", [512, 1, 3, 3], "float32"], [1, 1], [1, 1, 1, 1], [1, 1], "float32"], {}], "config": {"index": 75, "code_hash": null, "entity": [["tile_f", "sp", [-1, 8, 4, 2]], ["tile_y", "sp", [-1, 1, 1, 1]], ["tile_x", "sp", [-1, 1, 1, 1]], ["auto_unroll_max_step", "ot", 0], ["unroll_explicit", "ot", 0]]}, "result": [[6.0622539143848825e-05, 6.062411608175858e-05, 6.062647589664481e-05], 0, 1.8323149681091309, 1678500271.0405111], "version": 0.2, "tvm_version": "0.10.0"}
{"input": ["cuda -keys=cuda,gpu -arch=sm_86 -max_num_threads=1024 -thread_warp_size=32", "depthwise_conv2d_nchw.cuda", [["TENSOR", [1, 512, 14, 14], "float32"], ["TENSOR", [512, 1, 3, 3], "float32"], [1, 1], [1, 1, 1, 1], [1, 1], "float32"], {}], "config": {"index": 76, "code_hash": null, "entity": [["tile_f", "sp", [-1, 16, 4, 2]], ["tile_y", "sp", [-1, 1, 1, 1]], ["tile_x", "sp", [-1, 1, 1, 1]], ["auto_unroll_max_step", "ot", 0], ["unroll_explicit", "ot", 0]]}, "result": [[0.000248711051968504, 0.00024880457480314956, 0.00024881908976377953], 0, 2.6227893829345703, 1678500272.2482443], "version": 0.2, "tvm_version": "0.10.0"}
{"input": ["cuda -keys=cuda,gpu -arch=sm_86 -max_num_threads=1024 -thread_warp_size=32", "depthwise_conv2d_nchw.cuda", [["TENSOR", [1, 512, 14, 14], "float32"], ["TENSOR", [512, 1, 3, 3], "float32"], [1, 1], [1, 1, 1, 1], [1, 1], "float32"], {}], "config": {"index": 77, "code_hash": null, "entity": [["tile_f", "sp", [-1, 32, 4, 2]], ["tile_y", "sp", [-1, 1, 1, 1]], ["tile_x", "sp", [-1, 1, 1, 1]], ["auto_unroll_max_step", "ot", 0], ["unroll_explicit", "ot", 0]]}, "result": [[0.00037836058212560385, 0.00037840016666666667, 0.0003785337342995169], 0, 4.122111082077026, 1678500273.4437687], "version": 0.2, "tvm_version": "0.10.0"}
{"input": ["cuda -keys=cuda,gpu -arch=sm_86 -max_num_threads=1024 -thread_warp_size=32", "depthwise_conv2d_nchw.cuda", [["TENSOR", [1, 512, 14, 14], "float32"], ["TENSOR", [512, 1, 3, 3], "float32"], [1, 1], [1, 1, 1, 1], [1, 1], "float32"], {}], "config": {"index": 78, "code_hash": null, "entity": [["tile_f", "sp", [-1, 64, 4, 2]], ["tile_y", "sp", [-1, 1, 1, 1]], ["tile_x", "sp", [-1, 1, 1, 1]], ["auto_unroll_max_step", "ot", 0], ["unroll_explicit", "ot", 0]]}, "result": [[0.0006782555854700854, 0.0006782992094017093, 0.0006783518333333333], 0, 3.437944173812866, 1678500274.6519532], "version": 0.2, "tvm_version": "0.10.0"}
{"input": ["cuda -keys=cuda,gpu -arch=sm_86 -max_num_threads=1024 -thread_warp_size=32", "depthwise_conv2d_nchw.cuda", [["TENSOR", [1, 512, 14, 14], "float32"], ["TENSOR", [512, 1, 3, 3], "float32"], [1, 1], [1, 1, 1, 1], [1, 1], "float32"], {}], "config": {"index": 79, "code_hash": null, "entity": [["tile_f", "sp", [-1, 1, 8, 2]], ["tile_y", "sp", [-1, 1, 1, 1]], ["tile_x", "sp", [-1, 1, 1, 1]], ["auto_unroll_max_step", "ot", 0], ["unroll_explicit", "ot", 0]]}, "result": [[2.451022288573273e-05, 2.451055277598451e-05, 2.4510885248547454e-05], 0, 1.6093924045562744, 1678500275.8296125], "version": 0.2, "tvm_version": "0.10.0"}
{"input": ["cuda -keys=cuda,gpu -arch=sm_86 -max_num_threads=1024 -thread_warp_size=32", "depthwise_conv2d_nchw.cuda", [["TENSOR", [1, 512, 14, 14], "float32"], ["TENSOR", [512, 1, 3, 3], "float32"], [1, 1], [1, 1, 1, 1], [1, 1], "float32"], {}], "config": {"index": 80, "code_hash": null, "entity": [["tile_f", "sp", [-1, 2, 8, 2]], ["tile_y", "sp", [-1, 1, 1, 1]], ["tile_x", "sp", [-1, 1, 1, 1]], ["auto_unroll_max_step", "ot", 0], ["unroll_explicit", "ot", 0]]}, "result": [[2.6004378306878307e-05, 2.6009304954304957e-05, 2.6021886724386724e-05], 0, 1.3743107318878174, 1678500279.7207153], "version": 0.2, "tvm_version": "0.10.0"}
{"input": ["cuda -keys=cuda,gpu -arch=sm_86 -max_num_threads=1024 -thread_warp_size=32", "depthwise_conv2d_nchw.cuda", [["TENSOR", [1, 512, 14, 14], "float32"], ["TENSOR", [512, 1, 3, 3], "float32"], [1, 1], [1, 1, 1, 1], [1, 1], "float32"], {}], "config": {"index": 81, "code_hash": null, "entity": [["tile_f", "sp", [-1, 4, 8, 2]], ["tile_y", "sp", [-1, 1, 1, 1]], ["tile_x", "sp", [-1, 1, 1, 1]], ["auto_unroll_max_step", "ot", 0], ["unroll_explicit", "ot", 0]]}, "result": [[3.3038321428571427e-05, 3.304382680722891e-05, 3.304448988812393e-05], 0, 1.7052597999572754, 1678500280.8992982], "version": 0.2, "tvm_version": "0.10.0"}
{"input": ["cuda -keys=cuda,gpu -arch=sm_86 -max_num_threads=1024 -thread_warp_size=32", "depthwise_conv2d_nchw.cuda", [["TENSOR", [1, 512, 14, 14], "float32"], ["TENSOR", [512, 1, 3, 3], "float32"], [1, 1], [1, 1, 1, 1], [1, 1], "float32"], {}], "config": {"index": 82, "code_hash": null, "entity": [["tile_f", "sp", [-1, 8, 8, 2]], ["tile_y", "sp", [-1, 1, 1, 1]], ["tile_x", "sp", [-1, 1, 1, 1]], ["auto_unroll_max_step", "ot", 0], ["unroll_explicit", "ot", 0]]}, "result": [[5.708328921745401e-05, 5.7093975477821854e-05, 5.710023187883159e-05], 0, 1.8399708271026611, 1678500282.1054006], "version": 0.2, "tvm_version": "0.10.0"}
{"input": ["cuda -keys=cuda,gpu -arch=sm_86 -max_num_threads=1024 -thread_warp_size=32", "depthwise_conv2d_nchw.cuda", [["TENSOR", [1, 512, 14, 14], "float32"], ["TENSOR", [512, 1, 3, 3], "float32"], [1, 1], [1, 1, 1, 1], [1, 1], "float32"], {}], "config": {"index": 83, "code_hash": null, "entity": [["tile_f", "sp", [-1, 16, 8, 2]], ["tile_y", "sp", [-1, 1, 1, 1]], ["tile_x", "sp", [-1, 1, 1, 1]], ["auto_unroll_max_step", "ot", 0], ["unroll_explicit", "ot", 0]]}, "result": [[0.0001984375931122449, 0.00019846270025510203, 0.0001984783673469388], 0, 2.5941712856292725, 1678500283.3106997], "version": 0.2, "tvm_version": "0.10.0"}
{"input": ["cuda -keys=cuda,gpu -arch=sm_86 -max_num_threads=1024 -thread_warp_size=32", "depthwise_conv2d_nchw.cuda", [["TENSOR", [1, 512, 14, 14], "float32"], ["TENSOR", [512, 1, 3, 3], "float32"], [1, 1], [1, 1, 1, 1], [1, 1], "float32"], {}], "config": {"index": 84, "code_hash": null, "entity": [["tile_f", "sp", [-1, 32, 8, 2]], ["tile_y", "sp", [-1, 1, 1, 1]], ["tile_x", "sp", [-1, 1, 1, 1]], ["auto_unroll_max_step", "ot", 0], ["unroll_explicit", "ot", 0]]}, "result": [[0.00041184155440414507, 0.00041201940155440416, 0.0004120592098445596], 0, 4.03931188583374, 1678500284.531143], "version": 0.2, "tvm_version": "0.10.0"}
{"input": ["cuda -keys=cuda,gpu -arch=sm_86 -max_num_threads=1024 -thread_warp_size=32", "depthwise_conv2d_nchw.cuda", [["TENSOR", [1, 512, 14, 14], "float32"], ["TENSOR", [512, 1, 3, 3], "float32"], [1, 1], [1, 1, 1, 1], [1, 1], "float32"], {}], "config": {"index": 85, "code_hash": null, "entity": [["tile_f", "sp", [-1, 1, 16, 2]], ["tile_y", "sp", [-1, 1, 1, 1]], ["tile_x", "sp", [-1, 1, 1, 1]], ["auto_unroll_max_step", "ot", 0], ["unroll_explicit", "ot", 0]]}, "result": [[1.560034800299818e-05, 1.560506339008459e-05, 1.5663066067030734e-05], 0, 1.5712192058563232, 1678500285.6753416], "version": 0.2, "tvm_version": "0.10.0"}
{"input": ["cuda -keys=cuda,gpu -arch=sm_86 -max_num_threads=1024 -thread_warp_size=32", "depthwise_conv2d_nchw.cuda", [["TENSOR", [1, 512, 14, 14], "float32"], ["TENSOR", [512, 1, 3, 3], "float32"], [1, 1], [1, 1, 1, 1], [1, 1], "float32"], {}], "config": {"index": 86, "code_hash": null, "entity": [["tile_f", "sp", [-1, 2, 16, 2]], ["tile_y", "sp", [-1, 1, 1, 1]], ["tile_x", "sp", [-1, 1, 1, 1]], ["auto_unroll_max_step", "ot", 0], ["unroll_explicit", "ot", 0]]}, "result": [[1.923108653347172e-05, 1.9231717955371044e-05, 1.9232414763881682e-05], 0, 1.577777624130249, 1678500286.8259673], "version": 0.2, "tvm_version": "0.10.0"}
{"input": ["cuda -keys=cuda,gpu -arch=sm_86 -max_num_threads=1024 -thread_warp_size=32", "depthwise_conv2d_nchw.cuda", [["TENSOR", [1, 512, 14, 14], "float32"], ["TENSOR", [512, 1, 3, 3], "float32"], [1, 1], [1, 1, 1, 1], [1, 1], "float32"], {}], "config": {"index": 87, "code_hash": null, "entity": [["tile_f", "sp", [-1, 4, 16, 2]], ["tile_y", "sp", [-1, 1, 1, 1]], ["tile_x", "sp", [-1, 1, 1, 1]], ["auto_unroll_max_step", "ot", 0], ["unroll_explicit", "ot", 0]]}, "result": [[3.256398283170835e-05, 3.25661528189911e-05, 3.256723632895295e-05], 0, 1.691066026687622, 1678500288.0162516], "version": 0.2, "tvm_version": "0.10.0"}
{"input": ["cuda -keys=cuda,gpu -arch=sm_86 -max_num_threads=1024 -thread_warp_size=32", "depthwise_conv2d_nchw.cuda", [["TENSOR", [1, 512, 14, 14], "float32"], ["TENSOR", [512, 1, 3, 3], "float32"], [1, 1], [1, 1, 1, 1], [1, 1], "float32"], {}], "config": {"index": 88, "code_hash": null, "entity": [["tile_f", "sp", [-1, 8, 16, 2]], ["tile_y", "sp", [-1, 1, 1, 1]], ["tile_x", "sp", [-1, 1, 1, 1]], ["auto_unroll_max_step", "ot", 0], ["unroll_explicit", "ot", 0]]}, "result": [[5.950603635667814e-05, 5.9523578262533485e-05, 5.952994336012246e-05], 0, 1.8008208274841309, 1678500289.205647], "version": 0.2, "tvm_version": "0.10.0"}
{"input": ["cuda -keys=cuda,gpu -arch=sm_86 -max_num_threads=1024 -thread_warp_size=32", "depthwise_conv2d_nchw.cuda", [["TENSOR", [1, 512, 14, 14], "float32"], ["TENSOR", [512, 1, 3, 3], "float32"], [1, 1], [1, 1, 1, 1], [1, 1], "float32"], {}], "config": {"index": 89, "code_hash": null, "entity": [["tile_f", "sp", [-1, 16, 16, 2]], ["tile_y", "sp", [-1, 1, 1, 1]], ["tile_x", "sp", [-1, 1, 1, 1]], ["auto_unroll_max_step", "ot", 0], ["unroll_explicit", "ot", 0]]}, "result": [[0.00020725127150537635, 0.0002072677809139785, 0.00020735022715053766], 0, 2.568894147872925, 1678500290.4001262], "version": 0.2, "tvm_version": "0.10.0"}
{"input": ["cuda -keys=cuda,gpu -arch=sm_86 -max_num_threads=1024 -thread_warp_size=32", "depthwise_conv2d_nchw.cuda", [["TENSOR", [1, 512, 14, 14], "float32"], ["TENSOR", [512, 1, 3, 3], "float32"], [1, 1], [1, 1, 1, 1], [1, 1], "float32"], {}], "config": {"index": 90, "code_hash": null, "entity": [["tile_f", "sp", [-1, 1, 32, 2]], ["tile_y", "sp", [-1, 1, 1, 1]], ["tile_x", "sp", [-1, 1, 1, 1]], ["auto_unroll_max_step", "ot", 0], ["unroll_explicit", "ot", 0]]}, "result": [[1.259373952334544e-05, 1.2615869938867723e-05, 1.2616139009479933e-05], 0, 1.5488548278808594, 1678500291.5108993], "version": 0.2, "tvm_version": "0.10.0"}
{"input": ["cuda -keys=cuda,gpu -arch=sm_86 -max_num_threads=1024 -thread_warp_size=32", "depthwise_conv2d_nchw.cuda", [["TENSOR", [1, 512, 14, 14], "float32"], ["TENSOR", [512, 1, 3, 3], "float32"], [1, 1], [1, 1, 1, 1], [1, 1], "float32"], {}], "config": {"index": 91, "code_hash": null, "entity": [["tile_f", "sp", [-1, 2, 32, 2]], ["tile_y", "sp", [-1, 1, 1, 1]], ["tile_x", "sp", [-1, 1, 1, 1]], ["auto_unroll_max_step", "ot", 0], ["unroll_explicit", "ot", 0]]}, "result": [[1.9354291738496223e-05, 1.9355513857578572e-05, 1.9357415859965524e-05], 0, 1.6048815250396729, 1678500292.6786227], "version": 0.2, "tvm_version": "0.10.0"}
{"input": ["cuda -keys=cuda,gpu -arch=sm_86 -max_num_threads=1024 -thread_warp_size=32", "depthwise_conv2d_nchw.cuda", [["TENSOR", [1, 512, 14, 14], "float32"], ["TENSOR", [512, 1, 3, 3], "float32"], [1, 1], [1, 1, 1, 1], [1, 1], "float32"], {}], "config": {"index": 92, "code_hash": null, "entity": [["tile_f", "sp", [-1, 4, 32, 2]], ["tile_y", "sp", [-1, 1, 1, 1]], ["tile_x", "sp", [-1, 1, 1, 1]], ["auto_unroll_max_step", "ot", 0], ["unroll_explicit", "ot", 0]]}, "result": [[3.316914393287436e-05, 3.317028635972461e-05, 3.317358885542169e-05], 0, 1.6788368225097656, 1678500293.8590834], "version": 0.2, "tvm_version": "0.10.0"}
{"input": ["cuda -keys=cuda,gpu -arch=sm_86 -max_num_threads=1024 -thread_warp_size=32", "depthwise_conv2d_nchw.cuda", [["TENSOR", [1, 512, 14, 14], "float32"], ["TENSOR", [512, 1, 3, 3], "float32"], [1, 1], [1, 1, 1, 1], [1, 1], "float32"], {}], "config": {"index": 93, "code_hash": null, "entity": [["tile_f", "sp", [-1, 8, 32, 2]], ["tile_y", "sp", [-1, 1, 1, 1]], ["tile_x", "sp", [-1, 1, 1, 1]], ["auto_unroll_max_step", "ot", 0], ["unroll_explicit", "ot", 0]]}, "result": [[6.222458214849921e-05, 6.222823420221169e-05, 6.223994944707741e-05], 0, 1.8013081550598145, 1678500295.0755177], "version": 0.2, "tvm_version": "0.10.0"}
{"input": ["cuda -keys=cuda,gpu -arch=sm_86 -max_num_threads=1024 -thread_warp_size=32", "depthwise_conv2d_nchw.cuda", [["TENSOR", [1, 512, 14, 14], "float32"], ["TENSOR", [512, 1, 3, 3], "float32"], [1, 1], [1, 1, 1, 1], [1, 1], "float32"], {}], "config": {"index": 94, "code_hash": null, "entity": [["tile_f", "sp", [-1, 1, 64, 2]], ["tile_y", "sp", [-1, 1, 1, 1]], ["tile_x", "sp", [-1, 1, 1, 1]], ["auto_unroll_max_step", "ot", 0], ["unroll_explicit", "ot", 0]]}, "result": [[1.3036109240719411e-05, 1.3041280145299903e-05, 1.3049081952688935e-05], 0, 1.5771145820617676, 1678500296.2245305], "version": 0.2, "tvm_version": "0.10.0"}
{"input": ["cuda -keys=cuda,gpu -arch=sm_86 -max_num_threads=1024 -thread_warp_size=32", "depthwise_conv2d_nchw.cuda", [["TENSOR", [1, 512, 14, 14], "float32"], ["TENSOR", [512, 1, 3, 3], "float32"], [1, 1], [1, 1, 1, 1], [1, 1], "float32"], {}], "config": {"index": 95, "code_hash": null, "entity": [["tile_f", "sp", [-1, 2, 64, 2]], ["tile_y", "sp", [-1, 1, 1, 1]], ["tile_x", "sp", [-1, 1, 1, 1]], ["auto_unroll_max_step", "ot", 0], ["unroll_explicit", "ot", 0]]}, "result": [[1.936951427088739e-05, 1.9370577322262586e-05, 1.937137506486767e-05], 0, 1.6029365062713623, 1678500297.3885093], "version": 0.2, "tvm_version": "0.10.0"}
{"input": ["cuda -keys=cuda,gpu -arch=sm_86 -max_num_threads=1024 -thread_warp_size=32", "depthwise_conv2d_nchw.cuda", [["TENSOR", [1, 512, 14, 14], "float32"], ["TENSOR", [512, 1, 3, 3], "float32"], [1, 1], [1, 1, 1, 1], [1, 1], "float32"], {}], "config": {"index": 96, "code_hash": null, "entity": [["tile_f", "sp", [-1, 4, 64, 2]], ["tile_y", "sp", [-1, 1, 1, 1]], ["tile_x", "sp", [-1, 1, 1, 1]], ["auto_unroll_max_step", "ot", 0], ["unroll_explicit", "ot", 0]]}, "result": [[3.358034216445888e-05, 3.361463534116471e-05, 3.402438790302425e-05], 0, 1.5011699199676514, 1678500301.763719], "version": 0.2, "tvm_version": "0.10.0"}
{"input": ["cuda -keys=cuda,gpu -arch=sm_86 -max_num_threads=1024 -thread_warp_size=32", "depthwise_conv2d_nchw.cuda", [["TENSOR", [1, 512, 14, 14], "float32"], ["TENSOR", [512, 1, 3, 3], "float32"], [1, 1], [1, 1, 1, 1], [1, 1], "float32"], {}], "config": {"index": 100, "code_hash": null, "entity": [["tile_f", "sp", [-1, 1, 1, 4]], ["tile_y", "sp", [-1, 1, 1, 1]], ["tile_x", "sp", [-1, 1, 1, 1]], ["auto_unroll_max_step", "ot", 0], ["unroll_explicit", "ot", 0]]}, "result": [[5.3482334461746785e-05, 5.3483026743398785e-05, 5.3483372714962764e-05], 0, 1.5893409252166748, 1678500302.9747136], "version": 0.2, "tvm_version": "0.10.0"}
{"input": ["cuda -keys=cuda,gpu -arch=sm_86 -max_num_threads=1024 -thread_warp_size=32", "depthwise_conv2d_nchw.cuda", [["TENSOR", [1, 512, 14, 14], "float32"], ["TENSOR", [512, 1, 3, 3], "float32"], [1, 1], [1, 1, 1, 1], [1, 1], "float32"], {}], "config": {"index": 101, "code_hash": null, "entity": [["tile_f", "sp", [-1, 2, 1, 4]], ["tile_y", "sp", [-1, 1, 1, 1]], ["tile_x", "sp", [-1, 1, 1, 1]], ["auto_unroll_max_step", "ot", 0], ["unroll_explicit", "ot", 0]]}, "result": [[7.442898917137476e-05, 7.443091431261771e-05, 7.443477212806026e-05], 0, 1.5573139190673828, 1678500304.1820767], "version": 0.2, "tvm_version": "0.10.0"}
{"input": ["cuda -keys=cuda,gpu -arch=sm_86 -max_num_threads=1024 -thread_warp_size=32", "depthwise_conv2d_nchw.cuda", [["TENSOR", [1, 512, 14, 14], "float32"], ["TENSOR", [512, 1, 3, 3], "float32"], [1, 1], [1, 1, 1, 1], [1, 1], "float32"], {}], "config": {"index": 102, "code_hash": null, "entity": [["tile_f", "sp", [-1, 4, 1, 4]], ["tile_y", "sp", [-1, 1, 1, 1]], ["tile_x", "sp", [-1, 1, 1, 1]], ["auto_unroll_max_step", "ot", 0], ["unroll_explicit", "ot", 0]]}, "result": [[7.700080340170085e-05, 7.701104702351176e-05, 7.70197563781891e-05], 0, 1.7486145496368408, 1678500305.3721087], "version": 0.2, "tvm_version": "0.10.0"}
{"input": ["cuda -keys=cuda,gpu -arch=sm_86 -max_num_threads=1024 -thread_warp_size=32", "depthwise_conv2d_nchw.cuda", [["TENSOR", [1, 512, 14, 14], "float32"], ["TENSOR", [512, 1, 3, 3], "float32"], [1, 1], [1, 1, 1, 1], [1, 1], "float32"], {}], "config": {"index": 103, "code_hash": null, "entity": [["tile_f", "sp", [-1, 8, 1, 4]], ["tile_y", "sp", [-1, 1, 1, 1]], ["tile_x", "sp", [-1, 1, 1, 1]], ["auto_unroll_max_step", "ot", 0], ["unroll_explicit", "ot", 0]]}, "result": [[0.00011919552701702441, 0.00011921835307179868, 0.00011922210288675057], 0, 1.9104828834533691, 1678500306.5888665], "version": 0.2, "tvm_version": "0.10.0"}
{"input": ["cuda -keys=cuda,gpu -arch=sm_86 -max_num_threads=1024 -thread_warp_size=32", "depthwise_conv2d_nchw.cuda", [["TENSOR", [1, 512, 14, 14], "float32"], ["TENSOR", [512, 1, 3, 3], "float32"], [1, 1], [1, 1, 1, 1], [1, 1], "float32"], {}], "config": {"index": 104, "code_hash": null, "entity": [["tile_f", "sp", [-1, 16, 1, 4]], ["tile_y", "sp", [-1, 1, 1, 1]], ["tile_x", "sp", [-1, 1, 1, 1]], ["auto_unroll_max_step", "ot", 0], ["unroll_explicit", "ot", 0]]}, "result": [[0.0007020079082969432, 0.0007023119519650655, 0.0007026344497816594], 0, 2.5040228366851807, 1678500307.8132575], "version": 0.2, "tvm_version": "0.10.0"}
{"input": ["cuda -keys=cuda,gpu -arch=sm_86 -max_num_threads=1024 -thread_warp_size=32", "depthwise_conv2d_nchw.cuda", [["TENSOR", [1, 512, 14, 14], "float32"], ["TENSOR", [512, 1, 3, 3], "float32"], [1, 1], [1, 1, 1, 1], [1, 1], "float32"], {}], "config": {"index": 105, "code_hash": null, "entity": [["tile_f", "sp", [-1, 32, 1, 4]], ["tile_y", "sp", [-1, 1, 1, 1]], ["tile_x", "sp", [-1, 1, 1, 1]], ["auto_unroll_max_step", "ot", 0], ["unroll_explicit", "ot", 0]]}, "result": [[0.0008673387608695652, 0.0008675782554347826, 0.0008676831576086957], 0, 3.41386342048645, 1678500309.0523138], "version": 0.2, "tvm_version": "0.10.0"}
{"input": ["cuda -keys=cuda,gpu -arch=sm_86 -max_num_threads=1024 -thread_warp_size=32", "depthwise_conv2d_nchw.cuda", [["TENSOR", [1, 512, 14, 14], "float32"], ["TENSOR", [512, 1, 3, 3], "float32"], [1, 1], [1, 1, 1, 1], [1, 1], "float32"], {}], "config": {"index": 106, "code_hash": null, "entity": [["tile_f", "sp", [-1, 64, 1, 4]], ["tile_y", "sp", [-1, 1, 1, 1]], ["tile_x", "sp", [-1, 1, 1, 1]], ["auto_unroll_max_step", "ot", 0], ["unroll_explicit", "ot", 0]]}, "result": [[0.0014738672941176471, 0.0014741660735294118, 0.001474168426470588], 0, 3.2888011932373047, 1678500309.881305], "version": 0.2, "tvm_version": "0.10.0"}
{"input": ["cuda -keys=cuda,gpu -arch=sm_86 -max_num_threads=1024 -thread_warp_size=32", "depthwise_conv2d_nchw.cuda", [["TENSOR", [1, 512, 14, 14], "float32"], ["TENSOR", [512, 1, 3, 3], "float32"], [1, 1], [1, 1, 1, 1], [1, 1], "float32"], {}], "config": {"index": 107, "code_hash": null, "entity": [["tile_f", "sp", [-1, 128, 1, 4]], ["tile_y", "sp", [-1, 1, 1, 1]], ["tile_x", "sp", [-1, 1, 1, 1]], ["auto_unroll_max_step", "ot", 0], ["unroll_explicit", "ot", 0]]}, "result": [[0.0016514602295081967, 0.0016518126885245903, 0.0016518268196721313], 0, 3.9619815349578857, 1678500310.6984487], "version": 0.2, "tvm_version": "0.10.0"}
{"input": ["cuda -keys=cuda,gpu -arch=sm_86 -max_num_threads=1024 -thread_warp_size=32", "depthwise_conv2d_nchw.cuda", [["TENSOR", [1, 512, 14, 14], "float32"], ["TENSOR", [512, 1, 3, 3], "float32"], [1, 1], [1, 1, 1, 1], [1, 1], "float32"], {}], "config": {"index": 108, "code_hash": null, "entity": [["tile_f", "sp", [-1, 1, 2, 4]], ["tile_y", "sp", [-1, 1, 1, 1]], ["tile_x", "sp", [-1, 1, 1, 1]], ["auto_unroll_max_step", "ot", 0], ["unroll_explicit", "ot", 0]]}, "result": [[6.928526253298153e-05, 6.928931530343009e-05, 6.929021459982409e-05], 0, 1.4948782920837402, 1678500311.9092636], "version": 0.2, "tvm_version": "0.10.0"}
