results/cuda_gtx1650/inception_v3/random/cpu.log_layer_6.log
{"input": ["cuda -keys=cuda,gpu -arch=sm_75 -max_num_threads=1024 -thread_warp_size=32", "conv2d_nchw.cuda", [["TENSOR", [1, 80, 73, 73], "float32"], ["TENSOR", [192, 80, 3, 3], "float32"], [1, 1], [0, 0, 0, 0], [1, 1], "float32"], {}], "config": {"index": 787633, "code_hash": null, "entity": [["tile_f", "sp", [-1, 1, 8, 1]], ["tile_y", "sp", [-1, 1, 1, 1]], ["tile_x", "sp", [-1, 1, 71, 1]], ["tile_rc", "sp", [-1, 16]], ["tile_ry", "sp", [-1, 1]], ["tile_rx", "sp", [-1, 3]], ["auto_unroll_max_step", "ot", 0], ["unroll_explicit", "ot", 1]]}, "result": [[0.0040875562, 0.004088124833333333, 0.004093003833333333], 0, 1.3726940155029297, 1678777843.5256846], "version": 0.2, "tvm_version": "0.10.0"}
{"input": ["cuda -keys=cuda,gpu -arch=sm_75 -max_num_threads=1024 -thread_warp_size=32", "conv2d_nchw.cuda", [["TENSOR", [1, 80, 73, 73], "float32"], ["TENSOR", [192, 80, 3, 3], "float32"], [1, 1], [0, 0, 0, 0], [1, 1], "float32"], {}], "config": {"index": 474334, "code_hash": null, "entity": [["tile_f", "sp", [-1, 1, 16, 6]], ["tile_y", "sp", [-1, 1, 1, 71]], ["tile_x", "sp", [-1, 1, 1, 1]], ["tile_rc", "sp", [-1, 40]], ["tile_ry", "sp", [-1, 1]], ["tile_rx", "sp", [-1, 1]], ["auto_unroll_max_step", "ot", 1500], ["unroll_explicit", "ot", 0]]}, "result": [[0.03529045333333333, 0.03547205333333334, 0.03633015433333334], 0, 3.0014498233795166, 1678777844.5312395], "version": 0.2, "tvm_version": "0.10.0"}
{"input": ["cuda -keys=cuda,gpu -arch=sm_75 -max_num_threads=1024 -thread_warp_size=32", "conv2d_nchw.cuda", [["TENSOR", [1, 80, 73, 73], "float32"], ["TENSOR", [192, 80, 3, 3], "float32"], [1, 1], [0, 0, 0, 0], [1, 1], "float32"], {}], "config": {"index": 271145, "code_hash": null, "entity": [["tile_f", "sp", [-1, 1, 1, 64]], ["tile_y", "sp", [-1, 1, 71, 1]], ["tile_x", "sp", [-1, 71, 1, 1]], ["tile_rc", "sp", [-1, 1]], ["tile_ry", "sp", [-1, 3]], ["tile_rx", "sp", [-1, 1]], ["auto_unroll_max_step", "ot", 512], ["unroll_explicit", "ot", 0]]}, "result": [[0.085277069, 0.08593271599999999, 0.0859443205], 0, 1.9957001209259033, 1678777845.8724654], "version": 0.2, "tvm_version": "0.10.0"}
{"input": ["cuda -keys=cuda,gpu -arch=sm_75 -max_num_threads=1024 -thread_warp_size=32", "conv2d_nchw.cuda", [["TENSOR", [1, 80, 73, 73], "float32"], ["TENSOR", [192, 80, 3, 3], "float32"], [1, 1], [0, 0, 0, 0], [1, 1], "float32"], {}], "config": {"index": 220754, "code_hash": null, "entity": [["tile_f", "sp", [-1, 3, 1, 1]], ["tile_y", "sp", [-1, 71, 1, 1]], ["tile_x", "sp", [-1, 1, 1, 1]], ["tile_rc", "sp", [-1, 2]], ["tile_ry", "sp", [-1, 1]], ["tile_rx", "sp", [-1, 1]], ["auto_unroll_max_step", "ot", 512], ["unroll_explicit", "ot", 0]]}, "result": [[0.033346900666666665, 0.03337085966666666, 0.033400917], 0, 1.713557481765747, 1678777846.9688978], "version": 0.2, "tvm_version": "0.10.0"}
{"input": ["cuda -keys=cuda,gpu -arch=sm_75 -max_num_threads=1024 -thread_warp_size=32", "conv2d_nchw.cuda", [["TENSOR", [1, 80, 73, 73], "float32"], ["TENSOR", [192, 80, 3, 3], "float32"], [1, 1], [0, 0, 0, 0], [1, 1], "float32"], {}], "config": {"index": 979831, "code_hash": null, "entity": [["tile_f", "sp", [-1, 12, 8, 1]], ["tile_y", "sp", [-1, 1, 1, 1]], ["tile_x", "sp", [-1, 71, 1, 1]], ["tile_rc", "sp", [-1, 4]], ["tile_ry", "sp", [-1, 1]], ["tile_rx", "sp", [-1, 3]], ["auto_unroll_max_step", "ot", 512], ["unroll_explicit", "ot", 1]]}, "result": [[0.191972351, 0.19238298, 0.1927216335], 0, 3.4212942123413086, 1678777849.4325402], "version": 0.2, "tvm_version": "0.10.0"}
{"input": ["cuda -keys=cuda,gpu -arch=sm_75 -max_num_threads=1024 -thread_warp_size=32", "conv2d_nchw.cuda", [["TENSOR", [1, 80, 73, 73], "float32"], ["TENSOR", [192, 80, 3, 3], "float32"], [1, 1], [0, 0, 0, 0], [1, 1], "float32"], {}], "config": {"index": 8656, "code_hash": null, "entity": [["tile_f", "sp", [-1, 2, 3, 8]], ["tile_y", "sp", [-1, 71, 1, 1]], ["tile_x", "sp", [-1, 1, 71, 1]], ["tile_rc", "sp", [-1, 2]], ["tile_ry", "sp", [-1, 1]], ["tile_rx", "sp", [-1, 1]], ["auto_unroll_max_step", "ot", 0], ["unroll_explicit", "ot", 0]]}, "result": [[0.046698475999999996, 0.046706217333333334, 0.046770594], 0, 2.243790626525879, 1678777859.26614], "version": 0.2, "tvm_version": "0.10.0"}
{"input": ["cuda -keys=cuda,gpu -arch=sm_75 -max_num_threads=1024 -thread_warp_size=32", "conv2d_nchw.cuda", [["TENSOR", [1, 80, 73, 73], "float32"], ["TENSOR", [192, 80, 3, 3], "float32"], [1, 1], [0, 0, 0, 0], [1, 1], "float32"], {}], "config": {"index": 489101, "code_hash": null, "entity": [["tile_f", "sp", [-1, 2, 1, 6]], ["tile_y", "sp", [-1, 1, 1, 71]], ["tile_x", "sp", [-1, 1, 1, 71]], ["tile_rc", "sp", [-1, 1]], ["tile_ry", "sp", [-1, 3]], ["tile_rx", "sp", [-1, 1]], ["auto_unroll_max_step", "ot", 1500], ["unroll_explicit", "ot", 0]]}, "result": [[0.819250671, 0.8203345945, 0.820744812], 0, 10.522216796875, 1678777868.6535218], "version": 0.2, "tvm_version": "0.10.0"}
{"input": ["cuda -keys=cuda,gpu -arch=sm_75 -max_num_threads=1024 -thread_warp_size=32", "conv2d_nchw.cuda", [["TENSOR", [1, 80, 73, 73], "float32"], ["TENSOR", [192, 80, 3, 3], "float32"], [1, 1], [0, 0, 0, 0], [1, 1], "float32"], {}], "config": {"index": 590147, "code_hash": null, "entity": [["tile_f", "sp", [-1, 1, 12, 2]], ["tile_y", "sp", [-1, 1, 1, 1]], ["tile_x", "sp", [-1, 1, 1, 71]], ["tile_rc", "sp", [-1, 80]], ["tile_ry", "sp", [-1, 1]], ["tile_rx", "sp", [-1, 3]], ["auto_unroll_max_step", "ot", 1500], ["unroll_explicit", "ot", 0]]}, "result": [[0.016054807285714286, 0.01605632014285714, 0.016057197428571427], 0, 9.436023473739624, 1678777870.071212], "version": 0.2, "tvm_version": "0.10.0"}
{"input": ["cuda -keys=cuda,gpu -arch=sm_75 -max_num_threads=1024 -thread_warp_size=32", "conv2d_nchw.cuda", [["TENSOR", [1, 80, 73, 73], "float32"], ["TENSOR", [192, 80, 3, 3], "float32"], [1, 1], [0, 0, 0, 0], [1, 1], "float32"], {}], "config": {"index": 834676, "code_hash": null, "entity": [["tile_f", "sp", [-1, 4, 8, 1]], ["tile_y", "sp", [-1, 1, 1, 1]], ["tile_x", "sp", [-1, 71, 1, 1]], ["tile_rc", "sp", [-1, 10]], ["tile_ry", "sp", [-1, 3]], ["tile_rx", "sp", [-1, 3]], ["auto_unroll_max_step", "ot", 0], ["unroll_explicit", "ot", 1]]}, "result": [[0.04245027133333334, 0.04255622333333334, 0.04300300566666667], 0, 2.0465517044067383, 1678777871.2320986], "version": 0.2, "tvm_version": "0.10.0"}
{"input": ["cuda -keys=cuda,gpu -arch=sm_75 -max_num_threads=1024 -thread_warp_size=32", "conv2d_nchw.cuda", [["TENSOR", [1, 80, 73, 73], "float32"], ["TENSOR", [192, 80, 3, 3], "float32"], [1, 1], [0, 0, 0, 0], [1, 1], "float32"], {}], "config": {"index": 488881, "code_hash": null, "entity": [["tile_f", "sp", [-1, 2, 1, 1]], ["tile_y", "sp", [-1, 1, 1, 71]], ["tile_x", "sp", [-1, 1, 1, 71]], ["tile_rc", "sp", [-1, 1]], ["tile_ry", "sp", [-1, 3]], ["tile_rx", "sp", [-1, 1]], ["auto_unroll_max_step", "ot", 1500], ["unroll_explicit", "ot", 0]]}, "result": [[0.7998399654999999, 0.8069683225, 0.81284082], 0, 10.116493940353394, 1678777880.4687872], "version": 0.2, "tvm_version": "0.10.0"}
{"input": ["cuda -keys=cuda,gpu -arch=sm_75 -max_num_threads=1024 -thread_warp_size=32", "conv2d_nchw.cuda", [["TENSOR", [1, 80, 73, 73], "float32"], ["TENSOR", [192, 80, 3, 3], "float32"], [1, 1], [0, 0, 0, 0], [1, 1], "float32"], {}], "config": {"index": 762828, "code_hash": null, "entity": [["tile_f", "sp", [-1, 4, 3, 2]], ["tile_y", "sp", [-1, 1, 71, 1]], ["tile_x", "sp", [-1, 1, 1, 71]], ["tile_rc", "sp", [-1, 2]], ["tile_ry", "sp", [-1, 1]], ["tile_rx", "sp", [-1, 3]], ["auto_unroll_max_step", "ot", 0], ["unroll_explicit", "ot", 1]]}, "result": [[0.04032052333333333, 0.040366826333333335, 0.040441172], 0, 2.878676414489746, 1678777881.5696886], "version": 0.2, "tvm_version": "0.10.0"}
{"input": ["cuda -keys=cuda,gpu -arch=sm_75 -max_num_threads=1024 -thread_warp_size=32", "conv2d_nchw.cuda", [["TENSOR", [1, 80, 73, 73], "float32"], ["TENSOR", [192, 80, 3, 3], "float32"], [1, 1], [0, 0, 0, 0], [1, 1], "float32"], {}], "config": {"index": 828953, "code_hash": null, "entity": [["tile_f", "sp", [-1, 24, 4, 1]], ["tile_y", "sp", [-1, 1, 1, 71]], ["tile_x", "sp", [-1, 1, 1, 1]], ["tile_rc", "sp", [-1, 8]], ["tile_ry", "sp", [-1, 3]], ["tile_rx", "sp", [-1, 3]], ["auto_unroll_max_step", "ot", 0], ["unroll_explicit", "ot", 1]]}, "result": [[0.3485747985, 0.34917904650000003, 0.3509210815], 0, 4.893629550933838, 1678777895.90319], "version": 0.2, "tvm_version": "0.10.0"}
{"input": ["cuda -keys=cuda,gpu -arch=sm_75 -max_num_threads=1024 -thread_warp_size=32", "conv2d_nchw.cuda", [["TENSOR", [1, 80, 73, 73], "float32"], ["TENSOR", [192, 80, 3, 3], "float32"], [1, 1], [0, 0, 0, 0], [1, 1], "float32"], {}], "config": {"index": 703687, "code_hash": null, "entity": [["tile_f", "sp", [-1, 16, 2, 2]], ["tile_y", "sp", [-1, 1, 71, 1]], ["tile_x", "sp", [-1, 1, 1, 71]], ["tile_rc", "sp", [-1, 1]], ["tile_ry", "sp", [-1, 3]], ["tile_rx", "sp", [-1, 1]], ["auto_unroll_max_step", "ot", 0], ["unroll_explicit", "ot", 1]]}, "result": [[0.0669868315, 0.06716629, 0.06742972550000001], 0, 1.5735046863555908, 1678777897.0071857], "version": 0.2, "tvm_version": "0.10.0"}
{"input": ["cuda -keys=cuda,gpu -arch=sm_75 -max_num_threads=1024 -thread_warp_size=32", "conv2d_nchw.cuda", [["TENSOR", [1, 80, 73, 73], "float32"], ["TENSOR", [192, 80, 3, 3], "float32"], [1, 1], [0, 0, 0, 0], [1, 1], "float32"], {}], "config": {"index": 588675, "code_hash": null, "entity": [["tile_f", "sp", [-1, 4, 1, 1]], ["tile_y", "sp", [-1, 1, 1, 1]], ["tile_x", "sp", [-1, 1, 71, 1]], ["tile_rc", "sp", [-1, 80]], ["tile_ry", "sp", [-1, 1]], ["tile_rx", "sp", [-1, 3]], ["auto_unroll_max_step", "ot", 1500], ["unroll_explicit", "ot", 0]]}, "result": [[0.005290302473684211, 0.005295959421052631, 0.005312414421052632], 0, 2.48419189453125, 1678777897.913056], "version": 0.2, "tvm_version": "0.10.0"}
{"input": ["cuda -keys=cuda,gpu -arch=sm_75 -max_num_threads=1024 -thread_warp_size=32", "conv2d_nchw.cuda", [["TENSOR", [1, 80, 73, 73], "float32"], ["TENSOR", [192, 80, 3, 3], "float32"], [1, 1], [0, 0, 0, 0], [1, 1], "float32"], {}], "config": {"index": 1163918, "code_hash": null, "entity": [["tile_f", "sp", [-1, 1, 2, 1]], ["tile_y", "sp", [-1, 1, 1, 1]], ["tile_x", "sp", [-1, 1, 71, 1]], ["tile_rc", "sp", [-1, 16]], ["tile_ry", "sp", [-1, 3]], ["tile_rx", "sp", [-1, 1]], ["auto_unroll_max_step", "ot", 1500], ["unroll_explicit", "ot", 1]]}, "result": [[0.015858167285714285, 0.015860767857142858, 0.015860882285714285], 0, 4.167680263519287, 1678777898.8780193], "version": 0.2, "tvm_version": "0.10.0"}
{"input": ["cuda -keys=cuda,gpu -arch=sm_75 -max_num_threads=1024 -thread_warp_size=32", "conv2d_nchw.cuda", [["TENSOR", [1, 80, 73, 73], "float32"], ["TENSOR", [192, 80, 3, 3], "float32"], [1, 1], [0, 0, 0, 0], [1, 1], "float32"], {}], "config": {"index": 28141, "code_hash": null, "entity": [["tile_f", "sp", [-1, 6, 2, 8]], ["tile_y", "sp", [-1, 1, 1, 71]], ["tile_x", "sp", [-1, 1, 1, 1]], ["tile_rc", "sp", [-1, 10]], ["tile_ry", "sp", [-1, 1]], ["tile_rx", "sp", [-1, 1]], ["auto_unroll_max_step", "ot", 0], ["unroll_explicit", "ot", 0]]}, "result": [[0.6704354855, 0.6710097045, 0.6714388425], 0, 9.047550916671753, 1678777917.1849644], "version": 0.2, "tvm_version": "0.10.0"}
{"input": ["cuda -keys=cuda,gpu -arch=sm_75 -max_num_threads=1024 -thread_warp_size=32", "conv2d_nchw.cuda", [["TENSOR", [1, 80, 73, 73], "float32"], ["TENSOR", [192, 80, 3, 3], "float32"], [1, 1], [0, 0, 0, 0], [1, 1], "float32"], {}], "config": {"index": 1204503, "code_hash": null, "entity": [["tile_f", "sp", [-1, 8, 2, 12]], ["tile_y", "sp", [-1, 1, 1, 1]], ["tile_x", "sp", [-1, 1, 1, 1]], ["tile_rc", "sp", [-1, 8]], ["tile_ry", "sp", [-1, 1]], ["tile_rx", "sp", [-1, 3]], ["auto_unroll_max_step", "ot", 1500], ["unroll_explicit", "ot", 1]]}, "result": [[0.4221644895, 0.422207092, 0.42227310149999997], 0, 6.271880149841309, 1678777922.212267], "version": 0.2, "tvm_version": "0.10.0"}
{"input": ["cuda -keys=cuda,gpu -arch=sm_75 -max_num_threads=1024 -thread_warp_size=32", "conv2d_nchw.cuda", [["TENSOR", [1, 80, 73, 73], "float32"], ["TENSOR", [192, 80, 3, 3], "float32"], [1, 1], [0, 0, 0, 0], [1, 1], "float32"], {}], "config": {"index": 128002, "code_hash": null, "entity": [["tile_f", "sp", [-1, 1, 6, 32]], ["tile_y", "sp", [-1, 1, 1, 1]], ["tile_x", "sp", [-1, 1, 1, 71]], ["tile_rc", "sp", [-1, 5]], ["tile_ry", "sp", [-1, 1]], ["tile_rx", "sp", [-1, 3]], ["auto_unroll_max_step", "ot", 0], ["unroll_explicit", "ot", 0]]}, "result": [[0.1428267515, 0.14300775100000002, 0.14312364149999998], 0, 2.9715161323547363, 1678777924.1942635], "version": 0.2, "tvm_version": "0.10.0"}
{"input": ["cuda -keys=cuda,gpu -arch=sm_75 -max_num_threads=1024 -thread_warp_size=32", "conv2d_nchw.cuda", [["TENSOR", [1, 80, 73, 73], "float32"], ["TENSOR", [192, 80, 3, 3], "float32"], [1, 1], [0, 0, 0, 0], [1, 1], "float32"], {}], "config": {"index": 1132305, "code_hash": null, "entity": [["tile_f", "sp", [-1, 2, 3, 32]], ["tile_y", "sp", [-1, 71, 1, 1]], ["tile_x", "sp", [-1, 1, 71, 1]], ["tile_rc", "sp", [-1, 1]], ["tile_ry", "sp", [-1, 3]], ["tile_rx", "sp", [-1, 1]], ["auto_unroll_max_step", "ot", 1500], ["unroll_explicit", "ot", 1]]}, "result": [[0.08270409349999999, 0.08270816, 0.082735649], 0, 3.2628235816955566, 1678777925.4733744], "version": 0.2, "tvm_version": "0.10.0"}
{"input": ["cuda -keys=cuda,gpu -arch=sm_75 -max_num_threads=1024 -thread_warp_size=32", "conv2d_nchw.cuda", [["TENSOR", [1, 80, 73, 73], "float32"], ["TENSOR", [192, 80, 3, 3], "float32"], [1, 1], [0, 0, 0, 0], [1, 1], "float32"], {}], "config": {"index": 1250086, "code_hash": null, "entity": [["tile_f", "sp", [-1, 2, 8, 3]], ["tile_y", "sp", [-1, 1, 1, 1]], ["tile_x", "sp", [-1, 1, 71, 1]], ["tile_rc", "sp", [-1, 4]], ["tile_ry", "sp", [-1, 3]], ["tile_rx", "sp", [-1, 3]], ["auto_unroll_max_step", "ot", 1500], ["unroll_explicit", "ot", 1]]}, "result": [[0.0018500776727272729, 0.0018521413454545453, 0.0018525626363636364], 0, 1.6020379066467285, 1678777926.8671706], "version": 0.2, "tvm_version": "0.10.0"}
{"input": ["cuda -keys=cuda,gpu -arch=sm_75 -max_num_threads=1024 -thread_warp_size=32", "conv2d_nchw.cuda", [["TENSOR", [1, 80, 73, 73], "float32"], ["TENSOR", [192, 80, 3, 3], "float32"], [1, 1], [0, 0, 0, 0], [1, 1], "float32"], {}], "config": {"index": 1223291, "code_hash": null, "entity": [["tile_f", "sp", [-1, 3, 2, 8]], ["tile_y", "sp", [-1, 1, 1, 1]], ["tile_x", "sp", [-1, 1, 71, 1]], ["tile_rc", "sp", [-1, 20]], ["tile_ry", "sp", [-1, 1]], ["tile_rx", "sp", [-1, 3]], ["auto_unroll_max_step", "ot", 1500], ["unroll_explicit", "ot", 1]]}, "result": [[0.001888282682352941, 0.0018886472452830187, 0.0018886521176470585], 0, 6.484528303146362, 1678777928.02088], "version": 0.2, "tvm_version": "0.10.0"}
{"input": ["cuda -keys=cuda,gpu -arch=sm_75 -max_num_threads=1024 -thread_warp_size=32", "conv2d_nchw.cuda", [["TENSOR", [1, 80, 73, 73], "float32"], ["TENSOR", [192, 80, 3, 3], "float32"], [1, 1], [0, 0, 0, 0], [1, 1], "float32"], {}], "config": {"index": 226302, "code_hash": null, "entity": [["tile_f", "sp", [-1, 1, 64, 3]], ["tile_y", "sp", [-1, 71, 1, 1]], ["tile_x", "sp", [-1, 1, 1, 1]], ["tile_rc", "sp", [-1, 4]], ["tile_ry", "sp", [-1, 1]], ["tile_rx", "sp", [-1, 1]], ["auto_unroll_max_step", "ot", 512], ["unroll_explicit", "ot", 0]]}, "result": [[0.005338437105263158, 0.005338913736842105, 0.005344394052631579], 0, 2.0493249893188477, 1678777928.952397], "version": 0.2, "tvm_version": "0.10.0"}
{"input": ["cuda -keys=cuda,gpu -arch=sm_75 -max_num_threads=1024 -thread_warp_size=32", "conv2d_nchw.cuda", [["TENSOR", [1, 80, 73, 73], "float32"], ["TENSOR", [192, 80, 3, 3], "float32"], [1, 1], [0, 0, 0, 0], [1, 1], "float32"], {}], "config": {"index": 908634, "code_hash": null, "entity": [["tile_f", "sp", [-1, 12, 1, 2]], ["tile_y", "sp", [-1, 1, 1, 1]], ["tile_x", "sp", [-1, 1, 1, 1]], ["tile_rc", "sp", [-1, 80]], ["tile_ry", "sp", [-1, 1]], ["tile_rx", "sp", [-1, 1]], ["auto_unroll_max_step", "ot", 512], ["unroll_explicit", "ot", 1]]}, "result": [[0.101634048, 0.1016718595, 0.10167694050000001], 0, 2.34702467918396, 1678777931.4245772], "version": 0.2, "tvm_version": "0.10.0"}
{"input": ["cuda -keys=cuda,gpu -arch=sm_75 -max_num_threads=1024 -thread_warp_size=32", "conv2d_nchw.cuda", [["TENSOR", [1, 80, 73, 73], "float32"], ["TENSOR", [192, 80, 3, 3], "float32"], [1, 1], [0, 0, 0, 0], [1, 1], "float32"], {}], "config": {"index": 873620, "code_hash": null, "entity": [["tile_f", "sp", [-1, 12, 2, 1]], ["tile_y", "sp", [-1, 1, 1, 1]], ["tile_x", "sp", [-1, 1, 71, 1]], ["tile_rc", "sp", [-1, 4]], ["tile_ry", "sp", [-1, 1]], ["tile_rx", "sp", [-1, 1]], ["auto_unroll_max_step", "ot", 512], ["unroll_explicit", "ot", 1]]}, "result": [[0.0019035193962264152, 0.0019035670377358493, 0.0019035972641509432], 0, 1.4310777187347412, 1678777932.310452], "version": 0.2, "tvm_version": "0.10.0"}
{"input": ["cuda -keys=cuda,gpu -arch=sm_75 -max_num_threads=1024 -thread_warp_size=32", "conv2d_nchw.cuda", [["TENSOR", [1, 80, 73, 73], "float32"], ["TENSOR", [192, 80, 3, 3], "float32"], [1, 1], [0, 0, 0, 0], [1, 1], "float32"], {}], "config": {"index": 1108727, "code_hash": null, "entity": [["tile_f", "sp", [-1, 1, 6, 8]], ["tile_y", "sp", [-1, 1, 1, 71]], ["tile_x", "sp", [-1, 1, 1, 1]], ["tile_rc", "sp", [-1, 16]], ["tile_ry", "sp", [-1, 1]], ["tile_rx", "sp", [-1, 1]], ["auto_unroll_max_step", "ot", 1500], ["unroll_explicit", "ot", 1]]}, "result": [[0.101665359, 0.1017563705, 0.101959518], 0, 6.35761833190918, 1678777938.7992678], "version": 0.2, "tvm_version": "0.10.0"}
{"input": ["cuda -keys=cuda,gpu -arch=sm_75 -max_num_threads=1024 -thread_warp_size=32", "conv2d_nchw.cuda", [["TENSOR", [1, 80, 73, 73], "float32"], ["TENSOR", [192, 80, 3, 3], "float32"], [1, 1], [0, 0, 0, 0], [1, 1], "float32"], {}], "config": {"index": 360866, "code_hash": null, "entity": [["tile_f", "sp", [-1, 3, 1, 1]], ["tile_y", "sp", [-1, 1, 71, 1]], ["tile_x", "sp", [-1, 1, 1, 1]], ["tile_rc", "sp", [-1, 20]], ["tile_ry", "sp", [-1, 1]], ["tile_rx", "sp", [-1, 3]], ["auto_unroll_max_step", "ot", 512], ["unroll_explicit", "ot", 0]]}, "result": [[0.014001795749999999, 0.014030431625, 0.014058544125], 0, 1.525818109512329, 1678777939.7550054], "version": 0.2, "tvm_version": "0.10.0"}
{"input": ["cuda -keys=cuda,gpu -arch=sm_75 -max_num_threads=1024 -thread_warp_size=32", "conv2d_nchw.cuda", [["TENSOR", [1, 80, 73, 73], "float32"], ["TENSOR", [192, 80, 3, 3], "float32"], [1, 1], [0, 0, 0, 0], [1, 1], "float32"], {}], "config": {"index": 166861, "code_hash": null, "entity": [["tile_f", "sp", [-1, 2, 6, 4]], ["tile_y", "sp", [-1, 1, 1, 1]], ["tile_x", "sp", [-1, 1, 1, 1]], ["tile_rc", "sp", [-1, 2]], ["tile_ry", "sp", [-1, 3]], ["tile_rx", "sp", [-1, 3]], ["auto_unroll_max_step", "ot", 0], ["unroll_explicit", "ot", 0]]}, "result": [[0.08123867, 0.0812435375, 0.0812518535], 0, 1.677231788635254, 1678777941.0518239], "version": 0.2, "tvm_version": "0.10.0"}
{"input": ["cuda -keys=cuda,gpu -arch=sm_75 -max_num_threads=1024 -thread_warp_size=32", "conv2d_nchw.cuda", [["TENSOR", [1, 80, 73, 73], "float32"], ["TENSOR", [192, 80, 3, 3], "float32"], [1, 1], [0, 0, 0, 0], [1, 1], "float32"], {}], "config": {"index": 323038, "code_hash": null, "entity": [["tile_f", "sp", [-1, 1, 32, 2]], ["tile_y", "sp", [-1, 71, 1, 1]], ["tile_x", "sp", [-1, 1, 1, 1]], ["tile_rc", "sp", [-1, 1]], ["tile_ry", "sp", [-1, 1]], ["tile_rx", "sp", [-1, 3]], ["auto_unroll_max_step", "ot", 512], ["unroll_explicit", "ot", 0]]}, "result": [[0.001961501329268293, 0.0019615208658536588, 0.0019620526829268294], 0, 1.986912727355957, 1678777942.3501806], "version": 0.2, "tvm_version": "0.10.0"}
{"input": ["cuda -keys=cuda,gpu -arch=sm_75 -max_num_threads=1024 -thread_warp_size=32", "conv2d_nchw.cuda", [["TENSOR", [1, 80, 73, 73], "float32"], ["TENSOR", [192, 80, 3, 3], "float32"], [1, 1], [0, 0, 0, 0], [1, 1], "float32"], {}], "config": {"index": 282436, "code_hash": null, "entity": [["tile_f", "sp", [-1, 8, 3, 4]], ["tile_y", "sp", [-1, 1, 1, 1]], ["tile_x", "sp", [-1, 1, 71, 1]], ["tile_rc", "sp", [-1, 4]], ["tile_ry", "sp", [-1, 3]], ["tile_rx", "sp", [-1, 1]], ["auto_unroll_max_step", "ot", 512], ["unroll_explicit", "ot", 0]]}, "result": [[0.0017593352982456139, 0.0017593987368421053, 0.0017595862631578946], 0, 1.7188849449157715, 1678777943.202494], "version": 0.2, "tvm_version": "0.10.0"}
{"input": ["cuda -keys=cuda,gpu -arch=sm_75 -max_num_threads=1024 -thread_warp_size=32", "conv2d_nchw.cuda", [["TENSOR", [1, 80, 73, 73], "float32"], ["TENSOR", [192, 80, 3, 3], "float32"], [1, 1], [0, 0, 0, 0], [1, 1], "float32"], {}], "config": {"index": 1237519, "code_hash": null, "entity": [["tile_f", "sp", [-1, 32, 3, 1]], ["tile_y", "sp", [-1, 1, 1, 71]], ["tile_x", "sp", [-1, 1, 1, 1]], ["tile_rc", "sp", [-1, 1]], ["tile_ry", "sp", [-1, 3]], ["tile_rx", "sp", [-1, 3]], ["auto_unroll_max_step", "ot", 1500], ["unroll_explicit", "ot", 1]]}, "result": [[0.5379574579999999, 0.5382012325, 0.5386964719999999], 0, 7.725714921951294, 1678777949.5135112], "version": 0.2, "tvm_version": "0.10.0"}
{"input": ["cuda -keys=cuda,gpu -arch=sm_75 -max_num_threads=1024 -thread_warp_size=32", "conv2d_nchw.cuda", [["TENSOR", [1, 80, 73, 73], "float32"], ["TENSOR", [192, 80, 3, 3], "float32"], [1, 1], [0, 0, 0, 0], [1, 1], "float32"], {}], "config": {"index": 686944, "code_hash": null, "entity": [["tile_f", "sp", [-1, 1, 4, 3]], ["tile_y", "sp", [-1, 1, 1, 1]], ["tile_x", "sp", [-1, 1, 1, 71]], ["tile_rc", "sp", [-1, 20]], ["tile_ry", "sp", [-1, 1]], ["tile_rx", "sp", [-1, 1]], ["auto_unroll_max_step", "ot", 0], ["unroll_explicit", "ot", 1]]}, "result": [[0.0106991363, 0.0107060668, 0.0107105567], 0, 1.5581340789794922, 1678777960.7210796], "version": 0.2, "tvm_version": "0.10.0"}
{"input": ["cuda -keys=cuda,gpu -arch=sm_75 -max_num_threads=1024 -thread_warp_size=32", "conv2d_nchw.cuda", [["TENSOR", [1, 80, 73, 73], "float32"], ["TENSOR", [192, 80, 3, 3], "float32"], [1, 1], [0, 0, 0, 0], [1, 1], "float32"], {}], "config": {"index": 876317, "code_hash": null, "entity": [["tile_f", "sp", [-1, 8, 3, 1]], ["tile_y", "sp", [-1, 1, 1, 1]], ["tile_x", "sp", [-1, 1, 1, 1]], ["tile_rc", "sp", [-1, 5]], ["tile_ry", "sp", [-1, 1]], ["tile_rx", "sp", [-1, 1]], ["auto_unroll_max_step", "ot", 512], ["unroll_explicit", "ot", 1]]}, "result": [[0.0997620925, 0.09977046199999999, 0.09983255749999999], 0, 2.18680477142334, 1678777966.952932], "version": 0.2, "tvm_version": "0.10.0"}
{"input": ["cuda -keys=cuda,gpu -arch=sm_75 -max_num_threads=1024 -thread_warp_size=32", "conv2d_nchw.cuda", [["TENSOR", [1, 80, 73, 73], "float32"], ["TENSOR", [192, 80, 3, 3], "float32"], [1, 1], [0, 0, 0, 0], [1, 1], "float32"], {}], "config": {"index": 614494, "code_hash": null, "entity": [["tile_f", "sp", [-1, 1, 1, 16]], ["tile_y", "sp", [-1, 1, 1, 1]], ["tile_x", "sp", [-1, 71, 1, 1]], ["tile_rc", "sp", [-1, 8]], ["tile_ry", "sp", [-1, 3]], ["tile_rx", "sp", [-1, 3]], ["auto_unroll_max_step", "ot", 1500], ["unroll_explicit", "ot", 0]]}, "result": [[0.5105284725, 0.5105798335, 0.51061853], 0, 10.573917865753174, 1678777972.9511666], "version": 0.2, "tvm_version": "0.10.0"}
{"input": ["cuda -keys=cuda,gpu -arch=sm_75 -max_num_threads=1024 -thread_warp_size=32", "conv2d_nchw.cuda", [["TENSOR", [1, 80, 73, 73], "float32"], ["TENSOR", [192, 80, 3, 3], "float32"], [1, 1], [0, 0, 0, 0], [1, 1], "float32"], {}], "config": {"index": 12347, "code_hash": null, "entity": [["tile_f", "sp", [-1, 3, 2, 8]], ["tile_y", "sp", [-1, 1, 1, 1]], ["tile_x", "sp", [-1, 71, 1, 1]], ["tile_rc", "sp", [-1, 4]], ["tile_ry", "sp", [-1, 1]], ["tile_rx", "sp", [-1, 1]], ["auto_unroll_max_step", "ot", 0], ["unroll_explicit", "ot", 0]]}, "result": [[0.798406433, 0.7984210205000001, 0.7984318235], 0, 10.416406154632568, 1678777982.1065772], "version": 0.2, "tvm_version": "0.10.0"}
{"input": ["cuda -keys=cuda,gpu -arch=sm_75 -max_num_threads=1024 -thread_warp_size=32", "conv2d_nchw.cuda", [["TENSOR", [1, 80, 73, 73], "float32"], ["TENSOR", [192, 80, 3, 3], "float32"], [1, 1], [0, 0, 0, 0], [1, 1], "float32"], {}], "config": {"index": 662877, "code_hash": null, "entity": [["tile_f", "sp", [-1, 1, 16, 12]], ["tile_y", "sp", [-1, 1, 1, 1]], ["tile_x", "sp", [-1, 71, 1, 1]], ["tile_rc", "sp", [-1, 5]], ["tile_ry", "sp", [-1, 1]], ["tile_rx", "sp", [-1, 1]], ["auto_unroll_max_step", "ot", 0], ["unroll_explicit", "ot", 1]]}, "result": [[0.0961693265, 0.0961943205, 0.09623732750000001], 0, 2.161193609237671, 1678777983.539285], "version": 0.2, "tvm_version": "0.10.0"}
{"input": ["cuda -keys=cuda,gpu -arch=sm_75 -max_num_threads=1024 -thread_warp_size=32", "conv2d_nchw.cuda", [["TENSOR", [1, 80, 73, 73], "float32"], ["TENSOR", [192, 80, 3, 3], "float32"], [1, 1], [0, 0, 0, 0], [1, 1], "float32"], {}], "config": {"index": 1033528, "code_hash": null, "entity": [["tile_f", "sp", [-1, 1, 4, 48]], ["tile_y", "sp", [-1, 1, 1, 71]], ["tile_x", "sp", [-1, 1, 1, 1]], ["tile_rc", "sp", [-1, 4]], ["tile_ry", "sp", [-1, 3]], ["tile_rx", "sp", [-1, 3]], ["auto_unroll_max_step", "ot", 512], ["unroll_explicit", "ot", 1]]}, "result": [[0.13714241000000002, 0.13717138650000002, 0.13722171], 0, 3.5905778408050537, 1678777985.4297168], "version": 0.2, "tvm_version": "0.10.0"}
{"input": ["cuda -keys=cuda,gpu -arch=sm_75 -max_num_threads=1024 -thread_warp_size=32", "conv2d_nchw.cuda", [["TENSOR", [1, 80, 73, 73], "float32"], ["TENSOR", [192, 80, 3, 3], "float32"], [1, 1], [0, 0, 0, 0], [1, 1], "float32"], {}], "config": {"index": 224591, "code_hash": null, "entity": [["tile_f", "sp", [-1, 3, 32, 2]], ["tile_y", "sp", [-1, 1, 1, 1]], ["tile_x", "sp", [-1, 1, 1, 71]], ["tile_rc", "sp", [-1, 2]], ["tile_ry", "sp", [-1, 1]], ["tile_rx", "sp", [-1, 1]], ["auto_unroll_max_step", "ot", 512], ["unroll_explicit", "ot", 0]]}, "result": [[0.0296007995, 0.029723648000000002, 0.029854936500000002], 0, 2.6829607486724854, 1678777986.4639885], "version": 0.2, "tvm_version": "0.10.0"}
{"input": ["cuda -keys=cuda,gpu -arch=sm_75 -max_num_threads=1024 -thread_warp_size=32", "conv2d_nchw.cuda", [["TENSOR", [1, 80, 73, 73], "float32"], ["TENSOR", [192, 80, 3, 3], "float32"], [1, 1], [0, 0, 0, 0], [1, 1], "float32"], {}], "config": {"index": 511688, "code_hash": null, "entity": [["tile_f", "sp", [-1, 1, 3, 16]], ["tile_y", "sp", [-1, 1, 71, 1]], ["tile_x", "sp", [-1, 1, 1, 1]], ["tile_rc", "sp", [-1, 10]], ["tile_ry", "sp", [-1, 3]], ["tile_rx", "sp", [-1, 1]], ["auto_unroll_max_step", "ot", 1500], ["unroll_explicit", "ot", 0]]}, "result": [[0.002154757382978723, 0.0021555581489361704, 0.0021558733829787234], 0, 2.640552520751953, 1678777987.8085952], "version": 0.2, "tvm_version": "0.10.0"}
{"input": ["cuda -keys=cuda,gpu -arch=sm_75 -max_num_threads=1024 -thread_warp_size=32", "conv2d_nchw.cuda", [["TENSOR", [1, 80, 73, 73], "float32"], ["TENSOR", [192, 80, 3, 3], "float32"], [1, 1], [0, 0, 0, 0], [1, 1], "float32"], {}], "config": {"index": 888317, "code_hash": null, "entity": [["tile_f", "sp", [-1, 2, 12, 8]], ["tile_y", "sp", [-1, 1, 1, 71]], ["tile_x", "sp", [-1, 1, 1, 1]], ["tile_rc", "sp", [-1, 10]], ["tile_ry", "sp", [-1, 1]], ["tile_rx", "sp", [-1, 1]], ["auto_unroll_max_step", "ot", 512], ["unroll_explicit", "ot", 1]]}, "result": [[0.082221153, 0.082261932, 0.0823142395], 0, 3.935941696166992, 1678777989.0458133], "version": 0.2, "tvm_version": "0.10.0"}
{"input": ["cuda -keys=cuda,gpu -arch=sm_75 -max_num_threads=1024 -thread_warp_size=32", "conv2d_nchw.cuda", [["TENSOR", [1, 80, 73, 73], "float32"], ["TENSOR", [192, 80, 3, 3], "float32"], [1, 1], [0, 0, 0, 0], [1, 1], "float32"], {}], "config": {"index": 761724, "code_hash": null, "entity": [["tile_f", "sp", [-1, 96, 1, 1]], ["tile_y", "sp", [-1, 1, 1, 71]], ["tile_x", "sp", [-1, 1, 71, 1]], ["tile_rc", "sp", [-1, 2]], ["tile_ry", "sp", [-1, 1]], ["tile_rx", "sp", [-1, 3]], ["auto_unroll_max_step", "ot", 0], ["unroll_explicit", "ot", 1]]}, "result": [[0.0815450055, 0.08186167899999999, 0.0820230255], 0, 2.3307268619537354, 1678777991.5518649], "version": 0.2, "tvm_version": "0.10.0"}
{"input": ["cuda -keys=cuda,gpu -arch=sm_75 -max_num_threads=1024 -thread_warp_size=32", "conv2d_nchw.cuda", [["TENSOR", [1, 80, 73, 73], "float32"], ["TENSOR", [192, 80, 3, 3], "float32"], [1, 1], [0, 0, 0, 0], [1, 1], "float32"], {}], "config": {"index": 871155, "code_hash": null, "entity": [["tile_f", "sp", [-1, 3, 1, 8]], ["tile_y", "sp", [-1, 1, 1, 1]], ["tile_x", "sp", [-1, 1, 1, 1]], ["tile_rc", "sp", [-1, 4]], ["tile_ry", "sp", [-1, 1]], ["tile_rx", "sp", [-1, 1]], ["auto_unroll_max_step", "ot", 512], ["unroll_explicit", "ot", 1]]}, "result": [[0.0927270735, 0.0927330245, 0.092756958], 0, 1.9126882553100586, 1678777992.9728181], "version": 0.2, "tvm_version": "0.10.0"}
{"input": ["cuda -keys=cuda,gpu -arch=sm_75 -max_num_threads=1024 -thread_warp_size=32", "conv2d_nchw.cuda", [["TENSOR", [1, 80, 73, 73], "float32"], ["TENSOR", [192, 80, 3, 3], "float32"], [1, 1], [0, 0, 0, 0], [1, 1], "float32"], {}], "config": {"index": 748026, "code_hash": null, "entity": [["tile_f", "sp", [-1, 12, 1, 2]], ["tile_y", "sp", [-1, 1, 71, 1]], ["tile_x", "sp", [-1, 1, 1, 1]], ["tile_rc", "sp", [-1, 80]], ["tile_ry", "sp", [-1, 3]], ["tile_rx", "sp", [-1, 1]], ["auto_unroll_max_step", "ot", 0], ["unroll_explicit", "ot", 1]]}, "result": [[0.005314440263157895, 0.0053147301578947365, 0.005315850105263159], 0, 1.2569398880004883, 1678777993.8744702], "version": 0.2, "tvm_version": "0.10.0"}
{"input": ["cuda -keys=cuda,gpu -arch=sm_75 -max_num_threads=1024 -thread_warp_size=32", "conv2d_nchw.cuda", [["TENSOR", [1, 80, 73, 73], "float32"], ["TENSOR", [192, 80, 3, 3], "float32"], [1, 1], [0, 0, 0, 0], [1, 1], "float32"], {}], "config": {"index": 766200, "code_hash": null, "entity": [["tile_f", "sp", [-1, 1, 6, 2]], ["tile_y", "sp", [-1, 1, 1, 1]], ["tile_x", "sp", [-1, 1, 71, 1]], ["tile_rc", "sp", [-1, 4]], ["tile_ry", "sp", [-1, 1]], ["tile_rx", "sp", [-1, 3]], ["auto_unroll_max_step", "ot", 0], ["unroll_explicit", "ot", 1]]}, "result": [[0.0027936994666666664, 0.0027987967555555553, 0.003597115357142857], 0, 1.330223798751831, 1678778004.9952521], "version": 0.2, "tvm_version": "0.10.0"}
{"input": ["cuda -keys=cuda,gpu -arch=sm_75 -max_num_threads=1024 -thread_warp_size=32", "conv2d_nchw.cuda", [["TENSOR", [1, 80, 73, 73], "float32"], ["TENSOR", [192, 80, 3, 3], "float32"], [1, 1], [0, 0, 0, 0], [1, 1], "float32"], {}], "config": {"index": 1060437, "code_hash": null, "entity": [["tile_f", "sp", [-1, 16, 2, 1]], ["tile_y", "sp", [-1, 1, 1, 1]], ["tile_x", "sp", [-1, 71, 1, 1]], ["tile_rc", "sp", [-1, 20]], ["tile_ry", "sp", [-1, 3]], ["tile_rx", "sp", [-1, 3]], ["auto_unroll_max_step", "ot", 512], ["unroll_explicit", "ot", 1]]}, "result": [[0.8805447385, 0.882740234, 0.8827752074999999], 0, 10.718248128890991, 1678778025.317669], "version": 0.2, "tvm_version": "0.10.0"}
{"input": ["cuda -keys=cuda,gpu -arch=sm_75 -max_num_threads=1024 -thread_warp_size=32", "conv2d_nchw.cuda", [["TENSOR", [1, 80, 73, 73], "float32"], ["TENSOR", [192, 80, 3, 3], "float32"], [1, 1], [0, 0, 0, 0], [1, 1], "float32"], {}], "config": {"index": 692370, "code_hash": null, "entity": [["tile_f", "sp", [-1, 3, 8, 4]], ["tile_y", "sp", [-1, 1, 1, 1]], ["tile_x", "sp", [-1, 1, 1, 71]], ["tile_rc", "sp", [-1, 40]], ["tile_ry", "sp", [-1, 1]], ["tile_rx", "sp", [-1, 1]], ["auto_unroll_max_step", "ot", 0], ["unroll_explicit", "ot", 1]]}, "result": [[0.103008255, 0.10304879750000001, 0.10304982750000001], 0, 2.837393283843994, 1678778026.788792], "version": 0.2, "tvm_version": "0.10.0"}
{"input": ["cuda -keys=cuda,gpu -arch=sm_75 -max_num_threads=1024 -thread_warp_size=32", "conv2d_nchw.cuda", [["TENSOR", [1, 80, 73, 73], "float32"], ["TENSOR", [192, 80, 3, 3], "float32"], [1, 1], [0, 0, 0, 0], [1, 1], "float32"], {}], "config": {"index": 299843, "code_hash": null, "entity": [["tile_f", "sp", [-1, 1, 12, 2]], ["tile_y", "sp", [-1, 1, 1, 1]], ["tile_x", "sp", [-1, 1, 1, 71]], ["tile_rc", "sp", [-1, 10]], ["tile_ry", "sp", [-1, 3]], ["tile_rx", "sp", [-1, 1]], ["auto_unroll_max_step", "ot", 512], ["unroll_explicit", "ot", 0]]}, "result": [[0.00899545, 0.0090089664375, 0.0105130783], 0, 3.415574312210083, 1678778030.32826], "version": 0.2, "tvm_version": "0.10.0"}
{"input": ["cuda -keys=cuda,gpu -arch=sm_75 -max_num_threads=1024 -thread_warp_size=32", "conv2d_nchw.cuda", [["TENSOR", [1, 80, 73, 73], "float32"], ["TENSOR", [192, 80, 3, 3], "float32"], [1, 1], [0, 0, 0, 0], [1, 1], "float32"], {}], "config": {"index": 543222, "code_hash": null, "entity": [["tile_f", "sp", [-1, 8, 1, 8]], ["tile_y", "sp", [-1, 1, 1, 1]], ["tile_x", "sp", [-1, 1, 1, 1]], ["tile_rc", "sp", [-1, 2]], ["tile_ry", "sp", [-1, 1]], ["tile_rx", "sp", [-1, 3]], ["auto_unroll_max_step", "ot", 1500], ["unroll_explicit", "ot", 0]]}, "result": [[0.09165553250000001, 0.09165993450000001, 0.0916684795], 0, 2.367478132247925, 1678778031.6635559], "version": 0.2, "tvm_version": "0.10.0"}
{"input": ["cuda -keys=cuda,gpu -arch=sm_75 -max_num_threads=1024 -thread_warp_size=32", "conv2d_nchw.cuda", [["TENSOR", [1, 80, 73, 73], "float32"], ["TENSOR", [192, 80, 3, 3], "float32"], [1, 1], [0, 0, 0, 0], [1, 1], "float32"], {}], "config": {"index": 62027, "code_hash": null, "entity": [["tile_f", "sp", [-1, 12, 4, 4]], ["tile_y", "sp", [-1, 1, 1, 1]], ["tile_x", "sp", [-1, 1, 71, 1]], ["tile_rc", "sp", [-1, 2]], ["tile_ry", "sp", [-1, 3]], ["tile_rx", "sp", [-1, 1]], ["auto_unroll_max_step", "ot", 0], ["unroll_explicit", "ot", 0]]}, "result": [[0.0027658515945945946, 0.0027661283243243244, 0.002766367108108108], 0, 1.3056490421295166, 1678778032.5348227], "version": 0.2, "tvm_version": "0.10.0"}
{"input": ["cuda -keys=cuda,gpu -arch=sm_75 -max_num_threads=1024 -thread_warp_size=32", "conv2d_nchw.cuda", [["TENSOR", [1, 80, 73, 73], "float32"], ["TENSOR", [192, 80, 3, 3], "float32"], [1, 1], [0, 0, 0, 0], [1, 1], "float32"], {}], "config": {"index": 219569, "code_hash": null, "entity": [["tile_f", "sp", [-1, 2, 4, 3]], ["tile_y", "sp", [-1, 71, 1, 1]], ["tile_x", "sp", [-1, 1, 1, 71]], ["tile_rc", "sp", [-1, 1]], ["tile_ry", "sp", [-1, 1]], ["tile_rx", "sp", [-1, 1]], ["auto_unroll_max_step", "ot", 512], ["unroll_explicit", "ot", 0]]}, "result": [[0.470968597, 0.477295593, 0.47734362750000003], 0, 6.699652671813965, 1678778038.1436052], "version": 0.2, "tvm_version": "0.10.0"}
{"input": ["cuda -keys=cuda,gpu -arch=sm_75 -max_num_threads=1024 -thread_warp_size=32", "conv2d_nchw.cuda", [["TENSOR", [1, 80, 73, 73], "float32"], ["TENSOR", [192, 80, 3, 3], "float32"], [1, 1], [0, 0, 0, 0], [1, 1], "float32"], {}], "config": {"index": 973126, "code_hash": null, "entity": [["tile_f", "sp", [-1, 4, 24, 1]], ["tile_y", "sp", [-1, 1, 1, 1]], ["tile_x", "sp", [-1, 1, 1, 1]], ["tile_rc", "sp", [-1, 2]], ["tile_ry", "sp", [-1, 1]], ["tile_rx", "sp", [-1, 3]], ["auto_unroll_max_step", "ot", 512], ["unroll_explicit", "ot", 1]]}, "result": [[0.06825624050000001, 0.0682567825, 0.0682722545], 0, 1.5670645236968994, 1678778039.794355], "version": 0.2, "tvm_version": "0.10.0"}
{"input": ["cuda -keys=cuda,gpu -arch=sm_75 -max_num_threads=1024 -thread_warp_size=32", "conv2d_nchw.cuda", [["TENSOR", [1, 80, 73, 73], "float32"], ["TENSOR", [192, 80, 3, 3], "float32"], [1, 1], [0, 0, 0, 0], [1, 1], "float32"], {}], "config": {"index": 327989, "code_hash": null, "entity": [["tile_f", "sp", [-1, 6, 8, 1]], ["tile_y", "sp", [-1, 1, 1, 1]], ["tile_x", "sp", [-1, 1, 1, 1]], ["tile_rc", "sp", [-1, 2]], ["tile_ry", "sp", [-1, 1]], ["tile_rx", "sp", [-1, 3]], ["auto_unroll_max_step", "ot", 512], ["unroll_explicit", "ot", 0]]}, "result": [[0.0655853725, 0.065676689, 0.06600473750000001], 0, 1.5765600204467773, 1678778043.5690901], "version": 0.2, "tvm_version": "0.10.0"}
{"input": ["cuda -keys=cuda,gpu -arch=sm_75 -max_num_threads=1024 -thread_warp_size=32", "conv2d_nchw.cuda", [["TENSOR", [1, 80, 73, 73], "float32"], ["TENSOR", [192, 80, 3, 3], "float32"], [1, 1], [0, 0, 0, 0], [1, 1], "float32"], {}], "config": {"index": 1113975, "code_hash": null, "entity": [["tile_f", "sp", [-1, 1, 16, 2]], ["tile_y", "sp", [-1, 1, 1, 71]], ["tile_x", "sp", [-1, 1, 1, 1]], ["tile_rc", "sp", [-1, 20]], ["tile_ry", "sp", [-1, 1]], ["tile_rx", "sp", [-1, 1]], ["auto_unroll_max_step", "ot", 1500], ["unroll_explicit", "ot", 1]]}, "result": [[0.00523963355, 0.00526408155, 0.00530636785], 0, 2.6061296463012695, 1678778044.490732], "version": 0.2, "tvm_version": "0.10.0"}
{"input": ["cuda -keys=cuda,gpu -arch=sm_75 -max_num_threads=1024 -thread_warp_size=32", "conv2d_nchw.cuda", [["TENSOR", [1, 80, 73, 73], "float32"], ["TENSOR", [192, 80, 3, 3], "float32"], [1, 1], [0, 0, 0, 0], [1, 1], "float32"], {}], "config": {"index": 172663, "code_hash": null, "entity": [["tile_f", "sp", [-1, 6, 2, 16]], ["tile_y", "sp", [-1, 71, 1, 1]], ["tile_x", "sp", [-1, 1, 1, 1]], ["tile_rc", "sp", [-1, 4]], ["tile_ry", "sp", [-1, 3]], ["tile_rx", "sp", [-1, 3]], ["auto_unroll_max_step", "ot", 0], ["unroll_explicit", "ot", 0]]}, "result": [[0.8677324824999999, 0.8678870845, 0.8679008785], 0, 10.868910312652588, 1678778054.4407551], "version": 0.2, "tvm_version": "0.10.0"}
{"input": ["cuda -keys=cuda,gpu -arch=sm_75 -max_num_threads=1024 -thread_warp_size=32", "conv2d_nchw.cuda", [["TENSOR", [1, 80, 73, 73], "float32"], ["TENSOR", [192, 80, 3, 3], "float32"], [1, 1], [0, 0, 0, 0], [1, 1], "float32"], {}], "config": {"index": 779797, "code_hash": null, "entity": [["tile_f", "sp", [-1, 2, 2, 12]], ["tile_y", "sp", [-1, 1, 1, 1]], ["tile_x", "sp", [-1, 1, 1, 1]], ["tile_rc", "sp", [-1, 10]], ["tile_ry", "sp", [-1, 1]], ["tile_rx", "sp", [-1, 3]], ["auto_unroll_max_step", "ot", 0], ["unroll_explicit", "ot", 1]]}, "result": [[0.137063812, 0.137098419, 0.1371039275], 0, 2.2276153564453125, 1678778066.5676367], "version": 0.2, "tvm_version": "0.10.0"}
{"input": ["cuda -keys=cuda,gpu -arch=sm_75 -max_num_threads=1024 -thread_warp_size=32", "conv2d_nchw.cuda", [["TENSOR", [1, 80, 73, 73], "float32"], ["TENSOR", [192, 80, 3, 3], "float32"], [1, 1], [0, 0, 0, 0], [1, 1], "float32"], {}], "config": {"index": 380225, "code_hash": null, "entity": [["tile_f", "sp", [-1, 2, 8, 4]], ["tile_y", "sp", [-1, 1, 1, 71]], ["tile_x", "sp", [-1, 1, 71, 1]], ["tile_rc", "sp", [-1, 1]], ["tile_ry", "sp", [-1, 3]], ["tile_rx", "sp", [-1, 3]], ["auto_unroll_max_step", "ot", 512], ["unroll_explicit", "ot", 0]]}, "result": [[0.0702072675, 0.07020934250000001, 0.07022796599999999], 0, 2.1136767864227295, 1678778067.7341197], "version": 0.2, "tvm_version": "0.10.0"}
{"input": ["cuda -keys=cuda,gpu -arch=sm_75 -max_num_threads=1024 -thread_warp_size=32", "conv2d_nchw.cuda", [["TENSOR", [1, 80, 73, 73], "float32"], ["TENSOR", [192, 80, 3, 3], "float32"], [1, 1], [0, 0, 0, 0], [1, 1], "float32"], {}], "config": {"index": 332523, "code_hash": null, "entity": [["tile_f", "sp", [-1, 1, 48, 4]], ["tile_y", "sp", [-1, 71, 1, 1]], ["tile_x", "sp", [-1, 1, 1, 71]], ["tile_rc", "sp", [-1, 2]], ["tile_ry", "sp", [-1, 1]], ["tile_rx", "sp", [-1, 3]], ["auto_unroll_max_step", "ot", 512], ["unroll_explicit", "ot", 0]]}, "result": [[0.633264282, 0.6344594115, 0.6345216060000001], 0, 9.790587186813354, 1678778075.0641441], "version": 0.2, "tvm_version": "0.10.0"}
{"input": ["cuda -keys=cuda,gpu -arch=sm_75 -max_num_threads=1024 -thread_warp_size=32", "conv2d_nchw.cuda", [["TENSOR", [1, 80, 73, 73], "float32"], ["TENSOR", [192, 80, 3, 3], "float32"], [1, 1], [0, 0, 0, 0], [1, 1], "float32"], {}], "config": {"index": 432389, "code_hash": null, "entity": [["tile_f", "sp", [-1, 2, 2, 16]], ["tile_y", "sp", [-1, 1, 71, 1]], ["tile_x", "sp", [-1, 71, 1, 1]], ["tile_rc", "sp", [-1, 1]], ["tile_ry", "sp", [-1, 1]], ["tile_rx", "sp", [-1, 1]], ["auto_unroll_max_step", "ot", 1500], ["unroll_explicit", "ot", 0]]}, "result": [[0.144235168, 0.14467257649999998, 0.144728149], 0, 2.7941906452178955, 1678778087.094169], "version": 0.2, "tvm_version": "0.10.0"}
{"input": ["cuda -keys=cuda,gpu -arch=sm_75 -max_num_threads=1024 -thread_warp_size=32", "conv2d_nchw.cuda", [["TENSOR", [1, 80, 73, 73], "float32"], ["TENSOR", [192, 80, 3, 3], "float32"], [1, 1], [0, 0, 0, 0], [1, 1], "float32"], {}], "config": {"index": 473814, "code_hash": null, "entity": [["tile_f", "sp", [-1, 8, 8, 1]], ["tile_y", "sp", [-1, 1, 71, 1]], ["tile_x", "sp", [-1, 1, 1, 1]], ["tile_rc", "sp", [-1, 40]], ["tile_ry", "sp", [-1, 1]], ["tile_rx", "sp", [-1, 1]], ["auto_unroll_max_step", "ot", 1500], ["unroll_explicit", "ot", 0]]}, "result": [[0.0027570862432432434, 0.002758386945945946, 0.002759375486486486], 0, 2.272484540939331, 1678778088.4844482], "version": 0.2, "tvm_version": "0.10.0"}
{"input": ["cuda -keys=cuda,gpu -arch=sm_75 -max_num_threads=1024 -thread_warp_size=32", "conv2d_nchw.cuda", [["TENSOR", [1, 80, 73, 73], "float32"], ["TENSOR", [192, 80, 3, 3], "float32"], [1, 1], [0, 0, 0, 0], [1, 1], "float32"], {}], "config": {"index": 808687, "code_hash": null, "entity": [["tile_f", "sp", [-1, 1, 1, 12]], ["tile_y", "sp", [-1, 1, 71, 1]], ["tile_x", "sp", [-1, 71, 1, 1]], ["tile_rc", "sp", [-1, 1]], ["tile_ry", "sp", [-1, 3]], ["tile_rx", "sp", [-1, 3]], ["auto_unroll_max_step", "ot", 0], ["unroll_explicit", "ot", 1]]}, "result": [[0.064764175, 0.0647906265, 0.06493265499999999], 0, 1.7566070556640625, 1678778089.5961266], "version": 0.2, "tvm_version": "0.10.0"}
{"input": ["cuda -keys=cuda,gpu -arch=sm_75 -max_num_threads=1024 -thread_warp_size=32", "conv2d_nchw.cuda", [["TENSOR", [1, 80, 73, 73], "float32"], ["TENSOR", [192, 80, 3, 3], "float32"], [1, 1], [0, 0, 0, 0], [1, 1], "float32"], {}], "config": {"index": 511212, "code_hash": null, "entity": [["tile_f", "sp", [-1, 4, 2, 3]], ["tile_y", "sp", [-1, 71, 1, 1]], ["tile_x", "sp", [-1, 1, 1, 1]], ["tile_rc", "sp", [-1, 10]], ["tile_ry", "sp", [-1, 3]], ["tile_rx", "sp", [-1, 1]], ["auto_unroll_max_step", "ot", 1500], ["unroll_explicit", "ot", 0]]}, "result": [[0.5060989375, 0.506238739, 0.506250244], 0, 9.475212812423706, 1678778095.5631783], "version": 0.2, "tvm_version": "0.10.0"}
{"input": ["cuda -keys=cuda,gpu -arch=sm_75 -max_num_threads=1024 -thread_warp_size=32", "conv2d_nchw.cuda", [["TENSOR", [1, 80, 73, 73], "float32"], ["TENSOR", [192, 80, 3, 3], "float32"], [1, 1], [0, 0, 0, 0], [1, 1], "float32"], {}], "config": {"index": 399325, "code_hash": null, "entity": [["tile_f", "sp", [-1, 8, 2, 3]], ["tile_y", "sp", [-1, 1, 1, 1]], ["tile_x", "sp", [-1, 71, 1, 1]], ["tile_rc", "sp", [-1, 8]], ["tile_ry", "sp", [-1, 3]], ["tile_rx", "sp", [-1, 3]], ["auto_unroll_max_step", "ot", 512], ["unroll_explicit", "ot", 0]]}, "result": [[0.797228027, 0.7975147705000001, 0.7975311884999999], 0, 10.312264680862427, 1678778104.712706], "version": 0.2, "tvm_version": "0.10.0"}
{"input": ["cuda -keys=cuda,gpu -arch=sm_75 -max_num_threads=1024 -thread_warp_size=32", "conv2d_nchw.cuda", [["TENSOR", [1, 80, 73, 73], "float32"], ["TENSOR", [192, 80, 3, 3], "float32"], [1, 1], [0, 0, 0, 0], [1, 1], "float32"], {}], "config": {"index": 995161, "code_hash": null, "entity": [["tile_f", "sp", [-1, 4, 6, 8]], ["tile_y", "sp", [-1, 71, 1, 1]], ["tile_x", "sp", [-1, 1, 1, 1]], ["tile_rc", "sp", [-1, 10]], ["tile_ry", "sp", [-1, 1]], ["tile_rx", "sp", [-1, 3]], ["auto_unroll_max_step", "ot", 512], ["unroll_explicit", "ot", 1]]}, "result": [[0.3212492675, 0.321402557, 0.3214196775], 0, 12.753999948501587, 1678778119.6292093], "version": 0.2, "tvm_version": "0.10.0"}
