src/tvm/results/cuda_gtx1650/inception_v3/droplet/cpu.log_layer_30.log
{"input": ["cuda -keys=cuda,gpu -arch=sm_75 -max_num_threads=1024 -thread_warp_size=32", "conv2d_nchw.cuda", [["TENSOR", [1, 160, 17, 17], "float32"], ["TENSOR", [160, 160, 1, 7], "float32"], [1, 1], [0, 3, 0, 3], [1, 1], "float32"], {}], "config": {"index": 0, "code_hash": null, "entity": [["tile_f", "sp", [-1, 1, 1, 1]], ["tile_y", "sp", [-1, 1, 1, 1]], ["tile_x", "sp", [-1, 1, 1, 1]], ["tile_rc", "sp", [-1, 1]], ["tile_ry", "sp", [-1, 1]], ["tile_rx", "sp", [-1, 1]], ["auto_unroll_max_step", "ot", 0], ["unroll_explicit", "ot", 0]]}, "result": [[0.009176895818181818, 0.009177239090909091, 0.009191418], 0, 1.0764386653900146, 1679482679.5427606], "version": 0.2, "tvm_version": "0.10.0"}
{"input": ["cuda -keys=cuda,gpu -arch=sm_75 -max_num_threads=1024 -thread_warp_size=32", "conv2d_nchw.cuda", [["TENSOR", [1, 160, 17, 17], "float32"], ["TENSOR", [160, 160, 1, 7], "float32"], [1, 1], [0, 3, 0, 3], [1, 1], "float32"], {}], "config": {"index": 391777, "code_hash": null, "entity": [["tile_f", "sp", [-1, 2, 1, 1]], ["tile_y", "sp", [-1, 17, 1, 1]], ["tile_x", "sp", [-1, 17, 1, 1]], ["tile_rc", "sp", [-1, 2]], ["tile_ry", "sp", [-1, 1]], ["tile_rx", "sp", [-1, 7]], ["auto_unroll_max_step", "ot", 512], ["unroll_explicit", "ot", 1]]}, "result": [[0.1140509795, 0.11413295700000001, 0.11422863750000001], 0, 2.5624003410339355, 1679482682.2195249], "version": 0.2, "tvm_version": "0.10.0"}
{"input": ["cuda -keys=cuda,gpu -arch=sm_75 -max_num_threads=1024 -thread_warp_size=32", "conv2d_nchw.cuda", [["TENSOR", [1, 160, 17, 17], "float32"], ["TENSOR", [160, 160, 1, 7], "float32"], [1, 1], [0, 3, 0, 3], [1, 1], "float32"], {}], "config": {"index": 258048, "code_hash": null, "entity": [["tile_f", "sp", [-1, 1, 1, 1]], ["tile_y", "sp", [-1, 1, 1, 1]], ["tile_x", "sp", [-1, 1, 1, 1]], ["tile_rc", "sp", [-1, 1]], ["tile_ry", "sp", [-1, 1]], ["tile_rx", "sp", [-1, 1]], ["auto_unroll_max_step", "ot", 0], ["unroll_explicit", "ot", 1]]}, "result": [[0.009175816545454546, 0.009177140636363636, 0.009192413272727273], 0, 1.3583762645721436, 1679482683.095738], "version": 0.2, "tvm_version": "0.10.0"}
{"input": ["cuda -keys=cuda,gpu -arch=sm_75 -max_num_threads=1024 -thread_warp_size=32", "conv2d_nchw.cuda", [["TENSOR", [1, 160, 17, 17], "float32"], ["TENSOR", [160, 160, 1, 7], "float32"], [1, 1], [0, 3, 0, 3], [1, 1], "float32"], {}], "config": {"index": 86016, "code_hash": null, "entity": [["tile_f", "sp", [-1, 1, 1, 1]], ["tile_y", "sp", [-1, 1, 1, 1]], ["tile_x", "sp", [-1, 1, 1, 1]], ["tile_rc", "sp", [-1, 1]], ["tile_ry", "sp", [-1, 1]], ["tile_rx", "sp", [-1, 1]], ["auto_unroll_max_step", "ot", 512], ["unroll_explicit", "ot", 0]]}, "result": [[0.009175970545454546, 0.009176782727272728, 0.009178018727272728], 0, 1.379213571548462, 1679482683.9742813], "version": 0.2, "tvm_version": "0.10.0"}
{"input": ["cuda -keys=cuda,gpu -arch=sm_75 -max_num_threads=1024 -thread_warp_size=32", "conv2d_nchw.cuda", [["TENSOR", [1, 160, 17, 17], "float32"], ["TENSOR", [160, 160, 1, 7], "float32"], [1, 1], [0, 3, 0, 3], [1, 1], "float32"], {}], "config": {"index": 43008, "code_hash": null, "entity": [["tile_f", "sp", [-1, 1, 1, 1]], ["tile_y", "sp", [-1, 1, 1, 1]], ["tile_x", "sp", [-1, 1, 1, 1]], ["tile_rc", "sp", [-1, 1]], ["tile_ry", "sp", [-1, 1]], ["tile_rx", "sp", [-1, 7]], ["auto_unroll_max_step", "ot", 0], ["unroll_explicit", "ot", 0]]}, "result": [[0.020504071, 0.020504998599999998, 0.020507993999999998], 0, 1.3978981971740723, 1679482684.892467], "version": 0.2, "tvm_version": "0.10.0"}
{"input": ["cuda -keys=cuda,gpu -arch=sm_75 -max_num_threads=1024 -thread_warp_size=32", "conv2d_nchw.cuda", [["TENSOR", [1, 160, 17, 17], "float32"], ["TENSOR", [160, 160, 1, 7], "float32"], [1, 1], [0, 3, 0, 3], [1, 1], "float32"], {}], "config": {"index": 3584, "code_hash": null, "entity": [["tile_f", "sp", [-1, 1, 1, 1]], ["tile_y", "sp", [-1, 1, 1, 1]], ["tile_x", "sp", [-1, 1, 1, 1]], ["tile_rc", "sp", [-1, 2]], ["tile_ry", "sp", [-1, 1]], ["tile_rx", "sp", [-1, 1]], ["auto_unroll_max_step", "ot", 0], ["unroll_explicit", "ot", 0]]}, "result": [[0.031641527, 0.031672159, 0.031708063], 0, 1.5372445583343506, 1679482685.9676142], "version": 0.2, "tvm_version": "0.10.0"}
{"input": ["cuda -keys=cuda,gpu -arch=sm_75 -max_num_threads=1024 -thread_warp_size=32", "conv2d_nchw.cuda", [["TENSOR", [1, 160, 17, 17], "float32"], ["TENSOR", [160, 160, 1, 7], "float32"], [1, 1], [0, 3, 0, 3], [1, 1], "float32"], {}], "config": {"index": 896, "code_hash": null, "entity": [["tile_f", "sp", [-1, 1, 1, 1]], ["tile_y", "sp", [-1, 1, 1, 1]], ["tile_x", "sp", [-1, 17, 1, 1]], ["tile_rc", "sp", [-1, 1]], ["tile_ry", "sp", [-1, 1]], ["tile_rx", "sp", [-1, 1]], ["auto_unroll_max_step", "ot", 0], ["unroll_explicit", "ot", 0]]}, "result": [[0.00499373815625, 0.0049950961875, 0.0050048641875], 0, 1.7108569145202637, 1679482687.1581924], "version": 0.2, "tvm_version": "0.10.0"}
{"input": ["cuda -keys=cuda,gpu -arch=sm_75 -max_num_threads=1024 -thread_warp_size=32", "conv2d_nchw.cuda", [["TENSOR", [1, 160, 17, 17], "float32"], ["TENSOR", [160, 160, 1, 7], "float32"], [1, 1], [0, 3, 0, 3], [1, 1], "float32"], {}], "config": {"index": 224, "code_hash": null, "entity": [["tile_f", "sp", [-1, 1, 1, 1]], ["tile_y", "sp", [-1, 17, 1, 1]], ["tile_x", "sp", [-1, 1, 1, 1]], ["tile_rc", "sp", [-1, 1]], ["tile_ry", "sp", [-1, 1]], ["tile_rx", "sp", [-1, 1]], ["auto_unroll_max_step", "ot", 0], ["unroll_explicit", "ot", 0]]}, "result": [[0.009246961363636364, 0.009263848727272728, 0.009282838909090908], 0, 1.4275310039520264, 1679482688.042391], "version": 0.2, "tvm_version": "0.10.0"}
{"input": ["cuda -keys=cuda,gpu -arch=sm_75 -max_num_threads=1024 -thread_warp_size=32", "conv2d_nchw.cuda", [["TENSOR", [1, 160, 17, 17], "float32"], ["TENSOR", [160, 160, 1, 7], "float32"], [1, 1], [0, 3, 0, 3], [1, 1], "float32"], {}], "config": {"index": 1, "code_hash": null, "entity": [["tile_f", "sp", [-1, 2, 1, 1]], ["tile_y", "sp", [-1, 1, 1, 1]], ["tile_x", "sp", [-1, 1, 1, 1]], ["tile_rc", "sp", [-1, 1]], ["tile_ry", "sp", [-1, 1]], ["tile_rx", "sp", [-1, 1]], ["auto_unroll_max_step", "ot", 0], ["unroll_explicit", "ot", 0]]}, "result": [[0.025405439250000002, 0.02540555175, 0.025409719249999997], 0, 1.4185621738433838, 1679482688.9692686], "version": 0.2, "tvm_version": "0.10.0"}
{"input": ["cuda -keys=cuda,gpu -arch=sm_75 -max_num_threads=1024 -thread_warp_size=32", "conv2d_nchw.cuda", [["TENSOR", [1, 160, 17, 17], "float32"], ["TENSOR", [160, 160, 1, 7], "float32"], [1, 1], [0, 3, 0, 3], [1, 1], "float32"], {}], "config": {"index": 172032, "code_hash": null, "entity": [["tile_f", "sp", [-1, 1, 1, 1]], ["tile_y", "sp", [-1, 1, 1, 1]], ["tile_x", "sp", [-1, 1, 1, 1]], ["tile_rc", "sp", [-1, 1]], ["tile_ry", "sp", [-1, 1]], ["tile_rx", "sp", [-1, 1]], ["auto_unroll_max_step", "ot", 1500], ["unroll_explicit", "ot", 0]]}, "result": [[0.009177489454545454, 0.009178213636363636, 0.009179019545454546], 0, 1.3674380779266357, 1679482689.8440309], "version": 0.2, "tvm_version": "0.10.0"}
{"input": ["cuda -keys=cuda,gpu -arch=sm_75 -max_num_threads=1024 -thread_warp_size=32", "conv2d_nchw.cuda", [["TENSOR", [1, 160, 17, 17], "float32"], ["TENSOR", [160, 160, 1, 7], "float32"], [1, 1], [0, 3, 0, 3], [1, 1], "float32"], {}], "config": {"index": 7168, "code_hash": null, "entity": [["tile_f", "sp", [-1, 1, 1, 1]], ["tile_y", "sp", [-1, 1, 1, 1]], ["tile_x", "sp", [-1, 1, 1, 1]], ["tile_rc", "sp", [-1, 4]], ["tile_ry", "sp", [-1, 1]], ["tile_rx", "sp", [-1, 1]], ["auto_unroll_max_step", "ot", 0], ["unroll_explicit", "ot", 0]]}, "result": [[0.023298316800000003, 0.023300019800000002, 0.0233021438], 0, 1.490083932876587, 1679482690.8369708], "version": 0.2, "tvm_version": "0.10.0"}
{"input": ["cuda -keys=cuda,gpu -arch=sm_75 -max_num_threads=1024 -thread_warp_size=32", "conv2d_nchw.cuda", [["TENSOR", [1, 160, 17, 17], "float32"], ["TENSOR", [160, 160, 1, 7], "float32"], [1, 1], [0, 3, 0, 3], [1, 1], "float32"], {}], "config": {"index": 1792, "code_hash": null, "entity": [["tile_f", "sp", [-1, 1, 1, 1]], ["tile_y", "sp", [-1, 1, 1, 1]], ["tile_x", "sp", [-1, 1, 17, 1]], ["tile_rc", "sp", [-1, 1]], ["tile_ry", "sp", [-1, 1]], ["tile_rx", "sp", [-1, 1]], ["auto_unroll_max_step", "ot", 0], ["unroll_explicit", "ot", 0]]}, "result": [[0.003009536058823529, 0.003011102088235294, 0.0030129176764705883], 0, 1.3652708530426025, 1679482691.7118444], "version": 0.2, "tvm_version": "0.10.0"}
{"input": ["cuda -keys=cuda,gpu -arch=sm_75 -max_num_threads=1024 -thread_warp_size=32", "conv2d_nchw.cuda", [["TENSOR", [1, 160, 17, 17], "float32"], ["TENSOR", [160, 160, 1, 7], "float32"], [1, 1], [0, 3, 0, 3], [1, 1], "float32"], {}], "config": {"index": 448, "code_hash": null, "entity": [["tile_f", "sp", [-1, 1, 1, 1]], ["tile_y", "sp", [-1, 1, 17, 1]], ["tile_x", "sp", [-1, 1, 1, 1]], ["tile_rc", "sp", [-1, 1]], ["tile_ry", "sp", [-1, 1]], ["tile_rx", "sp", [-1, 1]], ["auto_unroll_max_step", "ot", 0], ["unroll_explicit", "ot", 0]]}, "result": [[0.003647054976744186, 0.003649440674418605, 0.0036522582093023253], 0, 1.6981637477874756, 1679482692.9457295], "version": 0.2, "tvm_version": "0.10.0"}
{"input": ["cuda -keys=cuda,gpu -arch=sm_75 -max_num_threads=1024 -thread_warp_size=32", "conv2d_nchw.cuda", [["TENSOR", [1, 160, 17, 17], "float32"], ["TENSOR", [160, 160, 1, 7], "float32"], [1, 1], [0, 3, 0, 3], [1, 1], "float32"], {}], "config": {"index": 2, "code_hash": null, "entity": [["tile_f", "sp", [-1, 4, 1, 1]], ["tile_y", "sp", [-1, 1, 1, 1]], ["tile_x", "sp", [-1, 1, 1, 1]], ["tile_rc", "sp", [-1, 1]], ["tile_ry", "sp", [-1, 1]], ["tile_rx", "sp", [-1, 1]], ["auto_unroll_max_step", "ot", 0], ["unroll_explicit", "ot", 0]]}, "result": [[0.015895821571428572, 0.015897750714285713, 0.015903552428571426], 0, 1.4846181869506836, 1679482693.8935754], "version": 0.2, "tvm_version": "0.10.0"}
{"input": ["cuda -keys=cuda,gpu -arch=sm_75 -max_num_threads=1024 -thread_warp_size=32", "conv2d_nchw.cuda", [["TENSOR", [1, 160, 17, 17], "float32"], ["TENSOR", [160, 160, 1, 7], "float32"], [1, 1], [0, 3, 0, 3], [1, 1], "float32"], {}], "config": {"index": 10752, "code_hash": null, "entity": [["tile_f", "sp", [-1, 1, 1, 1]], ["tile_y", "sp", [-1, 1, 1, 1]], ["tile_x", "sp", [-1, 1, 1, 1]], ["tile_rc", "sp", [-1, 5]], ["tile_ry", "sp", [-1, 1]], ["tile_rx", "sp", [-1, 1]], ["auto_unroll_max_step", "ot", 0], ["unroll_explicit", "ot", 0]]}, "result": [[0.019547466166666666, 0.019548522833333335, 0.019550399666666666], 0, 1.4374003410339355, 1679482694.8515537], "version": 0.2, "tvm_version": "0.10.0"}
{"input": ["cuda -keys=cuda,gpu -arch=sm_75 -max_num_threads=1024 -thread_warp_size=32", "conv2d_nchw.cuda", [["TENSOR", [1, 160, 17, 17], "float32"], ["TENSOR", [160, 160, 1, 7], "float32"], [1, 1], [0, 3, 0, 3], [1, 1], "float32"], {}], "config": {"index": 2688, "code_hash": null, "entity": [["tile_f", "sp", [-1, 1, 1, 1]], ["tile_y", "sp", [-1, 1, 1, 1]], ["tile_x", "sp", [-1, 1, 1, 17]], ["tile_rc", "sp", [-1, 1]], ["tile_ry", "sp", [-1, 1]], ["tile_rx", "sp", [-1, 1]], ["auto_unroll_max_step", "ot", 0], ["unroll_explicit", "ot", 0]]}, "result": [[0.0049907631562499995, 0.00499445484375, 0.0049958500624999996], 0, 1.7397956848144531, 1679482696.1082673], "version": 0.2, "tvm_version": "0.10.0"}
{"input": ["cuda -keys=cuda,gpu -arch=sm_75 -max_num_threads=1024 -thread_warp_size=32", "conv2d_nchw.cuda", [["TENSOR", [1, 160, 17, 17], "float32"], ["TENSOR", [160, 160, 1, 7], "float32"], [1, 1], [0, 3, 0, 3], [1, 1], "float32"], {}], "config": {"index": 672, "code_hash": null, "entity": [["tile_f", "sp", [-1, 1, 1, 1]], ["tile_y", "sp", [-1, 1, 1, 17]], ["tile_x", "sp", [-1, 1, 1, 1]], ["tile_rc", "sp", [-1, 1]], ["tile_ry", "sp", [-1, 1]], ["tile_rx", "sp", [-1, 1]], ["auto_unroll_max_step", "ot", 0], ["unroll_explicit", "ot", 0]]}, "result": [[0.009256444727272727, 0.009259278727272726, 0.009271970545454545], 0, 1.3942785263061523, 1679482696.9864802], "version": 0.2, "tvm_version": "0.10.0"}
{"input": ["cuda -keys=cuda,gpu -arch=sm_75 -max_num_threads=1024 -thread_warp_size=32", "conv2d_nchw.cuda", [["TENSOR", [1, 160, 17, 17], "float32"], ["TENSOR", [160, 160, 1, 7], "float32"], [1, 1], [0, 3, 0, 3], [1, 1], "float32"], {}], "config": {"index": 393569, "code_hash": null, "entity": [["tile_f", "sp", [-1, 2, 1, 1]], ["tile_y", "sp", [-1, 17, 1, 1]], ["tile_x", "sp", [-1, 1, 1, 17]], ["tile_rc", "sp", [-1, 2]], ["tile_ry", "sp", [-1, 1]], ["tile_rx", "sp", [-1, 7]], ["auto_unroll_max_step", "ot", 512], ["unroll_explicit", "ot", 1]]}, "result": [[0.11408148950000001, 0.114117683, 0.114237297], 0, 2.535977363586426, 1679482699.6405141], "version": 0.2, "tvm_version": "0.10.0"}
{"input": ["cuda -keys=cuda,gpu -arch=sm_75 -max_num_threads=1024 -thread_warp_size=32", "conv2d_nchw.cuda", [["TENSOR", [1, 160, 17, 17], "float32"], ["TENSOR", [160, 160, 1, 7], "float32"], [1, 1], [0, 3, 0, 3], [1, 1], "float32"], {}], "config": {"index": 87808, "code_hash": null, "entity": [["tile_f", "sp", [-1, 1, 1, 1]], ["tile_y", "sp", [-1, 1, 1, 1]], ["tile_x", "sp", [-1, 1, 17, 1]], ["tile_rc", "sp", [-1, 1]], ["tile_ry", "sp", [-1, 1]], ["tile_rx", "sp", [-1, 1]], ["auto_unroll_max_step", "ot", 512], ["unroll_explicit", "ot", 0]]}, "result": [[0.0030100575471698116, 0.0030105147358490563, 0.0030130977924528305], 0, 1.706672191619873, 1679482700.8918648], "version": 0.2, "tvm_version": "0.10.0"}
{"input": ["cuda -keys=cuda,gpu -arch=sm_75 -max_num_threads=1024 -thread_warp_size=32", "conv2d_nchw.cuda", [["TENSOR", [1, 160, 17, 17], "float32"], ["TENSOR", [160, 160, 1, 7], "float32"], [1, 1], [0, 3, 0, 3], [1, 1], "float32"], {}], "config": {"index": 16128, "code_hash": null, "entity": [["tile_f", "sp", [-1, 1, 1, 1]], ["tile_y", "sp", [-1, 1, 1, 1]], ["tile_x", "sp", [-1, 1, 17, 1]], ["tile_rc", "sp", [-1, 8]], ["tile_ry", "sp", [-1, 1]], ["tile_rx", "sp", [-1, 1]], ["auto_unroll_max_step", "ot", 0], ["unroll_explicit", "ot", 0]]}, "result": [[0.003976644923076924, 0.003976836846153846, 0.003978132961538461], 0, 1.3966937065124512, 1679482701.7659419], "version": 0.2, "tvm_version": "0.10.0"}
{"input": ["cuda -keys=cuda,gpu -arch=sm_75 -max_num_threads=1024 -thread_warp_size=32", "conv2d_nchw.cuda", [["TENSOR", [1, 160, 17, 17], "float32"], ["TENSOR", [160, 160, 1, 7], "float32"], [1, 1], [0, 3, 0, 3], [1, 1], "float32"], {}], "config": {"index": 1796, "code_hash": null, "entity": [["tile_f", "sp", [-1, 8, 1, 1]], ["tile_y", "sp", [-1, 1, 1, 1]], ["tile_x", "sp", [-1, 1, 17, 1]], ["tile_rc", "sp", [-1, 1]], ["tile_ry", "sp", [-1, 1]], ["tile_rx", "sp", [-1, 1]], ["auto_unroll_max_step", "ot", 0], ["unroll_explicit", "ot", 0]]}, "result": [[0.0007529813407407406, 0.0007530166592592592, 0.0007531109777777778], 0, 1.383603811264038, 1679482702.618208], "version": 0.2, "tvm_version": "0.10.0"}
{"input": ["cuda -keys=cuda,gpu -arch=sm_75 -max_num_threads=1024 -thread_warp_size=32", "conv2d_nchw.cuda", [["TENSOR", [1, 160, 17, 17], "float32"], ["TENSOR", [160, 160, 1, 7], "float32"], [1, 1], [0, 3, 0, 3], [1, 1], "float32"], {}], "config": {"index": 259840, "code_hash": null, "entity": [["tile_f", "sp", [-1, 1, 1, 1]], ["tile_y", "sp", [-1, 1, 1, 1]], ["tile_x", "sp", [-1, 1, 17, 1]], ["tile_rc", "sp", [-1, 1]], ["tile_ry", "sp", [-1, 1]], ["tile_rx", "sp", [-1, 1]], ["auto_unroll_max_step", "ot", 0], ["unroll_explicit", "ot", 1]]}, "result": [[0.003008572294117647, 0.003009415558823529, 0.0030131858235294116], 0, 1.3547487258911133, 1679482703.4732873], "version": 0.2, "tvm_version": "0.10.0"}
{"input": ["cuda -keys=cuda,gpu -arch=sm_75 -max_num_threads=1024 -thread_warp_size=32", "conv2d_nchw.cuda", [["TENSOR", [1, 160, 17, 17], "float32"], ["TENSOR", [160, 160, 1, 7], "float32"], [1, 1], [0, 3, 0, 3], [1, 1], "float32"], {}], "config": {"index": 173824, "code_hash": null, "entity": [["tile_f", "sp", [-1, 1, 1, 1]], ["tile_y", "sp", [-1, 1, 1, 1]], ["tile_x", "sp", [-1, 1, 17, 1]], ["tile_rc", "sp", [-1, 1]], ["tile_ry", "sp", [-1, 1]], ["tile_rx", "sp", [-1, 1]], ["auto_unroll_max_step", "ot", 1500], ["unroll_explicit", "ot", 0]]}, "result": [[0.0030102501509433966, 0.0030110182830188677, 0.003013123698113208], 0, 1.617995023727417, 1679482704.6614277], "version": 0.2, "tvm_version": "0.10.0"}
{"input": ["cuda -keys=cuda,gpu -arch=sm_75 -max_num_threads=1024 -thread_warp_size=32", "conv2d_nchw.cuda", [["TENSOR", [1, 160, 17, 17], "float32"], ["TENSOR", [160, 160, 1, 7], "float32"], [1, 1], [0, 3, 0, 3], [1, 1], "float32"], {}], "config": {"index": 44800, "code_hash": null, "entity": [["tile_f", "sp", [-1, 1, 1, 1]], ["tile_y", "sp", [-1, 1, 1, 1]], ["tile_x", "sp", [-1, 1, 17, 1]], ["tile_rc", "sp", [-1, 1]], ["tile_ry", "sp", [-1, 1]], ["tile_rx", "sp", [-1, 7]], ["auto_unroll_max_step", "ot", 0], ["unroll_explicit", "ot", 0]]}, "result": [[0.00102225502, 0.00102244194, 0.00102267967], 0, 1.3602252006530762, 1679482705.5378306], "version": 0.2, "tvm_version": "0.10.0"}
{"input": ["cuda -keys=cuda,gpu -arch=sm_75 -max_num_threads=1024 -thread_warp_size=32", "conv2d_nchw.cuda", [["TENSOR", [1, 160, 17, 17], "float32"], ["TENSOR", [160, 160, 1, 7], "float32"], [1, 1], [0, 3, 0, 3], [1, 1], "float32"], {}], "config": {"index": 19712, "code_hash": null, "entity": [["tile_f", "sp", [-1, 1, 1, 1]], ["tile_y", "sp", [-1, 1, 1, 1]], ["tile_x", "sp", [-1, 1, 17, 1]], ["tile_rc", "sp", [-1, 10]], ["tile_ry", "sp", [-1, 1]], ["tile_rx", "sp", [-1, 1]], ["auto_unroll_max_step", "ot", 0], ["unroll_explicit", "ot", 0]]}, "result": [[0.0025244927777777777, 0.0025254007936507936, 0.0025259316984126987], 0, 1.774916648864746, 1679482706.7826114], "version": 0.2, "tvm_version": "0.10.0"}
{"input": ["cuda -keys=cuda,gpu -arch=sm_75 -max_num_threads=1024 -thread_warp_size=32", "conv2d_nchw.cuda", [["TENSOR", [1, 160, 17, 17], "float32"], ["TENSOR", [160, 160, 1, 7], "float32"], [1, 1], [0, 3, 0, 3], [1, 1], "float32"], {}], "config": {"index": 2016, "code_hash": null, "entity": [["tile_f", "sp", [-1, 1, 1, 1]], ["tile_y", "sp", [-1, 17, 1, 1]], ["tile_x", "sp", [-1, 1, 17, 1]], ["tile_rc", "sp", [-1, 1]], ["tile_ry", "sp", [-1, 1]], ["tile_rx", "sp", [-1, 1]], ["auto_unroll_max_step", "ot", 0], ["unroll_explicit", "ot", 0]]}, "result": [[0.0007730606615384615, 0.0007731923615384615, 0.0007735470692307693], 0, 1.3554441928863525, 1679482707.621605], "version": 0.2, "tvm_version": "0.10.0"}
{"input": ["cuda -keys=cuda,gpu -arch=sm_75 -max_num_threads=1024 -thread_warp_size=32", "conv2d_nchw.cuda", [["TENSOR", [1, 160, 17, 17], "float32"], ["TENSOR", [160, 160, 1, 7], "float32"], [1, 1], [0, 3, 0, 3], [1, 1], "float32"], {}], "config": {"index": 1797, "code_hash": null, "entity": [["tile_f", "sp", [-1, 10, 1, 1]], ["tile_y", "sp", [-1, 1, 1, 1]], ["tile_x", "sp", [-1, 1, 17, 1]], ["tile_rc", "sp", [-1, 1]], ["tile_ry", "sp", [-1, 1]], ["tile_rx", "sp", [-1, 1]], ["auto_unroll_max_step", "ot", 0], ["unroll_explicit", "ot", 0]]}, "result": [[0.0006658174105960264, 0.0006658248344370861, 0.0006658642450331126], 0, 1.3508174419403076, 1679482708.4810615], "version": 0.2, "tvm_version": "0.10.0"}
{"input": ["cuda -keys=cuda,gpu -arch=sm_75 -max_num_threads=1024 -thread_warp_size=32", "conv2d_nchw.cuda", [["TENSOR", [1, 160, 17, 17], "float32"], ["TENSOR", [160, 160, 1, 7], "float32"], [1, 1], [0, 3, 0, 3], [1, 1], "float32"], {}], "config": {"index": 23296, "code_hash": null, "entity": [["tile_f", "sp", [-1, 1, 1, 1]], ["tile_y", "sp", [-1, 1, 1, 1]], ["tile_x", "sp", [-1, 1, 17, 1]], ["tile_rc", "sp", [-1, 16]], ["tile_ry", "sp", [-1, 1]], ["tile_rx", "sp", [-1, 1]], ["auto_unroll_max_step", "ot", 0], ["unroll_explicit", "ot", 0]]}, "result": [[0.006253056, 0.0062540740625, 0.006258684125], 0, 1.4903862476348877, 1679482709.3452544], "version": 0.2, "tvm_version": "0.10.0"}
{"input": ["cuda -keys=cuda,gpu -arch=sm_75 -max_num_threads=1024 -thread_warp_size=32", "conv2d_nchw.cuda", [["TENSOR", [1, 160, 17, 17], "float32"], ["TENSOR", [160, 160, 1, 7], "float32"], [1, 1], [0, 3, 0, 3], [1, 1], "float32"], {}], "config": {"index": 2240, "code_hash": null, "entity": [["tile_f", "sp", [-1, 1, 1, 1]], ["tile_y", "sp", [-1, 1, 17, 1]], ["tile_x", "sp", [-1, 1, 17, 1]], ["tile_rc", "sp", [-1, 1]], ["tile_ry", "sp", [-1, 1]], ["tile_rx", "sp", [-1, 1]], ["auto_unroll_max_step", "ot", 0], ["unroll_explicit", "ot", 0]]}, "result": [[0.0011180554666666669, 0.001118071488888889, 0.0011184355777777778], 0, 1.3449609279632568, 1679482710.197845], "version": 0.2, "tvm_version": "0.10.0"}
{"input": ["cuda -keys=cuda,gpu -arch=sm_75 -max_num_threads=1024 -thread_warp_size=32", "conv2d_nchw.cuda", [["TENSOR", [1, 160, 17, 17], "float32"], ["TENSOR", [160, 160, 1, 7], "float32"], [1, 1], [0, 3, 0, 3], [1, 1], "float32"], {}], "config": {"index": 1798, "code_hash": null, "entity": [["tile_f", "sp", [-1, 16, 1, 1]], ["tile_y", "sp", [-1, 1, 1, 1]], ["tile_x", "sp", [-1, 1, 17, 1]], ["tile_rc", "sp", [-1, 1]], ["tile_ry", "sp", [-1, 1]], ["tile_rx", "sp", [-1, 1]], ["auto_unroll_max_step", "ot", 0], ["unroll_explicit", "ot", 0]]}, "result": [[0.0005918987459016394, 0.0005925434918032787, 0.0005925646885245902], 0, 1.6480753421783447, 1679482711.3511276], "version": 0.2, "tvm_version": "0.10.0"}
{"input": ["cuda -keys=cuda,gpu -arch=sm_75 -max_num_threads=1024 -thread_warp_size=32", "conv2d_nchw.cuda", [["TENSOR", [1, 160, 17, 17], "float32"], ["TENSOR", [160, 160, 1, 7], "float32"], [1, 1], [0, 3, 0, 3], [1, 1], "float32"], {}], "config": {"index": 26880, "code_hash": null, "entity": [["tile_f", "sp", [-1, 1, 1, 1]], ["tile_y", "sp", [-1, 1, 1, 1]], ["tile_x", "sp", [-1, 1, 17, 1]], ["tile_rc", "sp", [-1, 20]], ["tile_ry", "sp", [-1, 1]], ["tile_rx", "sp", [-1, 1]], ["auto_unroll_max_step", "ot", 0], ["unroll_explicit", "ot", 0]]}, "result": [[0.0033497156774193546, 0.0033532293870967744, 0.0033543937419354838], 0, 1.389634609222412, 1679482712.2331424], "version": 0.2, "tvm_version": "0.10.0"}
{"input": ["cuda -keys=cuda,gpu -arch=sm_75 -max_num_threads=1024 -thread_warp_size=32", "conv2d_nchw.cuda", [["TENSOR", [1, 160, 17, 17], "float32"], ["TENSOR", [160, 160, 1, 7], "float32"], [1, 1], [0, 3, 0, 3], [1, 1], "float32"], {}], "config": {"index": 2464, "code_hash": null, "entity": [["tile_f", "sp", [-1, 1, 1, 1]], ["tile_y", "sp", [-1, 1, 1, 17]], ["tile_x", "sp", [-1, 1, 17, 1]], ["tile_rc", "sp", [-1, 1]], ["tile_ry", "sp", [-1, 1]], ["tile_rx", "sp", [-1, 1]], ["auto_unroll_max_step", "ot", 0], ["unroll_explicit", "ot", 0]]}, "result": [[0.0007729513846153847, 0.0007741612307692308, 0.0007749228230769231], 0, 1.3963391780853271, 1679482713.0902305], "version": 0.2, "tvm_version": "0.10.0"}
{"input": ["cuda -keys=cuda,gpu -arch=sm_75 -max_num_threads=1024 -thread_warp_size=32", "conv2d_nchw.cuda", [["TENSOR", [1, 160, 17, 17], "float32"], ["TENSOR", [160, 160, 1, 7], "float32"], [1, 1], [0, 3, 0, 3], [1, 1], "float32"], {}], "config": {"index": 1799, "code_hash": null, "entity": [["tile_f", "sp", [-1, 20, 1, 1]], ["tile_y", "sp", [-1, 1, 1, 1]], ["tile_x", "sp", [-1, 1, 17, 1]], ["tile_rc", "sp", [-1, 1]], ["tile_ry", "sp", [-1, 1]], ["tile_rx", "sp", [-1, 1]], ["auto_unroll_max_step", "ot", 0], ["unroll_explicit", "ot", 0]]}, "result": [[0.0005491444699453552, 0.0005492728360655738, 0.000549289262295082], 0, 1.3544831275939941, 1679482713.9610524], "version": 0.2, "tvm_version": "0.10.0"}
{"input": ["cuda -keys=cuda,gpu -arch=sm_75 -max_num_threads=1024 -thread_warp_size=32", "conv2d_nchw.cuda", [["TENSOR", [1, 160, 17, 17], "float32"], ["TENSOR", [160, 160, 1, 7], "float32"], [1, 1], [0, 3, 0, 3], [1, 1], "float32"], {}], "config": {"index": 393576, "code_hash": null, "entity": [["tile_f", "sp", [-1, 32, 1, 1]], ["tile_y", "sp", [-1, 17, 1, 1]], ["tile_x", "sp", [-1, 1, 1, 17]], ["tile_rc", "sp", [-1, 2]], ["tile_ry", "sp", [-1, 1]], ["tile_rx", "sp", [-1, 7]], ["auto_unroll_max_step", "ot", 512], ["unroll_explicit", "ot", 1]]}, "result": [[0.320100494, 0.32063552850000004, 0.3210485835], 0, 6.33197546005249, 1679482720.4098294], "version": 0.2, "tvm_version": "0.10.0"}
{"input": ["cuda -keys=cuda,gpu -arch=sm_75 -max_num_threads=1024 -thread_warp_size=32", "conv2d_nchw.cuda", [["TENSOR", [1, 160, 17, 17], "float32"], ["TENSOR", [160, 160, 1, 7], "float32"], [1, 1], [0, 3, 0, 3], [1, 1], "float32"], {}], "config": {"index": 173831, "code_hash": null, "entity": [["tile_f", "sp", [-1, 20, 1, 1]], ["tile_y", "sp", [-1, 1, 1, 1]], ["tile_x", "sp", [-1, 1, 17, 1]], ["tile_rc", "sp", [-1, 1]], ["tile_ry", "sp", [-1, 1]], ["tile_rx", "sp", [-1, 1]], ["auto_unroll_max_step", "ot", 1500], ["unroll_explicit", "ot", 0]]}, "result": [[0.0005458301032608696, 0.0005459304456521738, 0.0005468617282608695], 0, 1.4103126525878906, 1679482721.2558584], "version": 0.2, "tvm_version": "0.10.0"}
{"input": ["cuda -keys=cuda,gpu -arch=sm_75 -max_num_threads=1024 -thread_warp_size=32", "conv2d_nchw.cuda", [["TENSOR", [1, 160, 17, 17], "float32"], ["TENSOR", [160, 160, 1, 7], "float32"], [1, 1], [0, 3, 0, 3], [1, 1], "float32"], {}], "config": {"index": 30471, "code_hash": null, "entity": [["tile_f", "sp", [-1, 20, 1, 1]], ["tile_y", "sp", [-1, 1, 1, 1]], ["tile_x", "sp", [-1, 1, 17, 1]], ["tile_rc", "sp", [-1, 32]], ["tile_ry", "sp", [-1, 1]], ["tile_rx", "sp", [-1, 1]], ["auto_unroll_max_step", "ot", 0], ["unroll_explicit", "ot", 0]]}, "result": [[0.000670210523178808, 0.0006704283907284767, 0.0006705377284768212], 0, 1.469726800918579, 1679482722.0837498], "version": 0.2, "tvm_version": "0.10.0"}
{"input": ["cuda -keys=cuda,gpu -arch=sm_75 -max_num_threads=1024 -thread_warp_size=32", "conv2d_nchw.cuda", [["TENSOR", [1, 160, 17, 17], "float32"], ["TENSOR", [160, 160, 1, 7], "float32"], [1, 1], [0, 3, 0, 3], [1, 1], "float32"], {}], "config": {"index": 1807, "code_hash": null, "entity": [["tile_f", "sp", [-1, 5, 2, 1]], ["tile_y", "sp", [-1, 1, 1, 1]], ["tile_x", "sp", [-1, 1, 17, 1]], ["tile_rc", "sp", [-1, 1]], ["tile_ry", "sp", [-1, 1]], ["tile_rx", "sp", [-1, 1]], ["auto_unroll_max_step", "ot", 0], ["unroll_explicit", "ot", 0]]}, "result": [[0.0008395146666666666, 0.0008395413, 0.0008395432083333333], 0, 1.3962817192077637, 1679482722.936962], "version": 0.2, "tvm_version": "0.10.0"}
{"input": ["cuda -keys=cuda,gpu -arch=sm_75 -max_num_threads=1024 -thread_warp_size=32", "conv2d_nchw.cuda", [["TENSOR", [1, 160, 17, 17], "float32"], ["TENSOR", [160, 160, 1, 7], "float32"], [1, 1], [0, 3, 0, 3], [1, 1], "float32"], {}], "config": {"index": 259847, "code_hash": null, "entity": [["tile_f", "sp", [-1, 20, 1, 1]], ["tile_y", "sp", [-1, 1, 1, 1]], ["tile_x", "sp", [-1, 1, 17, 1]], ["tile_rc", "sp", [-1, 1]], ["tile_ry", "sp", [-1, 1]], ["tile_rx", "sp", [-1, 1]], ["auto_unroll_max_step", "ot", 0], ["unroll_explicit", "ot", 1]]}, "result": [[0.0005491978967391305, 0.0005492078097826087, 0.0005492960054347826], 0, 1.3937625885009766, 1679482723.785066], "version": 0.2, "tvm_version": "0.10.0"}
{"input": ["cuda -keys=cuda,gpu -arch=sm_75 -max_num_threads=1024 -thread_warp_size=32", "conv2d_nchw.cuda", [["TENSOR", [1, 160, 17, 17], "float32"], ["TENSOR", [160, 160, 1, 7], "float32"], [1, 1], [0, 3, 0, 3], [1, 1], "float32"], {}], "config": {"index": 44807, "code_hash": null, "entity": [["tile_f", "sp", [-1, 20, 1, 1]], ["tile_y", "sp", [-1, 1, 1, 1]], ["tile_x", "sp", [-1, 1, 17, 1]], ["tile_rc", "sp", [-1, 1]], ["tile_ry", "sp", [-1, 1]], ["tile_rx", "sp", [-1, 7]], ["auto_unroll_max_step", "ot", 0], ["unroll_explicit", "ot", 0]]}, "result": [[0.0003424678983050848, 0.0003424741830508475, 0.00034251183728813557], 0, 1.4034783840179443, 1679482724.636235], "version": 0.2, "tvm_version": "0.10.0"}
{"input": ["cuda -keys=cuda,gpu -arch=sm_75 -max_num_threads=1024 -thread_warp_size=32", "conv2d_nchw.cuda", [["TENSOR", [1, 160, 17, 17], "float32"], ["TENSOR", [160, 160, 1, 7], "float32"], [1, 1], [0, 3, 0, 3], [1, 1], "float32"], {}], "config": {"index": 34055, "code_hash": null, "entity": [["tile_f", "sp", [-1, 20, 1, 1]], ["tile_y", "sp", [-1, 1, 1, 1]], ["tile_x", "sp", [-1, 1, 17, 1]], ["tile_rc", "sp", [-1, 40]], ["tile_ry", "sp", [-1, 1]], ["tile_rx", "sp", [-1, 1]], ["auto_unroll_max_step", "ot", 0], ["unroll_explicit", "ot", 0]]}, "result": [[0.0006349207875000001, 0.0006353015874999999, 0.0006361772], 0, 1.526416540145874, 1679482725.493794], "version": 0.2, "tvm_version": "0.10.0"}
{"input": ["cuda -keys=cuda,gpu -arch=sm_75 -max_num_threads=1024 -thread_warp_size=32", "conv2d_nchw.cuda", [["TENSOR", [1, 160, 17, 17], "float32"], ["TENSOR", [160, 160, 1, 7], "float32"], [1, 1], [0, 3, 0, 3], [1, 1], "float32"], {}], "config": {"index": 2695, "code_hash": null, "entity": [["tile_f", "sp", [-1, 20, 1, 1]], ["tile_y", "sp", [-1, 1, 1, 1]], ["tile_x", "sp", [-1, 1, 1, 17]], ["tile_rc", "sp", [-1, 1]], ["tile_ry", "sp", [-1, 1]], ["tile_rx", "sp", [-1, 1]], ["auto_unroll_max_step", "ot", 0], ["unroll_explicit", "ot", 0]]}, "result": [[0.014140416125, 0.014168948125, 0.014177816375000001], 0, 1.8640921115875244, 1679482726.45792], "version": 0.2, "tvm_version": "0.10.0"}
{"input": ["cuda -keys=cuda,gpu -arch=sm_75 -max_num_threads=1024 -thread_warp_size=32", "conv2d_nchw.cuda", [["TENSOR", [1, 160, 17, 17], "float32"], ["TENSOR", [160, 160, 1, 7], "float32"], [1, 1], [0, 3, 0, 3], [1, 1], "float32"], {}], "config": {"index": 2023, "code_hash": null, "entity": [["tile_f", "sp", [-1, 20, 1, 1]], ["tile_y", "sp", [-1, 17, 1, 1]], ["tile_x", "sp", [-1, 1, 17, 1]], ["tile_rc", "sp", [-1, 1]], ["tile_ry", "sp", [-1, 1]], ["tile_rx", "sp", [-1, 1]], ["auto_unroll_max_step", "ot", 0], ["unroll_explicit", "ot", 0]]}, "result": [[0.0014319134507042254, 0.001432043690140845, 0.0014336815352112675], 0, 1.7454512119293213, 1679482727.3277304], "version": 0.2, "tvm_version": "0.10.0"}
{"input": ["cuda -keys=cuda,gpu -arch=sm_75 -max_num_threads=1024 -thread_warp_size=32", "conv2d_nchw.cuda", [["TENSOR", [1, 160, 17, 17], "float32"], ["TENSOR", [160, 160, 1, 7], "float32"], [1, 1], [0, 3, 0, 3], [1, 1], "float32"], {}], "config": {"index": 1808, "code_hash": null, "entity": [["tile_f", "sp", [-1, 8, 2, 1]], ["tile_y", "sp", [-1, 1, 1, 1]], ["tile_x", "sp", [-1, 1, 17, 1]], ["tile_rc", "sp", [-1, 1]], ["tile_ry", "sp", [-1, 1]], ["tile_rx", "sp", [-1, 1]], ["auto_unroll_max_step", "ot", 0], ["unroll_explicit", "ot", 0]]}, "result": [[0.000757281171641791, 0.0007573456791044775, 0.0007573547313432836], 0, 1.4481632709503174, 1679482728.1888294], "version": 0.2, "tvm_version": "0.10.0"}
{"input": ["cuda -keys=cuda,gpu -arch=sm_75 -max_num_threads=1024 -thread_warp_size=32", "conv2d_nchw.cuda", [["TENSOR", [1, 160, 17, 17], "float32"], ["TENSOR", [160, 160, 1, 7], "float32"], [1, 1], [0, 3, 0, 3], [1, 1], "float32"], {}], "config": {"index": 87815, "code_hash": null, "entity": [["tile_f", "sp", [-1, 20, 1, 1]], ["tile_y", "sp", [-1, 1, 1, 1]], ["tile_x", "sp", [-1, 1, 17, 1]], ["tile_rc", "sp", [-1, 1]], ["tile_ry", "sp", [-1, 1]], ["tile_rx", "sp", [-1, 1]], ["auto_unroll_max_step", "ot", 512], ["unroll_explicit", "ot", 0]]}, "result": [[0.0005456956594594595, 0.0005457532702702702, 0.0005460052864864865], 0, 1.4113659858703613, 1679482729.022013], "version": 0.2, "tvm_version": "0.10.0"}
{"input": ["cuda -keys=cuda,gpu -arch=sm_75 -max_num_threads=1024 -thread_warp_size=32", "conv2d_nchw.cuda", [["TENSOR", [1, 160, 17, 17], "float32"], ["TENSOR", [160, 160, 1, 7], "float32"], [1, 1], [0, 3, 0, 3], [1, 1], "float32"], {}], "config": {"index": 37639, "code_hash": null, "entity": [["tile_f", "sp", [-1, 20, 1, 1]], ["tile_y", "sp", [-1, 1, 1, 1]], ["tile_x", "sp", [-1, 1, 17, 1]], ["tile_rc", "sp", [-1, 80]], ["tile_ry", "sp", [-1, 1]], ["tile_rx", "sp", [-1, 1]], ["auto_unroll_max_step", "ot", 0], ["unroll_explicit", "ot", 0]]}, "result": [[0.0006323867701863354, 0.0006324094161490683, 0.0006335737763975155], 0, 1.6862719058990479, 1679482729.895418], "version": 0.2, "tvm_version": "0.10.0"}
{"input": ["cuda -keys=cuda,gpu -arch=sm_75 -max_num_threads=1024 -thread_warp_size=32", "conv2d_nchw.cuda", [["TENSOR", [1, 160, 17, 17], "float32"], ["TENSOR", [160, 160, 1, 7], "float32"], [1, 1], [0, 3, 0, 3], [1, 1], "float32"], {}], "config": {"index": 7, "code_hash": null, "entity": [["tile_f", "sp", [-1, 20, 1, 1]], ["tile_y", "sp", [-1, 1, 1, 1]], ["tile_x", "sp", [-1, 1, 1, 1]], ["tile_rc", "sp", [-1, 1]], ["tile_ry", "sp", [-1, 1]], ["tile_rx", "sp", [-1, 1]], ["auto_unroll_max_step", "ot", 0], ["unroll_explicit", "ot", 0]]}, "result": [[0.008410903916666667, 0.008428885083333332, 0.008440645166666667], 0, 1.4623544216156006, 1679482730.7752879], "version": 0.2, "tvm_version": "0.10.0"}
{"input": ["cuda -keys=cuda,gpu -arch=sm_75 -max_num_threads=1024 -thread_warp_size=32", "conv2d_nchw.cuda", [["TENSOR", [1, 160, 17, 17], "float32"], ["TENSOR", [160, 160, 1, 7], "float32"], [1, 1], [0, 3, 0, 3], [1, 1], "float32"], {}], "config": {"index": 2247, "code_hash": null, "entity": [["tile_f", "sp", [-1, 20, 1, 1]], ["tile_y", "sp", [-1, 1, 17, 1]], ["tile_x", "sp", [-1, 1, 17, 1]], ["tile_rc", "sp", [-1, 1]], ["tile_ry", "sp", [-1, 1]], ["tile_rx", "sp", [-1, 1]], ["auto_unroll_max_step", "ot", 0], ["unroll_explicit", "ot", 0]]}, "result": [[0.0003068410972644377, 0.0003070132583586626, 0.00030813004863221885], 0, 1.3984899520874023, 1679482731.6406665], "version": 0.2, "tvm_version": "0.10.0"}
{"input": ["cuda -keys=cuda,gpu -arch=sm_75 -max_num_threads=1024 -thread_warp_size=32", "conv2d_nchw.cuda", [["TENSOR", [1, 160, 17, 17], "float32"], ["TENSOR", [160, 160, 1, 7], "float32"], [1, 1], [0, 3, 0, 3], [1, 1], "float32"], {}], "config": {"index": 1809, "code_hash": null, "entity": [["tile_f", "sp", [-1, 10, 2, 1]], ["tile_y", "sp", [-1, 1, 1, 1]], ["tile_x", "sp", [-1, 1, 17, 1]], ["tile_rc", "sp", [-1, 1]], ["tile_ry", "sp", [-1, 1]], ["tile_rx", "sp", [-1, 1]], ["auto_unroll_max_step", "ot", 0], ["unroll_explicit", "ot", 0]]}, "result": [[0.0006936127123287671, 0.0006937985821917808, 0.0006938507328767123], 0, 1.3993048667907715, 1679482732.4918272], "version": 0.2, "tvm_version": "0.10.0"}
{"input": ["cuda -keys=cuda,gpu -arch=sm_75 -max_num_threads=1024 -thread_warp_size=32", "conv2d_nchw.cuda", [["TENSOR", [1, 160, 17, 17], "float32"], ["TENSOR", [160, 160, 1, 7], "float32"], [1, 1], [0, 3, 0, 3], [1, 1], "float32"], {}], "config": {"index": 41223, "code_hash": null, "entity": [["tile_f", "sp", [-1, 20, 1, 1]], ["tile_y", "sp", [-1, 1, 1, 1]], ["tile_x", "sp", [-1, 1, 17, 1]], ["tile_rc", "sp", [-1, 160]], ["tile_ry", "sp", [-1, 1]], ["tile_rx", "sp", [-1, 1]], ["auto_unroll_max_step", "ot", 0], ["unroll_explicit", "ot", 0]]}, "result": [[0.001224035048192771, 0.0012256138795180725, 0.0012261597951807228], 0, 1.861288070678711, 1679482733.3528461], "version": 0.2, "tvm_version": "0.10.0"}
{"input": ["cuda -keys=cuda,gpu -arch=sm_75 -max_num_threads=1024 -thread_warp_size=32", "conv2d_nchw.cuda", [["TENSOR", [1, 160, 17, 17], "float32"], ["TENSOR", [160, 160, 1, 7], "float32"], [1, 1], [0, 3, 0, 3], [1, 1], "float32"], {}], "config": {"index": 903, "code_hash": null, "entity": [["tile_f", "sp", [-1, 20, 1, 1]], ["tile_y", "sp", [-1, 1, 1, 1]], ["tile_x", "sp", [-1, 17, 1, 1]], ["tile_rc", "sp", [-1, 1]], ["tile_ry", "sp", [-1, 1]], ["tile_rx", "sp", [-1, 1]], ["auto_unroll_max_step", "ot", 0], ["unroll_explicit", "ot", 0]]}, "result": [[0.014151866545454545, 0.014167664909090908, 0.014524703857142857], 0, 2.043210744857788, 1679482737.1843193], "version": 0.2, "tvm_version": "0.10.0"}
{"input": ["cuda -keys=cuda,gpu -arch=sm_75 -max_num_threads=1024 -thread_warp_size=32", "conv2d_nchw.cuda", [["TENSOR", [1, 160, 17, 17], "float32"], ["TENSOR", [160, 160, 1, 7], "float32"], [1, 1], [0, 3, 0, 3], [1, 1], "float32"], {}], "config": {"index": 2471, "code_hash": null, "entity": [["tile_f", "sp", [-1, 20, 1, 1]], ["tile_y", "sp", [-1, 1, 1, 17]], ["tile_x", "sp", [-1, 1, 17, 1]], ["tile_rc", "sp", [-1, 1]], ["tile_ry", "sp", [-1, 1]], ["tile_rx", "sp", [-1, 1]], ["auto_unroll_max_step", "ot", 0], ["unroll_explicit", "ot", 0]]}, "result": [[0.0014317197042253522, 0.0014321379295774647, 0.0014339177183098593], 0, 1.7572147846221924, 1679482738.0310884], "version": 0.2, "tvm_version": "0.10.0"}
{"input": ["cuda -keys=cuda,gpu -arch=sm_75 -max_num_threads=1024 -thread_warp_size=32", "conv2d_nchw.cuda", [["TENSOR", [1, 160, 17, 17], "float32"], ["TENSOR", [160, 160, 1, 7], "float32"], [1, 1], [0, 3, 0, 3], [1, 1], "float32"], {}], "config": {"index": 394024, "code_hash": null, "entity": [["tile_f", "sp", [-1, 32, 1, 1]], ["tile_y", "sp", [-1, 1, 1, 17]], ["tile_x", "sp", [-1, 1, 1, 17]], ["tile_rc", "sp", [-1, 2]], ["tile_ry", "sp", [-1, 1]], ["tile_rx", "sp", [-1, 7]], ["auto_unroll_max_step", "ot", 512], ["unroll_explicit", "ot", 1]]}, "result": [[0.35350570649999996, 0.35352474949999996, 0.353782806], 0, 6.781233787536621, 1679482742.2601564], "version": 0.2, "tvm_version": "0.10.0"}
{"input": ["cuda -keys=cuda,gpu -arch=sm_75 -max_num_threads=1024 -thread_warp_size=32", "conv2d_nchw.cuda", [["TENSOR", [1, 160, 17, 17], "float32"], ["TENSOR", [160, 160, 1, 7], "float32"], [1, 1], [0, 3, 0, 3], [1, 1], "float32"], {}], "config": {"index": 2259, "code_hash": null, "entity": [["tile_f", "sp", [-1, 20, 2, 1]], ["tile_y", "sp", [-1, 1, 17, 1]], ["tile_x", "sp", [-1, 1, 17, 1]], ["tile_rc", "sp", [-1, 1]], ["tile_ry", "sp", [-1, 1]], ["tile_rx", "sp", [-1, 1]], ["auto_unroll_max_step", "ot", 0], ["unroll_explicit", "ot", 0]]}, "result": [[0.0008501598403361344, 0.0008502585714285713, 0.000850274924369748], 0, 1.439479112625122, 1679482743.1077783], "version": 0.2, "tvm_version": "0.10.0"}
{"input": ["cuda -keys=cuda,gpu -arch=sm_75 -max_num_threads=1024 -thread_warp_size=32", "conv2d_nchw.cuda", [["TENSOR", [1, 160, 17, 17], "float32"], ["TENSOR", [160, 160, 1, 7], "float32"], [1, 1], [0, 3, 0, 3], [1, 1], "float32"], {}], "config": {"index": 260295, "code_hash": null, "entity": [["tile_f", "sp", [-1, 20, 1, 1]], ["tile_y", "sp", [-1, 1, 17, 1]], ["tile_x", "sp", [-1, 1, 17, 1]], ["tile_rc", "sp", [-1, 1]], ["tile_ry", "sp", [-1, 1]], ["tile_rx", "sp", [-1, 1]], ["auto_unroll_max_step", "ot", 0], ["unroll_explicit", "ot", 1]]}, "result": [[0.00030586014734774065, 0.0003058681218074656, 0.000306282626719057], 0, 1.7348546981811523, 1679482744.3158565], "version": 0.2, "tvm_version": "0.10.0"}
{"input": ["cuda -keys=cuda,gpu -arch=sm_75 -max_num_threads=1024 -thread_warp_size=32", "conv2d_nchw.cuda", [["TENSOR", [1, 160, 17, 17], "float32"], ["TENSOR", [160, 160, 1, 7], "float32"], [1, 1], [0, 3, 0, 3], [1, 1], "float32"], {}], "config": {"index": 88263, "code_hash": null, "entity": [["tile_f", "sp", [-1, 20, 1, 1]], ["tile_y", "sp", [-1, 1, 17, 1]], ["tile_x", "sp", [-1, 1, 17, 1]], ["tile_rc", "sp", [-1, 1]], ["tile_ry", "sp", [-1, 1]], ["tile_rx", "sp", [-1, 1]], ["auto_unroll_max_step", "ot", 512], ["unroll_explicit", "ot", 0]]}, "result": [[0.0002405496995515695, 0.00024060808968609867, 0.00024065721823617335], 0, 1.7810227870941162, 1679482745.5155914], "version": 0.2, "tvm_version": "0.10.0"}
{"input": ["cuda -keys=cuda,gpu -arch=sm_75 -max_num_threads=1024 -thread_warp_size=32", "conv2d_nchw.cuda", [["TENSOR", [1, 160, 17, 17], "float32"], ["TENSOR", [160, 160, 1, 7], "float32"], [1, 1], [0, 3, 0, 3], [1, 1], "float32"], {}], "config": {"index": 45255, "code_hash": null, "entity": [["tile_f", "sp", [-1, 20, 1, 1]], ["tile_y", "sp", [-1, 1, 17, 1]], ["tile_x", "sp", [-1, 1, 17, 1]], ["tile_rc", "sp", [-1, 1]], ["tile_ry", "sp", [-1, 1]], ["tile_rx", "sp", [-1, 7]], ["auto_unroll_max_step", "ot", 0], ["unroll_explicit", "ot", 0]]}, "result": [[0.00022772756306306308, 0.00022777081306306305, 0.0002277948873873874], 0, 1.4537184238433838, 1679482746.3642955], "version": 0.2, "tvm_version": "0.10.0"}
{"input": ["cuda -keys=cuda,gpu -arch=sm_75 -max_num_threads=1024 -thread_warp_size=32", "conv2d_nchw.cuda", [["TENSOR", [1, 160, 17, 17], "float32"], ["TENSOR", [160, 160, 1, 7], "float32"], [1, 1], [0, 3, 0, 3], [1, 1], "float32"], {}], "config": {"index": 5831, "code_hash": null, "entity": [["tile_f", "sp", [-1, 20, 1, 1]], ["tile_y", "sp", [-1, 1, 17, 1]], ["tile_x", "sp", [-1, 1, 17, 1]], ["tile_rc", "sp", [-1, 2]], ["tile_ry", "sp", [-1, 1]], ["tile_rx", "sp", [-1, 1]], ["auto_unroll_max_step", "ot", 0], ["unroll_explicit", "ot", 0]]}, "result": [[0.00022734678684807258, 0.00022736050566893423, 0.0002274168866213152], 0, 1.4540228843688965, 1679482747.2168362], "version": 0.2, "tvm_version": "0.10.0"}
{"input": ["cuda -keys=cuda,gpu -arch=sm_75 -max_num_threads=1024 -thread_warp_size=32", "conv2d_nchw.cuda", [["TENSOR", [1, 160, 17, 17], "float32"], ["TENSOR", [160, 160, 1, 7], "float32"], [1, 1], [0, 3, 0, 3], [1, 1], "float32"], {}], "config": {"index": 3143, "code_hash": null, "entity": [["tile_f", "sp", [-1, 20, 1, 1]], ["tile_y", "sp", [-1, 1, 17, 1]], ["tile_x", "sp", [-1, 1, 1, 17]], ["tile_rc", "sp", [-1, 1]], ["tile_ry", "sp", [-1, 1]], ["tile_rx", "sp", [-1, 1]], ["auto_unroll_max_step", "ot", 0], ["unroll_explicit", "ot", 0]]}, "result": [[0.0014092853333333333, 0.0014097159583333334, 0.0014100479444444445], 0, 1.757730484008789, 1679482748.0782526], "version": 0.2, "tvm_version": "0.10.0"}
{"input": ["cuda -keys=cuda,gpu -arch=sm_75 -max_num_threads=1024 -thread_warp_size=32", "conv2d_nchw.cuda", [["TENSOR", [1, 160, 17, 17], "float32"], ["TENSOR", [160, 160, 1, 7], "float32"], [1, 1], [0, 3, 0, 3], [1, 1], "float32"], {}], "config": {"index": 2260, "code_hash": null, "entity": [["tile_f", "sp", [-1, 40, 2, 1]], ["tile_y", "sp", [-1, 1, 17, 1]], ["tile_x", "sp", [-1, 1, 17, 1]], ["tile_rc", "sp", [-1, 1]], ["tile_ry", "sp", [-1, 1]], ["tile_rx", "sp", [-1, 1]], ["auto_unroll_max_step", "ot", 0], ["unroll_explicit", "ot", 0]]}, "result": [[0.0014301885633802817, 0.0014307731267605634, 0.0014312995492957747], 0, 1.4261507987976074, 1679482748.9310274], "version": 0.2, "tvm_version": "0.10.0"}
{"input": ["cuda -keys=cuda,gpu -arch=sm_75 -max_num_threads=1024 -thread_warp_size=32", "conv2d_nchw.cuda", [["TENSOR", [1, 160, 17, 17], "float32"], ["TENSOR", [160, 160, 1, 7], "float32"], [1, 1], [0, 3, 0, 3], [1, 1], "float32"], {}], "config": {"index": 174279, "code_hash": null, "entity": [["tile_f", "sp", [-1, 20, 1, 1]], ["tile_y", "sp", [-1, 1, 17, 1]], ["tile_x", "sp", [-1, 1, 17, 1]], ["tile_rc", "sp", [-1, 1]], ["tile_ry", "sp", [-1, 1]], ["tile_rx", "sp", [-1, 1]], ["auto_unroll_max_step", "ot", 1500], ["unroll_explicit", "ot", 0]]}, "result": [[0.00024047740714285714, 0.00024049660714285713, 0.0002405570976190476], 0, 1.4569365978240967, 1679482749.774404], "version": 0.2, "tvm_version": "0.10.0"}
{"input": ["cuda -keys=cuda,gpu -arch=sm_75 -max_num_threads=1024 -thread_warp_size=32", "conv2d_nchw.cuda", [["TENSOR", [1, 160, 17, 17], "float32"], ["TENSOR", [160, 160, 1, 7], "float32"], [1, 1], [0, 3, 0, 3], [1, 1], "float32"], {}], "config": {"index": 9415, "code_hash": null, "entity": [["tile_f", "sp", [-1, 20, 1, 1]], ["tile_y", "sp", [-1, 1, 17, 1]], ["tile_x", "sp", [-1, 1, 17, 1]], ["tile_rc", "sp", [-1, 4]], ["tile_ry", "sp", [-1, 1]], ["tile_rx", "sp", [-1, 1]], ["auto_unroll_max_step", "ot", 0], ["unroll_explicit", "ot", 0]]}, "result": [[0.0002631788795811518, 0.0002632216204188482, 0.0002634826361256545], 0, 1.4624261856079102, 1679482750.6239128], "version": 0.2, "tvm_version": "0.10.0"}
{"input": ["cuda -keys=cuda,gpu -arch=sm_75 -max_num_threads=1024 -thread_warp_size=32", "conv2d_nchw.cuda", [["TENSOR", [1, 160, 17, 17], "float32"], ["TENSOR", [160, 160, 1, 7], "float32"], [1, 1], [0, 3, 0, 3], [1, 1], "float32"], {}], "config": {"index": 455, "code_hash": null, "entity": [["tile_f", "sp", [-1, 20, 1, 1]], ["tile_y", "sp", [-1, 1, 17, 1]], ["tile_x", "sp", [-1, 1, 1, 1]], ["tile_rc", "sp", [-1, 1]], ["tile_ry", "sp", [-1, 1]], ["tile_rx", "sp", [-1, 1]], ["auto_unroll_max_step", "ot", 0], ["unroll_explicit", "ot", 0]]}, "result": [[0.0005943759235294118, 0.0005943778058823529, 0.0005944901823529412], 0, 1.4212253093719482, 1679482751.473935], "version": 0.2, "tvm_version": "0.10.0"}
{"input": ["cuda -keys=cuda,gpu -arch=sm_75 -max_num_threads=1024 -thread_warp_size=32", "conv2d_nchw.cuda", [["TENSOR", [1, 160, 17, 17], "float32"], ["TENSOR", [160, 160, 1, 7], "float32"], [1, 1], [0, 3, 0, 3], [1, 1], "float32"], {}], "config": {"index": 2261, "code_hash": null, "entity": [["tile_f", "sp", [-1, 80, 2, 1]], ["tile_y", "sp", [-1, 1, 17, 1]], ["tile_x", "sp", [-1, 1, 17, 1]], ["tile_rc", "sp", [-1, 1]], ["tile_ry", "sp", [-1, 1]], ["tile_rx", "sp", [-1, 1]], ["auto_unroll_max_step", "ot", 0], ["unroll_explicit", "ot", 0]]}, "result": [[0.0031884600937499997, 0.0031888740000000004, 0.00319154190625], 0, 1.5785026550292969, 1679482752.316619], "version": 0.2, "tvm_version": "0.10.0"}
{"input": ["cuda -keys=cuda,gpu -arch=sm_75 -max_num_threads=1024 -thread_warp_size=32", "conv2d_nchw.cuda", [["TENSOR", [1, 160, 17, 17], "float32"], ["TENSOR", [160, 160, 1, 7], "float32"], [1, 1], [0, 3, 0, 3], [1, 1], "float32"], {}], "config": {"index": 12999, "code_hash": null, "entity": [["tile_f", "sp", [-1, 20, 1, 1]], ["tile_y", "sp", [-1, 1, 17, 1]], ["tile_x", "sp", [-1, 1, 17, 1]], ["tile_rc", "sp", [-1, 5]], ["tile_ry", "sp", [-1, 1]], ["tile_rx", "sp", [-1, 1]], ["auto_unroll_max_step", "ot", 0], ["unroll_explicit", "ot", 0]]}, "result": [[0.0001973201689587426, 0.00019732420039292732, 0.00019735236542239685], 0, 1.4786131381988525, 1679482753.1456106], "version": 0.2, "tvm_version": "0.10.0"}
{"input": ["cuda -keys=cuda,gpu -arch=sm_75 -max_num_threads=1024 -thread_warp_size=32", "conv2d_nchw.cuda", [["TENSOR", [1, 160, 17, 17], "float32"], ["TENSOR", [160, 160, 1, 7], "float32"], [1, 1], [0, 3, 0, 3], [1, 1], "float32"], {}], "config": {"index": 1351, "code_hash": null, "entity": [["tile_f", "sp", [-1, 20, 1, 1]], ["tile_y", "sp", [-1, 1, 17, 1]], ["tile_x", "sp", [-1, 17, 1, 1]], ["tile_rc", "sp", [-1, 1]], ["tile_ry", "sp", [-1, 1]], ["tile_rx", "sp", [-1, 1]], ["auto_unroll_max_step", "ot", 0], ["unroll_explicit", "ot", 0]]}, "result": [[0.0014092800277777779, 0.0014093369305555555, 0.0014095315833333334], 0, 1.7631738185882568, 1679482754.000931], "version": 0.2, "tvm_version": "0.10.0"}
{"input": ["cuda -keys=cuda,gpu -arch=sm_75 -max_num_threads=1024 -thread_warp_size=32", "conv2d_nchw.cuda", [["TENSOR", [1, 160, 17, 17], "float32"], ["TENSOR", [160, 160, 1, 7], "float32"], [1, 1], [0, 3, 0, 3], [1, 1], "float32"], {}], "config": {"index": 404776, "code_hash": null, "entity": [["tile_f", "sp", [-1, 32, 1, 1]], ["tile_y", "sp", [-1, 1, 1, 17]], ["tile_x", "sp", [-1, 1, 1, 17]], ["tile_rc", "sp", [-1, 8]], ["tile_ry", "sp", [-1, 1]], ["tile_rx", "sp", [-1, 7]], ["auto_unroll_max_step", "ot", 512], ["unroll_explicit", "ot", 1]]}, "result": [[0.3499786985, 0.350097198, 0.350312164], 0, 5.832290172576904, 1679482759.9726841], "version": 0.2, "tvm_version": "0.10.0"}
{"input": ["cuda -keys=cuda,gpu -arch=sm_75 -max_num_threads=1024 -thread_warp_size=32", "conv2d_nchw.cuda", [["TENSOR", [1, 160, 17, 17], "float32"], ["TENSOR", [160, 160, 1, 7], "float32"], [1, 1], [0, 3, 0, 3], [1, 1], "float32"], {}], "config": {"index": 99015, "code_hash": null, "entity": [["tile_f", "sp", [-1, 20, 1, 1]], ["tile_y", "sp", [-1, 1, 17, 1]], ["tile_x", "sp", [-1, 1, 17, 1]], ["tile_rc", "sp", [-1, 5]], ["tile_ry", "sp", [-1, 1]], ["tile_rx", "sp", [-1, 1]], ["auto_unroll_max_step", "ot", 512], ["unroll_explicit", "ot", 0]]}, "result": [[0.00019665073439412484, 0.00019670467197062424, 0.00019672792533659733], 0, 1.7540748119354248, 1679482761.2309568], "version": 0.2, "tvm_version": "0.10.0"}
{"input": ["cuda -keys=cuda,gpu -arch=sm_75 -max_num_threads=1024 -thread_warp_size=32", "conv2d_nchw.cuda", [["TENSOR", [1, 160, 17, 17], "float32"], ["TENSOR", [160, 160, 1, 7], "float32"], [1, 1], [0, 3, 0, 3], [1, 1], "float32"], {}], "config": {"index": 27335, "code_hash": null, "entity": [["tile_f", "sp", [-1, 20, 1, 1]], ["tile_y", "sp", [-1, 1, 17, 1]], ["tile_x", "sp", [-1, 1, 17, 1]], ["tile_rc", "sp", [-1, 20]], ["tile_ry", "sp", [-1, 1]], ["tile_rx", "sp", [-1, 1]], ["auto_unroll_max_step", "ot", 0], ["unroll_explicit", "ot", 0]]}, "result": [[0.00028327851549295776, 0.0002833217774647887, 0.00028335098309859155], 0, 1.2047488689422607, 1679482762.0768638], "version": 0.2, "tvm_version": "0.10.0"}
{"input": ["cuda -keys=cuda,gpu -arch=sm_75 -max_num_threads=1024 -thread_warp_size=32", "conv2d_nchw.cuda", [["TENSOR", [1, 160, 17, 17], "float32"], ["TENSOR", [160, 160, 1, 7], "float32"], [1, 1], [0, 3, 0, 3], [1, 1], "float32"], {}], "config": {"index": 271047, "code_hash": null, "entity": [["tile_f", "sp", [-1, 20, 1, 1]], ["tile_y", "sp", [-1, 1, 17, 1]], ["tile_x", "sp", [-1, 1, 17, 1]], ["tile_rc", "sp", [-1, 5]], ["tile_ry", "sp", [-1, 1]], ["tile_rx", "sp", [-1, 1]], ["auto_unroll_max_step", "ot", 0], ["unroll_explicit", "ot", 1]]}, "result": [[0.00019728873673870333, 0.00019733915913555994, 0.00019743685854616897], 0, 1.258981466293335, 1679482762.928099], "version": 0.2, "tvm_version": "0.10.0"}
{"input": ["cuda -keys=cuda,gpu -arch=sm_75 -max_num_threads=1024 -thread_warp_size=32", "conv2d_nchw.cuda", [["TENSOR", [1, 160, 17, 17], "float32"], ["TENSOR", [160, 160, 1, 7], "float32"], [1, 1], [0, 3, 0, 3], [1, 1], "float32"], {}], "config": {"index": 185031, "code_hash": null, "entity": [["tile_f", "sp", [-1, 20, 1, 1]], ["tile_y", "sp", [-1, 1, 17, 1]], ["tile_x", "sp", [-1, 1, 17, 1]], ["tile_rc", "sp", [-1, 5]], ["tile_ry", "sp", [-1, 1]], ["tile_rx", "sp", [-1, 1]], ["auto_unroll_max_step", "ot", 1500], ["unroll_explicit", "ot", 0]]}, "result": [[0.00019650042787286063, 0.0001965779902200489, 0.00019658022860635698], 0, 1.984973669052124, 1679482764.182094], "version": 0.2, "tvm_version": "0.10.0"}
{"input": ["cuda -keys=cuda,gpu -arch=sm_75 -max_num_threads=1024 -thread_warp_size=32", "conv2d_nchw.cuda", [["TENSOR", [1, 160, 17, 17], "float32"], ["TENSOR", [160, 160, 1, 7], "float32"], [1, 1], [0, 3, 0, 3], [1, 1], "float32"], {}], "config": {"index": 56007, "code_hash": null, "entity": [["tile_f", "sp", [-1, 20, 1, 1]], ["tile_y", "sp", [-1, 1, 17, 1]], ["tile_x", "sp", [-1, 1, 17, 1]], ["tile_rc", "sp", [-1, 5]], ["tile_ry", "sp", [-1, 1]], ["tile_rx", "sp", [-1, 7]], ["auto_unroll_max_step", "ot", 0], ["unroll_explicit", "ot", 0]]}, "result": [[0.00017442673483535528, 0.00017443505025996534, 0.00017447375389948008], 0, 1.3346776962280273, 1679482765.0300477], "version": 0.2, "tvm_version": "0.10.0"}
{"input": ["cuda -keys=cuda,gpu -arch=sm_75 -max_num_threads=1024 -thread_warp_size=32", "conv2d_nchw.cuda", [["TENSOR", [1, 160, 17, 17], "float32"], ["TENSOR", [160, 160, 1, 7], "float32"], [1, 1], [0, 3, 0, 3], [1, 1], "float32"], {}], "config": {"index": 30919, "code_hash": null, "entity": [["tile_f", "sp", [-1, 20, 1, 1]], ["tile_y", "sp", [-1, 1, 17, 1]], ["tile_x", "sp", [-1, 1, 17, 1]], ["tile_rc", "sp", [-1, 32]], ["tile_ry", "sp", [-1, 1]], ["tile_rx", "sp", [-1, 1]], ["auto_unroll_max_step", "ot", 0], ["unroll_explicit", "ot", 0]]}, "result": [[0.0008544019237288136, 0.0008545193389830508, 0.0008547658050847457], 0, 1.2574148178100586, 1679482765.8729367], "version": 0.2, "tvm_version": "0.10.0"}
{"input": ["cuda -keys=cuda,gpu -arch=sm_75 -max_num_threads=1024 -thread_warp_size=32", "conv2d_nchw.cuda", [["TENSOR", [1, 160, 17, 17], "float32"], ["TENSOR", [160, 160, 1, 7], "float32"], [1, 1], [0, 3, 0, 3], [1, 1], "float32"], {}], "config": {"index": 13895, "code_hash": null, "entity": [["tile_f", "sp", [-1, 20, 1, 1]], ["tile_y", "sp", [-1, 1, 17, 1]], ["tile_x", "sp", [-1, 1, 1, 17]], ["tile_rc", "sp", [-1, 5]], ["tile_ry", "sp", [-1, 1]], ["tile_rx", "sp", [-1, 1]], ["auto_unroll_max_step", "ot", 0], ["unroll_explicit", "ot", 0]]}, "result": [[0.004613652272727273, 0.004614510590909091, 0.004614648636363637], 0, 1.9553744792938232, 1679482766.7500267], "version": 0.2, "tvm_version": "0.10.0"}
{"input": ["cuda -keys=cuda,gpu -arch=sm_75 -max_num_threads=1024 -thread_warp_size=32", "conv2d_nchw.cuda", [["TENSOR", [1, 160, 17, 17], "float32"], ["TENSOR", [160, 160, 1, 7], "float32"], [1, 1], [0, 3, 0, 3], [1, 1], "float32"], {}], "config": {"index": 13223, "code_hash": null, "entity": [["tile_f", "sp", [-1, 20, 1, 1]], ["tile_y", "sp", [-1, 1, 1, 17]], ["tile_x", "sp", [-1, 1, 17, 1]], ["tile_rc", "sp", [-1, 5]], ["tile_ry", "sp", [-1, 1]], ["tile_rx", "sp", [-1, 1]], ["auto_unroll_max_step", "ot", 0], ["unroll_explicit", "ot", 0]]}, "result": [[0.004552479818181818, 0.004559675727272727, 0.004559976727272728], 0, 1.953139305114746, 1679482767.61558], "version": 0.2, "tvm_version": "0.10.0"}
{"input": ["cuda -keys=cuda,gpu -arch=sm_75 -max_num_threads=1024 -thread_warp_size=32", "conv2d_nchw.cuda", [["TENSOR", [1, 160, 17, 17], "float32"], ["TENSOR", [160, 160, 1, 7], "float32"], [1, 1], [0, 3, 0, 3], [1, 1], "float32"], {}], "config": {"index": 11207, "code_hash": null, "entity": [["tile_f", "sp", [-1, 20, 1, 1]], ["tile_y", "sp", [-1, 1, 17, 1]], ["tile_x", "sp", [-1, 1, 1, 1]], ["tile_rc", "sp", [-1, 5]], ["tile_ry", "sp", [-1, 1]], ["tile_rx", "sp", [-1, 1]], ["auto_unroll_max_step", "ot", 0], ["unroll_explicit", "ot", 0]]}, "result": [[0.0004485482389380531, 0.0004486177831858407, 0.00044875625663716814], 0, 1.3374009132385254, 1679482768.4650435], "version": 0.2, "tvm_version": "0.10.0"}
{"input": ["cuda -keys=cuda,gpu -arch=sm_75 -max_num_threads=1024 -thread_warp_size=32", "conv2d_nchw.cuda", [["TENSOR", [1, 160, 17, 17], "float32"], ["TENSOR", [160, 160, 1, 7], "float32"], [1, 1], [0, 3, 0, 3], [1, 1], "float32"], {}], "config": {"index": 12551, "code_hash": null, "entity": [["tile_f", "sp", [-1, 20, 1, 1]], ["tile_y", "sp", [-1, 1, 1, 1]], ["tile_x", "sp", [-1, 1, 17, 1]], ["tile_rc", "sp", [-1, 5]], ["tile_ry", "sp", [-1, 1]], ["tile_rx", "sp", [-1, 1]], ["auto_unroll_max_step", "ot", 0], ["unroll_explicit", "ot", 0]]}, "result": [[0.00038535665042979943, 0.0003854045243553009, 0.00038544374212034387], 0, 1.6321136951446533, 1679482769.562407], "version": 0.2, "tvm_version": "0.10.0"}
{"input": ["cuda -keys=cuda,gpu -arch=sm_75 -max_num_threads=1024 -thread_warp_size=32", "conv2d_nchw.cuda", [["TENSOR", [1, 160, 17, 17], "float32"], ["TENSOR", [160, 160, 1, 7], "float32"], [1, 1], [0, 3, 0, 3], [1, 1], "float32"], {}], "config": {"index": 12103, "code_hash": null, "entity": [["tile_f", "sp", [-1, 20, 1, 1]], ["tile_y", "sp", [-1, 1, 17, 1]], ["tile_x", "sp", [-1, 17, 1, 1]], ["tile_rc", "sp", [-1, 5]], ["tile_ry", "sp", [-1, 1]], ["tile_rx", "sp", [-1, 1]], ["auto_unroll_max_step", "ot", 0], ["unroll_explicit", "ot", 0]]}, "result": [[0.004613612962962963, 0.004634556518518519, 0.004637410481481481], 0, 2.190645694732666, 1679482775.655341], "version": 0.2, "tvm_version": "0.10.0"}
{"input": ["cuda -keys=cuda,gpu -arch=sm_75 -max_num_threads=1024 -thread_warp_size=32", "conv2d_nchw.cuda", [["TENSOR", [1, 160, 17, 17], "float32"], ["TENSOR", [160, 160, 1, 7], "float32"], [1, 1], [0, 3, 0, 3], [1, 1], "float32"], {}], "config": {"index": 12775, "code_hash": null, "entity": [["tile_f", "sp", [-1, 20, 1, 1]], ["tile_y", "sp", [-1, 17, 1, 1]], ["tile_x", "sp", [-1, 1, 17, 1]], ["tile_rc", "sp", [-1, 5]], ["tile_ry", "sp", [-1, 1]], ["tile_rx", "sp", [-1, 1]], ["auto_unroll_max_step", "ot", 0], ["unroll_explicit", "ot", 0]]}, "result": [[0.0045570674999999995, 0.004559866090909091, 0.004571106954545454], 0, 2.0773956775665283, 1679482776.526316], "version": 0.2, "tvm_version": "0.10.0"}
{"input": ["cuda -keys=cuda,gpu -arch=sm_75 -max_num_threads=1024 -thread_warp_size=32", "conv2d_nchw.cuda", [["TENSOR", [1, 160, 17, 17], "float32"], ["TENSOR", [160, 160, 1, 7], "float32"], [1, 1], [0, 3, 0, 3], [1, 1], "float32"], {}], "config": {"index": 361768, "code_hash": null, "entity": [["tile_f", "sp", [-1, 32, 1, 1]], ["tile_y", "sp", [-1, 1, 1, 17]], ["tile_x", "sp", [-1, 1, 1, 17]], ["tile_rc", "sp", [-1, 8]], ["tile_ry", "sp", [-1, 1]], ["tile_rx", "sp", [-1, 1]], ["auto_unroll_max_step", "ot", 512], ["unroll_explicit", "ot", 1]]}, "result": [[0.3262070615, 0.3280045775, 0.32805902049999996], 0, 5.979504585266113, 1679482780.4796934], "version": 0.2, "tvm_version": "0.10.0"}
{"input": ["cuda -keys=cuda,gpu -arch=sm_75 -max_num_threads=1024 -thread_warp_size=32", "conv2d_nchw.cuda", [["TENSOR", [1, 160, 17, 17], "float32"], ["TENSOR", [160, 160, 1, 7], "float32"], [1, 1], [0, 3, 0, 3], [1, 1], "float32"], {}], "config": {"index": 228039, "code_hash": null, "entity": [["tile_f", "sp", [-1, 20, 1, 1]], ["tile_y", "sp", [-1, 1, 17, 1]], ["tile_x", "sp", [-1, 1, 17, 1]], ["tile_rc", "sp", [-1, 5]], ["tile_ry", "sp", [-1, 1]], ["tile_rx", "sp", [-1, 7]], ["auto_unroll_max_step", "ot", 1500], ["unroll_explicit", "ot", 0]]}, "result": [[0.00017437061697497282, 0.0001744983656147987, 0.00017453280195865072], 0, 2.2889256477355957, 1679482781.7340562], "version": 0.2, "tvm_version": "0.10.0"}
{"input": ["cuda -keys=cuda,gpu -arch=sm_75 -max_num_threads=1024 -thread_warp_size=32", "conv2d_nchw.cuda", [["TENSOR", [1, 160, 17, 17], "float32"], ["TENSOR", [160, 160, 1, 7], "float32"], [1, 1], [0, 3, 0, 3], [1, 1], "float32"], {}], "config": {"index": 314055, "code_hash": null, "entity": [["tile_f", "sp", [-1, 20, 1, 1]], ["tile_y", "sp", [-1, 1, 17, 1]], ["tile_x", "sp", [-1, 1, 17, 1]], ["tile_rc", "sp", [-1, 5]], ["tile_ry", "sp", [-1, 1]], ["tile_rx", "sp", [-1, 7]], ["auto_unroll_max_step", "ot", 0], ["unroll_explicit", "ot", 1]]}, "result": [[0.00017444708695652173, 0.00017445214260869567, 0.00017448932000000002], 0, 1.3703210353851318, 1679482782.5883098], "version": 0.2, "tvm_version": "0.10.0"}
{"input": ["cuda -keys=cuda,gpu -arch=sm_75 -max_num_threads=1024 -thread_warp_size=32", "conv2d_nchw.cuda", [["TENSOR", [1, 160, 17, 17], "float32"], ["TENSOR", [160, 160, 1, 7], "float32"], [1, 1], [0, 3, 0, 3], [1, 1], "float32"], {}], "config": {"index": 56903, "code_hash": null, "entity": [["tile_f", "sp", [-1, 20, 1, 1]], ["tile_y", "sp", [-1, 1, 17, 1]], ["tile_x", "sp", [-1, 1, 1, 17]], ["tile_rc", "sp", [-1, 5]], ["tile_ry", "sp", [-1, 1]], ["tile_rx", "sp", [-1, 7]], ["auto_unroll_max_step", "ot", 0], ["unroll_explicit", "ot", 0]]}, "result": [[0.004924952523809524, 0.004925829904761905, 0.004935006619047619], 0, 2.100897789001465, 1679482783.468354], "version": 0.2, "tvm_version": "0.10.0"}
{"input": ["cuda -keys=cuda,gpu -arch=sm_75 -max_num_threads=1024 -thread_warp_size=32", "conv2d_nchw.cuda", [["TENSOR", [1, 160, 17, 17], "float32"], ["TENSOR", [160, 160, 1, 7], "float32"], [1, 1], [0, 3, 0, 3], [1, 1], "float32"], {}], "config": {"index": 56231, "code_hash": null, "entity": [["tile_f", "sp", [-1, 20, 1, 1]], ["tile_y", "sp", [-1, 1, 1, 17]], ["tile_x", "sp", [-1, 1, 17, 1]], ["tile_rc", "sp", [-1, 5]], ["tile_ry", "sp", [-1, 1]], ["tile_rx", "sp", [-1, 7]], ["auto_unroll_max_step", "ot", 0], ["unroll_explicit", "ot", 0]]}, "result": [[0.004896185714285715, 0.004906867952380952, 0.004915113142857143], 0, 2.077636241912842, 1679482784.3475158], "version": 0.2, "tvm_version": "0.10.0"}
{"input": ["cuda -keys=cuda,gpu -arch=sm_75 -max_num_threads=1024 -thread_warp_size=32", "conv2d_nchw.cuda", [["TENSOR", [1, 160, 17, 17], "float32"], ["TENSOR", [160, 160, 1, 7], "float32"], [1, 1], [0, 3, 0, 3], [1, 1], "float32"], {}], "config": {"index": 142023, "code_hash": null, "entity": [["tile_f", "sp", [-1, 20, 1, 1]], ["tile_y", "sp", [-1, 1, 17, 1]], ["tile_x", "sp", [-1, 1, 17, 1]], ["tile_rc", "sp", [-1, 5]], ["tile_ry", "sp", [-1, 1]], ["tile_rx", "sp", [-1, 7]], ["auto_unroll_max_step", "ot", 512], ["unroll_explicit", "ot", 0]]}, "result": [[0.00020309143927125508, 0.0002030927975708502, 0.00020309953238866396], 0, 5.71366024017334, 1679482785.167268], "version": 0.2, "tvm_version": "0.10.0"}
{"input": ["cuda -keys=cuda,gpu -arch=sm_75 -max_num_threads=1024 -thread_warp_size=32", "conv2d_nchw.cuda", [["TENSOR", [1, 160, 17, 17], "float32"], ["TENSOR", [160, 160, 1, 7], "float32"], [1, 1], [0, 3, 0, 3], [1, 1], "float32"], {}], "config": {"index": 48839, "code_hash": null, "entity": [["tile_f", "sp", [-1, 20, 1, 1]], ["tile_y", "sp", [-1, 1, 17, 1]], ["tile_x", "sp", [-1, 1, 17, 1]], ["tile_rc", "sp", [-1, 2]], ["tile_ry", "sp", [-1, 1]], ["tile_rx", "sp", [-1, 7]], ["auto_unroll_max_step", "ot", 0], ["unroll_explicit", "ot", 0]]}, "result": [[0.00018008551779359432, 0.00018010767259786476, 0.00018011166370106763], 0, 1.2482035160064697, 1679482786.009231], "version": 0.2, "tvm_version": "0.10.0"}
{"input": ["cuda -keys=cuda,gpu -arch=sm_75 -max_num_threads=1024 -thread_warp_size=32", "conv2d_nchw.cuda", [["TENSOR", [1, 160, 17, 17], "float32"], ["TENSOR", [160, 160, 1, 7], "float32"], [1, 1], [0, 3, 0, 3], [1, 1], "float32"], {}], "config": {"index": 54215, "code_hash": null, "entity": [["tile_f", "sp", [-1, 20, 1, 1]], ["tile_y", "sp", [-1, 1, 17, 1]], ["tile_x", "sp", [-1, 1, 1, 1]], ["tile_rc", "sp", [-1, 5]], ["tile_ry", "sp", [-1, 1]], ["tile_rx", "sp", [-1, 7]], ["auto_unroll_max_step", "ot", 0], ["unroll_explicit", "ot", 0]]}, "result": [[0.0004491134622222222, 0.0004491855511111111, 0.0004492454355555555], 0, 1.4405288696289062, 1679482786.8518233], "version": 0.2, "tvm_version": "0.10.0"}
{"input": ["cuda -keys=cuda,gpu -arch=sm_75 -max_num_threads=1024 -thread_warp_size=32", "conv2d_nchw.cuda", [["TENSOR", [1, 160, 17, 17], "float32"], ["TENSOR", [160, 160, 1, 7], "float32"], [1, 1], [0, 3, 0, 3], [1, 1], "float32"], {}], "config": {"index": 55559, "code_hash": null, "entity": [["tile_f", "sp", [-1, 20, 1, 1]], ["tile_y", "sp", [-1, 1, 1, 1]], ["tile_x", "sp", [-1, 1, 17, 1]], ["tile_rc", "sp", [-1, 5]], ["tile_ry", "sp", [-1, 1]], ["tile_rx", "sp", [-1, 7]], ["auto_unroll_max_step", "ot", 0], ["unroll_explicit", "ot", 0]]}, "result": [[0.00035292162587412593, 0.0003529362692307692, 0.0003529935699300699], 0, 1.4253461360931396, 1679482787.6971283], "version": 0.2, "tvm_version": "0.10.0"}
{"input": ["cuda -keys=cuda,gpu -arch=sm_75 -max_num_threads=1024 -thread_warp_size=32", "conv2d_nchw.cuda", [["TENSOR", [1, 160, 17, 17], "float32"], ["TENSOR", [160, 160, 1, 7], "float32"], [1, 1], [0, 3, 0, 3], [1, 1], "float32"], {}], "config": {"index": 52423, "code_hash": null, "entity": [["tile_f", "sp", [-1, 20, 1, 1]], ["tile_y", "sp", [-1, 1, 17, 1]], ["tile_x", "sp", [-1, 1, 17, 1]], ["tile_rc", "sp", [-1, 4]], ["tile_ry", "sp", [-1, 1]], ["tile_rx", "sp", [-1, 7]], ["auto_unroll_max_step", "ot", 0], ["unroll_explicit", "ot", 0]]}, "result": [[0.0001796235563506261, 0.00017966712164579606, 0.00017969276744186045], 0, 1.2971243858337402, 1679482788.5358982], "version": 0.2, "tvm_version": "0.10.0"}
{"input": ["cuda -keys=cuda,gpu -arch=sm_75 -max_num_threads=1024 -thread_warp_size=32", "conv2d_nchw.cuda", [["TENSOR", [1, 160, 17, 17], "float32"], ["TENSOR", [160, 160, 1, 7], "float32"], [1, 1], [0, 3, 0, 3], [1, 1], "float32"], {}], "config": {"index": 55111, "code_hash": null, "entity": [["tile_f", "sp", [-1, 20, 1, 1]], ["tile_y", "sp", [-1, 1, 17, 1]], ["tile_x", "sp", [-1, 17, 1, 1]], ["tile_rc", "sp", [-1, 5]], ["tile_ry", "sp", [-1, 1]], ["tile_rx", "sp", [-1, 7]], ["auto_unroll_max_step", "ot", 0], ["unroll_explicit", "ot", 0]]}, "result": [[0.004924499857142857, 0.004926518714285714, 0.0049289430476190475], 0, 1.6627233028411865, 1679482790.3142755], "version": 0.2, "tvm_version": "0.10.0"}
{"input": ["cuda -keys=cuda,gpu -arch=sm_75 -max_num_threads=1024 -thread_warp_size=32", "conv2d_nchw.cuda", [["TENSOR", [1, 160, 17, 17], "float32"], ["TENSOR", [160, 160, 1, 7], "float32"], [1, 1], [0, 3, 0, 3], [1, 1], "float32"], {}], "config": {"index": 55783, "code_hash": null, "entity": [["tile_f", "sp", [-1, 20, 1, 1]], ["tile_y", "sp", [-1, 17, 1, 1]], ["tile_x", "sp", [-1, 1, 17, 1]], ["tile_rc", "sp", [-1, 5]], ["tile_ry", "sp", [-1, 1]], ["tile_rx", "sp", [-1, 7]], ["auto_unroll_max_step", "ot", 0], ["unroll_explicit", "ot", 0]]}, "result": [[0.0049051550000000005, 0.004914296428571429, 0.004920583428571428], 0, 1.6623640060424805, 1679482791.1853595], "version": 0.2, "tvm_version": "0.10.0"}
