src/tvm/results/cuda_gtx1650/inception_v3/droplet/cpu.log_layer_25.log
{"input": ["cuda -keys=cuda,gpu -arch=sm_75 -max_num_threads=1024 -thread_warp_size=32", "conv2d_nchw.cuda", [["TENSOR", [1, 128, 17, 17], "float32"], ["TENSOR", [128, 128, 1, 7], "float32"], [1, 1], [0, 3, 0, 3], [1, 1], "float32"], {}], "config": {"index": 0, "code_hash": null, "entity": [["tile_f", "sp", [-1, 1, 1, 1]], ["tile_y", "sp", [-1, 1, 1, 1]], ["tile_x", "sp", [-1, 1, 1, 1]], ["tile_rc", "sp", [-1, 1]], ["tile_ry", "sp", [-1, 1]], ["tile_rx", "sp", [-1, 1]], ["auto_unroll_max_step", "ot", 0], ["unroll_explicit", "ot", 0]]}, "result": [[0.005912692764705883, 0.0059441393529411765, 0.0071104641764705885], 0, 1.2172248363494873, 1678636085.0011728], "version": 0.2, "tvm_version": "0.10.0"}
{"input": ["cuda -keys=cuda,gpu -arch=sm_75 -max_num_threads=1024 -thread_warp_size=32", "conv2d_nchw.cuda", [["TENSOR", [1, 128, 17, 17], "float32"], ["TENSOR", [128, 128, 1, 7], "float32"], [1, 1], [0, 3, 0, 3], [1, 1], "float32"], {}], "config": {"index": 92160, "code_hash": null, "entity": [["tile_f", "sp", [-1, 1, 1, 1]], ["tile_y", "sp", [-1, 1, 1, 1]], ["tile_x", "sp", [-1, 1, 1, 1]], ["tile_rc", "sp", [-1, 1]], ["tile_ry", "sp", [-1, 1]], ["tile_rx", "sp", [-1, 1]], ["auto_unroll_max_step", "ot", 0], ["unroll_explicit", "ot", 1]]}, "result": [[0.0059123427058823536, 0.005913803058823529, 0.005924261647058823], 0, 1.2236831188201904, 1678636086.3782456], "version": 0.2, "tvm_version": "0.10.0"}
{"input": ["cuda -keys=cuda,gpu -arch=sm_75 -max_num_threads=1024 -thread_warp_size=32", "conv2d_nchw.cuda", [["TENSOR", [1, 128, 17, 17], "float32"], ["TENSOR", [128, 128, 1, 7], "float32"], [1, 1], [0, 3, 0, 3], [1, 1], "float32"], {}], "config": {"index": 30720, "code_hash": null, "entity": [["tile_f", "sp", [-1, 1, 1, 1]], ["tile_y", "sp", [-1, 1, 1, 1]], ["tile_x", "sp", [-1, 1, 1, 1]], ["tile_rc", "sp", [-1, 1]], ["tile_ry", "sp", [-1, 1]], ["tile_rx", "sp", [-1, 1]], ["auto_unroll_max_step", "ot", 512], ["unroll_explicit", "ot", 0]]}, "result": [[0.00591188494117647, 0.005913788235294118, 0.00591478005882353], 0, 1.2454571723937988, 1678636087.2535615], "version": 0.2, "tvm_version": "0.10.0"}
{"input": ["cuda -keys=cuda,gpu -arch=sm_75 -max_num_threads=1024 -thread_warp_size=32", "conv2d_nchw.cuda", [["TENSOR", [1, 128, 17, 17], "float32"], ["TENSOR", [128, 128, 1, 7], "float32"], [1, 1], [0, 3, 0, 3], [1, 1], "float32"], {}], "config": {"index": 15360, "code_hash": null, "entity": [["tile_f", "sp", [-1, 1, 1, 1]], ["tile_y", "sp", [-1, 1, 1, 1]], ["tile_x", "sp", [-1, 1, 1, 1]], ["tile_rc", "sp", [-1, 1]], ["tile_ry", "sp", [-1, 1]], ["tile_rx", "sp", [-1, 7]], ["auto_unroll_max_step", "ot", 0], ["unroll_explicit", "ot", 0]]}, "result": [[0.01327830025, 0.01329967975, 0.013302528374999999], 0, 1.3178281784057617, 1678636088.1808782], "version": 0.2, "tvm_version": "0.10.0"}
{"input": ["cuda -keys=cuda,gpu -arch=sm_75 -max_num_threads=1024 -thread_warp_size=32", "conv2d_nchw.cuda", [["TENSOR", [1, 128, 17, 17], "float32"], ["TENSOR", [128, 128, 1, 7], "float32"], [1, 1], [0, 3, 0, 3], [1, 1], "float32"], {}], "config": {"index": 1920, "code_hash": null, "entity": [["tile_f", "sp", [-1, 1, 1, 1]], ["tile_y", "sp", [-1, 1, 1, 1]], ["tile_x", "sp", [-1, 1, 1, 1]], ["tile_rc", "sp", [-1, 2]], ["tile_ry", "sp", [-1, 1]], ["tile_rx", "sp", [-1, 1]], ["auto_unroll_max_step", "ot", 0], ["unroll_explicit", "ot", 0]]}, "result": [[0.0204904448, 0.0204931578, 0.02049337], 0, 1.3163321018218994, 1678636089.076816], "version": 0.2, "tvm_version": "0.10.0"}
{"input": ["cuda -keys=cuda,gpu -arch=sm_75 -max_num_threads=1024 -thread_warp_size=32", "conv2d_nchw.cuda", [["TENSOR", [1, 128, 17, 17], "float32"], ["TENSOR", [128, 128, 1, 7], "float32"], [1, 1], [0, 3, 0, 3], [1, 1], "float32"], {}], "config": {"index": 480, "code_hash": null, "entity": [["tile_f", "sp", [-1, 1, 1, 1]], ["tile_y", "sp", [-1, 1, 1, 1]], ["tile_x", "sp", [-1, 17, 1, 1]], ["tile_rc", "sp", [-1, 1]], ["tile_ry", "sp", [-1, 1]], ["tile_rx", "sp", [-1, 1]], ["auto_unroll_max_step", "ot", 0], ["unroll_explicit", "ot", 0]]}, "result": [[0.00322675990625, 0.0032271358750000003, 0.0032283658750000004], 0, 1.284522294998169, 1678636089.9436011], "version": 0.2, "tvm_version": "0.10.0"}
{"input": ["cuda -keys=cuda,gpu -arch=sm_75 -max_num_threads=1024 -thread_warp_size=32", "conv2d_nchw.cuda", [["TENSOR", [1, 128, 17, 17], "float32"], ["TENSOR", [128, 128, 1, 7], "float32"], [1, 1], [0, 3, 0, 3], [1, 1], "float32"], {}], "config": {"index": 120, "code_hash": null, "entity": [["tile_f", "sp", [-1, 1, 1, 1]], ["tile_y", "sp", [-1, 17, 1, 1]], ["tile_x", "sp", [-1, 1, 1, 1]], ["tile_rc", "sp", [-1, 1]], ["tile_ry", "sp", [-1, 1]], ["tile_rx", "sp", [-1, 1]], ["auto_unroll_max_step", "ot", 0], ["unroll_explicit", "ot", 0]]}, "result": [[0.006028553176470588, 0.006029434176470588, 0.006031060588235294], 0, 1.2679691314697266, 1678636090.7960298], "version": 0.2, "tvm_version": "0.10.0"}
{"input": ["cuda -keys=cuda,gpu -arch=sm_75 -max_num_threads=1024 -thread_warp_size=32", "conv2d_nchw.cuda", [["TENSOR", [1, 128, 17, 17], "float32"], ["TENSOR", [128, 128, 1, 7], "float32"], [1, 1], [0, 3, 0, 3], [1, 1], "float32"], {}], "config": {"index": 1, "code_hash": null, "entity": [["tile_f", "sp", [-1, 2, 1, 1]], ["tile_y", "sp", [-1, 1, 1, 1]], ["tile_x", "sp", [-1, 1, 1, 1]], ["tile_rc", "sp", [-1, 1]], ["tile_ry", "sp", [-1, 1]], ["tile_rx", "sp", [-1, 1]], ["auto_unroll_max_step", "ot", 0], ["unroll_explicit", "ot", 0]]}, "result": [[0.016476868714285716, 0.016477079, 0.01648001857142857], 0, 1.3223085403442383, 1678636091.7373724], "version": 0.2, "tvm_version": "0.10.0"}
{"input": ["cuda -keys=cuda,gpu -arch=sm_75 -max_num_threads=1024 -thread_warp_size=32", "conv2d_nchw.cuda", [["TENSOR", [1, 128, 17, 17], "float32"], ["TENSOR", [128, 128, 1, 7], "float32"], [1, 1], [0, 3, 0, 3], [1, 1], "float32"], {}], "config": {"index": 92640, "code_hash": null, "entity": [["tile_f", "sp", [-1, 1, 1, 1]], ["tile_y", "sp", [-1, 1, 1, 1]], ["tile_x", "sp", [-1, 17, 1, 1]], ["tile_rc", "sp", [-1, 1]], ["tile_ry", "sp", [-1, 1]], ["tile_rx", "sp", [-1, 1]], ["auto_unroll_max_step", "ot", 0], ["unroll_explicit", "ot", 1]]}, "result": [[0.0032272300624999997, 0.0032281646666666667, 0.0032288665624999996], 0, 1.571096420288086, 1678636093.739689], "version": 0.2, "tvm_version": "0.10.0"}
{"input": ["cuda -keys=cuda,gpu -arch=sm_75 -max_num_threads=1024 -thread_warp_size=32", "conv2d_nchw.cuda", [["TENSOR", [1, 128, 17, 17], "float32"], ["TENSOR", [128, 128, 1, 7], "float32"], [1, 1], [0, 3, 0, 3], [1, 1], "float32"], {}], "config": {"index": 31200, "code_hash": null, "entity": [["tile_f", "sp", [-1, 1, 1, 1]], ["tile_y", "sp", [-1, 1, 1, 1]], ["tile_x", "sp", [-1, 17, 1, 1]], ["tile_rc", "sp", [-1, 1]], ["tile_ry", "sp", [-1, 1]], ["tile_rx", "sp", [-1, 1]], ["auto_unroll_max_step", "ot", 512], ["unroll_explicit", "ot", 0]]}, "result": [[0.0031949167083333333, 0.003195108083333333, 0.0031972265208333336], 0, 1.6786069869995117, 1678636094.9456358], "version": 0.2, "tvm_version": "0.10.0"}
{"input": ["cuda -keys=cuda,gpu -arch=sm_75 -max_num_threads=1024 -thread_warp_size=32", "conv2d_nchw.cuda", [["TENSOR", [1, 128, 17, 17], "float32"], ["TENSOR", [128, 128, 1, 7], "float32"], [1, 1], [0, 3, 0, 3], [1, 1], "float32"], {}], "config": {"index": 15840, "code_hash": null, "entity": [["tile_f", "sp", [-1, 1, 1, 1]], ["tile_y", "sp", [-1, 1, 1, 1]], ["tile_x", "sp", [-1, 17, 1, 1]], ["tile_rc", "sp", [-1, 1]], ["tile_ry", "sp", [-1, 1]], ["tile_rx", "sp", [-1, 7]], ["auto_unroll_max_step", "ot", 0], ["unroll_explicit", "ot", 0]]}, "result": [[0.0011704782045454545, 0.0011705392386363637, 0.0011706646931818182], 0, 1.2671818733215332, 1678636095.819698], "version": 0.2, "tvm_version": "0.10.0"}
{"input": ["cuda -keys=cuda,gpu -arch=sm_75 -max_num_threads=1024 -thread_warp_size=32", "conv2d_nchw.cuda", [["TENSOR", [1, 128, 17, 17], "float32"], ["TENSOR", [128, 128, 1, 7], "float32"], [1, 1], [0, 3, 0, 3], [1, 1], "float32"], {}], "config": {"index": 2400, "code_hash": null, "entity": [["tile_f", "sp", [-1, 1, 1, 1]], ["tile_y", "sp", [-1, 1, 1, 1]], ["tile_x", "sp", [-1, 17, 1, 1]], ["tile_rc", "sp", [-1, 2]], ["tile_ry", "sp", [-1, 1]], ["tile_rx", "sp", [-1, 1]], ["auto_unroll_max_step", "ot", 0], ["unroll_explicit", "ot", 0]]}, "result": [[0.003716513148148148, 0.003716663777777778, 0.0037166648888888893], 0, 1.3784420490264893, 1678636096.7006269], "version": 0.2, "tvm_version": "0.10.0"}
{"input": ["cuda -keys=cuda,gpu -arch=sm_75 -max_num_threads=1024 -thread_warp_size=32", "conv2d_nchw.cuda", [["TENSOR", [1, 128, 17, 17], "float32"], ["TENSOR", [128, 128, 1, 7], "float32"], [1, 1], [0, 3, 0, 3], [1, 1], "float32"], {}], "config": {"index": 960, "code_hash": null, "entity": [["tile_f", "sp", [-1, 1, 1, 1]], ["tile_y", "sp", [-1, 1, 1, 1]], ["tile_x", "sp", [-1, 1, 17, 1]], ["tile_rc", "sp", [-1, 1]], ["tile_ry", "sp", [-1, 1]], ["tile_rx", "sp", [-1, 1]], ["auto_unroll_max_step", "ot", 0], ["unroll_explicit", "ot", 0]]}, "result": [[0.0019467393396226413, 0.0019474934905660379, 0.001948148471698113], 0, 1.2728650569915771, 1678636097.5567548], "version": 0.2, "tvm_version": "0.10.0"}
{"input": ["cuda -keys=cuda,gpu -arch=sm_75 -max_num_threads=1024 -thread_warp_size=32", "conv2d_nchw.cuda", [["TENSOR", [1, 128, 17, 17], "float32"], ["TENSOR", [128, 128, 1, 7], "float32"], [1, 1], [0, 3, 0, 3], [1, 1], "float32"], {}], "config": {"index": 600, "code_hash": null, "entity": [["tile_f", "sp", [-1, 1, 1, 1]], ["tile_y", "sp", [-1, 17, 1, 1]], ["tile_x", "sp", [-1, 17, 1, 1]], ["tile_rc", "sp", [-1, 1]], ["tile_ry", "sp", [-1, 1]], ["tile_rx", "sp", [-1, 1]], ["auto_unroll_max_step", "ot", 0], ["unroll_explicit", "ot", 0]]}, "result": [[0.0202346496, 0.0202635008, 0.0203109816], 0, 1.6694114208221436, 1678636098.4985294], "version": 0.2, "tvm_version": "0.10.0"}
{"input": ["cuda -keys=cuda,gpu -arch=sm_75 -max_num_threads=1024 -thread_warp_size=32", "conv2d_nchw.cuda", [["TENSOR", [1, 128, 17, 17], "float32"], ["TENSOR", [128, 128, 1, 7], "float32"], [1, 1], [0, 3, 0, 3], [1, 1], "float32"], {}], "config": {"index": 481, "code_hash": null, "entity": [["tile_f", "sp", [-1, 2, 1, 1]], ["tile_y", "sp", [-1, 1, 1, 1]], ["tile_x", "sp", [-1, 17, 1, 1]], ["tile_rc", "sp", [-1, 1]], ["tile_ry", "sp", [-1, 1]], ["tile_rx", "sp", [-1, 1]], ["auto_unroll_max_step", "ot", 0], ["unroll_explicit", "ot", 0]]}, "result": [[0.001808994754385965, 0.0018091019649122807, 0.0018091026315789473], 0, 1.2766516208648682, 1678636099.3694646], "version": 0.2, "tvm_version": "0.10.0"}
{"input": ["cuda -keys=cuda,gpu -arch=sm_75 -max_num_threads=1024 -thread_warp_size=32", "conv2d_nchw.cuda", [["TENSOR", [1, 128, 17, 17], "float32"], ["TENSOR", [128, 128, 1, 7], "float32"], [1, 1], [0, 3, 0, 3], [1, 1], "float32"], {}], "config": {"index": 108000, "code_hash": null, "entity": [["tile_f", "sp", [-1, 1, 1, 1]], ["tile_y", "sp", [-1, 1, 1, 1]], ["tile_x", "sp", [-1, 17, 1, 1]], ["tile_rc", "sp", [-1, 1]], ["tile_ry", "sp", [-1, 1]], ["tile_rx", "sp", [-1, 7]], ["auto_unroll_max_step", "ot", 0], ["unroll_explicit", "ot", 1]]}, "result": [[0.0011710305568181818, 0.0011710720000000002, 0.0011743672954545455], 0, 1.2455801963806152, 1678636101.1382372], "version": 0.2, "tvm_version": "0.10.0"}
{"input": ["cuda -keys=cuda,gpu -arch=sm_75 -max_num_threads=1024 -thread_warp_size=32", "conv2d_nchw.cuda", [["TENSOR", [1, 128, 17, 17], "float32"], ["TENSOR", [128, 128, 1, 7], "float32"], [1, 1], [0, 3, 0, 3], [1, 1], "float32"], {}], "config": {"index": 46560, "code_hash": null, "entity": [["tile_f", "sp", [-1, 1, 1, 1]], ["tile_y", "sp", [-1, 1, 1, 1]], ["tile_x", "sp", [-1, 17, 1, 1]], ["tile_rc", "sp", [-1, 1]], ["tile_ry", "sp", [-1, 1]], ["tile_rx", "sp", [-1, 7]], ["auto_unroll_max_step", "ot", 512], ["unroll_explicit", "ot", 0]]}, "result": [[0.0011524436888888888, 0.0011525141333333332, 0.0011530186888888889], 0, 1.281412124633789, 1678636102.0264442], "version": 0.2, "tvm_version": "0.10.0"}
{"input": ["cuda -keys=cuda,gpu -arch=sm_75 -max_num_threads=1024 -thread_warp_size=32", "conv2d_nchw.cuda", [["TENSOR", [1, 128, 17, 17], "float32"], ["TENSOR", [128, 128, 1, 7], "float32"], [1, 1], [0, 3, 0, 3], [1, 1], "float32"], {}], "config": {"index": 17760, "code_hash": null, "entity": [["tile_f", "sp", [-1, 1, 1, 1]], ["tile_y", "sp", [-1, 1, 1, 1]], ["tile_x", "sp", [-1, 17, 1, 1]], ["tile_rc", "sp", [-1, 2]], ["tile_ry", "sp", [-1, 1]], ["tile_rx", "sp", [-1, 7]], ["auto_unroll_max_step", "ot", 0], ["unroll_explicit", "ot", 0]]}, "result": [[0.0012027113565891473, 0.0012029379844961242, 0.0012043668759689921], 0, 1.5798308849334717, 1678636103.2021172], "version": 0.2, "tvm_version": "0.10.0"}
{"input": ["cuda -keys=cuda,gpu -arch=sm_75 -max_num_threads=1024 -thread_warp_size=32", "conv2d_nchw.cuda", [["TENSOR", [1, 128, 17, 17], "float32"], ["TENSOR", [128, 128, 1, 7], "float32"], [1, 1], [0, 3, 0, 3], [1, 1], "float32"], {}], "config": {"index": 16320, "code_hash": null, "entity": [["tile_f", "sp", [-1, 1, 1, 1]], ["tile_y", "sp", [-1, 1, 1, 1]], ["tile_x", "sp", [-1, 1, 17, 1]], ["tile_rc", "sp", [-1, 1]], ["tile_ry", "sp", [-1, 1]], ["tile_rx", "sp", [-1, 7]], ["auto_unroll_max_step", "ot", 0], ["unroll_explicit", "ot", 0]]}, "result": [[0.0006321843719512194, 0.0006323090487804878, 0.0006326072012195122], 0, 1.2136216163635254, 1678636104.0412066], "version": 0.2, "tvm_version": "0.10.0"}
{"input": ["cuda -keys=cuda,gpu -arch=sm_75 -max_num_threads=1024 -thread_warp_size=32", "conv2d_nchw.cuda", [["TENSOR", [1, 128, 17, 17], "float32"], ["TENSOR", [128, 128, 1, 7], "float32"], [1, 1], [0, 3, 0, 3], [1, 1], "float32"], {}], "config": {"index": 15960, "code_hash": null, "entity": [["tile_f", "sp", [-1, 1, 1, 1]], ["tile_y", "sp", [-1, 17, 1, 1]], ["tile_x", "sp", [-1, 17, 1, 1]], ["tile_rc", "sp", [-1, 1]], ["tile_ry", "sp", [-1, 1]], ["tile_rx", "sp", [-1, 7]], ["auto_unroll_max_step", "ot", 0], ["unroll_explicit", "ot", 0]]}, "result": [[0.0693950575, 0.06955515250000001, 0.0695808485], 0, 1.8965840339660645, 1678636105.1144335], "version": 0.2, "tvm_version": "0.10.0"}
{"input": ["cuda -keys=cuda,gpu -arch=sm_75 -max_num_threads=1024 -thread_warp_size=32", "conv2d_nchw.cuda", [["TENSOR", [1, 128, 17, 17], "float32"], ["TENSOR", [128, 128, 1, 7], "float32"], [1, 1], [0, 3, 0, 3], [1, 1], "float32"], {}], "config": {"index": 15841, "code_hash": null, "entity": [["tile_f", "sp", [-1, 2, 1, 1]], ["tile_y", "sp", [-1, 1, 1, 1]], ["tile_x", "sp", [-1, 17, 1, 1]], ["tile_rc", "sp", [-1, 1]], ["tile_ry", "sp", [-1, 1]], ["tile_rx", "sp", [-1, 7]], ["auto_unroll_max_step", "ot", 0], ["unroll_explicit", "ot", 0]]}, "result": [[0.0007890944230769231, 0.0007910569923076922, 0.0007916659384615384], 0, 1.2380430698394775, 1678636105.9701686], "version": 0.2, "tvm_version": "0.10.0"}
{"input": ["cuda -keys=cuda,gpu -arch=sm_75 -max_num_threads=1024 -thread_warp_size=32", "conv2d_nchw.cuda", [["TENSOR", [1, 128, 17, 17], "float32"], ["TENSOR", [128, 128, 1, 7], "float32"], [1, 1], [0, 3, 0, 3], [1, 1], "float32"], {}], "config": {"index": 108480, "code_hash": null, "entity": [["tile_f", "sp", [-1, 1, 1, 1]], ["tile_y", "sp", [-1, 1, 1, 1]], ["tile_x", "sp", [-1, 1, 17, 1]], ["tile_rc", "sp", [-1, 1]], ["tile_ry", "sp", [-1, 1]], ["tile_rx", "sp", [-1, 7]], ["auto_unroll_max_step", "ot", 0], ["unroll_explicit", "ot", 1]]}, "result": [[0.0006317648963414633, 0.000631890737804878, 0.0006319079024390244], 0, 1.176929235458374, 1678636107.285205], "version": 0.2, "tvm_version": "0.10.0"}
{"input": ["cuda -keys=cuda,gpu -arch=sm_75 -max_num_threads=1024 -thread_warp_size=32", "conv2d_nchw.cuda", [["TENSOR", [1, 128, 17, 17], "float32"], ["TENSOR", [128, 128, 1, 7], "float32"], [1, 1], [0, 3, 0, 3], [1, 1], "float32"], {}], "config": {"index": 47040, "code_hash": null, "entity": [["tile_f", "sp", [-1, 1, 1, 1]], ["tile_y", "sp", [-1, 1, 1, 1]], ["tile_x", "sp", [-1, 1, 17, 1]], ["tile_rc", "sp", [-1, 1]], ["tile_ry", "sp", [-1, 1]], ["tile_rx", "sp", [-1, 7]], ["auto_unroll_max_step", "ot", 512], ["unroll_explicit", "ot", 0]]}, "result": [[0.0006330303757575757, 0.0006334925757575758, 0.0006338216606060605], 0, 1.1771409511566162, 1678636108.114401], "version": 0.2, "tvm_version": "0.10.0"}
{"input": ["cuda -keys=cuda,gpu -arch=sm_75 -max_num_threads=1024 -thread_warp_size=32", "conv2d_nchw.cuda", [["TENSOR", [1, 128, 17, 17], "float32"], ["TENSOR", [128, 128, 1, 7], "float32"], [1, 1], [0, 3, 0, 3], [1, 1], "float32"], {}], "config": {"index": 18240, "code_hash": null, "entity": [["tile_f", "sp", [-1, 1, 1, 1]], ["tile_y", "sp", [-1, 1, 1, 1]], ["tile_x", "sp", [-1, 1, 17, 1]], ["tile_rc", "sp", [-1, 2]], ["tile_ry", "sp", [-1, 1]], ["tile_rx", "sp", [-1, 7]], ["auto_unroll_max_step", "ot", 0], ["unroll_explicit", "ot", 0]]}, "result": [[0.00045501799559471366, 0.000455114422907489, 0.0004563884977973568], 0, 1.2125258445739746, 1678636108.9783618], "version": 0.2, "tvm_version": "0.10.0"}
{"input": ["cuda -keys=cuda,gpu -arch=sm_75 -max_num_threads=1024 -thread_warp_size=32", "conv2d_nchw.cuda", [["TENSOR", [1, 128, 17, 17], "float32"], ["TENSOR", [128, 128, 1, 7], "float32"], [1, 1], [0, 3, 0, 3], [1, 1], "float32"], {}], "config": {"index": 16800, "code_hash": null, "entity": [["tile_f", "sp", [-1, 1, 1, 1]], ["tile_y", "sp", [-1, 1, 1, 1]], ["tile_x", "sp", [-1, 1, 1, 17]], ["tile_rc", "sp", [-1, 1]], ["tile_ry", "sp", [-1, 1]], ["tile_rx", "sp", [-1, 7]], ["auto_unroll_max_step", "ot", 0], ["unroll_explicit", "ot", 0]]}, "result": [[0.0011715491022727274, 0.0011715494431818183, 0.0011767541704545454], 0, 1.2189404964447021, 1678636109.8210926], "version": 0.2, "tvm_version": "0.10.0"}
{"input": ["cuda -keys=cuda,gpu -arch=sm_75 -max_num_threads=1024 -thread_warp_size=32", "conv2d_nchw.cuda", [["TENSOR", [1, 128, 17, 17], "float32"], ["TENSOR", [128, 128, 1, 7], "float32"], [1, 1], [0, 3, 0, 3], [1, 1], "float32"], {}], "config": {"index": 16440, "code_hash": null, "entity": [["tile_f", "sp", [-1, 1, 1, 1]], ["tile_y", "sp", [-1, 17, 1, 1]], ["tile_x", "sp", [-1, 1, 17, 1]], ["tile_rc", "sp", [-1, 1]], ["tile_ry", "sp", [-1, 1]], ["tile_rx", "sp", [-1, 7]], ["auto_unroll_max_step", "ot", 0], ["unroll_explicit", "ot", 0]]}, "result": [[0.0003188943899371069, 0.00031914968867924527, 0.00031924709433962264], 0, 1.205524206161499, 1678636110.6626306], "version": 0.2, "tvm_version": "0.10.0"}
{"input": ["cuda -keys=cuda,gpu -arch=sm_75 -max_num_threads=1024 -thread_warp_size=32", "conv2d_nchw.cuda", [["TENSOR", [1, 128, 17, 17], "float32"], ["TENSOR", [128, 128, 1, 7], "float32"], [1, 1], [0, 3, 0, 3], [1, 1], "float32"], {}], "config": {"index": 16321, "code_hash": null, "entity": [["tile_f", "sp", [-1, 2, 1, 1]], ["tile_y", "sp", [-1, 1, 1, 1]], ["tile_x", "sp", [-1, 1, 17, 1]], ["tile_rc", "sp", [-1, 1]], ["tile_ry", "sp", [-1, 1]], ["tile_rx", "sp", [-1, 7]], ["auto_unroll_max_step", "ot", 0], ["unroll_explicit", "ot", 0]]}, "result": [[0.00035504641176470586, 0.0003550632560553633, 0.00035515449134948095], 0, 1.2173116207122803, 1678636111.5236495], "version": 0.2, "tvm_version": "0.10.0"}
{"input": ["cuda -keys=cuda,gpu -arch=sm_75 -max_num_threads=1024 -thread_warp_size=32", "conv2d_nchw.cuda", [["TENSOR", [1, 128, 17, 17], "float32"], ["TENSOR", [128, 128, 1, 7], "float32"], [1, 1], [0, 3, 0, 3], [1, 1], "float32"], {}], "config": {"index": 108600, "code_hash": null, "entity": [["tile_f", "sp", [-1, 1, 1, 1]], ["tile_y", "sp", [-1, 17, 1, 1]], ["tile_x", "sp", [-1, 1, 17, 1]], ["tile_rc", "sp", [-1, 1]], ["tile_ry", "sp", [-1, 1]], ["tile_rx", "sp", [-1, 7]], ["auto_unroll_max_step", "ot", 0], ["unroll_explicit", "ot", 1]]}, "result": [[0.0003188568037974684, 0.00031889297151898736, 0.00031889386708860756], 0, 1.2453529834747314, 1678636113.3159368], "version": 0.2, "tvm_version": "0.10.0"}
{"input": ["cuda -keys=cuda,gpu -arch=sm_75 -max_num_threads=1024 -thread_warp_size=32", "conv2d_nchw.cuda", [["TENSOR", [1, 128, 17, 17], "float32"], ["TENSOR", [128, 128, 1, 7], "float32"], [1, 1], [0, 3, 0, 3], [1, 1], "float32"], {}], "config": {"index": 47160, "code_hash": null, "entity": [["tile_f", "sp", [-1, 1, 1, 1]], ["tile_y", "sp", [-1, 17, 1, 1]], ["tile_x", "sp", [-1, 1, 17, 1]], ["tile_rc", "sp", [-1, 1]], ["tile_ry", "sp", [-1, 1]], ["tile_rx", "sp", [-1, 7]], ["auto_unroll_max_step", "ot", 512], ["unroll_explicit", "ot", 0]]}, "result": [[0.00031619742901234566, 0.00031629541049382716, 0.0003164602438271605], 0, 1.3247952461242676, 1678636114.165368], "version": 0.2, "tvm_version": "0.10.0"}
{"input": ["cuda -keys=cuda,gpu -arch=sm_75 -max_num_threads=1024 -thread_warp_size=32", "conv2d_nchw.cuda", [["TENSOR", [1, 128, 17, 17], "float32"], ["TENSOR", [128, 128, 1, 7], "float32"], [1, 1], [0, 3, 0, 3], [1, 1], "float32"], {}], "config": {"index": 1080, "code_hash": null, "entity": [["tile_f", "sp", [-1, 1, 1, 1]], ["tile_y", "sp", [-1, 17, 1, 1]], ["tile_x", "sp", [-1, 1, 17, 1]], ["tile_rc", "sp", [-1, 1]], ["tile_ry", "sp", [-1, 1]], ["tile_rx", "sp", [-1, 1]], ["auto_unroll_max_step", "ot", 0], ["unroll_explicit", "ot", 0]]}, "result": [[0.000538126652631579, 0.0005384484894736842, 0.0005385701210526316], 0, 1.2664530277252197, 1678636115.0062664], "version": 0.2, "tvm_version": "0.10.0"}
{"input": ["cuda -keys=cuda,gpu -arch=sm_75 -max_num_threads=1024 -thread_warp_size=32", "conv2d_nchw.cuda", [["TENSOR", [1, 128, 17, 17], "float32"], ["TENSOR", [128, 128, 1, 7], "float32"], [1, 1], [0, 3, 0, 3], [1, 1], "float32"], {}], "config": {"index": 18360, "code_hash": null, "entity": [["tile_f", "sp", [-1, 1, 1, 1]], ["tile_y", "sp", [-1, 17, 1, 1]], ["tile_x", "sp", [-1, 1, 17, 1]], ["tile_rc", "sp", [-1, 2]], ["tile_ry", "sp", [-1, 1]], ["tile_rx", "sp", [-1, 7]], ["auto_unroll_max_step", "ot", 0], ["unroll_explicit", "ot", 0]]}, "result": [[0.0003876115107526882, 0.0003876665994623656, 0.0003878137715053764], 0, 1.5962469577789307, 1678636116.17334], "version": 0.2, "tvm_version": "0.10.0"}
{"input": ["cuda -keys=cuda,gpu -arch=sm_75 -max_num_threads=1024 -thread_warp_size=32", "conv2d_nchw.cuda", [["TENSOR", [1, 128, 17, 17], "float32"], ["TENSOR", [128, 128, 1, 7], "float32"], [1, 1], [0, 3, 0, 3], [1, 1], "float32"], {}], "config": {"index": 16920, "code_hash": null, "entity": [["tile_f", "sp", [-1, 1, 1, 1]], ["tile_y", "sp", [-1, 17, 1, 1]], ["tile_x", "sp", [-1, 1, 1, 17]], ["tile_rc", "sp", [-1, 1]], ["tile_ry", "sp", [-1, 1]], ["tile_rx", "sp", [-1, 7]], ["auto_unroll_max_step", "ot", 0], ["unroll_explicit", "ot", 0]]}, "result": [[0.069521507, 0.0696033245, 0.069824638], 0, 1.9863314628601074, 1678636117.3034596], "version": 0.2, "tvm_version": "0.10.0"}
{"input": ["cuda -keys=cuda,gpu -arch=sm_75 -max_num_threads=1024 -thread_warp_size=32", "conv2d_nchw.cuda", [["TENSOR", [1, 128, 17, 17], "float32"], ["TENSOR", [128, 128, 1, 7], "float32"], [1, 1], [0, 3, 0, 3], [1, 1], "float32"], {}], "config": {"index": 16560, "code_hash": null, "entity": [["tile_f", "sp", [-1, 1, 1, 1]], ["tile_y", "sp", [-1, 1, 17, 1]], ["tile_x", "sp", [-1, 1, 17, 1]], ["tile_rc", "sp", [-1, 1]], ["tile_ry", "sp", [-1, 1]], ["tile_rx", "sp", [-1, 7]], ["auto_unroll_max_step", "ot", 0], ["unroll_explicit", "ot", 0]]}, "result": [[0.00039608198076923075, 0.00039608318461538465, 0.00039773022307692304], 0, 1.2781610488891602, 1678636118.1678345], "version": 0.2, "tvm_version": "0.10.0"}
{"input": ["cuda -keys=cuda,gpu -arch=sm_75 -max_num_threads=1024 -thread_warp_size=32", "conv2d_nchw.cuda", [["TENSOR", [1, 128, 17, 17], "float32"], ["TENSOR", [128, 128, 1, 7], "float32"], [1, 1], [0, 3, 0, 3], [1, 1], "float32"], {}], "config": {"index": 16441, "code_hash": null, "entity": [["tile_f", "sp", [-1, 2, 1, 1]], ["tile_y", "sp", [-1, 17, 1, 1]], ["tile_x", "sp", [-1, 1, 17, 1]], ["tile_rc", "sp", [-1, 1]], ["tile_ry", "sp", [-1, 1]], ["tile_rx", "sp", [-1, 7]], ["auto_unroll_max_step", "ot", 0], ["unroll_explicit", "ot", 0]]}, "result": [[0.00018809675779816513, 0.0001881186660550459, 0.000188137928440367], 0, 1.2699580192565918, 1678636119.0181327], "version": 0.2, "tvm_version": "0.10.0"}
{"input": ["cuda -keys=cuda,gpu -arch=sm_75 -max_num_threads=1024 -thread_warp_size=32", "conv2d_nchw.cuda", [["TENSOR", [1, 128, 17, 17], "float32"], ["TENSOR", [128, 128, 1, 7], "float32"], [1, 1], [0, 3, 0, 3], [1, 1], "float32"], {}], "config": {"index": 108601, "code_hash": null, "entity": [["tile_f", "sp", [-1, 2, 1, 1]], ["tile_y", "sp", [-1, 17, 1, 1]], ["tile_x", "sp", [-1, 1, 17, 1]], ["tile_rc", "sp", [-1, 1]], ["tile_ry", "sp", [-1, 1]], ["tile_rx", "sp", [-1, 7]], ["auto_unroll_max_step", "ot", 0], ["unroll_explicit", "ot", 1]]}, "result": [[0.00018813342173112338, 0.00018814714917127069, 0.00018814891896869244], 0, 1.249107837677002, 1678636120.8244336], "version": 0.2, "tvm_version": "0.10.0"}
{"input": ["cuda -keys=cuda,gpu -arch=sm_75 -max_num_threads=1024 -thread_warp_size=32", "conv2d_nchw.cuda", [["TENSOR", [1, 128, 17, 17], "float32"], ["TENSOR", [128, 128, 1, 7], "float32"], [1, 1], [0, 3, 0, 3], [1, 1], "float32"], {}], "config": {"index": 47161, "code_hash": null, "entity": [["tile_f", "sp", [-1, 2, 1, 1]], ["tile_y", "sp", [-1, 17, 1, 1]], ["tile_x", "sp", [-1, 1, 17, 1]], ["tile_rc", "sp", [-1, 1]], ["tile_ry", "sp", [-1, 1]], ["tile_rx", "sp", [-1, 7]], ["auto_unroll_max_step", "ot", 512], ["unroll_explicit", "ot", 0]]}, "result": [[0.00018877496678966789, 0.00018879221033210331, 0.00018918990959409593], 0, 1.4831557273864746, 1678636121.6938818], "version": 0.2, "tvm_version": "0.10.0"}
{"input": ["cuda -keys=cuda,gpu -arch=sm_75 -max_num_threads=1024 -thread_warp_size=32", "conv2d_nchw.cuda", [["TENSOR", [1, 128, 17, 17], "float32"], ["TENSOR", [128, 128, 1, 7], "float32"], [1, 1], [0, 3, 0, 3], [1, 1], "float32"], {}], "config": {"index": 1081, "code_hash": null, "entity": [["tile_f", "sp", [-1, 2, 1, 1]], ["tile_y", "sp", [-1, 17, 1, 1]], ["tile_x", "sp", [-1, 1, 17, 1]], ["tile_rc", "sp", [-1, 1]], ["tile_ry", "sp", [-1, 1]], ["tile_rx", "sp", [-1, 1]], ["auto_unroll_max_step", "ot", 0], ["unroll_explicit", "ot", 0]]}, "result": [[0.0003232367929936306, 0.0003232774426751593, 0.0003237779458598726], 0, 1.2909691333770752, 1678636122.507252], "version": 0.2, "tvm_version": "0.10.0"}
{"input": ["cuda -keys=cuda,gpu -arch=sm_75 -max_num_threads=1024 -thread_warp_size=32", "conv2d_nchw.cuda", [["TENSOR", [1, 128, 17, 17], "float32"], ["TENSOR", [128, 128, 1, 7], "float32"], [1, 1], [0, 3, 0, 3], [1, 1], "float32"], {}], "config": {"index": 18361, "code_hash": null, "entity": [["tile_f", "sp", [-1, 2, 1, 1]], ["tile_y", "sp", [-1, 17, 1, 1]], ["tile_x", "sp", [-1, 1, 17, 1]], ["tile_rc", "sp", [-1, 2]], ["tile_ry", "sp", [-1, 1]], ["tile_rx", "sp", [-1, 7]], ["auto_unroll_max_step", "ot", 0], ["unroll_explicit", "ot", 0]]}, "result": [[0.00022601706415929204, 0.00022606407300884956, 0.00022607462168141592], 0, 1.3167519569396973, 1678636123.3443623], "version": 0.2, "tvm_version": "0.10.0"}
{"input": ["cuda -keys=cuda,gpu -arch=sm_75 -max_num_threads=1024 -thread_warp_size=32", "conv2d_nchw.cuda", [["TENSOR", [1, 128, 17, 17], "float32"], ["TENSOR", [128, 128, 1, 7], "float32"], [1, 1], [0, 3, 0, 3], [1, 1], "float32"], {}], "config": {"index": 16921, "code_hash": null, "entity": [["tile_f", "sp", [-1, 2, 1, 1]], ["tile_y", "sp", [-1, 17, 1, 1]], ["tile_x", "sp", [-1, 1, 1, 17]], ["tile_rc", "sp", [-1, 1]], ["tile_ry", "sp", [-1, 1]], ["tile_rx", "sp", [-1, 7]], ["auto_unroll_max_step", "ot", 0], ["unroll_explicit", "ot", 0]]}, "result": [[0.072625038, 0.07274086749999999, 0.07282476800000001], 0, 2.023757219314575, 1678636124.4873664], "version": 0.2, "tvm_version": "0.10.0"}
{"input": ["cuda -keys=cuda,gpu -arch=sm_75 -max_num_threads=1024 -thread_warp_size=32", "conv2d_nchw.cuda", [["TENSOR", [1, 128, 17, 17], "float32"], ["TENSOR", [128, 128, 1, 7], "float32"], [1, 1], [0, 3, 0, 3], [1, 1], "float32"], {}], "config": {"index": 15961, "code_hash": null, "entity": [["tile_f", "sp", [-1, 2, 1, 1]], ["tile_y", "sp", [-1, 17, 1, 1]], ["tile_x", "sp", [-1, 17, 1, 1]], ["tile_rc", "sp", [-1, 1]], ["tile_ry", "sp", [-1, 1]], ["tile_rx", "sp", [-1, 7]], ["auto_unroll_max_step", "ot", 0], ["unroll_explicit", "ot", 0]]}, "result": [[0.072487808, 0.0726934585, 0.07285614750000001], 0, 2.0153968334198, 1678636125.644759], "version": 0.2, "tvm_version": "0.10.0"}
{"input": ["cuda -keys=cuda,gpu -arch=sm_75 -max_num_threads=1024 -thread_warp_size=32", "conv2d_nchw.cuda", [["TENSOR", [1, 128, 17, 17], "float32"], ["TENSOR", [128, 128, 1, 7], "float32"], [1, 1], [0, 3, 0, 3], [1, 1], "float32"], {}], "config": {"index": 16561, "code_hash": null, "entity": [["tile_f", "sp", [-1, 2, 1, 1]], ["tile_y", "sp", [-1, 1, 17, 1]], ["tile_x", "sp", [-1, 1, 17, 1]], ["tile_rc", "sp", [-1, 1]], ["tile_ry", "sp", [-1, 1]], ["tile_rx", "sp", [-1, 7]], ["auto_unroll_max_step", "ot", 0], ["unroll_explicit", "ot", 0]]}, "result": [[0.000227480156626506, 0.00022750097590361446, 0.00022761175502008035], 0, 1.5215542316436768, 1678636126.631568], "version": 0.2, "tvm_version": "0.10.0"}
{"input": ["cuda -keys=cuda,gpu -arch=sm_75 -max_num_threads=1024 -thread_warp_size=32", "conv2d_nchw.cuda", [["TENSOR", [1, 128, 17, 17], "float32"], ["TENSOR", [128, 128, 1, 7], "float32"], [1, 1], [0, 3, 0, 3], [1, 1], "float32"], {}], "config": {"index": 16442, "code_hash": null, "entity": [["tile_f", "sp", [-1, 4, 1, 1]], ["tile_y", "sp", [-1, 17, 1, 1]], ["tile_x", "sp", [-1, 1, 17, 1]], ["tile_rc", "sp", [-1, 1]], ["tile_ry", "sp", [-1, 1]], ["tile_rx", "sp", [-1, 7]], ["auto_unroll_max_step", "ot", 0], ["unroll_explicit", "ot", 0]]}, "result": [[0.00012605423312401885, 0.00012651142229199371, 0.00012651430847723704], 0, 1.7627079486846924, 1678636127.9376633], "version": 0.2, "tvm_version": "0.10.0"}
{"input": ["cuda -keys=cuda,gpu -arch=sm_75 -max_num_threads=1024 -thread_warp_size=32", "conv2d_nchw.cuda", [["TENSOR", [1, 128, 17, 17], "float32"], ["TENSOR", [128, 128, 1, 7], "float32"], [1, 1], [0, 3, 0, 3], [1, 1], "float32"], {}], "config": {"index": 108602, "code_hash": null, "entity": [["tile_f", "sp", [-1, 4, 1, 1]], ["tile_y", "sp", [-1, 17, 1, 1]], ["tile_x", "sp", [-1, 1, 17, 1]], ["tile_rc", "sp", [-1, 1]], ["tile_ry", "sp", [-1, 1]], ["tile_rx", "sp", [-1, 7]], ["auto_unroll_max_step", "ot", 0], ["unroll_explicit", "ot", 1]]}, "result": [[0.00012626475123762377, 0.0001262826163366337, 0.00012650961881188118], 0, 1.397709846496582, 1678636129.481134], "version": 0.2, "tvm_version": "0.10.0"}
{"input": ["cuda -keys=cuda,gpu -arch=sm_75 -max_num_threads=1024 -thread_warp_size=32", "conv2d_nchw.cuda", [["TENSOR", [1, 128, 17, 17], "float32"], ["TENSOR", [128, 128, 1, 7], "float32"], [1, 1], [0, 3, 0, 3], [1, 1], "float32"], {}], "config": {"index": 47162, "code_hash": null, "entity": [["tile_f", "sp", [-1, 4, 1, 1]], ["tile_y", "sp", [-1, 17, 1, 1]], ["tile_x", "sp", [-1, 1, 17, 1]], ["tile_rc", "sp", [-1, 1]], ["tile_ry", "sp", [-1, 1]], ["tile_rx", "sp", [-1, 7]], ["auto_unroll_max_step", "ot", 512], ["unroll_explicit", "ot", 0]]}, "result": [[0.00011819919190751444, 0.00011820078843930636, 0.0001188117838150289], 0, 1.4705712795257568, 1678636130.321193], "version": 0.2, "tvm_version": "0.10.0"}
{"input": ["cuda -keys=cuda,gpu -arch=sm_75 -max_num_threads=1024 -thread_warp_size=32", "conv2d_nchw.cuda", [["TENSOR", [1, 128, 17, 17], "float32"], ["TENSOR", [128, 128, 1, 7], "float32"], [1, 1], [0, 3, 0, 3], [1, 1], "float32"], {}], "config": {"index": 1082, "code_hash": null, "entity": [["tile_f", "sp", [-1, 4, 1, 1]], ["tile_y", "sp", [-1, 17, 1, 1]], ["tile_x", "sp", [-1, 1, 17, 1]], ["tile_rc", "sp", [-1, 1]], ["tile_ry", "sp", [-1, 1]], ["tile_rx", "sp", [-1, 1]], ["auto_unroll_max_step", "ot", 0], ["unroll_explicit", "ot", 0]]}, "result": [[0.000189769829588015, 0.00018979997565543073, 0.00018989638576779027], 0, 1.4334211349487305, 1678636131.138231], "version": 0.2, "tvm_version": "0.10.0"}
{"input": ["cuda -keys=cuda,gpu -arch=sm_75 -max_num_threads=1024 -thread_warp_size=32", "conv2d_nchw.cuda", [["TENSOR", [1, 128, 17, 17], "float32"], ["TENSOR", [128, 128, 1, 7], "float32"], [1, 1], [0, 3, 0, 3], [1, 1], "float32"], {}], "config": {"index": 18362, "code_hash": null, "entity": [["tile_f", "sp", [-1, 4, 1, 1]], ["tile_y", "sp", [-1, 17, 1, 1]], ["tile_x", "sp", [-1, 1, 17, 1]], ["tile_rc", "sp", [-1, 2]], ["tile_ry", "sp", [-1, 1]], ["tile_rx", "sp", [-1, 7]], ["auto_unroll_max_step", "ot", 0], ["unroll_explicit", "ot", 0]]}, "result": [[0.0001498047673048601, 0.00014982070103092783, 0.00014987465684830636], 0, 1.37168550491333, 1678636131.9689255], "version": 0.2, "tvm_version": "0.10.0"}
{"input": ["cuda -keys=cuda,gpu -arch=sm_75 -max_num_threads=1024 -thread_warp_size=32", "conv2d_nchw.cuda", [["TENSOR", [1, 128, 17, 17], "float32"], ["TENSOR", [128, 128, 1, 7], "float32"], [1, 1], [0, 3, 0, 3], [1, 1], "float32"], {}], "config": {"index": 16922, "code_hash": null, "entity": [["tile_f", "sp", [-1, 4, 1, 1]], ["tile_y", "sp", [-1, 17, 1, 1]], ["tile_x", "sp", [-1, 1, 1, 17]], ["tile_rc", "sp", [-1, 1]], ["tile_ry", "sp", [-1, 1]], ["tile_rx", "sp", [-1, 7]], ["auto_unroll_max_step", "ot", 0], ["unroll_explicit", "ot", 0]]}, "result": [[0.07438950300000001, 0.0744731825, 0.074500099], 0, 1.6885168552398682, 1678636133.0915942], "version": 0.2, "tvm_version": "0.10.0"}
{"input": ["cuda -keys=cuda,gpu -arch=sm_75 -max_num_threads=1024 -thread_warp_size=32", "conv2d_nchw.cuda", [["TENSOR", [1, 128, 17, 17], "float32"], ["TENSOR", [128, 128, 1, 7], "float32"], [1, 1], [0, 3, 0, 3], [1, 1], "float32"], {}], "config": {"index": 15962, "code_hash": null, "entity": [["tile_f", "sp", [-1, 4, 1, 1]], ["tile_y", "sp", [-1, 17, 1, 1]], ["tile_x", "sp", [-1, 17, 1, 1]], ["tile_rc", "sp", [-1, 1]], ["tile_ry", "sp", [-1, 1]], ["tile_rx", "sp", [-1, 7]], ["auto_unroll_max_step", "ot", 0], ["unroll_explicit", "ot", 0]]}, "result": [[0.0743909755, 0.0744246595, 0.07448481750000001], 0, 1.774843692779541, 1678636134.2745202], "version": 0.2, "tvm_version": "0.10.0"}
{"input": ["cuda -keys=cuda,gpu -arch=sm_75 -max_num_threads=1024 -thread_warp_size=32", "conv2d_nchw.cuda", [["TENSOR", [1, 128, 17, 17], "float32"], ["TENSOR", [128, 128, 1, 7], "float32"], [1, 1], [0, 3, 0, 3], [1, 1], "float32"], {}], "config": {"index": 16562, "code_hash": null, "entity": [["tile_f", "sp", [-1, 4, 1, 1]], ["tile_y", "sp", [-1, 1, 17, 1]], ["tile_x", "sp", [-1, 1, 17, 1]], ["tile_rc", "sp", [-1, 1]], ["tile_ry", "sp", [-1, 1]], ["tile_rx", "sp", [-1, 7]], ["auto_unroll_max_step", "ot", 0], ["unroll_explicit", "ot", 0]]}, "result": [[0.00016297619968304279, 0.00016300647543581617, 0.00016302306339144215], 0, 1.2091717720031738, 1678636135.089445], "version": 0.2, "tvm_version": "0.10.0"}
{"input": ["cuda -keys=cuda,gpu -arch=sm_75 -max_num_threads=1024 -thread_warp_size=32", "conv2d_nchw.cuda", [["TENSOR", [1, 128, 17, 17], "float32"], ["TENSOR", [128, 128, 1, 7], "float32"], [1, 1], [0, 3, 0, 3], [1, 1], "float32"], {}], "config": {"index": 16322, "code_hash": null, "entity": [["tile_f", "sp", [-1, 4, 1, 1]], ["tile_y", "sp", [-1, 1, 1, 1]], ["tile_x", "sp", [-1, 1, 17, 1]], ["tile_rc", "sp", [-1, 1]], ["tile_ry", "sp", [-1, 1]], ["tile_rx", "sp", [-1, 7]], ["auto_unroll_max_step", "ot", 0], ["unroll_explicit", "ot", 0]]}, "result": [[0.0002585072537688442, 0.00025855741959798995, 0.0002586421658291457], 0, 1.3527555465698242, 1678636135.93887], "version": 0.2, "tvm_version": "0.10.0"}
{"input": ["cuda -keys=cuda,gpu -arch=sm_75 -max_num_threads=1024 -thread_warp_size=32", "conv2d_nchw.cuda", [["TENSOR", [1, 128, 17, 17], "float32"], ["TENSOR", [128, 128, 1, 7], "float32"], [1, 1], [0, 3, 0, 3], [1, 1], "float32"], {}], "config": {"index": 16443, "code_hash": null, "entity": [["tile_f", "sp", [-1, 8, 1, 1]], ["tile_y", "sp", [-1, 17, 1, 1]], ["tile_x", "sp", [-1, 1, 17, 1]], ["tile_rc", "sp", [-1, 1]], ["tile_ry", "sp", [-1, 1]], ["tile_rx", "sp", [-1, 7]], ["auto_unroll_max_step", "ot", 0], ["unroll_explicit", "ot", 0]]}, "result": [[0.00023994917674418603, 0.00024015046744186046, 0.00024046132093023256], 0, 1.419339895248413, 1678636136.7622356], "version": 0.2, "tvm_version": "0.10.0"}
{"input": ["cuda -keys=cuda,gpu -arch=sm_75 -max_num_threads=1024 -thread_warp_size=32", "conv2d_nchw.cuda", [["TENSOR", [1, 128, 17, 17], "float32"], ["TENSOR", [128, 128, 1, 7], "float32"], [1, 1], [0, 3, 0, 3], [1, 1], "float32"], {}], "config": {"index": 139322, "code_hash": null, "entity": [["tile_f", "sp", [-1, 4, 1, 1]], ["tile_y", "sp", [-1, 17, 1, 1]], ["tile_x", "sp", [-1, 1, 17, 1]], ["tile_rc", "sp", [-1, 1]], ["tile_ry", "sp", [-1, 1]], ["tile_rx", "sp", [-1, 7]], ["auto_unroll_max_step", "ot", 512], ["unroll_explicit", "ot", 1]]}, "result": [[0.00011924061209964413, 0.00011924297390272835, 0.00011925773546856466], 0, 1.696660041809082, 1678636138.7980738], "version": 0.2, "tvm_version": "0.10.0"}
{"input": ["cuda -keys=cuda,gpu -arch=sm_75 -max_num_threads=1024 -thread_warp_size=32", "conv2d_nchw.cuda", [["TENSOR", [1, 128, 17, 17], "float32"], ["TENSOR", [128, 128, 1, 7], "float32"], [1, 1], [0, 3, 0, 3], [1, 1], "float32"], {}], "config": {"index": 77882, "code_hash": null, "entity": [["tile_f", "sp", [-1, 4, 1, 1]], ["tile_y", "sp", [-1, 17, 1, 1]], ["tile_x", "sp", [-1, 1, 17, 1]], ["tile_rc", "sp", [-1, 1]], ["tile_ry", "sp", [-1, 1]], ["tile_rx", "sp", [-1, 7]], ["auto_unroll_max_step", "ot", 1500], ["unroll_explicit", "ot", 0]]}, "result": [[0.00011824253675612602, 0.00011825109218203034, 0.00011827035705950993], 0, 1.512406349182129, 1678636139.6354146], "version": 0.2, "tvm_version": "0.10.0"}
{"input": ["cuda -keys=cuda,gpu -arch=sm_75 -max_num_threads=1024 -thread_warp_size=32", "conv2d_nchw.cuda", [["TENSOR", [1, 128, 17, 17], "float32"], ["TENSOR", [128, 128, 1, 7], "float32"], [1, 1], [0, 3, 0, 3], [1, 1], "float32"], {}], "config": {"index": 31802, "code_hash": null, "entity": [["tile_f", "sp", [-1, 4, 1, 1]], ["tile_y", "sp", [-1, 17, 1, 1]], ["tile_x", "sp", [-1, 1, 17, 1]], ["tile_rc", "sp", [-1, 1]], ["tile_ry", "sp", [-1, 1]], ["tile_rx", "sp", [-1, 1]], ["auto_unroll_max_step", "ot", 512], ["unroll_explicit", "ot", 0]]}, "result": [[0.00018980705740740742, 0.0001898080611111111, 0.00019021688333333331], 0, 1.3128697872161865, 1678636140.4515188], "version": 0.2, "tvm_version": "0.10.0"}
{"input": ["cuda -keys=cuda,gpu -arch=sm_75 -max_num_threads=1024 -thread_warp_size=32", "conv2d_nchw.cuda", [["TENSOR", [1, 128, 17, 17], "float32"], ["TENSOR", [128, 128, 1, 7], "float32"], [1, 1], [0, 3, 0, 3], [1, 1], "float32"], {}], "config": {"index": 49082, "code_hash": null, "entity": [["tile_f", "sp", [-1, 4, 1, 1]], ["tile_y", "sp", [-1, 17, 1, 1]], ["tile_x", "sp", [-1, 1, 17, 1]], ["tile_rc", "sp", [-1, 2]], ["tile_ry", "sp", [-1, 1]], ["tile_rx", "sp", [-1, 7]], ["auto_unroll_max_step", "ot", 512], ["unroll_explicit", "ot", 0]]}, "result": [[0.0001376561771720613, 0.00013785550340715503, 0.00013789276660988075], 0, 2.027815341949463, 1678636141.6816497], "version": 0.2, "tvm_version": "0.10.0"}
{"input": ["cuda -keys=cuda,gpu -arch=sm_75 -max_num_threads=1024 -thread_warp_size=32", "conv2d_nchw.cuda", [["TENSOR", [1, 128, 17, 17], "float32"], ["TENSOR", [128, 128, 1, 7], "float32"], [1, 1], [0, 3, 0, 3], [1, 1], "float32"], {}], "config": {"index": 47642, "code_hash": null, "entity": [["tile_f", "sp", [-1, 4, 1, 1]], ["tile_y", "sp", [-1, 17, 1, 1]], ["tile_x", "sp", [-1, 1, 1, 17]], ["tile_rc", "sp", [-1, 1]], ["tile_ry", "sp", [-1, 1]], ["tile_rx", "sp", [-1, 7]], ["auto_unroll_max_step", "ot", 512], ["unroll_explicit", "ot", 0]]}, "result": [[0.07448374149999999, 0.074539085, 0.074675491], 0, 2.2061543464660645, 1678636142.8275318], "version": 0.2, "tvm_version": "0.10.0"}
{"input": ["cuda -keys=cuda,gpu -arch=sm_75 -max_num_threads=1024 -thread_warp_size=32", "conv2d_nchw.cuda", [["TENSOR", [1, 128, 17, 17], "float32"], ["TENSOR", [128, 128, 1, 7], "float32"], [1, 1], [0, 3, 0, 3], [1, 1], "float32"], {}], "config": {"index": 46682, "code_hash": null, "entity": [["tile_f", "sp", [-1, 4, 1, 1]], ["tile_y", "sp", [-1, 17, 1, 1]], ["tile_x", "sp", [-1, 17, 1, 1]], ["tile_rc", "sp", [-1, 1]], ["tile_ry", "sp", [-1, 1]], ["tile_rx", "sp", [-1, 7]], ["auto_unroll_max_step", "ot", 512], ["unroll_explicit", "ot", 0]]}, "result": [[0.0745279235, 0.07459737350000001, 0.0746650695], 0, 2.217517614364624, 1678636144.0102403], "version": 0.2, "tvm_version": "0.10.0"}
{"input": ["cuda -keys=cuda,gpu -arch=sm_75 -max_num_threads=1024 -thread_warp_size=32", "conv2d_nchw.cuda", [["TENSOR", [1, 128, 17, 17], "float32"], ["TENSOR", [128, 128, 1, 7], "float32"], [1, 1], [0, 3, 0, 3], [1, 1], "float32"], {}], "config": {"index": 47282, "code_hash": null, "entity": [["tile_f", "sp", [-1, 4, 1, 1]], ["tile_y", "sp", [-1, 1, 17, 1]], ["tile_x", "sp", [-1, 1, 17, 1]], ["tile_rc", "sp", [-1, 1]], ["tile_ry", "sp", [-1, 1]], ["tile_rx", "sp", [-1, 7]], ["auto_unroll_max_step", "ot", 512], ["unroll_explicit", "ot", 0]]}, "result": [[0.0001628716846275753, 0.0001629214881141046, 0.00016300125198098257], 0, 1.303483486175537, 1678636144.8800907], "version": 0.2, "tvm_version": "0.10.0"}
{"input": ["cuda -keys=cuda,gpu -arch=sm_75 -max_num_threads=1024 -thread_warp_size=32", "conv2d_nchw.cuda", [["TENSOR", [1, 128, 17, 17], "float32"], ["TENSOR", [128, 128, 1, 7], "float32"], [1, 1], [0, 3, 0, 3], [1, 1], "float32"], {}], "config": {"index": 47042, "code_hash": null, "entity": [["tile_f", "sp", [-1, 4, 1, 1]], ["tile_y", "sp", [-1, 1, 1, 1]], ["tile_x", "sp", [-1, 1, 17, 1]], ["tile_rc", "sp", [-1, 1]], ["tile_ry", "sp", [-1, 1]], ["tile_rx", "sp", [-1, 7]], ["auto_unroll_max_step", "ot", 512], ["unroll_explicit", "ot", 0]]}, "result": [[0.0002584874202531645, 0.00025854412911392407, 0.00025878740000000004], 0, 1.258915662765503, 1678636145.7366629], "version": 0.2, "tvm_version": "0.10.0"}
{"input": ["cuda -keys=cuda,gpu -arch=sm_75 -max_num_threads=1024 -thread_warp_size=32", "conv2d_nchw.cuda", [["TENSOR", [1, 128, 17, 17], "float32"], ["TENSOR", [128, 128, 1, 7], "float32"], [1, 1], [0, 3, 0, 3], [1, 1], "float32"], {}], "config": {"index": 47163, "code_hash": null, "entity": [["tile_f", "sp", [-1, 8, 1, 1]], ["tile_y", "sp", [-1, 17, 1, 1]], ["tile_x", "sp", [-1, 1, 17, 1]], ["tile_rc", "sp", [-1, 1]], ["tile_ry", "sp", [-1, 1]], ["tile_rx", "sp", [-1, 7]], ["auto_unroll_max_step", "ot", 512], ["unroll_explicit", "ot", 0]]}, "result": [[0.0002398784, 0.0002399303511627907, 0.00023995721395348837], 0, 1.4507510662078857, 1678636146.607619], "version": 0.2, "tvm_version": "0.10.0"}
{"input": ["cuda -keys=cuda,gpu -arch=sm_75 -max_num_threads=1024 -thread_warp_size=32", "conv2d_nchw.cuda", [["TENSOR", [1, 128, 17, 17], "float32"], ["TENSOR", [128, 128, 1, 7], "float32"], [1, 1], [0, 3, 0, 3], [1, 1], "float32"], {}], "config": {"index": 170042, "code_hash": null, "entity": [["tile_f", "sp", [-1, 4, 1, 1]], ["tile_y", "sp", [-1, 17, 1, 1]], ["tile_x", "sp", [-1, 1, 17, 1]], ["tile_rc", "sp", [-1, 1]], ["tile_ry", "sp", [-1, 1]], ["tile_rx", "sp", [-1, 7]], ["auto_unroll_max_step", "ot", 1500], ["unroll_explicit", "ot", 1]]}, "result": [[0.00011934819553072624, 0.00011942262756052142, 0.00015416607078313252], 0, 1.9054162502288818, 1678636151.0680473], "version": 0.2, "tvm_version": "0.10.0"}
{"input": ["cuda -keys=cuda,gpu -arch=sm_75 -max_num_threads=1024 -thread_warp_size=32", "conv2d_nchw.cuda", [["TENSOR", [1, 128, 17, 17], "float32"], ["TENSOR", [128, 128, 1, 7], "float32"], [1, 1], [0, 3, 0, 3], [1, 1], "float32"], {}], "config": {"index": 62522, "code_hash": null, "entity": [["tile_f", "sp", [-1, 4, 1, 1]], ["tile_y", "sp", [-1, 17, 1, 1]], ["tile_x", "sp", [-1, 1, 17, 1]], ["tile_rc", "sp", [-1, 1]], ["tile_ry", "sp", [-1, 1]], ["tile_rx", "sp", [-1, 1]], ["auto_unroll_max_step", "ot", 1500], ["unroll_explicit", "ot", 0]]}, "result": [[0.00018782754243542433, 0.0001878529926199262, 0.00018786892619926198], 0, 1.400836706161499, 1678636151.9084163], "version": 0.2, "tvm_version": "0.10.0"}
{"input": ["cuda -keys=cuda,gpu -arch=sm_75 -max_num_threads=1024 -thread_warp_size=32", "conv2d_nchw.cuda", [["TENSOR", [1, 128, 17, 17], "float32"], ["TENSOR", [128, 128, 1, 7], "float32"], [1, 1], [0, 3, 0, 3], [1, 1], "float32"], {}], "config": {"index": 79802, "code_hash": null, "entity": [["tile_f", "sp", [-1, 4, 1, 1]], ["tile_y", "sp", [-1, 17, 1, 1]], ["tile_x", "sp", [-1, 1, 17, 1]], ["tile_rc", "sp", [-1, 2]], ["tile_ry", "sp", [-1, 1]], ["tile_rx", "sp", [-1, 7]], ["auto_unroll_max_step", "ot", 1500], ["unroll_explicit", "ot", 0]]}, "result": [[0.00014288591807909605, 0.0001429119533898305, 0.00014293080084745762], 0, 1.6383519172668457, 1678636152.7283332], "version": 0.2, "tvm_version": "0.10.0"}
{"input": ["cuda -keys=cuda,gpu -arch=sm_75 -max_num_threads=1024 -thread_warp_size=32", "conv2d_nchw.cuda", [["TENSOR", [1, 128, 17, 17], "float32"], ["TENSOR", [128, 128, 1, 7], "float32"], [1, 1], [0, 3, 0, 3], [1, 1], "float32"], {}], "config": {"index": 78362, "code_hash": null, "entity": [["tile_f", "sp", [-1, 4, 1, 1]], ["tile_y", "sp", [-1, 17, 1, 1]], ["tile_x", "sp", [-1, 1, 1, 17]], ["tile_rc", "sp", [-1, 1]], ["tile_ry", "sp", [-1, 1]], ["tile_rx", "sp", [-1, 7]], ["auto_unroll_max_step", "ot", 1500], ["unroll_explicit", "ot", 0]]}, "result": [[0.06480648, 0.064917068, 0.0649194865], 0, 4.392987966537476, 1678636153.7924013], "version": 0.2, "tvm_version": "0.10.0"}
{"input": ["cuda -keys=cuda,gpu -arch=sm_75 -max_num_threads=1024 -thread_warp_size=32", "conv2d_nchw.cuda", [["TENSOR", [1, 128, 17, 17], "float32"], ["TENSOR", [128, 128, 1, 7], "float32"], [1, 1], [0, 3, 0, 3], [1, 1], "float32"], {}], "config": {"index": 77402, "code_hash": null, "entity": [["tile_f", "sp", [-1, 4, 1, 1]], ["tile_y", "sp", [-1, 17, 1, 1]], ["tile_x", "sp", [-1, 17, 1, 1]], ["tile_rc", "sp", [-1, 1]], ["tile_ry", "sp", [-1, 1]], ["tile_rx", "sp", [-1, 7]], ["auto_unroll_max_step", "ot", 1500], ["unroll_explicit", "ot", 0]]}, "result": [[0.064753662, 0.064927612, 0.064928108], 0, 4.123440504074097, 1678636154.872521], "version": 0.2, "tvm_version": "0.10.0"}
{"input": ["cuda -keys=cuda,gpu -arch=sm_75 -max_num_threads=1024 -thread_warp_size=32", "conv2d_nchw.cuda", [["TENSOR", [1, 128, 17, 17], "float32"], ["TENSOR", [128, 128, 1, 7], "float32"], [1, 1], [0, 3, 0, 3], [1, 1], "float32"], {}], "config": {"index": 78002, "code_hash": null, "entity": [["tile_f", "sp", [-1, 4, 1, 1]], ["tile_y", "sp", [-1, 1, 17, 1]], ["tile_x", "sp", [-1, 1, 17, 1]], ["tile_rc", "sp", [-1, 1]], ["tile_ry", "sp", [-1, 1]], ["tile_rx", "sp", [-1, 7]], ["auto_unroll_max_step", "ot", 1500], ["unroll_explicit", "ot", 0]]}, "result": [[0.00016297183492063492, 0.00016302303650793653, 0.00016308835873015873], 0, 1.2650880813598633, 1678636155.7060966], "version": 0.2, "tvm_version": "0.10.0"}
{"input": ["cuda -keys=cuda,gpu -arch=sm_75 -max_num_threads=1024 -thread_warp_size=32", "conv2d_nchw.cuda", [["TENSOR", [1, 128, 17, 17], "float32"], ["TENSOR", [128, 128, 1, 7], "float32"], [1, 1], [0, 3, 0, 3], [1, 1], "float32"], {}], "config": {"index": 77762, "code_hash": null, "entity": [["tile_f", "sp", [-1, 4, 1, 1]], ["tile_y", "sp", [-1, 1, 1, 1]], ["tile_x", "sp", [-1, 1, 17, 1]], ["tile_rc", "sp", [-1, 1]], ["tile_ry", "sp", [-1, 1]], ["tile_rx", "sp", [-1, 7]], ["auto_unroll_max_step", "ot", 1500], ["unroll_explicit", "ot", 0]]}, "result": [[0.00025832890024937656, 0.00025841061596009975, 0.0002585284812967581], 0, 1.2545959949493408, 1678636156.5381303], "version": 0.2, "tvm_version": "0.10.0"}
{"input": ["cuda -keys=cuda,gpu -arch=sm_75 -max_num_threads=1024 -thread_warp_size=32", "conv2d_nchw.cuda", [["TENSOR", [1, 128, 17, 17], "float32"], ["TENSOR", [128, 128, 1, 7], "float32"], [1, 1], [0, 3, 0, 3], [1, 1], "float32"], {}], "config": {"index": 77883, "code_hash": null, "entity": [["tile_f", "sp", [-1, 8, 1, 1]], ["tile_y", "sp", [-1, 17, 1, 1]], ["tile_x", "sp", [-1, 1, 17, 1]], ["tile_rc", "sp", [-1, 1]], ["tile_ry", "sp", [-1, 1]], ["tile_rx", "sp", [-1, 7]], ["auto_unroll_max_step", "ot", 1500], ["unroll_explicit", "ot", 0]]}, "result": [[0.0002362370251716247, 0.000236260471395881, 0.00023666364302059496], 0, 1.5983476638793945, 1678636157.361203], "version": 0.2, "tvm_version": "0.10.0"}
{"input": ["cuda -keys=cuda,gpu -arch=sm_75 -max_num_threads=1024 -thread_warp_size=32", "conv2d_nchw.cuda", [["TENSOR", [1, 128, 17, 17], "float32"], ["TENSOR", [128, 128, 1, 7], "float32"], [1, 1], [0, 3, 0, 3], [1, 1], "float32"], {}], "config": {"index": 77881, "code_hash": null, "entity": [["tile_f", "sp", [-1, 2, 1, 1]], ["tile_y", "sp", [-1, 17, 1, 1]], ["tile_x", "sp", [-1, 1, 17, 1]], ["tile_rc", "sp", [-1, 1]], ["tile_ry", "sp", [-1, 1]], ["tile_rx", "sp", [-1, 7]], ["auto_unroll_max_step", "ot", 1500], ["unroll_explicit", "ot", 0]]}, "result": [[0.00018876794280442804, 0.00018884298339483395, 0.00018914786346863467], 0, 1.368058204650879, 1678636158.2191281], "version": 0.2, "tvm_version": "0.10.0"}
{"input": ["cuda -keys=cuda,gpu -arch=sm_75 -max_num_threads=1024 -thread_warp_size=32", "conv2d_nchw.cuda", [["TENSOR", [1, 128, 17, 17], "float32"], ["TENSOR", [128, 128, 1, 7], "float32"], [1, 1], [0, 3, 0, 3], [1, 1], "float32"], {}], "config": {"index": 81722, "code_hash": null, "entity": [["tile_f", "sp", [-1, 4, 1, 1]], ["tile_y", "sp", [-1, 17, 1, 1]], ["tile_x", "sp", [-1, 1, 17, 1]], ["tile_rc", "sp", [-1, 4]], ["tile_ry", "sp", [-1, 1]], ["tile_rx", "sp", [-1, 7]], ["auto_unroll_max_step", "ot", 1500], ["unroll_explicit", "ot", 0]]}, "result": [[0.00013314514454664913, 0.00013315229303547963, 0.0001331847161629435], 0, 1.3660392761230469, 1678636159.6935794], "version": 0.2, "tvm_version": "0.10.0"}
{"input": ["cuda -keys=cuda,gpu -arch=sm_75 -max_num_threads=1024 -thread_warp_size=32", "conv2d_nchw.cuda", [["TENSOR", [1, 128, 17, 17], "float32"], ["TENSOR", [128, 128, 1, 7], "float32"], [1, 1], [0, 3, 0, 3], [1, 1], "float32"], {}], "config": {"index": 76922, "code_hash": null, "entity": [["tile_f", "sp", [-1, 4, 1, 1]], ["tile_y", "sp", [-1, 17, 1, 1]], ["tile_x", "sp", [-1, 1, 1, 1]], ["tile_rc", "sp", [-1, 1]], ["tile_ry", "sp", [-1, 1]], ["tile_rx", "sp", [-1, 7]], ["auto_unroll_max_step", "ot", 1500], ["unroll_explicit", "ot", 0]]}, "result": [[0.00204966331372549, 0.0020501616078431374, 0.0020559906274509802], 0, 1.388833999633789, 1678636160.5282953], "version": 0.2, "tvm_version": "0.10.0"}
{"input": ["cuda -keys=cuda,gpu -arch=sm_75 -max_num_threads=1024 -thread_warp_size=32", "conv2d_nchw.cuda", [["TENSOR", [1, 128, 17, 17], "float32"], ["TENSOR", [128, 128, 1, 7], "float32"], [1, 1], [0, 3, 0, 3], [1, 1], "float32"], {}], "config": {"index": 78122, "code_hash": null, "entity": [["tile_f", "sp", [-1, 4, 1, 1]], ["tile_y", "sp", [-1, 1, 1, 17]], ["tile_x", "sp", [-1, 1, 17, 1]], ["tile_rc", "sp", [-1, 1]], ["tile_ry", "sp", [-1, 1]], ["tile_rx", "sp", [-1, 7]], ["auto_unroll_max_step", "ot", 1500], ["unroll_explicit", "ot", 0]]}, "result": [[0.00011816780161476355, 0.00011818914071510957, 0.00011822653171856978], 0, 1.359928846359253, 1678636161.382887], "version": 0.2, "tvm_version": "0.10.0"}
{"input": ["cuda -keys=cuda,gpu -arch=sm_75 -max_num_threads=1024 -thread_warp_size=32", "conv2d_nchw.cuda", [["TENSOR", [1, 128, 17, 17], "float32"], ["TENSOR", [128, 128, 1, 7], "float32"], [1, 1], [0, 3, 0, 3], [1, 1], "float32"], {}], "config": {"index": 77884, "code_hash": null, "entity": [["tile_f", "sp", [-1, 16, 1, 1]], ["tile_y", "sp", [-1, 17, 1, 1]], ["tile_x", "sp", [-1, 1, 17, 1]], ["tile_rc", "sp", [-1, 1]], ["tile_ry", "sp", [-1, 1]], ["tile_rx", "sp", [-1, 7]], ["auto_unroll_max_step", "ot", 1500], ["unroll_explicit", "ot", 0]]}, "result": [[0.0008061627734374999, 0.0008063617343750001, 0.00080641596875], 0, 1.4274272918701172, 1678636162.2541492], "version": 0.2, "tvm_version": "0.10.0"}
{"input": ["cuda -keys=cuda,gpu -arch=sm_75 -max_num_threads=1024 -thread_warp_size=32", "conv2d_nchw.cuda", [["TENSOR", [1, 128, 17, 17], "float32"], ["TENSOR", [128, 128, 1, 7], "float32"], [1, 1], [0, 3, 0, 3], [1, 1], "float32"], {}], "config": {"index": 77880, "code_hash": null, "entity": [["tile_f", "sp", [-1, 1, 1, 1]], ["tile_y", "sp", [-1, 17, 1, 1]], ["tile_x", "sp", [-1, 1, 17, 1]], ["tile_rc", "sp", [-1, 1]], ["tile_ry", "sp", [-1, 1]], ["tile_rx", "sp", [-1, 7]], ["auto_unroll_max_step", "ot", 1500], ["unroll_explicit", "ot", 0]]}, "result": [[0.00031584916307692305, 0.00031606508615384613, 0.00031637504923076923], 0, 1.2975828647613525, 1678636163.0951731], "version": 0.2, "tvm_version": "0.10.0"}
{"input": ["cuda -keys=cuda,gpu -arch=sm_75 -max_num_threads=1024 -thread_warp_size=32", "conv2d_nchw.cuda", [["TENSOR", [1, 128, 17, 17], "float32"], ["TENSOR", [128, 128, 1, 7], "float32"], [1, 1], [0, 3, 0, 3], [1, 1], "float32"], {}], "config": {"index": 170282, "code_hash": null, "entity": [["tile_f", "sp", [-1, 4, 1, 1]], ["tile_y", "sp", [-1, 1, 1, 17]], ["tile_x", "sp", [-1, 1, 17, 1]], ["tile_rc", "sp", [-1, 1]], ["tile_ry", "sp", [-1, 1]], ["tile_rx", "sp", [-1, 7]], ["auto_unroll_max_step", "ot", 1500], ["unroll_explicit", "ot", 1]]}, "result": [[0.00011918293345829427, 0.00011941739925023431, 0.00011979219775070292], 0, 1.8582329750061035, 1678636167.6509242], "version": 0.2, "tvm_version": "0.10.0"}
{"input": ["cuda -keys=cuda,gpu -arch=sm_75 -max_num_threads=1024 -thread_warp_size=32", "conv2d_nchw.cuda", [["TENSOR", [1, 128, 17, 17], "float32"], ["TENSOR", [128, 128, 1, 7], "float32"], [1, 1], [0, 3, 0, 3], [1, 1], "float32"], {}], "config": {"index": 16682, "code_hash": null, "entity": [["tile_f", "sp", [-1, 4, 1, 1]], ["tile_y", "sp", [-1, 1, 1, 17]], ["tile_x", "sp", [-1, 1, 17, 1]], ["tile_rc", "sp", [-1, 1]], ["tile_ry", "sp", [-1, 1]], ["tile_rx", "sp", [-1, 7]], ["auto_unroll_max_step", "ot", 0], ["unroll_explicit", "ot", 0]]}, "result": [[0.00012634702122347064, 0.00012639253058676654, 0.0001266060586766542], 0, 1.4039690494537354, 1678636168.4652054], "version": 0.2, "tvm_version": "0.10.0"}
{"input": ["cuda -keys=cuda,gpu -arch=sm_75 -max_num_threads=1024 -thread_warp_size=32", "conv2d_nchw.cuda", [["TENSOR", [1, 128, 17, 17], "float32"], ["TENSOR", [128, 128, 1, 7], "float32"], [1, 1], [0, 3, 0, 3], [1, 1], "float32"], {}], "config": {"index": 47402, "code_hash": null, "entity": [["tile_f", "sp", [-1, 4, 1, 1]], ["tile_y", "sp", [-1, 1, 1, 17]], ["tile_x", "sp", [-1, 1, 17, 1]], ["tile_rc", "sp", [-1, 1]], ["tile_ry", "sp", [-1, 1]], ["tile_rx", "sp", [-1, 7]], ["auto_unroll_max_step", "ot", 512], ["unroll_explicit", "ot", 0]]}, "result": [[0.0001181478429561201, 0.00011819107274826791, 0.00011821417321016167], 0, 1.4389009475708008, 1678636169.3105958], "version": 0.2, "tvm_version": "0.10.0"}
{"input": ["cuda -keys=cuda,gpu -arch=sm_75 -max_num_threads=1024 -thread_warp_size=32", "conv2d_nchw.cuda", [["TENSOR", [1, 128, 17, 17], "float32"], ["TENSOR", [128, 128, 1, 7], "float32"], [1, 1], [0, 3, 0, 3], [1, 1], "float32"], {}], "config": {"index": 62762, "code_hash": null, "entity": [["tile_f", "sp", [-1, 4, 1, 1]], ["tile_y", "sp", [-1, 1, 1, 17]], ["tile_x", "sp", [-1, 1, 17, 1]], ["tile_rc", "sp", [-1, 1]], ["tile_ry", "sp", [-1, 1]], ["tile_rx", "sp", [-1, 1]], ["auto_unroll_max_step", "ot", 1500], ["unroll_explicit", "ot", 0]]}, "result": [[0.00018791884346224677, 0.00018792716022099446, 0.0001879702965009208], 0, 1.4931883811950684, 1678636170.163084], "version": 0.2, "tvm_version": "0.10.0"}
{"input": ["cuda -keys=cuda,gpu -arch=sm_75 -max_num_threads=1024 -thread_warp_size=32", "conv2d_nchw.cuda", [["TENSOR", [1, 128, 17, 17], "float32"], ["TENSOR", [128, 128, 1, 7], "float32"], [1, 1], [0, 3, 0, 3], [1, 1], "float32"], {}], "config": {"index": 80042, "code_hash": null, "entity": [["tile_f", "sp", [-1, 4, 1, 1]], ["tile_y", "sp", [-1, 1, 1, 17]], ["tile_x", "sp", [-1, 1, 17, 1]], ["tile_rc", "sp", [-1, 2]], ["tile_ry", "sp", [-1, 1]], ["tile_rx", "sp", [-1, 7]], ["auto_unroll_max_step", "ot", 1500], ["unroll_explicit", "ot", 0]]}, "result": [[0.00014294279050279328, 0.0001430078212290503, 0.000143239282122905], 0, 1.6802616119384766, 1678636171.001431], "version": 0.2, "tvm_version": "0.10.0"}
{"input": ["cuda -keys=cuda,gpu -arch=sm_75 -max_num_threads=1024 -thread_warp_size=32", "conv2d_nchw.cuda", [["TENSOR", [1, 128, 17, 17], "float32"], ["TENSOR", [128, 128, 1, 7], "float32"], [1, 1], [0, 3, 0, 3], [1, 1], "float32"], {}], "config": {"index": 78602, "code_hash": null, "entity": [["tile_f", "sp", [-1, 4, 1, 1]], ["tile_y", "sp", [-1, 1, 1, 17]], ["tile_x", "sp", [-1, 1, 1, 17]], ["tile_rc", "sp", [-1, 1]], ["tile_ry", "sp", [-1, 1]], ["tile_rx", "sp", [-1, 7]], ["auto_unroll_max_step", "ot", 1500], ["unroll_explicit", "ot", 0]]}, "result": [[0.042137397666666666, 0.042273012666666665, 0.042394966], 0, 4.398905038833618, 1678636172.1376705], "version": 0.2, "tvm_version": "0.10.0"}
{"input": ["cuda -keys=cuda,gpu -arch=sm_75 -max_num_threads=1024 -thread_warp_size=32", "conv2d_nchw.cuda", [["TENSOR", [1, 128, 17, 17], "float32"], ["TENSOR", [128, 128, 1, 7], "float32"], [1, 1], [0, 3, 0, 3], [1, 1], "float32"], {}], "config": {"index": 77642, "code_hash": null, "entity": [["tile_f", "sp", [-1, 4, 1, 1]], ["tile_y", "sp", [-1, 1, 1, 17]], ["tile_x", "sp", [-1, 17, 1, 1]], ["tile_rc", "sp", [-1, 1]], ["tile_ry", "sp", [-1, 1]], ["tile_rx", "sp", [-1, 7]], ["auto_unroll_max_step", "ot", 1500], ["unroll_explicit", "ot", 0]]}, "result": [[0.062659233, 0.062673088, 0.0632082555], 0, 4.432229280471802, 1678636173.1428735], "version": 0.2, "tvm_version": "0.10.0"}
{"input": ["cuda -keys=cuda,gpu -arch=sm_75 -max_num_threads=1024 -thread_warp_size=32", "conv2d_nchw.cuda", [["TENSOR", [1, 128, 17, 17], "float32"], ["TENSOR", [128, 128, 1, 7], "float32"], [1, 1], [0, 3, 0, 3], [1, 1], "float32"], {}], "config": {"index": 78123, "code_hash": null, "entity": [["tile_f", "sp", [-1, 8, 1, 1]], ["tile_y", "sp", [-1, 1, 1, 17]], ["tile_x", "sp", [-1, 1, 17, 1]], ["tile_rc", "sp", [-1, 1]], ["tile_ry", "sp", [-1, 1]], ["tile_rx", "sp", [-1, 7]], ["auto_unroll_max_step", "ot", 1500], ["unroll_explicit", "ot", 0]]}, "result": [[0.00023621980459770118, 0.00023622224137931035, 0.0002363326482758621], 0, 1.6512582302093506, 1678636173.9831693], "version": 0.2, "tvm_version": "0.10.0"}
{"input": ["cuda -keys=cuda,gpu -arch=sm_75 -max_num_threads=1024 -thread_warp_size=32", "conv2d_nchw.cuda", [["TENSOR", [1, 128, 17, 17], "float32"], ["TENSOR", [128, 128, 1, 7], "float32"], [1, 1], [0, 3, 0, 3], [1, 1], "float32"], {}], "config": {"index": 78121, "code_hash": null, "entity": [["tile_f", "sp", [-1, 2, 1, 1]], ["tile_y", "sp", [-1, 1, 1, 17]], ["tile_x", "sp", [-1, 1, 17, 1]], ["tile_rc", "sp", [-1, 1]], ["tile_ry", "sp", [-1, 1]], ["tile_rx", "sp", [-1, 7]], ["auto_unroll_max_step", "ot", 1500], ["unroll_explicit", "ot", 0]]}, "result": [[0.00018885338547486034, 0.00018886286219739292, 0.00018888890316573557], 0, 1.4661734104156494, 1678636174.8018408], "version": 0.2, "tvm_version": "0.10.0"}
{"input": ["cuda -keys=cuda,gpu -arch=sm_75 -max_num_threads=1024 -thread_warp_size=32", "conv2d_nchw.cuda", [["TENSOR", [1, 128, 17, 17], "float32"], ["TENSOR", [128, 128, 1, 7], "float32"], [1, 1], [0, 3, 0, 3], [1, 1], "float32"], {}], "config": {"index": 139562, "code_hash": null, "entity": [["tile_f", "sp", [-1, 4, 1, 1]], ["tile_y", "sp", [-1, 1, 1, 17]], ["tile_x", "sp", [-1, 1, 17, 1]], ["tile_rc", "sp", [-1, 1]], ["tile_ry", "sp", [-1, 1]], ["tile_rx", "sp", [-1, 7]], ["auto_unroll_max_step", "ot", 512], ["unroll_explicit", "ot", 1]]}, "result": [[0.00011912454069767441, 0.00011913201860465116, 0.00011913391744186046], 0, 1.5375778675079346, 1678636176.671617], "version": 0.2, "tvm_version": "0.10.0"}
{"input": ["cuda -keys=cuda,gpu -arch=sm_75 -max_num_threads=1024 -thread_warp_size=32", "conv2d_nchw.cuda", [["TENSOR", [1, 128, 17, 17], "float32"], ["TENSOR", [128, 128, 1, 7], "float32"], [1, 1], [0, 3, 0, 3], [1, 1], "float32"], {}], "config": {"index": 32042, "code_hash": null, "entity": [["tile_f", "sp", [-1, 4, 1, 1]], ["tile_y", "sp", [-1, 1, 1, 17]], ["tile_x", "sp", [-1, 1, 17, 1]], ["tile_rc", "sp", [-1, 1]], ["tile_ry", "sp", [-1, 1]], ["tile_rx", "sp", [-1, 1]], ["auto_unroll_max_step", "ot", 512], ["unroll_explicit", "ot", 0]]}, "result": [[0.00018985605194805197, 0.00018987214656771798, 0.00018991197773654916], 0, 1.2724347114562988, 1678636177.4819233], "version": 0.2, "tvm_version": "0.10.0"}
{"input": ["cuda -keys=cuda,gpu -arch=sm_75 -max_num_threads=1024 -thread_warp_size=32", "conv2d_nchw.cuda", [["TENSOR", [1, 128, 17, 17], "float32"], ["TENSOR", [128, 128, 1, 7], "float32"], [1, 1], [0, 3, 0, 3], [1, 1], "float32"], {}], "config": {"index": 49322, "code_hash": null, "entity": [["tile_f", "sp", [-1, 4, 1, 1]], ["tile_y", "sp", [-1, 1, 1, 17]], ["tile_x", "sp", [-1, 1, 17, 1]], ["tile_rc", "sp", [-1, 2]], ["tile_ry", "sp", [-1, 1]], ["tile_rx", "sp", [-1, 7]], ["auto_unroll_max_step", "ot", 512], ["unroll_explicit", "ot", 0]]}, "result": [[0.00013758129166666666, 0.0001376955685483871, 0.00013840163575268817], 0, 1.4988229274749756, 1678636178.3190503], "version": 0.2, "tvm_version": "0.10.0"}
{"input": ["cuda -keys=cuda,gpu -arch=sm_75 -max_num_threads=1024 -thread_warp_size=32", "conv2d_nchw.cuda", [["TENSOR", [1, 128, 17, 17], "float32"], ["TENSOR", [128, 128, 1, 7], "float32"], [1, 1], [0, 3, 0, 3], [1, 1], "float32"], {}], "config": {"index": 47882, "code_hash": null, "entity": [["tile_f", "sp", [-1, 4, 1, 1]], ["tile_y", "sp", [-1, 1, 1, 17]], ["tile_x", "sp", [-1, 1, 1, 17]], ["tile_rc", "sp", [-1, 1]], ["tile_ry", "sp", [-1, 1]], ["tile_rx", "sp", [-1, 7]], ["auto_unroll_max_step", "ot", 512], ["unroll_explicit", "ot", 0]]}, "result": [[0.03810746733333333, 0.03815561666666666, 0.038194612999999995], 0, 1.956972599029541, 1678636179.334967], "version": 0.2, "tvm_version": "0.10.0"}
{"input": ["cuda -keys=cuda,gpu -arch=sm_75 -max_num_threads=1024 -thread_warp_size=32", "conv2d_nchw.cuda", [["TENSOR", [1, 128, 17, 17], "float32"], ["TENSOR", [128, 128, 1, 7], "float32"], [1, 1], [0, 3, 0, 3], [1, 1], "float32"], {}], "config": {"index": 46922, "code_hash": null, "entity": [["tile_f", "sp", [-1, 4, 1, 1]], ["tile_y", "sp", [-1, 1, 1, 17]], ["tile_x", "sp", [-1, 17, 1, 1]], ["tile_rc", "sp", [-1, 1]], ["tile_ry", "sp", [-1, 1]], ["tile_rx", "sp", [-1, 7]], ["auto_unroll_max_step", "ot", 512], ["unroll_explicit", "ot", 0]]}, "result": [[0.074585075, 0.0746005095, 0.074684898], 0, 2.1121416091918945, 1678636180.5070744], "version": 0.2, "tvm_version": "0.10.0"}
{"input": ["cuda -keys=cuda,gpu -arch=sm_75 -max_num_threads=1024 -thread_warp_size=32", "conv2d_nchw.cuda", [["TENSOR", [1, 128, 17, 17], "float32"], ["TENSOR", [128, 128, 1, 7], "float32"], [1, 1], [0, 3, 0, 3], [1, 1], "float32"], {}], "config": {"index": 47403, "code_hash": null, "entity": [["tile_f", "sp", [-1, 8, 1, 1]], ["tile_y", "sp", [-1, 1, 1, 17]], ["tile_x", "sp", [-1, 1, 17, 1]], ["tile_rc", "sp", [-1, 1]], ["tile_ry", "sp", [-1, 1]], ["tile_rx", "sp", [-1, 7]], ["auto_unroll_max_step", "ot", 512], ["unroll_explicit", "ot", 0]]}, "result": [[0.00023997593911007024, 0.00024042657377049183, 0.00024096944028103044], 0, 1.4454798698425293, 1678636181.401017], "version": 0.2, "tvm_version": "0.10.0"}
