src/tvm/results/cuda_gtx1650/inception_v3/droplet/cpu.log_layer_19.log
{"input": ["cuda -keys=cuda,gpu -arch=sm_75 -max_num_threads=1024 -thread_warp_size=32", "conv2d_nchw.cuda", [["TENSOR", [1, 288, 35, 35], "float32"], ["TENSOR", [64, 288, 1, 1], "float32"], [1, 1], [0, 0, 0, 0], [1, 1], "float32"], {}], "config": {"index": 0, "code_hash": null, "entity": [["tile_f", "sp", [-1, 1, 1, 1]], ["tile_y", "sp", [-1, 1, 1, 1]], ["tile_x", "sp", [-1, 1, 1, 1]], ["tile_rc", "sp", [-1, 1]], ["tile_ry", "sp", [-1, 1]], ["tile_rx", "sp", [-1, 1]], ["auto_unroll_max_step", "ot", 0], ["unroll_explicit", "ot", 0]]}, "result": [[0.00424854275, 0.004248646708333334, 0.00425233075], 0, 1.009124517440796, 1679480300.6535988], "version": 0.2, "tvm_version": "0.10.0"}
{"input": ["cuda -keys=cuda,gpu -arch=sm_75 -max_num_threads=1024 -thread_warp_size=32", "conv2d_nchw.cuda", [["TENSOR", [1, 288, 35, 35], "float32"], ["TENSOR", [64, 288, 1, 1], "float32"], [1, 1], [0, 0, 0, 0], [1, 1], "float32"], {}], "config": {"index": 1571221, "code_hash": null, "entity": [["tile_f", "sp", [-1, 2, 1, 1]], ["tile_y", "sp", [-1, 5, 1, 1]], ["tile_x", "sp", [-1, 5, 1, 1]], ["tile_rc", "sp", [-1, 2]], ["tile_ry", "sp", [-1, 1]], ["tile_rx", "sp", [-1, 1]], ["auto_unroll_max_step", "ot", 512], ["unroll_explicit", "ot", 1]]}, "result": [[0.0018213410727272727, 0.0018216773272727272, 0.0018218414181818182], 0, 1.4057700634002686, 1679480302.422625], "version": 0.2, "tvm_version": "0.10.0"}
{"input": ["cuda -keys=cuda,gpu -arch=sm_75 -max_num_threads=1024 -thread_warp_size=32", "conv2d_nchw.cuda", [["TENSOR", [1, 288, 35, 35], "float32"], ["TENSOR", [64, 288, 1, 1], "float32"], [1, 1], [0, 0, 0, 0], [1, 1], "float32"], {}], "config": {"index": 1161216, "code_hash": null, "entity": [["tile_f", "sp", [-1, 1, 1, 1]], ["tile_y", "sp", [-1, 1, 1, 1]], ["tile_x", "sp", [-1, 1, 1, 1]], ["tile_rc", "sp", [-1, 1]], ["tile_ry", "sp", [-1, 1]], ["tile_rx", "sp", [-1, 1]], ["auto_unroll_max_step", "ot", 0], ["unroll_explicit", "ot", 1]]}, "result": [[0.004247637416666667, 0.0042478707499999995, 0.004247886625], 0, 1.2932651042938232, 1679480303.2684186], "version": 0.2, "tvm_version": "0.10.0"}
{"input": ["cuda -keys=cuda,gpu -arch=sm_75 -max_num_threads=1024 -thread_warp_size=32", "conv2d_nchw.cuda", [["TENSOR", [1, 288, 35, 35], "float32"], ["TENSOR", [64, 288, 1, 1], "float32"], [1, 1], [0, 0, 0, 0], [1, 1], "float32"], {}], "config": {"index": 387072, "code_hash": null, "entity": [["tile_f", "sp", [-1, 1, 1, 1]], ["tile_y", "sp", [-1, 1, 1, 1]], ["tile_x", "sp", [-1, 1, 1, 1]], ["tile_rc", "sp", [-1, 1]], ["tile_ry", "sp", [-1, 1]], ["tile_rx", "sp", [-1, 1]], ["auto_unroll_max_step", "ot", 512], ["unroll_explicit", "ot", 0]]}, "result": [[0.00424755475, 0.004247788083333334, 0.004248061166666667], 0, 1.2880654335021973, 1679480304.1326697], "version": 0.2, "tvm_version": "0.10.0"}
{"input": ["cuda -keys=cuda,gpu -arch=sm_75 -max_num_threads=1024 -thread_warp_size=32", "conv2d_nchw.cuda", [["TENSOR", [1, 288, 35, 35], "float32"], ["TENSOR", [64, 288, 1, 1], "float32"], [1, 1], [0, 0, 0, 0], [1, 1], "float32"], {}], "config": {"index": 21504, "code_hash": null, "entity": [["tile_f", "sp", [-1, 1, 1, 1]], ["tile_y", "sp", [-1, 1, 1, 1]], ["tile_x", "sp", [-1, 1, 1, 1]], ["tile_rc", "sp", [-1, 2]], ["tile_ry", "sp", [-1, 1]], ["tile_rx", "sp", [-1, 1]], ["auto_unroll_max_step", "ot", 0], ["unroll_explicit", "ot", 0]]}, "result": [[0.011306553222222222, 0.011307320444444444, 0.011307686666666667], 0, 1.408728837966919, 1679480305.014928], "version": 0.2, "tvm_version": "0.10.0"}
{"input": ["cuda -keys=cuda,gpu -arch=sm_75 -max_num_threads=1024 -thread_warp_size=32", "conv2d_nchw.cuda", [["TENSOR", [1, 288, 35, 35], "float32"], ["TENSOR", [64, 288, 1, 1], "float32"], [1, 1], [0, 0, 0, 0], [1, 1], "float32"], {}], "config": {"index": 1344, "code_hash": null, "entity": [["tile_f", "sp", [-1, 1, 1, 1]], ["tile_y", "sp", [-1, 1, 1, 1]], ["tile_x", "sp", [-1, 5, 1, 1]], ["tile_rc", "sp", [-1, 1]], ["tile_ry", "sp", [-1, 1]], ["tile_rx", "sp", [-1, 1]], ["auto_unroll_max_step", "ot", 0], ["unroll_explicit", "ot", 0]]}, "result": [[0.006174814058823529, 0.0061753355882352935, 0.006175683823529412], 0, 1.3170607089996338, 1679480305.8956056], "version": 0.2, "tvm_version": "0.10.0"}
{"input": ["cuda -keys=cuda,gpu -arch=sm_75 -max_num_threads=1024 -thread_warp_size=32", "conv2d_nchw.cuda", [["TENSOR", [1, 288, 35, 35], "float32"], ["TENSOR", [64, 288, 1, 1], "float32"], [1, 1], [0, 0, 0, 0], [1, 1], "float32"], {}], "config": {"index": 84, "code_hash": null, "entity": [["tile_f", "sp", [-1, 1, 1, 1]], ["tile_y", "sp", [-1, 5, 1, 1]], ["tile_x", "sp", [-1, 1, 1, 1]], ["tile_rc", "sp", [-1, 1]], ["tile_ry", "sp", [-1, 1]], ["tile_rx", "sp", [-1, 1]], ["auto_unroll_max_step", "ot", 0], ["unroll_explicit", "ot", 0]]}, "result": [[0.006145325117647059, 0.0061455737647058825, 0.006145807117647058], 0, 1.339601993560791, 1679480306.7792196], "version": 0.2, "tvm_version": "0.10.0"}
{"input": ["cuda -keys=cuda,gpu -arch=sm_75 -max_num_threads=1024 -thread_warp_size=32", "conv2d_nchw.cuda", [["TENSOR", [1, 288, 35, 35], "float32"], ["TENSOR", [64, 288, 1, 1], "float32"], [1, 1], [0, 0, 0, 0], [1, 1], "float32"], {}], "config": {"index": 1, "code_hash": null, "entity": [["tile_f", "sp", [-1, 2, 1, 1]], ["tile_y", "sp", [-1, 1, 1, 1]], ["tile_x", "sp", [-1, 1, 1, 1]], ["tile_rc", "sp", [-1, 1]], ["tile_ry", "sp", [-1, 1]], ["tile_rx", "sp", [-1, 1]], ["auto_unroll_max_step", "ot", 0], ["unroll_explicit", "ot", 0]]}, "result": [[0.0110272605, 0.0110274559, 0.0110280929], 0, 1.3516521453857422, 1679480307.7092698], "version": 0.2, "tvm_version": "0.10.0"}
{"input": ["cuda -keys=cuda,gpu -arch=sm_75 -max_num_threads=1024 -thread_warp_size=32", "conv2d_nchw.cuda", [["TENSOR", [1, 288, 35, 35], "float32"], ["TENSOR", [64, 288, 1, 1], "float32"], [1, 1], [0, 0, 0, 0], [1, 1], "float32"], {}], "config": {"index": 774144, "code_hash": null, "entity": [["tile_f", "sp", [-1, 1, 1, 1]], ["tile_y", "sp", [-1, 1, 1, 1]], ["tile_x", "sp", [-1, 1, 1, 1]], ["tile_rc", "sp", [-1, 1]], ["tile_ry", "sp", [-1, 1]], ["tile_rx", "sp", [-1, 1]], ["auto_unroll_max_step", "ot", 1500], ["unroll_explicit", "ot", 0]]}, "result": [[0.0042871545, 0.004288341166666667, 0.004289185166666667], 0, 1.700650691986084, 1679480308.5856776], "version": 0.2, "tvm_version": "0.10.0"}
{"input": ["cuda -keys=cuda,gpu -arch=sm_75 -max_num_threads=1024 -thread_warp_size=32", "conv2d_nchw.cuda", [["TENSOR", [1, 288, 35, 35], "float32"], ["TENSOR", [64, 288, 1, 1], "float32"], [1, 1], [0, 0, 0, 0], [1, 1], "float32"], {}], "config": {"index": 43008, "code_hash": null, "entity": [["tile_f", "sp", [-1, 1, 1, 1]], ["tile_y", "sp", [-1, 1, 1, 1]], ["tile_x", "sp", [-1, 1, 1, 1]], ["tile_rc", "sp", [-1, 3]], ["tile_ry", "sp", [-1, 1]], ["tile_rx", "sp", [-1, 1]], ["auto_unroll_max_step", "ot", 0], ["unroll_explicit", "ot", 0]]}, "result": [[0.009917026818181818, 0.009917533090909092, 0.009918463909090909], 0, 1.4549217224121094, 1679480309.510332], "version": 0.2, "tvm_version": "0.10.0"}
{"input": ["cuda -keys=cuda,gpu -arch=sm_75 -max_num_threads=1024 -thread_warp_size=32", "conv2d_nchw.cuda", [["TENSOR", [1, 288, 35, 35], "float32"], ["TENSOR", [64, 288, 1, 1], "float32"], [1, 1], [0, 0, 0, 0], [1, 1], "float32"], {}], "config": {"index": 2688, "code_hash": null, "entity": [["tile_f", "sp", [-1, 1, 1, 1]], ["tile_y", "sp", [-1, 1, 1, 1]], ["tile_x", "sp", [-1, 7, 1, 1]], ["tile_rc", "sp", [-1, 1]], ["tile_ry", "sp", [-1, 1]], ["tile_rx", "sp", [-1, 1]], ["auto_unroll_max_step", "ot", 0], ["unroll_explicit", "ot", 0]]}, "result": [[0.0051008094499999995, 0.00510095365, 0.00510139995], 0, 1.3084633350372314, 1679480310.3683877], "version": 0.2, "tvm_version": "0.10.0"}
{"input": ["cuda -keys=cuda,gpu -arch=sm_75 -max_num_threads=1024 -thread_warp_size=32", "conv2d_nchw.cuda", [["TENSOR", [1, 288, 35, 35], "float32"], ["TENSOR", [64, 288, 1, 1], "float32"], [1, 1], [0, 0, 0, 0], [1, 1], "float32"], {}], "config": {"index": 168, "code_hash": null, "entity": [["tile_f", "sp", [-1, 1, 1, 1]], ["tile_y", "sp", [-1, 7, 1, 1]], ["tile_x", "sp", [-1, 1, 1, 1]], ["tile_rc", "sp", [-1, 1]], ["tile_ry", "sp", [-1, 1]], ["tile_rx", "sp", [-1, 1]], ["auto_unroll_max_step", "ot", 0], ["unroll_explicit", "ot", 0]]}, "result": [[0.00508160015, 0.0050819103, 0.0050822368500000005], 0, 1.3207151889801025, 1679480311.2421393], "version": 0.2, "tvm_version": "0.10.0"}
{"input": ["cuda -keys=cuda,gpu -arch=sm_75 -max_num_threads=1024 -thread_warp_size=32", "conv2d_nchw.cuda", [["TENSOR", [1, 288, 35, 35], "float32"], ["TENSOR", [64, 288, 1, 1], "float32"], [1, 1], [0, 0, 0, 0], [1, 1], "float32"], {}], "config": {"index": 2, "code_hash": null, "entity": [["tile_f", "sp", [-1, 4, 1, 1]], ["tile_y", "sp", [-1, 1, 1, 1]], ["tile_x", "sp", [-1, 1, 1, 1]], ["tile_rc", "sp", [-1, 1]], ["tile_ry", "sp", [-1, 1]], ["tile_rx", "sp", [-1, 1]], ["auto_unroll_max_step", "ot", 0], ["unroll_explicit", "ot", 0]]}, "result": [[0.006887684066666667, 0.006887953133333334, 0.0068879552], 0, 1.3520722389221191, 1679480312.141185], "version": 0.2, "tvm_version": "0.10.0"}
{"input": ["cuda -keys=cuda,gpu -arch=sm_75 -max_num_threads=1024 -thread_warp_size=32", "conv2d_nchw.cuda", [["TENSOR", [1, 288, 35, 35], "float32"], ["TENSOR", [64, 288, 1, 1], "float32"], [1, 1], [0, 0, 0, 0], [1, 1], "float32"], {}], "config": {"index": 64512, "code_hash": null, "entity": [["tile_f", "sp", [-1, 1, 1, 1]], ["tile_y", "sp", [-1, 1, 1, 1]], ["tile_x", "sp", [-1, 1, 1, 1]], ["tile_rc", "sp", [-1, 4]], ["tile_ry", "sp", [-1, 1]], ["tile_rx", "sp", [-1, 1]], ["auto_unroll_max_step", "ot", 0], ["unroll_explicit", "ot", 0]]}, "result": [[0.008464117, 0.00846473625, 0.00846523725], 0, 1.3722996711730957, 1679480313.0169733], "version": 0.2, "tvm_version": "0.10.0"}
{"input": ["cuda -keys=cuda,gpu -arch=sm_75 -max_num_threads=1024 -thread_warp_size=32", "conv2d_nchw.cuda", [["TENSOR", [1, 288, 35, 35], "float32"], ["TENSOR", [64, 288, 1, 1], "float32"], [1, 1], [0, 0, 0, 0], [1, 1], "float32"], {}], "config": {"index": 4032, "code_hash": null, "entity": [["tile_f", "sp", [-1, 1, 1, 1]], ["tile_y", "sp", [-1, 1, 1, 1]], ["tile_x", "sp", [-1, 35, 1, 1]], ["tile_rc", "sp", [-1, 1]], ["tile_ry", "sp", [-1, 1]], ["tile_rx", "sp", [-1, 1]], ["auto_unroll_max_step", "ot", 0], ["unroll_explicit", "ot", 0]]}, "result": [[0.0035031469655172416, 0.003503248517241379, 0.00350697824137931], 0, 1.3433794975280762, 1679480313.8784158], "version": 0.2, "tvm_version": "0.10.0"}
{"input": ["cuda -keys=cuda,gpu -arch=sm_75 -max_num_threads=1024 -thread_warp_size=32", "conv2d_nchw.cuda", [["TENSOR", [1, 288, 35, 35], "float32"], ["TENSOR", [64, 288, 1, 1], "float32"], [1, 1], [0, 0, 0, 0], [1, 1], "float32"], {}], "config": {"index": 252, "code_hash": null, "entity": [["tile_f", "sp", [-1, 1, 1, 1]], ["tile_y", "sp", [-1, 35, 1, 1]], ["tile_x", "sp", [-1, 1, 1, 1]], ["tile_rc", "sp", [-1, 1]], ["tile_ry", "sp", [-1, 1]], ["tile_rx", "sp", [-1, 1]], ["auto_unroll_max_step", "ot", 0], ["unroll_explicit", "ot", 0]]}, "result": [[0.003469850448275862, 0.003469914379310345, 0.0034699906896551724], 0, 1.3120205402374268, 1679480314.7290986], "version": 0.2, "tvm_version": "0.10.0"}
{"input": ["cuda -keys=cuda,gpu -arch=sm_75 -max_num_threads=1024 -thread_warp_size=32", "conv2d_nchw.cuda", [["TENSOR", [1, 288, 35, 35], "float32"], ["TENSOR", [64, 288, 1, 1], "float32"], [1, 1], [0, 0, 0, 0], [1, 1], "float32"], {}], "config": {"index": 3, "code_hash": null, "entity": [["tile_f", "sp", [-1, 8, 1, 1]], ["tile_y", "sp", [-1, 1, 1, 1]], ["tile_x", "sp", [-1, 1, 1, 1]], ["tile_rc", "sp", [-1, 1]], ["tile_ry", "sp", [-1, 1]], ["tile_rx", "sp", [-1, 1]], ["auto_unroll_max_step", "ot", 0], ["unroll_explicit", "ot", 0]]}, "result": [[0.004825185476190476, 0.004825289, 0.004825542238095238], 0, 1.2958285808563232, 1679480315.584925], "version": 0.2, "tvm_version": "0.10.0"}
{"input": ["cuda -keys=cuda,gpu -arch=sm_75 -max_num_threads=1024 -thread_warp_size=32", "conv2d_nchw.cuda", [["TENSOR", [1, 288, 35, 35], "float32"], ["TENSOR", [64, 288, 1, 1], "float32"], [1, 1], [0, 0, 0, 0], [1, 1], "float32"], {}], "config": {"index": 820010, "code_hash": null, "entity": [["tile_f", "sp", [-1, 4, 1, 1]], ["tile_y", "sp", [-1, 7, 1, 1]], ["tile_x", "sp", [-1, 7, 1, 1]], ["tile_rc", "sp", [-1, 3]], ["tile_ry", "sp", [-1, 1]], ["tile_rx", "sp", [-1, 1]], ["auto_unroll_max_step", "ot", 1500], ["unroll_explicit", "ot", 0]]}, "result": [[0.0009747205118110237, 0.0009750405196850394, 0.0009753569921259844], 0, 2.284201145172119, 1679480326.7266686], "version": 0.2, "tvm_version": "0.10.0"}
{"input": ["cuda -keys=cuda,gpu -arch=sm_75 -max_num_threads=1024 -thread_warp_size=32", "conv2d_nchw.cuda", [["TENSOR", [1, 288, 35, 35], "float32"], ["TENSOR", [64, 288, 1, 1], "float32"], [1, 1], [0, 0, 0, 0], [1, 1], "float32"], {}], "config": {"index": 1958293, "code_hash": null, "entity": [["tile_f", "sp", [-1, 2, 1, 1]], ["tile_y", "sp", [-1, 5, 1, 1]], ["tile_x", "sp", [-1, 5, 1, 1]], ["tile_rc", "sp", [-1, 2]], ["tile_ry", "sp", [-1, 1]], ["tile_rx", "sp", [-1, 1]], ["auto_unroll_max_step", "ot", 1500], ["unroll_explicit", "ot", 1]]}, "result": [[0.0018217146363636364, 0.0018219752909090909, 0.0018220415818181817], 0, 1.4444177150726318, 1679480327.5745635], "version": 0.2, "tvm_version": "0.10.0"}
{"input": ["cuda -keys=cuda,gpu -arch=sm_75 -max_num_threads=1024 -thread_warp_size=32", "conv2d_nchw.cuda", [["TENSOR", [1, 288, 35, 35], "float32"], ["TENSOR", [64, 288, 1, 1], "float32"], [1, 1], [0, 0, 0, 0], [1, 1], "float32"], {}], "config": {"index": 1657237, "code_hash": null, "entity": [["tile_f", "sp", [-1, 2, 1, 1]], ["tile_y", "sp", [-1, 5, 1, 1]], ["tile_x", "sp", [-1, 5, 1, 1]], ["tile_rc", "sp", [-1, 8]], ["tile_ry", "sp", [-1, 1]], ["tile_rx", "sp", [-1, 1]], ["auto_unroll_max_step", "ot", 512], ["unroll_explicit", "ot", 1]]}, "result": [[0.0016882335500000001, 0.0016882704333333334, 0.001688296], 0, 1.9319190979003906, 1679480328.4257302], "version": 0.2, "tvm_version": "0.10.0"}
{"input": ["cuda -keys=cuda,gpu -arch=sm_75 -max_num_threads=1024 -thread_warp_size=32", "conv2d_nchw.cuda", [["TENSOR", [1, 288, 35, 35], "float32"], ["TENSOR", [64, 288, 1, 1], "float32"], [1, 1], [0, 0, 0, 0], [1, 1], "float32"], {}], "config": {"index": 1576597, "code_hash": null, "entity": [["tile_f", "sp", [-1, 2, 1, 1]], ["tile_y", "sp", [-1, 5, 1, 1]], ["tile_x", "sp", [-1, 7, 5, 1]], ["tile_rc", "sp", [-1, 2]], ["tile_ry", "sp", [-1, 1]], ["tile_rx", "sp", [-1, 1]], ["auto_unroll_max_step", "ot", 512], ["unroll_explicit", "ot", 1]]}, "result": [[0.0008935174196428571, 0.0008935999821428571, 0.0008936394196428571], 0, 1.6994373798370361, 1679480329.2807539], "version": 0.2, "tvm_version": "0.10.0"}
{"input": ["cuda -keys=cuda,gpu -arch=sm_75 -max_num_threads=1024 -thread_warp_size=32", "conv2d_nchw.cuda", [["TENSOR", [1, 288, 35, 35], "float32"], ["TENSOR", [64, 288, 1, 1], "float32"], [1, 1], [0, 0, 0, 0], [1, 1], "float32"], {}], "config": {"index": 1571557, "code_hash": null, "entity": [["tile_f", "sp", [-1, 2, 1, 1]], ["tile_y", "sp", [-1, 7, 5, 1]], ["tile_x", "sp", [-1, 5, 1, 1]], ["tile_rc", "sp", [-1, 2]], ["tile_ry", "sp", [-1, 1]], ["tile_rx", "sp", [-1, 1]], ["auto_unroll_max_step", "ot", 512], ["unroll_explicit", "ot", 1]]}, "result": [[0.0008575860683760684, 0.0008579369487179487, 0.0008580521111111112], 0, 1.700681209564209, 1679480330.1363854], "version": 0.2, "tvm_version": "0.10.0"}
{"input": ["cuda -keys=cuda,gpu -arch=sm_75 -max_num_threads=1024 -thread_warp_size=32", "conv2d_nchw.cuda", [["TENSOR", [1, 288, 35, 35], "float32"], ["TENSOR", [64, 288, 1, 1], "float32"], [1, 1], [0, 0, 0, 0], [1, 1], "float32"], {}], "config": {"index": 1571225, "code_hash": null, "entity": [["tile_f", "sp", [-1, 32, 1, 1]], ["tile_y", "sp", [-1, 5, 1, 1]], ["tile_x", "sp", [-1, 5, 1, 1]], ["tile_rc", "sp", [-1, 2]], ["tile_ry", "sp", [-1, 1]], ["tile_rx", "sp", [-1, 1]], ["auto_unroll_max_step", "ot", 512], ["unroll_explicit", "ot", 1]]}, "result": [[0.03476000966666667, 0.03476617666666667, 0.034777697], 0, 4.689757347106934, 1679480331.1054177], "version": 0.2, "tvm_version": "0.10.0"}
{"input": ["cuda -keys=cuda,gpu -arch=sm_75 -max_num_threads=1024 -thread_warp_size=32", "conv2d_nchw.cuda", [["TENSOR", [1, 288, 35, 35], "float32"], ["TENSOR", [64, 288, 1, 1], "float32"], [1, 1], [0, 0, 0, 0], [1, 1], "float32"], {}], "config": {"index": 410005, "code_hash": null, "entity": [["tile_f", "sp", [-1, 2, 1, 1]], ["tile_y", "sp", [-1, 5, 1, 1]], ["tile_x", "sp", [-1, 5, 1, 1]], ["tile_rc", "sp", [-1, 2]], ["tile_ry", "sp", [-1, 1]], ["tile_rx", "sp", [-1, 1]], ["auto_unroll_max_step", "ot", 512], ["unroll_explicit", "ot", 0]]}, "result": [[0.001820895381818182, 0.0018211403454545453, 0.001821230509090909], 0, 1.4456150531768799, 1679480331.9455357], "version": 0.2, "tvm_version": "0.10.0"}
{"input": ["cuda -keys=cuda,gpu -arch=sm_75 -max_num_threads=1024 -thread_warp_size=32", "conv2d_nchw.cuda", [["TENSOR", [1, 288, 35, 35], "float32"], ["TENSOR", [64, 288, 1, 1], "float32"], [1, 1], [0, 0, 0, 0], [1, 1], "float32"], {}], "config": {"index": 1184149, "code_hash": null, "entity": [["tile_f", "sp", [-1, 2, 1, 1]], ["tile_y", "sp", [-1, 5, 1, 1]], ["tile_x", "sp", [-1, 5, 1, 1]], ["tile_rc", "sp", [-1, 2]], ["tile_ry", "sp", [-1, 1]], ["tile_rx", "sp", [-1, 1]], ["auto_unroll_max_step", "ot", 0], ["unroll_explicit", "ot", 1]]}, "result": [[0.0018386926727272728, 0.0018390633272727273, 0.0018391261636363635], 0, 1.4487440586090088, 1679480332.79785], "version": 0.2, "tvm_version": "0.10.0"}
{"input": ["cuda -keys=cuda,gpu -arch=sm_75 -max_num_threads=1024 -thread_warp_size=32", "conv2d_nchw.cuda", [["TENSOR", [1, 288, 35, 35], "float32"], ["TENSOR", [64, 288, 1, 1], "float32"], [1, 1], [0, 0, 0, 0], [1, 1], "float32"], {}], "config": {"index": 1678741, "code_hash": null, "entity": [["tile_f", "sp", [-1, 2, 1, 1]], ["tile_y", "sp", [-1, 5, 1, 1]], ["tile_x", "sp", [-1, 5, 1, 1]], ["tile_rc", "sp", [-1, 9]], ["tile_ry", "sp", [-1, 1]], ["tile_rx", "sp", [-1, 1]], ["auto_unroll_max_step", "ot", 512], ["unroll_explicit", "ot", 1]]}, "result": [[0.0016876543666666667, 0.0016876543666666667, 0.00168779195], 0, 2.057558059692383, 1679480333.6268778], "version": 0.2, "tvm_version": "0.10.0"}
{"input": ["cuda -keys=cuda,gpu -arch=sm_75 -max_num_threads=1024 -thread_warp_size=32", "conv2d_nchw.cuda", [["TENSOR", [1, 288, 35, 35], "float32"], ["TENSOR", [64, 288, 1, 1], "float32"], [1, 1], [0, 0, 0, 0], [1, 1], "float32"], {}], "config": {"index": 1577941, "code_hash": null, "entity": [["tile_f", "sp", [-1, 2, 1, 1]], ["tile_y", "sp", [-1, 5, 1, 1]], ["tile_x", "sp", [-1, 1, 7, 1]], ["tile_rc", "sp", [-1, 2]], ["tile_ry", "sp", [-1, 1]], ["tile_rx", "sp", [-1, 1]], ["auto_unroll_max_step", "ot", 512], ["unroll_explicit", "ot", 1]]}, "result": [[0.0008213636639344263, 0.0008215960491803278, 0.0008218184918032786], 0, 1.3677213191986084, 1679480334.4720538], "version": 0.2, "tvm_version": "0.10.0"}
{"input": ["cuda -keys=cuda,gpu -arch=sm_75 -max_num_threads=1024 -thread_warp_size=32", "conv2d_nchw.cuda", [["TENSOR", [1, 288, 35, 35], "float32"], ["TENSOR", [64, 288, 1, 1], "float32"], [1, 1], [0, 0, 0, 0], [1, 1], "float32"], {}], "config": {"index": 1571641, "code_hash": null, "entity": [["tile_f", "sp", [-1, 2, 1, 1]], ["tile_y", "sp", [-1, 1, 7, 1]], ["tile_x", "sp", [-1, 5, 1, 1]], ["tile_rc", "sp", [-1, 2]], ["tile_ry", "sp", [-1, 1]], ["tile_rx", "sp", [-1, 1]], ["auto_unroll_max_step", "ot", 512], ["unroll_explicit", "ot", 1]]}, "result": [[0.0008373792, 0.0008376490833333333, 0.0008380930500000001], 0, 1.3249144554138184, 1679480335.3170896], "version": 0.2, "tvm_version": "0.10.0"}
{"input": ["cuda -keys=cuda,gpu -arch=sm_75 -max_num_threads=1024 -thread_warp_size=32", "conv2d_nchw.cuda", [["TENSOR", [1, 288, 35, 35], "float32"], ["TENSOR", [64, 288, 1, 1], "float32"], [1, 1], [0, 0, 0, 0], [1, 1], "float32"], {}], "config": {"index": 1700245, "code_hash": null, "entity": [["tile_f", "sp", [-1, 2, 1, 1]], ["tile_y", "sp", [-1, 5, 1, 1]], ["tile_x", "sp", [-1, 5, 1, 1]], ["tile_rc", "sp", [-1, 12]], ["tile_ry", "sp", [-1, 1]], ["tile_rx", "sp", [-1, 1]], ["auto_unroll_max_step", "ot", 512], ["unroll_explicit", "ot", 1]]}, "result": [[0.0017074224067796608, 0.0017075677627118645, 0.0017076426271186442], 0, 2.0212996006011963, 1679480336.164676], "version": 0.2, "tvm_version": "0.10.0"}
{"input": ["cuda -keys=cuda,gpu -arch=sm_75 -max_num_threads=1024 -thread_warp_size=32", "conv2d_nchw.cuda", [["TENSOR", [1, 288, 35, 35], "float32"], ["TENSOR", [64, 288, 1, 1], "float32"], [1, 1], [0, 0, 0, 0], [1, 1], "float32"], {}], "config": {"index": 1579285, "code_hash": null, "entity": [["tile_f", "sp", [-1, 2, 1, 1]], ["tile_y", "sp", [-1, 5, 1, 1]], ["tile_x", "sp", [-1, 5, 7, 1]], ["tile_rc", "sp", [-1, 2]], ["tile_ry", "sp", [-1, 1]], ["tile_rx", "sp", [-1, 1]], ["auto_unroll_max_step", "ot", 512], ["unroll_explicit", "ot", 1]]}, "result": [[0.00071617965, 0.0007161817214285714, 0.0007161855928571429], 0, 1.6256179809570312, 1679480337.0132453], "version": 0.2, "tvm_version": "0.10.0"}
{"input": ["cuda -keys=cuda,gpu -arch=sm_75 -max_num_threads=1024 -thread_warp_size=32", "conv2d_nchw.cuda", [["TENSOR", [1, 288, 35, 35], "float32"], ["TENSOR", [64, 288, 1, 1], "float32"], [1, 1], [0, 0, 0, 0], [1, 1], "float32"], {}], "config": {"index": 1571725, "code_hash": null, "entity": [["tile_f", "sp", [-1, 2, 1, 1]], ["tile_y", "sp", [-1, 5, 7, 1]], ["tile_x", "sp", [-1, 5, 1, 1]], ["tile_rc", "sp", [-1, 2]], ["tile_ry", "sp", [-1, 1]], ["tile_rx", "sp", [-1, 1]], ["auto_unroll_max_step", "ot", 512], ["unroll_explicit", "ot", 1]]}, "result": [[0.0006647654752066116, 0.0006650036239669422, 0.0006650914586776859], 0, 1.9288451671600342, 1679480338.2610471], "version": 0.2, "tvm_version": "0.10.0"}
{"input": ["cuda -keys=cuda,gpu -arch=sm_75 -max_num_threads=1024 -thread_warp_size=32", "conv2d_nchw.cuda", [["TENSOR", [1, 288, 35, 35], "float32"], ["TENSOR", [64, 288, 1, 1], "float32"], [1, 1], [0, 0, 0, 0], [1, 1], "float32"], {}], "config": {"index": 1571227, "code_hash": null, "entity": [["tile_f", "sp", [-1, 1, 2, 1]], ["tile_y", "sp", [-1, 5, 1, 1]], ["tile_x", "sp", [-1, 5, 1, 1]], ["tile_rc", "sp", [-1, 2]], ["tile_ry", "sp", [-1, 1]], ["tile_rx", "sp", [-1, 1]], ["auto_unroll_max_step", "ot", 512], ["unroll_explicit", "ot", 1]]}, "result": [[0.001565482015625, 0.0015655864374999999, 0.001565600984375], 0, 1.3411176204681396, 1679480339.104455], "version": 0.2, "tvm_version": "0.10.0"}
{"input": ["cuda -keys=cuda,gpu -arch=sm_75 -max_num_threads=1024 -thread_warp_size=32", "conv2d_nchw.cuda", [["TENSOR", [1, 288, 35, 35], "float32"], ["TENSOR", [64, 288, 1, 1], "float32"], [1, 1], [0, 0, 0, 0], [1, 1], "float32"], {}], "config": {"index": 820514, "code_hash": null, "entity": [["tile_f", "sp", [-1, 4, 1, 1]], ["tile_y", "sp", [-1, 1, 35, 1]], ["tile_x", "sp", [-1, 7, 1, 1]], ["tile_rc", "sp", [-1, 3]], ["tile_ry", "sp", [-1, 1]], ["tile_rx", "sp", [-1, 1]], ["auto_unroll_max_step", "ot", 1500], ["unroll_explicit", "ot", 0]]}, "result": [[0.0003073844702970297, 0.00030751358415841585, 0.00032326953217821783], 0, 1.663661241531372, 1679480342.8508158], "version": 0.2, "tvm_version": "0.10.0"}
{"input": ["cuda -keys=cuda,gpu -arch=sm_75 -max_num_threads=1024 -thread_warp_size=32", "conv2d_nchw.cuda", [["TENSOR", [1, 288, 35, 35], "float32"], ["TENSOR", [64, 288, 1, 1], "float32"], [1, 1], [0, 0, 0, 0], [1, 1], "float32"], {}], "config": {"index": 410509, "code_hash": null, "entity": [["tile_f", "sp", [-1, 2, 1, 1]], ["tile_y", "sp", [-1, 5, 7, 1]], ["tile_x", "sp", [-1, 5, 1, 1]], ["tile_rc", "sp", [-1, 2]], ["tile_ry", "sp", [-1, 1]], ["tile_rx", "sp", [-1, 1]], ["auto_unroll_max_step", "ot", 512], ["unroll_explicit", "ot", 0]]}, "result": [[0.0006647133925619835, 0.0006649544421487602, 0.0006656828925619834], 0, 1.9070570468902588, 1679480344.04865], "version": 0.2, "tvm_version": "0.10.0"}
{"input": ["cuda -keys=cuda,gpu -arch=sm_75 -max_num_threads=1024 -thread_warp_size=32", "conv2d_nchw.cuda", [["TENSOR", [1, 288, 35, 35], "float32"], ["TENSOR", [64, 288, 1, 1], "float32"], [1, 1], [0, 0, 0, 0], [1, 1], "float32"], {}], "config": {"index": 1958797, "code_hash": null, "entity": [["tile_f", "sp", [-1, 2, 1, 1]], ["tile_y", "sp", [-1, 5, 7, 1]], ["tile_x", "sp", [-1, 5, 1, 1]], ["tile_rc", "sp", [-1, 2]], ["tile_ry", "sp", [-1, 1]], ["tile_rx", "sp", [-1, 1]], ["auto_unroll_max_step", "ot", 1500], ["unroll_explicit", "ot", 1]]}, "result": [[0.0006641394503311258, 0.000664582761589404, 0.0006646620331125828], 0, 1.596325159072876, 1679480344.8914878], "version": 0.2, "tvm_version": "0.10.0"}
{"input": ["cuda -keys=cuda,gpu -arch=sm_75 -max_num_threads=1024 -thread_warp_size=32", "conv2d_nchw.cuda", [["TENSOR", [1, 288, 35, 35], "float32"], ["TENSOR", [64, 288, 1, 1], "float32"], [1, 1], [0, 0, 0, 0], [1, 1], "float32"], {}], "config": {"index": 1722253, "code_hash": null, "entity": [["tile_f", "sp", [-1, 2, 1, 1]], ["tile_y", "sp", [-1, 5, 7, 1]], ["tile_x", "sp", [-1, 5, 1, 1]], ["tile_rc", "sp", [-1, 16]], ["tile_ry", "sp", [-1, 1]], ["tile_rx", "sp", [-1, 1]], ["auto_unroll_max_step", "ot", 512], ["unroll_explicit", "ot", 1]]}, "result": [[0.0010030212375, 0.0010042624437500002, 0.0010048383687499998], 0, 3.51548433303833, 1679480346.1328962], "version": 0.2, "tvm_version": "0.10.0"}
{"input": ["cuda -keys=cuda,gpu -arch=sm_75 -max_num_threads=1024 -thread_warp_size=32", "conv2d_nchw.cuda", [["TENSOR", [1, 288, 35, 35], "float32"], ["TENSOR", [64, 288, 1, 1], "float32"], [1, 1], [0, 0, 0, 0], [1, 1], "float32"], {}], "config": {"index": 1581133, "code_hash": null, "entity": [["tile_f", "sp", [-1, 2, 1, 1]], ["tile_y", "sp", [-1, 5, 7, 1]], ["tile_x", "sp", [-1, 1, 35, 1]], ["tile_rc", "sp", [-1, 2]], ["tile_ry", "sp", [-1, 1]], ["tile_rx", "sp", [-1, 1]], ["auto_unroll_max_step", "ot", 512], ["unroll_explicit", "ot", 1]]}, "result": [[0.00025588057987220445, 0.000255941517571885, 0.0002560666102236422], 0, 1.7861454486846924, 1679480347.379478], "version": 0.2, "tvm_version": "0.10.0"}
{"input": ["cuda -keys=cuda,gpu -arch=sm_75 -max_num_threads=1024 -thread_warp_size=32", "conv2d_nchw.cuda", [["TENSOR", [1, 288, 35, 35], "float32"], ["TENSOR", [64, 288, 1, 1], "float32"], [1, 1], [0, 0, 0, 0], [1, 1], "float32"], {}], "config": {"index": 1572313, "code_hash": null, "entity": [["tile_f", "sp", [-1, 2, 1, 1]], ["tile_y", "sp", [-1, 1, 5, 7]], ["tile_x", "sp", [-1, 5, 1, 1]], ["tile_rc", "sp", [-1, 2]], ["tile_ry", "sp", [-1, 1]], ["tile_rx", "sp", [-1, 1]], ["auto_unroll_max_step", "ot", 512], ["unroll_explicit", "ot", 1]]}, "result": [[0.0008566077435897436, 0.0008568342136752136, 0.0008581295128205127], 0, 1.672684669494629, 1679480348.2149644], "version": 0.2, "tvm_version": "0.10.0"}
{"input": ["cuda -keys=cuda,gpu -arch=sm_75 -max_num_threads=1024 -thread_warp_size=32", "conv2d_nchw.cuda", [["TENSOR", [1, 288, 35, 35], "float32"], ["TENSOR", [64, 288, 1, 1], "float32"], [1, 1], [0, 0, 0, 0], [1, 1], "float32"], {}], "config": {"index": 1571137, "code_hash": null, "entity": [["tile_f", "sp", [-1, 2, 1, 1]], ["tile_y", "sp", [-1, 1, 1, 1]], ["tile_x", "sp", [-1, 5, 1, 1]], ["tile_rc", "sp", [-1, 2]], ["tile_ry", "sp", [-1, 1]], ["tile_rx", "sp", [-1, 1]], ["auto_unroll_max_step", "ot", 512], ["unroll_explicit", "ot", 1]]}, "result": [[0.0027826230555555555, 0.002783175138888889, 0.0027884311666666666], 0, 1.3361146450042725, 1679480349.0560153], "version": 0.2, "tvm_version": "0.10.0"}
{"input": ["cuda -keys=cuda,gpu -arch=sm_75 -max_num_threads=1024 -thread_warp_size=32", "conv2d_nchw.cuda", [["TENSOR", [1, 288, 35, 35], "float32"], ["TENSOR", [64, 288, 1, 1], "float32"], [1, 1], [0, 0, 0, 0], [1, 1], "float32"], {}], "config": {"index": 1571732, "code_hash": null, "entity": [["tile_f", "sp", [-1, 2, 2, 1]], ["tile_y", "sp", [-1, 5, 7, 1]], ["tile_x", "sp", [-1, 5, 1, 1]], ["tile_rc", "sp", [-1, 2]], ["tile_ry", "sp", [-1, 1]], ["tile_rx", "sp", [-1, 1]], ["auto_unroll_max_step", "ot", 512], ["unroll_explicit", "ot", 1]]}, "result": [[0.00033109046817248464, 0.00033110886036960985, 0.000331127659137577], 0, 1.9649176597595215, 1679480350.3086987], "version": 0.2, "tvm_version": "0.10.0"}
{"input": ["cuda -keys=cuda,gpu -arch=sm_75 -max_num_threads=1024 -thread_warp_size=32", "conv2d_nchw.cuda", [["TENSOR", [1, 288, 35, 35], "float32"], ["TENSOR", [64, 288, 1, 1], "float32"], [1, 1], [0, 0, 0, 0], [1, 1], "float32"], {}], "config": {"index": 1184653, "code_hash": null, "entity": [["tile_f", "sp", [-1, 2, 1, 1]], ["tile_y", "sp", [-1, 5, 7, 1]], ["tile_x", "sp", [-1, 5, 1, 1]], ["tile_rc", "sp", [-1, 2]], ["tile_ry", "sp", [-1, 1]], ["tile_rx", "sp", [-1, 1]], ["auto_unroll_max_step", "ot", 0], ["unroll_explicit", "ot", 1]]}, "result": [[0.0006748366375838926, 0.0006748778523489933, 0.0006752111409395972], 0, 1.492366075515747, 1679480351.1615674], "version": 0.2, "tvm_version": "0.10.0"}
{"input": ["cuda -keys=cuda,gpu -arch=sm_75 -max_num_threads=1024 -thread_warp_size=32", "conv2d_nchw.cuda", [["TENSOR", [1, 288, 35, 35], "float32"], ["TENSOR", [64, 288, 1, 1], "float32"], [1, 1], [0, 0, 0, 0], [1, 1], "float32"], {}], "config": {"index": 1743757, "code_hash": null, "entity": [["tile_f", "sp", [-1, 2, 1, 1]], ["tile_y", "sp", [-1, 5, 7, 1]], ["tile_x", "sp", [-1, 5, 1, 1]], ["tile_rc", "sp", [-1, 18]], ["tile_ry", "sp", [-1, 1]], ["tile_rx", "sp", [-1, 1]], ["auto_unroll_max_step", "ot", 512], ["unroll_explicit", "ot", 1]]}, "result": [[0.00071588505, 0.0007160539285714286, 0.0007164219428571428], 0, 3.375640392303467, 1679480352.0098786], "version": 0.2, "tvm_version": "0.10.0"}
{"input": ["cuda -keys=cuda,gpu -arch=sm_75 -max_num_threads=1024 -thread_warp_size=32", "conv2d_nchw.cuda", [["TENSOR", [1, 288, 35, 35], "float32"], ["TENSOR", [64, 288, 1, 1], "float32"], [1, 1], [0, 0, 0, 0], [1, 1], "float32"], {}], "config": {"index": 1582477, "code_hash": null, "entity": [["tile_f", "sp", [-1, 2, 1, 1]], ["tile_y", "sp", [-1, 5, 7, 1]], ["tile_x", "sp", [-1, 1, 1, 5]], ["tile_rc", "sp", [-1, 2]], ["tile_ry", "sp", [-1, 1]], ["tile_rx", "sp", [-1, 1]], ["auto_unroll_max_step", "ot", 512], ["unroll_explicit", "ot", 1]]}, "result": [[0.0006642967634854772, 0.0006643508340248963, 0.000664753132780083], 0, 1.9965083599090576, 1679480353.2538476], "version": 0.2, "tvm_version": "0.10.0"}
{"input": ["cuda -keys=cuda,gpu -arch=sm_75 -max_num_threads=1024 -thread_warp_size=32", "conv2d_nchw.cuda", [["TENSOR", [1, 288, 35, 35], "float32"], ["TENSOR", [64, 288, 1, 1], "float32"], [1, 1], [0, 0, 0, 0], [1, 1], "float32"], {}], "config": {"index": 1572397, "code_hash": null, "entity": [["tile_f", "sp", [-1, 2, 1, 1]], ["tile_y", "sp", [-1, 1, 1, 35]], ["tile_x", "sp", [-1, 5, 1, 1]], ["tile_rc", "sp", [-1, 2]], ["tile_ry", "sp", [-1, 1]], ["tile_rx", "sp", [-1, 1]], ["auto_unroll_max_step", "ot", 512], ["unroll_explicit", "ot", 1]]}, "result": [[0.005313192263157895, 0.0053146658947368424, 0.005315487894736842], 0, 3.265578269958496, 1679480354.1210296], "version": 0.2, "tvm_version": "0.10.0"}
{"input": ["cuda -keys=cuda,gpu -arch=sm_75 -max_num_threads=1024 -thread_warp_size=32", "conv2d_nchw.cuda", [["TENSOR", [1, 288, 35, 35], "float32"], ["TENSOR", [64, 288, 1, 1], "float32"], [1, 1], [0, 0, 0, 0], [1, 1], "float32"], {}], "config": {"index": 1571733, "code_hash": null, "entity": [["tile_f", "sp", [-1, 4, 2, 1]], ["tile_y", "sp", [-1, 5, 7, 1]], ["tile_x", "sp", [-1, 5, 1, 1]], ["tile_rc", "sp", [-1, 2]], ["tile_ry", "sp", [-1, 1]], ["tile_rx", "sp", [-1, 1]], ["auto_unroll_max_step", "ot", 512], ["unroll_explicit", "ot", 1]]}, "result": [[0.00019668841104294478, 0.00019674066625766868, 0.00019679898650306748], 0, 2.077770471572876, 1679480355.3620687], "version": 0.2, "tvm_version": "0.10.0"}
{"input": ["cuda -keys=cuda,gpu -arch=sm_75 -max_num_threads=1024 -thread_warp_size=32", "conv2d_nchw.cuda", [["TENSOR", [1, 288, 35, 35], "float32"], ["TENSOR", [64, 288, 1, 1], "float32"], [1, 1], [0, 0, 0, 0], [1, 1], "float32"], {}], "config": {"index": 1765261, "code_hash": null, "entity": [["tile_f", "sp", [-1, 2, 1, 1]], ["tile_y", "sp", [-1, 5, 7, 1]], ["tile_x", "sp", [-1, 5, 1, 1]], ["tile_rc", "sp", [-1, 24]], ["tile_ry", "sp", [-1, 1]], ["tile_rx", "sp", [-1, 1]], ["auto_unroll_max_step", "ot", 512], ["unroll_explicit", "ot", 1]]}, "result": [[0.00406429684, 0.0040655206, 0.00406578184], 0, 1.5225520133972168, 1679480356.2205071], "version": 0.2, "tvm_version": "0.10.0"}
{"input": ["cuda -keys=cuda,gpu -arch=sm_75 -max_num_threads=1024 -thread_warp_size=32", "conv2d_nchw.cuda", [["TENSOR", [1, 288, 35, 35], "float32"], ["TENSOR", [64, 288, 1, 1], "float32"], [1, 1], [0, 0, 0, 0], [1, 1], "float32"], {}], "config": {"index": 1583821, "code_hash": null, "entity": [["tile_f", "sp", [-1, 2, 1, 1]], ["tile_y", "sp", [-1, 5, 7, 1]], ["tile_x", "sp", [-1, 7, 1, 5]], ["tile_rc", "sp", [-1, 2]], ["tile_ry", "sp", [-1, 1]], ["tile_rx", "sp", [-1, 1]], ["auto_unroll_max_step", "ot", 512], ["unroll_explicit", "ot", 1]]}, "result": [[0.0029546616470588235, 0.0029551586764705886, 0.0029554108823529415], 0, 3.0941526889801025, 1679480357.0769637], "version": 0.2, "tvm_version": "0.10.0"}
{"input": ["cuda -keys=cuda,gpu -arch=sm_75 -max_num_threads=1024 -thread_warp_size=32", "conv2d_nchw.cuda", [["TENSOR", [1, 288, 35, 35], "float32"], ["TENSOR", [64, 288, 1, 1], "float32"], [1, 1], [0, 0, 0, 0], [1, 1], "float32"], {}], "config": {"index": 1571734, "code_hash": null, "entity": [["tile_f", "sp", [-1, 8, 2, 1]], ["tile_y", "sp", [-1, 5, 7, 1]], ["tile_x", "sp", [-1, 5, 1, 1]], ["tile_rc", "sp", [-1, 2]], ["tile_ry", "sp", [-1, 1]], ["tile_rx", "sp", [-1, 1]], ["auto_unroll_max_step", "ot", 512], ["unroll_explicit", "ot", 1]]}, "result": [[0.0001723066192513369, 0.00017235618181818182, 0.0001723654513368984], 0, 2.188903570175171, 1679480358.3223562], "version": 0.2, "tvm_version": "0.10.0"}
{"input": ["cuda -keys=cuda,gpu -arch=sm_75 -max_num_threads=1024 -thread_warp_size=32", "conv2d_nchw.cuda", [["TENSOR", [1, 288, 35, 35], "float32"], ["TENSOR", [64, 288, 1, 1], "float32"], [1, 1], [0, 0, 0, 0], [1, 1], "float32"], {}], "config": {"index": 820523, "code_hash": null, "entity": [["tile_f", "sp", [-1, 16, 2, 1]], ["tile_y", "sp", [-1, 1, 35, 1]], ["tile_x", "sp", [-1, 7, 1, 1]], ["tile_rc", "sp", [-1, 3]], ["tile_ry", "sp", [-1, 1]], ["tile_rx", "sp", [-1, 1]], ["auto_unroll_max_step", "ot", 1500], ["unroll_explicit", "ot", 0]]}, "result": [[0.000135754194092827, 0.00013576006962025315, 0.00013780870675105485], 0, 1.8143417835235596, 1679480369.5350118], "version": 0.2, "tvm_version": "0.10.0"}
{"input": ["cuda -keys=cuda,gpu -arch=sm_75 -max_num_threads=1024 -thread_warp_size=32", "conv2d_nchw.cuda", [["TENSOR", [1, 288, 35, 35], "float32"], ["TENSOR", [64, 288, 1, 1], "float32"], [1, 1], [0, 0, 0, 0], [1, 1], "float32"], {}], "config": {"index": 1958806, "code_hash": null, "entity": [["tile_f", "sp", [-1, 8, 2, 1]], ["tile_y", "sp", [-1, 5, 7, 1]], ["tile_x", "sp", [-1, 5, 1, 1]], ["tile_rc", "sp", [-1, 2]], ["tile_ry", "sp", [-1, 1]], ["tile_rx", "sp", [-1, 1]], ["auto_unroll_max_step", "ot", 1500], ["unroll_explicit", "ot", 1]]}, "result": [[0.00017216242594594595, 0.00017221902378378377, 0.00017222233945945946], 0, 2.787041425704956, 1679480370.77551], "version": 0.2, "tvm_version": "0.10.0"}
{"input": ["cuda -keys=cuda,gpu -arch=sm_75 -max_num_threads=1024 -thread_warp_size=32", "conv2d_nchw.cuda", [["TENSOR", [1, 288, 35, 35], "float32"], ["TENSOR", [64, 288, 1, 1], "float32"], [1, 1], [0, 0, 0, 0], [1, 1], "float32"], {}], "config": {"index": 1786774, "code_hash": null, "entity": [["tile_f", "sp", [-1, 8, 2, 1]], ["tile_y", "sp", [-1, 5, 7, 1]], ["tile_x", "sp", [-1, 5, 1, 1]], ["tile_rc", "sp", [-1, 32]], ["tile_ry", "sp", [-1, 1]], ["tile_rx", "sp", [-1, 1]], ["auto_unroll_max_step", "ot", 512], ["unroll_explicit", "ot", 1]]}, "result": [[0.00029996145065176906, 0.00029996329795158283, 0.00029996489013035376], 0, 4.605802774429321, 1679480372.0212204], "version": 0.2, "tvm_version": "0.10.0"}
{"input": ["cuda -keys=cuda,gpu -arch=sm_75 -max_num_threads=1024 -thread_warp_size=32", "conv2d_nchw.cuda", [["TENSOR", [1, 288, 35, 35], "float32"], ["TENSOR", [64, 288, 1, 1], "float32"], [1, 1], [0, 0, 0, 0], [1, 1], "float32"], {}], "config": {"index": 1585174, "code_hash": null, "entity": [["tile_f", "sp", [-1, 8, 2, 1]], ["tile_y", "sp", [-1, 5, 7, 1]], ["tile_x", "sp", [-1, 1, 7, 5]], ["tile_rc", "sp", [-1, 2]], ["tile_ry", "sp", [-1, 1]], ["tile_rx", "sp", [-1, 1]], ["auto_unroll_max_step", "ot", 512], ["unroll_explicit", "ot", 1]]}, "result": [[0.00020521038676844783, 0.00020521399745547075, 0.00020521535623409668], 0, 2.72271728515625, 1679480373.265974], "version": 0.2, "tvm_version": "0.10.0"}
{"input": ["cuda -keys=cuda,gpu -arch=sm_75 -max_num_threads=1024 -thread_warp_size=32", "conv2d_nchw.cuda", [["TENSOR", [1, 288, 35, 35], "float32"], ["TENSOR", [64, 288, 1, 1], "float32"], [1, 1], [0, 0, 0, 0], [1, 1], "float32"], {}], "config": {"index": 1571230, "code_hash": null, "entity": [["tile_f", "sp", [-1, 8, 2, 1]], ["tile_y", "sp", [-1, 5, 1, 1]], ["tile_x", "sp", [-1, 5, 1, 1]], ["tile_rc", "sp", [-1, 2]], ["tile_ry", "sp", [-1, 1]], ["tile_rx", "sp", [-1, 1]], ["auto_unroll_max_step", "ot", 512], ["unroll_explicit", "ot", 1]]}, "result": [[0.00038288278707224334, 0.0003829107794676806, 0.00038360517110266163], 0, 2.4316904544830322, 1679480374.1173327], "version": 0.2, "tvm_version": "0.10.0"}
{"input": ["cuda -keys=cuda,gpu -arch=sm_75 -max_num_threads=1024 -thread_warp_size=32", "conv2d_nchw.cuda", [["TENSOR", [1, 288, 35, 35], "float32"], ["TENSOR", [64, 288, 1, 1], "float32"], [1, 1], [0, 0, 0, 0], [1, 1], "float32"], {}], "config": {"index": 1571744, "code_hash": null, "entity": [["tile_f", "sp", [-1, 4, 8, 1]], ["tile_y", "sp", [-1, 5, 7, 1]], ["tile_x", "sp", [-1, 5, 1, 1]], ["tile_rc", "sp", [-1, 2]], ["tile_ry", "sp", [-1, 1]], ["tile_rx", "sp", [-1, 1]], ["auto_unroll_max_step", "ot", 512], ["unroll_explicit", "ot", 1]]}, "result": [[0.00015576937000973712, 0.00015577565433300876, 0.00015578786757546248], 0, 2.0934739112854004, 1679480375.363807], "version": 0.2, "tvm_version": "0.10.0"}
{"input": ["cuda -keys=cuda,gpu -arch=sm_75 -max_num_threads=1024 -thread_warp_size=32", "conv2d_nchw.cuda", [["TENSOR", [1, 288, 35, 35], "float32"], ["TENSOR", [64, 288, 1, 1], "float32"], [1, 1], [0, 0, 0, 0], [1, 1], "float32"], {}], "config": {"index": 1571724, "code_hash": null, "entity": [["tile_f", "sp", [-1, 1, 1, 1]], ["tile_y", "sp", [-1, 5, 7, 1]], ["tile_x", "sp", [-1, 5, 1, 1]], ["tile_rc", "sp", [-1, 2]], ["tile_ry", "sp", [-1, 1]], ["tile_rx", "sp", [-1, 1]], ["auto_unroll_max_step", "ot", 512], ["unroll_explicit", "ot", 1]]}, "result": [[0.0012850301666666667, 0.0012858842692307691, 0.0012861185256410257], 0, 1.438523769378662, 1679480376.2118711], "version": 0.2, "tvm_version": "0.10.0"}
{"input": ["cuda -keys=cuda,gpu -arch=sm_75 -max_num_threads=1024 -thread_warp_size=32", "conv2d_nchw.cuda", [["TENSOR", [1, 288, 35, 35], "float32"], ["TENSOR", [64, 288, 1, 1], "float32"], [1, 1], [0, 0, 0, 0], [1, 1], "float32"], {}], "config": {"index": 410518, "code_hash": null, "entity": [["tile_f", "sp", [-1, 8, 2, 1]], ["tile_y", "sp", [-1, 5, 7, 1]], ["tile_x", "sp", [-1, 5, 1, 1]], ["tile_rc", "sp", [-1, 2]], ["tile_ry", "sp", [-1, 1]], ["tile_rx", "sp", [-1, 1]], ["auto_unroll_max_step", "ot", 512], ["unroll_explicit", "ot", 0]]}, "result": [[0.00017302176267529665, 0.00017302865911542612, 0.00017303929234088457], 0, 2.542848825454712, 1679480377.453119], "version": 0.2, "tvm_version": "0.10.0"}
{"input": ["cuda -keys=cuda,gpu -arch=sm_75 -max_num_threads=1024 -thread_warp_size=32", "conv2d_nchw.cuda", [["TENSOR", [1, 288, 35, 35], "float32"], ["TENSOR", [64, 288, 1, 1], "float32"], [1, 1], [0, 0, 0, 0], [1, 1], "float32"], {}], "config": {"index": 1184662, "code_hash": null, "entity": [["tile_f", "sp", [-1, 8, 2, 1]], ["tile_y", "sp", [-1, 5, 7, 1]], ["tile_x", "sp", [-1, 5, 1, 1]], ["tile_rc", "sp", [-1, 2]], ["tile_ry", "sp", [-1, 1]], ["tile_rx", "sp", [-1, 1]], ["auto_unroll_max_step", "ot", 0], ["unroll_explicit", "ot", 1]]}, "result": [[0.00018026797175141245, 0.00018028181581920905, 0.0001802910406779661], 0, 2.403794050216675, 1679480378.6916902], "version": 0.2, "tvm_version": "0.10.0"}
{"input": ["cuda -keys=cuda,gpu -arch=sm_75 -max_num_threads=1024 -thread_warp_size=32", "conv2d_nchw.cuda", [["TENSOR", [1, 288, 35, 35], "float32"], ["TENSOR", [64, 288, 1, 1], "float32"], [1, 1], [0, 0, 0, 0], [1, 1], "float32"], {}], "config": {"index": 1808278, "code_hash": null, "entity": [["tile_f", "sp", [-1, 8, 2, 1]], ["tile_y", "sp", [-1, 5, 7, 1]], ["tile_x", "sp", [-1, 5, 1, 1]], ["tile_rc", "sp", [-1, 36]], ["tile_ry", "sp", [-1, 1]], ["tile_rx", "sp", [-1, 1]], ["auto_unroll_max_step", "ot", 512], ["unroll_explicit", "ot", 1]]}, "result": [[0.0003027727500000001, 0.0003027845394736842, 0.00030279084962406017], 0, 4.790663719177246, 1679480379.9327207], "version": 0.2, "tvm_version": "0.10.0"}
{"input": ["cuda -keys=cuda,gpu -arch=sm_75 -max_num_threads=1024 -thread_warp_size=32", "conv2d_nchw.cuda", [["TENSOR", [1, 288, 35, 35], "float32"], ["TENSOR", [64, 288, 1, 1], "float32"], [1, 1], [0, 0, 0, 0], [1, 1], "float32"], {}], "config": {"index": 1586518, "code_hash": null, "entity": [["tile_f", "sp", [-1, 8, 2, 1]], ["tile_y", "sp", [-1, 5, 7, 1]], ["tile_x", "sp", [-1, 1, 1, 7]], ["tile_rc", "sp", [-1, 2]], ["tile_ry", "sp", [-1, 1]], ["tile_rx", "sp", [-1, 1]], ["auto_unroll_max_step", "ot", 512], ["unroll_explicit", "ot", 1]]}, "result": [[0.00053358963, 0.00053362686, 0.0005336948133333333], 0, 2.824098825454712, 1679480381.1742237], "version": 0.2, "tvm_version": "0.10.0"}
{"input": ["cuda -keys=cuda,gpu -arch=sm_75 -max_num_threads=1024 -thread_warp_size=32", "conv2d_nchw.cuda", [["TENSOR", [1, 288, 35, 35], "float32"], ["TENSOR", [64, 288, 1, 1], "float32"], [1, 1], [0, 0, 0, 0], [1, 1], "float32"], {}], "config": {"index": 1571314, "code_hash": null, "entity": [["tile_f", "sp", [-1, 8, 2, 1]], ["tile_y", "sp", [-1, 7, 1, 1]], ["tile_x", "sp", [-1, 5, 1, 1]], ["tile_rc", "sp", [-1, 2]], ["tile_ry", "sp", [-1, 1]], ["tile_rx", "sp", [-1, 1]], ["auto_unroll_max_step", "ot", 512], ["unroll_explicit", "ot", 1]]}, "result": [[0.001839645738095238, 0.0018499574166666668, 0.0018631435476190474], 0, 2.883636713027954, 1679480382.4056315], "version": 0.2, "tvm_version": "0.10.0"}
{"input": ["cuda -keys=cuda,gpu -arch=sm_75 -max_num_threads=1024 -thread_warp_size=32", "conv2d_nchw.cuda", [["TENSOR", [1, 288, 35, 35], "float32"], ["TENSOR", [64, 288, 1, 1], "float32"], [1, 1], [0, 0, 0, 0], [1, 1], "float32"], {}], "config": {"index": 1571745, "code_hash": null, "entity": [["tile_f", "sp", [-1, 8, 8, 1]], ["tile_y", "sp", [-1, 5, 7, 1]], ["tile_x", "sp", [-1, 5, 1, 1]], ["tile_rc", "sp", [-1, 2]], ["tile_ry", "sp", [-1, 1]], ["tile_rx", "sp", [-1, 1]], ["auto_unroll_max_step", "ot", 512], ["unroll_explicit", "ot", 1]]}, "result": [[0.00017485051363140674, 0.00017485246019629226, 0.00017487116357688113], 0, 2.7596607208251953, 1679480383.6491346], "version": 0.2, "tvm_version": "0.10.0"}
{"input": ["cuda -keys=cuda,gpu -arch=sm_75 -max_num_threads=1024 -thread_warp_size=32", "conv2d_nchw.cuda", [["TENSOR", [1, 288, 35, 35], "float32"], ["TENSOR", [64, 288, 1, 1], "float32"], [1, 1], [0, 0, 0, 0], [1, 1], "float32"], {}], "config": {"index": 1829782, "code_hash": null, "entity": [["tile_f", "sp", [-1, 8, 2, 1]], ["tile_y", "sp", [-1, 5, 7, 1]], ["tile_x", "sp", [-1, 5, 1, 1]], ["tile_rc", "sp", [-1, 48]], ["tile_ry", "sp", [-1, 1]], ["tile_rx", "sp", [-1, 1]], ["auto_unroll_max_step", "ot", 512], ["unroll_explicit", "ot", 1]]}, "result": [[0.0012713932025316455, 0.0012714406202531646, 0.0012715807468354431], 0, 2.3916492462158203, 1679480384.4944127], "version": 0.2, "tvm_version": "0.10.0"}
{"input": ["cuda -keys=cuda,gpu -arch=sm_75 -max_num_threads=1024 -thread_warp_size=32", "conv2d_nchw.cuda", [["TENSOR", [1, 288, 35, 35], "float32"], ["TENSOR", [64, 288, 1, 1], "float32"], [1, 1], [0, 0, 0, 0], [1, 1], "float32"], {}], "config": {"index": 1587862, "code_hash": null, "entity": [["tile_f", "sp", [-1, 8, 2, 1]], ["tile_y", "sp", [-1, 5, 7, 1]], ["tile_x", "sp", [-1, 5, 1, 7]], ["tile_rc", "sp", [-1, 2]], ["tile_ry", "sp", [-1, 1]], ["tile_rx", "sp", [-1, 1]], ["auto_unroll_max_step", "ot", 512], ["unroll_explicit", "ot", 1]]}, "result": [[0.0026585827631578946, 0.0026585861842105263, 0.002658627342105263], 0, 4.247018814086914, 1679480385.346852], "version": 0.2, "tvm_version": "0.10.0"}
{"input": ["cuda -keys=cuda,gpu -arch=sm_75 -max_num_threads=1024 -thread_warp_size=32", "conv2d_nchw.cuda", [["TENSOR", [1, 288, 35, 35], "float32"], ["TENSOR", [64, 288, 1, 1], "float32"], [1, 1], [0, 0, 0, 0], [1, 1], "float32"], {}], "config": {"index": 1230528, "code_hash": null, "entity": [["tile_f", "sp", [-1, 32, 2, 1]], ["tile_y", "sp", [-1, 1, 1, 5]], ["tile_x", "sp", [-1, 35, 1, 1]], ["tile_rc", "sp", [-1, 4]], ["tile_ry", "sp", [-1, 1]], ["tile_rx", "sp", [-1, 1]], ["auto_unroll_max_step", "ot", 0], ["unroll_explicit", "ot", 1]]}, "result": [[0.033981109333333336, 0.03398885333333333, 0.034038625], 0, 2.03704571723938, 1679480388.9260862], "version": 0.2, "tvm_version": "0.10.0"}
{"input": ["cuda -keys=cuda,gpu -arch=sm_75 -max_num_threads=1024 -thread_warp_size=32", "conv2d_nchw.cuda", [["TENSOR", [1, 288, 35, 35], "float32"], ["TENSOR", [64, 288, 1, 1], "float32"], [1, 1], [0, 0, 0, 0], [1, 1], "float32"], {}], "config": {"index": 1981739, "code_hash": null, "entity": [["tile_f", "sp", [-1, 16, 2, 1]], ["tile_y", "sp", [-1, 1, 35, 1]], ["tile_x", "sp", [-1, 7, 1, 1]], ["tile_rc", "sp", [-1, 3]], ["tile_ry", "sp", [-1, 1]], ["tile_rx", "sp", [-1, 1]], ["auto_unroll_max_step", "ot", 1500], ["unroll_explicit", "ot", 1]]}, "result": [[0.00015299981921979065, 0.00015300177925784965, 0.00015304269172216936], 0, 2.2045538425445557, 1679480390.159419], "version": 0.2, "tvm_version": "0.10.0"}
{"input": ["cuda -keys=cuda,gpu -arch=sm_75 -max_num_threads=1024 -thread_warp_size=32", "conv2d_nchw.cuda", [["TENSOR", [1, 288, 35, 35], "float32"], ["TENSOR", [64, 288, 1, 1], "float32"], [1, 1], [0, 0, 0, 0], [1, 1], "float32"], {}], "config": {"index": 46379, "code_hash": null, "entity": [["tile_f", "sp", [-1, 16, 2, 1]], ["tile_y", "sp", [-1, 1, 35, 1]], ["tile_x", "sp", [-1, 7, 1, 1]], ["tile_rc", "sp", [-1, 3]], ["tile_ry", "sp", [-1, 1]], ["tile_rx", "sp", [-1, 1]], ["auto_unroll_max_step", "ot", 0], ["unroll_explicit", "ot", 0]]}, "result": [[0.00015113714205079962, 0.00015113777422389466, 0.00015114153527751647], 0, 1.8495781421661377, 1679480391.401744], "version": 0.2, "tvm_version": "0.10.0"}
{"input": ["cuda -keys=cuda,gpu -arch=sm_75 -max_num_threads=1024 -thread_warp_size=32", "conv2d_nchw.cuda", [["TENSOR", [1, 288, 35, 35], "float32"], ["TENSOR", [64, 288, 1, 1], "float32"], [1, 1], [0, 0, 0, 0], [1, 1], "float32"], {}], "config": {"index": 837995, "code_hash": null, "entity": [["tile_f", "sp", [-1, 16, 2, 1]], ["tile_y", "sp", [-1, 1, 35, 1]], ["tile_x", "sp", [-1, 1, 1, 35]], ["tile_rc", "sp", [-1, 3]], ["tile_ry", "sp", [-1, 1]], ["tile_rx", "sp", [-1, 1]], ["auto_unroll_max_step", "ot", 1500], ["unroll_explicit", "ot", 0]]}, "result": [[0.002345765930232558, 0.002346245860465116, 0.0023466365581395346], 0, 2.2401766777038574, 1679480392.2600594], "version": 0.2, "tvm_version": "0.10.0"}
{"input": ["cuda -keys=cuda,gpu -arch=sm_75 -max_num_threads=1024 -thread_warp_size=32", "conv2d_nchw.cuda", [["TENSOR", [1, 288, 35, 35], "float32"], ["TENSOR", [64, 288, 1, 1], "float32"], [1, 1], [0, 0, 0, 0], [1, 1], "float32"], {}], "config": {"index": 820271, "code_hash": null, "entity": [["tile_f", "sp", [-1, 16, 2, 1]], ["tile_y", "sp", [-1, 7, 5, 1]], ["tile_x", "sp", [-1, 7, 1, 1]], ["tile_rc", "sp", [-1, 3]], ["tile_ry", "sp", [-1, 1]], ["tile_rx", "sp", [-1, 1]], ["auto_unroll_max_step", "ot", 1500], ["unroll_explicit", "ot", 0]]}, "result": [[0.004988325904761904, 0.005008979761904763, 0.005022567714285714], 0, 3.365138053894043, 1679480393.139694], "version": 0.2, "tvm_version": "0.10.0"}
{"input": ["cuda -keys=cuda,gpu -arch=sm_75 -max_num_threads=1024 -thread_warp_size=32", "conv2d_nchw.cuda", [["TENSOR", [1, 288, 35, 35], "float32"], ["TENSOR", [64, 288, 1, 1], "float32"], [1, 1], [0, 0, 0, 0], [1, 1], "float32"], {}], "config": {"index": 820536, "code_hash": null, "entity": [["tile_f", "sp", [-1, 4, 16, 1]], ["tile_y", "sp", [-1, 1, 35, 1]], ["tile_x", "sp", [-1, 7, 1, 1]], ["tile_rc", "sp", [-1, 3]], ["tile_ry", "sp", [-1, 1]], ["tile_rx", "sp", [-1, 1]], ["auto_unroll_max_step", "ot", 1500], ["unroll_explicit", "ot", 0]]}, "result": [[0.0001610409090909091, 0.00016104321078921078, 0.0001610439120879121], 0, 1.7139074802398682, 1679480394.3810818], "version": 0.2, "tvm_version": "0.10.0"}
{"input": ["cuda -keys=cuda,gpu -arch=sm_75 -max_num_threads=1024 -thread_warp_size=32", "conv2d_nchw.cuda", [["TENSOR", [1, 288, 35, 35], "float32"], ["TENSOR", [64, 288, 1, 1], "float32"], [1, 1], [0, 0, 0, 0], [1, 1], "float32"], {}], "config": {"index": 433451, "code_hash": null, "entity": [["tile_f", "sp", [-1, 16, 2, 1]], ["tile_y", "sp", [-1, 1, 35, 1]], ["tile_x", "sp", [-1, 7, 1, 1]], ["tile_rc", "sp", [-1, 3]], ["tile_ry", "sp", [-1, 1]], ["tile_rx", "sp", [-1, 1]], ["auto_unroll_max_step", "ot", 512], ["unroll_explicit", "ot", 0]]}, "result": [[0.00013574670558375634, 0.00013575363790186126, 0.00013575450253807108], 0, 1.871783971786499, 1679480395.6324923], "version": 0.2, "tvm_version": "0.10.0"}
{"input": ["cuda -keys=cuda,gpu -arch=sm_75 -max_num_threads=1024 -thread_warp_size=32", "conv2d_nchw.cuda", [["TENSOR", [1, 288, 35, 35], "float32"], ["TENSOR", [64, 288, 1, 1], "float32"], [1, 1], [0, 0, 0, 0], [1, 1], "float32"], {}], "config": {"index": 817835, "code_hash": null, "entity": [["tile_f", "sp", [-1, 16, 2, 1]], ["tile_y", "sp", [-1, 1, 35, 1]], ["tile_x", "sp", [-1, 1, 1, 1]], ["tile_rc", "sp", [-1, 3]], ["tile_ry", "sp", [-1, 1]], ["tile_rx", "sp", [-1, 1]], ["auto_unroll_max_step", "ot", 1500], ["unroll_explicit", "ot", 0]]}, "result": [[0.00017159121818181817, 0.00017161186310160427, 0.00017161342994652406], 0, 1.6511216163635254, 1679480396.8739762], "version": 0.2, "tvm_version": "0.10.0"}
{"input": ["cuda -keys=cuda,gpu -arch=sm_75 -max_num_threads=1024 -thread_warp_size=32", "conv2d_nchw.cuda", [["TENSOR", [1, 288, 35, 35], "float32"], ["TENSOR", [64, 288, 1, 1], "float32"], [1, 1], [0, 0, 0, 0], [1, 1], "float32"], {}], "config": {"index": 820355, "code_hash": null, "entity": [["tile_f", "sp", [-1, 16, 2, 1]], ["tile_y", "sp", [-1, 1, 7, 1]], ["tile_x", "sp", [-1, 7, 1, 1]], ["tile_rc", "sp", [-1, 3]], ["tile_ry", "sp", [-1, 1]], ["tile_rx", "sp", [-1, 1]], ["auto_unroll_max_step", "ot", 1500], ["unroll_explicit", "ot", 0]]}, "result": [[0.00012337810114942529, 0.00012339131417624523, 0.0001233947517241379], 0, 1.9647557735443115, 1679480398.12831], "version": 0.2, "tvm_version": "0.10.0"}
{"input": ["cuda -keys=cuda,gpu -arch=sm_75 -max_num_threads=1024 -thread_warp_size=32", "conv2d_nchw.cuda", [["TENSOR", [1, 288, 35, 35], "float32"], ["TENSOR", [64, 288, 1, 1], "float32"], [1, 1], [0, 0, 0, 0], [1, 1], "float32"], {}], "config": {"index": 819179, "code_hash": null, "entity": [["tile_f", "sp", [-1, 16, 2, 1]], ["tile_y", "sp", [-1, 1, 35, 1]], ["tile_x", "sp", [-1, 5, 1, 1]], ["tile_rc", "sp", [-1, 3]], ["tile_ry", "sp", [-1, 1]], ["tile_rx", "sp", [-1, 1]], ["auto_unroll_max_step", "ot", 1500], ["unroll_explicit", "ot", 0]]}, "result": [[0.00012845980830670926, 0.00012846149041533547, 0.00012846307428115015], 0, 1.8171977996826172, 1679480399.374519], "version": 0.2, "tvm_version": "0.10.0"}
{"input": ["cuda -keys=cuda,gpu -arch=sm_75 -max_num_threads=1024 -thread_warp_size=32", "conv2d_nchw.cuda", [["TENSOR", [1, 288, 35, 35], "float32"], ["TENSOR", [64, 288, 1, 1], "float32"], [1, 1], [0, 0, 0, 0], [1, 1], "float32"], {}], "config": {"index": 820439, "code_hash": null, "entity": [["tile_f", "sp", [-1, 16, 2, 1]], ["tile_y", "sp", [-1, 5, 7, 1]], ["tile_x", "sp", [-1, 7, 1, 1]], ["tile_rc", "sp", [-1, 3]], ["tile_ry", "sp", [-1, 1]], ["tile_rx", "sp", [-1, 1]], ["auto_unroll_max_step", "ot", 1500], ["unroll_explicit", "ot", 0]]}, "result": [[0.002561462873015873, 0.0025617498888888886, 0.002562585968253968], 0, 2.900826930999756, 1679480400.6311224], "version": 0.2, "tvm_version": "0.10.0"}
{"input": ["cuda -keys=cuda,gpu -arch=sm_75 -max_num_threads=1024 -thread_warp_size=32", "conv2d_nchw.cuda", [["TENSOR", [1, 288, 35, 35], "float32"], ["TENSOR", [64, 288, 1, 1], "float32"], [1, 1], [0, 0, 0, 0], [1, 1], "float32"], {}], "config": {"index": 1230360, "code_hash": null, "entity": [["tile_f", "sp", [-1, 32, 2, 1]], ["tile_y", "sp", [-1, 5, 7, 1]], ["tile_x", "sp", [-1, 35, 1, 1]], ["tile_rc", "sp", [-1, 4]], ["tile_ry", "sp", [-1, 1]], ["tile_rx", "sp", [-1, 1]], ["auto_unroll_max_step", "ot", 0], ["unroll_explicit", "ot", 1]]}, "result": [[0.0101485945, 0.010155165333333334, 0.013017804124999999], 0, 2.2501776218414307, 1679480411.7481315], "version": 0.2, "tvm_version": "0.10.0"}
{"input": ["cuda -keys=cuda,gpu -arch=sm_75 -max_num_threads=1024 -thread_warp_size=32", "conv2d_nchw.cuda", [["TENSOR", [1, 288, 35, 35], "float32"], ["TENSOR", [64, 288, 1, 1], "float32"], [1, 1], [0, 0, 0, 0], [1, 1], "float32"], {}], "config": {"index": 46211, "code_hash": null, "entity": [["tile_f", "sp", [-1, 16, 2, 1]], ["tile_y", "sp", [-1, 1, 7, 1]], ["tile_x", "sp", [-1, 7, 1, 1]], ["tile_rc", "sp", [-1, 3]], ["tile_ry", "sp", [-1, 1]], ["tile_rx", "sp", [-1, 1]], ["auto_unroll_max_step", "ot", 0], ["unroll_explicit", "ot", 0]]}, "result": [[0.00026200998531810765, 0.0002620203898858075, 0.0002620270619902121], 0, 1.975114107131958, 1679480412.9980338], "version": 0.2, "tvm_version": "0.10.0"}
{"input": ["cuda -keys=cuda,gpu -arch=sm_75 -max_num_threads=1024 -thread_warp_size=32", "conv2d_nchw.cuda", [["TENSOR", [1, 288, 35, 35], "float32"], ["TENSOR", [64, 288, 1, 1], "float32"], [1, 1], [0, 0, 0, 0], [1, 1], "float32"], {}], "config": {"index": 777347, "code_hash": null, "entity": [["tile_f", "sp", [-1, 16, 2, 1]], ["tile_y", "sp", [-1, 1, 7, 1]], ["tile_x", "sp", [-1, 7, 1, 1]], ["tile_rc", "sp", [-1, 1]], ["tile_ry", "sp", [-1, 1]], ["tile_rx", "sp", [-1, 1]], ["auto_unroll_max_step", "ot", 1500], ["unroll_explicit", "ot", 0]]}, "result": [[0.00016021746626984125, 0.00016022047916666667, 0.00016023974900793652], 0, 1.877598524093628, 1679480414.2513497], "version": 0.2, "tvm_version": "0.10.0"}
{"input": ["cuda -keys=cuda,gpu -arch=sm_75 -max_num_threads=1024 -thread_warp_size=32", "conv2d_nchw.cuda", [["TENSOR", [1, 288, 35, 35], "float32"], ["TENSOR", [64, 288, 1, 1], "float32"], [1, 1], [0, 0, 0, 0], [1, 1], "float32"], {}], "config": {"index": 820371, "code_hash": null, "entity": [["tile_f", "sp", [-1, 1, 64, 1]], ["tile_y", "sp", [-1, 1, 7, 1]], ["tile_x", "sp", [-1, 7, 1, 1]], ["tile_rc", "sp", [-1, 3]], ["tile_ry", "sp", [-1, 1]], ["tile_rx", "sp", [-1, 1]], ["auto_unroll_max_step", "ot", 1500], ["unroll_explicit", "ot", 0]]}, "result": [[0.00013278292103075645, 0.00013278292103075645, 0.00013278495012468828], 0, 1.7224373817443848, 1679480415.4886928], "version": 0.2, "tvm_version": "0.10.0"}
{"input": ["cuda -keys=cuda,gpu -arch=sm_75 -max_num_threads=1024 -thread_warp_size=32", "conv2d_nchw.cuda", [["TENSOR", [1, 288, 35, 35], "float32"], ["TENSOR", [64, 288, 1, 1], "float32"], [1, 1], [0, 0, 0, 0], [1, 1], "float32"], {}], "config": {"index": 1981571, "code_hash": null, "entity": [["tile_f", "sp", [-1, 16, 2, 1]], ["tile_y", "sp", [-1, 1, 7, 1]], ["tile_x", "sp", [-1, 7, 1, 1]], ["tile_rc", "sp", [-1, 3]], ["tile_ry", "sp", [-1, 1]], ["tile_rx", "sp", [-1, 1]], ["auto_unroll_max_step", "ot", 1500], ["unroll_explicit", "ot", 1]]}, "result": [[0.00012172800076628353, 0.00012173648965517241, 0.00012174977241379311], 0, 2.2170488834381104, 1679480416.7317367], "version": 0.2, "tvm_version": "0.10.0"}
{"input": ["cuda -keys=cuda,gpu -arch=sm_75 -max_num_threads=1024 -thread_warp_size=32", "conv2d_nchw.cuda", [["TENSOR", [1, 288, 35, 35], "float32"], ["TENSOR", [64, 288, 1, 1], "float32"], [1, 1], [0, 0, 0, 0], [1, 1], "float32"], {}], "config": {"index": 433283, "code_hash": null, "entity": [["tile_f", "sp", [-1, 16, 2, 1]], ["tile_y", "sp", [-1, 1, 7, 1]], ["tile_x", "sp", [-1, 7, 1, 1]], ["tile_rc", "sp", [-1, 3]], ["tile_ry", "sp", [-1, 1]], ["tile_rx", "sp", [-1, 1]], ["auto_unroll_max_step", "ot", 512], ["unroll_explicit", "ot", 0]]}, "result": [[0.0001233803425925926, 0.00012338236805555555, 0.00012339184567901234], 0, 1.9817912578582764, 1679480417.9659474], "version": 0.2, "tvm_version": "0.10.0"}
{"input": ["cuda -keys=cuda,gpu -arch=sm_75 -max_num_threads=1024 -thread_warp_size=32", "conv2d_nchw.cuda", [["TENSOR", [1, 288, 35, 35], "float32"], ["TENSOR", [64, 288, 1, 1], "float32"], [1, 1], [0, 0, 0, 0], [1, 1], "float32"], {}], "config": {"index": 798851, "code_hash": null, "entity": [["tile_f", "sp", [-1, 16, 2, 1]], ["tile_y", "sp", [-1, 1, 7, 1]], ["tile_x", "sp", [-1, 7, 1, 1]], ["tile_rc", "sp", [-1, 2]], ["tile_ry", "sp", [-1, 1]], ["tile_rx", "sp", [-1, 1]], ["auto_unroll_max_step", "ot", 1500], ["unroll_explicit", "ot", 0]]}, "result": [[0.00011971477108433733, 0.00011971778162650604, 0.00011972623795180722], 0, 1.8744664192199707, 1679480419.201357], "version": 0.2, "tvm_version": "0.10.0"}
{"input": ["cuda -keys=cuda,gpu -arch=sm_75 -max_num_threads=1024 -thread_warp_size=32", "conv2d_nchw.cuda", [["TENSOR", [1, 288, 35, 35], "float32"], ["TENSOR", [64, 288, 1, 1], "float32"], [1, 1], [0, 0, 0, 0], [1, 1], "float32"], {}], "config": {"index": 821699, "code_hash": null, "entity": [["tile_f", "sp", [-1, 16, 2, 1]], ["tile_y", "sp", [-1, 1, 7, 1]], ["tile_x", "sp", [-1, 35, 1, 1]], ["tile_rc", "sp", [-1, 3]], ["tile_ry", "sp", [-1, 1]], ["tile_rx", "sp", [-1, 1]], ["auto_unroll_max_step", "ot", 1500], ["unroll_explicit", "ot", 0]]}, "result": [[0.0025056749512195123, 0.002506570951219512, 0.0025072514390243905], 0, 2.537008762359619, 1679480420.065738], "version": 0.2, "tvm_version": "0.10.0"}
{"input": ["cuda -keys=cuda,gpu -arch=sm_75 -max_num_threads=1024 -thread_warp_size=32", "conv2d_nchw.cuda", [["TENSOR", [1, 288, 35, 35], "float32"], ["TENSOR", [64, 288, 1, 1], "float32"], [1, 1], [0, 0, 0, 0], [1, 1], "float32"], {}], "config": {"index": 820372, "code_hash": null, "entity": [["tile_f", "sp", [-1, 1, 1, 2]], ["tile_y", "sp", [-1, 1, 7, 1]], ["tile_x", "sp", [-1, 7, 1, 1]], ["tile_rc", "sp", [-1, 3]], ["tile_ry", "sp", [-1, 1]], ["tile_rx", "sp", [-1, 1]], ["auto_unroll_max_step", "ot", 1500], ["unroll_explicit", "ot", 0]]}, "result": [[0.0008837551929824561, 0.0008838150263157895, 0.000883873649122807], 0, 1.3610129356384277, 1679480420.9250677], "version": 0.2, "tvm_version": "0.10.0"}
{"input": ["cuda -keys=cuda,gpu -arch=sm_75 -max_num_threads=1024 -thread_warp_size=32", "conv2d_nchw.cuda", [["TENSOR", [1, 288, 35, 35], "float32"], ["TENSOR", [64, 288, 1, 1], "float32"], [1, 1], [0, 0, 0, 0], [1, 1], "float32"], {}], "config": {"index": 823043, "code_hash": null, "entity": [["tile_f", "sp", [-1, 16, 2, 1]], ["tile_y", "sp", [-1, 1, 7, 1]], ["tile_x", "sp", [-1, 1, 5, 1]], ["tile_rc", "sp", [-1, 3]], ["tile_ry", "sp", [-1, 1]], ["tile_rx", "sp", [-1, 1]], ["auto_unroll_max_step", "ot", 1500], ["unroll_explicit", "ot", 0]]}, "result": [[0.00015969921371769384, 0.0001597160347912525, 0.00015971928131212725], 0, 1.711951732635498, 1679480422.169727], "version": 0.2, "tvm_version": "0.10.0"}
{"input": ["cuda -keys=cuda,gpu -arch=sm_75 -max_num_threads=1024 -thread_warp_size=32", "conv2d_nchw.cuda", [["TENSOR", [1, 288, 35, 35], "float32"], ["TENSOR", [64, 288, 1, 1], "float32"], [1, 1], [0, 0, 0, 0], [1, 1], "float32"], {}], "config": {"index": 820187, "code_hash": null, "entity": [["tile_f", "sp", [-1, 16, 2, 1]], ["tile_y", "sp", [-1, 1, 5, 1]], ["tile_x", "sp", [-1, 7, 1, 1]], ["tile_rc", "sp", [-1, 3]], ["tile_ry", "sp", [-1, 1]], ["tile_rx", "sp", [-1, 1]], ["auto_unroll_max_step", "ot", 1500], ["unroll_explicit", "ot", 0]]}, "result": [[0.00016110660839160839, 0.0001611104345654346, 0.00016114201898101898], 0, 2.0126640796661377, 1679480423.4142146], "version": 0.2, "tvm_version": "0.10.0"}
{"input": ["cuda -keys=cuda,gpu -arch=sm_75 -max_num_threads=1024 -thread_warp_size=32", "conv2d_nchw.cuda", [["TENSOR", [1, 288, 35, 35], "float32"], ["TENSOR", [64, 288, 1, 1], "float32"], [1, 1], [0, 0, 0, 0], [1, 1], "float32"], {}], "config": {"index": 820373, "code_hash": null, "entity": [["tile_f", "sp", [-1, 2, 1, 2]], ["tile_y", "sp", [-1, 1, 7, 1]], ["tile_x", "sp", [-1, 7, 1, 1]], ["tile_rc", "sp", [-1, 3]], ["tile_ry", "sp", [-1, 1]], ["tile_rx", "sp", [-1, 1]], ["auto_unroll_max_step", "ot", 1500], ["unroll_explicit", "ot", 0]]}, "result": [[0.0004499178467966574, 0.00045002899442896934, 0.000450052286908078], 0, 1.7835626602172852, 1679480424.6602], "version": 0.2, "tvm_version": "0.10.0"}
{"input": ["cuda -keys=cuda,gpu -arch=sm_75 -max_num_threads=1024 -thread_warp_size=32", "conv2d_nchw.cuda", [["TENSOR", [1, 288, 35, 35], "float32"], ["TENSOR", [64, 288, 1, 1], "float32"], [1, 1], [0, 0, 0, 0], [1, 1], "float32"], {}], "config": {"index": 841859, "code_hash": null, "entity": [["tile_f", "sp", [-1, 16, 2, 1]], ["tile_y", "sp", [-1, 1, 7, 1]], ["tile_x", "sp", [-1, 7, 1, 1]], ["tile_rc", "sp", [-1, 4]], ["tile_ry", "sp", [-1, 1]], ["tile_rx", "sp", [-1, 1]], ["auto_unroll_max_step", "ot", 1500], ["unroll_explicit", "ot", 0]]}, "result": [[0.00011588404866743917, 0.00011588605561993048, 0.00011588965353418308], 0, 1.7800188064575195, 1679480425.7279441], "version": 0.2, "tvm_version": "0.10.0"}
{"input": ["cuda -keys=cuda,gpu -arch=sm_75 -max_num_threads=1024 -thread_warp_size=32", "conv2d_nchw.cuda", [["TENSOR", [1, 288, 35, 35], "float32"], ["TENSOR", [64, 288, 1, 1], "float32"], [1, 1], [0, 0, 0, 0], [1, 1], "float32"], {}], "config": {"index": 824387, "code_hash": null, "entity": [["tile_f", "sp", [-1, 16, 2, 1]], ["tile_y", "sp", [-1, 1, 7, 1]], ["tile_x", "sp", [-1, 7, 5, 1]], ["tile_rc", "sp", [-1, 3]], ["tile_ry", "sp", [-1, 1]], ["tile_rx", "sp", [-1, 1]], ["auto_unroll_max_step", "ot", 1500], ["unroll_explicit", "ot", 0]]}, "result": [[0.00011687408498168498, 0.00011687757289377291, 0.00011688015531135532], 0, 1.9965283870697021, 1679480426.964465], "version": 0.2, "tvm_version": "0.10.0"}
{"input": ["cuda -keys=cuda,gpu -arch=sm_75 -max_num_threads=1024 -thread_warp_size=32", "conv2d_nchw.cuda", [["TENSOR", [1, 288, 35, 35], "float32"], ["TENSOR", [64, 288, 1, 1], "float32"], [1, 1], [0, 0, 0, 0], [1, 1], "float32"], {}], "config": {"index": 820607, "code_hash": null, "entity": [["tile_f", "sp", [-1, 16, 2, 1]], ["tile_y", "sp", [-1, 1, 1, 5]], ["tile_x", "sp", [-1, 7, 1, 1]], ["tile_rc", "sp", [-1, 3]], ["tile_ry", "sp", [-1, 1]], ["tile_rx", "sp", [-1, 1]], ["auto_unroll_max_step", "ot", 1500], ["unroll_explicit", "ot", 0]]}, "result": [[0.018663823333333333, 0.0186688855, 0.018682373], 0, 2.909580945968628, 1679480427.9278407], "version": 0.2, "tvm_version": "0.10.0"}
