src/tvm/results/cuda_gtx1650/inception_v3/droplet/cpu.log_layer_14.log
{"input": ["cuda -keys=cuda,gpu -arch=sm_75 -max_num_threads=1024 -thread_warp_size=32", "conv2d_nchw.cuda", [["TENSOR", [1, 96, 35, 35], "float32"], ["TENSOR", [96, 96, 3, 3], "float32"], [1, 1], [1, 1, 1, 1], [1, 1], "float32"], {}], "config": {"index": 0, "code_hash": null, "entity": [["tile_f", "sp", [-1, 1, 1, 1]], ["tile_y", "sp", [-1, 1, 1, 1]], ["tile_x", "sp", [-1, 1, 1, 1]], ["tile_rc", "sp", [-1, 1]], ["tile_ry", "sp", [-1, 1]], ["tile_rx", "sp", [-1, 1]], ["auto_unroll_max_step", "ot", 0], ["unroll_explicit", "ot", 0]]}, "result": [[0.022923881499999996, 0.022927614833333332, 0.022942815000000002], 0, 1.6259911060333252, 1678633525.9551685], "version": 0.2, "tvm_version": "0.10.0"}
{"input": ["cuda -keys=cuda,gpu -arch=sm_75 -max_num_threads=1024 -thread_warp_size=32", "conv2d_nchw.cuda", [["TENSOR", [1, 96, 35, 35], "float32"], ["TENSOR", [96, 96, 3, 3], "float32"], [1, 1], [1, 1, 1, 1], [1, 1], "float32"], {}], "config": {"index": 8257536, "code_hash": null, "entity": [["tile_f", "sp", [-1, 1, 1, 1]], ["tile_y", "sp", [-1, 1, 1, 1]], ["tile_x", "sp", [-1, 1, 1, 1]], ["tile_rc", "sp", [-1, 1]], ["tile_ry", "sp", [-1, 1]], ["tile_rx", "sp", [-1, 1]], ["auto_unroll_max_step", "ot", 0], ["unroll_explicit", "ot", 1]]}, "result": [[0.0229214598, 0.0229220352, 0.022922406], 0, 1.3000240325927734, 1678633527.4063604], "version": 0.2, "tvm_version": "0.10.0"}
{"input": ["cuda -keys=cuda,gpu -arch=sm_75 -max_num_threads=1024 -thread_warp_size=32", "conv2d_nchw.cuda", [["TENSOR", [1, 96, 35, 35], "float32"], ["TENSOR", [96, 96, 3, 3], "float32"], [1, 1], [1, 1, 1, 1], [1, 1], "float32"], {}], "config": {"index": 2752512, "code_hash": null, "entity": [["tile_f", "sp", [-1, 1, 1, 1]], ["tile_y", "sp", [-1, 1, 1, 1]], ["tile_x", "sp", [-1, 1, 1, 1]], ["tile_rc", "sp", [-1, 1]], ["tile_ry", "sp", [-1, 1]], ["tile_rx", "sp", [-1, 1]], ["auto_unroll_max_step", "ot", 512], ["unroll_explicit", "ot", 0]]}, "result": [[0.0229208572, 0.022924493400000003, 0.0229267196], 0, 1.3320863246917725, 1678633528.4193285], "version": 0.2, "tvm_version": "0.10.0"}
{"input": ["cuda -keys=cuda,gpu -arch=sm_75 -max_num_threads=1024 -thread_warp_size=32", "conv2d_nchw.cuda", [["TENSOR", [1, 96, 35, 35], "float32"], ["TENSOR", [96, 96, 3, 3], "float32"], [1, 1], [1, 1, 1, 1], [1, 1], "float32"], {}], "config": {"index": 1376256, "code_hash": null, "entity": [["tile_f", "sp", [-1, 1, 1, 1]], ["tile_y", "sp", [-1, 1, 1, 1]], ["tile_x", "sp", [-1, 1, 1, 1]], ["tile_rc", "sp", [-1, 1]], ["tile_ry", "sp", [-1, 1]], ["tile_rx", "sp", [-1, 3]], ["auto_unroll_max_step", "ot", 0], ["unroll_explicit", "ot", 0]]}, "result": [[0.051894241, 0.051894496500000005, 0.0518955535], 0, 1.314887285232544, 1678633529.3747113], "version": 0.2, "tvm_version": "0.10.0"}
{"input": ["cuda -keys=cuda,gpu -arch=sm_75 -max_num_threads=1024 -thread_warp_size=32", "conv2d_nchw.cuda", [["TENSOR", [1, 96, 35, 35], "float32"], ["TENSOR", [96, 96, 3, 3], "float32"], [1, 1], [1, 1, 1, 1], [1, 1], "float32"], {}], "config": {"index": 688128, "code_hash": null, "entity": [["tile_f", "sp", [-1, 1, 1, 1]], ["tile_y", "sp", [-1, 1, 1, 1]], ["tile_x", "sp", [-1, 1, 1, 1]], ["tile_rc", "sp", [-1, 1]], ["tile_ry", "sp", [-1, 3]], ["tile_rx", "sp", [-1, 1]], ["auto_unroll_max_step", "ot", 0], ["unroll_explicit", "ot", 0]]}, "result": [[0.051345390000000005, 0.051351551, 0.051352161], 0, 1.239408016204834, 1678633530.2568648], "version": 0.2, "tvm_version": "0.10.0"}
{"input": ["cuda -keys=cuda,gpu -arch=sm_75 -max_num_threads=1024 -thread_warp_size=32", "conv2d_nchw.cuda", [["TENSOR", [1, 96, 35, 35], "float32"], ["TENSOR", [96, 96, 3, 3], "float32"], [1, 1], [1, 1, 1, 1], [1, 1], "float32"], {}], "config": {"index": 57344, "code_hash": null, "entity": [["tile_f", "sp", [-1, 1, 1, 1]], ["tile_y", "sp", [-1, 1, 1, 1]], ["tile_x", "sp", [-1, 1, 1, 1]], ["tile_rc", "sp", [-1, 2]], ["tile_ry", "sp", [-1, 1]], ["tile_rx", "sp", [-1, 1]], ["auto_unroll_max_step", "ot", 0], ["unroll_explicit", "ot", 0]]}, "result": [[0.061164127, 0.0611642875, 0.061164543], 0, 1.3600051403045654, 1678633531.2619057], "version": 0.2, "tvm_version": "0.10.0"}
{"input": ["cuda -keys=cuda,gpu -arch=sm_75 -max_num_threads=1024 -thread_warp_size=32", "conv2d_nchw.cuda", [["TENSOR", [1, 96, 35, 35], "float32"], ["TENSOR", [96, 96, 3, 3], "float32"], [1, 1], [1, 1, 1, 1], [1, 1], "float32"], {}], "config": {"index": 3584, "code_hash": null, "entity": [["tile_f", "sp", [-1, 1, 1, 1]], ["tile_y", "sp", [-1, 1, 1, 1]], ["tile_x", "sp", [-1, 5, 1, 1]], ["tile_rc", "sp", [-1, 1]], ["tile_ry", "sp", [-1, 1]], ["tile_rx", "sp", [-1, 1]], ["auto_unroll_max_step", "ot", 0], ["unroll_explicit", "ot", 0]]}, "result": [[0.03259038525, 0.032591175, 0.03259174325], 0, 1.4715282917022705, 1678633532.3981972], "version": 0.2, "tvm_version": "0.10.0"}
{"input": ["cuda -keys=cuda,gpu -arch=sm_75 -max_num_threads=1024 -thread_warp_size=32", "conv2d_nchw.cuda", [["TENSOR", [1, 96, 35, 35], "float32"], ["TENSOR", [96, 96, 3, 3], "float32"], [1, 1], [1, 1, 1, 1], [1, 1], "float32"], {}], "config": {"index": 224, "code_hash": null, "entity": [["tile_f", "sp", [-1, 1, 1, 1]], ["tile_y", "sp", [-1, 5, 1, 1]], ["tile_x", "sp", [-1, 1, 1, 1]], ["tile_rc", "sp", [-1, 1]], ["tile_ry", "sp", [-1, 1]], ["tile_rx", "sp", [-1, 1]], ["auto_unroll_max_step", "ot", 0], ["unroll_explicit", "ot", 0]]}, "result": [[0.0324541435, 0.0324546545, 0.03246073525], 0, 1.4973886013031006, 1678633533.5161338], "version": 0.2, "tvm_version": "0.10.0"}
{"input": ["cuda -keys=cuda,gpu -arch=sm_75 -max_num_threads=1024 -thread_warp_size=32", "conv2d_nchw.cuda", [["TENSOR", [1, 96, 35, 35], "float32"], ["TENSOR", [96, 96, 3, 3], "float32"], [1, 1], [1, 1, 1, 1], [1, 1], "float32"], {}], "config": {"index": 1, "code_hash": null, "entity": [["tile_f", "sp", [-1, 2, 1, 1]], ["tile_y", "sp", [-1, 1, 1, 1]], ["tile_x", "sp", [-1, 1, 1, 1]], ["tile_rc", "sp", [-1, 1]], ["tile_ry", "sp", [-1, 1]], ["tile_rx", "sp", [-1, 1]], ["auto_unroll_max_step", "ot", 0], ["unroll_explicit", "ot", 0]]}, "result": [[0.049199615333333335, 0.049201833, 0.04920470166666666], 0, 1.5882833003997803, 1678633534.7853959], "version": 0.2, "tvm_version": "0.10.0"}
{"input": ["cuda -keys=cuda,gpu -arch=sm_75 -max_num_threads=1024 -thread_warp_size=32", "conv2d_nchw.cuda", [["TENSOR", [1, 96, 35, 35], "float32"], ["TENSOR", [96, 96, 3, 3], "float32"], [1, 1], [1, 1, 1, 1], [1, 1], "float32"], {}], "config": {"index": 11010048, "code_hash": null, "entity": [["tile_f", "sp", [-1, 1, 1, 1]], ["tile_y", "sp", [-1, 1, 1, 1]], ["tile_x", "sp", [-1, 1, 1, 1]], ["tile_rc", "sp", [-1, 1]], ["tile_ry", "sp", [-1, 1]], ["tile_rx", "sp", [-1, 1]], ["auto_unroll_max_step", "ot", 512], ["unroll_explicit", "ot", 1]]}, "result": [[0.017623743666666667, 0.0176278775, 0.017628789166666665], 0, 1.2662155628204346, 1678633536.1727583], "version": 0.2, "tvm_version": "0.10.0"}
{"input": ["cuda -keys=cuda,gpu -arch=sm_75 -max_num_threads=1024 -thread_warp_size=32", "conv2d_nchw.cuda", [["TENSOR", [1, 96, 35, 35], "float32"], ["TENSOR", [96, 96, 3, 3], "float32"], [1, 1], [1, 1, 1, 1], [1, 1], "float32"], {}], "config": {"index": 9633792, "code_hash": null, "entity": [["tile_f", "sp", [-1, 1, 1, 1]], ["tile_y", "sp", [-1, 1, 1, 1]], ["tile_x", "sp", [-1, 1, 1, 1]], ["tile_rc", "sp", [-1, 1]], ["tile_ry", "sp", [-1, 1]], ["tile_rx", "sp", [-1, 3]], ["auto_unroll_max_step", "ot", 0], ["unroll_explicit", "ot", 1]]}, "result": [[0.051888206, 0.0518933445, 0.051900272000000004], 0, 1.3261570930480957, 1678633537.1290414], "version": 0.2, "tvm_version": "0.10.0"}
{"input": ["cuda -keys=cuda,gpu -arch=sm_75 -max_num_threads=1024 -thread_warp_size=32", "conv2d_nchw.cuda", [["TENSOR", [1, 96, 35, 35], "float32"], ["TENSOR", [96, 96, 3, 3], "float32"], [1, 1], [1, 1, 1, 1], [1, 1], "float32"], {}], "config": {"index": 8945664, "code_hash": null, "entity": [["tile_f", "sp", [-1, 1, 1, 1]], ["tile_y", "sp", [-1, 1, 1, 1]], ["tile_x", "sp", [-1, 1, 1, 1]], ["tile_rc", "sp", [-1, 1]], ["tile_ry", "sp", [-1, 3]], ["tile_rx", "sp", [-1, 1]], ["auto_unroll_max_step", "ot", 0], ["unroll_explicit", "ot", 1]]}, "result": [[0.0513375205, 0.051341758499999994, 0.0513445585], 0, 1.3169968128204346, 1678633538.0802612], "version": 0.2, "tvm_version": "0.10.0"}
{"input": ["cuda -keys=cuda,gpu -arch=sm_75 -max_num_threads=1024 -thread_warp_size=32", "conv2d_nchw.cuda", [["TENSOR", [1, 96, 35, 35], "float32"], ["TENSOR", [96, 96, 3, 3], "float32"], [1, 1], [1, 1, 1, 1], [1, 1], "float32"], {}], "config": {"index": 8314880, "code_hash": null, "entity": [["tile_f", "sp", [-1, 1, 1, 1]], ["tile_y", "sp", [-1, 1, 1, 1]], ["tile_x", "sp", [-1, 1, 1, 1]], ["tile_rc", "sp", [-1, 2]], ["tile_ry", "sp", [-1, 1]], ["tile_rx", "sp", [-1, 1]], ["auto_unroll_max_step", "ot", 0], ["unroll_explicit", "ot", 1]]}, "result": [[0.061159473, 0.0611597935, 0.061159889], 0, 1.3407928943634033, 1678633539.074332], "version": 0.2, "tvm_version": "0.10.0"}
{"input": ["cuda -keys=cuda,gpu -arch=sm_75 -max_num_threads=1024 -thread_warp_size=32", "conv2d_nchw.cuda", [["TENSOR", [1, 96, 35, 35], "float32"], ["TENSOR", [96, 96, 3, 3], "float32"], [1, 1], [1, 1, 1, 1], [1, 1], "float32"], {}], "config": {"index": 8261120, "code_hash": null, "entity": [["tile_f", "sp", [-1, 1, 1, 1]], ["tile_y", "sp", [-1, 1, 1, 1]], ["tile_x", "sp", [-1, 5, 1, 1]], ["tile_rc", "sp", [-1, 1]], ["tile_ry", "sp", [-1, 1]], ["tile_rx", "sp", [-1, 1]], ["auto_unroll_max_step", "ot", 0], ["unroll_explicit", "ot", 1]]}, "result": [[0.032580120000000004, 0.03258243925, 0.03258419025], 0, 1.5007565021514893, 1678633540.2095275], "version": 0.2, "tvm_version": "0.10.0"}
{"input": ["cuda -keys=cuda,gpu -arch=sm_75 -max_num_threads=1024 -thread_warp_size=32", "conv2d_nchw.cuda", [["TENSOR", [1, 96, 35, 35], "float32"], ["TENSOR", [96, 96, 3, 3], "float32"], [1, 1], [1, 1, 1, 1], [1, 1], "float32"], {}], "config": {"index": 8257760, "code_hash": null, "entity": [["tile_f", "sp", [-1, 1, 1, 1]], ["tile_y", "sp", [-1, 5, 1, 1]], ["tile_x", "sp", [-1, 1, 1, 1]], ["tile_rc", "sp", [-1, 1]], ["tile_ry", "sp", [-1, 1]], ["tile_rx", "sp", [-1, 1]], ["auto_unroll_max_step", "ot", 0], ["unroll_explicit", "ot", 1]]}, "result": [[0.032454521, 0.0324553755, 0.0324557455], 0, 1.4391558170318604, 1678633541.3280473], "version": 0.2, "tvm_version": "0.10.0"}
{"input": ["cuda -keys=cuda,gpu -arch=sm_75 -max_num_threads=1024 -thread_warp_size=32", "conv2d_nchw.cuda", [["TENSOR", [1, 96, 35, 35], "float32"], ["TENSOR", [96, 96, 3, 3], "float32"], [1, 1], [1, 1, 1, 1], [1, 1], "float32"], {}], "config": {"index": 8257537, "code_hash": null, "entity": [["tile_f", "sp", [-1, 2, 1, 1]], ["tile_y", "sp", [-1, 1, 1, 1]], ["tile_x", "sp", [-1, 1, 1, 1]], ["tile_rc", "sp", [-1, 1]], ["tile_ry", "sp", [-1, 1]], ["tile_rx", "sp", [-1, 1]], ["auto_unroll_max_step", "ot", 0], ["unroll_explicit", "ot", 1]]}, "result": [[0.049210026999999996, 0.049210647333333336, 0.04921139], 0, 1.593569278717041, 1678633542.5608609], "version": 0.2, "tvm_version": "0.10.0"}
{"input": ["cuda -keys=cuda,gpu -arch=sm_75 -max_num_threads=1024 -thread_warp_size=32", "conv2d_nchw.cuda", [["TENSOR", [1, 96, 35, 35], "float32"], ["TENSOR", [96, 96, 3, 3], "float32"], [1, 1], [1, 1, 1, 1], [1, 1], "float32"], {}], "config": {"index": 13762560, "code_hash": null, "entity": [["tile_f", "sp", [-1, 1, 1, 1]], ["tile_y", "sp", [-1, 1, 1, 1]], ["tile_x", "sp", [-1, 1, 1, 1]], ["tile_rc", "sp", [-1, 1]], ["tile_ry", "sp", [-1, 1]], ["tile_rx", "sp", [-1, 1]], ["auto_unroll_max_step", "ot", 1500], ["unroll_explicit", "ot", 1]]}, "result": [[0.017628053, 0.017630512166666668, 0.017637498166666668], 0, 1.297361135482788, 1678633544.0202262], "version": 0.2, "tvm_version": "0.10.0"}
{"input": ["cuda -keys=cuda,gpu -arch=sm_75 -max_num_threads=1024 -thread_warp_size=32", "conv2d_nchw.cuda", [["TENSOR", [1, 96, 35, 35], "float32"], ["TENSOR", [96, 96, 3, 3], "float32"], [1, 1], [1, 1, 1, 1], [1, 1], "float32"], {}], "config": {"index": 12386304, "code_hash": null, "entity": [["tile_f", "sp", [-1, 1, 1, 1]], ["tile_y", "sp", [-1, 1, 1, 1]], ["tile_x", "sp", [-1, 1, 1, 1]], ["tile_rc", "sp", [-1, 1]], ["tile_ry", "sp", [-1, 1]], ["tile_rx", "sp", [-1, 3]], ["auto_unroll_max_step", "ot", 512], ["unroll_explicit", "ot", 1]]}, "result": [[0.04830047066666667, 0.04830139666666666, 0.04830302933333333], 0, 1.626948356628418, 1678633545.275594], "version": 0.2, "tvm_version": "0.10.0"}
{"input": ["cuda -keys=cuda,gpu -arch=sm_75 -max_num_threads=1024 -thread_warp_size=32", "conv2d_nchw.cuda", [["TENSOR", [1, 96, 35, 35], "float32"], ["TENSOR", [96, 96, 3, 3], "float32"], [1, 1], [1, 1, 1, 1], [1, 1], "float32"], {}], "config": {"index": 11698176, "code_hash": null, "entity": [["tile_f", "sp", [-1, 1, 1, 1]], ["tile_y", "sp", [-1, 1, 1, 1]], ["tile_x", "sp", [-1, 1, 1, 1]], ["tile_rc", "sp", [-1, 1]], ["tile_ry", "sp", [-1, 3]], ["tile_rx", "sp", [-1, 1]], ["auto_unroll_max_step", "ot", 512], ["unroll_explicit", "ot", 1]]}, "result": [[0.048321171999999996, 0.048322942, 0.048325271333333336], 0, 1.5914218425750732, 1678633546.5024068], "version": 0.2, "tvm_version": "0.10.0"}
{"input": ["cuda -keys=cuda,gpu -arch=sm_75 -max_num_threads=1024 -thread_warp_size=32", "conv2d_nchw.cuda", [["TENSOR", [1, 96, 35, 35], "float32"], ["TENSOR", [96, 96, 3, 3], "float32"], [1, 1], [1, 1, 1, 1], [1, 1], "float32"], {}], "config": {"index": 11067392, "code_hash": null, "entity": [["tile_f", "sp", [-1, 1, 1, 1]], ["tile_y", "sp", [-1, 1, 1, 1]], ["tile_x", "sp", [-1, 1, 1, 1]], ["tile_rc", "sp", [-1, 2]], ["tile_ry", "sp", [-1, 1]], ["tile_rx", "sp", [-1, 1]], ["auto_unroll_max_step", "ot", 512], ["unroll_explicit", "ot", 1]]}, "result": [[0.059954574499999996, 0.0599560965, 0.0599564625], 0, 1.450838565826416, 1678633547.5503345], "version": 0.2, "tvm_version": "0.10.0"}
{"input": ["cuda -keys=cuda,gpu -arch=sm_75 -max_num_threads=1024 -thread_warp_size=32", "conv2d_nchw.cuda", [["TENSOR", [1, 96, 35, 35], "float32"], ["TENSOR", [96, 96, 3, 3], "float32"], [1, 1], [1, 1, 1, 1], [1, 1], "float32"], {}], "config": {"index": 11013632, "code_hash": null, "entity": [["tile_f", "sp", [-1, 1, 1, 1]], ["tile_y", "sp", [-1, 1, 1, 1]], ["tile_x", "sp", [-1, 5, 1, 1]], ["tile_rc", "sp", [-1, 1]], ["tile_ry", "sp", [-1, 1]], ["tile_rx", "sp", [-1, 1]], ["auto_unroll_max_step", "ot", 512], ["unroll_explicit", "ot", 1]]}, "result": [[0.030583599, 0.030586040249999998, 0.030588415], 0, 1.4958174228668213, 1678633548.628699], "version": 0.2, "tvm_version": "0.10.0"}
{"input": ["cuda -keys=cuda,gpu -arch=sm_75 -max_num_threads=1024 -thread_warp_size=32", "conv2d_nchw.cuda", [["TENSOR", [1, 96, 35, 35], "float32"], ["TENSOR", [96, 96, 3, 3], "float32"], [1, 1], [1, 1, 1, 1], [1, 1], "float32"], {}], "config": {"index": 11010272, "code_hash": null, "entity": [["tile_f", "sp", [-1, 1, 1, 1]], ["tile_y", "sp", [-1, 5, 1, 1]], ["tile_x", "sp", [-1, 1, 1, 1]], ["tile_rc", "sp", [-1, 1]], ["tile_ry", "sp", [-1, 1]], ["tile_rx", "sp", [-1, 1]], ["auto_unroll_max_step", "ot", 512], ["unroll_explicit", "ot", 1]]}, "result": [[0.03042490375, 0.0304267595, 0.030426855], 0, 1.4514813423156738, 1678633549.6686866], "version": 0.2, "tvm_version": "0.10.0"}
{"input": ["cuda -keys=cuda,gpu -arch=sm_75 -max_num_threads=1024 -thread_warp_size=32", "conv2d_nchw.cuda", [["TENSOR", [1, 96, 35, 35], "float32"], ["TENSOR", [96, 96, 3, 3], "float32"], [1, 1], [1, 1, 1, 1], [1, 1], "float32"], {}], "config": {"index": 11010049, "code_hash": null, "entity": [["tile_f", "sp", [-1, 2, 1, 1]], ["tile_y", "sp", [-1, 1, 1, 1]], ["tile_x", "sp", [-1, 1, 1, 1]], ["tile_rc", "sp", [-1, 1]], ["tile_ry", "sp", [-1, 1]], ["tile_rx", "sp", [-1, 1]], ["auto_unroll_max_step", "ot", 512], ["unroll_explicit", "ot", 1]]}, "result": [[0.052915649, 0.052916225, 0.0529162405], 0, 1.335221529006958, 1678633550.6369042], "version": 0.2, "tvm_version": "0.10.0"}
{"input": ["cuda -keys=cuda,gpu -arch=sm_75 -max_num_threads=1024 -thread_warp_size=32", "conv2d_nchw.cuda", [["TENSOR", [1, 96, 35, 35], "float32"], ["TENSOR", [96, 96, 3, 3], "float32"], [1, 1], [1, 1, 1, 1], [1, 1], "float32"], {}], "config": {"index": 11124736, "code_hash": null, "entity": [["tile_f", "sp", [-1, 1, 1, 1]], ["tile_y", "sp", [-1, 1, 1, 1]], ["tile_x", "sp", [-1, 1, 1, 1]], ["tile_rc", "sp", [-1, 3]], ["tile_ry", "sp", [-1, 1]], ["tile_rx", "sp", [-1, 1]], ["auto_unroll_max_step", "ot", 512], ["unroll_explicit", "ot", 1]]}, "result": [[0.0508415985, 0.050843070500000004, 0.0508440475], 0, 1.259948968887329, 1678633552.0630922], "version": 0.2, "tvm_version": "0.10.0"}
{"input": ["cuda -keys=cuda,gpu -arch=sm_75 -max_num_threads=1024 -thread_warp_size=32", "conv2d_nchw.cuda", [["TENSOR", [1, 96, 35, 35], "float32"], ["TENSOR", [96, 96, 3, 3], "float32"], [1, 1], [1, 1, 1, 1], [1, 1], "float32"], {}], "config": {"index": 11017216, "code_hash": null, "entity": [["tile_f", "sp", [-1, 1, 1, 1]], ["tile_y", "sp", [-1, 1, 1, 1]], ["tile_x", "sp", [-1, 7, 1, 1]], ["tile_rc", "sp", [-1, 1]], ["tile_ry", "sp", [-1, 1]], ["tile_rx", "sp", [-1, 1]], ["auto_unroll_max_step", "ot", 512], ["unroll_explicit", "ot", 1]]}, "result": [[0.02636144825, 0.02636163125, 0.0263627605], 0, 1.3742942810058594, 1678633553.0276787], "version": 0.2, "tvm_version": "0.10.0"}
{"input": ["cuda -keys=cuda,gpu -arch=sm_75 -max_num_threads=1024 -thread_warp_size=32", "conv2d_nchw.cuda", [["TENSOR", [1, 96, 35, 35], "float32"], ["TENSOR", [96, 96, 3, 3], "float32"], [1, 1], [1, 1, 1, 1], [1, 1], "float32"], {}], "config": {"index": 11010496, "code_hash": null, "entity": [["tile_f", "sp", [-1, 1, 1, 1]], ["tile_y", "sp", [-1, 7, 1, 1]], ["tile_x", "sp", [-1, 1, 1, 1]], ["tile_rc", "sp", [-1, 1]], ["tile_ry", "sp", [-1, 1]], ["tile_rx", "sp", [-1, 1]], ["auto_unroll_max_step", "ot", 512], ["unroll_explicit", "ot", 1]]}, "result": [[0.026230319749999998, 0.02623488025, 0.026246168], 0, 1.3953399658203125, 1678633554.0188565], "version": 0.2, "tvm_version": "0.10.0"}
{"input": ["cuda -keys=cuda,gpu -arch=sm_75 -max_num_threads=1024 -thread_warp_size=32", "conv2d_nchw.cuda", [["TENSOR", [1, 96, 35, 35], "float32"], ["TENSOR", [96, 96, 3, 3], "float32"], [1, 1], [1, 1, 1, 1], [1, 1], "float32"], {}], "config": {"index": 11010050, "code_hash": null, "entity": [["tile_f", "sp", [-1, 3, 1, 1]], ["tile_y", "sp", [-1, 1, 1, 1]], ["tile_x", "sp", [-1, 1, 1, 1]], ["tile_rc", "sp", [-1, 1]], ["tile_ry", "sp", [-1, 1]], ["tile_rx", "sp", [-1, 1]], ["auto_unroll_max_step", "ot", 512], ["unroll_explicit", "ot", 1]]}, "result": [[0.03809723633333333, 0.03809888966666666, 0.03810041533333334], 0, 1.396303415298462, 1678633555.061778], "version": 0.2, "tvm_version": "0.10.0"}
{"input": ["cuda -keys=cuda,gpu -arch=sm_75 -max_num_threads=1024 -thread_warp_size=32", "conv2d_nchw.cuda", [["TENSOR", [1, 96, 35, 35], "float32"], ["TENSOR", [96, 96, 3, 3], "float32"], [1, 1], [1, 1, 1, 1], [1, 1], "float32"], {}], "config": {"index": 11182080, "code_hash": null, "entity": [["tile_f", "sp", [-1, 1, 1, 1]], ["tile_y", "sp", [-1, 1, 1, 1]], ["tile_x", "sp", [-1, 1, 1, 1]], ["tile_rc", "sp", [-1, 4]], ["tile_ry", "sp", [-1, 1]], ["tile_rx", "sp", [-1, 1]], ["auto_unroll_max_step", "ot", 512], ["unroll_explicit", "ot", 1]]}, "result": [[0.046107869333333336, 0.04610858633333333, 0.04610898333333333], 0, 1.5520009994506836, 1678633556.89646], "version": 0.2, "tvm_version": "0.10.0"}
{"input": ["cuda -keys=cuda,gpu -arch=sm_75 -max_num_threads=1024 -thread_warp_size=32", "conv2d_nchw.cuda", [["TENSOR", [1, 96, 35, 35], "float32"], ["TENSOR", [96, 96, 3, 3], "float32"], [1, 1], [1, 1, 1, 1], [1, 1], "float32"], {}], "config": {"index": 11020800, "code_hash": null, "entity": [["tile_f", "sp", [-1, 1, 1, 1]], ["tile_y", "sp", [-1, 1, 1, 1]], ["tile_x", "sp", [-1, 35, 1, 1]], ["tile_rc", "sp", [-1, 1]], ["tile_ry", "sp", [-1, 1]], ["tile_rx", "sp", [-1, 1]], ["auto_unroll_max_step", "ot", 512], ["unroll_explicit", "ot", 1]]}, "result": [[0.0248098814, 0.0248106048, 0.024810649], 0, 1.5899238586425781, 1678633557.9103272], "version": 0.2, "tvm_version": "0.10.0"}
{"input": ["cuda -keys=cuda,gpu -arch=sm_75 -max_num_threads=1024 -thread_warp_size=32", "conv2d_nchw.cuda", [["TENSOR", [1, 96, 35, 35], "float32"], ["TENSOR", [96, 96, 3, 3], "float32"], [1, 1], [1, 1, 1, 1], [1, 1], "float32"], {}], "config": {"index": 11010720, "code_hash": null, "entity": [["tile_f", "sp", [-1, 1, 1, 1]], ["tile_y", "sp", [-1, 35, 1, 1]], ["tile_x", "sp", [-1, 1, 1, 1]], ["tile_rc", "sp", [-1, 1]], ["tile_ry", "sp", [-1, 1]], ["tile_rx", "sp", [-1, 1]], ["auto_unroll_max_step", "ot", 512], ["unroll_explicit", "ot", 1]]}, "result": [[0.0218609404, 0.021876544, 0.0218833282], 0, 1.490992784500122, 1678633558.9137306], "version": 0.2, "tvm_version": "0.10.0"}
{"input": ["cuda -keys=cuda,gpu -arch=sm_75 -max_num_threads=1024 -thread_warp_size=32", "conv2d_nchw.cuda", [["TENSOR", [1, 96, 35, 35], "float32"], ["TENSOR", [96, 96, 3, 3], "float32"], [1, 1], [1, 1, 1, 1], [1, 1], "float32"], {}], "config": {"index": 11010051, "code_hash": null, "entity": [["tile_f", "sp", [-1, 4, 1, 1]], ["tile_y", "sp", [-1, 1, 1, 1]], ["tile_x", "sp", [-1, 1, 1, 1]], ["tile_rc", "sp", [-1, 1]], ["tile_ry", "sp", [-1, 1]], ["tile_rx", "sp", [-1, 1]], ["auto_unroll_max_step", "ot", 512], ["unroll_explicit", "ot", 1]]}, "result": [[0.034630315, 0.034632212, 0.034632873333333335], 0, 1.3436532020568848, 1678633559.9029148], "version": 0.2, "tvm_version": "0.10.0"}
{"input": ["cuda -keys=cuda,gpu -arch=sm_75 -max_num_threads=1024 -thread_warp_size=32", "conv2d_nchw.cuda", [["TENSOR", [1, 96, 35, 35], "float32"], ["TENSOR", [96, 96, 3, 3], "float32"], [1, 1], [1, 1, 1, 1], [1, 1], "float32"], {}], "config": {"index": 11239424, "code_hash": null, "entity": [["tile_f", "sp", [-1, 1, 1, 1]], ["tile_y", "sp", [-1, 1, 1, 1]], ["tile_x", "sp", [-1, 1, 1, 1]], ["tile_rc", "sp", [-1, 6]], ["tile_ry", "sp", [-1, 1]], ["tile_rx", "sp", [-1, 1]], ["auto_unroll_max_step", "ot", 512], ["unroll_explicit", "ot", 1]]}, "result": [[0.043035756333333335, 0.043037215999999996, 0.043039403000000004], 0, 1.5065653324127197, 1678633561.5203338], "version": 0.2, "tvm_version": "0.10.0"}
{"input": ["cuda -keys=cuda,gpu -arch=sm_75 -max_num_threads=1024 -thread_warp_size=32", "conv2d_nchw.cuda", [["TENSOR", [1, 96, 35, 35], "float32"], ["TENSOR", [96, 96, 3, 3], "float32"], [1, 1], [1, 1, 1, 1], [1, 1], "float32"], {}], "config": {"index": 11024384, "code_hash": null, "entity": [["tile_f", "sp", [-1, 1, 1, 1]], ["tile_y", "sp", [-1, 1, 1, 1]], ["tile_x", "sp", [-1, 1, 5, 1]], ["tile_rc", "sp", [-1, 1]], ["tile_ry", "sp", [-1, 1]], ["tile_rx", "sp", [-1, 1]], ["auto_unroll_max_step", "ot", 512], ["unroll_explicit", "ot", 1]]}, "result": [[0.0195691845, 0.019570453499999998, 0.019571739166666668], 0, 1.3899805545806885, 1678633562.5272765], "version": 0.2, "tvm_version": "0.10.0"}
{"input": ["cuda -keys=cuda,gpu -arch=sm_75 -max_num_threads=1024 -thread_warp_size=32", "conv2d_nchw.cuda", [["TENSOR", [1, 96, 35, 35], "float32"], ["TENSOR", [96, 96, 3, 3], "float32"], [1, 1], [1, 1, 1, 1], [1, 1], "float32"], {}], "config": {"index": 11010944, "code_hash": null, "entity": [["tile_f", "sp", [-1, 1, 1, 1]], ["tile_y", "sp", [-1, 1, 5, 1]], ["tile_x", "sp", [-1, 1, 1, 1]], ["tile_rc", "sp", [-1, 1]], ["tile_ry", "sp", [-1, 1]], ["tile_rx", "sp", [-1, 1]], ["auto_unroll_max_step", "ot", 512], ["unroll_explicit", "ot", 1]]}, "result": [[0.0217939834, 0.021794873, 0.021795187200000003], 0, 1.3490314483642578, 1678633563.5227828], "version": 0.2, "tvm_version": "0.10.0"}
{"input": ["cuda -keys=cuda,gpu -arch=sm_75 -max_num_threads=1024 -thread_warp_size=32", "conv2d_nchw.cuda", [["TENSOR", [1, 96, 35, 35], "float32"], ["TENSOR", [96, 96, 3, 3], "float32"], [1, 1], [1, 1, 1, 1], [1, 1], "float32"], {}], "config": {"index": 11010052, "code_hash": null, "entity": [["tile_f", "sp", [-1, 6, 1, 1]], ["tile_y", "sp", [-1, 1, 1, 1]], ["tile_x", "sp", [-1, 1, 1, 1]], ["tile_rc", "sp", [-1, 1]], ["tile_ry", "sp", [-1, 1]], ["tile_rx", "sp", [-1, 1]], ["auto_unroll_max_step", "ot", 512], ["unroll_explicit", "ot", 1]]}, "result": [[0.027236391000000002, 0.027237831, 0.0272383995], 0, 1.3559043407440186, 1678633564.5397053], "version": 0.2, "tvm_version": "0.10.0"}
{"input": ["cuda -keys=cuda,gpu -arch=sm_75 -max_num_threads=1024 -thread_warp_size=32", "conv2d_nchw.cuda", [["TENSOR", [1, 96, 35, 35], "float32"], ["TENSOR", [96, 96, 3, 3], "float32"], [1, 1], [1, 1, 1, 1], [1, 1], "float32"], {}], "config": {"index": 11296768, "code_hash": null, "entity": [["tile_f", "sp", [-1, 1, 1, 1]], ["tile_y", "sp", [-1, 1, 1, 1]], ["tile_x", "sp", [-1, 1, 1, 1]], ["tile_rc", "sp", [-1, 8]], ["tile_ry", "sp", [-1, 1]], ["tile_rx", "sp", [-1, 1]], ["auto_unroll_max_step", "ot", 512], ["unroll_explicit", "ot", 1]]}, "result": [[0.04056297533333333, 0.040563285666666664, 0.04056423433333333], 0, 1.5061895847320557, 1678633566.156785], "version": 0.2, "tvm_version": "0.10.0"}
{"input": ["cuda -keys=cuda,gpu -arch=sm_75 -max_num_threads=1024 -thread_warp_size=32", "conv2d_nchw.cuda", [["TENSOR", [1, 96, 35, 35], "float32"], ["TENSOR", [96, 96, 3, 3], "float32"], [1, 1], [1, 1, 1, 1], [1, 1], "float32"], {}], "config": {"index": 11027968, "code_hash": null, "entity": [["tile_f", "sp", [-1, 1, 1, 1]], ["tile_y", "sp", [-1, 1, 1, 1]], ["tile_x", "sp", [-1, 7, 5, 1]], ["tile_rc", "sp", [-1, 1]], ["tile_ry", "sp", [-1, 1]], ["tile_rx", "sp", [-1, 1]], ["auto_unroll_max_step", "ot", 512], ["unroll_explicit", "ot", 1]]}, "result": [[0.007477424071428572, 0.007477979357142857, 0.0074785646428571426], 0, 1.341087818145752, 1678633567.0855753], "version": 0.2, "tvm_version": "0.10.0"}
{"input": ["cuda -keys=cuda,gpu -arch=sm_75 -max_num_threads=1024 -thread_warp_size=32", "conv2d_nchw.cuda", [["TENSOR", [1, 96, 35, 35], "float32"], ["TENSOR", [96, 96, 3, 3], "float32"], [1, 1], [1, 1, 1, 1], [1, 1], "float32"], {}], "config": {"index": 11011168, "code_hash": null, "entity": [["tile_f", "sp", [-1, 1, 1, 1]], ["tile_y", "sp", [-1, 7, 5, 1]], ["tile_x", "sp", [-1, 1, 1, 1]], ["tile_rc", "sp", [-1, 1]], ["tile_ry", "sp", [-1, 1]], ["tile_rx", "sp", [-1, 1]], ["auto_unroll_max_step", "ot", 512], ["unroll_explicit", "ot", 1]]}, "result": [[0.009052672, 0.009054890916666667, 0.009055061333333333], 0, 1.360046148300171, 1678633568.0417426], "version": 0.2, "tvm_version": "0.10.0"}
{"input": ["cuda -keys=cuda,gpu -arch=sm_75 -max_num_threads=1024 -thread_warp_size=32", "conv2d_nchw.cuda", [["TENSOR", [1, 96, 35, 35], "float32"], ["TENSOR", [96, 96, 3, 3], "float32"], [1, 1], [1, 1, 1, 1], [1, 1], "float32"], {}], "config": {"index": 11010053, "code_hash": null, "entity": [["tile_f", "sp", [-1, 8, 1, 1]], ["tile_y", "sp", [-1, 1, 1, 1]], ["tile_x", "sp", [-1, 1, 1, 1]], ["tile_rc", "sp", [-1, 1]], ["tile_ry", "sp", [-1, 1]], ["tile_rx", "sp", [-1, 1]], ["auto_unroll_max_step", "ot", 512], ["unroll_explicit", "ot", 1]]}, "result": [[0.0235111998, 0.0235133316, 0.0235153274], 0, 1.4397873878479004, 1678633569.0857923], "version": 0.2, "tvm_version": "0.10.0"}
{"input": ["cuda -keys=cuda,gpu -arch=sm_75 -max_num_threads=1024 -thread_warp_size=32", "conv2d_nchw.cuda", [["TENSOR", [1, 96, 35, 35], "float32"], ["TENSOR", [96, 96, 3, 3], "float32"], [1, 1], [1, 1, 1, 1], [1, 1], "float32"], {}], "config": {"index": 2770432, "code_hash": null, "entity": [["tile_f", "sp", [-1, 1, 1, 1]], ["tile_y", "sp", [-1, 1, 1, 1]], ["tile_x", "sp", [-1, 7, 5, 1]], ["tile_rc", "sp", [-1, 1]], ["tile_ry", "sp", [-1, 1]], ["tile_rx", "sp", [-1, 1]], ["auto_unroll_max_step", "ot", 512], ["unroll_explicit", "ot", 0]]}, "result": [[0.007296439000000001, 0.0072967725, 0.0072970237142857145], 0, 1.3081161975860596, 1678633570.9846623], "version": 0.2, "tvm_version": "0.10.0"}
{"input": ["cuda -keys=cuda,gpu -arch=sm_75 -max_num_threads=1024 -thread_warp_size=32", "conv2d_nchw.cuda", [["TENSOR", [1, 96, 35, 35], "float32"], ["TENSOR", [96, 96, 3, 3], "float32"], [1, 1], [1, 1, 1, 1], [1, 1], "float32"], {}], "config": {"index": 13780480, "code_hash": null, "entity": [["tile_f", "sp", [-1, 1, 1, 1]], ["tile_y", "sp", [-1, 1, 1, 1]], ["tile_x", "sp", [-1, 7, 5, 1]], ["tile_rc", "sp", [-1, 1]], ["tile_ry", "sp", [-1, 1]], ["tile_rx", "sp", [-1, 1]], ["auto_unroll_max_step", "ot", 1500], ["unroll_explicit", "ot", 1]]}, "result": [[0.007476809357142857, 0.007478400071428572, 0.007478710714285714], 0, 1.5719032287597656, 1678633571.914236], "version": 0.2, "tvm_version": "0.10.0"}
{"input": ["cuda -keys=cuda,gpu -arch=sm_75 -max_num_threads=1024 -thread_warp_size=32", "conv2d_nchw.cuda", [["TENSOR", [1, 96, 35, 35], "float32"], ["TENSOR", [96, 96, 3, 3], "float32"], [1, 1], [1, 1, 1, 1], [1, 1], "float32"], {}], "config": {"index": 8275456, "code_hash": null, "entity": [["tile_f", "sp", [-1, 1, 1, 1]], ["tile_y", "sp", [-1, 1, 1, 1]], ["tile_x", "sp", [-1, 7, 5, 1]], ["tile_rc", "sp", [-1, 1]], ["tile_ry", "sp", [-1, 1]], ["tile_rx", "sp", [-1, 1]], ["auto_unroll_max_step", "ot", 0], ["unroll_explicit", "ot", 1]]}, "result": [[0.0073059474285714285, 0.007306317428571428, 0.0073063288571428575], 0, 1.2708730697631836, 1678633572.8153327], "version": 0.2, "tvm_version": "0.10.0"}
{"input": ["cuda -keys=cuda,gpu -arch=sm_75 -max_num_threads=1024 -thread_warp_size=32", "conv2d_nchw.cuda", [["TENSOR", [1, 96, 35, 35], "float32"], ["TENSOR", [96, 96, 3, 3], "float32"], [1, 1], [1, 1, 1, 1], [1, 1], "float32"], {}], "config": {"index": 12404224, "code_hash": null, "entity": [["tile_f", "sp", [-1, 1, 1, 1]], ["tile_y", "sp", [-1, 1, 1, 1]], ["tile_x", "sp", [-1, 7, 5, 1]], ["tile_rc", "sp", [-1, 1]], ["tile_ry", "sp", [-1, 1]], ["tile_rx", "sp", [-1, 3]], ["auto_unroll_max_step", "ot", 512], ["unroll_explicit", "ot", 1]]}, "result": [[0.0041723734166666665, 0.004172856, 0.004173055958333334], 0, 1.2817249298095703, 1678633573.700695], "version": 0.2, "tvm_version": "0.10.0"}
{"input": ["cuda -keys=cuda,gpu -arch=sm_75 -max_num_threads=1024 -thread_warp_size=32", "conv2d_nchw.cuda", [["TENSOR", [1, 96, 35, 35], "float32"], ["TENSOR", [96, 96, 3, 3], "float32"], [1, 1], [1, 1, 1, 1], [1, 1], "float32"], {}], "config": {"index": 11716096, "code_hash": null, "entity": [["tile_f", "sp", [-1, 1, 1, 1]], ["tile_y", "sp", [-1, 1, 1, 1]], ["tile_x", "sp", [-1, 7, 5, 1]], ["tile_rc", "sp", [-1, 1]], ["tile_ry", "sp", [-1, 3]], ["tile_rx", "sp", [-1, 1]], ["auto_unroll_max_step", "ot", 512], ["unroll_explicit", "ot", 1]]}, "result": [[0.006540056187500001, 0.0065402779375, 0.0065414719375], 0, 1.6491539478302002, 1678633574.616331], "version": 0.2, "tvm_version": "0.10.0"}
{"input": ["cuda -keys=cuda,gpu -arch=sm_75 -max_num_threads=1024 -thread_warp_size=32", "conv2d_nchw.cuda", [["TENSOR", [1, 96, 35, 35], "float32"], ["TENSOR", [96, 96, 3, 3], "float32"], [1, 1], [1, 1, 1, 1], [1, 1], "float32"], {}], "config": {"index": 11085312, "code_hash": null, "entity": [["tile_f", "sp", [-1, 1, 1, 1]], ["tile_y", "sp", [-1, 1, 1, 1]], ["tile_x", "sp", [-1, 7, 5, 1]], ["tile_rc", "sp", [-1, 2]], ["tile_ry", "sp", [-1, 1]], ["tile_rx", "sp", [-1, 1]], ["auto_unroll_max_step", "ot", 512], ["unroll_explicit", "ot", 1]]}, "result": [[0.007304900571428572, 0.0073049305, 0.007306175714285715], 0, 1.8556392192840576, 1678633575.5369298], "version": 0.2, "tvm_version": "0.10.0"}
{"input": ["cuda -keys=cuda,gpu -arch=sm_75 -max_num_threads=1024 -thread_warp_size=32", "conv2d_nchw.cuda", [["TENSOR", [1, 96, 35, 35], "float32"], ["TENSOR", [96, 96, 3, 3], "float32"], [1, 1], [1, 1, 1, 1], [1, 1], "float32"], {}], "config": {"index": 11031552, "code_hash": null, "entity": [["tile_f", "sp", [-1, 1, 1, 1]], ["tile_y", "sp", [-1, 1, 1, 1]], ["tile_x", "sp", [-1, 1, 7, 1]], ["tile_rc", "sp", [-1, 1]], ["tile_ry", "sp", [-1, 1]], ["tile_rx", "sp", [-1, 1]], ["auto_unroll_max_step", "ot", 512], ["unroll_explicit", "ot", 1]]}, "result": [[0.013989175749999999, 0.013991680125000001, 0.013992959875], 0, 1.3740174770355225, 1678633576.4894192], "version": 0.2, "tvm_version": "0.10.0"}
{"input": ["cuda -keys=cuda,gpu -arch=sm_75 -max_num_threads=1024 -thread_warp_size=32", "conv2d_nchw.cuda", [["TENSOR", [1, 96, 35, 35], "float32"], ["TENSOR", [96, 96, 3, 3], "float32"], [1, 1], [1, 1, 1, 1], [1, 1], "float32"], {}], "config": {"index": 11028192, "code_hash": null, "entity": [["tile_f", "sp", [-1, 1, 1, 1]], ["tile_y", "sp", [-1, 5, 1, 1]], ["tile_x", "sp", [-1, 7, 5, 1]], ["tile_rc", "sp", [-1, 1]], ["tile_ry", "sp", [-1, 1]], ["tile_rx", "sp", [-1, 1]], ["auto_unroll_max_step", "ot", 512], ["unroll_explicit", "ot", 1]]}, "result": [[0.007088947, 0.007090175866666667, 0.0070938624], 0, 1.7454047203063965, 1678633577.3702912], "version": 0.2, "tvm_version": "0.10.0"}
{"input": ["cuda -keys=cuda,gpu -arch=sm_75 -max_num_threads=1024 -thread_warp_size=32", "conv2d_nchw.cuda", [["TENSOR", [1, 96, 35, 35], "float32"], ["TENSOR", [96, 96, 3, 3], "float32"], [1, 1], [1, 1, 1, 1], [1, 1], "float32"], {}], "config": {"index": 11027969, "code_hash": null, "entity": [["tile_f", "sp", [-1, 2, 1, 1]], ["tile_y", "sp", [-1, 1, 1, 1]], ["tile_x", "sp", [-1, 7, 5, 1]], ["tile_rc", "sp", [-1, 1]], ["tile_ry", "sp", [-1, 1]], ["tile_rx", "sp", [-1, 1]], ["auto_unroll_max_step", "ot", 512], ["unroll_explicit", "ot", 1]]}, "result": [[0.003967133423076924, 0.003967932153846153, 0.003969333038461539], 0, 1.5108308792114258, 1678633578.274007], "version": 0.2, "tvm_version": "0.10.0"}
{"input": ["cuda -keys=cuda,gpu -arch=sm_75 -max_num_threads=1024 -thread_warp_size=32", "conv2d_nchw.cuda", [["TENSOR", [1, 96, 35, 35], "float32"], ["TENSOR", [96, 96, 3, 3], "float32"], [1, 1], [1, 1, 1, 1], [1, 1], "float32"], {}], "config": {"index": 2770433, "code_hash": null, "entity": [["tile_f", "sp", [-1, 2, 1, 1]], ["tile_y", "sp", [-1, 1, 1, 1]], ["tile_x", "sp", [-1, 7, 5, 1]], ["tile_rc", "sp", [-1, 1]], ["tile_ry", "sp", [-1, 1]], ["tile_rx", "sp", [-1, 1]], ["auto_unroll_max_step", "ot", 512], ["unroll_explicit", "ot", 0]]}, "result": [[0.0038784196923076918, 0.003878596961538461, 0.003879270076923077], 0, 1.288207769393921, 1678633580.397607], "version": 0.2, "tvm_version": "0.10.0"}
{"input": ["cuda -keys=cuda,gpu -arch=sm_75 -max_num_threads=1024 -thread_warp_size=32", "conv2d_nchw.cuda", [["TENSOR", [1, 96, 35, 35], "float32"], ["TENSOR", [96, 96, 3, 3], "float32"], [1, 1], [1, 1, 1, 1], [1, 1], "float32"], {}], "config": {"index": 13780481, "code_hash": null, "entity": [["tile_f", "sp", [-1, 2, 1, 1]], ["tile_y", "sp", [-1, 1, 1, 1]], ["tile_x", "sp", [-1, 7, 5, 1]], ["tile_rc", "sp", [-1, 1]], ["tile_ry", "sp", [-1, 1]], ["tile_rx", "sp", [-1, 1]], ["auto_unroll_max_step", "ot", 1500], ["unroll_explicit", "ot", 1]]}, "result": [[0.0039686302692307695, 0.003968809846153846, 0.003969634384615384], 0, 1.4753704071044922, 1678633581.3144574], "version": 0.2, "tvm_version": "0.10.0"}
{"input": ["cuda -keys=cuda,gpu -arch=sm_75 -max_num_threads=1024 -thread_warp_size=32", "conv2d_nchw.cuda", [["TENSOR", [1, 96, 35, 35], "float32"], ["TENSOR", [96, 96, 3, 3], "float32"], [1, 1], [1, 1, 1, 1], [1, 1], "float32"], {}], "config": {"index": 8275457, "code_hash": null, "entity": [["tile_f", "sp", [-1, 2, 1, 1]], ["tile_y", "sp", [-1, 1, 1, 1]], ["tile_x", "sp", [-1, 7, 5, 1]], ["tile_rc", "sp", [-1, 1]], ["tile_ry", "sp", [-1, 1]], ["tile_rx", "sp", [-1, 1]], ["auto_unroll_max_step", "ot", 0], ["unroll_explicit", "ot", 1]]}, "result": [[0.0040309274, 0.00403128324, 0.00403131772], 0, 1.42429780960083, 1678633582.214435], "version": 0.2, "tvm_version": "0.10.0"}
{"input": ["cuda -keys=cuda,gpu -arch=sm_75 -max_num_threads=1024 -thread_warp_size=32", "conv2d_nchw.cuda", [["TENSOR", [1, 96, 35, 35], "float32"], ["TENSOR", [96, 96, 3, 3], "float32"], [1, 1], [1, 1, 1, 1], [1, 1], "float32"], {}], "config": {"index": 12404225, "code_hash": null, "entity": [["tile_f", "sp", [-1, 2, 1, 1]], ["tile_y", "sp", [-1, 1, 1, 1]], ["tile_x", "sp", [-1, 7, 5, 1]], ["tile_rc", "sp", [-1, 1]], ["tile_ry", "sp", [-1, 1]], ["tile_rx", "sp", [-1, 3]], ["auto_unroll_max_step", "ot", 512], ["unroll_explicit", "ot", 1]]}, "result": [[0.0022365461555555557, 0.0022367801111111115, 0.0022368711555555555], 0, 1.443434715270996, 1678633583.112778], "version": 0.2, "tvm_version": "0.10.0"}
{"input": ["cuda -keys=cuda,gpu -arch=sm_75 -max_num_threads=1024 -thread_warp_size=32", "conv2d_nchw.cuda", [["TENSOR", [1, 96, 35, 35], "float32"], ["TENSOR", [96, 96, 3, 3], "float32"], [1, 1], [1, 1, 1, 1], [1, 1], "float32"], {}], "config": {"index": 11716097, "code_hash": null, "entity": [["tile_f", "sp", [-1, 2, 1, 1]], ["tile_y", "sp", [-1, 1, 1, 1]], ["tile_x", "sp", [-1, 7, 5, 1]], ["tile_rc", "sp", [-1, 1]], ["tile_ry", "sp", [-1, 3]], ["tile_rx", "sp", [-1, 1]], ["auto_unroll_max_step", "ot", 512], ["unroll_explicit", "ot", 1]]}, "result": [[0.0034318336333333333, 0.0034319969, 0.0034323231999999998], 0, 1.690720558166504, 1678633584.0280342], "version": 0.2, "tvm_version": "0.10.0"}
{"input": ["cuda -keys=cuda,gpu -arch=sm_75 -max_num_threads=1024 -thread_warp_size=32", "conv2d_nchw.cuda", [["TENSOR", [1, 96, 35, 35], "float32"], ["TENSOR", [96, 96, 3, 3], "float32"], [1, 1], [1, 1, 1, 1], [1, 1], "float32"], {}], "config": {"index": 11085313, "code_hash": null, "entity": [["tile_f", "sp", [-1, 2, 1, 1]], ["tile_y", "sp", [-1, 1, 1, 1]], ["tile_x", "sp", [-1, 7, 5, 1]], ["tile_rc", "sp", [-1, 2]], ["tile_ry", "sp", [-1, 1]], ["tile_rx", "sp", [-1, 1]], ["auto_unroll_max_step", "ot", 512], ["unroll_explicit", "ot", 1]]}, "result": [[0.0037559633333333338, 0.0037578523333333335, 0.003758167666666667], 0, 2.0828945636749268, 1678633584.9333339], "version": 0.2, "tvm_version": "0.10.0"}
{"input": ["cuda -keys=cuda,gpu -arch=sm_75 -max_num_threads=1024 -thread_warp_size=32", "conv2d_nchw.cuda", [["TENSOR", [1, 96, 35, 35], "float32"], ["TENSOR", [96, 96, 3, 3], "float32"], [1, 1], [1, 1, 1, 1], [1, 1], "float32"], {}], "config": {"index": 11031553, "code_hash": null, "entity": [["tile_f", "sp", [-1, 2, 1, 1]], ["tile_y", "sp", [-1, 1, 1, 1]], ["tile_x", "sp", [-1, 1, 7, 1]], ["tile_rc", "sp", [-1, 1]], ["tile_ry", "sp", [-1, 1]], ["tile_rx", "sp", [-1, 1]], ["auto_unroll_max_step", "ot", 512], ["unroll_explicit", "ot", 1]]}, "result": [[0.008173071, 0.008174052846153846, 0.008174089846153846], 0, 1.4847750663757324, 1678633585.8654761], "version": 0.2, "tvm_version": "0.10.0"}
{"input": ["cuda -keys=cuda,gpu -arch=sm_75 -max_num_threads=1024 -thread_warp_size=32", "conv2d_nchw.cuda", [["TENSOR", [1, 96, 35, 35], "float32"], ["TENSOR", [96, 96, 3, 3], "float32"], [1, 1], [1, 1, 1, 1], [1, 1], "float32"], {}], "config": {"index": 11024385, "code_hash": null, "entity": [["tile_f", "sp", [-1, 2, 1, 1]], ["tile_y", "sp", [-1, 1, 1, 1]], ["tile_x", "sp", [-1, 1, 5, 1]], ["tile_rc", "sp", [-1, 1]], ["tile_ry", "sp", [-1, 1]], ["tile_rx", "sp", [-1, 1]], ["auto_unroll_max_step", "ot", 512], ["unroll_explicit", "ot", 1]]}, "result": [[0.011425109, 0.011426410222222223, 0.011426492444444443], 0, 1.4824118614196777, 1678633586.796632], "version": 0.2, "tvm_version": "0.10.0"}
{"input": ["cuda -keys=cuda,gpu -arch=sm_75 -max_num_threads=1024 -thread_warp_size=32", "conv2d_nchw.cuda", [["TENSOR", [1, 96, 35, 35], "float32"], ["TENSOR", [96, 96, 3, 3], "float32"], [1, 1], [1, 1, 1, 1], [1, 1], "float32"], {}], "config": {"index": 11028193, "code_hash": null, "entity": [["tile_f", "sp", [-1, 2, 1, 1]], ["tile_y", "sp", [-1, 5, 1, 1]], ["tile_x", "sp", [-1, 7, 5, 1]], ["tile_rc", "sp", [-1, 1]], ["tile_ry", "sp", [-1, 1]], ["tile_rx", "sp", [-1, 1]], ["auto_unroll_max_step", "ot", 512], ["unroll_explicit", "ot", 1]]}, "result": [[0.0035799040000000005, 0.0035805028928571426, 0.0035805816428571427], 0, 1.8477399349212646, 1678633587.6602752], "version": 0.2, "tvm_version": "0.10.0"}
{"input": ["cuda -keys=cuda,gpu -arch=sm_75 -max_num_threads=1024 -thread_warp_size=32", "conv2d_nchw.cuda", [["TENSOR", [1, 96, 35, 35], "float32"], ["TENSOR", [96, 96, 3, 3], "float32"], [1, 1], [1, 1, 1, 1], [1, 1], "float32"], {}], "config": {"index": 11027970, "code_hash": null, "entity": [["tile_f", "sp", [-1, 3, 1, 1]], ["tile_y", "sp", [-1, 1, 1, 1]], ["tile_x", "sp", [-1, 7, 5, 1]], ["tile_rc", "sp", [-1, 1]], ["tile_ry", "sp", [-1, 1]], ["tile_rx", "sp", [-1, 1]], ["auto_unroll_max_step", "ot", 512], ["unroll_explicit", "ot", 1]]}, "result": [[0.0027158945405405407, 0.002715924837837838, 0.002716525918918919], 0, 1.4952166080474854, 1678633588.5587945], "version": 0.2, "tvm_version": "0.10.0"}
{"input": ["cuda -keys=cuda,gpu -arch=sm_75 -max_num_threads=1024 -thread_warp_size=32", "conv2d_nchw.cuda", [["TENSOR", [1, 96, 35, 35], "float32"], ["TENSOR", [96, 96, 3, 3], "float32"], [1, 1], [1, 1, 1, 1], [1, 1], "float32"], {}], "config": {"index": 4146689, "code_hash": null, "entity": [["tile_f", "sp", [-1, 2, 1, 1]], ["tile_y", "sp", [-1, 1, 1, 1]], ["tile_x", "sp", [-1, 7, 5, 1]], ["tile_rc", "sp", [-1, 1]], ["tile_ry", "sp", [-1, 1]], ["tile_rx", "sp", [-1, 3]], ["auto_unroll_max_step", "ot", 512], ["unroll_explicit", "ot", 0]]}, "result": [[0.002294543340909091, 0.0022947840227272726, 0.002294922909090909], 0, 1.2691290378570557, 1678633590.2867017], "version": 0.2, "tvm_version": "0.10.0"}
{"input": ["cuda -keys=cuda,gpu -arch=sm_75 -max_num_threads=1024 -thread_warp_size=32", "conv2d_nchw.cuda", [["TENSOR", [1, 96, 35, 35], "float32"], ["TENSOR", [96, 96, 3, 3], "float32"], [1, 1], [1, 1, 1, 1], [1, 1], "float32"], {}], "config": {"index": 15156737, "code_hash": null, "entity": [["tile_f", "sp", [-1, 2, 1, 1]], ["tile_y", "sp", [-1, 1, 1, 1]], ["tile_x", "sp", [-1, 7, 5, 1]], ["tile_rc", "sp", [-1, 1]], ["tile_ry", "sp", [-1, 1]], ["tile_rx", "sp", [-1, 3]], ["auto_unroll_max_step", "ot", 1500], ["unroll_explicit", "ot", 1]]}, "result": [[0.002235642311111111, 0.0022361336444444444, 0.0022364194888888885], 0, 1.435889482498169, 1678633591.1764708], "version": 0.2, "tvm_version": "0.10.0"}
{"input": ["cuda -keys=cuda,gpu -arch=sm_75 -max_num_threads=1024 -thread_warp_size=32", "conv2d_nchw.cuda", [["TENSOR", [1, 96, 35, 35], "float32"], ["TENSOR", [96, 96, 3, 3], "float32"], [1, 1], [1, 1, 1, 1], [1, 1], "float32"], {}], "config": {"index": 9651713, "code_hash": null, "entity": [["tile_f", "sp", [-1, 2, 1, 1]], ["tile_y", "sp", [-1, 1, 1, 1]], ["tile_x", "sp", [-1, 7, 5, 1]], ["tile_rc", "sp", [-1, 1]], ["tile_ry", "sp", [-1, 1]], ["tile_rx", "sp", [-1, 3]], ["auto_unroll_max_step", "ot", 0], ["unroll_explicit", "ot", 1]]}, "result": [[0.0022946444318181817, 0.002294868295454545, 0.0022952029318181817], 0, 1.3836336135864258, 1678633592.060868], "version": 0.2, "tvm_version": "0.10.0"}
{"input": ["cuda -keys=cuda,gpu -arch=sm_75 -max_num_threads=1024 -thread_warp_size=32", "conv2d_nchw.cuda", [["TENSOR", [1, 96, 35, 35], "float32"], ["TENSOR", [96, 96, 3, 3], "float32"], [1, 1], [1, 1, 1, 1], [1, 1], "float32"], {}], "config": {"index": 13092353, "code_hash": null, "entity": [["tile_f", "sp", [-1, 2, 1, 1]], ["tile_y", "sp", [-1, 1, 1, 1]], ["tile_x", "sp", [-1, 7, 5, 1]], ["tile_rc", "sp", [-1, 1]], ["tile_ry", "sp", [-1, 3]], ["tile_rx", "sp", [-1, 3]], ["auto_unroll_max_step", "ot", 512], ["unroll_explicit", "ot", 1]]}, "result": [[0.001948177173076923, 0.0019483476730769232, 0.0019484239615384614], 0, 1.6549651622772217, 1678633592.9588943], "version": 0.2, "tvm_version": "0.10.0"}
{"input": ["cuda -keys=cuda,gpu -arch=sm_75 -max_num_threads=1024 -thread_warp_size=32", "conv2d_nchw.cuda", [["TENSOR", [1, 96, 35, 35], "float32"], ["TENSOR", [96, 96, 3, 3], "float32"], [1, 1], [1, 1, 1, 1], [1, 1], "float32"], {}], "config": {"index": 12461569, "code_hash": null, "entity": [["tile_f", "sp", [-1, 2, 1, 1]], ["tile_y", "sp", [-1, 1, 1, 1]], ["tile_x", "sp", [-1, 7, 5, 1]], ["tile_rc", "sp", [-1, 2]], ["tile_ry", "sp", [-1, 1]], ["tile_rx", "sp", [-1, 3]], ["auto_unroll_max_step", "ot", 512], ["unroll_explicit", "ot", 1]]}, "result": [[0.0021465585531914894, 0.0021466137446808507, 0.00214701485106383], 0, 1.6841740608215332, 1678633593.8396764], "version": 0.2, "tvm_version": "0.10.0"}
{"input": ["cuda -keys=cuda,gpu -arch=sm_75 -max_num_threads=1024 -thread_warp_size=32", "conv2d_nchw.cuda", [["TENSOR", [1, 96, 35, 35], "float32"], ["TENSOR", [96, 96, 3, 3], "float32"], [1, 1], [1, 1, 1, 1], [1, 1], "float32"], {}], "config": {"index": 12407809, "code_hash": null, "entity": [["tile_f", "sp", [-1, 2, 1, 1]], ["tile_y", "sp", [-1, 1, 1, 1]], ["tile_x", "sp", [-1, 1, 7, 1]], ["tile_rc", "sp", [-1, 1]], ["tile_ry", "sp", [-1, 1]], ["tile_rx", "sp", [-1, 3]], ["auto_unroll_max_step", "ot", 512], ["unroll_explicit", "ot", 1]]}, "result": [[0.0036273187857142858, 0.003629517678571429, 0.0036296628928571425], 0, 1.3383874893188477, 1678633594.7212272], "version": 0.2, "tvm_version": "0.10.0"}
{"input": ["cuda -keys=cuda,gpu -arch=sm_75 -max_num_threads=1024 -thread_warp_size=32", "conv2d_nchw.cuda", [["TENSOR", [1, 96, 35, 35], "float32"], ["TENSOR", [96, 96, 3, 3], "float32"], [1, 1], [1, 1, 1, 1], [1, 1], "float32"], {}], "config": {"index": 12400641, "code_hash": null, "entity": [["tile_f", "sp", [-1, 2, 1, 1]], ["tile_y", "sp", [-1, 1, 1, 1]], ["tile_x", "sp", [-1, 1, 5, 1]], ["tile_rc", "sp", [-1, 1]], ["tile_ry", "sp", [-1, 1]], ["tile_rx", "sp", [-1, 3]], ["auto_unroll_max_step", "ot", 512], ["unroll_explicit", "ot", 1]]}, "result": [[0.005720806944444445, 0.0057212159444444445, 0.005721415166666666], 0, 1.3427820205688477, 1678633595.6435292], "version": 0.2, "tvm_version": "0.10.0"}
{"input": ["cuda -keys=cuda,gpu -arch=sm_75 -max_num_threads=1024 -thread_warp_size=32", "conv2d_nchw.cuda", [["TENSOR", [1, 96, 35, 35], "float32"], ["TENSOR", [96, 96, 3, 3], "float32"], [1, 1], [1, 1, 1, 1], [1, 1], "float32"], {}], "config": {"index": 12404449, "code_hash": null, "entity": [["tile_f", "sp", [-1, 2, 1, 1]], ["tile_y", "sp", [-1, 5, 1, 1]], ["tile_x", "sp", [-1, 7, 5, 1]], ["tile_rc", "sp", [-1, 1]], ["tile_ry", "sp", [-1, 1]], ["tile_rx", "sp", [-1, 3]], ["auto_unroll_max_step", "ot", 512], ["unroll_explicit", "ot", 1]]}, "result": [[0.0018756640370370373, 0.0018758862777777778, 0.0018760859074074075], 0, 1.6773717403411865, 1678633596.5423803], "version": 0.2, "tvm_version": "0.10.0"}
{"input": ["cuda -keys=cuda,gpu -arch=sm_75 -max_num_threads=1024 -thread_warp_size=32", "conv2d_nchw.cuda", [["TENSOR", [1, 96, 35, 35], "float32"], ["TENSOR", [96, 96, 3, 3], "float32"], [1, 1], [1, 1, 1, 1], [1, 1], "float32"], {}], "config": {"index": 12404226, "code_hash": null, "entity": [["tile_f", "sp", [-1, 3, 1, 1]], ["tile_y", "sp", [-1, 1, 1, 1]], ["tile_x", "sp", [-1, 7, 5, 1]], ["tile_rc", "sp", [-1, 1]], ["tile_ry", "sp", [-1, 1]], ["tile_rx", "sp", [-1, 3]], ["auto_unroll_max_step", "ot", 512], ["unroll_explicit", "ot", 1]]}, "result": [[0.00157499253125, 0.00157525753125, 0.00157545196875], 0, 1.5068378448486328, 1678633597.4342618], "version": 0.2, "tvm_version": "0.10.0"}
{"input": ["cuda -keys=cuda,gpu -arch=sm_75 -max_num_threads=1024 -thread_warp_size=32", "conv2d_nchw.cuda", [["TENSOR", [1, 96, 35, 35], "float32"], ["TENSOR", [96, 96, 3, 3], "float32"], [1, 1], [1, 1, 1, 1], [1, 1], "float32"], {}], "config": {"index": 4146690, "code_hash": null, "entity": [["tile_f", "sp", [-1, 3, 1, 1]], ["tile_y", "sp", [-1, 1, 1, 1]], ["tile_x", "sp", [-1, 7, 5, 1]], ["tile_rc", "sp", [-1, 1]], ["tile_ry", "sp", [-1, 1]], ["tile_rx", "sp", [-1, 3]], ["auto_unroll_max_step", "ot", 512], ["unroll_explicit", "ot", 0]]}, "result": [[0.0016154884677419355, 0.0016154999193548388, 0.0016159318387096776], 0, 1.2285330295562744, 1678633599.367766], "version": 0.2, "tvm_version": "0.10.0"}
{"input": ["cuda -keys=cuda,gpu -arch=sm_75 -max_num_threads=1024 -thread_warp_size=32", "conv2d_nchw.cuda", [["TENSOR", [1, 96, 35, 35], "float32"], ["TENSOR", [96, 96, 3, 3], "float32"], [1, 1], [1, 1, 1, 1], [1, 1], "float32"], {}], "config": {"index": 15156738, "code_hash": null, "entity": [["tile_f", "sp", [-1, 3, 1, 1]], ["tile_y", "sp", [-1, 1, 1, 1]], ["tile_x", "sp", [-1, 7, 5, 1]], ["tile_rc", "sp", [-1, 1]], ["tile_ry", "sp", [-1, 1]], ["tile_rx", "sp", [-1, 3]], ["auto_unroll_max_step", "ot", 1500], ["unroll_explicit", "ot", 1]]}, "result": [[0.0015753279843750002, 0.0015754319375000001, 0.0015754879687500001], 0, 1.3871285915374756, 1678633600.243473], "version": 0.2, "tvm_version": "0.10.0"}
{"input": ["cuda -keys=cuda,gpu -arch=sm_75 -max_num_threads=1024 -thread_warp_size=32", "conv2d_nchw.cuda", [["TENSOR", [1, 96, 35, 35], "float32"], ["TENSOR", [96, 96, 3, 3], "float32"], [1, 1], [1, 1, 1, 1], [1, 1], "float32"], {}], "config": {"index": 9651714, "code_hash": null, "entity": [["tile_f", "sp", [-1, 3, 1, 1]], ["tile_y", "sp", [-1, 1, 1, 1]], ["tile_x", "sp", [-1, 7, 5, 1]], ["tile_rc", "sp", [-1, 1]], ["tile_ry", "sp", [-1, 1]], ["tile_rx", "sp", [-1, 3]], ["auto_unroll_max_step", "ot", 0], ["unroll_explicit", "ot", 1]]}, "result": [[0.0016174044354838712, 0.001617459564516129, 0.001617463741935484], 0, 1.3029019832611084, 1678633601.1222405], "version": 0.2, "tvm_version": "0.10.0"}
{"input": ["cuda -keys=cuda,gpu -arch=sm_75 -max_num_threads=1024 -thread_warp_size=32", "conv2d_nchw.cuda", [["TENSOR", [1, 96, 35, 35], "float32"], ["TENSOR", [96, 96, 3, 3], "float32"], [1, 1], [1, 1, 1, 1], [1, 1], "float32"], {}], "config": {"index": 13092354, "code_hash": null, "entity": [["tile_f", "sp", [-1, 3, 1, 1]], ["tile_y", "sp", [-1, 1, 1, 1]], ["tile_x", "sp", [-1, 7, 5, 1]], ["tile_rc", "sp", [-1, 1]], ["tile_ry", "sp", [-1, 3]], ["tile_rx", "sp", [-1, 3]], ["auto_unroll_max_step", "ot", 512], ["unroll_explicit", "ot", 1]]}, "result": [[0.0013835782602739726, 0.0013836729452054795, 0.0013837186164383562], 0, 1.5615627765655518, 1678633601.9872456], "version": 0.2, "tvm_version": "0.10.0"}
{"input": ["cuda -keys=cuda,gpu -arch=sm_75 -max_num_threads=1024 -thread_warp_size=32", "conv2d_nchw.cuda", [["TENSOR", [1, 96, 35, 35], "float32"], ["TENSOR", [96, 96, 3, 3], "float32"], [1, 1], [1, 1, 1, 1], [1, 1], "float32"], {}], "config": {"index": 12461570, "code_hash": null, "entity": [["tile_f", "sp", [-1, 3, 1, 1]], ["tile_y", "sp", [-1, 1, 1, 1]], ["tile_x", "sp", [-1, 7, 5, 1]], ["tile_rc", "sp", [-1, 2]], ["tile_ry", "sp", [-1, 1]], ["tile_rx", "sp", [-1, 3]], ["auto_unroll_max_step", "ot", 512], ["unroll_explicit", "ot", 1]]}, "result": [[0.0014895223676470587, 0.0014896493676470589, 0.0014896791029411765], 0, 1.805793046951294, 1678633602.8830066], "version": 0.2, "tvm_version": "0.10.0"}
{"input": ["cuda -keys=cuda,gpu -arch=sm_75 -max_num_threads=1024 -thread_warp_size=32", "conv2d_nchw.cuda", [["TENSOR", [1, 96, 35, 35], "float32"], ["TENSOR", [96, 96, 3, 3], "float32"], [1, 1], [1, 1, 1, 1], [1, 1], "float32"], {}], "config": {"index": 12407810, "code_hash": null, "entity": [["tile_f", "sp", [-1, 3, 1, 1]], ["tile_y", "sp", [-1, 1, 1, 1]], ["tile_x", "sp", [-1, 1, 7, 1]], ["tile_rc", "sp", [-1, 1]], ["tile_ry", "sp", [-1, 1]], ["tile_rx", "sp", [-1, 3]], ["auto_unroll_max_step", "ot", 512], ["unroll_explicit", "ot", 1]]}, "result": [[0.0029882729411764707, 0.0029882729411764707, 0.0029888150588235295], 0, 1.3880562782287598, 1678633603.7685273], "version": 0.2, "tvm_version": "0.10.0"}
{"input": ["cuda -keys=cuda,gpu -arch=sm_75 -max_num_threads=1024 -thread_warp_size=32", "conv2d_nchw.cuda", [["TENSOR", [1, 96, 35, 35], "float32"], ["TENSOR", [96, 96, 3, 3], "float32"], [1, 1], [1, 1, 1, 1], [1, 1], "float32"], {}], "config": {"index": 12400642, "code_hash": null, "entity": [["tile_f", "sp", [-1, 3, 1, 1]], ["tile_y", "sp", [-1, 1, 1, 1]], ["tile_x", "sp", [-1, 1, 5, 1]], ["tile_rc", "sp", [-1, 1]], ["tile_ry", "sp", [-1, 1]], ["tile_rx", "sp", [-1, 3]], ["auto_unroll_max_step", "ot", 512], ["unroll_explicit", "ot", 1]]}, "result": [[0.0041660405, 0.004166281447368421, 0.004166287868421052], 0, 1.7864971160888672, 1678633605.050325], "version": 0.2, "tvm_version": "0.10.0"}
{"input": ["cuda -keys=cuda,gpu -arch=sm_75 -max_num_threads=1024 -thread_warp_size=32", "conv2d_nchw.cuda", [["TENSOR", [1, 96, 35, 35], "float32"], ["TENSOR", [96, 96, 3, 3], "float32"], [1, 1], [1, 1, 1, 1], [1, 1], "float32"], {}], "config": {"index": 12404450, "code_hash": null, "entity": [["tile_f", "sp", [-1, 3, 1, 1]], ["tile_y", "sp", [-1, 5, 1, 1]], ["tile_x", "sp", [-1, 7, 5, 1]], ["tile_rc", "sp", [-1, 1]], ["tile_ry", "sp", [-1, 1]], ["tile_rx", "sp", [-1, 3]], ["auto_unroll_max_step", "ot", 512], ["unroll_explicit", "ot", 1]]}, "result": [[0.0012887401025641024, 0.0012891224487179488, 0.0012892262307692309], 0, 1.878589391708374, 1678633605.9432905], "version": 0.2, "tvm_version": "0.10.0"}
{"input": ["cuda -keys=cuda,gpu -arch=sm_75 -max_num_threads=1024 -thread_warp_size=32", "conv2d_nchw.cuda", [["TENSOR", [1, 96, 35, 35], "float32"], ["TENSOR", [96, 96, 3, 3], "float32"], [1, 1], [1, 1, 1, 1], [1, 1], "float32"], {}], "config": {"index": 12404227, "code_hash": null, "entity": [["tile_f", "sp", [-1, 4, 1, 1]], ["tile_y", "sp", [-1, 1, 1, 1]], ["tile_x", "sp", [-1, 7, 5, 1]], ["tile_rc", "sp", [-1, 1]], ["tile_ry", "sp", [-1, 1]], ["tile_rx", "sp", [-1, 3]], ["auto_unroll_max_step", "ot", 512], ["unroll_explicit", "ot", 1]]}, "result": [[0.0013659830810810812, 0.0013663022837837838, 0.0013667057027027026], 0, 1.4255445003509521, 1678633606.8382885], "version": 0.2, "tvm_version": "0.10.0"}
{"input": ["cuda -keys=cuda,gpu -arch=sm_75 -max_num_threads=1024 -thread_warp_size=32", "conv2d_nchw.cuda", [["TENSOR", [1, 96, 35, 35], "float32"], ["TENSOR", [96, 96, 3, 3], "float32"], [1, 1], [1, 1, 1, 1], [1, 1], "float32"], {}], "config": {"index": 4146914, "code_hash": null, "entity": [["tile_f", "sp", [-1, 3, 1, 1]], ["tile_y", "sp", [-1, 5, 1, 1]], ["tile_x", "sp", [-1, 7, 5, 1]], ["tile_rc", "sp", [-1, 1]], ["tile_ry", "sp", [-1, 1]], ["tile_rx", "sp", [-1, 3]], ["auto_unroll_max_step", "ot", 512], ["unroll_explicit", "ot", 0]]}, "result": [[0.0012905668969072164, 0.001296257329896907, 0.0016748203166666667], 0, 1.8061800003051758, 1678633609.9256597], "version": 0.2, "tvm_version": "0.10.0"}
{"input": ["cuda -keys=cuda,gpu -arch=sm_75 -max_num_threads=1024 -thread_warp_size=32", "conv2d_nchw.cuda", [["TENSOR", [1, 96, 35, 35], "float32"], ["TENSOR", [96, 96, 3, 3], "float32"], [1, 1], [1, 1, 1, 1], [1, 1], "float32"], {}], "config": {"index": 15156962, "code_hash": null, "entity": [["tile_f", "sp", [-1, 3, 1, 1]], ["tile_y", "sp", [-1, 5, 1, 1]], ["tile_x", "sp", [-1, 7, 5, 1]], ["tile_rc", "sp", [-1, 1]], ["tile_ry", "sp", [-1, 1]], ["tile_rx", "sp", [-1, 3]], ["auto_unroll_max_step", "ot", 1500], ["unroll_explicit", "ot", 1]]}, "result": [[0.0012627182598425198, 0.0012630586377952754, 0.0012630609212598424], 0, 2.814882278442383, 1678633611.1371646], "version": 0.2, "tvm_version": "0.10.0"}
{"input": ["cuda -keys=cuda,gpu -arch=sm_75 -max_num_threads=1024 -thread_warp_size=32", "conv2d_nchw.cuda", [["TENSOR", [1, 96, 35, 35], "float32"], ["TENSOR", [96, 96, 3, 3], "float32"], [1, 1], [1, 1, 1, 1], [1, 1], "float32"], {}], "config": {"index": 9651938, "code_hash": null, "entity": [["tile_f", "sp", [-1, 3, 1, 1]], ["tile_y", "sp", [-1, 5, 1, 1]], ["tile_x", "sp", [-1, 7, 5, 1]], ["tile_rc", "sp", [-1, 1]], ["tile_ry", "sp", [-1, 1]], ["tile_rx", "sp", [-1, 3]], ["auto_unroll_max_step", "ot", 0], ["unroll_explicit", "ot", 1]]}, "result": [[0.00134687448, 0.0013468748933333334, 0.0013469013466666667], 0, 1.6125783920288086, 1678633612.0033367], "version": 0.2, "tvm_version": "0.10.0"}
{"input": ["cuda -keys=cuda,gpu -arch=sm_75 -max_num_threads=1024 -thread_warp_size=32", "conv2d_nchw.cuda", [["TENSOR", [1, 96, 35, 35], "float32"], ["TENSOR", [96, 96, 3, 3], "float32"], [1, 1], [1, 1, 1, 1], [1, 1], "float32"], {}], "config": {"index": 11028194, "code_hash": null, "entity": [["tile_f", "sp", [-1, 3, 1, 1]], ["tile_y", "sp", [-1, 5, 1, 1]], ["tile_x", "sp", [-1, 7, 5, 1]], ["tile_rc", "sp", [-1, 1]], ["tile_ry", "sp", [-1, 1]], ["tile_rx", "sp", [-1, 1]], ["auto_unroll_max_step", "ot", 512], ["unroll_explicit", "ot", 1]]}, "result": [[0.002418883, 0.0024190971666666664, 0.0024192944285714286], 0, 2.2711496353149414, 1678633612.910947], "version": 0.2, "tvm_version": "0.10.0"}
{"input": ["cuda -keys=cuda,gpu -arch=sm_75 -max_num_threads=1024 -thread_warp_size=32", "conv2d_nchw.cuda", [["TENSOR", [1, 96, 35, 35], "float32"], ["TENSOR", [96, 96, 3, 3], "float32"], [1, 1], [1, 1, 1, 1], [1, 1], "float32"], {}], "config": {"index": 13092578, "code_hash": null, "entity": [["tile_f", "sp", [-1, 3, 1, 1]], ["tile_y", "sp", [-1, 5, 1, 1]], ["tile_x", "sp", [-1, 7, 5, 1]], ["tile_rc", "sp", [-1, 1]], ["tile_ry", "sp", [-1, 3]], ["tile_rx", "sp", [-1, 3]], ["auto_unroll_max_step", "ot", 512], ["unroll_explicit", "ot", 1]]}, "result": [[0.0009732600776699029, 0.0009732828155339806, 0.0009732902233009708], 0, 2.423527240753174, 1678633613.801499], "version": 0.2, "tvm_version": "0.10.0"}
{"input": ["cuda -keys=cuda,gpu -arch=sm_75 -max_num_threads=1024 -thread_warp_size=32", "conv2d_nchw.cuda", [["TENSOR", [1, 96, 35, 35], "float32"], ["TENSOR", [96, 96, 3, 3], "float32"], [1, 1], [1, 1, 1, 1], [1, 1], "float32"], {}], "config": {"index": 12461794, "code_hash": null, "entity": [["tile_f", "sp", [-1, 3, 1, 1]], ["tile_y", "sp", [-1, 5, 1, 1]], ["tile_x", "sp", [-1, 7, 5, 1]], ["tile_rc", "sp", [-1, 2]], ["tile_ry", "sp", [-1, 1]], ["tile_rx", "sp", [-1, 3]], ["auto_unroll_max_step", "ot", 512], ["unroll_explicit", "ot", 1]]}, "result": [[0.0013688951864406777, 0.0013690323898305082, 0.0013691031186440679], 0, 2.696711540222168, 1678633615.1009583], "version": 0.2, "tvm_version": "0.10.0"}
{"input": ["cuda -keys=cuda,gpu -arch=sm_75 -max_num_threads=1024 -thread_warp_size=32", "conv2d_nchw.cuda", [["TENSOR", [1, 96, 35, 35], "float32"], ["TENSOR", [96, 96, 3, 3], "float32"], [1, 1], [1, 1, 1, 1], [1, 1], "float32"], {}], "config": {"index": 12408034, "code_hash": null, "entity": [["tile_f", "sp", [-1, 3, 1, 1]], ["tile_y", "sp", [-1, 5, 1, 1]], ["tile_x", "sp", [-1, 1, 7, 1]], ["tile_rc", "sp", [-1, 1]], ["tile_ry", "sp", [-1, 1]], ["tile_rx", "sp", [-1, 3]], ["auto_unroll_max_step", "ot", 512], ["unroll_explicit", "ot", 1]]}, "result": [[0.0014154843521126759, 0.001415615985915493, 0.0014156755211267606], 0, 1.4812250137329102, 1678633615.971358], "version": 0.2, "tvm_version": "0.10.0"}
{"input": ["cuda -keys=cuda,gpu -arch=sm_75 -max_num_threads=1024 -thread_warp_size=32", "conv2d_nchw.cuda", [["TENSOR", [1, 96, 35, 35], "float32"], ["TENSOR", [96, 96, 3, 3], "float32"], [1, 1], [1, 1, 1, 1], [1, 1], "float32"], {}], "config": {"index": 12400866, "code_hash": null, "entity": [["tile_f", "sp", [-1, 3, 1, 1]], ["tile_y", "sp", [-1, 5, 1, 1]], ["tile_x", "sp", [-1, 1, 5, 1]], ["tile_rc", "sp", [-1, 1]], ["tile_ry", "sp", [-1, 1]], ["tile_rx", "sp", [-1, 3]], ["auto_unroll_max_step", "ot", 512], ["unroll_explicit", "ot", 1]]}, "result": [[0.001999870137254902, 0.0020009524705882353, 0.002001015156862745], 0, 1.4318749904632568, 1678633616.876489], "version": 0.2, "tvm_version": "0.10.0"}
{"input": ["cuda -keys=cuda,gpu -arch=sm_75 -max_num_threads=1024 -thread_warp_size=32", "conv2d_nchw.cuda", [["TENSOR", [1, 96, 35, 35], "float32"], ["TENSOR", [96, 96, 3, 3], "float32"], [1, 1], [1, 1, 1, 1], [1, 1], "float32"], {}], "config": {"index": 12404674, "code_hash": null, "entity": [["tile_f", "sp", [-1, 3, 1, 1]], ["tile_y", "sp", [-1, 7, 1, 1]], ["tile_x", "sp", [-1, 7, 5, 1]], ["tile_rc", "sp", [-1, 1]], ["tile_ry", "sp", [-1, 1]], ["tile_rx", "sp", [-1, 3]], ["auto_unroll_max_step", "ot", 512], ["unroll_explicit", "ot", 1]]}, "result": [[0.002722783054054054, 0.0027330837567567565, 0.0027384303243243244], 0, 2.792797088623047, 1678633617.7769613], "version": 0.2, "tvm_version": "0.10.0"}
{"input": ["cuda -keys=cuda,gpu -arch=sm_75 -max_num_threads=1024 -thread_warp_size=32", "conv2d_nchw.cuda", [["TENSOR", [1, 96, 35, 35], "float32"], ["TENSOR", [96, 96, 3, 3], "float32"], [1, 1], [1, 1, 1, 1], [1, 1], "float32"], {}], "config": {"index": 12404451, "code_hash": null, "entity": [["tile_f", "sp", [-1, 4, 1, 1]], ["tile_y", "sp", [-1, 5, 1, 1]], ["tile_x", "sp", [-1, 7, 5, 1]], ["tile_rc", "sp", [-1, 1]], ["tile_ry", "sp", [-1, 1]], ["tile_rx", "sp", [-1, 3]], ["auto_unroll_max_step", "ot", 512], ["unroll_explicit", "ot", 1]]}, "result": [[0.0010085754375, 0.001008623025, 0.0010087778062500001], 0, 2.4642908573150635, 1678633619.0173051], "version": 0.2, "tvm_version": "0.10.0"}
{"input": ["cuda -keys=cuda,gpu -arch=sm_75 -max_num_threads=1024 -thread_warp_size=32", "conv2d_nchw.cuda", [["TENSOR", [1, 96, 35, 35], "float32"], ["TENSOR", [96, 96, 3, 3], "float32"], [1, 1], [1, 1, 1, 1], [1, 1], "float32"], {}], "config": {"index": 4835042, "code_hash": null, "entity": [["tile_f", "sp", [-1, 3, 1, 1]], ["tile_y", "sp", [-1, 5, 1, 1]], ["tile_x", "sp", [-1, 7, 5, 1]], ["tile_rc", "sp", [-1, 1]], ["tile_ry", "sp", [-1, 3]], ["tile_rx", "sp", [-1, 3]], ["auto_unroll_max_step", "ot", 512], ["unroll_explicit", "ot", 0]]}, "result": [[0.001476169130952381, 0.0014781435952380953, 0.0014792404166666666], 0, 2.149120569229126, 1678633623.9033086], "version": 0.2, "tvm_version": "0.10.0"}
{"input": ["cuda -keys=cuda,gpu -arch=sm_75 -max_num_threads=1024 -thread_warp_size=32", "conv2d_nchw.cuda", [["TENSOR", [1, 96, 35, 35], "float32"], ["TENSOR", [96, 96, 3, 3], "float32"], [1, 1], [1, 1, 1, 1], [1, 1], "float32"], {}], "config": {"index": 15845090, "code_hash": null, "entity": [["tile_f", "sp", [-1, 3, 1, 1]], ["tile_y", "sp", [-1, 5, 1, 1]], ["tile_x", "sp", [-1, 7, 5, 1]], ["tile_rc", "sp", [-1, 1]], ["tile_ry", "sp", [-1, 3]], ["tile_rx", "sp", [-1, 3]], ["auto_unroll_max_step", "ot", 1500], ["unroll_explicit", "ot", 1]]}, "result": [[0.000809752417085427, 0.0008114111005025125, 0.0008124100552763818], 0, 3.3665380477905273, 1678633625.1370745], "version": 0.2, "tvm_version": "0.10.0"}
{"input": ["cuda -keys=cuda,gpu -arch=sm_75 -max_num_threads=1024 -thread_warp_size=32", "conv2d_nchw.cuda", [["TENSOR", [1, 96, 35, 35], "float32"], ["TENSOR", [96, 96, 3, 3], "float32"], [1, 1], [1, 1, 1, 1], [1, 1], "float32"], {}], "config": {"index": 10340066, "code_hash": null, "entity": [["tile_f", "sp", [-1, 3, 1, 1]], ["tile_y", "sp", [-1, 5, 1, 1]], ["tile_x", "sp", [-1, 7, 5, 1]], ["tile_rc", "sp", [-1, 1]], ["tile_ry", "sp", [-1, 3]], ["tile_rx", "sp", [-1, 3]], ["auto_unroll_max_step", "ot", 0], ["unroll_explicit", "ot", 1]]}, "result": [[0.00132765147107438, 0.001327866223140496, 0.001327892082644628], 0, 1.818936824798584, 1678633626.3303733], "version": 0.2, "tvm_version": "0.10.0"}
{"input": ["cuda -keys=cuda,gpu -arch=sm_75 -max_num_threads=1024 -thread_warp_size=32", "conv2d_nchw.cuda", [["TENSOR", [1, 96, 35, 35], "float32"], ["TENSOR", [96, 96, 3, 3], "float32"], [1, 1], [1, 1, 1, 1], [1, 1], "float32"], {}], "config": {"index": 11716322, "code_hash": null, "entity": [["tile_f", "sp", [-1, 3, 1, 1]], ["tile_y", "sp", [-1, 5, 1, 1]], ["tile_x", "sp", [-1, 7, 5, 1]], ["tile_rc", "sp", [-1, 1]], ["tile_ry", "sp", [-1, 3]], ["tile_rx", "sp", [-1, 1]], ["auto_unroll_max_step", "ot", 512], ["unroll_explicit", "ot", 1]]}, "result": [[0.002160156040540541, 0.0021614425135135134, 0.002162272878378378], 0, 2.736539840698242, 1678633627.6164436], "version": 0.2, "tvm_version": "0.10.0"}
