src/tvm/results/cuda_rtx3080/inception_v3/xgb/cpu.log_layer_36.log
{"input": ["cuda -keys=cuda,gpu -arch=sm_86 -max_num_threads=1024 -thread_warp_size=32", "conv2d_nchw.cuda", [["TENSOR", [1, 192, 17, 17], "float32"], ["TENSOR", [320, 192, 3, 3], "float32"], [2, 2], [0, 0, 0, 0], [1, 1], "float32"], {}], "config": {"index": 16945363, "code_hash": null, "entity": [["tile_f", "sp", [-1, 2, 8, 5]], ["tile_y", "sp", [-1, 4, 1, 2]], ["tile_x", "sp", [-1, 2, 1, 1]], ["tile_rc", "sp", [-1, 1]], ["tile_ry", "sp", [-1, 3]], ["tile_rx", "sp", [-1, 1]], ["auto_unroll_max_step", "ot", 1500], ["unroll_explicit", "ot", 0]]}, "result": [[0.0005090602287822878, 0.0005149964022140221, 0.0005956327797619047], 0, 1.7149763107299805, 1679425598.128234], "version": 0.2, "tvm_version": "0.10.0"}
{"input": ["cuda -keys=cuda,gpu -arch=sm_86 -max_num_threads=1024 -thread_warp_size=32", "conv2d_nchw.cuda", [["TENSOR", [1, 192, 17, 17], "float32"], ["TENSOR", [320, 192, 3, 3], "float32"], [2, 2], [0, 0, 0, 0], [1, 1], "float32"], {}], "config": {"index": 28918428, "code_hash": null, "entity": [["tile_f", "sp", [-1, 4, 1, 10]], ["tile_y", "sp", [-1, 4, 2, 1]], ["tile_x", "sp", [-1, 8, 1, 1]], ["tile_rc", "sp", [-1, 8]], ["tile_ry", "sp", [-1, 3]], ["tile_rx", "sp", [-1, 3]], ["auto_unroll_max_step", "ot", 0], ["unroll_explicit", "ot", 1]]}, "result": [[0.013303159625, 0.01330316825, 0.013304832375], 0, 2.475705623626709, 1679425599.0379376], "version": 0.2, "tvm_version": "0.10.0"}
{"input": ["cuda -keys=cuda,gpu -arch=sm_86 -max_num_threads=1024 -thread_warp_size=32", "conv2d_nchw.cuda", [["TENSOR", [1, 192, 17, 17], "float32"], ["TENSOR", [320, 192, 3, 3], "float32"], [2, 2], [0, 0, 0, 0], [1, 1], "float32"], {}], "config": {"index": 24933580, "code_hash": null, "entity": [["tile_f", "sp", [-1, 4, 4, 1]], ["tile_y", "sp", [-1, 1, 4, 1]], ["tile_x", "sp", [-1, 1, 1, 2]], ["tile_rc", "sp", [-1, 4]], ["tile_ry", "sp", [-1, 3]], ["tile_rx", "sp", [-1, 1]], ["auto_unroll_max_step", "ot", 0], ["unroll_explicit", "ot", 1]]}, "result": [[7.797810392156863e-05, 7.799717745098039e-05, 7.801926519607844e-05], 0, 1.5257744789123535, 1679425600.183485], "version": 0.2, "tvm_version": "0.10.0"}
{"input": ["cuda -keys=cuda,gpu -arch=sm_86 -max_num_threads=1024 -thread_warp_size=32", "conv2d_nchw.cuda", [["TENSOR", [1, 192, 17, 17], "float32"], ["TENSOR", [320, 192, 3, 3], "float32"], [2, 2], [0, 0, 0, 0], [1, 1], "float32"], {}], "config": {"index": 30333600, "code_hash": null, "entity": [["tile_f", "sp", [-1, 1, 1, 5]], ["tile_y", "sp", [-1, 1, 2, 4]], ["tile_x", "sp", [-1, 1, 2, 2]], ["tile_rc", "sp", [-1, 2]], ["tile_ry", "sp", [-1, 1]], ["tile_rx", "sp", [-1, 1]], ["auto_unroll_max_step", "ot", 512], ["unroll_explicit", "ot", 1]]}, "result": [[0.000314399986328125, 0.00031441000000000005, 0.000314413994140625], 0, 2.5616934299468994, 1679425601.4183474], "version": 0.2, "tvm_version": "0.10.0"}
{"input": ["cuda -keys=cuda,gpu -arch=sm_86 -max_num_threads=1024 -thread_warp_size=32", "conv2d_nchw.cuda", [["TENSOR", [1, 192, 17, 17], "float32"], ["TENSOR", [320, 192, 3, 3], "float32"], [2, 2], [0, 0, 0, 0], [1, 1], "float32"], {}], "config": {"index": 1664064, "code_hash": null, "entity": [["tile_f", "sp", [-1, 1, 1, 5]], ["tile_y", "sp", [-1, 4, 1, 2]], ["tile_x", "sp", [-1, 1, 4, 1]], ["tile_rc", "sp", [-1, 96]], ["tile_ry", "sp", [-1, 1]], ["tile_rx", "sp", [-1, 1]], ["auto_unroll_max_step", "ot", 0], ["unroll_explicit", "ot", 0]]}, "result": [[0.0022777017954545456, 0.0022777250454545455, 0.0022777482727272726], 0, 1.2083714008331299, 1679425602.250401], "version": 0.2, "tvm_version": "0.10.0"}
{"input": ["cuda -keys=cuda,gpu -arch=sm_86 -max_num_threads=1024 -thread_warp_size=32", "conv2d_nchw.cuda", [["TENSOR", [1, 192, 17, 17], "float32"], ["TENSOR", [320, 192, 3, 3], "float32"], [2, 2], [0, 0, 0, 0], [1, 1], "float32"], {}], "config": {"index": 39842864, "code_hash": null, "entity": [["tile_f", "sp", [-1, 1, 4, 40]], ["tile_y", "sp", [-1, 1, 1, 8]], ["tile_x", "sp", [-1, 2, 4, 1]], ["tile_rc", "sp", [-1, 3]], ["tile_ry", "sp", [-1, 3]], ["tile_rx", "sp", [-1, 1]], ["auto_unroll_max_step", "ot", 1500], ["unroll_explicit", "ot", 1]]}, "result": [[0.0109483009, 0.0109504508, 0.0109505439], 0, 4.656903028488159, 1679425603.1643958], "version": 0.2, "tvm_version": "0.10.0"}
{"input": ["cuda -keys=cuda,gpu -arch=sm_86 -max_num_threads=1024 -thread_warp_size=32", "conv2d_nchw.cuda", [["TENSOR", [1, 192, 17, 17], "float32"], ["TENSOR", [320, 192, 3, 3], "float32"], [2, 2], [0, 0, 0, 0], [1, 1], "float32"], {}], "config": {"index": 7838794, "code_hash": null, "entity": [["tile_f", "sp", [-1, 1, 1, 10]], ["tile_y", "sp", [-1, 1, 8, 1]], ["tile_x", "sp", [-1, 4, 2, 1]], ["tile_rc", "sp", [-1, 3]], ["tile_ry", "sp", [-1, 1]], ["tile_rx", "sp", [-1, 1]], ["auto_unroll_max_step", "ot", 512], ["unroll_explicit", "ot", 0]]}, "result": [[0.00041885288571428576, 0.00041885855324675324, 0.00041885855324675324], 0, 2.5221636295318604, 1679425604.3952632], "version": 0.2, "tvm_version": "0.10.0"}
{"input": ["cuda -keys=cuda,gpu -arch=sm_86 -max_num_threads=1024 -thread_warp_size=32", "conv2d_nchw.cuda", [["TENSOR", [1, 192, 17, 17], "float32"], ["TENSOR", [320, 192, 3, 3], "float32"], [2, 2], [0, 0, 0, 0], [1, 1], "float32"], {}], "config": {"index": 19023253, "code_hash": null, "entity": [["tile_f", "sp", [-1, 1, 2, 16]], ["tile_y", "sp", [-1, 1, 1, 4]], ["tile_x", "sp", [-1, 1, 1, 2]], ["tile_rc", "sp", [-1, 2]], ["tile_ry", "sp", [-1, 1]], ["tile_rx", "sp", [-1, 3]], ["auto_unroll_max_step", "ot", 1500], ["unroll_explicit", "ot", 0]]}, "result": [[0.0003611964730941704, 0.00036119876681614353, 0.00036119876681614353], 0, 2.3409430980682373, 1679425605.6298373], "version": 0.2, "tvm_version": "0.10.0"}
{"input": ["cuda -keys=cuda,gpu -arch=sm_86 -max_num_threads=1024 -thread_warp_size=32", "conv2d_nchw.cuda", [["TENSOR", [1, 192, 17, 17], "float32"], ["TENSOR", [320, 192, 3, 3], "float32"], [2, 2], [0, 0, 0, 0], [1, 1], "float32"], {}], "config": {"index": 43976352, "code_hash": null, "entity": [["tile_f", "sp", [-1, 1, 1, 1]], ["tile_y", "sp", [-1, 4, 1, 1]], ["tile_x", "sp", [-1, 1, 2, 1]], ["tile_rc", "sp", [-1, 8]], ["tile_ry", "sp", [-1, 3]], ["tile_rx", "sp", [-1, 3]], ["auto_unroll_max_step", "ot", 1500], ["unroll_explicit", "ot", 1]]}, "result": [[0.00041695633160621765, 0.0004170671761658031, 0.0004171334300518135], 0, 2.3176615238189697, 1679425606.8650296], "version": 0.2, "tvm_version": "0.10.0"}
{"input": ["cuda -keys=cuda,gpu -arch=sm_86 -max_num_threads=1024 -thread_warp_size=32", "conv2d_nchw.cuda", [["TENSOR", [1, 192, 17, 17], "float32"], ["TENSOR", [320, 192, 3, 3], "float32"], [2, 2], [0, 0, 0, 0], [1, 1], "float32"], {}], "config": {"index": 8207060, "code_hash": null, "entity": [["tile_f", "sp", [-1, 16, 2, 10]], ["tile_y", "sp", [-1, 2, 2, 1]], ["tile_x", "sp", [-1, 2, 1, 1]], ["tile_rc", "sp", [-1, 8]], ["tile_ry", "sp", [-1, 1]], ["tile_rx", "sp", [-1, 1]], ["auto_unroll_max_step", "ot", 512], ["unroll_explicit", "ot", 0]]}, "result": [[0.008894549, 0.008894549, 0.00889472], 0, 1.7296290397644043, 1679425607.7626855], "version": 0.2, "tvm_version": "0.10.0"}
{"input": ["cuda -keys=cuda,gpu -arch=sm_86 -max_num_threads=1024 -thread_warp_size=32", "conv2d_nchw.cuda", [["TENSOR", [1, 192, 17, 17], "float32"], ["TENSOR", [320, 192, 3, 3], "float32"], [2, 2], [0, 0, 0, 0], [1, 1], "float32"], {}], "config": {"index": 20766919, "code_hash": null, "entity": [["tile_f", "sp", [-1, 20, 2, 2]], ["tile_y", "sp", [-1, 4, 2, 1]], ["tile_x", "sp", [-1, 1, 1, 2]], ["tile_rc", "sp", [-1, 1]], ["tile_ry", "sp", [-1, 3]], ["tile_rx", "sp", [-1, 3]], ["auto_unroll_max_step", "ot", 1500], ["unroll_explicit", "ot", 0]]}, "result": [[0.0030245096415094344, 0.003024664245283019, 0.0030258397358490564], 0, 2.715019464492798, 1679425608.9817336], "version": 0.2, "tvm_version": "0.10.0"}
{"input": ["cuda -keys=cuda,gpu -arch=sm_86 -max_num_threads=1024 -thread_warp_size=32", "conv2d_nchw.cuda", [["TENSOR", [1, 192, 17, 17], "float32"], ["TENSOR", [320, 192, 3, 3], "float32"], [2, 2], [0, 0, 0, 0], [1, 1], "float32"], {}], "config": {"index": 9715003, "code_hash": null, "entity": [["tile_f", "sp", [-1, 2, 4, 8]], ["tile_y", "sp", [-1, 1, 2, 2]], ["tile_x", "sp", [-1, 2, 2, 1]], ["tile_rc", "sp", [-1, 3]], ["tile_ry", "sp", [-1, 3]], ["tile_rx", "sp", [-1, 1]], ["auto_unroll_max_step", "ot", 512], ["unroll_explicit", "ot", 0]]}, "result": [[0.00032857862040816326, 0.00032859322653061226, 0.000328595], 0, 1.749013900756836, 1679425610.208063], "version": 0.2, "tvm_version": "0.10.0"}
{"input": ["cuda -keys=cuda,gpu -arch=sm_86 -max_num_threads=1024 -thread_warp_size=32", "conv2d_nchw.cuda", [["TENSOR", [1, 192, 17, 17], "float32"], ["TENSOR", [320, 192, 3, 3], "float32"], [2, 2], [0, 0, 0, 0], [1, 1], "float32"], {}], "config": {"index": 5788206, "code_hash": null, "entity": [["tile_f", "sp", [-1, 1, 32, 10]], ["tile_y", "sp", [-1, 4, 2, 1]], ["tile_x", "sp", [-1, 2, 1, 1]], ["tile_rc", "sp", [-1, 2]], ["tile_ry", "sp", [-1, 3]], ["tile_rx", "sp", [-1, 3]], ["auto_unroll_max_step", "ot", 0], ["unroll_explicit", "ot", 0]]}, "result": [[0.00047062202623906704, 0.0004706310116618076, 0.0004706365714285714], 0, 1.6844606399536133, 1679425611.4473352], "version": 0.2, "tvm_version": "0.10.0"}
{"input": ["cuda -keys=cuda,gpu -arch=sm_86 -max_num_threads=1024 -thread_warp_size=32", "conv2d_nchw.cuda", [["TENSOR", [1, 192, 17, 17], "float32"], ["TENSOR", [320, 192, 3, 3], "float32"], [2, 2], [0, 0, 0, 0], [1, 1], "float32"], {}], "config": {"index": 5753283, "code_hash": null, "entity": [["tile_f", "sp", [-1, 4, 1, 20]], ["tile_y", "sp", [-1, 4, 1, 1]], ["tile_x", "sp", [-1, 1, 1, 4]], ["tile_rc", "sp", [-1, 1]], ["tile_ry", "sp", [-1, 3]], ["tile_rx", "sp", [-1, 3]], ["auto_unroll_max_step", "ot", 0], ["unroll_explicit", "ot", 0]]}, "result": [[0.0299002875, 0.02991078375, 0.029990655749999998], 0, 1.7477431297302246, 1679425620.0178382], "version": 0.2, "tvm_version": "0.10.0"}
{"input": ["cuda -keys=cuda,gpu -arch=sm_86 -max_num_threads=1024 -thread_warp_size=32", "conv2d_nchw.cuda", [["TENSOR", [1, 192, 17, 17], "float32"], ["TENSOR", [320, 192, 3, 3], "float32"], [2, 2], [0, 0, 0, 0], [1, 1], "float32"], {}], "config": {"index": 15937827, "code_hash": null, "entity": [["tile_f", "sp", [-1, 5, 1, 1]], ["tile_y", "sp", [-1, 2, 2, 2]], ["tile_x", "sp", [-1, 2, 1, 2]], ["tile_rc", "sp", [-1, 12]], ["tile_ry", "sp", [-1, 1]], ["tile_rx", "sp", [-1, 1]], ["auto_unroll_max_step", "ot", 1500], ["unroll_explicit", "ot", 0]]}, "result": [[0.0006489823413654617, 0.0006489857108433736, 0.0006489980281124497], 0, 3.266308307647705, 1679425621.2720785], "version": 0.2, "tvm_version": "0.10.0"}
{"input": ["cuda -keys=cuda,gpu -arch=sm_86 -max_num_threads=1024 -thread_warp_size=32", "conv2d_nchw.cuda", [["TENSOR", [1, 192, 17, 17], "float32"], ["TENSOR", [320, 192, 3, 3], "float32"], [2, 2], [0, 0, 0, 0], [1, 1], "float32"], {}], "config": {"index": 36160508, "code_hash": null, "entity": [["tile_f", "sp", [-1, 4, 20, 4]], ["tile_y", "sp", [-1, 1, 1, 1]], ["tile_x", "sp", [-1, 2, 1, 1]], ["tile_rc", "sp", [-1, 4]], ["tile_ry", "sp", [-1, 3]], ["tile_rx", "sp", [-1, 3]], ["auto_unroll_max_step", "ot", 512], ["unroll_explicit", "ot", 1]]}, "result": [[0.0011895769999999998, 0.001189667985185185, 0.0011897438296296298], 0, 1.8612568378448486, 1679425622.5076501], "version": 0.2, "tvm_version": "0.10.0"}
{"input": ["cuda -keys=cuda,gpu -arch=sm_86 -max_num_threads=1024 -thread_warp_size=32", "conv2d_nchw.cuda", [["TENSOR", [1, 192, 17, 17], "float32"], ["TENSOR", [320, 192, 3, 3], "float32"], [2, 2], [0, 0, 0, 0], [1, 1], "float32"], {}], "config": {"index": 16400198, "code_hash": null, "entity": [["tile_f", "sp", [-1, 4, 5, 1]], ["tile_y", "sp", [-1, 1, 1, 2]], ["tile_x", "sp", [-1, 1, 1, 1]], ["tile_rc", "sp", [-1, 48]], ["tile_ry", "sp", [-1, 1]], ["tile_rx", "sp", [-1, 1]], ["auto_unroll_max_step", "ot", 1500], ["unroll_explicit", "ot", 0]]}, "result": [[0.0002516114359605911, 0.00025166690886699506, 0.00025184093842364535], 0, 1.7941741943359375, 1679425623.3473587], "version": 0.2, "tvm_version": "0.10.0"}
{"input": ["cuda -keys=cuda,gpu -arch=sm_86 -max_num_threads=1024 -thread_warp_size=32", "conv2d_nchw.cuda", [["TENSOR", [1, 192, 17, 17], "float32"], ["TENSOR", [320, 192, 3, 3], "float32"], [2, 2], [0, 0, 0, 0], [1, 1], "float32"], {}], "config": {"index": 23095086, "code_hash": null, "entity": [["tile_f", "sp", [-1, 1, 10, 2]], ["tile_y", "sp", [-1, 1, 4, 2]], ["tile_x", "sp", [-1, 1, 1, 4]], ["tile_rc", "sp", [-1, 4]], ["tile_ry", "sp", [-1, 1]], ["tile_rx", "sp", [-1, 1]], ["auto_unroll_max_step", "ot", 0], ["unroll_explicit", "ot", 1]]}, "result": [[0.0006284371439688716, 0.000628441120622568, 0.0006285207392996109], 0, 1.381162166595459, 1679425624.5052347], "version": 0.2, "tvm_version": "0.10.0"}
{"input": ["cuda -keys=cuda,gpu -arch=sm_86 -max_num_threads=1024 -thread_warp_size=32", "conv2d_nchw.cuda", [["TENSOR", [1, 192, 17, 17], "float32"], ["TENSOR", [320, 192, 3, 3], "float32"], [2, 2], [0, 0, 0, 0], [1, 1], "float32"], {}], "config": {"index": 42664734, "code_hash": null, "entity": [["tile_f", "sp", [-1, 1, 10, 2]], ["tile_y", "sp", [-1, 1, 2, 4]], ["tile_x", "sp", [-1, 2, 4, 1]], ["tile_rc", "sp", [-1, 32]], ["tile_ry", "sp", [-1, 1]], ["tile_rx", "sp", [-1, 3]], ["auto_unroll_max_step", "ot", 1500], ["unroll_explicit", "ot", 1]]}, "result": [[9.721306414172266e-05, 9.721432254123396e-05, 9.721432254123396e-05], 0, 2.4113664627075195, 1679425625.7314942], "version": 0.2, "tvm_version": "0.10.0"}
{"input": ["cuda -keys=cuda,gpu -arch=sm_86 -max_num_threads=1024 -thread_warp_size=32", "conv2d_nchw.cuda", [["TENSOR", [1, 192, 17, 17], "float32"], ["TENSOR", [320, 192, 3, 3], "float32"], [2, 2], [0, 0, 0, 0], [1, 1], "float32"], {}], "config": {"index": 38852168, "code_hash": null, "entity": [["tile_f", "sp", [-1, 10, 1, 4]], ["tile_y", "sp", [-1, 2, 1, 2]], ["tile_x", "sp", [-1, 2, 1, 1]], ["tile_rc", "sp", [-1, 32]], ["tile_ry", "sp", [-1, 1]], ["tile_rx", "sp", [-1, 1]], ["auto_unroll_max_step", "ot", 1500], ["unroll_explicit", "ot", 1]]}, "result": [[0.0030929144545454542, 0.0030929387272727272, 0.0030929454242424243], 0, 8.175731182098389, 1679425626.5784395], "version": 0.2, "tvm_version": "0.10.0"}
{"input": ["cuda -keys=cuda,gpu -arch=sm_86 -max_num_threads=1024 -thread_warp_size=32", "conv2d_nchw.cuda", [["TENSOR", [1, 192, 17, 17], "float32"], ["TENSOR", [320, 192, 3, 3], "float32"], [2, 2], [0, 0, 0, 0], [1, 1], "float32"], {}], "config": {"index": 19107955, "code_hash": null, "entity": [["tile_f", "sp", [-1, 10, 1, 32]], ["tile_y", "sp", [-1, 2, 4, 1]], ["tile_x", "sp", [-1, 8, 1, 1]], ["tile_rc", "sp", [-1, 3]], ["tile_ry", "sp", [-1, 1]], ["tile_rx", "sp", [-1, 3]], ["auto_unroll_max_step", "ot", 1500], ["unroll_explicit", "ot", 0]]}, "result": [[0.5348413695, 0.5368693845, 0.5372979125], 0, 10.578267335891724, 1679425632.8161757], "version": 0.2, "tvm_version": "0.10.0"}
{"input": ["cuda -keys=cuda,gpu -arch=sm_86 -max_num_threads=1024 -thread_warp_size=32", "conv2d_nchw.cuda", [["TENSOR", [1, 192, 17, 17], "float32"], ["TENSOR", [320, 192, 3, 3], "float32"], [2, 2], [0, 0, 0, 0], [1, 1], "float32"], {}], "config": {"index": 34341952, "code_hash": null, "entity": [["tile_f", "sp", [-1, 2, 20, 1]], ["tile_y", "sp", [-1, 2, 4, 1]], ["tile_x", "sp", [-1, 1, 1, 2]], ["tile_rc", "sp", [-1, 4]], ["tile_ry", "sp", [-1, 1]], ["tile_rx", "sp", [-1, 3]], ["auto_unroll_max_step", "ot", 512], ["unroll_explicit", "ot", 1]]}, "result": [[6.226146637658227e-05, 6.22618710443038e-05, 6.226309018987342e-05], 0, 1.6304938793182373, 1679425634.0372324], "version": 0.2, "tvm_version": "0.10.0"}
{"input": ["cuda -keys=cuda,gpu -arch=sm_86 -max_num_threads=1024 -thread_warp_size=32", "conv2d_nchw.cuda", [["TENSOR", [1, 192, 17, 17], "float32"], ["TENSOR", [320, 192, 3, 3], "float32"], [2, 2], [0, 0, 0, 0], [1, 1], "float32"], {}], "config": {"index": 33915774, "code_hash": null, "entity": [["tile_f", "sp", [-1, 1, 32, 10]], ["tile_y", "sp", [-1, 1, 1, 8]], ["tile_x", "sp", [-1, 4, 2, 1]], ["tile_rc", "sp", [-1, 1]], ["tile_ry", "sp", [-1, 1]], ["tile_rx", "sp", [-1, 3]], ["auto_unroll_max_step", "ot", 512], ["unroll_explicit", "ot", 1]]}, "result": [[0.0023131959491525427, 0.0023138895762711865, 0.0023139795762711864], 0, 2.107983350753784, 1679425641.2207232], "version": 0.2, "tvm_version": "0.10.0"}
{"input": ["cuda -keys=cuda,gpu -arch=sm_86 -max_num_threads=1024 -thread_warp_size=32", "conv2d_nchw.cuda", [["TENSOR", [1, 192, 17, 17], "float32"], ["TENSOR", [320, 192, 3, 3], "float32"], [2, 2], [0, 0, 0, 0], [1, 1], "float32"], {}], "config": {"index": 44366369, "code_hash": null, "entity": [["tile_f", "sp", [-1, 2, 2, 10]], ["tile_y", "sp", [-1, 4, 1, 1]], ["tile_x", "sp", [-1, 4, 1, 1]], ["tile_rc", "sp", [-1, 24]], ["tile_ry", "sp", [-1, 3]], ["tile_rx", "sp", [-1, 3]], ["auto_unroll_max_step", "ot", 1500], ["unroll_explicit", "ot", 1]]}, "result": [[0.0035944878571428575, 0.0035945690357142854, 0.003595008], 0, 6.825498580932617, 1679425642.0708504], "version": 0.2, "tvm_version": "0.10.0"}
{"input": ["cuda -keys=cuda,gpu -arch=sm_86 -max_num_threads=1024 -thread_warp_size=32", "conv2d_nchw.cuda", [["TENSOR", [1, 192, 17, 17], "float32"], ["TENSOR", [320, 192, 3, 3], "float32"], [2, 2], [0, 0, 0, 0], [1, 1], "float32"], {}], "config": {"index": 22358810, "code_hash": null, "entity": [["tile_f", "sp", [-1, 1, 4, 1]], ["tile_y", "sp", [-1, 1, 2, 1]], ["tile_x", "sp", [-1, 1, 4, 1]], ["tile_rc", "sp", [-1, 96]], ["tile_ry", "sp", [-1, 3]], ["tile_rx", "sp", [-1, 3]], ["auto_unroll_max_step", "ot", 1500], ["unroll_explicit", "ot", 0]]}, "result": [[5.6043418378002095e-05, 5.604769369996519e-05, 5.606620292377306e-05], 0, 4.653183460235596, 1679425643.2813556], "version": 0.2, "tvm_version": "0.10.0"}
{"input": ["cuda -keys=cuda,gpu -arch=sm_86 -max_num_threads=1024 -thread_warp_size=32", "conv2d_nchw.cuda", [["TENSOR", [1, 192, 17, 17], "float32"], ["TENSOR", [320, 192, 3, 3], "float32"], [2, 2], [0, 0, 0, 0], [1, 1], "float32"], {}], "config": {"index": 30295959, "code_hash": null, "entity": [["tile_f", "sp", [-1, 8, 10, 4]], ["tile_y", "sp", [-1, 4, 2, 1]], ["tile_x", "sp", [-1, 2, 4, 1]], ["tile_rc", "sp", [-1, 2]], ["tile_ry", "sp", [-1, 1]], ["tile_rx", "sp", [-1, 1]], ["auto_unroll_max_step", "ot", 512], ["unroll_explicit", "ot", 1]]}, "result": [[0.0018944772641509436, 0.0018946511509433963, 0.0018947091698113207], 0, 2.274461507797241, 1679425644.1164742], "version": 0.2, "tvm_version": "0.10.0"}
{"input": ["cuda -keys=cuda,gpu -arch=sm_86 -max_num_threads=1024 -thread_warp_size=32", "conv2d_nchw.cuda", [["TENSOR", [1, 192, 17, 17], "float32"], ["TENSOR", [320, 192, 3, 3], "float32"], [2, 2], [0, 0, 0, 0], [1, 1], "float32"], {}], "config": {"index": 32659336, "code_hash": null, "entity": [["tile_f", "sp", [-1, 2, 20, 2]], ["tile_y", "sp", [-1, 1, 1, 1]], ["tile_x", "sp", [-1, 1, 1, 1]], ["tile_rc", "sp", [-1, 8]], ["tile_ry", "sp", [-1, 3]], ["tile_rx", "sp", [-1, 1]], ["auto_unroll_max_step", "ot", 512], ["unroll_explicit", "ot", 1]]}, "result": [[0.00039210499029126213, 0.0003921348422330097, 0.00039269156553398056], 0, 1.735222578048706, 1679425645.3591733], "version": 0.2, "tvm_version": "0.10.0"}
{"input": ["cuda -keys=cuda,gpu -arch=sm_86 -max_num_threads=1024 -thread_warp_size=32", "conv2d_nchw.cuda", [["TENSOR", [1, 192, 17, 17], "float32"], ["TENSOR", [320, 192, 3, 3], "float32"], [2, 2], [0, 0, 0, 0], [1, 1], "float32"], {}], "config": {"index": 13240691, "code_hash": null, "entity": [["tile_f", "sp", [-1, 10, 1, 16]], ["tile_y", "sp", [-1, 4, 2, 1]], ["tile_x", "sp", [-1, 1, 1, 2]], ["tile_rc", "sp", [-1, 1]], ["tile_ry", "sp", [-1, 3]], ["tile_rx", "sp", [-1, 3]], ["auto_unroll_max_step", "ot", 512], ["unroll_explicit", "ot", 0]]}, "result": [[0.0222467834, 0.0222531386, 0.0222547972], 0, 1.8172802925109863, 1679425646.3119943], "version": 0.2, "tvm_version": "0.10.0"}
{"input": ["cuda -keys=cuda,gpu -arch=sm_86 -max_num_threads=1024 -thread_warp_size=32", "conv2d_nchw.cuda", [["TENSOR", [1, 192, 17, 17], "float32"], ["TENSOR", [320, 192, 3, 3], "float32"], [2, 2], [0, 0, 0, 0], [1, 1], "float32"], {}], "config": {"index": 40079149, "code_hash": null, "entity": [["tile_f", "sp", [-1, 10, 16, 1]], ["tile_y", "sp", [-1, 8, 1, 1]], ["tile_x", "sp", [-1, 1, 2, 1]], ["tile_rc", "sp", [-1, 6]], ["tile_ry", "sp", [-1, 3]], ["tile_rx", "sp", [-1, 1]], ["auto_unroll_max_step", "ot", 1500], ["unroll_explicit", "ot", 1]]}, "result": [[0.0002922950362976406, 0.0002922953139745917, 0.00029229689110707804], 0, 3.4700307846069336, 1679425647.5390663], "version": 0.2, "tvm_version": "0.10.0"}
{"input": ["cuda -keys=cuda,gpu -arch=sm_86 -max_num_threads=1024 -thread_warp_size=32", "conv2d_nchw.cuda", [["TENSOR", [1, 192, 17, 17], "float32"], ["TENSOR", [320, 192, 3, 3], "float32"], [2, 2], [0, 0, 0, 0], [1, 1], "float32"], {}], "config": {"index": 4064496, "code_hash": null, "entity": [["tile_f", "sp", [-1, 4, 5, 8]], ["tile_y", "sp", [-1, 1, 1, 4]], ["tile_x", "sp", [-1, 1, 2, 1]], ["tile_rc", "sp", [-1, 3]], ["tile_ry", "sp", [-1, 1]], ["tile_rx", "sp", [-1, 3]], ["auto_unroll_max_step", "ot", 0], ["unroll_explicit", "ot", 0]]}, "result": [[0.0010059068999999999, 0.00100591613, 0.0010065408300000001], 0, 1.228977918624878, 1679425648.3779166], "version": 0.2, "tvm_version": "0.10.0"}
{"input": ["cuda -keys=cuda,gpu -arch=sm_86 -max_num_threads=1024 -thread_warp_size=32", "conv2d_nchw.cuda", [["TENSOR", [1, 192, 17, 17], "float32"], ["TENSOR", [320, 192, 3, 3], "float32"], [2, 2], [0, 0, 0, 0], [1, 1], "float32"], {}], "config": {"index": 4488158, "code_hash": null, "entity": [["tile_f", "sp", [-1, 2, 4, 5]], ["tile_y", "sp", [-1, 2, 1, 4]], ["tile_x", "sp", [-1, 1, 4, 1]], ["tile_rc", "sp", [-1, 8]], ["tile_ry", "sp", [-1, 1]], ["tile_rx", "sp", [-1, 3]], ["auto_unroll_max_step", "ot", 0], ["unroll_explicit", "ot", 0]]}, "result": [[0.0010000027453416149, 0.0010000087142857143, 0.00100019203], 0, 1.4409945011138916, 1679425649.4929488], "version": 0.2, "tvm_version": "0.10.0"}
{"input": ["cuda -keys=cuda,gpu -arch=sm_86 -max_num_threads=1024 -thread_warp_size=32", "conv2d_nchw.cuda", [["TENSOR", [1, 192, 17, 17], "float32"], ["TENSOR", [320, 192, 3, 3], "float32"], [2, 2], [0, 0, 0, 0], [1, 1], "float32"], {}], "config": {"index": 30620518, "code_hash": null, "entity": [["tile_f", "sp", [-1, 2, 4, 4]], ["tile_y", "sp", [-1, 4, 1, 2]], ["tile_x", "sp", [-1, 1, 1, 4]], ["tile_rc", "sp", [-1, 4]], ["tile_ry", "sp", [-1, 1]], ["tile_rx", "sp", [-1, 1]], ["auto_unroll_max_step", "ot", 512], ["unroll_explicit", "ot", 1]]}, "result": [[0.001745829316455696, 0.0017458552025316455, 0.0017806452405063292], 0, 2.7745072841644287, 1679425654.3888009], "version": 0.2, "tvm_version": "0.10.0"}
{"input": ["cuda -keys=cuda,gpu -arch=sm_86 -max_num_threads=1024 -thread_warp_size=32", "conv2d_nchw.cuda", [["TENSOR", [1, 192, 17, 17], "float32"], ["TENSOR", [320, 192, 3, 3], "float32"], [2, 2], [0, 0, 0, 0], [1, 1], "float32"], {}], "config": {"index": 13583095, "code_hash": null, "entity": [["tile_f", "sp", [-1, 2, 2, 20]], ["tile_y", "sp", [-1, 2, 2, 1]], ["tile_x", "sp", [-1, 2, 1, 1]], ["tile_rc", "sp", [-1, 4]], ["tile_ry", "sp", [-1, 3]], ["tile_rx", "sp", [-1, 3]], ["auto_unroll_max_step", "ot", 512], ["unroll_explicit", "ot", 0]]}, "result": [[0.0011042774725274725, 0.001104286945054945, 0.0011042996043956043], 0, 1.607229471206665, 1679425655.2147071], "version": 0.2, "tvm_version": "0.10.0"}
{"input": ["cuda -keys=cuda,gpu -arch=sm_86 -max_num_threads=1024 -thread_warp_size=32", "conv2d_nchw.cuda", [["TENSOR", [1, 192, 17, 17], "float32"], ["TENSOR", [320, 192, 3, 3], "float32"], [2, 2], [0, 0, 0, 0], [1, 1], "float32"], {}], "config": {"index": 1231605, "code_hash": null, "entity": [["tile_f", "sp", [-1, 1, 4, 4]], ["tile_y", "sp", [-1, 2, 2, 1]], ["tile_x", "sp", [-1, 8, 1, 1]], ["tile_rc", "sp", [-1, 32]], ["tile_ry", "sp", [-1, 1]], ["tile_rx", "sp", [-1, 1]], ["auto_unroll_max_step", "ot", 0], ["unroll_explicit", "ot", 0]]}, "result": [[0.0013149070081967212, 0.001314916762295082, 0.0013162410245901638], 0, 1.6292436122894287, 1679425656.4354565], "version": 0.2, "tvm_version": "0.10.0"}
{"input": ["cuda -keys=cuda,gpu -arch=sm_86 -max_num_threads=1024 -thread_warp_size=32", "conv2d_nchw.cuda", [["TENSOR", [1, 192, 17, 17], "float32"], ["TENSOR", [320, 192, 3, 3], "float32"], [2, 2], [0, 0, 0, 0], [1, 1], "float32"], {}], "config": {"index": 26884791, "code_hash": null, "entity": [["tile_f", "sp", [-1, 5, 1, 2]], ["tile_y", "sp", [-1, 2, 2, 2]], ["tile_x", "sp", [-1, 1, 1, 1]], ["tile_rc", "sp", [-1, 6]], ["tile_ry", "sp", [-1, 1]], ["tile_rx", "sp", [-1, 3]], ["auto_unroll_max_step", "ot", 0], ["unroll_explicit", "ot", 1]]}, "result": [[0.00032286738966202786, 0.00032287961630218684, 0.0003246446302186878], 0, 1.7017457485198975, 1679425657.67993], "version": 0.2, "tvm_version": "0.10.0"}
{"input": ["cuda -keys=cuda,gpu -arch=sm_86 -max_num_threads=1024 -thread_warp_size=32", "conv2d_nchw.cuda", [["TENSOR", [1, 192, 17, 17], "float32"], ["TENSOR", [320, 192, 3, 3], "float32"], [2, 2], [0, 0, 0, 0], [1, 1], "float32"], {}], "config": {"index": 17668836, "code_hash": null, "entity": [["tile_f", "sp", [-1, 20, 1, 16]], ["tile_y", "sp", [-1, 2, 2, 1]], ["tile_x", "sp", [-1, 1, 8, 1]], ["tile_rc", "sp", [-1, 8]], ["tile_ry", "sp", [-1, 3]], ["tile_rx", "sp", [-1, 1]], ["auto_unroll_max_step", "ot", 1500], ["unroll_explicit", "ot", 0]]}, "result": [[0.0110909439, 0.011091347500000001, 0.01109719], 0, 4.601281642913818, 1679425658.600091], "version": 0.2, "tvm_version": "0.10.0"}
{"input": ["cuda -keys=cuda,gpu -arch=sm_86 -max_num_threads=1024 -thread_warp_size=32", "conv2d_nchw.cuda", [["TENSOR", [1, 192, 17, 17], "float32"], ["TENSOR", [320, 192, 3, 3], "float32"], [2, 2], [0, 0, 0, 0], [1, 1], "float32"], {}], "config": {"index": 10772605, "code_hash": null, "entity": [["tile_f", "sp", [-1, 5, 4, 2]], ["tile_y", "sp", [-1, 2, 1, 1]], ["tile_x", "sp", [-1, 8, 1, 1]], ["tile_rc", "sp", [-1, 48]], ["tile_ry", "sp", [-1, 3]], ["tile_rx", "sp", [-1, 1]], ["auto_unroll_max_step", "ot", 512], ["unroll_explicit", "ot", 0]]}, "result": [[0.0009153809272727273, 0.0009153815454545454, 0.0009153815454545454], 0, 1.5838661193847656, 1679425659.4295402], "version": 0.2, "tvm_version": "0.10.0"}
{"input": ["cuda -keys=cuda,gpu -arch=sm_86 -max_num_threads=1024 -thread_warp_size=32", "conv2d_nchw.cuda", [["TENSOR", [1, 192, 17, 17], "float32"], ["TENSOR", [320, 192, 3, 3], "float32"], [2, 2], [0, 0, 0, 0], [1, 1], "float32"], {}], "config": {"index": 24574398, "code_hash": null, "entity": [["tile_f", "sp", [-1, 8, 4, 1]], ["tile_y", "sp", [-1, 1, 2, 4]], ["tile_x", "sp", [-1, 1, 1, 4]], ["tile_rc", "sp", [-1, 1]], ["tile_ry", "sp", [-1, 3]], ["tile_rx", "sp", [-1, 1]], ["auto_unroll_max_step", "ot", 0], ["unroll_explicit", "ot", 1]]}, "result": [[0.0004546653045454545, 0.00045466995, 0.00045466995], 0, 1.187014102935791, 1679425660.2529347], "version": 0.2, "tvm_version": "0.10.0"}
{"input": ["cuda -keys=cuda,gpu -arch=sm_86 -max_num_threads=1024 -thread_warp_size=32", "conv2d_nchw.cuda", [["TENSOR", [1, 192, 17, 17], "float32"], ["TENSOR", [320, 192, 3, 3], "float32"], [2, 2], [0, 0, 0, 0], [1, 1], "float32"], {}], "config": {"index": 7941368, "code_hash": null, "entity": [["tile_f", "sp", [-1, 32, 1, 1]], ["tile_y", "sp", [-1, 1, 4, 2]], ["tile_x", "sp", [-1, 2, 1, 1]], ["tile_rc", "sp", [-1, 4]], ["tile_ry", "sp", [-1, 1]], ["tile_rx", "sp", [-1, 1]], ["auto_unroll_max_step", "ot", 512], ["unroll_explicit", "ot", 0]]}, "result": [[0.0003209902814371258, 0.00032100048502994014, 0.00032100048502994014], 0, 2.086634635925293, 1679425661.4838152], "version": 0.2, "tvm_version": "0.10.0"}
{"input": ["cuda -keys=cuda,gpu -arch=sm_86 -max_num_threads=1024 -thread_warp_size=32", "conv2d_nchw.cuda", [["TENSOR", [1, 192, 17, 17], "float32"], ["TENSOR", [320, 192, 3, 3], "float32"], [2, 2], [0, 0, 0, 0], [1, 1], "float32"], {}], "config": {"index": 9417390, "code_hash": null, "entity": [["tile_f", "sp", [-1, 2, 2, 40]], ["tile_y", "sp", [-1, 1, 4, 1]], ["tile_x", "sp", [-1, 2, 1, 1]], ["tile_rc", "sp", [-1, 1]], ["tile_ry", "sp", [-1, 3]], ["tile_rx", "sp", [-1, 1]], ["auto_unroll_max_step", "ot", 512], ["unroll_explicit", "ot", 0]]}, "result": [[0.0007448699351851852, 0.0007448699351851852, 0.0007448746712962964], 0, 2.0625288486480713, 1679425662.7112484], "version": 0.2, "tvm_version": "0.10.0"}
{"input": ["cuda -keys=cuda,gpu -arch=sm_86 -max_num_threads=1024 -thread_warp_size=32", "conv2d_nchw.cuda", [["TENSOR", [1, 192, 17, 17], "float32"], ["TENSOR", [320, 192, 3, 3], "float32"], [2, 2], [0, 0, 0, 0], [1, 1], "float32"], {}], "config": {"index": 8216951, "code_hash": null, "entity": [["tile_f", "sp", [-1, 10, 32, 1]], ["tile_y", "sp", [-1, 1, 4, 2]], ["tile_x", "sp", [-1, 4, 1, 1]], ["tile_rc", "sp", [-1, 8]], ["tile_ry", "sp", [-1, 1]], ["tile_rx", "sp", [-1, 1]], ["auto_unroll_max_step", "ot", 512], ["unroll_explicit", "ot", 0]]}, "result": [[0.0005818394476744186, 0.0005818403779069767, 0.0005827571918604651], 0, 1.283545732498169, 1679425663.5500388], "version": 0.2, "tvm_version": "0.10.0"}
{"input": ["cuda -keys=cuda,gpu -arch=sm_86 -max_num_threads=1024 -thread_warp_size=32", "conv2d_nchw.cuda", [["TENSOR", [1, 192, 17, 17], "float32"], ["TENSOR", [320, 192, 3, 3], "float32"], [2, 2], [0, 0, 0, 0], [1, 1], "float32"], {}], "config": {"index": 25026009, "code_hash": null, "entity": [["tile_f", "sp", [-1, 1, 16, 1]], ["tile_y", "sp", [-1, 4, 1, 1]], ["tile_x", "sp", [-1, 1, 2, 1]], ["tile_rc", "sp", [-1, 6]], ["tile_ry", "sp", [-1, 3]], ["tile_rx", "sp", [-1, 1]], ["auto_unroll_max_step", "ot", 0], ["unroll_explicit", "ot", 1]]}, "result": [[5.965973315363882e-05, 5.966893216531896e-05, 5.983131581311769e-05], 0, 1.4728035926818848, 1679425740.8269172], "version": 0.2, "tvm_version": "0.10.0"}
{"input": ["cuda -keys=cuda,gpu -arch=sm_86 -max_num_threads=1024 -thread_warp_size=32", "conv2d_nchw.cuda", [["TENSOR", [1, 192, 17, 17], "float32"], ["TENSOR", [320, 192, 3, 3], "float32"], [2, 2], [0, 0, 0, 0], [1, 1], "float32"], {}], "config": {"index": 40078809, "code_hash": null, "entity": [["tile_f", "sp", [-1, 1, 16, 1]], ["tile_y", "sp", [-1, 4, 1, 1]], ["tile_x", "sp", [-1, 1, 2, 1]], ["tile_rc", "sp", [-1, 6]], ["tile_ry", "sp", [-1, 3]], ["tile_rx", "sp", [-1, 1]], ["auto_unroll_max_step", "ot", 1500], ["unroll_explicit", "ot", 1]]}, "result": [[5.614970596797671e-05, 5.61511943231441e-05, 5.61511943231441e-05], 0, 1.8011178970336914, 1679425742.0177252], "version": 0.2, "tvm_version": "0.10.0"}
{"input": ["cuda -keys=cuda,gpu -arch=sm_86 -max_num_threads=1024 -thread_warp_size=32", "conv2d_nchw.cuda", [["TENSOR", [1, 192, 17, 17], "float32"], ["TENSOR", [320, 192, 3, 3], "float32"], [2, 2], [0, 0, 0, 0], [1, 1], "float32"], {}], "config": {"index": 32552409, "code_hash": null, "entity": [["tile_f", "sp", [-1, 1, 16, 1]], ["tile_y", "sp", [-1, 4, 1, 1]], ["tile_x", "sp", [-1, 1, 2, 1]], ["tile_rc", "sp", [-1, 6]], ["tile_ry", "sp", [-1, 3]], ["tile_rx", "sp", [-1, 1]], ["auto_unroll_max_step", "ot", 512], ["unroll_explicit", "ot", 1]]}, "result": [[5.615271763433105e-05, 5.646438658492607e-05, 5.647213992066354e-05], 0, 1.797966480255127, 1679425743.2134755], "version": 0.2, "tvm_version": "0.10.0"}
{"input": ["cuda -keys=cuda,gpu -arch=sm_86 -max_num_threads=1024 -thread_warp_size=32", "conv2d_nchw.cuda", [["TENSOR", [1, 192, 17, 17], "float32"], ["TENSOR", [320, 192, 3, 3], "float32"], [2, 2], [0, 0, 0, 0], [1, 1], "float32"], {}], "config": {"index": 25007529, "code_hash": null, "entity": [["tile_f", "sp", [-1, 1, 16, 1]], ["tile_y", "sp", [-1, 1, 4, 1]], ["tile_x", "sp", [-1, 2, 1, 1]], ["tile_rc", "sp", [-1, 6]], ["tile_ry", "sp", [-1, 3]], ["tile_rx", "sp", [-1, 1]], ["auto_unroll_max_step", "ot", 0], ["unroll_explicit", "ot", 1]]}, "result": [[5.347201161995898e-05, 5.35625994531784e-05, 5.3563668489405326e-05], 0, 1.6385612487792969, 1679425744.4199917], "version": 0.2, "tvm_version": "0.10.0"}
{"input": ["cuda -keys=cuda,gpu -arch=sm_86 -max_num_threads=1024 -thread_warp_size=32", "conv2d_nchw.cuda", [["TENSOR", [1, 192, 17, 17], "float32"], ["TENSOR", [320, 192, 3, 3], "float32"], [2, 2], [0, 0, 0, 0], [1, 1], "float32"], {}], "config": {"index": 40060329, "code_hash": null, "entity": [["tile_f", "sp", [-1, 1, 16, 1]], ["tile_y", "sp", [-1, 1, 4, 1]], ["tile_x", "sp", [-1, 2, 1, 1]], ["tile_rc", "sp", [-1, 6]], ["tile_ry", "sp", [-1, 3]], ["tile_rx", "sp", [-1, 1]], ["auto_unroll_max_step", "ot", 1500], ["unroll_explicit", "ot", 1]]}, "result": [[5.129065697484482e-05, 5.129366808232604e-05, 5.129567690297288e-05], 0, 1.7023558616638184, 1679425745.633896], "version": 0.2, "tvm_version": "0.10.0"}
{"input": ["cuda -keys=cuda,gpu -arch=sm_86 -max_num_threads=1024 -thread_warp_size=32", "conv2d_nchw.cuda", [["TENSOR", [1, 192, 17, 17], "float32"], ["TENSOR", [320, 192, 3, 3], "float32"], [2, 2], [0, 0, 0, 0], [1, 1], "float32"], {}], "config": {"index": 32533929, "code_hash": null, "entity": [["tile_f", "sp", [-1, 1, 16, 1]], ["tile_y", "sp", [-1, 1, 4, 1]], ["tile_x", "sp", [-1, 2, 1, 1]], ["tile_rc", "sp", [-1, 6]], ["tile_ry", "sp", [-1, 3]], ["tile_rx", "sp", [-1, 1]], ["auto_unroll_max_step", "ot", 512], ["unroll_explicit", "ot", 1]]}, "result": [[5.1289262171052625e-05, 5.129292631578948e-05, 5.1293644078947374e-05], 0, 1.6863675117492676, 1679425746.8319008], "version": 0.2, "tvm_version": "0.10.0"}
{"input": ["cuda -keys=cuda,gpu -arch=sm_86 -max_num_threads=1024 -thread_warp_size=32", "conv2d_nchw.cuda", [["TENSOR", [1, 192, 17, 17], "float32"], ["TENSOR", [320, 192, 3, 3], "float32"], [2, 2], [0, 0, 0, 0], [1, 1], "float32"], {}], "config": {"index": 2718639, "code_hash": null, "entity": [["tile_f", "sp", [-1, 1, 20, 1]], ["tile_y", "sp", [-1, 2, 1, 2]], ["tile_x", "sp", [-1, 1, 2, 1]], ["tile_rc", "sp", [-1, 12]], ["tile_ry", "sp", [-1, 3]], ["tile_rx", "sp", [-1, 1]], ["auto_unroll_max_step", "ot", 0], ["unroll_explicit", "ot", 0]]}, "result": [[7.902949602780536e-05, 7.903001886792454e-05, 7.90310417080437e-05], 0, 1.6313972473144531, 1679425748.0547516], "version": 0.2, "tvm_version": "0.10.0"}
{"input": ["cuda -keys=cuda,gpu -arch=sm_86 -max_num_threads=1024 -thread_warp_size=32", "conv2d_nchw.cuda", [["TENSOR", [1, 192, 17, 17], "float32"], ["TENSOR", [320, 192, 3, 3], "float32"], [2, 2], [0, 0, 0, 0], [1, 1], "float32"], {}], "config": {"index": 10245039, "code_hash": null, "entity": [["tile_f", "sp", [-1, 1, 20, 1]], ["tile_y", "sp", [-1, 2, 1, 2]], ["tile_x", "sp", [-1, 1, 2, 1]], ["tile_rc", "sp", [-1, 12]], ["tile_ry", "sp", [-1, 3]], ["tile_rx", "sp", [-1, 1]], ["auto_unroll_max_step", "ot", 512], ["unroll_explicit", "ot", 0]]}, "result": [[7.030031991150442e-05, 7.030031991150442e-05, 7.032433539823009e-05], 0, 1.735849380493164, 1679425749.2707264], "version": 0.2, "tvm_version": "0.10.0"}
{"input": ["cuda -keys=cuda,gpu -arch=sm_86 -max_num_threads=1024 -thread_warp_size=32", "conv2d_nchw.cuda", [["TENSOR", [1, 192, 17, 17], "float32"], ["TENSOR", [320, 192, 3, 3], "float32"], [2, 2], [0, 0, 0, 0], [1, 1], "float32"], {}], "config": {"index": 17771439, "code_hash": null, "entity": [["tile_f", "sp", [-1, 1, 20, 1]], ["tile_y", "sp", [-1, 2, 1, 2]], ["tile_x", "sp", [-1, 1, 2, 1]], ["tile_rc", "sp", [-1, 12]], ["tile_ry", "sp", [-1, 3]], ["tile_rx", "sp", [-1, 1]], ["auto_unroll_max_step", "ot", 1500], ["unroll_explicit", "ot", 0]]}, "result": [[7.335016842588342e-05, 7.3353459385039e-05, 7.343607664066085e-05], 0, 1.8868658542633057, 1679425750.5236313], "version": 0.2, "tvm_version": "0.10.0"}
{"input": ["cuda -keys=cuda,gpu -arch=sm_86 -max_num_threads=1024 -thread_warp_size=32", "conv2d_nchw.cuda", [["TENSOR", [1, 192, 17, 17], "float32"], ["TENSOR", [320, 192, 3, 3], "float32"], [2, 2], [0, 0, 0, 0], [1, 1], "float32"], {}], "config": {"index": 9973209, "code_hash": null, "entity": [["tile_f", "sp", [-1, 1, 16, 1]], ["tile_y", "sp", [-1, 4, 1, 1]], ["tile_x", "sp", [-1, 1, 2, 1]], ["tile_rc", "sp", [-1, 6]], ["tile_ry", "sp", [-1, 3]], ["tile_rx", "sp", [-1, 1]], ["auto_unroll_max_step", "ot", 512], ["unroll_explicit", "ot", 0]]}, "result": [[5.786314280469898e-05, 5.7865019456681345e-05, 5.787178597650514e-05], 0, 1.6955056190490723, 1679425751.7250834], "version": 0.2, "tvm_version": "0.10.0"}
{"input": ["cuda -keys=cuda,gpu -arch=sm_86 -max_num_threads=1024 -thread_warp_size=32", "conv2d_nchw.cuda", [["TENSOR", [1, 192, 17, 17], "float32"], ["TENSOR", [320, 192, 3, 3], "float32"], [2, 2], [0, 0, 0, 0], [1, 1], "float32"], {}], "config": {"index": 17499609, "code_hash": null, "entity": [["tile_f", "sp", [-1, 1, 16, 1]], ["tile_y", "sp", [-1, 4, 1, 1]], ["tile_x", "sp", [-1, 1, 2, 1]], ["tile_rc", "sp", [-1, 6]], ["tile_ry", "sp", [-1, 3]], ["tile_rx", "sp", [-1, 1]], ["auto_unroll_max_step", "ot", 1500], ["unroll_explicit", "ot", 0]]}, "result": [[5.785938436123348e-05, 5.7864268722466954e-05, 5.7869158957415574e-05], 0, 1.7363481521606445, 1679425752.9641066], "version": 0.2, "tvm_version": "0.10.0"}
{"input": ["cuda -keys=cuda,gpu -arch=sm_86 -max_num_threads=1024 -thread_warp_size=32", "conv2d_nchw.cuda", [["TENSOR", [1, 192, 17, 17], "float32"], ["TENSOR", [320, 192, 3, 3], "float32"], [2, 2], [0, 0, 0, 0], [1, 1], "float32"], {}], "config": {"index": 2446809, "code_hash": null, "entity": [["tile_f", "sp", [-1, 1, 16, 1]], ["tile_y", "sp", [-1, 4, 1, 1]], ["tile_x", "sp", [-1, 1, 2, 1]], ["tile_rc", "sp", [-1, 6]], ["tile_ry", "sp", [-1, 3]], ["tile_rx", "sp", [-1, 1]], ["auto_unroll_max_step", "ot", 0], ["unroll_explicit", "ot", 0]]}, "result": [[5.999511174894756e-05, 5.9997856104094904e-05, 5.999824760811328e-05], 0, 1.5727136135101318, 1679425754.1193774], "version": 0.2, "tvm_version": "0.10.0"}
{"input": ["cuda -keys=cuda,gpu -arch=sm_86 -max_num_threads=1024 -thread_warp_size=32", "conv2d_nchw.cuda", [["TENSOR", [1, 192, 17, 17], "float32"], ["TENSOR", [320, 192, 3, 3], "float32"], [2, 2], [0, 0, 0, 0], [1, 1], "float32"], {}], "config": {"index": 2428329, "code_hash": null, "entity": [["tile_f", "sp", [-1, 1, 16, 1]], ["tile_y", "sp", [-1, 1, 4, 1]], ["tile_x", "sp", [-1, 2, 1, 1]], ["tile_rc", "sp", [-1, 6]], ["tile_ry", "sp", [-1, 3]], ["tile_rx", "sp", [-1, 1]], ["auto_unroll_max_step", "ot", 0], ["unroll_explicit", "ot", 0]]}, "result": [[5.355282159945318e-05, 5.355981989063568e-05, 5.356542071086807e-05], 0, 1.6083478927612305, 1679425755.3244524], "version": 0.2, "tvm_version": "0.10.0"}
{"input": ["cuda -keys=cuda,gpu -arch=sm_86 -max_num_threads=1024 -thread_warp_size=32", "conv2d_nchw.cuda", [["TENSOR", [1, 192, 17, 17], "float32"], ["TENSOR", [320, 192, 3, 3], "float32"], [2, 2], [0, 0, 0, 0], [1, 1], "float32"], {}], "config": {"index": 17481129, "code_hash": null, "entity": [["tile_f", "sp", [-1, 1, 16, 1]], ["tile_y", "sp", [-1, 1, 4, 1]], ["tile_x", "sp", [-1, 2, 1, 1]], ["tile_rc", "sp", [-1, 6]], ["tile_ry", "sp", [-1, 3]], ["tile_rx", "sp", [-1, 1]], ["auto_unroll_max_step", "ot", 1500], ["unroll_explicit", "ot", 0]]}, "result": [[5.2232426104284294e-05, 5.223346994354035e-05, 5.223964231152441e-05], 0, 1.6708588600158691, 1679425756.5393903], "version": 0.2, "tvm_version": "0.10.0"}
{"input": ["cuda -keys=cuda,gpu -arch=sm_86 -max_num_threads=1024 -thread_warp_size=32", "conv2d_nchw.cuda", [["TENSOR", [1, 192, 17, 17], "float32"], ["TENSOR", [320, 192, 3, 3], "float32"], [2, 2], [0, 0, 0, 0], [1, 1], "float32"], {}], "config": {"index": 9954729, "code_hash": null, "entity": [["tile_f", "sp", [-1, 1, 16, 1]], ["tile_y", "sp", [-1, 1, 4, 1]], ["tile_x", "sp", [-1, 2, 1, 1]], ["tile_rc", "sp", [-1, 6]], ["tile_ry", "sp", [-1, 3]], ["tile_rx", "sp", [-1, 1]], ["auto_unroll_max_step", "ot", 512], ["unroll_explicit", "ot", 0]]}, "result": [[5.22352235137828e-05, 5.22352235137828e-05, 5.2289923945533045e-05], 0, 1.6610729694366455, 1679425757.7447329], "version": 0.2, "tvm_version": "0.10.0"}
{"input": ["cuda -keys=cuda,gpu -arch=sm_86 -max_num_threads=1024 -thread_warp_size=32", "conv2d_nchw.cuda", [["TENSOR", [1, 192, 17, 17], "float32"], ["TENSOR", [320, 192, 3, 3], "float32"], [2, 2], [0, 0, 0, 0], [1, 1], "float32"], {}], "config": {"index": 25163439, "code_hash": null, "entity": [["tile_f", "sp", [-1, 1, 20, 1]], ["tile_y", "sp", [-1, 2, 1, 2]], ["tile_x", "sp", [-1, 1, 2, 1]], ["tile_rc", "sp", [-1, 8]], ["tile_ry", "sp", [-1, 3]], ["tile_rx", "sp", [-1, 1]], ["auto_unroll_max_step", "ot", 0], ["unroll_explicit", "ot", 1]]}, "result": [[5.3024998322710496e-05, 5.3258650788326065e-05, 5.331567259308957e-05], 0, 1.626978874206543, 1679425758.9659479], "version": 0.2, "tvm_version": "0.10.0"}
{"input": ["cuda -keys=cuda,gpu -arch=sm_86 -max_num_threads=1024 -thread_warp_size=32", "conv2d_nchw.cuda", [["TENSOR", [1, 192, 17, 17], "float32"], ["TENSOR", [320, 192, 3, 3], "float32"], [2, 2], [0, 0, 0, 0], [1, 1], "float32"], {}], "config": {"index": 32689839, "code_hash": null, "entity": [["tile_f", "sp", [-1, 1, 20, 1]], ["tile_y", "sp", [-1, 2, 1, 2]], ["tile_x", "sp", [-1, 1, 2, 1]], ["tile_rc", "sp", [-1, 8]], ["tile_ry", "sp", [-1, 3]], ["tile_rx", "sp", [-1, 1]], ["auto_unroll_max_step", "ot", 512], ["unroll_explicit", "ot", 1]]}, "result": [[5.3802245736164284e-05, 5.382005917159763e-05, 5.395656491472329e-05], 0, 1.870378017425537, 1679425761.1261303], "version": 0.2, "tvm_version": "0.10.0"}
{"input": ["cuda -keys=cuda,gpu -arch=sm_86 -max_num_threads=1024 -thread_warp_size=32", "conv2d_nchw.cuda", [["TENSOR", [1, 192, 17, 17], "float32"], ["TENSOR", [320, 192, 3, 3], "float32"], [2, 2], [0, 0, 0, 0], [1, 1], "float32"], {}], "config": {"index": 40216239, "code_hash": null, "entity": [["tile_f", "sp", [-1, 1, 20, 1]], ["tile_y", "sp", [-1, 2, 1, 2]], ["tile_x", "sp", [-1, 1, 2, 1]], ["tile_rc", "sp", [-1, 8]], ["tile_ry", "sp", [-1, 3]], ["tile_rx", "sp", [-1, 1]], ["auto_unroll_max_step", "ot", 1500], ["unroll_explicit", "ot", 1]]}, "result": [[5.385281273929691e-05, 5.396155760529063e-05, 5.396298085624782e-05], 0, 1.859926700592041, 1679425762.3191903], "version": 0.2, "tvm_version": "0.10.0"}
{"input": ["cuda -keys=cuda,gpu -arch=sm_86 -max_num_threads=1024 -thread_warp_size=32", "conv2d_nchw.cuda", [["TENSOR", [1, 192, 17, 17], "float32"], ["TENSOR", [320, 192, 3, 3], "float32"], [2, 2], [0, 0, 0, 0], [1, 1], "float32"], {}], "config": {"index": 25297839, "code_hash": null, "entity": [["tile_f", "sp", [-1, 1, 20, 1]], ["tile_y", "sp", [-1, 2, 1, 2]], ["tile_x", "sp", [-1, 1, 2, 1]], ["tile_rc", "sp", [-1, 12]], ["tile_ry", "sp", [-1, 3]], ["tile_rx", "sp", [-1, 1]], ["auto_unroll_max_step", "ot", 0], ["unroll_explicit", "ot", 1]]}, "result": [[7.946578089044523e-05, 7.946782641320662e-05, 7.94683611805903e-05], 0, 1.6184625625610352, 1679425763.5283866], "version": 0.2, "tvm_version": "0.10.0"}
{"input": ["cuda -keys=cuda,gpu -arch=sm_86 -max_num_threads=1024 -thread_warp_size=32", "conv2d_nchw.cuda", [["TENSOR", [1, 192, 17, 17], "float32"], ["TENSOR", [320, 192, 3, 3], "float32"], [2, 2], [0, 0, 0, 0], [1, 1], "float32"], {}], "config": {"index": 40350639, "code_hash": null, "entity": [["tile_f", "sp", [-1, 1, 20, 1]], ["tile_y", "sp", [-1, 2, 1, 2]], ["tile_x", "sp", [-1, 1, 2, 1]], ["tile_rc", "sp", [-1, 12]], ["tile_ry", "sp", [-1, 3]], ["tile_rx", "sp", [-1, 1]], ["auto_unroll_max_step", "ot", 1500], ["unroll_explicit", "ot", 1]]}, "result": [[6.294683227848101e-05, 6.294886036392405e-05, 6.3069542721519e-05], 0, 2.1033153533935547, 1679425764.7702994], "version": 0.2, "tvm_version": "0.10.0"}
{"input": ["cuda -keys=cuda,gpu -arch=sm_86 -max_num_threads=1024 -thread_warp_size=32", "conv2d_nchw.cuda", [["TENSOR", [1, 192, 17, 17], "float32"], ["TENSOR", [320, 192, 3, 3], "float32"], [2, 2], [0, 0, 0, 0], [1, 1], "float32"], {}], "config": {"index": 32824239, "code_hash": null, "entity": [["tile_f", "sp", [-1, 1, 20, 1]], ["tile_y", "sp", [-1, 2, 1, 2]], ["tile_x", "sp", [-1, 1, 2, 1]], ["tile_rc", "sp", [-1, 12]], ["tile_ry", "sp", [-1, 3]], ["tile_rx", "sp", [-1, 1]], ["auto_unroll_max_step", "ot", 512], ["unroll_explicit", "ot", 1]]}, "result": [[6.607089800995025e-05, 6.607092330016584e-05, 6.607347263681592e-05], 0, 1.8343138694763184, 1679425765.993353], "version": 0.2, "tvm_version": "0.10.0"}
{"input": ["cuda -keys=cuda,gpu -arch=sm_86 -max_num_threads=1024 -thread_warp_size=32", "conv2d_nchw.cuda", [["TENSOR", [1, 192, 17, 17], "float32"], ["TENSOR", [320, 192, 3, 3], "float32"], [2, 2], [0, 0, 0, 0], [1, 1], "float32"], {}], "config": {"index": 10110639, "code_hash": null, "entity": [["tile_f", "sp", [-1, 1, 20, 1]], ["tile_y", "sp", [-1, 2, 1, 2]], ["tile_x", "sp", [-1, 1, 2, 1]], ["tile_rc", "sp", [-1, 8]], ["tile_ry", "sp", [-1, 3]], ["tile_rx", "sp", [-1, 1]], ["auto_unroll_max_step", "ot", 512], ["unroll_explicit", "ot", 0]]}, "result": [[5.514565472427115e-05, 5.51470052687039e-05, 5.515062311204777e-05], 0, 1.7306408882141113, 1679425767.1949673], "version": 0.2, "tvm_version": "0.10.0"}
{"input": ["cuda -keys=cuda,gpu -arch=sm_86 -max_num_threads=1024 -thread_warp_size=32", "conv2d_nchw.cuda", [["TENSOR", [1, 192, 17, 17], "float32"], ["TENSOR", [320, 192, 3, 3], "float32"], [2, 2], [0, 0, 0, 0], [1, 1], "float32"], {}], "config": {"index": 2584239, "code_hash": null, "entity": [["tile_f", "sp", [-1, 1, 20, 1]], ["tile_y", "sp", [-1, 2, 1, 2]], ["tile_x", "sp", [-1, 1, 2, 1]], ["tile_rc", "sp", [-1, 8]], ["tile_ry", "sp", [-1, 3]], ["tile_rx", "sp", [-1, 1]], ["auto_unroll_max_step", "ot", 0], ["unroll_explicit", "ot", 0]]}, "result": [[5.316997987252599e-05, 5.3173460583696745e-05, 5.317790338812479e-05], 0, 1.6423263549804688, 1679425768.4080045], "version": 0.2, "tvm_version": "0.10.0"}
{"input": ["cuda -keys=cuda,gpu -arch=sm_86 -max_num_threads=1024 -thread_warp_size=32", "conv2d_nchw.cuda", [["TENSOR", [1, 192, 17, 17], "float32"], ["TENSOR", [320, 192, 3, 3], "float32"], [2, 2], [0, 0, 0, 0], [1, 1], "float32"], {}], "config": {"index": 17637039, "code_hash": null, "entity": [["tile_f", "sp", [-1, 1, 20, 1]], ["tile_y", "sp", [-1, 2, 1, 2]], ["tile_x", "sp", [-1, 1, 2, 1]], ["tile_rc", "sp", [-1, 8]], ["tile_ry", "sp", [-1, 3]], ["tile_rx", "sp", [-1, 1]], ["auto_unroll_max_step", "ot", 1500], ["unroll_explicit", "ot", 0]]}, "result": [[5.513918018967334e-05, 5.514098103266596e-05, 5.51427766069547e-05], 0, 1.730724811553955, 1679425769.6147852], "version": 0.2, "tvm_version": "0.10.0"}
{"input": ["cuda -keys=cuda,gpu -arch=sm_86 -max_num_threads=1024 -thread_warp_size=32", "conv2d_nchw.cuda", [["TENSOR", [1, 192, 17, 17], "float32"], ["TENSOR", [320, 192, 3, 3], "float32"], [2, 2], [0, 0, 0, 0], [1, 1], "float32"], {}], "config": {"index": 39791865, "code_hash": null, "entity": [["tile_f", "sp", [-1, 1, 16, 1]], ["tile_y", "sp", [-1, 2, 4, 1]], ["tile_x", "sp", [-1, 2, 1, 1]], ["tile_rc", "sp", [-1, 3]], ["tile_ry", "sp", [-1, 3]], ["tile_rx", "sp", [-1, 1]], ["auto_unroll_max_step", "ot", 1500], ["unroll_explicit", "ot", 1]]}, "result": [[5.7670296255506606e-05, 5.76709684287812e-05, 5.767364610866374e-05], 0, 1.6839570999145508, 1679425770.8362024], "version": 0.2, "tvm_version": "0.10.0"}
{"input": ["cuda -keys=cuda,gpu -arch=sm_86 -max_num_threads=1024 -thread_warp_size=32", "conv2d_nchw.cuda", [["TENSOR", [1, 192, 17, 17], "float32"], ["TENSOR", [320, 192, 3, 3], "float32"], [2, 2], [0, 0, 0, 0], [1, 1], "float32"], {}], "config": {"index": 24739065, "code_hash": null, "entity": [["tile_f", "sp", [-1, 1, 16, 1]], ["tile_y", "sp", [-1, 2, 4, 1]], ["tile_x", "sp", [-1, 2, 1, 1]], ["tile_rc", "sp", [-1, 3]], ["tile_ry", "sp", [-1, 3]], ["tile_rx", "sp", [-1, 1]], ["auto_unroll_max_step", "ot", 0], ["unroll_explicit", "ot", 1]]}, "result": [[5.777792968171724e-05, 5.7781295706883785e-05, 5.778357698001481e-05], 0, 1.5995469093322754, 1679425772.0356436], "version": 0.2, "tvm_version": "0.10.0"}
{"input": ["cuda -keys=cuda,gpu -arch=sm_86 -max_num_threads=1024 -thread_warp_size=32", "conv2d_nchw.cuda", [["TENSOR", [1, 192, 17, 17], "float32"], ["TENSOR", [320, 192, 3, 3], "float32"], [2, 2], [0, 0, 0, 0], [1, 1], "float32"], {}], "config": {"index": 32265465, "code_hash": null, "entity": [["tile_f", "sp", [-1, 1, 16, 1]], ["tile_y", "sp", [-1, 2, 4, 1]], ["tile_x", "sp", [-1, 2, 1, 1]], ["tile_rc", "sp", [-1, 3]], ["tile_ry", "sp", [-1, 3]], ["tile_rx", "sp", [-1, 1]], ["auto_unroll_max_step", "ot", 512], ["unroll_explicit", "ot", 1]]}, "result": [[5.7674445544554454e-05, 5.7676683901723496e-05, 5.767745031169783e-05], 0, 1.6914148330688477, 1679425773.2377925], "version": 0.2, "tvm_version": "0.10.0"}
{"input": ["cuda -keys=cuda,gpu -arch=sm_86 -max_num_threads=1024 -thread_warp_size=32", "conv2d_nchw.cuda", [["TENSOR", [1, 192, 17, 17], "float32"], ["TENSOR", [320, 192, 3, 3], "float32"], [2, 2], [0, 0, 0, 0], [1, 1], "float32"], {}], "config": {"index": 28634313, "code_hash": null, "entity": [["tile_f", "sp", [-1, 1, 16, 1]], ["tile_y", "sp", [-1, 2, 1, 1]], ["tile_x", "sp", [-1, 2, 1, 1]], ["tile_rc", "sp", [-1, 4]], ["tile_ry", "sp", [-1, 3]], ["tile_rx", "sp", [-1, 3]], ["auto_unroll_max_step", "ot", 0], ["unroll_explicit", "ot", 1]]}, "result": [[9.328231967213115e-05, 9.328892154566745e-05, 9.329011885245903e-05], 0, 1.6126551628112793, 1679425774.459135], "version": 0.2, "tvm_version": "0.10.0"}
{"input": ["cuda -keys=cuda,gpu -arch=sm_86 -max_num_threads=1024 -thread_warp_size=32", "conv2d_nchw.cuda", [["TENSOR", [1, 192, 17, 17], "float32"], ["TENSOR", [320, 192, 3, 3], "float32"], [2, 2], [0, 0, 0, 0], [1, 1], "float32"], {}], "config": {"index": 43687113, "code_hash": null, "entity": [["tile_f", "sp", [-1, 1, 16, 1]], ["tile_y", "sp", [-1, 2, 1, 1]], ["tile_x", "sp", [-1, 2, 1, 1]], ["tile_rc", "sp", [-1, 4]], ["tile_ry", "sp", [-1, 3]], ["tile_rx", "sp", [-1, 3]], ["auto_unroll_max_step", "ot", 1500], ["unroll_explicit", "ot", 1]]}, "result": [[9.406081116389548e-05, 9.406314014251781e-05, 9.406571318289787e-05], 0, 1.7167086601257324, 1679425775.6774483], "version": 0.2, "tvm_version": "0.10.0"}
{"input": ["cuda -keys=cuda,gpu -arch=sm_86 -max_num_threads=1024 -thread_warp_size=32", "conv2d_nchw.cuda", [["TENSOR", [1, 192, 17, 17], "float32"], ["TENSOR", [320, 192, 3, 3], "float32"], [2, 2], [0, 0, 0, 0], [1, 1], "float32"], {}], "config": {"index": 36160713, "code_hash": null, "entity": [["tile_f", "sp", [-1, 1, 16, 1]], ["tile_y", "sp", [-1, 2, 1, 1]], ["tile_x", "sp", [-1, 2, 1, 1]], ["tile_rc", "sp", [-1, 4]], ["tile_ry", "sp", [-1, 3]], ["tile_rx", "sp", [-1, 3]], ["auto_unroll_max_step", "ot", 512], ["unroll_explicit", "ot", 1]]}, "result": [[9.405741058823528e-05, 9.405803e-05, 9.406825294117648e-05], 0, 1.7186839580535889, 1679425776.9119165], "version": 0.2, "tvm_version": "0.10.0"}
{"input": ["cuda -keys=cuda,gpu -arch=sm_86 -max_num_threads=1024 -thread_warp_size=32", "conv2d_nchw.cuda", [["TENSOR", [1, 192, 17, 17], "float32"], ["TENSOR", [320, 192, 3, 3], "float32"], [2, 2], [0, 0, 0, 0], [1, 1], "float32"], {}], "config": {"index": 25180227, "code_hash": null, "entity": [["tile_f", "sp", [-1, 1, 10, 1]], ["tile_y", "sp", [-1, 2, 1, 1]], ["tile_x", "sp", [-1, 1, 4, 1]], ["tile_rc", "sp", [-1, 8]], ["tile_ry", "sp", [-1, 3]], ["tile_rx", "sp", [-1, 1]], ["auto_unroll_max_step", "ot", 0], ["unroll_explicit", "ot", 1]]}, "result": [[5.123671480263158e-05, 5.12474509868421e-05, 5.124917763157895e-05], 0, 1.5894031524658203, 1679425778.106306], "version": 0.2, "tvm_version": "0.10.0"}
{"input": ["cuda -keys=cuda,gpu -arch=sm_86 -max_num_threads=1024 -thread_warp_size=32", "conv2d_nchw.cuda", [["TENSOR", [1, 192, 17, 17], "float32"], ["TENSOR", [320, 192, 3, 3], "float32"], [2, 2], [0, 0, 0, 0], [1, 1], "float32"], {}], "config": {"index": 32706627, "code_hash": null, "entity": [["tile_f", "sp", [-1, 1, 10, 1]], ["tile_y", "sp", [-1, 2, 1, 1]], ["tile_x", "sp", [-1, 1, 4, 1]], ["tile_rc", "sp", [-1, 8]], ["tile_ry", "sp", [-1, 3]], ["tile_rx", "sp", [-1, 1]], ["auto_unroll_max_step", "ot", 512], ["unroll_explicit", "ot", 1]]}, "result": [[4.87570843335439e-05, 4.87570843335439e-05, 4.882015319014529e-05], 0, 1.6856322288513184, 1679425779.2929618], "version": 0.2, "tvm_version": "0.10.0"}
{"input": ["cuda -keys=cuda,gpu -arch=sm_86 -max_num_threads=1024 -thread_warp_size=32", "conv2d_nchw.cuda", [["TENSOR", [1, 192, 17, 17], "float32"], ["TENSOR", [320, 192, 3, 3], "float32"], [2, 2], [0, 0, 0, 0], [1, 1], "float32"], {}], "config": {"index": 40233027, "code_hash": null, "entity": [["tile_f", "sp", [-1, 1, 10, 1]], ["tile_y", "sp", [-1, 2, 1, 1]], ["tile_x", "sp", [-1, 1, 4, 1]], ["tile_rc", "sp", [-1, 8]], ["tile_ry", "sp", [-1, 3]], ["tile_rx", "sp", [-1, 1]], ["auto_unroll_max_step", "ot", 1500], ["unroll_explicit", "ot", 1]]}, "result": [[4.876479041353383e-05, 4.876861936090225e-05, 4.877086622807017e-05], 0, 1.6603055000305176, 1679425781.3627944], "version": 0.2, "tvm_version": "0.10.0"}
{"input": ["cuda -keys=cuda,gpu -arch=sm_86 -max_num_threads=1024 -thread_warp_size=32", "conv2d_nchw.cuda", [["TENSOR", [1, 192, 17, 17], "float32"], ["TENSOR", [320, 192, 3, 3], "float32"], [2, 2], [0, 0, 0, 0], [1, 1], "float32"], {}], "config": {"index": 25029033, "code_hash": null, "entity": [["tile_f", "sp", [-1, 1, 16, 1]], ["tile_y", "sp", [-1, 2, 1, 2]], ["tile_x", "sp", [-1, 1, 2, 1]], ["tile_rc", "sp", [-1, 6]], ["tile_ry", "sp", [-1, 3]], ["tile_rx", "sp", [-1, 1]], ["auto_unroll_max_step", "ot", 0], ["unroll_explicit", "ot", 1]]}, "result": [[5.6285668348954584e-05, 5.628825342465754e-05, 5.629231290555155e-05], 0, 1.578467845916748, 1679425782.5659044], "version": 0.2, "tvm_version": "0.10.0"}
{"input": ["cuda -keys=cuda,gpu -arch=sm_86 -max_num_threads=1024 -thread_warp_size=32", "conv2d_nchw.cuda", [["TENSOR", [1, 192, 17, 17], "float32"], ["TENSOR", [320, 192, 3, 3], "float32"], [2, 2], [0, 0, 0, 0], [1, 1], "float32"], {}], "config": {"index": 32555433, "code_hash": null, "entity": [["tile_f", "sp", [-1, 1, 16, 1]], ["tile_y", "sp", [-1, 2, 1, 2]], ["tile_x", "sp", [-1, 1, 2, 1]], ["tile_rc", "sp", [-1, 6]], ["tile_ry", "sp", [-1, 3]], ["tile_rx", "sp", [-1, 1]], ["auto_unroll_max_step", "ot", 512], ["unroll_explicit", "ot", 1]]}, "result": [[5.863174020156775e-05, 5.863174020156775e-05, 5.863365397536393e-05], 0, 1.7962162494659424, 1679425783.7667696], "version": 0.2, "tvm_version": "0.10.0"}
{"input": ["cuda -keys=cuda,gpu -arch=sm_86 -max_num_threads=1024 -thread_warp_size=32", "conv2d_nchw.cuda", [["TENSOR", [1, 192, 17, 17], "float32"], ["TENSOR", [320, 192, 3, 3], "float32"], [2, 2], [0, 0, 0, 0], [1, 1], "float32"], {}], "config": {"index": 40081833, "code_hash": null, "entity": [["tile_f", "sp", [-1, 1, 16, 1]], ["tile_y", "sp", [-1, 2, 1, 2]], ["tile_x", "sp", [-1, 1, 2, 1]], ["tile_rc", "sp", [-1, 6]], ["tile_ry", "sp", [-1, 3]], ["tile_rx", "sp", [-1, 1]], ["auto_unroll_max_step", "ot", 1500], ["unroll_explicit", "ot", 1]]}, "result": [[5.863492212189616e-05, 5.863574868322047e-05, 5.863574868322047e-05], 0, 1.7870910167694092, 1679425784.9641802], "version": 0.2, "tvm_version": "0.10.0"}
{"input": ["cuda -keys=cuda,gpu -arch=sm_86 -max_num_threads=1024 -thread_warp_size=32", "conv2d_nchw.cuda", [["TENSOR", [1, 192, 17, 17], "float32"], ["TENSOR", [320, 192, 3, 3], "float32"], [2, 2], [0, 0, 0, 0], [1, 1], "float32"], {}], "config": {"index": 17212665, "code_hash": null, "entity": [["tile_f", "sp", [-1, 1, 16, 1]], ["tile_y", "sp", [-1, 2, 4, 1]], ["tile_x", "sp", [-1, 2, 1, 1]], ["tile_rc", "sp", [-1, 3]], ["tile_ry", "sp", [-1, 3]], ["tile_rx", "sp", [-1, 1]], ["auto_unroll_max_step", "ot", 1500], ["unroll_explicit", "ot", 0]]}, "result": [[5.6330973204715964e-05, 5.6330973204715964e-05, 5.6396462307967136e-05], 0, 1.5787761211395264, 1679425786.1157756], "version": 0.2, "tvm_version": "0.10.0"}
{"input": ["cuda -keys=cuda,gpu -arch=sm_86 -max_num_threads=1024 -thread_warp_size=32", "conv2d_nchw.cuda", [["TENSOR", [1, 192, 17, 17], "float32"], ["TENSOR", [320, 192, 3, 3], "float32"], [2, 2], [0, 0, 0, 0], [1, 1], "float32"], {}], "config": {"index": 9686265, "code_hash": null, "entity": [["tile_f", "sp", [-1, 1, 16, 1]], ["tile_y", "sp", [-1, 2, 4, 1]], ["tile_x", "sp", [-1, 2, 1, 1]], ["tile_rc", "sp", [-1, 3]], ["tile_ry", "sp", [-1, 3]], ["tile_rx", "sp", [-1, 1]], ["auto_unroll_max_step", "ot", 512], ["unroll_explicit", "ot", 0]]}, "result": [[5.632768609224169e-05, 5.6328395066142296e-05, 5.6336474794422586e-05], 0, 1.625967025756836, 1679425787.3301666], "version": 0.2, "tvm_version": "0.10.0"}
{"input": ["cuda -keys=cuda,gpu -arch=sm_86 -max_num_threads=1024 -thread_warp_size=32", "conv2d_nchw.cuda", [["TENSOR", [1, 192, 17, 17], "float32"], ["TENSOR", [320, 192, 3, 3], "float32"], [2, 2], [0, 0, 0, 0], [1, 1], "float32"], {}], "config": {"index": 2159865, "code_hash": null, "entity": [["tile_f", "sp", [-1, 1, 16, 1]], ["tile_y", "sp", [-1, 2, 4, 1]], ["tile_x", "sp", [-1, 2, 1, 1]], ["tile_rc", "sp", [-1, 3]], ["tile_ry", "sp", [-1, 3]], ["tile_rx", "sp", [-1, 1]], ["auto_unroll_max_step", "ot", 0], ["unroll_explicit", "ot", 0]]}, "result": [[5.777338378978534e-05, 5.777338378978534e-05, 5.777489711324945e-05], 0, 1.5746052265167236, 1679425788.5296066], "version": 0.2, "tvm_version": "0.10.0"}
{"input": ["cuda -keys=cuda,gpu -arch=sm_86 -max_num_threads=1024 -thread_warp_size=32", "conv2d_nchw.cuda", [["TENSOR", [1, 192, 17, 17], "float32"], ["TENSOR", [320, 192, 3, 3], "float32"], [2, 2], [0, 0, 0, 0], [1, 1], "float32"], {}], "config": {"index": 2601027, "code_hash": null, "entity": [["tile_f", "sp", [-1, 1, 10, 1]], ["tile_y", "sp", [-1, 2, 1, 1]], ["tile_x", "sp", [-1, 1, 4, 1]], ["tile_rc", "sp", [-1, 8]], ["tile_ry", "sp", [-1, 3]], ["tile_rx", "sp", [-1, 1]], ["auto_unroll_max_step", "ot", 0], ["unroll_explicit", "ot", 0]]}, "result": [[5.1251873026315785e-05, 5.133001907894738e-05, 5.160892368421053e-05], 0, 1.6201136112213135, 1679425789.7410035], "version": 0.2, "tvm_version": "0.10.0"}
{"input": ["cuda -keys=cuda,gpu -arch=sm_86 -max_num_threads=1024 -thread_warp_size=32", "conv2d_nchw.cuda", [["TENSOR", [1, 192, 17, 17], "float32"], ["TENSOR", [320, 192, 3, 3], "float32"], [2, 2], [0, 0, 0, 0], [1, 1], "float32"], {}], "config": {"index": 17653827, "code_hash": null, "entity": [["tile_f", "sp", [-1, 1, 10, 1]], ["tile_y", "sp", [-1, 2, 1, 1]], ["tile_x", "sp", [-1, 1, 4, 1]], ["tile_rc", "sp", [-1, 8]], ["tile_ry", "sp", [-1, 3]], ["tile_rx", "sp", [-1, 1]], ["auto_unroll_max_step", "ot", 1500], ["unroll_explicit", "ot", 0]]}, "result": [[4.901699502487562e-05, 4.902113246268657e-05, 4.903093470149253e-05], 0, 1.626063346862793, 1679425790.9536], "version": 0.2, "tvm_version": "0.10.0"}
{"input": ["cuda -keys=cuda,gpu -arch=sm_86 -max_num_threads=1024 -thread_warp_size=32", "conv2d_nchw.cuda", [["TENSOR", [1, 192, 17, 17], "float32"], ["TENSOR", [320, 192, 3, 3], "float32"], [2, 2], [0, 0, 0, 0], [1, 1], "float32"], {}], "config": {"index": 10127427, "code_hash": null, "entity": [["tile_f", "sp", [-1, 1, 10, 1]], ["tile_y", "sp", [-1, 2, 1, 1]], ["tile_x", "sp", [-1, 1, 4, 1]], ["tile_rc", "sp", [-1, 8]], ["tile_ry", "sp", [-1, 3]], ["tile_rx", "sp", [-1, 1]], ["auto_unroll_max_step", "ot", 512], ["unroll_explicit", "ot", 0]]}, "result": [[4.902175875e-05, 4.9024247812499996e-05, 4.9030079687499997e-05], 0, 1.6418397426605225, 1679425792.1853144], "version": 0.2, "tvm_version": "0.10.0"}
{"input": ["cuda -keys=cuda,gpu -arch=sm_86 -max_num_threads=1024 -thread_warp_size=32", "conv2d_nchw.cuda", [["TENSOR", [1, 192, 17, 17], "float32"], ["TENSOR", [320, 192, 3, 3], "float32"], [2, 2], [0, 0, 0, 0], [1, 1], "float32"], {}], "config": {"index": 40216233, "code_hash": null, "entity": [["tile_f", "sp", [-1, 1, 16, 1]], ["tile_y", "sp", [-1, 2, 1, 2]], ["tile_x", "sp", [-1, 1, 2, 1]], ["tile_rc", "sp", [-1, 8]], ["tile_ry", "sp", [-1, 3]], ["tile_rx", "sp", [-1, 1]], ["auto_unroll_max_step", "ot", 1500], ["unroll_explicit", "ot", 1]]}, "result": [[5.604175688237397e-05, 5.6042848051483736e-05, 5.610363210582768e-05], 0, 1.951350212097168, 1679425793.3865535], "version": 0.2, "tvm_version": "0.10.0"}
{"input": ["cuda -keys=cuda,gpu -arch=sm_86 -max_num_threads=1024 -thread_warp_size=32", "conv2d_nchw.cuda", [["TENSOR", [1, 192, 17, 17], "float32"], ["TENSOR", [320, 192, 3, 3], "float32"], [2, 2], [0, 0, 0, 0], [1, 1], "float32"], {}], "config": {"index": 25163433, "code_hash": null, "entity": [["tile_f", "sp", [-1, 1, 16, 1]], ["tile_y", "sp", [-1, 2, 1, 2]], ["tile_x", "sp", [-1, 1, 2, 1]], ["tile_rc", "sp", [-1, 8]], ["tile_ry", "sp", [-1, 3]], ["tile_rx", "sp", [-1, 1]], ["auto_unroll_max_step", "ot", 0], ["unroll_explicit", "ot", 1]]}, "result": [[5.335852494873548e-05, 5.3359990430622006e-05, 5.336488721804511e-05], 0, 1.6309008598327637, 1679425794.5847943], "version": 0.2, "tvm_version": "0.10.0"}
{"input": ["cuda -keys=cuda,gpu -arch=sm_86 -max_num_threads=1024 -thread_warp_size=32", "conv2d_nchw.cuda", [["TENSOR", [1, 192, 17, 17], "float32"], ["TENSOR", [320, 192, 3, 3], "float32"], [2, 2], [0, 0, 0, 0], [1, 1], "float32"], {}], "config": {"index": 32689833, "code_hash": null, "entity": [["tile_f", "sp", [-1, 1, 16, 1]], ["tile_y", "sp", [-1, 2, 1, 2]], ["tile_x", "sp", [-1, 1, 2, 1]], ["tile_rc", "sp", [-1, 8]], ["tile_ry", "sp", [-1, 3]], ["tile_rx", "sp", [-1, 1]], ["auto_unroll_max_step", "ot", 512], ["unroll_explicit", "ot", 1]]}, "result": [[5.6036101151907844e-05, 5.603874838012959e-05, 5.603979769618431e-05], 0, 1.945730209350586, 1679425795.7790477], "version": 0.2, "tvm_version": "0.10.0"}
{"input": ["cuda -keys=cuda,gpu -arch=sm_86 -max_num_threads=1024 -thread_warp_size=32", "conv2d_nchw.cuda", [["TENSOR", [1, 192, 17, 17], "float32"], ["TENSOR", [320, 192, 3, 3], "float32"], [2, 2], [0, 0, 0, 0], [1, 1], "float32"], {}], "config": {"index": 40213209, "code_hash": null, "entity": [["tile_f", "sp", [-1, 1, 16, 1]], ["tile_y", "sp", [-1, 4, 1, 1]], ["tile_x", "sp", [-1, 1, 2, 1]], ["tile_rc", "sp", [-1, 8]], ["tile_ry", "sp", [-1, 3]], ["tile_rx", "sp", [-1, 1]], ["auto_unroll_max_step", "ot", 1500], ["unroll_explicit", "ot", 1]]}, "result": [[5.5559533498759304e-05, 5.5559533498759304e-05, 5.5559533498759304e-05], 0, 1.8644485473632812, 1679425796.9803276], "version": 0.2, "tvm_version": "0.10.0"}
{"input": ["cuda -keys=cuda,gpu -arch=sm_86 -max_num_threads=1024 -thread_warp_size=32", "conv2d_nchw.cuda", [["TENSOR", [1, 192, 17, 17], "float32"], ["TENSOR", [320, 192, 3, 3], "float32"], [2, 2], [0, 0, 0, 0], [1, 1], "float32"], {}], "config": {"index": 25160409, "code_hash": null, "entity": [["tile_f", "sp", [-1, 1, 16, 1]], ["tile_y", "sp", [-1, 4, 1, 1]], ["tile_x", "sp", [-1, 1, 2, 1]], ["tile_rc", "sp", [-1, 8]], ["tile_ry", "sp", [-1, 3]], ["tile_rx", "sp", [-1, 1]], ["auto_unroll_max_step", "ot", 0], ["unroll_explicit", "ot", 1]]}, "result": [[5.292249593771158e-05, 5.292492383209208e-05, 5.293081753554502e-05], 0, 1.626729965209961, 1679425798.189102], "version": 0.2, "tvm_version": "0.10.0"}
{"input": ["cuda -keys=cuda,gpu -arch=sm_86 -max_num_threads=1024 -thread_warp_size=32", "conv2d_nchw.cuda", [["TENSOR", [1, 192, 17, 17], "float32"], ["TENSOR", [320, 192, 3, 3], "float32"], [2, 2], [0, 0, 0, 0], [1, 1], "float32"], {}], "config": {"index": 32686809, "code_hash": null, "entity": [["tile_f", "sp", [-1, 1, 16, 1]], ["tile_y", "sp", [-1, 4, 1, 1]], ["tile_x", "sp", [-1, 1, 2, 1]], ["tile_rc", "sp", [-1, 8]], ["tile_ry", "sp", [-1, 3]], ["tile_rx", "sp", [-1, 1]], ["auto_unroll_max_step", "ot", 512], ["unroll_explicit", "ot", 1]]}, "result": [[5.55649205955335e-05, 5.556600779865297e-05, 5.565780964197094e-05], 0, 1.850893497467041, 1679425799.4023945], "version": 0.2, "tvm_version": "0.10.0"}
