src/tvm/results/cuda_rtx3080/bert/ga/cpu.log_layer_0.log
{"input": ["cuda -keys=cuda,gpu -arch=sm_86 -max_num_threads=1024 -thread_warp_size=32", "batch_matmul.cuda", [["TENSOR", [1, 128, 768], "float32"], ["TENSOR", [1, 768, 768], "float32"], [1, 128, 768], "float32", 0, 0], {}], "config": {"index": 21892, "code_hash": null, "entity": [["tile_y", "sp", [-1, 16, 1]], ["tile_x", "sp", [-1, 4, 8]], ["tile_k", "sp", [-1, 6]], ["auto_unroll_max_step", "ot", 8], ["unroll_explicit", "ot", 0]]}, "result": [[4.875910719530102e-05, 4.909598825256975e-05, 4.909824559471365e-05], 0, 1.6209087371826172, 1688766084.3282788], "version": 0.2, "tvm_version": "0.13.dev0"}
{"input": ["cuda -keys=cuda,gpu -arch=sm_86 -max_num_threads=1024 -thread_warp_size=32", "batch_matmul.cuda", [["TENSOR", [1, 128, 768], "float32"], ["TENSOR", [1, 768, 768], "float32"], [1, 128, 768], "float32", 0, 0], {}], "config": {"index": 312073, "code_hash": null, "entity": [["tile_y", "sp", [-1, 16, 8]], ["tile_x", "sp", [-1, 48, 2]], ["tile_k", "sp", [-1, 48]], ["auto_unroll_max_step", "ot", 64], ["unroll_explicit", "ot", 0]]}, "result": [[8.251412095933264e-05, 8.25174228362878e-05, 8.252057299270073e-05], 0, 1.6923799514770508, 1688766085.6562705], "version": 0.2, "tvm_version": "0.13.dev0"}
{"input": ["cuda -keys=cuda,gpu -arch=sm_86 -max_num_threads=1024 -thread_warp_size=32", "batch_matmul.cuda", [["TENSOR", [1, 128, 768], "float32"], ["TENSOR", [1, 768, 768], "float32"], [1, 128, 768], "float32", 0, 0], {}], "config": {"index": 97291, "code_hash": null, "entity": [["tile_y", "sp", [-1, 16, 4]], ["tile_x", "sp", [-1, 3, 1]], ["tile_k", "sp", [-1, 3]], ["auto_unroll_max_step", "ot", 16], ["unroll_explicit", "ot", 0]]}, "result": [[0.00014215179365079366, 0.00014231506525573192, 0.00014231686860670194], 0, 1.65248703956604, 1688766086.9853299], "version": 0.2, "tvm_version": "0.13.dev0"}
{"input": ["cuda -keys=cuda,gpu -arch=sm_86 -max_num_threads=1024 -thread_warp_size=32", "batch_matmul.cuda", [["TENSOR", [1, 128, 768], "float32"], ["TENSOR", [1, 768, 768], "float32"], [1, 128, 768], "float32", 0, 0], {}], "config": {"index": 490126, "code_hash": null, "entity": [["tile_y", "sp", [-1, 2, 8]], ["tile_x", "sp", [-1, 2, 64]], ["tile_k", "sp", [-1, 48]], ["auto_unroll_max_step", "ot", 16], ["unroll_explicit", "ot", 1]]}, "result": [[0.0022415588222222224, 0.0022424689333333334, 0.0022445851555555557], 0, 1.7574150562286377, 1688766087.9208658], "version": 0.2, "tvm_version": "0.13.dev0"}
{"input": ["cuda -keys=cuda,gpu -arch=sm_86 -max_num_threads=1024 -thread_warp_size=32", "batch_matmul.cuda", [["TENSOR", [1, 128, 768], "float32"], ["TENSOR", [1, 768, 768], "float32"], [1, 128, 768], "float32", 0, 0], {}], "config": {"index": 618767, "code_hash": null, "entity": [["tile_y", "sp", [-1, 1, 128]], ["tile_x", "sp", [-1, 256, 3]], ["tile_k", "sp", [-1, 2]], ["auto_unroll_max_step", "ot", 64], ["unroll_explicit", "ot", 1]]}, "result": [[0.007506651142857143, 0.007507821714285714, 0.007513088214285714], 0, 2.098238468170166, 1688766088.9022355], "version": 0.2, "tvm_version": "0.13.dev0"}
{"input": ["cuda -keys=cuda,gpu -arch=sm_86 -max_num_threads=1024 -thread_warp_size=32", "batch_matmul.cuda", [["TENSOR", [1, 128, 768], "float32"], ["TENSOR", [1, 768, 768], "float32"], [1, 128, 768], "float32", 0, 0], {}], "config": {"index": 551821, "code_hash": null, "entity": [["tile_y", "sp", [-1, 32, 2]], ["tile_x", "sp", [-1, 24, 8]], ["tile_k", "sp", [-1, 8]], ["auto_unroll_max_step", "ot", 32], ["unroll_explicit", "ot", 1]]}, "result": [[0.00022114308539944905, 0.00022115010606060608, 0.00022115138842975206], 0, 1.6803185939788818, 1688766090.2256649], "version": 0.2, "tvm_version": "0.13.dev0"}
{"input": ["cuda -keys=cuda,gpu -arch=sm_86 -max_num_threads=1024 -thread_warp_size=32", "batch_matmul.cuda", [["TENSOR", [1, 128, 768], "float32"], ["TENSOR", [1, 768, 768], "float32"], [1, 128, 768], "float32", 0, 0], {}], "config": {"index": 196626, "code_hash": null, "entity": [["tile_y", "sp", [-1, 1, 32]], ["tile_x", "sp", [-1, 16, 6]], ["tile_k", "sp", [-1, 6]], ["auto_unroll_max_step", "ot", 32], ["unroll_explicit", "ot", 0]]}, "result": [[0.0001836197399770905, 0.00018362077090492551, 0.00018362091065292097], 0, 1.8778271675109863, 1688766091.540821], "version": 0.2, "tvm_version": "0.13.dev0"}
{"input": ["cuda -keys=cuda,gpu -arch=sm_86 -max_num_threads=1024 -thread_warp_size=32", "batch_matmul.cuda", [["TENSOR", [1, 128, 768], "float32"], ["TENSOR", [1, 768, 768], "float32"], [1, 128, 768], "float32", 0, 0], {}], "config": {"index": 427789, "code_hash": null, "entity": [["tile_y", "sp", [-1, 2, 1]], ["tile_x", "sp", [-1, 4, 1]], ["tile_k", "sp", [-1, 384]], ["auto_unroll_max_step", "ot", 8], ["unroll_explicit", "ot", 1]]}, "result": [[0.0004707125726744186, 0.00047071607558139535, 0.0004707185145348837], 0, 1.621403694152832, 1688766092.8751626], "version": 0.2, "tvm_version": "0.13.dev0"}
{"input": ["cuda -keys=cuda,gpu -arch=sm_86 -max_num_threads=1024 -thread_warp_size=32", "batch_matmul.cuda", [["TENSOR", [1, 128, 768], "float32"], ["TENSOR", [1, 768, 768], "float32"], [1, 128, 768], "float32", 0, 0], {}], "config": {"index": 641422, "code_hash": null, "entity": [["tile_y", "sp", [-1, 4, 2]], ["tile_x", "sp", [-1, 1, 384]], ["tile_k", "sp", [-1, 8]], ["auto_unroll_max_step", "ot", 64], ["unroll_explicit", "ot", 1]]}, "result": [[0.016974116714285715, 0.01697423542857143, 0.017317303142857142], 0, 2.207571029663086, 1688766093.9849365], "version": 0.2, "tvm_version": "0.13.dev0"}
{"input": ["cuda -keys=cuda,gpu -arch=sm_86 -max_num_threads=1024 -thread_warp_size=32", "batch_matmul.cuda", [["TENSOR", [1, 128, 768], "float32"], ["TENSOR", [1, 768, 768], "float32"], [1, 128, 768], "float32", 0, 0], {}], "config": {"index": 13206, "code_hash": null, "entity": [["tile_y", "sp", [-1, 1, 32]], ["tile_x", "sp", [-1, 4, 24]], ["tile_k", "sp", [-1, 3]], ["auto_unroll_max_step", "ot", 8], ["unroll_explicit", "ot", 0]]}, "result": [[0.004953380380952381, 0.004953429428571429, 0.004953624523809524], 0, 1.6007773876190186, 1688766094.9413455], "version": 0.2, "tvm_version": "0.13.dev0"}
{"input": ["cuda -keys=cuda,gpu -arch=sm_86 -max_num_threads=1024 -thread_warp_size=32", "batch_matmul.cuda", [["TENSOR", [1, 128, 768], "float32"], ["TENSOR", [1, 768, 768], "float32"], [1, 128, 768], "float32", 0, 0], {}], "config": {"index": 279580, "code_hash": null, "entity": [["tile_y", "sp", [-1, 16, 1]], ["tile_x", "sp", [-1, 12, 8]], ["tile_k", "sp", [-1, 4]], ["auto_unroll_max_step", "ot", 64], ["unroll_explicit", "ot", 0]]}, "result": [[9.001676330690828e-05, 9.00169014722537e-05, 9.00169014722537e-05], 0, 1.511437177658081, 1688766096.2489853], "version": 0.2, "tvm_version": "0.13.dev0"}
{"input": ["cuda -keys=cuda,gpu -arch=sm_86 -max_num_threads=1024 -thread_warp_size=32", "batch_matmul.cuda", [["TENSOR", [1, 128, 768], "float32"], ["TENSOR", [1, 768, 768], "float32"], [1, 128, 768], "float32", 0, 0], {}], "config": {"index": 297245, "code_hash": null, "entity": [["tile_y", "sp", [-1, 8, 16]], ["tile_x", "sp", [-1, 4, 2]], ["tile_k", "sp", [-1, 16]], ["auto_unroll_max_step", "ot", 64], ["unroll_explicit", "ot", 0]]}, "result": [[7.248847243735764e-05, 7.491423876197493e-05, 7.878673323507738e-05], 0, 1.5572726726531982, 1688766098.8230271], "version": 0.2, "tvm_version": "0.13.dev0"}
{"input": ["cuda -keys=cuda,gpu -arch=sm_86 -max_num_threads=1024 -thread_warp_size=32", "batch_matmul.cuda", [["TENSOR", [1, 128, 768], "float32"], ["TENSOR", [1, 768, 768], "float32"], [1, 128, 768], "float32", 0, 0], {}], "config": {"index": 24103, "code_hash": null, "entity": [["tile_y", "sp", [-1, 16, 4]], ["tile_x", "sp", [-1, 4, 192]], ["tile_k", "sp", [-1, 6]], ["auto_unroll_max_step", "ot", 8], ["unroll_explicit", "ot", 0]]}, "result": [[0.005676373333333333, 0.005676430166666666, 0.005676544166666667], 0, 2.254608154296875, 1688766099.7725708], "version": 0.2, "tvm_version": "0.13.dev0"}
{"input": ["cuda -keys=cuda,gpu -arch=sm_86 -max_num_threads=1024 -thread_warp_size=32", "batch_matmul.cuda", [["TENSOR", [1, 128, 768], "float32"], ["TENSOR", [1, 768, 768], "float32"], [1, 128, 768], "float32", 0, 0], {}], "config": {"index": 568233, "code_hash": null, "entity": [["tile_y", "sp", [-1, 2, 2]], ["tile_x", "sp", [-1, 2, 128]], ["tile_k", "sp", [-1, 24]], ["auto_unroll_max_step", "ot", 32], ["unroll_explicit", "ot", 1]]}, "result": [[0.00134402048, 0.0013440887333333335, 0.0013444573866666666], 0, 1.5009121894836426, 1688766100.6852467], "version": 0.2, "tvm_version": "0.13.dev0"}
{"input": ["cuda -keys=cuda,gpu -arch=sm_86 -max_num_threads=1024 -thread_warp_size=32", "batch_matmul.cuda", [["TENSOR", [1, 128, 768], "float32"], ["TENSOR", [1, 768, 768], "float32"], [1, 128, 768], "float32", 0, 0], {}], "config": {"index": 351277, "code_hash": null, "entity": [["tile_y", "sp", [-1, 16, 8]], ["tile_x", "sp", [-1, 8, 3]], ["tile_k", "sp", [-1, 1]], ["auto_unroll_max_step", "ot", 8], ["unroll_explicit", "ot", 1]]}, "result": [[0.00021497821820615798, 0.00021498105756358765, 0.0002149821606425703], 0, 1.64615797996521, 1688766102.0062532], "version": 0.2, "tvm_version": "0.13.dev0"}
{"input": ["cuda -keys=cuda,gpu -arch=sm_86 -max_num_threads=1024 -thread_warp_size=32", "batch_matmul.cuda", [["TENSOR", [1, 128, 768], "float32"], ["TENSOR", [1, 768, 768], "float32"], [1, 128, 768], "float32", 0, 0], {}], "config": {"index": 23342, "code_hash": null, "entity": [["tile_y", "sp", [-1, 64, 2]], ["tile_x", "sp", [-1, 1, 48]], ["tile_k", "sp", [-1, 6]], ["auto_unroll_max_step", "ot", 8], ["unroll_explicit", "ot", 0]]}, "result": [[0.00019878380840543885, 0.00019878510877626698, 0.00019878609023485787], 0, 1.7196166515350342, 1688766103.3250604], "version": 0.2, "tvm_version": "0.13.dev0"}
{"input": ["cuda -keys=cuda,gpu -arch=sm_86 -max_num_threads=1024 -thread_warp_size=32", "batch_matmul.cuda", [["TENSOR", [1, 128, 768], "float32"], ["TENSOR", [1, 768, 768], "float32"], [1, 128, 768], "float32", 0, 0], {}], "config": {"index": 20274, "code_hash": null, "entity": [["tile_y", "sp", [-1, 64, 1]], ["tile_x", "sp", [-1, 8, 2]], ["tile_k", "sp", [-1, 6]], ["auto_unroll_max_step", "ot", 8], ["unroll_explicit", "ot", 0]]}, "result": [[7.545168328584994e-05, 7.553823646723647e-05, 7.553872174738842e-05], 0, 1.6134822368621826, 1688766104.6365376], "version": 0.2, "tvm_version": "0.13.dev0"}
{"input": ["cuda -keys=cuda,gpu -arch=sm_86 -max_num_threads=1024 -thread_warp_size=32", "batch_matmul.cuda", [["TENSOR", [1, 128, 768], "float32"], ["TENSOR", [1, 768, 768], "float32"], [1, 128, 768], "float32", 0, 0], {}], "config": {"index": 141238, "code_hash": null, "entity": [["tile_y", "sp", [-1, 4, 2]], ["tile_x", "sp", [-1, 24, 1]], ["tile_k", "sp", [-1, 64]], ["auto_unroll_max_step", "ot", 16], ["unroll_explicit", "ot", 0]]}, "result": [[5.0383232718173286e-05, 5.0453970910228334e-05, 5.0489543009071e-05], 0, 1.567495346069336, 1688766105.9658089], "version": 0.2, "tvm_version": "0.13.dev0"}
{"input": ["cuda -keys=cuda,gpu -arch=sm_86 -max_num_threads=1024 -thread_warp_size=32", "batch_matmul.cuda", [["TENSOR", [1, 128, 768], "float32"], ["TENSOR", [1, 768, 768], "float32"], [1, 128, 768], "float32", 0, 0], {}], "config": {"index": 319039, "code_hash": null, "entity": [["tile_y", "sp", [-1, 128, 1]], ["tile_x", "sp", [-1, 4, 16]], ["tile_k", "sp", [-1, 64]], ["auto_unroll_max_step", "ot", 64], ["unroll_explicit", "ot", 0]]}, "result": [[0.0003026266447368421, 0.0003026304887218045, 0.00030264204699248124], 0, 1.5862150192260742, 1688766107.2843783], "version": 0.2, "tvm_version": "0.13.dev0"}
{"input": ["cuda -keys=cuda,gpu -arch=sm_86 -max_num_threads=1024 -thread_warp_size=32", "batch_matmul.cuda", [["TENSOR", [1, 128, 768], "float32"], ["TENSOR", [1, 768, 768], "float32"], [1, 128, 768], "float32", 0, 0], {}], "config": {"index": 542915, "code_hash": null, "entity": [["tile_y", "sp", [-1, 1, 128]], ["tile_x", "sp", [-1, 2, 24]], ["tile_k", "sp", [-1, 4]], ["auto_unroll_max_step", "ot", 32], ["unroll_explicit", "ot", 1]]}, "result": [[0.029855232000000002, 0.0298567675, 0.02988723175], 0, 1.9900918006896973, 1688766108.3890758], "version": 0.2, "tvm_version": "0.13.dev0"}
{"input": ["cuda -keys=cuda,gpu -arch=sm_86 -max_num_threads=1024 -thread_warp_size=32", "batch_matmul.cuda", [["TENSOR", [1, 128, 768], "float32"], ["TENSOR", [1, 768, 768], "float32"], [1, 128, 768], "float32", 0, 0], {}], "config": {"index": 515268, "code_hash": null, "entity": [["tile_y", "sp", [-1, 1, 1]], ["tile_x", "sp", [-1, 4, 1]], ["tile_k", "sp", [-1, 384]], ["auto_unroll_max_step", "ot", 16], ["unroll_explicit", "ot", 1]]}, "result": [[0.000978819315151515, 0.0009788757272727274, 0.0009823200545454546], 0, 1.6705763339996338, 1688766109.7244055], "version": 0.2, "tvm_version": "0.13.dev0"}
{"input": ["cuda -keys=cuda,gpu -arch=sm_86 -max_num_threads=1024 -thread_warp_size=32", "batch_matmul.cuda", [["TENSOR", [1, 128, 768], "float32"], ["TENSOR", [1, 768, 768], "float32"], [1, 128, 768], "float32", 0, 0], {}], "config": {"index": 507207, "code_hash": null, "entity": [["tile_y", "sp", [-1, 8, 1]], ["tile_x", "sp", [-1, 12, 4]], ["tile_k", "sp", [-1, 192]], ["auto_unroll_max_step", "ot", 16], ["unroll_explicit", "ot", 1]]}, "result": [[5.680732205240175e-05, 5.683317540029113e-05, 5.685323726346434e-05], 0, 1.6638555526733398, 1688766111.0331852], "version": 0.2, "tvm_version": "0.13.dev0"}
{"input": ["cuda -keys=cuda,gpu -arch=sm_86 -max_num_threads=1024 -thread_warp_size=32", "batch_matmul.cuda", [["TENSOR", [1, 128, 768], "float32"], ["TENSOR", [1, 768, 768], "float32"], [1, 128, 768], "float32", 0, 0], {}], "config": {"index": 450127, "code_hash": null, "entity": [["tile_y", "sp", [-1, 16, 4]], ["tile_x", "sp", [-1, 64, 12]], ["tile_k", "sp", [-1, 3]], ["auto_unroll_max_step", "ot", 16], ["unroll_explicit", "ot", 1]]}, "result": [[0.0013566318108108107, 0.0013566477972972973, 0.001356799972972973], 0, 1.296783447265625, 1688766112.9581885], "version": 0.2, "tvm_version": "0.13.dev0"}
{"input": ["cuda -keys=cuda,gpu -arch=sm_86 -max_num_threads=1024 -thread_warp_size=32", "batch_matmul.cuda", [["TENSOR", [1, 128, 768], "float32"], ["TENSOR", [1, 768, 768], "float32"], [1, 128, 768], "float32", 0, 0], {}], "config": {"index": 645970, "code_hash": null, "entity": [["tile_y", "sp", [-1, 2, 8]], ["tile_x", "sp", [-1, 1, 128]], ["tile_k", "sp", [-1, 12]], ["auto_unroll_max_step", "ot", 64], ["unroll_explicit", "ot", 1]]}, "result": [[0.0105394172, 0.010548505400000002, 0.010660147], 0, 1.7969403266906738, 1688766113.9393065], "version": 0.2, "tvm_version": "0.13.dev0"}
{"input": ["cuda -keys=cuda,gpu -arch=sm_86 -max_num_threads=1024 -thread_warp_size=32", "batch_matmul.cuda", [["TENSOR", [1, 128, 768], "float32"], ["TENSOR", [1, 768, 768], "float32"], [1, 128, 768], "float32", 0, 0], {}], "config": {"index": 121175, "code_hash": null, "entity": [["tile_y", "sp", [-1, 1, 128]], ["tile_x", "sp", [-1, 3, 128]], ["tile_k", "sp", [-1, 12]], ["auto_unroll_max_step", "ot", 16], ["unroll_explicit", "ot", 0]]}, "result": [[0.047853566333333326, 0.047862101, 0.04787575266666667], 0, 2.1778948307037354, 1688766115.2137115], "version": 0.2, "tvm_version": "0.13.dev0"}
{"input": ["cuda -keys=cuda,gpu -arch=sm_86 -max_num_threads=1024 -thread_warp_size=32", "batch_matmul.cuda", [["TENSOR", [1, 128, 768], "float32"], ["TENSOR", [1, 768, 768], "float32"], [1, 128, 768], "float32", 0, 0], {}], "config": {"index": 465495, "code_hash": null, "entity": [["tile_y", "sp", [-1, 1, 4]], ["tile_x", "sp", [-1, 8, 32]], ["tile_k", "sp", [-1, 8]], ["auto_unroll_max_step", "ot", 16], ["unroll_explicit", "ot", 1]]}, "result": [[0.00040260723599999995, 0.00040262042, 0.00040269823999999996], 0, 1.368941068649292, 1688766116.1565115], "version": 0.2, "tvm_version": "0.13.dev0"}
{"input": ["cuda -keys=cuda,gpu -arch=sm_86 -max_num_threads=1024 -thread_warp_size=32", "batch_matmul.cuda", [["TENSOR", [1, 128, 768], "float32"], ["TENSOR", [1, 768, 768], "float32"], [1, 128, 768], "float32", 0, 0], {}], "config": {"index": 197722, "code_hash": null, "entity": [["tile_y", "sp", [-1, 4, 2]], ["tile_x", "sp", [-1, 24, 16]], ["tile_k", "sp", [-1, 6]], ["auto_unroll_max_step", "ot", 32], ["unroll_explicit", "ot", 0]]}, "result": [[0.00022549110939691443, 0.00022549399859747547, 0.00022550403646563817], 0, 1.6951537132263184, 1688766117.4767056], "version": 0.2, "tvm_version": "0.13.dev0"}
{"input": ["cuda -keys=cuda,gpu -arch=sm_86 -max_num_threads=1024 -thread_warp_size=32", "batch_matmul.cuda", [["TENSOR", [1, 128, 768], "float32"], ["TENSOR", [1, 768, 768], "float32"], [1, 128, 768], "float32", 0, 0], {}], "config": {"index": 657891, "code_hash": null, "entity": [["tile_y", "sp", [-1, 2, 16]], ["tile_x", "sp", [-1, 12, 4]], ["tile_k", "sp", [-1, 32]], ["auto_unroll_max_step", "ot", 64], ["unroll_explicit", "ot", 1]]}, "result": [[8.614859902067465e-05, 8.614915505984767e-05, 8.615017627856365e-05], 0, 1.8991029262542725, 1688766118.7815893], "version": 0.2, "tvm_version": "0.13.dev0"}
{"input": ["cuda -keys=cuda,gpu -arch=sm_86 -max_num_threads=1024 -thread_warp_size=32", "batch_matmul.cuda", [["TENSOR", [1, 128, 768], "float32"], ["TENSOR", [1, 768, 768], "float32"], [1, 128, 768], "float32", 0, 0], {}], "config": {"index": 546915, "code_hash": null, "entity": [["tile_y", "sp", [-1, 8, 1]], ["tile_x", "sp", [-1, 16, 8]], ["tile_k", "sp", [-1, 6]], ["auto_unroll_max_step", "ot", 32], ["unroll_explicit", "ot", 1]]}, "result": [[9.474149434860202e-05, 9.47421748958953e-05, 9.474467102914933e-05], 0, 1.6595087051391602, 1688766120.090899], "version": 0.2, "tvm_version": "0.13.dev0"}
{"input": ["cuda -keys=cuda,gpu -arch=sm_86 -max_num_threads=1024 -thread_warp_size=32", "batch_matmul.cuda", [["TENSOR", [1, 128, 768], "float32"], ["TENSOR", [1, 768, 768], "float32"], [1, 128, 768], "float32", 0, 0], {}], "config": {"index": 212583, "code_hash": null, "entity": [["tile_y", "sp", [-1, 8, 1]], ["tile_x", "sp", [-1, 1, 32]], ["tile_k", "sp", [-1, 16]], ["auto_unroll_max_step", "ot", 32], ["unroll_explicit", "ot", 0]]}, "result": [[0.00014475931674208143, 0.00014529030859728508, 0.00014540800180995475], 0, 1.6530482769012451, 1688766121.4174619], "version": 0.2, "tvm_version": "0.13.dev0"}
{"input": ["cuda -keys=cuda,gpu -arch=sm_86 -max_num_threads=1024 -thread_warp_size=32", "batch_matmul.cuda", [["TENSOR", [1, 128, 768], "float32"], ["TENSOR", [1, 768, 768], "float32"], [1, 128, 768], "float32", 0, 0], {}], "config": {"index": 206311, "code_hash": null, "entity": [["tile_y", "sp", [-1, 2, 32]], ["tile_x", "sp", [-1, 8, 6]], ["tile_k", "sp", [-1, 12]], ["auto_unroll_max_step", "ot", 32], ["unroll_explicit", "ot", 0]]}, "result": [[0.00019336685662650605, 0.0001933904253012048, 0.00019339527831325302], 0, 1.8336400985717773, 1688766122.743125], "version": 0.2, "tvm_version": "0.13.dev0"}
{"input": ["cuda -keys=cuda,gpu -arch=sm_86 -max_num_threads=1024 -thread_warp_size=32", "batch_matmul.cuda", [["TENSOR", [1, 128, 768], "float32"], ["TENSOR", [1, 768, 768], "float32"], [1, 128, 768], "float32", 0, 0], {}], "config": {"index": 21360, "code_hash": null, "entity": [["tile_y", "sp", [-1, 16, 2]], ["tile_x", "sp", [-1, 48, 4]], ["tile_k", "sp", [-1, 6]], ["auto_unroll_max_step", "ot", 8], ["unroll_explicit", "ot", 0]]}, "result": [[0.00010546709457671958, 0.00010547199933862432, 0.00010547199933862432], 0, 1.5758507251739502, 1688766124.0476882], "version": 0.2, "tvm_version": "0.13.dev0"}
{"input": ["cuda -keys=cuda,gpu -arch=sm_86 -max_num_threads=1024 -thread_warp_size=32", "batch_matmul.cuda", [["TENSOR", [1, 128, 768], "float32"], ["TENSOR", [1, 768, 768], "float32"], [1, 128, 768], "float32", 0, 0], {}], "config": {"index": 133365, "code_hash": null, "entity": [["tile_y", "sp", [-1, 1, 8]], ["tile_x", "sp", [-1, 4, 6]], ["tile_k", "sp", [-1, 32]], ["auto_unroll_max_step", "ot", 16], ["unroll_explicit", "ot", 0]]}, "result": [[0.00013582461577608143, 0.00013629622731128074, 0.00013632730110262935], 0, 1.7742764949798584, 1688766125.3674705], "version": 0.2, "tvm_version": "0.13.dev0"}
{"input": ["cuda -keys=cuda,gpu -arch=sm_86 -max_num_threads=1024 -thread_warp_size=32", "batch_matmul.cuda", [["TENSOR", [1, 128, 768], "float32"], ["TENSOR", [1, 768, 768], "float32"], [1, 128, 768], "float32", 0, 0], {}], "config": {"index": 38390, "code_hash": null, "entity": [["tile_y", "sp", [-1, 64, 2]], ["tile_x", "sp", [-1, 4, 96]], ["tile_k", "sp", [-1, 16]], ["auto_unroll_max_step", "ot", 8], ["unroll_explicit", "ot", 0]]}, "result": [[0.0016482355081967215, 0.0016483378032786887, 0.0016484384918032788], 0, 1.3648056983947754, 1688766126.3010955], "version": 0.2, "tvm_version": "0.13.dev0"}
{"input": ["cuda -keys=cuda,gpu -arch=sm_86 -max_num_threads=1024 -thread_warp_size=32", "batch_matmul.cuda", [["TENSOR", [1, 128, 768], "float32"], ["TENSOR", [1, 768, 768], "float32"], [1, 128, 768], "float32", 0, 0], {}], "config": {"index": 335991, "code_hash": null, "entity": [["tile_y", "sp", [-1, 8, 1]], ["tile_x", "sp", [-1, 1, 2]], ["tile_k", "sp", [-1, 256]], ["auto_unroll_max_step", "ot", 64], ["unroll_explicit", "ot", 0]]}, "result": [[0.0005190830880829016, 0.0005310038393782383, 0.000544051725388601], 0, 1.3284668922424316, 1688766128.5611157], "version": 0.2, "tvm_version": "0.13.dev0"}
{"input": ["cuda -keys=cuda,gpu -arch=sm_86 -max_num_threads=1024 -thread_warp_size=32", "batch_matmul.cuda", [["TENSOR", [1, 128, 768], "float32"], ["TENSOR", [1, 768, 768], "float32"], [1, 128, 768], "float32", 0, 0], {}], "config": {"index": 130812, "code_hash": null, "entity": [["tile_y", "sp", [-1, 8, 8]], ["tile_x", "sp", [-1, 1, 128]], ["tile_k", "sp", [-1, 24]], ["auto_unroll_max_step", "ot", 16], ["unroll_explicit", "ot", 0]]}, "result": [[0.003245844677419355, 0.0032463442580645163, 0.003246469064516129], 0, 1.9249839782714844, 1688766129.4982023], "version": 0.2, "tvm_version": "0.13.dev0"}
{"input": ["cuda -keys=cuda,gpu -arch=sm_86 -max_num_threads=1024 -thread_warp_size=32", "batch_matmul.cuda", [["TENSOR", [1, 128, 768], "float32"], ["TENSOR", [1, 768, 768], "float32"], [1, 128, 768], "float32", 0, 0], {}], "config": {"index": 21892, "code_hash": null, "entity": [["tile_y", "sp", [-1, 16, 1]], ["tile_x", "sp", [-1, 4, 8]], ["tile_k", "sp", [-1, 6]], ["auto_unroll_max_step", "ot", 8], ["unroll_explicit", "ot", 0]]}, "result": [[4.935808012519562e-05, 4.936513395931142e-05, 4.936833865414711e-05], 0, 1.55312180519104, 1688766130.7969031], "version": 0.2, "tvm_version": "0.13.dev0"}
{"input": ["cuda -keys=cuda,gpu -arch=sm_86 -max_num_threads=1024 -thread_warp_size=32", "batch_matmul.cuda", [["TENSOR", [1, 128, 768], "float32"], ["TENSOR", [1, 768, 768], "float32"], [1, 128, 768], "float32", 0, 0], {}], "config": {"index": 312073, "code_hash": null, "entity": [["tile_y", "sp", [-1, 16, 8]], ["tile_x", "sp", [-1, 48, 2]], ["tile_k", "sp", [-1, 48]], ["auto_unroll_max_step", "ot", 64], ["unroll_explicit", "ot", 0]]}, "result": [[8.312313368146215e-05, 8.312366736292428e-05, 8.312741253263707e-05], 0, 1.667550802230835, 1688766132.1473677], "version": 0.2, "tvm_version": "0.13.dev0"}
{"input": ["cuda -keys=cuda,gpu -arch=sm_86 -max_num_threads=1024 -thread_warp_size=32", "batch_matmul.cuda", [["TENSOR", [1, 128, 768], "float32"], ["TENSOR", [1, 768, 768], "float32"], [1, 128, 768], "float32", 0, 0], {}], "config": {"index": 97291, "code_hash": null, "entity": [["tile_y", "sp", [-1, 16, 4]], ["tile_x", "sp", [-1, 3, 1]], ["tile_k", "sp", [-1, 3]], ["auto_unroll_max_step", "ot", 16], ["unroll_explicit", "ot", 0]]}, "result": [[0.00014286117746228926, 0.0001430492511091393, 0.0001430556149068323], 0, 1.6175312995910645, 1688766133.4726586], "version": 0.2, "tvm_version": "0.13.dev0"}
{"input": ["cuda -keys=cuda,gpu -arch=sm_86 -max_num_threads=1024 -thread_warp_size=32", "batch_matmul.cuda", [["TENSOR", [1, 128, 768], "float32"], ["TENSOR", [1, 768, 768], "float32"], [1, 128, 768], "float32", 0, 0], {}], "config": {"index": 490126, "code_hash": null, "entity": [["tile_y", "sp", [-1, 2, 8]], ["tile_x", "sp", [-1, 2, 64]], ["tile_k", "sp", [-1, 48]], ["auto_unroll_max_step", "ot", 16], ["unroll_explicit", "ot", 1]]}, "result": [[0.0022414677777777775, 0.0022416042666666665, 0.0022457685555555555], 0, 1.850203275680542, 1688766134.4638653], "version": 0.2, "tvm_version": "0.13.dev0"}
{"input": ["cuda -keys=cuda,gpu -arch=sm_86 -max_num_threads=1024 -thread_warp_size=32", "batch_matmul.cuda", [["TENSOR", [1, 128, 768], "float32"], ["TENSOR", [1, 768, 768], "float32"], [1, 128, 768], "float32", 0, 0], {}], "config": {"index": 618767, "code_hash": null, "entity": [["tile_y", "sp", [-1, 1, 128]], ["tile_x", "sp", [-1, 256, 3]], ["tile_k", "sp", [-1, 2]], ["auto_unroll_max_step", "ot", 64], ["unroll_explicit", "ot", 1]]}, "result": [[0.007521206928571429, 0.0075230352857142855, 0.007527627642857143], 0, 1.905879259109497, 1688766135.420249], "version": 0.2, "tvm_version": "0.13.dev0"}
{"input": ["cuda -keys=cuda,gpu -arch=sm_86 -max_num_threads=1024 -thread_warp_size=32", "batch_matmul.cuda", [["TENSOR", [1, 128, 768], "float32"], ["TENSOR", [1, 768, 768], "float32"], [1, 128, 768], "float32", 0, 0], {}], "config": {"index": 551821, "code_hash": null, "entity": [["tile_y", "sp", [-1, 32, 2]], ["tile_x", "sp", [-1, 24, 8]], ["tile_k", "sp", [-1, 8]], ["auto_unroll_max_step", "ot", 32], ["unroll_explicit", "ot", 1]]}, "result": [[0.00022244150760719226, 0.00022245018118948823, 0.00022245585892116183], 0, 1.6769723892211914, 1688766136.74885], "version": 0.2, "tvm_version": "0.13.dev0"}
{"input": ["cuda -keys=cuda,gpu -arch=sm_86 -max_num_threads=1024 -thread_warp_size=32", "batch_matmul.cuda", [["TENSOR", [1, 128, 768], "float32"], ["TENSOR", [1, 768, 768], "float32"], [1, 128, 768], "float32", 0, 0], {}], "config": {"index": 196626, "code_hash": null, "entity": [["tile_y", "sp", [-1, 1, 32]], ["tile_x", "sp", [-1, 16, 6]], ["tile_k", "sp", [-1, 6]], ["auto_unroll_max_step", "ot", 32], ["unroll_explicit", "ot", 0]]}, "result": [[0.0001846090391705069, 0.00018461002304147466, 0.00018461375], 0, 1.8977973461151123, 1688766138.0700035], "version": 0.2, "tvm_version": "0.13.dev0"}
{"input": ["cuda -keys=cuda,gpu -arch=sm_86 -max_num_threads=1024 -thread_warp_size=32", "batch_matmul.cuda", [["TENSOR", [1, 128, 768], "float32"], ["TENSOR", [1, 768, 768], "float32"], [1, 128, 768], "float32", 0, 0], {}], "config": {"index": 427789, "code_hash": null, "entity": [["tile_y", "sp", [-1, 2, 1]], ["tile_x", "sp", [-1, 4, 1]], ["tile_k", "sp", [-1, 384]], ["auto_unroll_max_step", "ot", 8], ["unroll_explicit", "ot", 1]]}, "result": [[0.0004732548104956269, 0.000473255166180758, 0.00047330592711370263], 0, 1.7115967273712158, 1688766139.407712], "version": 0.2, "tvm_version": "0.13.dev0"}
{"input": ["cuda -keys=cuda,gpu -arch=sm_86 -max_num_threads=1024 -thread_warp_size=32", "batch_matmul.cuda", [["TENSOR", [1, 128, 768], "float32"], ["TENSOR", [1, 768, 768], "float32"], [1, 128, 768], "float32", 0, 0], {}], "config": {"index": 641422, "code_hash": null, "entity": [["tile_y", "sp", [-1, 4, 2]], ["tile_x", "sp", [-1, 1, 384]], ["tile_k", "sp", [-1, 8]], ["auto_unroll_max_step", "ot", 64], ["unroll_explicit", "ot", 1]]}, "result": [[0.016996011000000002, 0.017269573166666666, 0.017284266], 0, 2.1908035278320312, 1688766140.3956757], "version": 0.2, "tvm_version": "0.13.dev0"}
{"input": ["cuda -keys=cuda,gpu -arch=sm_86 -max_num_threads=1024 -thread_warp_size=32", "batch_matmul.cuda", [["TENSOR", [1, 128, 768], "float32"], ["TENSOR", [1, 768, 768], "float32"], [1, 128, 768], "float32", 0, 0], {}], "config": {"index": 13206, "code_hash": null, "entity": [["tile_y", "sp", [-1, 1, 32]], ["tile_x", "sp", [-1, 4, 24]], ["tile_k", "sp", [-1, 3]], ["auto_unroll_max_step", "ot", 8], ["unroll_explicit", "ot", 0]]}, "result": [[0.004971422428571429, 0.004971900904761905, 0.00497190380952381], 0, 1.633594036102295, 1688766141.3583724], "version": 0.2, "tvm_version": "0.13.dev0"}
{"input": ["cuda -keys=cuda,gpu -arch=sm_86 -max_num_threads=1024 -thread_warp_size=32", "batch_matmul.cuda", [["TENSOR", [1, 128, 768], "float32"], ["TENSOR", [1, 768, 768], "float32"], [1, 128, 768], "float32", 0, 0], {}], "config": {"index": 307971, "code_hash": null, "entity": [["tile_y", "sp", [-1, 2, 16]], ["tile_x", "sp", [-1, 12, 4]], ["tile_k", "sp", [-1, 32]], ["auto_unroll_max_step", "ot", 64], ["unroll_explicit", "ot", 0]]}, "result": [[8.609002120717782e-05, 8.609344806960304e-05, 8.609555573681348e-05], 0, 1.7520368099212646, 1688766143.3379834], "version": 0.2, "tvm_version": "0.13.dev0"}
{"input": ["cuda -keys=cuda,gpu -arch=sm_86 -max_num_threads=1024 -thread_warp_size=32", "batch_matmul.cuda", [["TENSOR", [1, 128, 768], "float32"], ["TENSOR", [1, 768, 768], "float32"], [1, 128, 768], "float32", 0, 0], {}], "config": {"index": 197041, "code_hash": null, "entity": [["tile_y", "sp", [-1, 32, 2]], ["tile_x", "sp", [-1, 24, 8]], ["tile_k", "sp", [-1, 6]], ["auto_unroll_max_step", "ot", 32], ["unroll_explicit", "ot", 0]]}, "result": [[0.00024309388502269288, 0.00024310307261724663, 0.00024310628139183059], 0, 1.7106084823608398, 1688766144.6670687], "version": 0.2, "tvm_version": "0.13.dev0"}
{"input": ["cuda -keys=cuda,gpu -arch=sm_86 -max_num_threads=1024 -thread_warp_size=32", "batch_matmul.cuda", [["TENSOR", [1, 128, 768], "float32"], ["TENSOR", [1, 768, 768], "float32"], [1, 128, 768], "float32", 0, 0], {}], "config": {"index": 297226, "code_hash": null, "entity": [["tile_y", "sp", [-1, 4, 2]], ["tile_x", "sp", [-1, 4, 2]], ["tile_k", "sp", [-1, 16]], ["auto_unroll_max_step", "ot", 64], ["unroll_explicit", "ot", 0]]}, "result": [[9.190932870370372e-05, 9.194963020833334e-05, 9.200118171296296e-05], 0, 1.652740716934204, 1688766145.9780667], "version": 0.2, "tvm_version": "0.13.dev0"}
{"input": ["cuda -keys=cuda,gpu -arch=sm_86 -max_num_threads=1024 -thread_warp_size=32", "batch_matmul.cuda", [["TENSOR", [1, 128, 768], "float32"], ["TENSOR", [1, 768, 768], "float32"], [1, 128, 768], "float32", 0, 0], {}], "config": {"index": 312073, "code_hash": null, "entity": [["tile_y", "sp", [-1, 16, 8]], ["tile_x", "sp", [-1, 48, 2]], ["tile_k", "sp", [-1, 48]], ["auto_unroll_max_step", "ot", 64], ["unroll_explicit", "ot", 0]]}, "result": [[8.312147584033613e-05, 8.312255777310924e-05, 8.312309453781511e-05], 0, 1.712334156036377, 1688766147.2930107], "version": 0.2, "tvm_version": "0.13.dev0"}
{"input": ["cuda -keys=cuda,gpu -arch=sm_86 -max_num_threads=1024 -thread_warp_size=32", "batch_matmul.cuda", [["TENSOR", [1, 128, 768], "float32"], ["TENSOR", [1, 768, 768], "float32"], [1, 128, 768], "float32", 0, 0], {}], "config": {"index": 133365, "code_hash": null, "entity": [["tile_y", "sp", [-1, 1, 8]], ["tile_x", "sp", [-1, 4, 6]], ["tile_k", "sp", [-1, 32]], ["auto_unroll_max_step", "ot", 16], ["unroll_explicit", "ot", 0]]}, "result": [[0.00013623292091836735, 0.00013631825850340137, 0.00013632257908163264], 0, 1.8108296394348145, 1688766148.6111698], "version": 0.2, "tvm_version": "0.13.dev0"}
{"input": ["cuda -keys=cuda,gpu -arch=sm_86 -max_num_threads=1024 -thread_warp_size=32", "batch_matmul.cuda", [["TENSOR", [1, 128, 768], "float32"], ["TENSOR", [1, 768, 768], "float32"], [1, 128, 768], "float32", 0, 0], {}], "config": {"index": 23838, "code_hash": null, "entity": [["tile_y", "sp", [-1, 64, 1]], ["tile_x", "sp", [-1, 8, 96]], ["tile_k", "sp", [-1, 6]], ["auto_unroll_max_step", "ot", 8], ["unroll_explicit", "ot", 0]]}, "result": [[0.005616412222222223, 0.005616697055555556, 0.005616810666666667], 0, 1.443467140197754, 1688766149.5759904], "version": 0.2, "tvm_version": "0.13.dev0"}
{"input": ["cuda -keys=cuda,gpu -arch=sm_86 -max_num_threads=1024 -thread_warp_size=32", "batch_matmul.cuda", [["TENSOR", [1, 128, 768], "float32"], ["TENSOR", [1, 768, 768], "float32"], [1, 128, 768], "float32", 0, 0], {}], "config": {"index": 197722, "code_hash": null, "entity": [["tile_y", "sp", [-1, 4, 2]], ["tile_x", "sp", [-1, 24, 16]], ["tile_k", "sp", [-1, 6]], ["auto_unroll_max_step", "ot", 32], ["unroll_explicit", "ot", 0]]}, "result": [[0.00022546532117812064, 0.00022547101402524544, 0.00022547818373071528], 0, 1.7229406833648682, 1688766150.900651], "version": 0.2, "tvm_version": "0.13.dev0"}
{"input": ["cuda -keys=cuda,gpu -arch=sm_86 -max_num_threads=1024 -thread_warp_size=32", "batch_matmul.cuda", [["TENSOR", [1, 128, 768], "float32"], ["TENSOR", [1, 768, 768], "float32"], [1, 128, 768], "float32", 0, 0], {}], "config": {"index": 49633, "code_hash": null, "entity": [["tile_y", "sp", [-1, 16, 8]], ["tile_x", "sp", [-1, 48, 2]], ["tile_k", "sp", [-1, 48]], ["auto_unroll_max_step", "ot", 8], ["unroll_explicit", "ot", 0]]}, "result": [[8.31199227154047e-05, 8.312212950391644e-05, 8.312251227154048e-05], 0, 1.7305958271026611, 1688766152.2222114], "version": 0.2, "tvm_version": "0.13.dev0"}
{"input": ["cuda -keys=cuda,gpu -arch=sm_86 -max_num_threads=1024 -thread_warp_size=32", "batch_matmul.cuda", [["TENSOR", [1, 128, 768], "float32"], ["TENSOR", [1, 768, 768], "float32"], [1, 128, 768], "float32", 0, 0], {}], "config": {"index": 272251, "code_hash": null, "entity": [["tile_y", "sp", [-1, 16, 4]], ["tile_x", "sp", [-1, 3, 1]], ["tile_k", "sp", [-1, 3]], ["auto_unroll_max_step", "ot", 64], ["unroll_explicit", "ot", 0]]}, "result": [[0.00014305441296625222, 0.00014305625577264655, 0.00014305807193605685], 0, 1.6394705772399902, 1688766153.5390735], "version": 0.2, "tvm_version": "0.13.dev0"}
{"input": ["cuda -keys=cuda,gpu -arch=sm_86 -max_num_threads=1024 -thread_warp_size=32", "batch_matmul.cuda", [["TENSOR", [1, 128, 768], "float32"], ["TENSOR", [1, 768, 768], "float32"], [1, 128, 768], "float32", 0, 0], {}], "config": {"index": 602749, "code_hash": null, "entity": [["tile_y", "sp", [-1, 2, 1]], ["tile_x", "sp", [-1, 4, 1]], ["tile_k", "sp", [-1, 384]], ["auto_unroll_max_step", "ot", 32], ["unroll_explicit", "ot", 1]]}, "result": [[0.0004732922844574781, 0.00047329519354838716, 0.00047330723167155424], 0, 1.6294536590576172, 1688766154.867187], "version": 0.2, "tvm_version": "0.13.dev0"}
{"input": ["cuda -keys=cuda,gpu -arch=sm_86 -max_num_threads=1024 -thread_warp_size=32", "batch_matmul.cuda", [["TENSOR", [1, 128, 768], "float32"], ["TENSOR", [1, 768, 768], "float32"], [1, 128, 768], "float32", 0, 0], {}], "config": {"index": 97304, "code_hash": null, "entity": [["tile_y", "sp", [-1, 4, 32]], ["tile_x", "sp", [-1, 3, 1]], ["tile_k", "sp", [-1, 3]], ["auto_unroll_max_step", "ot", 16], ["unroll_explicit", "ot", 0]]}, "result": [[0.0002194960095759234, 0.00021950008071135432, 0.0002195142120383037], 0, 1.701648235321045, 1688766156.187717], "version": 0.2, "tvm_version": "0.13.dev0"}
{"input": ["cuda -keys=cuda,gpu -arch=sm_86 -max_num_threads=1024 -thread_warp_size=32", "batch_matmul.cuda", [["TENSOR", [1, 128, 768], "float32"], ["TENSOR", [1, 768, 768], "float32"], [1, 128, 768], "float32", 0, 0], {}], "config": {"index": 21360, "code_hash": null, "entity": [["tile_y", "sp", [-1, 16, 2]], ["tile_x", "sp", [-1, 48, 4]], ["tile_k", "sp", [-1, 6]], ["auto_unroll_max_step", "ot", 8], ["unroll_explicit", "ot", 0]]}, "result": [[0.00010546183664021164, 0.00010546252314814815, 0.00010546252314814815], 0, 1.6958141326904297, 1688766157.5247743], "version": 0.2, "tvm_version": "0.13.dev0"}
{"input": ["cuda -keys=cuda,gpu -arch=sm_86 -max_num_threads=1024 -thread_warp_size=32", "batch_matmul.cuda", [["TENSOR", [1, 128, 768], "float32"], ["TENSOR", [1, 768, 768], "float32"], [1, 128, 768], "float32", 0, 0], {}], "config": {"index": 133365, "code_hash": null, "entity": [["tile_y", "sp", [-1, 1, 8]], ["tile_x", "sp", [-1, 4, 6]], ["tile_k", "sp", [-1, 32]], ["auto_unroll_max_step", "ot", 16], ["unroll_explicit", "ot", 0]]}, "result": [[0.00013647513994910943, 0.00013662176081424935, 0.00013662626463104325], 0, 1.812469482421875, 1688766158.8548305], "version": 0.2, "tvm_version": "0.13.dev0"}
{"input": ["cuda -keys=cuda,gpu -arch=sm_86 -max_num_threads=1024 -thread_warp_size=32", "batch_matmul.cuda", [["TENSOR", [1, 128, 768], "float32"], ["TENSOR", [1, 768, 768], "float32"], [1, 128, 768], "float32", 0, 0], {}], "config": {"index": 494974, "code_hash": null, "entity": [["tile_y", "sp", [-1, 4, 2]], ["tile_x", "sp", [-1, 2, 64]], ["tile_k", "sp", [-1, 64]], ["auto_unroll_max_step", "ot", 16], ["unroll_explicit", "ot", 1]]}, "result": [[0.00024800236882716053, 0.00024800710185185183, 0.0002480133904320988], 0, 1.867532730102539, 1688766160.1712687], "version": 0.2, "tvm_version": "0.13.dev0"}
{"input": ["cuda -keys=cuda,gpu -arch=sm_86 -max_num_threads=1024 -thread_warp_size=32", "batch_matmul.cuda", [["TENSOR", [1, 128, 768], "float32"], ["TENSOR", [1, 768, 768], "float32"], [1, 128, 768], "float32", 0, 0], {}], "config": {"index": 319039, "code_hash": null, "entity": [["tile_y", "sp", [-1, 128, 1]], ["tile_x", "sp", [-1, 4, 16]], ["tile_k", "sp", [-1, 64]], ["auto_unroll_max_step", "ot", 64], ["unroll_explicit", "ot", 0]]}, "result": [[0.000302604487804878, 0.00030260640712945593, 0.00030262178048780485], 0, 1.6876091957092285, 1688766161.4952083], "version": 0.2, "tvm_version": "0.13.dev0"}
{"input": ["cuda -keys=cuda,gpu -arch=sm_86 -max_num_threads=1024 -thread_warp_size=32", "batch_matmul.cuda", [["TENSOR", [1, 128, 768], "float32"], ["TENSOR", [1, 768, 768], "float32"], [1, 128, 768], "float32", 0, 0], {}], "config": {"index": 77869, "code_hash": null, "entity": [["tile_y", "sp", [-1, 2, 1]], ["tile_x", "sp", [-1, 4, 1]], ["tile_k", "sp", [-1, 384]], ["auto_unroll_max_step", "ot", 8], ["unroll_explicit", "ot", 0]]}, "result": [[0.0004733089067055393, 0.000473326833819242, 0.00047332981632653055], 0, 1.7087433338165283, 1688766163.4919298], "version": 0.2, "tvm_version": "0.13.dev0"}
{"input": ["cuda -keys=cuda,gpu -arch=sm_86 -max_num_threads=1024 -thread_warp_size=32", "batch_matmul.cuda", [["TENSOR", [1, 128, 768], "float32"], ["TENSOR", [1, 768, 768], "float32"], [1, 128, 768], "float32", 0, 0], {}], "config": {"index": 21923, "code_hash": null, "entity": [["tile_y", "sp", [-1, 1, 128]], ["tile_x", "sp", [-1, 4, 8]], ["tile_k", "sp", [-1, 6]], ["auto_unroll_max_step", "ot", 8], ["unroll_explicit", "ot", 0]]}, "result": [[0.00621561788235294, 0.006221462470588235, 0.006225302705882353], 0, 1.551990032196045, 1688766164.4671931], "version": 0.2, "tvm_version": "0.13.dev0"}
{"input": ["cuda -keys=cuda,gpu -arch=sm_86 -max_num_threads=1024 -thread_warp_size=32", "batch_matmul.cuda", [["TENSOR", [1, 128, 768], "float32"], ["TENSOR", [1, 768, 768], "float32"], [1, 128, 768], "float32", 0, 0], {}], "config": {"index": 312052, "code_hash": null, "entity": [["tile_y", "sp", [-1, 16, 1]], ["tile_x", "sp", [-1, 48, 2]], ["tile_k", "sp", [-1, 48]], ["auto_unroll_max_step", "ot", 64], ["unroll_explicit", "ot", 0]]}, "result": [[3.678000888585099e-05, 3.67920970608339e-05, 3.6795830940988837e-05], 0, 1.6694366931915283, 1688766165.790334], "version": 0.2, "tvm_version": "0.13.dev0"}
{"input": ["cuda -keys=cuda,gpu -arch=sm_86 -max_num_threads=1024 -thread_warp_size=32", "batch_matmul.cuda", [["TENSOR", [1, 128, 768], "float32"], ["TENSOR", [1, 768, 768], "float32"], [1, 128, 768], "float32", 0, 0], {}], "config": {"index": 49633, "code_hash": null, "entity": [["tile_y", "sp", [-1, 16, 8]], ["tile_x", "sp", [-1, 48, 2]], ["tile_k", "sp", [-1, 48]], ["auto_unroll_max_step", "ot", 8], ["unroll_explicit", "ot", 0]]}, "result": [[8.351408508403361e-05, 8.351455777310924e-05, 8.351515913865546e-05], 0, 1.7538750171661377, 1688766167.1343672], "version": 0.2, "tvm_version": "0.13.dev0"}
{"input": ["cuda -keys=cuda,gpu -arch=sm_86 -max_num_threads=1024 -thread_warp_size=32", "batch_matmul.cuda", [["TENSOR", [1, 128, 768], "float32"], ["TENSOR", [1, 768, 768], "float32"], [1, 128, 768], "float32", 0, 0], {}], "config": {"index": 307971, "code_hash": null, "entity": [["tile_y", "sp", [-1, 2, 16]], ["tile_x", "sp", [-1, 12, 4]], ["tile_k", "sp", [-1, 32]], ["auto_unroll_max_step", "ot", 64], ["unroll_explicit", "ot", 0]]}, "result": [[8.646178860898136e-05, 8.646673548740417e-05, 8.646799726177436e-05], 0, 1.7989897727966309, 1688766168.467239], "version": 0.2, "tvm_version": "0.13.dev0"}
{"input": ["cuda -keys=cuda,gpu -arch=sm_86 -max_num_threads=1024 -thread_warp_size=32", "batch_matmul.cuda", [["TENSOR", [1, 128, 768], "float32"], ["TENSOR", [1, 768, 768], "float32"], [1, 128, 768], "float32", 0, 0], {}], "config": {"index": 107218, "code_hash": null, "entity": [["tile_y", "sp", [-1, 4, 2]], ["tile_x", "sp", [-1, 24, 1]], ["tile_k", "sp", [-1, 6]], ["auto_unroll_max_step", "ot", 16], ["unroll_explicit", "ot", 0]]}, "result": [[6.390225149461937e-05, 6.420630809087286e-05, 6.436303148664808e-05], 0, 1.670844316482544, 1688766169.794984], "version": 0.2, "tvm_version": "0.13.dev0"}
{"input": ["cuda -keys=cuda,gpu -arch=sm_86 -max_num_threads=1024 -thread_warp_size=32", "batch_matmul.cuda", [["TENSOR", [1, 128, 768], "float32"], ["TENSOR", [1, 768, 768], "float32"], [1, 128, 768], "float32", 0, 0], {}], "config": {"index": 100207, "code_hash": null, "entity": [["tile_y", "sp", [-1, 16, 4]], ["tile_x", "sp", [-1, 64, 12]], ["tile_k", "sp", [-1, 3]], ["auto_unroll_max_step", "ot", 16], ["unroll_explicit", "ot", 0]]}, "result": [[0.0010417919895833333, 0.0010418026354166666, 0.0010418240208333333], 0, 1.377570390701294, 1688766170.7745247], "version": 0.2, "tvm_version": "0.13.dev0"}
{"input": ["cuda -keys=cuda,gpu -arch=sm_86 -max_num_threads=1024 -thread_warp_size=32", "batch_matmul.cuda", [["TENSOR", [1, 128, 768], "float32"], ["TENSOR", [1, 768, 768], "float32"], [1, 128, 768], "float32", 0, 0], {}], "config": {"index": 65638, "code_hash": null, "entity": [["tile_y", "sp", [-1, 4, 2]], ["tile_x", "sp", [-1, 4, 8]], ["tile_k", "sp", [-1, 128]], ["auto_unroll_max_step", "ot", 8], ["unroll_explicit", "ot", 0]]}, "result": [[9.834504301075268e-05, 9.838007233626589e-05, 9.844213685239491e-05], 0, 1.336583137512207, 1688766171.6991718], "version": 0.2, "tvm_version": "0.13.dev0"}
{"input": ["cuda -keys=cuda,gpu -arch=sm_86 -max_num_threads=1024 -thread_warp_size=32", "batch_matmul.cuda", [["TENSOR", [1, 128, 768], "float32"], ["TENSOR", [1, 768, 768], "float32"], [1, 128, 768], "float32", 0, 0], {}], "config": {"index": 9811, "code_hash": null, "entity": [["tile_y", "sp", [-1, 16, 4]], ["tile_x", "sp", [-1, 3, 1]], ["tile_k", "sp", [-1, 3]], ["auto_unroll_max_step", "ot", 8], ["unroll_explicit", "ot", 0]]}, "result": [[0.00014291149063336305, 0.0001430331248884924, 0.00014377001159678857], 0, 1.667424201965332, 1688766173.0179713], "version": 0.2, "tvm_version": "0.13.dev0"}
{"input": ["cuda -keys=cuda,gpu -arch=sm_86 -max_num_threads=1024 -thread_warp_size=32", "batch_matmul.cuda", [["TENSOR", [1, 128, 768], "float32"], ["TENSOR", [1, 768, 768], "float32"], [1, 128, 768], "float32", 0, 0], {}], "config": {"index": 23342, "code_hash": null, "entity": [["tile_y", "sp", [-1, 64, 2]], ["tile_x", "sp", [-1, 1, 48]], ["tile_k", "sp", [-1, 6]], ["auto_unroll_max_step", "ot", 8], ["unroll_explicit", "ot", 0]]}, "result": [[0.00020026713466334163, 0.00020027116832917706, 0.00020027244264339154], 0, 1.8371858596801758, 1688766174.3431365], "version": 0.2, "tvm_version": "0.13.dev0"}
{"input": ["cuda -keys=cuda,gpu -arch=sm_86 -max_num_threads=1024 -thread_warp_size=32", "batch_matmul.cuda", [["TENSOR", [1, 128, 768], "float32"], ["TENSOR", [1, 768, 768], "float32"], [1, 128, 768], "float32", 0, 0], {}], "config": {"index": 336106, "code_hash": null, "entity": [["tile_y", "sp", [-1, 4, 2]], ["tile_x", "sp", [-1, 4, 2]], ["tile_k", "sp", [-1, 256]], ["auto_unroll_max_step", "ot", 64], ["unroll_explicit", "ot", 0]]}, "result": [[0.00016804236935991603, 0.0001680562350472193, 0.00016827661490031477], 0, 1.7838237285614014, 1688766175.6610668], "version": 0.2, "tvm_version": "0.13.dev0"}
{"input": ["cuda -keys=cuda,gpu -arch=sm_86 -max_num_threads=1024 -thread_warp_size=32", "batch_matmul.cuda", [["TENSOR", [1, 128, 768], "float32"], ["TENSOR", [1, 768, 768], "float32"], [1, 128, 768], "float32", 0, 0], {}], "config": {"index": 24999, "code_hash": null, "entity": [["tile_y", "sp", [-1, 1, 4]], ["tile_x", "sp", [-1, 2, 2]], ["tile_k", "sp", [-1, 8]], ["auto_unroll_max_step", "ot", 8], ["unroll_explicit", "ot", 0]]}, "result": [[0.0005510357857142857, 0.0005520147802197803, 0.0005547094615384615], 0, 1.2956326007843018, 1688766176.5840466], "version": 0.2, "tvm_version": "0.13.dev0"}
{"input": ["cuda -keys=cuda,gpu -arch=sm_86 -max_num_threads=1024 -thread_warp_size=32", "batch_matmul.cuda", [["TENSOR", [1, 128, 768], "float32"], ["TENSOR", [1, 768, 768], "float32"], [1, 128, 768], "float32", 0, 0], {}], "config": {"index": 209765, "code_hash": null, "entity": [["tile_y", "sp", [-1, 8, 16]], ["tile_x", "sp", [-1, 4, 2]], ["tile_k", "sp", [-1, 16]], ["auto_unroll_max_step", "ot", 32], ["unroll_explicit", "ot", 0]]}, "result": [[7.931106746626687e-05, 7.931163918040979e-05, 7.931266116941528e-05], 0, 1.7238655090332031, 1688766177.9074628], "version": 0.2, "tvm_version": "0.13.dev0"}
{"input": ["cuda -keys=cuda,gpu -arch=sm_86 -max_num_threads=1024 -thread_warp_size=32", "batch_matmul.cuda", [["TENSOR", [1, 128, 768], "float32"], ["TENSOR", [1, 768, 768], "float32"], [1, 128, 768], "float32", 0, 0], {}], "config": {"index": 312073, "code_hash": null, "entity": [["tile_y", "sp", [-1, 16, 8]], ["tile_x", "sp", [-1, 48, 2]], ["tile_k", "sp", [-1, 48]], ["auto_unroll_max_step", "ot", 64], ["unroll_explicit", "ot", 0]]}, "result": [[8.337209978991596e-05, 8.33737106092437e-05, 8.337532930672269e-05], 0, 1.7071282863616943, 1688766179.2128096], "version": 0.2, "tvm_version": "0.13.dev0"}
{"input": ["cuda -keys=cuda,gpu -arch=sm_86 -max_num_threads=1024 -thread_warp_size=32", "batch_matmul.cuda", [["TENSOR", [1, 128, 768], "float32"], ["TENSOR", [1, 768, 768], "float32"], [1, 128, 768], "float32", 0, 0], {}], "config": {"index": 312073, "code_hash": null, "entity": [["tile_y", "sp", [-1, 16, 8]], ["tile_x", "sp", [-1, 48, 2]], ["tile_k", "sp", [-1, 48]], ["auto_unroll_max_step", "ot", 64], ["unroll_explicit", "ot", 0]]}, "result": [[8.337532930672269e-05, 8.337694012605042e-05, 8.337694012605042e-05], 0, 1.7096350193023682, 1688766180.5251803], "version": 0.2, "tvm_version": "0.13.dev0"}
{"input": ["cuda -keys=cuda,gpu -arch=sm_86 -max_num_threads=1024 -thread_warp_size=32", "batch_matmul.cuda", [["TENSOR", [1, 128, 768], "float32"], ["TENSOR", [1, 768, 768], "float32"], [1, 128, 768], "float32", 0, 0], {}], "config": {"index": 546929, "code_hash": null, "entity": [["tile_y", "sp", [-1, 4, 4]], ["tile_x", "sp", [-1, 16, 8]], ["tile_k", "sp", [-1, 6]], ["auto_unroll_max_step", "ot", 32], ["unroll_explicit", "ot", 1]]}, "result": [[8.411897147385103e-05, 8.412054305335446e-05, 8.412108293713682e-05], 0, 1.7606658935546875, 1688766181.8468227], "version": 0.2, "tvm_version": "0.13.dev0"}
{"input": ["cuda -keys=cuda,gpu -arch=sm_86 -max_num_threads=1024 -thread_warp_size=32", "batch_matmul.cuda", [["TENSOR", [1, 128, 768], "float32"], ["TENSOR", [1, 768, 768], "float32"], [1, 128, 768], "float32", 0, 0], {}], "config": {"index": 279580, "code_hash": null, "entity": [["tile_y", "sp", [-1, 16, 1]], ["tile_x", "sp", [-1, 12, 8]], ["tile_k", "sp", [-1, 4]], ["auto_unroll_max_step", "ot", 64], ["unroll_explicit", "ot", 0]]}, "result": [[9.068466857469948e-05, 9.068525414997139e-05, 9.068876531196338e-05], 0, 1.615260124206543, 1688766183.8255246], "version": 0.2, "tvm_version": "0.13.dev0"}
{"input": ["cuda -keys=cuda,gpu -arch=sm_86 -max_num_threads=1024 -thread_warp_size=32", "batch_matmul.cuda", [["TENSOR", [1, 128, 768], "float32"], ["TENSOR", [1, 768, 768], "float32"], [1, 128, 768], "float32", 0, 0], {}], "config": {"index": 507207, "code_hash": null, "entity": [["tile_y", "sp", [-1, 8, 1]], ["tile_x", "sp", [-1, 12, 4]], ["tile_k", "sp", [-1, 192]], ["auto_unroll_max_step", "ot", 16], ["unroll_explicit", "ot", 1]]}, "result": [[5.7207514048991345e-05, 5.7207871397694524e-05, 5.724809077809798e-05], 0, 1.7031002044677734, 1688766185.1302545], "version": 0.2, "tvm_version": "0.13.dev0"}
{"input": ["cuda -keys=cuda,gpu -arch=sm_86 -max_num_threads=1024 -thread_warp_size=32", "batch_matmul.cuda", [["TENSOR", [1, 128, 768], "float32"], ["TENSOR", [1, 768, 768], "float32"], [1, 128, 768], "float32", 0, 0], {}], "config": {"index": 551812, "code_hash": null, "entity": [["tile_y", "sp", [-1, 16, 1]], ["tile_x", "sp", [-1, 24, 8]], ["tile_k", "sp", [-1, 8]], ["auto_unroll_max_step", "ot", 32], ["unroll_explicit", "ot", 1]]}, "result": [[0.0001244311290824261, 0.00012443430870917574, 0.00012443511586314153], 0, 1.7079455852508545, 1688766186.4638965], "version": 0.2, "tvm_version": "0.13.dev0"}
{"input": ["cuda -keys=cuda,gpu -arch=sm_86 -max_num_threads=1024 -thread_warp_size=32", "batch_matmul.cuda", [["TENSOR", [1, 128, 768], "float32"], ["TENSOR", [1, 768, 768], "float32"], [1, 128, 768], "float32", 0, 0], {}], "config": {"index": 507207, "code_hash": null, "entity": [["tile_y", "sp", [-1, 8, 1]], ["tile_x", "sp", [-1, 12, 4]], ["tile_k", "sp", [-1, 192]], ["auto_unroll_max_step", "ot", 16], ["unroll_explicit", "ot", 1]]}, "result": [[5.721489048991355e-05, 5.7233705691642647e-05, 5.729673631123918e-05], 0, 1.6436855792999268, 1688766187.7793295], "version": 0.2, "tvm_version": "0.13.dev0"}
{"input": ["cuda -keys=cuda,gpu -arch=sm_86 -max_num_threads=1024 -thread_warp_size=32", "batch_matmul.cuda", [["TENSOR", [1, 128, 768], "float32"], ["TENSOR", [1, 768, 768], "float32"], [1, 128, 768], "float32", 0, 0], {}], "config": {"index": 635691, "code_hash": null, "entity": [["tile_y", "sp", [-1, 8, 1]], ["tile_x", "sp", [-1, 1, 48]], ["tile_k", "sp", [-1, 6]], ["auto_unroll_max_step", "ot", 64], ["unroll_explicit", "ot", 1]]}, "result": [[0.00014708875114364134, 0.0001471203714547118, 0.000147125285452882], 0, 1.8780794143676758, 1688766189.166861], "version": 0.2, "tvm_version": "0.13.dev0"}
{"input": ["cuda -keys=cuda,gpu -arch=sm_86 -max_num_threads=1024 -thread_warp_size=32", "batch_matmul.cuda", [["TENSOR", [1, 128, 768], "float32"], ["TENSOR", [1, 768, 768], "float32"], [1, 128, 768], "float32", 0, 0], {}], "config": {"index": 1357, "code_hash": null, "entity": [["tile_y", "sp", [-1, 16, 8]], ["tile_x", "sp", [-1, 8, 3]], ["tile_k", "sp", [-1, 1]], ["auto_unroll_max_step", "ot", 8], ["unroll_explicit", "ot", 0]]}, "result": [[0.00021657876819407008, 0.00021658427897574124, 0.00021658427897574124], 0, 1.6800122261047363, 1688766190.4922278], "version": 0.2, "tvm_version": "0.13.dev0"}
{"input": ["cuda -keys=cuda,gpu -arch=sm_86 -max_num_threads=1024 -thread_warp_size=32", "batch_matmul.cuda", [["TENSOR", [1, 128, 768], "float32"], ["TENSOR", [1, 768, 768], "float32"], [1, 128, 768], "float32", 0, 0], {}], "config": {"index": 138000, "code_hash": null, "entity": [["tile_y", "sp", [-1, 16, 2]], ["tile_x", "sp", [-1, 48, 4]], ["tile_k", "sp", [-1, 48]], ["auto_unroll_max_step", "ot", 16], ["unroll_explicit", "ot", 0]]}, "result": [[6.980868428005283e-05, 6.981103610744166e-05, 6.98150673712021e-05], 0, 1.6563687324523926, 1688766191.7992468], "version": 0.2, "tvm_version": "0.13.dev0"}
{"input": ["cuda -keys=cuda,gpu -arch=sm_86 -max_num_threads=1024 -thread_warp_size=32", "batch_matmul.cuda", [["TENSOR", [1, 128, 768], "float32"], ["TENSOR", [1, 768, 768], "float32"], [1, 128, 768], "float32", 0, 0], {}], "config": {"index": 69807, "code_hash": null, "entity": [["tile_y", "sp", [-1, 8, 1]], ["tile_x", "sp", [-1, 12, 4]], ["tile_k", "sp", [-1, 192]], ["auto_unroll_max_step", "ot", 8], ["unroll_explicit", "ot", 0]]}, "result": [[5.740898990263254e-05, 5.743594734944104e-05, 5.744776703930761e-05], 0, 1.6513936519622803, 1688766193.1055207], "version": 0.2, "tvm_version": "0.13.dev0"}
{"input": ["cuda -keys=cuda,gpu -arch=sm_86 -max_num_threads=1024 -thread_warp_size=32", "batch_matmul.cuda", [["TENSOR", [1, 128, 768], "float32"], ["TENSOR", [1, 768, 768], "float32"], [1, 128, 768], "float32", 0, 0], {}], "config": {"index": 280839, "code_hash": null, "entity": [["tile_y", "sp", [-1, 8, 1]], ["tile_x", "sp", [-1, 12, 32]], ["tile_k", "sp", [-1, 4]], ["auto_unroll_max_step", "ot", 64], ["unroll_explicit", "ot", 0]]}, "result": [[0.0005752055287356323, 0.0005752290747126438, 0.0005752584942528736], 0, 1.3274734020233154, 1688766194.0623987], "version": 0.2, "tvm_version": "0.13.dev0"}
{"input": ["cuda -keys=cuda,gpu -arch=sm_86 -max_num_threads=1024 -thread_warp_size=32", "batch_matmul.cuda", [["TENSOR", [1, 128, 768], "float32"], ["TENSOR", [1, 768, 768], "float32"], [1, 128, 768], "float32", 0, 0], {}], "config": {"index": 311809, "code_hash": null, "entity": [["tile_y", "sp", [-1, 32, 2]], ["tile_x", "sp", [-1, 4, 2]], ["tile_k", "sp", [-1, 48]], ["auto_unroll_max_step", "ot", 64], ["unroll_explicit", "ot", 0]]}, "result": [[0.00011832543745373796, 0.00011832543745373796, 0.00011832846410066616], 0, 1.6529016494750977, 1688766195.3609297], "version": 0.2, "tvm_version": "0.13.dev0"}
{"input": ["cuda -keys=cuda,gpu -arch=sm_86 -max_num_threads=1024 -thread_warp_size=32", "batch_matmul.cuda", [["TENSOR", [1, 128, 768], "float32"], ["TENSOR", [1, 768, 768], "float32"], [1, 128, 768], "float32", 0, 0], {}], "config": {"index": 212583, "code_hash": null, "entity": [["tile_y", "sp", [-1, 8, 1]], ["tile_x", "sp", [-1, 1, 32]], ["tile_k", "sp", [-1, 16]], ["auto_unroll_max_step", "ot", 32], ["unroll_explicit", "ot", 0]]}, "result": [[0.00014543201352569882, 0.0001460903561767358, 0.00014613467448151488], 0, 1.7581946849822998, 1688766196.6953144], "version": 0.2, "tvm_version": "0.13.dev0"}
{"input": ["cuda -keys=cuda,gpu -arch=sm_86 -max_num_threads=1024 -thread_warp_size=32", "batch_matmul.cuda", [["TENSOR", [1, 128, 768], "float32"], ["TENSOR", [1, 768, 768], "float32"], [1, 128, 768], "float32", 0, 0], {}], "config": {"index": 505738, "code_hash": null, "entity": [["tile_y", "sp", [-1, 4, 2]], ["tile_x", "sp", [-1, 24, 1]], ["tile_k", "sp", [-1, 192]], ["auto_unroll_max_step", "ot", 16], ["unroll_explicit", "ot", 1]]}, "result": [[5.329140847847519e-05, 5.329544988498193e-05, 5.332976339139007e-05], 0, 1.753241777420044, 1688766198.0271666], "version": 0.2, "tvm_version": "0.13.dev0"}
{"input": ["cuda -keys=cuda,gpu -arch=sm_86 -max_num_threads=1024 -thread_warp_size=32", "batch_matmul.cuda", [["TENSOR", [1, 128, 768], "float32"], ["TENSOR", [1, 768, 768], "float32"], [1, 128, 768], "float32", 0, 0], {}], "config": {"index": 293791, "code_hash": null, "entity": [["tile_y", "sp", [-1, 2, 32]], ["tile_x", "sp", [-1, 8, 6]], ["tile_k", "sp", [-1, 12]], ["auto_unroll_max_step", "ot", 64], ["unroll_explicit", "ot", 0]]}, "result": [[0.0001948007478787879, 0.00019480576000000002, 0.00019481580242424243], 0, 1.8199951648712158, 1688766199.371806], "version": 0.2, "tvm_version": "0.13.dev0"}
{"input": ["cuda -keys=cuda,gpu -arch=sm_86 -max_num_threads=1024 -thread_warp_size=32", "batch_matmul.cuda", [["TENSOR", [1, 128, 768], "float32"], ["TENSOR", [1, 768, 768], "float32"], [1, 128, 768], "float32", 0, 0], {}], "config": {"index": 313225, "code_hash": null, "entity": [["tile_y", "sp", [-1, 16, 8]], ["tile_x", "sp", [-1, 8, 6]], ["tile_k", "sp", [-1, 48]], ["auto_unroll_max_step", "ot", 64], ["unroll_explicit", "ot", 0]]}, "result": [[5.47385019318581e-05, 5.473912890762206e-05, 5.473957920618195e-05], 0, 1.847764492034912, 1688766200.6679053], "version": 0.2, "tvm_version": "0.13.dev0"}
{"input": ["cuda -keys=cuda,gpu -arch=sm_86 -max_num_threads=1024 -thread_warp_size=32", "batch_matmul.cuda", [["TENSOR", [1, 128, 768], "float32"], ["TENSOR", [1, 768, 768], "float32"], [1, 128, 768], "float32", 0, 0], {}], "config": {"index": 141238, "code_hash": null, "entity": [["tile_y", "sp", [-1, 4, 2]], ["tile_x", "sp", [-1, 24, 1]], ["tile_k", "sp", [-1, 64]], ["auto_unroll_max_step", "ot", 16], ["unroll_explicit", "ot", 0]]}, "result": [[5.0828512844611527e-05, 5.087502537593985e-05, 5.0904218984962405e-05], 0, 1.6515476703643799, 1688766202.608021], "version": 0.2, "tvm_version": "0.13.dev0"}
{"input": ["cuda -keys=cuda,gpu -arch=sm_86 -max_num_threads=1024 -thread_warp_size=32", "batch_matmul.cuda", [["TENSOR", [1, 128, 768], "float32"], ["TENSOR", [1, 768, 768], "float32"], [1, 128, 768], "float32", 0, 0], {}], "config": {"index": 578638, "code_hash": null, "entity": [["tile_y", "sp", [-1, 4, 2]], ["tile_x", "sp", [-1, 24, 1]], ["tile_k", "sp", [-1, 64]], ["auto_unroll_max_step", "ot", 32], ["unroll_explicit", "ot", 1]]}, "result": [[5.0769160401002506e-05, 5.077172744360902e-05, 5.098471961152882e-05], 0, 1.6992418766021729, 1688766203.945362], "version": 0.2, "tvm_version": "0.13.dev0"}
{"input": ["cuda -keys=cuda,gpu -arch=sm_86 -max_num_threads=1024 -thread_warp_size=32", "batch_matmul.cuda", [["TENSOR", [1, 128, 768], "float32"], ["TENSOR", [1, 768, 768], "float32"], [1, 128, 768], "float32", 0, 0], {}], "config": {"index": 307971, "code_hash": null, "entity": [["tile_y", "sp", [-1, 2, 16]], ["tile_x", "sp", [-1, 12, 4]], ["tile_k", "sp", [-1, 32]], ["auto_unroll_max_step", "ot", 64], ["unroll_explicit", "ot", 0]]}, "result": [[8.648398531011969e-05, 8.648621817192601e-05, 8.648677475516867e-05], 0, 1.7827260494232178, 1688766205.2577584], "version": 0.2, "tvm_version": "0.13.dev0"}
{"input": ["cuda -keys=cuda,gpu -arch=sm_86 -max_num_threads=1024 -thread_warp_size=32", "batch_matmul.cuda", [["TENSOR", [1, 128, 768], "float32"], ["TENSOR", [1, 768, 768], "float32"], [1, 128, 768], "float32", 0, 0], {}], "config": {"index": 197041, "code_hash": null, "entity": [["tile_y", "sp", [-1, 32, 2]], ["tile_x", "sp", [-1, 24, 8]], ["tile_k", "sp", [-1, 6]], ["auto_unroll_max_step", "ot", 32], ["unroll_explicit", "ot", 0]]}, "result": [[0.00024405106534954407, 0.0002440528054711246, 0.00024405593617021277], 0, 1.7103593349456787, 1688766206.5896263], "version": 0.2, "tvm_version": "0.13.dev0"}
{"input": ["cuda -keys=cuda,gpu -arch=sm_86 -max_num_threads=1024 -thread_warp_size=32", "batch_matmul.cuda", [["TENSOR", [1, 128, 768], "float32"], ["TENSOR", [1, 768, 768], "float32"], [1, 128, 768], "float32", 0, 0], {}], "config": {"index": 297226, "code_hash": null, "entity": [["tile_y", "sp", [-1, 4, 2]], ["tile_x", "sp", [-1, 4, 2]], ["tile_k", "sp", [-1, 16]], ["auto_unroll_max_step", "ot", 64], ["unroll_explicit", "ot", 0]]}, "result": [[9.195594474637682e-05, 9.224347735507247e-05, 9.228706974637681e-05], 0, 1.178497076034546, 1688766207.5181406], "version": 0.2, "tvm_version": "0.13.dev0"}
{"input": ["cuda -keys=cuda,gpu -arch=sm_86 -max_num_threads=1024 -thread_warp_size=32", "batch_matmul.cuda", [["TENSOR", [1, 128, 768], "float32"], ["TENSOR", [1, 768, 768], "float32"], [1, 128, 768], "float32", 0, 0], {}], "config": {"index": 312073, "code_hash": null, "entity": [["tile_y", "sp", [-1, 16, 8]], ["tile_x", "sp", [-1, 48, 2]], ["tile_k", "sp", [-1, 48]], ["auto_unroll_max_step", "ot", 64], ["unroll_explicit", "ot", 0]]}, "result": [[8.351832854864434e-05, 8.351942371079213e-05, 8.352423444976076e-05], 0, 1.7114055156707764, 1688766208.8208692], "version": 0.2, "tvm_version": "0.13.dev0"}
{"input": ["cuda -keys=cuda,gpu -arch=sm_86 -max_num_threads=1024 -thread_warp_size=32", "batch_matmul.cuda", [["TENSOR", [1, 128, 768], "float32"], ["TENSOR", [1, 768, 768], "float32"], [1, 128, 768], "float32", 0, 0], {}], "config": {"index": 133365, "code_hash": null, "entity": [["tile_y", "sp", [-1, 1, 8]], ["tile_x", "sp", [-1, 4, 6]], ["tile_k", "sp", [-1, 32]], ["auto_unroll_max_step", "ot", 16], ["unroll_explicit", "ot", 0]]}, "result": [[0.00013633716225448336, 0.0001365111853116994, 0.00013695628351836038], 0, 1.7928235530853271, 1688766210.1266444], "version": 0.2, "tvm_version": "0.13.dev0"}
{"input": ["cuda -keys=cuda,gpu -arch=sm_86 -max_num_threads=1024 -thread_warp_size=32", "batch_matmul.cuda", [["TENSOR", [1, 128, 768], "float32"], ["TENSOR", [1, 768, 768], "float32"], [1, 128, 768], "float32", 0, 0], {}], "config": {"index": 23838, "code_hash": null, "entity": [["tile_y", "sp", [-1, 64, 1]], ["tile_x", "sp", [-1, 8, 96]], ["tile_k", "sp", [-1, 6]], ["auto_unroll_max_step", "ot", 8], ["unroll_explicit", "ot", 0]]}, "result": [[0.005639281777777777, 0.005639281777777777, 0.005639566166666667], 0, 1.434985876083374, 1688766211.1018922], "version": 0.2, "tvm_version": "0.13.dev0"}
{"input": ["cuda -keys=cuda,gpu -arch=sm_86 -max_num_threads=1024 -thread_warp_size=32", "batch_matmul.cuda", [["TENSOR", [1, 128, 768], "float32"], ["TENSOR", [1, 768, 768], "float32"], [1, 128, 768], "float32", 0, 0], {}], "config": {"index": 197722, "code_hash": null, "entity": [["tile_y", "sp", [-1, 4, 2]], ["tile_x", "sp", [-1, 24, 16]], ["tile_k", "sp", [-1, 6]], ["auto_unroll_max_step", "ot", 32], ["unroll_explicit", "ot", 0]]}, "result": [[0.00022593386357243323, 0.00022593961462728552, 0.00022594502250351613], 0, 1.7049858570098877, 1688766212.4263268], "version": 0.2, "tvm_version": "0.13.dev0"}
{"input": ["cuda -keys=cuda,gpu -arch=sm_86 -max_num_threads=1024 -thread_warp_size=32", "batch_matmul.cuda", [["TENSOR", [1, 128, 768], "float32"], ["TENSOR", [1, 768, 768], "float32"], [1, 128, 768], "float32", 0, 0], {}], "config": {"index": 49633, "code_hash": null, "entity": [["tile_y", "sp", [-1, 16, 8]], ["tile_x", "sp", [-1, 48, 2]], ["tile_k", "sp", [-1, 48]], ["auto_unroll_max_step", "ot", 8], ["unroll_explicit", "ot", 0]]}, "result": [[8.337479254201681e-05, 8.337747741596639e-05, 8.337963287815126e-05], 0, 1.7206034660339355, 1688766213.7392027], "version": 0.2, "tvm_version": "0.13.dev0"}
{"input": ["cuda -keys=cuda,gpu -arch=sm_86 -max_num_threads=1024 -thread_warp_size=32", "batch_matmul.cuda", [["TENSOR", [1, 128, 768], "float32"], ["TENSOR", [1, 768, 768], "float32"], [1, 128, 768], "float32", 0, 0], {}], "config": {"index": 272251, "code_hash": null, "entity": [["tile_y", "sp", [-1, 16, 4]], ["tile_x", "sp", [-1, 3, 1]], ["tile_k", "sp", [-1, 3]], ["auto_unroll_max_step", "ot", 64], ["unroll_explicit", "ot", 0]]}, "result": [[0.0001427963889384478, 0.00014371168510258697, 0.00014377014808206957], 0, 1.6350891590118408, 1688766215.0591078], "version": 0.2, "tvm_version": "0.13.dev0"}
{"input": ["cuda -keys=cuda,gpu -arch=sm_86 -max_num_threads=1024 -thread_warp_size=32", "batch_matmul.cuda", [["TENSOR", [1, 128, 768], "float32"], ["TENSOR", [1, 768, 768], "float32"], [1, 128, 768], "float32", 0, 0], {}], "config": {"index": 602749, "code_hash": null, "entity": [["tile_y", "sp", [-1, 2, 1]], ["tile_x", "sp", [-1, 4, 1]], ["tile_k", "sp", [-1, 384]], ["auto_unroll_max_step", "ot", 32], ["unroll_explicit", "ot", 1]]}, "result": [[0.0004761359677419355, 0.0004761389677419355, 0.00047615650733137834], 0, 1.7087969779968262, 1688766216.3919842], "version": 0.2, "tvm_version": "0.13.dev0"}
{"input": ["cuda -keys=cuda,gpu -arch=sm_86 -max_num_threads=1024 -thread_warp_size=32", "batch_matmul.cuda", [["TENSOR", [1, 128, 768], "float32"], ["TENSOR", [1, 768, 768], "float32"], [1, 128, 768], "float32", 0, 0], {}], "config": {"index": 97304, "code_hash": null, "entity": [["tile_y", "sp", [-1, 4, 32]], ["tile_x", "sp", [-1, 3, 1]], ["tile_k", "sp", [-1, 3]], ["auto_unroll_max_step", "ot", 16], ["unroll_explicit", "ot", 0]]}, "result": [[0.000219505704359673, 0.00021951686784741145, 0.0002195531226158038], 0, 1.7029492855072021, 1688766217.7134135], "version": 0.2, "tvm_version": "0.13.dev0"}
{"input": ["cuda -keys=cuda,gpu -arch=sm_86 -max_num_threads=1024 -thread_warp_size=32", "batch_matmul.cuda", [["TENSOR", [1, 128, 768], "float32"], ["TENSOR", [1, 768, 768], "float32"], [1, 128, 768], "float32", 0, 0], {}], "config": {"index": 21360, "code_hash": null, "entity": [["tile_y", "sp", [-1, 16, 2]], ["tile_x", "sp", [-1, 48, 4]], ["tile_k", "sp", [-1, 6]], ["auto_unroll_max_step", "ot", 8], ["unroll_explicit", "ot", 0]]}, "result": [[0.0001059325277777778, 0.00010593466732804233, 0.00010594400264550263], 0, 1.6420283317565918, 1688766219.02417], "version": 0.2, "tvm_version": "0.13.dev0"}
