src/tvm/results/cuda_gtx1650/inception_v3/ga/cpu.log_layer_41.log
{"input": ["cuda -keys=cuda,gpu -arch=sm_75 -max_num_threads=1024 -thread_warp_size=32", "conv2d_nchw.cuda", [["TENSOR", [1, 384, 8, 8], "float32"], ["TENSOR", [384, 384, 3, 1], "float32"], [1, 1], [1, 0, 1, 0], [1, 1], "float32"], {}], "config": {"index": 11070336, "code_hash": null, "entity": [["tile_f", "sp", [-1, 1, 64, 1]], ["tile_y", "sp", [-1, 8, 1, 1]], ["tile_x", "sp", [-1, 1, 2, 2]], ["tile_rc", "sp", [-1, 32]], ["tile_ry", "sp", [-1, 3]], ["tile_rx", "sp", [-1, 1]], ["auto_unroll_max_step", "ot", 512], ["unroll_explicit", "ot", 0]]}, "result": [[0.00018850266109422491, 0.000188614273556231, 0.00020304237386018233], 0, 1.722703456878662, 1678859799.0196319], "version": 0.2, "tvm_version": "0.10.0"}
{"input": ["cuda -keys=cuda,gpu -arch=sm_75 -max_num_threads=1024 -thread_warp_size=32", "conv2d_nchw.cuda", [["TENSOR", [1, 384, 8, 8], "float32"], ["TENSOR", [384, 384, 3, 1], "float32"], [1, 1], [1, 0, 1, 0], [1, 1], "float32"], {}], "config": {"index": 580228, "code_hash": null, "entity": [["tile_f", "sp", [-1, 4, 1, 16]], ["tile_y", "sp", [-1, 2, 4, 1]], ["tile_x", "sp", [-1, 1, 1, 1]], ["tile_rc", "sp", [-1, 4]], ["tile_ry", "sp", [-1, 1]], ["tile_rx", "sp", [-1, 1]], ["auto_unroll_max_step", "ot", 0], ["unroll_explicit", "ot", 0]]}, "result": [[0.0005508312714776632, 0.0005508540274914089, 0.0005508697594501719], 0, 2.0247983932495117, 1678859800.3088453], "version": 0.2, "tvm_version": "0.10.0"}
{"input": ["cuda -keys=cuda,gpu -arch=sm_75 -max_num_threads=1024 -thread_warp_size=32", "conv2d_nchw.cuda", [["TENSOR", [1, 384, 8, 8], "float32"], ["TENSOR", [384, 384, 3, 1], "float32"], [1, 1], [1, 0, 1, 0], [1, 1], "float32"], {}], "config": {"index": 19222081, "code_hash": null, "entity": [["tile_f", "sp", [-1, 2, 1, 1]], ["tile_y", "sp", [-1, 4, 2, 1]], ["tile_x", "sp", [-1, 4, 1, 1]], ["tile_rc", "sp", [-1, 6]], ["tile_ry", "sp", [-1, 1]], ["tile_rx", "sp", [-1, 1]], ["auto_unroll_max_step", "ot", 0], ["unroll_explicit", "ot", 1]]}, "result": [[0.0013619657972972973, 0.0013621072432432432, 0.0013621348783783784], 0, 1.5223782062530518, 1678859801.201819], "version": 0.2, "tvm_version": "0.10.0"}
{"input": ["cuda -keys=cuda,gpu -arch=sm_75 -max_num_threads=1024 -thread_warp_size=32", "conv2d_nchw.cuda", [["TENSOR", [1, 384, 8, 8], "float32"], ["TENSOR", [384, 384, 3, 1], "float32"], [1, 1], [1, 0, 1, 0], [1, 1], "float32"], {}], "config": {"index": 28173446, "code_hash": null, "entity": [["tile_f", "sp", [-1, 16, 1, 8]], ["tile_y", "sp", [-1, 2, 2, 2]], ["tile_x", "sp", [-1, 2, 2, 2]], ["tile_rc", "sp", [-1, 3]], ["tile_ry", "sp", [-1, 3]], ["tile_rx", "sp", [-1, 1]], ["auto_unroll_max_step", "ot", 512], ["unroll_explicit", "ot", 1]]}, "result": [[0.01685943466666667, 0.016860655333333332, 0.016883035], 0, 6.927975654602051, 1678859802.1211524], "version": 0.2, "tvm_version": "0.10.0"}
{"input": ["cuda -keys=cuda,gpu -arch=sm_75 -max_num_threads=1024 -thread_warp_size=32", "conv2d_nchw.cuda", [["TENSOR", [1, 384, 8, 8], "float32"], ["TENSOR", [384, 384, 3, 1], "float32"], [1, 1], [1, 0, 1, 0], [1, 1], "float32"], {}], "config": {"index": 28893616, "code_hash": null, "entity": [["tile_f", "sp", [-1, 1, 2, 1]], ["tile_y", "sp", [-1, 1, 4, 2]], ["tile_x", "sp", [-1, 1, 8, 1]], ["tile_rc", "sp", [-1, 12]], ["tile_ry", "sp", [-1, 3]], ["tile_rx", "sp", [-1, 1]], ["auto_unroll_max_step", "ot", 512], ["unroll_explicit", "ot", 1]]}, "result": [[0.00019486806682867557, 0.0001948859951397327, 0.00019488823815309842], 0, 1.8894462585449219, 1678859803.3764975], "version": 0.2, "tvm_version": "0.10.0"}
{"input": ["cuda -keys=cuda,gpu -arch=sm_75 -max_num_threads=1024 -thread_warp_size=32", "conv2d_nchw.cuda", [["TENSOR", [1, 384, 8, 8], "float32"], ["TENSOR", [384, 384, 3, 1], "float32"], [1, 1], [1, 0, 1, 0], [1, 1], "float32"], {}], "config": {"index": 32708865, "code_hash": null, "entity": [["tile_f", "sp", [-1, 1, 64, 3]], ["tile_y", "sp", [-1, 8, 1, 1]], ["tile_x", "sp", [-1, 1, 4, 1]], ["tile_rc", "sp", [-1, 48]], ["tile_ry", "sp", [-1, 1]], ["tile_rx", "sp", [-1, 1]], ["auto_unroll_max_step", "ot", 1500], ["unroll_explicit", "ot", 1]]}, "result": [[0.0002754521558219178, 0.0002754665256849315, 0.0002754783099315069], 0, 3.583259344100952, 1678859804.65425], "version": 0.2, "tvm_version": "0.10.0"}
{"input": ["cuda -keys=cuda,gpu -arch=sm_75 -max_num_threads=1024 -thread_warp_size=32", "conv2d_nchw.cuda", [["TENSOR", [1, 384, 8, 8], "float32"], ["TENSOR", [384, 384, 3, 1], "float32"], [1, 1], [1, 0, 1, 0], [1, 1], "float32"], {}], "config": {"index": 8685234, "code_hash": null, "entity": [["tile_f", "sp", [-1, 12, 1, 2]], ["tile_y", "sp", [-1, 2, 2, 2]], ["tile_x", "sp", [-1, 1, 2, 1]], ["tile_rc", "sp", [-1, 128]], ["tile_ry", "sp", [-1, 1]], ["tile_rx", "sp", [-1, 1]], ["auto_unroll_max_step", "ot", 512], ["unroll_explicit", "ot", 0]]}, "result": [[0.0007807517632850242, 0.0007820492028985508, 0.0007825626231884058], 0, 2.948302745819092, 1678859805.8643556], "version": 0.2, "tvm_version": "0.10.0"}
{"input": ["cuda -keys=cuda,gpu -arch=sm_75 -max_num_threads=1024 -thread_warp_size=32", "conv2d_nchw.cuda", [["TENSOR", [1, 384, 8, 8], "float32"], ["TENSOR", [384, 384, 3, 1], "float32"], [1, 1], [1, 0, 1, 0], [1, 1], "float32"], {}], "config": {"index": 25870142, "code_hash": null, "entity": [["tile_f", "sp", [-1, 8, 8, 1]], ["tile_y", "sp", [-1, 1, 1, 4]], ["tile_x", "sp", [-1, 2, 2, 2]], ["tile_rc", "sp", [-1, 12]], ["tile_ry", "sp", [-1, 1]], ["tile_rx", "sp", [-1, 1]], ["auto_unroll_max_step", "ot", 512], ["unroll_explicit", "ot", 1]]}, "result": [[0.0003262331257606491, 0.00032624881744421904, 0.00032628862068965515], 0, 2.2465193271636963, 1678859807.105137], "version": 0.2, "tvm_version": "0.10.0"}
{"input": ["cuda -keys=cuda,gpu -arch=sm_75 -max_num_threads=1024 -thread_warp_size=32", "conv2d_nchw.cuda", [["TENSOR", [1, 384, 8, 8], "float32"], ["TENSOR", [384, 384, 3, 1], "float32"], [1, 1], [1, 0, 1, 0], [1, 1], "float32"], {}], "config": {"index": 31108238, "code_hash": null, "entity": [["tile_f", "sp", [-1, 12, 2, 16]], ["tile_y", "sp", [-1, 2, 4, 1]], ["tile_x", "sp", [-1, 1, 1, 1]], ["tile_rc", "sp", [-1, 3]], ["tile_ry", "sp", [-1, 1]], ["tile_rx", "sp", [-1, 1]], ["auto_unroll_max_step", "ot", 1500], ["unroll_explicit", "ot", 1]]}, "result": [[0.0107510337, 0.010757545399999999, 0.0107579551], 0, 5.6083550453186035, 1678859808.0408075], "version": 0.2, "tvm_version": "0.10.0"}
{"input": ["cuda -keys=cuda,gpu -arch=sm_75 -max_num_threads=1024 -thread_warp_size=32", "conv2d_nchw.cuda", [["TENSOR", [1, 384, 8, 8], "float32"], ["TENSOR", [384, 384, 3, 1], "float32"], [1, 1], [1, 0, 1, 0], [1, 1], "float32"], {}], "config": {"index": 25885837, "code_hash": null, "entity": [["tile_f", "sp", [-1, 6, 2, 16]], ["tile_y", "sp", [-1, 2, 4, 1]], ["tile_x", "sp", [-1, 1, 1, 4]], ["tile_rc", "sp", [-1, 12]], ["tile_ry", "sp", [-1, 1]], ["tile_rx", "sp", [-1, 1]], ["auto_unroll_max_step", "ot", 512], ["unroll_explicit", "ot", 1]]}, "result": [[0.0031736929374999996, 0.0031775040625000002, 0.00317883203125], 0, 3.0197908878326416, 1678859808.9504604], "version": 0.2, "tvm_version": "0.10.0"}
{"input": ["cuda -keys=cuda,gpu -arch=sm_75 -max_num_threads=1024 -thread_warp_size=32", "conv2d_nchw.cuda", [["TENSOR", [1, 384, 8, 8], "float32"], ["TENSOR", [384, 384, 3, 1], "float32"], [1, 1], [1, 0, 1, 0], [1, 1], "float32"], {}], "config": {"index": 10671956, "code_hash": null, "entity": [["tile_f", "sp", [-1, 24, 1, 2]], ["tile_y", "sp", [-1, 1, 2, 2]], ["tile_x", "sp", [-1, 2, 1, 2]], ["tile_rc", "sp", [-1, 16]], ["tile_ry", "sp", [-1, 3]], ["tile_rx", "sp", [-1, 1]], ["auto_unroll_max_step", "ot", 512], ["unroll_explicit", "ot", 0]]}, "result": [[0.010371040299999999, 0.010372621100000002, 0.0103757568], 0, 2.462756872177124, 1678859809.8681755], "version": 0.2, "tvm_version": "0.10.0"}
{"input": ["cuda -keys=cuda,gpu -arch=sm_75 -max_num_threads=1024 -thread_warp_size=32", "conv2d_nchw.cuda", [["TENSOR", [1, 384, 8, 8], "float32"], ["TENSOR", [384, 384, 3, 1], "float32"], [1, 1], [1, 0, 1, 0], [1, 1], "float32"], {}], "config": {"index": 16199520, "code_hash": null, "entity": [["tile_f", "sp", [-1, 1, 1, 1]], ["tile_y", "sp", [-1, 1, 8, 1]], ["tile_x", "sp", [-1, 1, 4, 1]], ["tile_rc", "sp", [-1, 6]], ["tile_ry", "sp", [-1, 3]], ["tile_rx", "sp", [-1, 1]], ["auto_unroll_max_step", "ot", 1500], ["unroll_explicit", "ot", 0]]}, "result": [[0.0004363313950276243, 0.00043668791160221, 0.0004367497900552486], 0, 1.7000679969787598, 1678859811.1294672], "version": 0.2, "tvm_version": "0.10.0"}
{"input": ["cuda -keys=cuda,gpu -arch=sm_75 -max_num_threads=1024 -thread_warp_size=32", "conv2d_nchw.cuda", [["TENSOR", [1, 384, 8, 8], "float32"], ["TENSOR", [384, 384, 3, 1], "float32"], [1, 1], [1, 0, 1, 0], [1, 1], "float32"], {}], "config": {"index": 29385965, "code_hash": null, "entity": [["tile_f", "sp", [-1, 2, 1, 12]], ["tile_y", "sp", [-1, 1, 1, 1]], ["tile_x", "sp", [-1, 2, 1, 1]], ["tile_rc", "sp", [-1, 32]], ["tile_ry", "sp", [-1, 3]], ["tile_rx", "sp", [-1, 1]], ["auto_unroll_max_step", "ot", 512], ["unroll_explicit", "ot", 1]]}, "result": [[0.005584313041666667, 0.00559487975, 0.006780810533333333], 0, 2.078300952911377, 1678859815.3072515], "version": 0.2, "tvm_version": "0.10.0"}
{"input": ["cuda -keys=cuda,gpu -arch=sm_75 -max_num_threads=1024 -thread_warp_size=32", "conv2d_nchw.cuda", [["TENSOR", [1, 384, 8, 8], "float32"], ["TENSOR", [384, 384, 3, 1], "float32"], [1, 1], [1, 0, 1, 0], [1, 1], "float32"], {}], "config": {"index": 3945635, "code_hash": null, "entity": [["tile_f", "sp", [-1, 32, 3, 1]], ["tile_y", "sp", [-1, 1, 1, 1]], ["tile_x", "sp", [-1, 2, 1, 2]], ["tile_rc", "sp", [-1, 6]], ["tile_ry", "sp", [-1, 3]], ["tile_rx", "sp", [-1, 1]], ["auto_unroll_max_step", "ot", 0], ["unroll_explicit", "ot", 0]]}, "result": [[0.001563205, 0.00156328546875, 0.001563336484375], 0, 1.4935698509216309, 1678859816.1955225], "version": 0.2, "tvm_version": "0.10.0"}
{"input": ["cuda -keys=cuda,gpu -arch=sm_75 -max_num_threads=1024 -thread_warp_size=32", "conv2d_nchw.cuda", [["TENSOR", [1, 384, 8, 8], "float32"], ["TENSOR", [384, 384, 3, 1], "float32"], [1, 1], [1, 0, 1, 0], [1, 1], "float32"], {}], "config": {"index": 966248, "code_hash": null, "entity": [["tile_f", "sp", [-1, 24, 1, 1]], ["tile_y", "sp", [-1, 1, 2, 2]], ["tile_x", "sp", [-1, 1, 1, 1]], ["tile_rc", "sp", [-1, 8]], ["tile_ry", "sp", [-1, 1]], ["tile_rx", "sp", [-1, 1]], ["auto_unroll_max_step", "ot", 0], ["unroll_explicit", "ot", 0]]}, "result": [[0.0011278305, 0.0011285604507042255, 0.0011291979929577466], 0, 1.9836156368255615, 1678859817.4600368], "version": 0.2, "tvm_version": "0.10.0"}
{"input": ["cuda -keys=cuda,gpu -arch=sm_75 -max_num_threads=1024 -thread_warp_size=32", "conv2d_nchw.cuda", [["TENSOR", [1, 384, 8, 8], "float32"], ["TENSOR", [384, 384, 3, 1], "float32"], [1, 1], [1, 0, 1, 0], [1, 1], "float32"], {}], "config": {"index": 33794279, "code_hash": null, "entity": [["tile_f", "sp", [-1, 1, 16, 8]], ["tile_y", "sp", [-1, 1, 2, 1]], ["tile_x", "sp", [-1, 1, 1, 1]], ["tile_rc", "sp", [-1, 1]], ["tile_ry", "sp", [-1, 3]], ["tile_rx", "sp", [-1, 1]], ["auto_unroll_max_step", "ot", 1500], ["unroll_explicit", "ot", 1]]}, "result": [[0.0013230887894736842, 0.0013231136842105265, 0.0013231587631578948], 0, 1.3400464057922363, 1678859818.309145], "version": 0.2, "tvm_version": "0.10.0"}
{"input": ["cuda -keys=cuda,gpu -arch=sm_75 -max_num_threads=1024 -thread_warp_size=32", "conv2d_nchw.cuda", [["TENSOR", [1, 384, 8, 8], "float32"], ["TENSOR", [384, 384, 3, 1], "float32"], [1, 1], [1, 0, 1, 0], [1, 1], "float32"], {}], "config": {"index": 8253916, "code_hash": null, "entity": [["tile_f", "sp", [-1, 1, 32, 6]], ["tile_y", "sp", [-1, 1, 4, 2]], ["tile_x", "sp", [-1, 1, 1, 8]], ["tile_rc", "sp", [-1, 48]], ["tile_ry", "sp", [-1, 1]], ["tile_rx", "sp", [-1, 1]], ["auto_unroll_max_step", "ot", 512], ["unroll_explicit", "ot", 0]]}, "result": [[0.00044937911420612814, 0.000449386, 0.00044942956545961], 0, 1.9571285247802734, 1678859819.583241], "version": 0.2, "tvm_version": "0.10.0"}
{"input": ["cuda -keys=cuda,gpu -arch=sm_75 -max_num_threads=1024 -thread_warp_size=32", "conv2d_nchw.cuda", [["TENSOR", [1, 384, 8, 8], "float32"], ["TENSOR", [384, 384, 3, 1], "float32"], [1, 1], [1, 0, 1, 0], [1, 1], "float32"], {}], "config": {"index": 1213959, "code_hash": null, "entity": [["tile_f", "sp", [-1, 2, 4, 1]], ["tile_y", "sp", [-1, 1, 8, 1]], ["tile_x", "sp", [-1, 4, 2, 1]], ["tile_rc", "sp", [-1, 12]], ["tile_ry", "sp", [-1, 1]], ["tile_rx", "sp", [-1, 1]], ["auto_unroll_max_step", "ot", 0], ["unroll_explicit", "ot", 0]]}, "result": [[0.00019053443720379147, 0.00019055492061611373, 0.0001906605568720379], 0, 1.9407739639282227, 1678859820.8734565], "version": 0.2, "tvm_version": "0.10.0"}
{"input": ["cuda -keys=cuda,gpu -arch=sm_75 -max_num_threads=1024 -thread_warp_size=32", "conv2d_nchw.cuda", [["TENSOR", [1, 384, 8, 8], "float32"], ["TENSOR", [384, 384, 3, 1], "float32"], [1, 1], [1, 0, 1, 0], [1, 1], "float32"], {}], "config": {"index": 14240793, "code_hash": null, "entity": [["tile_f", "sp", [-1, 4, 6, 2]], ["tile_y", "sp", [-1, 2, 4, 1]], ["tile_x", "sp", [-1, 8, 1, 1]], ["tile_rc", "sp", [-1, 48]], ["tile_ry", "sp", [-1, 1]], ["tile_rx", "sp", [-1, 1]], ["auto_unroll_max_step", "ot", 1500], ["unroll_explicit", "ot", 0]]}, "result": [[0.0004751060707964602, 0.00047562959587020646, 0.00047600593510324483], 0, 2.1880152225494385, 1678859822.0646956], "version": 0.2, "tvm_version": "0.10.0"}
{"input": ["cuda -keys=cuda,gpu -arch=sm_75 -max_num_threads=1024 -thread_warp_size=32", "conv2d_nchw.cuda", [["TENSOR", [1, 384, 8, 8], "float32"], ["TENSOR", [384, 384, 3, 1], "float32"], [1, 1], [1, 0, 1, 0], [1, 1], "float32"], {}], "config": {"index": 4358684, "code_hash": null, "entity": [["tile_f", "sp", [-1, 2, 24, 4]], ["tile_y", "sp", [-1, 1, 1, 1]], ["tile_x", "sp", [-1, 2, 2, 2]], ["tile_rc", "sp", [-1, 12]], ["tile_ry", "sp", [-1, 3]], ["tile_rx", "sp", [-1, 1]], ["auto_unroll_max_step", "ot", 0], ["unroll_explicit", "ot", 0]]}, "result": [[0.0006425149519999999, 0.000642557676, 0.00064261322], 0, 1.8271865844726562, 1678859823.3331974], "version": 0.2, "tvm_version": "0.10.0"}
{"input": ["cuda -keys=cuda,gpu -arch=sm_75 -max_num_threads=1024 -thread_warp_size=32", "conv2d_nchw.cuda", [["TENSOR", [1, 384, 8, 8], "float32"], ["TENSOR", [384, 384, 3, 1], "float32"], [1, 1], [1, 0, 1, 0], [1, 1], "float32"], {}], "config": {"index": 10309430, "code_hash": null, "entity": [["tile_f", "sp", [-1, 1, 2, 96]], ["tile_y", "sp", [-1, 2, 1, 4]], ["tile_x", "sp", [-1, 1, 2, 2]], ["tile_rc", "sp", [-1, 8]], ["tile_ry", "sp", [-1, 3]], ["tile_rx", "sp", [-1, 1]], ["auto_unroll_max_step", "ot", 512], ["unroll_explicit", "ot", 0]]}, "result": [[0.017495381666666667, 0.0175002085, 0.01751779683333333], 0, 1.5895583629608154, 1678859824.2293744], "version": 0.2, "tvm_version": "0.10.0"}
{"input": ["cuda -keys=cuda,gpu -arch=sm_75 -max_num_threads=1024 -thread_warp_size=32", "conv2d_nchw.cuda", [["TENSOR", [1, 384, 8, 8], "float32"], ["TENSOR", [384, 384, 3, 1], "float32"], [1, 1], [1, 0, 1, 0], [1, 1], "float32"], {}], "config": {"index": 12641753, "code_hash": null, "entity": [["tile_f", "sp", [-1, 1, 1, 128]], ["tile_y", "sp", [-1, 1, 1, 4]], ["tile_x", "sp", [-1, 1, 1, 4]], ["tile_rc", "sp", [-1, 2]], ["tile_ry", "sp", [-1, 1]], ["tile_rx", "sp", [-1, 1]], ["auto_unroll_max_step", "ot", 1500], ["unroll_explicit", "ot", 0]]}, "result": [[0.04508010833333334, 0.04508801266666667, 0.045140584000000004], 0, 2.0767691135406494, 1678859825.4190943], "version": 0.2, "tvm_version": "0.10.0"}
{"input": ["cuda -keys=cuda,gpu -arch=sm_75 -max_num_threads=1024 -thread_warp_size=32", "conv2d_nchw.cuda", [["TENSOR", [1, 384, 8, 8], "float32"], ["TENSOR", [384, 384, 3, 1], "float32"], [1, 1], [1, 0, 1, 0], [1, 1], "float32"], {}], "config": {"index": 35580850, "code_hash": null, "entity": [["tile_f", "sp", [-1, 1, 2, 12]], ["tile_y", "sp", [-1, 4, 2, 1]], ["tile_x", "sp", [-1, 4, 2, 1]], ["tile_rc", "sp", [-1, 32]], ["tile_ry", "sp", [-1, 3]], ["tile_rx", "sp", [-1, 1]], ["auto_unroll_max_step", "ot", 1500], ["unroll_explicit", "ot", 1]]}, "result": [[0.0003745553402777778, 0.00037462170833333334, 0.0003746702037037037], 0, 4.291756868362427, 1678859826.6849117], "version": 0.2, "tvm_version": "0.10.0"}
{"input": ["cuda -keys=cuda,gpu -arch=sm_75 -max_num_threads=1024 -thread_warp_size=32", "conv2d_nchw.cuda", [["TENSOR", [1, 384, 8, 8], "float32"], ["TENSOR", [384, 384, 3, 1], "float32"], [1, 1], [1, 0, 1, 0], [1, 1], "float32"], {}], "config": {"index": 33235105, "code_hash": null, "entity": [["tile_f", "sp", [-1, 1, 1, 16]], ["tile_y", "sp", [-1, 1, 1, 8]], ["tile_x", "sp", [-1, 2, 1, 1]], ["tile_rc", "sp", [-1, 128]], ["tile_ry", "sp", [-1, 1]], ["tile_rx", "sp", [-1, 1]], ["auto_unroll_max_step", "ot", 1500], ["unroll_explicit", "ot", 1]]}, "result": [[0.003385606366666667, 0.003386582433333333, 0.0033871103666666667], 0, 1.8163259029388428, 1678859827.5610955], "version": 0.2, "tvm_version": "0.10.0"}
{"input": ["cuda -keys=cuda,gpu -arch=sm_75 -max_num_threads=1024 -thread_warp_size=32", "conv2d_nchw.cuda", [["TENSOR", [1, 384, 8, 8], "float32"], ["TENSOR", [384, 384, 3, 1], "float32"], [1, 1], [1, 0, 1, 0], [1, 1], "float32"], {}], "config": {"index": 22187380, "code_hash": null, "entity": [["tile_f", "sp", [-1, 8, 3, 8]], ["tile_y", "sp", [-1, 8, 1, 1]], ["tile_x", "sp", [-1, 2, 1, 2]], ["tile_rc", "sp", [-1, 4]], ["tile_ry", "sp", [-1, 3]], ["tile_rx", "sp", [-1, 1]], ["auto_unroll_max_step", "ot", 0], ["unroll_explicit", "ot", 1]]}, "result": [[0.022252851799999997, 0.0224450622, 0.022468313400000002], 0, 3.5962507724761963, 1678859828.5565865], "version": 0.2, "tvm_version": "0.10.0"}
{"input": ["cuda -keys=cuda,gpu -arch=sm_75 -max_num_threads=1024 -thread_warp_size=32", "conv2d_nchw.cuda", [["TENSOR", [1, 384, 8, 8], "float32"], ["TENSOR", [384, 384, 3, 1], "float32"], [1, 1], [1, 0, 1, 0], [1, 1], "float32"], {}], "config": {"index": 24906771, "code_hash": null, "entity": [["tile_f", "sp", [-1, 2, 6, 1]], ["tile_y", "sp", [-1, 1, 8, 1]], ["tile_x", "sp", [-1, 2, 2, 2]], ["tile_rc", "sp", [-1, 2]], ["tile_ry", "sp", [-1, 1]], ["tile_rx", "sp", [-1, 1]], ["auto_unroll_max_step", "ot", 512], ["unroll_explicit", "ot", 1]]}, "result": [[0.0002113059574468085, 0.00021131207692307694, 0.00021164756955810148], 0, 1.4923372268676758, 1678859833.2315226], "version": 0.2, "tvm_version": "0.10.0"}
{"input": ["cuda -keys=cuda,gpu -arch=sm_75 -max_num_threads=1024 -thread_warp_size=32", "conv2d_nchw.cuda", [["TENSOR", [1, 384, 8, 8], "float32"], ["TENSOR", [384, 384, 3, 1], "float32"], [1, 1], [1, 0, 1, 0], [1, 1], "float32"], {}], "config": {"index": 10091082, "code_hash": null, "entity": [["tile_f", "sp", [-1, 6, 4, 1]], ["tile_y", "sp", [-1, 8, 1, 1]], ["tile_x", "sp", [-1, 2, 1, 2]], ["tile_rc", "sp", [-1, 6]], ["tile_ry", "sp", [-1, 3]], ["tile_rx", "sp", [-1, 1]], ["auto_unroll_max_step", "ot", 512], ["unroll_explicit", "ot", 0]]}, "result": [[0.000528627386885246, 0.0005286660098360656, 0.0005294873344262295], 0, 2.189263343811035, 1678859834.4362953], "version": 0.2, "tvm_version": "0.10.0"}
{"input": ["cuda -keys=cuda,gpu -arch=sm_75 -max_num_threads=1024 -thread_warp_size=32", "conv2d_nchw.cuda", [["TENSOR", [1, 384, 8, 8], "float32"], ["TENSOR", [384, 384, 3, 1], "float32"], [1, 1], [1, 0, 1, 0], [1, 1], "float32"], {}], "config": {"index": 1852873, "code_hash": null, "entity": [["tile_f", "sp", [-1, 1, 16, 1]], ["tile_y", "sp", [-1, 1, 1, 1]], ["tile_x", "sp", [-1, 1, 2, 2]], ["tile_rc", "sp", [-1, 32]], ["tile_ry", "sp", [-1, 1]], ["tile_rx", "sp", [-1, 1]], ["auto_unroll_max_step", "ot", 0], ["unroll_explicit", "ot", 0]]}, "result": [[0.0007803035845410628, 0.0007803306376811595, 0.0007804223381642512], 0, 1.568817377090454, 1678859835.6516316], "version": 0.2, "tvm_version": "0.10.0"}
{"input": ["cuda -keys=cuda,gpu -arch=sm_75 -max_num_threads=1024 -thread_warp_size=32", "conv2d_nchw.cuda", [["TENSOR", [1, 384, 8, 8], "float32"], ["TENSOR", [384, 384, 3, 1], "float32"], [1, 1], [1, 0, 1, 0], [1, 1], "float32"], {}], "config": {"index": 7464319, "code_hash": null, "entity": [["tile_f", "sp", [-1, 1, 1, 8]], ["tile_y", "sp", [-1, 1, 1, 2]], ["tile_x", "sp", [-1, 2, 1, 4]], ["tile_rc", "sp", [-1, 12]], ["tile_ry", "sp", [-1, 1]], ["tile_rx", "sp", [-1, 1]], ["auto_unroll_max_step", "ot", 512], ["unroll_explicit", "ot", 0]]}, "result": [[0.0014528700144927536, 0.0014535368695652174, 0.0014540503623188406], 0, 1.5886859893798828, 1678859836.4667335], "version": 0.2, "tvm_version": "0.10.0"}
{"input": ["cuda -keys=cuda,gpu -arch=sm_75 -max_num_threads=1024 -thread_warp_size=32", "conv2d_nchw.cuda", [["TENSOR", [1, 384, 8, 8], "float32"], ["TENSOR", [384, 384, 3, 1], "float32"], [1, 1], [1, 0, 1, 0], [1, 1], "float32"], {}], "config": {"index": 746836, "code_hash": null, "entity": [["tile_f", "sp", [-1, 1, 2, 32]], ["tile_y", "sp", [-1, 1, 4, 2]], ["tile_x", "sp", [-1, 2, 1, 4]], ["tile_rc", "sp", [-1, 4]], ["tile_ry", "sp", [-1, 1]], ["tile_rx", "sp", [-1, 1]], ["auto_unroll_max_step", "ot", 0], ["unroll_explicit", "ot", 0]]}, "result": [[0.00555835, 0.0055587145, 0.005559459666666666], 0, 1.7686314582824707, 1678859837.368813], "version": 0.2, "tvm_version": "0.10.0"}
{"input": ["cuda -keys=cuda,gpu -arch=sm_75 -max_num_threads=1024 -thread_warp_size=32", "conv2d_nchw.cuda", [["TENSOR", [1, 384, 8, 8], "float32"], ["TENSOR", [384, 384, 3, 1], "float32"], [1, 1], [1, 0, 1, 0], [1, 1], "float32"], {}], "config": {"index": 1146016, "code_hash": null, "entity": [["tile_f", "sp", [-1, 1, 4, 4]], ["tile_y", "sp", [-1, 1, 4, 1]], ["tile_x", "sp", [-1, 1, 1, 8]], ["tile_rc", "sp", [-1, 8]], ["tile_ry", "sp", [-1, 1]], ["tile_rx", "sp", [-1, 1]], ["auto_unroll_max_step", "ot", 0], ["unroll_explicit", "ot", 0]]}, "result": [[0.00027070773949579833, 0.0002707097142857143, 0.00027075485042016805], 0, 1.6410574913024902, 1678859838.6629534], "version": 0.2, "tvm_version": "0.10.0"}
{"input": ["cuda -keys=cuda,gpu -arch=sm_75 -max_num_threads=1024 -thread_warp_size=32", "conv2d_nchw.cuda", [["TENSOR", [1, 384, 8, 8], "float32"], ["TENSOR", [384, 384, 3, 1], "float32"], [1, 1], [1, 0, 1, 0], [1, 1], "float32"], {}], "config": {"index": 20140002, "code_hash": null, "entity": [["tile_f", "sp", [-1, 8, 8, 2]], ["tile_y", "sp", [-1, 1, 2, 4]], ["tile_x", "sp", [-1, 2, 1, 4]], ["tile_rc", "sp", [-1, 24]], ["tile_ry", "sp", [-1, 1]], ["tile_rx", "sp", [-1, 1]], ["auto_unroll_max_step", "ot", 0], ["unroll_explicit", "ot", 1]]}, "result": [[0.0027810153243243243, 0.002781128540540541, 0.0027814054594594594], 0, 2.0800843238830566, 1678859839.5047207], "version": 0.2, "tvm_version": "0.10.0"}
{"input": ["cuda -keys=cuda,gpu -arch=sm_75 -max_num_threads=1024 -thread_warp_size=32", "conv2d_nchw.cuda", [["TENSOR", [1, 384, 8, 8], "float32"], ["TENSOR", [384, 384, 3, 1], "float32"], [1, 1], [1, 0, 1, 0], [1, 1], "float32"], {}], "config": {"index": 34669764, "code_hash": null, "entity": [["tile_f", "sp", [-1, 8, 1, 8]], ["tile_y", "sp", [-1, 2, 4, 1]], ["tile_x", "sp", [-1, 2, 1, 2]], ["tile_rc", "sp", [-1, 6]], ["tile_ry", "sp", [-1, 3]], ["tile_rx", "sp", [-1, 1]], ["auto_unroll_max_step", "ot", 1500], ["unroll_explicit", "ot", 1]]}, "result": [[0.014888959571428573, 0.014889188428571428, 0.014899904428571429], 0, 4.275415658950806, 1678859840.3817303], "version": 0.2, "tvm_version": "0.10.0"}
{"input": ["cuda -keys=cuda,gpu -arch=sm_75 -max_num_threads=1024 -thread_warp_size=32", "conv2d_nchw.cuda", [["TENSOR", [1, 384, 8, 8], "float32"], ["TENSOR", [384, 384, 3, 1], "float32"], [1, 1], [1, 0, 1, 0], [1, 1], "float32"], {}], "config": {"index": 25874469, "code_hash": null, "entity": [["tile_f", "sp", [-1, 4, 12, 1]], ["tile_y", "sp", [-1, 2, 2, 1]], ["tile_x", "sp", [-1, 1, 4, 2]], ["tile_rc", "sp", [-1, 12]], ["tile_ry", "sp", [-1, 1]], ["tile_rx", "sp", [-1, 1]], ["auto_unroll_max_step", "ot", 512], ["unroll_explicit", "ot", 1]]}, "result": [[0.0001254960334008097, 0.00012551047368421052, 0.0001255953390688259], 0, 1.8916380405426025, 1678859847.4684258], "version": 0.2, "tvm_version": "0.10.0"}
{"input": ["cuda -keys=cuda,gpu -arch=sm_75 -max_num_threads=1024 -thread_warp_size=32", "conv2d_nchw.cuda", [["TENSOR", [1, 384, 8, 8], "float32"], ["TENSOR", [384, 384, 3, 1], "float32"], [1, 1], [1, 0, 1, 0], [1, 1], "float32"], {}], "config": {"index": 12709811, "code_hash": null, "entity": [["tile_f", "sp", [-1, 2, 2, 12]], ["tile_y", "sp", [-1, 1, 2, 4]], ["tile_x", "sp", [-1, 8, 1, 1]], ["tile_rc", "sp", [-1, 3]], ["tile_ry", "sp", [-1, 1]], ["tile_rx", "sp", [-1, 1]], ["auto_unroll_max_step", "ot", 1500], ["unroll_explicit", "ot", 0]]}, "result": [[0.0108463325, 0.0108464035, 0.0108465858], 0, 2.780209541320801, 1678859848.4292204], "version": 0.2, "tvm_version": "0.10.0"}
{"input": ["cuda -keys=cuda,gpu -arch=sm_75 -max_num_threads=1024 -thread_warp_size=32", "conv2d_nchw.cuda", [["TENSOR", [1, 384, 8, 8], "float32"], ["TENSOR", [384, 384, 3, 1], "float32"], [1, 1], [1, 0, 1, 0], [1, 1], "float32"], {}], "config": {"index": 11070336, "code_hash": null, "entity": [["tile_f", "sp", [-1, 1, 64, 1]], ["tile_y", "sp", [-1, 8, 1, 1]], ["tile_x", "sp", [-1, 1, 2, 2]], ["tile_rc", "sp", [-1, 32]], ["tile_ry", "sp", [-1, 3]], ["tile_rx", "sp", [-1, 1]], ["auto_unroll_max_step", "ot", 512], ["unroll_explicit", "ot", 0]]}, "result": [[0.00018845156557377048, 0.00018846875409836065, 0.00018850120140515223], 0, 1.8400752544403076, 1678859849.7041633], "version": 0.2, "tvm_version": "0.10.0"}
{"input": ["cuda -keys=cuda,gpu -arch=sm_75 -max_num_threads=1024 -thread_warp_size=32", "conv2d_nchw.cuda", [["TENSOR", [1, 384, 8, 8], "float32"], ["TENSOR", [384, 384, 3, 1], "float32"], [1, 1], [1, 0, 1, 0], [1, 1], "float32"], {}], "config": {"index": 580228, "code_hash": null, "entity": [["tile_f", "sp", [-1, 4, 1, 16]], ["tile_y", "sp", [-1, 2, 4, 1]], ["tile_x", "sp", [-1, 1, 1, 1]], ["tile_rc", "sp", [-1, 4]], ["tile_ry", "sp", [-1, 1]], ["tile_rx", "sp", [-1, 1]], ["auto_unroll_max_step", "ot", 0], ["unroll_explicit", "ot", 0]]}, "result": [[0.000550766576923077, 0.0005508530989010989, 0.0005509007582417582], 0, 1.822993516921997, 1678859850.5714757], "version": 0.2, "tvm_version": "0.10.0"}
{"input": ["cuda -keys=cuda,gpu -arch=sm_75 -max_num_threads=1024 -thread_warp_size=32", "conv2d_nchw.cuda", [["TENSOR", [1, 384, 8, 8], "float32"], ["TENSOR", [384, 384, 3, 1], "float32"], [1, 1], [1, 0, 1, 0], [1, 1], "float32"], {}], "config": {"index": 19222081, "code_hash": null, "entity": [["tile_f", "sp", [-1, 2, 1, 1]], ["tile_y", "sp", [-1, 4, 2, 1]], ["tile_x", "sp", [-1, 4, 1, 1]], ["tile_rc", "sp", [-1, 6]], ["tile_ry", "sp", [-1, 1]], ["tile_rx", "sp", [-1, 1]], ["auto_unroll_max_step", "ot", 0], ["unroll_explicit", "ot", 1]]}, "result": [[0.0013623697432432432, 0.0013624367567567567, 0.0013624458243243244], 0, 1.531402826309204, 1678859851.4442604], "version": 0.2, "tvm_version": "0.10.0"}
{"input": ["cuda -keys=cuda,gpu -arch=sm_75 -max_num_threads=1024 -thread_warp_size=32", "conv2d_nchw.cuda", [["TENSOR", [1, 384, 8, 8], "float32"], ["TENSOR", [384, 384, 3, 1], "float32"], [1, 1], [1, 0, 1, 0], [1, 1], "float32"], {}], "config": {"index": 28173446, "code_hash": null, "entity": [["tile_f", "sp", [-1, 16, 1, 8]], ["tile_y", "sp", [-1, 2, 2, 2]], ["tile_x", "sp", [-1, 2, 2, 2]], ["tile_rc", "sp", [-1, 3]], ["tile_ry", "sp", [-1, 3]], ["tile_rx", "sp", [-1, 1]], ["auto_unroll_max_step", "ot", 512], ["unroll_explicit", "ot", 1]]}, "result": [[0.0168632315, 0.016863914333333334, 0.016863914333333334], 0, 6.753330707550049, 1678859852.3647313], "version": 0.2, "tvm_version": "0.10.0"}
{"input": ["cuda -keys=cuda,gpu -arch=sm_75 -max_num_threads=1024 -thread_warp_size=32", "conv2d_nchw.cuda", [["TENSOR", [1, 384, 8, 8], "float32"], ["TENSOR", [384, 384, 3, 1], "float32"], [1, 1], [1, 0, 1, 0], [1, 1], "float32"], {}], "config": {"index": 28893616, "code_hash": null, "entity": [["tile_f", "sp", [-1, 1, 2, 1]], ["tile_y", "sp", [-1, 1, 4, 2]], ["tile_x", "sp", [-1, 1, 8, 1]], ["tile_rc", "sp", [-1, 12]], ["tile_ry", "sp", [-1, 3]], ["tile_rx", "sp", [-1, 1]], ["auto_unroll_max_step", "ot", 512], ["unroll_explicit", "ot", 1]]}, "result": [[0.00019484594775212637, 0.00019487086634264883, 0.00019489554313487241], 0, 1.9560811519622803, 1678859853.642679], "version": 0.2, "tvm_version": "0.10.0"}
{"input": ["cuda -keys=cuda,gpu -arch=sm_75 -max_num_threads=1024 -thread_warp_size=32", "conv2d_nchw.cuda", [["TENSOR", [1, 384, 8, 8], "float32"], ["TENSOR", [384, 384, 3, 1], "float32"], [1, 1], [1, 0, 1, 0], [1, 1], "float32"], {}], "config": {"index": 32708865, "code_hash": null, "entity": [["tile_f", "sp", [-1, 1, 64, 3]], ["tile_y", "sp", [-1, 8, 1, 1]], ["tile_x", "sp", [-1, 1, 4, 1]], ["tile_rc", "sp", [-1, 48]], ["tile_ry", "sp", [-1, 1]], ["tile_rx", "sp", [-1, 1]], ["auto_unroll_max_step", "ot", 1500], ["unroll_explicit", "ot", 1]]}, "result": [[0.00027534200512820513, 0.00027535622051282055, 0.00027538757264957266], 0, 3.4221012592315674, 1678859854.934931], "version": 0.2, "tvm_version": "0.10.0"}
{"input": ["cuda -keys=cuda,gpu -arch=sm_75 -max_num_threads=1024 -thread_warp_size=32", "conv2d_nchw.cuda", [["TENSOR", [1, 384, 8, 8], "float32"], ["TENSOR", [384, 384, 3, 1], "float32"], [1, 1], [1, 0, 1, 0], [1, 1], "float32"], {}], "config": {"index": 8685234, "code_hash": null, "entity": [["tile_f", "sp", [-1, 12, 1, 2]], ["tile_y", "sp", [-1, 2, 2, 2]], ["tile_x", "sp", [-1, 1, 2, 1]], ["tile_rc", "sp", [-1, 128]], ["tile_ry", "sp", [-1, 1]], ["tile_rx", "sp", [-1, 1]], ["auto_unroll_max_step", "ot", 512], ["unroll_explicit", "ot", 0]]}, "result": [[0.0007813288695652174, 0.0007821875652173912, 0.0007833946328502416], 0, 3.1330409049987793, 1678859856.1319842], "version": 0.2, "tvm_version": "0.10.0"}
{"input": ["cuda -keys=cuda,gpu -arch=sm_75 -max_num_threads=1024 -thread_warp_size=32", "conv2d_nchw.cuda", [["TENSOR", [1, 384, 8, 8], "float32"], ["TENSOR", [384, 384, 3, 1], "float32"], [1, 1], [1, 0, 1, 0], [1, 1], "float32"], {}], "config": {"index": 25870142, "code_hash": null, "entity": [["tile_f", "sp", [-1, 8, 8, 1]], ["tile_y", "sp", [-1, 1, 1, 4]], ["tile_x", "sp", [-1, 2, 2, 2]], ["tile_rc", "sp", [-1, 12]], ["tile_ry", "sp", [-1, 1]], ["tile_rx", "sp", [-1, 1]], ["auto_unroll_max_step", "ot", 512], ["unroll_explicit", "ot", 1]]}, "result": [[0.00032626558383838384, 0.0003262803494949495, 0.0003263444060606061], 0, 2.3228344917297363, 1678859857.4011848], "version": 0.2, "tvm_version": "0.10.0"}
{"input": ["cuda -keys=cuda,gpu -arch=sm_75 -max_num_threads=1024 -thread_warp_size=32", "conv2d_nchw.cuda", [["TENSOR", [1, 384, 8, 8], "float32"], ["TENSOR", [384, 384, 3, 1], "float32"], [1, 1], [1, 0, 1, 0], [1, 1], "float32"], {}], "config": {"index": 31108238, "code_hash": null, "entity": [["tile_f", "sp", [-1, 12, 2, 16]], ["tile_y", "sp", [-1, 2, 4, 1]], ["tile_x", "sp", [-1, 1, 1, 1]], ["tile_rc", "sp", [-1, 3]], ["tile_ry", "sp", [-1, 1]], ["tile_rx", "sp", [-1, 1]], ["auto_unroll_max_step", "ot", 1500], ["unroll_explicit", "ot", 1]]}, "result": [[0.0107458625, 0.010746163100000001, 0.010752847999999999], 0, 5.490575790405273, 1678859858.3264313], "version": 0.2, "tvm_version": "0.10.0"}
{"input": ["cuda -keys=cuda,gpu -arch=sm_75 -max_num_threads=1024 -thread_warp_size=32", "conv2d_nchw.cuda", [["TENSOR", [1, 384, 8, 8], "float32"], ["TENSOR", [384, 384, 3, 1], "float32"], [1, 1], [1, 0, 1, 0], [1, 1], "float32"], {}], "config": {"index": 25885837, "code_hash": null, "entity": [["tile_f", "sp", [-1, 6, 2, 16]], ["tile_y", "sp", [-1, 2, 4, 1]], ["tile_x", "sp", [-1, 1, 1, 4]], ["tile_rc", "sp", [-1, 12]], ["tile_ry", "sp", [-1, 1]], ["tile_rx", "sp", [-1, 1]], ["auto_unroll_max_step", "ot", 512], ["unroll_explicit", "ot", 1]]}, "result": [[0.0031731800937500002, 0.0031732780625000003, 0.003173295], 0, 2.936875820159912, 1678859859.2223296], "version": 0.2, "tvm_version": "0.10.0"}
{"input": ["cuda -keys=cuda,gpu -arch=sm_75 -max_num_threads=1024 -thread_warp_size=32", "conv2d_nchw.cuda", [["TENSOR", [1, 384, 8, 8], "float32"], ["TENSOR", [384, 384, 3, 1], "float32"], [1, 1], [1, 0, 1, 0], [1, 1], "float32"], {}], "config": {"index": 24904371, "code_hash": null, "entity": [["tile_f", "sp", [-1, 2, 6, 1]], ["tile_y", "sp", [-1, 1, 2, 1]], ["tile_x", "sp", [-1, 2, 2, 2]], ["tile_rc", "sp", [-1, 2]], ["tile_ry", "sp", [-1, 1]], ["tile_rx", "sp", [-1, 1]], ["auto_unroll_max_step", "ot", 512], ["unroll_explicit", "ot", 1]]}, "result": [[0.00023188449345794393, 0.00023227346542056075, 0.00024571658691588784], 0, 1.692415475845337, 1678859865.361988], "version": 0.2, "tvm_version": "0.10.0"}
{"input": ["cuda -keys=cuda,gpu -arch=sm_75 -max_num_threads=1024 -thread_warp_size=32", "conv2d_nchw.cuda", [["TENSOR", [1, 384, 8, 8], "float32"], ["TENSOR", [384, 384, 3, 1], "float32"], [1, 1], [1, 0, 1, 0], [1, 1], "float32"], {}], "config": {"index": 13434771, "code_hash": null, "entity": [["tile_f", "sp", [-1, 2, 6, 1]], ["tile_y", "sp", [-1, 1, 8, 1]], ["tile_x", "sp", [-1, 1, 1, 8]], ["tile_rc", "sp", [-1, 8]], ["tile_ry", "sp", [-1, 1]], ["tile_rx", "sp", [-1, 1]], ["auto_unroll_max_step", "ot", 1500], ["unroll_explicit", "ot", 0]]}, "result": [[0.00020244177693282635, 0.00020245349683143218, 0.00020245881495564003], 0, 2.0436930656433105, 1678859866.59432], "version": 0.2, "tvm_version": "0.10.0"}
{"input": ["cuda -keys=cuda,gpu -arch=sm_75 -max_num_threads=1024 -thread_warp_size=32", "conv2d_nchw.cuda", [["TENSOR", [1, 384, 8, 8], "float32"], ["TENSOR", [384, 384, 3, 1], "float32"], [1, 1], [1, 0, 1, 0], [1, 1], "float32"], {}], "config": {"index": 34372228, "code_hash": null, "entity": [["tile_f", "sp", [-1, 4, 1, 16]], ["tile_y", "sp", [-1, 2, 4, 1]], ["tile_x", "sp", [-1, 1, 1, 1]], ["tile_rc", "sp", [-1, 4]], ["tile_ry", "sp", [-1, 3]], ["tile_rx", "sp", [-1, 1]], ["auto_unroll_max_step", "ot", 1500], ["unroll_explicit", "ot", 1]]}, "result": [[0.00080536705, 0.00080568321, 0.0008058718100000001], 0, 3.7419931888580322, 1678859867.7824647], "version": 0.2, "tvm_version": "0.10.0"}
{"input": ["cuda -keys=cuda,gpu -arch=sm_75 -max_num_threads=1024 -thread_warp_size=32", "conv2d_nchw.cuda", [["TENSOR", [1, 384, 8, 8], "float32"], ["TENSOR", [384, 384, 3, 1], "float32"], [1, 1], [1, 0, 1, 0], [1, 1], "float32"], {}], "config": {"index": 28946469, "code_hash": null, "entity": [["tile_f", "sp", [-1, 4, 12, 1]], ["tile_y", "sp", [-1, 2, 2, 1]], ["tile_x", "sp", [-1, 1, 4, 2]], ["tile_rc", "sp", [-1, 12]], ["tile_ry", "sp", [-1, 3]], ["tile_rx", "sp", [-1, 1]], ["auto_unroll_max_step", "ot", 512], ["unroll_explicit", "ot", 1]]}, "result": [[0.0001371580874785592, 0.00013716093996569468, 0.00013716330874785594], 0, 1.9259960651397705, 1678859868.9830415], "version": 0.2, "tvm_version": "0.10.0"}
{"input": ["cuda -keys=cuda,gpu -arch=sm_75 -max_num_threads=1024 -thread_warp_size=32", "conv2d_nchw.cuda", [["TENSOR", [1, 384, 8, 8], "float32"], ["TENSOR", [384, 384, 3, 1], "float32"], [1, 1], [1, 0, 1, 0], [1, 1], "float32"], {}], "config": {"index": 16188850, "code_hash": null, "entity": [["tile_f", "sp", [-1, 1, 2, 12]], ["tile_y", "sp", [-1, 4, 2, 1]], ["tile_x", "sp", [-1, 4, 2, 1]], ["tile_rc", "sp", [-1, 6]], ["tile_ry", "sp", [-1, 3]], ["tile_rx", "sp", [-1, 1]], ["auto_unroll_max_step", "ot", 1500], ["unroll_explicit", "ot", 0]]}, "result": [[0.0004631543657407407, 0.0004631565925925926, 0.00046317125], 0, 1.9680185317993164, 1678859869.8411522], "version": 0.2, "tvm_version": "0.10.0"}
{"input": ["cuda -keys=cuda,gpu -arch=sm_75 -max_num_threads=1024 -thread_warp_size=32", "conv2d_nchw.cuda", [["TENSOR", [1, 384, 8, 8], "float32"], ["TENSOR", [384, 384, 3, 1], "float32"], [1, 1], [1, 0, 1, 0], [1, 1], "float32"], {}], "config": {"index": 3947082, "code_hash": null, "entity": [["tile_f", "sp", [-1, 6, 4, 1]], ["tile_y", "sp", [-1, 8, 1, 1]], ["tile_x", "sp", [-1, 2, 1, 2]], ["tile_rc", "sp", [-1, 6]], ["tile_ry", "sp", [-1, 3]], ["tile_rx", "sp", [-1, 1]], ["auto_unroll_max_step", "ot", 0], ["unroll_explicit", "ot", 0]]}, "result": [[0.0006724694765100672, 0.00067248622147651, 0.0006725246711409396], 0, 1.9779393672943115, 1678859870.6983247], "version": 0.2, "tvm_version": "0.10.0"}
{"input": ["cuda -keys=cuda,gpu -arch=sm_75 -max_num_threads=1024 -thread_warp_size=32", "conv2d_nchw.cuda", [["TENSOR", [1, 384, 8, 8], "float32"], ["TENSOR", [384, 384, 3, 1], "float32"], [1, 1], [1, 0, 1, 0], [1, 1], "float32"], {}], "config": {"index": 25877349, "code_hash": null, "entity": [["tile_f", "sp", [-1, 4, 12, 1]], ["tile_y", "sp", [-1, 2, 1, 2]], ["tile_x", "sp", [-1, 1, 4, 2]], ["tile_rc", "sp", [-1, 12]], ["tile_ry", "sp", [-1, 1]], ["tile_rx", "sp", [-1, 1]], ["auto_unroll_max_step", "ot", 512], ["unroll_explicit", "ot", 1]]}, "result": [[0.00017678478146853147, 0.00017694942657342657, 0.00017710165384615383], 0, 1.828587293624878, 1678859871.529087], "version": 0.2, "tvm_version": "0.10.0"}
{"input": ["cuda -keys=cuda,gpu -arch=sm_75 -max_num_threads=1024 -thread_warp_size=32", "conv2d_nchw.cuda", [["TENSOR", [1, 384, 8, 8], "float32"], ["TENSOR", [384, 384, 3, 1], "float32"], [1, 1], [1, 0, 1, 0], [1, 1], "float32"], {}], "config": {"index": 1298469, "code_hash": null, "entity": [["tile_f", "sp", [-1, 4, 12, 1]], ["tile_y", "sp", [-1, 2, 2, 1]], ["tile_x", "sp", [-1, 1, 4, 2]], ["tile_rc", "sp", [-1, 12]], ["tile_ry", "sp", [-1, 1]], ["tile_rx", "sp", [-1, 1]], ["auto_unroll_max_step", "ot", 0], ["unroll_explicit", "ot", 0]]}, "result": [[0.00012480470132916342, 0.0001248064073494918, 0.00012484636200156373], 0, 1.9469165802001953, 1678859872.8023667], "version": 0.2, "tvm_version": "0.10.0"}
{"input": ["cuda -keys=cuda,gpu -arch=sm_75 -max_num_threads=1024 -thread_warp_size=32", "conv2d_nchw.cuda", [["TENSOR", [1, 384, 8, 8], "float32"], ["TENSOR", [384, 384, 3, 1], "float32"], [1, 1], [1, 0, 1, 0], [1, 1], "float32"], {}], "config": {"index": 1292199, "code_hash": null, "entity": [["tile_f", "sp", [-1, 2, 4, 1]], ["tile_y", "sp", [-1, 4, 1, 2]], ["tile_x", "sp", [-1, 2, 2, 2]], ["tile_rc", "sp", [-1, 12]], ["tile_ry", "sp", [-1, 1]], ["tile_rx", "sp", [-1, 1]], ["auto_unroll_max_step", "ot", 0], ["unroll_explicit", "ot", 0]]}, "result": [[0.0007307351605839415, 0.000730747299270073, 0.000730764401459854], 0, 1.5357625484466553, 1678859873.67446], "version": 0.2, "tvm_version": "0.10.0"}
{"input": ["cuda -keys=cuda,gpu -arch=sm_75 -max_num_threads=1024 -thread_warp_size=32", "conv2d_nchw.cuda", [["TENSOR", [1, 384, 8, 8], "float32"], ["TENSOR", [384, 384, 3, 1], "float32"], [1, 1], [1, 0, 1, 0], [1, 1], "float32"], {}], "config": {"index": 9534336, "code_hash": null, "entity": [["tile_f", "sp", [-1, 1, 64, 1]], ["tile_y", "sp", [-1, 8, 1, 1]], ["tile_x", "sp", [-1, 1, 2, 2]], ["tile_rc", "sp", [-1, 2]], ["tile_ry", "sp", [-1, 3]], ["tile_rx", "sp", [-1, 1]], ["auto_unroll_max_step", "ot", 512], ["unroll_explicit", "ot", 0]]}, "result": [[0.0001464431839708561, 0.0001464477422586521, 0.00014647693989071038], 0, 1.904188871383667, 1678859874.9653096], "version": 0.2, "tvm_version": "0.10.0"}
{"input": ["cuda -keys=cuda,gpu -arch=sm_75 -max_num_threads=1024 -thread_warp_size=32", "conv2d_nchw.cuda", [["TENSOR", [1, 384, 8, 8], "float32"], ["TENSOR", [384, 384, 3, 1], "float32"], [1, 1], [1, 0, 1, 0], [1, 1], "float32"], {}], "config": {"index": 10091286, "code_hash": null, "entity": [["tile_f", "sp", [-1, 12, 2, 4]], ["tile_y", "sp", [-1, 8, 1, 1]], ["tile_x", "sp", [-1, 2, 1, 2]], ["tile_rc", "sp", [-1, 6]], ["tile_ry", "sp", [-1, 3]], ["tile_rx", "sp", [-1, 1]], ["auto_unroll_max_step", "ot", 512], ["unroll_explicit", "ot", 0]]}, "result": [[0.02438884216666667, 0.024477124500000003, 0.024902603], 0, 6.157163619995117, 1678859876.2589533], "version": 0.2, "tvm_version": "0.10.0"}
{"input": ["cuda -keys=cuda,gpu -arch=sm_75 -max_num_threads=1024 -thread_warp_size=32", "conv2d_nchw.cuda", [["TENSOR", [1, 384, 8, 8], "float32"], ["TENSOR", [384, 384, 3, 1], "float32"], [1, 1], [1, 0, 1, 0], [1, 1], "float32"], {}], "config": {"index": 34122771, "code_hash": null, "entity": [["tile_f", "sp", [-1, 2, 6, 1]], ["tile_y", "sp", [-1, 1, 8, 1]], ["tile_x", "sp", [-1, 2, 2, 2]], ["tile_rc", "sp", [-1, 2]], ["tile_ry", "sp", [-1, 3]], ["tile_rx", "sp", [-1, 1]], ["auto_unroll_max_step", "ot", 1500], ["unroll_explicit", "ot", 1]]}, "result": [[0.000151485561734213, 0.00015152337040527804, 0.00015153939114043356], 0, 1.8503806591033936, 1678859877.4870005], "version": 0.2, "tvm_version": "0.10.0"}
{"input": ["cuda -keys=cuda,gpu -arch=sm_75 -max_num_threads=1024 -thread_warp_size=32", "conv2d_nchw.cuda", [["TENSOR", [1, 384, 8, 8], "float32"], ["TENSOR", [384, 384, 3, 1], "float32"], [1, 1], [1, 0, 1, 0], [1, 1], "float32"], {}], "config": {"index": 28521635, "code_hash": null, "entity": [["tile_f", "sp", [-1, 32, 3, 1]], ["tile_y", "sp", [-1, 1, 1, 1]], ["tile_x", "sp", [-1, 2, 1, 2]], ["tile_rc", "sp", [-1, 6]], ["tile_ry", "sp", [-1, 3]], ["tile_rx", "sp", [-1, 1]], ["auto_unroll_max_step", "ot", 512], ["unroll_explicit", "ot", 1]]}, "result": [[0.0015560704153846153, 0.0015561713538461538, 0.001556511507692308], 0, 2.070807933807373, 1678859878.3760087], "version": 0.2, "tvm_version": "0.10.0"}
{"input": ["cuda -keys=cuda,gpu -arch=sm_75 -max_num_threads=1024 -thread_warp_size=32", "conv2d_nchw.cuda", [["TENSOR", [1, 384, 8, 8], "float32"], ["TENSOR", [384, 384, 3, 1], "float32"], [1, 1], [1, 0, 1, 0], [1, 1], "float32"], {}], "config": {"index": 583742, "code_hash": null, "entity": [["tile_f", "sp", [-1, 8, 8, 1]], ["tile_y", "sp", [-1, 1, 1, 4]], ["tile_x", "sp", [-1, 1, 1, 1]], ["tile_rc", "sp", [-1, 4]], ["tile_ry", "sp", [-1, 1]], ["tile_rx", "sp", [-1, 1]], ["auto_unroll_max_step", "ot", 0], ["unroll_explicit", "ot", 0]]}, "result": [[0.0008051857750000001, 0.00080519165, 0.00080523262], 0, 1.9316136837005615, 1678859879.6671696], "version": 0.2, "tvm_version": "0.10.0"}
{"input": ["cuda -keys=cuda,gpu -arch=sm_75 -max_num_threads=1024 -thread_warp_size=32", "conv2d_nchw.cuda", [["TENSOR", [1, 384, 8, 8], "float32"], ["TENSOR", [384, 384, 3, 1], "float32"], [1, 1], [1, 0, 1, 0], [1, 1], "float32"], {}], "config": {"index": 28886473, "code_hash": null, "entity": [["tile_f", "sp", [-1, 1, 16, 1]], ["tile_y", "sp", [-1, 1, 1, 1]], ["tile_x", "sp", [-1, 1, 8, 1]], ["tile_rc", "sp", [-1, 12]], ["tile_ry", "sp", [-1, 3]], ["tile_rx", "sp", [-1, 1]], ["auto_unroll_max_step", "ot", 512], ["unroll_explicit", "ot", 1]]}, "result": [[0.00021308347152317877, 0.00021309877086092712, 0.00021310503576158944], 0, 1.8719172477722168, 1678859880.9174225], "version": 0.2, "tvm_version": "0.10.0"}
{"input": ["cuda -keys=cuda,gpu -arch=sm_75 -max_num_threads=1024 -thread_warp_size=32", "conv2d_nchw.cuda", [["TENSOR", [1, 384, 8, 8], "float32"], ["TENSOR", [384, 384, 3, 1], "float32"], [1, 1], [1, 0, 1, 0], [1, 1], "float32"], {}], "config": {"index": 35005959, "code_hash": null, "entity": [["tile_f", "sp", [-1, 2, 4, 1]], ["tile_y", "sp", [-1, 1, 8, 1]], ["tile_x", "sp", [-1, 4, 2, 1]], ["tile_rc", "sp", [-1, 12]], ["tile_ry", "sp", [-1, 3]], ["tile_rx", "sp", [-1, 1]], ["auto_unroll_max_step", "ot", 1500], ["unroll_explicit", "ot", 1]]}, "result": [[0.0001174601430667645, 0.00011746474394717533, 0.00011746474394717533], 0, 2.2466325759887695, 1678859882.197133], "version": 0.2, "tvm_version": "0.10.0"}
{"input": ["cuda -keys=cuda,gpu -arch=sm_75 -max_num_threads=1024 -thread_warp_size=32", "conv2d_nchw.cuda", [["TENSOR", [1, 384, 8, 8], "float32"], ["TENSOR", [384, 384, 3, 1], "float32"], [1, 1], [1, 0, 1, 0], [1, 1], "float32"], {}], "config": {"index": 19383136, "code_hash": null, "entity": [["tile_f", "sp", [-1, 1, 4, 4]], ["tile_y", "sp", [-1, 2, 1, 1]], ["tile_x", "sp", [-1, 1, 1, 8]], ["tile_rc", "sp", [-1, 6]], ["tile_ry", "sp", [-1, 1]], ["tile_rx", "sp", [-1, 1]], ["auto_unroll_max_step", "ot", 0], ["unroll_explicit", "ot", 1]]}, "result": [[0.00038915833018867926, 0.00038921488050314466, 0.0004133864559748428], 0, 1.8704490661621094, 1678859885.4433532], "version": 0.2, "tvm_version": "0.10.0"}
{"input": ["cuda -keys=cuda,gpu -arch=sm_75 -max_num_threads=1024 -thread_warp_size=32", "conv2d_nchw.cuda", [["TENSOR", [1, 384, 8, 8], "float32"], ["TENSOR", [384, 384, 3, 1], "float32"], [1, 1], [1, 0, 1, 0], [1, 1], "float32"], {}], "config": {"index": 25878309, "code_hash": null, "entity": [["tile_f", "sp", [-1, 4, 12, 1]], ["tile_y", "sp", [-1, 1, 2, 2]], ["tile_x", "sp", [-1, 1, 4, 2]], ["tile_rc", "sp", [-1, 12]], ["tile_ry", "sp", [-1, 1]], ["tile_rx", "sp", [-1, 1]], ["auto_unroll_max_step", "ot", 512], ["unroll_explicit", "ot", 1]]}, "result": [[0.00012485289018691588, 0.00012485592056074766, 0.0001249736059190031], 0, 2.092191219329834, 1678859886.7362373], "version": 0.2, "tvm_version": "0.10.0"}
{"input": ["cuda -keys=cuda,gpu -arch=sm_75 -max_num_threads=1024 -thread_warp_size=32", "conv2d_nchw.cuda", [["TENSOR", [1, 384, 8, 8], "float32"], ["TENSOR", [384, 384, 3, 1], "float32"], [1, 1], [1, 0, 1, 0], [1, 1], "float32"], {}], "config": {"index": 28794016, "code_hash": null, "entity": [["tile_f", "sp", [-1, 1, 4, 4]], ["tile_y", "sp", [-1, 1, 4, 1]], ["tile_x", "sp", [-1, 1, 1, 8]], ["tile_rc", "sp", [-1, 8]], ["tile_ry", "sp", [-1, 3]], ["tile_rx", "sp", [-1, 1]], ["auto_unroll_max_step", "ot", 512], ["unroll_explicit", "ot", 1]]}, "result": [[0.00022703135211267605, 0.00022704244225352113, 0.0002270489323943662], 0, 2.0418968200683594, 1678859887.9779913], "version": 0.2, "tvm_version": "0.10.0"}
{"input": ["cuda -keys=cuda,gpu -arch=sm_75 -max_num_threads=1024 -thread_warp_size=32", "conv2d_nchw.cuda", [["TENSOR", [1, 384, 8, 8], "float32"], ["TENSOR", [384, 384, 3, 1], "float32"], [1, 1], [1, 0, 1, 0], [1, 1], "float32"], {}], "config": {"index": 7357989, "code_hash": null, "entity": [["tile_f", "sp", [-1, 4, 12, 1]], ["tile_y", "sp", [-1, 1, 8, 1]], ["tile_x", "sp", [-1, 4, 2, 1]], ["tile_rc", "sp", [-1, 12]], ["tile_ry", "sp", [-1, 1]], ["tile_rx", "sp", [-1, 1]], ["auto_unroll_max_step", "ot", 512], ["unroll_explicit", "ot", 0]]}, "result": [[0.00012416310956790122, 0.0001241708449074074, 0.00012417179861111112], 0, 1.9553163051605225, 1678859889.2736378], "version": 0.2, "tvm_version": "0.10.0"}
{"input": ["cuda -keys=cuda,gpu -arch=sm_75 -max_num_threads=1024 -thread_warp_size=32", "conv2d_nchw.cuda", [["TENSOR", [1, 384, 8, 8], "float32"], ["TENSOR", [384, 384, 3, 1], "float32"], [1, 1], [1, 0, 1, 0], [1, 1], "float32"], {}], "config": {"index": 24839520, "code_hash": null, "entity": [["tile_f", "sp", [-1, 1, 1, 1]], ["tile_y", "sp", [-1, 1, 8, 1]], ["tile_x", "sp", [-1, 1, 4, 1]], ["tile_rc", "sp", [-1, 2]], ["tile_ry", "sp", [-1, 1]], ["tile_rx", "sp", [-1, 1]], ["auto_unroll_max_step", "ot", 512], ["unroll_explicit", "ot", 1]]}, "result": [[0.0008099315967741935, 0.0008100707096774195, 0.0008103078387096775], 0, 1.4402437210083008, 1678859890.1646705], "version": 0.2, "tvm_version": "0.10.0"}
{"input": ["cuda -keys=cuda,gpu -arch=sm_75 -max_num_threads=1024 -thread_warp_size=32", "conv2d_nchw.cuda", [["TENSOR", [1, 384, 8, 8], "float32"], ["TENSOR", [384, 384, 3, 1], "float32"], [1, 1], [1, 0, 1, 0], [1, 1], "float32"], {}], "config": {"index": 25874556, "code_hash": null, "entity": [["tile_f", "sp", [-1, 32, 6, 2]], ["tile_y", "sp", [-1, 2, 2, 1]], ["tile_x", "sp", [-1, 1, 4, 2]], ["tile_rc", "sp", [-1, 12]], ["tile_ry", "sp", [-1, 1]], ["tile_rx", "sp", [-1, 1]], ["auto_unroll_max_step", "ot", 512], ["unroll_explicit", "ot", 1]]}, "result": [[0.001191373369047619, 0.0011913927142857144, 0.0011914449404761905], 0, 2.3947930335998535, 1678859891.0553994], "version": 0.2, "tvm_version": "0.10.0"}
{"input": ["cuda -keys=cuda,gpu -arch=sm_75 -max_num_threads=1024 -thread_warp_size=32", "conv2d_nchw.cuda", [["TENSOR", [1, 384, 8, 8], "float32"], ["TENSOR", [384, 384, 3, 1], "float32"], [1, 1], [1, 0, 1, 0], [1, 1], "float32"], {}], "config": {"index": 32509207, "code_hash": null, "entity": [["tile_f", "sp", [-1, 16, 2, 4]], ["tile_y", "sp", [-1, 1, 4, 1]], ["tile_x", "sp", [-1, 4, 2, 1]], ["tile_rc", "sp", [-1, 32]], ["tile_ry", "sp", [-1, 1]], ["tile_rx", "sp", [-1, 1]], ["auto_unroll_max_step", "ot", 1500], ["unroll_explicit", "ot", 1]]}, "result": [[0.0008880580796460176, 0.0008881432831858408, 0.0008893020707964602], 0, 2.8662824630737305, 1678859891.895834], "version": 0.2, "tvm_version": "0.10.0"}
{"input": ["cuda -keys=cuda,gpu -arch=sm_75 -max_num_threads=1024 -thread_warp_size=32", "conv2d_nchw.cuda", [["TENSOR", [1, 384, 8, 8], "float32"], ["TENSOR", [384, 384, 3, 1], "float32"], [1, 1], [1, 0, 1, 0], [1, 1], "float32"], {}], "config": {"index": 25874684, "code_hash": null, "entity": [["tile_f", "sp", [-1, 2, 24, 4]], ["tile_y", "sp", [-1, 2, 2, 1]], ["tile_x", "sp", [-1, 1, 4, 2]], ["tile_rc", "sp", [-1, 12]], ["tile_ry", "sp", [-1, 1]], ["tile_rx", "sp", [-1, 1]], ["auto_unroll_max_step", "ot", 512], ["unroll_explicit", "ot", 1]]}, "result": [[0.00022070504514363885, 0.0002207190095759234, 0.0002207785417236662], 0, 2.2287347316741943, 1678859893.134702], "version": 0.2, "tvm_version": "0.10.0"}
{"input": ["cuda -keys=cuda,gpu -arch=sm_75 -max_num_threads=1024 -thread_warp_size=32", "conv2d_nchw.cuda", [["TENSOR", [1, 384, 8, 8], "float32"], ["TENSOR", [384, 384, 3, 1], "float32"], [1, 1], [1, 0, 1, 0], [1, 1], "float32"], {}], "config": {"index": 1405959, "code_hash": null, "entity": [["tile_f", "sp", [-1, 2, 4, 1]], ["tile_y", "sp", [-1, 1, 8, 1]], ["tile_x", "sp", [-1, 4, 2, 1]], ["tile_rc", "sp", [-1, 16]], ["tile_ry", "sp", [-1, 1]], ["tile_rx", "sp", [-1, 1]], ["auto_unroll_max_step", "ot", 0], ["unroll_explicit", "ot", 0]]}, "result": [[0.0003832620142857143, 0.0003832738238095238, 0.0003832777833333333], 0, 1.9094247817993164, 1678859894.4030597], "version": 0.2, "tvm_version": "0.10.0"}
{"input": ["cuda -keys=cuda,gpu -arch=sm_75 -max_num_threads=1024 -thread_warp_size=32", "conv2d_nchw.cuda", [["TENSOR", [1, 384, 8, 8], "float32"], ["TENSOR", [384, 384, 3, 1], "float32"], [1, 1], [1, 0, 1, 0], [1, 1], "float32"], {}], "config": {"index": 839520, "code_hash": null, "entity": [["tile_f", "sp", [-1, 1, 1, 1]], ["tile_y", "sp", [-1, 1, 8, 1]], ["tile_x", "sp", [-1, 1, 4, 1]], ["tile_rc", "sp", [-1, 6]], ["tile_ry", "sp", [-1, 1]], ["tile_rx", "sp", [-1, 1]], ["auto_unroll_max_step", "ot", 0], ["unroll_explicit", "ot", 0]]}, "result": [[0.0007880939842519686, 0.000788205842519685, 0.0007884152598425197], 0, 1.4310097694396973, 1678859895.2765336], "version": 0.2, "tvm_version": "0.10.0"}
{"input": ["cuda -keys=cuda,gpu -arch=sm_75 -max_num_threads=1024 -thread_warp_size=32", "conv2d_nchw.cuda", [["TENSOR", [1, 384, 8, 8], "float32"], ["TENSOR", [384, 384, 3, 1], "float32"], [1, 1], [1, 0, 1, 0], [1, 1], "float32"], {}], "config": {"index": 25490469, "code_hash": null, "entity": [["tile_f", "sp", [-1, 4, 12, 1]], ["tile_y", "sp", [-1, 2, 2, 1]], ["tile_x", "sp", [-1, 1, 4, 2]], ["tile_rc", "sp", [-1, 6]], ["tile_ry", "sp", [-1, 1]], ["tile_rx", "sp", [-1, 1]], ["auto_unroll_max_step", "ot", 512], ["unroll_explicit", "ot", 1]]}, "result": [[0.00011481730851825339, 0.00011482580601288477, 0.00011483846528274875], 0, 2.0633552074432373, 1678859896.5419111], "version": 0.2, "tvm_version": "0.10.0"}
{"input": ["cuda -keys=cuda,gpu -arch=sm_75 -max_num_threads=1024 -thread_warp_size=32", "conv2d_nchw.cuda", [["TENSOR", [1, 384, 8, 8], "float32"], ["TENSOR", [384, 384, 3, 1], "float32"], [1, 1], [1, 0, 1, 0], [1, 1], "float32"], {}], "config": {"index": 25777536, "code_hash": null, "entity": [["tile_f", "sp", [-1, 1, 64, 1]], ["tile_y", "sp", [-1, 8, 1, 1]], ["tile_x", "sp", [-1, 2, 2, 1]], ["tile_rc", "sp", [-1, 12]], ["tile_ry", "sp", [-1, 1]], ["tile_rx", "sp", [-1, 1]], ["auto_unroll_max_step", "ot", 512], ["unroll_explicit", "ot", 1]]}, "result": [[0.00015713029330708658, 0.00015713178051181105, 0.0001571354596456693], 0, 2.084949016571045, 1678859897.8007188], "version": 0.2, "tvm_version": "0.10.0"}
{"input": ["cuda -keys=cuda,gpu -arch=sm_75 -max_num_threads=1024 -thread_warp_size=32", "conv2d_nchw.cuda", [["TENSOR", [1, 384, 8, 8], "float32"], ["TENSOR", [384, 384, 3, 1], "float32"], [1, 1], [1, 0, 1, 0], [1, 1], "float32"], {}], "config": {"index": 13501959, "code_hash": null, "entity": [["tile_f", "sp", [-1, 2, 4, 1]], ["tile_y", "sp", [-1, 1, 8, 1]], ["tile_x", "sp", [-1, 4, 2, 1]], ["tile_rc", "sp", [-1, 12]], ["tile_ry", "sp", [-1, 1]], ["tile_rx", "sp", [-1, 1]], ["auto_unroll_max_step", "ot", 1500], ["unroll_explicit", "ot", 0]]}, "result": [[0.00019138365047393363, 0.00019138562085308056, 0.00019138609123222752], 0, 1.9544503688812256, 1678859899.0306878], "version": 0.2, "tvm_version": "0.10.0"}
{"input": ["cuda -keys=cuda,gpu -arch=sm_75 -max_num_threads=1024 -thread_warp_size=32", "conv2d_nchw.cuda", [["TENSOR", [1, 384, 8, 8], "float32"], ["TENSOR", [384, 384, 3, 1], "float32"], [1, 1], [1, 0, 1, 0], [1, 1], "float32"], {}], "config": {"index": 28905635, "code_hash": null, "entity": [["tile_f", "sp", [-1, 32, 3, 1]], ["tile_y", "sp", [-1, 1, 1, 1]], ["tile_x", "sp", [-1, 2, 1, 2]], ["tile_rc", "sp", [-1, 12]], ["tile_ry", "sp", [-1, 3]], ["tile_rx", "sp", [-1, 1]], ["auto_unroll_max_step", "ot", 512], ["unroll_explicit", "ot", 1]]}, "result": [[0.002737567162162162, 0.002737980594594595, 0.00273835072972973], 0, 2.10762882232666, 1678859899.9313214], "version": 0.2, "tvm_version": "0.10.0"}
{"input": ["cuda -keys=cuda,gpu -arch=sm_75 -max_num_threads=1024 -thread_warp_size=32", "conv2d_nchw.cuda", [["TENSOR", [1, 384, 8, 8], "float32"], ["TENSOR", [384, 384, 3, 1], "float32"], [1, 1], [1, 0, 1, 0], [1, 1], "float32"], {}], "config": {"index": 26442016, "code_hash": null, "entity": [["tile_f", "sp", [-1, 1, 4, 4]], ["tile_y", "sp", [-1, 1, 4, 1]], ["tile_x", "sp", [-1, 2, 2, 2]], ["tile_rc", "sp", [-1, 32]], ["tile_ry", "sp", [-1, 1]], ["tile_rx", "sp", [-1, 1]], ["auto_unroll_max_step", "ot", 512], ["unroll_explicit", "ot", 1]]}, "result": [[0.0002457817503828484, 0.0002457980367534456, 0.0002457981301684533], 0, 2.4935898780822754, 1678859901.1880643], "version": 0.2, "tvm_version": "0.10.0"}
{"input": ["cuda -keys=cuda,gpu -arch=sm_75 -max_num_threads=1024 -thread_warp_size=32", "conv2d_nchw.cuda", [["TENSOR", [1, 384, 8, 8], "float32"], ["TENSOR", [384, 384, 3, 1], "float32"], [1, 1], [1, 0, 1, 0], [1, 1], "float32"], {}], "config": {"index": 330771, "code_hash": null, "entity": [["tile_f", "sp", [-1, 2, 6, 1]], ["tile_y", "sp", [-1, 1, 8, 1]], ["tile_x", "sp", [-1, 2, 2, 2]], ["tile_rc", "sp", [-1, 2]], ["tile_ry", "sp", [-1, 1]], ["tile_rx", "sp", [-1, 1]], ["auto_unroll_max_step", "ot", 0], ["unroll_explicit", "ot", 0]]}, "result": [[0.0002556741583166333, 0.0002556926893787575, 0.00025617910621242486], 0, 1.6778626441955566, 1678859904.582953], "version": 0.2, "tvm_version": "0.10.0"}
{"input": ["cuda -keys=cuda,gpu -arch=sm_75 -max_num_threads=1024 -thread_warp_size=32", "conv2d_nchw.cuda", [["TENSOR", [1, 384, 8, 8], "float32"], ["TENSOR", [384, 384, 3, 1], "float32"], [1, 1], [1, 0, 1, 0], [1, 1], "float32"], {}], "config": {"index": 16198816, "code_hash": null, "entity": [["tile_f", "sp", [-1, 1, 4, 4]], ["tile_y", "sp", [-1, 1, 4, 1]], ["tile_x", "sp", [-1, 1, 4, 1]], ["tile_rc", "sp", [-1, 6]], ["tile_ry", "sp", [-1, 3]], ["tile_rx", "sp", [-1, 1]], ["auto_unroll_max_step", "ot", 1500], ["unroll_explicit", "ot", 0]]}, "result": [[0.0001377361422413793, 0.00013774039137931035, 0.00013780201810344826], 0, 1.8453707695007324, 1678859905.839403], "version": 0.2, "tvm_version": "0.10.0"}
{"input": ["cuda -keys=cuda,gpu -arch=sm_75 -max_num_threads=1024 -thread_warp_size=32", "conv2d_nchw.cuda", [["TENSOR", [1, 384, 8, 8], "float32"], ["TENSOR", [384, 384, 3, 1], "float32"], [1, 1], [1, 0, 1, 0], [1, 1], "float32"], {}], "config": {"index": 1144615, "code_hash": null, "entity": [["tile_f", "sp", [-1, 16, 1, 6]], ["tile_y", "sp", [-1, 1, 2, 1]], ["tile_x", "sp", [-1, 1, 1, 8]], ["tile_rc", "sp", [-1, 8]], ["tile_ry", "sp", [-1, 1]], ["tile_rx", "sp", [-1, 1]], ["auto_unroll_max_step", "ot", 0], ["unroll_explicit", "ot", 0]]}, "result": [[0.009997203812500001, 0.009997263875, 0.0099974479375], 0, 2.5556740760803223, 1678859907.109121], "version": 0.2, "tvm_version": "0.10.0"}
{"input": ["cuda -keys=cuda,gpu -arch=sm_75 -max_num_threads=1024 -thread_warp_size=32", "conv2d_nchw.cuda", [["TENSOR", [1, 384, 8, 8], "float32"], ["TENSOR", [384, 384, 3, 1], "float32"], [1, 1], [1, 0, 1, 0], [1, 1], "float32"], {}], "config": {"index": 1211082, "code_hash": null, "entity": [["tile_f", "sp", [-1, 6, 4, 1]], ["tile_y", "sp", [-1, 8, 1, 1]], ["tile_x", "sp", [-1, 4, 2, 1]], ["tile_rc", "sp", [-1, 12]], ["tile_ry", "sp", [-1, 1]], ["tile_rx", "sp", [-1, 1]], ["auto_unroll_max_step", "ot", 0], ["unroll_explicit", "ot", 0]]}, "result": [[0.0006841647245762712, 0.0006843211906779661, 0.0006844416440677968], 0, 2.1634681224823, 1678859908.306697], "version": 0.2, "tvm_version": "0.10.0"}
{"input": ["cuda -keys=cuda,gpu -arch=sm_75 -max_num_threads=1024 -thread_warp_size=32", "conv2d_nchw.cuda", [["TENSOR", [1, 384, 8, 8], "float32"], ["TENSOR", [384, 384, 3, 1], "float32"], [1, 1], [1, 0, 1, 0], [1, 1], "float32"], {}], "config": {"index": 25730469, "code_hash": null, "entity": [["tile_f", "sp", [-1, 4, 12, 1]], ["tile_y", "sp", [-1, 2, 2, 1]], ["tile_x", "sp", [-1, 1, 1, 1]], ["tile_rc", "sp", [-1, 12]], ["tile_ry", "sp", [-1, 1]], ["tile_rx", "sp", [-1, 1]], ["auto_unroll_max_step", "ot", 512], ["unroll_explicit", "ot", 1]]}, "result": [[0.0007214470403587444, 0.0007214853587443946, 0.0007215333946188341], 0, 2.1745166778564453, 1678859909.5993652], "version": 0.2, "tvm_version": "0.10.0"}
{"input": ["cuda -keys=cuda,gpu -arch=sm_75 -max_num_threads=1024 -thread_warp_size=32", "conv2d_nchw.cuda", [["TENSOR", [1, 384, 8, 8], "float32"], ["TENSOR", [384, 384, 3, 1], "float32"], [1, 1], [1, 0, 1, 0], [1, 1], "float32"], {}], "config": {"index": 25865822, "code_hash": null, "entity": [["tile_f", "sp", [-1, 8, 8, 1]], ["tile_y", "sp", [-1, 1, 4, 1]], ["tile_x", "sp", [-1, 2, 2, 2]], ["tile_rc", "sp", [-1, 12]], ["tile_ry", "sp", [-1, 1]], ["tile_rx", "sp", [-1, 1]], ["auto_unroll_max_step", "ot", 512], ["unroll_explicit", "ot", 1]]}, "result": [[0.00013468743145500422, 0.0001346991993271657, 0.0001347682809083263], 0, 2.50622820854187, 1678859910.884929], "version": 0.2, "tvm_version": "0.10.0"}
{"input": ["cuda -keys=cuda,gpu -arch=sm_75 -max_num_threads=1024 -thread_warp_size=32", "conv2d_nchw.cuda", [["TENSOR", [1, 384, 8, 8], "float32"], ["TENSOR", [384, 384, 3, 1], "float32"], [1, 1], [1, 0, 1, 0], [1, 1], "float32"], {}], "config": {"index": 31866016, "code_hash": null, "entity": [["tile_f", "sp", [-1, 1, 4, 4]], ["tile_y", "sp", [-1, 1, 4, 1]], ["tile_x", "sp", [-1, 1, 1, 8]], ["tile_rc", "sp", [-1, 8]], ["tile_ry", "sp", [-1, 1]], ["tile_rx", "sp", [-1, 1]], ["auto_unroll_max_step", "ot", 1500], ["unroll_explicit", "ot", 1]]}, "result": [[0.00020996732105263156, 0.00021001014605263155, 0.00021001149210526316], 0, 2.5871763229370117, 1678859912.1049151], "version": 0.2, "tvm_version": "0.10.0"}
{"input": ["cuda -keys=cuda,gpu -arch=sm_75 -max_num_threads=1024 -thread_warp_size=32", "conv2d_nchw.cuda", [["TENSOR", [1, 384, 8, 8], "float32"], ["TENSOR", [384, 384, 3, 1], "float32"], [1, 1], [1, 0, 1, 0], [1, 1], "float32"], {}], "config": {"index": 7846242, "code_hash": null, "entity": [["tile_f", "sp", [-1, 8, 8, 2]], ["tile_y", "sp", [-1, 4, 2, 1]], ["tile_x", "sp", [-1, 2, 1, 4]], ["tile_rc", "sp", [-1, 24]], ["tile_ry", "sp", [-1, 1]], ["tile_rx", "sp", [-1, 1]], ["auto_unroll_max_step", "ot", 512], ["unroll_explicit", "ot", 0]]}, "result": [[0.005762222277777777, 0.005763998222222223, 0.005764506833333333], 0, 2.752809762954712, 1678859913.024069], "version": 0.2, "tvm_version": "0.10.0"}
{"input": ["cuda -keys=cuda,gpu -arch=sm_75 -max_num_threads=1024 -thread_warp_size=32", "conv2d_nchw.cuda", [["TENSOR", [1, 384, 8, 8], "float32"], ["TENSOR", [384, 384, 3, 1], "float32"], [1, 1], [1, 0, 1, 0], [1, 1], "float32"], {}], "config": {"index": 1099159, "code_hash": null, "entity": [["tile_f", "sp", [-1, 6, 2, 32]], ["tile_y", "sp", [-1, 1, 8, 1]], ["tile_x", "sp", [-1, 2, 2, 2]], ["tile_rc", "sp", [-1, 8]], ["tile_ry", "sp", [-1, 1]], ["tile_rx", "sp", [-1, 1]], ["auto_unroll_max_step", "ot", 0], ["unroll_explicit", "ot", 0]]}, "result": [[0.008834581333333334, 0.008835074666666666, 0.008836135833333333], 0, 2.09139084815979, 1678859913.965502], "version": 0.2, "tvm_version": "0.10.0"}
{"input": ["cuda -keys=cuda,gpu -arch=sm_75 -max_num_threads=1024 -thread_warp_size=32", "conv2d_nchw.cuda", [["TENSOR", [1, 384, 8, 8], "float32"], ["TENSOR", [384, 384, 3, 1], "float32"], [1, 1], [1, 0, 1, 0], [1, 1], "float32"], {}], "config": {"index": 25836226, "code_hash": null, "entity": [["tile_f", "sp", [-1, 2, 64, 3]], ["tile_y", "sp", [-1, 2, 2, 1]], ["tile_x", "sp", [-1, 2, 1, 2]], ["tile_rc", "sp", [-1, 12]], ["tile_ry", "sp", [-1, 1]], ["tile_rx", "sp", [-1, 1]], ["auto_unroll_max_step", "ot", 512], ["unroll_explicit", "ot", 1]]}, "result": [[0.0004894603073170732, 0.0004894957365853658, 0.000489507756097561], 0, 1.5493645668029785, 1678859914.817756], "version": 0.2, "tvm_version": "0.10.0"}
{"input": ["cuda -keys=cuda,gpu -arch=sm_75 -max_num_threads=1024 -thread_warp_size=32", "conv2d_nchw.cuda", [["TENSOR", [1, 384, 8, 8], "float32"], ["TENSOR", [384, 384, 3, 1], "float32"], [1, 1], [1, 0, 1, 0], [1, 1], "float32"], {}], "config": {"index": 35571250, "code_hash": null, "entity": [["tile_f", "sp", [-1, 1, 2, 12]], ["tile_y", "sp", [-1, 4, 2, 1]], ["tile_x", "sp", [-1, 2, 2, 1]], ["tile_rc", "sp", [-1, 32]], ["tile_ry", "sp", [-1, 3]], ["tile_rx", "sp", [-1, 1]], ["auto_unroll_max_step", "ot", 1500], ["unroll_explicit", "ot", 1]]}, "result": [[0.0002752345873287671, 0.0002752489315068493, 0.00027525611643835617], 0, 3.3973193168640137, 1678859916.0850408], "version": 0.2, "tvm_version": "0.10.0"}
{"input": ["cuda -keys=cuda,gpu -arch=sm_75 -max_num_threads=1024 -thread_warp_size=32", "conv2d_nchw.cuda", [["TENSOR", [1, 384, 8, 8], "float32"], ["TENSOR", [384, 384, 3, 1], "float32"], [1, 1], [1, 0, 1, 0], [1, 1], "float32"], {}], "config": {"index": 28893651, "code_hash": null, "entity": [["tile_f", "sp", [-1, 2, 6, 1]], ["tile_y", "sp", [-1, 1, 4, 2]], ["tile_x", "sp", [-1, 1, 8, 1]], ["tile_rc", "sp", [-1, 12]], ["tile_ry", "sp", [-1, 3]], ["tile_rx", "sp", [-1, 1]], ["auto_unroll_max_step", "ot", 512], ["unroll_explicit", "ot", 1]]}, "result": [[9.634378226779252e-05, 9.634646019300363e-05, 9.635709891435465e-05], 0, 1.9899532794952393, 1678859917.33083], "version": 0.2, "tvm_version": "0.10.0"}
{"input": ["cuda -keys=cuda,gpu -arch=sm_75 -max_num_threads=1024 -thread_warp_size=32", "conv2d_nchw.cuda", [["TENSOR", [1, 384, 8, 8], "float32"], ["TENSOR", [384, 384, 3, 1], "float32"], [1, 1], [1, 0, 1, 0], [1, 1], "float32"], {}], "config": {"index": 11004850, "code_hash": null, "entity": [["tile_f", "sp", [-1, 1, 2, 12]], ["tile_y", "sp", [-1, 4, 2, 1]], ["tile_x", "sp", [-1, 4, 2, 1]], ["tile_rc", "sp", [-1, 32]], ["tile_ry", "sp", [-1, 3]], ["tile_rx", "sp", [-1, 1]], ["auto_unroll_max_step", "ot", 512], ["unroll_explicit", "ot", 0]]}, "result": [[0.0003746122546728972, 0.00037465646261682247, 0.00037465728271028034], 0, 3.1409904956817627, 1678859918.5908623], "version": 0.2, "tvm_version": "0.10.0"}
