src/tvm/results/cuda_gtx1650/inception_v3/ga/cpu.log_layer_40.log
{"input": ["cuda -keys=cuda,gpu -arch=sm_75 -max_num_threads=1024 -thread_warp_size=32", "conv2d_nchw.cuda", [["TENSOR", [1, 384, 8, 8], "float32"], ["TENSOR", [384, 384, 1, 3], "float32"], [1, 1], [0, 1, 0, 1], [1, 1], "float32"], {}], "config": {"index": 9363236, "code_hash": null, "entity": [["tile_f", "sp", [-1, 1, 12, 8]], ["tile_y", "sp", [-1, 4, 2, 1]], ["tile_x", "sp", [-1, 1, 4, 2]], ["tile_rc", "sp", [-1, 1]], ["tile_ry", "sp", [-1, 1]], ["tile_rx", "sp", [-1, 3]], ["auto_unroll_max_step", "ot", 512], ["unroll_explicit", "ot", 0]]}, "result": [[0.0003477272654155496, 0.0003478589490616622, 0.00034832996782841824], 0, 1.5272812843322754, 1678859574.0453491], "version": 0.2, "tvm_version": "0.10.0"}
{"input": ["cuda -keys=cuda,gpu -arch=sm_75 -max_num_threads=1024 -thread_warp_size=32", "conv2d_nchw.cuda", [["TENSOR", [1, 384, 8, 8], "float32"], ["TENSOR", [384, 384, 1, 3], "float32"], [1, 1], [0, 1, 0, 1], [1, 1], "float32"], {}], "config": {"index": 2280554, "code_hash": null, "entity": [["tile_f", "sp", [-1, 2, 16, 1]], ["tile_y", "sp", [-1, 2, 1, 2]], ["tile_x", "sp", [-1, 2, 1, 4]], ["tile_rc", "sp", [-1, 64]], ["tile_ry", "sp", [-1, 1]], ["tile_rx", "sp", [-1, 1]], ["auto_unroll_max_step", "ot", 0], ["unroll_explicit", "ot", 0]]}, "result": [[0.00040900490609137053, 0.00040902187055837563, 0.00040905420812182745], 0, 1.6693549156188965, 1678859575.2725372], "version": 0.2, "tvm_version": "0.10.0"}
{"input": ["cuda -keys=cuda,gpu -arch=sm_75 -max_num_threads=1024 -thread_warp_size=32", "conv2d_nchw.cuda", [["TENSOR", [1, 384, 8, 8], "float32"], ["TENSOR", [384, 384, 1, 3], "float32"], [1, 1], [0, 1, 0, 1], [1, 1], "float32"], {}], "config": {"index": 3451551, "code_hash": null, "entity": [["tile_f", "sp", [-1, 8, 6, 8]], ["tile_y", "sp", [-1, 1, 1, 2]], ["tile_x", "sp", [-1, 1, 1, 8]], ["tile_rc", "sp", [-1, 2]], ["tile_ry", "sp", [-1, 1]], ["tile_rx", "sp", [-1, 3]], ["auto_unroll_max_step", "ot", 0], ["unroll_explicit", "ot", 0]]}, "result": [[0.00794831023076923, 0.007948603076923076, 0.007948760384615384], 0, 1.9403786659240723, 1678859576.1771472], "version": 0.2, "tvm_version": "0.10.0"}
{"input": ["cuda -keys=cuda,gpu -arch=sm_75 -max_num_threads=1024 -thread_warp_size=32", "conv2d_nchw.cuda", [["TENSOR", [1, 384, 8, 8], "float32"], ["TENSOR", [384, 384, 1, 3], "float32"], [1, 1], [0, 1, 0, 1], [1, 1], "float32"], {}], "config": {"index": 34062936, "code_hash": null, "entity": [["tile_f", "sp", [-1, 8, 8, 3]], ["tile_y", "sp", [-1, 1, 2, 1]], ["tile_x", "sp", [-1, 2, 4, 1]], ["tile_rc", "sp", [-1, 2]], ["tile_ry", "sp", [-1, 1]], ["tile_rx", "sp", [-1, 3]], ["auto_unroll_max_step", "ot", 1500], ["unroll_explicit", "ot", 1]]}, "result": [[0.00037222547113163973, 0.0003724281362586605, 0.00037257113856812934], 0, 1.9004621505737305, 1678859577.4193277], "version": 0.2, "tvm_version": "0.10.0"}
{"input": ["cuda -keys=cuda,gpu -arch=sm_75 -max_num_threads=1024 -thread_warp_size=32", "conv2d_nchw.cuda", [["TENSOR", [1, 384, 8, 8], "float32"], ["TENSOR", [384, 384, 1, 3], "float32"], [1, 1], [0, 1, 0, 1], [1, 1], "float32"], {}], "config": {"index": 32362023, "code_hash": null, "entity": [["tile_f", "sp", [-1, 8, 2, 24]], ["tile_y", "sp", [-1, 1, 1, 1]], ["tile_x", "sp", [-1, 2, 1, 2]], ["tile_rc", "sp", [-1, 24]], ["tile_ry", "sp", [-1, 1]], ["tile_rx", "sp", [-1, 1]], ["auto_unroll_max_step", "ot", 1500], ["unroll_explicit", "ot", 1]]}, "result": [[0.034056874333333334, 0.034280085, 0.034280789666666665], 0, 4.822139501571655, 1678859578.3976922], "version": 0.2, "tvm_version": "0.10.0"}
{"input": ["cuda -keys=cuda,gpu -arch=sm_75 -max_num_threads=1024 -thread_warp_size=32", "conv2d_nchw.cuda", [["TENSOR", [1, 384, 8, 8], "float32"], ["TENSOR", [384, 384, 1, 3], "float32"], [1, 1], [0, 1, 0, 1], [1, 1], "float32"], {}], "config": {"index": 12492447, "code_hash": null, "entity": [["tile_f", "sp", [-1, 1, 12, 32]], ["tile_y", "sp", [-1, 2, 2, 1]], ["tile_x", "sp", [-1, 2, 1, 1]], ["tile_rc", "sp", [-1, 2]], ["tile_ry", "sp", [-1, 1]], ["tile_rx", "sp", [-1, 1]], ["auto_unroll_max_step", "ot", 1500], ["unroll_explicit", "ot", 0]]}, "result": [[0.00080576515, 0.0008058152, 0.0008058367900000001], 0, 1.8450336456298828, 1678859579.6380215], "version": 0.2, "tvm_version": "0.10.0"}
{"input": ["cuda -keys=cuda,gpu -arch=sm_75 -max_num_threads=1024 -thread_warp_size=32", "conv2d_nchw.cuda", [["TENSOR", [1, 384, 8, 8], "float32"], ["TENSOR", [384, 384, 1, 3], "float32"], [1, 1], [0, 1, 0, 1], [1, 1], "float32"], {}], "config": {"index": 16430369, "code_hash": null, "entity": [["tile_f", "sp", [-1, 2, 1, 48]], ["tile_y", "sp", [-1, 1, 8, 1]], ["tile_x", "sp", [-1, 2, 1, 2]], ["tile_rc", "sp", [-1, 8]], ["tile_ry", "sp", [-1, 1]], ["tile_rx", "sp", [-1, 3]], ["auto_unroll_max_step", "ot", 1500], ["unroll_explicit", "ot", 0]]}, "result": [[0.003980287961538462, 0.003980649769230769, 0.0039807530769230765], 0, 2.551591157913208, 1678859580.5510492], "version": 0.2, "tvm_version": "0.10.0"}
{"input": ["cuda -keys=cuda,gpu -arch=sm_75 -max_num_threads=1024 -thread_warp_size=32", "conv2d_nchw.cuda", [["TENSOR", [1, 384, 8, 8], "float32"], ["TENSOR", [384, 384, 1, 3], "float32"], [1, 1], [0, 1, 0, 1], [1, 1], "float32"], {}], "config": {"index": 23678420, "code_hash": null, "entity": [["tile_f", "sp", [-1, 6, 2, 1]], ["tile_y", "sp", [-1, 1, 1, 2]], ["tile_x", "sp", [-1, 4, 2, 1]], ["tile_rc", "sp", [-1, 64]], ["tile_ry", "sp", [-1, 1]], ["tile_rx", "sp", [-1, 3]], ["auto_unroll_max_step", "ot", 0], ["unroll_explicit", "ot", 1]]}, "result": [[0.0005536003701657458, 0.0005538473370165746, 0.0005539146961325966], 0, 1.418956995010376, 1678859581.4070334], "version": 0.2, "tvm_version": "0.10.0"}
{"input": ["cuda -keys=cuda,gpu -arch=sm_75 -max_num_threads=1024 -thread_warp_size=32", "conv2d_nchw.cuda", [["TENSOR", [1, 384, 8, 8], "float32"], ["TENSOR", [384, 384, 1, 3], "float32"], [1, 1], [0, 1, 0, 1], [1, 1], "float32"], {}], "config": {"index": 20603191, "code_hash": null, "entity": [["tile_f", "sp", [-1, 1, 6, 2]], ["tile_y", "sp", [-1, 8, 1, 1]], ["tile_x", "sp", [-1, 4, 2, 1]], ["tile_rc", "sp", [-1, 64]], ["tile_ry", "sp", [-1, 1]], ["tile_rx", "sp", [-1, 1]], ["auto_unroll_max_step", "ot", 0], ["unroll_explicit", "ot", 1]]}, "result": [[0.0013377903199999997, 0.0013378282666666667, 0.00133802408], 0, 1.4153594970703125, 1678859582.2271583], "version": 0.2, "tvm_version": "0.10.0"}
{"input": ["cuda -keys=cuda,gpu -arch=sm_75 -max_num_threads=1024 -thread_warp_size=32", "conv2d_nchw.cuda", [["TENSOR", [1, 384, 8, 8], "float32"], ["TENSOR", [384, 384, 1, 3], "float32"], [1, 1], [0, 1, 0, 1], [1, 1], "float32"], {}], "config": {"index": 4205697, "code_hash": null, "entity": [["tile_f", "sp", [-1, 4, 1, 24]], ["tile_y", "sp", [-1, 2, 1, 1]], ["tile_x", "sp", [-1, 1, 2, 4]], ["tile_rc", "sp", [-1, 8]], ["tile_ry", "sp", [-1, 1]], ["tile_rx", "sp", [-1, 3]], ["auto_unroll_max_step", "ot", 0], ["unroll_explicit", "ot", 0]]}, "result": [[0.014144233, 0.01415003681818182, 0.015377892571428572], 0, 1.97798490524292, 1678859587.499989], "version": 0.2, "tvm_version": "0.10.0"}
{"input": ["cuda -keys=cuda,gpu -arch=sm_75 -max_num_threads=1024 -thread_warp_size=32", "conv2d_nchw.cuda", [["TENSOR", [1, 384, 8, 8], "float32"], ["TENSOR", [384, 384, 1, 3], "float32"], [1, 1], [0, 1, 0, 1], [1, 1], "float32"], {}], "config": {"index": 27649300, "code_hash": null, "entity": [["tile_f", "sp", [-1, 8, 3, 8]], ["tile_y", "sp", [-1, 4, 1, 1]], ["tile_x", "sp", [-1, 1, 1, 1]], ["tile_rc", "sp", [-1, 1]], ["tile_ry", "sp", [-1, 1]], ["tile_rx", "sp", [-1, 3]], ["auto_unroll_max_step", "ot", 512], ["unroll_explicit", "ot", 1]]}, "result": [[0.0028369645, 0.002837219444444444, 0.002837255027777778], 0, 2.1652050018310547, 1678859588.4013734], "version": 0.2, "tvm_version": "0.10.0"}
{"input": ["cuda -keys=cuda,gpu -arch=sm_75 -max_num_threads=1024 -thread_warp_size=32", "conv2d_nchw.cuda", [["TENSOR", [1, 384, 8, 8], "float32"], ["TENSOR", [384, 384, 1, 3], "float32"], [1, 1], [0, 1, 0, 1], [1, 1], "float32"], {}], "config": {"index": 14760145, "code_hash": null, "entity": [["tile_f", "sp", [-1, 6, 4, 2]], ["tile_y", "sp", [-1, 1, 1, 2]], ["tile_x", "sp", [-1, 2, 1, 4]], ["tile_rc", "sp", [-1, 96]], ["tile_ry", "sp", [-1, 1]], ["tile_rx", "sp", [-1, 1]], ["auto_unroll_max_step", "ot", 1500], ["unroll_explicit", "ot", 0]]}, "result": [[0.0009429072429906542, 0.0009433235046728971, 0.0009451137009345795], 0, 4.816077709197998, 1678859589.2604325], "version": 0.2, "tvm_version": "0.10.0"}
{"input": ["cuda -keys=cuda,gpu -arch=sm_75 -max_num_threads=1024 -thread_warp_size=32", "conv2d_nchw.cuda", [["TENSOR", [1, 384, 8, 8], "float32"], ["TENSOR", [384, 384, 1, 3], "float32"], [1, 1], [0, 1, 0, 1], [1, 1], "float32"], {}], "config": {"index": 5360394, "code_hash": null, "entity": [["tile_f", "sp", [-1, 12, 1, 4]], ["tile_y", "sp", [-1, 1, 4, 1]], ["tile_x", "sp", [-1, 1, 2, 4]], ["tile_rc", "sp", [-1, 64]], ["tile_ry", "sp", [-1, 1]], ["tile_rx", "sp", [-1, 3]], ["auto_unroll_max_step", "ot", 0], ["unroll_explicit", "ot", 0]]}, "result": [[0.0009609776761904761, 0.0009612022761904762, 0.0009613601619047619], 0, 1.647857904434204, 1678859590.147865], "version": 0.2, "tvm_version": "0.10.0"}
{"input": ["cuda -keys=cuda,gpu -arch=sm_75 -max_num_threads=1024 -thread_warp_size=32", "conv2d_nchw.cuda", [["TENSOR", [1, 384, 8, 8], "float32"], ["TENSOR", [384, 384, 1, 3], "float32"], [1, 1], [0, 1, 0, 1], [1, 1], "float32"], {}], "config": {"index": 14253486, "code_hash": null, "entity": [["tile_f", "sp", [-1, 4, 1, 12]], ["tile_y", "sp", [-1, 2, 2, 2]], ["tile_x", "sp", [-1, 1, 2, 1]], ["tile_rc", "sp", [-1, 48]], ["tile_ry", "sp", [-1, 1]], ["tile_rx", "sp", [-1, 1]], ["auto_unroll_max_step", "ot", 1500], ["unroll_explicit", "ot", 0]]}, "result": [[0.0005634326235955055, 0.0005635726573033707, 0.0005636150898876405], 0, 2.744518518447876, 1678859591.0359185], "version": 0.2, "tvm_version": "0.10.0"}
{"input": ["cuda -keys=cuda,gpu -arch=sm_75 -max_num_threads=1024 -thread_warp_size=32", "conv2d_nchw.cuda", [["TENSOR", [1, 384, 8, 8], "float32"], ["TENSOR", [384, 384, 1, 3], "float32"], [1, 1], [0, 1, 0, 1], [1, 1], "float32"], {}], "config": {"index": 15660072, "code_hash": null, "entity": [["tile_f", "sp", [-1, 32, 12, 1]], ["tile_y", "sp", [-1, 2, 2, 1]], ["tile_x", "sp", [-1, 2, 1, 2]], ["tile_rc", "sp", [-1, 2]], ["tile_ry", "sp", [-1, 1]], ["tile_rx", "sp", [-1, 3]], ["auto_unroll_max_step", "ot", 1500], ["unroll_explicit", "ot", 0]]}, "result": [[0.0017826929666666666, 0.0017827853666666667, 0.0017828715], 0, 2.184636116027832, 1678859592.2904937], "version": 0.2, "tvm_version": "0.10.0"}
{"input": ["cuda -keys=cuda,gpu -arch=sm_75 -max_num_threads=1024 -thread_warp_size=32", "conv2d_nchw.cuda", [["TENSOR", [1, 384, 8, 8], "float32"], ["TENSOR", [384, 384, 1, 3], "float32"], [1, 1], [0, 1, 0, 1], [1, 1], "float32"], {}], "config": {"index": 25823214, "code_hash": null, "entity": [["tile_f", "sp", [-1, 6, 16, 2]], ["tile_y", "sp", [-1, 1, 2, 4]], ["tile_x", "sp", [-1, 1, 8, 1]], ["tile_rc", "sp", [-1, 12]], ["tile_ry", "sp", [-1, 1]], ["tile_rx", "sp", [-1, 1]], ["auto_unroll_max_step", "ot", 512], ["unroll_explicit", "ot", 1]]}, "result": [[0.00038142185579196215, 0.00038150345390070917, 0.00038159983924349885], 0, 1.6900529861450195, 1678859593.5496976], "version": 0.2, "tvm_version": "0.10.0"}
{"input": ["cuda -keys=cuda,gpu -arch=sm_75 -max_num_threads=1024 -thread_warp_size=32", "conv2d_nchw.cuda", [["TENSOR", [1, 384, 8, 8], "float32"], ["TENSOR", [384, 384, 1, 3], "float32"], [1, 1], [0, 1, 0, 1], [1, 1], "float32"], {}], "config": {"index": 22839733, "code_hash": null, "entity": [["tile_f", "sp", [-1, 8, 2, 12]], ["tile_y", "sp", [-1, 4, 1, 1]], ["tile_x", "sp", [-1, 1, 1, 8]], ["tile_rc", "sp", [-1, 12]], ["tile_ry", "sp", [-1, 1]], ["tile_rx", "sp", [-1, 3]], ["auto_unroll_max_step", "ot", 0], ["unroll_explicit", "ot", 1]]}, "result": [[0.029093376, 0.0291221275, 0.0291965675], 0, 2.574566125869751, 1678859594.5927937], "version": 0.2, "tvm_version": "0.10.0"}
{"input": ["cuda -keys=cuda,gpu -arch=sm_75 -max_num_threads=1024 -thread_warp_size=32", "conv2d_nchw.cuda", [["TENSOR", [1, 384, 8, 8], "float32"], ["TENSOR", [384, 384, 1, 3], "float32"], [1, 1], [0, 1, 0, 1], [1, 1], "float32"], {}], "config": {"index": 10493345, "code_hash": null, "entity": [["tile_f", "sp", [-1, 24, 8, 1]], ["tile_y", "sp", [-1, 2, 1, 1]], ["tile_x", "sp", [-1, 1, 2, 2]], ["tile_rc", "sp", [-1, 12]], ["tile_ry", "sp", [-1, 1]], ["tile_rx", "sp", [-1, 3]], ["auto_unroll_max_step", "ot", 512], ["unroll_explicit", "ot", 0]]}, "result": [[0.0005094898401639344, 0.0005098764672131147, 0.000541863237704918], 0, 2.4393036365509033, 1678859605.1664922], "version": 0.2, "tvm_version": "0.10.0"}
{"input": ["cuda -keys=cuda,gpu -arch=sm_75 -max_num_threads=1024 -thread_warp_size=32", "conv2d_nchw.cuda", [["TENSOR", [1, 384, 8, 8], "float32"], ["TENSOR", [384, 384, 1, 3], "float32"], [1, 1], [0, 1, 0, 1], [1, 1], "float32"], {}], "config": {"index": 13131905, "code_hash": null, "entity": [["tile_f", "sp", [-1, 24, 8, 1]], ["tile_y", "sp", [-1, 1, 2, 4]], ["tile_x", "sp", [-1, 1, 4, 1]], ["tile_rc", "sp", [-1, 6]], ["tile_ry", "sp", [-1, 1]], ["tile_rx", "sp", [-1, 1]], ["auto_unroll_max_step", "ot", 1500], ["unroll_explicit", "ot", 0]]}, "result": [[0.00028561439253996446, 0.00028562642628774423, 0.0002856526341030195], 0, 2.1034116744995117, 1678859606.4105923], "version": 0.2, "tvm_version": "0.10.0"}
{"input": ["cuda -keys=cuda,gpu -arch=sm_75 -max_num_threads=1024 -thread_warp_size=32", "conv2d_nchw.cuda", [["TENSOR", [1, 384, 8, 8], "float32"], ["TENSOR", [384, 384, 1, 3], "float32"], [1, 1], [0, 1, 0, 1], [1, 1], "float32"], {}], "config": {"index": 7624210, "code_hash": null, "entity": [["tile_f", "sp", [-1, 1, 2, 12]], ["tile_y", "sp", [-1, 8, 1, 1]], ["tile_x", "sp", [-1, 2, 2, 2]], ["tile_rc", "sp", [-1, 16]], ["tile_ry", "sp", [-1, 1]], ["tile_rx", "sp", [-1, 1]], ["auto_unroll_max_step", "ot", 512], ["unroll_explicit", "ot", 0]]}, "result": [[0.004966692571428572, 0.004966789952380953, 0.004966809952380953], 0, 2.2028110027313232, 1678859607.2866225], "version": 0.2, "tvm_version": "0.10.0"}
{"input": ["cuda -keys=cuda,gpu -arch=sm_75 -max_num_threads=1024 -thread_warp_size=32", "conv2d_nchw.cuda", [["TENSOR", [1, 384, 8, 8], "float32"], ["TENSOR", [384, 384, 1, 3], "float32"], [1, 1], [0, 1, 0, 1], [1, 1], "float32"], {}], "config": {"index": 3141178, "code_hash": null, "entity": [["tile_f", "sp", [-1, 2, 8, 1]], ["tile_y", "sp", [-1, 1, 2, 1]], ["tile_x", "sp", [-1, 1, 4, 1]], ["tile_rc", "sp", [-1, 1]], ["tile_ry", "sp", [-1, 1]], ["tile_rx", "sp", [-1, 3]], ["auto_unroll_max_step", "ot", 0], ["unroll_explicit", "ot", 0]]}, "result": [[0.00031477793945312496, 0.0003147951953125, 0.000314820259765625], 0, 1.776907205581665, 1678859608.5808396], "version": 0.2, "tvm_version": "0.10.0"}
{"input": ["cuda -keys=cuda,gpu -arch=sm_75 -max_num_threads=1024 -thread_warp_size=32", "conv2d_nchw.cuda", [["TENSOR", [1, 384, 8, 8], "float32"], ["TENSOR", [384, 384, 1, 3], "float32"], [1, 1], [0, 1, 0, 1], [1, 1], "float32"], {}], "config": {"index": 24697135, "code_hash": null, "entity": [["tile_f", "sp", [-1, 12, 16, 2]], ["tile_y", "sp", [-1, 4, 1, 2]], ["tile_x", "sp", [-1, 4, 1, 2]], ["tile_rc", "sp", [-1, 1]], ["tile_ry", "sp", [-1, 1]], ["tile_rx", "sp", [-1, 1]], ["auto_unroll_max_step", "ot", 512], ["unroll_explicit", "ot", 1]]}, "result": [[0.011184035333333333, 0.011184604111111112, 0.011186381777777777], 0, 10.224880695343018, 1678859609.4617682], "version": 0.2, "tvm_version": "0.10.0"}
{"input": ["cuda -keys=cuda,gpu -arch=sm_75 -max_num_threads=1024 -thread_warp_size=32", "conv2d_nchw.cuda", [["TENSOR", [1, 384, 8, 8], "float32"], ["TENSOR", [384, 384, 1, 3], "float32"], [1, 1], [0, 1, 0, 1], [1, 1], "float32"], {}], "config": {"index": 20180402, "code_hash": null, "entity": [["tile_f", "sp", [-1, 3, 2, 4]], ["tile_y", "sp", [-1, 4, 1, 1]], ["tile_x", "sp", [-1, 4, 1, 1]], ["tile_rc", "sp", [-1, 32]], ["tile_ry", "sp", [-1, 1]], ["tile_rx", "sp", [-1, 1]], ["auto_unroll_max_step", "ot", 0], ["unroll_explicit", "ot", 1]]}, "result": [[0.0009203631834862386, 0.0009205169633027524, 0.0009206041743119265], 0, 1.530236005783081, 1678859610.329872], "version": 0.2, "tvm_version": "0.10.0"}
{"input": ["cuda -keys=cuda,gpu -arch=sm_75 -max_num_threads=1024 -thread_warp_size=32", "conv2d_nchw.cuda", [["TENSOR", [1, 384, 8, 8], "float32"], ["TENSOR", [384, 384, 1, 3], "float32"], [1, 1], [0, 1, 0, 1], [1, 1], "float32"], {}], "config": {"index": 24003974, "code_hash": null, "entity": [["tile_f", "sp", [-1, 1, 3, 2]], ["tile_y", "sp", [-1, 2, 4, 1]], ["tile_x", "sp", [-1, 1, 1, 1]], ["tile_rc", "sp", [-1, 128]], ["tile_ry", "sp", [-1, 1]], ["tile_rx", "sp", [-1, 3]], ["auto_unroll_max_step", "ot", 0], ["unroll_explicit", "ot", 1]]}, "result": [[0.0012268686951219512, 0.001227078219512195, 0.0012272015975609758], 0, 1.400498867034912, 1678859611.1862102], "version": 0.2, "tvm_version": "0.10.0"}
{"input": ["cuda -keys=cuda,gpu -arch=sm_75 -max_num_threads=1024 -thread_warp_size=32", "conv2d_nchw.cuda", [["TENSOR", [1, 384, 8, 8], "float32"], ["TENSOR", [384, 384, 1, 3], "float32"], [1, 1], [0, 1, 0, 1], [1, 1], "float32"], {}], "config": {"index": 31047713, "code_hash": null, "entity": [["tile_f", "sp", [-1, 2, 8, 8]], ["tile_y", "sp", [-1, 4, 1, 1]], ["tile_x", "sp", [-1, 2, 2, 2]], ["tile_rc", "sp", [-1, 2]], ["tile_ry", "sp", [-1, 1]], ["tile_rx", "sp", [-1, 1]], ["auto_unroll_max_step", "ot", 1500], ["unroll_explicit", "ot", 1]]}, "result": [[0.0010583635789473684, 0.0010584508736842105, 0.0010584643684210526], 0, 2.3075695037841797, 1678859612.0678785], "version": 0.2, "tvm_version": "0.10.0"}
{"input": ["cuda -keys=cuda,gpu -arch=sm_75 -max_num_threads=1024 -thread_warp_size=32", "conv2d_nchw.cuda", [["TENSOR", [1, 384, 8, 8], "float32"], ["TENSOR", [384, 384, 1, 3], "float32"], [1, 1], [0, 1, 0, 1], [1, 1], "float32"], {}], "config": {"index": 10472469, "code_hash": null, "entity": [["tile_f", "sp", [-1, 1, 8, 6]], ["tile_y", "sp", [-1, 2, 1, 4]], ["tile_x", "sp", [-1, 1, 1, 2]], ["tile_rc", "sp", [-1, 12]], ["tile_ry", "sp", [-1, 1]], ["tile_rx", "sp", [-1, 3]], ["auto_unroll_max_step", "ot", 512], ["unroll_explicit", "ot", 0]]}, "result": [[0.00029924772625698325, 0.0002992735270018622, 0.000299403156424581], 0, 2.0864357948303223, 1678859613.3204544], "version": 0.2, "tvm_version": "0.10.0"}
{"input": ["cuda -keys=cuda,gpu -arch=sm_75 -max_num_threads=1024 -thread_warp_size=32", "conv2d_nchw.cuda", [["TENSOR", [1, 384, 8, 8], "float32"], ["TENSOR", [384, 384, 1, 3], "float32"], [1, 1], [0, 1, 0, 1], [1, 1], "float32"], {}], "config": {"index": 6277377, "code_hash": null, "entity": [["tile_f", "sp", [-1, 4, 1, 24]], ["tile_y", "sp", [-1, 2, 1, 4]], ["tile_x", "sp", [-1, 1, 2, 2]], ["tile_rc", "sp", [-1, 1]], ["tile_ry", "sp", [-1, 1]], ["tile_rx", "sp", [-1, 1]], ["auto_unroll_max_step", "ot", 512], ["unroll_explicit", "ot", 0]]}, "result": [[0.016402724, 0.016410756714285716, 0.016412136571428572], 0, 1.7059118747711182, 1678859614.3240352], "version": 0.2, "tvm_version": "0.10.0"}
{"input": ["cuda -keys=cuda,gpu -arch=sm_75 -max_num_threads=1024 -thread_warp_size=32", "conv2d_nchw.cuda", [["TENSOR", [1, 384, 8, 8], "float32"], ["TENSOR", [384, 384, 1, 3], "float32"], [1, 1], [0, 1, 0, 1], [1, 1], "float32"], {}], "config": {"index": 7809303, "code_hash": null, "entity": [["tile_f", "sp", [-1, 6, 32, 2]], ["tile_y", "sp", [-1, 1, 8, 1]], ["tile_x", "sp", [-1, 1, 2, 2]], ["tile_rc", "sp", [-1, 24]], ["tile_ry", "sp", [-1, 1]], ["tile_rx", "sp", [-1, 1]], ["auto_unroll_max_step", "ot", 512], ["unroll_explicit", "ot", 0]]}, "result": [[0.000542663622895623, 0.000542885723905724, 0.0005439137554347826], 0, 1.8012588024139404, 1678859615.551931], "version": 0.2, "tvm_version": "0.10.0"}
{"input": ["cuda -keys=cuda,gpu -arch=sm_75 -max_num_threads=1024 -thread_warp_size=32", "conv2d_nchw.cuda", [["TENSOR", [1, 384, 8, 8], "float32"], ["TENSOR", [384, 384, 1, 3], "float32"], [1, 1], [0, 1, 0, 1], [1, 1], "float32"], {}], "config": {"index": 5358257, "code_hash": null, "entity": [["tile_f", "sp", [-1, 2, 2, 1]], ["tile_y", "sp", [-1, 8, 1, 1]], ["tile_x", "sp", [-1, 1, 2, 4]], ["tile_rc", "sp", [-1, 64]], ["tile_ry", "sp", [-1, 1]], ["tile_rx", "sp", [-1, 3]], ["auto_unroll_max_step", "ot", 0], ["unroll_explicit", "ot", 0]]}, "result": [[0.001310957494736842, 0.0013110625368421053, 0.0013143275999999999], 0, 1.456484317779541, 1678859626.6861455], "version": 0.2, "tvm_version": "0.10.0"}
{"input": ["cuda -keys=cuda,gpu -arch=sm_75 -max_num_threads=1024 -thread_warp_size=32", "conv2d_nchw.cuda", [["TENSOR", [1, 384, 8, 8], "float32"], ["TENSOR", [384, 384, 1, 3], "float32"], [1, 1], [0, 1, 0, 1], [1, 1], "float32"], {}], "config": {"index": 9363236, "code_hash": null, "entity": [["tile_f", "sp", [-1, 1, 12, 8]], ["tile_y", "sp", [-1, 4, 2, 1]], ["tile_x", "sp", [-1, 1, 4, 2]], ["tile_rc", "sp", [-1, 1]], ["tile_ry", "sp", [-1, 1]], ["tile_rx", "sp", [-1, 3]], ["auto_unroll_max_step", "ot", 512], ["unroll_explicit", "ot", 0]]}, "result": [[0.0003480660238095238, 0.0003480955173160173, 0.0003482742294372294], 0, 1.8557851314544678, 1678859627.976101], "version": 0.2, "tvm_version": "0.10.0"}
{"input": ["cuda -keys=cuda,gpu -arch=sm_75 -max_num_threads=1024 -thread_warp_size=32", "conv2d_nchw.cuda", [["TENSOR", [1, 384, 8, 8], "float32"], ["TENSOR", [384, 384, 1, 3], "float32"], [1, 1], [0, 1, 0, 1], [1, 1], "float32"], {}], "config": {"index": 2280554, "code_hash": null, "entity": [["tile_f", "sp", [-1, 2, 16, 1]], ["tile_y", "sp", [-1, 2, 1, 2]], ["tile_x", "sp", [-1, 2, 1, 4]], ["tile_rc", "sp", [-1, 64]], ["tile_ry", "sp", [-1, 1]], ["tile_rx", "sp", [-1, 1]], ["auto_unroll_max_step", "ot", 0], ["unroll_explicit", "ot", 0]]}, "result": [[0.0004087787360406091, 0.0004088099111675127, 0.0004088776472081218], 0, 1.8519113063812256, 1678859629.2096286], "version": 0.2, "tvm_version": "0.10.0"}
{"input": ["cuda -keys=cuda,gpu -arch=sm_75 -max_num_threads=1024 -thread_warp_size=32", "conv2d_nchw.cuda", [["TENSOR", [1, 384, 8, 8], "float32"], ["TENSOR", [384, 384, 1, 3], "float32"], [1, 1], [0, 1, 0, 1], [1, 1], "float32"], {}], "config": {"index": 3451551, "code_hash": null, "entity": [["tile_f", "sp", [-1, 8, 6, 8]], ["tile_y", "sp", [-1, 1, 1, 2]], ["tile_x", "sp", [-1, 1, 1, 8]], ["tile_rc", "sp", [-1, 2]], ["tile_ry", "sp", [-1, 1]], ["tile_rx", "sp", [-1, 3]], ["auto_unroll_max_step", "ot", 0], ["unroll_explicit", "ot", 0]]}, "result": [[0.007951066769230769, 0.007951554461538462, 0.007951596153846153], 0, 1.8927438259124756, 1678859630.1313121], "version": 0.2, "tvm_version": "0.10.0"}
{"input": ["cuda -keys=cuda,gpu -arch=sm_75 -max_num_threads=1024 -thread_warp_size=32", "conv2d_nchw.cuda", [["TENSOR", [1, 384, 8, 8], "float32"], ["TENSOR", [384, 384, 1, 3], "float32"], [1, 1], [0, 1, 0, 1], [1, 1], "float32"], {}], "config": {"index": 34062936, "code_hash": null, "entity": [["tile_f", "sp", [-1, 8, 8, 3]], ["tile_y", "sp", [-1, 1, 2, 1]], ["tile_x", "sp", [-1, 2, 4, 1]], ["tile_rc", "sp", [-1, 2]], ["tile_ry", "sp", [-1, 1]], ["tile_rx", "sp", [-1, 3]], ["auto_unroll_max_step", "ot", 1500], ["unroll_explicit", "ot", 1]]}, "result": [[0.00037224349074074076, 0.00037225638425925924, 0.00037228213194444445], 0, 1.9341018199920654, 1678859631.4253967], "version": 0.2, "tvm_version": "0.10.0"}
{"input": ["cuda -keys=cuda,gpu -arch=sm_75 -max_num_threads=1024 -thread_warp_size=32", "conv2d_nchw.cuda", [["TENSOR", [1, 384, 8, 8], "float32"], ["TENSOR", [384, 384, 1, 3], "float32"], [1, 1], [0, 1, 0, 1], [1, 1], "float32"], {}], "config": {"index": 32362023, "code_hash": null, "entity": [["tile_f", "sp", [-1, 8, 2, 24]], ["tile_y", "sp", [-1, 1, 1, 1]], ["tile_x", "sp", [-1, 2, 1, 2]], ["tile_rc", "sp", [-1, 24]], ["tile_ry", "sp", [-1, 1]], ["tile_rx", "sp", [-1, 1]], ["auto_unroll_max_step", "ot", 1500], ["unroll_explicit", "ot", 1]]}, "result": [[0.033851417499999994, 0.03415372075, 0.034403457500000005], 0, 4.881485223770142, 1678859632.5937085], "version": 0.2, "tvm_version": "0.10.0"}
{"input": ["cuda -keys=cuda,gpu -arch=sm_75 -max_num_threads=1024 -thread_warp_size=32", "conv2d_nchw.cuda", [["TENSOR", [1, 384, 8, 8], "float32"], ["TENSOR", [384, 384, 1, 3], "float32"], [1, 1], [0, 1, 0, 1], [1, 1], "float32"], {}], "config": {"index": 12492447, "code_hash": null, "entity": [["tile_f", "sp", [-1, 1, 12, 32]], ["tile_y", "sp", [-1, 2, 2, 1]], ["tile_x", "sp", [-1, 2, 1, 1]], ["tile_rc", "sp", [-1, 2]], ["tile_ry", "sp", [-1, 1]], ["tile_rx", "sp", [-1, 1]], ["auto_unroll_max_step", "ot", 1500], ["unroll_explicit", "ot", 0]]}, "result": [[0.0008052262560000001, 0.00080537188, 0.0008054517759999999], 0, 1.6455423831939697, 1678859633.4703667], "version": 0.2, "tvm_version": "0.10.0"}
{"input": ["cuda -keys=cuda,gpu -arch=sm_75 -max_num_threads=1024 -thread_warp_size=32", "conv2d_nchw.cuda", [["TENSOR", [1, 384, 8, 8], "float32"], ["TENSOR", [384, 384, 1, 3], "float32"], [1, 1], [0, 1, 0, 1], [1, 1], "float32"], {}], "config": {"index": 16430369, "code_hash": null, "entity": [["tile_f", "sp", [-1, 2, 1, 48]], ["tile_y", "sp", [-1, 1, 8, 1]], ["tile_x", "sp", [-1, 2, 1, 2]], ["tile_rc", "sp", [-1, 8]], ["tile_ry", "sp", [-1, 1]], ["tile_rx", "sp", [-1, 3]], ["auto_unroll_max_step", "ot", 1500], ["unroll_explicit", "ot", 0]]}, "result": [[0.003980209346153846, 0.003980287961538462, 0.003980707576923077], 0, 2.4985318183898926, 1678859634.3780248], "version": 0.2, "tvm_version": "0.10.0"}
{"input": ["cuda -keys=cuda,gpu -arch=sm_75 -max_num_threads=1024 -thread_warp_size=32", "conv2d_nchw.cuda", [["TENSOR", [1, 384, 8, 8], "float32"], ["TENSOR", [384, 384, 1, 3], "float32"], [1, 1], [0, 1, 0, 1], [1, 1], "float32"], {}], "config": {"index": 23678420, "code_hash": null, "entity": [["tile_f", "sp", [-1, 6, 2, 1]], ["tile_y", "sp", [-1, 1, 1, 2]], ["tile_x", "sp", [-1, 4, 2, 1]], ["tile_rc", "sp", [-1, 64]], ["tile_ry", "sp", [-1, 1]], ["tile_rx", "sp", [-1, 3]], ["auto_unroll_max_step", "ot", 0], ["unroll_explicit", "ot", 1]]}, "result": [[0.0005536215326460482, 0.0005536680446735395, 0.0005537415051546392], 0, 1.8758282661437988, 1678859635.653126], "version": 0.2, "tvm_version": "0.10.0"}
{"input": ["cuda -keys=cuda,gpu -arch=sm_75 -max_num_threads=1024 -thread_warp_size=32", "conv2d_nchw.cuda", [["TENSOR", [1, 384, 8, 8], "float32"], ["TENSOR", [384, 384, 1, 3], "float32"], [1, 1], [0, 1, 0, 1], [1, 1], "float32"], {}], "config": {"index": 10467236, "code_hash": null, "entity": [["tile_f", "sp", [-1, 1, 12, 8]], ["tile_y", "sp", [-1, 4, 2, 1]], ["tile_x", "sp", [-1, 1, 1, 2]], ["tile_rc", "sp", [-1, 12]], ["tile_ry", "sp", [-1, 1]], ["tile_rx", "sp", [-1, 3]], ["auto_unroll_max_step", "ot", 512], ["unroll_explicit", "ot", 0]]}, "result": [[0.0004444780501792115, 0.00044449675627240143, 0.00044463908960573476], 0, 1.9673442840576172, 1678859638.7781491], "version": 0.2, "tvm_version": "0.10.0"}
{"input": ["cuda -keys=cuda,gpu -arch=sm_75 -max_num_threads=1024 -thread_warp_size=32", "conv2d_nchw.cuda", [["TENSOR", [1, 384, 8, 8], "float32"], ["TENSOR", [384, 384, 1, 3], "float32"], [1, 1], [0, 1, 0, 1], [1, 1], "float32"], {}], "config": {"index": 4407733, "code_hash": null, "entity": [["tile_f", "sp", [-1, 8, 2, 12]], ["tile_y", "sp", [-1, 4, 1, 1]], ["tile_x", "sp", [-1, 1, 1, 8]], ["tile_rc", "sp", [-1, 12]], ["tile_ry", "sp", [-1, 1]], ["tile_rx", "sp", [-1, 3]], ["auto_unroll_max_step", "ot", 0], ["unroll_explicit", "ot", 0]]}, "result": [[0.029068591999999997, 0.0291252155, 0.029128664000000002], 0, 2.7681121826171875, 1678859639.8382664], "version": 0.2, "tvm_version": "0.10.0"}
{"input": ["cuda -keys=cuda,gpu -arch=sm_75 -max_num_threads=1024 -thread_warp_size=32", "conv2d_nchw.cuda", [["TENSOR", [1, 384, 8, 8], "float32"], ["TENSOR", [384, 384, 1, 3], "float32"], [1, 1], [0, 1, 0, 1], [1, 1], "float32"], {}], "config": {"index": 34109345, "code_hash": null, "entity": [["tile_f", "sp", [-1, 24, 8, 1]], ["tile_y", "sp", [-1, 2, 1, 1]], ["tile_x", "sp", [-1, 1, 2, 2]], ["tile_rc", "sp", [-1, 2]], ["tile_ry", "sp", [-1, 1]], ["tile_rx", "sp", [-1, 3]], ["auto_unroll_max_step", "ot", 1500], ["unroll_explicit", "ot", 1]]}, "result": [[0.00047939046130952384, 0.0004794301071428571, 0.00047953678273809523], 0, 2.603156805038452, 1678859641.115329], "version": 0.2, "tvm_version": "0.10.0"}
{"input": ["cuda -keys=cuda,gpu -arch=sm_75 -max_num_threads=1024 -thread_warp_size=32", "conv2d_nchw.cuda", [["TENSOR", [1, 384, 8, 8], "float32"], ["TENSOR", [384, 384, 1, 3], "float32"], [1, 1], [0, 1, 0, 1], [1, 1], "float32"], {}], "config": {"index": 2501414, "code_hash": null, "entity": [["tile_f", "sp", [-1, 1, 3, 2]], ["tile_y", "sp", [-1, 2, 1, 2]], ["tile_x", "sp", [-1, 1, 1, 1]], ["tile_rc", "sp", [-1, 128]], ["tile_ry", "sp", [-1, 1]], ["tile_rx", "sp", [-1, 1]], ["auto_unroll_max_step", "ot", 0], ["unroll_explicit", "ot", 0]]}, "result": [[0.0014414683714285715, 0.001441822157142857, 0.0014421723428571429], 0, 1.4854342937469482, 1678859641.9606717], "version": 0.2, "tvm_version": "0.10.0"}
{"input": ["cuda -keys=cuda,gpu -arch=sm_75 -max_num_threads=1024 -thread_warp_size=32", "conv2d_nchw.cuda", [["TENSOR", [1, 384, 8, 8], "float32"], ["TENSOR", [384, 384, 1, 3], "float32"], [1, 1], [0, 1, 0, 1], [1, 1], "float32"], {}], "config": {"index": 13544469, "code_hash": null, "entity": [["tile_f", "sp", [-1, 1, 8, 6]], ["tile_y", "sp", [-1, 2, 1, 4]], ["tile_x", "sp", [-1, 1, 1, 2]], ["tile_rc", "sp", [-1, 12]], ["tile_ry", "sp", [-1, 1]], ["tile_rx", "sp", [-1, 1]], ["auto_unroll_max_step", "ot", 1500], ["unroll_explicit", "ot", 0]]}, "result": [[0.000324706523659306, 0.00032484269716088327, 0.00032517429968454255], 0, 1.8643989562988281, 1678859642.810352], "version": 0.2, "tvm_version": "0.10.0"}
{"input": ["cuda -keys=cuda,gpu -arch=sm_75 -max_num_threads=1024 -thread_warp_size=32", "conv2d_nchw.cuda", [["TENSOR", [1, 384, 8, 8], "float32"], ["TENSOR", [384, 384, 1, 3], "float32"], [1, 1], [0, 1, 0, 1], [1, 1], "float32"], {}], "config": {"index": 843905, "code_hash": null, "entity": [["tile_f", "sp", [-1, 24, 8, 1]], ["tile_y", "sp", [-1, 1, 2, 4]], ["tile_x", "sp", [-1, 1, 4, 1]], ["tile_rc", "sp", [-1, 6]], ["tile_ry", "sp", [-1, 1]], ["tile_rx", "sp", [-1, 1]], ["auto_unroll_max_step", "ot", 0], ["unroll_explicit", "ot", 0]]}, "result": [[0.0003697430321100918, 0.0003697668302752293, 0.00036982163532110095], 0, 1.9149093627929688, 1678859644.0838985], "version": 0.2, "tvm_version": "0.10.0"}
{"input": ["cuda -keys=cuda,gpu -arch=sm_75 -max_num_threads=1024 -thread_warp_size=32", "conv2d_nchw.cuda", [["TENSOR", [1, 384, 8, 8], "float32"], ["TENSOR", [384, 384, 1, 3], "float32"], [1, 1], [0, 1, 0, 1], [1, 1], "float32"], {}], "config": {"index": 15660836, "code_hash": null, "entity": [["tile_f", "sp", [-1, 1, 12, 8]], ["tile_y", "sp", [-1, 4, 2, 1]], ["tile_x", "sp", [-1, 2, 1, 2]], ["tile_rc", "sp", [-1, 2]], ["tile_ry", "sp", [-1, 1]], ["tile_rx", "sp", [-1, 3]], ["auto_unroll_max_step", "ot", 1500], ["unroll_explicit", "ot", 0]]}, "result": [[0.0002943123735294118, 0.0002943226294117647, 0.00029441214117647055], 0, 1.5786256790161133, 1678859644.927945], "version": 0.2, "tvm_version": "0.10.0"}
{"input": ["cuda -keys=cuda,gpu -arch=sm_75 -max_num_threads=1024 -thread_warp_size=32", "conv2d_nchw.cuda", [["TENSOR", [1, 384, 8, 8], "float32"], ["TENSOR", [384, 384, 1, 3], "float32"], [1, 1], [0, 1, 0, 1], [1, 1], "float32"], {}], "config": {"index": 204447, "code_hash": null, "entity": [["tile_f", "sp", [-1, 1, 12, 32]], ["tile_y", "sp", [-1, 2, 2, 1]], ["tile_x", "sp", [-1, 2, 1, 1]], ["tile_rc", "sp", [-1, 2]], ["tile_ry", "sp", [-1, 1]], ["tile_rx", "sp", [-1, 1]], ["auto_unroll_max_step", "ot", 0], ["unroll_explicit", "ot", 0]]}, "result": [[0.0012871679615384616, 0.0012871942692307692, 0.0012874724487179487], 0, 1.5230798721313477, 1678859645.8189623], "version": 0.2, "tvm_version": "0.10.0"}
{"input": ["cuda -keys=cuda,gpu -arch=sm_75 -max_num_threads=1024 -thread_warp_size=32", "conv2d_nchw.cuda", [["TENSOR", [1, 384, 8, 8], "float32"], ["TENSOR", [384, 384, 1, 3], "float32"], [1, 1], [0, 1, 0, 1], [1, 1], "float32"], {}], "config": {"index": 10430420, "code_hash": null, "entity": [["tile_f", "sp", [-1, 6, 2, 1]], ["tile_y", "sp", [-1, 1, 1, 2]], ["tile_x", "sp", [-1, 4, 2, 1]], ["tile_rc", "sp", [-1, 12]], ["tile_ry", "sp", [-1, 1]], ["tile_rx", "sp", [-1, 3]], ["auto_unroll_max_step", "ot", 512], ["unroll_explicit", "ot", 0]]}, "result": [[0.0003707447690531178, 0.0003707542147806004, 0.00037077267898383374], 0, 2.2990005016326904, 1678859647.1109157], "version": 0.2, "tvm_version": "0.10.0"}
{"input": ["cuda -keys=cuda,gpu -arch=sm_75 -max_num_threads=1024 -thread_warp_size=32", "conv2d_nchw.cuda", [["TENSOR", [1, 384, 8, 8], "float32"], ["TENSOR", [384, 384, 1, 3], "float32"], [1, 1], [0, 1, 0, 1], [1, 1], "float32"], {}], "config": {"index": 31656554, "code_hash": null, "entity": [["tile_f", "sp", [-1, 2, 16, 1]], ["tile_y", "sp", [-1, 2, 1, 2]], ["tile_x", "sp", [-1, 2, 1, 4]], ["tile_rc", "sp", [-1, 6]], ["tile_ry", "sp", [-1, 1]], ["tile_rx", "sp", [-1, 1]], ["auto_unroll_max_step", "ot", 1500], ["unroll_explicit", "ot", 1]]}, "result": [[0.00015664484660194174, 0.00015665628349514565, 0.00015675208737864075], 0, 3.12448787689209, 1678859648.371628], "version": 0.2, "tvm_version": "0.10.0"}
{"input": ["cuda -keys=cuda,gpu -arch=sm_75 -max_num_threads=1024 -thread_warp_size=32", "conv2d_nchw.cuda", [["TENSOR", [1, 384, 8, 8], "float32"], ["TENSOR", [384, 384, 1, 3], "float32"], [1, 1], [0, 1, 0, 1], [1, 1], "float32"], {}], "config": {"index": 25814945, "code_hash": null, "entity": [["tile_f", "sp", [-1, 24, 8, 1]], ["tile_y", "sp", [-1, 2, 1, 1]], ["tile_x", "sp", [-1, 1, 8, 1]], ["tile_rc", "sp", [-1, 12]], ["tile_ry", "sp", [-1, 1]], ["tile_rx", "sp", [-1, 1]], ["auto_unroll_max_step", "ot", 512], ["unroll_explicit", "ot", 1]]}, "result": [[0.0003603565691964286, 0.00036044151339285717, 0.0003606132767857143], 0, 2.011500358581543, 1678859649.6021495], "version": 0.2, "tvm_version": "0.10.0"}
{"input": ["cuda -keys=cuda,gpu -arch=sm_75 -max_num_threads=1024 -thread_warp_size=32", "conv2d_nchw.cuda", [["TENSOR", [1, 384, 8, 8], "float32"], ["TENSOR", [384, 384, 1, 3], "float32"], [1, 1], [0, 1, 0, 1], [1, 1], "float32"], {}], "config": {"index": 25817994, "code_hash": null, "entity": [["tile_f", "sp", [-1, 12, 1, 4]], ["tile_y", "sp", [-1, 1, 4, 1]], ["tile_x", "sp", [-1, 1, 8, 1]], ["tile_rc", "sp", [-1, 12]], ["tile_ry", "sp", [-1, 1]], ["tile_rx", "sp", [-1, 1]], ["auto_unroll_max_step", "ot", 512], ["unroll_explicit", "ot", 1]]}, "result": [[0.0002451838619631902, 0.00024523277453987734, 0.0002454742009202454], 0, 2.309612989425659, 1678859650.8294575], "version": 0.2, "tvm_version": "0.10.0"}
{"input": ["cuda -keys=cuda,gpu -arch=sm_75 -max_num_threads=1024 -thread_warp_size=32", "conv2d_nchw.cuda", [["TENSOR", [1, 384, 8, 8], "float32"], ["TENSOR", [384, 384, 1, 3], "float32"], [1, 1], [0, 1, 0, 1], [1, 1], "float32"], {}], "config": {"index": 6348447, "code_hash": null, "entity": [["tile_f", "sp", [-1, 1, 12, 32]], ["tile_y", "sp", [-1, 2, 2, 1]], ["tile_x", "sp", [-1, 2, 1, 1]], ["tile_rc", "sp", [-1, 2]], ["tile_ry", "sp", [-1, 1]], ["tile_rx", "sp", [-1, 1]], ["auto_unroll_max_step", "ot", 512], ["unroll_explicit", "ot", 0]]}, "result": [[0.000836388775, 0.0008364512083333333, 0.00083646265], 0, 1.743750810623169, 1678859651.7209315], "version": 0.2, "tvm_version": "0.10.0"}
{"input": ["cuda -keys=cuda,gpu -arch=sm_75 -max_num_threads=1024 -thread_warp_size=32", "conv2d_nchw.cuda", [["TENSOR", [1, 384, 8, 8], "float32"], ["TENSOR", [384, 384, 1, 3], "float32"], [1, 1], [0, 1, 0, 1], [1, 1], "float32"], {}], "config": {"index": 7421345, "code_hash": null, "entity": [["tile_f", "sp", [-1, 24, 8, 1]], ["tile_y", "sp", [-1, 2, 1, 1]], ["tile_x", "sp", [-1, 1, 2, 2]], ["tile_rc", "sp", [-1, 12]], ["tile_ry", "sp", [-1, 1]], ["tile_rx", "sp", [-1, 1]], ["auto_unroll_max_step", "ot", 512], ["unroll_explicit", "ot", 0]]}, "result": [[0.0005412808756756756, 0.0005412836432432432, 0.0005413478108108108], 0, 1.518495798110962, 1678859652.6137428], "version": 0.2, "tvm_version": "0.10.0"}
{"input": ["cuda -keys=cuda,gpu -arch=sm_75 -max_num_threads=1024 -thread_warp_size=32", "conv2d_nchw.cuda", [["TENSOR", [1, 384, 8, 8], "float32"], ["TENSOR", [384, 384, 1, 3], "float32"], [1, 1], [0, 1, 0, 1], [1, 1], "float32"], {}], "config": {"index": 13131669, "code_hash": null, "entity": [["tile_f", "sp", [-1, 1, 8, 6]], ["tile_y", "sp", [-1, 2, 1, 4]], ["tile_x", "sp", [-1, 1, 4, 1]], ["tile_rc", "sp", [-1, 6]], ["tile_ry", "sp", [-1, 1]], ["tile_rx", "sp", [-1, 1]], ["auto_unroll_max_step", "ot", 1500], ["unroll_explicit", "ot", 0]]}, "result": [[0.00015684448933500628, 0.00015686588331242156, 0.00015729959096612295], 0, 1.886244535446167, 1678859656.5651472], "version": 0.2, "tvm_version": "0.10.0"}
{"input": ["cuda -keys=cuda,gpu -arch=sm_75 -max_num_threads=1024 -thread_warp_size=32", "conv2d_nchw.cuda", [["TENSOR", [1, 384, 8, 8], "float32"], ["TENSOR", [384, 384, 1, 3], "float32"], [1, 1], [0, 1, 0, 1], [1, 1], "float32"], {}], "config": {"index": 26537101, "code_hash": null, "entity": [["tile_f", "sp", [-1, 8, 2, 6]], ["tile_y", "sp", [-1, 2, 2, 1]], ["tile_x", "sp", [-1, 1, 2, 1]], ["tile_rc", "sp", [-1, 48]], ["tile_ry", "sp", [-1, 1]], ["tile_rx", "sp", [-1, 1]], ["auto_unroll_max_step", "ot", 512], ["unroll_explicit", "ot", 1]]}, "result": [[0.0007600684123222749, 0.0007600728246445499, 0.0007600797677725118], 0, 2.2021496295928955, 1678859657.8571036], "version": 0.2, "tvm_version": "0.10.0"}
{"input": ["cuda -keys=cuda,gpu -arch=sm_75 -max_num_threads=1024 -thread_warp_size=32", "conv2d_nchw.cuda", [["TENSOR", [1, 384, 8, 8], "float32"], ["TENSOR", [384, 384, 1, 3], "float32"], [1, 1], [0, 1, 0, 1], [1, 1], "float32"], {}], "config": {"index": 27717178, "code_hash": null, "entity": [["tile_f", "sp", [-1, 2, 8, 1]], ["tile_y", "sp", [-1, 1, 2, 1]], ["tile_x", "sp", [-1, 1, 4, 1]], ["tile_rc", "sp", [-1, 1]], ["tile_ry", "sp", [-1, 1]], ["tile_rx", "sp", [-1, 3]], ["auto_unroll_max_step", "ot", 512], ["unroll_explicit", "ot", 1]]}, "result": [[0.00031484425, 0.00031487598828125, 0.0003148925], 0, 1.7815778255462646, 1678859659.0530407], "version": 0.2, "tvm_version": "0.10.0"}
{"input": ["cuda -keys=cuda,gpu -arch=sm_75 -max_num_threads=1024 -thread_warp_size=32", "conv2d_nchw.cuda", [["TENSOR", [1, 384, 8, 8], "float32"], ["TENSOR", [384, 384, 1, 3], "float32"], [1, 1], [0, 1, 0, 1], [1, 1], "float32"], {}], "config": {"index": 10466709, "code_hash": null, "entity": [["tile_f", "sp", [-1, 1, 8, 6]], ["tile_y", "sp", [-1, 2, 2, 1]], ["tile_x", "sp", [-1, 1, 1, 2]], ["tile_rc", "sp", [-1, 12]], ["tile_ry", "sp", [-1, 1]], ["tile_rx", "sp", [-1, 3]], ["auto_unroll_max_step", "ot", 512], ["unroll_explicit", "ot", 0]]}, "result": [[0.0004357512092391305, 0.00043579147010869567, 0.000435937464673913], 0, 1.9244451522827148, 1678859660.3278334], "version": 0.2, "tvm_version": "0.10.0"}
{"input": ["cuda -keys=cuda,gpu -arch=sm_75 -max_num_threads=1024 -thread_warp_size=32", "conv2d_nchw.cuda", [["TENSOR", [1, 384, 8, 8], "float32"], ["TENSOR", [384, 384, 1, 3], "float32"], [1, 1], [0, 1, 0, 1], [1, 1], "float32"], {}], "config": {"index": 11205178, "code_hash": null, "entity": [["tile_f", "sp", [-1, 2, 8, 1]], ["tile_y", "sp", [-1, 1, 2, 1]], ["tile_x", "sp", [-1, 1, 4, 1]], ["tile_rc", "sp", [-1, 48]], ["tile_ry", "sp", [-1, 1]], ["tile_rx", "sp", [-1, 3]], ["auto_unroll_max_step", "ot", 512], ["unroll_explicit", "ot", 0]]}, "result": [[0.00028415218894830657, 0.0002842002228163993, 0.00028446209625668446], 0, 2.239997148513794, 1678859661.612156], "version": 0.2, "tvm_version": "0.10.0"}
{"input": ["cuda -keys=cuda,gpu -arch=sm_75 -max_num_threads=1024 -thread_warp_size=32", "conv2d_nchw.cuda", [["TENSOR", [1, 384, 8, 8], "float32"], ["TENSOR", [384, 384, 1, 3], "float32"], [1, 1], [0, 1, 0, 1], [1, 1], "float32"], {}], "config": {"index": 3147898, "code_hash": null, "entity": [["tile_f", "sp", [-1, 2, 8, 1]], ["tile_y", "sp", [-1, 1, 2, 4]], ["tile_x", "sp", [-1, 1, 4, 1]], ["tile_rc", "sp", [-1, 1]], ["tile_ry", "sp", [-1, 1]], ["tile_rx", "sp", [-1, 3]], ["auto_unroll_max_step", "ot", 0], ["unroll_explicit", "ot", 0]]}, "result": [[0.00016525036652977412, 0.00016525411088295688, 0.00016526141067761807], 0, 1.8231678009033203, 1678859662.886198], "version": 0.2, "tvm_version": "0.10.0"}
{"input": ["cuda -keys=cuda,gpu -arch=sm_75 -max_num_threads=1024 -thread_warp_size=32", "conv2d_nchw.cuda", [["TENSOR", [1, 384, 8, 8], "float32"], ["TENSOR", [384, 384, 1, 3], "float32"], [1, 1], [0, 1, 0, 1], [1, 1], "float32"], {}], "config": {"index": 22609591, "code_hash": null, "entity": [["tile_f", "sp", [-1, 1, 6, 2]], ["tile_y", "sp", [-1, 8, 1, 1]], ["tile_x", "sp", [-1, 1, 4, 2]], ["tile_rc", "sp", [-1, 8]], ["tile_ry", "sp", [-1, 1]], ["tile_rx", "sp", [-1, 3]], ["auto_unroll_max_step", "ot", 0], ["unroll_explicit", "ot", 1]]}, "result": [[0.00034647415301724134, 0.00034649352155172414, 0.0003465079267241379], 0, 1.8176987171173096, 1678859664.1202474], "version": 0.2, "tvm_version": "0.10.0"}
{"input": ["cuda -keys=cuda,gpu -arch=sm_75 -max_num_threads=1024 -thread_warp_size=32", "conv2d_nchw.cuda", [["TENSOR", [1, 384, 8, 8], "float32"], ["TENSOR", [384, 384, 1, 3], "float32"], [1, 1], [0, 1, 0, 1], [1, 1], "float32"], {}], "config": {"index": 27248394, "code_hash": null, "entity": [["tile_f", "sp", [-1, 12, 1, 4]], ["tile_y", "sp", [-1, 1, 4, 1]], ["tile_x", "sp", [-1, 1, 2, 4]], ["tile_rc", "sp", [-1, 128]], ["tile_ry", "sp", [-1, 1]], ["tile_rx", "sp", [-1, 1]], ["auto_unroll_max_step", "ot", 512], ["unroll_explicit", "ot", 1]]}, "result": [[0.0008975094375, 0.0008981965535714286, 0.0008987005714285715], 0, 3.539353370666504, 1678859664.9934027], "version": 0.2, "tvm_version": "0.10.0"}
{"input": ["cuda -keys=cuda,gpu -arch=sm_75 -max_num_threads=1024 -thread_warp_size=32", "conv2d_nchw.cuda", [["TENSOR", [1, 384, 8, 8], "float32"], ["TENSOR", [384, 384, 1, 3], "float32"], [1, 1], [0, 1, 0, 1], [1, 1], "float32"], {}], "config": {"index": 7809515, "code_hash": null, "entity": [["tile_f", "sp", [-1, 3, 2, 16]], ["tile_y", "sp", [-1, 1, 8, 1]], ["tile_x", "sp", [-1, 1, 2, 2]], ["tile_rc", "sp", [-1, 24]], ["tile_ry", "sp", [-1, 1]], ["tile_rx", "sp", [-1, 1]], ["auto_unroll_max_step", "ot", 512], ["unroll_explicit", "ot", 0]]}, "result": [[0.0003292899918367347, 0.00032929600204081633, 0.00032933408775510204], 0, 1.9710350036621094, 1678859666.2857487], "version": 0.2, "tvm_version": "0.10.0"}
{"input": ["cuda -keys=cuda,gpu -arch=sm_75 -max_num_threads=1024 -thread_warp_size=32", "conv2d_nchw.cuda", [["TENSOR", [1, 384, 8, 8], "float32"], ["TENSOR", [384, 384, 1, 3], "float32"], [1, 1], [0, 1, 0, 1], [1, 1], "float32"], {}], "config": {"index": 28904469, "code_hash": null, "entity": [["tile_f", "sp", [-1, 1, 8, 6]], ["tile_y", "sp", [-1, 2, 1, 4]], ["tile_x", "sp", [-1, 1, 1, 2]], ["tile_rc", "sp", [-1, 12]], ["tile_ry", "sp", [-1, 1]], ["tile_rx", "sp", [-1, 3]], ["auto_unroll_max_step", "ot", 512], ["unroll_explicit", "ot", 1]]}, "result": [[0.0002948237631578948, 0.0002949239707602339, 0.00029512757602339186], 0, 2.300452470779419, 1678859667.1588795], "version": 0.2, "tvm_version": "0.10.0"}
{"input": ["cuda -keys=cuda,gpu -arch=sm_75 -max_num_threads=1024 -thread_warp_size=32", "conv2d_nchw.cuda", [["TENSOR", [1, 384, 8, 8], "float32"], ["TENSOR", [384, 384, 1, 3], "float32"], [1, 1], [0, 1, 0, 1], [1, 1], "float32"], {}], "config": {"index": 18875135, "code_hash": null, "entity": [["tile_f", "sp", [-1, 8, 48, 1]], ["tile_y", "sp", [-1, 8, 1, 1]], ["tile_x", "sp", [-1, 4, 2, 1]], ["tile_rc", "sp", [-1, 3]], ["tile_ry", "sp", [-1, 1]], ["tile_rx", "sp", [-1, 1]], ["auto_unroll_max_step", "ot", 0], ["unroll_explicit", "ot", 1]]}, "result": [[0.0014800616911764704, 0.0014800715588235295, 0.001480170294117647], 0, 1.9587066173553467, 1678859668.0486326], "version": 0.2, "tvm_version": "0.10.0"}
{"input": ["cuda -keys=cuda,gpu -arch=sm_75 -max_num_threads=1024 -thread_warp_size=32", "conv2d_nchw.cuda", [["TENSOR", [1, 384, 8, 8], "float32"], ["TENSOR", [384, 384, 1, 3], "float32"], [1, 1], [0, 1, 0, 1], [1, 1], "float32"], {}], "config": {"index": 15361300, "code_hash": null, "entity": [["tile_f", "sp", [-1, 8, 3, 8]], ["tile_y", "sp", [-1, 4, 1, 1]], ["tile_x", "sp", [-1, 1, 1, 1]], ["tile_rc", "sp", [-1, 1]], ["tile_ry", "sp", [-1, 1]], ["tile_rx", "sp", [-1, 3]], ["auto_unroll_max_step", "ot", 1500], ["unroll_explicit", "ot", 0]]}, "result": [[0.0019108998867924528, 0.0019110157735849054, 0.0019111516603773585], 0, 2.0096445083618164, 1678859668.8939686], "version": 0.2, "tvm_version": "0.10.0"}
{"input": ["cuda -keys=cuda,gpu -arch=sm_75 -max_num_threads=1024 -thread_warp_size=32", "conv2d_nchw.cuda", [["TENSOR", [1, 384, 8, 8], "float32"], ["TENSOR", [384, 384, 1, 3], "float32"], [1, 1], [0, 1, 0, 1], [1, 1], "float32"], {}], "config": {"index": 33872856, "code_hash": null, "entity": [["tile_f", "sp", [-1, 8, 8, 3]], ["tile_y", "sp", [-1, 2, 4, 1]], ["tile_x", "sp", [-1, 2, 4, 1]], ["tile_rc", "sp", [-1, 1]], ["tile_ry", "sp", [-1, 1]], ["tile_rx", "sp", [-1, 3]], ["auto_unroll_max_step", "ot", 1500], ["unroll_explicit", "ot", 1]]}, "result": [[0.00046876649999999997, 0.00046876774127906974, 0.00046879572965116277], 0, 2.1254262924194336, 1678859670.160321], "version": 0.2, "tvm_version": "0.10.0"}
{"input": ["cuda -keys=cuda,gpu -arch=sm_75 -max_num_threads=1024 -thread_warp_size=32", "conv2d_nchw.cuda", [["TENSOR", [1, 384, 8, 8], "float32"], ["TENSOR", [384, 384, 1, 3], "float32"], [1, 1], [0, 1, 0, 1], [1, 1], "float32"], {}], "config": {"index": 12435236, "code_hash": null, "entity": [["tile_f", "sp", [-1, 1, 12, 8]], ["tile_y", "sp", [-1, 4, 2, 1]], ["tile_x", "sp", [-1, 1, 4, 2]], ["tile_rc", "sp", [-1, 1]], ["tile_ry", "sp", [-1, 1]], ["tile_rx", "sp", [-1, 1]], ["auto_unroll_max_step", "ot", 1500], ["unroll_explicit", "ot", 0]]}, "result": [[0.0004352122945945946, 0.00043523208918918915, 0.00043524982162162156], 0, 1.8884813785552979, 1678859671.4533741], "version": 0.2, "tvm_version": "0.10.0"}
{"input": ["cuda -keys=cuda,gpu -arch=sm_75 -max_num_threads=1024 -thread_warp_size=32", "conv2d_nchw.cuda", [["TENSOR", [1, 384, 8, 8], "float32"], ["TENSOR", [384, 384, 1, 3], "float32"], [1, 1], [0, 1, 0, 1], [1, 1], "float32"], {}], "config": {"index": 23790257, "code_hash": null, "entity": [["tile_f", "sp", [-1, 2, 2, 1]], ["tile_y", "sp", [-1, 8, 1, 1]], ["tile_x", "sp", [-1, 1, 2, 4]], ["tile_rc", "sp", [-1, 64]], ["tile_ry", "sp", [-1, 1]], ["tile_rx", "sp", [-1, 3]], ["auto_unroll_max_step", "ot", 0], ["unroll_explicit", "ot", 1]]}, "result": [[0.001311027842105263, 0.001311154894736842, 0.0013131256842105264], 0, 1.7106738090515137, 1678859674.027702], "version": 0.2, "tvm_version": "0.10.0"}
{"input": ["cuda -keys=cuda,gpu -arch=sm_75 -max_num_threads=1024 -thread_warp_size=32", "conv2d_nchw.cuda", [["TENSOR", [1, 384, 8, 8], "float32"], ["TENSOR", [384, 384, 1, 3], "float32"], [1, 1], [0, 1, 0, 1], [1, 1], "float32"], {}], "config": {"index": 5329459, "code_hash": null, "entity": [["tile_f", "sp", [-1, 4, 2, 1]], ["tile_y", "sp", [-1, 8, 1, 1]], ["tile_x", "sp", [-1, 1, 4, 2]], ["tile_rc", "sp", [-1, 64]], ["tile_ry", "sp", [-1, 1]], ["tile_rx", "sp", [-1, 3]], ["auto_unroll_max_step", "ot", 0], ["unroll_explicit", "ot", 0]]}, "result": [[0.0005322968940397351, 0.0005323502980132451, 0.0005323986026490067], 0, 2.031820774078369, 1678859675.3235116], "version": 0.2, "tvm_version": "0.10.0"}
{"input": ["cuda -keys=cuda,gpu -arch=sm_75 -max_num_threads=1024 -thread_warp_size=32", "conv2d_nchw.cuda", [["TENSOR", [1, 384, 8, 8], "float32"], ["TENSOR", [384, 384, 1, 3], "float32"], [1, 1], [0, 1, 0, 1], [1, 1], "float32"], {}], "config": {"index": 3145498, "code_hash": null, "entity": [["tile_f", "sp", [-1, 2, 8, 1]], ["tile_y", "sp", [-1, 1, 2, 2]], ["tile_x", "sp", [-1, 1, 4, 1]], ["tile_rc", "sp", [-1, 1]], ["tile_ry", "sp", [-1, 1]], ["tile_rx", "sp", [-1, 3]], ["auto_unroll_max_step", "ot", 0], ["unroll_explicit", "ot", 0]]}, "result": [[0.0002137706835106383, 0.00021384442021276596, 0.00021401871941489363], 0, 1.7409098148345947, 1678859676.592466], "version": 0.2, "tvm_version": "0.10.0"}
{"input": ["cuda -keys=cuda,gpu -arch=sm_75 -max_num_threads=1024 -thread_warp_size=32", "conv2d_nchw.cuda", [["TENSOR", [1, 384, 8, 8], "float32"], ["TENSOR", [384, 384, 1, 3], "float32"], [1, 1], [0, 1, 0, 1], [1, 1], "float32"], {}], "config": {"index": 2288394, "code_hash": null, "entity": [["tile_f", "sp", [-1, 12, 1, 4]], ["tile_y", "sp", [-1, 1, 4, 1]], ["tile_x", "sp", [-1, 1, 2, 4]], ["tile_rc", "sp", [-1, 64]], ["tile_ry", "sp", [-1, 1]], ["tile_rx", "sp", [-1, 1]], ["auto_unroll_max_step", "ot", 0], ["unroll_explicit", "ot", 0]]}, "result": [[0.0005693072508833922, 0.0005693244522968197, 0.0005696769116607774], 0, 2.118314743041992, 1678859677.8898208], "version": 0.2, "tvm_version": "0.10.0"}
{"input": ["cuda -keys=cuda,gpu -arch=sm_75 -max_num_threads=1024 -thread_warp_size=32", "conv2d_nchw.cuda", [["TENSOR", [1, 384, 8, 8], "float32"], ["TENSOR", [384, 384, 1, 3], "float32"], [1, 1], [0, 1, 0, 1], [1, 1], "float32"], {}], "config": {"index": 10443905, "code_hash": null, "entity": [["tile_f", "sp", [-1, 24, 8, 1]], ["tile_y", "sp", [-1, 1, 2, 4]], ["tile_x", "sp", [-1, 1, 4, 1]], ["tile_rc", "sp", [-1, 12]], ["tile_ry", "sp", [-1, 1]], ["tile_rx", "sp", [-1, 3]], ["auto_unroll_max_step", "ot", 512], ["unroll_explicit", "ot", 0]]}, "result": [[0.00031546175733855185, 0.0003154648923679061, 0.0003154946927592955], 0, 2.2377915382385254, 1678859679.1728907], "version": 0.2, "tvm_version": "0.10.0"}
{"input": ["cuda -keys=cuda,gpu -arch=sm_75 -max_num_threads=1024 -thread_warp_size=32", "conv2d_nchw.cuda", [["TENSOR", [1, 384, 8, 8], "float32"], ["TENSOR", [384, 384, 1, 3], "float32"], [1, 1], [0, 1, 0, 1], [1, 1], "float32"], {}], "config": {"index": 31007214, "code_hash": null, "entity": [["tile_f", "sp", [-1, 6, 16, 2]], ["tile_y", "sp", [-1, 1, 2, 4]], ["tile_x", "sp", [-1, 1, 8, 1]], ["tile_rc", "sp", [-1, 2]], ["tile_ry", "sp", [-1, 1]], ["tile_rx", "sp", [-1, 1]], ["auto_unroll_max_step", "ot", 1500], ["unroll_explicit", "ot", 1]]}, "result": [[0.000428058264957265, 0.00042811417948717946, 0.0004281265042735043], 0, 1.717036247253418, 1678859680.0290806], "version": 0.2, "tvm_version": "0.10.0"}
{"input": ["cuda -keys=cuda,gpu -arch=sm_75 -max_num_threads=1024 -thread_warp_size=32", "conv2d_nchw.cuda", [["TENSOR", [1, 384, 8, 8], "float32"], ["TENSOR", [384, 384, 1, 3], "float32"], [1, 1], [0, 1, 0, 1], [1, 1], "float32"], {}], "config": {"index": 10472334, "code_hash": null, "entity": [["tile_f", "sp", [-1, 6, 16, 2]], ["tile_y", "sp", [-1, 2, 1, 4]], ["tile_x", "sp", [-1, 1, 1, 2]], ["tile_rc", "sp", [-1, 12]], ["tile_ry", "sp", [-1, 1]], ["tile_rx", "sp", [-1, 3]], ["auto_unroll_max_step", "ot", 512], ["unroll_explicit", "ot", 0]]}, "result": [[0.0005643056348314607, 0.0005643390674157303, 0.000564444595505618], 0, 2.294783353805542, 1678859680.8862667], "version": 0.2, "tvm_version": "0.10.0"}
{"input": ["cuda -keys=cuda,gpu -arch=sm_75 -max_num_threads=1024 -thread_warp_size=32", "conv2d_nchw.cuda", [["TENSOR", [1, 384, 8, 8], "float32"], ["TENSOR", [384, 384, 1, 3], "float32"], [1, 1], [0, 1, 0, 1], [1, 1], "float32"], {}], "config": {"index": 10472225, "code_hash": null, "entity": [["tile_f", "sp", [-1, 24, 8, 1]], ["tile_y", "sp", [-1, 2, 1, 4]], ["tile_x", "sp", [-1, 1, 1, 2]], ["tile_rc", "sp", [-1, 12]], ["tile_ry", "sp", [-1, 1]], ["tile_rx", "sp", [-1, 3]], ["auto_unroll_max_step", "ot", 512], ["unroll_explicit", "ot", 0]]}, "result": [[0.0038437568809523807, 0.0038447784999999994, 0.0038448228333333332], 0, 2.545964241027832, 1678859682.1641693], "version": 0.2, "tvm_version": "0.10.0"}
{"input": ["cuda -keys=cuda,gpu -arch=sm_75 -max_num_threads=1024 -thread_warp_size=32", "conv2d_nchw.cuda", [["TENSOR", [1, 384, 8, 8], "float32"], ["TENSOR", [384, 384, 1, 3], "float32"], [1, 1], [0, 1, 0, 1], [1, 1], "float32"], {}], "config": {"index": 9334436, "code_hash": null, "entity": [["tile_f", "sp", [-1, 1, 12, 8]], ["tile_y", "sp", [-1, 4, 2, 1]], ["tile_x", "sp", [-1, 4, 1, 2]], ["tile_rc", "sp", [-1, 1]], ["tile_ry", "sp", [-1, 1]], ["tile_rx", "sp", [-1, 3]], ["auto_unroll_max_step", "ot", 512], ["unroll_explicit", "ot", 0]]}, "result": [[0.001123074423611111, 0.0011231195625, 0.0011231715902777777], 0, 2.1088173389434814, 1678859683.449785], "version": 0.2, "tvm_version": "0.10.0"}
{"input": ["cuda -keys=cuda,gpu -arch=sm_75 -max_num_threads=1024 -thread_warp_size=32", "conv2d_nchw.cuda", [["TENSOR", [1, 384, 8, 8], "float32"], ["TENSOR", [384, 384, 1, 3], "float32"], [1, 1], [0, 1, 0, 1], [1, 1], "float32"], {}], "config": {"index": 20691236, "code_hash": null, "entity": [["tile_f", "sp", [-1, 1, 12, 8]], ["tile_y", "sp", [-1, 4, 2, 1]], ["tile_x", "sp", [-1, 1, 4, 2]], ["tile_rc", "sp", [-1, 64]], ["tile_ry", "sp", [-1, 1]], ["tile_rx", "sp", [-1, 1]], ["auto_unroll_max_step", "ot", 0], ["unroll_explicit", "ot", 1]]}, "result": [[0.00043149240948275864, 0.00043152634482758625, 0.0004315541982758621], 0, 1.4925475120544434, 1678859684.3358774], "version": 0.2, "tvm_version": "0.10.0"}
{"input": ["cuda -keys=cuda,gpu -arch=sm_75 -max_num_threads=1024 -thread_warp_size=32", "conv2d_nchw.cuda", [["TENSOR", [1, 384, 8, 8], "float32"], ["TENSOR", [384, 384, 1, 3], "float32"], [1, 1], [0, 1, 0, 1], [1, 1], "float32"], {}], "config": {"index": 13899905, "code_hash": null, "entity": [["tile_f", "sp", [-1, 24, 8, 1]], ["tile_y", "sp", [-1, 1, 2, 4]], ["tile_x", "sp", [-1, 1, 4, 1]], ["tile_rc", "sp", [-1, 24]], ["tile_ry", "sp", [-1, 1]], ["tile_rx", "sp", [-1, 1]], ["auto_unroll_max_step", "ot", 1500], ["unroll_explicit", "ot", 0]]}, "result": [[0.00034918176355748374, 0.00034922181344902383, 0.0003492439566160521], 0, 2.020230770111084, 1678859685.6107469], "version": 0.2, "tvm_version": "0.10.0"}
{"input": ["cuda -keys=cuda,gpu -arch=sm_75 -max_num_threads=1024 -thread_warp_size=32", "conv2d_nchw.cuda", [["TENSOR", [1, 384, 8, 8], "float32"], ["TENSOR", [384, 384, 1, 3], "float32"], [1, 1], [0, 1, 0, 1], [1, 1], "float32"], {}], "config": {"index": 25419905, "code_hash": null, "entity": [["tile_f", "sp", [-1, 24, 8, 1]], ["tile_y", "sp", [-1, 1, 2, 4]], ["tile_x", "sp", [-1, 1, 4, 1]], ["tile_rc", "sp", [-1, 6]], ["tile_ry", "sp", [-1, 1]], ["tile_rx", "sp", [-1, 1]], ["auto_unroll_max_step", "ot", 512], ["unroll_explicit", "ot", 1]]}, "result": [[0.000372542064665127, 0.0003726019376443418, 0.00037264045496535796], 0, 2.0129806995391846, 1678859686.889813], "version": 0.2, "tvm_version": "0.10.0"}
{"input": ["cuda -keys=cuda,gpu -arch=sm_75 -max_num_threads=1024 -thread_warp_size=32", "conv2d_nchw.cuda", [["TENSOR", [1, 384, 8, 8], "float32"], ["TENSOR", [384, 384, 1, 3], "float32"], [1, 1], [0, 1, 0, 1], [1, 1], "float32"], {}], "config": {"index": 34065816, "code_hash": null, "entity": [["tile_f", "sp", [-1, 8, 8, 3]], ["tile_y", "sp", [-1, 1, 1, 2]], ["tile_x", "sp", [-1, 2, 4, 1]], ["tile_rc", "sp", [-1, 2]], ["tile_ry", "sp", [-1, 1]], ["tile_rx", "sp", [-1, 3]], ["auto_unroll_max_step", "ot", 1500], ["unroll_explicit", "ot", 1]]}, "result": [[0.000400023556, 0.00040003710799999995, 0.00040005453200000004], 0, 1.935532808303833, 1678859687.7813735], "version": 0.2, "tvm_version": "0.10.0"}
{"input": ["cuda -keys=cuda,gpu -arch=sm_75 -max_num_threads=1024 -thread_warp_size=32", "conv2d_nchw.cuda", [["TENSOR", [1, 384, 8, 8], "float32"], ["TENSOR", [384, 384, 1, 3], "float32"], [1, 1], [0, 1, 0, 1], [1, 1], "float32"], {}], "config": {"index": 14253966, "code_hash": null, "entity": [["tile_f", "sp", [-1, 4, 1, 12]], ["tile_y", "sp", [-1, 1, 4, 2]], ["tile_x", "sp", [-1, 1, 2, 1]], ["tile_rc", "sp", [-1, 48]], ["tile_ry", "sp", [-1, 1]], ["tile_rx", "sp", [-1, 1]], ["auto_unroll_max_step", "ot", 1500], ["unroll_explicit", "ot", 0]]}, "result": [[0.0005055311565656565, 0.0005055364696969697, 0.0005055964292929293], 0, 2.0550150871276855, 1678859688.6681688], "version": 0.2, "tvm_version": "0.10.0"}
{"input": ["cuda -keys=cuda,gpu -arch=sm_75 -max_num_threads=1024 -thread_warp_size=32", "conv2d_nchw.cuda", [["TENSOR", [1, 384, 8, 8], "float32"], ["TENSOR", [384, 384, 1, 3], "float32"], [1, 1], [0, 1, 0, 1], [1, 1], "float32"], {}], "config": {"index": 30924927, "code_hash": null, "entity": [["tile_f", "sp", [-1, 1, 12, 32]], ["tile_y", "sp", [-1, 4, 2, 1]], ["tile_x", "sp", [-1, 2, 1, 1]], ["tile_rc", "sp", [-1, 2]], ["tile_ry", "sp", [-1, 1]], ["tile_rx", "sp", [-1, 1]], ["auto_unroll_max_step", "ot", 1500], ["unroll_explicit", "ot", 1]]}, "result": [[0.00155472955, 0.0015548671625000001, 0.00155816955], 0, 2.562967300415039, 1678859691.6543627], "version": 0.2, "tvm_version": "0.10.0"}
{"input": ["cuda -keys=cuda,gpu -arch=sm_75 -max_num_threads=1024 -thread_warp_size=32", "conv2d_nchw.cuda", [["TENSOR", [1, 384, 8, 8], "float32"], ["TENSOR", [384, 384, 1, 3], "float32"], [1, 1], [0, 1, 0, 1], [1, 1], "float32"], {}], "config": {"index": 3143703, "code_hash": null, "entity": [["tile_f", "sp", [-1, 6, 32, 2]], ["tile_y", "sp", [-1, 1, 8, 1]], ["tile_x", "sp", [-1, 1, 4, 1]], ["tile_rc", "sp", [-1, 1]], ["tile_ry", "sp", [-1, 1]], ["tile_rx", "sp", [-1, 3]], ["auto_unroll_max_step", "ot", 0], ["unroll_explicit", "ot", 0]]}, "result": [[0.0006703216390041494, 0.000670374887966805, 0.0006717430497925311], 0, 1.7010040283203125, 1678859692.8458488], "version": 0.2, "tvm_version": "0.10.0"}
{"input": ["cuda -keys=cuda,gpu -arch=sm_75 -max_num_threads=1024 -thread_warp_size=32", "conv2d_nchw.cuda", [["TENSOR", [1, 384, 8, 8], "float32"], ["TENSOR", [384, 384, 1, 3], "float32"], [1, 1], [0, 1, 0, 1], [1, 1], "float32"], {}], "config": {"index": 10467236, "code_hash": null, "entity": [["tile_f", "sp", [-1, 1, 12, 8]], ["tile_y", "sp", [-1, 4, 2, 1]], ["tile_x", "sp", [-1, 1, 1, 2]], ["tile_rc", "sp", [-1, 12]], ["tile_ry", "sp", [-1, 1]], ["tile_rx", "sp", [-1, 3]], ["auto_unroll_max_step", "ot", 512], ["unroll_explicit", "ot", 0]]}, "result": [[0.00044440451657458565, 0.00044444544475138125, 0.00044446251657458564], 0, 2.0869853496551514, 1678859694.074712], "version": 0.2, "tvm_version": "0.10.0"}
{"input": ["cuda -keys=cuda,gpu -arch=sm_75 -max_num_threads=1024 -thread_warp_size=32", "conv2d_nchw.cuda", [["TENSOR", [1, 384, 8, 8], "float32"], ["TENSOR", [384, 384, 1, 3], "float32"], [1, 1], [0, 1, 0, 1], [1, 1], "float32"], {}], "config": {"index": 4407733, "code_hash": null, "entity": [["tile_f", "sp", [-1, 8, 2, 12]], ["tile_y", "sp", [-1, 4, 1, 1]], ["tile_x", "sp", [-1, 1, 1, 8]], ["tile_rc", "sp", [-1, 12]], ["tile_ry", "sp", [-1, 1]], ["tile_rx", "sp", [-1, 3]], ["auto_unroll_max_step", "ot", 0], ["unroll_explicit", "ot", 0]]}, "result": [[0.02909795175, 0.029170568249999997, 0.029177944], 0, 2.740354061126709, 1678859695.0995746], "version": 0.2, "tvm_version": "0.10.0"}
{"input": ["cuda -keys=cuda,gpu -arch=sm_75 -max_num_threads=1024 -thread_warp_size=32", "conv2d_nchw.cuda", [["TENSOR", [1, 384, 8, 8], "float32"], ["TENSOR", [384, 384, 1, 3], "float32"], [1, 1], [0, 1, 0, 1], [1, 1], "float32"], {}], "config": {"index": 34109345, "code_hash": null, "entity": [["tile_f", "sp", [-1, 24, 8, 1]], ["tile_y", "sp", [-1, 2, 1, 1]], ["tile_x", "sp", [-1, 1, 2, 2]], ["tile_rc", "sp", [-1, 2]], ["tile_ry", "sp", [-1, 1]], ["tile_rx", "sp", [-1, 3]], ["auto_unroll_max_step", "ot", 1500], ["unroll_explicit", "ot", 1]]}, "result": [[0.00047951357894736844, 0.00047954233971291867, 0.00047957497607655506], 0, 2.0904035568237305, 1678859695.9532995], "version": 0.2, "tvm_version": "0.10.0"}
{"input": ["cuda -keys=cuda,gpu -arch=sm_75 -max_num_threads=1024 -thread_warp_size=32", "conv2d_nchw.cuda", [["TENSOR", [1, 384, 8, 8], "float32"], ["TENSOR", [384, 384, 1, 3], "float32"], [1, 1], [0, 1, 0, 1], [1, 1], "float32"], {}], "config": {"index": 2501414, "code_hash": null, "entity": [["tile_f", "sp", [-1, 1, 3, 2]], ["tile_y", "sp", [-1, 2, 1, 2]], ["tile_x", "sp", [-1, 1, 1, 1]], ["tile_rc", "sp", [-1, 128]], ["tile_ry", "sp", [-1, 1]], ["tile_rx", "sp", [-1, 1]], ["auto_unroll_max_step", "ot", 0], ["unroll_explicit", "ot", 0]]}, "result": [[0.0014414769714285716, 0.0014418798142857142, 0.0014421146857142857], 0, 1.4985275268554688, 1678859696.7996724], "version": 0.2, "tvm_version": "0.10.0"}
{"input": ["cuda -keys=cuda,gpu -arch=sm_75 -max_num_threads=1024 -thread_warp_size=32", "conv2d_nchw.cuda", [["TENSOR", [1, 384, 8, 8], "float32"], ["TENSOR", [384, 384, 1, 3], "float32"], [1, 1], [0, 1, 0, 1], [1, 1], "float32"], {}], "config": {"index": 13544469, "code_hash": null, "entity": [["tile_f", "sp", [-1, 1, 8, 6]], ["tile_y", "sp", [-1, 2, 1, 4]], ["tile_x", "sp", [-1, 1, 1, 2]], ["tile_rc", "sp", [-1, 12]], ["tile_ry", "sp", [-1, 1]], ["tile_rx", "sp", [-1, 1]], ["auto_unroll_max_step", "ot", 1500], ["unroll_explicit", "ot", 0]]}, "result": [[0.00032470970846394984, 0.00032473008463949844, 0.00032475144200626955], 0, 1.8863296508789062, 1678859697.6695147], "version": 0.2, "tvm_version": "0.10.0"}
{"input": ["cuda -keys=cuda,gpu -arch=sm_75 -max_num_threads=1024 -thread_warp_size=32", "conv2d_nchw.cuda", [["TENSOR", [1, 384, 8, 8], "float32"], ["TENSOR", [384, 384, 1, 3], "float32"], [1, 1], [0, 1, 0, 1], [1, 1], "float32"], {}], "config": {"index": 843905, "code_hash": null, "entity": [["tile_f", "sp", [-1, 24, 8, 1]], ["tile_y", "sp", [-1, 1, 2, 4]], ["tile_x", "sp", [-1, 1, 4, 1]], ["tile_rc", "sp", [-1, 6]], ["tile_ry", "sp", [-1, 1]], ["tile_rx", "sp", [-1, 1]], ["auto_unroll_max_step", "ot", 0], ["unroll_explicit", "ot", 0]]}, "result": [[0.00036971531422018346, 0.00036975741513761473, 0.00036979076834862387], 0, 1.8352441787719727, 1678859698.9258132], "version": 0.2, "tvm_version": "0.10.0"}
{"input": ["cuda -keys=cuda,gpu -arch=sm_75 -max_num_threads=1024 -thread_warp_size=32", "conv2d_nchw.cuda", [["TENSOR", [1, 384, 8, 8], "float32"], ["TENSOR", [384, 384, 1, 3], "float32"], [1, 1], [0, 1, 0, 1], [1, 1], "float32"], {}], "config": {"index": 15660836, "code_hash": null, "entity": [["tile_f", "sp", [-1, 1, 12, 8]], ["tile_y", "sp", [-1, 4, 2, 1]], ["tile_x", "sp", [-1, 2, 1, 2]], ["tile_rc", "sp", [-1, 2]], ["tile_ry", "sp", [-1, 1]], ["tile_rx", "sp", [-1, 3]], ["auto_unroll_max_step", "ot", 1500], ["unroll_explicit", "ot", 0]]}, "result": [[0.00029426912820512815, 0.00029430434065934064, 0.00029436436996337], 0, 2.085026502609253, 1678859700.179724], "version": 0.2, "tvm_version": "0.10.0"}
{"input": ["cuda -keys=cuda,gpu -arch=sm_75 -max_num_threads=1024 -thread_warp_size=32", "conv2d_nchw.cuda", [["TENSOR", [1, 384, 8, 8], "float32"], ["TENSOR", [384, 384, 1, 3], "float32"], [1, 1], [0, 1, 0, 1], [1, 1], "float32"], {}], "config": {"index": 204447, "code_hash": null, "entity": [["tile_f", "sp", [-1, 1, 12, 32]], ["tile_y", "sp", [-1, 2, 2, 1]], ["tile_x", "sp", [-1, 2, 1, 1]], ["tile_rc", "sp", [-1, 2]], ["tile_ry", "sp", [-1, 1]], ["tile_rx", "sp", [-1, 1]], ["auto_unroll_max_step", "ot", 0], ["unroll_explicit", "ot", 0]]}, "result": [[0.0012873517435897438, 0.001287378064102564, 0.0012876405897435895], 0, 1.3759629726409912, 1678859701.013233], "version": 0.2, "tvm_version": "0.10.0"}
