results/cuda_gtx1650/mxnet/droplet/cpu.log_layer_10.log
{"input": ["cuda -keys=cuda,gpu -arch=sm_75 -max_num_threads=1024 -thread_warp_size=32", "conv2d_nchw.cuda", [["TENSOR", [1, 128, 28, 28], "float32"], ["TENSOR", [512, 128, 1, 1], "float32"], [1, 1], [0, 0, 0, 0], [1, 1], "float32"], {}], "config": {"index": 0, "code_hash": null, "entity": [["tile_f", "sp", [-1, 1, 1, 1]], ["tile_y", "sp", [-1, 1, 1, 1]], ["tile_x", "sp", [-1, 1, 1, 1]], ["tile_rc", "sp", [-1, 1]], ["tile_ry", "sp", [-1, 1]], ["tile_rx", "sp", [-1, 1]], ["auto_unroll_max_step", "ot", 0], ["unroll_explicit", "ot", 0]]}, "result": [[0.008843621500000001, 0.008843887916666666, 0.008844970666666665], 0, 1.0440468788146973, 1679470749.9451985], "version": 0.2, "tvm_version": "0.10.0"}
{"input": ["cuda -keys=cuda,gpu -arch=sm_75 -max_num_threads=1024 -thread_warp_size=32", "conv2d_nchw.cuda", [["TENSOR", [1, 128, 28, 28], "float32"], ["TENSOR", [512, 128, 1, 1], "float32"], [1, 1], [0, 0, 0, 0], [1, 1], "float32"], {}], "config": {"index": 11625021, "code_hash": null, "entity": [["tile_f", "sp", [-1, 2, 1, 1]], ["tile_y", "sp", [-1, 2, 1, 1]], ["tile_x", "sp", [-1, 2, 1, 1]], ["tile_rc", "sp", [-1, 2]], ["tile_ry", "sp", [-1, 1]], ["tile_rx", "sp", [-1, 1]], ["auto_unroll_max_step", "ot", 512], ["unroll_explicit", "ot", 1]]}, "result": [[0.006632598052631579, 0.006632609684210526, 0.0066430230000000005], 0, 1.5773365497589111, 1679470752.4440267], "version": 0.2, "tvm_version": "0.10.0"}
{"input": ["cuda -keys=cuda,gpu -arch=sm_75 -max_num_threads=1024 -thread_warp_size=32", "conv2d_nchw.cuda", [["TENSOR", [1, 128, 28, 28], "float32"], ["TENSOR", [512, 128, 1, 1], "float32"], [1, 1], [0, 0, 0, 0], [1, 1], "float32"], {}], "config": {"index": 8448000, "code_hash": null, "entity": [["tile_f", "sp", [-1, 1, 1, 1]], ["tile_y", "sp", [-1, 1, 1, 1]], ["tile_x", "sp", [-1, 1, 1, 1]], ["tile_rc", "sp", [-1, 1]], ["tile_ry", "sp", [-1, 1]], ["tile_rx", "sp", [-1, 1]], ["auto_unroll_max_step", "ot", 0], ["unroll_explicit", "ot", 1]]}, "result": [[0.0088422775, 0.00884526125, 0.008845317166666667], 0, 1.3239891529083252, 1679470753.3444703], "version": 0.2, "tvm_version": "0.10.0"}
{"input": ["cuda -keys=cuda,gpu -arch=sm_75 -max_num_threads=1024 -thread_warp_size=32", "conv2d_nchw.cuda", [["TENSOR", [1, 128, 28, 28], "float32"], ["TENSOR", [512, 128, 1, 1], "float32"], [1, 1], [0, 0, 0, 0], [1, 1], "float32"], {}], "config": {"index": 2816000, "code_hash": null, "entity": [["tile_f", "sp", [-1, 1, 1, 1]], ["tile_y", "sp", [-1, 1, 1, 1]], ["tile_x", "sp", [-1, 1, 1, 1]], ["tile_rc", "sp", [-1, 1]], ["tile_ry", "sp", [-1, 1]], ["tile_rx", "sp", [-1, 1]], ["auto_unroll_max_step", "ot", 512], ["unroll_explicit", "ot", 0]]}, "result": [[0.008944274833333333, 0.008944306666666667, 0.00894463475], 0, 1.522611141204834, 1679470754.2492878], "version": 0.2, "tvm_version": "0.10.0"}
{"input": ["cuda -keys=cuda,gpu -arch=sm_75 -max_num_threads=1024 -thread_warp_size=32", "conv2d_nchw.cuda", [["TENSOR", [1, 128, 28, 28], "float32"], ["TENSOR", [512, 128, 1, 1], "float32"], [1, 1], [0, 0, 0, 0], [1, 1], "float32"], {}], "config": {"index": 352000, "code_hash": null, "entity": [["tile_f", "sp", [-1, 1, 1, 1]], ["tile_y", "sp", [-1, 1, 1, 1]], ["tile_x", "sp", [-1, 1, 1, 1]], ["tile_rc", "sp", [-1, 2]], ["tile_ry", "sp", [-1, 1]], ["tile_rx", "sp", [-1, 1]], ["auto_unroll_max_step", "ot", 0], ["unroll_explicit", "ot", 0]]}, "result": [[0.025791032749999998, 0.02579258325, 0.02579269575], 0, 1.4348475933074951, 1679470755.1806436], "version": 0.2, "tvm_version": "0.10.0"}
{"input": ["cuda -keys=cuda,gpu -arch=sm_75 -max_num_threads=1024 -thread_warp_size=32", "conv2d_nchw.cuda", [["TENSOR", [1, 128, 28, 28], "float32"], ["TENSOR", [512, 128, 1, 1], "float32"], [1, 1], [0, 0, 0, 0], [1, 1], "float32"], {}], "config": {"index": 8800, "code_hash": null, "entity": [["tile_f", "sp", [-1, 1, 1, 1]], ["tile_y", "sp", [-1, 1, 1, 1]], ["tile_x", "sp", [-1, 2, 1, 1]], ["tile_rc", "sp", [-1, 1]], ["tile_ry", "sp", [-1, 1]], ["tile_rx", "sp", [-1, 1]], ["auto_unroll_max_step", "ot", 0], ["unroll_explicit", "ot", 0]]}, "result": [[0.025185911000000002, 0.025187328250000002, 0.0252043035], 0, 1.4431920051574707, 1679470756.09638], "version": 0.2, "tvm_version": "0.10.0"}
{"input": ["cuda -keys=cuda,gpu -arch=sm_75 -max_num_threads=1024 -thread_warp_size=32", "conv2d_nchw.cuda", [["TENSOR", [1, 128, 28, 28], "float32"], ["TENSOR", [512, 128, 1, 1], "float32"], [1, 1], [0, 0, 0, 0], [1, 1], "float32"], {}], "config": {"index": 220, "code_hash": null, "entity": [["tile_f", "sp", [-1, 1, 1, 1]], ["tile_y", "sp", [-1, 2, 1, 1]], ["tile_x", "sp", [-1, 1, 1, 1]], ["tile_rc", "sp", [-1, 1]], ["tile_ry", "sp", [-1, 1]], ["tile_rx", "sp", [-1, 1]], ["auto_unroll_max_step", "ot", 0], ["unroll_explicit", "ot", 0]]}, "result": [[0.025176359000000002, 0.0251772325, 0.025177400500000002], 0, 1.4875280857086182, 1679470757.0425367], "version": 0.2, "tvm_version": "0.10.0"}
{"input": ["cuda -keys=cuda,gpu -arch=sm_75 -max_num_threads=1024 -thread_warp_size=32", "conv2d_nchw.cuda", [["TENSOR", [1, 128, 28, 28], "float32"], ["TENSOR", [512, 128, 1, 1], "float32"], [1, 1], [0, 0, 0, 0], [1, 1], "float32"], {}], "config": {"index": 1, "code_hash": null, "entity": [["tile_f", "sp", [-1, 2, 1, 1]], ["tile_y", "sp", [-1, 1, 1, 1]], ["tile_x", "sp", [-1, 1, 1, 1]], ["tile_rc", "sp", [-1, 1]], ["tile_ry", "sp", [-1, 1]], ["tile_rx", "sp", [-1, 1]], ["auto_unroll_max_step", "ot", 0], ["unroll_explicit", "ot", 0]]}, "result": [[0.025115135, 0.02511547275, 0.02511564825], 0, 1.476353645324707, 1679470757.9597914], "version": 0.2, "tvm_version": "0.10.0"}
{"input": ["cuda -keys=cuda,gpu -arch=sm_75 -max_num_threads=1024 -thread_warp_size=32", "conv2d_nchw.cuda", [["TENSOR", [1, 128, 28, 28], "float32"], ["TENSOR", [512, 128, 1, 1], "float32"], [1, 1], [0, 0, 0, 0], [1, 1], "float32"], {}], "config": {"index": 5632000, "code_hash": null, "entity": [["tile_f", "sp", [-1, 1, 1, 1]], ["tile_y", "sp", [-1, 1, 1, 1]], ["tile_x", "sp", [-1, 1, 1, 1]], ["tile_rc", "sp", [-1, 1]], ["tile_ry", "sp", [-1, 1]], ["tile_rx", "sp", [-1, 1]], ["auto_unroll_max_step", "ot", 1500], ["unroll_explicit", "ot", 0]]}, "result": [[0.008943456, 0.008944533, 0.008945122333333335], 0, 1.3017549514770508, 1679470758.847534], "version": 0.2, "tvm_version": "0.10.0"}
{"input": ["cuda -keys=cuda,gpu -arch=sm_75 -max_num_threads=1024 -thread_warp_size=32", "conv2d_nchw.cuda", [["TENSOR", [1, 128, 28, 28], "float32"], ["TENSOR", [512, 128, 1, 1], "float32"], [1, 1], [0, 0, 0, 0], [1, 1], "float32"], {}], "config": {"index": 704000, "code_hash": null, "entity": [["tile_f", "sp", [-1, 1, 1, 1]], ["tile_y", "sp", [-1, 1, 1, 1]], ["tile_x", "sp", [-1, 1, 1, 1]], ["tile_rc", "sp", [-1, 4]], ["tile_ry", "sp", [-1, 1]], ["tile_rx", "sp", [-1, 1]], ["auto_unroll_max_step", "ot", 0], ["unroll_explicit", "ot", 0]]}, "result": [[0.0191682395, 0.019168858833333333, 0.019168938833333333], 0, 1.501155138015747, 1679470759.8298025], "version": 0.2, "tvm_version": "0.10.0"}
{"input": ["cuda -keys=cuda,gpu -arch=sm_75 -max_num_threads=1024 -thread_warp_size=32", "conv2d_nchw.cuda", [["TENSOR", [1, 128, 28, 28], "float32"], ["TENSOR", [512, 128, 1, 1], "float32"], [1, 1], [0, 0, 0, 0], [1, 1], "float32"], {}], "config": {"index": 17600, "code_hash": null, "entity": [["tile_f", "sp", [-1, 1, 1, 1]], ["tile_y", "sp", [-1, 1, 1, 1]], ["tile_x", "sp", [-1, 4, 1, 1]], ["tile_rc", "sp", [-1, 1]], ["tile_ry", "sp", [-1, 1]], ["tile_rx", "sp", [-1, 1]], ["auto_unroll_max_step", "ot", 0], ["unroll_explicit", "ot", 0]]}, "result": [[0.016254980857142855, 0.016255139999999998, 0.016255780857142858], 0, 1.5387117862701416, 1679470760.7935185], "version": 0.2, "tvm_version": "0.10.0"}
{"input": ["cuda -keys=cuda,gpu -arch=sm_75 -max_num_threads=1024 -thread_warp_size=32", "conv2d_nchw.cuda", [["TENSOR", [1, 128, 28, 28], "float32"], ["TENSOR", [512, 128, 1, 1], "float32"], [1, 1], [0, 0, 0, 0], [1, 1], "float32"], {}], "config": {"index": 440, "code_hash": null, "entity": [["tile_f", "sp", [-1, 1, 1, 1]], ["tile_y", "sp", [-1, 4, 1, 1]], ["tile_x", "sp", [-1, 1, 1, 1]], ["tile_rc", "sp", [-1, 1]], ["tile_ry", "sp", [-1, 1]], ["tile_rx", "sp", [-1, 1]], ["auto_unroll_max_step", "ot", 0], ["unroll_explicit", "ot", 0]]}, "result": [[0.016125719285714286, 0.016127313857142857, 0.01612887785714286], 0, 1.491990089416504, 1679470761.7290661], "version": 0.2, "tvm_version": "0.10.0"}
{"input": ["cuda -keys=cuda,gpu -arch=sm_75 -max_num_threads=1024 -thread_warp_size=32", "conv2d_nchw.cuda", [["TENSOR", [1, 128, 28, 28], "float32"], ["TENSOR", [512, 128, 1, 1], "float32"], [1, 1], [0, 0, 0, 0], [1, 1], "float32"], {}], "config": {"index": 2, "code_hash": null, "entity": [["tile_f", "sp", [-1, 4, 1, 1]], ["tile_y", "sp", [-1, 1, 1, 1]], ["tile_x", "sp", [-1, 1, 1, 1]], ["tile_rc", "sp", [-1, 1]], ["tile_ry", "sp", [-1, 1]], ["tile_rx", "sp", [-1, 1]], ["auto_unroll_max_step", "ot", 0], ["unroll_explicit", "ot", 0]]}, "result": [[0.01571722942857143, 0.015717270857142855, 0.01571730257142857], 0, 1.5772180557250977, 1679470762.6665518], "version": 0.2, "tvm_version": "0.10.0"}
{"input": ["cuda -keys=cuda,gpu -arch=sm_75 -max_num_threads=1024 -thread_warp_size=32", "conv2d_nchw.cuda", [["TENSOR", [1, 128, 28, 28], "float32"], ["TENSOR", [512, 128, 1, 1], "float32"], [1, 1], [0, 0, 0, 0], [1, 1], "float32"], {}], "config": {"index": 1056000, "code_hash": null, "entity": [["tile_f", "sp", [-1, 1, 1, 1]], ["tile_y", "sp", [-1, 1, 1, 1]], ["tile_x", "sp", [-1, 1, 1, 1]], ["tile_rc", "sp", [-1, 8]], ["tile_ry", "sp", [-1, 1]], ["tile_rx", "sp", [-1, 1]], ["auto_unroll_max_step", "ot", 0], ["unroll_explicit", "ot", 0]]}, "result": [[0.01605456857142857, 0.01605494357142857, 0.016054949], 0, 1.471217393875122, 1679470763.6092005], "version": 0.2, "tvm_version": "0.10.0"}
{"input": ["cuda -keys=cuda,gpu -arch=sm_75 -max_num_threads=1024 -thread_warp_size=32", "conv2d_nchw.cuda", [["TENSOR", [1, 128, 28, 28], "float32"], ["TENSOR", [512, 128, 1, 1], "float32"], [1, 1], [0, 0, 0, 0], [1, 1], "float32"], {}], "config": {"index": 26400, "code_hash": null, "entity": [["tile_f", "sp", [-1, 1, 1, 1]], ["tile_y", "sp", [-1, 1, 1, 1]], ["tile_x", "sp", [-1, 7, 1, 1]], ["tile_rc", "sp", [-1, 1]], ["tile_ry", "sp", [-1, 1]], ["tile_rx", "sp", [-1, 1]], ["auto_unroll_max_step", "ot", 0], ["unroll_explicit", "ot", 0]]}, "result": [[0.011359882777777778, 0.011360483777777777, 0.011360597333333333], 0, 1.3691463470458984, 1679470764.4987643], "version": 0.2, "tvm_version": "0.10.0"}
{"input": ["cuda -keys=cuda,gpu -arch=sm_75 -max_num_threads=1024 -thread_warp_size=32", "conv2d_nchw.cuda", [["TENSOR", [1, 128, 28, 28], "float32"], ["TENSOR", [512, 128, 1, 1], "float32"], [1, 1], [0, 0, 0, 0], [1, 1], "float32"], {}], "config": {"index": 660, "code_hash": null, "entity": [["tile_f", "sp", [-1, 1, 1, 1]], ["tile_y", "sp", [-1, 7, 1, 1]], ["tile_x", "sp", [-1, 1, 1, 1]], ["tile_rc", "sp", [-1, 1]], ["tile_ry", "sp", [-1, 1]], ["tile_rx", "sp", [-1, 1]], ["auto_unroll_max_step", "ot", 0], ["unroll_explicit", "ot", 0]]}, "result": [[0.011240561555555556, 0.011242563777777779, 0.011246240333333333], 0, 1.370509147644043, 1679470765.3771071], "version": 0.2, "tvm_version": "0.10.0"}
{"input": ["cuda -keys=cuda,gpu -arch=sm_75 -max_num_threads=1024 -thread_warp_size=32", "conv2d_nchw.cuda", [["TENSOR", [1, 128, 28, 28], "float32"], ["TENSOR", [512, 128, 1, 1], "float32"], [1, 1], [0, 0, 0, 0], [1, 1], "float32"], {}], "config": {"index": 3, "code_hash": null, "entity": [["tile_f", "sp", [-1, 8, 1, 1]], ["tile_y", "sp", [-1, 1, 1, 1]], ["tile_x", "sp", [-1, 1, 1, 1]], ["tile_rc", "sp", [-1, 1]], ["tile_ry", "sp", [-1, 1]], ["tile_rx", "sp", [-1, 1]], ["auto_unroll_max_step", "ot", 0], ["unroll_explicit", "ot", 0]]}, "result": [[0.0109502334, 0.0109503456, 0.010951065800000001], 0, 1.4176690578460693, 1679470766.279666], "version": 0.2, "tvm_version": "0.10.0"}
{"input": ["cuda -keys=cuda,gpu -arch=sm_75 -max_num_threads=1024 -thread_warp_size=32", "conv2d_nchw.cuda", [["TENSOR", [1, 128, 28, 28], "float32"], ["TENSOR", [512, 128, 1, 1], "float32"], [1, 1], [0, 0, 0, 0], [1, 1], "float32"], {}], "config": {"index": 6354042, "code_hash": null, "entity": [["tile_f", "sp", [-1, 4, 1, 1]], ["tile_y", "sp", [-1, 4, 1, 1]], ["tile_x", "sp", [-1, 4, 1, 1]], ["tile_rc", "sp", [-1, 4]], ["tile_ry", "sp", [-1, 1]], ["tile_rx", "sp", [-1, 1]], ["auto_unroll_max_step", "ot", 1500], ["unroll_explicit", "ot", 0]]}, "result": [[0.002230703482142857, 0.002234622803571428, 0.0024843578214285714], 0, 1.714003324508667, 1679470770.155057], "version": 0.2, "tvm_version": "0.10.0"}
{"input": ["cuda -keys=cuda,gpu -arch=sm_75 -max_num_threads=1024 -thread_warp_size=32", "conv2d_nchw.cuda", [["TENSOR", [1, 128, 28, 28], "float32"], ["TENSOR", [512, 128, 1, 1], "float32"], [1, 1], [0, 0, 0, 0], [1, 1], "float32"], {}], "config": {"index": 14441021, "code_hash": null, "entity": [["tile_f", "sp", [-1, 2, 1, 1]], ["tile_y", "sp", [-1, 2, 1, 1]], ["tile_x", "sp", [-1, 2, 1, 1]], ["tile_rc", "sp", [-1, 2]], ["tile_ry", "sp", [-1, 1]], ["tile_rx", "sp", [-1, 1]], ["auto_unroll_max_step", "ot", 1500], ["unroll_explicit", "ot", 1]]}, "result": [[0.0066321239375000006, 0.006632530187499999, 0.0066325759375], 0, 1.3061473369598389, 1679470771.0553102], "version": 0.2, "tvm_version": "0.10.0"}
{"input": ["cuda -keys=cuda,gpu -arch=sm_75 -max_num_threads=1024 -thread_warp_size=32", "conv2d_nchw.cuda", [["TENSOR", [1, 128, 28, 28], "float32"], ["TENSOR", [512, 128, 1, 1], "float32"], [1, 1], [0, 0, 0, 0], [1, 1], "float32"], {}], "config": {"index": 13033021, "code_hash": null, "entity": [["tile_f", "sp", [-1, 2, 1, 1]], ["tile_y", "sp", [-1, 2, 1, 1]], ["tile_x", "sp", [-1, 2, 1, 1]], ["tile_rc", "sp", [-1, 32]], ["tile_ry", "sp", [-1, 1]], ["tile_rx", "sp", [-1, 1]], ["auto_unroll_max_step", "ot", 512], ["unroll_explicit", "ot", 1]]}, "result": [[0.005071656, 0.0050717697, 0.0050718704], 0, 1.7171416282653809, 1679470771.9157314], "version": 0.2, "tvm_version": "0.10.0"}
{"input": ["cuda -keys=cuda,gpu -arch=sm_75 -max_num_threads=1024 -thread_warp_size=32", "conv2d_nchw.cuda", [["TENSOR", [1, 128, 28, 28], "float32"], ["TENSOR", [512, 128, 1, 1], "float32"], [1, 1], [0, 0, 0, 0], [1, 1], "float32"], {}], "config": {"index": 11660221, "code_hash": null, "entity": [["tile_f", "sp", [-1, 2, 1, 1]], ["tile_y", "sp", [-1, 2, 1, 1]], ["tile_x", "sp", [-1, 28, 1, 1]], ["tile_rc", "sp", [-1, 2]], ["tile_ry", "sp", [-1, 1]], ["tile_rx", "sp", [-1, 1]], ["auto_unroll_max_step", "ot", 512], ["unroll_explicit", "ot", 1]]}, "result": [[0.00365492, 0.00365664125, 0.0036572731428571427], 0, 1.7077019214630127, 1679470772.7577481], "version": 0.2, "tvm_version": "0.10.0"}
{"input": ["cuda -keys=cuda,gpu -arch=sm_75 -max_num_threads=1024 -thread_warp_size=32", "conv2d_nchw.cuda", [["TENSOR", [1, 128, 28, 28], "float32"], ["TENSOR", [512, 128, 1, 1], "float32"], [1, 1], [0, 0, 0, 0], [1, 1], "float32"], {}], "config": {"index": 11625901, "code_hash": null, "entity": [["tile_f", "sp", [-1, 2, 1, 1]], ["tile_y", "sp", [-1, 28, 1, 1]], ["tile_x", "sp", [-1, 2, 1, 1]], ["tile_rc", "sp", [-1, 2]], ["tile_ry", "sp", [-1, 1]], ["tile_rx", "sp", [-1, 1]], ["auto_unroll_max_step", "ot", 512], ["unroll_explicit", "ot", 1]]}, "result": [[0.0036422821785714286, 0.003642587357142857, 0.0036426811071428567], 0, 1.6446433067321777, 1679470773.6261091], "version": 0.2, "tvm_version": "0.10.0"}
{"input": ["cuda -keys=cuda,gpu -arch=sm_75 -max_num_threads=1024 -thread_warp_size=32", "conv2d_nchw.cuda", [["TENSOR", [1, 128, 28, 28], "float32"], ["TENSOR", [512, 128, 1, 1], "float32"], [1, 1], [0, 0, 0, 0], [1, 1], "float32"], {}], "config": {"index": 11625025, "code_hash": null, "entity": [["tile_f", "sp", [-1, 32, 1, 1]], ["tile_y", "sp", [-1, 2, 1, 1]], ["tile_x", "sp", [-1, 2, 1, 1]], ["tile_rc", "sp", [-1, 2]], ["tile_ry", "sp", [-1, 1]], ["tile_rx", "sp", [-1, 1]], ["auto_unroll_max_step", "ot", 512], ["unroll_explicit", "ot", 1]]}, "result": [[0.0020347730999999997, 0.0020348684600000003, 0.0020351718], 0, 1.6919798851013184, 1679470774.488228], "version": 0.2, "tvm_version": "0.10.0"}
{"input": ["cuda -keys=cuda,gpu -arch=sm_75 -max_num_threads=1024 -thread_warp_size=32", "conv2d_nchw.cuda", [["TENSOR", [1, 128, 28, 28], "float32"], ["TENSOR", [512, 128, 1, 1], "float32"], [1, 1], [0, 0, 0, 0], [1, 1], "float32"], {}], "config": {"index": 3177021, "code_hash": null, "entity": [["tile_f", "sp", [-1, 2, 1, 1]], ["tile_y", "sp", [-1, 2, 1, 1]], ["tile_x", "sp", [-1, 2, 1, 1]], ["tile_rc", "sp", [-1, 2]], ["tile_ry", "sp", [-1, 1]], ["tile_rx", "sp", [-1, 1]], ["auto_unroll_max_step", "ot", 512], ["unroll_explicit", "ot", 0]]}, "result": [[0.006633081875, 0.0066332201875, 0.006633235875], 0, 1.2955458164215088, 1679470775.3760512], "version": 0.2, "tvm_version": "0.10.0"}
{"input": ["cuda -keys=cuda,gpu -arch=sm_75 -max_num_threads=1024 -thread_warp_size=32", "conv2d_nchw.cuda", [["TENSOR", [1, 128, 28, 28], "float32"], ["TENSOR", [512, 128, 1, 1], "float32"], [1, 1], [0, 0, 0, 0], [1, 1], "float32"], {}], "config": {"index": 8809021, "code_hash": null, "entity": [["tile_f", "sp", [-1, 2, 1, 1]], ["tile_y", "sp", [-1, 2, 1, 1]], ["tile_x", "sp", [-1, 2, 1, 1]], ["tile_rc", "sp", [-1, 2]], ["tile_ry", "sp", [-1, 1]], ["tile_rx", "sp", [-1, 1]], ["auto_unroll_max_step", "ot", 0], ["unroll_explicit", "ot", 1]]}, "result": [[0.0066329598125, 0.0066332120625, 0.0066334981875], 0, 1.3012442588806152, 1679470776.2616978], "version": 0.2, "tvm_version": "0.10.0"}
{"input": ["cuda -keys=cuda,gpu -arch=sm_75 -max_num_threads=1024 -thread_warp_size=32", "conv2d_nchw.cuda", [["TENSOR", [1, 128, 28, 28], "float32"], ["TENSOR", [512, 128, 1, 1], "float32"], [1, 1], [0, 0, 0, 0], [1, 1], "float32"], {}], "config": {"index": 13385021, "code_hash": null, "entity": [["tile_f", "sp", [-1, 2, 1, 1]], ["tile_y", "sp", [-1, 2, 1, 1]], ["tile_x", "sp", [-1, 2, 1, 1]], ["tile_rc", "sp", [-1, 64]], ["tile_ry", "sp", [-1, 1]], ["tile_rx", "sp", [-1, 1]], ["auto_unroll_max_step", "ot", 512], ["unroll_explicit", "ot", 1]]}, "result": [[0.00509309765, 0.00509313125, 0.005093163249999999], 0, 2.1983885765075684, 1679470777.1042], "version": 0.2, "tvm_version": "0.10.0"}
{"input": ["cuda -keys=cuda,gpu -arch=sm_75 -max_num_threads=1024 -thread_warp_size=32", "conv2d_nchw.cuda", [["TENSOR", [1, 128, 28, 28], "float32"], ["TENSOR", [512, 128, 1, 1], "float32"], [1, 1], [0, 0, 0, 0], [1, 1], "float32"], {}], "config": {"index": 11669021, "code_hash": null, "entity": [["tile_f", "sp", [-1, 2, 1, 1]], ["tile_y", "sp", [-1, 2, 1, 1]], ["tile_x", "sp", [-1, 1, 2, 1]], ["tile_rc", "sp", [-1, 2]], ["tile_ry", "sp", [-1, 1]], ["tile_rx", "sp", [-1, 1]], ["auto_unroll_max_step", "ot", 512], ["unroll_explicit", "ot", 1]]}, "result": [[0.005818136833333333, 0.0058181491111111115, 0.005818252555555555], 0, 1.3074486255645752, 1679470777.9854097], "version": 0.2, "tvm_version": "0.10.0"}
{"input": ["cuda -keys=cuda,gpu -arch=sm_75 -max_num_threads=1024 -thread_warp_size=32", "conv2d_nchw.cuda", [["TENSOR", [1, 128, 28, 28], "float32"], ["TENSOR", [512, 128, 1, 1], "float32"], [1, 1], [0, 0, 0, 0], [1, 1], "float32"], {}], "config": {"index": 11626121, "code_hash": null, "entity": [["tile_f", "sp", [-1, 2, 1, 1]], ["tile_y", "sp", [-1, 1, 2, 1]], ["tile_x", "sp", [-1, 2, 1, 1]], ["tile_rc", "sp", [-1, 2]], ["tile_ry", "sp", [-1, 1]], ["tile_rx", "sp", [-1, 1]], ["auto_unroll_max_step", "ot", 512], ["unroll_explicit", "ot", 1]]}, "result": [[0.005321249684210527, 0.0053213235789473685, 0.005321444842105263], 0, 1.2913506031036377, 1679470778.8464077], "version": 0.2, "tvm_version": "0.10.0"}
{"input": ["cuda -keys=cuda,gpu -arch=sm_75 -max_num_threads=1024 -thread_warp_size=32", "conv2d_nchw.cuda", [["TENSOR", [1, 128, 28, 28], "float32"], ["TENSOR", [512, 128, 1, 1], "float32"], [1, 1], [0, 0, 0, 0], [1, 1], "float32"], {}], "config": {"index": 11625026, "code_hash": null, "entity": [["tile_f", "sp", [-1, 64, 1, 1]], ["tile_y", "sp", [-1, 2, 1, 1]], ["tile_x", "sp", [-1, 2, 1, 1]], ["tile_rc", "sp", [-1, 2]], ["tile_ry", "sp", [-1, 1]], ["tile_rx", "sp", [-1, 1]], ["auto_unroll_max_step", "ot", 512], ["unroll_explicit", "ot", 1]]}, "result": [[0.0020888746458333335, 0.0020891733125, 0.0020892699375000003], 0, 2.158677101135254, 1679470779.7002957], "version": 0.2, "tvm_version": "0.10.0"}
{"input": ["cuda -keys=cuda,gpu -arch=sm_75 -max_num_threads=1024 -thread_warp_size=32", "conv2d_nchw.cuda", [["TENSOR", [1, 128, 28, 28], "float32"], ["TENSOR", [512, 128, 1, 1], "float32"], [1, 1], [0, 0, 0, 0], [1, 1], "float32"], {}], "config": {"index": 13737021, "code_hash": null, "entity": [["tile_f", "sp", [-1, 2, 1, 1]], ["tile_y", "sp", [-1, 2, 1, 1]], ["tile_x", "sp", [-1, 2, 1, 1]], ["tile_rc", "sp", [-1, 128]], ["tile_ry", "sp", [-1, 1]], ["tile_rx", "sp", [-1, 1]], ["auto_unroll_max_step", "ot", 512], ["unroll_explicit", "ot", 1]]}, "result": [[0.004978733571428572, 0.004978785523809524, 0.0049788313333333336], 0, 2.9701030254364014, 1679470780.5815668], "version": 0.2, "tvm_version": "0.10.0"}
{"input": ["cuda -keys=cuda,gpu -arch=sm_75 -max_num_threads=1024 -thread_warp_size=32", "conv2d_nchw.cuda", [["TENSOR", [1, 128, 28, 28], "float32"], ["TENSOR", [512, 128, 1, 1], "float32"], [1, 1], [0, 0, 0, 0], [1, 1], "float32"], {}], "config": {"index": 11677821, "code_hash": null, "entity": [["tile_f", "sp", [-1, 2, 1, 1]], ["tile_y", "sp", [-1, 2, 1, 1]], ["tile_x", "sp", [-1, 2, 2, 1]], ["tile_rc", "sp", [-1, 2]], ["tile_ry", "sp", [-1, 1]], ["tile_rx", "sp", [-1, 1]], ["auto_unroll_max_step", "ot", 512], ["unroll_explicit", "ot", 1]]}, "result": [[0.004311056125, 0.004311141291666667, 0.004311150541666667], 0, 1.2839746475219727, 1679470781.4516494], "version": 0.2, "tvm_version": "0.10.0"}
{"input": ["cuda -keys=cuda,gpu -arch=sm_75 -max_num_threads=1024 -thread_warp_size=32", "conv2d_nchw.cuda", [["TENSOR", [1, 128, 28, 28], "float32"], ["TENSOR", [512, 128, 1, 1], "float32"], [1, 1], [0, 0, 0, 0], [1, 1], "float32"], {}], "config": {"index": 11626341, "code_hash": null, "entity": [["tile_f", "sp", [-1, 2, 1, 1]], ["tile_y", "sp", [-1, 2, 2, 1]], ["tile_x", "sp", [-1, 2, 1, 1]], ["tile_rc", "sp", [-1, 2]], ["tile_ry", "sp", [-1, 1]], ["tile_rx", "sp", [-1, 1]], ["auto_unroll_max_step", "ot", 512], ["unroll_explicit", "ot", 1]]}, "result": [[0.003791832814814815, 0.003791901740740741, 0.003791909925925926], 0, 1.297299861907959, 1679470782.2970045], "version": 0.2, "tvm_version": "0.10.0"}
{"input": ["cuda -keys=cuda,gpu -arch=sm_75 -max_num_threads=1024 -thread_warp_size=32", "conv2d_nchw.cuda", [["TENSOR", [1, 128, 28, 28], "float32"], ["TENSOR", [512, 128, 1, 1], "float32"], [1, 1], [0, 0, 0, 0], [1, 1], "float32"], {}], "config": {"index": 11625027, "code_hash": null, "entity": [["tile_f", "sp", [-1, 128, 1, 1]], ["tile_y", "sp", [-1, 2, 1, 1]], ["tile_x", "sp", [-1, 2, 1, 1]], ["tile_rc", "sp", [-1, 2]], ["tile_ry", "sp", [-1, 1]], ["tile_rx", "sp", [-1, 1]], ["auto_unroll_max_step", "ot", 512], ["unroll_explicit", "ot", 1]]}, "result": [[0.02597935275, 0.026053312250000002, 0.026081056499999998], 0, 3.6084413528442383, 1679470783.242078], "version": 0.2, "tvm_version": "0.10.0"}
{"input": ["cuda -keys=cuda,gpu -arch=sm_75 -max_num_threads=1024 -thread_warp_size=32", "conv2d_nchw.cuda", [["TENSOR", [1, 128, 28, 28], "float32"], ["TENSOR", [512, 128, 1, 1], "float32"], [1, 1], [0, 0, 0, 0], [1, 1], "float32"], {}], "config": {"index": 6354046, "code_hash": null, "entity": [["tile_f", "sp", [-1, 64, 1, 1]], ["tile_y", "sp", [-1, 4, 1, 1]], ["tile_x", "sp", [-1, 4, 1, 1]], ["tile_rc", "sp", [-1, 4]], ["tile_ry", "sp", [-1, 1]], ["tile_rx", "sp", [-1, 1]], ["auto_unroll_max_step", "ot", 1500], ["unroll_explicit", "ot", 0]]}, "result": [[0.047798238, 0.047805526666666674, 0.04785890166666667], 0, 3.658318042755127, 1679470790.0673583], "version": 0.2, "tvm_version": "0.10.0"}
{"input": ["cuda -keys=cuda,gpu -arch=sm_75 -max_num_threads=1024 -thread_warp_size=32", "conv2d_nchw.cuda", [["TENSOR", [1, 128, 28, 28], "float32"], ["TENSOR", [512, 128, 1, 1], "float32"], [1, 1], [0, 0, 0, 0], [1, 1], "float32"], {}], "config": {"index": 3177025, "code_hash": null, "entity": [["tile_f", "sp", [-1, 32, 1, 1]], ["tile_y", "sp", [-1, 2, 1, 1]], ["tile_x", "sp", [-1, 2, 1, 1]], ["tile_rc", "sp", [-1, 2]], ["tile_ry", "sp", [-1, 1]], ["tile_rx", "sp", [-1, 1]], ["auto_unroll_max_step", "ot", 512], ["unroll_explicit", "ot", 0]]}, "result": [[0.00202260482, 0.0020226361, 0.00202301436], 0, 1.5259532928466797, 1679470790.9314928], "version": 0.2, "tvm_version": "0.10.0"}
{"input": ["cuda -keys=cuda,gpu -arch=sm_75 -max_num_threads=1024 -thread_warp_size=32", "conv2d_nchw.cuda", [["TENSOR", [1, 128, 28, 28], "float32"], ["TENSOR", [512, 128, 1, 1], "float32"], [1, 1], [0, 0, 0, 0], [1, 1], "float32"], {}], "config": {"index": 14441025, "code_hash": null, "entity": [["tile_f", "sp", [-1, 32, 1, 1]], ["tile_y", "sp", [-1, 2, 1, 1]], ["tile_x", "sp", [-1, 2, 1, 1]], ["tile_rc", "sp", [-1, 2]], ["tile_ry", "sp", [-1, 1]], ["tile_rx", "sp", [-1, 1]], ["auto_unroll_max_step", "ot", 1500], ["unroll_explicit", "ot", 1]]}, "result": [[0.00203429762, 0.0020346861200000003, 0.00203468794], 0, 1.6474740505218506, 1679470791.7535665], "version": 0.2, "tvm_version": "0.10.0"}
{"input": ["cuda -keys=cuda,gpu -arch=sm_75 -max_num_threads=1024 -thread_warp_size=32", "conv2d_nchw.cuda", [["TENSOR", [1, 128, 28, 28], "float32"], ["TENSOR", [512, 128, 1, 1], "float32"], [1, 1], [0, 0, 0, 0], [1, 1], "float32"], {}], "config": {"index": 11273025, "code_hash": null, "entity": [["tile_f", "sp", [-1, 32, 1, 1]], ["tile_y", "sp", [-1, 2, 1, 1]], ["tile_x", "sp", [-1, 2, 1, 1]], ["tile_rc", "sp", [-1, 1]], ["tile_ry", "sp", [-1, 1]], ["tile_rx", "sp", [-1, 1]], ["auto_unroll_max_step", "ot", 512], ["unroll_explicit", "ot", 1]]}, "result": [[0.00200826492, 0.0020082687200000003, 0.0020082687200000003], 0, 1.5480985641479492, 1679470792.577356], "version": 0.2, "tvm_version": "0.10.0"}
{"input": ["cuda -keys=cuda,gpu -arch=sm_75 -max_num_threads=1024 -thread_warp_size=32", "conv2d_nchw.cuda", [["TENSOR", [1, 128, 28, 28], "float32"], ["TENSOR", [512, 128, 1, 1], "float32"], [1, 1], [0, 0, 0, 0], [1, 1], "float32"], {}], "config": {"index": 11686625, "code_hash": null, "entity": [["tile_f", "sp", [-1, 32, 1, 1]], ["tile_y", "sp", [-1, 2, 1, 1]], ["tile_x", "sp", [-1, 7, 2, 1]], ["tile_rc", "sp", [-1, 2]], ["tile_ry", "sp", [-1, 1]], ["tile_rx", "sp", [-1, 1]], ["auto_unroll_max_step", "ot", 512], ["unroll_explicit", "ot", 1]]}, "result": [[0.017081333, 0.017084746, 0.017084757333333336], 0, 3.0788047313690186, 1679470793.4568548], "version": 0.2, "tvm_version": "0.10.0"}
{"input": ["cuda -keys=cuda,gpu -arch=sm_75 -max_num_threads=1024 -thread_warp_size=32", "conv2d_nchw.cuda", [["TENSOR", [1, 128, 28, 28], "float32"], ["TENSOR", [512, 128, 1, 1], "float32"], [1, 1], [0, 0, 0, 0], [1, 1], "float32"], {}], "config": {"index": 11626565, "code_hash": null, "entity": [["tile_f", "sp", [-1, 32, 1, 1]], ["tile_y", "sp", [-1, 7, 2, 1]], ["tile_x", "sp", [-1, 2, 1, 1]], ["tile_rc", "sp", [-1, 2]], ["tile_ry", "sp", [-1, 1]], ["tile_rx", "sp", [-1, 1]], ["auto_unroll_max_step", "ot", 512], ["unroll_explicit", "ot", 1]]}, "result": [[0.017127082666666665, 0.017135567833333334, 0.017138324666666666], 0, 3.1684062480926514, 1679470794.379039], "version": 0.2, "tvm_version": "0.10.0"}
{"input": ["cuda -keys=cuda,gpu -arch=sm_75 -max_num_threads=1024 -thread_warp_size=32", "conv2d_nchw.cuda", [["TENSOR", [1, 128, 28, 28], "float32"], ["TENSOR", [512, 128, 1, 1], "float32"], [1, 1], [0, 0, 0, 0], [1, 1], "float32"], {}], "config": {"index": 11625032, "code_hash": null, "entity": [["tile_f", "sp", [-1, 4, 2, 1]], ["tile_y", "sp", [-1, 2, 1, 1]], ["tile_x", "sp", [-1, 2, 1, 1]], ["tile_rc", "sp", [-1, 2]], ["tile_ry", "sp", [-1, 1]], ["tile_rx", "sp", [-1, 1]], ["auto_unroll_max_step", "ot", 512], ["unroll_explicit", "ot", 1]]}, "result": [[0.00238270169047619, 0.0023827505476190476, 0.0023828860476190475], 0, 1.320439100265503, 1679470795.228804], "version": 0.2, "tvm_version": "0.10.0"}
{"input": ["cuda -keys=cuda,gpu -arch=sm_75 -max_num_threads=1024 -thread_warp_size=32", "conv2d_nchw.cuda", [["TENSOR", [1, 128, 28, 28], "float32"], ["TENSOR", [512, 128, 1, 1], "float32"], [1, 1], [0, 0, 0, 0], [1, 1], "float32"], {}], "config": {"index": 8809025, "code_hash": null, "entity": [["tile_f", "sp", [-1, 32, 1, 1]], ["tile_y", "sp", [-1, 2, 1, 1]], ["tile_x", "sp", [-1, 2, 1, 1]], ["tile_rc", "sp", [-1, 2]], ["tile_ry", "sp", [-1, 1]], ["tile_rx", "sp", [-1, 1]], ["auto_unroll_max_step", "ot", 0], ["unroll_explicit", "ot", 1]]}, "result": [[0.0027571615135135136, 0.002757196972972973, 0.0027572402702702704], 0, 1.4609801769256592, 1679470796.0669553], "version": 0.2, "tvm_version": "0.10.0"}
{"input": ["cuda -keys=cuda,gpu -arch=sm_75 -max_num_threads=1024 -thread_warp_size=32", "conv2d_nchw.cuda", [["TENSOR", [1, 128, 28, 28], "float32"], ["TENSOR", [512, 128, 1, 1], "float32"], [1, 1], [0, 0, 0, 0], [1, 1], "float32"], {}], "config": {"index": 11695425, "code_hash": null, "entity": [["tile_f", "sp", [-1, 32, 1, 1]], ["tile_y", "sp", [-1, 2, 1, 1]], ["tile_x", "sp", [-1, 14, 2, 1]], ["tile_rc", "sp", [-1, 2]], ["tile_ry", "sp", [-1, 1]], ["tile_rx", "sp", [-1, 1]], ["auto_unroll_max_step", "ot", 512], ["unroll_explicit", "ot", 1]]}, "result": [[0.043952051666666665, 0.043958786, 0.043966573], 0, 6.485230445861816, 1679470797.2039437], "version": 0.2, "tvm_version": "0.10.0"}
{"input": ["cuda -keys=cuda,gpu -arch=sm_75 -max_num_threads=1024 -thread_warp_size=32", "conv2d_nchw.cuda", [["TENSOR", [1, 128, 28, 28], "float32"], ["TENSOR", [512, 128, 1, 1], "float32"], [1, 1], [0, 0, 0, 0], [1, 1], "float32"], {}], "config": {"index": 11626785, "code_hash": null, "entity": [["tile_f", "sp", [-1, 32, 1, 1]], ["tile_y", "sp", [-1, 14, 2, 1]], ["tile_x", "sp", [-1, 2, 1, 1]], ["tile_rc", "sp", [-1, 2]], ["tile_ry", "sp", [-1, 1]], ["tile_rx", "sp", [-1, 1]], ["auto_unroll_max_step", "ot", 512], ["unroll_explicit", "ot", 1]]}, "result": [[0.04387089, 0.04387567133333334, 0.043885676000000005], 0, 6.618174076080322, 1679470798.3340871], "version": 0.2, "tvm_version": "0.10.0"}
{"input": ["cuda -keys=cuda,gpu -arch=sm_75 -max_num_threads=1024 -thread_warp_size=32", "conv2d_nchw.cuda", [["TENSOR", [1, 128, 28, 28], "float32"], ["TENSOR", [512, 128, 1, 1], "float32"], [1, 1], [0, 0, 0, 0], [1, 1], "float32"], {}], "config": {"index": 11625033, "code_hash": null, "entity": [["tile_f", "sp", [-1, 8, 2, 1]], ["tile_y", "sp", [-1, 2, 1, 1]], ["tile_x", "sp", [-1, 2, 1, 1]], ["tile_rc", "sp", [-1, 2]], ["tile_ry", "sp", [-1, 1]], ["tile_rx", "sp", [-1, 1]], ["auto_unroll_max_step", "ot", 512], ["unroll_explicit", "ot", 1]]}, "result": [[0.0019088350566037735, 0.0019089140943396225, 0.0019089243018867925], 0, 1.3408682346343994, 1679470799.1961918], "version": 0.2, "tvm_version": "0.10.0"}
{"input": ["cuda -keys=cuda,gpu -arch=sm_75 -max_num_threads=1024 -thread_warp_size=32", "conv2d_nchw.cuda", [["TENSOR", [1, 128, 28, 28], "float32"], ["TENSOR", [512, 128, 1, 1], "float32"], [1, 1], [0, 0, 0, 0], [1, 1], "float32"], {}], "config": {"index": 11977025, "code_hash": null, "entity": [["tile_f", "sp", [-1, 32, 1, 1]], ["tile_y", "sp", [-1, 2, 1, 1]], ["tile_x", "sp", [-1, 2, 1, 1]], ["tile_rc", "sp", [-1, 4]], ["tile_ry", "sp", [-1, 1]], ["tile_rx", "sp", [-1, 1]], ["auto_unroll_max_step", "ot", 512], ["unroll_explicit", "ot", 1]]}, "result": [[0.0019475169423076924, 0.0019475630192307691, 0.0019477500769230771], 0, 1.928431510925293, 1679470800.0451257], "version": 0.2, "tvm_version": "0.10.0"}
{"input": ["cuda -keys=cuda,gpu -arch=sm_75 -max_num_threads=1024 -thread_warp_size=32", "conv2d_nchw.cuda", [["TENSOR", [1, 128, 28, 28], "float32"], ["TENSOR", [512, 128, 1, 1], "float32"], [1, 1], [0, 0, 0, 0], [1, 1], "float32"], {}], "config": {"index": 11704225, "code_hash": null, "entity": [["tile_f", "sp", [-1, 32, 1, 1]], ["tile_y", "sp", [-1, 2, 1, 1]], ["tile_x", "sp", [-1, 1, 4, 1]], ["tile_rc", "sp", [-1, 2]], ["tile_ry", "sp", [-1, 1]], ["tile_rx", "sp", [-1, 1]], ["auto_unroll_max_step", "ot", 512], ["unroll_explicit", "ot", 1]]}, "result": [[0.0008838197807017543, 0.0008839115964912282, 0.0008842119561403509], 0, 1.4912593364715576, 1679470800.892131], "version": 0.2, "tvm_version": "0.10.0"}
{"input": ["cuda -keys=cuda,gpu -arch=sm_75 -max_num_threads=1024 -thread_warp_size=32", "conv2d_nchw.cuda", [["TENSOR", [1, 128, 28, 28], "float32"], ["TENSOR", [512, 128, 1, 1], "float32"], [1, 1], [0, 0, 0, 0], [1, 1], "float32"], {}], "config": {"index": 11627005, "code_hash": null, "entity": [["tile_f", "sp", [-1, 32, 1, 1]], ["tile_y", "sp", [-1, 1, 4, 1]], ["tile_x", "sp", [-1, 2, 1, 1]], ["tile_rc", "sp", [-1, 2]], ["tile_ry", "sp", [-1, 1]], ["tile_rx", "sp", [-1, 1]], ["auto_unroll_max_step", "ot", 512], ["unroll_explicit", "ot", 1]]}, "result": [[0.000866197775862069, 0.0008664565172413793, 0.0008670336551724137], 0, 1.469714641571045, 1679470801.7382135], "version": 0.2, "tvm_version": "0.10.0"}
{"input": ["cuda -keys=cuda,gpu -arch=sm_75 -max_num_threads=1024 -thread_warp_size=32", "conv2d_nchw.cuda", [["TENSOR", [1, 128, 28, 28], "float32"], ["TENSOR", [512, 128, 1, 1], "float32"], [1, 1], [0, 0, 0, 0], [1, 1], "float32"], {}], "config": {"index": 11625034, "code_hash": null, "entity": [["tile_f", "sp", [-1, 16, 2, 1]], ["tile_y", "sp", [-1, 2, 1, 1]], ["tile_x", "sp", [-1, 2, 1, 1]], ["tile_rc", "sp", [-1, 2]], ["tile_ry", "sp", [-1, 1]], ["tile_rx", "sp", [-1, 1]], ["auto_unroll_max_step", "ot", 512], ["unroll_explicit", "ot", 1]]}, "result": [[0.001803877142857143, 0.001803885732142857, 0.001804214875], 0, 1.52156400680542, 1679470802.5876827], "version": 0.2, "tvm_version": "0.10.0"}
{"input": ["cuda -keys=cuda,gpu -arch=sm_75 -max_num_threads=1024 -thread_warp_size=32", "conv2d_nchw.cuda", [["TENSOR", [1, 128, 28, 28], "float32"], ["TENSOR", [512, 128, 1, 1], "float32"], [1, 1], [0, 0, 0, 0], [1, 1], "float32"], {}], "config": {"index": 12329025, "code_hash": null, "entity": [["tile_f", "sp", [-1, 32, 1, 1]], ["tile_y", "sp", [-1, 2, 1, 1]], ["tile_x", "sp", [-1, 2, 1, 1]], ["tile_rc", "sp", [-1, 8]], ["tile_ry", "sp", [-1, 1]], ["tile_rx", "sp", [-1, 1]], ["auto_unroll_max_step", "ot", 512], ["unroll_explicit", "ot", 1]]}, "result": [[0.0021202773958333334, 0.0021207046458333336, 0.002120970708333333], 0, 2.0798938274383545, 1679470803.4439485], "version": 0.2, "tvm_version": "0.10.0"}
{"input": ["cuda -keys=cuda,gpu -arch=sm_75 -max_num_threads=1024 -thread_warp_size=32", "conv2d_nchw.cuda", [["TENSOR", [1, 128, 28, 28], "float32"], ["TENSOR", [512, 128, 1, 1], "float32"], [1, 1], [0, 0, 0, 0], [1, 1], "float32"], {}], "config": {"index": 11713025, "code_hash": null, "entity": [["tile_f", "sp", [-1, 32, 1, 1]], ["tile_y", "sp", [-1, 2, 1, 1]], ["tile_x", "sp", [-1, 7, 4, 1]], ["tile_rc", "sp", [-1, 2]], ["tile_ry", "sp", [-1, 1]], ["tile_rx", "sp", [-1, 1]], ["auto_unroll_max_step", "ot", 512], ["unroll_explicit", "ot", 1]]}, "result": [[0.008550410583333333, 0.008551354666666667, 0.008693189583333333], 0, 3.026160717010498, 1679470814.3845587], "version": 0.2, "tvm_version": "0.10.0"}
{"input": ["cuda -keys=cuda,gpu -arch=sm_75 -max_num_threads=1024 -thread_warp_size=32", "conv2d_nchw.cuda", [["TENSOR", [1, 128, 28, 28], "float32"], ["TENSOR", [512, 128, 1, 1], "float32"], [1, 1], [0, 0, 0, 0], [1, 1], "float32"], {}], "config": {"index": 11627225, "code_hash": null, "entity": [["tile_f", "sp", [-1, 32, 1, 1]], ["tile_y", "sp", [-1, 7, 4, 1]], ["tile_x", "sp", [-1, 2, 1, 1]], ["tile_rc", "sp", [-1, 2]], ["tile_ry", "sp", [-1, 1]], ["tile_rx", "sp", [-1, 1]], ["auto_unroll_max_step", "ot", 512], ["unroll_explicit", "ot", 1]]}, "result": [[0.008849791833333334, 0.008855208, 0.008857386833333333], 0, 3.0821571350097656, 1679470815.2906404], "version": 0.2, "tvm_version": "0.10.0"}
{"input": ["cuda -keys=cuda,gpu -arch=sm_75 -max_num_threads=1024 -thread_warp_size=32", "conv2d_nchw.cuda", [["TENSOR", [1, 128, 28, 28], "float32"], ["TENSOR", [512, 128, 1, 1], "float32"], [1, 1], [0, 0, 0, 0], [1, 1], "float32"], {}], "config": {"index": 6356026, "code_hash": null, "entity": [["tile_f", "sp", [-1, 64, 1, 1]], ["tile_y", "sp", [-1, 7, 4, 1]], ["tile_x", "sp", [-1, 4, 1, 1]], ["tile_rc", "sp", [-1, 4]], ["tile_ry", "sp", [-1, 1]], ["tile_rx", "sp", [-1, 1]], ["auto_unroll_max_step", "ot", 1500], ["unroll_explicit", "ot", 0]]}, "result": [[0.0267621765, 0.026764303000000003, 0.02676579275], 0, 5.810279607772827, 1679470816.2528596], "version": 0.2, "tvm_version": "0.10.0"}
{"input": ["cuda -keys=cuda,gpu -arch=sm_75 -max_num_threads=1024 -thread_warp_size=32", "conv2d_nchw.cuda", [["TENSOR", [1, 128, 28, 28], "float32"], ["TENSOR", [512, 128, 1, 1], "float32"], [1, 1], [0, 0, 0, 0], [1, 1], "float32"], {}], "config": {"index": 3179005, "code_hash": null, "entity": [["tile_f", "sp", [-1, 32, 1, 1]], ["tile_y", "sp", [-1, 1, 4, 1]], ["tile_x", "sp", [-1, 2, 1, 1]], ["tile_rc", "sp", [-1, 2]], ["tile_ry", "sp", [-1, 1]], ["tile_rx", "sp", [-1, 1]], ["auto_unroll_max_step", "ot", 512], ["unroll_explicit", "ot", 0]]}, "result": [[0.000866564974137931, 0.0008665853620689656, 0.0008665859568965518], 0, 1.3418810367584229, 1679470817.0807974], "version": 0.2, "tvm_version": "0.10.0"}
{"input": ["cuda -keys=cuda,gpu -arch=sm_75 -max_num_threads=1024 -thread_warp_size=32", "conv2d_nchw.cuda", [["TENSOR", [1, 128, 28, 28], "float32"], ["TENSOR", [512, 128, 1, 1], "float32"], [1, 1], [0, 0, 0, 0], [1, 1], "float32"], {}], "config": {"index": 8811005, "code_hash": null, "entity": [["tile_f", "sp", [-1, 32, 1, 1]], ["tile_y", "sp", [-1, 1, 4, 1]], ["tile_x", "sp", [-1, 2, 1, 1]], ["tile_rc", "sp", [-1, 2]], ["tile_ry", "sp", [-1, 1]], ["tile_rx", "sp", [-1, 1]], ["auto_unroll_max_step", "ot", 0], ["unroll_explicit", "ot", 1]]}, "result": [[0.0012641804566929133, 0.001264213377952756, 0.0012642308031496064], 0, 1.7505838871002197, 1679470818.3283749], "version": 0.2, "tvm_version": "0.10.0"}
{"input": ["cuda -keys=cuda,gpu -arch=sm_75 -max_num_threads=1024 -thread_warp_size=32", "conv2d_nchw.cuda", [["TENSOR", [1, 128, 28, 28], "float32"], ["TENSOR", [512, 128, 1, 1], "float32"], [1, 1], [0, 0, 0, 0], [1, 1], "float32"], {}], "config": {"index": 12683005, "code_hash": null, "entity": [["tile_f", "sp", [-1, 32, 1, 1]], ["tile_y", "sp", [-1, 1, 4, 1]], ["tile_x", "sp", [-1, 2, 1, 1]], ["tile_rc", "sp", [-1, 16]], ["tile_ry", "sp", [-1, 1]], ["tile_rx", "sp", [-1, 1]], ["auto_unroll_max_step", "ot", 512], ["unroll_explicit", "ot", 1]]}, "result": [[0.0009925991089108912, 0.0009926789504950495, 0.0009928168019801978], 0, 1.8626844882965088, 1679470819.1745386], "version": 0.2, "tvm_version": "0.10.0"}
{"input": ["cuda -keys=cuda,gpu -arch=sm_75 -max_num_threads=1024 -thread_warp_size=32", "conv2d_nchw.cuda", [["TENSOR", [1, 128, 28, 28], "float32"], ["TENSOR", [512, 128, 1, 1], "float32"], [1, 1], [0, 0, 0, 0], [1, 1], "float32"], {}], "config": {"index": 11723805, "code_hash": null, "entity": [["tile_f", "sp", [-1, 32, 1, 1]], ["tile_y", "sp", [-1, 1, 4, 1]], ["tile_x", "sp", [-1, 1, 7, 1]], ["tile_rc", "sp", [-1, 2]], ["tile_ry", "sp", [-1, 1]], ["tile_rx", "sp", [-1, 1]], ["auto_unroll_max_step", "ot", 512], ["unroll_explicit", "ot", 1]]}, "result": [[0.00022502136211699164, 0.00022502899164345404, 0.0002250363871866295], 0, 1.7588212490081787, 1679470820.42145], "version": 0.2, "tvm_version": "0.10.0"}
{"input": ["cuda -keys=cuda,gpu -arch=sm_75 -max_num_threads=1024 -thread_warp_size=32", "conv2d_nchw.cuda", [["TENSOR", [1, 128, 28, 28], "float32"], ["TENSOR", [512, 128, 1, 1], "float32"], [1, 1], [0, 0, 0, 0], [1, 1], "float32"], {}], "config": {"index": 11627016, "code_hash": null, "entity": [["tile_f", "sp", [-1, 64, 2, 1]], ["tile_y", "sp", [-1, 1, 4, 1]], ["tile_x", "sp", [-1, 2, 1, 1]], ["tile_rc", "sp", [-1, 2]], ["tile_ry", "sp", [-1, 1]], ["tile_rx", "sp", [-1, 1]], ["auto_unroll_max_step", "ot", 512], ["unroll_explicit", "ot", 1]]}, "result": [[0.0008312634545454545, 0.0008315705206611571, 0.0008315884876033058], 0, 1.9491450786590576, 1679470821.2663634], "version": 0.2, "tvm_version": "0.10.0"}
{"input": ["cuda -keys=cuda,gpu -arch=sm_75 -max_num_threads=1024 -thread_warp_size=32", "conv2d_nchw.cuda", [["TENSOR", [1, 128, 28, 28], "float32"], ["TENSOR", [512, 128, 1, 1], "float32"], [1, 1], [0, 0, 0, 0], [1, 1], "float32"], {}], "config": {"index": 13035005, "code_hash": null, "entity": [["tile_f", "sp", [-1, 32, 1, 1]], ["tile_y", "sp", [-1, 1, 4, 1]], ["tile_x", "sp", [-1, 2, 1, 1]], ["tile_rc", "sp", [-1, 32]], ["tile_ry", "sp", [-1, 1]], ["tile_rx", "sp", [-1, 1]], ["auto_unroll_max_step", "ot", 512], ["unroll_explicit", "ot", 1]]}, "result": [[0.0011602757913669064, 0.00116114235971223, 0.0011631686976744187], 0, 3.8057503700256348, 1679470822.3996572], "version": 0.2, "tvm_version": "0.10.0"}
{"input": ["cuda -keys=cuda,gpu -arch=sm_75 -max_num_threads=1024 -thread_warp_size=32", "conv2d_nchw.cuda", [["TENSOR", [1, 128, 28, 28], "float32"], ["TENSOR", [512, 128, 1, 1], "float32"], [1, 1], [0, 0, 0, 0], [1, 1], "float32"], {}], "config": {"index": 11732605, "code_hash": null, "entity": [["tile_f", "sp", [-1, 32, 1, 1]], ["tile_y", "sp", [-1, 1, 4, 1]], ["tile_x", "sp", [-1, 2, 7, 1]], ["tile_rc", "sp", [-1, 2]], ["tile_ry", "sp", [-1, 1]], ["tile_rx", "sp", [-1, 1]], ["auto_unroll_max_step", "ot", 512], ["unroll_explicit", "ot", 1]]}, "result": [[0.00014384209523809522, 0.00014385288499550763, 0.00014408315094339622], 0, 1.9114634990692139, 1679470823.656921], "version": 0.2, "tvm_version": "0.10.0"}
{"input": ["cuda -keys=cuda,gpu -arch=sm_75 -max_num_threads=1024 -thread_warp_size=32", "conv2d_nchw.cuda", [["TENSOR", [1, 128, 28, 28], "float32"], ["TENSOR", [512, 128, 1, 1], "float32"], [1, 1], [0, 0, 0, 0], [1, 1], "float32"], {}], "config": {"index": 11629645, "code_hash": null, "entity": [["tile_f", "sp", [-1, 32, 1, 1]], ["tile_y", "sp", [-1, 1, 2, 2]], ["tile_x", "sp", [-1, 2, 1, 1]], ["tile_rc", "sp", [-1, 2]], ["tile_ry", "sp", [-1, 1]], ["tile_rx", "sp", [-1, 1]], ["auto_unroll_max_step", "ot", 512], ["unroll_explicit", "ot", 1]]}, "result": [[0.0009693526265060241, 0.000969376343373494, 0.0009694135722891566], 0, 2.114535331726074, 1679470824.8514795], "version": 0.2, "tvm_version": "0.10.0"}
{"input": ["cuda -keys=cuda,gpu -arch=sm_75 -max_num_threads=1024 -thread_warp_size=32", "conv2d_nchw.cuda", [["TENSOR", [1, 128, 28, 28], "float32"], ["TENSOR", [512, 128, 1, 1], "float32"], [1, 1], [0, 0, 0, 0], [1, 1], "float32"], {}], "config": {"index": 11627017, "code_hash": null, "entity": [["tile_f", "sp", [-1, 128, 2, 1]], ["tile_y", "sp", [-1, 1, 4, 1]], ["tile_x", "sp", [-1, 2, 1, 1]], ["tile_rc", "sp", [-1, 2]], ["tile_ry", "sp", [-1, 1]], ["tile_rx", "sp", [-1, 1]], ["auto_unroll_max_step", "ot", 512], ["unroll_explicit", "ot", 1]]}, "result": [[0.0009659836506024095, 0.0009662122590361446, 0.0009663570301204819], 0, 3.058429002761841, 1679470826.101929], "version": 0.2, "tvm_version": "0.10.0"}
{"input": ["cuda -keys=cuda,gpu -arch=sm_75 -max_num_threads=1024 -thread_warp_size=32", "conv2d_nchw.cuda", [["TENSOR", [1, 128, 28, 28], "float32"], ["TENSOR", [512, 128, 1, 1], "float32"], [1, 1], [0, 0, 0, 0], [1, 1], "float32"], {}], "config": {"index": 14443005, "code_hash": null, "entity": [["tile_f", "sp", [-1, 32, 1, 1]], ["tile_y", "sp", [-1, 1, 4, 1]], ["tile_x", "sp", [-1, 2, 1, 1]], ["tile_rc", "sp", [-1, 2]], ["tile_ry", "sp", [-1, 1]], ["tile_rx", "sp", [-1, 1]], ["auto_unroll_max_step", "ot", 1500], ["unroll_explicit", "ot", 1]]}, "result": [[0.0008664640172413794, 0.0008664874310344827, 0.000866490198275862], 0, 1.459514856338501, 1679470826.9424846], "version": 0.2, "tvm_version": "0.10.0"}
{"input": ["cuda -keys=cuda,gpu -arch=sm_75 -max_num_threads=1024 -thread_warp_size=32", "conv2d_nchw.cuda", [["TENSOR", [1, 128, 28, 28], "float32"], ["TENSOR", [512, 128, 1, 1], "float32"], [1, 1], [0, 0, 0, 0], [1, 1], "float32"], {}], "config": {"index": 13387005, "code_hash": null, "entity": [["tile_f", "sp", [-1, 32, 1, 1]], ["tile_y", "sp", [-1, 1, 4, 1]], ["tile_x", "sp", [-1, 2, 1, 1]], ["tile_rc", "sp", [-1, 64]], ["tile_ry", "sp", [-1, 1]], ["tile_rx", "sp", [-1, 1]], ["auto_unroll_max_step", "ot", 512], ["unroll_explicit", "ot", 1]]}, "result": [[0.0013811120821917808, 0.0013811660136986302, 0.0013812348767123287], 0, 3.377617120742798, 1679470827.792383], "version": 0.2, "tvm_version": "0.10.0"}
{"input": ["cuda -keys=cuda,gpu -arch=sm_75 -max_num_threads=1024 -thread_warp_size=32", "conv2d_nchw.cuda", [["TENSOR", [1, 128, 28, 28], "float32"], ["TENSOR", [512, 128, 1, 1], "float32"], [1, 1], [0, 0, 0, 0], [1, 1], "float32"], {}], "config": {"index": 11741405, "code_hash": null, "entity": [["tile_f", "sp", [-1, 32, 1, 1]], ["tile_y", "sp", [-1, 1, 4, 1]], ["tile_x", "sp", [-1, 4, 7, 1]], ["tile_rc", "sp", [-1, 2]], ["tile_ry", "sp", [-1, 1]], ["tile_rx", "sp", [-1, 1]], ["auto_unroll_max_step", "ot", 512], ["unroll_explicit", "ot", 1]]}, "result": [[0.00011800931680236863, 0.00011805620059215397, 0.00011817915173945226], 0, 2.1643917560577393, 1679470829.0362842], "version": 0.2, "tvm_version": "0.10.0"}
{"input": ["cuda -keys=cuda,gpu -arch=sm_75 -max_num_threads=1024 -thread_warp_size=32", "conv2d_nchw.cuda", [["TENSOR", [1, 128, 28, 28], "float32"], ["TENSOR", [512, 128, 1, 1], "float32"], [1, 1], [0, 0, 0, 0], [1, 1], "float32"], {}], "config": {"index": 6470426, "code_hash": null, "entity": [["tile_f", "sp", [-1, 64, 1, 1]], ["tile_y", "sp", [-1, 7, 4, 1]], ["tile_x", "sp", [-1, 1, 14, 1]], ["tile_rc", "sp", [-1, 4]], ["tile_ry", "sp", [-1, 1]], ["tile_rx", "sp", [-1, 1]], ["auto_unroll_max_step", "ot", 1500], ["unroll_explicit", "ot", 0]]}, "result": [[0.0005268657213114755, 0.0005273931516393442, 0.0005285435], 0, 2.489612102508545, 1679470840.2168772], "version": 0.2, "tvm_version": "0.10.0"}
{"input": ["cuda -keys=cuda,gpu -arch=sm_75 -max_num_threads=1024 -thread_warp_size=32", "conv2d_nchw.cuda", [["TENSOR", [1, 128, 28, 28], "float32"], ["TENSOR", [512, 128, 1, 1], "float32"], [1, 1], [0, 0, 0, 0], [1, 1], "float32"], {}], "config": {"index": 8925405, "code_hash": null, "entity": [["tile_f", "sp", [-1, 32, 1, 1]], ["tile_y", "sp", [-1, 1, 4, 1]], ["tile_x", "sp", [-1, 4, 7, 1]], ["tile_rc", "sp", [-1, 2]], ["tile_ry", "sp", [-1, 1]], ["tile_rx", "sp", [-1, 1]], ["auto_unroll_max_step", "ot", 0], ["unroll_explicit", "ot", 1]]}, "result": [[0.00014301845138269402, 0.0001430220178412132, 0.00014302721766280106], 0, 1.9597644805908203, 1679470841.469559], "version": 0.2, "tvm_version": "0.10.0"}
{"input": ["cuda -keys=cuda,gpu -arch=sm_75 -max_num_threads=1024 -thread_warp_size=32", "conv2d_nchw.cuda", [["TENSOR", [1, 128, 28, 28], "float32"], ["TENSOR", [512, 128, 1, 1], "float32"], [1, 1], [0, 0, 0, 0], [1, 1], "float32"], {}], "config": {"index": 11864605, "code_hash": null, "entity": [["tile_f", "sp", [-1, 32, 1, 1]], ["tile_y", "sp", [-1, 1, 4, 1]], ["tile_x", "sp", [-1, 7, 1, 4]], ["tile_rc", "sp", [-1, 2]], ["tile_ry", "sp", [-1, 1]], ["tile_rx", "sp", [-1, 1]], ["auto_unroll_max_step", "ot", 512], ["unroll_explicit", "ot", 1]]}, "result": [[0.02878116025, 0.02878133575, 0.028791807], 0, 4.360112428665161, 1679470842.470086], "version": 0.2, "tvm_version": "0.10.0"}
{"input": ["cuda -keys=cuda,gpu -arch=sm_75 -max_num_threads=1024 -thread_warp_size=32", "conv2d_nchw.cuda", [["TENSOR", [1, 128, 28, 28], "float32"], ["TENSOR", [512, 128, 1, 1], "float32"], [1, 1], [0, 0, 0, 0], [1, 1], "float32"], {}], "config": {"index": 11618205, "code_hash": null, "entity": [["tile_f", "sp", [-1, 32, 1, 1]], ["tile_y", "sp", [-1, 1, 4, 1]], ["tile_x", "sp", [-1, 1, 1, 1]], ["tile_rc", "sp", [-1, 2]], ["tile_ry", "sp", [-1, 1]], ["tile_rx", "sp", [-1, 1]], ["auto_unroll_max_step", "ot", 512], ["unroll_explicit", "ot", 1]]}, "result": [[0.0016470594426229506, 0.0016470620819672133, 0.0016471627540983608], 0, 1.4626092910766602, 1679470843.3278146], "version": 0.2, "tvm_version": "0.10.0"}
{"input": ["cuda -keys=cuda,gpu -arch=sm_75 -max_num_threads=1024 -thread_warp_size=32", "conv2d_nchw.cuda", [["TENSOR", [1, 128, 28, 28], "float32"], ["TENSOR", [512, 128, 1, 1], "float32"], [1, 1], [0, 0, 0, 0], [1, 1], "float32"], {}], "config": {"index": 11744485, "code_hash": null, "entity": [["tile_f", "sp", [-1, 32, 1, 1]], ["tile_y", "sp", [-1, 1, 7, 2]], ["tile_x", "sp", [-1, 4, 7, 1]], ["tile_rc", "sp", [-1, 2]], ["tile_ry", "sp", [-1, 1]], ["tile_rx", "sp", [-1, 1]], ["auto_unroll_max_step", "ot", 512], ["unroll_explicit", "ot", 1]]}, "result": [[0.0002344031405152225, 0.0002344610843091335, 0.0002345978407494145], 0, 2.396202564239502, 1679470844.1739962], "version": 0.2, "tvm_version": "0.10.0"}
{"input": ["cuda -keys=cuda,gpu -arch=sm_75 -max_num_threads=1024 -thread_warp_size=32", "conv2d_nchw.cuda", [["TENSOR", [1, 128, 28, 28], "float32"], ["TENSOR", [512, 128, 1, 1], "float32"], [1, 1], [0, 0, 0, 0], [1, 1], "float32"], {}], "config": {"index": 11741419, "code_hash": null, "entity": [["tile_f", "sp", [-1, 1, 4, 1]], ["tile_y", "sp", [-1, 1, 4, 1]], ["tile_x", "sp", [-1, 4, 7, 1]], ["tile_rc", "sp", [-1, 2]], ["tile_ry", "sp", [-1, 1]], ["tile_rx", "sp", [-1, 1]], ["auto_unroll_max_step", "ot", 512], ["unroll_explicit", "ot", 1]]}, "result": [[0.0004986421542288557, 0.0004986621940298506, 0.0004986809850746268], 0, 1.298680305480957, 1679470845.0202289], "version": 0.2, "tvm_version": "0.10.0"}
{"input": ["cuda -keys=cuda,gpu -arch=sm_75 -max_num_threads=1024 -thread_warp_size=32", "conv2d_nchw.cuda", [["TENSOR", [1, 128, 28, 28], "float32"], ["TENSOR", [512, 128, 1, 1], "float32"], [1, 1], [0, 0, 0, 0], [1, 1], "float32"], {}], "config": {"index": 3293405, "code_hash": null, "entity": [["tile_f", "sp", [-1, 32, 1, 1]], ["tile_y", "sp", [-1, 1, 4, 1]], ["tile_x", "sp", [-1, 4, 7, 1]], ["tile_rc", "sp", [-1, 2]], ["tile_ry", "sp", [-1, 1]], ["tile_rx", "sp", [-1, 1]], ["auto_unroll_max_step", "ot", 512], ["unroll_explicit", "ot", 0]]}, "result": [[0.00011854683121732636, 0.00011855218670649738, 0.00011857713218820015], 0, 1.9084362983703613, 1679470846.253793], "version": 0.2, "tvm_version": "0.10.0"}
{"input": ["cuda -keys=cuda,gpu -arch=sm_75 -max_num_threads=1024 -thread_warp_size=32", "conv2d_nchw.cuda", [["TENSOR", [1, 128, 28, 28], "float32"], ["TENSOR", [512, 128, 1, 1], "float32"], [1, 1], [0, 0, 0, 0], [1, 1], "float32"], {}], "config": {"index": 11389405, "code_hash": null, "entity": [["tile_f", "sp", [-1, 32, 1, 1]], ["tile_y", "sp", [-1, 1, 4, 1]], ["tile_x", "sp", [-1, 4, 7, 1]], ["tile_rc", "sp", [-1, 1]], ["tile_ry", "sp", [-1, 1]], ["tile_rx", "sp", [-1, 1]], ["auto_unroll_max_step", "ot", 512], ["unroll_explicit", "ot", 1]]}, "result": [[0.00011680670690909091, 0.00011685515781818181, 0.00011687972727272727], 0, 1.9750463962554932, 1679470847.4997826], "version": 0.2, "tvm_version": "0.10.0"}
{"input": ["cuda -keys=cuda,gpu -arch=sm_75 -max_num_threads=1024 -thread_warp_size=32", "conv2d_nchw.cuda", [["TENSOR", [1, 128, 28, 28], "float32"], ["TENSOR", [512, 128, 1, 1], "float32"], [1, 1], [0, 0, 0, 0], [1, 1], "float32"], {}], "config": {"index": 11873405, "code_hash": null, "entity": [["tile_f", "sp", [-1, 32, 1, 1]], ["tile_y", "sp", [-1, 1, 4, 1]], ["tile_x", "sp", [-1, 1, 7, 4]], ["tile_rc", "sp", [-1, 2]], ["tile_ry", "sp", [-1, 1]], ["tile_rx", "sp", [-1, 1]], ["auto_unroll_max_step", "ot", 512], ["unroll_explicit", "ot", 1]]}, "result": [[0.0001228429144254279, 0.00012286302322738388, 0.0001228896980440098], 0, 1.747514009475708, 1679470848.351947], "version": 0.2, "tvm_version": "0.10.0"}
{"input": ["cuda -keys=cuda,gpu -arch=sm_75 -max_num_threads=1024 -thread_warp_size=32", "conv2d_nchw.cuda", [["TENSOR", [1, 128, 28, 28], "float32"], ["TENSOR", [512, 128, 1, 1], "float32"], [1, 1], [0, 0, 0, 0], [1, 1], "float32"], {}], "config": {"index": 11744705, "code_hash": null, "entity": [["tile_f", "sp", [-1, 32, 1, 1]], ["tile_y", "sp", [-1, 2, 7, 2]], ["tile_x", "sp", [-1, 4, 7, 1]], ["tile_rc", "sp", [-1, 2]], ["tile_ry", "sp", [-1, 1]], ["tile_rx", "sp", [-1, 1]], ["auto_unroll_max_step", "ot", 512], ["unroll_explicit", "ot", 1]]}, "result": [[0.0020136647, 0.0020140031399999998, 0.0020140876600000003], 0, 3.284147024154663, 1679470849.2025058], "version": 0.2, "tvm_version": "0.10.0"}
{"input": ["cuda -keys=cuda,gpu -arch=sm_75 -max_num_threads=1024 -thread_warp_size=32", "conv2d_nchw.cuda", [["TENSOR", [1, 128, 28, 28], "float32"], ["TENSOR", [512, 128, 1, 1], "float32"], [1, 1], [0, 0, 0, 0], [1, 1], "float32"], {}], "config": {"index": 11741420, "code_hash": null, "entity": [["tile_f", "sp", [-1, 2, 4, 1]], ["tile_y", "sp", [-1, 1, 4, 1]], ["tile_x", "sp", [-1, 4, 7, 1]], ["tile_rc", "sp", [-1, 2]], ["tile_ry", "sp", [-1, 1]], ["tile_rx", "sp", [-1, 1]], ["auto_unroll_max_step", "ot", 512], ["unroll_explicit", "ot", 1]]}, "result": [[0.00026885060971524287, 0.00026886791289782244, 0.00026901666834170854], 0, 1.723081111907959, 1679470850.4475641], "version": 0.2, "tvm_version": "0.10.0"}
{"input": ["cuda -keys=cuda,gpu -arch=sm_75 -max_num_threads=1024 -thread_warp_size=32", "conv2d_nchw.cuda", [["TENSOR", [1, 128, 28, 28], "float32"], ["TENSOR", [512, 128, 1, 1], "float32"], [1, 1], [0, 0, 0, 0], [1, 1], "float32"], {}], "config": {"index": 14557405, "code_hash": null, "entity": [["tile_f", "sp", [-1, 32, 1, 1]], ["tile_y", "sp", [-1, 1, 4, 1]], ["tile_x", "sp", [-1, 4, 7, 1]], ["tile_rc", "sp", [-1, 2]], ["tile_ry", "sp", [-1, 1]], ["tile_rx", "sp", [-1, 1]], ["auto_unroll_max_step", "ot", 1500], ["unroll_explicit", "ot", 1]]}, "result": [[0.00011800412948061448, 0.0001180394133138259, 0.00011804671324067301], 0, 2.038644790649414, 1679470851.637924], "version": 0.2, "tvm_version": "0.10.0"}
{"input": ["cuda -keys=cuda,gpu -arch=sm_75 -max_num_threads=1024 -thread_warp_size=32", "conv2d_nchw.cuda", [["TENSOR", [1, 128, 28, 28], "float32"], ["TENSOR", [512, 128, 1, 1], "float32"], [1, 1], [0, 0, 0, 0], [1, 1], "float32"], {}], "config": {"index": 11882205, "code_hash": null, "entity": [["tile_f", "sp", [-1, 32, 1, 1]], ["tile_y", "sp", [-1, 1, 4, 1]], ["tile_x", "sp", [-1, 1, 1, 7]], ["tile_rc", "sp", [-1, 2]], ["tile_ry", "sp", [-1, 1]], ["tile_rx", "sp", [-1, 1]], ["auto_unroll_max_step", "ot", 512], ["unroll_explicit", "ot", 1]]}, "result": [[0.0004653639106628242, 0.0004653881844380403, 0.00046540920461095103], 0, 2.5455353260040283, 1679470852.8811054], "version": 0.2, "tvm_version": "0.10.0"}
{"input": ["cuda -keys=cuda,gpu -arch=sm_75 -max_num_threads=1024 -thread_warp_size=32", "conv2d_nchw.cuda", [["TENSOR", [1, 128, 28, 28], "float32"], ["TENSOR", [512, 128, 1, 1], "float32"], [1, 1], [0, 0, 0, 0], [1, 1], "float32"], {}], "config": {"index": 11744925, "code_hash": null, "entity": [["tile_f", "sp", [-1, 32, 1, 1]], ["tile_y", "sp", [-1, 1, 14, 2]], ["tile_x", "sp", [-1, 4, 7, 1]], ["tile_rc", "sp", [-1, 2]], ["tile_ry", "sp", [-1, 1]], ["tile_rx", "sp", [-1, 1]], ["auto_unroll_max_step", "ot", 512], ["unroll_explicit", "ot", 1]]}, "result": [[0.0002636129116202946, 0.00026363558756137484, 0.0002636380605564648], 0, 2.344028949737549, 1679470854.127402], "version": 0.2, "tvm_version": "0.10.0"}
{"input": ["cuda -keys=cuda,gpu -arch=sm_75 -max_num_threads=1024 -thread_warp_size=32", "conv2d_nchw.cuda", [["TENSOR", [1, 128, 28, 28], "float32"], ["TENSOR", [512, 128, 1, 1], "float32"], [1, 1], [0, 0, 0, 0], [1, 1], "float32"], {}], "config": {"index": 6118426, "code_hash": null, "entity": [["tile_f", "sp", [-1, 64, 1, 1]], ["tile_y", "sp", [-1, 7, 4, 1]], ["tile_x", "sp", [-1, 1, 14, 1]], ["tile_rc", "sp", [-1, 2]], ["tile_ry", "sp", [-1, 1]], ["tile_rx", "sp", [-1, 1]], ["auto_unroll_max_step", "ot", 1500], ["unroll_explicit", "ot", 0]]}, "result": [[0.0007604476627218936, 0.0007605222426035501, 0.00076271075147929], 0, 2.3759424686431885, 1679470865.2587874], "version": 0.2, "tvm_version": "0.10.0"}
{"input": ["cuda -keys=cuda,gpu -arch=sm_75 -max_num_threads=1024 -thread_warp_size=32", "conv2d_nchw.cuda", [["TENSOR", [1, 128, 28, 28], "float32"], ["TENSOR", [512, 128, 1, 1], "float32"], [1, 1], [0, 0, 0, 0], [1, 1], "float32"], {}], "config": {"index": 2941405, "code_hash": null, "entity": [["tile_f", "sp", [-1, 32, 1, 1]], ["tile_y", "sp", [-1, 1, 4, 1]], ["tile_x", "sp", [-1, 4, 7, 1]], ["tile_rc", "sp", [-1, 1]], ["tile_ry", "sp", [-1, 1]], ["tile_rx", "sp", [-1, 1]], ["auto_unroll_max_step", "ot", 512], ["unroll_explicit", "ot", 0]]}, "result": [[0.00011661374871039056, 0.00011667699926308033, 0.00011673658364038319], 0, 1.857038974761963, 1679470866.494273], "version": 0.2, "tvm_version": "0.10.0"}
{"input": ["cuda -keys=cuda,gpu -arch=sm_75 -max_num_threads=1024 -thread_warp_size=32", "conv2d_nchw.cuda", [["TENSOR", [1, 128, 28, 28], "float32"], ["TENSOR", [512, 128, 1, 1], "float32"], [1, 1], [0, 0, 0, 0], [1, 1], "float32"], {}], "config": {"index": 8573405, "code_hash": null, "entity": [["tile_f", "sp", [-1, 32, 1, 1]], ["tile_y", "sp", [-1, 1, 4, 1]], ["tile_x", "sp", [-1, 4, 7, 1]], ["tile_rc", "sp", [-1, 1]], ["tile_ry", "sp", [-1, 1]], ["tile_rx", "sp", [-1, 1]], ["auto_unroll_max_step", "ot", 0], ["unroll_explicit", "ot", 1]]}, "result": [[0.00011662747283406755, 0.00011663072173274595, 0.0001166532966226138], 0, 1.86138916015625, 1679470867.7254376], "version": 0.2, "tvm_version": "0.10.0"}
{"input": ["cuda -keys=cuda,gpu -arch=sm_75 -max_num_threads=1024 -thread_warp_size=32", "conv2d_nchw.cuda", [["TENSOR", [1, 128, 28, 28], "float32"], ["TENSOR", [512, 128, 1, 1], "float32"], [1, 1], [0, 0, 0, 0], [1, 1], "float32"], {}], "config": {"index": 11539005, "code_hash": null, "entity": [["tile_f", "sp", [-1, 32, 1, 1]], ["tile_y", "sp", [-1, 1, 4, 1]], ["tile_x", "sp", [-1, 2, 1, 7]], ["tile_rc", "sp", [-1, 1]], ["tile_ry", "sp", [-1, 1]], ["tile_rx", "sp", [-1, 1]], ["auto_unroll_max_step", "ot", 512], ["unroll_explicit", "ot", 1]]}, "result": [[0.018405012666666668, 0.018408507, 0.018414677833333334], 0, 3.1140968799591064, 1679470868.6736536], "version": 0.2, "tvm_version": "0.10.0"}
{"input": ["cuda -keys=cuda,gpu -arch=sm_75 -max_num_threads=1024 -thread_warp_size=32", "conv2d_nchw.cuda", [["TENSOR", [1, 128, 28, 28], "float32"], ["TENSOR", [512, 128, 1, 1], "float32"], [1, 1], [0, 0, 0, 0], [1, 1], "float32"], {}], "config": {"index": 11393145, "code_hash": null, "entity": [["tile_f", "sp", [-1, 32, 1, 1]], ["tile_y", "sp", [-1, 1, 1, 4]], ["tile_x", "sp", [-1, 4, 7, 1]], ["tile_rc", "sp", [-1, 1]], ["tile_ry", "sp", [-1, 1]], ["tile_rx", "sp", [-1, 1]], ["auto_unroll_max_step", "ot", 512], ["unroll_explicit", "ot", 1]]}, "result": [[0.005689683666666666, 0.0056931165, 0.005693895111111111], 0, 3.196479320526123, 1679470869.5431857], "version": 0.2, "tvm_version": "0.10.0"}
{"input": ["cuda -keys=cuda,gpu -arch=sm_75 -max_num_threads=1024 -thread_warp_size=32", "conv2d_nchw.cuda", [["TENSOR", [1, 128, 28, 28], "float32"], ["TENSOR", [512, 128, 1, 1], "float32"], [1, 1], [0, 0, 0, 0], [1, 1], "float32"], {}], "config": {"index": 11389422, "code_hash": null, "entity": [["tile_f", "sp", [-1, 8, 4, 1]], ["tile_y", "sp", [-1, 1, 4, 1]], ["tile_x", "sp", [-1, 4, 7, 1]], ["tile_rc", "sp", [-1, 1]], ["tile_ry", "sp", [-1, 1]], ["tile_rx", "sp", [-1, 1]], ["auto_unroll_max_step", "ot", 512], ["unroll_explicit", "ot", 1]]}, "result": [[0.00014784181926605504, 0.00014785432018348628, 0.0001478602275229358], 0, 1.8408482074737549, 1679470870.7960758], "version": 0.2, "tvm_version": "0.10.0"}
{"input": ["cuda -keys=cuda,gpu -arch=sm_75 -max_num_threads=1024 -thread_warp_size=32", "conv2d_nchw.cuda", [["TENSOR", [1, 128, 28, 28], "float32"], ["TENSOR", [512, 128, 1, 1], "float32"], [1, 1], [0, 0, 0, 0], [1, 1], "float32"], {}], "config": {"index": 12093405, "code_hash": null, "entity": [["tile_f", "sp", [-1, 32, 1, 1]], ["tile_y", "sp", [-1, 1, 4, 1]], ["tile_x", "sp", [-1, 4, 7, 1]], ["tile_rc", "sp", [-1, 4]], ["tile_ry", "sp", [-1, 1]], ["tile_rx", "sp", [-1, 1]], ["auto_unroll_max_step", "ot", 512], ["unroll_explicit", "ot", 1]]}, "result": [[0.0001534760066921606, 0.0001535451826003824, 0.0001535508135755258], 0, 2.598508834838867, 1679470872.0401175], "version": 0.2, "tvm_version": "0.10.0"}
{"input": ["cuda -keys=cuda,gpu -arch=sm_75 -max_num_threads=1024 -thread_warp_size=32", "conv2d_nchw.cuda", [["TENSOR", [1, 128, 28, 28], "float32"], ["TENSOR", [512, 128, 1, 1], "float32"], [1, 1], [0, 0, 0, 0], [1, 1], "float32"], {}], "config": {"index": 11547805, "code_hash": null, "entity": [["tile_f", "sp", [-1, 32, 1, 1]], ["tile_y", "sp", [-1, 1, 4, 1]], ["tile_x", "sp", [-1, 4, 1, 7]], ["tile_rc", "sp", [-1, 1]], ["tile_ry", "sp", [-1, 1]], ["tile_rx", "sp", [-1, 1]], ["auto_unroll_max_step", "ot", 512], ["unroll_explicit", "ot", 1]]}, "result": [[0.028830192499999997, 0.028840408249999998, 0.0288405685], 0, 2.548109769821167, 1679470873.0407162], "version": 0.2, "tvm_version": "0.10.0"}
{"input": ["cuda -keys=cuda,gpu -arch=sm_75 -max_num_threads=1024 -thread_warp_size=32", "conv2d_nchw.cuda", [["TENSOR", [1, 128, 28, 28], "float32"], ["TENSOR", [512, 128, 1, 1], "float32"], [1, 1], [0, 0, 0, 0], [1, 1], "float32"], {}], "config": {"index": 11389423, "code_hash": null, "entity": [["tile_f", "sp", [-1, 16, 4, 1]], ["tile_y", "sp", [-1, 1, 4, 1]], ["tile_x", "sp", [-1, 4, 7, 1]], ["tile_rc", "sp", [-1, 1]], ["tile_ry", "sp", [-1, 1]], ["tile_rx", "sp", [-1, 1]], ["auto_unroll_max_step", "ot", 512], ["unroll_explicit", "ot", 1]]}, "result": [[0.00012606291679748821, 0.00012611438226059655, 0.00012614359419152276], 0, 1.9128742218017578, 1679470874.2887638], "version": 0.2, "tvm_version": "0.10.0"}
{"input": ["cuda -keys=cuda,gpu -arch=sm_75 -max_num_threads=1024 -thread_warp_size=32", "conv2d_nchw.cuda", [["TENSOR", [1, 128, 28, 28], "float32"], ["TENSOR", [512, 128, 1, 1], "float32"], [1, 1], [0, 0, 0, 0], [1, 1], "float32"], {}], "config": {"index": 14205405, "code_hash": null, "entity": [["tile_f", "sp", [-1, 32, 1, 1]], ["tile_y", "sp", [-1, 1, 4, 1]], ["tile_x", "sp", [-1, 4, 7, 1]], ["tile_rc", "sp", [-1, 1]], ["tile_ry", "sp", [-1, 1]], ["tile_rx", "sp", [-1, 1]], ["auto_unroll_max_step", "ot", 1500], ["unroll_explicit", "ot", 1]]}, "result": [[0.00011681418575624083, 0.00011686235976505142, 0.00011688822760646109], 0, 2.023336172103882, 1679470875.520189], "version": 0.2, "tvm_version": "0.10.0"}
{"input": ["cuda -keys=cuda,gpu -arch=sm_75 -max_num_threads=1024 -thread_warp_size=32", "conv2d_nchw.cuda", [["TENSOR", [1, 128, 28, 28], "float32"], ["TENSOR", [512, 128, 1, 1], "float32"], [1, 1], [0, 0, 0, 0], [1, 1], "float32"], {}], "config": {"index": 12445405, "code_hash": null, "entity": [["tile_f", "sp", [-1, 32, 1, 1]], ["tile_y", "sp", [-1, 1, 4, 1]], ["tile_x", "sp", [-1, 4, 7, 1]], ["tile_rc", "sp", [-1, 8]], ["tile_ry", "sp", [-1, 1]], ["tile_rx", "sp", [-1, 1]], ["auto_unroll_max_step", "ot", 512], ["unroll_explicit", "ot", 1]]}, "result": [[0.0002229287974860335, 0.00022295739664804468, 0.00022296517597765364], 0, 2.449212074279785, 1679470876.7662938], "version": 0.2, "tvm_version": "0.10.0"}
{"input": ["cuda -keys=cuda,gpu -arch=sm_75 -max_num_threads=1024 -thread_warp_size=32", "conv2d_nchw.cuda", [["TENSOR", [1, 128, 28, 28], "float32"], ["TENSOR", [512, 128, 1, 1], "float32"], [1, 1], [0, 0, 0, 0], [1, 1], "float32"], {}], "config": {"index": 11556605, "code_hash": null, "entity": [["tile_f", "sp", [-1, 32, 1, 1]], ["tile_y", "sp", [-1, 1, 4, 1]], ["tile_x", "sp", [-1, 1, 2, 7]], ["tile_rc", "sp", [-1, 1]], ["tile_ry", "sp", [-1, 1]], ["tile_rx", "sp", [-1, 1]], ["auto_unroll_max_step", "ot", 512], ["unroll_explicit", "ot", 1]]}, "result": [[0.00023247081700288185, 0.00023249414409221903, 0.00023256549135446686], 0, 2.462913751602173, 1679470878.0167022], "version": 0.2, "tvm_version": "0.10.0"}
