src/tvm/results/cuda_rtx3080/inception_v3/ga/cpu.log_layer_32.log
{"input": ["cuda -keys=cuda,gpu -arch=sm_86 -max_num_threads=1024 -thread_warp_size=32", "conv2d_nchw.cuda", [["TENSOR", [1, 160, 17, 17], "float32"], ["TENSOR", [160, 160, 7, 1], "float32"], [1, 1], [3, 0, 3, 0], [1, 1], "float32"], {}], "config": {"index": 463425, "code_hash": null, "entity": [["tile_f", "sp", [-1, 2, 1, 16]], ["tile_y", "sp", [-1, 1, 1, 1]], ["tile_x", "sp", [-1, 17, 1, 1]], ["tile_rc", "sp", [-1, 40]], ["tile_ry", "sp", [-1, 1]], ["tile_rx", "sp", [-1, 1]], ["auto_unroll_max_step", "ot", 1500], ["unroll_explicit", "ot", 1]]}, "result": [[0.005824597, 0.005824721000000001, 0.006817041], 0, 10.729735851287842, 1679208091.2975786], "version": 0.2, "tvm_version": "0.10.0"}
{"input": ["cuda -keys=cuda,gpu -arch=sm_86 -max_num_threads=1024 -thread_warp_size=32", "conv2d_nchw.cuda", [["TENSOR", [1, 160, 17, 17], "float32"], ["TENSOR", [160, 160, 7, 1], "float32"], [1, 1], [3, 0, 3, 0], [1, 1], "float32"], {}], "config": {"index": 4007, "code_hash": null, "entity": [["tile_f", "sp", [-1, 2, 5, 16]], ["tile_y", "sp", [-1, 17, 1, 1]], ["tile_x", "sp", [-1, 1, 1, 1]], ["tile_rc", "sp", [-1, 2]], ["tile_ry", "sp", [-1, 1]], ["tile_rx", "sp", [-1, 1]], ["auto_unroll_max_step", "ot", 0], ["unroll_explicit", "ot", 0]]}, "result": [[0.005810176, 0.005810631166666667, 0.005812622055555555], 0, 1.8048419952392578, 1679208092.2587268], "version": 0.2, "tvm_version": "0.10.0"}
{"input": ["cuda -keys=cuda,gpu -arch=sm_86 -max_num_threads=1024 -thread_warp_size=32", "conv2d_nchw.cuda", [["TENSOR", [1, 160, 17, 17], "float32"], ["TENSOR", [160, 160, 7, 1], "float32"], [1, 1], [3, 0, 3, 0], [1, 1], "float32"], {}], "config": {"index": 130279, "code_hash": null, "entity": [["tile_f", "sp", [-1, 1, 20, 4]], ["tile_y", "sp", [-1, 17, 1, 1]], ["tile_x", "sp", [-1, 17, 1, 1]], ["tile_rc", "sp", [-1, 1]], ["tile_ry", "sp", [-1, 7]], ["tile_rx", "sp", [-1, 1]], ["auto_unroll_max_step", "ot", 512], ["unroll_explicit", "ot", 0]]}, "result": [[0.114059776, 0.11407816300000001, 0.1141370845], 0, 3.6092262268066406, 1679208093.9339745], "version": 0.2, "tvm_version": "0.10.0"}
{"input": ["cuda -keys=cuda,gpu -arch=sm_86 -max_num_threads=1024 -thread_warp_size=32", "conv2d_nchw.cuda", [["TENSOR", [1, 160, 17, 17], "float32"], ["TENSOR", [160, 160, 7, 1], "float32"], [1, 1], [3, 0, 3, 0], [1, 1], "float32"], {}], "config": {"index": 29824, "code_hash": null, "entity": [["tile_f", "sp", [-1, 4, 5, 1]], ["tile_y", "sp", [-1, 17, 1, 1]], ["tile_x", "sp", [-1, 17, 1, 1]], ["tile_rc", "sp", [-1, 32]], ["tile_ry", "sp", [-1, 1]], ["tile_rx", "sp", [-1, 1]], ["auto_unroll_max_step", "ot", 0], ["unroll_explicit", "ot", 0]]}, "result": [[0.018390864, 0.018390869, 0.018398208500000002], 0, 1.5159437656402588, 1679208094.9476035], "version": 0.2, "tvm_version": "0.10.0"}
{"input": ["cuda -keys=cuda,gpu -arch=sm_86 -max_num_threads=1024 -thread_warp_size=32", "conv2d_nchw.cuda", [["TENSOR", [1, 160, 17, 17], "float32"], ["TENSOR", [160, 160, 7, 1], "float32"], [1, 1], [3, 0, 3, 0], [1, 1], "float32"], {}], "config": {"index": 217811, "code_hash": null, "entity": [["tile_f", "sp", [-1, 4, 4, 2]], ["tile_y", "sp", [-1, 1, 1, 1]], ["tile_x", "sp", [-1, 1, 1, 17]], ["tile_rc", "sp", [-1, 1]], ["tile_ry", "sp", [-1, 7]], ["tile_rx", "sp", [-1, 1]], ["auto_unroll_max_step", "ot", 1500], ["unroll_explicit", "ot", 0]]}, "result": [[0.0006800007848101267, 0.000680018105485232, 0.000680022417721519], 0, 2.199847936630249, 1679208096.2682617], "version": 0.2, "tvm_version": "0.10.0"}
{"input": ["cuda -keys=cuda,gpu -arch=sm_86 -max_num_threads=1024 -thread_warp_size=32", "conv2d_nchw.cuda", [["TENSOR", [1, 160, 17, 17], "float32"], ["TENSOR", [160, 160, 7, 1], "float32"], [1, 1], [3, 0, 3, 0], [1, 1], "float32"], {}], "config": {"index": 351330, "code_hash": null, "entity": [["tile_f", "sp", [-1, 4, 10, 2]], ["tile_y", "sp", [-1, 1, 1, 1]], ["tile_x", "sp", [-1, 1, 1, 1]], ["tile_rc", "sp", [-1, 4]], ["tile_ry", "sp", [-1, 1]], ["tile_rx", "sp", [-1, 1]], ["auto_unroll_max_step", "ot", 512], ["unroll_explicit", "ot", 1]]}, "result": [[0.0005915606703296703, 0.0005926559487179488, 0.0005927234688644688], 0, 2.210056781768799, 1679208097.5902612], "version": 0.2, "tvm_version": "0.10.0"}
{"input": ["cuda -keys=cuda,gpu -arch=sm_86 -max_num_threads=1024 -thread_warp_size=32", "conv2d_nchw.cuda", [["TENSOR", [1, 160, 17, 17], "float32"], ["TENSOR", [160, 160, 7, 1], "float32"], [1, 1], [3, 0, 3, 0], [1, 1], "float32"], {}], "config": {"index": 9187, "code_hash": null, "entity": [["tile_f", "sp", [-1, 5, 1, 1]], ["tile_y", "sp", [-1, 17, 1, 1]], ["tile_x", "sp", [-1, 1, 17, 1]], ["tile_rc", "sp", [-1, 4]], ["tile_ry", "sp", [-1, 1]], ["tile_rx", "sp", [-1, 1]], ["auto_unroll_max_step", "ot", 0], ["unroll_explicit", "ot", 0]]}, "result": [[0.00023764218639053255, 0.0002376422307692308, 0.0002376422307692308], 0, 2.3044321537017822, 1679208098.9183464], "version": 0.2, "tvm_version": "0.10.0"}
{"input": ["cuda -keys=cuda,gpu -arch=sm_86 -max_num_threads=1024 -thread_warp_size=32", "conv2d_nchw.cuda", [["TENSOR", [1, 160, 17, 17], "float32"], ["TENSOR", [160, 160, 7, 1], "float32"], [1, 1], [3, 0, 3, 0], [1, 1], "float32"], {}], "config": {"index": 100126, "code_hash": null, "entity": [["tile_f", "sp", [-1, 1, 2, 80]], ["tile_y", "sp", [-1, 1, 17, 1]], ["tile_x", "sp", [-1, 1, 1, 17]], ["tile_rc", "sp", [-1, 5]], ["tile_ry", "sp", [-1, 1]], ["tile_rx", "sp", [-1, 1]], ["auto_unroll_max_step", "ot", 512], ["unroll_explicit", "ot", 0]]}, "result": [[0.0192414715, 0.019241786833333333, 0.019242154333333334], 0, 1.9152069091796875, 1679208099.9755087], "version": 0.2, "tvm_version": "0.10.0"}
{"input": ["cuda -keys=cuda,gpu -arch=sm_86 -max_num_threads=1024 -thread_warp_size=32", "conv2d_nchw.cuda", [["TENSOR", [1, 160, 17, 17], "float32"], ["TENSOR", [160, 160, 7, 1], "float32"], [1, 1], [3, 0, 3, 0], [1, 1], "float32"], {}], "config": {"index": 280906, "code_hash": null, "entity": [["tile_f", "sp", [-1, 80, 1, 1]], ["tile_y", "sp", [-1, 1, 17, 1]], ["tile_x", "sp", [-1, 17, 1, 1]], ["tile_rc", "sp", [-1, 16]], ["tile_ry", "sp", [-1, 1]], ["tile_rx", "sp", [-1, 1]], ["auto_unroll_max_step", "ot", 0], ["unroll_explicit", "ot", 1]]}, "result": [[0.010826451099999999, 0.0108269538, 0.0108269569], 0, 1.6669526100158691, 1679208100.9625278], "version": 0.2, "tvm_version": "0.10.0"}
{"input": ["cuda -keys=cuda,gpu -arch=sm_86 -max_num_threads=1024 -thread_warp_size=32", "conv2d_nchw.cuda", [["TENSOR", [1, 160, 17, 17], "float32"], ["TENSOR", [160, 160, 7, 1], "float32"], [1, 1], [3, 0, 3, 0], [1, 1], "float32"], {}], "config": {"index": 283167, "code_hash": null, "entity": [["tile_f", "sp", [-1, 2, 5, 1]], ["tile_y", "sp", [-1, 1, 1, 1]], ["tile_x", "sp", [-1, 1, 1, 1]], ["tile_rc", "sp", [-1, 20]], ["tile_ry", "sp", [-1, 1]], ["tile_rx", "sp", [-1, 1]], ["auto_unroll_max_step", "ot", 0], ["unroll_explicit", "ot", 1]]}, "result": [[0.000504540775, 0.000504540775, 0.00050455040625], 0, 1.6922643184661865, 1679208102.2660522], "version": 0.2, "tvm_version": "0.10.0"}
{"input": ["cuda -keys=cuda,gpu -arch=sm_86 -max_num_threads=1024 -thread_warp_size=32", "conv2d_nchw.cuda", [["TENSOR", [1, 160, 17, 17], "float32"], ["TENSOR", [160, 160, 7, 1], "float32"], [1, 1], [3, 0, 3, 0], [1, 1], "float32"], {}], "config": {"index": 110590, "code_hash": null, "entity": [["tile_f", "sp", [-1, 1, 32, 5]], ["tile_y", "sp", [-1, 17, 1, 1]], ["tile_x", "sp", [-1, 1, 1, 17]], ["tile_rc", "sp", [-1, 16]], ["tile_ry", "sp", [-1, 1]], ["tile_rx", "sp", [-1, 1]], ["auto_unroll_max_step", "ot", 512], ["unroll_explicit", "ot", 0]]}, "result": [[0.14851994300000002, 0.148578186, 0.1485818175], 0, 5.6115593910217285, 1679208104.3121629], "version": 0.2, "tvm_version": "0.10.0"}
{"input": ["cuda -keys=cuda,gpu -arch=sm_86 -max_num_threads=1024 -thread_warp_size=32", "conv2d_nchw.cuda", [["TENSOR", [1, 160, 17, 17], "float32"], ["TENSOR", [160, 160, 7, 1], "float32"], [1, 1], [3, 0, 3, 0], [1, 1], "float32"], {}], "config": {"index": 187789, "code_hash": null, "entity": [["tile_f", "sp", [-1, 8, 2, 2]], ["tile_y", "sp", [-1, 1, 17, 1]], ["tile_x", "sp", [-1, 17, 1, 1]], ["tile_rc", "sp", [-1, 8]], ["tile_ry", "sp", [-1, 1]], ["tile_rx", "sp", [-1, 1]], ["auto_unroll_max_step", "ot", 1500], ["unroll_explicit", "ot", 0]]}, "result": [[0.0007808268792270532, 0.0007808420628019324, 0.0007808420628019324], 0, 1.995096206665039, 1679208105.6314065], "version": 0.2, "tvm_version": "0.10.0"}
{"input": ["cuda -keys=cuda,gpu -arch=sm_86 -max_num_threads=1024 -thread_warp_size=32", "conv2d_nchw.cuda", [["TENSOR", [1, 160, 17, 17], "float32"], ["TENSOR", [160, 160, 7, 1], "float32"], [1, 1], [3, 0, 3, 0], [1, 1], "float32"], {}], "config": {"index": 356284, "code_hash": null, "entity": [["tile_f", "sp", [-1, 5, 4, 4]], ["tile_y", "sp", [-1, 1, 17, 1]], ["tile_x", "sp", [-1, 17, 1, 1]], ["tile_rc", "sp", [-1, 5]], ["tile_ry", "sp", [-1, 1]], ["tile_rx", "sp", [-1, 1]], ["auto_unroll_max_step", "ot", 512], ["unroll_explicit", "ot", 1]]}, "result": [[0.002922261914285714, 0.0029224923142857143, 0.0029243392857142858], 0, 2.5176901817321777, 1679208106.559653], "version": 0.2, "tvm_version": "0.10.0"}
{"input": ["cuda -keys=cuda,gpu -arch=sm_86 -max_num_threads=1024 -thread_warp_size=32", "conv2d_nchw.cuda", [["TENSOR", [1, 160, 17, 17], "float32"], ["TENSOR", [160, 160, 7, 1], "float32"], [1, 1], [3, 0, 3, 0], [1, 1], "float32"], {}], "config": {"index": 322638, "code_hash": null, "entity": [["tile_f", "sp", [-1, 10, 2, 2]], ["tile_y", "sp", [-1, 1, 1, 1]], ["tile_x", "sp", [-1, 1, 1, 1]], ["tile_rc", "sp", [-1, 16]], ["tile_ry", "sp", [-1, 7]], ["tile_rx", "sp", [-1, 1]], ["auto_unroll_max_step", "ot", 0], ["unroll_explicit", "ot", 1]]}, "result": [[0.0011282293707865168, 0.00112831997752809, 0.001128399786516854], 0, 1.3569893836975098, 1679208107.4801707], "version": 0.2, "tvm_version": "0.10.0"}
{"input": ["cuda -keys=cuda,gpu -arch=sm_86 -max_num_threads=1024 -thread_warp_size=32", "conv2d_nchw.cuda", [["TENSOR", [1, 160, 17, 17], "float32"], ["TENSOR", [160, 160, 7, 1], "float32"], [1, 1], [3, 0, 3, 0], [1, 1], "float32"], {}], "config": {"index": 217055, "code_hash": null, "entity": [["tile_f", "sp", [-1, 1, 1, 160]], ["tile_y", "sp", [-1, 1, 1, 1]], ["tile_x", "sp", [-1, 1, 17, 1]], ["tile_rc", "sp", [-1, 1]], ["tile_ry", "sp", [-1, 7]], ["tile_rx", "sp", [-1, 1]], ["auto_unroll_max_step", "ot", 1500], ["unroll_explicit", "ot", 0]]}, "result": [[0.0017825711688311688, 0.0017828105454545454, 0.0017843267142857145], 0, 2.902134895324707, 1679208115.8317058], "version": 0.2, "tvm_version": "0.10.0"}
{"input": ["cuda -keys=cuda,gpu -arch=sm_86 -max_num_threads=1024 -thread_warp_size=32", "conv2d_nchw.cuda", [["TENSOR", [1, 160, 17, 17], "float32"], ["TENSOR", [160, 160, 7, 1], "float32"], [1, 1], [3, 0, 3, 0], [1, 1], "float32"], {}], "config": {"index": 316438, "code_hash": null, "entity": [["tile_f", "sp", [-1, 2, 4, 5]], ["tile_y", "sp", [-1, 1, 1, 1]], ["tile_x", "sp", [-1, 17, 1, 1]], ["tile_rc", "sp", [-1, 8]], ["tile_ry", "sp", [-1, 7]], ["tile_rx", "sp", [-1, 1]], ["auto_unroll_max_step", "ot", 0], ["unroll_explicit", "ot", 1]]}, "result": [[0.0006296440880503145, 0.0006296505220125786, 0.0006296569496855346], 0, 1.363434076309204, 1679208116.7501817], "version": 0.2, "tvm_version": "0.10.0"}
{"input": ["cuda -keys=cuda,gpu -arch=sm_86 -max_num_threads=1024 -thread_warp_size=32", "conv2d_nchw.cuda", [["TENSOR", [1, 160, 17, 17], "float32"], ["TENSOR", [160, 160, 7, 1], "float32"], [1, 1], [3, 0, 3, 0], [1, 1], "float32"], {}], "config": {"index": 264933, "code_hash": null, "entity": [["tile_f", "sp", [-1, 1, 2, 8]], ["tile_y", "sp", [-1, 1, 17, 1]], ["tile_x", "sp", [-1, 1, 1, 17]], ["tile_rc", "sp", [-1, 2]], ["tile_ry", "sp", [-1, 1]], ["tile_rx", "sp", [-1, 1]], ["auto_unroll_max_step", "ot", 0], ["unroll_explicit", "ot", 1]]}, "result": [[0.00022427888128491617, 0.00022428030865921788, 0.00022428030865921788], 0, 1.9142584800720215, 1679208118.0714447], "version": 0.2, "tvm_version": "0.10.0"}
{"input": ["cuda -keys=cuda,gpu -arch=sm_86 -max_num_threads=1024 -thread_warp_size=32", "conv2d_nchw.cuda", [["TENSOR", [1, 160, 17, 17], "float32"], ["TENSOR", [160, 160, 7, 1], "float32"], [1, 1], [3, 0, 3, 0], [1, 1], "float32"], {}], "config": {"index": 201031, "code_hash": null, "entity": [["tile_f", "sp", [-1, 2, 20, 2]], ["tile_y", "sp", [-1, 17, 1, 1]], ["tile_x", "sp", [-1, 1, 1, 1]], ["tile_rc", "sp", [-1, 32]], ["tile_ry", "sp", [-1, 1]], ["tile_rx", "sp", [-1, 1]], ["auto_unroll_max_step", "ot", 1500], ["unroll_explicit", "ot", 0]]}, "result": [[0.00023360373830409357, 0.0002336051885964912, 0.00023360973976608188], 0, 1.944812536239624, 1679208119.3852637], "version": 0.2, "tvm_version": "0.10.0"}
{"input": ["cuda -keys=cuda,gpu -arch=sm_86 -max_num_threads=1024 -thread_warp_size=32", "conv2d_nchw.cuda", [["TENSOR", [1, 160, 17, 17], "float32"], ["TENSOR", [160, 160, 7, 1], "float32"], [1, 1], [3, 0, 3, 0], [1, 1], "float32"], {}], "config": {"index": 488499, "code_hash": null, "entity": [["tile_f", "sp", [-1, 4, 1, 10]], ["tile_y", "sp", [-1, 1, 1, 1]], ["tile_x", "sp", [-1, 17, 1, 1]], ["tile_rc", "sp", [-1, 8]], ["tile_ry", "sp", [-1, 7]], ["tile_rx", "sp", [-1, 1]], ["auto_unroll_max_step", "ot", 1500], ["unroll_explicit", "ot", 1]]}, "result": [[0.0073763105714285725, 0.007436141928571428, 0.007443529357142857], 0, 7.927998781204224, 1679208120.339399], "version": 0.2, "tvm_version": "0.10.0"}
{"input": ["cuda -keys=cuda,gpu -arch=sm_86 -max_num_threads=1024 -thread_warp_size=32", "conv2d_nchw.cuda", [["TENSOR", [1, 160, 17, 17], "float32"], ["TENSOR", [160, 160, 7, 1], "float32"], [1, 1], [3, 0, 3, 0], [1, 1], "float32"], {}], "config": {"index": 282444, "code_hash": null, "entity": [["tile_f", "sp", [-1, 8, 1, 20]], ["tile_y", "sp", [-1, 1, 1, 1]], ["tile_x", "sp", [-1, 1, 1, 17]], ["tile_rc", "sp", [-1, 16]], ["tile_ry", "sp", [-1, 1]], ["tile_rx", "sp", [-1, 1]], ["auto_unroll_max_step", "ot", 0], ["unroll_explicit", "ot", 1]]}, "result": [[0.06936473800000001, 0.069547523, 0.076447166], 0, 1.9969706535339355, 1679208121.5513556], "version": 0.2, "tvm_version": "0.10.0"}
{"input": ["cuda -keys=cuda,gpu -arch=sm_86 -max_num_threads=1024 -thread_warp_size=32", "conv2d_nchw.cuda", [["TENSOR", [1, 160, 17, 17], "float32"], ["TENSOR", [160, 160, 7, 1], "float32"], [1, 1], [3, 0, 3, 0], [1, 1], "float32"], {}], "config": {"index": 268048, "code_hash": null, "entity": [["tile_f", "sp", [-1, 1, 2, 5]], ["tile_y", "sp", [-1, 1, 1, 1]], ["tile_x", "sp", [-1, 1, 1, 17]], ["tile_rc", "sp", [-1, 4]], ["tile_ry", "sp", [-1, 1]], ["tile_rx", "sp", [-1, 1]], ["auto_unroll_max_step", "ot", 0], ["unroll_explicit", "ot", 1]]}, "result": [[0.00022974025142857144, 0.00023017617285714287, 0.00023017911571428573], 0, 1.8510165214538574, 1679208122.8706274], "version": 0.2, "tvm_version": "0.10.0"}
{"input": ["cuda -keys=cuda,gpu -arch=sm_86 -max_num_threads=1024 -thread_warp_size=32", "conv2d_nchw.cuda", [["TENSOR", [1, 160, 17, 17], "float32"], ["TENSOR", [160, 160, 7, 1], "float32"], [1, 1], [3, 0, 3, 0], [1, 1], "float32"], {}], "config": {"index": 160, "code_hash": null, "entity": [["tile_f", "sp", [-1, 2, 1, 8]], ["tile_y", "sp", [-1, 1, 1, 1]], ["tile_x", "sp", [-1, 1, 1, 1]], ["tile_rc", "sp", [-1, 1]], ["tile_ry", "sp", [-1, 1]], ["tile_rx", "sp", [-1, 1]], ["auto_unroll_max_step", "ot", 0], ["unroll_explicit", "ot", 0]]}, "result": [[0.0015309255151515152, 0.0015310971666666667, 0.001531267909090909], 0, 1.1524202823638916, 1679208123.790816], "version": 0.2, "tvm_version": "0.10.0"}
{"input": ["cuda -keys=cuda,gpu -arch=sm_86 -max_num_threads=1024 -thread_warp_size=32", "conv2d_nchw.cuda", [["TENSOR", [1, 160, 17, 17], "float32"], ["TENSOR", [160, 160, 7, 1], "float32"], [1, 1], [3, 0, 3, 0], [1, 1], "float32"], {}], "config": {"index": 50606, "code_hash": null, "entity": [["tile_f", "sp", [-1, 2, 2, 20]], ["tile_y", "sp", [-1, 17, 1, 1]], ["tile_x", "sp", [-1, 1, 1, 1]], ["tile_rc", "sp", [-1, 4]], ["tile_ry", "sp", [-1, 7]], ["tile_rx", "sp", [-1, 1]], ["auto_unroll_max_step", "ot", 0], ["unroll_explicit", "ot", 0]]}, "result": [[0.007415753789473685, 0.00741656252631579, 0.007418718000000001], 0, 2.0680582523345947, 1679208131.223047], "version": 0.2, "tvm_version": "0.10.0"}
{"input": ["cuda -keys=cuda,gpu -arch=sm_86 -max_num_threads=1024 -thread_warp_size=32", "conv2d_nchw.cuda", [["TENSOR", [1, 160, 17, 17], "float32"], ["TENSOR", [160, 160, 7, 1], "float32"], [1, 1], [3, 0, 3, 0], [1, 1], "float32"], {}], "config": {"index": 444509, "code_hash": null, "entity": [["tile_f", "sp", [-1, 2, 8, 2]], ["tile_y", "sp", [-1, 1, 1, 1]], ["tile_x", "sp", [-1, 1, 1, 1]], ["tile_rc", "sp", [-1, 8]], ["tile_ry", "sp", [-1, 1]], ["tile_rx", "sp", [-1, 1]], ["auto_unroll_max_step", "ot", 1500], ["unroll_explicit", "ot", 1]]}, "result": [[0.0006263784341085271, 0.0006279065, 0.0006282398875968992], 0, 2.14145565032959, 1679208132.5548003], "version": 0.2, "tvm_version": "0.10.0"}
{"input": ["cuda -keys=cuda,gpu -arch=sm_86 -max_num_threads=1024 -thread_warp_size=32", "conv2d_nchw.cuda", [["TENSOR", [1, 160, 17, 17], "float32"], ["TENSOR", [160, 160, 7, 1], "float32"], [1, 1], [3, 0, 3, 0], [1, 1], "float32"], {}], "config": {"index": 229841, "code_hash": null, "entity": [["tile_f", "sp", [-1, 10, 2, 1]], ["tile_y", "sp", [-1, 1, 17, 1]], ["tile_x", "sp", [-1, 1, 1, 1]], ["tile_rc", "sp", [-1, 8]], ["tile_ry", "sp", [-1, 7]], ["tile_rx", "sp", [-1, 1]], ["auto_unroll_max_step", "ot", 1500], ["unroll_explicit", "ot", 0]]}, "result": [[6.430686821705426e-05, 6.430728518971847e-05, 6.430764626682987e-05], 0, 2.2531237602233887, 1679208133.8516207], "version": 0.2, "tvm_version": "0.10.0"}
{"input": ["cuda -keys=cuda,gpu -arch=sm_86 -max_num_threads=1024 -thread_warp_size=32", "conv2d_nchw.cuda", [["TENSOR", [1, 160, 17, 17], "float32"], ["TENSOR", [160, 160, 7, 1], "float32"], [1, 1], [3, 0, 3, 0], [1, 1], "float32"], {}], "config": {"index": 26336, "code_hash": null, "entity": [["tile_f", "sp", [-1, 4, 5, 4]], ["tile_y", "sp", [-1, 17, 1, 1]], ["tile_x", "sp", [-1, 17, 1, 1]], ["tile_rc", "sp", [-1, 20]], ["tile_ry", "sp", [-1, 1]], ["tile_rx", "sp", [-1, 1]], ["auto_unroll_max_step", "ot", 0], ["unroll_explicit", "ot", 0]]}, "result": [[0.04009362, 0.040100118, 0.04011178566666667], 0, 2.425095319747925, 1679208134.9940734], "version": 0.2, "tvm_version": "0.10.0"}
{"input": ["cuda -keys=cuda,gpu -arch=sm_86 -max_num_threads=1024 -thread_warp_size=32", "conv2d_nchw.cuda", [["TENSOR", [1, 160, 17, 17], "float32"], ["TENSOR", [160, 160, 7, 1], "float32"], [1, 1], [3, 0, 3, 0], [1, 1], "float32"], {}], "config": {"index": 161600, "code_hash": null, "entity": [["tile_f", "sp", [-1, 1, 10, 2]], ["tile_y", "sp", [-1, 17, 1, 1]], ["tile_x", "sp", [-1, 1, 1, 1]], ["tile_rc", "sp", [-1, 40]], ["tile_ry", "sp", [-1, 7]], ["tile_rx", "sp", [-1, 1]], ["auto_unroll_max_step", "ot", 512], ["unroll_explicit", "ot", 0]]}, "result": [[7.109229158964879e-05, 7.109419547134935e-05, 7.109512615526803e-05], 0, 1.780562162399292, 1679208136.2861624], "version": 0.2, "tvm_version": "0.10.0"}
{"input": ["cuda -keys=cuda,gpu -arch=sm_86 -max_num_threads=1024 -thread_warp_size=32", "conv2d_nchw.cuda", [["TENSOR", [1, 160, 17, 17], "float32"], ["TENSOR", [160, 160, 7, 1], "float32"], [1, 1], [3, 0, 3, 0], [1, 1], "float32"], {}], "config": {"index": 146887, "code_hash": null, "entity": [["tile_f", "sp", [-1, 5, 2, 8]], ["tile_y", "sp", [-1, 1, 1, 17]], ["tile_x", "sp", [-1, 1, 1, 17]], ["tile_rc", "sp", [-1, 8]], ["tile_ry", "sp", [-1, 7]], ["tile_rx", "sp", [-1, 1]], ["auto_unroll_max_step", "ot", 512], ["unroll_explicit", "ot", 0]]}, "result": [[0.086557693, 0.08656025649999999, 0.0866391065], 0, 2.5655484199523926, 1679208137.6643548], "version": 0.2, "tvm_version": "0.10.0"}
{"input": ["cuda -keys=cuda,gpu -arch=sm_86 -max_num_threads=1024 -thread_warp_size=32", "conv2d_nchw.cuda", [["TENSOR", [1, 160, 17, 17], "float32"], ["TENSOR", [160, 160, 7, 1], "float32"], [1, 1], [3, 0, 3, 0], [1, 1], "float32"], {}], "config": {"index": 154706, "code_hash": null, "entity": [["tile_f", "sp", [-1, 4, 2, 5]], ["tile_y", "sp", [-1, 1, 17, 1]], ["tile_x", "sp", [-1, 1, 1, 1]], ["tile_rc", "sp", [-1, 20]], ["tile_ry", "sp", [-1, 7]], ["tile_rx", "sp", [-1, 1]], ["auto_unroll_max_step", "ot", 512], ["unroll_explicit", "ot", 0]]}, "result": [[0.000544693883161512, 0.0005447327903780069, 0.0005447539209621993], 0, 6.024033546447754, 1679208138.984179], "version": 0.2, "tvm_version": "0.10.0"}
{"input": ["cuda -keys=cuda,gpu -arch=sm_86 -max_num_threads=1024 -thread_warp_size=32", "conv2d_nchw.cuda", [["TENSOR", [1, 160, 17, 17], "float32"], ["TENSOR", [160, 160, 7, 1], "float32"], [1, 1], [3, 0, 3, 0], [1, 1], "float32"], {}], "config": {"index": 103546, "code_hash": null, "entity": [["tile_f", "sp", [-1, 2, 40, 1]], ["tile_y", "sp", [-1, 1, 17, 1]], ["tile_x", "sp", [-1, 1, 1, 17]], ["tile_rc", "sp", [-1, 8]], ["tile_ry", "sp", [-1, 1]], ["tile_rx", "sp", [-1, 1]], ["auto_unroll_max_step", "ot", 512], ["unroll_explicit", "ot", 0]]}, "result": [[0.0005315873486842106, 0.0005316108388157895, 0.0005316278026315789], 0, 1.9818637371063232, 1679208140.3098886], "version": 0.2, "tvm_version": "0.10.0"}
{"input": ["cuda -keys=cuda,gpu -arch=sm_86 -max_num_threads=1024 -thread_warp_size=32", "conv2d_nchw.cuda", [["TENSOR", [1, 160, 17, 17], "float32"], ["TENSOR", [160, 160, 7, 1], "float32"], [1, 1], [3, 0, 3, 0], [1, 1], "float32"], {}], "config": {"index": 112399, "code_hash": null, "entity": [["tile_f", "sp", [-1, 2, 10, 8]], ["tile_y", "sp", [-1, 17, 1, 1]], ["tile_x", "sp", [-1, 17, 1, 1]], ["tile_rc", "sp", [-1, 20]], ["tile_ry", "sp", [-1, 1]], ["tile_rx", "sp", [-1, 1]], ["auto_unroll_max_step", "ot", 512], ["unroll_explicit", "ot", 0]]}, "result": [[0.047194112, 0.04720298766666666, 0.04721220366666667], 0, 3.0188889503479004, 1679208141.5746582], "version": 0.2, "tvm_version": "0.10.0"}
{"input": ["cuda -keys=cuda,gpu -arch=sm_86 -max_num_threads=1024 -thread_warp_size=32", "conv2d_nchw.cuda", [["TENSOR", [1, 160, 17, 17], "float32"], ["TENSOR", [160, 160, 7, 1], "float32"], [1, 1], [3, 0, 3, 0], [1, 1], "float32"], {}], "config": {"index": 279363, "code_hash": null, "entity": [["tile_f", "sp", [-1, 32, 5, 1]], ["tile_y", "sp", [-1, 1, 1, 17]], ["tile_x", "sp", [-1, 1, 1, 17]], ["tile_rc", "sp", [-1, 10]], ["tile_ry", "sp", [-1, 1]], ["tile_rx", "sp", [-1, 1]], ["auto_unroll_max_step", "ot", 0], ["unroll_explicit", "ot", 1]]}, "result": [[0.085786621, 0.0858178555, 0.085867004], 0, 2.362726926803589, 1679208142.9338686], "version": 0.2, "tvm_version": "0.10.0"}
{"input": ["cuda -keys=cuda,gpu -arch=sm_86 -max_num_threads=1024 -thread_warp_size=32", "conv2d_nchw.cuda", [["TENSOR", [1, 160, 17, 17], "float32"], ["TENSOR", [160, 160, 7, 1], "float32"], [1, 1], [3, 0, 3, 0], [1, 1], "float32"], {}], "config": {"index": 454133, "code_hash": null, "entity": [["tile_f", "sp", [-1, 10, 4, 2]], ["tile_y", "sp", [-1, 1, 1, 17]], ["tile_x", "sp", [-1, 1, 17, 1]], ["tile_rc", "sp", [-1, 16]], ["tile_ry", "sp", [-1, 1]], ["tile_rx", "sp", [-1, 1]], ["auto_unroll_max_step", "ot", 1500], ["unroll_explicit", "ot", 1]]}, "result": [[0.0015900281746031744, 0.0015905133174603176, 0.0015905645396825398], 0, 2.5545530319213867, 1679208143.8611217], "version": 0.2, "tvm_version": "0.10.0"}
{"input": ["cuda -keys=cuda,gpu -arch=sm_86 -max_num_threads=1024 -thread_warp_size=32", "conv2d_nchw.cuda", [["TENSOR", [1, 160, 17, 17], "float32"], ["TENSOR", [160, 160, 7, 1], "float32"], [1, 1], [3, 0, 3, 0], [1, 1], "float32"], {}], "config": {"index": 301532, "code_hash": null, "entity": [["tile_f", "sp", [-1, 20, 4, 1]], ["tile_y", "sp", [-1, 1, 17, 1]], ["tile_x", "sp", [-1, 1, 1, 1]], ["tile_rc", "sp", [-1, 1]], ["tile_ry", "sp", [-1, 7]], ["tile_rx", "sp", [-1, 1]], ["auto_unroll_max_step", "ot", 0], ["unroll_explicit", "ot", 1]]}, "result": [[0.000191227406424581, 0.00019123486452513966, 0.00019144938268156423], 0, 1.6687893867492676, 1679208154.6863663], "version": 0.2, "tvm_version": "0.10.0"}
{"input": ["cuda -keys=cuda,gpu -arch=sm_86 -max_num_threads=1024 -thread_warp_size=32", "conv2d_nchw.cuda", [["TENSOR", [1, 160, 17, 17], "float32"], ["TENSOR", [160, 160, 7, 1], "float32"], [1, 1], [3, 0, 3, 0], [1, 1], "float32"], {}], "config": {"index": 326576, "code_hash": null, "entity": [["tile_f", "sp", [-1, 1, 4, 20]], ["tile_y", "sp", [-1, 17, 1, 1]], ["tile_x", "sp", [-1, 1, 1, 1]], ["tile_rc", "sp", [-1, 20]], ["tile_ry", "sp", [-1, 7]], ["tile_rx", "sp", [-1, 1]], ["auto_unroll_max_step", "ot", 0], ["unroll_explicit", "ot", 1]]}, "result": [[0.00493607, 0.0049363624761904765, 0.0049364601904761905], 0, 1.8714258670806885, 1679208155.64677], "version": 0.2, "tvm_version": "0.10.0"}
{"input": ["cuda -keys=cuda,gpu -arch=sm_86 -max_num_threads=1024 -thread_warp_size=32", "conv2d_nchw.cuda", [["TENSOR", [1, 160, 17, 17], "float32"], ["TENSOR", [160, 160, 7, 1], "float32"], [1, 1], [3, 0, 3, 0], [1, 1], "float32"], {}], "config": {"index": 463425, "code_hash": null, "entity": [["tile_f", "sp", [-1, 2, 1, 16]], ["tile_y", "sp", [-1, 1, 1, 1]], ["tile_x", "sp", [-1, 17, 1, 1]], ["tile_rc", "sp", [-1, 40]], ["tile_ry", "sp", [-1, 1]], ["tile_rx", "sp", [-1, 1]], ["auto_unroll_max_step", "ot", 1500], ["unroll_explicit", "ot", 1]]}, "result": [[0.005815296166666667, 0.005815296166666667, 0.0058155805555555554], 0, 10.373834133148193, 1679208156.5934002], "version": 0.2, "tvm_version": "0.10.0"}
{"input": ["cuda -keys=cuda,gpu -arch=sm_86 -max_num_threads=1024 -thread_warp_size=32", "conv2d_nchw.cuda", [["TENSOR", [1, 160, 17, 17], "float32"], ["TENSOR", [160, 160, 7, 1], "float32"], [1, 1], [3, 0, 3, 0], [1, 1], "float32"], {}], "config": {"index": 4007, "code_hash": null, "entity": [["tile_f", "sp", [-1, 2, 5, 16]], ["tile_y", "sp", [-1, 17, 1, 1]], ["tile_x", "sp", [-1, 1, 1, 1]], ["tile_rc", "sp", [-1, 2]], ["tile_ry", "sp", [-1, 1]], ["tile_rx", "sp", [-1, 1]], ["auto_unroll_max_step", "ot", 0], ["unroll_explicit", "ot", 0]]}, "result": [[0.005801984111111111, 0.005802040944444444, 0.005804878222222223], 0, 1.7729556560516357, 1679208157.5351055], "version": 0.2, "tvm_version": "0.10.0"}
{"input": ["cuda -keys=cuda,gpu -arch=sm_86 -max_num_threads=1024 -thread_warp_size=32", "conv2d_nchw.cuda", [["TENSOR", [1, 160, 17, 17], "float32"], ["TENSOR", [160, 160, 7, 1], "float32"], [1, 1], [3, 0, 3, 0], [1, 1], "float32"], {}], "config": {"index": 130279, "code_hash": null, "entity": [["tile_f", "sp", [-1, 1, 20, 4]], ["tile_y", "sp", [-1, 17, 1, 1]], ["tile_x", "sp", [-1, 17, 1, 1]], ["tile_rc", "sp", [-1, 1]], ["tile_ry", "sp", [-1, 7]], ["tile_rx", "sp", [-1, 1]], ["auto_unroll_max_step", "ot", 512], ["unroll_explicit", "ot", 0]]}, "result": [[0.114067459, 0.1140864025, 0.1141447675], 0, 3.667706251144409, 1679208159.203087], "version": 0.2, "tvm_version": "0.10.0"}
{"input": ["cuda -keys=cuda,gpu -arch=sm_86 -max_num_threads=1024 -thread_warp_size=32", "conv2d_nchw.cuda", [["TENSOR", [1, 160, 17, 17], "float32"], ["TENSOR", [160, 160, 7, 1], "float32"], [1, 1], [3, 0, 3, 0], [1, 1], "float32"], {}], "config": {"index": 29824, "code_hash": null, "entity": [["tile_f", "sp", [-1, 4, 5, 1]], ["tile_y", "sp", [-1, 17, 1, 1]], ["tile_x", "sp", [-1, 17, 1, 1]], ["tile_rc", "sp", [-1, 32]], ["tile_ry", "sp", [-1, 1]], ["tile_rx", "sp", [-1, 1]], ["auto_unroll_max_step", "ot", 0], ["unroll_explicit", "ot", 0]]}, "result": [[0.0183712425, 0.01837140766666667, 0.018381125], 0, 1.5809729099273682, 1679208160.2196195], "version": 0.2, "tvm_version": "0.10.0"}
{"input": ["cuda -keys=cuda,gpu -arch=sm_86 -max_num_threads=1024 -thread_warp_size=32", "conv2d_nchw.cuda", [["TENSOR", [1, 160, 17, 17], "float32"], ["TENSOR", [160, 160, 7, 1], "float32"], [1, 1], [3, 0, 3, 0], [1, 1], "float32"], {}], "config": {"index": 217811, "code_hash": null, "entity": [["tile_f", "sp", [-1, 4, 4, 2]], ["tile_y", "sp", [-1, 1, 1, 1]], ["tile_x", "sp", [-1, 1, 1, 17]], ["tile_rc", "sp", [-1, 1]], ["tile_ry", "sp", [-1, 7]], ["tile_rx", "sp", [-1, 1]], ["auto_unroll_max_step", "ot", 1500], ["unroll_explicit", "ot", 0]]}, "result": [[0.0006789335738396625, 0.0006789422658227848, 0.0006789422658227848], 0, 2.278069257736206, 1679208161.5467281], "version": 0.2, "tvm_version": "0.10.0"}
{"input": ["cuda -keys=cuda,gpu -arch=sm_86 -max_num_threads=1024 -thread_warp_size=32", "conv2d_nchw.cuda", [["TENSOR", [1, 160, 17, 17], "float32"], ["TENSOR", [160, 160, 7, 1], "float32"], [1, 1], [3, 0, 3, 0], [1, 1], "float32"], {}], "config": {"index": 351330, "code_hash": null, "entity": [["tile_f", "sp", [-1, 4, 10, 2]], ["tile_y", "sp", [-1, 1, 1, 1]], ["tile_x", "sp", [-1, 1, 1, 1]], ["tile_rc", "sp", [-1, 4]], ["tile_ry", "sp", [-1, 1]], ["tile_rx", "sp", [-1, 1]], ["auto_unroll_max_step", "ot", 512], ["unroll_explicit", "ot", 1]]}, "result": [[0.0005914781721611721, 0.0005915456886446887, 0.0005915794505494506], 0, 2.2163078784942627, 1679208162.8751578], "version": 0.2, "tvm_version": "0.10.0"}
{"input": ["cuda -keys=cuda,gpu -arch=sm_86 -max_num_threads=1024 -thread_warp_size=32", "conv2d_nchw.cuda", [["TENSOR", [1, 160, 17, 17], "float32"], ["TENSOR", [160, 160, 7, 1], "float32"], [1, 1], [3, 0, 3, 0], [1, 1], "float32"], {}], "config": {"index": 9187, "code_hash": null, "entity": [["tile_f", "sp", [-1, 5, 1, 1]], ["tile_y", "sp", [-1, 17, 1, 1]], ["tile_x", "sp", [-1, 1, 17, 1]], ["tile_rc", "sp", [-1, 4]], ["tile_ry", "sp", [-1, 1]], ["tile_rx", "sp", [-1, 1]], ["auto_unroll_max_step", "ot", 0], ["unroll_explicit", "ot", 0]]}, "result": [[0.00023730633234859673, 0.0002373153929098966, 0.00023731994534711967], 0, 2.3860771656036377, 1679208164.198015], "version": 0.2, "tvm_version": "0.10.0"}
{"input": ["cuda -keys=cuda,gpu -arch=sm_86 -max_num_threads=1024 -thread_warp_size=32", "conv2d_nchw.cuda", [["TENSOR", [1, 160, 17, 17], "float32"], ["TENSOR", [160, 160, 7, 1], "float32"], [1, 1], [3, 0, 3, 0], [1, 1], "float32"], {}], "config": {"index": 100126, "code_hash": null, "entity": [["tile_f", "sp", [-1, 1, 2, 80]], ["tile_y", "sp", [-1, 1, 17, 1]], ["tile_x", "sp", [-1, 1, 1, 17]], ["tile_rc", "sp", [-1, 5]], ["tile_ry", "sp", [-1, 1]], ["tile_rx", "sp", [-1, 1]], ["auto_unroll_max_step", "ot", 512], ["unroll_explicit", "ot", 0]]}, "result": [[0.01915356316666667, 0.019153722, 0.019154747], 0, 1.9019992351531982, 1679208165.2530982], "version": 0.2, "tvm_version": "0.10.0"}
{"input": ["cuda -keys=cuda,gpu -arch=sm_86 -max_num_threads=1024 -thread_warp_size=32", "conv2d_nchw.cuda", [["TENSOR", [1, 160, 17, 17], "float32"], ["TENSOR", [160, 160, 7, 1], "float32"], [1, 1], [3, 0, 3, 0], [1, 1], "float32"], {}], "config": {"index": 280906, "code_hash": null, "entity": [["tile_f", "sp", [-1, 80, 1, 1]], ["tile_y", "sp", [-1, 1, 17, 1]], ["tile_x", "sp", [-1, 17, 1, 1]], ["tile_rc", "sp", [-1, 16]], ["tile_ry", "sp", [-1, 1]], ["tile_rx", "sp", [-1, 1]], ["auto_unroll_max_step", "ot", 0], ["unroll_explicit", "ot", 1]]}, "result": [[0.0107794433, 0.0107799552, 0.010780364899999999], 0, 1.6505992412567139, 1679208166.2514763], "version": 0.2, "tvm_version": "0.10.0"}
{"input": ["cuda -keys=cuda,gpu -arch=sm_86 -max_num_threads=1024 -thread_warp_size=32", "conv2d_nchw.cuda", [["TENSOR", [1, 160, 17, 17], "float32"], ["TENSOR", [160, 160, 7, 1], "float32"], [1, 1], [3, 0, 3, 0], [1, 1], "float32"], {}], "config": {"index": 283167, "code_hash": null, "entity": [["tile_f", "sp", [-1, 2, 5, 1]], ["tile_y", "sp", [-1, 1, 1, 1]], ["tile_x", "sp", [-1, 1, 1, 1]], ["tile_rc", "sp", [-1, 20]], ["tile_ry", "sp", [-1, 1]], ["tile_rx", "sp", [-1, 1]], ["auto_unroll_max_step", "ot", 0], ["unroll_explicit", "ot", 1]]}, "result": [[0.0005035391781250001, 0.0005035488124999999, 0.00050355200625], 0, 1.7723262310028076, 1679208167.5700655], "version": 0.2, "tvm_version": "0.10.0"}
{"input": ["cuda -keys=cuda,gpu -arch=sm_86 -max_num_threads=1024 -thread_warp_size=32", "conv2d_nchw.cuda", [["TENSOR", [1, 160, 17, 17], "float32"], ["TENSOR", [160, 160, 7, 1], "float32"], [1, 1], [3, 0, 3, 0], [1, 1], "float32"], {}], "config": {"index": 110590, "code_hash": null, "entity": [["tile_f", "sp", [-1, 1, 32, 5]], ["tile_y", "sp", [-1, 17, 1, 1]], ["tile_x", "sp", [-1, 1, 1, 17]], ["tile_rc", "sp", [-1, 16]], ["tile_ry", "sp", [-1, 1]], ["tile_rx", "sp", [-1, 1]], ["auto_unroll_max_step", "ot", 512], ["unroll_explicit", "ot", 0]]}, "result": [[0.14775036600000002, 0.14781080600000002, 0.14781234699999998], 0, 5.631635665893555, 1679208169.6204393], "version": 0.2, "tvm_version": "0.10.0"}
{"input": ["cuda -keys=cuda,gpu -arch=sm_86 -max_num_threads=1024 -thread_warp_size=32", "conv2d_nchw.cuda", [["TENSOR", [1, 160, 17, 17], "float32"], ["TENSOR", [160, 160, 7, 1], "float32"], [1, 1], [3, 0, 3, 0], [1, 1], "float32"], {}], "config": {"index": 187789, "code_hash": null, "entity": [["tile_f", "sp", [-1, 8, 2, 2]], ["tile_y", "sp", [-1, 1, 17, 1]], ["tile_x", "sp", [-1, 17, 1, 1]], ["tile_rc", "sp", [-1, 8]], ["tile_ry", "sp", [-1, 1]], ["tile_rx", "sp", [-1, 1]], ["auto_unroll_max_step", "ot", 1500], ["unroll_explicit", "ot", 0]]}, "result": [[0.0007796399371980677, 0.0007796448743961354, 0.0007796993526570049], 0, 2.1411819458007812, 1679208170.9461355], "version": 0.2, "tvm_version": "0.10.0"}
{"input": ["cuda -keys=cuda,gpu -arch=sm_86 -max_num_threads=1024 -thread_warp_size=32", "conv2d_nchw.cuda", [["TENSOR", [1, 160, 17, 17], "float32"], ["TENSOR", [160, 160, 7, 1], "float32"], [1, 1], [3, 0, 3, 0], [1, 1], "float32"], {}], "config": {"index": 356284, "code_hash": null, "entity": [["tile_f", "sp", [-1, 5, 4, 4]], ["tile_y", "sp", [-1, 1, 17, 1]], ["tile_x", "sp", [-1, 17, 1, 1]], ["tile_rc", "sp", [-1, 5]], ["tile_ry", "sp", [-1, 1]], ["tile_rx", "sp", [-1, 1]], ["auto_unroll_max_step", "ot", 512], ["unroll_explicit", "ot", 1]]}, "result": [[0.0029083354285714285, 0.0029093302857142855, 0.002909447342857143], 0, 2.4935805797576904, 1679208171.8710039], "version": 0.2, "tvm_version": "0.10.0"}
{"input": ["cuda -keys=cuda,gpu -arch=sm_86 -max_num_threads=1024 -thread_warp_size=32", "conv2d_nchw.cuda", [["TENSOR", [1, 160, 17, 17], "float32"], ["TENSOR", [160, 160, 7, 1], "float32"], [1, 1], [3, 0, 3, 0], [1, 1], "float32"], {}], "config": {"index": 193634, "code_hash": null, "entity": [["tile_f", "sp", [-1, 4, 10, 2]], ["tile_y", "sp", [-1, 1, 1, 1]], ["tile_x", "sp", [-1, 1, 1, 1]], ["tile_rc", "sp", [-1, 16]], ["tile_ry", "sp", [-1, 1]], ["tile_rx", "sp", [-1, 1]], ["auto_unroll_max_step", "ot", 1500], ["unroll_explicit", "ot", 0]]}, "result": [[0.0007381014064171123, 0.0007381723957219252, 0.0007384400374331551], 0, 1.997476577758789, 1679208182.2355855], "version": 0.2, "tvm_version": "0.10.0"}
{"input": ["cuda -keys=cuda,gpu -arch=sm_86 -max_num_threads=1024 -thread_warp_size=32", "conv2d_nchw.cuda", [["TENSOR", [1, 160, 17, 17], "float32"], ["TENSOR", [160, 160, 7, 1], "float32"], [1, 1], [3, 0, 3, 0], [1, 1], "float32"], {}], "config": {"index": 445837, "code_hash": null, "entity": [["tile_f", "sp", [-1, 8, 2, 2]], ["tile_y", "sp", [-1, 1, 17, 1]], ["tile_x", "sp", [-1, 17, 1, 1]], ["tile_rc", "sp", [-1, 8]], ["tile_ry", "sp", [-1, 1]], ["tile_rx", "sp", [-1, 1]], ["auto_unroll_max_step", "ot", 1500], ["unroll_explicit", "ot", 1]]}, "result": [[0.0007969348217821781, 0.0007969401881188119, 0.0007969660198019802], 0, 2.7777445316314697, 1679208183.5508125], "version": 0.2, "tvm_version": "0.10.0"}
{"input": ["cuda -keys=cuda,gpu -arch=sm_86 -max_num_threads=1024 -thread_warp_size=32", "conv2d_nchw.cuda", [["TENSOR", [1, 160, 17, 17], "float32"], ["TENSOR", [160, 160, 7, 1], "float32"], [1, 1], [3, 0, 3, 0], [1, 1], "float32"], {}], "config": {"index": 115015, "code_hash": null, "entity": [["tile_f", "sp", [-1, 2, 20, 2]], ["tile_y", "sp", [-1, 17, 1, 1]], ["tile_x", "sp", [-1, 1, 1, 1]], ["tile_rc", "sp", [-1, 32]], ["tile_ry", "sp", [-1, 1]], ["tile_rx", "sp", [-1, 1]], ["auto_unroll_max_step", "ot", 512], ["unroll_explicit", "ot", 0]]}, "result": [[0.00023453791520467834, 0.0002345439166666667, 0.0002345513903508772], 0, 2.2490904331207275, 1679208184.865807], "version": 0.2, "tvm_version": "0.10.0"}
{"input": ["cuda -keys=cuda,gpu -arch=sm_86 -max_num_threads=1024 -thread_warp_size=32", "conv2d_nchw.cuda", [["TENSOR", [1, 160, 17, 17], "float32"], ["TENSOR", [160, 160, 7, 1], "float32"], [1, 1], [3, 0, 3, 0], [1, 1], "float32"], {}], "config": {"index": 229976, "code_hash": null, "entity": [["tile_f", "sp", [-1, 8, 4, 5]], ["tile_y", "sp", [-1, 1, 17, 1]], ["tile_x", "sp", [-1, 1, 1, 1]], ["tile_rc", "sp", [-1, 8]], ["tile_ry", "sp", [-1, 7]], ["tile_rx", "sp", [-1, 1]], ["auto_unroll_max_step", "ot", 1500], ["unroll_explicit", "ot", 0]]}, "result": [[0.0009192165459770115, 0.0009192518908045977, 0.0009193033678160919], 0, 4.824666738510132, 1679208186.1890666], "version": 0.2, "tvm_version": "0.10.0"}
{"input": ["cuda -keys=cuda,gpu -arch=sm_86 -max_num_threads=1024 -thread_warp_size=32", "conv2d_nchw.cuda", [["TENSOR", [1, 160, 17, 17], "float32"], ["TENSOR", [160, 160, 7, 1], "float32"], [1, 1], [3, 0, 3, 0], [1, 1], "float32"], {}], "config": {"index": 505809, "code_hash": null, "entity": [["tile_f", "sp", [-1, 10, 2, 1]], ["tile_y", "sp", [-1, 1, 17, 1]], ["tile_x", "sp", [-1, 1, 1, 1]], ["tile_rc", "sp", [-1, 40]], ["tile_ry", "sp", [-1, 7]], ["tile_rx", "sp", [-1, 1]], ["auto_unroll_max_step", "ot", 1500], ["unroll_explicit", "ot", 1]]}, "result": [[0.00011625003389830507, 0.0001162636175386883, 0.0001162779543109801], 0, 3.9854187965393066, 1679208187.497124], "version": 0.2, "tvm_version": "0.10.0"}
{"input": ["cuda -keys=cuda,gpu -arch=sm_86 -max_num_threads=1024 -thread_warp_size=32", "conv2d_nchw.cuda", [["TENSOR", [1, 160, 17, 17], "float32"], ["TENSOR", [160, 160, 7, 1], "float32"], [1, 1], [3, 0, 3, 0], [1, 1], "float32"], {}], "config": {"index": 229696, "code_hash": null, "entity": [["tile_f", "sp", [-1, 1, 10, 2]], ["tile_y", "sp", [-1, 17, 1, 1]], ["tile_x", "sp", [-1, 1, 1, 1]], ["tile_rc", "sp", [-1, 8]], ["tile_ry", "sp", [-1, 7]], ["tile_rx", "sp", [-1, 1]], ["auto_unroll_max_step", "ot", 1500], ["unroll_explicit", "ot", 0]]}, "result": [[0.00013079457249378623, 0.00013079627920463958, 0.0001307979726594863], 0, 1.9258685111999512, 1679208188.7987723], "version": 0.2, "tvm_version": "0.10.0"}
{"input": ["cuda -keys=cuda,gpu -arch=sm_86 -max_num_threads=1024 -thread_warp_size=32", "conv2d_nchw.cuda", [["TENSOR", [1, 160, 17, 17], "float32"], ["TENSOR", [160, 160, 7, 1], "float32"], [1, 1], [3, 0, 3, 0], [1, 1], "float32"], {}], "config": {"index": 143825, "code_hash": null, "entity": [["tile_f", "sp", [-1, 10, 2, 1]], ["tile_y", "sp", [-1, 1, 17, 1]], ["tile_x", "sp", [-1, 1, 1, 1]], ["tile_rc", "sp", [-1, 8]], ["tile_ry", "sp", [-1, 7]], ["tile_rx", "sp", [-1, 1]], ["auto_unroll_max_step", "ot", 512], ["unroll_explicit", "ot", 0]]}, "result": [[9.83439169249845e-05, 9.834780471171729e-05, 9.834970613763176e-05], 0, 2.061149835586548, 1679208190.1038318], "version": 0.2, "tvm_version": "0.10.0"}
{"input": ["cuda -keys=cuda,gpu -arch=sm_86 -max_num_threads=1024 -thread_warp_size=32", "conv2d_nchw.cuda", [["TENSOR", [1, 160, 17, 17], "float32"], ["TENSOR", [160, 160, 7, 1], "float32"], [1, 1], [3, 0, 3, 0], [1, 1], "float32"], {}], "config": {"index": 229632, "code_hash": null, "entity": [["tile_f", "sp", [-1, 4, 5, 1]], ["tile_y", "sp", [-1, 17, 1, 1]], ["tile_x", "sp", [-1, 1, 1, 1]], ["tile_rc", "sp", [-1, 8]], ["tile_ry", "sp", [-1, 7]], ["tile_rx", "sp", [-1, 1]], ["auto_unroll_max_step", "ot", 1500], ["unroll_explicit", "ot", 0]]}, "result": [[0.00021895249658002736, 0.00021895529411764707, 0.00021896487414500685], 0, 2.2681381702423096, 1679208191.4126525], "version": 0.2, "tvm_version": "0.10.0"}
{"input": ["cuda -keys=cuda,gpu -arch=sm_86 -max_num_threads=1024 -thread_warp_size=32", "conv2d_nchw.cuda", [["TENSOR", [1, 160, 17, 17], "float32"], ["TENSOR", [160, 160, 7, 1], "float32"], [1, 1], [3, 0, 3, 0], [1, 1], "float32"], {}], "config": {"index": 419648, "code_hash": null, "entity": [["tile_f", "sp", [-1, 1, 10, 2]], ["tile_y", "sp", [-1, 17, 1, 1]], ["tile_x", "sp", [-1, 1, 1, 1]], ["tile_rc", "sp", [-1, 40]], ["tile_ry", "sp", [-1, 7]], ["tile_rx", "sp", [-1, 1]], ["auto_unroll_max_step", "ot", 512], ["unroll_explicit", "ot", 1]]}, "result": [[7.074635339366516e-05, 7.074913574660635e-05, 7.074959864253394e-05], 0, 2.001511573791504, 1679208192.703137], "version": 0.2, "tvm_version": "0.10.0"}
{"input": ["cuda -keys=cuda,gpu -arch=sm_86 -max_num_threads=1024 -thread_warp_size=32", "conv2d_nchw.cuda", [["TENSOR", [1, 160, 17, 17], "float32"], ["TENSOR", [160, 160, 7, 1], "float32"], [1, 1], [3, 0, 3, 0], [1, 1], "float32"], {}], "config": {"index": 182032, "code_hash": null, "entity": [["tile_f", "sp", [-1, 1, 2, 5]], ["tile_y", "sp", [-1, 1, 1, 1]], ["tile_x", "sp", [-1, 1, 1, 17]], ["tile_rc", "sp", [-1, 4]], ["tile_ry", "sp", [-1, 1]], ["tile_rx", "sp", [-1, 1]], ["auto_unroll_max_step", "ot", 1500], ["unroll_explicit", "ot", 0]]}, "result": [[0.00020019072693266832, 0.0002001983753117207, 0.00020020859226932669], 0, 1.7880699634552002, 1679208194.0125895], "version": 0.2, "tvm_version": "0.10.0"}
{"input": ["cuda -keys=cuda,gpu -arch=sm_86 -max_num_threads=1024 -thread_warp_size=32", "conv2d_nchw.cuda", [["TENSOR", [1, 160, 17, 17], "float32"], ["TENSOR", [160, 160, 7, 1], "float32"], [1, 1], [3, 0, 3, 0], [1, 1], "float32"], {}], "config": {"index": 196085, "code_hash": null, "entity": [["tile_f", "sp", [-1, 10, 4, 2]], ["tile_y", "sp", [-1, 1, 1, 17]], ["tile_x", "sp", [-1, 1, 17, 1]], ["tile_rc", "sp", [-1, 16]], ["tile_ry", "sp", [-1, 1]], ["tile_rx", "sp", [-1, 1]], ["auto_unroll_max_step", "ot", 1500], ["unroll_explicit", "ot", 0]]}, "result": [[0.0016414378870967742, 0.001641439, 0.0016415050806451613], 0, 1.8236167430877686, 1679208194.9384105], "version": 0.2, "tvm_version": "0.10.0"}
{"input": ["cuda -keys=cuda,gpu -arch=sm_86 -max_num_threads=1024 -thread_warp_size=32", "conv2d_nchw.cuda", [["TENSOR", [1, 160, 17, 17], "float32"], ["TENSOR", [160, 160, 7, 1], "float32"], [1, 1], [3, 0, 3, 0], [1, 1], "float32"], {}], "config": {"index": 323036, "code_hash": null, "entity": [["tile_f", "sp", [-1, 20, 4, 1]], ["tile_y", "sp", [-1, 1, 17, 1]], ["tile_x", "sp", [-1, 1, 1, 1]], ["tile_rc", "sp", [-1, 16]], ["tile_ry", "sp", [-1, 7]], ["tile_rx", "sp", [-1, 1]], ["auto_unroll_max_step", "ot", 0], ["unroll_explicit", "ot", 1]]}, "result": [[0.00028827523792486584, 0.0002882880679785331, 0.0002883741610017889], 0, 1.744797945022583, 1679208196.255639], "version": 0.2, "tvm_version": "0.10.0"}
{"input": ["cuda -keys=cuda,gpu -arch=sm_86 -max_num_threads=1024 -thread_warp_size=32", "conv2d_nchw.cuda", [["TENSOR", [1, 160, 17, 17], "float32"], ["TENSOR", [160, 160, 7, 1], "float32"], [1, 1], [3, 0, 3, 0], [1, 1], "float32"], {}], "config": {"index": 852, "code_hash": null, "entity": [["tile_f", "sp", [-1, 8, 1, 10]], ["tile_y", "sp", [-1, 1, 1, 17]], ["tile_x", "sp", [-1, 1, 1, 1]], ["tile_rc", "sp", [-1, 1]], ["tile_ry", "sp", [-1, 1]], ["tile_rx", "sp", [-1, 1]], ["auto_unroll_max_step", "ot", 0], ["unroll_explicit", "ot", 0]]}, "result": [[0.137483261, 0.1405486145, 0.14056806900000002], 0, 2.887075185775757, 1679208198.2039382], "version": 0.2, "tvm_version": "0.10.0"}
{"input": ["cuda -keys=cuda,gpu -arch=sm_86 -max_num_threads=1024 -thread_warp_size=32", "conv2d_nchw.cuda", [["TENSOR", [1, 160, 17, 17], "float32"], ["TENSOR", [160, 160, 7, 1], "float32"], [1, 1], [3, 0, 3, 0], [1, 1], "float32"], {}], "config": {"index": 372453, "code_hash": null, "entity": [["tile_f", "sp", [-1, 1, 2, 8]], ["tile_y", "sp", [-1, 1, 17, 1]], ["tile_x", "sp", [-1, 1, 1, 17]], ["tile_rc", "sp", [-1, 20]], ["tile_ry", "sp", [-1, 1]], ["tile_rx", "sp", [-1, 1]], ["auto_unroll_max_step", "ot", 512], ["unroll_explicit", "ot", 1]]}, "result": [[0.0002648592904290429, 0.0002648662640264027, 0.0002648812211221122], 0, 2.8486409187316895, 1679208199.5212317], "version": 0.2, "tvm_version": "0.10.0"}
{"input": ["cuda -keys=cuda,gpu -arch=sm_86 -max_num_threads=1024 -thread_warp_size=32", "conv2d_nchw.cuda", [["TENSOR", [1, 160, 17, 17], "float32"], ["TENSOR", [160, 160, 7, 1], "float32"], [1, 1], [3, 0, 3, 0], [1, 1], "float32"], {}], "config": {"index": 230031, "code_hash": null, "entity": [["tile_f", "sp", [-1, 4, 2, 20]], ["tile_y", "sp", [-1, 1, 17, 1]], ["tile_x", "sp", [-1, 1, 1, 1]], ["tile_rc", "sp", [-1, 8]], ["tile_ry", "sp", [-1, 7]], ["tile_rx", "sp", [-1, 1]], ["auto_unroll_max_step", "ot", 1500], ["unroll_explicit", "ot", 0]]}, "result": [[0.0009537341142857144, 0.0009538120761904762, 0.0009547775904761905], 0, 9.907271385192871, 1679208200.4489145], "version": 0.2, "tvm_version": "0.10.0"}
{"input": ["cuda -keys=cuda,gpu -arch=sm_86 -max_num_threads=1024 -thread_warp_size=32", "conv2d_nchw.cuda", [["TENSOR", [1, 160, 17, 17], "float32"], ["TENSOR", [160, 160, 7, 1], "float32"], [1, 1], [3, 0, 3, 0], [1, 1], "float32"], {}], "config": {"index": 258368, "code_hash": null, "entity": [["tile_f", "sp", [-1, 1, 10, 2]], ["tile_y", "sp", [-1, 17, 1, 1]], ["tile_x", "sp", [-1, 1, 1, 1]], ["tile_rc", "sp", [-1, 1]], ["tile_ry", "sp", [-1, 1]], ["tile_rx", "sp", [-1, 1]], ["auto_unroll_max_step", "ot", 0], ["unroll_explicit", "ot", 1]]}, "result": [[0.00034999060869565215, 0.00034999849360613813, 0.00035000372122762145], 0, 1.6163570880889893, 1679208204.6098316], "version": 0.2, "tvm_version": "0.10.0"}
{"input": ["cuda -keys=cuda,gpu -arch=sm_86 -max_num_threads=1024 -thread_warp_size=32", "conv2d_nchw.cuda", [["TENSOR", [1, 160, 17, 17], "float32"], ["TENSOR", [160, 160, 7, 1], "float32"], [1, 1], [3, 0, 3, 0], [1, 1], "float32"], {}], "config": {"index": 264785, "code_hash": null, "entity": [["tile_f", "sp", [-1, 10, 2, 1]], ["tile_y", "sp", [-1, 1, 17, 1]], ["tile_x", "sp", [-1, 1, 1, 17]], ["tile_rc", "sp", [-1, 2]], ["tile_ry", "sp", [-1, 1]], ["tile_rx", "sp", [-1, 1]], ["auto_unroll_max_step", "ot", 0], ["unroll_explicit", "ot", 1]]}, "result": [[0.00032474038383838383, 0.00032474454545454543, 0.00032475487272727273], 0, 1.8281440734863281, 1679208205.930256], "version": 0.2, "tvm_version": "0.10.0"}
{"input": ["cuda -keys=cuda,gpu -arch=sm_86 -max_num_threads=1024 -thread_warp_size=32", "conv2d_nchw.cuda", [["TENSOR", [1, 160, 17, 17], "float32"], ["TENSOR", [160, 160, 7, 1], "float32"], [1, 1], [3, 0, 3, 0], [1, 1], "float32"], {}], "config": {"index": 444444, "code_hash": null, "entity": [["tile_f", "sp", [-1, 20, 4, 1]], ["tile_y", "sp", [-1, 1, 1, 1]], ["tile_x", "sp", [-1, 1, 1, 1]], ["tile_rc", "sp", [-1, 8]], ["tile_ry", "sp", [-1, 1]], ["tile_rx", "sp", [-1, 1]], ["auto_unroll_max_step", "ot", 1500], ["unroll_explicit", "ot", 1]]}, "result": [[0.0005931670647058824, 0.0005932513941176471, 0.0005933285411764707], 0, 2.0350968837738037, 1679208206.8506758], "version": 0.2, "tvm_version": "0.10.0"}
{"input": ["cuda -keys=cuda,gpu -arch=sm_86 -max_num_threads=1024 -thread_warp_size=32", "conv2d_nchw.cuda", [["TENSOR", [1, 160, 17, 17], "float32"], ["TENSOR", [160, 160, 7, 1], "float32"], [1, 1], [3, 0, 3, 0], [1, 1], "float32"], {}], "config": {"index": 229703, "code_hash": null, "entity": [["tile_f", "sp", [-1, 2, 20, 2]], ["tile_y", "sp", [-1, 17, 1, 1]], ["tile_x", "sp", [-1, 1, 1, 1]], ["tile_rc", "sp", [-1, 8]], ["tile_ry", "sp", [-1, 7]], ["tile_rx", "sp", [-1, 1]], ["auto_unroll_max_step", "ot", 1500], ["unroll_explicit", "ot", 0]]}, "result": [[0.00016234090558375633, 0.00016234194314720813, 0.00016234194314720813], 0, 2.0122175216674805, 1679208208.163349], "version": 0.2, "tvm_version": "0.10.0"}
{"input": ["cuda -keys=cuda,gpu -arch=sm_86 -max_num_threads=1024 -thread_warp_size=32", "conv2d_nchw.cuda", [["TENSOR", [1, 160, 17, 17], "float32"], ["TENSOR", [160, 160, 7, 1], "float32"], [1, 1], [3, 0, 3, 0], [1, 1], "float32"], {}], "config": {"index": 487889, "code_hash": null, "entity": [["tile_f", "sp", [-1, 10, 2, 1]], ["tile_y", "sp", [-1, 1, 17, 1]], ["tile_x", "sp", [-1, 1, 1, 1]], ["tile_rc", "sp", [-1, 8]], ["tile_ry", "sp", [-1, 7]], ["tile_rx", "sp", [-1, 1]], ["auto_unroll_max_step", "ot", 1500], ["unroll_explicit", "ot", 1]]}, "result": [[5.796009638554217e-05, 5.7963181475903614e-05, 5.7963181475903614e-05], 0, 2.888815402984619, 1679208209.4437642], "version": 0.2, "tvm_version": "0.10.0"}
{"input": ["cuda -keys=cuda,gpu -arch=sm_86 -max_num_threads=1024 -thread_warp_size=32", "conv2d_nchw.cuda", [["TENSOR", [1, 160, 17, 17], "float32"], ["TENSOR", [160, 160, 7, 1], "float32"], [1, 1], [3, 0, 3, 0], [1, 1], "float32"], {}], "config": {"index": 275578, "code_hash": null, "entity": [["tile_f", "sp", [-1, 2, 40, 1]], ["tile_y", "sp", [-1, 1, 17, 1]], ["tile_x", "sp", [-1, 1, 1, 17]], ["tile_rc", "sp", [-1, 8]], ["tile_ry", "sp", [-1, 1]], ["tile_rx", "sp", [-1, 1]], ["auto_unroll_max_step", "ot", 0], ["unroll_explicit", "ot", 1]]}, "result": [[0.000563020986013986, 0.000563052409090909, 0.0005630560909090908], 0, 1.689903974533081, 1679208210.7651424], "version": 0.2, "tvm_version": "0.10.0"}
{"input": ["cuda -keys=cuda,gpu -arch=sm_86 -max_num_threads=1024 -thread_warp_size=32", "conv2d_nchw.cuda", [["TENSOR", [1, 160, 17, 17], "float32"], ["TENSOR", [160, 160, 7, 1], "float32"], [1, 1], [3, 0, 3, 0], [1, 1], "float32"], {}], "config": {"index": 229920, "code_hash": null, "entity": [["tile_f", "sp", [-1, 1, 10, 2]], ["tile_y", "sp", [-1, 1, 17, 1]], ["tile_x", "sp", [-1, 1, 1, 1]], ["tile_rc", "sp", [-1, 8]], ["tile_ry", "sp", [-1, 7]], ["tile_rx", "sp", [-1, 1]], ["auto_unroll_max_step", "ot", 1500], ["unroll_explicit", "ot", 0]]}, "result": [[3.907170990382116e-05, 3.929024330647257e-05, 3.929050896802704e-05], 0, 1.6808013916015625, 1679208212.0249531], "version": 0.2, "tvm_version": "0.10.0"}
{"input": ["cuda -keys=cuda,gpu -arch=sm_86 -max_num_threads=1024 -thread_warp_size=32", "conv2d_nchw.cuda", [["TENSOR", [1, 160, 17, 17], "float32"], ["TENSOR", [160, 160, 7, 1], "float32"], [1, 1], [3, 0, 3, 0], [1, 1], "float32"], {}], "config": {"index": 174803, "code_hash": null, "entity": [["tile_f", "sp", [-1, 4, 4, 2]], ["tile_y", "sp", [-1, 1, 1, 1]], ["tile_x", "sp", [-1, 1, 1, 17]], ["tile_rc", "sp", [-1, 1]], ["tile_ry", "sp", [-1, 1]], ["tile_rx", "sp", [-1, 1]], ["auto_unroll_max_step", "ot", 1500], ["unroll_explicit", "ot", 0]]}, "result": [[0.00039702951724137936, 0.0003970320369458128, 0.00039705740640394086], 0, 2.0966951847076416, 1679208213.3418448], "version": 0.2, "tvm_version": "0.10.0"}
{"input": ["cuda -keys=cuda,gpu -arch=sm_86 -max_num_threads=1024 -thread_warp_size=32", "conv2d_nchw.cuda", [["TENSOR", [1, 160, 17, 17], "float32"], ["TENSOR", [160, 160, 7, 1], "float32"], [1, 1], [3, 0, 3, 0], [1, 1], "float32"], {}], "config": {"index": 445004, "code_hash": null, "entity": [["tile_f", "sp", [-1, 4, 1, 5]], ["tile_y", "sp", [-1, 1, 17, 1]], ["tile_x", "sp", [-1, 1, 1, 1]], ["tile_rc", "sp", [-1, 8]], ["tile_ry", "sp", [-1, 1]], ["tile_rx", "sp", [-1, 1]], ["auto_unroll_max_step", "ot", 1500], ["unroll_explicit", "ot", 1]]}, "result": [[5.117045890640725e-05, 5.1171467292854756e-05, 5.117767125125797e-05], 0, 3.0764570236206055, 1679208214.613825], "version": 0.2, "tvm_version": "0.10.0"}
{"input": ["cuda -keys=cuda,gpu -arch=sm_86 -max_num_threads=1024 -thread_warp_size=32", "conv2d_nchw.cuda", [["TENSOR", [1, 160, 17, 17], "float32"], ["TENSOR", [160, 160, 7, 1], "float32"], [1, 1], [3, 0, 3, 0], [1, 1], "float32"], {}], "config": {"index": 268000, "code_hash": null, "entity": [["tile_f", "sp", [-1, 1, 10, 2]], ["tile_y", "sp", [-1, 1, 1, 1]], ["tile_x", "sp", [-1, 1, 1, 17]], ["tile_rc", "sp", [-1, 4]], ["tile_ry", "sp", [-1, 1]], ["tile_rx", "sp", [-1, 1]], ["auto_unroll_max_step", "ot", 0], ["unroll_explicit", "ot", 1]]}, "result": [[0.0001241998753894081, 0.00012420067211838006, 0.00012420146806853583], 0, 1.796452283859253, 1679208215.9298363], "version": 0.2, "tvm_version": "0.10.0"}
{"input": ["cuda -keys=cuda,gpu -arch=sm_86 -max_num_threads=1024 -thread_warp_size=32", "conv2d_nchw.cuda", [["TENSOR", [1, 160, 17, 17], "float32"], ["TENSOR", [160, 160, 7, 1], "float32"], [1, 1], [3, 0, 3, 0], [1, 1], "float32"], {}], "config": {"index": 8515, "code_hash": null, "entity": [["tile_f", "sp", [-1, 5, 1, 1]], ["tile_y", "sp", [-1, 1, 17, 1]], ["tile_x", "sp", [-1, 17, 1, 1]], ["tile_rc", "sp", [-1, 4]], ["tile_ry", "sp", [-1, 1]], ["tile_rx", "sp", [-1, 1]], ["auto_unroll_max_step", "ot", 0], ["unroll_explicit", "ot", 0]]}, "result": [[0.00023666143593519882, 0.00023666314285714286, 0.00023666916642120769], 0, 2.295778512954712, 1679208217.2456934], "version": 0.2, "tvm_version": "0.10.0"}
{"input": ["cuda -keys=cuda,gpu -arch=sm_86 -max_num_threads=1024 -thread_warp_size=32", "conv2d_nchw.cuda", [["TENSOR", [1, 160, 17, 17], "float32"], ["TENSOR", [160, 160, 7, 1], "float32"], [1, 1], [3, 0, 3, 0], [1, 1], "float32"], {}], "config": {"index": 351697, "code_hash": null, "entity": [["tile_f", "sp", [-1, 10, 2, 1]], ["tile_y", "sp", [-1, 1, 17, 1]], ["tile_x", "sp", [-1, 1, 1, 1]], ["tile_rc", "sp", [-1, 4]], ["tile_ry", "sp", [-1, 1]], ["tile_rx", "sp", [-1, 1]], ["auto_unroll_max_step", "ot", 512], ["unroll_explicit", "ot", 1]]}, "result": [[5.248555421686748e-05, 5.2635715318416527e-05, 5.276472943201378e-05], 0, 1.8724720478057861, 1679208218.5246987], "version": 0.2, "tvm_version": "0.10.0"}
{"input": ["cuda -keys=cuda,gpu -arch=sm_86 -max_num_threads=1024 -thread_warp_size=32", "conv2d_nchw.cuda", [["TENSOR", [1, 160, 17, 17], "float32"], ["TENSOR", [160, 160, 7, 1], "float32"], [1, 1], [3, 0, 3, 0], [1, 1], "float32"], {}], "config": {"index": 229970, "code_hash": null, "entity": [["tile_f", "sp", [-1, 4, 2, 5]], ["tile_y", "sp", [-1, 1, 17, 1]], ["tile_x", "sp", [-1, 1, 1, 1]], ["tile_rc", "sp", [-1, 8]], ["tile_ry", "sp", [-1, 7]], ["tile_rx", "sp", [-1, 1]], ["auto_unroll_max_step", "ot", 1500], ["unroll_explicit", "ot", 0]]}, "result": [[0.00018681861233993017, 0.00018682099185098953, 0.00018682099185098953], 0, 4.070200443267822, 1679208219.869779], "version": 0.2, "tvm_version": "0.10.0"}
{"input": ["cuda -keys=cuda,gpu -arch=sm_86 -max_num_threads=1024 -thread_warp_size=32", "conv2d_nchw.cuda", [["TENSOR", [1, 160, 17, 17], "float32"], ["TENSOR", [160, 160, 7, 1], "float32"], [1, 1], [3, 0, 3, 0], [1, 1], "float32"], {}], "config": {"index": 93282, "code_hash": null, "entity": [["tile_f", "sp", [-1, 4, 10, 2]], ["tile_y", "sp", [-1, 1, 1, 1]], ["tile_x", "sp", [-1, 1, 1, 1]], ["tile_rc", "sp", [-1, 4]], ["tile_ry", "sp", [-1, 1]], ["tile_rx", "sp", [-1, 1]], ["auto_unroll_max_step", "ot", 512], ["unroll_explicit", "ot", 0]]}, "result": [[0.0005894466273062731, 0.000589465036900369, 0.0005896154870848708], 0, 1.9183850288391113, 1679208221.1810777], "version": 0.2, "tvm_version": "0.10.0"}
{"input": ["cuda -keys=cuda,gpu -arch=sm_86 -max_num_threads=1024 -thread_warp_size=32", "conv2d_nchw.cuda", [["TENSOR", [1, 160, 17, 17], "float32"], ["TENSOR", [160, 160, 7, 1], "float32"], [1, 1], [3, 0, 3, 0], [1, 1], "float32"], {}], "config": {"index": 176039, "code_hash": null, "entity": [["tile_f", "sp", [-1, 2, 5, 16]], ["tile_y", "sp", [-1, 17, 1, 1]], ["tile_x", "sp", [-1, 1, 1, 1]], ["tile_rc", "sp", [-1, 2]], ["tile_ry", "sp", [-1, 1]], ["tile_rx", "sp", [-1, 1]], ["auto_unroll_max_step", "ot", 1500], ["unroll_explicit", "ot", 0]]}, "result": [[0.003371340925, 0.003371494275, 0.0033715911749999995], 0, 2.704533338546753, 1679208226.2286787], "version": 0.2, "tvm_version": "0.10.0"}
{"input": ["cuda -keys=cuda,gpu -arch=sm_86 -max_num_threads=1024 -thread_warp_size=32", "conv2d_nchw.cuda", [["TENSOR", [1, 160, 17, 17], "float32"], ["TENSOR", [160, 160, 7, 1], "float32"], [1, 1], [3, 0, 3, 0], [1, 1], "float32"], {}], "config": {"index": 419594, "code_hash": null, "entity": [["tile_f", "sp", [-1, 1, 10, 1]], ["tile_y", "sp", [-1, 17, 1, 1]], ["tile_x", "sp", [-1, 1, 1, 1]], ["tile_rc", "sp", [-1, 40]], ["tile_ry", "sp", [-1, 7]], ["tile_rx", "sp", [-1, 1]], ["auto_unroll_max_step", "ot", 512], ["unroll_explicit", "ot", 1]]}, "result": [[5.383110616080752e-05, 5.384358197006614e-05, 5.384814966933519e-05], 0, 2.455127239227295, 1679208227.5067415], "version": 0.2, "tvm_version": "0.10.0"}
{"input": ["cuda -keys=cuda,gpu -arch=sm_86 -max_num_threads=1024 -thread_warp_size=32", "conv2d_nchw.cuda", [["TENSOR", [1, 160, 17, 17], "float32"], ["TENSOR", [160, 160, 7, 1], "float32"], [1, 1], [3, 0, 3, 0], [1, 1], "float32"], {}], "config": {"index": 247616, "code_hash": null, "entity": [["tile_f", "sp", [-1, 1, 10, 2]], ["tile_y", "sp", [-1, 17, 1, 1]], ["tile_x", "sp", [-1, 1, 1, 1]], ["tile_rc", "sp", [-1, 40]], ["tile_ry", "sp", [-1, 7]], ["tile_rx", "sp", [-1, 1]], ["auto_unroll_max_step", "ot", 1500], ["unroll_explicit", "ot", 0]]}, "result": [[6.573439139515455e-05, 6.573480576441102e-05, 6.573609941520467e-05], 0, 2.9516358375549316, 1679208228.8023555], "version": 0.2, "tvm_version": "0.10.0"}
{"input": ["cuda -keys=cuda,gpu -arch=sm_86 -max_num_threads=1024 -thread_warp_size=32", "conv2d_nchw.cuda", [["TENSOR", [1, 160, 17, 17], "float32"], ["TENSOR", [160, 160, 7, 1], "float32"], [1, 1], [3, 0, 3, 0], [1, 1], "float32"], {}], "config": {"index": 230034, "code_hash": null, "entity": [["tile_f", "sp", [-1, 1, 8, 20]], ["tile_y", "sp", [-1, 1, 17, 1]], ["tile_x", "sp", [-1, 1, 1, 1]], ["tile_rc", "sp", [-1, 8]], ["tile_ry", "sp", [-1, 7]], ["tile_rx", "sp", [-1, 1]], ["auto_unroll_max_step", "ot", 1500], ["unroll_explicit", "ot", 0]]}, "result": [[0.0001654958730489074, 0.00016549774609781476, 0.00016550652757544226], 0, 4.170916795730591, 1679208230.1110132], "version": 0.2, "tvm_version": "0.10.0"}
{"input": ["cuda -keys=cuda,gpu -arch=sm_86 -max_num_threads=1024 -thread_warp_size=32", "conv2d_nchw.cuda", [["TENSOR", [1, 160, 17, 17], "float32"], ["TENSOR", [160, 160, 7, 1], "float32"], [1, 1], [3, 0, 3, 0], [1, 1], "float32"], {}], "config": {"index": 230144, "code_hash": null, "entity": [["tile_f", "sp", [-1, 1, 10, 2]], ["tile_y", "sp", [-1, 1, 1, 17]], ["tile_x", "sp", [-1, 1, 1, 1]], ["tile_rc", "sp", [-1, 8]], ["tile_ry", "sp", [-1, 7]], ["tile_rx", "sp", [-1, 1]], ["auto_unroll_max_step", "ot", 1500], ["unroll_explicit", "ot", 0]]}, "result": [[0.00012934138662316476, 0.00012934645187601959, 0.00012934811990212073], 0, 1.841186761856079, 1679208231.4102345], "version": 0.2, "tvm_version": "0.10.0"}
{"input": ["cuda -keys=cuda,gpu -arch=sm_86 -max_num_threads=1024 -thread_warp_size=32", "conv2d_nchw.cuda", [["TENSOR", [1, 160, 17, 17], "float32"], ["TENSOR", [160, 160, 7, 1], "float32"], [1, 1], [3, 0, 3, 0], [1, 1], "float32"], {}], "config": {"index": 232529, "code_hash": null, "entity": [["tile_f", "sp", [-1, 10, 2, 1]], ["tile_y", "sp", [-1, 1, 17, 1]], ["tile_x", "sp", [-1, 1, 1, 17]], ["tile_rc", "sp", [-1, 8]], ["tile_ry", "sp", [-1, 7]], ["tile_rx", "sp", [-1, 1]], ["auto_unroll_max_step", "ot", 1500], ["unroll_explicit", "ot", 0]]}, "result": [[0.0003362147754237288, 0.0003362234724576271, 0.0003362256377118644], 0, 3.4420108795166016, 1679208232.7316575], "version": 0.2, "tvm_version": "0.10.0"}
{"input": ["cuda -keys=cuda,gpu -arch=sm_86 -max_num_threads=1024 -thread_warp_size=32", "conv2d_nchw.cuda", [["TENSOR", [1, 160, 17, 17], "float32"], ["TENSOR", [160, 160, 7, 1], "float32"], [1, 1], [3, 0, 3, 0], [1, 1], "float32"], {}], "config": {"index": 203536, "code_hash": null, "entity": [["tile_f", "sp", [-1, 1, 2, 5]], ["tile_y", "sp", [-1, 1, 1, 1]], ["tile_x", "sp", [-1, 1, 1, 17]], ["tile_rc", "sp", [-1, 32]], ["tile_ry", "sp", [-1, 1]], ["tile_rx", "sp", [-1, 1]], ["auto_unroll_max_step", "ot", 1500], ["unroll_explicit", "ot", 0]]}, "result": [[0.0002314016448326055, 0.0002314061091703057, 0.00023141357205240176], 0, 2.3232510089874268, 1679208234.0352652], "version": 0.2, "tvm_version": "0.10.0"}
{"input": ["cuda -keys=cuda,gpu -arch=sm_86 -max_num_threads=1024 -thread_warp_size=32", "conv2d_nchw.cuda", [["TENSOR", [1, 160, 17, 17], "float32"], ["TENSOR", [160, 160, 7, 1], "float32"], [1, 1], [3, 0, 3, 0], [1, 1], "float32"], {}], "config": {"index": 444881, "code_hash": null, "entity": [["tile_f", "sp", [-1, 10, 2, 1]], ["tile_y", "sp", [-1, 1, 17, 1]], ["tile_x", "sp", [-1, 1, 1, 1]], ["tile_rc", "sp", [-1, 8]], ["tile_ry", "sp", [-1, 1]], ["tile_rx", "sp", [-1, 1]], ["auto_unroll_max_step", "ot", 1500], ["unroll_explicit", "ot", 1]]}, "result": [[4.80368906641604e-05, 4.804038032581454e-05, 4.8336119674185464e-05], 0, 2.2056827545166016, 1679208235.3143146], "version": 0.2, "tvm_version": "0.10.0"}
{"input": ["cuda -keys=cuda,gpu -arch=sm_86 -max_num_threads=1024 -thread_warp_size=32", "conv2d_nchw.cuda", [["TENSOR", [1, 160, 17, 17], "float32"], ["TENSOR", [160, 160, 7, 1], "float32"], [1, 1], [3, 0, 3, 0], [1, 1], "float32"], {}], "config": {"index": 267235, "code_hash": null, "entity": [["tile_f", "sp", [-1, 5, 1, 1]], ["tile_y", "sp", [-1, 17, 1, 1]], ["tile_x", "sp", [-1, 1, 17, 1]], ["tile_rc", "sp", [-1, 4]], ["tile_ry", "sp", [-1, 1]], ["tile_rx", "sp", [-1, 1]], ["auto_unroll_max_step", "ot", 0], ["unroll_explicit", "ot", 1]]}, "result": [[0.00023727843888070692, 0.00023727843888070692, 0.0002372799440353461], 0, 2.4619154930114746, 1679208236.6405709], "version": 0.2, "tvm_version": "0.10.0"}
{"input": ["cuda -keys=cuda,gpu -arch=sm_86 -max_num_threads=1024 -thread_warp_size=32", "conv2d_nchw.cuda", [["TENSOR", [1, 160, 17, 17], "float32"], ["TENSOR", [160, 160, 7, 1], "float32"], [1, 1], [3, 0, 3, 0], [1, 1], "float32"], {}], "config": {"index": 10000, "code_hash": null, "entity": [["tile_f", "sp", [-1, 1, 2, 5]], ["tile_y", "sp", [-1, 1, 1, 1]], ["tile_x", "sp", [-1, 1, 1, 17]], ["tile_rc", "sp", [-1, 4]], ["tile_ry", "sp", [-1, 1]], ["tile_rx", "sp", [-1, 1]], ["auto_unroll_max_step", "ot", 0], ["unroll_explicit", "ot", 0]]}, "result": [[0.00022979998567335241, 0.00022980112320916907, 0.0002298014498567335], 0, 1.9771311283111572, 1679208237.9534495], "version": 0.2, "tvm_version": "0.10.0"}
{"input": ["cuda -keys=cuda,gpu -arch=sm_86 -max_num_threads=1024 -thread_warp_size=32", "conv2d_nchw.cuda", [["TENSOR", [1, 160, 17, 17], "float32"], ["TENSOR", [160, 160, 7, 1], "float32"], [1, 1], [3, 0, 3, 0], [1, 1], "float32"], {}], "config": {"index": 135440, "code_hash": null, "entity": [["tile_f", "sp", [-1, 1, 2, 5]], ["tile_y", "sp", [-1, 1, 1, 1]], ["tile_x", "sp", [-1, 1, 1, 17]], ["tile_rc", "sp", [-1, 2]], ["tile_ry", "sp", [-1, 7]], ["tile_rx", "sp", [-1, 1]], ["auto_unroll_max_step", "ot", 512], ["unroll_explicit", "ot", 0]]}, "result": [[0.00022069394329183957, 0.00022069394329183957, 0.00022070360995850622], 0, 2.1612260341644287, 1679208239.2649379], "version": 0.2, "tvm_version": "0.10.0"}
{"input": ["cuda -keys=cuda,gpu -arch=sm_86 -max_num_threads=1024 -thread_warp_size=32", "conv2d_nchw.cuda", [["TENSOR", [1, 160, 17, 17], "float32"], ["TENSOR", [160, 160, 7, 1], "float32"], [1, 1], [3, 0, 3, 0], [1, 1], "float32"], {}], "config": {"index": 239315, "code_hash": null, "entity": [["tile_f", "sp", [-1, 4, 4, 2]], ["tile_y", "sp", [-1, 1, 1, 1]], ["tile_x", "sp", [-1, 1, 1, 17]], ["tile_rc", "sp", [-1, 16]], ["tile_ry", "sp", [-1, 7]], ["tile_rx", "sp", [-1, 1]], ["auto_unroll_max_step", "ot", 1500], ["unroll_explicit", "ot", 0]]}, "result": [[0.0002049507784891165, 0.00020495181434058898, 0.00020495734314980794], 0, 4.939576864242554, 1679208240.5739439], "version": 0.2, "tvm_version": "0.10.0"}
