src/tvm/results/cuda_gtx1650/bert/ga/cpu.log_layer_2.log
{"input": ["cuda -keys=cuda,gpu -arch=sm_75 -max_num_threads=1024 -thread_warp_size=32", "batch_matmul.cuda", [["TENSOR", [12, 128, 128], "float32"], ["TENSOR", [12, 128, 64], "float32"], [12, 128, 64], "float32", 0, 0], {}], "config": {"index": 4097, "code_hash": null, "entity": [["tile_y", "sp", [-1, 8, 16]], ["tile_x", "sp", [-1, 2, 1]], ["tile_k", "sp", [-1, 16]], ["auto_unroll_max_step", "ot", 8], ["unroll_explicit", "ot", 0]]}, "result": [[0.0007926022435897436, 0.0007927829487179486, 0.0007935288205128205], 0, 2.059191942214966, 1688602914.2376263], "version": 0.2, "tvm_version": "0.13.dev0"}
{"input": ["cuda -keys=cuda,gpu -arch=sm_75 -max_num_threads=1024 -thread_warp_size=32", "batch_matmul.cuda", [["TENSOR", [12, 128, 128], "float32"], ["TENSOR", [12, 128, 64], "float32"], [12, 128, 64], "float32", 0, 0], {}], "config": {"index": 20481, "code_hash": null, "entity": [["tile_y", "sp", [-1, 1, 64]], ["tile_x", "sp", [-1, 2, 2]], ["tile_k", "sp", [-1, 16]], ["auto_unroll_max_step", "ot", 32], ["unroll_explicit", "ot", 0]]}, "result": [[0.0005557492249134949, 0.0005557546089965397, 0.0005557678096885812], 0, 2.6793668270111084, 1688602915.6383538], "version": 0.2, "tvm_version": "0.13.dev0"}
{"input": ["cuda -keys=cuda,gpu -arch=sm_75 -max_num_threads=1024 -thread_warp_size=32", "batch_matmul.cuda", [["TENSOR", [12, 128, 128], "float32"], ["TENSOR", [12, 128, 64], "float32"], [12, 128, 64], "float32", 0, 0], {}], "config": {"index": 56839, "code_hash": null, "entity": [["tile_y", "sp", [-1, 2, 32]], ["tile_x", "sp", [-1, 8, 2]], ["tile_k", "sp", [-1, 1]], ["auto_unroll_max_step", "ot", 64], ["unroll_explicit", "ot", 1]]}, "result": [[0.00016198441489361705, 0.00016205137446808512, 0.00016206215319148937], 0, 2.4056546688079834, 1688602916.9946296], "version": 0.2, "tvm_version": "0.13.dev0"}
{"input": ["cuda -keys=cuda,gpu -arch=sm_75 -max_num_threads=1024 -thread_warp_size=32", "batch_matmul.cuda", [["TENSOR", [12, 128, 128], "float32"], ["TENSOR", [12, 128, 64], "float32"], [12, 128, 64], "float32", 0, 0], {}], "config": {"index": 39565, "code_hash": null, "entity": [["tile_y", "sp", [-1, 2, 1]], ["tile_x", "sp", [-1, 1, 2]], ["tile_k", "sp", [-1, 128]], ["auto_unroll_max_step", "ot", 8], ["unroll_explicit", "ot", 1]]}, "result": [[0.0015321381212121212, 0.0015322807727272728, 0.001532367], 0, 1.849984884262085, 1688602917.9997385], "version": 0.2, "tvm_version": "0.13.dev0"}
{"input": ["cuda -keys=cuda,gpu -arch=sm_75 -max_num_threads=1024 -thread_warp_size=32", "batch_matmul.cuda", [["TENSOR", [12, 128, 128], "float32"], ["TENSOR", [12, 128, 64], "float32"], [12, 128, 64], "float32", 0, 0], {}], "config": {"index": 26253, "code_hash": null, "entity": [["tile_y", "sp", [-1, 2, 2]], ["tile_x", "sp", [-1, 2, 1]], ["tile_k", "sp", [-1, 4]], ["auto_unroll_max_step", "ot", 64], ["unroll_explicit", "ot", 0]]}, "result": [[0.0009025257692307693, 0.0009026131656804735, 0.00090282525443787], 0, 2.2084708213806152, 1688602919.3558624], "version": 0.2, "tvm_version": "0.13.dev0"}
{"input": ["cuda -keys=cuda,gpu -arch=sm_75 -max_num_threads=1024 -thread_warp_size=32", "batch_matmul.cuda", [["TENSOR", [12, 128, 128], "float32"], ["TENSOR", [12, 128, 64], "float32"], [12, 128, 64], "float32", 0, 0], {}], "config": {"index": 58767, "code_hash": null, "entity": [["tile_y", "sp", [-1, 1, 4]], ["tile_x", "sp", [-1, 2, 2]], ["tile_k", "sp", [-1, 4]], ["auto_unroll_max_step", "ot", 64], ["unroll_explicit", "ot", 1]]}, "result": [[0.0006406393492063492, 0.0006407797063492064, 0.0006407929047619048], 0, 2.2108259201049805, 1688602920.6998057], "version": 0.2, "tvm_version": "0.13.dev0"}
{"input": ["cuda -keys=cuda,gpu -arch=sm_75 -max_num_threads=1024 -thread_warp_size=32", "batch_matmul.cuda", [["TENSOR", [12, 128, 128], "float32"], ["TENSOR", [12, 128, 64], "float32"], [12, 128, 64], "float32", 0, 0], {}], "config": {"index": 59537, "code_hash": null, "entity": [["tile_y", "sp", [-1, 8, 16]], ["tile_x", "sp", [-1, 2, 1]], ["tile_k", "sp", [-1, 8]], ["auto_unroll_max_step", "ot", 64], ["unroll_explicit", "ot", 1]]}, "result": [[0.0004727834047619047, 0.00047280325, 0.0004728076101190476], 0, 2.3387863636016846, 1688602922.0729425], "version": 0.2, "tvm_version": "0.13.dev0"}
{"input": ["cuda -keys=cuda,gpu -arch=sm_75 -max_num_threads=1024 -thread_warp_size=32", "batch_matmul.cuda", [["TENSOR", [12, 128, 128], "float32"], ["TENSOR", [12, 128, 64], "float32"], [12, 128, 64], "float32", 0, 0], {}], "config": {"index": 54545, "code_hash": null, "entity": [["tile_y", "sp", [-1, 32, 1]], ["tile_x", "sp", [-1, 8, 1]], ["tile_k", "sp", [-1, 64]], ["auto_unroll_max_step", "ot", 32], ["unroll_explicit", "ot", 1]]}, "result": [[0.00012315112548113934, 0.00012334199538106233, 0.00012339153040800616], 0, 2.2982702255249023, 1688602923.477722], "version": 0.2, "tvm_version": "0.13.dev0"}
{"input": ["cuda -keys=cuda,gpu -arch=sm_75 -max_num_threads=1024 -thread_warp_size=32", "batch_matmul.cuda", [["TENSOR", [12, 128, 128], "float32"], ["TENSOR", [12, 128, 64], "float32"], [12, 128, 64], "float32", 0, 0], {}], "config": {"index": 54929, "code_hash": null, "entity": [["tile_y", "sp", [-1, 8, 16]], ["tile_x", "sp", [-1, 1, 4]], ["tile_k", "sp", [-1, 64]], ["auto_unroll_max_step", "ot", 32], ["unroll_explicit", "ot", 1]]}, "result": [[0.0007348705636363637, 0.0007352134, 0.0007359244926470588], 0, 2.353724479675293, 1688602924.8191442], "version": 0.2, "tvm_version": "0.13.dev0"}
{"input": ["cuda -keys=cuda,gpu -arch=sm_75 -max_num_threads=1024 -thread_warp_size=32", "batch_matmul.cuda", [["TENSOR", [12, 128, 128], "float32"], ["TENSOR", [12, 128, 64], "float32"], [12, 128, 64], "float32", 0, 0], {}], "config": {"index": 9237, "code_hash": null, "entity": [["tile_y", "sp", [-1, 1, 8]], ["tile_x", "sp", [-1, 16, 1]], ["tile_k", "sp", [-1, 2]], ["auto_unroll_max_step", "ot", 16], ["unroll_explicit", "ot", 0]]}, "result": [[0.00014106791620111732, 0.00014108385754189946, 0.00014109628864059591], 0, 2.141247510910034, 1688602926.1629143], "version": 0.2, "tvm_version": "0.13.dev0"}
{"input": ["cuda -keys=cuda,gpu -arch=sm_75 -max_num_threads=1024 -thread_warp_size=32", "batch_matmul.cuda", [["TENSOR", [12, 128, 128], "float32"], ["TENSOR", [12, 128, 64], "float32"], [12, 128, 64], "float32", 0, 0], {}], "config": {"index": 35098, "code_hash": null, "entity": [["tile_y", "sp", [-1, 2, 64]], ["tile_x", "sp", [-1, 1, 16]], ["tile_k", "sp", [-1, 4]], ["auto_unroll_max_step", "ot", 8], ["unroll_explicit", "ot", 1]]}, "result": [[0.00501962735, 0.005023470300000001, 0.005028779200000001], 0, 2.276804208755493, 1688602927.1904213], "version": 0.2, "tvm_version": "0.13.dev0"}
{"input": ["cuda -keys=cuda,gpu -arch=sm_75 -max_num_threads=1024 -thread_warp_size=32", "batch_matmul.cuda", [["TENSOR", [12, 128, 128], "float32"], ["TENSOR", [12, 128, 64], "float32"], [12, 128, 64], "float32", 0, 0], {}], "config": {"index": 1050, "code_hash": null, "entity": [["tile_y", "sp", [-1, 64, 1]], ["tile_x", "sp", [-1, 2, 1]], ["tile_k", "sp", [-1, 2]], ["auto_unroll_max_step", "ot", 8], ["unroll_explicit", "ot", 0]]}, "result": [[0.0003886171038647343, 0.00038862506521739136, 0.00038879320772946857], 0, 2.244074821472168, 1688602928.5884178], "version": 0.2, "tvm_version": "0.13.dev0"}
{"input": ["cuda -keys=cuda,gpu -arch=sm_75 -max_num_threads=1024 -thread_warp_size=32", "batch_matmul.cuda", [["TENSOR", [12, 128, 128], "float32"], ["TENSOR", [12, 128, 64], "float32"], [12, 128, 64], "float32", 0, 0], {}], "config": {"index": 43170, "code_hash": null, "entity": [["tile_y", "sp", [-1, 64, 1]], ["tile_x", "sp", [-1, 2, 16]], ["tile_k", "sp", [-1, 4]], ["auto_unroll_max_step", "ot", 16], ["unroll_explicit", "ot", 1]]}, "result": [[6.586022810304449e-05, 6.586214332552693e-05, 6.586713911007025e-05], 0, 2.2022109031677246, 1688602929.8802729], "version": 0.2, "tvm_version": "0.13.dev0"}
{"input": ["cuda -keys=cuda,gpu -arch=sm_75 -max_num_threads=1024 -thread_warp_size=32", "batch_matmul.cuda", [["TENSOR", [12, 128, 128], "float32"], ["TENSOR", [12, 128, 64], "float32"], [12, 128, 64], "float32", 0, 0], {}], "config": {"index": 11429, "code_hash": null, "entity": [["tile_y", "sp", [-1, 4, 4]], ["tile_x", "sp", [-1, 4, 2]], ["tile_k", "sp", [-1, 8]], ["auto_unroll_max_step", "ot", 16], ["unroll_explicit", "ot", 0]]}, "result": [[0.00011997126666666666, 0.00011998340000000001, 0.00012000799759036144], 0, 2.1850006580352783, 1688602931.2047756], "version": 0.2, "tvm_version": "0.13.dev0"}
{"input": ["cuda -keys=cuda,gpu -arch=sm_75 -max_num_threads=1024 -thread_warp_size=32", "batch_matmul.cuda", [["TENSOR", [12, 128, 128], "float32"], ["TENSOR", [12, 128, 64], "float32"], [12, 128, 64], "float32", 0, 0], {}], "config": {"index": 50470, "code_hash": null, "entity": [["tile_y", "sp", [-1, 2, 64]], ["tile_x", "sp", [-1, 2, 1]], ["tile_k", "sp", [-1, 4]], ["auto_unroll_max_step", "ot", 32], ["unroll_explicit", "ot", 1]]}, "result": [[0.0009376071588785047, 0.0009377025700934579, 0.0009378066728971963], 0, 1.921804666519165, 1688602932.2029266], "version": 0.2, "tvm_version": "0.13.dev0"}
{"input": ["cuda -keys=cuda,gpu -arch=sm_75 -max_num_threads=1024 -thread_warp_size=32", "batch_matmul.cuda", [["TENSOR", [12, 128, 128], "float32"], ["TENSOR", [12, 128, 64], "float32"], [12, 128, 64], "float32", 0, 0], {}], "config": {"index": 42541, "code_hash": null, "entity": [["tile_y", "sp", [-1, 16, 8]], ["tile_x", "sp", [-1, 32, 1]], ["tile_k", "sp", [-1, 4]], ["auto_unroll_max_step", "ot", 16], ["unroll_explicit", "ot", 1]]}, "result": [[5.590438263785394e-05, 5.592932302533532e-05, 5.593161400894187e-05], 0, 2.1755900382995605, 1688602933.5399802], "version": 0.2, "tvm_version": "0.13.dev0"}
{"input": ["cuda -keys=cuda,gpu -arch=sm_75 -max_num_threads=1024 -thread_warp_size=32", "batch_matmul.cuda", [["TENSOR", [12, 128, 128], "float32"], ["TENSOR", [12, 128, 64], "float32"], [12, 128, 64], "float32", 0, 0], {}], "config": {"index": 37935, "code_hash": null, "entity": [["tile_y", "sp", [-1, 2, 16]], ["tile_x", "sp", [-1, 16, 4]], ["tile_k", "sp", [-1, 32]], ["auto_unroll_max_step", "ot", 8], ["unroll_explicit", "ot", 1]]}, "result": [[3.1501542629686697e-05, 3.151322778633796e-05, 3.159102645095018e-05], 0, 2.1759471893310547, 1688602936.4584622], "version": 0.2, "tvm_version": "0.13.dev0"}
{"input": ["cuda -keys=cuda,gpu -arch=sm_75 -max_num_threads=1024 -thread_warp_size=32", "batch_matmul.cuda", [["TENSOR", [12, 128, 128], "float32"], ["TENSOR", [12, 128, 64], "float32"], [12, 128, 64], "float32", 0, 0], {}], "config": {"index": 36272, "code_hash": null, "entity": [["tile_y", "sp", [-1, 32, 4]], ["tile_x", "sp", [-1, 1, 64]], ["tile_k", "sp", [-1, 8]], ["auto_unroll_max_step", "ot", 8], ["unroll_explicit", "ot", 1]]}, "result": [[0.00021703261475409835, 0.00021710059153005464, 0.00021725299180327866], 0, 2.859764575958252, 1688602937.8528144], "version": 0.2, "tvm_version": "0.13.dev0"}
{"input": ["cuda -keys=cuda,gpu -arch=sm_75 -max_num_threads=1024 -thread_warp_size=32", "batch_matmul.cuda", [["TENSOR", [12, 128, 128], "float32"], ["TENSOR", [12, 128, 64], "float32"], [12, 128, 64], "float32", 0, 0], {}], "config": {"index": 28208, "code_hash": null, "entity": [["tile_y", "sp", [-1, 32, 4]], ["tile_x", "sp", [-1, 1, 64]], ["tile_k", "sp", [-1, 8]], ["auto_unroll_max_step", "ot", 64], ["unroll_explicit", "ot", 0]]}, "result": [[0.00019196368952618457, 0.0001923567842892768, 0.00019236991271820447], 0, 2.9592478275299072, 1688602939.2299964], "version": 0.2, "tvm_version": "0.13.dev0"}
{"input": ["cuda -keys=cuda,gpu -arch=sm_75 -max_num_threads=1024 -thread_warp_size=32", "batch_matmul.cuda", [["TENSOR", [12, 128, 128], "float32"], ["TENSOR", [12, 128, 64], "float32"], [12, 128, 64], "float32", 0, 0], {}], "config": {"index": 180, "code_hash": null, "entity": [["tile_y", "sp", [-1, 1, 1]], ["tile_x", "sp", [-1, 32, 1]], ["tile_k", "sp", [-1, 1]], ["auto_unroll_max_step", "ot", 8], ["unroll_explicit", "ot", 0]]}, "result": [[0.00038752921463414635, 0.00038753684390243904, 0.0003875885365853659], 0, 2.2503280639648438, 1688602940.6207142], "version": 0.2, "tvm_version": "0.13.dev0"}
{"input": ["cuda -keys=cuda,gpu -arch=sm_75 -max_num_threads=1024 -thread_warp_size=32", "batch_matmul.cuda", [["TENSOR", [12, 128, 128], "float32"], ["TENSOR", [12, 128, 64], "float32"], [12, 128, 64], "float32", 0, 0], {}], "config": {"index": 62901, "code_hash": null, "entity": [["tile_y", "sp", [-1, 2, 2]], ["tile_x", "sp", [-1, 16, 2]], ["tile_k", "sp", [-1, 64]], ["auto_unroll_max_step", "ot", 64], ["unroll_explicit", "ot", 1]]}, "result": [[5.885744592030361e-05, 5.886115218216319e-05, 5.886115218216319e-05], 0, 2.425441026687622, 1688602941.991473], "version": 0.2, "tvm_version": "0.13.dev0"}
{"input": ["cuda -keys=cuda,gpu -arch=sm_75 -max_num_threads=1024 -thread_warp_size=32", "batch_matmul.cuda", [["TENSOR", [12, 128, 128], "float32"], ["TENSOR", [12, 128, 64], "float32"], [12, 128, 64], "float32", 0, 0], {}], "config": {"index": 53433, "code_hash": null, "entity": [["tile_y", "sp", [-1, 2, 2]], ["tile_x", "sp", [-1, 1, 1]], ["tile_k", "sp", [-1, 32]], ["auto_unroll_max_step", "ot", 32], ["unroll_explicit", "ot", 1]]}, "result": [[0.0019209475609756096, 0.0019210837682926828, 0.0019213548902439024], 0, 2.339078664779663, 1688602943.381091], "version": 0.2, "tvm_version": "0.13.dev0"}
{"input": ["cuda -keys=cuda,gpu -arch=sm_75 -max_num_threads=1024 -thread_warp_size=32", "batch_matmul.cuda", [["TENSOR", [12, 128, 128], "float32"], ["TENSOR", [12, 128, 64], "float32"], [12, 128, 64], "float32", 0, 0], {}], "config": {"index": 42041, "code_hash": null, "entity": [["tile_y", "sp", [-1, 8, 16]], ["tile_x", "sp", [-1, 2, 8]], ["tile_k", "sp", [-1, 2]], ["auto_unroll_max_step", "ot", 16], ["unroll_explicit", "ot", 1]]}, "result": [[0.0001483324737327189, 0.00014836604331797235, 0.00014842053917050693], 0, 2.384018898010254, 1688602944.7812903], "version": 0.2, "tvm_version": "0.13.dev0"}
{"input": ["cuda -keys=cuda,gpu -arch=sm_75 -max_num_threads=1024 -thread_warp_size=32", "batch_matmul.cuda", [["TENSOR", [12, 128, 128], "float32"], ["TENSOR", [12, 128, 64], "float32"], [12, 128, 64], "float32", 0, 0], {}], "config": {"index": 18491, "code_hash": null, "entity": [["tile_y", "sp", [-1, 4, 8]], ["tile_x", "sp", [-1, 4, 2]], ["tile_k", "sp", [-1, 4]], ["auto_unroll_max_step", "ot", 32], ["unroll_explicit", "ot", 0]]}, "result": [[0.00012136124797406808, 0.00012136474797406806, 0.00012139277957860614], 0, 2.170304775238037, 1688602946.107773], "version": 0.2, "tvm_version": "0.13.dev0"}
{"input": ["cuda -keys=cuda,gpu -arch=sm_75 -max_num_threads=1024 -thread_warp_size=32", "batch_matmul.cuda", [["TENSOR", [12, 128, 128], "float32"], ["TENSOR", [12, 128, 64], "float32"], [12, 128, 64], "float32", 0, 0], {}], "config": {"index": 60349, "code_hash": null, "entity": [["tile_y", "sp", [-1, 32, 2]], ["tile_x", "sp", [-1, 4, 16]], ["tile_k", "sp", [-1, 8]], ["auto_unroll_max_step", "ot", 64], ["unroll_explicit", "ot", 1]]}, "result": [[7.343536601618277e-05, 7.344508329366968e-05, 7.344531603998095e-05], 0, 2.3111655712127686, 1688602947.4719858], "version": 0.2, "tvm_version": "0.13.dev0"}
{"input": ["cuda -keys=cuda,gpu -arch=sm_75 -max_num_threads=1024 -thread_warp_size=32", "batch_matmul.cuda", [["TENSOR", [12, 128, 128], "float32"], ["TENSOR", [12, 128, 64], "float32"], [12, 128, 64], "float32", 0, 0], {}], "config": {"index": 24125, "code_hash": null, "entity": [["tile_y", "sp", [-1, 32, 1]], ["tile_x", "sp", [-1, 2, 32]], ["tile_k", "sp", [-1, 128]], ["auto_unroll_max_step", "ot", 32], ["unroll_explicit", "ot", 0]]}, "result": [[0.00015264968030447192, 0.00015277366698382492, 0.00015278157944814463], 0, 2.3779966831207275, 1688602948.8527462], "version": 0.2, "tvm_version": "0.13.dev0"}
{"input": ["cuda -keys=cuda,gpu -arch=sm_75 -max_num_threads=1024 -thread_warp_size=32", "batch_matmul.cuda", [["TENSOR", [12, 128, 128], "float32"], ["TENSOR", [12, 128, 64], "float32"], [12, 128, 64], "float32", 0, 0], {}], "config": {"index": 20031, "code_hash": null, "entity": [["tile_y", "sp", [-1, 1, 4]], ["tile_x", "sp", [-1, 4, 16]], ["tile_k", "sp", [-1, 8]], ["auto_unroll_max_step", "ot", 32], ["unroll_explicit", "ot", 0]]}, "result": [[0.00021781962652232746, 0.00021782871177266575, 0.00021785245602165087], 0, 2.3497061729431152, 1688602950.2433295], "version": 0.2, "tvm_version": "0.13.dev0"}
{"input": ["cuda -keys=cuda,gpu -arch=sm_75 -max_num_threads=1024 -thread_warp_size=32", "batch_matmul.cuda", [["TENSOR", [12, 128, 128], "float32"], ["TENSOR", [12, 128, 64], "float32"], [12, 128, 64], "float32", 0, 0], {}], "config": {"index": 57919, "code_hash": null, "entity": [["tile_y", "sp", [-1, 2, 32]], ["tile_x", "sp", [-1, 32, 2]], ["tile_k", "sp", [-1, 2]], ["auto_unroll_max_step", "ot", 64], ["unroll_explicit", "ot", 1]]}, "result": [[6.0811193436293436e-05, 6.081430424710425e-05, 6.0829886872586874e-05], 0, 2.4160192012786865, 1688602951.6390376], "version": 0.2, "tvm_version": "0.13.dev0"}
{"input": ["cuda -keys=cuda,gpu -arch=sm_75 -max_num_threads=1024 -thread_warp_size=32", "batch_matmul.cuda", [["TENSOR", [12, 128, 128], "float32"], ["TENSOR", [12, 128, 64], "float32"], [12, 128, 64], "float32", 0, 0], {}], "config": {"index": 21440, "code_hash": null, "entity": [["tile_y", "sp", [-1, 32, 4]], ["tile_x", "sp", [-1, 1, 2]], ["tile_k", "sp", [-1, 32]], ["auto_unroll_max_step", "ot", 32], ["unroll_explicit", "ot", 0]]}, "result": [[0.0008064446598984771, 0.0008071626751269035, 0.0008071837411167512], 0, 2.351325273513794, 1688602953.0375693], "version": 0.2, "tvm_version": "0.13.dev0"}
{"input": ["cuda -keys=cuda,gpu -arch=sm_75 -max_num_threads=1024 -thread_warp_size=32", "batch_matmul.cuda", [["TENSOR", [12, 128, 128], "float32"], ["TENSOR", [12, 128, 64], "float32"], [12, 128, 64], "float32", 0, 0], {}], "config": {"index": 30398, "code_hash": null, "entity": [["tile_y", "sp", [-1, 64, 2]], ["tile_x", "sp", [-1, 16, 1]], ["tile_k", "sp", [-1, 64]], ["auto_unroll_max_step", "ot", 64], ["unroll_explicit", "ot", 0]]}, "result": [[6.212996732026144e-05, 6.215662269756387e-05, 6.220940701128936e-05], 0, 1.8486957550048828, 1688602954.0573413], "version": 0.2, "tvm_version": "0.13.dev0"}
{"input": ["cuda -keys=cuda,gpu -arch=sm_75 -max_num_threads=1024 -thread_warp_size=32", "batch_matmul.cuda", [["TENSOR", [12, 128, 128], "float32"], ["TENSOR", [12, 128, 64], "float32"], [12, 128, 64], "float32", 0, 0], {}], "config": {"index": 24776, "code_hash": null, "entity": [["tile_y", "sp", [-1, 1, 2]], ["tile_x", "sp", [-1, 8, 4]], ["tile_k", "sp", [-1, 1]], ["auto_unroll_max_step", "ot", 64], ["unroll_explicit", "ot", 0]]}, "result": [[0.0003201851382765531, 0.000320236877755511, 0.0003203170561122245], 0, 2.245086908340454, 1688602955.4476], "version": 0.2, "tvm_version": "0.13.dev0"}
{"input": ["cuda -keys=cuda,gpu -arch=sm_75 -max_num_threads=1024 -thread_warp_size=32", "batch_matmul.cuda", [["TENSOR", [12, 128, 128], "float32"], ["TENSOR", [12, 128, 64], "float32"], [12, 128, 64], "float32", 0, 0], {}], "config": {"index": 7753, "code_hash": null, "entity": [["tile_y", "sp", [-1, 32, 2]], ["tile_x", "sp", [-1, 2, 8]], ["tile_k", "sp", [-1, 128]], ["auto_unroll_max_step", "ot", 8], ["unroll_explicit", "ot", 0]]}, "result": [[0.00017537112541254126, 0.0001754318085808581, 0.00017546487678767874], 0, 2.4019994735717773, 1688602956.8180754], "version": 0.2, "tvm_version": "0.13.dev0"}
{"input": ["cuda -keys=cuda,gpu -arch=sm_75 -max_num_threads=1024 -thread_warp_size=32", "batch_matmul.cuda", [["TENSOR", [12, 128, 128], "float32"], ["TENSOR", [12, 128, 64], "float32"], [12, 128, 64], "float32", 0, 0], {}], "config": {"index": 2762, "code_hash": null, "entity": [["tile_y", "sp", [-1, 1, 16]], ["tile_x", "sp", [-1, 4, 8]], ["tile_k", "sp", [-1, 4]], ["auto_unroll_max_step", "ot", 8], ["unroll_explicit", "ot", 0]]}, "result": [[0.00011143592952720784, 0.00011144589384478145, 0.00011733340410347904], 0, 2.1653261184692383, 1688602959.4477496], "version": 0.2, "tvm_version": "0.13.dev0"}
{"input": ["cuda -keys=cuda,gpu -arch=sm_75 -max_num_threads=1024 -thread_warp_size=32", "batch_matmul.cuda", [["TENSOR", [12, 128, 128], "float32"], ["TENSOR", [12, 128, 64], "float32"], [12, 128, 64], "float32", 0, 0], {}], "config": {"index": 33996, "code_hash": null, "entity": [["tile_y", "sp", [-1, 16, 2]], ["tile_x", "sp", [-1, 4, 8]], ["tile_k", "sp", [-1, 2]], ["auto_unroll_max_step", "ot", 8], ["unroll_explicit", "ot", 1]]}, "result": [[6.3977793399057e-05, 6.399179639948564e-05, 6.399186840977282e-05], 0, 2.140631914138794, 1688602960.7773337], "version": 0.2, "tvm_version": "0.13.dev0"}
{"input": ["cuda -keys=cuda,gpu -arch=sm_75 -max_num_threads=1024 -thread_warp_size=32", "batch_matmul.cuda", [["TENSOR", [12, 128, 128], "float32"], ["TENSOR", [12, 128, 64], "float32"], [12, 128, 64], "float32", 0, 0], {}], "config": {"index": 38221, "code_hash": null, "entity": [["tile_y", "sp", [-1, 16, 8]], ["tile_x", "sp", [-1, 1, 32]], ["tile_k", "sp", [-1, 32]], ["auto_unroll_max_step", "ot", 8], ["unroll_explicit", "ot", 1]]}, "result": [[0.00019299664231738035, 0.0001930236813602015, 0.00019304649244332496], 0, 2.4237072467803955, 1688602962.1396818], "version": 0.2, "tvm_version": "0.13.dev0"}
{"input": ["cuda -keys=cuda,gpu -arch=sm_75 -max_num_threads=1024 -thread_warp_size=32", "batch_matmul.cuda", [["TENSOR", [12, 128, 128], "float32"], ["TENSOR", [12, 128, 64], "float32"], [12, 128, 64], "float32", 0, 0], {}], "config": {"index": 48719, "code_hash": null, "entity": [["tile_y", "sp", [-1, 8, 2]], ["tile_x", "sp", [-1, 4, 2]], ["tile_k", "sp", [-1, 1]], ["auto_unroll_max_step", "ot", 32], ["unroll_explicit", "ot", 1]]}, "result": [[0.0002499877921875, 0.000249990390625, 0.00025002806093749996], 0, 2.1522438526153564, 1688602963.5233483], "version": 0.2, "tvm_version": "0.13.dev0"}
{"input": ["cuda -keys=cuda,gpu -arch=sm_75 -max_num_threads=1024 -thread_warp_size=32", "batch_matmul.cuda", [["TENSOR", [12, 128, 128], "float32"], ["TENSOR", [12, 128, 64], "float32"], [12, 128, 64], "float32", 0, 0], {}], "config": {"index": 46033, "code_hash": null, "entity": [["tile_y", "sp", [-1, 16, 8]], ["tile_x", "sp", [-1, 1, 8]], ["tile_k", "sp", [-1, 32]], ["auto_unroll_max_step", "ot", 16], ["unroll_explicit", "ot", 1]]}, "result": [[0.00033996369894736845, 0.00034007397894736846, 0.00034036184210526314], 0, 2.2033164501190186, 1688602964.8530505], "version": 0.2, "tvm_version": "0.13.dev0"}
{"input": ["cuda -keys=cuda,gpu -arch=sm_75 -max_num_threads=1024 -thread_warp_size=32", "batch_matmul.cuda", [["TENSOR", [12, 128, 128], "float32"], ["TENSOR", [12, 128, 64], "float32"], [12, 128, 64], "float32", 0, 0], {}], "config": {"index": 46675, "code_hash": null, "entity": [["tile_y", "sp", [-1, 16, 4]], ["tile_x", "sp", [-1, 2, 2]], ["tile_k", "sp", [-1, 64]], ["auto_unroll_max_step", "ot", 16], ["unroll_explicit", "ot", 1]]}, "result": [[0.00041550918961038956, 0.00041557910389610386, 0.00041562571168831167], 0, 2.2812869548797607, 1688602966.2520967], "version": 0.2, "tvm_version": "0.13.dev0"}
{"input": ["cuda -keys=cuda,gpu -arch=sm_75 -max_num_threads=1024 -thread_warp_size=32", "batch_matmul.cuda", [["TENSOR", [12, 128, 128], "float32"], ["TENSOR", [12, 128, 64], "float32"], [12, 128, 64], "float32", 0, 0], {}], "config": {"index": 61396, "code_hash": null, "entity": [["tile_y", "sp", [-1, 2, 4]], ["tile_x", "sp", [-1, 1, 32]], ["tile_k", "sp", [-1, 16]], ["auto_unroll_max_step", "ot", 64], ["unroll_explicit", "ot", 1]]}, "result": [[0.00028957721100917434, 0.0002898457376146789, 0.0002899235706422018], 0, 2.6734883785247803, 1688602967.6190386], "version": 0.2, "tvm_version": "0.13.dev0"}
{"input": ["cuda -keys=cuda,gpu -arch=sm_75 -max_num_threads=1024 -thread_warp_size=32", "batch_matmul.cuda", [["TENSOR", [12, 128, 128], "float32"], ["TENSOR", [12, 128, 64], "float32"], [12, 128, 64], "float32", 0, 0], {}], "config": {"index": 62294, "code_hash": null, "entity": [["tile_y", "sp", [-1, 64, 2]], ["tile_x", "sp", [-1, 1, 16]], ["tile_k", "sp", [-1, 32]], ["auto_unroll_max_step", "ot", 64], ["unroll_explicit", "ot", 1]]}, "result": [[0.00014762966520467835, 0.000147956067251462, 0.0001482969356725146], 0, 2.2280256748199463, 1688602968.6203072], "version": 0.2, "tvm_version": "0.13.dev0"}
{"input": ["cuda -keys=cuda,gpu -arch=sm_75 -max_num_threads=1024 -thread_warp_size=32", "batch_matmul.cuda", [["TENSOR", [12, 128, 128], "float32"], ["TENSOR", [12, 128, 64], "float32"], [12, 128, 64], "float32", 0, 0], {}], "config": {"index": 5724, "code_hash": null, "entity": [["tile_y", "sp", [-1, 1, 1]], ["tile_x", "sp", [-1, 2, 8]], ["tile_k", "sp", [-1, 32]], ["auto_unroll_max_step", "ot", 8], ["unroll_explicit", "ot", 0]]}, "result": [[0.0013361028, 0.00133647104, 0.0013402265333333334], 0, 1.832322120666504, 1688602969.6131947], "version": 0.2, "tvm_version": "0.13.dev0"}
{"input": ["cuda -keys=cuda,gpu -arch=sm_75 -max_num_threads=1024 -thread_warp_size=32", "batch_matmul.cuda", [["TENSOR", [12, 128, 128], "float32"], ["TENSOR", [12, 128, 64], "float32"], [12, 128, 64], "float32", 0, 0], {}], "config": {"index": 50781, "code_hash": null, "entity": [["tile_y", "sp", [-1, 1, 8]], ["tile_x", "sp", [-1, 8, 2]], ["tile_k", "sp", [-1, 4]], ["auto_unroll_max_step", "ot", 32], ["unroll_explicit", "ot", 1]]}, "result": [[0.00010574136122177954, 0.0001057439754316069, 0.00010574931474103585], 0, 2.1935346126556396, 1688602970.9983277], "version": 0.2, "tvm_version": "0.13.dev0"}
{"input": ["cuda -keys=cuda,gpu -arch=sm_75 -max_num_threads=1024 -thread_warp_size=32", "batch_matmul.cuda", [["TENSOR", [12, 128, 128], "float32"], ["TENSOR", [12, 128, 64], "float32"], [12, 128, 64], "float32", 0, 0], {}], "config": {"index": 4575, "code_hash": null, "entity": [["tile_y", "sp", [-1, 8, 1]], ["tile_x", "sp", [-1, 4, 4]], ["tile_k", "sp", [-1, 16]], ["auto_unroll_max_step", "ot", 8], ["unroll_explicit", "ot", 0]]}, "result": [[0.00010705122627182992, 0.00010707678511769171, 0.00010716289217919515], 0, 2.065899133682251, 1688602972.2726274], "version": 0.2, "tvm_version": "0.13.dev0"}
{"input": ["cuda -keys=cuda,gpu -arch=sm_75 -max_num_threads=1024 -thread_warp_size=32", "batch_matmul.cuda", [["TENSOR", [12, 128, 128], "float32"], ["TENSOR", [12, 128, 64], "float32"], [12, 128, 64], "float32", 0, 0], {}], "config": {"index": 10978, "code_hash": null, "entity": [["tile_y", "sp", [-1, 2, 64]], ["tile_x", "sp", [-1, 4, 16]], ["tile_k", "sp", [-1, 4]], ["auto_unroll_max_step", "ot", 16], ["unroll_explicit", "ot", 0]]}, "result": [[0.0019053258301886793, 0.0019054044150943396, 0.0019062249433962264], 0, 2.284177303314209, 1688602973.2928672], "version": 0.2, "tvm_version": "0.13.dev0"}
{"input": ["cuda -keys=cuda,gpu -arch=sm_75 -max_num_threads=1024 -thread_warp_size=32", "batch_matmul.cuda", [["TENSOR", [12, 128, 128], "float32"], ["TENSOR", [12, 128, 64], "float32"], [12, 128, 64], "float32", 0, 0], {}], "config": {"index": 21479, "code_hash": null, "entity": [["tile_y", "sp", [-1, 4, 8]], ["tile_x", "sp", [-1, 2, 2]], ["tile_k", "sp", [-1, 32]], ["auto_unroll_max_step", "ot", 32], ["unroll_explicit", "ot", 0]]}, "result": [[0.0003321303209109731, 0.00033226812422360247, 0.00033231800621118013], 0, 2.2507431507110596, 1688602974.6973078], "version": 0.2, "tvm_version": "0.13.dev0"}
{"input": ["cuda -keys=cuda,gpu -arch=sm_75 -max_num_threads=1024 -thread_warp_size=32", "batch_matmul.cuda", [["TENSOR", [12, 128, 128], "float32"], ["TENSOR", [12, 128, 64], "float32"], [12, 128, 64], "float32", 0, 0], {}], "config": {"index": 50922, "code_hash": null, "entity": [["tile_y", "sp", [-1, 8, 4]], ["tile_x", "sp", [-1, 2, 4]], ["tile_k", "sp", [-1, 4]], ["auto_unroll_max_step", "ot", 32], ["unroll_explicit", "ot", 1]]}, "result": [[0.00013257420727580372, 0.00013257751184433164, 0.0001326660439932318], 0, 2.2208871841430664, 1688602976.0683208], "version": 0.2, "tvm_version": "0.13.dev0"}
{"input": ["cuda -keys=cuda,gpu -arch=sm_75 -max_num_threads=1024 -thread_warp_size=32", "batch_matmul.cuda", [["TENSOR", [12, 128, 128], "float32"], ["TENSOR", [12, 128, 64], "float32"], [12, 128, 64], "float32", 0, 0], {}], "config": {"index": 30702, "code_hash": null, "entity": [["tile_y", "sp", [-1, 1, 32]], ["tile_x", "sp", [-1, 32, 2]], ["tile_k", "sp", [-1, 64]], ["auto_unroll_max_step", "ot", 64], ["unroll_explicit", "ot", 0]]}, "result": [[4.619538924661945e-05, 4.621187121699936e-05, 4.621828235672892e-05], 0, 2.20999813079834, 1688602977.3725305], "version": 0.2, "tvm_version": "0.13.dev0"}
{"input": ["cuda -keys=cuda,gpu -arch=sm_75 -max_num_threads=1024 -thread_warp_size=32", "batch_matmul.cuda", [["TENSOR", [12, 128, 128], "float32"], ["TENSOR", [12, 128, 64], "float32"], [12, 128, 64], "float32", 0, 0], {}], "config": {"index": 58871, "code_hash": null, "entity": [["tile_y", "sp", [-1, 8, 2]], ["tile_x", "sp", [-1, 16, 2]], ["tile_k", "sp", [-1, 4]], ["auto_unroll_max_step", "ot", 64], ["unroll_explicit", "ot", 1]]}, "result": [[5.360516311030742e-05, 5.360804412296564e-05, 6.501160620245758e-05], 0, 2.0809214115142822, 1688602979.9806702], "version": 0.2, "tvm_version": "0.13.dev0"}
{"input": ["cuda -keys=cuda,gpu -arch=sm_75 -max_num_threads=1024 -thread_warp_size=32", "batch_matmul.cuda", [["TENSOR", [12, 128, 128], "float32"], ["TENSOR", [12, 128, 64], "float32"], [12, 128, 64], "float32", 0, 0], {}], "config": {"index": 62334, "code_hash": null, "entity": [["tile_y", "sp", [-1, 8, 4]], ["tile_x", "sp", [-1, 2, 16]], ["tile_k", "sp", [-1, 32]], ["auto_unroll_max_step", "ot", 64], ["unroll_explicit", "ot", 1]]}, "result": [[6.329821860659157e-05, 6.330341927409262e-05, 6.332470004171883e-05], 0, 2.608492851257324, 1688602981.3273904], "version": 0.2, "tvm_version": "0.13.dev0"}
{"input": ["cuda -keys=cuda,gpu -arch=sm_75 -max_num_threads=1024 -thread_warp_size=32", "batch_matmul.cuda", [["TENSOR", [12, 128, 128], "float32"], ["TENSOR", [12, 128, 64], "float32"], [12, 128, 64], "float32", 0, 0], {}], "config": {"index": 4097, "code_hash": null, "entity": [["tile_y", "sp", [-1, 8, 16]], ["tile_x", "sp", [-1, 2, 1]], ["tile_k", "sp", [-1, 16]], ["auto_unroll_max_step", "ot", 8], ["unroll_explicit", "ot", 0]]}, "result": [[0.0007926567339901477, 0.0007927776009852216, 0.0007930389507389163], 0, 2.1963350772857666, 1688602982.6661499], "version": 0.2, "tvm_version": "0.13.dev0"}
{"input": ["cuda -keys=cuda,gpu -arch=sm_75 -max_num_threads=1024 -thread_warp_size=32", "batch_matmul.cuda", [["TENSOR", [12, 128, 128], "float32"], ["TENSOR", [12, 128, 64], "float32"], [12, 128, 64], "float32", 0, 0], {}], "config": {"index": 20481, "code_hash": null, "entity": [["tile_y", "sp", [-1, 1, 64]], ["tile_x", "sp", [-1, 2, 2]], ["tile_k", "sp", [-1, 16]], ["auto_unroll_max_step", "ot", 32], ["unroll_explicit", "ot", 0]]}, "result": [[0.0005554804270833333, 0.0005555957673611112, 0.0005559537673611112], 0, 2.6537933349609375, 1688602984.0568206], "version": 0.2, "tvm_version": "0.13.dev0"}
{"input": ["cuda -keys=cuda,gpu -arch=sm_75 -max_num_threads=1024 -thread_warp_size=32", "batch_matmul.cuda", [["TENSOR", [12, 128, 128], "float32"], ["TENSOR", [12, 128, 64], "float32"], [12, 128, 64], "float32", 0, 0], {}], "config": {"index": 56839, "code_hash": null, "entity": [["tile_y", "sp", [-1, 2, 32]], ["tile_x", "sp", [-1, 8, 2]], ["tile_k", "sp", [-1, 1]], ["auto_unroll_max_step", "ot", 64], ["unroll_explicit", "ot", 1]]}, "result": [[0.00016298553500522468, 0.00016301394775339602, 0.00016306819122257054], 0, 2.407045364379883, 1688602985.427737], "version": 0.2, "tvm_version": "0.13.dev0"}
{"input": ["cuda -keys=cuda,gpu -arch=sm_75 -max_num_threads=1024 -thread_warp_size=32", "batch_matmul.cuda", [["TENSOR", [12, 128, 128], "float32"], ["TENSOR", [12, 128, 64], "float32"], [12, 128, 64], "float32", 0, 0], {}], "config": {"index": 39565, "code_hash": null, "entity": [["tile_y", "sp", [-1, 2, 1]], ["tile_x", "sp", [-1, 1, 2]], ["tile_k", "sp", [-1, 128]], ["auto_unroll_max_step", "ot", 8], ["unroll_explicit", "ot", 1]]}, "result": [[0.0015337597047619049, 0.0015340794095238097, 0.0015341516380952382], 0, 2.202972412109375, 1688602986.7660623], "version": 0.2, "tvm_version": "0.13.dev0"}
{"input": ["cuda -keys=cuda,gpu -arch=sm_75 -max_num_threads=1024 -thread_warp_size=32", "batch_matmul.cuda", [["TENSOR", [12, 128, 128], "float32"], ["TENSOR", [12, 128, 64], "float32"], [12, 128, 64], "float32", 0, 0], {}], "config": {"index": 26253, "code_hash": null, "entity": [["tile_y", "sp", [-1, 2, 2]], ["tile_x", "sp", [-1, 2, 1]], ["tile_k", "sp", [-1, 4]], ["auto_unroll_max_step", "ot", 64], ["unroll_explicit", "ot", 0]]}, "result": [[0.0008993347821229052, 0.0008993694748603352, 0.0008995032234636872], 0, 2.165067195892334, 1688602988.10709], "version": 0.2, "tvm_version": "0.13.dev0"}
{"input": ["cuda -keys=cuda,gpu -arch=sm_75 -max_num_threads=1024 -thread_warp_size=32", "batch_matmul.cuda", [["TENSOR", [12, 128, 128], "float32"], ["TENSOR", [12, 128, 64], "float32"], [12, 128, 64], "float32", 0, 0], {}], "config": {"index": 58767, "code_hash": null, "entity": [["tile_y", "sp", [-1, 1, 4]], ["tile_x", "sp", [-1, 2, 2]], ["tile_k", "sp", [-1, 4]], ["auto_unroll_max_step", "ot", 64], ["unroll_explicit", "ot", 1]]}, "result": [[0.000641925108, 0.000642100708, 0.00064228558], 0, 2.2770941257476807, 1688602989.5098348], "version": 0.2, "tvm_version": "0.13.dev0"}
{"input": ["cuda -keys=cuda,gpu -arch=sm_75 -max_num_threads=1024 -thread_warp_size=32", "batch_matmul.cuda", [["TENSOR", [12, 128, 128], "float32"], ["TENSOR", [12, 128, 64], "float32"], [12, 128, 64], "float32", 0, 0], {}], "config": {"index": 59537, "code_hash": null, "entity": [["tile_y", "sp", [-1, 8, 16]], ["tile_x", "sp", [-1, 2, 1]], ["tile_k", "sp", [-1, 8]], ["auto_unroll_max_step", "ot", 64], ["unroll_explicit", "ot", 1]]}, "result": [[0.00047263054572271385, 0.0004727840353982301, 0.00047288864011799407], 0, 2.369474411010742, 1688602990.9092684], "version": 0.2, "tvm_version": "0.13.dev0"}
{"input": ["cuda -keys=cuda,gpu -arch=sm_75 -max_num_threads=1024 -thread_warp_size=32", "batch_matmul.cuda", [["TENSOR", [12, 128, 128], "float32"], ["TENSOR", [12, 128, 64], "float32"], [12, 128, 64], "float32", 0, 0], {}], "config": {"index": 54545, "code_hash": null, "entity": [["tile_y", "sp", [-1, 32, 1]], ["tile_x", "sp", [-1, 8, 1]], ["tile_k", "sp", [-1, 64]], ["auto_unroll_max_step", "ot", 32], ["unroll_explicit", "ot", 1]]}, "result": [[0.00012105326877470356, 0.00012106837075098814, 0.0001211949280632411], 0, 2.213472366333008, 1688602992.2614658], "version": 0.2, "tvm_version": "0.13.dev0"}
{"input": ["cuda -keys=cuda,gpu -arch=sm_75 -max_num_threads=1024 -thread_warp_size=32", "batch_matmul.cuda", [["TENSOR", [12, 128, 128], "float32"], ["TENSOR", [12, 128, 64], "float32"], [12, 128, 64], "float32", 0, 0], {}], "config": {"index": 54929, "code_hash": null, "entity": [["tile_y", "sp", [-1, 8, 16]], ["tile_x", "sp", [-1, 1, 4]], ["tile_k", "sp", [-1, 64]], ["auto_unroll_max_step", "ot", 32], ["unroll_explicit", "ot", 1]]}, "result": [[0.000734291768181818, 0.0007343290136363636, 0.00073463315], 0, 2.328213691711426, 1688602993.5947595], "version": 0.2, "tvm_version": "0.13.dev0"}
{"input": ["cuda -keys=cuda,gpu -arch=sm_75 -max_num_threads=1024 -thread_warp_size=32", "batch_matmul.cuda", [["TENSOR", [12, 128, 128], "float32"], ["TENSOR", [12, 128, 64], "float32"], [12, 128, 64], "float32", 0, 0], {}], "config": {"index": 9237, "code_hash": null, "entity": [["tile_y", "sp", [-1, 1, 8]], ["tile_x", "sp", [-1, 16, 1]], ["tile_k", "sp", [-1, 2]], ["auto_unroll_max_step", "ot", 16], ["unroll_explicit", "ot", 0]]}, "result": [[0.0001444211931290622, 0.00014442126462395542, 0.00014443445496750232], 0, 2.2077908515930176, 1688602994.9697602], "version": 0.2, "tvm_version": "0.13.dev0"}
{"input": ["cuda -keys=cuda,gpu -arch=sm_75 -max_num_threads=1024 -thread_warp_size=32", "batch_matmul.cuda", [["TENSOR", [12, 128, 128], "float32"], ["TENSOR", [12, 128, 64], "float32"], [12, 128, 64], "float32", 0, 0], {}], "config": {"index": 35098, "code_hash": null, "entity": [["tile_y", "sp", [-1, 2, 64]], ["tile_x", "sp", [-1, 1, 16]], ["tile_k", "sp", [-1, 4]], ["auto_unroll_max_step", "ot", 8], ["unroll_explicit", "ot", 1]]}, "result": [[0.0050303455, 0.0050318286499999995, 0.0050318958], 0, 2.250957489013672, 1688602995.9739177], "version": 0.2, "tvm_version": "0.13.dev0"}
{"input": ["cuda -keys=cuda,gpu -arch=sm_75 -max_num_threads=1024 -thread_warp_size=32", "batch_matmul.cuda", [["TENSOR", [12, 128, 128], "float32"], ["TENSOR", [12, 128, 64], "float32"], [12, 128, 64], "float32", 0, 0], {}], "config": {"index": 1050, "code_hash": null, "entity": [["tile_y", "sp", [-1, 64, 1]], ["tile_x", "sp", [-1, 2, 1]], ["tile_k", "sp", [-1, 2]], ["auto_unroll_max_step", "ot", 8], ["unroll_explicit", "ot", 0]]}, "result": [[0.0003881556674757281, 0.0003882998106796117, 0.00038832381067961164], 0, 2.2018492221832275, 1688602997.3572257], "version": 0.2, "tvm_version": "0.13.dev0"}
{"input": ["cuda -keys=cuda,gpu -arch=sm_75 -max_num_threads=1024 -thread_warp_size=32", "batch_matmul.cuda", [["TENSOR", [12, 128, 128], "float32"], ["TENSOR", [12, 128, 64], "float32"], [12, 128, 64], "float32", 0, 0], {}], "config": {"index": 43170, "code_hash": null, "entity": [["tile_y", "sp", [-1, 64, 1]], ["tile_x", "sp", [-1, 2, 16]], ["tile_k", "sp", [-1, 4]], ["auto_unroll_max_step", "ot", 16], ["unroll_explicit", "ot", 1]]}, "result": [[6.586009268707484e-05, 6.586078698979592e-05, 6.586780654761904e-05], 0, 2.2756690979003906, 1688602998.7252882], "version": 0.2, "tvm_version": "0.13.dev0"}
{"input": ["cuda -keys=cuda,gpu -arch=sm_75 -max_num_threads=1024 -thread_warp_size=32", "batch_matmul.cuda", [["TENSOR", [12, 128, 128], "float32"], ["TENSOR", [12, 128, 64], "float32"], [12, 128, 64], "float32", 0, 0], {}], "config": {"index": 11429, "code_hash": null, "entity": [["tile_y", "sp", [-1, 4, 4]], ["tile_x", "sp", [-1, 4, 2]], ["tile_k", "sp", [-1, 8]], ["auto_unroll_max_step", "ot", 16], ["unroll_explicit", "ot", 0]]}, "result": [[0.00011991338479262673, 0.00011991495545314899, 0.00011992481182795698], 0, 2.283046245574951, 1688603000.100618], "version": 0.2, "tvm_version": "0.13.dev0"}
{"input": ["cuda -keys=cuda,gpu -arch=sm_75 -max_num_threads=1024 -thread_warp_size=32", "batch_matmul.cuda", [["TENSOR", [12, 128, 128], "float32"], ["TENSOR", [12, 128, 64], "float32"], [12, 128, 64], "float32", 0, 0], {}], "config": {"index": 41790, "code_hash": null, "entity": [["tile_y", "sp", [-1, 1, 32]], ["tile_x", "sp", [-1, 32, 2]], ["tile_k", "sp", [-1, 2]], ["auto_unroll_max_step", "ot", 16], ["unroll_explicit", "ot", 1]]}, "result": [[6.745585714285715e-05, 6.748722582417582e-05, 6.760066923076923e-05], 0, 2.073676347732544, 1688603003.4116888], "version": 0.2, "tvm_version": "0.13.dev0"}
{"input": ["cuda -keys=cuda,gpu -arch=sm_75 -max_num_threads=1024 -thread_warp_size=32", "batch_matmul.cuda", [["TENSOR", [12, 128, 128], "float32"], ["TENSOR", [12, 128, 64], "float32"], [12, 128, 64], "float32", 0, 0], {}], "config": {"index": 58912, "code_hash": null, "entity": [["tile_y", "sp", [-1, 2, 4]], ["tile_x", "sp", [-1, 32, 2]], ["tile_k", "sp", [-1, 4]], ["auto_unroll_max_step", "ot", 64], ["unroll_explicit", "ot", 1]]}, "result": [[4.605013140556369e-05, 4.606046156661786e-05, 4.6062628477306005e-05], 0, 1.9923596382141113, 1688603004.60717], "version": 0.2, "tvm_version": "0.13.dev0"}
{"input": ["cuda -keys=cuda,gpu -arch=sm_75 -max_num_threads=1024 -thread_warp_size=32", "batch_matmul.cuda", [["TENSOR", [12, 128, 128], "float32"], ["TENSOR", [12, 128, 64], "float32"], [12, 128, 64], "float32", 0, 0], {}], "config": {"index": 10485, "code_hash": null, "entity": [["tile_y", "sp", [-1, 2, 2]], ["tile_x", "sp", [-1, 16, 2]], ["tile_k", "sp", [-1, 4]], ["auto_unroll_max_step", "ot", 16], ["unroll_explicit", "ot", 0]]}, "result": [[7.744283732317737e-05, 7.746162404787812e-05, 7.746576713819369e-05], 0, 2.0786008834838867, 1688603005.906913], "version": 0.2, "tvm_version": "0.13.dev0"}
{"input": ["cuda -keys=cuda,gpu -arch=sm_75 -max_num_threads=1024 -thread_warp_size=32", "batch_matmul.cuda", [["TENSOR", [12, 128, 128], "float32"], ["TENSOR", [12, 128, 64], "float32"], [12, 128, 64], "float32", 0, 0], {}], "config": {"index": 59934, "code_hash": null, "entity": [["tile_y", "sp", [-1, 1, 32]], ["tile_x", "sp", [-1, 32, 2]], ["tile_k", "sp", [-1, 8]], ["auto_unroll_max_step", "ot", 64], ["unroll_explicit", "ot", 1]]}, "result": [[6.258647679153095e-05, 6.258944625407167e-05, 6.259011115635179e-05], 0, 3.3622241020202637, 1688603007.2782981], "version": 0.2, "tvm_version": "0.13.dev0"}
{"input": ["cuda -keys=cuda,gpu -arch=sm_75 -max_num_threads=1024 -thread_warp_size=32", "batch_matmul.cuda", [["TENSOR", [12, 128, 128], "float32"], ["TENSOR", [12, 128, 64], "float32"], [12, 128, 64], "float32", 0, 0], {}], "config": {"index": 43177, "code_hash": null, "entity": [["tile_y", "sp", [-1, 32, 2]], ["tile_x", "sp", [-1, 2, 16]], ["tile_k", "sp", [-1, 4]], ["auto_unroll_max_step", "ot", 16], ["unroll_explicit", "ot", 1]]}, "result": [[5.324907346528011e-05, 5.325074740020127e-05, 5.325769339147937e-05], 0, 2.295938491821289, 1688603008.6648471], "version": 0.2, "tvm_version": "0.13.dev0"}
{"input": ["cuda -keys=cuda,gpu -arch=sm_75 -max_num_threads=1024 -thread_warp_size=32", "batch_matmul.cuda", [["TENSOR", [12, 128, 128], "float32"], ["TENSOR", [12, 128, 64], "float32"], [12, 128, 64], "float32", 0, 0], {}], "config": {"index": 10285, "code_hash": null, "entity": [["tile_y", "sp", [-1, 16, 8]], ["tile_x", "sp", [-1, 32, 1]], ["tile_k", "sp", [-1, 4]], ["auto_unroll_max_step", "ot", 16], ["unroll_explicit", "ot", 0]]}, "result": [[5.7277361368209256e-05, 5.7293019315895375e-05, 5.731103501006036e-05], 0, 2.092989444732666, 1688603009.9636667], "version": 0.2, "tvm_version": "0.13.dev0"}
{"input": ["cuda -keys=cuda,gpu -arch=sm_75 -max_num_threads=1024 -thread_warp_size=32", "batch_matmul.cuda", [["TENSOR", [12, 128, 128], "float32"], ["TENSOR", [12, 128, 64], "float32"], [12, 128, 64], "float32", 0, 0], {}], "config": {"index": 62339, "code_hash": null, "entity": [["tile_y", "sp", [-1, 4, 8]], ["tile_x", "sp", [-1, 2, 16]], ["tile_k", "sp", [-1, 32]], ["auto_unroll_max_step", "ot", 64], ["unroll_explicit", "ot", 1]]}, "result": [[9.25963003492433e-05, 9.262729743888244e-05, 9.270716181606519e-05], 0, 2.4348087310791016, 1688603011.373878], "version": 0.2, "tvm_version": "0.13.dev0"}
{"input": ["cuda -keys=cuda,gpu -arch=sm_75 -max_num_threads=1024 -thread_warp_size=32", "batch_matmul.cuda", [["TENSOR", [12, 128, 128], "float32"], ["TENSOR", [12, 128, 64], "float32"], [12, 128, 64], "float32", 0, 0], {}], "config": {"index": 30699, "code_hash": null, "entity": [["tile_y", "sp", [-1, 2, 16]], ["tile_x", "sp", [-1, 32, 2]], ["tile_k", "sp", [-1, 64]], ["auto_unroll_max_step", "ot", 64], ["unroll_explicit", "ot", 0]]}, "result": [[2.6905308970099665e-05, 2.6920653820598004e-05, 2.6923595791805092e-05], 0, 2.2768032550811768, 1688603012.5560246], "version": 0.2, "tvm_version": "0.13.dev0"}
{"input": ["cuda -keys=cuda,gpu -arch=sm_75 -max_num_threads=1024 -thread_warp_size=32", "batch_matmul.cuda", [["TENSOR", [12, 128, 128], "float32"], ["TENSOR", [12, 128, 64], "float32"], [12, 128, 64], "float32", 0, 0], {}], "config": {"index": 62831, "code_hash": null, "entity": [["tile_y", "sp", [-1, 8, 2]], ["tile_x", "sp", [-1, 4, 2]], ["tile_k", "sp", [-1, 64]], ["auto_unroll_max_step", "ot", 64], ["unroll_explicit", "ot", 1]]}, "result": [[0.00016039903137651823, 0.00016044857591093116, 0.0001604881902834008], 0, 2.385613203048706, 1688603013.9437816], "version": 0.2, "tvm_version": "0.13.dev0"}
{"input": ["cuda -keys=cuda,gpu -arch=sm_75 -max_num_threads=1024 -thread_warp_size=32", "batch_matmul.cuda", [["TENSOR", [12, 128, 128], "float32"], ["TENSOR", [12, 128, 64], "float32"], [12, 128, 64], "float32", 0, 0], {}], "config": {"index": 63711, "code_hash": null, "entity": [["tile_y", "sp", [-1, 2, 16]], ["tile_x", "sp", [-1, 32, 1]], ["tile_k", "sp", [-1, 128]], ["auto_unroll_max_step", "ot", 64], ["unroll_explicit", "ot", 1]]}, "result": [[4.537134544934173e-05, 4.537527561534058e-05, 4.5379441900400685e-05], 0, 2.5060629844665527, 1688603015.3304284], "version": 0.2, "tvm_version": "0.13.dev0"}
{"input": ["cuda -keys=cuda,gpu -arch=sm_75 -max_num_threads=1024 -thread_warp_size=32", "batch_matmul.cuda", [["TENSOR", [12, 128, 128], "float32"], ["TENSOR", [12, 128, 64], "float32"], [12, 128, 64], "float32", 0, 0], {}], "config": {"index": 30677, "code_hash": null, "entity": [["tile_y", "sp", [-1, 32, 1]], ["tile_x", "sp", [-1, 32, 2]], ["tile_k", "sp", [-1, 64]], ["auto_unroll_max_step", "ot", 64], ["unroll_explicit", "ot", 0]]}, "result": [[5.8462978221415604e-05, 5.8468040653357535e-05, 5.849740617059891e-05], 0, 2.2608420848846436, 1688603016.7235553], "version": 0.2, "tvm_version": "0.13.dev0"}
{"input": ["cuda -keys=cuda,gpu -arch=sm_75 -max_num_threads=1024 -thread_warp_size=32", "batch_matmul.cuda", [["TENSOR", [12, 128, 128], "float32"], ["TENSOR", [12, 128, 64], "float32"], [12, 128, 64], "float32", 0, 0], {}], "config": {"index": 59537, "code_hash": null, "entity": [["tile_y", "sp", [-1, 8, 16]], ["tile_x", "sp", [-1, 2, 1]], ["tile_k", "sp", [-1, 8]], ["auto_unroll_max_step", "ot", 64], ["unroll_explicit", "ot", 1]]}, "result": [[0.00047238093230769226, 0.00047266699999999997, 0.00047315927076923073], 0, 2.331315755844116, 1688603018.084504], "version": 0.2, "tvm_version": "0.13.dev0"}
{"input": ["cuda -keys=cuda,gpu -arch=sm_75 -max_num_threads=1024 -thread_warp_size=32", "batch_matmul.cuda", [["TENSOR", [12, 128, 128], "float32"], ["TENSOR", [12, 128, 64], "float32"], [12, 128, 64], "float32", 0, 0], {}], "config": {"index": 54349, "code_hash": null, "entity": [["tile_y", "sp", [-1, 16, 8]], ["tile_x", "sp", [-1, 1, 32]], ["tile_k", "sp", [-1, 32]], ["auto_unroll_max_step", "ot", 32], ["unroll_explicit", "ot", 1]]}, "result": [[0.0001893208695652174, 0.00018934618683901292, 0.0001893491457109283], 0, 2.5946717262268066, 1688603019.4769561], "version": 0.2, "tvm_version": "0.13.dev0"}
{"input": ["cuda -keys=cuda,gpu -arch=sm_75 -max_num_threads=1024 -thread_warp_size=32", "batch_matmul.cuda", [["TENSOR", [12, 128, 128], "float32"], ["TENSOR", [12, 128, 64], "float32"], [12, 128, 64], "float32", 0, 0], {}], "config": {"index": 24583, "code_hash": null, "entity": [["tile_y", "sp", [-1, 2, 32]], ["tile_x", "sp", [-1, 8, 2]], ["tile_k", "sp", [-1, 1]], ["auto_unroll_max_step", "ot", 64], ["unroll_explicit", "ot", 0]]}, "result": [[0.00016098033367451382, 0.00016099140634595702, 0.00016099206243602864], 0, 2.30192232131958, 1688603020.8569946], "version": 0.2, "tvm_version": "0.13.dev0"}
{"input": ["cuda -keys=cuda,gpu -arch=sm_75 -max_num_threads=1024 -thread_warp_size=32", "batch_matmul.cuda", [["TENSOR", [12, 128, 128], "float32"], ["TENSOR", [12, 128, 64], "float32"], [12, 128, 64], "float32", 0, 0], {}], "config": {"index": 50747, "code_hash": null, "entity": [["tile_y", "sp", [-1, 4, 8]], ["tile_x", "sp", [-1, 4, 2]], ["tile_k", "sp", [-1, 4]], ["auto_unroll_max_step", "ot", 32], ["unroll_explicit", "ot", 1]]}, "result": [[0.0001221259758566978, 0.00012215122897196262, 0.0001221677476635514], 0, 2.264343023300171, 1688603022.2329156], "version": 0.2, "tvm_version": "0.13.dev0"}
{"input": ["cuda -keys=cuda,gpu -arch=sm_75 -max_num_threads=1024 -thread_warp_size=32", "batch_matmul.cuda", [["TENSOR", [12, 128, 128], "float32"], ["TENSOR", [12, 128, 64], "float32"], [12, 128, 64], "float32", 0, 0], {}], "config": {"index": 63135, "code_hash": null, "entity": [["tile_y", "sp", [-1, 2, 16]], ["tile_x", "sp", [-1, 16, 4]], ["tile_k", "sp", [-1, 64]], ["auto_unroll_max_step", "ot", 64], ["unroll_explicit", "ot", 1]]}, "result": [[4.384401879271071e-05, 4.384931919134396e-05, 4.385763069476082e-05], 0, 2.479736566543579, 1688603023.5909164], "version": 0.2, "tvm_version": "0.13.dev0"}
{"input": ["cuda -keys=cuda,gpu -arch=sm_75 -max_num_threads=1024 -thread_warp_size=32", "batch_matmul.cuda", [["TENSOR", [12, 128, 128], "float32"], ["TENSOR", [12, 128, 64], "float32"], [12, 128, 64], "float32", 0, 0], {}], "config": {"index": 36353, "code_hash": null, "entity": [["tile_y", "sp", [-1, 8, 16]], ["tile_x", "sp", [-1, 2, 1]], ["tile_k", "sp", [-1, 16]], ["auto_unroll_max_step", "ot", 8], ["unroll_explicit", "ot", 1]]}, "result": [[0.0007935273161290323, 0.0007937837612903226, 0.0007951789548387096], 0, 2.121157169342041, 1688603026.4800653], "version": 0.2, "tvm_version": "0.13.dev0"}
{"input": ["cuda -keys=cuda,gpu -arch=sm_75 -max_num_threads=1024 -thread_warp_size=32", "batch_matmul.cuda", [["TENSOR", [12, 128, 128], "float32"], ["TENSOR", [12, 128, 64], "float32"], [12, 128, 64], "float32", 0, 0], {}], "config": {"index": 58188, "code_hash": null, "entity": [["tile_y", "sp", [-1, 16, 2]], ["tile_x", "sp", [-1, 4, 8]], ["tile_k", "sp", [-1, 2]], ["auto_unroll_max_step", "ot", 64], ["unroll_explicit", "ot", 1]]}, "result": [[6.352396110881258e-05, 6.35399271824576e-05, 6.355055812991312e-05], 0, 2.2464852333068848, 1688603027.837395], "version": 0.2, "tvm_version": "0.13.dev0"}
{"input": ["cuda -keys=cuda,gpu -arch=sm_75 -max_num_threads=1024 -thread_warp_size=32", "batch_matmul.cuda", [["TENSOR", [12, 128, 128], "float32"], ["TENSOR", [12, 128, 64], "float32"], [12, 128, 64], "float32", 0, 0], {}], "config": {"index": 57317, "code_hash": null, "entity": [["tile_y", "sp", [-1, 32, 1]], ["tile_x", "sp", [-1, 4, 16]], ["tile_k", "sp", [-1, 1]], ["auto_unroll_max_step", "ot", 64], ["unroll_explicit", "ot", 1]]}, "result": [[0.0001666541337513062, 0.00016667642424242425, 0.00016667766771159874], 0, 2.3283913135528564, 1688603029.2385235], "version": 0.2, "tvm_version": "0.13.dev0"}
{"input": ["cuda -keys=cuda,gpu -arch=sm_75 -max_num_threads=1024 -thread_warp_size=32", "batch_matmul.cuda", [["TENSOR", [12, 128, 128], "float32"], ["TENSOR", [12, 128, 64], "float32"], [12, 128, 64], "float32", 0, 0], {}], "config": {"index": 22581, "code_hash": null, "entity": [["tile_y", "sp", [-1, 2, 2]], ["tile_x", "sp", [-1, 16, 2]], ["tile_k", "sp", [-1, 64]], ["auto_unroll_max_step", "ot", 32], ["unroll_explicit", "ot", 0]]}, "result": [[5.886809405940595e-05, 5.8874648514851486e-05, 5.887571210967251e-05], 0, 2.2678990364074707, 1688603030.6151974], "version": 0.2, "tvm_version": "0.13.dev0"}
{"input": ["cuda -keys=cuda,gpu -arch=sm_75 -max_num_threads=1024 -thread_warp_size=32", "batch_matmul.cuda", [["TENSOR", [12, 128, 128], "float32"], ["TENSOR", [12, 128, 64], "float32"], [12, 128, 64], "float32", 0, 0], {}], "config": {"index": 33306, "code_hash": null, "entity": [["tile_y", "sp", [-1, 64, 1]], ["tile_x", "sp", [-1, 2, 1]], ["tile_k", "sp", [-1, 2]], ["auto_unroll_max_step", "ot", 8], ["unroll_explicit", "ot", 1]]}, "result": [[0.00038491272860635695, 0.0003849408190709047, 0.0003849889462102689], 0, 2.1875662803649902, 1688603031.9964335], "version": 0.2, "tvm_version": "0.13.dev0"}
{"input": ["cuda -keys=cuda,gpu -arch=sm_75 -max_num_threads=1024 -thread_warp_size=32", "batch_matmul.cuda", [["TENSOR", [12, 128, 128], "float32"], ["TENSOR", [12, 128, 64], "float32"], [12, 128, 64], "float32", 0, 0], {}], "config": {"index": 11447, "code_hash": null, "entity": [["tile_y", "sp", [-1, 1, 128]], ["tile_x", "sp", [-1, 4, 2]], ["tile_k", "sp", [-1, 8]], ["auto_unroll_max_step", "ot", 16], ["unroll_explicit", "ot", 0]]}, "result": [[0.0034402422333333336, 0.0034402987, 0.0034407765666666667], 0, 2.5932505130767822, 1688603033.0237296], "version": 0.2, "tvm_version": "0.13.dev0"}
{"input": ["cuda -keys=cuda,gpu -arch=sm_75 -max_num_threads=1024 -thread_warp_size=32", "batch_matmul.cuda", [["TENSOR", [12, 128, 128], "float32"], ["TENSOR", [12, 128, 64], "float32"], [12, 128, 64], "float32", 0, 0], {}], "config": {"index": 57661, "code_hash": null, "entity": [["tile_y", "sp", [-1, 16, 8]], ["tile_x", "sp", [-1, 32, 1]], ["tile_k", "sp", [-1, 2]], ["auto_unroll_max_step", "ot", 64], ["unroll_explicit", "ot", 1]]}, "result": [[7.926437709923665e-05, 7.928741679389313e-05, 7.92972707379135e-05], 0, 2.226605176925659, 1688603034.4013643], "version": 0.2, "tvm_version": "0.13.dev0"}
{"input": ["cuda -keys=cuda,gpu -arch=sm_75 -max_num_threads=1024 -thread_warp_size=32", "batch_matmul.cuda", [["TENSOR", [12, 128, 128], "float32"], ["TENSOR", [12, 128, 64], "float32"], [12, 128, 64], "float32", 0, 0], {}], "config": {"index": 59310, "code_hash": null, "entity": [["tile_y", "sp", [-1, 8, 4]], ["tile_x", "sp", [-1, 2, 16]], ["tile_k", "sp", [-1, 4]], ["auto_unroll_max_step", "ot", 64], ["unroll_explicit", "ot", 1]]}, "result": [[7.048106924829158e-05, 7.048222323462415e-05, 7.049408974943052e-05], 0, 2.339076280593872, 1688603035.7501025], "version": 0.2, "tvm_version": "0.13.dev0"}
{"input": ["cuda -keys=cuda,gpu -arch=sm_75 -max_num_threads=1024 -thread_warp_size=32", "batch_matmul.cuda", [["TENSOR", [12, 128, 128], "float32"], ["TENSOR", [12, 128, 64], "float32"], [12, 128, 64], "float32", 0, 0], {}], "config": {"index": 4601, "code_hash": null, "entity": [["tile_y", "sp", [-1, 8, 16]], ["tile_x", "sp", [-1, 4, 4]], ["tile_k", "sp", [-1, 16]], ["auto_unroll_max_step", "ot", 8], ["unroll_explicit", "ot", 0]]}, "result": [[9.690761097560976e-05, 9.691935243902437e-05, 9.69825743902439e-05], 0, 2.3004825115203857, 1688603037.122521], "version": 0.2, "tvm_version": "0.13.dev0"}
{"input": ["cuda -keys=cuda,gpu -arch=sm_75 -max_num_threads=1024 -thread_warp_size=32", "batch_matmul.cuda", [["TENSOR", [12, 128, 128], "float32"], ["TENSOR", [12, 128, 64], "float32"], [12, 128, 64], "float32", 0, 0], {}], "config": {"index": 30353, "code_hash": null, "entity": [["tile_y", "sp", [-1, 32, 1]], ["tile_x", "sp", [-1, 8, 1]], ["tile_k", "sp", [-1, 64]], ["auto_unroll_max_step", "ot", 64], ["unroll_explicit", "ot", 0]]}, "result": [[0.00011795376754716981, 0.00011799178188679246, 0.00011806680905660377], 0, 2.2625842094421387, 1688603038.5041316], "version": 0.2, "tvm_version": "0.13.dev0"}
{"input": ["cuda -keys=cuda,gpu -arch=sm_75 -max_num_threads=1024 -thread_warp_size=32", "batch_matmul.cuda", [["TENSOR", [12, 128, 128], "float32"], ["TENSOR", [12, 128, 64], "float32"], [12, 128, 64], "float32", 0, 0], {}], "config": {"index": 57919, "code_hash": null, "entity": [["tile_y", "sp", [-1, 2, 32]], ["tile_x", "sp", [-1, 32, 2]], ["tile_k", "sp", [-1, 2]], ["auto_unroll_max_step", "ot", 64], ["unroll_explicit", "ot", 1]]}, "result": [[6.070593e-05, 6.0709122692307687e-05, 6.072206923076922e-05], 0, 2.3911056518554688, 1688603039.888453], "version": 0.2, "tvm_version": "0.13.dev0"}
{"input": ["cuda -keys=cuda,gpu -arch=sm_75 -max_num_threads=1024 -thread_warp_size=32", "batch_matmul.cuda", [["TENSOR", [12, 128, 128], "float32"], ["TENSOR", [12, 128, 64], "float32"], [12, 128, 64], "float32", 0, 0], {}], "config": {"index": 58511, "code_hash": null, "entity": [["tile_y", "sp", [-1, 8, 2]], ["tile_x", "sp", [-1, 2, 1]], ["tile_k", "sp", [-1, 4]], ["auto_unroll_max_step", "ot", 64], ["unroll_explicit", "ot", 1]]}, "result": [[0.0004459859502762431, 0.0004460558812154696, 0.00044622195580110505], 0, 2.152631998062134, 1688603041.215553], "version": 0.2, "tvm_version": "0.13.dev0"}
{"input": ["cuda -keys=cuda,gpu -arch=sm_75 -max_num_threads=1024 -thread_warp_size=32", "batch_matmul.cuda", [["TENSOR", [12, 128, 128], "float32"], ["TENSOR", [12, 128, 64], "float32"], [12, 128, 64], "float32", 0, 0], {}], "config": {"index": 54565, "code_hash": null, "entity": [["tile_y", "sp", [-1, 16, 8]], ["tile_x", "sp", [-1, 8, 1]], ["tile_k", "sp", [-1, 64]], ["auto_unroll_max_step", "ot", 32], ["unroll_explicit", "ot", 1]]}, "result": [[0.00011315001717699775, 0.0001131625638536221, 0.00011318608439133681], 0, 2.292644500732422, 1688603042.5492575], "version": 0.2, "tvm_version": "0.13.dev0"}
{"input": ["cuda -keys=cuda,gpu -arch=sm_75 -max_num_threads=1024 -thread_warp_size=32", "batch_matmul.cuda", [["TENSOR", [12, 128, 128], "float32"], ["TENSOR", [12, 128, 64], "float32"], [12, 128, 64], "float32", 0, 0], {}], "config": {"index": 38717, "code_hash": null, "entity": [["tile_y", "sp", [-1, 4, 4]], ["tile_x", "sp", [-1, 16, 2]], ["tile_k", "sp", [-1, 64]], ["auto_unroll_max_step", "ot", 8], ["unroll_explicit", "ot", 1]]}, "result": [[3.188113336792942e-05, 3.188193098079917e-05, 3.190129372080955e-05], 0, 2.143293857574463, 1688603043.7271645], "version": 0.2, "tvm_version": "0.13.dev0"}
{"input": ["cuda -keys=cuda,gpu -arch=sm_75 -max_num_threads=1024 -thread_warp_size=32", "batch_matmul.cuda", [["TENSOR", [12, 128, 128], "float32"], ["TENSOR", [12, 128, 64], "float32"], [12, 128, 64], "float32", 0, 0], {}], "config": {"index": 22673, "code_hash": null, "entity": [["tile_y", "sp", [-1, 8, 16]], ["tile_x", "sp", [-1, 1, 4]], ["tile_k", "sp", [-1, 64]], ["auto_unroll_max_step", "ot", 32], ["unroll_explicit", "ot", 0]]}, "result": [[0.0007278825231481482, 0.0007282536111111111, 0.0007282825], 0, 2.3568410873413086, 1688603045.1112874], "version": 0.2, "tvm_version": "0.13.dev0"}
{"input": ["cuda -keys=cuda,gpu -arch=sm_75 -max_num_threads=1024 -thread_warp_size=32", "batch_matmul.cuda", [["TENSOR", [12, 128, 128], "float32"], ["TENSOR", [12, 128, 64], "float32"], [12, 128, 64], "float32", 0, 0], {}], "config": {"index": 27872, "code_hash": null, "entity": [["tile_y", "sp", [-1, 1, 2]], ["tile_x", "sp", [-1, 1, 8]], ["tile_k", "sp", [-1, 8]], ["auto_unroll_max_step", "ot", 64], ["unroll_explicit", "ot", 0]]}, "result": [[0.0010815366451612904, 0.0010819863655913977, 0.0010821990107526883], 0, 2.1514711380004883, 1688603046.0948493], "version": 0.2, "tvm_version": "0.13.dev0"}
{"input": ["cuda -keys=cuda,gpu -arch=sm_75 -max_num_threads=1024 -thread_warp_size=32", "batch_matmul.cuda", [["TENSOR", [12, 128, 128], "float32"], ["TENSOR", [12, 128, 64], "float32"], [12, 128, 64], "float32", 0, 0], {}], "config": {"index": 61799, "code_hash": null, "entity": [["tile_y", "sp", [-1, 4, 8]], ["tile_x", "sp", [-1, 2, 2]], ["tile_k", "sp", [-1, 32]], ["auto_unroll_max_step", "ot", 64], ["unroll_explicit", "ot", 1]]}, "result": [[0.0003314975170212766, 0.00033152293617021275, 0.0003315702382978723], 0, 2.306401252746582, 1688603048.6463144], "version": 0.2, "tvm_version": "0.13.dev0"}
{"input": ["cuda -keys=cuda,gpu -arch=sm_75 -max_num_threads=1024 -thread_warp_size=32", "batch_matmul.cuda", [["TENSOR", [12, 128, 128], "float32"], ["TENSOR", [12, 128, 64], "float32"], [12, 128, 64], "float32", 0, 0], {}], "config": {"index": 42545, "code_hash": null, "entity": [["tile_y", "sp", [-1, 8, 16]], ["tile_x", "sp", [-1, 32, 1]], ["tile_k", "sp", [-1, 4]], ["auto_unroll_max_step", "ot", 16], ["unroll_explicit", "ot", 1]]}, "result": [[4.9697258704605016e-05, 4.973033582927742e-05, 4.974064170722576e-05], 0, 2.1823360919952393, 1688603049.88817], "version": 0.2, "tvm_version": "0.13.dev0"}
{"input": ["cuda -keys=cuda,gpu -arch=sm_75 -max_num_threads=1024 -thread_warp_size=32", "batch_matmul.cuda", [["TENSOR", [12, 128, 128], "float32"], ["TENSOR", [12, 128, 64], "float32"], [12, 128, 64], "float32", 0, 0], {}], "config": {"index": 1754, "code_hash": null, "entity": [["tile_y", "sp", [-1, 1, 16]], ["tile_x", "sp", [-1, 4, 8]], ["tile_k", "sp", [-1, 2]], ["auto_unroll_max_step", "ot", 8], ["unroll_explicit", "ot", 0]]}, "result": [[0.00014183922905525848, 0.00014189841443850267, 0.00014192895989304814], 0, 2.35740065574646, 1688603051.2650967], "version": 0.2, "tvm_version": "0.13.dev0"}
{"input": ["cuda -keys=cuda,gpu -arch=sm_75 -max_num_threads=1024 -thread_warp_size=32", "batch_matmul.cuda", [["TENSOR", [12, 128, 128], "float32"], ["TENSOR", [12, 128, 64], "float32"], [12, 128, 64], "float32", 0, 0], {}], "config": {"index": 30417, "code_hash": null, "entity": [["tile_y", "sp", [-1, 1, 64]], ["tile_x", "sp", [-1, 16, 1]], ["tile_k", "sp", [-1, 64]], ["auto_unroll_max_step", "ot", 64], ["unroll_explicit", "ot", 0]]}, "result": [[0.0001182626460807601, 0.00011829138796516233, 0.00011845135708630244], 0, 2.3463497161865234, 1688603052.6024468], "version": 0.2, "tvm_version": "0.13.dev0"}
{"input": ["cuda -keys=cuda,gpu -arch=sm_75 -max_num_threads=1024 -thread_warp_size=32", "batch_matmul.cuda", [["TENSOR", [12, 128, 128], "float32"], ["TENSOR", [12, 128, 64], "float32"], [12, 128, 64], "float32", 0, 0], {}], "config": {"index": 37935, "code_hash": null, "entity": [["tile_y", "sp", [-1, 2, 16]], ["tile_x", "sp", [-1, 16, 4]], ["tile_k", "sp", [-1, 32]], ["auto_unroll_max_step", "ot", 8], ["unroll_explicit", "ot", 1]]}, "result": [[3.117851342356335e-05, 3.124306966940315e-05, 3.128296516529843e-05], 0, 2.2451372146606445, 1688603053.8848808], "version": 0.2, "tvm_version": "0.13.dev0"}
{"input": ["cuda -keys=cuda,gpu -arch=sm_75 -max_num_threads=1024 -thread_warp_size=32", "batch_matmul.cuda", [["TENSOR", [12, 128, 128], "float32"], ["TENSOR", [12, 128, 64], "float32"], [12, 128, 64], "float32", 0, 0], {}], "config": {"index": 30645, "code_hash": null, "entity": [["tile_y", "sp", [-1, 2, 2]], ["tile_x", "sp", [-1, 16, 2]], ["tile_k", "sp", [-1, 64]], ["auto_unroll_max_step", "ot", 64], ["unroll_explicit", "ot", 0]]}, "result": [[5.904122964669739e-05, 5.9052251920122895e-05, 5.905233986175115e-05], 0, 2.263288736343384, 1688603055.2385743], "version": 0.2, "tvm_version": "0.13.dev0"}
{"input": ["cuda -keys=cuda,gpu -arch=sm_75 -max_num_threads=1024 -thread_warp_size=32", "batch_matmul.cuda", [["TENSOR", [12, 128, 128], "float32"], ["TENSOR", [12, 128, 64], "float32"], [12, 128, 64], "float32", 0, 0], {}], "config": {"index": 30445, "code_hash": null, "entity": [["tile_y", "sp", [-1, 16, 8]], ["tile_x", "sp", [-1, 32, 1]], ["tile_k", "sp", [-1, 64]], ["auto_unroll_max_step", "ot", 64], ["unroll_explicit", "ot", 0]]}, "result": [[3.586392954264524e-05, 3.587183238566131e-05, 3.587467292954265e-05], 0, 2.183954954147339, 1688603056.5437012], "version": 0.2, "tvm_version": "0.13.dev0"}
{"input": ["cuda -keys=cuda,gpu -arch=sm_75 -max_num_threads=1024 -thread_warp_size=32", "batch_matmul.cuda", [["TENSOR", [12, 128, 128], "float32"], ["TENSOR", [12, 128, 64], "float32"], [12, 128, 64], "float32", 0, 0], {}], "config": {"index": 7695, "code_hash": null, "entity": [["tile_y", "sp", [-1, 2, 16]], ["tile_x", "sp", [-1, 16, 4]], ["tile_k", "sp", [-1, 128]], ["auto_unroll_max_step", "ot", 8], ["unroll_explicit", "ot", 0]]}, "result": [[7.800507258485639e-05, 7.801277806788512e-05, 7.806068198433421e-05], 0, 2.2825067043304443, 1688603057.8777971], "version": 0.2, "tvm_version": "0.13.dev0"}
{"input": ["cuda -keys=cuda,gpu -arch=sm_75 -max_num_threads=1024 -thread_warp_size=32", "batch_matmul.cuda", [["TENSOR", [12, 128, 128], "float32"], ["TENSOR", [12, 128, 64], "float32"], [12, 128, 64], "float32", 0, 0], {}], "config": {"index": 37926, "code_hash": null, "entity": [["tile_y", "sp", [-1, 8, 4]], ["tile_x", "sp", [-1, 16, 4]], ["tile_k", "sp", [-1, 32]], ["auto_unroll_max_step", "ot", 8], ["unroll_explicit", "ot", 1]]}, "result": [[2.493860115036976e-05, 2.4951605587510272e-05, 2.497478340180772e-05], 0, 2.2843377590179443, 1688603059.2332926], "version": 0.2, "tvm_version": "0.13.dev0"}
{"input": ["cuda -keys=cuda,gpu -arch=sm_75 -max_num_threads=1024 -thread_warp_size=32", "batch_matmul.cuda", [["TENSOR", [12, 128, 128], "float32"], ["TENSOR", [12, 128, 64], "float32"], [12, 128, 64], "float32", 0, 0], {}], "config": {"index": 11429, "code_hash": null, "entity": [["tile_y", "sp", [-1, 4, 4]], ["tile_x", "sp", [-1, 4, 2]], ["tile_k", "sp", [-1, 8]], ["auto_unroll_max_step", "ot", 16], ["unroll_explicit", "ot", 0]]}, "result": [[0.00012033440513219285, 0.00012036141057542767, 0.00012039405209953344], 0, 2.26946759223938, 1688603060.6048703], "version": 0.2, "tvm_version": "0.13.dev0"}
