src/tvm/results/cuda_gtx1650/mobilenet/xgb/cpu.log_layer_15.log
{"input": ["cuda -keys=cuda,gpu -arch=sm_75 -max_num_threads=1024 -thread_warp_size=32", "depthwise_conv2d_nchw.cuda", [["TENSOR", [1, 512, 14, 14], "float32"], ["TENSOR", [512, 1, 3, 3], "float32"], [2, 2], [1, 1, 1, 1], [1, 1], "float32"], {}], "config": {"index": 746, "code_hash": null, "entity": [["tile_f", "sp", [-1, 2, 16, 2]], ["tile_y", "sp", [-1, 1, 1, 7]], ["tile_x", "sp", [-1, 1, 1, 1]], ["auto_unroll_max_step", "ot", 0], ["unroll_explicit", "ot", 0]]}, "result": [[3.813679449018366e-05, 3.8139623495883465e-05, 3.837380557314756e-05], 0, 1.560783863067627, 1678950960.9314682], "version": 0.2, "tvm_version": "0.10.0"}
{"input": ["cuda -keys=cuda,gpu -arch=sm_75 -max_num_threads=1024 -thread_warp_size=32", "depthwise_conv2d_nchw.cuda", [["TENSOR", [1, 512, 14, 14], "float32"], ["TENSOR", [512, 1, 3, 3], "float32"], [2, 2], [1, 1, 1, 1], [1, 1], "float32"], {}], "config": {"index": 13316, "code_hash": null, "entity": [["tile_f", "sp", [-1, 2, 4, 4]], ["tile_y", "sp", [-1, 1, 1, 1]], ["tile_x", "sp", [-1, 1, 1, 7]], ["auto_unroll_max_step", "ot", 0], ["unroll_explicit", "ot", 1]]}, "result": [[0.0001345123035551504, 0.00013453952506836827, 0.00013461250774840473], 0, 2.213334083557129, 1678950962.1105163], "version": 0.2, "tvm_version": "0.10.0"}
{"input": ["cuda -keys=cuda,gpu -arch=sm_75 -max_num_threads=1024 -thread_warp_size=32", "depthwise_conv2d_nchw.cuda", [["TENSOR", [1, 512, 14, 14], "float32"], ["TENSOR", [512, 1, 3, 3], "float32"], [2, 2], [1, 1, 1, 1], [1, 1], "float32"], {}], "config": {"index": 7197, "code_hash": null, "entity": [["tile_f", "sp", [-1, 8, 8, 8]], ["tile_y", "sp", [-1, 1, 1, 1]], ["tile_x", "sp", [-1, 1, 1, 1]], ["auto_unroll_max_step", "ot", 1500], ["unroll_explicit", "ot", 0]]}, "result": [[0.00041334067098445593, 0.0004133412642487046, 0.0004133825336787565], 0, 7.838603734970093, 1678950963.3541114], "version": 0.2, "tvm_version": "0.10.0"}
{"input": ["cuda -keys=cuda,gpu -arch=sm_75 -max_num_threads=1024 -thread_warp_size=32", "depthwise_conv2d_nchw.cuda", [["TENSOR", [1, 512, 14, 14], "float32"], ["TENSOR", [512, 1, 3, 3], "float32"], [2, 2], [1, 1, 1, 1], [1, 1], "float32"], {}], "config": {"index": 2089, "code_hash": null, "entity": [["tile_f", "sp", [-1, 2, 2, 4]], ["tile_y", "sp", [-1, 7, 1, 1]], ["tile_x", "sp", [-1, 1, 7, 1]], ["auto_unroll_max_step", "ot", 0], ["unroll_explicit", "ot", 0]]}, "result": [[0.00011850499999999999, 0.000118508780147662, 0.00011851183511074651], 0, 1.865119457244873, 1678950964.4825325], "version": 0.2, "tvm_version": "0.10.0"}
{"input": ["cuda -keys=cuda,gpu -arch=sm_75 -max_num_threads=1024 -thread_warp_size=32", "depthwise_conv2d_nchw.cuda", [["TENSOR", [1, 512, 14, 14], "float32"], ["TENSOR", [512, 1, 3, 3], "float32"], [2, 2], [1, 1, 1, 1], [1, 1], "float32"], {}], "config": {"index": 13605, "code_hash": null, "entity": [["tile_f", "sp", [-1, 1, 1, 32]], ["tile_y", "sp", [-1, 7, 1, 1]], ["tile_x", "sp", [-1, 1, 1, 7]], ["auto_unroll_max_step", "ot", 0], ["unroll_explicit", "ot", 1]]}, "result": [[0.0006442008039999999, 0.0006442873520000001, 0.000644360044], 0, 2.554226875305176, 1678950965.7211552], "version": 0.2, "tvm_version": "0.10.0"}
{"input": ["cuda -keys=cuda,gpu -arch=sm_75 -max_num_threads=1024 -thread_warp_size=32", "depthwise_conv2d_nchw.cuda", [["TENSOR", [1, 512, 14, 14], "float32"], ["TENSOR", [512, 1, 3, 3], "float32"], [2, 2], [1, 1, 1, 1], [1, 1], "float32"], {}], "config": {"index": 12486, "code_hash": null, "entity": [["tile_f", "sp", [-1, 4, 1, 16]], ["tile_y", "sp", [-1, 1, 1, 1]], ["tile_x", "sp", [-1, 1, 7, 1]], ["auto_unroll_max_step", "ot", 0], ["unroll_explicit", "ot", 1]]}, "result": [[0.00019007203588516748, 0.0001900893397129187, 0.0001901005466507177], 0, 1.8031041622161865, 1678950966.9911087], "version": 0.2, "tvm_version": "0.10.0"}
{"input": ["cuda -keys=cuda,gpu -arch=sm_75 -max_num_threads=1024 -thread_warp_size=32", "depthwise_conv2d_nchw.cuda", [["TENSOR", [1, 512, 14, 14], "float32"], ["TENSOR", [512, 1, 3, 3], "float32"], [2, 2], [1, 1, 1, 1], [1, 1], "float32"], {}], "config": {"index": 4728, "code_hash": null, "entity": [["tile_f", "sp", [-1, 1, 2, 4]], ["tile_y", "sp", [-1, 7, 1, 1]], ["tile_x", "sp", [-1, 7, 1, 1]], ["auto_unroll_max_step", "ot", 256], ["unroll_explicit", "ot", 0]]}, "result": [[0.00034846489826839824, 0.00034848118181818186, 0.0003484919805194806], 0, 2.9714698791503906, 1678950968.278988], "version": 0.2, "tvm_version": "0.10.0"}
{"input": ["cuda -keys=cuda,gpu -arch=sm_75 -max_num_threads=1024 -thread_warp_size=32", "depthwise_conv2d_nchw.cuda", [["TENSOR", [1, 512, 14, 14], "float32"], ["TENSOR", [512, 1, 3, 3], "float32"], [2, 2], [1, 1, 1, 1], [1, 1], "float32"], {}], "config": {"index": 15654, "code_hash": null, "entity": [["tile_f", "sp", [-1, 1, 16, 1]], ["tile_y", "sp", [-1, 1, 1, 7]], ["tile_x", "sp", [-1, 7, 1, 1]], ["auto_unroll_max_step", "ot", 256], ["unroll_explicit", "ot", 1]]}, "result": [[1.5273184983388705e-05, 1.5312002126245847e-05, 1.672719348837209e-05], 0, 4.055491924285889, 1678950972.4612422], "version": 0.2, "tvm_version": "0.10.0"}
{"input": ["cuda -keys=cuda,gpu -arch=sm_75 -max_num_threads=1024 -thread_warp_size=32", "depthwise_conv2d_nchw.cuda", [["TENSOR", [1, 512, 14, 14], "float32"], ["TENSOR", [512, 1, 3, 3], "float32"], [2, 2], [1, 1, 1, 1], [1, 1], "float32"], {}], "config": {"index": 8001, "code_hash": null, "entity": [["tile_f", "sp", [-1, 4, 8, 2]], ["tile_y", "sp", [-1, 1, 1, 1]], ["tile_x", "sp", [-1, 7, 1, 1]], ["auto_unroll_max_step", "ot", 1500], ["unroll_explicit", "ot", 0]]}, "result": [[7.341692175925927e-05, 7.341964120370371e-05, 7.342069398148148e-05], 0, 3.1966352462768555, 1678950973.7125902], "version": 0.2, "tvm_version": "0.10.0"}
{"input": ["cuda -keys=cuda,gpu -arch=sm_75 -max_num_threads=1024 -thread_warp_size=32", "depthwise_conv2d_nchw.cuda", [["TENSOR", [1, 512, 14, 14], "float32"], ["TENSOR", [512, 1, 3, 3], "float32"], [2, 2], [1, 1, 1, 1], [1, 1], "float32"], {}], "config": {"index": 10419, "code_hash": null, "entity": [["tile_f", "sp", [-1, 1, 8, 2]], ["tile_y", "sp", [-1, 1, 1, 7]], ["tile_x", "sp", [-1, 1, 1, 7]], ["auto_unroll_max_step", "ot", 1500], ["unroll_explicit", "ot", 0]]}, "result": [[8.450249497088408e-05, 8.450508787718368e-05, 8.450629168872418e-05], 0, 3.354682683944702, 1678950974.9682207], "version": 0.2, "tvm_version": "0.10.0"}
{"input": ["cuda -keys=cuda,gpu -arch=sm_75 -max_num_threads=1024 -thread_warp_size=32", "depthwise_conv2d_nchw.cuda", [["TENSOR", [1, 512, 14, 14], "float32"], ["TENSOR", [512, 1, 3, 3], "float32"], [2, 2], [1, 1, 1, 1], [1, 1], "float32"], {}], "config": {"index": 14341, "code_hash": null, "entity": [["tile_f", "sp", [-1, 2, 32, 1]], ["tile_y", "sp", [-1, 7, 1, 1]], ["tile_x", "sp", [-1, 1, 1, 1]], ["auto_unroll_max_step", "ot", 256], ["unroll_explicit", "ot", 1]]}, "result": [[1.207254272613589e-05, 1.2073192746977908e-05, 1.2073552730304292e-05], 0, 2.440093517303467, 1678950976.1357856], "version": 0.2, "tvm_version": "0.10.0"}
{"input": ["cuda -keys=cuda,gpu -arch=sm_75 -max_num_threads=1024 -thread_warp_size=32", "depthwise_conv2d_nchw.cuda", [["TENSOR", [1, 512, 14, 14], "float32"], ["TENSOR", [512, 1, 3, 3], "float32"], [2, 2], [1, 1, 1, 1], [1, 1], "float32"], {}], "config": {"index": 11407, "code_hash": null, "entity": [["tile_f", "sp", [-1, 4, 1, 32]], ["tile_y", "sp", [-1, 1, 1, 7]], ["tile_x", "sp", [-1, 1, 1, 1]], ["auto_unroll_max_step", "ot", 0], ["unroll_explicit", "ot", 1]]}, "result": [[0.0010663888604651164, 0.0010668472170542633, 0.0010682636821705426], 0, 2.1451256275177, 1678950987.290224], "version": 0.2, "tvm_version": "0.10.0"}
{"input": ["cuda -keys=cuda,gpu -arch=sm_75 -max_num_threads=1024 -thread_warp_size=32", "depthwise_conv2d_nchw.cuda", [["TENSOR", [1, 512, 14, 14], "float32"], ["TENSOR", [512, 1, 3, 3], "float32"], [2, 2], [1, 1, 1, 1], [1, 1], "float32"], {}], "config": {"index": 19276, "code_hash": null, "entity": [["tile_f", "sp", [-1, 1, 1, 8]], ["tile_y", "sp", [-1, 1, 1, 7]], ["tile_x", "sp", [-1, 7, 1, 1]], ["auto_unroll_max_step", "ot", 1500], ["unroll_explicit", "ot", 1]]}, "result": [[0.00040927127735368955, 0.00040929931043256996, 0.0004093551424936387], 0, 6.913923501968384, 1678950988.5544283], "version": 0.2, "tvm_version": "0.10.0"}
{"input": ["cuda -keys=cuda,gpu -arch=sm_75 -max_num_threads=1024 -thread_warp_size=32", "depthwise_conv2d_nchw.cuda", [["TENSOR", [1, 512, 14, 14], "float32"], ["TENSOR", [512, 1, 3, 3], "float32"], [2, 2], [1, 1, 1, 1], [1, 1], "float32"], {}], "config": {"index": 2065, "code_hash": null, "entity": [["tile_f", "sp", [-1, 1, 16, 2]], ["tile_y", "sp", [-1, 7, 1, 1]], ["tile_x", "sp", [-1, 1, 7, 1]], ["auto_unroll_max_step", "ot", 0], ["unroll_explicit", "ot", 0]]}, "result": [[1.906273556962025e-05, 1.9063258987341772e-05, 1.9063838481012656e-05], 0, 1.5678982734680176, 1678950989.7447839], "version": 0.2, "tvm_version": "0.10.0"}
{"input": ["cuda -keys=cuda,gpu -arch=sm_75 -max_num_threads=1024 -thread_warp_size=32", "depthwise_conv2d_nchw.cuda", [["TENSOR", [1, 512, 14, 14], "float32"], ["TENSOR", [512, 1, 3, 3], "float32"], [2, 2], [1, 1, 1, 1], [1, 1], "float32"], {}], "config": {"index": 5280, "code_hash": null, "entity": [["tile_f", "sp", [-1, 1, 1, 1]], ["tile_y", "sp", [-1, 1, 1, 1]], ["tile_x", "sp", [-1, 1, 7, 1]], ["auto_unroll_max_step", "ot", 256], ["unroll_explicit", "ot", 0]]}, "result": [[2.536111610738255e-05, 2.536120822147651e-05, 2.53626572147651e-05], 0, 1.5475835800170898, 1678950990.9654012], "version": 0.2, "tvm_version": "0.10.0"}
{"input": ["cuda -keys=cuda,gpu -arch=sm_75 -max_num_threads=1024 -thread_warp_size=32", "depthwise_conv2d_nchw.cuda", [["TENSOR", [1, 512, 14, 14], "float32"], ["TENSOR", [512, 1, 3, 3], "float32"], [2, 2], [1, 1, 1, 1], [1, 1], "float32"], {}], "config": {"index": 2365, "code_hash": null, "entity": [["tile_f", "sp", [-1, 2, 1, 16]], ["tile_y", "sp", [-1, 1, 7, 1]], ["tile_x", "sp", [-1, 1, 7, 1]], ["auto_unroll_max_step", "ot", 0], ["unroll_explicit", "ot", 0]]}, "result": [[3.701843459392436e-05, 3.705318319900806e-05, 4.020862585244886e-05], 0, 1.858598232269287, 1678950996.5595956], "version": 0.2, "tvm_version": "0.10.0"}
{"input": ["cuda -keys=cuda,gpu -arch=sm_75 -max_num_threads=1024 -thread_warp_size=32", "depthwise_conv2d_nchw.cuda", [["TENSOR", [1, 512, 14, 14], "float32"], ["TENSOR", [512, 1, 3, 3], "float32"], [2, 2], [1, 1, 1, 1], [1, 1], "float32"], {}], "config": {"index": 8940, "code_hash": null, "entity": [["tile_f", "sp", [-1, 16, 1, 8]], ["tile_y", "sp", [-1, 1, 1, 1]], ["tile_x", "sp", [-1, 1, 7, 1]], ["auto_unroll_max_step", "ot", 1500], ["unroll_explicit", "ot", 0]]}, "result": [[0.00017379854098360656, 0.00017380602841530053, 0.00017380704590163934], 0, 5.6207380294799805, 1678950997.8203104], "version": 0.2, "tvm_version": "0.10.0"}
{"input": ["cuda -keys=cuda,gpu -arch=sm_75 -max_num_threads=1024 -thread_warp_size=32", "depthwise_conv2d_nchw.cuda", [["TENSOR", [1, 512, 14, 14], "float32"], ["TENSOR", [512, 1, 3, 3], "float32"], [2, 2], [1, 1, 1, 1], [1, 1], "float32"], {}], "config": {"index": 7539, "code_hash": null, "entity": [["tile_f", "sp", [-1, 16, 1, 2]], ["tile_y", "sp", [-1, 1, 7, 1]], ["tile_x", "sp", [-1, 1, 1, 1]], ["auto_unroll_max_step", "ot", 1500], ["unroll_explicit", "ot", 0]]}, "result": [[5.182178606638186e-05, 5.182416266841933e-05, 5.182554157081826e-05], 0, 2.5869297981262207, 1678950999.071231], "version": 0.2, "tvm_version": "0.10.0"}
{"input": ["cuda -keys=cuda,gpu -arch=sm_75 -max_num_threads=1024 -thread_warp_size=32", "depthwise_conv2d_nchw.cuda", [["TENSOR", [1, 512, 14, 14], "float32"], ["TENSOR", [512, 1, 3, 3], "float32"], [2, 2], [1, 1, 1, 1], [1, 1], "float32"], {}], "config": {"index": 3586, "code_hash": null, "entity": [["tile_f", "sp", [-1, 4, 2, 2]], ["tile_y", "sp", [-1, 1, 1, 1]], ["tile_x", "sp", [-1, 1, 1, 1]], ["auto_unroll_max_step", "ot", 256], ["unroll_explicit", "ot", 0]]}, "result": [[0.00010670007166778297, 0.00010671193703951776, 0.0001067201031480241], 0, 1.8582348823547363, 1678951000.3204002], "version": 0.2, "tvm_version": "0.10.0"}
{"input": ["cuda -keys=cuda,gpu -arch=sm_75 -max_num_threads=1024 -thread_warp_size=32", "depthwise_conv2d_nchw.cuda", [["TENSOR", [1, 512, 14, 14], "float32"], ["TENSOR", [512, 1, 3, 3], "float32"], [2, 2], [1, 1, 1, 1], [1, 1], "float32"], {}], "config": {"index": 13699, "code_hash": null, "entity": [["tile_f", "sp", [-1, 16, 1, 2]], ["tile_y", "sp", [-1, 1, 7, 1]], ["tile_x", "sp", [-1, 1, 1, 7]], ["auto_unroll_max_step", "ot", 0], ["unroll_explicit", "ot", 1]]}, "result": [[0.0003506688074398249, 0.0003507251684901532, 0.0003507475733041575], 0, 3.001427173614502, 1678951001.5758567], "version": 0.2, "tvm_version": "0.10.0"}
{"input": ["cuda -keys=cuda,gpu -arch=sm_75 -max_num_threads=1024 -thread_warp_size=32", "depthwise_conv2d_nchw.cuda", [["TENSOR", [1, 512, 14, 14], "float32"], ["TENSOR", [512, 1, 3, 3], "float32"], [2, 2], [1, 1, 1, 1], [1, 1], "float32"], {}], "config": {"index": 17905, "code_hash": null, "entity": [["tile_f", "sp", [-1, 1, 16, 2]], ["tile_y", "sp", [-1, 7, 1, 1]], ["tile_x", "sp", [-1, 1, 1, 1]], ["auto_unroll_max_step", "ot", 1500], ["unroll_explicit", "ot", 1]]}, "result": [[1.153524654491609e-05, 1.1536258308654164e-05, 1.1537393056926621e-05], 0, 2.359734296798706, 1678951002.6855488], "version": 0.2, "tvm_version": "0.10.0"}
{"input": ["cuda -keys=cuda,gpu -arch=sm_75 -max_num_threads=1024 -thread_warp_size=32", "depthwise_conv2d_nchw.cuda", [["TENSOR", [1, 512, 14, 14], "float32"], ["TENSOR", [512, 1, 3, 3], "float32"], [2, 2], [1, 1, 1, 1], [1, 1], "float32"], {}], "config": {"index": 12377, "code_hash": null, "entity": [["tile_f", "sp", [-1, 4, 1, 2]], ["tile_y", "sp", [-1, 1, 1, 1]], ["tile_x", "sp", [-1, 1, 7, 1]], ["auto_unroll_max_step", "ot", 0], ["unroll_explicit", "ot", 1]]}, "result": [[2.695027166400851e-05, 2.6950690767322348e-05, 2.6952085947191213e-05], 0, 1.5413587093353271, 1678951003.9078658], "version": 0.2, "tvm_version": "0.10.0"}
{"input": ["cuda -keys=cuda,gpu -arch=sm_75 -max_num_threads=1024 -thread_warp_size=32", "depthwise_conv2d_nchw.cuda", [["TENSOR", [1, 512, 14, 14], "float32"], ["TENSOR", [512, 1, 3, 3], "float32"], [2, 2], [1, 1, 1, 1], [1, 1], "float32"], {}], "config": {"index": 10814, "code_hash": null, "entity": [["tile_f", "sp", [-1, 1, 16, 1]], ["tile_y", "sp", [-1, 7, 1, 1]], ["tile_x", "sp", [-1, 1, 1, 1]], ["auto_unroll_max_step", "ot", 0], ["unroll_explicit", "ot", 1]]}, "result": [[1.3702198804929665e-05, 1.370224623428358e-05, 1.3773448524835055e-05], 0, 1.7013084888458252, 1678951024.6131222], "version": 0.2, "tvm_version": "0.10.0"}
{"input": ["cuda -keys=cuda,gpu -arch=sm_75 -max_num_threads=1024 -thread_warp_size=32", "depthwise_conv2d_nchw.cuda", [["TENSOR", [1, 512, 14, 14], "float32"], ["TENSOR", [512, 1, 3, 3], "float32"], [2, 2], [1, 1, 1, 1], [1, 1], "float32"], {}], "config": {"index": 254, "code_hash": null, "entity": [["tile_f", "sp", [-1, 1, 16, 1]], ["tile_y", "sp", [-1, 7, 1, 1]], ["tile_x", "sp", [-1, 1, 1, 1]], ["auto_unroll_max_step", "ot", 0], ["unroll_explicit", "ot", 0]]}, "result": [[1.3702247230107133e-05, 1.3703406922443e-05, 1.3703849830601592e-05], 0, 1.8885877132415771, 1678951025.839753], "version": 0.2, "tvm_version": "0.10.0"}
{"input": ["cuda -keys=cuda,gpu -arch=sm_75 -max_num_threads=1024 -thread_warp_size=32", "depthwise_conv2d_nchw.cuda", [["TENSOR", [1, 512, 14, 14], "float32"], ["TENSOR", [512, 1, 3, 3], "float32"], [2, 2], [1, 1, 1, 1], [1, 1], "float32"], {}], "config": {"index": 965, "code_hash": null, "entity": [["tile_f", "sp", [-1, 1, 16, 2]], ["tile_y", "sp", [-1, 1, 1, 1]], ["tile_x", "sp", [-1, 7, 1, 1]], ["auto_unroll_max_step", "ot", 0], ["unroll_explicit", "ot", 0]]}, "result": [[2.268279352827668e-05, 2.2683602048389488e-05, 2.26836450942556e-05], 0, 1.912632703781128, 1678951027.0809667], "version": 0.2, "tvm_version": "0.10.0"}
{"input": ["cuda -keys=cuda,gpu -arch=sm_75 -max_num_threads=1024 -thread_warp_size=32", "depthwise_conv2d_nchw.cuda", [["TENSOR", [1, 512, 14, 14], "float32"], ["TENSOR", [512, 1, 3, 3], "float32"], [2, 2], [1, 1, 1, 1], [1, 1], "float32"], {}], "config": {"index": 305, "code_hash": null, "entity": [["tile_f", "sp", [-1, 1, 16, 2]], ["tile_y", "sp", [-1, 7, 1, 1]], ["tile_x", "sp", [-1, 1, 1, 1]], ["auto_unroll_max_step", "ot", 0], ["unroll_explicit", "ot", 0]]}, "result": [[2.1741082644628097e-05, 2.1741419635223712e-05, 2.1742380592761472e-05], 0, 1.8809447288513184, 1678951028.3188775], "version": 0.2, "tvm_version": "0.10.0"}
{"input": ["cuda -keys=cuda,gpu -arch=sm_75 -max_num_threads=1024 -thread_warp_size=32", "depthwise_conv2d_nchw.cuda", [["TENSOR", [1, 512, 14, 14], "float32"], ["TENSOR", [512, 1, 3, 3], "float32"], [2, 2], [1, 1, 1, 1], [1, 1], "float32"], {}], "config": {"index": 11525, "code_hash": null, "entity": [["tile_f", "sp", [-1, 1, 16, 2]], ["tile_y", "sp", [-1, 1, 1, 1]], ["tile_x", "sp", [-1, 7, 1, 1]], ["auto_unroll_max_step", "ot", 0], ["unroll_explicit", "ot", 1]]}, "result": [[2.2682704233662783e-05, 2.268408629591385e-05, 2.2684214485912373e-05], 0, 1.8984887599945068, 1678951029.5587032], "version": 0.2, "tvm_version": "0.10.0"}
{"input": ["cuda -keys=cuda,gpu -arch=sm_75 -max_num_threads=1024 -thread_warp_size=32", "depthwise_conv2d_nchw.cuda", [["TENSOR", [1, 512, 14, 14], "float32"], ["TENSOR", [512, 1, 3, 3], "float32"], [2, 2], [1, 1, 1, 1], [1, 1], "float32"], {}], "config": {"index": 10865, "code_hash": null, "entity": [["tile_f", "sp", [-1, 1, 16, 2]], ["tile_y", "sp", [-1, 7, 1, 1]], ["tile_x", "sp", [-1, 1, 1, 1]], ["auto_unroll_max_step", "ot", 0], ["unroll_explicit", "ot", 1]]}, "result": [[2.174153927998834e-05, 2.1741895059029298e-05, 2.1742384346305202e-05], 0, 1.9373044967651367, 1678951030.7614484], "version": 0.2, "tvm_version": "0.10.0"}
{"input": ["cuda -keys=cuda,gpu -arch=sm_75 -max_num_threads=1024 -thread_warp_size=32", "depthwise_conv2d_nchw.cuda", [["TENSOR", [1, 512, 14, 14], "float32"], ["TENSOR", [512, 1, 3, 3], "float32"], [2, 2], [1, 1, 1, 1], [1, 1], "float32"], {}], "config": {"index": 3774, "code_hash": null, "entity": [["tile_f", "sp", [-1, 1, 16, 1]], ["tile_y", "sp", [-1, 7, 1, 1]], ["tile_x", "sp", [-1, 1, 1, 1]], ["auto_unroll_max_step", "ot", 256], ["unroll_explicit", "ot", 0]]}, "result": [[1.3779528122452677e-05, 1.3780642061407481e-05, 1.378066832714428e-05], 0, 1.9840970039367676, 1678951031.993714], "version": 0.2, "tvm_version": "0.10.0"}
{"input": ["cuda -keys=cuda,gpu -arch=sm_75 -max_num_threads=1024 -thread_warp_size=32", "depthwise_conv2d_nchw.cuda", [["TENSOR", [1, 512, 14, 14], "float32"], ["TENSOR", [512, 1, 3, 3], "float32"], [2, 2], [1, 1, 1, 1], [1, 1], "float32"], {}], "config": {"index": 14334, "code_hash": null, "entity": [["tile_f", "sp", [-1, 1, 16, 1]], ["tile_y", "sp", [-1, 7, 1, 1]], ["tile_x", "sp", [-1, 1, 1, 1]], ["auto_unroll_max_step", "ot", 256], ["unroll_explicit", "ot", 1]]}, "result": [[1.0337472717733474e-05, 1.0340542347474142e-05, 1.0341657397691502e-05], 0, 2.0666191577911377, 1678951033.100851], "version": 0.2, "tvm_version": "0.10.0"}
{"input": ["cuda -keys=cuda,gpu -arch=sm_75 -max_num_threads=1024 -thread_warp_size=32", "depthwise_conv2d_nchw.cuda", [["TENSOR", [1, 512, 14, 14], "float32"], ["TENSOR", [512, 1, 3, 3], "float32"], [2, 2], [1, 1, 1, 1], [1, 1], "float32"], {}], "config": {"index": 914, "code_hash": null, "entity": [["tile_f", "sp", [-1, 1, 16, 1]], ["tile_y", "sp", [-1, 1, 1, 1]], ["tile_x", "sp", [-1, 7, 1, 1]], ["auto_unroll_max_step", "ot", 0], ["unroll_explicit", "ot", 0]]}, "result": [[1.3478912724230875e-05, 1.3479455897388233e-05, 1.3479480063202899e-05], 0, 1.875661849975586, 1678951034.3005333], "version": 0.2, "tvm_version": "0.10.0"}
{"input": ["cuda -keys=cuda,gpu -arch=sm_75 -max_num_threads=1024 -thread_warp_size=32", "depthwise_conv2d_nchw.cuda", [["TENSOR", [1, 512, 14, 14], "float32"], ["TENSOR", [512, 1, 3, 3], "float32"], [2, 2], [1, 1, 1, 1], [1, 1], "float32"], {}], "config": {"index": 11474, "code_hash": null, "entity": [["tile_f", "sp", [-1, 1, 16, 1]], ["tile_y", "sp", [-1, 1, 1, 1]], ["tile_x", "sp", [-1, 7, 1, 1]], ["auto_unroll_max_step", "ot", 0], ["unroll_explicit", "ot", 1]]}, "result": [[1.3478821743570698e-05, 1.3479076687401354e-05, 1.3479748212793613e-05], 0, 1.8441574573516846, 1678951035.4818134], "version": 0.2, "tvm_version": "0.10.0"}
{"input": ["cuda -keys=cuda,gpu -arch=sm_75 -max_num_threads=1024 -thread_warp_size=32", "depthwise_conv2d_nchw.cuda", [["TENSOR", [1, 512, 14, 14], "float32"], ["TENSOR", [512, 1, 3, 3], "float32"], [2, 2], [1, 1, 1, 1], [1, 1], "float32"], {}], "config": {"index": 4485, "code_hash": null, "entity": [["tile_f", "sp", [-1, 1, 16, 2]], ["tile_y", "sp", [-1, 1, 1, 1]], ["tile_x", "sp", [-1, 7, 1, 1]], ["auto_unroll_max_step", "ot", 256], ["unroll_explicit", "ot", 0]]}, "result": [[2.2814374102870815e-05, 2.281737888755981e-05, 2.2817990281100477e-05], 0, 2.164501190185547, 1678951036.7200918], "version": 0.2, "tvm_version": "0.10.0"}
{"input": ["cuda -keys=cuda,gpu -arch=sm_75 -max_num_threads=1024 -thread_warp_size=32", "depthwise_conv2d_nchw.cuda", [["TENSOR", [1, 512, 14, 14], "float32"], ["TENSOR", [512, 1, 3, 3], "float32"], [2, 2], [1, 1, 1, 1], [1, 1], "float32"], {}], "config": {"index": 3825, "code_hash": null, "entity": [["tile_f", "sp", [-1, 1, 16, 2]], ["tile_y", "sp", [-1, 7, 1, 1]], ["tile_x", "sp", [-1, 1, 1, 1]], ["auto_unroll_max_step", "ot", 256], ["unroll_explicit", "ot", 0]]}, "result": [[2.254055851528384e-05, 2.2541116011644837e-05, 2.2541713537117904e-05], 0, 2.0988008975982666, 1678951037.9171176], "version": 0.2, "tvm_version": "0.10.0"}
{"input": ["cuda -keys=cuda,gpu -arch=sm_75 -max_num_threads=1024 -thread_warp_size=32", "depthwise_conv2d_nchw.cuda", [["TENSOR", [1, 512, 14, 14], "float32"], ["TENSOR", [512, 1, 3, 3], "float32"], [2, 2], [1, 1, 1, 1], [1, 1], "float32"], {}], "config": {"index": 15045, "code_hash": null, "entity": [["tile_f", "sp", [-1, 1, 16, 2]], ["tile_y", "sp", [-1, 1, 1, 1]], ["tile_x", "sp", [-1, 7, 1, 1]], ["auto_unroll_max_step", "ot", 256], ["unroll_explicit", "ot", 1]]}, "result": [[1.0831481646936192e-05, 1.0832417764872311e-05, 1.0833021070657435e-05], 0, 2.716020345687866, 1678951039.1198535], "version": 0.2, "tvm_version": "0.10.0"}
{"input": ["cuda -keys=cuda,gpu -arch=sm_75 -max_num_threads=1024 -thread_warp_size=32", "depthwise_conv2d_nchw.cuda", [["TENSOR", [1, 512, 14, 14], "float32"], ["TENSOR", [512, 1, 3, 3], "float32"], [2, 2], [1, 1, 1, 1], [1, 1], "float32"], {}], "config": {"index": 85, "code_hash": null, "entity": [["tile_f", "sp", [-1, 1, 16, 2]], ["tile_y", "sp", [-1, 1, 1, 1]], ["tile_x", "sp", [-1, 1, 1, 1]], ["auto_unroll_max_step", "ot", 0], ["unroll_explicit", "ot", 0]]}, "result": [[1.9469122643912383e-05, 1.9470341059602647e-05, 1.9470605323484464e-05], 0, 1.8190832138061523, 1678951040.3102314], "version": 0.2, "tvm_version": "0.10.0"}
{"input": ["cuda -keys=cuda,gpu -arch=sm_75 -max_num_threads=1024 -thread_warp_size=32", "depthwise_conv2d_nchw.cuda", [["TENSOR", [1, 512, 14, 14], "float32"], ["TENSOR", [512, 1, 3, 3], "float32"], [2, 2], [1, 1, 1, 1], [1, 1], "float32"], {}], "config": {"index": 14385, "code_hash": null, "entity": [["tile_f", "sp", [-1, 1, 16, 2]], ["tile_y", "sp", [-1, 7, 1, 1]], ["tile_x", "sp", [-1, 1, 1, 1]], ["auto_unroll_max_step", "ot", 256], ["unroll_explicit", "ot", 1]]}, "result": [[1.1531350921604304e-05, 1.153222118503283e-05, 1.1535238905149909e-05], 0, 2.6140856742858887, 1678951041.5167167], "version": 0.2, "tvm_version": "0.10.0"}
{"input": ["cuda -keys=cuda,gpu -arch=sm_75 -max_num_threads=1024 -thread_warp_size=32", "depthwise_conv2d_nchw.cuda", [["TENSOR", [1, 512, 14, 14], "float32"], ["TENSOR", [512, 1, 3, 3], "float32"], [2, 2], [1, 1, 1, 1], [1, 1], "float32"], {}], "config": {"index": 14994, "code_hash": null, "entity": [["tile_f", "sp", [-1, 1, 16, 1]], ["tile_y", "sp", [-1, 1, 1, 1]], ["tile_x", "sp", [-1, 7, 1, 1]], ["auto_unroll_max_step", "ot", 256], ["unroll_explicit", "ot", 1]]}, "result": [[9.334403359696712e-06, 9.33547454081966e-06, 9.335652068762665e-06], 0, 2.214555501937866, 1678951042.6998653], "version": 0.2, "tvm_version": "0.10.0"}
{"input": ["cuda -keys=cuda,gpu -arch=sm_75 -max_num_threads=1024 -thread_warp_size=32", "depthwise_conv2d_nchw.cuda", [["TENSOR", [1, 512, 14, 14], "float32"], ["TENSOR", [512, 1, 3, 3], "float32"], [2, 2], [1, 1, 1, 1], [1, 1], "float32"], {}], "config": {"index": 4434, "code_hash": null, "entity": [["tile_f", "sp", [-1, 1, 16, 1]], ["tile_y", "sp", [-1, 1, 1, 1]], ["tile_x", "sp", [-1, 7, 1, 1]], ["auto_unroll_max_step", "ot", 256], ["unroll_explicit", "ot", 0]]}, "result": [[1.3449360952550838e-05, 1.3451256689261508e-05, 1.3452466553692474e-05], 0, 1.9495787620544434, 1678951045.3601692], "version": 0.2, "tvm_version": "0.10.0"}
{"input": ["cuda -keys=cuda,gpu -arch=sm_75 -max_num_threads=1024 -thread_warp_size=32", "depthwise_conv2d_nchw.cuda", [["TENSOR", [1, 512, 14, 14], "float32"], ["TENSOR", [512, 1, 3, 3], "float32"], [2, 2], [1, 1, 1, 1], [1, 1], "float32"], {}], "config": {"index": 960, "code_hash": null, "entity": [["tile_f", "sp", [-1, 2, 8, 2]], ["tile_y", "sp", [-1, 1, 1, 1]], ["tile_x", "sp", [-1, 7, 1, 1]], ["auto_unroll_max_step", "ot", 0], ["unroll_explicit", "ot", 0]]}, "result": [[3.7252962304409675e-05, 3.725440208629683e-05, 3.7256033665244194e-05], 0, 2.095404624938965, 1678951046.609292], "version": 0.2, "tvm_version": "0.10.0"}
{"input": ["cuda -keys=cuda,gpu -arch=sm_75 -max_num_threads=1024 -thread_warp_size=32", "depthwise_conv2d_nchw.cuda", [["TENSOR", [1, 512, 14, 14], "float32"], ["TENSOR", [512, 1, 3, 3], "float32"], [2, 2], [1, 1, 1, 1], [1, 1], "float32"], {}], "config": {"index": 959, "code_hash": null, "entity": [["tile_f", "sp", [-1, 1, 8, 2]], ["tile_y", "sp", [-1, 1, 1, 1]], ["tile_x", "sp", [-1, 7, 1, 1]], ["auto_unroll_max_step", "ot", 0], ["unroll_explicit", "ot", 0]]}, "result": [[2.176049612839645e-05, 2.1762291989300295e-05, 2.1762517527805152e-05], 0, 1.9794871807098389, 1678951047.8204331], "version": 0.2, "tvm_version": "0.10.0"}
{"input": ["cuda -keys=cuda,gpu -arch=sm_75 -max_num_threads=1024 -thread_warp_size=32", "depthwise_conv2d_nchw.cuda", [["TENSOR", [1, 512, 14, 14], "float32"], ["TENSOR", [512, 1, 3, 3], "float32"], [2, 2], [1, 1, 1, 1], [1, 1], "float32"], {}], "config": {"index": 11519, "code_hash": null, "entity": [["tile_f", "sp", [-1, 1, 8, 2]], ["tile_y", "sp", [-1, 1, 1, 1]], ["tile_x", "sp", [-1, 7, 1, 1]], ["auto_unroll_max_step", "ot", 0], ["unroll_explicit", "ot", 1]]}, "result": [[2.1761478479196555e-05, 2.1761767431850792e-05, 2.176228192252511e-05], 0, 1.9590446949005127, 1678951049.0508041], "version": 0.2, "tvm_version": "0.10.0"}
{"input": ["cuda -keys=cuda,gpu -arch=sm_75 -max_num_threads=1024 -thread_warp_size=32", "depthwise_conv2d_nchw.cuda", [["TENSOR", [1, 512, 14, 14], "float32"], ["TENSOR", [512, 1, 3, 3], "float32"], [2, 2], [1, 1, 1, 1], [1, 1], "float32"], {}], "config": {"index": 260, "code_hash": null, "entity": [["tile_f", "sp", [-1, 1, 32, 1]], ["tile_y", "sp", [-1, 7, 1, 1]], ["tile_x", "sp", [-1, 1, 1, 1]], ["auto_unroll_max_step", "ot", 0], ["unroll_explicit", "ot", 0]]}, "result": [[1.5033303159173756e-05, 1.5035551235317943e-05, 1.503587869582827e-05], 0, 1.9014136791229248, 1678951050.247416], "version": 0.2, "tvm_version": "0.10.0"}
{"input": ["cuda -keys=cuda,gpu -arch=sm_75 -max_num_threads=1024 -thread_warp_size=32", "depthwise_conv2d_nchw.cuda", [["TENSOR", [1, 512, 14, 14], "float32"], ["TENSOR", [512, 1, 3, 3], "float32"], [2, 2], [1, 1, 1, 1], [1, 1], "float32"], {}], "config": {"index": 10645, "code_hash": null, "entity": [["tile_f", "sp", [-1, 1, 16, 2]], ["tile_y", "sp", [-1, 1, 1, 1]], ["tile_x", "sp", [-1, 1, 1, 1]], ["auto_unroll_max_step", "ot", 0], ["unroll_explicit", "ot", 1]]}, "result": [[1.947218135192004e-05, 1.9473156628090477e-05, 1.9474340478695422e-05], 0, 1.9361498355865479, 1678951051.4581876], "version": 0.2, "tvm_version": "0.10.0"}
{"input": ["cuda -keys=cuda,gpu -arch=sm_75 -max_num_threads=1024 -thread_warp_size=32", "depthwise_conv2d_nchw.cuda", [["TENSOR", [1, 512, 14, 14], "float32"], ["TENSOR", [512, 1, 3, 3], "float32"], [2, 2], [1, 1, 1, 1], [1, 1], "float32"], {}], "config": {"index": 3605, "code_hash": null, "entity": [["tile_f", "sp", [-1, 1, 16, 2]], ["tile_y", "sp", [-1, 1, 1, 1]], ["tile_x", "sp", [-1, 1, 1, 1]], ["auto_unroll_max_step", "ot", 256], ["unroll_explicit", "ot", 0]]}, "result": [[2.0294348728246315e-05, 2.0294863453815262e-05, 2.0294910441767067e-05], 0, 1.9543089866638184, 1678951052.6899264], "version": 0.2, "tvm_version": "0.10.0"}
{"input": ["cuda -keys=cuda,gpu -arch=sm_75 -max_num_threads=1024 -thread_warp_size=32", "depthwise_conv2d_nchw.cuda", [["TENSOR", [1, 512, 14, 14], "float32"], ["TENSOR", [512, 1, 3, 3], "float32"], [2, 2], [1, 1, 1, 1], [1, 1], "float32"], {}], "config": {"index": 11520, "code_hash": null, "entity": [["tile_f", "sp", [-1, 2, 8, 2]], ["tile_y", "sp", [-1, 1, 1, 1]], ["tile_x", "sp", [-1, 7, 1, 1]], ["auto_unroll_max_step", "ot", 0], ["unroll_explicit", "ot", 1]]}, "result": [[3.7255223577235774e-05, 3.7257245098039215e-05, 3.725727427068388e-05], 0, 2.1077394485473633, 1678951053.9472842], "version": 0.2, "tvm_version": "0.10.0"}
{"input": ["cuda -keys=cuda,gpu -arch=sm_75 -max_num_threads=1024 -thread_warp_size=32", "depthwise_conv2d_nchw.cuda", [["TENSOR", [1, 512, 14, 14], "float32"], ["TENSOR", [512, 1, 3, 3], "float32"], [2, 2], [1, 1, 1, 1], [1, 1], "float32"], {}], "config": {"index": 10820, "code_hash": null, "entity": [["tile_f", "sp", [-1, 1, 32, 1]], ["tile_y", "sp", [-1, 7, 1, 1]], ["tile_x", "sp", [-1, 1, 1, 1]], ["auto_unroll_max_step", "ot", 0], ["unroll_explicit", "ot", 1]]}, "result": [[1.5031192772297163e-05, 1.5031586068049126e-05, 1.5033189651701229e-05], 0, 1.8638744354248047, 1678951055.128496], "version": 0.2, "tvm_version": "0.10.0"}
{"input": ["cuda -keys=cuda,gpu -arch=sm_75 -max_num_threads=1024 -thread_warp_size=32", "depthwise_conv2d_nchw.cuda", [["TENSOR", [1, 512, 14, 14], "float32"], ["TENSOR", [512, 1, 3, 3], "float32"], [2, 2], [1, 1, 1, 1], [1, 1], "float32"], {}], "config": {"index": 10594, "code_hash": null, "entity": [["tile_f", "sp", [-1, 1, 16, 1]], ["tile_y", "sp", [-1, 1, 1, 1]], ["tile_x", "sp", [-1, 1, 1, 1]], ["auto_unroll_max_step", "ot", 0], ["unroll_explicit", "ot", 1]]}, "result": [[1.8703374422380416e-05, 1.8704525415261645e-05, 1.8705217184963158e-05], 0, 1.8287675380706787, 1678951056.305617], "version": 0.2, "tvm_version": "0.10.0"}
{"input": ["cuda -keys=cuda,gpu -arch=sm_75 -max_num_threads=1024 -thread_warp_size=32", "depthwise_conv2d_nchw.cuda", [["TENSOR", [1, 512, 14, 14], "float32"], ["TENSOR", [512, 1, 3, 3], "float32"], [2, 2], [1, 1, 1, 1], [1, 1], "float32"], {}], "config": {"index": 34, "code_hash": null, "entity": [["tile_f", "sp", [-1, 1, 16, 1]], ["tile_y", "sp", [-1, 1, 1, 1]], ["tile_x", "sp", [-1, 1, 1, 1]], ["auto_unroll_max_step", "ot", 0], ["unroll_explicit", "ot", 0]]}, "result": [[1.8703782228419317e-05, 1.8704842185321335e-05, 1.870544555710483e-05], 0, 1.841872215270996, 1678951057.5145404], "version": 0.2, "tvm_version": "0.10.0"}
{"input": ["cuda -keys=cuda,gpu -arch=sm_75 -max_num_threads=1024 -thread_warp_size=32", "depthwise_conv2d_nchw.cuda", [["TENSOR", [1, 512, 14, 14], "float32"], ["TENSOR", [512, 1, 3, 3], "float32"], [2, 2], [1, 1, 1, 1], [1, 1], "float32"], {}], "config": {"index": 4480, "code_hash": null, "entity": [["tile_f", "sp", [-1, 2, 8, 2]], ["tile_y", "sp", [-1, 1, 1, 1]], ["tile_x", "sp", [-1, 7, 1, 1]], ["auto_unroll_max_step", "ot", 256], ["unroll_explicit", "ot", 0]]}, "result": [[3.844437025316456e-05, 3.844985272638754e-05, 3.844993816942551e-05], 0, 2.5537405014038086, 1678951058.783061], "version": 0.2, "tvm_version": "0.10.0"}
{"input": ["cuda -keys=cuda,gpu -arch=sm_75 -max_num_threads=1024 -thread_warp_size=32", "depthwise_conv2d_nchw.cuda", [["TENSOR", [1, 512, 14, 14], "float32"], ["TENSOR", [512, 1, 3, 3], "float32"], [2, 2], [1, 1, 1, 1], [1, 1], "float32"], {}], "config": {"index": 15039, "code_hash": null, "entity": [["tile_f", "sp", [-1, 1, 8, 2]], ["tile_y", "sp", [-1, 1, 1, 1]], ["tile_x", "sp", [-1, 7, 1, 1]], ["auto_unroll_max_step", "ot", 256], ["unroll_explicit", "ot", 1]]}, "result": [[1.0258099547511313e-05, 1.025949554581448e-05, 1.026031440893665e-05], 0, 2.4558486938476562, 1678951059.8976512], "version": 0.2, "tvm_version": "0.10.0"}
{"input": ["cuda -keys=cuda,gpu -arch=sm_75 -max_num_threads=1024 -thread_warp_size=32", "depthwise_conv2d_nchw.cuda", [["TENSOR", [1, 512, 14, 14], "float32"], ["TENSOR", [512, 1, 3, 3], "float32"], [2, 2], [1, 1, 1, 1], [1, 1], "float32"], {}], "config": {"index": 4479, "code_hash": null, "entity": [["tile_f", "sp", [-1, 1, 8, 2]], ["tile_y", "sp", [-1, 1, 1, 1]], ["tile_x", "sp", [-1, 7, 1, 1]], ["auto_unroll_max_step", "ot", 256], ["unroll_explicit", "ot", 0]]}, "result": [[2.1708580189345768e-05, 2.1708823795393523e-05, 2.1709356365691674e-05], 0, 2.105548143386841, 1678951061.0868597], "version": 0.2, "tvm_version": "0.10.0"}
{"input": ["cuda -keys=cuda,gpu -arch=sm_75 -max_num_threads=1024 -thread_warp_size=32", "depthwise_conv2d_nchw.cuda", [["TENSOR", [1, 512, 14, 14], "float32"], ["TENSOR", [512, 1, 3, 3], "float32"], [2, 2], [1, 1, 1, 1], [1, 1], "float32"], {}], "config": {"index": 3780, "code_hash": null, "entity": [["tile_f", "sp", [-1, 1, 32, 1]], ["tile_y", "sp", [-1, 7, 1, 1]], ["tile_x", "sp", [-1, 1, 1, 1]], ["auto_unroll_max_step", "ot", 256], ["unroll_explicit", "ot", 0]]}, "result": [[1.5168861684892669e-05, 1.5169218610773593e-05, 1.5169309740785744e-05], 0, 1.951507329940796, 1678951062.2797036], "version": 0.2, "tvm_version": "0.10.0"}
{"input": ["cuda -keys=cuda,gpu -arch=sm_75 -max_num_threads=1024 -thread_warp_size=32", "depthwise_conv2d_nchw.cuda", [["TENSOR", [1, 512, 14, 14], "float32"], ["TENSOR", [512, 1, 3, 3], "float32"], [2, 2], [1, 1, 1, 1], [1, 1], "float32"], {}], "config": {"index": 1845, "code_hash": null, "entity": [["tile_f", "sp", [-1, 1, 16, 2]], ["tile_y", "sp", [-1, 1, 1, 1]], ["tile_x", "sp", [-1, 1, 7, 1]], ["auto_unroll_max_step", "ot", 0], ["unroll_explicit", "ot", 0]]}, "result": [[7.581419906023067e-06, 7.582087996582657e-06, 7.582236330627937e-06], 0, 1.8115124702453613, 1678951063.412559], "version": 0.2, "tvm_version": "0.10.0"}
{"input": ["cuda -keys=cuda,gpu -arch=sm_75 -max_num_threads=1024 -thread_warp_size=32", "depthwise_conv2d_nchw.cuda", [["TENSOR", [1, 512, 14, 14], "float32"], ["TENSOR", [512, 1, 3, 3], "float32"], [2, 2], [1, 1, 1, 1], [1, 1], "float32"], {}], "config": {"index": 14165, "code_hash": null, "entity": [["tile_f", "sp", [-1, 1, 16, 2]], ["tile_y", "sp", [-1, 1, 1, 1]], ["tile_x", "sp", [-1, 1, 1, 1]], ["auto_unroll_max_step", "ot", 256], ["unroll_explicit", "ot", 1]]}, "result": [[1.974927494654312e-05, 1.9751959907341413e-05, 1.9839544369208837e-05], 0, 1.8469390869140625, 1678951067.5164444], "version": 0.2, "tvm_version": "0.10.0"}
{"input": ["cuda -keys=cuda,gpu -arch=sm_75 -max_num_threads=1024 -thread_warp_size=32", "depthwise_conv2d_nchw.cuda", [["TENSOR", [1, 512, 14, 14], "float32"], ["TENSOR", [512, 1, 3, 3], "float32"], [2, 2], [1, 1, 1, 1], [1, 1], "float32"], {}], "config": {"index": 10859, "code_hash": null, "entity": [["tile_f", "sp", [-1, 1, 8, 2]], ["tile_y", "sp", [-1, 7, 1, 1]], ["tile_x", "sp", [-1, 1, 1, 1]], ["auto_unroll_max_step", "ot", 0], ["unroll_explicit", "ot", 1]]}, "result": [[2.2695748122559326e-05, 2.269604145389006e-05, 2.2697916191048365e-05], 0, 1.9418730735778809, 1678951068.7307072], "version": 0.2, "tvm_version": "0.10.0"}
{"input": ["cuda -keys=cuda,gpu -arch=sm_75 -max_num_threads=1024 -thread_warp_size=32", "depthwise_conv2d_nchw.cuda", [["TENSOR", [1, 512, 14, 14], "float32"], ["TENSOR", [512, 1, 3, 3], "float32"], [2, 2], [1, 1, 1, 1], [1, 1], "float32"], {}], "config": {"index": 299, "code_hash": null, "entity": [["tile_f", "sp", [-1, 1, 8, 2]], ["tile_y", "sp", [-1, 7, 1, 1]], ["tile_x", "sp", [-1, 1, 1, 1]], ["auto_unroll_max_step", "ot", 0], ["unroll_explicit", "ot", 0]]}, "result": [[2.2693351138353763e-05, 2.269504801517805e-05, 2.2698522037361353e-05], 0, 1.9489364624023438, 1678951069.9590385], "version": 0.2, "tvm_version": "0.10.0"}
{"input": ["cuda -keys=cuda,gpu -arch=sm_75 -max_num_threads=1024 -thread_warp_size=32", "depthwise_conv2d_nchw.cuda", [["TENSOR", [1, 512, 14, 14], "float32"], ["TENSOR", [512, 1, 3, 3], "float32"], [2, 2], [1, 1, 1, 1], [1, 1], "float32"], {}], "config": {"index": 80, "code_hash": null, "entity": [["tile_f", "sp", [-1, 2, 8, 2]], ["tile_y", "sp", [-1, 1, 1, 1]], ["tile_x", "sp", [-1, 1, 1, 1]], ["auto_unroll_max_step", "ot", 0], ["unroll_explicit", "ot", 0]]}, "result": [[3.4667742192691025e-05, 3.4667779401993356e-05, 3.466834042081949e-05], 0, 1.9649221897125244, 1678951071.2182972], "version": 0.2, "tvm_version": "0.10.0"}
{"input": ["cuda -keys=cuda,gpu -arch=sm_75 -max_num_threads=1024 -thread_warp_size=32", "depthwise_conv2d_nchw.cuda", [["TENSOR", [1, 512, 14, 14], "float32"], ["TENSOR", [512, 1, 3, 3], "float32"], [2, 2], [1, 1, 1, 1], [1, 1], "float32"], {}], "config": {"index": 300, "code_hash": null, "entity": [["tile_f", "sp", [-1, 2, 8, 2]], ["tile_y", "sp", [-1, 7, 1, 1]], ["tile_x", "sp", [-1, 1, 1, 1]], ["auto_unroll_max_step", "ot", 0], ["unroll_explicit", "ot", 0]]}, "result": [[3.815655049019608e-05, 3.815706642156863e-05, 3.815741053921569e-05], 0, 2.108201265335083, 1678951072.470589], "version": 0.2, "tvm_version": "0.10.0"}
{"input": ["cuda -keys=cuda,gpu -arch=sm_75 -max_num_threads=1024 -thread_warp_size=32", "depthwise_conv2d_nchw.cuda", [["TENSOR", [1, 512, 14, 14], "float32"], ["TENSOR", [512, 1, 3, 3], "float32"], [2, 2], [1, 1, 1, 1], [1, 1], "float32"], {}], "config": {"index": 255, "code_hash": null, "entity": [["tile_f", "sp", [-1, 2, 16, 1]], ["tile_y", "sp", [-1, 7, 1, 1]], ["tile_x", "sp", [-1, 1, 1, 1]], ["auto_unroll_max_step", "ot", 0], ["unroll_explicit", "ot", 0]]}, "result": [[2.1994678792235802e-05, 2.1995949101365925e-05, 2.19975046728972e-05], 0, 1.9235928058624268, 1678951073.678596], "version": 0.2, "tvm_version": "0.10.0"}
{"input": ["cuda -keys=cuda,gpu -arch=sm_75 -max_num_threads=1024 -thread_warp_size=32", "depthwise_conv2d_nchw.cuda", [["TENSOR", [1, 512, 14, 14], "float32"], ["TENSOR", [512, 1, 3, 3], "float32"], [2, 2], [1, 1, 1, 1], [1, 1], "float32"], {}], "config": {"index": 11468, "code_hash": null, "entity": [["tile_f", "sp", [-1, 2, 8, 1]], ["tile_y", "sp", [-1, 1, 1, 1]], ["tile_x", "sp", [-1, 7, 1, 1]], ["auto_unroll_max_step", "ot", 0], ["unroll_explicit", "ot", 1]]}, "result": [[2.2804382086851627e-05, 2.2804980398069962e-05, 2.2805306996381183e-05], 0, 1.947995662689209, 1678951074.90795], "version": 0.2, "tvm_version": "0.10.0"}
{"input": ["cuda -keys=cuda,gpu -arch=sm_75 -max_num_threads=1024 -thread_warp_size=32", "depthwise_conv2d_nchw.cuda", [["TENSOR", [1, 512, 14, 14], "float32"], ["TENSOR", [512, 1, 3, 3], "float32"], [2, 2], [1, 1, 1, 1], [1, 1], "float32"], {}], "config": {"index": 908, "code_hash": null, "entity": [["tile_f", "sp", [-1, 2, 8, 1]], ["tile_y", "sp", [-1, 1, 1, 1]], ["tile_x", "sp", [-1, 7, 1, 1]], ["auto_unroll_max_step", "ot", 0], ["unroll_explicit", "ot", 0]]}, "result": [[2.28031939870071e-05, 2.2803885632270738e-05, 2.2807654781689078e-05], 0, 1.9175825119018555, 1678951076.0726159], "version": 0.2, "tvm_version": "0.10.0"}
{"input": ["cuda -keys=cuda,gpu -arch=sm_75 -max_num_threads=1024 -thread_warp_size=32", "depthwise_conv2d_nchw.cuda", [["TENSOR", [1, 512, 14, 14], "float32"], ["TENSOR", [512, 1, 3, 3], "float32"], [2, 2], [1, 1, 1, 1], [1, 1], "float32"], {}], "config": {"index": 15040, "code_hash": null, "entity": [["tile_f", "sp", [-1, 2, 8, 2]], ["tile_y", "sp", [-1, 1, 1, 1]], ["tile_x", "sp", [-1, 7, 1, 1]], ["auto_unroll_max_step", "ot", 256], ["unroll_explicit", "ot", 1]]}, "result": [[1.0637945705967979e-05, 1.06380134643377e-05, 1.0639015138282386e-05], 0, 4.118349313735962, 1678951077.2580369], "version": 0.2, "tvm_version": "0.10.0"}
{"input": ["cuda -keys=cuda,gpu -arch=sm_75 -max_num_threads=1024 -thread_warp_size=32", "depthwise_conv2d_nchw.cuda", [["TENSOR", [1, 512, 14, 14], "float32"], ["TENSOR", [512, 1, 3, 3], "float32"], [2, 2], [1, 1, 1, 1], [1, 1], "float32"], {}], "config": {"index": 12354, "code_hash": null, "entity": [["tile_f", "sp", [-1, 1, 16, 1]], ["tile_y", "sp", [-1, 1, 1, 1]], ["tile_x", "sp", [-1, 1, 7, 1]], ["auto_unroll_max_step", "ot", 0], ["unroll_explicit", "ot", 1]]}, "result": [[7.363836941598902e-06, 7.364006125250819e-06, 7.364218872108986e-06], 0, 1.785222053527832, 1678951078.3739908], "version": 0.2, "tvm_version": "0.10.0"}
{"input": ["cuda -keys=cuda,gpu -arch=sm_75 -max_num_threads=1024 -thread_warp_size=32", "depthwise_conv2d_nchw.cuda", [["TENSOR", [1, 512, 14, 14], "float32"], ["TENSOR", [512, 1, 3, 3], "float32"], [2, 2], [1, 1, 1, 1], [1, 1], "float32"], {}], "config": {"index": 1794, "code_hash": null, "entity": [["tile_f", "sp", [-1, 1, 16, 1]], ["tile_y", "sp", [-1, 1, 1, 1]], ["tile_x", "sp", [-1, 1, 7, 1]], ["auto_unroll_max_step", "ot", 0], ["unroll_explicit", "ot", 0]]}, "result": [[7.363815363735071e-06, 7.363929695982628e-06, 7.364207166123779e-06], 0, 1.7535200119018555, 1678951079.4679787], "version": 0.2, "tvm_version": "0.10.0"}
{"input": ["cuda -keys=cuda,gpu -arch=sm_75 -max_num_threads=1024 -thread_warp_size=32", "depthwise_conv2d_nchw.cuda", [["TENSOR", [1, 512, 14, 14], "float32"], ["TENSOR", [512, 1, 3, 3], "float32"], [2, 2], [1, 1, 1, 1], [1, 1], "float32"], {}], "config": {"index": 14340, "code_hash": null, "entity": [["tile_f", "sp", [-1, 1, 32, 1]], ["tile_y", "sp", [-1, 7, 1, 1]], ["tile_x", "sp", [-1, 1, 1, 1]], ["auto_unroll_max_step", "ot", 256], ["unroll_explicit", "ot", 1]]}, "result": [[1.1491815288564032e-05, 1.1492358991929343e-05, 1.1492841099436577e-05], 0, 2.1967344284057617, 1678951080.651278], "version": 0.2, "tvm_version": "0.10.0"}
{"input": ["cuda -keys=cuda,gpu -arch=sm_75 -max_num_threads=1024 -thread_warp_size=32", "depthwise_conv2d_nchw.cuda", [["TENSOR", [1, 512, 14, 14], "float32"], ["TENSOR", [512, 1, 3, 3], "float32"], [2, 2], [1, 1, 1, 1], [1, 1], "float32"], {}], "config": {"index": 12405, "code_hash": null, "entity": [["tile_f", "sp", [-1, 1, 16, 2]], ["tile_y", "sp", [-1, 1, 1, 1]], ["tile_x", "sp", [-1, 1, 7, 1]], ["auto_unroll_max_step", "ot", 0], ["unroll_explicit", "ot", 1]]}, "result": [[7.605413777827002e-06, 7.605431498504819e-06, 7.605580186067117e-06], 0, 1.8328015804290771, 1678951081.797661], "version": 0.2, "tvm_version": "0.10.0"}
{"input": ["cuda -keys=cuda,gpu -arch=sm_75 -max_num_threads=1024 -thread_warp_size=32", "depthwise_conv2d_nchw.cuda", [["TENSOR", [1, 512, 14, 14], "float32"], ["TENSOR", [512, 1, 3, 3], "float32"], [2, 2], [1, 1, 1, 1], [1, 1], "float32"], {}], "config": {"index": 7345, "code_hash": null, "entity": [["tile_f", "sp", [-1, 1, 16, 2]], ["tile_y", "sp", [-1, 7, 1, 1]], ["tile_x", "sp", [-1, 1, 1, 1]], ["auto_unroll_max_step", "ot", 1500], ["unroll_explicit", "ot", 0]]}, "result": [[2.2542670884213623e-05, 2.254326805943799e-05, 2.254356878034427e-05], 0, 2.1410155296325684, 1678951083.0160027], "version": 0.2, "tvm_version": "0.10.0"}
{"input": ["cuda -keys=cuda,gpu -arch=sm_75 -max_num_threads=1024 -thread_warp_size=32", "depthwise_conv2d_nchw.cuda", [["TENSOR", [1, 512, 14, 14], "float32"], ["TENSOR", [512, 1, 3, 3], "float32"], [2, 2], [1, 1, 1, 1], [1, 1], "float32"], {}], "config": {"index": 3554, "code_hash": null, "entity": [["tile_f", "sp", [-1, 1, 16, 1]], ["tile_y", "sp", [-1, 1, 1, 1]], ["tile_x", "sp", [-1, 1, 1, 1]], ["auto_unroll_max_step", "ot", 256], ["unroll_explicit", "ot", 0]]}, "result": [[1.8701665392676616e-05, 1.8701674885957343e-05, 1.8702679447663664e-05], 0, 1.789529800415039, 1678951084.1978033], "version": 0.2, "tvm_version": "0.10.0"}
{"input": ["cuda -keys=cuda,gpu -arch=sm_75 -max_num_threads=1024 -thread_warp_size=32", "depthwise_conv2d_nchw.cuda", [["TENSOR", [1, 512, 14, 14], "float32"], ["TENSOR", [512, 1, 3, 3], "float32"], [2, 2], [1, 1, 1, 1], [1, 1], "float32"], {}], "config": {"index": 14114, "code_hash": null, "entity": [["tile_f", "sp", [-1, 1, 16, 1]], ["tile_y", "sp", [-1, 1, 1, 1]], ["tile_x", "sp", [-1, 1, 1, 1]], ["auto_unroll_max_step", "ot", 256], ["unroll_explicit", "ot", 1]]}, "result": [[1.9244479367088607e-05, 1.9244711139240506e-05, 1.9246014936708864e-05], 0, 1.8918242454528809, 1678951085.3989918], "version": 0.2, "tvm_version": "0.10.0"}
{"input": ["cuda -keys=cuda,gpu -arch=sm_75 -max_num_threads=1024 -thread_warp_size=32", "depthwise_conv2d_nchw.cuda", [["TENSOR", [1, 512, 14, 14], "float32"], ["TENSOR", [512, 1, 3, 3], "float32"], [2, 2], [1, 1, 1, 1], [1, 1], "float32"], {}], "config": {"index": 248, "code_hash": null, "entity": [["tile_f", "sp", [-1, 2, 8, 1]], ["tile_y", "sp", [-1, 7, 1, 1]], ["tile_x", "sp", [-1, 1, 1, 1]], ["auto_unroll_max_step", "ot", 0], ["unroll_explicit", "ot", 0]]}, "result": [[2.325513135914958e-05, 2.325609764616553e-05, 2.325616249050873e-05], 0, 1.851119041442871, 1678951088.008049], "version": 0.2, "tvm_version": "0.10.0"}
{"input": ["cuda -keys=cuda,gpu -arch=sm_75 -max_num_threads=1024 -thread_warp_size=32", "depthwise_conv2d_nchw.cuda", [["TENSOR", [1, 512, 14, 14], "float32"], ["TENSOR", [512, 1, 3, 3], "float32"], [2, 2], [1, 1, 1, 1], [1, 1], "float32"], {}], "config": {"index": 10808, "code_hash": null, "entity": [["tile_f", "sp", [-1, 2, 8, 1]], ["tile_y", "sp", [-1, 7, 1, 1]], ["tile_x", "sp", [-1, 1, 1, 1]], ["auto_unroll_max_step", "ot", 0], ["unroll_explicit", "ot", 1]]}, "result": [[2.3251101746393318e-05, 2.325115732725892e-05, 2.3254519514047078e-05], 0, 1.8486614227294922, 1678951089.2301977], "version": 0.2, "tvm_version": "0.10.0"}
{"input": ["cuda -keys=cuda,gpu -arch=sm_75 -max_num_threads=1024 -thread_warp_size=32", "depthwise_conv2d_nchw.cuda", [["TENSOR", [1, 512, 14, 14], "float32"], ["TENSOR", [512, 1, 3, 3], "float32"], [2, 2], [1, 1, 1, 1], [1, 1], "float32"], {}], "config": {"index": 17854, "code_hash": null, "entity": [["tile_f", "sp", [-1, 1, 16, 1]], ["tile_y", "sp", [-1, 7, 1, 1]], ["tile_x", "sp", [-1, 1, 1, 1]], ["auto_unroll_max_step", "ot", 1500], ["unroll_explicit", "ot", 1]]}, "result": [[1.033543611468341e-05, 1.0337060216355248e-05, 1.0338803237763825e-05], 0, 1.9410271644592285, 1678951090.3434484], "version": 0.2, "tvm_version": "0.10.0"}
{"input": ["cuda -keys=cuda,gpu -arch=sm_75 -max_num_threads=1024 -thread_warp_size=32", "depthwise_conv2d_nchw.cuda", [["TENSOR", [1, 512, 14, 14], "float32"], ["TENSOR", [512, 1, 3, 3], "float32"], [2, 2], [1, 1, 1, 1], [1, 1], "float32"], {}], "config": {"index": 7294, "code_hash": null, "entity": [["tile_f", "sp", [-1, 1, 16, 1]], ["tile_y", "sp", [-1, 7, 1, 1]], ["tile_x", "sp", [-1, 1, 1, 1]], ["auto_unroll_max_step", "ot", 1500], ["unroll_explicit", "ot", 0]]}, "result": [[1.377769941444372e-05, 1.3777723487312947e-05, 1.378170025095269e-05], 0, 1.8188457489013672, 1678951091.523181], "version": 0.2, "tvm_version": "0.10.0"}
{"input": ["cuda -keys=cuda,gpu -arch=sm_75 -max_num_threads=1024 -thread_warp_size=32", "depthwise_conv2d_nchw.cuda", [["TENSOR", [1, 512, 14, 14], "float32"], ["TENSOR", [512, 1, 3, 3], "float32"], [2, 2], [1, 1, 1, 1], [1, 1], "float32"], {}], "config": {"index": 5365, "code_hash": null, "entity": [["tile_f", "sp", [-1, 1, 16, 2]], ["tile_y", "sp", [-1, 1, 1, 1]], ["tile_x", "sp", [-1, 1, 7, 1]], ["auto_unroll_max_step", "ot", 256], ["unroll_explicit", "ot", 0]]}, "result": [[7.5633911591667995e-06, 7.563869136587691e-06, 7.564801611278952e-06], 0, 1.750662088394165, 1678951092.7005463], "version": 0.2, "tvm_version": "0.10.0"}
{"input": ["cuda -keys=cuda,gpu -arch=sm_75 -max_num_threads=1024 -thread_warp_size=32", "depthwise_conv2d_nchw.cuda", [["TENSOR", [1, 512, 14, 14], "float32"], ["TENSOR", [512, 1, 3, 3], "float32"], [2, 2], [1, 1, 1, 1], [1, 1], "float32"], {}], "config": {"index": 10640, "code_hash": null, "entity": [["tile_f", "sp", [-1, 2, 8, 2]], ["tile_y", "sp", [-1, 1, 1, 1]], ["tile_x", "sp", [-1, 1, 1, 1]], ["auto_unroll_max_step", "ot", 0], ["unroll_explicit", "ot", 1]]}, "result": [[3.4668235147392295e-05, 3.466849455782313e-05, 3.4669134693877555e-05], 0, 1.8641369342803955, 1678951093.9440866], "version": 0.2, "tvm_version": "0.10.0"}
{"input": ["cuda -keys=cuda,gpu -arch=sm_75 -max_num_threads=1024 -thread_warp_size=32", "depthwise_conv2d_nchw.cuda", [["TENSOR", [1, 512, 14, 14], "float32"], ["TENSOR", [512, 1, 3, 3], "float32"], [2, 2], [1, 1, 1, 1], [1, 1], "float32"], {}], "config": {"index": 10860, "code_hash": null, "entity": [["tile_f", "sp", [-1, 2, 8, 2]], ["tile_y", "sp", [-1, 7, 1, 1]], ["tile_x", "sp", [-1, 1, 1, 1]], ["auto_unroll_max_step", "ot", 0], ["unroll_explicit", "ot", 1]]}, "result": [[3.815448788249694e-05, 3.8156471481028154e-05, 3.815947833537332e-05], 0, 2.038581132888794, 1678951095.1749604], "version": 0.2, "tvm_version": "0.10.0"}
{"input": ["cuda -keys=cuda,gpu -arch=sm_75 -max_num_threads=1024 -thread_warp_size=32", "depthwise_conv2d_nchw.cuda", [["TENSOR", [1, 512, 14, 14], "float32"], ["TENSOR", [512, 1, 3, 3], "float32"], [2, 2], [1, 1, 1, 1], [1, 1], "float32"], {}], "config": {"index": 10815, "code_hash": null, "entity": [["tile_f", "sp", [-1, 2, 16, 1]], ["tile_y", "sp", [-1, 7, 1, 1]], ["tile_x", "sp", [-1, 1, 1, 1]], ["auto_unroll_max_step", "ot", 0], ["unroll_explicit", "ot", 1]]}, "result": [[2.199229941775837e-05, 2.1992352692867542e-05, 2.199238384279476e-05], 0, 1.8264155387878418, 1678951096.3302233], "version": 0.2, "tvm_version": "0.10.0"}
{"input": ["cuda -keys=cuda,gpu -arch=sm_75 -max_num_threads=1024 -thread_warp_size=32", "depthwise_conv2d_nchw.cuda", [["TENSOR", [1, 512, 14, 14], "float32"], ["TENSOR", [512, 1, 3, 3], "float32"], [2, 2], [1, 1, 1, 1], [1, 1], "float32"], {}], "config": {"index": 3819, "code_hash": null, "entity": [["tile_f", "sp", [-1, 1, 8, 2]], ["tile_y", "sp", [-1, 7, 1, 1]], ["tile_x", "sp", [-1, 1, 1, 1]], ["auto_unroll_max_step", "ot", 256], ["unroll_explicit", "ot", 0]]}, "result": [[2.248620926143024e-05, 2.2487611225087925e-05, 2.2489283851113717e-05], 0, 2.1008458137512207, 1678951097.5554235], "version": 0.2, "tvm_version": "0.10.0"}
{"input": ["cuda -keys=cuda,gpu -arch=sm_75 -max_num_threads=1024 -thread_warp_size=32", "depthwise_conv2d_nchw.cuda", [["TENSOR", [1, 512, 14, 14], "float32"], ["TENSOR", [512, 1, 3, 3], "float32"], [2, 2], [1, 1, 1, 1], [1, 1], "float32"], {}], "config": {"index": 14379, "code_hash": null, "entity": [["tile_f", "sp", [-1, 1, 8, 2]], ["tile_y", "sp", [-1, 7, 1, 1]], ["tile_x", "sp", [-1, 1, 1, 1]], ["auto_unroll_max_step", "ot", 256], ["unroll_explicit", "ot", 1]]}, "result": [[1.1316934789367323e-05, 1.1318603450956008e-05, 1.1319431291776777e-05], 0, 2.440708637237549, 1678951098.7283783], "version": 0.2, "tvm_version": "0.10.0"}
{"input": ["cuda -keys=cuda,gpu -arch=sm_75 -max_num_threads=1024 -thread_warp_size=32", "depthwise_conv2d_nchw.cuda", [["TENSOR", [1, 512, 14, 14], "float32"], ["TENSOR", [512, 1, 3, 3], "float32"], [2, 2], [1, 1, 1, 1], [1, 1], "float32"], {}], "config": {"index": 8005, "code_hash": null, "entity": [["tile_f", "sp", [-1, 1, 16, 2]], ["tile_y", "sp", [-1, 1, 1, 1]], ["tile_x", "sp", [-1, 7, 1, 1]], ["auto_unroll_max_step", "ot", 1500], ["unroll_explicit", "ot", 0]]}, "result": [[2.281167508315694e-05, 2.2812874659812518e-05, 2.281550695494406e-05], 0, 2.082671880722046, 1678951099.933239], "version": 0.2, "tvm_version": "0.10.0"}
{"input": ["cuda -keys=cuda,gpu -arch=sm_75 -max_num_threads=1024 -thread_warp_size=32", "depthwise_conv2d_nchw.cuda", [["TENSOR", [1, 512, 14, 14], "float32"], ["TENSOR", [512, 1, 3, 3], "float32"], [2, 2], [1, 1, 1, 1], [1, 1], "float32"], {}], "config": {"index": 920, "code_hash": null, "entity": [["tile_f", "sp", [-1, 1, 32, 1]], ["tile_y", "sp", [-1, 1, 1, 1]], ["tile_x", "sp", [-1, 7, 1, 1]], ["auto_unroll_max_step", "ot", 0], ["unroll_explicit", "ot", 0]]}, "result": [[1.5116961573373676e-05, 1.5117470902672719e-05, 1.5119465456379223e-05], 0, 1.85377836227417, 1678951101.1542606], "version": 0.2, "tvm_version": "0.10.0"}
{"input": ["cuda -keys=cuda,gpu -arch=sm_75 -max_num_threads=1024 -thread_warp_size=32", "depthwise_conv2d_nchw.cuda", [["TENSOR", [1, 512, 14, 14], "float32"], ["TENSOR", [512, 1, 3, 3], "float32"], [2, 2], [1, 1, 1, 1], [1, 1], "float32"], {}], "config": {"index": 3600, "code_hash": null, "entity": [["tile_f", "sp", [-1, 2, 8, 2]], ["tile_y", "sp", [-1, 1, 1, 1]], ["tile_x", "sp", [-1, 1, 1, 1]], ["auto_unroll_max_step", "ot", 256], ["unroll_explicit", "ot", 0]]}, "result": [[3.5619055758683734e-05, 3.562053404936015e-05, 3.5621308272394885e-05], 0, 1.971874475479126, 1678951102.41054], "version": 0.2, "tvm_version": "0.10.0"}
{"input": ["cuda -keys=cuda,gpu -arch=sm_75 -max_num_threads=1024 -thread_warp_size=32", "depthwise_conv2d_nchw.cuda", [["TENSOR", [1, 512, 14, 14], "float32"], ["TENSOR", [512, 1, 3, 3], "float32"], [2, 2], [1, 1, 1, 1], [1, 1], "float32"], {}], "config": {"index": 15874, "code_hash": null, "entity": [["tile_f", "sp", [-1, 1, 16, 1]], ["tile_y", "sp", [-1, 1, 1, 1]], ["tile_x", "sp", [-1, 1, 7, 1]], ["auto_unroll_max_step", "ot", 256], ["unroll_explicit", "ot", 1]]}, "result": [[7.399502333144797e-06, 7.418809954751131e-06, 8.377748868778281e-06], 0, 1.6968483924865723, 1678951115.5239553], "version": 0.2, "tvm_version": "0.10.0"}
{"input": ["cuda -keys=cuda,gpu -arch=sm_75 -max_num_threads=1024 -thread_warp_size=32", "depthwise_conv2d_nchw.cuda", [["TENSOR", [1, 512, 14, 14], "float32"], ["TENSOR", [512, 1, 3, 3], "float32"], [2, 2], [1, 1, 1, 1], [1, 1], "float32"], {}], "config": {"index": 19394, "code_hash": null, "entity": [["tile_f", "sp", [-1, 1, 16, 1]], ["tile_y", "sp", [-1, 1, 1, 1]], ["tile_x", "sp", [-1, 1, 7, 1]], ["auto_unroll_max_step", "ot", 1500], ["unroll_explicit", "ot", 1]]}, "result": [[7.3986643256943706e-06, 7.398909282923223e-06, 7.3993161896715605e-06], 0, 1.8979580402374268, 1678951116.6907814], "version": 0.2, "tvm_version": "0.10.0"}
{"input": ["cuda -keys=cuda,gpu -arch=sm_75 -max_num_threads=1024 -thread_warp_size=32", "depthwise_conv2d_nchw.cuda", [["TENSOR", [1, 512, 14, 14], "float32"], ["TENSOR", [512, 1, 3, 3], "float32"], [2, 2], [1, 1, 1, 1], [1, 1], "float32"], {}], "config": {"index": 5314, "code_hash": null, "entity": [["tile_f", "sp", [-1, 1, 16, 1]], ["tile_y", "sp", [-1, 1, 1, 1]], ["tile_x", "sp", [-1, 1, 7, 1]], ["auto_unroll_max_step", "ot", 256], ["unroll_explicit", "ot", 0]]}, "result": [[7.364357309376243e-06, 7.365557229771992e-06, 7.365565929379654e-06], 0, 1.7584753036499023, 1678951117.7999318], "version": 0.2, "tvm_version": "0.10.0"}
{"input": ["cuda -keys=cuda,gpu -arch=sm_75 -max_num_threads=1024 -thread_warp_size=32", "depthwise_conv2d_nchw.cuda", [["TENSOR", [1, 512, 14, 14], "float32"], ["TENSOR", [512, 1, 3, 3], "float32"], [2, 2], [1, 1, 1, 1], [1, 1], "float32"], {}], "config": {"index": 15925, "code_hash": null, "entity": [["tile_f", "sp", [-1, 1, 16, 2]], ["tile_y", "sp", [-1, 1, 1, 1]], ["tile_x", "sp", [-1, 1, 7, 1]], ["auto_unroll_max_step", "ot", 256], ["unroll_explicit", "ot", 1]]}, "result": [[7.34180337206653e-06, 7.3421553884711775e-06, 7.342542150831625e-06], 0, 1.8917617797851562, 1678951118.9022708], "version": 0.2, "tvm_version": "0.10.0"}
{"input": ["cuda -keys=cuda,gpu -arch=sm_75 -max_num_threads=1024 -thread_warp_size=32", "depthwise_conv2d_nchw.cuda", [["TENSOR", [1, 512, 14, 14], "float32"], ["TENSOR", [512, 1, 3, 3], "float32"], [2, 2], [1, 1, 1, 1], [1, 1], "float32"], {}], "config": {"index": 474, "code_hash": null, "entity": [["tile_f", "sp", [-1, 1, 16, 1]], ["tile_y", "sp", [-1, 1, 7, 1]], ["tile_x", "sp", [-1, 1, 1, 1]], ["auto_unroll_max_step", "ot", 0], ["unroll_explicit", "ot", 0]]}, "result": [[9.198195279115514e-06, 9.198272875262837e-06, 9.198982907142373e-06], 0, 1.83638334274292, 1678951120.0391424], "version": 0.2, "tvm_version": "0.10.0"}
{"input": ["cuda -keys=cuda,gpu -arch=sm_75 -max_num_threads=1024 -thread_warp_size=32", "depthwise_conv2d_nchw.cuda", [["TENSOR", [1, 512, 14, 14], "float32"], ["TENSOR", [512, 1, 3, 3], "float32"], [2, 2], [1, 1, 1, 1], [1, 1], "float32"], {}], "config": {"index": 14554, "code_hash": null, "entity": [["tile_f", "sp", [-1, 1, 16, 1]], ["tile_y", "sp", [-1, 1, 7, 1]], ["tile_x", "sp", [-1, 1, 1, 1]], ["auto_unroll_max_step", "ot", 256], ["unroll_explicit", "ot", 1]]}, "result": [[9.199542413066386e-06, 9.20096134088514e-06, 9.201129149104321e-06], 0, 1.8644280433654785, 1678951121.208367], "version": 0.2, "tvm_version": "0.10.0"}
{"input": ["cuda -keys=cuda,gpu -arch=sm_75 -max_num_threads=1024 -thread_warp_size=32", "depthwise_conv2d_nchw.cuda", [["TENSOR", [1, 512, 14, 14], "float32"], ["TENSOR", [512, 1, 3, 3], "float32"], [2, 2], [1, 1, 1, 1], [1, 1], "float32"], {}], "config": {"index": 8834, "code_hash": null, "entity": [["tile_f", "sp", [-1, 1, 16, 1]], ["tile_y", "sp", [-1, 1, 1, 1]], ["tile_x", "sp", [-1, 1, 7, 1]], ["auto_unroll_max_step", "ot", 1500], ["unroll_explicit", "ot", 0]]}, "result": [[7.3653649910911945e-06, 7.365435829598834e-06, 7.3655651962637e-06], 0, 1.8497931957244873, 1678951122.3569512], "version": 0.2, "tvm_version": "0.10.0"}
{"input": ["cuda -keys=cuda,gpu -arch=sm_75 -max_num_threads=1024 -thread_warp_size=32", "depthwise_conv2d_nchw.cuda", [["TENSOR", [1, 512, 14, 14], "float32"], ["TENSOR", [512, 1, 3, 3], "float32"], [2, 2], [1, 1, 1, 1], [1, 1], "float32"], {}], "config": {"index": 15875, "code_hash": null, "entity": [["tile_f", "sp", [-1, 2, 16, 1]], ["tile_y", "sp", [-1, 1, 1, 1]], ["tile_x", "sp", [-1, 1, 7, 1]], ["auto_unroll_max_step", "ot", 256], ["unroll_explicit", "ot", 1]]}, "result": [[7.2574866050689095e-06, 7.257954472719764e-06, 7.258304960512052e-06], 0, 1.8740925788879395, 1678951123.4692035], "version": 0.2, "tvm_version": "0.10.0"}
{"input": ["cuda -keys=cuda,gpu -arch=sm_75 -max_num_threads=1024 -thread_warp_size=32", "depthwise_conv2d_nchw.cuda", [["TENSOR", [1, 512, 14, 14], "float32"], ["TENSOR", [512, 1, 3, 3], "float32"], [2, 2], [1, 1, 1, 1], [1, 1], "float32"], {}], "config": {"index": 11034, "code_hash": null, "entity": [["tile_f", "sp", [-1, 1, 16, 1]], ["tile_y", "sp", [-1, 1, 7, 1]], ["tile_x", "sp", [-1, 1, 1, 1]], ["auto_unroll_max_step", "ot", 0], ["unroll_explicit", "ot", 1]]}, "result": [[9.198698601531354e-06, 9.199361007403656e-06, 9.200124786432955e-06], 0, 1.852893590927124, 1678951124.6251922], "version": 0.2, "tvm_version": "0.10.0"}
{"input": ["cuda -keys=cuda,gpu -arch=sm_75 -max_num_threads=1024 -thread_warp_size=32", "depthwise_conv2d_nchw.cuda", [["TENSOR", [1, 512, 14, 14], "float32"], ["TENSOR", [512, 1, 3, 3], "float32"], [2, 2], [1, 1, 1, 1], [1, 1], "float32"], {}], "config": {"index": 19445, "code_hash": null, "entity": [["tile_f", "sp", [-1, 1, 16, 2]], ["tile_y", "sp", [-1, 1, 1, 1]], ["tile_x", "sp", [-1, 1, 7, 1]], ["auto_unroll_max_step", "ot", 1500], ["unroll_explicit", "ot", 1]]}, "result": [[7.340840458522539e-06, 7.341113412338022e-06, 7.341747978735186e-06], 0, 1.8640310764312744, 1678951125.714382], "version": 0.2, "tvm_version": "0.10.0"}
{"input": ["cuda -keys=cuda,gpu -arch=sm_75 -max_num_threads=1024 -thread_warp_size=32", "depthwise_conv2d_nchw.cuda", [["TENSOR", [1, 512, 14, 14], "float32"], ["TENSOR", [512, 1, 3, 3], "float32"], [2, 2], [1, 1, 1, 1], [1, 1], "float32"], {}], "config": {"index": 19395, "code_hash": null, "entity": [["tile_f", "sp", [-1, 2, 16, 1]], ["tile_y", "sp", [-1, 1, 1, 1]], ["tile_x", "sp", [-1, 1, 7, 1]], ["auto_unroll_max_step", "ot", 1500], ["unroll_explicit", "ot", 1]]}, "result": [[7.257050825015278e-06, 7.257384956202892e-06, 7.257533408026075e-06], 0, 1.9391565322875977, 1678951126.8621721], "version": 0.2, "tvm_version": "0.10.0"}
{"input": ["cuda -keys=cuda,gpu -arch=sm_75 -max_num_threads=1024 -thread_warp_size=32", "depthwise_conv2d_nchw.cuda", [["TENSOR", [1, 512, 14, 14], "float32"], ["TENSOR", [512, 1, 3, 3], "float32"], [2, 2], [1, 1, 1, 1], [1, 1], "float32"], {}], "config": {"index": 18074, "code_hash": null, "entity": [["tile_f", "sp", [-1, 1, 16, 1]], ["tile_y", "sp", [-1, 1, 7, 1]], ["tile_x", "sp", [-1, 1, 1, 1]], ["auto_unroll_max_step", "ot", 1500], ["unroll_explicit", "ot", 1]]}, "result": [[9.199006644308043e-06, 9.199336834778207e-06, 9.199995380623933e-06], 0, 1.894118309020996, 1678951128.0595355], "version": 0.2, "tvm_version": "0.10.0"}
{"input": ["cuda -keys=cuda,gpu -arch=sm_75 -max_num_threads=1024 -thread_warp_size=32", "depthwise_conv2d_nchw.cuda", [["TENSOR", [1, 512, 14, 14], "float32"], ["TENSOR", [512, 1, 3, 3], "float32"], [2, 2], [1, 1, 1, 1], [1, 1], "float32"], {}], "config": {"index": 3994, "code_hash": null, "entity": [["tile_f", "sp", [-1, 1, 16, 1]], ["tile_y", "sp", [-1, 1, 7, 1]], ["tile_x", "sp", [-1, 1, 1, 1]], ["auto_unroll_max_step", "ot", 256], ["unroll_explicit", "ot", 0]]}, "result": [[9.198451433272161e-06, 9.198718914130228e-06, 9.198934252989938e-06], 0, 1.8853676319122314, 1678951129.254453], "version": 0.2, "tvm_version": "0.10.0"}
{"input": ["cuda -keys=cuda,gpu -arch=sm_75 -max_num_threads=1024 -thread_warp_size=32", "depthwise_conv2d_nchw.cuda", [["TENSOR", [1, 512, 14, 14], "float32"], ["TENSOR", [512, 1, 3, 3], "float32"], [2, 2], [1, 1, 1, 1], [1, 1], "float32"], {}], "config": {"index": 15919, "code_hash": null, "entity": [["tile_f", "sp", [-1, 1, 8, 2]], ["tile_y", "sp", [-1, 1, 1, 1]], ["tile_x", "sp", [-1, 1, 7, 1]], ["auto_unroll_max_step", "ot", 256], ["unroll_explicit", "ot", 1]]}, "result": [[7.465099253569884e-06, 7.46520818909563e-06, 7.465536672436175e-06], 0, 1.9343822002410889, 1678951130.4063177], "version": 0.2, "tvm_version": "0.10.0"}
{"input": ["cuda -keys=cuda,gpu -arch=sm_75 -max_num_threads=1024 -thread_warp_size=32", "depthwise_conv2d_nchw.cuda", [["TENSOR", [1, 512, 14, 14], "float32"], ["TENSOR", [512, 1, 3, 3], "float32"], [2, 2], [1, 1, 1, 1], [1, 1], "float32"], {}], "config": {"index": 15868, "code_hash": null, "entity": [["tile_f", "sp", [-1, 2, 8, 1]], ["tile_y", "sp", [-1, 1, 1, 1]], ["tile_x", "sp", [-1, 1, 7, 1]], ["auto_unroll_max_step", "ot", 256], ["unroll_explicit", "ot", 1]]}, "result": [[7.334706690857111e-06, 7.334803122766508e-06, 7.335179833965584e-06], 0, 1.85817551612854, 1678951131.501732], "version": 0.2, "tvm_version": "0.10.0"}
{"input": ["cuda -keys=cuda,gpu -arch=sm_75 -max_num_threads=1024 -thread_warp_size=32", "depthwise_conv2d_nchw.cuda", [["TENSOR", [1, 512, 14, 14], "float32"], ["TENSOR", [512, 1, 3, 3], "float32"], [2, 2], [1, 1, 1, 1], [1, 1], "float32"], {}], "config": {"index": 1839, "code_hash": null, "entity": [["tile_f", "sp", [-1, 1, 8, 2]], ["tile_y", "sp", [-1, 1, 1, 1]], ["tile_x", "sp", [-1, 1, 7, 1]], ["auto_unroll_max_step", "ot", 0], ["unroll_explicit", "ot", 0]]}, "result": [[7.660661683801056e-06, 7.661425673798276e-06, 7.661859794387329e-06], 0, 1.8243072032928467, 1678951132.6339672], "version": 0.2, "tvm_version": "0.10.0"}
{"input": ["cuda -keys=cuda,gpu -arch=sm_75 -max_num_threads=1024 -thread_warp_size=32", "depthwise_conv2d_nchw.cuda", [["TENSOR", [1, 512, 14, 14], "float32"], ["TENSOR", [512, 1, 3, 3], "float32"], [2, 2], [1, 1, 1, 1], [1, 1], "float32"], {}], "config": {"index": 12355, "code_hash": null, "entity": [["tile_f", "sp", [-1, 2, 16, 1]], ["tile_y", "sp", [-1, 1, 1, 1]], ["tile_x", "sp", [-1, 1, 7, 1]], ["auto_unroll_max_step", "ot", 0], ["unroll_explicit", "ot", 1]]}, "result": [[7.522122434341205e-06, 7.522705032001766e-06, 7.522906256896932e-06], 0, 1.79427170753479, 1678951134.8933418], "version": 0.2, "tvm_version": "0.10.0"}
