results/cuda_gtx1650/mobilenet/droplet/cpu.log_layer_0.log
{"input": ["cuda -keys=cuda,gpu -arch=sm_75 -max_num_threads=1024 -thread_warp_size=32", "conv2d_nchw.cuda", [["TENSOR", [1, 3, 224, 224], "float32"], ["TENSOR", [32, 3, 3, 3], "float32"], [2, 2], [1, 1, 1, 1], [1, 1], "float32"], {}], "config": {"index": 0, "code_hash": null, "entity": [["tile_f", "sp", [-1, 1, 1, 1]], ["tile_y", "sp", [-1, 1, 1, 1]], ["tile_x", "sp", [-1, 1, 1, 1]], ["tile_rc", "sp", [-1, 1]], ["tile_ry", "sp", [-1, 1]], ["tile_rx", "sp", [-1, 1]], ["auto_unroll_max_step", "ot", 0], ["unroll_explicit", "ot", 0]]}, "result": [[0.0025255162000000003, 0.00252910338, 0.0025293510400000003], 0, 1.3526232242584229, 1679461128.4856083], "version": 0.2, "tvm_version": "0.10.0"}
{"input": ["cuda -keys=cuda,gpu -arch=sm_75 -max_num_threads=1024 -thread_warp_size=32", "conv2d_nchw.cuda", [["TENSOR", [1, 3, 224, 224], "float32"], ["TENSOR", [32, 3, 3, 3], "float32"], [2, 2], [1, 1, 1, 1], [1, 1], "float32"], {}], "config": {"index": 42814297, "code_hash": null, "entity": [["tile_f", "sp", [-1, 2, 1, 1]], ["tile_y", "sp", [-1, 2, 1, 1]], ["tile_x", "sp", [-1, 2, 1, 1]], ["tile_rc", "sp", [-1, 3]], ["tile_ry", "sp", [-1, 3]], ["tile_rx", "sp", [-1, 3]], ["auto_unroll_max_step", "ot", 512], ["unroll_explicit", "ot", 1]]}, "result": [[0.001037692041322314, 0.0010392208842975206, 0.0011998045041322312], 0, 1.9257757663726807, 1679461132.149563], "version": 0.2, "tvm_version": "0.10.0"}
{"input": ["cuda -keys=cuda,gpu -arch=sm_75 -max_num_threads=1024 -thread_warp_size=32", "conv2d_nchw.cuda", [["TENSOR", [1, 3, 224, 224], "float32"], ["TENSOR", [32, 3, 3, 3], "float32"], [2, 2], [1, 1, 1, 1], [1, 1], "float32"], {}], "config": {"index": 26342400, "code_hash": null, "entity": [["tile_f", "sp", [-1, 1, 1, 1]], ["tile_y", "sp", [-1, 1, 1, 1]], ["tile_x", "sp", [-1, 1, 1, 1]], ["tile_rc", "sp", [-1, 1]], ["tile_ry", "sp", [-1, 1]], ["tile_rx", "sp", [-1, 1]], ["auto_unroll_max_step", "ot", 0], ["unroll_explicit", "ot", 1]]}, "result": [[0.002525322325, 0.002525598325, 0.002525778375], 0, 1.819746494293213, 1679461133.0096512], "version": 0.2, "tvm_version": "0.10.0"}
{"input": ["cuda -keys=cuda,gpu -arch=sm_75 -max_num_threads=1024 -thread_warp_size=32", "conv2d_nchw.cuda", [["TENSOR", [1, 3, 224, 224], "float32"], ["TENSOR", [32, 3, 3, 3], "float32"], [2, 2], [1, 1, 1, 1], [1, 1], "float32"], {}], "config": {"index": 8780800, "code_hash": null, "entity": [["tile_f", "sp", [-1, 1, 1, 1]], ["tile_y", "sp", [-1, 1, 1, 1]], ["tile_x", "sp", [-1, 1, 1, 1]], ["tile_rc", "sp", [-1, 1]], ["tile_ry", "sp", [-1, 1]], ["tile_rx", "sp", [-1, 1]], ["auto_unroll_max_step", "ot", 512], ["unroll_explicit", "ot", 0]]}, "result": [[0.00251651515, 0.0025165687500000003, 0.002516582475], 0, 1.4751672744750977, 1679461133.8631587], "version": 0.2, "tvm_version": "0.10.0"}
{"input": ["cuda -keys=cuda,gpu -arch=sm_75 -max_num_threads=1024 -thread_warp_size=32", "conv2d_nchw.cuda", [["TENSOR", [1, 3, 224, 224], "float32"], ["TENSOR", [32, 3, 3, 3], "float32"], [2, 2], [1, 1, 1, 1], [1, 1], "float32"], {}], "config": {"index": 4390400, "code_hash": null, "entity": [["tile_f", "sp", [-1, 1, 1, 1]], ["tile_y", "sp", [-1, 1, 1, 1]], ["tile_x", "sp", [-1, 1, 1, 1]], ["tile_rc", "sp", [-1, 1]], ["tile_ry", "sp", [-1, 1]], ["tile_rx", "sp", [-1, 3]], ["auto_unroll_max_step", "ot", 0], ["unroll_explicit", "ot", 0]]}, "result": [[0.005923548058823529, 0.0059236328823529414, 0.005923753588235294], 0, 1.4971482753753662, 1679461134.727056], "version": 0.2, "tvm_version": "0.10.0"}
{"input": ["cuda -keys=cuda,gpu -arch=sm_75 -max_num_threads=1024 -thread_warp_size=32", "conv2d_nchw.cuda", [["TENSOR", [1, 3, 224, 224], "float32"], ["TENSOR", [32, 3, 3, 3], "float32"], [2, 2], [1, 1, 1, 1], [1, 1], "float32"], {}], "config": {"index": 2195200, "code_hash": null, "entity": [["tile_f", "sp", [-1, 1, 1, 1]], ["tile_y", "sp", [-1, 1, 1, 1]], ["tile_x", "sp", [-1, 1, 1, 1]], ["tile_rc", "sp", [-1, 1]], ["tile_ry", "sp", [-1, 3]], ["tile_rx", "sp", [-1, 1]], ["auto_unroll_max_step", "ot", 0], ["unroll_explicit", "ot", 0]]}, "result": [[0.005877735111111112, 0.005877872, 0.005878179722222222], 0, 1.497818946838379, 1679461135.5953224], "version": 0.2, "tvm_version": "0.10.0"}
{"input": ["cuda -keys=cuda,gpu -arch=sm_75 -max_num_threads=1024 -thread_warp_size=32", "conv2d_nchw.cuda", [["TENSOR", [1, 3, 224, 224], "float32"], ["TENSOR", [32, 3, 3, 3], "float32"], [2, 2], [1, 1, 1, 1], [1, 1], "float32"], {}], "config": {"index": 1097600, "code_hash": null, "entity": [["tile_f", "sp", [-1, 1, 1, 1]], ["tile_y", "sp", [-1, 1, 1, 1]], ["tile_x", "sp", [-1, 1, 1, 1]], ["tile_rc", "sp", [-1, 3]], ["tile_ry", "sp", [-1, 1]], ["tile_rx", "sp", [-1, 1]], ["auto_unroll_max_step", "ot", 0], ["unroll_explicit", "ot", 0]]}, "result": [[0.0053027030526315785, 0.005303070421052631, 0.005303223421052631], 0, 1.4778921604156494, 1679461136.4604986], "version": 0.2, "tvm_version": "0.10.0"}
{"input": ["cuda -keys=cuda,gpu -arch=sm_75 -max_num_threads=1024 -thread_warp_size=32", "conv2d_nchw.cuda", [["TENSOR", [1, 3, 224, 224], "float32"], ["TENSOR", [32, 3, 3, 3], "float32"], [2, 2], [1, 1, 1, 1], [1, 1], "float32"], {}], "config": {"index": 7840, "code_hash": null, "entity": [["tile_f", "sp", [-1, 1, 1, 1]], ["tile_y", "sp", [-1, 1, 1, 1]], ["tile_x", "sp", [-1, 2, 1, 1]], ["tile_rc", "sp", [-1, 1]], ["tile_ry", "sp", [-1, 1]], ["tile_rx", "sp", [-1, 1]], ["auto_unroll_max_step", "ot", 0], ["unroll_explicit", "ot", 0]]}, "result": [[0.007018165066666667, 0.007018233733333334, 0.0070182678], 0, 1.5175364017486572, 1679461137.3524754], "version": 0.2, "tvm_version": "0.10.0"}
{"input": ["cuda -keys=cuda,gpu -arch=sm_75 -max_num_threads=1024 -thread_warp_size=32", "conv2d_nchw.cuda", [["TENSOR", [1, 3, 224, 224], "float32"], ["TENSOR", [32, 3, 3, 3], "float32"], [2, 2], [1, 1, 1, 1], [1, 1], "float32"], {}], "config": {"index": 56, "code_hash": null, "entity": [["tile_f", "sp", [-1, 1, 1, 1]], ["tile_y", "sp", [-1, 2, 1, 1]], ["tile_x", "sp", [-1, 1, 1, 1]], ["tile_rc", "sp", [-1, 1]], ["tile_ry", "sp", [-1, 1]], ["tile_rx", "sp", [-1, 1]], ["auto_unroll_max_step", "ot", 0], ["unroll_explicit", "ot", 0]]}, "result": [[0.0065657839375, 0.006565887875, 0.0065660900625], 0, 1.501612663269043, 1679461138.238679], "version": 0.2, "tvm_version": "0.10.0"}
{"input": ["cuda -keys=cuda,gpu -arch=sm_75 -max_num_threads=1024 -thread_warp_size=32", "conv2d_nchw.cuda", [["TENSOR", [1, 3, 224, 224], "float32"], ["TENSOR", [32, 3, 3, 3], "float32"], [2, 2], [1, 1, 1, 1], [1, 1], "float32"], {}], "config": {"index": 1, "code_hash": null, "entity": [["tile_f", "sp", [-1, 2, 1, 1]], ["tile_y", "sp", [-1, 1, 1, 1]], ["tile_x", "sp", [-1, 1, 1, 1]], ["tile_rc", "sp", [-1, 1]], ["tile_ry", "sp", [-1, 1]], ["tile_rx", "sp", [-1, 1]], ["auto_unroll_max_step", "ot", 0], ["unroll_explicit", "ot", 0]]}, "result": [[0.005331233736842105, 0.0053312674736842106, 0.005331368263157894], 0, 1.4939708709716797, 1679461139.0999026], "version": 0.2, "tvm_version": "0.10.0"}
{"input": ["cuda -keys=cuda,gpu -arch=sm_75 -max_num_threads=1024 -thread_warp_size=32", "conv2d_nchw.cuda", [["TENSOR", [1, 3, 224, 224], "float32"], ["TENSOR", [32, 3, 3, 3], "float32"], [2, 2], [1, 1, 1, 1], [1, 1], "float32"], {}], "config": {"index": 17561600, "code_hash": null, "entity": [["tile_f", "sp", [-1, 1, 1, 1]], ["tile_y", "sp", [-1, 1, 1, 1]], ["tile_x", "sp", [-1, 1, 1, 1]], ["tile_rc", "sp", [-1, 1]], ["tile_ry", "sp", [-1, 1]], ["tile_rx", "sp", [-1, 1]], ["auto_unroll_max_step", "ot", 1500], ["unroll_explicit", "ot", 0]]}, "result": [[0.00251645125, 0.002516576, 0.0025166846999999997], 0, 1.439464807510376, 1679461139.9263198], "version": 0.2, "tvm_version": "0.10.0"}
{"input": ["cuda -keys=cuda,gpu -arch=sm_75 -max_num_threads=1024 -thread_warp_size=32", "conv2d_nchw.cuda", [["TENSOR", [1, 3, 224, 224], "float32"], ["TENSOR", [32, 3, 3, 3], "float32"], [2, 2], [1, 1, 1, 1], [1, 1], "float32"], {}], "config": {"index": 15680, "code_hash": null, "entity": [["tile_f", "sp", [-1, 1, 1, 1]], ["tile_y", "sp", [-1, 1, 1, 1]], ["tile_x", "sp", [-1, 4, 1, 1]], ["tile_rc", "sp", [-1, 1]], ["tile_ry", "sp", [-1, 1]], ["tile_rx", "sp", [-1, 1]], ["auto_unroll_max_step", "ot", 0], ["unroll_explicit", "ot", 0]]}, "result": [[0.006534421875, 0.0065344819999999994, 0.0065345778125], 0, 1.493011474609375, 1679461140.805985], "version": 0.2, "tvm_version": "0.10.0"}
{"input": ["cuda -keys=cuda,gpu -arch=sm_75 -max_num_threads=1024 -thread_warp_size=32", "conv2d_nchw.cuda", [["TENSOR", [1, 3, 224, 224], "float32"], ["TENSOR", [32, 3, 3, 3], "float32"], [2, 2], [1, 1, 1, 1], [1, 1], "float32"], {}], "config": {"index": 112, "code_hash": null, "entity": [["tile_f", "sp", [-1, 1, 1, 1]], ["tile_y", "sp", [-1, 4, 1, 1]], ["tile_x", "sp", [-1, 1, 1, 1]], ["tile_rc", "sp", [-1, 1]], ["tile_ry", "sp", [-1, 1]], ["tile_rx", "sp", [-1, 1]], ["auto_unroll_max_step", "ot", 0], ["unroll_explicit", "ot", 0]]}, "result": [[0.005783299722222222, 0.005783342111111111, 0.005783376055555556], 0, 1.495159387588501, 1679461141.6897545], "version": 0.2, "tvm_version": "0.10.0"}
{"input": ["cuda -keys=cuda,gpu -arch=sm_75 -max_num_threads=1024 -thread_warp_size=32", "conv2d_nchw.cuda", [["TENSOR", [1, 3, 224, 224], "float32"], ["TENSOR", [32, 3, 3, 3], "float32"], [2, 2], [1, 1, 1, 1], [1, 1], "float32"], {}], "config": {"index": 2, "code_hash": null, "entity": [["tile_f", "sp", [-1, 4, 1, 1]], ["tile_y", "sp", [-1, 1, 1, 1]], ["tile_x", "sp", [-1, 1, 1, 1]], ["tile_rc", "sp", [-1, 1]], ["tile_ry", "sp", [-1, 1]], ["tile_rx", "sp", [-1, 1]], ["auto_unroll_max_step", "ot", 0], ["unroll_explicit", "ot", 0]]}, "result": [[0.003344753, 0.0033448768333333334, 0.0033448822000000005], 0, 1.4345252513885498, 1679461142.5243628], "version": 0.2, "tvm_version": "0.10.0"}
{"input": ["cuda -keys=cuda,gpu -arch=sm_75 -max_num_threads=1024 -thread_warp_size=32", "conv2d_nchw.cuda", [["TENSOR", [1, 3, 224, 224], "float32"], ["TENSOR", [32, 3, 3, 3], "float32"], [2, 2], [1, 1, 1, 1], [1, 1], "float32"], {}], "config": {"index": 23520, "code_hash": null, "entity": [["tile_f", "sp", [-1, 1, 1, 1]], ["tile_y", "sp", [-1, 1, 1, 1]], ["tile_x", "sp", [-1, 7, 1, 1]], ["tile_rc", "sp", [-1, 1]], ["tile_ry", "sp", [-1, 1]], ["tile_rx", "sp", [-1, 1]], ["auto_unroll_max_step", "ot", 0], ["unroll_explicit", "ot", 0]]}, "result": [[0.005622323333333333, 0.005622634444444444, 0.005622773444444445], 0, 1.4460644721984863, 1679461143.3878417], "version": 0.2, "tvm_version": "0.10.0"}
{"input": ["cuda -keys=cuda,gpu -arch=sm_75 -max_num_threads=1024 -thread_warp_size=32", "conv2d_nchw.cuda", [["TENSOR", [1, 3, 224, 224], "float32"], ["TENSOR", [32, 3, 3, 3], "float32"], [2, 2], [1, 1, 1, 1], [1, 1], "float32"], {}], "config": {"index": 168, "code_hash": null, "entity": [["tile_f", "sp", [-1, 1, 1, 1]], ["tile_y", "sp", [-1, 7, 1, 1]], ["tile_x", "sp", [-1, 1, 1, 1]], ["tile_rc", "sp", [-1, 1]], ["tile_ry", "sp", [-1, 1]], ["tile_rx", "sp", [-1, 1]], ["auto_unroll_max_step", "ot", 0], ["unroll_explicit", "ot", 0]]}, "result": [[0.005564462, 0.0055649083333333335, 0.005564974], 0, 1.500072717666626, 1679461144.2519672], "version": 0.2, "tvm_version": "0.10.0"}
{"input": ["cuda -keys=cuda,gpu -arch=sm_75 -max_num_threads=1024 -thread_warp_size=32", "conv2d_nchw.cuda", [["TENSOR", [1, 3, 224, 224], "float32"], ["TENSOR", [32, 3, 3, 3], "float32"], [2, 2], [1, 1, 1, 1], [1, 1], "float32"], {}], "config": {"index": 3, "code_hash": null, "entity": [["tile_f", "sp", [-1, 8, 1, 1]], ["tile_y", "sp", [-1, 1, 1, 1]], ["tile_x", "sp", [-1, 1, 1, 1]], ["tile_rc", "sp", [-1, 1]], ["tile_ry", "sp", [-1, 1]], ["tile_rx", "sp", [-1, 1]], ["auto_unroll_max_step", "ot", 0], ["unroll_explicit", "ot", 0]]}, "result": [[0.0023396256744186044, 0.002339720953488372, 0.002339720953488372], 0, 1.4812405109405518, 1679461145.10748], "version": 0.2, "tvm_version": "0.10.0"}
{"input": ["cuda -keys=cuda,gpu -arch=sm_75 -max_num_threads=1024 -thread_warp_size=32", "conv2d_nchw.cuda", [["TENSOR", [1, 3, 224, 224], "float32"], ["TENSOR", [32, 3, 3, 3], "float32"], [2, 2], [1, 1, 1, 1], [1, 1], "float32"], {}], "config": {"index": 17577394, "code_hash": null, "entity": [["tile_f", "sp", [-1, 4, 1, 1]], ["tile_y", "sp", [-1, 4, 1, 1]], ["tile_x", "sp", [-1, 4, 1, 1]], ["tile_rc", "sp", [-1, 1]], ["tile_ry", "sp", [-1, 1]], ["tile_rx", "sp", [-1, 1]], ["auto_unroll_max_step", "ot", 1500], ["unroll_explicit", "ot", 0]]}, "result": [[0.002191854275862069, 0.002195102948275862, 0.0028301084166666665], 0, 2.654104709625244, 1679461148.7929688], "version": 0.2, "tvm_version": "0.10.0"}
{"input": ["cuda -keys=cuda,gpu -arch=sm_75 -max_num_threads=1024 -thread_warp_size=32", "conv2d_nchw.cuda", [["TENSOR", [1, 3, 224, 224], "float32"], ["TENSOR", [32, 3, 3, 3], "float32"], [2, 2], [1, 1, 1, 1], [1, 1], "float32"], {}], "config": {"index": 51595097, "code_hash": null, "entity": [["tile_f", "sp", [-1, 2, 1, 1]], ["tile_y", "sp", [-1, 2, 1, 1]], ["tile_x", "sp", [-1, 2, 1, 1]], ["tile_rc", "sp", [-1, 3]], ["tile_ry", "sp", [-1, 3]], ["tile_rx", "sp", [-1, 3]], ["auto_unroll_max_step", "ot", 1500], ["unroll_explicit", "ot", 1]]}, "result": [[0.0010376986580645162, 0.001037701806451613, 0.0010387852774193548], 0, 1.9553585052490234, 1679461150.0466342], "version": 0.2, "tvm_version": "0.10.0"}
{"input": ["cuda -keys=cuda,gpu -arch=sm_75 -max_num_threads=1024 -thread_warp_size=32", "conv2d_nchw.cuda", [["TENSOR", [1, 3, 224, 224], "float32"], ["TENSOR", [32, 3, 3, 3], "float32"], [2, 2], [1, 1, 1, 1], [1, 1], "float32"], {}], "config": {"index": 42845657, "code_hash": null, "entity": [["tile_f", "sp", [-1, 2, 1, 1]], ["tile_y", "sp", [-1, 2, 1, 1]], ["tile_x", "sp", [-1, 14, 1, 1]], ["tile_rc", "sp", [-1, 3]], ["tile_ry", "sp", [-1, 3]], ["tile_rx", "sp", [-1, 3]], ["auto_unroll_max_step", "ot", 512], ["unroll_explicit", "ot", 1]]}, "result": [[0.0005891412307692307, 0.0005891488315018314, 0.0005891774468864468], 0, 3.7512149810791016, 1679461151.300267], "version": 0.2, "tvm_version": "0.10.0"}
{"input": ["cuda -keys=cuda,gpu -arch=sm_75 -max_num_threads=1024 -thread_warp_size=32", "conv2d_nchw.cuda", [["TENSOR", [1, 3, 224, 224], "float32"], ["TENSOR", [32, 3, 3, 3], "float32"], [2, 2], [1, 1, 1, 1], [1, 1], "float32"], {}], "config": {"index": 42814521, "code_hash": null, "entity": [["tile_f", "sp", [-1, 2, 1, 1]], ["tile_y", "sp", [-1, 14, 1, 1]], ["tile_x", "sp", [-1, 2, 1, 1]], ["tile_rc", "sp", [-1, 3]], ["tile_ry", "sp", [-1, 3]], ["tile_rx", "sp", [-1, 3]], ["auto_unroll_max_step", "ot", 512], ["unroll_explicit", "ot", 1]]}, "result": [[0.0005874111090909092, 0.0005874159927272728, 0.0005874441236363636], 0, 3.776947498321533, 1679461152.5512865], "version": 0.2, "tvm_version": "0.10.0"}
{"input": ["cuda -keys=cuda,gpu -arch=sm_75 -max_num_threads=1024 -thread_warp_size=32", "conv2d_nchw.cuda", [["TENSOR", [1, 3, 224, 224], "float32"], ["TENSOR", [32, 3, 3, 3], "float32"], [2, 2], [1, 1, 1, 1], [1, 1], "float32"], {}], "config": {"index": 42814301, "code_hash": null, "entity": [["tile_f", "sp", [-1, 32, 1, 1]], ["tile_y", "sp", [-1, 2, 1, 1]], ["tile_x", "sp", [-1, 2, 1, 1]], ["tile_rc", "sp", [-1, 3]], ["tile_ry", "sp", [-1, 3]], ["tile_rx", "sp", [-1, 3]], ["auto_unroll_max_step", "ot", 512], ["unroll_explicit", "ot", 1]]}, "result": [[0.00046331811520737326, 0.0004633293317972351, 0.0004633303502304148], 0, 2.8268184661865234, 1679461153.3972573], "version": 0.2, "tvm_version": "0.10.0"}
{"input": ["cuda -keys=cuda,gpu -arch=sm_75 -max_num_threads=1024 -thread_warp_size=32", "conv2d_nchw.cuda", [["TENSOR", [1, 3, 224, 224], "float32"], ["TENSOR", [32, 3, 3, 3], "float32"], [2, 2], [1, 1, 1, 1], [1, 1], "float32"], {}], "config": {"index": 16471897, "code_hash": null, "entity": [["tile_f", "sp", [-1, 2, 1, 1]], ["tile_y", "sp", [-1, 2, 1, 1]], ["tile_x", "sp", [-1, 2, 1, 1]], ["tile_rc", "sp", [-1, 3]], ["tile_ry", "sp", [-1, 3]], ["tile_rx", "sp", [-1, 3]], ["auto_unroll_max_step", "ot", 512], ["unroll_explicit", "ot", 0]]}, "result": [[0.0012921784102564104, 0.0012921879102564102, 0.0012922092307692309], 0, 1.4221739768981934, 1679461154.2436485], "version": 0.2, "tvm_version": "0.10.0"}
{"input": ["cuda -keys=cuda,gpu -arch=sm_75 -max_num_threads=1024 -thread_warp_size=32", "conv2d_nchw.cuda", [["TENSOR", [1, 3, 224, 224], "float32"], ["TENSOR", [32, 3, 3, 3], "float32"], [2, 2], [1, 1, 1, 1], [1, 1], "float32"], {}], "config": {"index": 34033497, "code_hash": null, "entity": [["tile_f", "sp", [-1, 2, 1, 1]], ["tile_y", "sp", [-1, 2, 1, 1]], ["tile_x", "sp", [-1, 2, 1, 1]], ["tile_rc", "sp", [-1, 3]], ["tile_ry", "sp", [-1, 3]], ["tile_rx", "sp", [-1, 3]], ["auto_unroll_max_step", "ot", 0], ["unroll_explicit", "ot", 1]]}, "result": [[0.0034534775172413794, 0.0034534896206896556, 0.0034535448620689655], 0, 1.3370134830474854, 1679461155.0962691], "version": 0.2, "tvm_version": "0.10.0"}
{"input": ["cuda -keys=cuda,gpu -arch=sm_75 -max_num_threads=1024 -thread_warp_size=32", "conv2d_nchw.cuda", [["TENSOR", [1, 3, 224, 224], "float32"], ["TENSOR", [32, 3, 3, 3], "float32"], [2, 2], [1, 1, 1, 1], [1, 1], "float32"], {}], "config": {"index": 38423897, "code_hash": null, "entity": [["tile_f", "sp", [-1, 2, 1, 1]], ["tile_y", "sp", [-1, 2, 1, 1]], ["tile_x", "sp", [-1, 2, 1, 1]], ["tile_rc", "sp", [-1, 3]], ["tile_ry", "sp", [-1, 3]], ["tile_rx", "sp", [-1, 1]], ["auto_unroll_max_step", "ot", 512], ["unroll_explicit", "ot", 1]]}, "result": [[0.001375370493150685, 0.0013753976575342464, 0.0013754327808219178], 0, 1.5672039985656738, 1679461155.9426348], "version": 0.2, "tvm_version": "0.10.0"}
{"input": ["cuda -keys=cuda,gpu -arch=sm_75 -max_num_threads=1024 -thread_warp_size=32", "conv2d_nchw.cuda", [["TENSOR", [1, 3, 224, 224], "float32"], ["TENSOR", [32, 3, 3, 3], "float32"], [2, 2], [1, 1, 1, 1], [1, 1], "float32"], {}], "config": {"index": 40619097, "code_hash": null, "entity": [["tile_f", "sp", [-1, 2, 1, 1]], ["tile_y", "sp", [-1, 2, 1, 1]], ["tile_x", "sp", [-1, 2, 1, 1]], ["tile_rc", "sp", [-1, 3]], ["tile_ry", "sp", [-1, 1]], ["tile_rx", "sp", [-1, 3]], ["auto_unroll_max_step", "ot", 512], ["unroll_explicit", "ot", 1]]}, "result": [[0.0013654356216216217, 0.001365458608108108, 0.0013654702567567566], 0, 1.5959627628326416, 1679461156.7968054], "version": 0.2, "tvm_version": "0.10.0"}
{"input": ["cuda -keys=cuda,gpu -arch=sm_75 -max_num_threads=1024 -thread_warp_size=32", "conv2d_nchw.cuda", [["TENSOR", [1, 3, 224, 224], "float32"], ["TENSOR", [32, 3, 3, 3], "float32"], [2, 2], [1, 1, 1, 1], [1, 1], "float32"], {}], "config": {"index": 41716697, "code_hash": null, "entity": [["tile_f", "sp", [-1, 2, 1, 1]], ["tile_y", "sp", [-1, 2, 1, 1]], ["tile_x", "sp", [-1, 2, 1, 1]], ["tile_rc", "sp", [-1, 1]], ["tile_ry", "sp", [-1, 3]], ["tile_rx", "sp", [-1, 3]], ["auto_unroll_max_step", "ot", 512], ["unroll_explicit", "ot", 1]]}, "result": [[0.0010800770537634408, 0.0010800887849462366, 0.0010812999677419354], 0, 1.544311761856079, 1679461157.6429808], "version": 0.2, "tvm_version": "0.10.0"}
{"input": ["cuda -keys=cuda,gpu -arch=sm_75 -max_num_threads=1024 -thread_warp_size=32", "conv2d_nchw.cuda", [["TENSOR", [1, 3, 224, 224], "float32"], ["TENSOR", [32, 3, 3, 3], "float32"], [2, 2], [1, 1, 1, 1], [1, 1], "float32"], {}], "config": {"index": 42853497, "code_hash": null, "entity": [["tile_f", "sp", [-1, 2, 1, 1]], ["tile_y", "sp", [-1, 2, 1, 1]], ["tile_x", "sp", [-1, 16, 1, 1]], ["tile_rc", "sp", [-1, 3]], ["tile_ry", "sp", [-1, 3]], ["tile_rx", "sp", [-1, 3]], ["auto_unroll_max_step", "ot", 512], ["unroll_explicit", "ot", 1]]}, "result": [[0.0005836022971014493, 0.000583663884057971, 0.000584962052631579], 0, 3.251497983932495, 1679461158.8314679], "version": 0.2, "tvm_version": "0.10.0"}
{"input": ["cuda -keys=cuda,gpu -arch=sm_75 -max_num_threads=1024 -thread_warp_size=32", "conv2d_nchw.cuda", [["TENSOR", [1, 3, 224, 224], "float32"], ["TENSOR", [32, 3, 3, 3], "float32"], [2, 2], [1, 1, 1, 1], [1, 1], "float32"], {}], "config": {"index": 42814577, "code_hash": null, "entity": [["tile_f", "sp", [-1, 2, 1, 1]], ["tile_y", "sp", [-1, 16, 1, 1]], ["tile_x", "sp", [-1, 2, 1, 1]], ["tile_rc", "sp", [-1, 3]], ["tile_ry", "sp", [-1, 3]], ["tile_rx", "sp", [-1, 3]], ["auto_unroll_max_step", "ot", 512], ["unroll_explicit", "ot", 1]]}, "result": [[0.00059413, 0.0005942856370370371, 0.0005942963185185184], 0, 3.44834566116333, 1679461160.09645], "version": 0.2, "tvm_version": "0.10.0"}
{"input": ["cuda -keys=cuda,gpu -arch=sm_75 -max_num_threads=1024 -thread_warp_size=32", "conv2d_nchw.cuda", [["TENSOR", [1, 3, 224, 224], "float32"], ["TENSOR", [32, 3, 3, 3], "float32"], [2, 2], [1, 1, 1, 1], [1, 1], "float32"], {}], "config": {"index": 42814302, "code_hash": null, "entity": [["tile_f", "sp", [-1, 1, 2, 1]], ["tile_y", "sp", [-1, 2, 1, 1]], ["tile_x", "sp", [-1, 2, 1, 1]], ["tile_rc", "sp", [-1, 3]], ["tile_ry", "sp", [-1, 3]], ["tile_rx", "sp", [-1, 3]], ["auto_unroll_max_step", "ot", 512], ["unroll_explicit", "ot", 1]]}, "result": [[0.0008620842887700535, 0.0008620865862068966, 0.0008620868181818182], 0, 2.0463967323303223, 1679461161.2391577], "version": 0.2, "tvm_version": "0.10.0"}
{"input": ["cuda -keys=cuda,gpu -arch=sm_75 -max_num_threads=1024 -thread_warp_size=32", "conv2d_nchw.cuda", [["TENSOR", [1, 3, 224, 224], "float32"], ["TENSOR", [32, 3, 3, 3], "float32"], [2, 2], [1, 1, 1, 1], [1, 1], "float32"], {}], "config": {"index": 42861337, "code_hash": null, "entity": [["tile_f", "sp", [-1, 2, 1, 1]], ["tile_y", "sp", [-1, 2, 1, 1]], ["tile_x", "sp", [-1, 28, 1, 1]], ["tile_rc", "sp", [-1, 3]], ["tile_ry", "sp", [-1, 3]], ["tile_rx", "sp", [-1, 3]], ["auto_unroll_max_step", "ot", 512], ["unroll_explicit", "ot", 1]]}, "result": [[0.004471496217391305, 0.004471675695652174, 0.004471941391304348], 0, 2.6086831092834473, 1679461162.108331], "version": 0.2, "tvm_version": "0.10.0"}
{"input": ["cuda -keys=cuda,gpu -arch=sm_75 -max_num_threads=1024 -thread_warp_size=32", "conv2d_nchw.cuda", [["TENSOR", [1, 3, 224, 224], "float32"], ["TENSOR", [32, 3, 3, 3], "float32"], [2, 2], [1, 1, 1, 1], [1, 1], "float32"], {}], "config": {"index": 42814633, "code_hash": null, "entity": [["tile_f", "sp", [-1, 2, 1, 1]], ["tile_y", "sp", [-1, 28, 1, 1]], ["tile_x", "sp", [-1, 2, 1, 1]], ["tile_rc", "sp", [-1, 3]], ["tile_ry", "sp", [-1, 3]], ["tile_rx", "sp", [-1, 3]], ["auto_unroll_max_step", "ot", 512], ["unroll_explicit", "ot", 1]]}, "result": [[0.004352815347826086, 0.004352950347826087, 0.004353424695652174], 0, 2.619162082672119, 1679461162.9690223], "version": 0.2, "tvm_version": "0.10.0"}
{"input": ["cuda -keys=cuda,gpu -arch=sm_75 -max_num_threads=1024 -thread_warp_size=32", "conv2d_nchw.cuda", [["TENSOR", [1, 3, 224, 224], "float32"], ["TENSOR", [32, 3, 3, 3], "float32"], [2, 2], [1, 1, 1, 1], [1, 1], "float32"], {}], "config": {"index": 42814303, "code_hash": null, "entity": [["tile_f", "sp", [-1, 2, 2, 1]], ["tile_y", "sp", [-1, 2, 1, 1]], ["tile_x", "sp", [-1, 2, 1, 1]], ["tile_rc", "sp", [-1, 3]], ["tile_ry", "sp", [-1, 3]], ["tile_rx", "sp", [-1, 3]], ["auto_unroll_max_step", "ot", 512], ["unroll_explicit", "ot", 1]]}, "result": [[0.0005645542797202797, 0.0005645636678321678, 0.0005645733251748252], 0, 2.3427064418792725, 1679461164.226082], "version": 0.2, "tvm_version": "0.10.0"}
{"input": ["cuda -keys=cuda,gpu -arch=sm_75 -max_num_threads=1024 -thread_warp_size=32", "conv2d_nchw.cuda", [["TENSOR", [1, 3, 224, 224], "float32"], ["TENSOR", [32, 3, 3, 3], "float32"], [2, 2], [1, 1, 1, 1], [1, 1], "float32"], {}], "config": {"index": 17577398, "code_hash": null, "entity": [["tile_f", "sp", [-1, 1, 2, 1]], ["tile_y", "sp", [-1, 4, 1, 1]], ["tile_x", "sp", [-1, 4, 1, 1]], ["tile_rc", "sp", [-1, 1]], ["tile_ry", "sp", [-1, 1]], ["tile_rx", "sp", [-1, 1]], ["auto_unroll_max_step", "ot", 1500], ["unroll_explicit", "ot", 0]]}, "result": [[0.006357596952380952, 0.006359813857142858, 0.0063710871904761905], 0, 7.675845623016357, 1679461172.0174754], "version": 0.2, "tvm_version": "0.10.0"}
{"input": ["cuda -keys=cuda,gpu -arch=sm_75 -max_num_threads=1024 -thread_warp_size=32", "conv2d_nchw.cuda", [["TENSOR", [1, 3, 224, 224], "float32"], ["TENSOR", [32, 3, 3, 3], "float32"], [2, 2], [1, 1, 1, 1], [1, 1], "float32"], {}], "config": {"index": 16471901, "code_hash": null, "entity": [["tile_f", "sp", [-1, 32, 1, 1]], ["tile_y", "sp", [-1, 2, 1, 1]], ["tile_x", "sp", [-1, 2, 1, 1]], ["tile_rc", "sp", [-1, 3]], ["tile_ry", "sp", [-1, 3]], ["tile_rx", "sp", [-1, 3]], ["auto_unroll_max_step", "ot", 512], ["unroll_explicit", "ot", 0]]}, "result": [[0.0004672108465116279, 0.00046727887441860464, 0.0004683915953488372], 0, 2.6726720333099365, 1679461172.8791552], "version": 0.2, "tvm_version": "0.10.0"}
{"input": ["cuda -keys=cuda,gpu -arch=sm_75 -max_num_threads=1024 -thread_warp_size=32", "conv2d_nchw.cuda", [["TENSOR", [1, 3, 224, 224], "float32"], ["TENSOR", [32, 3, 3, 3], "float32"], [2, 2], [1, 1, 1, 1], [1, 1], "float32"], {}], "config": {"index": 51595101, "code_hash": null, "entity": [["tile_f", "sp", [-1, 32, 1, 1]], ["tile_y", "sp", [-1, 2, 1, 1]], ["tile_x", "sp", [-1, 2, 1, 1]], ["tile_rc", "sp", [-1, 3]], ["tile_ry", "sp", [-1, 3]], ["tile_rx", "sp", [-1, 3]], ["auto_unroll_max_step", "ot", 1500], ["unroll_explicit", "ot", 1]]}, "result": [[0.0004631887361111111, 0.0004632557037037037, 0.00046346621759259265], 0, 6.798133611679077, 1679461173.7246423], "version": 0.2, "tvm_version": "0.10.0"}
{"input": ["cuda -keys=cuda,gpu -arch=sm_75 -max_num_threads=1024 -thread_warp_size=32", "conv2d_nchw.cuda", [["TENSOR", [1, 3, 224, 224], "float32"], ["TENSOR", [32, 3, 3, 3], "float32"], [2, 2], [1, 1, 1, 1], [1, 1], "float32"], {}], "config": {"index": 38423901, "code_hash": null, "entity": [["tile_f", "sp", [-1, 32, 1, 1]], ["tile_y", "sp", [-1, 2, 1, 1]], ["tile_x", "sp", [-1, 2, 1, 1]], ["tile_rc", "sp", [-1, 3]], ["tile_ry", "sp", [-1, 3]], ["tile_rx", "sp", [-1, 1]], ["auto_unroll_max_step", "ot", 512], ["unroll_explicit", "ot", 1]]}, "result": [[0.0005284507344262294, 0.0005285723049180327, 0.0005285787081967214], 0, 3.7176573276519775, 1679461174.977362], "version": 0.2, "tvm_version": "0.10.0"}
{"input": ["cuda -keys=cuda,gpu -arch=sm_75 -max_num_threads=1024 -thread_warp_size=32", "conv2d_nchw.cuda", [["TENSOR", [1, 3, 224, 224], "float32"], ["TENSOR", [32, 3, 3, 3], "float32"], [2, 2], [1, 1, 1, 1], [1, 1], "float32"], {}], "config": {"index": 40619101, "code_hash": null, "entity": [["tile_f", "sp", [-1, 32, 1, 1]], ["tile_y", "sp", [-1, 2, 1, 1]], ["tile_x", "sp", [-1, 2, 1, 1]], ["tile_rc", "sp", [-1, 3]], ["tile_ry", "sp", [-1, 1]], ["tile_rx", "sp", [-1, 3]], ["auto_unroll_max_step", "ot", 512], ["unroll_explicit", "ot", 1]]}, "result": [[0.0005327504966666667, 0.00053291692, 0.0005331136066666665], 0, 3.6307082176208496, 1679461176.2206092], "version": 0.2, "tvm_version": "0.10.0"}
{"input": ["cuda -keys=cuda,gpu -arch=sm_75 -max_num_threads=1024 -thread_warp_size=32", "conv2d_nchw.cuda", [["TENSOR", [1, 3, 224, 224], "float32"], ["TENSOR", [32, 3, 3, 3], "float32"], [2, 2], [1, 1, 1, 1], [1, 1], "float32"], {}], "config": {"index": 41716701, "code_hash": null, "entity": [["tile_f", "sp", [-1, 32, 1, 1]], ["tile_y", "sp", [-1, 2, 1, 1]], ["tile_x", "sp", [-1, 2, 1, 1]], ["tile_rc", "sp", [-1, 1]], ["tile_ry", "sp", [-1, 3]], ["tile_rx", "sp", [-1, 3]], ["auto_unroll_max_step", "ot", 512], ["unroll_explicit", "ot", 1]]}, "result": [[0.0005035696918238993, 0.0005036276540880503, 0.0005036613867924529], 0, 3.593135118484497, 1679461177.4589443], "version": 0.2, "tvm_version": "0.10.0"}
{"input": ["cuda -keys=cuda,gpu -arch=sm_75 -max_num_threads=1024 -thread_warp_size=32", "conv2d_nchw.cuda", [["TENSOR", [1, 3, 224, 224], "float32"], ["TENSOR", [32, 3, 3, 3], "float32"], [2, 2], [1, 1, 1, 1], [1, 1], "float32"], {}], "config": {"index": 42869181, "code_hash": null, "entity": [["tile_f", "sp", [-1, 32, 1, 1]], ["tile_y", "sp", [-1, 2, 1, 1]], ["tile_x", "sp", [-1, 56, 1, 1]], ["tile_rc", "sp", [-1, 3]], ["tile_ry", "sp", [-1, 3]], ["tile_rx", "sp", [-1, 3]], ["auto_unroll_max_step", "ot", 512], ["unroll_explicit", "ot", 1]]}, "result": [[0.026495096, 0.02653937525, 0.026541864249999998], 0, 2.4391705989837646, 1679461178.4080937], "version": 0.2, "tvm_version": "0.10.0"}
{"input": ["cuda -keys=cuda,gpu -arch=sm_75 -max_num_threads=1024 -thread_warp_size=32", "conv2d_nchw.cuda", [["TENSOR", [1, 3, 224, 224], "float32"], ["TENSOR", [32, 3, 3, 3], "float32"], [2, 2], [1, 1, 1, 1], [1, 1], "float32"], {}], "config": {"index": 42814693, "code_hash": null, "entity": [["tile_f", "sp", [-1, 32, 1, 1]], ["tile_y", "sp", [-1, 56, 1, 1]], ["tile_x", "sp", [-1, 2, 1, 1]], ["tile_rc", "sp", [-1, 3]], ["tile_ry", "sp", [-1, 3]], ["tile_rx", "sp", [-1, 3]], ["auto_unroll_max_step", "ot", 512], ["unroll_explicit", "ot", 1]]}, "result": [[0.02608900825, 0.02609382425, 0.02609612075], 0, 2.453253746032715, 1679461179.335187], "version": 0.2, "tvm_version": "0.10.0"}
{"input": ["cuda -keys=cuda,gpu -arch=sm_75 -max_num_threads=1024 -thread_warp_size=32", "conv2d_nchw.cuda", [["TENSOR", [1, 3, 224, 224], "float32"], ["TENSOR", [32, 3, 3, 3], "float32"], [2, 2], [1, 1, 1, 1], [1, 1], "float32"], {}], "config": {"index": 42814308, "code_hash": null, "entity": [["tile_f", "sp", [-1, 2, 4, 1]], ["tile_y", "sp", [-1, 2, 1, 1]], ["tile_x", "sp", [-1, 2, 1, 1]], ["tile_rc", "sp", [-1, 3]], ["tile_ry", "sp", [-1, 3]], ["tile_rx", "sp", [-1, 3]], ["auto_unroll_max_step", "ot", 512], ["unroll_explicit", "ot", 1]]}, "result": [[0.00034638947311827953, 0.0003464052258064516, 0.00034642009032258064], 0, 2.2967631816864014, 1679461180.5838223], "version": 0.2, "tvm_version": "0.10.0"}
{"input": ["cuda -keys=cuda,gpu -arch=sm_75 -max_num_threads=1024 -thread_warp_size=32", "conv2d_nchw.cuda", [["TENSOR", [1, 3, 224, 224], "float32"], ["TENSOR", [32, 3, 3, 3], "float32"], [2, 2], [1, 1, 1, 1], [1, 1], "float32"], {}], "config": {"index": 34033501, "code_hash": null, "entity": [["tile_f", "sp", [-1, 32, 1, 1]], ["tile_y", "sp", [-1, 2, 1, 1]], ["tile_x", "sp", [-1, 2, 1, 1]], ["tile_rc", "sp", [-1, 3]], ["tile_ry", "sp", [-1, 3]], ["tile_rx", "sp", [-1, 3]], ["auto_unroll_max_step", "ot", 0], ["unroll_explicit", "ot", 1]]}, "result": [[0.0008031288571428572, 0.0008032060634920635, 0.0008034486269841271], 0, 2.339775323867798, 1679461181.4279675], "version": 0.2, "tvm_version": "0.10.0"}
{"input": ["cuda -keys=cuda,gpu -arch=sm_75 -max_num_threads=1024 -thread_warp_size=32", "conv2d_nchw.cuda", [["TENSOR", [1, 3, 224, 224], "float32"], ["TENSOR", [32, 3, 3, 3], "float32"], [2, 2], [1, 1, 1, 1], [1, 1], "float32"], {}], "config": {"index": 42877021, "code_hash": null, "entity": [["tile_f", "sp", [-1, 32, 1, 1]], ["tile_y", "sp", [-1, 2, 1, 1]], ["tile_x", "sp", [-1, 112, 1, 1]], ["tile_rc", "sp", [-1, 3]], ["tile_ry", "sp", [-1, 3]], ["tile_rx", "sp", [-1, 3]], ["auto_unroll_max_step", "ot", 512], ["unroll_explicit", "ot", 1]]}, "result": [[0.0278026235, 0.02781217575, 0.0278646715], 0, 2.4588868618011475, 1679461182.411061], "version": 0.2, "tvm_version": "0.10.0"}
{"input": ["cuda -keys=cuda,gpu -arch=sm_75 -max_num_threads=1024 -thread_warp_size=32", "conv2d_nchw.cuda", [["TENSOR", [1, 3, 224, 224], "float32"], ["TENSOR", [32, 3, 3, 3], "float32"], [2, 2], [1, 1, 1, 1], [1, 1], "float32"], {}], "config": {"index": 42814749, "code_hash": null, "entity": [["tile_f", "sp", [-1, 32, 1, 1]], ["tile_y", "sp", [-1, 112, 1, 1]], ["tile_x", "sp", [-1, 2, 1, 1]], ["tile_rc", "sp", [-1, 3]], ["tile_ry", "sp", [-1, 3]], ["tile_rx", "sp", [-1, 3]], ["auto_unroll_max_step", "ot", 512], ["unroll_explicit", "ot", 1]]}, "result": [[0.02780734425, 0.0278143995, 0.02783513625], 0, 2.4831044673919678, 1679461183.3928182], "version": 0.2, "tvm_version": "0.10.0"}
{"input": ["cuda -keys=cuda,gpu -arch=sm_75 -max_num_threads=1024 -thread_warp_size=32", "conv2d_nchw.cuda", [["TENSOR", [1, 3, 224, 224], "float32"], ["TENSOR", [32, 3, 3, 3], "float32"], [2, 2], [1, 1, 1, 1], [1, 1], "float32"], {}], "config": {"index": 42814309, "code_hash": null, "entity": [["tile_f", "sp", [-1, 4, 4, 1]], ["tile_y", "sp", [-1, 2, 1, 1]], ["tile_x", "sp", [-1, 2, 1, 1]], ["tile_rc", "sp", [-1, 3]], ["tile_ry", "sp", [-1, 3]], ["tile_rx", "sp", [-1, 3]], ["auto_unroll_max_step", "ot", 512], ["unroll_explicit", "ot", 1]]}, "result": [[0.0002760858664383562, 0.0002760983544520548, 0.0002761062448630137], 0, 2.8215272426605225, 1679461184.639779], "version": 0.2, "tvm_version": "0.10.0"}
{"input": ["cuda -keys=cuda,gpu -arch=sm_75 -max_num_threads=1024 -thread_warp_size=32", "conv2d_nchw.cuda", [["TENSOR", [1, 3, 224, 224], "float32"], ["TENSOR", [32, 3, 3, 3], "float32"], [2, 2], [1, 1, 1, 1], [1, 1], "float32"], {}], "config": {"index": 42884861, "code_hash": null, "entity": [["tile_f", "sp", [-1, 32, 1, 1]], ["tile_y", "sp", [-1, 2, 1, 1]], ["tile_x", "sp", [-1, 1, 2, 1]], ["tile_rc", "sp", [-1, 3]], ["tile_ry", "sp", [-1, 3]], ["tile_rx", "sp", [-1, 3]], ["auto_unroll_max_step", "ot", 512], ["unroll_explicit", "ot", 1]]}, "result": [[0.0002892839712230216, 0.0002893683884892086, 0.00028937818525179857], 0, 4.148039102554321, 1679461185.888004], "version": 0.2, "tvm_version": "0.10.0"}
{"input": ["cuda -keys=cuda,gpu -arch=sm_75 -max_num_threads=1024 -thread_warp_size=32", "conv2d_nchw.cuda", [["TENSOR", [1, 3, 224, 224], "float32"], ["TENSOR", [32, 3, 3, 3], "float32"], [2, 2], [1, 1, 1, 1], [1, 1], "float32"], {}], "config": {"index": 42814805, "code_hash": null, "entity": [["tile_f", "sp", [-1, 32, 1, 1]], ["tile_y", "sp", [-1, 1, 2, 1]], ["tile_x", "sp", [-1, 2, 1, 1]], ["tile_rc", "sp", [-1, 3]], ["tile_ry", "sp", [-1, 3]], ["tile_rx", "sp", [-1, 3]], ["auto_unroll_max_step", "ot", 512], ["unroll_explicit", "ot", 1]]}, "result": [[0.00030077742342342345, 0.0003008337387387387, 0.0003009815135135135], 0, 3.747568130493164, 1679461186.730383], "version": 0.2, "tvm_version": "0.10.0"}
{"input": ["cuda -keys=cuda,gpu -arch=sm_75 -max_num_threads=1024 -thread_warp_size=32", "conv2d_nchw.cuda", [["TENSOR", [1, 3, 224, 224], "float32"], ["TENSOR", [32, 3, 3, 3], "float32"], [2, 2], [1, 1, 1, 1], [1, 1], "float32"], {}], "config": {"index": 42814310, "code_hash": null, "entity": [["tile_f", "sp", [-1, 8, 4, 1]], ["tile_y", "sp", [-1, 2, 1, 1]], ["tile_x", "sp", [-1, 2, 1, 1]], ["tile_rc", "sp", [-1, 3]], ["tile_ry", "sp", [-1, 3]], ["tile_rx", "sp", [-1, 3]], ["auto_unroll_max_step", "ot", 512], ["unroll_explicit", "ot", 1]]}, "result": [[0.00027047991351351354, 0.00027057954864864866, 0.00027059692972972974], 0, 2.584429979324341, 1679461187.575482], "version": 0.2, "tvm_version": "0.10.0"}
{"input": ["cuda -keys=cuda,gpu -arch=sm_75 -max_num_threads=1024 -thread_warp_size=32", "conv2d_nchw.cuda", [["TENSOR", [1, 3, 224, 224], "float32"], ["TENSOR", [32, 3, 3, 3], "float32"], [2, 2], [1, 1, 1, 1], [1, 1], "float32"], {}], "config": {"index": 17577407, "code_hash": null, "entity": [["tile_f", "sp", [-1, 1, 8, 1]], ["tile_y", "sp", [-1, 4, 1, 1]], ["tile_x", "sp", [-1, 4, 1, 1]], ["tile_rc", "sp", [-1, 1]], ["tile_ry", "sp", [-1, 1]], ["tile_rx", "sp", [-1, 1]], ["auto_unroll_max_step", "ot", 1500], ["unroll_explicit", "ot", 0]]}, "result": [[0.0005942223285714286, 0.000594363438095238, 0.0006371940238095239], 0, 2.1356403827667236, 1679461191.313836], "version": 0.2, "tvm_version": "0.10.0"}
{"input": ["cuda -keys=cuda,gpu -arch=sm_75 -max_num_threads=1024 -thread_warp_size=32", "conv2d_nchw.cuda", [["TENSOR", [1, 3, 224, 224], "float32"], ["TENSOR", [32, 3, 3, 3], "float32"], [2, 2], [1, 1, 1, 1], [1, 1], "float32"], {}], "config": {"index": 51595110, "code_hash": null, "entity": [["tile_f", "sp", [-1, 8, 4, 1]], ["tile_y", "sp", [-1, 2, 1, 1]], ["tile_x", "sp", [-1, 2, 1, 1]], ["tile_rc", "sp", [-1, 3]], ["tile_ry", "sp", [-1, 3]], ["tile_rx", "sp", [-1, 3]], ["auto_unroll_max_step", "ot", 1500], ["unroll_explicit", "ot", 1]]}, "result": [[0.00025626782958199356, 0.00025627987459807077, 0.00025630256591639873], 0, 3.415543794631958, 1679461192.5607462], "version": 0.2, "tvm_version": "0.10.0"}
{"input": ["cuda -keys=cuda,gpu -arch=sm_75 -max_num_threads=1024 -thread_warp_size=32", "conv2d_nchw.cuda", [["TENSOR", [1, 3, 224, 224], "float32"], ["TENSOR", [32, 3, 3, 3], "float32"], [2, 2], [1, 1, 1, 1], [1, 1], "float32"], {}], "config": {"index": 42892710, "code_hash": null, "entity": [["tile_f", "sp", [-1, 8, 4, 1]], ["tile_y", "sp", [-1, 2, 1, 1]], ["tile_x", "sp", [-1, 2, 2, 1]], ["tile_rc", "sp", [-1, 3]], ["tile_ry", "sp", [-1, 3]], ["tile_rx", "sp", [-1, 3]], ["auto_unroll_max_step", "ot", 512], ["unroll_explicit", "ot", 1]]}, "result": [[0.00013713333447390932, 0.00013713715911035075, 0.00013716035414884517], 0, 2.7235753536224365, 1679461193.8216386], "version": 0.2, "tvm_version": "0.10.0"}
{"input": ["cuda -keys=cuda,gpu -arch=sm_75 -max_num_threads=1024 -thread_warp_size=32", "conv2d_nchw.cuda", [["TENSOR", [1, 3, 224, 224], "float32"], ["TENSOR", [32, 3, 3, 3], "float32"], [2, 2], [1, 1, 1, 1], [1, 1], "float32"], {}], "config": {"index": 42814870, "code_hash": null, "entity": [["tile_f", "sp", [-1, 8, 4, 1]], ["tile_y", "sp", [-1, 2, 2, 1]], ["tile_x", "sp", [-1, 2, 1, 1]], ["tile_rc", "sp", [-1, 3]], ["tile_ry", "sp", [-1, 3]], ["tile_rx", "sp", [-1, 3]], ["auto_unroll_max_step", "ot", 512], ["unroll_explicit", "ot", 1]]}, "result": [[0.00015640365725413827, 0.00015642867770204478, 0.00015643849853943527], 0, 2.5893115997314453, 1679461195.0597115], "version": 0.2, "tvm_version": "0.10.0"}
{"input": ["cuda -keys=cuda,gpu -arch=sm_75 -max_num_threads=1024 -thread_warp_size=32", "conv2d_nchw.cuda", [["TENSOR", [1, 3, 224, 224], "float32"], ["TENSOR", [32, 3, 3, 3], "float32"], [2, 2], [1, 1, 1, 1], [1, 1], "float32"], {}], "config": {"index": 42814320, "code_hash": null, "entity": [["tile_f", "sp", [-1, 8, 1, 2]], ["tile_y", "sp", [-1, 2, 1, 1]], ["tile_x", "sp", [-1, 2, 1, 1]], ["tile_rc", "sp", [-1, 3]], ["tile_ry", "sp", [-1, 3]], ["tile_rx", "sp", [-1, 3]], ["auto_unroll_max_step", "ot", 512], ["unroll_explicit", "ot", 1]]}, "result": [[0.00047742690952380954, 0.0004774663619047619, 0.0004774765714285714], 0, 2.7404236793518066, 1679461195.9046445], "version": 0.2, "tvm_version": "0.10.0"}
{"input": ["cuda -keys=cuda,gpu -arch=sm_75 -max_num_threads=1024 -thread_warp_size=32", "conv2d_nchw.cuda", [["TENSOR", [1, 3, 224, 224], "float32"], ["TENSOR", [32, 3, 3, 3], "float32"], [2, 2], [1, 1, 1, 1], [1, 1], "float32"], {}], "config": {"index": 42814300, "code_hash": null, "entity": [["tile_f", "sp", [-1, 16, 1, 1]], ["tile_y", "sp", [-1, 2, 1, 1]], ["tile_x", "sp", [-1, 2, 1, 1]], ["tile_rc", "sp", [-1, 3]], ["tile_ry", "sp", [-1, 3]], ["tile_rx", "sp", [-1, 3]], ["auto_unroll_max_step", "ot", 512], ["unroll_explicit", "ot", 1]]}, "result": [[0.0004771644952380952, 0.0004771977, 0.0004772121952380953], 0, 2.7955079078674316, 1679461196.7513587], "version": 0.2, "tvm_version": "0.10.0"}
{"input": ["cuda -keys=cuda,gpu -arch=sm_75 -max_num_threads=1024 -thread_warp_size=32", "conv2d_nchw.cuda", [["TENSOR", [1, 3, 224, 224], "float32"], ["TENSOR", [32, 3, 3, 3], "float32"], [2, 2], [1, 1, 1, 1], [1, 1], "float32"], {}], "config": {"index": 16471910, "code_hash": null, "entity": [["tile_f", "sp", [-1, 8, 4, 1]], ["tile_y", "sp", [-1, 2, 1, 1]], ["tile_x", "sp", [-1, 2, 1, 1]], ["tile_rc", "sp", [-1, 3]], ["tile_ry", "sp", [-1, 3]], ["tile_rx", "sp", [-1, 3]], ["auto_unroll_max_step", "ot", 512], ["unroll_explicit", "ot", 0]]}, "result": [[0.00027126156974789916, 0.00027131422016806725, 0.00027133245378151263], 0, 2.2676329612731934, 1679461197.997276], "version": 0.2, "tvm_version": "0.10.0"}
{"input": ["cuda -keys=cuda,gpu -arch=sm_75 -max_num_threads=1024 -thread_warp_size=32", "conv2d_nchw.cuda", [["TENSOR", [1, 3, 224, 224], "float32"], ["TENSOR", [32, 3, 3, 3], "float32"], [2, 2], [1, 1, 1, 1], [1, 1], "float32"], {}], "config": {"index": 34033510, "code_hash": null, "entity": [["tile_f", "sp", [-1, 8, 4, 1]], ["tile_y", "sp", [-1, 2, 1, 1]], ["tile_x", "sp", [-1, 2, 1, 1]], ["tile_rc", "sp", [-1, 3]], ["tile_ry", "sp", [-1, 3]], ["tile_rx", "sp", [-1, 3]], ["auto_unroll_max_step", "ot", 0], ["unroll_explicit", "ot", 1]]}, "result": [[0.00026187592931937174, 0.0002618811230366492, 0.00026199606282722516], 0, 1.4658231735229492, 1679461198.8505418], "version": 0.2, "tvm_version": "0.10.0"}
{"input": ["cuda -keys=cuda,gpu -arch=sm_75 -max_num_threads=1024 -thread_warp_size=32", "conv2d_nchw.cuda", [["TENSOR", [1, 3, 224, 224], "float32"], ["TENSOR", [32, 3, 3, 3], "float32"], [2, 2], [1, 1, 1, 1], [1, 1], "float32"], {}], "config": {"index": 38423910, "code_hash": null, "entity": [["tile_f", "sp", [-1, 8, 4, 1]], ["tile_y", "sp", [-1, 2, 1, 1]], ["tile_x", "sp", [-1, 2, 1, 1]], ["tile_rc", "sp", [-1, 3]], ["tile_ry", "sp", [-1, 3]], ["tile_rx", "sp", [-1, 1]], ["auto_unroll_max_step", "ot", 512], ["unroll_explicit", "ot", 1]]}, "result": [[0.00031766356126482215, 0.00031767007509881425, 0.0003178609308300395], 0, 2.195103883743286, 1679461200.1013267], "version": 0.2, "tvm_version": "0.10.0"}
{"input": ["cuda -keys=cuda,gpu -arch=sm_75 -max_num_threads=1024 -thread_warp_size=32", "conv2d_nchw.cuda", [["TENSOR", [1, 3, 224, 224], "float32"], ["TENSOR", [32, 3, 3, 3], "float32"], [2, 2], [1, 1, 1, 1], [1, 1], "float32"], {}], "config": {"index": 40619110, "code_hash": null, "entity": [["tile_f", "sp", [-1, 8, 4, 1]], ["tile_y", "sp", [-1, 2, 1, 1]], ["tile_x", "sp", [-1, 2, 1, 1]], ["tile_rc", "sp", [-1, 3]], ["tile_ry", "sp", [-1, 1]], ["tile_rx", "sp", [-1, 3]], ["auto_unroll_max_step", "ot", 512], ["unroll_explicit", "ot", 1]]}, "result": [[0.0003005374521575985, 0.0003005813395872421, 0.0003007024934333959], 0, 2.357408046722412, 1679461201.3444216], "version": 0.2, "tvm_version": "0.10.0"}
{"input": ["cuda -keys=cuda,gpu -arch=sm_75 -max_num_threads=1024 -thread_warp_size=32", "conv2d_nchw.cuda", [["TENSOR", [1, 3, 224, 224], "float32"], ["TENSOR", [32, 3, 3, 3], "float32"], [2, 2], [1, 1, 1, 1], [1, 1], "float32"], {}], "config": {"index": 41716710, "code_hash": null, "entity": [["tile_f", "sp", [-1, 8, 4, 1]], ["tile_y", "sp", [-1, 2, 1, 1]], ["tile_x", "sp", [-1, 2, 1, 1]], ["tile_rc", "sp", [-1, 1]], ["tile_ry", "sp", [-1, 3]], ["tile_rx", "sp", [-1, 3]], ["auto_unroll_max_step", "ot", 512], ["unroll_explicit", "ot", 1]]}, "result": [[0.00028544186809269164, 0.0002854641729055258, 0.0002854899572192513], 0, 2.141569137573242, 1679461202.5926023], "version": 0.2, "tvm_version": "0.10.0"}
{"input": ["cuda -keys=cuda,gpu -arch=sm_75 -max_num_threads=1024 -thread_warp_size=32", "conv2d_nchw.cuda", [["TENSOR", [1, 3, 224, 224], "float32"], ["TENSOR", [32, 3, 3, 3], "float32"], [2, 2], [1, 1, 1, 1], [1, 1], "float32"], {}], "config": {"index": 42900550, "code_hash": null, "entity": [["tile_f", "sp", [-1, 8, 4, 1]], ["tile_y", "sp", [-1, 2, 1, 1]], ["tile_x", "sp", [-1, 4, 2, 1]], ["tile_rc", "sp", [-1, 3]], ["tile_ry", "sp", [-1, 3]], ["tile_rx", "sp", [-1, 3]], ["auto_unroll_max_step", "ot", 512], ["unroll_explicit", "ot", 1]]}, "result": [[0.00011038811387163562, 0.00011039553761214632, 0.0001105641111111111], 0, 2.932546377182007, 1679461203.8410242], "version": 0.2, "tvm_version": "0.10.0"}
{"input": ["cuda -keys=cuda,gpu -arch=sm_75 -max_num_threads=1024 -thread_warp_size=32", "conv2d_nchw.cuda", [["TENSOR", [1, 3, 224, 224], "float32"], ["TENSOR", [32, 3, 3, 3], "float32"], [2, 2], [1, 1, 1, 1], [1, 1], "float32"], {}], "config": {"index": 42814926, "code_hash": null, "entity": [["tile_f", "sp", [-1, 8, 4, 1]], ["tile_y", "sp", [-1, 4, 2, 1]], ["tile_x", "sp", [-1, 2, 1, 1]], ["tile_rc", "sp", [-1, 3]], ["tile_ry", "sp", [-1, 3]], ["tile_rx", "sp", [-1, 3]], ["auto_unroll_max_step", "ot", 512], ["unroll_explicit", "ot", 1]]}, "result": [[0.00013847254379878578, 0.00013850279705117087, 0.0001386049106678231], 0, 2.995481252670288, 1679461205.0868785], "version": 0.2, "tvm_version": "0.10.0"}
{"input": ["cuda -keys=cuda,gpu -arch=sm_75 -max_num_threads=1024 -thread_warp_size=32", "conv2d_nchw.cuda", [["TENSOR", [1, 3, 224, 224], "float32"], ["TENSOR", [32, 3, 3, 3], "float32"], [2, 2], [1, 1, 1, 1], [1, 1], "float32"], {}], "config": {"index": 42814321, "code_hash": null, "entity": [["tile_f", "sp", [-1, 16, 1, 2]], ["tile_y", "sp", [-1, 2, 1, 1]], ["tile_x", "sp", [-1, 2, 1, 1]], ["tile_rc", "sp", [-1, 3]], ["tile_ry", "sp", [-1, 3]], ["tile_rx", "sp", [-1, 3]], ["auto_unroll_max_step", "ot", 512], ["unroll_explicit", "ot", 1]]}, "result": [[0.0004712430087463556, 0.0004713093381924198, 0.00047130982798833815], 0, 3.31710147857666, 1679461206.3387082], "version": 0.2, "tvm_version": "0.10.0"}
{"input": ["cuda -keys=cuda,gpu -arch=sm_75 -max_num_threads=1024 -thread_warp_size=32", "conv2d_nchw.cuda", [["TENSOR", [1, 3, 224, 224], "float32"], ["TENSOR", [32, 3, 3, 3], "float32"], [2, 2], [1, 1, 1, 1], [1, 1], "float32"], {}], "config": {"index": 42814299, "code_hash": null, "entity": [["tile_f", "sp", [-1, 8, 1, 1]], ["tile_y", "sp", [-1, 2, 1, 1]], ["tile_x", "sp", [-1, 2, 1, 1]], ["tile_rc", "sp", [-1, 3]], ["tile_ry", "sp", [-1, 3]], ["tile_rx", "sp", [-1, 3]], ["auto_unroll_max_step", "ot", 512], ["unroll_explicit", "ot", 1]]}, "result": [[0.0005496026318681319, 0.0005496061538461538, 0.0005496365879120879], 0, 2.313443422317505, 1679461207.1830375], "version": 0.2, "tvm_version": "0.10.0"}
{"input": ["cuda -keys=cuda,gpu -arch=sm_75 -max_num_threads=1024 -thread_warp_size=32", "conv2d_nchw.cuda", [["TENSOR", [1, 3, 224, 224], "float32"], ["TENSOR", [32, 3, 3, 3], "float32"], [2, 2], [1, 1, 1, 1], [1, 1], "float32"], {}], "config": {"index": 42908390, "code_hash": null, "entity": [["tile_f", "sp", [-1, 8, 4, 1]], ["tile_y", "sp", [-1, 2, 1, 1]], ["tile_x", "sp", [-1, 7, 2, 1]], ["tile_rc", "sp", [-1, 3]], ["tile_ry", "sp", [-1, 3]], ["tile_rx", "sp", [-1, 3]], ["auto_unroll_max_step", "ot", 512], ["unroll_explicit", "ot", 1]]}, "result": [[0.00011225277731092436, 0.00011228002521008405, 0.00011239932773109243], 0, 3.8022818565368652, 1679461208.435896], "version": 0.2, "tvm_version": "0.10.0"}
{"input": ["cuda -keys=cuda,gpu -arch=sm_75 -max_num_threads=1024 -thread_warp_size=32", "conv2d_nchw.cuda", [["TENSOR", [1, 3, 224, 224], "float32"], ["TENSOR", [32, 3, 3, 3], "float32"], [2, 2], [1, 1, 1, 1], [1, 1], "float32"], {}], "config": {"index": 42814982, "code_hash": null, "entity": [["tile_f", "sp", [-1, 8, 4, 1]], ["tile_y", "sp", [-1, 7, 2, 1]], ["tile_x", "sp", [-1, 2, 1, 1]], ["tile_rc", "sp", [-1, 3]], ["tile_ry", "sp", [-1, 3]], ["tile_rx", "sp", [-1, 3]], ["auto_unroll_max_step", "ot", 512], ["unroll_explicit", "ot", 1]]}, "result": [[0.0001391363506063947, 0.0001391759360529217, 0.00013947399558985666], 0, 3.7157278060913086, 1679461219.647284], "version": 0.2, "tvm_version": "0.10.0"}
{"input": ["cuda -keys=cuda,gpu -arch=sm_75 -max_num_threads=1024 -thread_warp_size=32", "conv2d_nchw.cuda", [["TENSOR", [1, 3, 224, 224], "float32"], ["TENSOR", [32, 3, 3, 3], "float32"], [2, 2], [1, 1, 1, 1], [1, 1], "float32"], {}], "config": {"index": 42814322, "code_hash": null, "entity": [["tile_f", "sp", [-1, 1, 2, 2]], ["tile_y", "sp", [-1, 2, 1, 1]], ["tile_x", "sp", [-1, 2, 1, 1]], ["tile_rc", "sp", [-1, 3]], ["tile_ry", "sp", [-1, 3]], ["tile_rx", "sp", [-1, 3]], ["auto_unroll_max_step", "ot", 512], ["unroll_explicit", "ot", 1]]}, "result": [[0.0005121755428571428, 0.0005121950634920635, 0.0005122225777777778], 0, 2.3256282806396484, 1679461220.8438659], "version": 0.2, "tvm_version": "0.10.0"}
{"input": ["cuda -keys=cuda,gpu -arch=sm_75 -max_num_threads=1024 -thread_warp_size=32", "conv2d_nchw.cuda", [["TENSOR", [1, 3, 224, 224], "float32"], ["TENSOR", [32, 3, 3, 3], "float32"], [2, 2], [1, 1, 1, 1], [1, 1], "float32"], {}], "config": {"index": 17663647, "code_hash": null, "entity": [["tile_f", "sp", [-1, 1, 8, 1]], ["tile_y", "sp", [-1, 4, 1, 1]], ["tile_x", "sp", [-1, 7, 2, 1]], ["tile_rc", "sp", [-1, 1]], ["tile_ry", "sp", [-1, 1]], ["tile_rx", "sp", [-1, 1]], ["auto_unroll_max_step", "ot", 1500], ["unroll_explicit", "ot", 0]]}, "result": [[0.00033247589278350516, 0.0003324796680412371, 0.00033262382474226807], 0, 3.5154929161071777, 1679461222.0974283], "version": 0.2, "tvm_version": "0.10.0"}
{"input": ["cuda -keys=cuda,gpu -arch=sm_75 -max_num_threads=1024 -thread_warp_size=32", "conv2d_nchw.cuda", [["TENSOR", [1, 3, 224, 224], "float32"], ["TENSOR", [32, 3, 3, 3], "float32"], [2, 2], [1, 1, 1, 1], [1, 1], "float32"], {}], "config": {"index": 16558150, "code_hash": null, "entity": [["tile_f", "sp", [-1, 8, 4, 1]], ["tile_y", "sp", [-1, 2, 1, 1]], ["tile_x", "sp", [-1, 4, 2, 1]], ["tile_rc", "sp", [-1, 3]], ["tile_ry", "sp", [-1, 3]], ["tile_rx", "sp", [-1, 3]], ["auto_unroll_max_step", "ot", 512], ["unroll_explicit", "ot", 0]]}, "result": [[0.0001127813459119497, 0.00011278602655485674, 0.0001128117351502446], 0, 2.219785690307617, 1679461223.287225], "version": 0.2, "tvm_version": "0.10.0"}
{"input": ["cuda -keys=cuda,gpu -arch=sm_75 -max_num_threads=1024 -thread_warp_size=32", "conv2d_nchw.cuda", [["TENSOR", [1, 3, 224, 224], "float32"], ["TENSOR", [32, 3, 3, 3], "float32"], [2, 2], [1, 1, 1, 1], [1, 1], "float32"], {}], "config": {"index": 51681350, "code_hash": null, "entity": [["tile_f", "sp", [-1, 8, 4, 1]], ["tile_y", "sp", [-1, 2, 1, 1]], ["tile_x", "sp", [-1, 4, 2, 1]], ["tile_rc", "sp", [-1, 3]], ["tile_ry", "sp", [-1, 3]], ["tile_rx", "sp", [-1, 3]], ["auto_unroll_max_step", "ot", 1500], ["unroll_explicit", "ot", 1]]}, "result": [[0.00011040875878704343, 0.00011041982150241214, 0.00011043147346657476], 0, 3.425590991973877, 1679461224.5340989], "version": 0.2, "tvm_version": "0.10.0"}
{"input": ["cuda -keys=cuda,gpu -arch=sm_75 -max_num_threads=1024 -thread_warp_size=32", "conv2d_nchw.cuda", [["TENSOR", [1, 3, 224, 224], "float32"], ["TENSOR", [32, 3, 3, 3], "float32"], [2, 2], [1, 1, 1, 1], [1, 1], "float32"], {}], "config": {"index": 38510150, "code_hash": null, "entity": [["tile_f", "sp", [-1, 8, 4, 1]], ["tile_y", "sp", [-1, 2, 1, 1]], ["tile_x", "sp", [-1, 4, 2, 1]], ["tile_rc", "sp", [-1, 3]], ["tile_ry", "sp", [-1, 3]], ["tile_rx", "sp", [-1, 1]], ["auto_unroll_max_step", "ot", 512], ["unroll_explicit", "ot", 1]]}, "result": [[0.0001109897033957034, 0.00011099790852390854, 0.00011100283645183647], 0, 2.715014934539795, 1679461225.7828507], "version": 0.2, "tvm_version": "0.10.0"}
{"input": ["cuda -keys=cuda,gpu -arch=sm_75 -max_num_threads=1024 -thread_warp_size=32", "conv2d_nchw.cuda", [["TENSOR", [1, 3, 224, 224], "float32"], ["TENSOR", [32, 3, 3, 3], "float32"], [2, 2], [1, 1, 1, 1], [1, 1], "float32"], {}], "config": {"index": 40705350, "code_hash": null, "entity": [["tile_f", "sp", [-1, 8, 4, 1]], ["tile_y", "sp", [-1, 2, 1, 1]], ["tile_x", "sp", [-1, 4, 2, 1]], ["tile_rc", "sp", [-1, 3]], ["tile_ry", "sp", [-1, 1]], ["tile_rx", "sp", [-1, 3]], ["auto_unroll_max_step", "ot", 512], ["unroll_explicit", "ot", 1]]}, "result": [[0.0001085729711409396, 0.0001085893765100671, 0.00010860027315436241], 0, 2.5385990142822266, 1679461227.0304782], "version": 0.2, "tvm_version": "0.10.0"}
{"input": ["cuda -keys=cuda,gpu -arch=sm_75 -max_num_threads=1024 -thread_warp_size=32", "conv2d_nchw.cuda", [["TENSOR", [1, 3, 224, 224], "float32"], ["TENSOR", [32, 3, 3, 3], "float32"], [2, 2], [1, 1, 1, 1], [1, 1], "float32"], {}], "config": {"index": 41802950, "code_hash": null, "entity": [["tile_f", "sp", [-1, 8, 4, 1]], ["tile_y", "sp", [-1, 2, 1, 1]], ["tile_x", "sp", [-1, 4, 2, 1]], ["tile_rc", "sp", [-1, 1]], ["tile_ry", "sp", [-1, 3]], ["tile_rx", "sp", [-1, 3]], ["auto_unroll_max_step", "ot", 512], ["unroll_explicit", "ot", 1]]}, "result": [[9.321328779918272e-05, 9.321551430239346e-05, 9.321893520140105e-05], 0, 2.176417112350464, 1679461228.274938], "version": 0.2, "tvm_version": "0.10.0"}
{"input": ["cuda -keys=cuda,gpu -arch=sm_75 -max_num_threads=1024 -thread_warp_size=32", "conv2d_nchw.cuda", [["TENSOR", [1, 3, 224, 224], "float32"], ["TENSOR", [32, 3, 3, 3], "float32"], [2, 2], [1, 1, 1, 1], [1, 1], "float32"], {}], "config": {"index": 43002470, "code_hash": null, "entity": [["tile_f", "sp", [-1, 8, 4, 1]], ["tile_y", "sp", [-1, 2, 1, 1]], ["tile_x", "sp", [-1, 2, 7, 1]], ["tile_rc", "sp", [-1, 3]], ["tile_ry", "sp", [-1, 3]], ["tile_rx", "sp", [-1, 3]], ["auto_unroll_max_step", "ot", 512], ["unroll_explicit", "ot", 1]]}, "result": [[4.56454284876905e-05, 4.565321453692849e-05, 4.5668839976553344e-05], 0, 2.469594717025757, 1679461229.4969947], "version": 0.2, "tvm_version": "0.10.0"}
{"input": ["cuda -keys=cuda,gpu -arch=sm_75 -max_num_threads=1024 -thread_warp_size=32", "conv2d_nchw.cuda", [["TENSOR", [1, 3, 224, 224], "float32"], ["TENSOR", [32, 3, 3, 3], "float32"], [2, 2], [1, 1, 1, 1], [1, 1], "float32"], {}], "config": {"index": 42901278, "code_hash": null, "entity": [["tile_f", "sp", [-1, 8, 4, 1]], ["tile_y", "sp", [-1, 8, 2, 1]], ["tile_x", "sp", [-1, 4, 2, 1]], ["tile_rc", "sp", [-1, 3]], ["tile_ry", "sp", [-1, 3]], ["tile_rx", "sp", [-1, 3]], ["auto_unroll_max_step", "ot", 512], ["unroll_explicit", "ot", 1]]}, "result": [[0.0002777711845730027, 0.0002777990523415978, 0.0002779015785123967], 0, 5.893922567367554, 1679461230.3503628], "version": 0.2, "tvm_version": "0.10.0"}
{"input": ["cuda -keys=cuda,gpu -arch=sm_75 -max_num_threads=1024 -thread_warp_size=32", "conv2d_nchw.cuda", [["TENSOR", [1, 3, 224, 224], "float32"], ["TENSOR", [32, 3, 3, 3], "float32"], [2, 2], [1, 1, 1, 1], [1, 1], "float32"], {}], "config": {"index": 42900563, "code_hash": null, "entity": [["tile_f", "sp", [-1, 2, 2, 2]], ["tile_y", "sp", [-1, 2, 1, 1]], ["tile_x", "sp", [-1, 4, 2, 1]], ["tile_rc", "sp", [-1, 3]], ["tile_ry", "sp", [-1, 3]], ["tile_rx", "sp", [-1, 3]], ["auto_unroll_max_step", "ot", 512], ["unroll_explicit", "ot", 1]]}, "result": [[0.00027412847789115645, 0.00027414825170068026, 0.0002741523265306123], 0, 3.5777435302734375, 1679461231.6046069], "version": 0.2, "tvm_version": "0.10.0"}
{"input": ["cuda -keys=cuda,gpu -arch=sm_75 -max_num_threads=1024 -thread_warp_size=32", "conv2d_nchw.cuda", [["TENSOR", [1, 3, 224, 224], "float32"], ["TENSOR", [32, 3, 3, 3], "float32"], [2, 2], [1, 1, 1, 1], [1, 1], "float32"], {}], "config": {"index": 42900537, "code_hash": null, "entity": [["tile_f", "sp", [-1, 2, 1, 1]], ["tile_y", "sp", [-1, 2, 1, 1]], ["tile_x", "sp", [-1, 4, 2, 1]], ["tile_rc", "sp", [-1, 3]], ["tile_ry", "sp", [-1, 3]], ["tile_rx", "sp", [-1, 3]], ["auto_unroll_max_step", "ot", 512], ["unroll_explicit", "ot", 1]]}, "result": [[0.0006861071643835616, 0.0006861220547945206, 0.0006861361095890411], 0, 3.527608871459961, 1679461232.457295], "version": 0.2, "tvm_version": "0.10.0"}
{"input": ["cuda -keys=cuda,gpu -arch=sm_75 -max_num_threads=1024 -thread_warp_size=32", "conv2d_nchw.cuda", [["TENSOR", [1, 3, 224, 224], "float32"], ["TENSOR", [32, 3, 3, 3], "float32"], [2, 2], [1, 1, 1, 1], [1, 1], "float32"], {}], "config": {"index": 34119750, "code_hash": null, "entity": [["tile_f", "sp", [-1, 8, 4, 1]], ["tile_y", "sp", [-1, 2, 1, 1]], ["tile_x", "sp", [-1, 4, 2, 1]], ["tile_rc", "sp", [-1, 3]], ["tile_ry", "sp", [-1, 3]], ["tile_rx", "sp", [-1, 3]], ["auto_unroll_max_step", "ot", 0], ["unroll_explicit", "ot", 1]]}, "result": [[0.00011124296866295264, 0.0001112692360724234, 0.00011127494220055711], 0, 1.9918746948242188, 1679461233.7117832], "version": 0.2, "tvm_version": "0.10.0"}
{"input": ["cuda -keys=cuda,gpu -arch=sm_75 -max_num_threads=1024 -thread_warp_size=32", "conv2d_nchw.cuda", [["TENSOR", [1, 3, 224, 224], "float32"], ["TENSOR", [32, 3, 3, 3], "float32"], [2, 2], [1, 1, 1, 1], [1, 1], "float32"], {}], "config": {"index": 43010310, "code_hash": null, "entity": [["tile_f", "sp", [-1, 8, 4, 1]], ["tile_y", "sp", [-1, 2, 1, 1]], ["tile_x", "sp", [-1, 4, 7, 1]], ["tile_rc", "sp", [-1, 3]], ["tile_ry", "sp", [-1, 3]], ["tile_rx", "sp", [-1, 3]], ["auto_unroll_max_step", "ot", 512], ["unroll_explicit", "ot", 1]]}, "result": [[4.5065040352372834e-05, 4.506615913611822e-05, 4.5068756464904805e-05], 0, 2.9054973125457764, 1679461234.9467301], "version": 0.2, "tvm_version": "0.10.0"}
{"input": ["cuda -keys=cuda,gpu -arch=sm_75 -max_num_threads=1024 -thread_warp_size=32", "conv2d_nchw.cuda", [["TENSOR", [1, 3, 224, 224], "float32"], ["TENSOR", [32, 3, 3, 3], "float32"], [2, 2], [1, 1, 1, 1], [1, 1], "float32"], {}], "config": {"index": 42900564, "code_hash": null, "entity": [["tile_f", "sp", [-1, 4, 2, 2]], ["tile_y", "sp", [-1, 2, 1, 1]], ["tile_x", "sp", [-1, 4, 2, 1]], ["tile_rc", "sp", [-1, 3]], ["tile_ry", "sp", [-1, 3]], ["tile_rx", "sp", [-1, 3]], ["auto_unroll_max_step", "ot", 512], ["unroll_explicit", "ot", 1]]}, "result": [[0.00019198599286563613, 0.00019199330439952436, 0.00019201549464922712], 0, 4.029303073883057, 1679461236.2046187], "version": 0.2, "tvm_version": "0.10.0"}
{"input": ["cuda -keys=cuda,gpu -arch=sm_75 -max_num_threads=1024 -thread_warp_size=32", "conv2d_nchw.cuda", [["TENSOR", [1, 3, 224, 224], "float32"], ["TENSOR", [32, 3, 3, 3], "float32"], [2, 2], [1, 1, 1, 1], [1, 1], "float32"], {}], "config": {"index": 17773407, "code_hash": null, "entity": [["tile_f", "sp", [-1, 1, 8, 1]], ["tile_y", "sp", [-1, 4, 1, 1]], ["tile_x", "sp", [-1, 8, 7, 1]], ["tile_rc", "sp", [-1, 1]], ["tile_ry", "sp", [-1, 1]], ["tile_rx", "sp", [-1, 1]], ["auto_unroll_max_step", "ot", 1500], ["unroll_explicit", "ot", 0]]}, "result": [[0.00020321880623973726, 0.0002033212709359606, 0.0002036849392446634], 0, 3.382871150970459, 1679461240.0933125], "version": 0.2, "tvm_version": "0.10.0"}
{"input": ["cuda -keys=cuda,gpu -arch=sm_75 -max_num_threads=1024 -thread_warp_size=32", "conv2d_nchw.cuda", [["TENSOR", [1, 3, 224, 224], "float32"], ["TENSOR", [32, 3, 3, 3], "float32"], [2, 2], [1, 1, 1, 1], [1, 1], "float32"], {}], "config": {"index": 16667910, "code_hash": null, "entity": [["tile_f", "sp", [-1, 8, 4, 1]], ["tile_y", "sp", [-1, 2, 1, 1]], ["tile_x", "sp", [-1, 4, 7, 1]], ["tile_rc", "sp", [-1, 3]], ["tile_ry", "sp", [-1, 3]], ["tile_rx", "sp", [-1, 3]], ["auto_unroll_max_step", "ot", 512], ["unroll_explicit", "ot", 0]]}, "result": [[5.3056739625167334e-05, 5.306004886211513e-05, 5.306395548862115e-05], 0, 2.1666247844696045, 1679461241.332331], "version": 0.2, "tvm_version": "0.10.0"}
{"input": ["cuda -keys=cuda,gpu -arch=sm_75 -max_num_threads=1024 -thread_warp_size=32", "conv2d_nchw.cuda", [["TENSOR", [1, 3, 224, 224], "float32"], ["TENSOR", [32, 3, 3, 3], "float32"], [2, 2], [1, 1, 1, 1], [1, 1], "float32"], {}], "config": {"index": 38619910, "code_hash": null, "entity": [["tile_f", "sp", [-1, 8, 4, 1]], ["tile_y", "sp", [-1, 2, 1, 1]], ["tile_x", "sp", [-1, 4, 7, 1]], ["tile_rc", "sp", [-1, 3]], ["tile_ry", "sp", [-1, 3]], ["tile_rx", "sp", [-1, 1]], ["auto_unroll_max_step", "ot", 512], ["unroll_explicit", "ot", 1]]}, "result": [[5.302035055350553e-05, 5.302302247567931e-05, 5.304670144246897e-05], 0, 2.5956382751464844, 1679461242.5621963], "version": 0.2, "tvm_version": "0.10.0"}
{"input": ["cuda -keys=cuda,gpu -arch=sm_75 -max_num_threads=1024 -thread_warp_size=32", "conv2d_nchw.cuda", [["TENSOR", [1, 3, 224, 224], "float32"], ["TENSOR", [32, 3, 3, 3], "float32"], [2, 2], [1, 1, 1, 1], [1, 1], "float32"], {}], "config": {"index": 40815110, "code_hash": null, "entity": [["tile_f", "sp", [-1, 8, 4, 1]], ["tile_y", "sp", [-1, 2, 1, 1]], ["tile_x", "sp", [-1, 4, 7, 1]], ["tile_rc", "sp", [-1, 3]], ["tile_ry", "sp", [-1, 1]], ["tile_rx", "sp", [-1, 3]], ["auto_unroll_max_step", "ot", 512], ["unroll_explicit", "ot", 1]]}, "result": [[4.7847900668286755e-05, 4.78559240583232e-05, 4.786123116646415e-05], 0, 2.453263998031616, 1679461243.782715], "version": 0.2, "tvm_version": "0.10.0"}
{"input": ["cuda -keys=cuda,gpu -arch=sm_75 -max_num_threads=1024 -thread_warp_size=32", "conv2d_nchw.cuda", [["TENSOR", [1, 3, 224, 224], "float32"], ["TENSOR", [32, 3, 3, 3], "float32"], [2, 2], [1, 1, 1, 1], [1, 1], "float32"], {}], "config": {"index": 41912710, "code_hash": null, "entity": [["tile_f", "sp", [-1, 8, 4, 1]], ["tile_y", "sp", [-1, 2, 1, 1]], ["tile_x", "sp", [-1, 4, 7, 1]], ["tile_rc", "sp", [-1, 1]], ["tile_ry", "sp", [-1, 3]], ["tile_rx", "sp", [-1, 3]], ["auto_unroll_max_step", "ot", 512], ["unroll_explicit", "ot", 1]]}, "result": [[3.359038556299979e-05, 3.359702723146747e-05, 3.359818802679922e-05], 0, 2.214902877807617, 1679461245.0013926], "version": 0.2, "tvm_version": "0.10.0"}
{"input": ["cuda -keys=cuda,gpu -arch=sm_75 -max_num_threads=1024 -thread_warp_size=32", "conv2d_nchw.cuda", [["TENSOR", [1, 3, 224, 224], "float32"], ["TENSOR", [32, 3, 3, 3], "float32"], [2, 2], [1, 1, 1, 1], [1, 1], "float32"], {}], "config": {"index": 43127910, "code_hash": null, "entity": [["tile_f", "sp", [-1, 8, 4, 1]], ["tile_y", "sp", [-1, 2, 1, 1]], ["tile_x", "sp", [-1, 4, 28, 1]], ["tile_rc", "sp", [-1, 3]], ["tile_ry", "sp", [-1, 3]], ["tile_rx", "sp", [-1, 3]], ["auto_unroll_max_step", "ot", 512], ["unroll_explicit", "ot", 1]]}, "result": [[4.0677660454429404e-05, 4.068256497319377e-05, 4.0691255808016344e-05], 0, 2.567796468734741, 1679461246.236246], "version": 0.2, "tvm_version": "0.10.0"}
{"input": ["cuda -keys=cuda,gpu -arch=sm_75 -max_num_threads=1024 -thread_warp_size=32", "conv2d_nchw.cuda", [["TENSOR", [1, 3, 224, 224], "float32"], ["TENSOR", [32, 3, 3, 3], "float32"], [2, 2], [1, 1, 1, 1], [1, 1], "float32"], {}], "config": {"index": 43010325, "code_hash": null, "entity": [["tile_f", "sp", [-1, 8, 2, 2]], ["tile_y", "sp", [-1, 2, 1, 1]], ["tile_x", "sp", [-1, 4, 7, 1]], ["tile_rc", "sp", [-1, 3]], ["tile_ry", "sp", [-1, 3]], ["tile_rx", "sp", [-1, 3]], ["auto_unroll_max_step", "ot", 512], ["unroll_explicit", "ot", 1]]}, "result": [[7.021302388323751e-05, 7.021881424148607e-05, 7.02271088014153e-05], 0, 3.9255664348602295, 1679461247.4824774], "version": 0.2, "tvm_version": "0.10.0"}
{"input": ["cuda -keys=cuda,gpu -arch=sm_75 -max_num_threads=1024 -thread_warp_size=32", "conv2d_nchw.cuda", [["TENSOR", [1, 3, 224, 224], "float32"], ["TENSOR", [32, 3, 3, 3], "float32"], [2, 2], [1, 1, 1, 1], [1, 1], "float32"], {}], "config": {"index": 51791110, "code_hash": null, "entity": [["tile_f", "sp", [-1, 8, 4, 1]], ["tile_y", "sp", [-1, 2, 1, 1]], ["tile_x", "sp", [-1, 4, 7, 1]], ["tile_rc", "sp", [-1, 3]], ["tile_ry", "sp", [-1, 3]], ["tile_rx", "sp", [-1, 3]], ["auto_unroll_max_step", "ot", 1500], ["unroll_explicit", "ot", 1]]}, "result": [[4.470938558964256e-05, 4.472863411201802e-05, 4.4732649591894176e-05], 0, 3.148793935775757, 1679461248.7115948], "version": 0.2, "tvm_version": "0.10.0"}
{"input": ["cuda -keys=cuda,gpu -arch=sm_75 -max_num_threads=1024 -thread_warp_size=32", "conv2d_nchw.cuda", [["TENSOR", [1, 3, 224, 224], "float32"], ["TENSOR", [32, 3, 3, 3], "float32"], [2, 2], [1, 1, 1, 1], [1, 1], "float32"], {}], "config": {"index": 43135750, "code_hash": null, "entity": [["tile_f", "sp", [-1, 8, 4, 1]], ["tile_y", "sp", [-1, 2, 1, 1]], ["tile_x", "sp", [-1, 1, 56, 1]], ["tile_rc", "sp", [-1, 3]], ["tile_ry", "sp", [-1, 3]], ["tile_rx", "sp", [-1, 3]], ["auto_unroll_max_step", "ot", 512], ["unroll_explicit", "ot", 1]]}, "result": [[3.3584033737024224e-05, 3.358478935986159e-05, 3.3589148572664364e-05], 0, 2.4564006328582764, 1679461249.920318], "version": 0.2, "tvm_version": "0.10.0"}
{"input": ["cuda -keys=cuda,gpu -arch=sm_75 -max_num_threads=1024 -thread_warp_size=32", "conv2d_nchw.cuda", [["TENSOR", [1, 3, 224, 224], "float32"], ["TENSOR", [32, 3, 3, 3], "float32"], [2, 2], [1, 1, 1, 1], [1, 1], "float32"], {}], "config": {"index": 42884870, "code_hash": null, "entity": [["tile_f", "sp", [-1, 8, 4, 1]], ["tile_y", "sp", [-1, 2, 1, 1]], ["tile_x", "sp", [-1, 1, 2, 1]], ["tile_rc", "sp", [-1, 3]], ["tile_ry", "sp", [-1, 3]], ["tile_rx", "sp", [-1, 3]], ["auto_unroll_max_step", "ot", 512], ["unroll_explicit", "ot", 1]]}, "result": [[0.00022201195454545455, 0.00022202462809917353, 0.00022202763360881542], 0, 2.7961621284484863, 1679461251.1669545], "version": 0.2, "tvm_version": "0.10.0"}
