src/tvm/results/cuda_gtx1650/bert/random/cpu.log_layer_0.log
{"input": ["cuda -keys=cuda,gpu -arch=sm_75 -max_num_threads=1024 -thread_warp_size=32", "batch_matmul.cuda", [["TENSOR", [1, 128, 768], "float32"], ["TENSOR", [1, 768, 768], "float32"], [1, 128, 768], "float32", 0, 0], {}], "config": {"index": 47232, "code_hash": null, "entity": [["tile_y", "sp", [-1, 1, 1]], ["tile_x", "sp", [-1, 8, 24]], ["tile_k", "sp", [-1, 32]], ["auto_unroll_max_step", "ot", 8], ["unroll_explicit", "ot", 0]]}, "result": [[0.006137342272727273, 0.006140673545454545, 0.006147863181818183], 0, 2.2455945014953613, 1688589844.5972219], "version": 0.2, "tvm_version": "0.13.dev0"}
{"input": ["cuda -keys=cuda,gpu -arch=sm_75 -max_num_threads=1024 -thread_warp_size=32", "batch_matmul.cuda", [["TENSOR", [1, 128, 768], "float32"], ["TENSOR", [1, 768, 768], "float32"], [1, 128, 768], "float32", 0, 0], {}], "config": {"index": 401293, "code_hash": null, "entity": [["tile_y", "sp", [-1, 2, 1]], ["tile_x", "sp", [-1, 1, 12]], ["tile_k", "sp", [-1, 48]], ["auto_unroll_max_step", "ot", 8], ["unroll_explicit", "ot", 1]]}, "result": [[0.005242811566666667, 0.005243690466666667, 0.005248000066666666], 0, 2.199875831604004, 1688589845.9823065], "version": 0.2, "tvm_version": "0.13.dev0"}
{"input": ["cuda -keys=cuda,gpu -arch=sm_75 -max_num_threads=1024 -thread_warp_size=32", "batch_matmul.cuda", [["TENSOR", [1, 128, 768], "float32"], ["TENSOR", [1, 768, 768], "float32"], [1, 128, 768], "float32", 0, 0], {}], "config": {"index": 216619, "code_hash": null, "entity": [["tile_y", "sp", [-1, 128, 1]], ["tile_x", "sp", [-1, 1, 12]], ["tile_k", "sp", [-1, 24]], ["auto_unroll_max_step", "ot", 32], ["unroll_explicit", "ot", 0]]}, "result": [[0.0008088155728643216, 0.0008088670251256283, 0.0008090217587939698], 0, 3.3289036750793457, 1688589847.3625705], "version": 0.2, "tvm_version": "0.13.dev0"}
{"input": ["cuda -keys=cuda,gpu -arch=sm_75 -max_num_threads=1024 -thread_warp_size=32", "batch_matmul.cuda", [["TENSOR", [1, 128, 768], "float32"], ["TENSOR", [1, 768, 768], "float32"], [1, 128, 768], "float32", 0, 0], {}], "config": {"index": 522361, "code_hash": null, "entity": [["tile_y", "sp", [-1, 2, 1]], ["tile_x", "sp", [-1, 1, 8]], ["tile_k", "sp", [-1, 768]], ["auto_unroll_max_step", "ot", 16], ["unroll_explicit", "ot", 1]]}, "result": [[0.009900718636363636, 0.009937212818181818, 0.009941358363636363], 0, 1.6809592247009277, 1688589848.409062], "version": 0.2, "tvm_version": "0.13.dev0"}
{"input": ["cuda -keys=cuda,gpu -arch=sm_75 -max_num_threads=1024 -thread_warp_size=32", "batch_matmul.cuda", [["TENSOR", [1, 128, 768], "float32"], ["TENSOR", [1, 768, 768], "float32"], [1, 128, 768], "float32", 0, 0], {}], "config": {"index": 51050, "code_hash": null, "entity": [["tile_y", "sp", [-1, 4, 1]], ["tile_x", "sp", [-1, 4, 8]], ["tile_k", "sp", [-1, 48]], ["auto_unroll_max_step", "ot", 8], ["unroll_explicit", "ot", 0]]}, "result": [[0.0007732287884615384, 0.0007735459951923077, 0.0007737693749999999], 0, 1.9584276676177979, 1688589849.7326493], "version": 0.2, "tvm_version": "0.13.dev0"}
{"input": ["cuda -keys=cuda,gpu -arch=sm_75 -max_num_threads=1024 -thread_warp_size=32", "batch_matmul.cuda", [["TENSOR", [1, 128, 768], "float32"], ["TENSOR", [1, 768, 768], "float32"], [1, 128, 768], "float32", 0, 0], {}], "config": {"index": 152331, "code_hash": null, "entity": [["tile_y", "sp", [-1, 1, 4]], ["tile_x", "sp", [-1, 4, 4]], ["tile_k", "sp", [-1, 128]], ["auto_unroll_max_step", "ot", 16], ["unroll_explicit", "ot", 0]]}, "result": [[0.001369808254237288, 0.0013700344237288135, 0.0013702237808219178], 0, 1.870781660079956, 1688589850.988432], "version": 0.2, "tvm_version": "0.13.dev0"}
{"input": ["cuda -keys=cuda,gpu -arch=sm_75 -max_num_threads=1024 -thread_warp_size=32", "batch_matmul.cuda", [["TENSOR", [1, 128, 768], "float32"], ["TENSOR", [1, 768, 768], "float32"], [1, 128, 768], "float32", 0, 0], {}], "config": {"index": 445162, "code_hash": null, "entity": [["tile_y", "sp", [-1, 2, 8]], ["tile_x", "sp", [-1, 8, 12]], ["tile_k", "sp", [-1, 2]], ["auto_unroll_max_step", "ot", 16], ["unroll_explicit", "ot", 1]]}, "result": [[0.00033301544092827006, 0.00033316326371308016, 0.00033317446624472576], 0, 1.9636237621307373, 1688589852.3465405], "version": 0.2, "tvm_version": "0.13.dev0"}
{"input": ["cuda -keys=cuda,gpu -arch=sm_75 -max_num_threads=1024 -thread_warp_size=32", "batch_matmul.cuda", [["TENSOR", [1, 128, 768], "float32"], ["TENSOR", [1, 768, 768], "float32"], [1, 128, 768], "float32", 0, 0], {}], "config": {"index": 102493, "code_hash": null, "entity": [["tile_y", "sp", [-1, 2, 1]], ["tile_x", "sp", [-1, 96, 1]], ["tile_k", "sp", [-1, 4]], ["auto_unroll_max_step", "ot", 16], ["unroll_explicit", "ot", 0]]}, "result": [[0.0007061473566433566, 0.0007063379860139861, 0.0007086223216783218], 0, 1.4975414276123047, 1688589853.3365633], "version": 0.2, "tvm_version": "0.13.dev0"}
{"input": ["cuda -keys=cuda,gpu -arch=sm_75 -max_num_threads=1024 -thread_warp_size=32", "batch_matmul.cuda", [["TENSOR", [1, 128, 768], "float32"], ["TENSOR", [1, 768, 768], "float32"], [1, 128, 768], "float32", 0, 0], {}], "config": {"index": 379677, "code_hash": null, "entity": [["tile_y", "sp", [-1, 1, 8]], ["tile_x", "sp", [-1, 384, 1]], ["tile_k", "sp", [-1, 12]], ["auto_unroll_max_step", "ot", 8], ["unroll_explicit", "ot", 1]]}, "result": [[0.0002651701459369817, 0.0002651895290215589, 0.0002654320497512437], 0, 2.0511255264282227, 1688589854.7139168], "version": 0.2, "tvm_version": "0.13.dev0"}
{"input": ["cuda -keys=cuda,gpu -arch=sm_75 -max_num_threads=1024 -thread_warp_size=32", "batch_matmul.cuda", [["TENSOR", [1, 128, 768], "float32"], ["TENSOR", [1, 768, 768], "float32"], [1, 128, 768], "float32", 0, 0], {}], "config": {"index": 273975, "code_hash": null, "entity": [["tile_y", "sp", [-1, 1, 4]], ["tile_x", "sp", [-1, 16, 4]], ["tile_k", "sp", [-1, 3]], ["auto_unroll_max_step", "ot", 64], ["unroll_explicit", "ot", 0]]}, "result": [[0.00045254364492753625, 0.0004527565217391305, 0.00046164973913043477], 0, 1.669806957244873, 1688589857.536084], "version": 0.2, "tvm_version": "0.13.dev0"}
{"input": ["cuda -keys=cuda,gpu -arch=sm_75 -max_num_threads=1024 -thread_warp_size=32", "batch_matmul.cuda", [["TENSOR", [1, 128, 768], "float32"], ["TENSOR", [1, 768, 768], "float32"], [1, 128, 768], "float32", 0, 0], {}], "config": {"index": 628727, "code_hash": null, "entity": [["tile_y", "sp", [-1, 4, 8]], ["tile_x", "sp", [-1, 12, 4]], ["tile_k", "sp", [-1, 4]], ["auto_unroll_max_step", "ot", 64], ["unroll_explicit", "ot", 1]]}, "result": [[0.00022889186962750716, 0.00022905324498567333, 0.00022906205444126075], 0, 1.8945293426513672, 1688589858.901465], "version": 0.2, "tvm_version": "0.13.dev0"}
{"input": ["cuda -keys=cuda,gpu -arch=sm_75 -max_num_threads=1024 -thread_warp_size=32", "batch_matmul.cuda", [["TENSOR", [1, 128, 768], "float32"], ["TENSOR", [1, 768, 768], "float32"], [1, 128, 768], "float32", 0, 0], {}], "config": {"index": 480867, "code_hash": null, "entity": [["tile_y", "sp", [-1, 1, 4]], ["tile_x", "sp", [-1, 1, 192]], ["tile_k", "sp", [-1, 24]], ["auto_unroll_max_step", "ot", 16], ["unroll_explicit", "ot", 1]]}, "result": [[0.060938255, 0.0609393765, 0.061082527], 0, 2.614431142807007, 1688589860.044695], "version": 0.2, "tvm_version": "0.13.dev0"}
{"input": ["cuda -keys=cuda,gpu -arch=sm_75 -max_num_threads=1024 -thread_warp_size=32", "batch_matmul.cuda", [["TENSOR", [1, 128, 768], "float32"], ["TENSOR", [1, 768, 768], "float32"], [1, 128, 768], "float32", 0, 0], {}], "config": {"index": 192627, "code_hash": null, "entity": [["tile_y", "sp", [-1, 2, 16]], ["tile_x", "sp", [-1, 2, 16]], ["tile_k", "sp", [-1, 4]], ["auto_unroll_max_step", "ot", 32], ["unroll_explicit", "ot", 0]]}, "result": [[0.009109689818181818, 0.009127010636363635, 0.009135101272727273], 0, 1.8901679515838623, 1688589861.0452795], "version": 0.2, "tvm_version": "0.13.dev0"}
{"input": ["cuda -keys=cuda,gpu -arch=sm_75 -max_num_threads=1024 -thread_warp_size=32", "batch_matmul.cuda", [["TENSOR", [1, 128, 768], "float32"], ["TENSOR", [1, 768, 768], "float32"], [1, 128, 768], "float32", 0, 0], {}], "config": {"index": 267076, "code_hash": null, "entity": [["tile_y", "sp", [-1, 4, 16]], ["tile_x", "sp", [-1, 2, 192]], ["tile_k", "sp", [-1, 1]], ["auto_unroll_max_step", "ot", 64], ["unroll_explicit", "ot", 0]]}, "result": [[0.02713497525, 0.027139759000000003, 0.02714119125], 0, 2.3159914016723633, 1688589862.143189], "version": 0.2, "tvm_version": "0.13.dev0"}
{"input": ["cuda -keys=cuda,gpu -arch=sm_75 -max_num_threads=1024 -thread_warp_size=32", "batch_matmul.cuda", [["TENSOR", [1, 128, 768], "float32"], ["TENSOR", [1, 768, 768], "float32"], [1, 128, 768], "float32", 0, 0], {}], "config": {"index": 328485, "code_hash": null, "entity": [["tile_y", "sp", [-1, 1, 8]], ["tile_x", "sp", [-1, 4, 12]], ["tile_k", "sp", [-1, 128]], ["auto_unroll_max_step", "ot", 64], ["unroll_explicit", "ot", 0]]}, "result": [[0.0025570966825396823, 0.0025571926031746034, 0.0025573342857142856], 0, 2.041351795196533, 1688589863.5243564], "version": 0.2, "tvm_version": "0.13.dev0"}
{"input": ["cuda -keys=cuda,gpu -arch=sm_75 -max_num_threads=1024 -thread_warp_size=32", "batch_matmul.cuda", [["TENSOR", [1, 128, 768], "float32"], ["TENSOR", [1, 768, 768], "float32"], [1, 128, 768], "float32", 0, 0], {}], "config": {"index": 272273, "code_hash": null, "entity": [["tile_y", "sp", [-1, 32, 1]], ["tile_x", "sp", [-1, 4, 1]], ["tile_k", "sp", [-1, 3]], ["auto_unroll_max_step", "ot", 64], ["unroll_explicit", "ot", 0]]}, "result": [[0.0012461765426356592, 0.0012464982790697675, 0.001246787488372093], 0, 1.8665430545806885, 1688589864.8944778], "version": 0.2, "tvm_version": "0.13.dev0"}
{"input": ["cuda -keys=cuda,gpu -arch=sm_75 -max_num_threads=1024 -thread_warp_size=32", "batch_matmul.cuda", [["TENSOR", [1, 128, 768], "float32"], ["TENSOR", [1, 768, 768], "float32"], [1, 128, 768], "float32", 0, 0], {}], "config": {"index": 139991, "code_hash": null, "entity": [["tile_y", "sp", [-1, 4, 8]], ["tile_x", "sp", [-1, 1, 48]], ["tile_k", "sp", [-1, 48]], ["auto_unroll_max_step", "ot", 16], ["unroll_explicit", "ot", 0]]}, "result": [[0.010443000785714284, 0.010454310785714285, 0.010470400071428573], 0, 2.397925615310669, 1688589867.5381308], "version": 0.2, "tvm_version": "0.13.dev0"}
{"input": ["cuda -keys=cuda,gpu -arch=sm_75 -max_num_threads=1024 -thread_warp_size=32", "batch_matmul.cuda", [["TENSOR", [1, 128, 768], "float32"], ["TENSOR", [1, 768, 768], "float32"], [1, 128, 768], "float32", 0, 0], {}], "config": {"index": 461371, "code_hash": null, "entity": [["tile_y", "sp", [-1, 2, 32]], ["tile_x", "sp", [-1, 3, 128]], ["tile_k", "sp", [-1, 6]], ["auto_unroll_max_step", "ot", 16], ["unroll_explicit", "ot", 1]]}, "result": [[0.022211322, 0.022241445800000002, 0.0222525634], 0, 2.15096116065979, 1688589868.6496572], "version": 0.2, "tvm_version": "0.13.dev0"}
{"input": ["cuda -keys=cuda,gpu -arch=sm_75 -max_num_threads=1024 -thread_warp_size=32", "batch_matmul.cuda", [["TENSOR", [1, 128, 768], "float32"], ["TENSOR", [1, 768, 768], "float32"], [1, 128, 768], "float32", 0, 0], {}], "config": {"index": 255744, "code_hash": null, "entity": [["tile_y", "sp", [-1, 1, 1]], ["tile_x", "sp", [-1, 1, 16]], ["tile_k", "sp", [-1, 384]], ["auto_unroll_max_step", "ot", 32], ["unroll_explicit", "ot", 0]]}, "result": [[0.03553336566666667, 0.035555201, 0.03556420366666666], 0, 1.60439133644104, 1688589869.770605], "version": 0.2, "tvm_version": "0.13.dev0"}
{"input": ["cuda -keys=cuda,gpu -arch=sm_75 -max_num_threads=1024 -thread_warp_size=32", "batch_matmul.cuda", [["TENSOR", [1, 128, 768], "float32"], ["TENSOR", [1, 768, 768], "float32"], [1, 128, 768], "float32", 0, 0], {}], "config": {"index": 441253, "code_hash": null, "entity": [["tile_y", "sp", [-1, 2, 1]], ["tile_x", "sp", [-1, 24, 32]], ["tile_k", "sp", [-1, 1]], ["auto_unroll_max_step", "ot", 16], ["unroll_explicit", "ot", 1]]}, "result": [[0.0100584991, 0.010058525, 0.010065174100000001], 0, 1.5081393718719482, 1688589870.7823489], "version": 0.2, "tvm_version": "0.13.dev0"}
{"input": ["cuda -keys=cuda,gpu -arch=sm_75 -max_num_threads=1024 -thread_warp_size=32", "batch_matmul.cuda", [["TENSOR", [1, 128, 768], "float32"], ["TENSOR", [1, 768, 768], "float32"], [1, 128, 768], "float32", 0, 0], {}], "config": {"index": 551341, "code_hash": null, "entity": [["tile_y", "sp", [-1, 2, 1]], ["tile_x", "sp", [-1, 8, 6]], ["tile_k", "sp", [-1, 8]], ["auto_unroll_max_step", "ot", 32], ["unroll_explicit", "ot", 1]]}, "result": [[0.0009104950625, 0.0009108127215909091, 0.0009108702045454545], 0, 1.9011850357055664, 1688589872.1539304], "version": 0.2, "tvm_version": "0.13.dev0"}
{"input": ["cuda -keys=cuda,gpu -arch=sm_75 -max_num_threads=1024 -thread_warp_size=32", "batch_matmul.cuda", [["TENSOR", [1, 128, 768], "float32"], ["TENSOR", [1, 768, 768], "float32"], [1, 128, 768], "float32", 0, 0], {}], "config": {"index": 305656, "code_hash": null, "entity": [["tile_y", "sp", [-1, 2, 4]], ["tile_x", "sp", [-1, 2, 96]], ["tile_k", "sp", [-1, 24]], ["auto_unroll_max_step", "ot", 64], ["unroll_explicit", "ot", 0]]}, "result": [[0.0066764526363636365, 0.00670896840909091, 0.006769101227272728], 0, 2.5788798332214355, 1688589873.4856093], "version": 0.2, "tvm_version": "0.13.dev0"}
{"input": ["cuda -keys=cuda,gpu -arch=sm_75 -max_num_threads=1024 -thread_warp_size=32", "batch_matmul.cuda", [["TENSOR", [1, 128, 768], "float32"], ["TENSOR", [1, 768, 768], "float32"], [1, 128, 768], "float32", 0, 0], {}], "config": {"index": 108328, "code_hash": null, "entity": [["tile_y", "sp", [-1, 16, 1]], ["tile_x", "sp", [-1, 32, 3]], ["tile_k", "sp", [-1, 6]], ["auto_unroll_max_step", "ot", 16], ["unroll_explicit", "ot", 0]]}, "result": [[0.0004034350460358056, 0.0004034543631713555, 0.0004035114936061381], 0, 1.8686435222625732, 1688589874.840974], "version": 0.2, "tvm_version": "0.13.dev0"}
{"input": ["cuda -keys=cuda,gpu -arch=sm_75 -max_num_threads=1024 -thread_warp_size=32", "batch_matmul.cuda", [["TENSOR", [1, 128, 768], "float32"], ["TENSOR", [1, 768, 768], "float32"], [1, 128, 768], "float32", 0, 0], {}], "config": {"index": 544120, "code_hash": null, "entity": [["tile_y", "sp", [-1, 2, 4]], ["tile_x", "sp", [-1, 4, 192]], ["tile_k", "sp", [-1, 4]], ["auto_unroll_max_step", "ot", 32], ["unroll_explicit", "ot", 1]]}, "result": [[0.008776448187499999, 0.008783488249999999, 0.00878643225], 0, 2.924328327178955, 1688589877.8934202], "version": 0.2, "tvm_version": "0.13.dev0"}
{"input": ["cuda -keys=cuda,gpu -arch=sm_75 -max_num_threads=1024 -thread_warp_size=32", "batch_matmul.cuda", [["TENSOR", [1, 128, 768], "float32"], ["TENSOR", [1, 768, 768], "float32"], [1, 128, 768], "float32", 0, 0], {}], "config": {"index": 181536, "code_hash": null, "entity": [["tile_y", "sp", [-1, 8, 8]], ["tile_x", "sp", [-1, 6, 4]], ["tile_k", "sp", [-1, 2]], ["auto_unroll_max_step", "ot", 32], ["unroll_explicit", "ot", 0]]}, "result": [[0.0003572525625, 0.0003573898571428572, 0.0003574183660714285], 0, 2.0155715942382812, 1688589879.2654963], "version": 0.2, "tvm_version": "0.13.dev0"}
{"input": ["cuda -keys=cuda,gpu -arch=sm_75 -max_num_threads=1024 -thread_warp_size=32", "batch_matmul.cuda", [["TENSOR", [1, 128, 768], "float32"], ["TENSOR", [1, 768, 768], "float32"], [1, 128, 768], "float32", 0, 0], {}], "config": {"index": 454247, "code_hash": null, "entity": [["tile_y", "sp", [-1, 1, 128]], ["tile_x", "sp", [-1, 32, 6]], ["tile_k", "sp", [-1, 4]], ["auto_unroll_max_step", "ot", 16], ["unroll_explicit", "ot", 1]]}, "result": [[0.007087268, 0.0070878550000000005, 0.007089399666666667], 0, 2.2352867126464844, 1688589880.3037097], "version": 0.2, "tvm_version": "0.13.dev0"}
{"input": ["cuda -keys=cuda,gpu -arch=sm_75 -max_num_threads=1024 -thread_warp_size=32", "batch_matmul.cuda", [["TENSOR", [1, 128, 768], "float32"], ["TENSOR", [1, 768, 768], "float32"], [1, 128, 768], "float32", 0, 0], {}], "config": {"index": 271512, "code_hash": null, "entity": [["tile_y", "sp", [-1, 1, 1]], ["tile_x", "sp", [-1, 6, 64]], ["tile_k", "sp", [-1, 2]], ["auto_unroll_max_step", "ot", 64], ["unroll_explicit", "ot", 0]]}, "result": [[0.01009906, 0.010112802636363636, 0.010154335636363636], 0, 1.8721296787261963, 1688589881.3634973], "version": 0.2, "tvm_version": "0.13.dev0"}
{"input": ["cuda -keys=cuda,gpu -arch=sm_75 -max_num_threads=1024 -thread_warp_size=32", "batch_matmul.cuda", [["TENSOR", [1, 128, 768], "float32"], ["TENSOR", [1, 768, 768], "float32"], [1, 128, 768], "float32", 0, 0], {}], "config": {"index": 313642, "code_hash": null, "entity": [["tile_y", "sp", [-1, 4, 2]], ["tile_x", "sp", [-1, 16, 8]], ["tile_k", "sp", [-1, 48]], ["auto_unroll_max_step", "ot", 64], ["unroll_explicit", "ot", 0]]}, "result": [[0.00048539977945619335, 0.00048604415407854987, 0.00048645531117824767], 0, 2.0625386238098145, 1688589882.7411394], "version": 0.2, "tvm_version": "0.13.dev0"}
{"input": ["cuda -keys=cuda,gpu -arch=sm_75 -max_num_threads=1024 -thread_warp_size=32", "batch_matmul.cuda", [["TENSOR", [1, 128, 768], "float32"], ["TENSOR", [1, 768, 768], "float32"], [1, 128, 768], "float32", 0, 0], {}], "config": {"index": 298628, "code_hash": null, "entity": [["tile_y", "sp", [-1, 1, 2]], ["tile_x", "sp", [-1, 8, 6]], ["tile_k", "sp", [-1, 16]], ["auto_unroll_max_step", "ot", 64], ["unroll_explicit", "ot", 0]]}, "result": [[0.0010045030199999998, 0.00100499267, 0.0010051952300000001], 0, 1.667496919631958, 1688589883.7380774], "version": 0.2, "tvm_version": "0.13.dev0"}
{"input": ["cuda -keys=cuda,gpu -arch=sm_75 -max_num_threads=1024 -thread_warp_size=32", "batch_matmul.cuda", [["TENSOR", [1, 128, 768], "float32"], ["TENSOR", [1, 768, 768], "float32"], [1, 128, 768], "float32", 0, 0], {}], "config": {"index": 577826, "code_hash": null, "entity": [["tile_y", "sp", [-1, 1, 16]], ["tile_x", "sp", [-1, 2, 96]], ["tile_k", "sp", [-1, 48]], ["auto_unroll_max_step", "ot", 32], ["unroll_explicit", "ot", 1]]}, "result": [[0.026602495, 0.026605176749999997, 0.026661703], 0, 2.128880739212036, 1688589884.8414981], "version": 0.2, "tvm_version": "0.13.dev0"}
{"input": ["cuda -keys=cuda,gpu -arch=sm_75 -max_num_threads=1024 -thread_warp_size=32", "batch_matmul.cuda", [["TENSOR", [1, 128, 768], "float32"], ["TENSOR", [1, 768, 768], "float32"], [1, 128, 768], "float32", 0, 0], {}], "config": {"index": 690849, "code_hash": null, "entity": [["tile_y", "sp", [-1, 2, 2]], ["tile_x", "sp", [-1, 3, 2]], ["tile_k", "sp", [-1, 384]], ["auto_unroll_max_step", "ot", 64], ["unroll_explicit", "ot", 1]]}, "result": [[0.0026206094590163938, 0.0026210171967213113, 0.0026213796557377047], 0, 2.0707647800445557, 1688589886.22773], "version": 0.2, "tvm_version": "0.13.dev0"}
{"input": ["cuda -keys=cuda,gpu -arch=sm_75 -max_num_threads=1024 -thread_warp_size=32", "batch_matmul.cuda", [["TENSOR", [1, 128, 768], "float32"], ["TENSOR", [1, 768, 768], "float32"], [1, 128, 768], "float32", 0, 0], {}], "config": {"index": 24469, "code_hash": null, "entity": [["tile_y", "sp", [-1, 16, 8]], ["tile_x", "sp", [-1, 6, 1]], ["tile_k", "sp", [-1, 8]], ["auto_unroll_max_step", "ot", 8], ["unroll_explicit", "ot", 0]]}, "result": [[0.0008220481641025641, 0.0008221974666666667, 0.000822250364102564], 0, 2.0912177562713623, 1688589887.6225982], "version": 0.2, "tvm_version": "0.13.dev0"}
{"input": ["cuda -keys=cuda,gpu -arch=sm_75 -max_num_threads=1024 -thread_warp_size=32", "batch_matmul.cuda", [["TENSOR", [1, 128, 768], "float32"], ["TENSOR", [1, 768, 768], "float32"], [1, 128, 768], "float32", 0, 0], {}], "config": {"index": 480501, "code_hash": null, "entity": [["tile_y", "sp", [-1, 2, 2]], ["tile_x", "sp", [-1, 6, 64]], ["tile_k", "sp", [-1, 24]], ["auto_unroll_max_step", "ot", 16], ["unroll_explicit", "ot", 1]]}, "result": [[0.003134598, 0.0031367039375, 0.0031372520625], 0, 1.8908789157867432, 1688589888.609725], "version": 0.2, "tvm_version": "0.13.dev0"}
{"input": ["cuda -keys=cuda,gpu -arch=sm_75 -max_num_threads=1024 -thread_warp_size=32", "batch_matmul.cuda", [["TENSOR", [1, 128, 768], "float32"], ["TENSOR", [1, 768, 768], "float32"], [1, 128, 768], "float32", 0, 0], {}], "config": {"index": 216454, "code_hash": null, "entity": [["tile_y", "sp", [-1, 2, 8]], ["tile_x", "sp", [-1, 16, 8]], ["tile_k", "sp", [-1, 24]], ["auto_unroll_max_step", "ot", 32], ["unroll_explicit", "ot", 0]]}, "result": [[0.00023933340356083085, 0.0002393420519287834, 0.0002393578545994065], 0, 2.0602073669433594, 1688589889.9362743], "version": 0.2, "tvm_version": "0.13.dev0"}
{"input": ["cuda -keys=cuda,gpu -arch=sm_75 -max_num_threads=1024 -thread_warp_size=32", "batch_matmul.cuda", [["TENSOR", [1, 128, 768], "float32"], ["TENSOR", [1, 768, 768], "float32"], [1, 128, 768], "float32", 0, 0], {}], "config": {"index": 3195, "code_hash": null, "entity": [["tile_y", "sp", [-1, 2, 16]], ["tile_x", "sp", [-1, 6, 16]], ["tile_k", "sp", [-1, 1]], ["auto_unroll_max_step", "ot", 8], ["unroll_explicit", "ot", 0]]}, "result": [[0.0009668780361445783, 0.0009669273975903615, 0.0009673831385542169], 0, 2.207057237625122, 1688589891.3197968], "version": 0.2, "tvm_version": "0.13.dev0"}
{"input": ["cuda -keys=cuda,gpu -arch=sm_75 -max_num_threads=1024 -thread_warp_size=32", "batch_matmul.cuda", [["TENSOR", [1, 128, 768], "float32"], ["TENSOR", [1, 768, 768], "float32"], [1, 128, 768], "float32", 0, 0], {}], "config": {"index": 437759, "code_hash": null, "entity": [["tile_y", "sp", [-1, 1, 128]], ["tile_x", "sp", [-1, 32, 1]], ["tile_k", "sp", [-1, 1]], ["auto_unroll_max_step", "ot", 16], ["unroll_explicit", "ot", 1]]}, "result": [[0.0007112378181818182, 0.0007135094715909091, 0.0009191198715596331], 0, 1.9957313537597656, 1688589893.9484973], "version": 0.2, "tvm_version": "0.13.dev0"}
{"input": ["cuda -keys=cuda,gpu -arch=sm_75 -max_num_threads=1024 -thread_warp_size=32", "batch_matmul.cuda", [["TENSOR", [1, 128, 768], "float32"], ["TENSOR", [1, 768, 768], "float32"], [1, 128, 768], "float32", 0, 0], {}], "config": {"index": 631364, "code_hash": null, "entity": [["tile_y", "sp", [-1, 4, 32]], ["tile_x", "sp", [-1, 8, 96]], ["tile_k", "sp", [-1, 4]], ["auto_unroll_max_step", "ot", 64], ["unroll_explicit", "ot", 1]]}, "result": [[0.015002477285714286, 0.015006308285714285, 0.015037586714285716], 0, 2.2419307231903076, 1688589895.0178418], "version": 0.2, "tvm_version": "0.13.dev0"}
{"input": ["cuda -keys=cuda,gpu -arch=sm_75 -max_num_threads=1024 -thread_warp_size=32", "batch_matmul.cuda", [["TENSOR", [1, 128, 768], "float32"], ["TENSOR", [1, 768, 768], "float32"], [1, 128, 768], "float32", 0, 0], {}], "config": {"index": 26469, "code_hash": null, "entity": [["tile_y", "sp", [-1, 2, 2]], ["tile_x", "sp", [-1, 8, 6]], ["tile_k", "sp", [-1, 8]], ["auto_unroll_max_step", "ot", 8], ["unroll_explicit", "ot", 0]]}, "result": [[0.0005461276323024055, 0.000546457085910653, 0.0005465624295532646], 0, 2.099576473236084, 1688589896.3986187], "version": 0.2, "tvm_version": "0.13.dev0"}
{"input": ["cuda -keys=cuda,gpu -arch=sm_75 -max_num_threads=1024 -thread_warp_size=32", "batch_matmul.cuda", [["TENSOR", [1, 128, 768], "float32"], ["TENSOR", [1, 768, 768], "float32"], [1, 128, 768], "float32", 0, 0], {}], "config": {"index": 620924, "code_hash": null, "entity": [["tile_y", "sp", [-1, 4, 32]], ["tile_x", "sp", [-1, 3, 32]], ["tile_k", "sp", [-1, 2]], ["auto_unroll_max_step", "ot", 64], ["unroll_explicit", "ot", 1]]}, "result": [[0.009618525363636363, 0.009643746727272728, 0.00964474209090909], 0, 2.11641526222229, 1688589897.4512594], "version": 0.2, "tvm_version": "0.13.dev0"}
{"input": ["cuda -keys=cuda,gpu -arch=sm_75 -max_num_threads=1024 -thread_warp_size=32", "batch_matmul.cuda", [["TENSOR", [1, 128, 768], "float32"], ["TENSOR", [1, 768, 768], "float32"], [1, 128, 768], "float32", 0, 0], {}], "config": {"index": 405464, "code_hash": null, "entity": [["tile_y", "sp", [-1, 4, 32]], ["tile_x", "sp", [-1, 1, 6]], ["tile_k", "sp", [-1, 64]], ["auto_unroll_max_step", "ot", 8], ["unroll_explicit", "ot", 1]]}, "result": [[0.003971780923076923, 0.0039729746153846154, 0.003973807961538462], 0, 1.9915497303009033, 1688589898.452763], "version": 0.2, "tvm_version": "0.13.dev0"}
{"input": ["cuda -keys=cuda,gpu -arch=sm_75 -max_num_threads=1024 -thread_warp_size=32", "batch_matmul.cuda", [["TENSOR", [1, 128, 768], "float32"], ["TENSOR", [1, 768, 768], "float32"], [1, 128, 768], "float32", 0, 0], {}], "config": {"index": 586368, "code_hash": null, "entity": [["tile_y", "sp", [-1, 1, 1]], ["tile_x", "sp", [-1, 6, 16]], ["tile_k", "sp", [-1, 96]], ["auto_unroll_max_step", "ot", 32], ["unroll_explicit", "ot", 1]]}, "result": [[0.009747345636363636, 0.009749038636363637, 0.009759534636363636], 0, 1.8914198875427246, 1688589899.5026548], "version": 0.2, "tvm_version": "0.13.dev0"}
{"input": ["cuda -keys=cuda,gpu -arch=sm_75 -max_num_threads=1024 -thread_warp_size=32", "batch_matmul.cuda", [["TENSOR", [1, 128, 768], "float32"], ["TENSOR", [1, 768, 768], "float32"], [1, 128, 768], "float32", 0, 0], {}], "config": {"index": 109691, "code_hash": null, "entity": [["tile_y", "sp", [-1, 1, 128]], ["tile_x", "sp", [-1, 96, 8]], ["tile_k", "sp", [-1, 6]], ["auto_unroll_max_step", "ot", 16], ["unroll_explicit", "ot", 0]]}, "result": [[0.009073972764705882, 0.009074185529411765, 0.009074326411764706], 0, 2.4133896827697754, 1688589900.8813255], "version": 0.2, "tvm_version": "0.13.dev0"}
{"input": ["cuda -keys=cuda,gpu -arch=sm_75 -max_num_threads=1024 -thread_warp_size=32", "batch_matmul.cuda", [["TENSOR", [1, 128, 768], "float32"], ["TENSOR", [1, 768, 768], "float32"], [1, 128, 768], "float32", 0, 0], {}], "config": {"index": 16865, "code_hash": null, "entity": [["tile_y", "sp", [-1, 4, 4]], ["tile_x", "sp", [-1, 64, 6]], ["tile_k", "sp", [-1, 4]], ["auto_unroll_max_step", "ot", 8], ["unroll_explicit", "ot", 0]]}, "result": [[0.00022417721958041957, 0.00022420906013986014, 0.00022423080699300702], 0, 2.1375861167907715, 1688589902.2636995], "version": 0.2, "tvm_version": "0.13.dev0"}
{"input": ["cuda -keys=cuda,gpu -arch=sm_75 -max_num_threads=1024 -thread_warp_size=32", "batch_matmul.cuda", [["TENSOR", [1, 128, 768], "float32"], ["TENSOR", [1, 768, 768], "float32"], [1, 128, 768], "float32", 0, 0], {}], "config": {"index": 399853, "code_hash": null, "entity": [["tile_y", "sp", [-1, 2, 1]], ["tile_x", "sp", [-1, 8, 3]], ["tile_k", "sp", [-1, 48]], ["auto_unroll_max_step", "ot", 8], ["unroll_explicit", "ot", 1]]}, "result": [[0.0012950129354838708, 0.0012950296693548385, 0.001295277991935484], 0, 2.190260648727417, 1688589903.6568236], "version": 0.2, "tvm_version": "0.13.dev0"}
{"input": ["cuda -keys=cuda,gpu -arch=sm_75 -max_num_threads=1024 -thread_warp_size=32", "batch_matmul.cuda", [["TENSOR", [1, 128, 768], "float32"], ["TENSOR", [1, 768, 768], "float32"], [1, 128, 768], "float32", 0, 0], {}], "config": {"index": 472389, "code_hash": null, "entity": [["tile_y", "sp", [-1, 1, 64]], ["tile_x", "sp", [-1, 24, 2]], ["tile_k", "sp", [-1, 16]], ["auto_unroll_max_step", "ot", 16], ["unroll_explicit", "ot", 1]]}, "result": [[0.00033151586491935483, 0.000331649810483871, 0.0003317072762096774], 0, 2.609469175338745, 1688589905.0728412], "version": 0.2, "tvm_version": "0.13.dev0"}
{"input": ["cuda -keys=cuda,gpu -arch=sm_75 -max_num_threads=1024 -thread_warp_size=32", "batch_matmul.cuda", [["TENSOR", [1, 128, 768], "float32"], ["TENSOR", [1, 768, 768], "float32"], [1, 128, 768], "float32", 0, 0], {}], "config": {"index": 42137, "code_hash": null, "entity": [["tile_y", "sp", [-1, 4, 4]], ["tile_x", "sp", [-1, 12, 16]], ["tile_k", "sp", [-1, 24]], ["auto_unroll_max_step", "ot", 8], ["unroll_explicit", "ot", 0]]}, "result": [[0.000541723898989899, 0.000541814835016835, 0.0005420638552188552], 0, 2.2065610885620117, 1688589906.4621117], "version": 0.2, "tvm_version": "0.13.dev0"}
{"input": ["cuda -keys=cuda,gpu -arch=sm_75 -max_num_threads=1024 -thread_warp_size=32", "batch_matmul.cuda", [["TENSOR", [1, 128, 768], "float32"], ["TENSOR", [1, 768, 768], "float32"], [1, 128, 768], "float32", 0, 0], {}], "config": {"index": 182681, "code_hash": null, "entity": [["tile_y", "sp", [-1, 4, 4]], ["tile_x", "sp", [-1, 4, 12]], ["tile_k", "sp", [-1, 2]], ["auto_unroll_max_step", "ot", 32], ["unroll_explicit", "ot", 0]]}, "result": [[0.0003433315806451613, 0.00034347514408602153, 0.00034351340645161286], 0, 2.1820454597473145, 1688589907.837527], "version": 0.2, "tvm_version": "0.13.dev0"}
{"input": ["cuda -keys=cuda,gpu -arch=sm_75 -max_num_threads=1024 -thread_warp_size=32", "batch_matmul.cuda", [["TENSOR", [1, 128, 768], "float32"], ["TENSOR", [1, 768, 768], "float32"], [1, 128, 768], "float32", 0, 0], {}], "config": {"index": 13881, "code_hash": null, "entity": [["tile_y", "sp", [-1, 1, 8]], ["tile_x", "sp", [-1, 3, 64]], ["tile_k", "sp", [-1, 3]], ["auto_unroll_max_step", "ot", 8], ["unroll_explicit", "ot", 0]]}, "result": [[0.0218238662, 0.0218268034, 0.0218763716], 0, 2.444596767425537, 1688589908.9360044], "version": 0.2, "tvm_version": "0.13.dev0"}
{"input": ["cuda -keys=cuda,gpu -arch=sm_75 -max_num_threads=1024 -thread_warp_size=32", "batch_matmul.cuda", [["TENSOR", [1, 128, 768], "float32"], ["TENSOR", [1, 768, 768], "float32"], [1, 128, 768], "float32", 0, 0], {}], "config": {"index": 521607, "code_hash": null, "entity": [["tile_y", "sp", [-1, 8, 1]], ["tile_x", "sp", [-1, 2, 4]], ["tile_k", "sp", [-1, 768]], ["auto_unroll_max_step", "ot", 16], ["unroll_explicit", "ot", 1]]}, "result": [[0.0022450653802816903, 0.0022485353661971827, 0.0022501156197183097], 0, 2.213073968887329, 1688589910.3296363], "version": 0.2, "tvm_version": "0.13.dev0"}
{"input": ["cuda -keys=cuda,gpu -arch=sm_75 -max_num_threads=1024 -thread_warp_size=32", "batch_matmul.cuda", [["TENSOR", [1, 128, 768], "float32"], ["TENSOR", [1, 768, 768], "float32"], [1, 128, 768], "float32", 0, 0], {}], "config": {"index": 294036, "code_hash": null, "entity": [["tile_y", "sp", [-1, 8, 8]], ["tile_x", "sp", [-1, 3, 8]], ["tile_k", "sp", [-1, 12]], ["auto_unroll_max_step", "ot", 64], ["unroll_explicit", "ot", 0]]}, "result": [[0.0004949040748031497, 0.0004949675708661417, 0.0004949953858267716], 0, 1.9621686935424805, 1688589920.2308779], "version": 0.2, "tvm_version": "0.13.dev0"}
{"input": ["cuda -keys=cuda,gpu -arch=sm_75 -max_num_threads=1024 -thread_warp_size=32", "batch_matmul.cuda", [["TENSOR", [1, 128, 768], "float32"], ["TENSOR", [1, 768, 768], "float32"], [1, 128, 768], "float32", 0, 0], {}], "config": {"index": 285729, "code_hash": null, "entity": [["tile_y", "sp", [-1, 1, 64]], ["tile_x", "sp", [-1, 12, 32]], ["tile_k", "sp", [-1, 6]], ["auto_unroll_max_step", "ot", 64], ["unroll_explicit", "ot", 0]]}, "result": [[0.015430509285714286, 0.015442212714285714, 0.015534674428571428], 0, 1.954033613204956, 1688589921.3084502], "version": 0.2, "tvm_version": "0.13.dev0"}
{"input": ["cuda -keys=cuda,gpu -arch=sm_75 -max_num_threads=1024 -thread_warp_size=32", "batch_matmul.cuda", [["TENSOR", [1, 128, 768], "float32"], ["TENSOR", [1, 768, 768], "float32"], [1, 128, 768], "float32", 0, 0], {}], "config": {"index": 492, "code_hash": null, "entity": [["tile_y", "sp", [-1, 8, 8]], ["tile_x", "sp", [-1, 128, 1]], ["tile_k", "sp", [-1, 1]], ["auto_unroll_max_step", "ot", 8], ["unroll_explicit", "ot", 0]]}, "result": [[0.0007754036356589147, 0.0007757951007751939, 0.0007759002558139535], 0, 1.5787367820739746, 1688589922.3063526], "version": 0.2, "tvm_version": "0.13.dev0"}
{"input": ["cuda -keys=cuda,gpu -arch=sm_75 -max_num_threads=1024 -thread_warp_size=32", "batch_matmul.cuda", [["TENSOR", [1, 128, 768], "float32"], ["TENSOR", [1, 768, 768], "float32"], [1, 128, 768], "float32", 0, 0], {}], "config": {"index": 279932, "code_hash": null, "entity": [["tile_y", "sp", [-1, 4, 32]], ["tile_x", "sp", [-1, 8, 12]], ["tile_k", "sp", [-1, 4]], ["auto_unroll_max_step", "ot", 64], ["unroll_explicit", "ot", 0]]}, "result": [[0.0015176300151515149, 0.0015177071212121212, 0.0015178472272727272], 0, 2.220181941986084, 1688589923.3004587], "version": 0.2, "tvm_version": "0.13.dev0"}
{"input": ["cuda -keys=cuda,gpu -arch=sm_75 -max_num_threads=1024 -thread_warp_size=32", "batch_matmul.cuda", [["TENSOR", [1, 128, 768], "float32"], ["TENSOR", [1, 768, 768], "float32"], [1, 128, 768], "float32", 0, 0], {}], "config": {"index": 364488, "code_hash": null, "entity": [["tile_y", "sp", [-1, 8, 8]], ["tile_x", "sp", [-1, 1, 768]], ["tile_k", "sp", [-1, 3]], ["auto_unroll_max_step", "ot", 8], ["unroll_explicit", "ot", 1]]}, "result": [[0.1168158415, 0.116819244, 0.116903938], 0, 10.315893173217773, 1688589925.0839622], "version": 0.2, "tvm_version": "0.13.dev0"}
{"input": ["cuda -keys=cuda,gpu -arch=sm_75 -max_num_threads=1024 -thread_warp_size=32", "batch_matmul.cuda", [["TENSOR", [1, 128, 768], "float32"], ["TENSOR", [1, 768, 768], "float32"], [1, 128, 768], "float32", 0, 0], {}], "config": {"index": 379745, "code_hash": null, "entity": [["tile_y", "sp", [-1, 4, 4]], ["tile_x", "sp", [-1, 1, 2]], ["tile_k", "sp", [-1, 12]], ["auto_unroll_max_step", "ot", 8], ["unroll_explicit", "ot", 1]]}, "result": [[0.004484976695652174, 0.004485754565217391, 0.004490962130434782], 0, 1.687941312789917, 1688589926.11342], "version": 0.2, "tvm_version": "0.13.dev0"}
{"input": ["cuda -keys=cuda,gpu -arch=sm_75 -max_num_threads=1024 -thread_warp_size=32", "batch_matmul.cuda", [["TENSOR", [1, 128, 768], "float32"], ["TENSOR", [1, 768, 768], "float32"], [1, 128, 768], "float32", 0, 0], {}], "config": {"index": 219553, "code_hash": null, "entity": [["tile_y", "sp", [-1, 16, 8]], ["tile_x", "sp", [-1, 8, 2]], ["tile_k", "sp", [-1, 32]], ["auto_unroll_max_step", "ot", 32], ["unroll_explicit", "ot", 0]]}, "result": [[0.00021856805206073751, 0.00021864732537960955, 0.00021881148156182215], 0, 1.6467115879058838, 1688589927.0900218], "version": 0.2, "tvm_version": "0.13.dev0"}
{"input": ["cuda -keys=cuda,gpu -arch=sm_75 -max_num_threads=1024 -thread_warp_size=32", "batch_matmul.cuda", [["TENSOR", [1, 128, 768], "float32"], ["TENSOR", [1, 768, 768], "float32"], [1, 128, 768], "float32", 0, 0], {}], "config": {"index": 37753, "code_hash": null, "entity": [["tile_y", "sp", [-1, 16, 8]], ["tile_x", "sp", [-1, 4, 32]], ["tile_k", "sp", [-1, 16]], ["auto_unroll_max_step", "ot", 8], ["unroll_explicit", "ot", 0]]}, "result": [[0.0007882444630541871, 0.0007883185763546799, 0.0007884698866995074], 0, 2.2912590503692627, 1688589928.4727612], "version": 0.2, "tvm_version": "0.13.dev0"}
{"input": ["cuda -keys=cuda,gpu -arch=sm_75 -max_num_threads=1024 -thread_warp_size=32", "batch_matmul.cuda", [["TENSOR", [1, 128, 768], "float32"], ["TENSOR", [1, 768, 768], "float32"], [1, 128, 768], "float32", 0, 0], {}], "config": {"index": 555305, "code_hash": null, "entity": [["tile_y", "sp", [-1, 32, 1]], ["tile_x", "sp", [-1, 2, 3]], ["tile_k", "sp", [-1, 12]], ["auto_unroll_max_step", "ot", 32], ["unroll_explicit", "ot", 1]]}, "result": [[0.0009532430946745563, 0.0009534455207100592, 0.0009539910380952382], 0, 1.9355580806732178, 1688589929.7367423], "version": 0.2, "tvm_version": "0.13.dev0"}
{"input": ["cuda -keys=cuda,gpu -arch=sm_75 -max_num_threads=1024 -thread_warp_size=32", "batch_matmul.cuda", [["TENSOR", [1, 128, 768], "float32"], ["TENSOR", [1, 768, 768], "float32"], [1, 128, 768], "float32", 0, 0], {}], "config": {"index": 423017, "code_hash": null, "entity": [["tile_y", "sp", [-1, 4, 4]], ["tile_x", "sp", [-1, 8, 1]], ["tile_k", "sp", [-1, 256]], ["auto_unroll_max_step", "ot", 8], ["unroll_explicit", "ot", 1]]}, "result": [[0.0013265766694214877, 0.0013267488016528925, 0.0013268890330578513], 0, 2.1241559982299805, 1688589931.1401215], "version": 0.2, "tvm_version": "0.13.dev0"}
{"input": ["cuda -keys=cuda,gpu -arch=sm_75 -max_num_threads=1024 -thread_warp_size=32", "batch_matmul.cuda", [["TENSOR", [1, 128, 768], "float32"], ["TENSOR", [1, 768, 768], "float32"], [1, 128, 768], "float32", 0, 0], {}], "config": {"index": 368853, "code_hash": null, "entity": [["tile_y", "sp", [-1, 1, 64]], ["tile_x", "sp", [-1, 2, 96]], ["tile_k", "sp", [-1, 4]], ["auto_unroll_max_step", "ot", 8], ["unroll_explicit", "ot", 1]]}, "result": [[0.0948147655, 0.094927055, 0.0949510265], 0, 2.537882089614868, 1688589932.6665463], "version": 0.2, "tvm_version": "0.13.dev0"}
{"input": ["cuda -keys=cuda,gpu -arch=sm_75 -max_num_threads=1024 -thread_warp_size=32", "batch_matmul.cuda", [["TENSOR", [1, 128, 768], "float32"], ["TENSOR", [1, 768, 768], "float32"], [1, 128, 768], "float32", 0, 0], {}], "config": {"index": 395585, "code_hash": null, "entity": [["tile_y", "sp", [-1, 4, 4]], ["tile_x", "sp", [-1, 48, 4]], ["tile_k", "sp", [-1, 32]], ["auto_unroll_max_step", "ot", 8], ["unroll_explicit", "ot", 1]]}, "result": [[0.0003380507106382979, 0.0003600679621993127, 0.000373143852233677], 0, 1.8225014209747314, 1688589935.1525688], "version": 0.2, "tvm_version": "0.13.dev0"}
{"input": ["cuda -keys=cuda,gpu -arch=sm_75 -max_num_threads=1024 -thread_warp_size=32", "batch_matmul.cuda", [["TENSOR", [1, 128, 768], "float32"], ["TENSOR", [1, 768, 768], "float32"], [1, 128, 768], "float32", 0, 0], {}], "config": {"index": 669234, "code_hash": null, "entity": [["tile_y", "sp", [-1, 1, 32]], ["tile_x", "sp", [-1, 1, 24]], ["tile_k", "sp", [-1, 64]], ["auto_unroll_max_step", "ot", 64], ["unroll_explicit", "ot", 1]]}, "result": [[0.0629557605, 0.062990047, 0.0630061755], 0, 2.3307995796203613, 1688589936.3271437], "version": 0.2, "tvm_version": "0.13.dev0"}
{"input": ["cuda -keys=cuda,gpu -arch=sm_75 -max_num_threads=1024 -thread_warp_size=32", "batch_matmul.cuda", [["TENSOR", [1, 128, 768], "float32"], ["TENSOR", [1, 768, 768], "float32"], [1, 128, 768], "float32", 0, 0], {}], "config": {"index": 368956, "code_hash": null, "entity": [["tile_y", "sp", [-1, 4, 16]], ["tile_x", "sp", [-1, 1, 128]], ["tile_k", "sp", [-1, 4]], ["auto_unroll_max_step", "ot", 8], ["unroll_explicit", "ot", 1]]}, "result": [[0.028979999500000003, 0.029005311750000002, 0.02900596025], 0, 2.3260910511016846, 1688589937.4876263], "version": 0.2, "tvm_version": "0.13.dev0"}
{"input": ["cuda -keys=cuda,gpu -arch=sm_75 -max_num_threads=1024 -thread_warp_size=32", "batch_matmul.cuda", [["TENSOR", [1, 128, 768], "float32"], ["TENSOR", [1, 768, 768], "float32"], [1, 128, 768], "float32", 0, 0], {}], "config": {"index": 37076, "code_hash": null, "entity": [["tile_y", "sp", [-1, 4, 32]], ["tile_x", "sp", [-1, 1, 16]], ["tile_k", "sp", [-1, 16]], ["auto_unroll_max_step", "ot", 8], ["unroll_explicit", "ot", 0]]}, "result": [[0.014682998571428572, 0.014686550571428572, 0.014712127571428571], 0, 1.8591277599334717, 1688589938.5405095], "version": 0.2, "tvm_version": "0.13.dev0"}
{"input": ["cuda -keys=cuda,gpu -arch=sm_75 -max_num_threads=1024 -thread_warp_size=32", "batch_matmul.cuda", [["TENSOR", [1, 128, 768], "float32"], ["TENSOR", [1, 768, 768], "float32"], [1, 128, 768], "float32", 0, 0], {}], "config": {"index": 326, "code_hash": null, "entity": [["tile_y", "sp", [-1, 4, 1]], ["tile_x", "sp", [-1, 32, 1]], ["tile_k", "sp", [-1, 1]], ["auto_unroll_max_step", "ot", 8], ["unroll_explicit", "ot", 0]]}, "result": [[0.0015214156969696972, 0.0015217934696969697, 0.0015252019696969695], 0, 1.596559762954712, 1688589939.5351403], "version": 0.2, "tvm_version": "0.13.dev0"}
{"input": ["cuda -keys=cuda,gpu -arch=sm_75 -max_num_threads=1024 -thread_warp_size=32", "batch_matmul.cuda", [["TENSOR", [1, 128, 768], "float32"], ["TENSOR", [1, 768, 768], "float32"], [1, 128, 768], "float32", 0, 0], {}], "config": {"index": 352778, "code_hash": null, "entity": [["tile_y", "sp", [-1, 64, 2]], ["tile_x", "sp", [-1, 4, 12]], ["tile_k", "sp", [-1, 1]], ["auto_unroll_max_step", "ot", 8], ["unroll_explicit", "ot", 1]]}, "result": [[0.000615657427480916, 0.0006157492709923664, 0.0006158006946564886], 0, 2.022048234939575, 1688589940.9213812], "version": 0.2, "tvm_version": "0.13.dev0"}
{"input": ["cuda -keys=cuda,gpu -arch=sm_75 -max_num_threads=1024 -thread_warp_size=32", "batch_matmul.cuda", [["TENSOR", [1, 128, 768], "float32"], ["TENSOR", [1, 768, 768], "float32"], [1, 128, 768], "float32", 0, 0], {}], "config": {"index": 475159, "code_hash": null, "entity": [["tile_y", "sp", [-1, 2, 32]], ["tile_x", "sp", [-1, 4, 32]], ["tile_k", "sp", [-1, 16]], ["auto_unroll_max_step", "ot", 16], ["unroll_explicit", "ot", 1]]}, "result": [[0.0110290435, 0.0110301406, 0.011031321699999999], 0, 1.9096384048461914, 1688589941.9869268], "version": 0.2, "tvm_version": "0.13.dev0"}
{"input": ["cuda -keys=cuda,gpu -arch=sm_75 -max_num_threads=1024 -thread_warp_size=32", "batch_matmul.cuda", [["TENSOR", [1, 128, 768], "float32"], ["TENSOR", [1, 768, 768], "float32"], [1, 128, 768], "float32", 0, 0], {}], "config": {"index": 377944, "code_hash": null, "entity": [["tile_y", "sp", [-1, 2, 4]], ["tile_x", "sp", [-1, 4, 32]], ["tile_k", "sp", [-1, 8]], ["auto_unroll_max_step", "ot", 8], ["unroll_explicit", "ot", 1]]}, "result": [[0.0012569855625, 0.0012574935875, 0.0012577351500000001], 0, 1.746579885482788, 1688589942.980287], "version": 0.2, "tvm_version": "0.13.dev0"}
{"input": ["cuda -keys=cuda,gpu -arch=sm_75 -max_num_threads=1024 -thread_warp_size=32", "batch_matmul.cuda", [["TENSOR", [1, 128, 768], "float32"], ["TENSOR", [1, 768, 768], "float32"], [1, 128, 768], "float32", 0, 0], {}], "config": {"index": 671013, "code_hash": null, "entity": [["tile_y", "sp", [-1, 2, 2]], ["tile_x", "sp", [-1, 32, 1]], ["tile_k", "sp", [-1, 96]], ["auto_unroll_max_step", "ot", 64], ["unroll_explicit", "ot", 1]]}, "result": [[0.00048469423333333326, 0.00048508344285714286, 0.00048529187142857145], 0, 1.7204985618591309, 1688589943.96423], "version": 0.2, "tvm_version": "0.13.dev0"}
{"input": ["cuda -keys=cuda,gpu -arch=sm_75 -max_num_threads=1024 -thread_warp_size=32", "batch_matmul.cuda", [["TENSOR", [1, 128, 768], "float32"], ["TENSOR", [1, 768, 768], "float32"], [1, 128, 768], "float32", 0, 0], {}], "config": {"index": 308105, "code_hash": null, "entity": [["tile_y", "sp", [-1, 4, 4]], ["tile_x", "sp", [-1, 48, 4]], ["tile_k", "sp", [-1, 32]], ["auto_unroll_max_step", "ot", 64], ["unroll_explicit", "ot", 0]]}, "result": [[0.00033740675884244374, 0.00033853252411575563, 0.0003387107459807074], 0, 1.6457788944244385, 1688589944.982727], "version": 0.2, "tvm_version": "0.13.dev0"}
{"input": ["cuda -keys=cuda,gpu -arch=sm_75 -max_num_threads=1024 -thread_warp_size=32", "batch_matmul.cuda", [["TENSOR", [1, 128, 768], "float32"], ["TENSOR", [1, 768, 768], "float32"], [1, 128, 768], "float32", 0, 0], {}], "config": {"index": 100941, "code_hash": null, "entity": [["tile_y", "sp", [-1, 1, 64]], ["tile_x", "sp", [-1, 4, 32]], ["tile_k", "sp", [-1, 3]], ["auto_unroll_max_step", "ot", 16], ["unroll_explicit", "ot", 0]]}, "result": [[0.0229366592, 0.0229515258, 0.0230203582], 0, 2.036776304244995, 1688589946.10622], "version": 0.2, "tvm_version": "0.13.dev0"}
{"input": ["cuda -keys=cuda,gpu -arch=sm_75 -max_num_threads=1024 -thread_warp_size=32", "batch_matmul.cuda", [["TENSOR", [1, 128, 768], "float32"], ["TENSOR", [1, 768, 768], "float32"], [1, 128, 768], "float32", 0, 0], {}], "config": {"index": 619631, "code_hash": null, "entity": [["tile_y", "sp", [-1, 1, 128]], ["tile_x", "sp", [-1, 2, 8]], ["tile_k", "sp", [-1, 2]], ["auto_unroll_max_step", "ot", 64], ["unroll_explicit", "ot", 1]]}, "result": [[0.031731472, 0.03173990425, 0.03179496], 0, 1.9412791728973389, 1688589948.288721], "version": 0.2, "tvm_version": "0.13.dev0"}
{"input": ["cuda -keys=cuda,gpu -arch=sm_75 -max_num_threads=1024 -thread_warp_size=32", "batch_matmul.cuda", [["TENSOR", [1, 128, 768], "float32"], ["TENSOR", [1, 768, 768], "float32"], [1, 128, 768], "float32", 0, 0], {}], "config": {"index": 84688, "code_hash": null, "entity": [["tile_y", "sp", [-1, 2, 4]], ["tile_x", "sp", [-1, 1, 6]], ["tile_k", "sp", [-1, 768]], ["auto_unroll_max_step", "ot", 8], ["unroll_explicit", "ot", 0]]}, "result": [[0.0102463485, 0.0102508514, 0.0102553596], 0, 1.673621654510498, 1688589949.3147833], "version": 0.2, "tvm_version": "0.13.dev0"}
{"input": ["cuda -keys=cuda,gpu -arch=sm_75 -max_num_threads=1024 -thread_warp_size=32", "batch_matmul.cuda", [["TENSOR", [1, 128, 768], "float32"], ["TENSOR", [1, 768, 768], "float32"], [1, 128, 768], "float32", 0, 0], {}], "config": {"index": 668215, "code_hash": null, "entity": [["tile_y", "sp", [-1, 16, 4]], ["tile_x", "sp", [-1, 2, 8]], ["tile_k", "sp", [-1, 64]], ["auto_unroll_max_step", "ot", 64], ["unroll_explicit", "ot", 1]]}, "result": [[0.0007366469636363636, 0.0007368897136363636, 0.0007378522058823528], 0, 1.9940719604492188, 1688589950.640254], "version": 0.2, "tvm_version": "0.13.dev0"}
{"input": ["cuda -keys=cuda,gpu -arch=sm_75 -max_num_threads=1024 -thread_warp_size=32", "batch_matmul.cuda", [["TENSOR", [1, 128, 768], "float32"], ["TENSOR", [1, 768, 768], "float32"], [1, 128, 768], "float32", 0, 0], {}], "config": {"index": 53718, "code_hash": null, "entity": [["tile_y", "sp", [-1, 64, 1]], ["tile_x", "sp", [-1, 16, 1]], ["tile_k", "sp", [-1, 64]], ["auto_unroll_max_step", "ot", 8], ["unroll_explicit", "ot", 0]]}, "result": [[0.00039488998477157363, 0.00039490524365482237, 0.0003949138807106599], 0, 1.9674224853515625, 1688589951.986765], "version": 0.2, "tvm_version": "0.13.dev0"}
{"input": ["cuda -keys=cuda,gpu -arch=sm_75 -max_num_threads=1024 -thread_warp_size=32", "batch_matmul.cuda", [["TENSOR", [1, 128, 768], "float32"], ["TENSOR", [1, 768, 768], "float32"], [1, 128, 768], "float32", 0, 0], {}], "config": {"index": 217862, "code_hash": null, "entity": [["tile_y", "sp", [-1, 1, 16]], ["tile_x", "sp", [-1, 8, 48]], ["tile_k", "sp", [-1, 24]], ["auto_unroll_max_step", "ot", 32], ["unroll_explicit", "ot", 0]]}, "result": [[0.009980086312499999, 0.010002845750000001, 0.0100038604375], 0, 2.232311487197876, 1688589953.343581], "version": 0.2, "tvm_version": "0.13.dev0"}
{"input": ["cuda -keys=cuda,gpu -arch=sm_75 -max_num_threads=1024 -thread_warp_size=32", "batch_matmul.cuda", [["TENSOR", [1, 128, 768], "float32"], ["TENSOR", [1, 768, 768], "float32"], [1, 128, 768], "float32", 0, 0], {}], "config": {"index": 122840, "code_hash": null, "entity": [["tile_y", "sp", [-1, 1, 2]], ["tile_x", "sp", [-1, 8, 3]], ["tile_k", "sp", [-1, 16]], ["auto_unroll_max_step", "ot", 16], ["unroll_explicit", "ot", 0]]}, "result": [[0.001463886190909091, 0.001464040718181818, 0.0014641730545454543], 0, 2.017332077026367, 1688589954.7262473], "version": 0.2, "tvm_version": "0.13.dev0"}
{"input": ["cuda -keys=cuda,gpu -arch=sm_75 -max_num_threads=1024 -thread_warp_size=32", "batch_matmul.cuda", [["TENSOR", [1, 128, 768], "float32"], ["TENSOR", [1, 768, 768], "float32"], [1, 128, 768], "float32", 0, 0], {}], "config": {"index": 155718, "code_hash": null, "entity": [["tile_y", "sp", [-1, 8, 4]], ["tile_x", "sp", [-1, 8, 1]], ["tile_k", "sp", [-1, 192]], ["auto_unroll_max_step", "ot", 16], ["unroll_explicit", "ot", 0]]}, "result": [[0.0006492442204081632, 0.0006493606857142857, 0.000649416987755102], 0, 1.9261298179626465, 1688589956.1164713], "version": 0.2, "tvm_version": "0.13.dev0"}
{"input": ["cuda -keys=cuda,gpu -arch=sm_75 -max_num_threads=1024 -thread_warp_size=32", "batch_matmul.cuda", [["TENSOR", [1, 128, 768], "float32"], ["TENSOR", [1, 768, 768], "float32"], [1, 128, 768], "float32", 0, 0], {}], "config": {"index": 2400, "code_hash": null, "entity": [["tile_y", "sp", [-1, 8, 8]], ["tile_x", "sp", [-1, 2, 8]], ["tile_k", "sp", [-1, 1]], ["auto_unroll_max_step", "ot", 8], ["unroll_explicit", "ot", 0]]}, "result": [[0.0006412623280000001, 0.000641492124, 0.000641556456], 0, 1.9515950679779053, 1688589957.511531], "version": 0.2, "tvm_version": "0.13.dev0"}
{"input": ["cuda -keys=cuda,gpu -arch=sm_75 -max_num_threads=1024 -thread_warp_size=32", "batch_matmul.cuda", [["TENSOR", [1, 128, 768], "float32"], ["TENSOR", [1, 768, 768], "float32"], [1, 128, 768], "float32", 0, 0], {}], "config": {"index": 570279, "code_hash": null, "entity": [["tile_y", "sp", [-1, 8, 1]], ["tile_x", "sp", [-1, 4, 4]], ["tile_k", "sp", [-1, 32]], ["auto_unroll_max_step", "ot", 32], ["unroll_explicit", "ot", 1]]}, "result": [[0.0006675637883817426, 0.0006676729419087136, 0.0006677669626556016], 0, 2.064368724822998, 1688589960.0592988], "version": 0.2, "tvm_version": "0.13.dev0"}
{"input": ["cuda -keys=cuda,gpu -arch=sm_75 -max_num_threads=1024 -thread_warp_size=32", "batch_matmul.cuda", [["TENSOR", [1, 128, 768], "float32"], ["TENSOR", [1, 768, 768], "float32"], [1, 128, 768], "float32", 0, 0], {}], "config": {"index": 613354, "code_hash": null, "entity": [["tile_y", "sp", [-1, 2, 8]], ["tile_x", "sp", [-1, 32, 2]], ["tile_k", "sp", [-1, 1]], ["auto_unroll_max_step", "ot", 64], ["unroll_explicit", "ot", 1]]}, "result": [[0.0004554048863636363, 0.0004556103607954545, 0.0004556745596590909], 0, 2.014453172683716, 1688589961.4405005], "version": 0.2, "tvm_version": "0.13.dev0"}
{"input": ["cuda -keys=cuda,gpu -arch=sm_75 -max_num_threads=1024 -thread_warp_size=32", "batch_matmul.cuda", [["TENSOR", [1, 128, 768], "float32"], ["TENSOR", [1, 768, 768], "float32"], [1, 128, 768], "float32", 0, 0], {}], "config": {"index": 103530, "code_hash": null, "entity": [["tile_y", "sp", [-1, 1, 32]], ["tile_x", "sp", [-1, 64, 3]], ["tile_k", "sp", [-1, 4]], ["auto_unroll_max_step", "ot", 16], ["unroll_explicit", "ot", 0]]}, "result": [[0.000253785663476874, 0.0002538605454545454, 0.0002538609106858054], 0, 2.0772311687469482, 1688589962.8140223], "version": 0.2, "tvm_version": "0.13.dev0"}
{"input": ["cuda -keys=cuda,gpu -arch=sm_75 -max_num_threads=1024 -thread_warp_size=32", "batch_matmul.cuda", [["TENSOR", [1, 128, 768], "float32"], ["TENSOR", [1, 768, 768], "float32"], [1, 128, 768], "float32", 0, 0], {}], "config": {"index": 557649, "code_hash": null, "entity": [["tile_y", "sp", [-1, 2, 2]], ["tile_x", "sp", [-1, 1, 32]], ["tile_k", "sp", [-1, 12]], ["auto_unroll_max_step", "ot", 32], ["unroll_explicit", "ot", 1]]}, "result": [[0.0026242638196721313, 0.002625732163934426, 0.0026263555245901638], 0, 2.161905527114868, 1688589964.1376934], "version": 0.2, "tvm_version": "0.13.dev0"}
{"input": ["cuda -keys=cuda,gpu -arch=sm_75 -max_num_threads=1024 -thread_warp_size=32", "batch_matmul.cuda", [["TENSOR", [1, 128, 768], "float32"], ["TENSOR", [1, 768, 768], "float32"], [1, 128, 768], "float32", 0, 0], {}], "config": {"index": 230815, "code_hash": null, "entity": [["tile_y", "sp", [-1, 16, 4]], ["tile_x", "sp", [-1, 2, 8]], ["tile_k", "sp", [-1, 64]], ["auto_unroll_max_step", "ot", 32], ["unroll_explicit", "ot", 0]]}, "result": [[0.0007332729635036496, 0.0007346658029197081, 0.0007347686058394161], 0, 1.7242145538330078, 1688589965.1235323], "version": 0.2, "tvm_version": "0.13.dev0"}
{"input": ["cuda -keys=cuda,gpu -arch=sm_75 -max_num_threads=1024 -thread_warp_size=32", "batch_matmul.cuda", [["TENSOR", [1, 128, 768], "float32"], ["TENSOR", [1, 768, 768], "float32"], [1, 128, 768], "float32", 0, 0], {}], "config": {"index": 476348, "code_hash": null, "entity": [["tile_y", "sp", [-1, 4, 32]], ["tile_x", "sp", [-1, 2, 1]], ["tile_k", "sp", [-1, 24]], ["auto_unroll_max_step", "ot", 16], ["unroll_explicit", "ot", 1]]}, "result": [[0.00516034545, 0.00516359825, 0.00516495665], 0, 1.6707258224487305, 1688589966.1484418], "version": 0.2, "tvm_version": "0.13.dev0"}
{"input": ["cuda -keys=cuda,gpu -arch=sm_75 -max_num_threads=1024 -thread_warp_size=32", "batch_matmul.cuda", [["TENSOR", [1, 128, 768], "float32"], ["TENSOR", [1, 768, 768], "float32"], [1, 128, 768], "float32", 0, 0], {}], "config": {"index": 221374, "code_hash": null, "entity": [["tile_y", "sp", [-1, 4, 2]], ["tile_x", "sp", [-1, 32, 8]], ["tile_k", "sp", [-1, 32]], ["auto_unroll_max_step", "ot", 32], ["unroll_explicit", "ot", 0]]}, "result": [[0.0004860570430622009, 0.0004868752488038278, 0.0004876786363636364], 0, 1.6696686744689941, 1688589967.1423414], "version": 0.2, "tvm_version": "0.13.dev0"}
{"input": ["cuda -keys=cuda,gpu -arch=sm_75 -max_num_threads=1024 -thread_warp_size=32", "batch_matmul.cuda", [["TENSOR", [1, 128, 768], "float32"], ["TENSOR", [1, 768, 768], "float32"], [1, 128, 768], "float32", 0, 0], {}], "config": {"index": 687734, "code_hash": null, "entity": [["tile_y", "sp", [-1, 1, 16]], ["tile_x", "sp", [-1, 4, 8]], ["tile_k", "sp", [-1, 256]], ["auto_unroll_max_step", "ot", 64], ["unroll_explicit", "ot", 1]]}, "result": [[0.0030246956226415095, 0.0030251663396226418, 0.003025775830188679], 0, 2.2412490844726562, 1688589968.527124], "version": 0.2, "tvm_version": "0.13.dev0"}
{"input": ["cuda -keys=cuda,gpu -arch=sm_75 -max_num_threads=1024 -thread_warp_size=32", "batch_matmul.cuda", [["TENSOR", [1, 128, 768], "float32"], ["TENSOR", [1, 768, 768], "float32"], [1, 128, 768], "float32", 0, 0], {}], "config": {"index": 41676, "code_hash": null, "entity": [["tile_y", "sp", [-1, 8, 8]], ["tile_x", "sp", [-1, 1, 12]], ["tile_k", "sp", [-1, 24]], ["auto_unroll_max_step", "ot", 8], ["unroll_explicit", "ot", 0]]}, "result": [[0.001442100309859155, 0.0014429430845070423, 0.001444272633802817], 0, 1.7305293083190918, 1688589969.5336142], "version": 0.2, "tvm_version": "0.13.dev0"}
{"input": ["cuda -keys=cuda,gpu -arch=sm_75 -max_num_threads=1024 -thread_warp_size=32", "batch_matmul.cuda", [["TENSOR", [1, 128, 768], "float32"], ["TENSOR", [1, 768, 768], "float32"], [1, 128, 768], "float32", 0, 0], {}], "config": {"index": 4490, "code_hash": null, "entity": [["tile_y", "sp", [-1, 1, 16]], ["tile_x", "sp", [-1, 2, 128]], ["tile_k", "sp", [-1, 1]], ["auto_unroll_max_step", "ot", 8], ["unroll_explicit", "ot", 0]]}, "result": [[0.036246849000000005, 0.036254378999999996, 0.03626187633333333], 0, 2.1710290908813477, 1688589970.6666467], "version": 0.2, "tvm_version": "0.13.dev0"}
{"input": ["cuda -keys=cuda,gpu -arch=sm_75 -max_num_threads=1024 -thread_warp_size=32", "batch_matmul.cuda", [["TENSOR", [1, 128, 768], "float32"], ["TENSOR", [1, 768, 768], "float32"], [1, 128, 768], "float32", 0, 0], {}], "config": {"index": 399310, "code_hash": null, "entity": [["tile_y", "sp", [-1, 2, 64]], ["tile_x", "sp", [-1, 4, 2]], ["tile_k", "sp", [-1, 48]], ["auto_unroll_max_step", "ot", 8], ["unroll_explicit", "ot", 1]]}, "result": [[0.0015889640634920634, 0.0015911659206349206, 0.0015912635396825396], 0, 1.7061011791229248, 1688589971.660932], "version": 0.2, "tvm_version": "0.13.dev0"}
{"input": ["cuda -keys=cuda,gpu -arch=sm_75 -max_num_threads=1024 -thread_warp_size=32", "batch_matmul.cuda", [["TENSOR", [1, 128, 768], "float32"], ["TENSOR", [1, 768, 768], "float32"], [1, 128, 768], "float32", 0, 0], {}], "config": {"index": 489168, "code_hash": null, "entity": [["tile_y", "sp", [-1, 1, 1]], ["tile_x", "sp", [-1, 6, 16]], ["tile_k", "sp", [-1, 48]], ["auto_unroll_max_step", "ot", 16], ["unroll_explicit", "ot", 1]]}, "result": [[0.004716127909090909, 0.004717943363636364, 0.004718048090909092], 0, 1.6173021793365479, 1688589973.8937163], "version": 0.2, "tvm_version": "0.13.dev0"}
{"input": ["cuda -keys=cuda,gpu -arch=sm_75 -max_num_threads=1024 -thread_warp_size=32", "batch_matmul.cuda", [["TENSOR", [1, 128, 768], "float32"], ["TENSOR", [1, 768, 768], "float32"], [1, 128, 768], "float32", 0, 0], {}], "config": {"index": 435321, "code_hash": null, "entity": [["tile_y", "sp", [-1, 2, 2]], ["tile_x", "sp", [-1, 1, 12]], ["tile_k", "sp", [-1, 768]], ["auto_unroll_max_step", "ot", 8], ["unroll_explicit", "ot", 1]]}, "result": [[0.015548122857142858, 0.015548708142857142, 0.015551652000000001], 0, 1.7234299182891846, 1688589974.965191], "version": 0.2, "tvm_version": "0.13.dev0"}
{"input": ["cuda -keys=cuda,gpu -arch=sm_75 -max_num_threads=1024 -thread_warp_size=32", "batch_matmul.cuda", [["TENSOR", [1, 128, 768], "float32"], ["TENSOR", [1, 768, 768], "float32"], [1, 128, 768], "float32", 0, 0], {}], "config": {"index": 274905, "code_hash": null, "entity": [["tile_y", "sp", [-1, 2, 2]], ["tile_x", "sp", [-1, 96, 8]], ["tile_k", "sp", [-1, 3]], ["auto_unroll_max_step", "ot", 64], ["unroll_explicit", "ot", 0]]}, "result": [[0.0011760153649635037, 0.0011760453211678832, 0.0011761602627737228], 0, 1.976196527481079, 1688589976.308734], "version": 0.2, "tvm_version": "0.13.dev0"}
{"input": ["cuda -keys=cuda,gpu -arch=sm_75 -max_num_threads=1024 -thread_warp_size=32", "batch_matmul.cuda", [["TENSOR", [1, 128, 768], "float32"], ["TENSOR", [1, 768, 768], "float32"], [1, 128, 768], "float32", 0, 0], {}], "config": {"index": 458982, "code_hash": null, "entity": [["tile_y", "sp", [-1, 8, 4]], ["tile_x", "sp", [-1, 4, 6]], ["tile_k", "sp", [-1, 6]], ["auto_unroll_max_step", "ot", 16], ["unroll_explicit", "ot", 1]]}, "result": [[0.00026382594719471944, 0.00026388746204620466, 0.00026392195709570957], 0, 2.0171499252319336, 1688589977.690489], "version": 0.2, "tvm_version": "0.13.dev0"}
{"input": ["cuda -keys=cuda,gpu -arch=sm_75 -max_num_threads=1024 -thread_warp_size=32", "batch_matmul.cuda", [["TENSOR", [1, 128, 768], "float32"], ["TENSOR", [1, 768, 768], "float32"], [1, 128, 768], "float32", 0, 0], {}], "config": {"index": 367631, "code_hash": null, "entity": [["tile_y", "sp", [-1, 1, 128]], ["tile_x", "sp", [-1, 3, 16]], ["tile_k", "sp", [-1, 4]], ["auto_unroll_max_step", "ot", 8], ["unroll_explicit", "ot", 1]]}, "result": [[0.02545090475, 0.02545446375, 0.0254566555], 0, 2.185741901397705, 1688589978.7637577], "version": 0.2, "tvm_version": "0.13.dev0"}
{"input": ["cuda -keys=cuda,gpu -arch=sm_75 -max_num_threads=1024 -thread_warp_size=32", "batch_matmul.cuda", [["TENSOR", [1, 128, 768], "float32"], ["TENSOR", [1, 768, 768], "float32"], [1, 128, 768], "float32", 0, 0], {}], "config": {"index": 93939, "code_hash": null, "entity": [["tile_y", "sp", [-1, 1, 4]], ["tile_x", "sp", [-1, 2, 4]], ["tile_k", "sp", [-1, 2]], ["auto_unroll_max_step", "ot", 16], ["unroll_explicit", "ot", 0]]}, "result": [[0.0029243100181818183, 0.0029245560909090906, 0.002924692872727273], 0, 1.9715907573699951, 1688589980.155889], "version": 0.2, "tvm_version": "0.13.dev0"}
{"input": ["cuda -keys=cuda,gpu -arch=sm_75 -max_num_threads=1024 -thread_warp_size=32", "batch_matmul.cuda", [["TENSOR", [1, 128, 768], "float32"], ["TENSOR", [1, 768, 768], "float32"], [1, 128, 768], "float32", 0, 0], {}], "config": {"index": 350586, "code_hash": null, "entity": [["tile_y", "sp", [-1, 8, 4]], ["tile_x", "sp", [-1, 1, 2]], ["tile_k", "sp", [-1, 1]], ["auto_unroll_max_step", "ot", 8], ["unroll_explicit", "ot", 1]]}, "result": [[0.004244486791666667, 0.004245341291666667, 0.004248064], 0, 1.5713403224945068, 1688589981.1635814], "version": 0.2, "tvm_version": "0.13.dev0"}
{"input": ["cuda -keys=cuda,gpu -arch=sm_75 -max_num_threads=1024 -thread_warp_size=32", "batch_matmul.cuda", [["TENSOR", [1, 128, 768], "float32"], ["TENSOR", [1, 768, 768], "float32"], [1, 128, 768], "float32", 0, 0], {}], "config": {"index": 621268, "code_hash": null, "entity": [["tile_y", "sp", [-1, 2, 4]], ["tile_x", "sp", [-1, 16, 48]], ["tile_k", "sp", [-1, 2]], ["auto_unroll_max_step", "ot", 64], ["unroll_explicit", "ot", 1]]}, "result": [[0.0011403019428571429, 0.0011403106642857142, 0.00114044505], 0, 2.2300796508789062, 1688589982.5516963], "version": 0.2, "tvm_version": "0.13.dev0"}
{"input": ["cuda -keys=cuda,gpu -arch=sm_75 -max_num_threads=1024 -thread_warp_size=32", "batch_matmul.cuda", [["TENSOR", [1, 128, 768], "float32"], ["TENSOR", [1, 768, 768], "float32"], [1, 128, 768], "float32", 0, 0], {}], "config": {"index": 58395, "code_hash": null, "entity": [["tile_y", "sp", [-1, 8, 1]], ["tile_x", "sp", [-1, 3, 1]], ["tile_k", "sp", [-1, 96]], ["auto_unroll_max_step", "ot", 8], ["unroll_explicit", "ot", 0]]}, "result": [[0.0037421795555555555, 0.0037425895925925928, 0.0037429676666666666], 0, 1.602924108505249, 1688589983.5493784], "version": 0.2, "tvm_version": "0.13.dev0"}
{"input": ["cuda -keys=cuda,gpu -arch=sm_75 -max_num_threads=1024 -thread_warp_size=32", "batch_matmul.cuda", [["TENSOR", [1, 128, 768], "float32"], ["TENSOR", [1, 768, 768], "float32"], [1, 128, 768], "float32", 0, 0], {}], "config": {"index": 196492, "code_hash": null, "entity": [["tile_y", "sp", [-1, 16, 1]], ["tile_x", "sp", [-1, 2, 6]], ["tile_k", "sp", [-1, 6]], ["auto_unroll_max_step", "ot", 32], ["unroll_explicit", "ot", 0]]}, "result": [[0.0006695059396551725, 0.000669598875, 0.0006696091336206898], 0, 1.9229953289031982, 1688589984.9095967], "version": 0.2, "tvm_version": "0.13.dev0"}
{"input": ["cuda -keys=cuda,gpu -arch=sm_75 -max_num_threads=1024 -thread_warp_size=32", "batch_matmul.cuda", [["TENSOR", [1, 128, 768], "float32"], ["TENSOR", [1, 768, 768], "float32"], [1, 128, 768], "float32", 0, 0], {}], "config": {"index": 390445, "code_hash": null, "entity": [["tile_y", "sp", [-1, 16, 8]], ["tile_x", "sp", [-1, 3, 4]], ["tile_k", "sp", [-1, 24]], ["auto_unroll_max_step", "ot", 8], ["unroll_explicit", "ot", 1]]}, "result": [[0.0005048322440000001, 0.000508127224, 0.0006503651225806451], 0, 1.7182087898254395, 1688589988.4343], "version": 0.2, "tvm_version": "0.13.dev0"}
{"input": ["cuda -keys=cuda,gpu -arch=sm_75 -max_num_threads=1024 -thread_warp_size=32", "batch_matmul.cuda", [["TENSOR", [1, 128, 768], "float32"], ["TENSOR", [1, 768, 768], "float32"], [1, 128, 768], "float32", 0, 0], {}], "config": {"index": 325997, "code_hash": null, "entity": [["tile_y", "sp", [-1, 4, 4]], ["tile_x", "sp", [-1, 48, 1]], ["tile_k", "sp", [-1, 128]], ["auto_unroll_max_step", "ot", 64], ["unroll_explicit", "ot", 0]]}, "result": [[0.0002300332392550143, 0.00023004205014326648, 0.00023010277936962752], 0, 1.874690055847168, 1688589989.8282657], "version": 0.2, "tvm_version": "0.13.dev0"}
{"input": ["cuda -keys=cuda,gpu -arch=sm_75 -max_num_threads=1024 -thread_warp_size=32", "batch_matmul.cuda", [["TENSOR", [1, 128, 768], "float32"], ["TENSOR", [1, 768, 768], "float32"], [1, 128, 768], "float32", 0, 0], {}], "config": {"index": 97908, "code_hash": null, "entity": [["tile_y", "sp", [-1, 8, 8]], ["tile_x", "sp", [-1, 2, 2]], ["tile_k", "sp", [-1, 3]], ["auto_unroll_max_step", "ot", 16], ["unroll_explicit", "ot", 0]]}, "result": [[0.0015422872615384615, 0.0015423644923076923, 0.0015425432615384614], 0, 1.4673161506652832, 1688589990.8262146], "version": 0.2, "tvm_version": "0.13.dev0"}
{"input": ["cuda -keys=cuda,gpu -arch=sm_75 -max_num_threads=1024 -thread_warp_size=32", "batch_matmul.cuda", [["TENSOR", [1, 128, 768], "float32"], ["TENSOR", [1, 768, 768], "float32"], [1, 128, 768], "float32", 0, 0], {}], "config": {"index": 271583, "code_hash": null, "entity": [["tile_y", "sp", [-1, 1, 128]], ["tile_x", "sp", [-1, 12, 64]], ["tile_k", "sp", [-1, 2]], ["auto_unroll_max_step", "ot", 64], ["unroll_explicit", "ot", 0]]}, "result": [[0.04425659666666667, 0.044798838, 0.04480339033333333], 0, 2.128880262374878, 1688589992.1395264], "version": 0.2, "tvm_version": "0.13.dev0"}
{"input": ["cuda -keys=cuda,gpu -arch=sm_75 -max_num_threads=1024 -thread_warp_size=32", "batch_matmul.cuda", [["TENSOR", [1, 128, 768], "float32"], ["TENSOR", [1, 768, 768], "float32"], [1, 128, 768], "float32", 0, 0], {}], "config": {"index": 89443, "code_hash": null, "entity": [["tile_y", "sp", [-1, 16, 4]], ["tile_x", "sp", [-1, 64, 4]], ["tile_k", "sp", [-1, 1]], ["auto_unroll_max_step", "ot", 16], ["unroll_explicit", "ot", 0]]}, "result": [[0.000649015893442623, 0.0006490565409836066, 0.000649093], 0, 1.8850345611572266, 1688589993.513866], "version": 0.2, "tvm_version": "0.13.dev0"}
{"input": ["cuda -keys=cuda,gpu -arch=sm_75 -max_num_threads=1024 -thread_warp_size=32", "batch_matmul.cuda", [["TENSOR", [1, 128, 768], "float32"], ["TENSOR", [1, 768, 768], "float32"], [1, 128, 768], "float32", 0, 0], {}], "config": {"index": 552294, "code_hash": null, "entity": [["tile_y", "sp", [-1, 8, 4]], ["tile_x", "sp", [-1, 3, 16]], ["tile_k", "sp", [-1, 8]], ["auto_unroll_max_step", "ot", 32], ["unroll_explicit", "ot", 1]]}, "result": [[0.0005229758078175896, 0.0005229938013029316, 0.0005230471824104235], 0, 1.9345803260803223, 1688589994.9144952], "version": 0.2, "tvm_version": "0.13.dev0"}
