results/cuda_teste_gogh/vgg-16/droplet/cpu.log_layer_1.log
{"input": ["cuda -keys=cuda,gpu -arch=sm_86 -max_num_threads=1024 -thread_warp_size=32", "conv2d_nchw_winograd.cuda", [["TENSOR", [1, 3, 224, 224], "float32"], ["TENSOR", [64, 3, 3, 3], "float32"], [1, 1], [1, 1, 1, 1], [1, 1], "float32"], {}], "config": {"index": 0, "code_hash": null, "entity": [["tile_b", "sp", [-1, 1, 1, 1]], ["tile_y", "sp", [-1, 1, 1, 1]], ["tile_x", "sp", [-1, 1, 1, 1]], ["tile_rc", "sp", [-1, 1]], ["auto_unroll_max_step", "ot", 0], ["unroll_explicit", "ot", 0]]}, "result": [[0.004324927781250001, 0.004324927781250001, 0.0050293247], 0, 5.186604738235474, 1679978488.010581], "version": 0.2, "tvm_version": "0.10.0"}
{"input": ["cuda -keys=cuda,gpu -arch=sm_86 -max_num_threads=1024 -thread_warp_size=32", "conv2d_nchw_winograd.cuda", [["TENSOR", [1, 3, 224, 224], "float32"], ["TENSOR", [64, 3, 3, 3], "float32"], [1, 1], [1, 1, 1, 1], [1, 1], "float32"], {}], "config": {"index": 423360, "code_hash": null, "entity": [["tile_b", "sp", [-1, 1, 1, 1]], ["tile_y", "sp", [-1, 1, 1, 1]], ["tile_x", "sp", [-1, 1, 1, 1]], ["tile_rc", "sp", [-1, 1]], ["auto_unroll_max_step", "ot", 0], ["unroll_explicit", "ot", 1]]}, "result": [[0.004324813166666667, 0.004324818583333333, 0.0043248214583333335], 0, 4.977028846740723, 1679978488.9218144], "version": 0.2, "tvm_version": "0.10.0"}
{"input": ["cuda -keys=cuda,gpu -arch=sm_86 -max_num_threads=1024 -thread_warp_size=32", "conv2d_nchw_winograd.cuda", [["TENSOR", [1, 3, 224, 224], "float32"], ["TENSOR", [64, 3, 3, 3], "float32"], [1, 1], [1, 1, 1, 1], [1, 1], "float32"], {}], "config": {"index": 0, "code_hash": null, "entity": [["tile_b", "sp", [-1, 1, 1, 1]], ["tile_y", "sp", [-1, 1, 1, 1]], ["tile_x", "sp", [-1, 1, 1, 1]], ["tile_rc", "sp", [-1, 1]], ["auto_unroll_max_step", "ot", 0], ["unroll_explicit", "ot", 0]]}, "result": [[0.004324955916666666, 0.004325119958333333, 0.0043252054583333335], 0, 5.062616348266602, 1679978489.8203433], "version": 0.2, "tvm_version": "0.10.0"}
{"input": ["cuda -keys=cuda,gpu -arch=sm_86 -max_num_threads=1024 -thread_warp_size=32", "conv2d_nchw_winograd.cuda", [["TENSOR", [1, 3, 224, 224], "float32"], ["TENSOR", [64, 3, 3, 3], "float32"], [1, 1], [1, 1, 1, 1], [1, 1], "float32"], {}], "config": {"index": 141120, "code_hash": null, "entity": [["tile_b", "sp", [-1, 1, 1, 1]], ["tile_y", "sp", [-1, 1, 1, 1]], ["tile_x", "sp", [-1, 1, 1, 1]], ["tile_rc", "sp", [-1, 1]], ["auto_unroll_max_step", "ot", 128], ["unroll_explicit", "ot", 0]]}, "result": [[0.004324778541666667, 0.004324864041666667, 0.004324982625], 0, 4.380098342895508, 1679978490.724949], "version": 0.2, "tvm_version": "0.10.0"}
{"input": ["cuda -keys=cuda,gpu -arch=sm_86 -max_num_threads=1024 -thread_warp_size=32", "conv2d_nchw_winograd.cuda", [["TENSOR", [1, 3, 224, 224], "float32"], ["TENSOR", [64, 3, 3, 3], "float32"], [1, 1], [1, 1, 1, 1], [1, 1], "float32"], {}], "config": {"index": 564480, "code_hash": null, "entity": [["tile_b", "sp", [-1, 1, 1, 1]], ["tile_y", "sp", [-1, 1, 1, 1]], ["tile_x", "sp", [-1, 1, 1, 1]], ["tile_rc", "sp", [-1, 1]], ["auto_unroll_max_step", "ot", 128], ["unroll_explicit", "ot", 1]]}, "result": [[0.004324778541666667, 0.0043248599166666665, 0.004324864041666667], 0, 4.992796421051025, 1679978491.638355], "version": 0.2, "tvm_version": "0.10.0"}
{"input": ["cuda -keys=cuda,gpu -arch=sm_86 -max_num_threads=1024 -thread_warp_size=32", "conv2d_nchw_winograd.cuda", [["TENSOR", [1, 3, 224, 224], "float32"], ["TENSOR", [64, 3, 3, 3], "float32"], [1, 1], [1, 1, 1, 1], [1, 1], "float32"], {}], "config": {"index": 70560, "code_hash": null, "entity": [["tile_b", "sp", [-1, 1, 1, 1]], ["tile_y", "sp", [-1, 1, 1, 1]], ["tile_x", "sp", [-1, 1, 1, 1]], ["tile_rc", "sp", [-1, 3]], ["auto_unroll_max_step", "ot", 0], ["unroll_explicit", "ot", 0]]}, "result": [[0.004324864041666667, 0.004324906666666667, 0.00432498675], 0, 5.026458263397217, 1679978492.5411072], "version": 0.2, "tvm_version": "0.10.0"}
{"input": ["cuda -keys=cuda,gpu -arch=sm_86 -max_num_threads=1024 -thread_warp_size=32", "conv2d_nchw_winograd.cuda", [["TENSOR", [1, 3, 224, 224], "float32"], ["TENSOR", [64, 3, 3, 3], "float32"], [1, 1], [1, 1, 1, 1], [1, 1], "float32"], {}], "config": {"index": 493920, "code_hash": null, "entity": [["tile_b", "sp", [-1, 1, 1, 1]], ["tile_y", "sp", [-1, 1, 1, 1]], ["tile_x", "sp", [-1, 1, 1, 1]], ["tile_rc", "sp", [-1, 3]], ["auto_unroll_max_step", "ot", 0], ["unroll_explicit", "ot", 1]]}, "result": [[0.0043248214583333335, 0.0043249492500000005, 0.004324991833333333], 0, 5.022816896438599, 1679978493.4450426], "version": 0.2, "tvm_version": "0.10.0"}
{"input": ["cuda -keys=cuda,gpu -arch=sm_86 -max_num_threads=1024 -thread_warp_size=32", "conv2d_nchw_winograd.cuda", [["TENSOR", [1, 3, 224, 224], "float32"], ["TENSOR", [64, 3, 3, 3], "float32"], [1, 1], [1, 1, 1, 1], [1, 1], "float32"], {}], "config": {"index": 211680, "code_hash": null, "entity": [["tile_b", "sp", [-1, 1, 1, 1]], ["tile_y", "sp", [-1, 1, 1, 1]], ["tile_x", "sp", [-1, 1, 1, 1]], ["tile_rc", "sp", [-1, 3]], ["auto_unroll_max_step", "ot", 128], ["unroll_explicit", "ot", 0]]}, "result": [[0.004324991833333333, 0.004324994708333333, 0.004325033166666666], 0, 4.988834619522095, 1679978494.3427837], "version": 0.2, "tvm_version": "0.10.0"}
{"input": ["cuda -keys=cuda,gpu -arch=sm_86 -max_num_threads=1024 -thread_warp_size=32", "conv2d_nchw_winograd.cuda", [["TENSOR", [1, 3, 224, 224], "float32"], ["TENSOR", [64, 3, 3, 3], "float32"], [1, 1], [1, 1, 1, 1], [1, 1], "float32"], {}], "config": {"index": 635040, "code_hash": null, "entity": [["tile_b", "sp", [-1, 1, 1, 1]], ["tile_y", "sp", [-1, 1, 1, 1]], ["tile_x", "sp", [-1, 1, 1, 1]], ["tile_rc", "sp", [-1, 3]], ["auto_unroll_max_step", "ot", 128], ["unroll_explicit", "ot", 1]]}, "result": [[0.00432503475, 0.004325068125, 0.004325119958333333], 0, 4.8827595710754395, 1679978495.2437487], "version": 0.2, "tvm_version": "0.10.0"}
{"input": ["cuda -keys=cuda,gpu -arch=sm_86 -max_num_threads=1024 -thread_warp_size=32", "conv2d_nchw_winograd.cuda", [["TENSOR", [1, 3, 224, 224], "float32"], ["TENSOR", [64, 3, 3, 3], "float32"], [1, 1], [1, 1, 1, 1], [1, 1], "float32"], {}], "config": {"index": 84, "code_hash": null, "entity": [["tile_b", "sp", [-1, 1, 1, 1]], ["tile_y", "sp", [-1, 1, 1, 1]], ["tile_x", "sp", [-1, 2, 1, 1]], ["tile_rc", "sp", [-1, 1]], ["auto_unroll_max_step", "ot", 0], ["unroll_explicit", "ot", 0]]}, "result": [[0.0024702626585365855, 0.002477780219512195, 0.002481951268292683], 0, 4.970895290374756, 1679978496.119082], "version": 0.2, "tvm_version": "0.10.0"}
{"input": ["cuda -keys=cuda,gpu -arch=sm_86 -max_num_threads=1024 -thread_warp_size=32", "conv2d_nchw_winograd.cuda", [["TENSOR", [1, 3, 224, 224], "float32"], ["TENSOR", [64, 3, 3, 3], "float32"], [1, 1], [1, 1, 1, 1], [1, 1], "float32"], {}], "config": {"index": 423444, "code_hash": null, "entity": [["tile_b", "sp", [-1, 1, 1, 1]], ["tile_y", "sp", [-1, 1, 1, 1]], ["tile_x", "sp", [-1, 2, 1, 1]], ["tile_rc", "sp", [-1, 1]], ["auto_unroll_max_step", "ot", 0], ["unroll_explicit", "ot", 1]]}, "result": [[0.002481926317073171, 0.002481951268292683, 0.0024820260731707317], 0, 4.88347315788269, 1679978497.0083988], "version": 0.2, "tvm_version": "0.10.0"}
{"input": ["cuda -keys=cuda,gpu -arch=sm_86 -max_num_threads=1024 -thread_warp_size=32", "conv2d_nchw_winograd.cuda", [["TENSOR", [1, 3, 224, 224], "float32"], ["TENSOR", [64, 3, 3, 3], "float32"], [1, 1], [1, 1, 1, 1], [1, 1], "float32"], {}], "config": {"index": 141204, "code_hash": null, "entity": [["tile_b", "sp", [-1, 1, 1, 1]], ["tile_y", "sp", [-1, 1, 1, 1]], ["tile_x", "sp", [-1, 2, 1, 1]], ["tile_rc", "sp", [-1, 1]], ["auto_unroll_max_step", "ot", 128], ["unroll_explicit", "ot", 0]]}, "result": [[0.0024819989024390246, 0.0024820011219512193, 0.002482102536585366], 0, 4.977758169174194, 1679978497.8892627], "version": 0.2, "tvm_version": "0.10.0"}
{"input": ["cuda -keys=cuda,gpu -arch=sm_86 -max_num_threads=1024 -thread_warp_size=32", "conv2d_nchw_winograd.cuda", [["TENSOR", [1, 3, 224, 224], "float32"], ["TENSOR", [64, 3, 3, 3], "float32"], [1, 1], [1, 1, 1, 1], [1, 1], "float32"], {}], "config": {"index": 564564, "code_hash": null, "entity": [["tile_b", "sp", [-1, 1, 1, 1]], ["tile_y", "sp", [-1, 1, 1, 1]], ["tile_x", "sp", [-1, 2, 1, 1]], ["tile_rc", "sp", [-1, 1]], ["auto_unroll_max_step", "ot", 128], ["unroll_explicit", "ot", 1]]}, "result": [[0.0023666307209302324, 0.002366797325581395, 0.002366797325581395], 0, 4.917479515075684, 1679978498.771119], "version": 0.2, "tvm_version": "0.10.0"}
{"input": ["cuda -keys=cuda,gpu -arch=sm_86 -max_num_threads=1024 -thread_warp_size=32", "conv2d_nchw_winograd.cuda", [["TENSOR", [1, 3, 224, 224], "float32"], ["TENSOR", [64, 3, 3, 3], "float32"], [1, 1], [1, 1, 1, 1], [1, 1], "float32"], {}], "config": {"index": 70644, "code_hash": null, "entity": [["tile_b", "sp", [-1, 1, 1, 1]], ["tile_y", "sp", [-1, 1, 1, 1]], ["tile_x", "sp", [-1, 2, 1, 1]], ["tile_rc", "sp", [-1, 3]], ["auto_unroll_max_step", "ot", 0], ["unroll_explicit", "ot", 0]]}, "result": [[0.0022118845217391305, 0.0022118845217391305, 0.0022119289782608696], 0, 4.983636379241943, 1679978499.6613004], "version": 0.2, "tvm_version": "0.10.0"}
{"input": ["cuda -keys=cuda,gpu -arch=sm_86 -max_num_threads=1024 -thread_warp_size=32", "conv2d_nchw_winograd.cuda", [["TENSOR", [1, 3, 224, 224], "float32"], ["TENSOR", [64, 3, 3, 3], "float32"], [1, 1], [1, 1, 1, 1], [1, 1], "float32"], {}], "config": {"index": 494004, "code_hash": null, "entity": [["tile_b", "sp", [-1, 1, 1, 1]], ["tile_y", "sp", [-1, 1, 1, 1]], ["tile_x", "sp", [-1, 2, 1, 1]], ["tile_rc", "sp", [-1, 3]], ["auto_unroll_max_step", "ot", 0], ["unroll_explicit", "ot", 1]]}, "result": [[0.0022119729347826085, 0.002212040260869565, 0.002212062652173913], 0, 4.929205656051636, 1679978500.5435119], "version": 0.2, "tvm_version": "0.10.0"}
{"input": ["cuda -keys=cuda,gpu -arch=sm_86 -max_num_threads=1024 -thread_warp_size=32", "conv2d_nchw_winograd.cuda", [["TENSOR", [1, 3, 224, 224], "float32"], ["TENSOR", [64, 3, 3, 3], "float32"], [1, 1], [1, 1, 1, 1], [1, 1], "float32"], {}], "config": {"index": 211764, "code_hash": null, "entity": [["tile_b", "sp", [-1, 1, 1, 1]], ["tile_y", "sp", [-1, 1, 1, 1]], ["tile_x", "sp", [-1, 2, 1, 1]], ["tile_rc", "sp", [-1, 3]], ["auto_unroll_max_step", "ot", 128], ["unroll_explicit", "ot", 0]]}, "result": [[0.0022119958260869567, 0.002212018043478261, 0.0022120848913043476], 0, 4.86388635635376, 1679978501.42439], "version": 0.2, "tvm_version": "0.10.0"}
{"input": ["cuda -keys=cuda,gpu -arch=sm_86 -max_num_threads=1024 -thread_warp_size=32", "conv2d_nchw_winograd.cuda", [["TENSOR", [1, 3, 224, 224], "float32"], ["TENSOR", [64, 3, 3, 3], "float32"], [1, 1], [1, 1, 1, 1], [1, 1], "float32"], {}], "config": {"index": 635124, "code_hash": null, "entity": [["tile_b", "sp", [-1, 1, 1, 1]], ["tile_y", "sp", [-1, 1, 1, 1]], ["tile_x", "sp", [-1, 2, 1, 1]], ["tile_rc", "sp", [-1, 3]], ["auto_unroll_max_step", "ot", 128], ["unroll_explicit", "ot", 1]]}, "result": [[0.00219287990625, 0.00219287990625, 0.0025461288249999997], 0, 4.909090042114258, 1679978506.614828], "version": 0.2, "tvm_version": "0.10.0"}
{"input": ["cuda -keys=cuda,gpu -arch=sm_86 -max_num_threads=1024 -thread_warp_size=32", "conv2d_nchw_winograd.cuda", [["TENSOR", [1, 3, 224, 224], "float32"], ["TENSOR", [64, 3, 3, 3], "float32"], [1, 1], [1, 1, 1, 1], [1, 1], "float32"], {}], "config": {"index": 1, "code_hash": null, "entity": [["tile_b", "sp", [-1, 1, 1, 1]], ["tile_y", "sp", [-1, 2, 1, 1]], ["tile_x", "sp", [-1, 1, 1, 1]], ["tile_rc", "sp", [-1, 1]], ["auto_unroll_max_step", "ot", 0], ["unroll_explicit", "ot", 0]]}, "result": [[0.002391935976190476, 0.0023919665, 0.0023919908333333334], 0, 4.672762632369995, 1679978507.4936774], "version": 0.2, "tvm_version": "0.10.0"}
{"input": ["cuda -keys=cuda,gpu -arch=sm_86 -max_num_threads=1024 -thread_warp_size=32", "conv2d_nchw_winograd.cuda", [["TENSOR", [1, 3, 224, 224], "float32"], ["TENSOR", [64, 3, 3, 3], "float32"], [1, 1], [1, 1, 1, 1], [1, 1], "float32"], {}], "config": {"index": 423361, "code_hash": null, "entity": [["tile_b", "sp", [-1, 1, 1, 1]], ["tile_y", "sp", [-1, 2, 1, 1]], ["tile_x", "sp", [-1, 1, 1, 1]], ["tile_rc", "sp", [-1, 1]], ["auto_unroll_max_step", "ot", 0], ["unroll_explicit", "ot", 1]]}, "result": [[0.0023916251666666667, 0.002391673857142857, 0.002391942142857143], 0, 4.711772918701172, 1679978508.3753407], "version": 0.2, "tvm_version": "0.10.0"}
{"input": ["cuda -keys=cuda,gpu -arch=sm_86 -max_num_threads=1024 -thread_warp_size=32", "conv2d_nchw_winograd.cuda", [["TENSOR", [1, 3, 224, 224], "float32"], ["TENSOR", [64, 3, 3, 3], "float32"], [1, 1], [1, 1, 1, 1], [1, 1], "float32"], {}], "config": {"index": 141121, "code_hash": null, "entity": [["tile_b", "sp", [-1, 1, 1, 1]], ["tile_y", "sp", [-1, 2, 1, 1]], ["tile_x", "sp", [-1, 1, 1, 1]], ["tile_rc", "sp", [-1, 1]], ["auto_unroll_max_step", "ot", 128], ["unroll_explicit", "ot", 0]]}, "result": [[0.002391673857142857, 0.002391673857142857, 0.0023918901904761906], 0, 4.74699854850769, 1679978509.2524939], "version": 0.2, "tvm_version": "0.10.0"}
{"input": ["cuda -keys=cuda,gpu -arch=sm_86 -max_num_threads=1024 -thread_warp_size=32", "conv2d_nchw_winograd.cuda", [["TENSOR", [1, 3, 224, 224], "float32"], ["TENSOR", [64, 3, 3, 3], "float32"], [1, 1], [1, 1, 1, 1], [1, 1], "float32"], {}], "config": {"index": 564481, "code_hash": null, "entity": [["tile_b", "sp", [-1, 1, 1, 1]], ["tile_y", "sp", [-1, 2, 1, 1]], ["tile_x", "sp", [-1, 1, 1, 1]], ["tile_rc", "sp", [-1, 1]], ["auto_unroll_max_step", "ot", 128], ["unroll_explicit", "ot", 1]]}, "result": [[0.0023742510697674422, 0.0023742750232558143, 0.0023745108139534886], 0, 4.7138471603393555, 1679978510.1391096], "version": 0.2, "tvm_version": "0.10.0"}
{"input": ["cuda -keys=cuda,gpu -arch=sm_86 -max_num_threads=1024 -thread_warp_size=32", "conv2d_nchw_winograd.cuda", [["TENSOR", [1, 3, 224, 224], "float32"], ["TENSOR", [64, 3, 3, 3], "float32"], [1, 1], [1, 1, 1, 1], [1, 1], "float32"], {}], "config": {"index": 70561, "code_hash": null, "entity": [["tile_b", "sp", [-1, 1, 1, 1]], ["tile_y", "sp", [-1, 2, 1, 1]], ["tile_x", "sp", [-1, 1, 1, 1]], ["tile_rc", "sp", [-1, 3]], ["auto_unroll_max_step", "ot", 0], ["unroll_explicit", "ot", 0]]}, "result": [[0.002192962804347826, 0.0021929850217391306, 0.0021930072608695654], 0, 4.6139538288116455, 1679978511.0216417], "version": 0.2, "tvm_version": "0.10.0"}
{"input": ["cuda -keys=cuda,gpu -arch=sm_86 -max_num_threads=1024 -thread_warp_size=32", "conv2d_nchw_winograd.cuda", [["TENSOR", [1, 3, 224, 224], "float32"], ["TENSOR", [64, 3, 3, 3], "float32"], [1, 1], [1, 1, 1, 1], [1, 1], "float32"], {}], "config": {"index": 493921, "code_hash": null, "entity": [["tile_b", "sp", [-1, 1, 1, 1]], ["tile_y", "sp", [-1, 2, 1, 1]], ["tile_x", "sp", [-1, 1, 1, 1]], ["tile_rc", "sp", [-1, 3]], ["auto_unroll_max_step", "ot", 0], ["unroll_explicit", "ot", 1]]}, "result": [[0.002192962804347826, 0.002193025326086957, 0.0021930294782608697], 0, 4.723225116729736, 1679978511.8967874], "version": 0.2, "tvm_version": "0.10.0"}
{"input": ["cuda -keys=cuda,gpu -arch=sm_86 -max_num_threads=1024 -thread_warp_size=32", "conv2d_nchw_winograd.cuda", [["TENSOR", [1, 3, 224, 224], "float32"], ["TENSOR", [64, 3, 3, 3], "float32"], [1, 1], [1, 1, 1, 1], [1, 1], "float32"], {}], "config": {"index": 211681, "code_hash": null, "entity": [["tile_b", "sp", [-1, 1, 1, 1]], ["tile_y", "sp", [-1, 2, 1, 1]], ["tile_x", "sp", [-1, 1, 1, 1]], ["tile_rc", "sp", [-1, 3]], ["auto_unroll_max_step", "ot", 128], ["unroll_explicit", "ot", 0]]}, "result": [[0.002193049717391304, 0.0021930518695652173, 0.0021930727608695656], 0, 4.763709545135498, 1679978512.7804708], "version": 0.2, "tvm_version": "0.10.0"}
{"input": ["cuda -keys=cuda,gpu -arch=sm_86 -max_num_threads=1024 -thread_warp_size=32", "conv2d_nchw_winograd.cuda", [["TENSOR", [1, 3, 224, 224], "float32"], ["TENSOR", [64, 3, 3, 3], "float32"], [1, 1], [1, 1, 1, 1], [1, 1], "float32"], {}], "config": {"index": 635041, "code_hash": null, "entity": [["tile_b", "sp", [-1, 1, 1, 1]], ["tile_y", "sp", [-1, 2, 1, 1]], ["tile_x", "sp", [-1, 1, 1, 1]], ["tile_rc", "sp", [-1, 3]], ["auto_unroll_max_step", "ot", 128], ["unroll_explicit", "ot", 1]]}, "result": [[0.0021929405869565216, 0.0021930294782608697, 0.0021930468913043477], 0, 4.721341609954834, 1679978513.6555166], "version": 0.2, "tvm_version": "0.10.0"}
{"input": ["cuda -keys=cuda,gpu -arch=sm_86 -max_num_threads=1024 -thread_warp_size=32", "conv2d_nchw_winograd.cuda", [["TENSOR", [1, 3, 224, 224], "float32"], ["TENSOR", [64, 3, 3, 3], "float32"], [1, 1], [1, 1, 1, 1], [1, 1], "float32"], {}], "config": {"index": 85, "code_hash": null, "entity": [["tile_b", "sp", [-1, 1, 1, 1]], ["tile_y", "sp", [-1, 2, 1, 1]], ["tile_x", "sp", [-1, 2, 1, 1]], ["tile_rc", "sp", [-1, 1]], ["auto_unroll_max_step", "ot", 0], ["unroll_explicit", "ot", 0]]}, "result": [[0.0012624896, 0.00126251315, 0.0012626303625], 0, 4.692306280136108, 1679978514.5334554], "version": 0.2, "tvm_version": "0.10.0"}
{"input": ["cuda -keys=cuda,gpu -arch=sm_86 -max_num_threads=1024 -thread_warp_size=32", "conv2d_nchw_winograd.cuda", [["TENSOR", [1, 3, 224, 224], "float32"], ["TENSOR", [64, 3, 3, 3], "float32"], [1, 1], [1, 1, 1, 1], [1, 1], "float32"], {}], "config": {"index": 423445, "code_hash": null, "entity": [["tile_b", "sp", [-1, 1, 1, 1]], ["tile_y", "sp", [-1, 2, 1, 1]], ["tile_x", "sp", [-1, 2, 1, 1]], ["tile_rc", "sp", [-1, 1]], ["auto_unroll_max_step", "ot", 0], ["unroll_explicit", "ot", 1]]}, "result": [[0.0012626048000000001, 0.001262693975, 0.0012626943499999999], 0, 4.771749258041382, 1679978515.4093184], "version": 0.2, "tvm_version": "0.10.0"}
{"input": ["cuda -keys=cuda,gpu -arch=sm_86 -max_num_threads=1024 -thread_warp_size=32", "conv2d_nchw_winograd.cuda", [["TENSOR", [1, 3, 224, 224], "float32"], ["TENSOR", [64, 3, 3, 3], "float32"], [1, 1], [1, 1, 1, 1], [1, 1], "float32"], {}], "config": {"index": 141205, "code_hash": null, "entity": [["tile_b", "sp", [-1, 1, 1, 1]], ["tile_y", "sp", [-1, 2, 1, 1]], ["tile_x", "sp", [-1, 2, 1, 1]], ["tile_rc", "sp", [-1, 1]], ["auto_unroll_max_step", "ot", 128], ["unroll_explicit", "ot", 0]]}, "result": [[0.0012625300375, 0.0012626303625, 0.0012626416125], 0, 4.72330904006958, 1679978516.2890322], "version": 0.2, "tvm_version": "0.10.0"}
{"input": ["cuda -keys=cuda,gpu -arch=sm_86 -max_num_threads=1024 -thread_warp_size=32", "conv2d_nchw_winograd.cuda", [["TENSOR", [1, 3, 224, 224], "float32"], ["TENSOR", [64, 3, 3, 3], "float32"], [1, 1], [1, 1, 1, 1], [1, 1], "float32"], {}], "config": {"index": 564565, "code_hash": null, "entity": [["tile_b", "sp", [-1, 1, 1, 1]], ["tile_y", "sp", [-1, 2, 1, 1]], ["tile_x", "sp", [-1, 2, 1, 1]], ["tile_rc", "sp", [-1, 1]], ["auto_unroll_max_step", "ot", 128], ["unroll_explicit", "ot", 1]]}, "result": [[0.0012680619620253164, 0.0012680733544303798, 0.0012681134303797468], 0, 4.791017770767212, 1679978517.1668198], "version": 0.2, "tvm_version": "0.10.0"}
{"input": ["cuda -keys=cuda,gpu -arch=sm_86 -max_num_threads=1024 -thread_warp_size=32", "conv2d_nchw_winograd.cuda", [["TENSOR", [1, 3, 224, 224], "float32"], ["TENSOR", [64, 3, 3, 3], "float32"], [1, 1], [1, 1, 1, 1], [1, 1], "float32"], {}], "config": {"index": 70645, "code_hash": null, "entity": [["tile_b", "sp", [-1, 1, 1, 1]], ["tile_y", "sp", [-1, 2, 1, 1]], ["tile_x", "sp", [-1, 2, 1, 1]], ["tile_rc", "sp", [-1, 3]], ["auto_unroll_max_step", "ot", 0], ["unroll_explicit", "ot", 0]]}, "result": [[0.0011272974719101123, 0.0011273089550561796, 0.0011273204494382022], 0, 4.736038446426392, 1679978518.0442426], "version": 0.2, "tvm_version": "0.10.0"}
{"input": ["cuda -keys=cuda,gpu -arch=sm_86 -max_num_threads=1024 -thread_warp_size=32", "conv2d_nchw_winograd.cuda", [["TENSOR", [1, 3, 224, 224], "float32"], ["TENSOR", [64, 3, 3, 3], "float32"], [1, 1], [1, 1, 1, 1], [1, 1], "float32"], {}], "config": {"index": 494005, "code_hash": null, "entity": [["tile_b", "sp", [-1, 1, 1, 1]], ["tile_y", "sp", [-1, 2, 1, 1]], ["tile_x", "sp", [-1, 2, 1, 1]], ["tile_rc", "sp", [-1, 3]], ["auto_unroll_max_step", "ot", 0], ["unroll_explicit", "ot", 1]]}, "result": [[0.001127218, 0.001127237382022472, 0.0011272629213483147], 0, 4.776282548904419, 1679978518.9252667], "version": 0.2, "tvm_version": "0.10.0"}
{"input": ["cuda -keys=cuda,gpu -arch=sm_86 -max_num_threads=1024 -thread_warp_size=32", "conv2d_nchw_winograd.cuda", [["TENSOR", [1, 3, 224, 224], "float32"], ["TENSOR", [64, 3, 3, 3], "float32"], [1, 1], [1, 1, 1, 1], [1, 1], "float32"], {}], "config": {"index": 211765, "code_hash": null, "entity": [["tile_b", "sp", [-1, 1, 1, 1]], ["tile_y", "sp", [-1, 2, 1, 1]], ["tile_x", "sp", [-1, 2, 1, 1]], ["tile_rc", "sp", [-1, 3]], ["auto_unroll_max_step", "ot", 128], ["unroll_explicit", "ot", 0]]}, "result": [[0.0011271939213483146, 0.0011272406404494381, 0.0011272858988764045], 0, 4.702669382095337, 1679978519.8112674], "version": 0.2, "tvm_version": "0.10.0"}
{"input": ["cuda -keys=cuda,gpu -arch=sm_86 -max_num_threads=1024 -thread_warp_size=32", "conv2d_nchw_winograd.cuda", [["TENSOR", [1, 3, 224, 224], "float32"], ["TENSOR", [64, 3, 3, 3], "float32"], [1, 1], [1, 1, 1, 1], [1, 1], "float32"], {}], "config": {"index": 70728, "code_hash": null, "entity": [["tile_b", "sp", [-1, 1, 1, 1]], ["tile_y", "sp", [-1, 1, 1, 1]], ["tile_x", "sp", [-1, 4, 1, 1]], ["tile_rc", "sp", [-1, 3]], ["auto_unroll_max_step", "ot", 0], ["unroll_explicit", "ot", 0]]}, "result": [[0.0011272670322580646, 0.0011282250161290322, 0.0013047222727272728], 0, 4.988781213760376, 1679978524.9981759], "version": 0.2, "tvm_version": "0.10.0"}
{"input": ["cuda -keys=cuda,gpu -arch=sm_86 -max_num_threads=1024 -thread_warp_size=32", "conv2d_nchw_winograd.cuda", [["TENSOR", [1, 3, 224, 224], "float32"], ["TENSOR", [64, 3, 3, 3], "float32"], [1, 1], [1, 1, 1, 1], [1, 1], "float32"], {}], "config": {"index": 494088, "code_hash": null, "entity": [["tile_b", "sp", [-1, 1, 1, 1]], ["tile_y", "sp", [-1, 1, 1, 1]], ["tile_x", "sp", [-1, 4, 1, 1]], ["tile_rc", "sp", [-1, 3]], ["auto_unroll_max_step", "ot", 0], ["unroll_explicit", "ot", 1]]}, "result": [[0.001127230179775281, 0.0011272514382022472, 0.0011272514382022472], 0, 4.776738405227661, 1679978525.8723023], "version": 0.2, "tvm_version": "0.10.0"}
{"input": ["cuda -keys=cuda,gpu -arch=sm_86 -max_num_threads=1024 -thread_warp_size=32", "conv2d_nchw_winograd.cuda", [["TENSOR", [1, 3, 224, 224], "float32"], ["TENSOR", [64, 3, 3, 3], "float32"], [1, 1], [1, 1, 1, 1], [1, 1], "float32"], {}], "config": {"index": 211848, "code_hash": null, "entity": [["tile_b", "sp", [-1, 1, 1, 1]], ["tile_y", "sp", [-1, 1, 1, 1]], ["tile_x", "sp", [-1, 4, 1, 1]], ["tile_rc", "sp", [-1, 3]], ["auto_unroll_max_step", "ot", 128], ["unroll_explicit", "ot", 0]]}, "result": [[0.0011272858988764045, 0.0011272858988764045, 0.0011272974719101123], 0, 4.798940181732178, 1679978526.746853], "version": 0.2, "tvm_version": "0.10.0"}
{"input": ["cuda -keys=cuda,gpu -arch=sm_86 -max_num_threads=1024 -thread_warp_size=32", "conv2d_nchw_winograd.cuda", [["TENSOR", [1, 3, 224, 224], "float32"], ["TENSOR", [64, 3, 3, 3], "float32"], [1, 1], [1, 1, 1, 1], [1, 1], "float32"], {}], "config": {"index": 635208, "code_hash": null, "entity": [["tile_b", "sp", [-1, 1, 1, 1]], ["tile_y", "sp", [-1, 1, 1, 1]], ["tile_x", "sp", [-1, 4, 1, 1]], ["tile_rc", "sp", [-1, 3]], ["auto_unroll_max_step", "ot", 128], ["unroll_explicit", "ot", 1]]}, "result": [[0.001127225550561798, 0.0011272604382022472, 0.0011272629213483147], 0, 4.700277805328369, 1679978527.6227195], "version": 0.2, "tvm_version": "0.10.0"}
{"input": ["cuda -keys=cuda,gpu -arch=sm_86 -max_num_threads=1024 -thread_warp_size=32", "conv2d_nchw_winograd.cuda", [["TENSOR", [1, 3, 224, 224], "float32"], ["TENSOR", [64, 3, 3, 3], "float32"], [1, 1], [1, 1, 1, 1], [1, 1], "float32"], {}], "config": {"index": 168, "code_hash": null, "entity": [["tile_b", "sp", [-1, 1, 1, 1]], ["tile_y", "sp", [-1, 1, 1, 1]], ["tile_x", "sp", [-1, 4, 1, 1]], ["tile_rc", "sp", [-1, 1]], ["auto_unroll_max_step", "ot", 0], ["unroll_explicit", "ot", 0]]}, "result": [[0.0011326590449438204, 0.00113268202247191, 0.0011327165730337077], 0, 4.789244890213013, 1679978528.5062122], "version": 0.2, "tvm_version": "0.10.0"}
{"input": ["cuda -keys=cuda,gpu -arch=sm_86 -max_num_threads=1024 -thread_warp_size=32", "conv2d_nchw_winograd.cuda", [["TENSOR", [1, 3, 224, 224], "float32"], ["TENSOR", [64, 3, 3, 3], "float32"], [1, 1], [1, 1, 1, 1], [1, 1], "float32"], {}], "config": {"index": 423528, "code_hash": null, "entity": [["tile_b", "sp", [-1, 1, 1, 1]], ["tile_y", "sp", [-1, 1, 1, 1]], ["tile_x", "sp", [-1, 4, 1, 1]], ["tile_rc", "sp", [-1, 1]], ["auto_unroll_max_step", "ot", 0], ["unroll_explicit", "ot", 1]]}, "result": [[0.0011326245056179774, 0.0011326360786516852, 0.0011326708764044945], 0, 4.727584362030029, 1679978529.3657582], "version": 0.2, "tvm_version": "0.10.0"}
{"input": ["cuda -keys=cuda,gpu -arch=sm_86 -max_num_threads=1024 -thread_warp_size=32", "conv2d_nchw_winograd.cuda", [["TENSOR", [1, 3, 224, 224], "float32"], ["TENSOR", [64, 3, 3, 3], "float32"], [1, 1], [1, 1, 1, 1], [1, 1], "float32"], {}], "config": {"index": 141288, "code_hash": null, "entity": [["tile_b", "sp", [-1, 1, 1, 1]], ["tile_y", "sp", [-1, 1, 1, 1]], ["tile_x", "sp", [-1, 4, 1, 1]], ["tile_rc", "sp", [-1, 1]], ["auto_unroll_max_step", "ot", 128], ["unroll_explicit", "ot", 0]]}, "result": [[0.00113268202247191, 0.00113268202247191, 0.0011326924831460675], 0, 4.755756378173828, 1679978530.2445707], "version": 0.2, "tvm_version": "0.10.0"}
{"input": ["cuda -keys=cuda,gpu -arch=sm_86 -max_num_threads=1024 -thread_warp_size=32", "conv2d_nchw_winograd.cuda", [["TENSOR", [1, 3, 224, 224], "float32"], ["TENSOR", [64, 3, 3, 3], "float32"], [1, 1], [1, 1, 1, 1], [1, 1], "float32"], {}], "config": {"index": 564648, "code_hash": null, "entity": [["tile_b", "sp", [-1, 1, 1, 1]], ["tile_y", "sp", [-1, 1, 1, 1]], ["tile_x", "sp", [-1, 4, 1, 1]], ["tile_rc", "sp", [-1, 1]], ["auto_unroll_max_step", "ot", 128], ["unroll_explicit", "ot", 1]]}, "result": [[0.0011649532674418604, 0.0011650132441860467, 0.0011650143023255815], 0, 4.804642915725708, 1679978531.1253078], "version": 0.2, "tvm_version": "0.10.0"}
{"input": ["cuda -keys=cuda,gpu -arch=sm_86 -max_num_threads=1024 -thread_warp_size=32", "conv2d_nchw_winograd.cuda", [["TENSOR", [1, 3, 224, 224], "float32"], ["TENSOR", [64, 3, 3, 3], "float32"], [1, 1], [1, 1, 1, 1], [1, 1], "float32"], {}], "config": {"index": 70729, "code_hash": null, "entity": [["tile_b", "sp", [-1, 1, 1, 1]], ["tile_y", "sp", [-1, 2, 1, 1]], ["tile_x", "sp", [-1, 4, 1, 1]], ["tile_rc", "sp", [-1, 3]], ["auto_unroll_max_step", "ot", 0], ["unroll_explicit", "ot", 0]]}, "result": [[0.0006013155333333334, 0.0006017630666666667, 0.0006020133666666667], 0, 5.223612546920776, 1679978532.4326727], "version": 0.2, "tvm_version": "0.10.0"}
{"input": ["cuda -keys=cuda,gpu -arch=sm_86 -max_num_threads=1024 -thread_warp_size=32", "conv2d_nchw_winograd.cuda", [["TENSOR", [1, 3, 224, 224], "float32"], ["TENSOR", [64, 3, 3, 3], "float32"], [1, 1], [1, 1, 1, 1], [1, 1], "float32"], {}], "config": {"index": 494089, "code_hash": null, "entity": [["tile_b", "sp", [-1, 1, 1, 1]], ["tile_y", "sp", [-1, 2, 1, 1]], ["tile_x", "sp", [-1, 4, 1, 1]], ["tile_rc", "sp", [-1, 3]], ["auto_unroll_max_step", "ot", 0], ["unroll_explicit", "ot", 1]]}, "result": [[0.0006017630666666667, 0.0006018078814814814, 0.0006018199777777779], 0, 5.205654621124268, 1679978533.7085617], "version": 0.2, "tvm_version": "0.10.0"}
{"input": ["cuda -keys=cuda,gpu -arch=sm_86 -max_num_threads=1024 -thread_warp_size=32", "conv2d_nchw_winograd.cuda", [["TENSOR", [1, 3, 224, 224], "float32"], ["TENSOR", [64, 3, 3, 3], "float32"], [1, 1], [1, 1, 1, 1], [1, 1], "float32"], {}], "config": {"index": 211849, "code_hash": null, "entity": [["tile_b", "sp", [-1, 1, 1, 1]], ["tile_y", "sp", [-1, 2, 1, 1]], ["tile_x", "sp", [-1, 4, 1, 1]], ["tile_rc", "sp", [-1, 3]], ["auto_unroll_max_step", "ot", 128], ["unroll_explicit", "ot", 0]]}, "result": [[0.0006017592814814815, 0.0006017779851851851, 0.0006026242259259258], 0, 5.195235729217529, 1679978535.0087752], "version": 0.2, "tvm_version": "0.10.0"}
{"input": ["cuda -keys=cuda,gpu -arch=sm_86 -max_num_threads=1024 -thread_warp_size=32", "conv2d_nchw_winograd.cuda", [["TENSOR", [1, 3, 224, 224], "float32"], ["TENSOR", [64, 3, 3, 3], "float32"], [1, 1], [1, 1, 1, 1], [1, 1], "float32"], {}], "config": {"index": 635209, "code_hash": null, "entity": [["tile_b", "sp", [-1, 1, 1, 1]], ["tile_y", "sp", [-1, 2, 1, 1]], ["tile_x", "sp", [-1, 4, 1, 1]], ["tile_rc", "sp", [-1, 3]], ["auto_unroll_max_step", "ot", 128], ["unroll_explicit", "ot", 1]]}, "result": [[0.0006017627259259259, 0.0006017934148148148, 0.0006026126407407407], 0, 5.172649621963501, 1679978536.2887907], "version": 0.2, "tvm_version": "0.10.0"}
{"input": ["cuda -keys=cuda,gpu -arch=sm_86 -max_num_threads=1024 -thread_warp_size=32", "conv2d_nchw_winograd.cuda", [["TENSOR", [1, 3, 224, 224], "float32"], ["TENSOR", [64, 3, 3, 3], "float32"], [1, 1], [1, 1, 1, 1], [1, 1], "float32"], {}], "config": {"index": 169, "code_hash": null, "entity": [["tile_b", "sp", [-1, 1, 1, 1]], ["tile_y", "sp", [-1, 2, 1, 1]], ["tile_x", "sp", [-1, 4, 1, 1]], ["tile_rc", "sp", [-1, 1]], ["auto_unroll_max_step", "ot", 0], ["unroll_explicit", "ot", 0]]}, "result": [[0.0006733590402684563, 0.0006759980469798658, 0.0006770289328859061], 0, 4.820717811584473, 1679978537.1963964], "version": 0.2, "tvm_version": "0.10.0"}
{"input": ["cuda -keys=cuda,gpu -arch=sm_86 -max_num_threads=1024 -thread_warp_size=32", "conv2d_nchw_winograd.cuda", [["TENSOR", [1, 3, 224, 224], "float32"], ["TENSOR", [64, 3, 3, 3], "float32"], [1, 1], [1, 1, 1, 1], [1, 1], "float32"], {}], "config": {"index": 423529, "code_hash": null, "entity": [["tile_b", "sp", [-1, 1, 1, 1]], ["tile_y", "sp", [-1, 2, 1, 1]], ["tile_x", "sp", [-1, 4, 1, 1]], ["tile_rc", "sp", [-1, 1]], ["auto_unroll_max_step", "ot", 0], ["unroll_explicit", "ot", 1]]}, "result": [[0.0006744867583892617, 0.0006770632953020134, 0.00067714577852349], 0, 4.812407970428467, 1679978538.1001832], "version": 0.2, "tvm_version": "0.10.0"}
{"input": ["cuda -keys=cuda,gpu -arch=sm_86 -max_num_threads=1024 -thread_warp_size=32", "conv2d_nchw_winograd.cuda", [["TENSOR", [1, 3, 224, 224], "float32"], ["TENSOR", [64, 3, 3, 3], "float32"], [1, 1], [1, 1, 1, 1], [1, 1], "float32"], {}], "config": {"index": 141289, "code_hash": null, "entity": [["tile_b", "sp", [-1, 1, 1, 1]], ["tile_y", "sp", [-1, 2, 1, 1]], ["tile_x", "sp", [-1, 4, 1, 1]], ["tile_rc", "sp", [-1, 1]], ["auto_unroll_max_step", "ot", 128], ["unroll_explicit", "ot", 0]]}, "result": [[0.0006770605606694561, 0.0006770910794979079, 0.0006794946861924685], 0, 5.275909662246704, 1679978539.4278684], "version": 0.2, "tvm_version": "0.10.0"}
{"input": ["cuda -keys=cuda,gpu -arch=sm_86 -max_num_threads=1024 -thread_warp_size=32", "conv2d_nchw_winograd.cuda", [["TENSOR", [1, 3, 224, 224], "float32"], ["TENSOR", [64, 3, 3, 3], "float32"], [1, 1], [1, 1, 1, 1], [1, 1], "float32"], {}], "config": {"index": 494006, "code_hash": null, "entity": [["tile_b", "sp", [-1, 1, 1, 1]], ["tile_y", "sp", [-1, 4, 1, 1]], ["tile_x", "sp", [-1, 2, 1, 1]], ["tile_rc", "sp", [-1, 3]], ["auto_unroll_max_step", "ot", 0], ["unroll_explicit", "ot", 1]]}, "result": [[0.0005989296227544911, 0.0006026088682634731, 0.0006027253652694611], 0, 4.797136306762695, 1679978540.3244343], "version": 0.2, "tvm_version": "0.10.0"}
{"input": ["cuda -keys=cuda,gpu -arch=sm_86 -max_num_threads=1024 -thread_warp_size=32", "conv2d_nchw_winograd.cuda", [["TENSOR", [1, 3, 224, 224], "float32"], ["TENSOR", [64, 3, 3, 3], "float32"], [1, 1], [1, 1, 1, 1], [1, 1], "float32"], {}], "config": {"index": 70646, "code_hash": null, "entity": [["tile_b", "sp", [-1, 1, 1, 1]], ["tile_y", "sp", [-1, 4, 1, 1]], ["tile_x", "sp", [-1, 2, 1, 1]], ["tile_rc", "sp", [-1, 3]], ["auto_unroll_max_step", "ot", 0], ["unroll_explicit", "ot", 0]]}, "result": [[0.0005982719661016949, 0.0005984932838983051, 0.000685715294520548], 0, 5.030545949935913, 1679978545.5557668], "version": 0.2, "tvm_version": "0.10.0"}
{"input": ["cuda -keys=cuda,gpu -arch=sm_86 -max_num_threads=1024 -thread_warp_size=32", "conv2d_nchw_winograd.cuda", [["TENSOR", [1, 3, 224, 224], "float32"], ["TENSOR", [64, 3, 3, 3], "float32"], [1, 1], [1, 1, 1, 1], [1, 1], "float32"], {}], "config": {"index": 635126, "code_hash": null, "entity": [["tile_b", "sp", [-1, 1, 1, 1]], ["tile_y", "sp", [-1, 4, 1, 1]], ["tile_x", "sp", [-1, 2, 1, 1]], ["tile_rc", "sp", [-1, 3]], ["auto_unroll_max_step", "ot", 128], ["unroll_explicit", "ot", 1]]}, "result": [[0.0005983838666666667, 0.0006009058629629629, 0.0006026467777777778], 0, 5.239737033843994, 1679978546.866516], "version": 0.2, "tvm_version": "0.10.0"}
{"input": ["cuda -keys=cuda,gpu -arch=sm_86 -max_num_threads=1024 -thread_warp_size=32", "conv2d_nchw_winograd.cuda", [["TENSOR", [1, 3, 224, 224], "float32"], ["TENSOR", [64, 3, 3, 3], "float32"], [1, 1], [1, 1, 1, 1], [1, 1], "float32"], {}], "config": {"index": 211766, "code_hash": null, "entity": [["tile_b", "sp", [-1, 1, 1, 1]], ["tile_y", "sp", [-1, 4, 1, 1]], ["tile_x", "sp", [-1, 2, 1, 1]], ["tile_rc", "sp", [-1, 3]], ["auto_unroll_max_step", "ot", 128], ["unroll_explicit", "ot", 0]]}, "result": [[0.0006010083777777778, 0.0006026543481481482, 0.0006026619222222222], 0, 5.166264533996582, 1679978548.152714], "version": 0.2, "tvm_version": "0.10.0"}
{"input": ["cuda -keys=cuda,gpu -arch=sm_86 -max_num_threads=1024 -thread_warp_size=32", "conv2d_nchw_winograd.cuda", [["TENSOR", [1, 3, 224, 224], "float32"], ["TENSOR", [64, 3, 3, 3], "float32"], [1, 1], [1, 1, 1, 1], [1, 1], "float32"], {}], "config": {"index": 423446, "code_hash": null, "entity": [["tile_b", "sp", [-1, 1, 1, 1]], ["tile_y", "sp", [-1, 4, 1, 1]], ["tile_x", "sp", [-1, 2, 1, 1]], ["tile_rc", "sp", [-1, 1]], ["auto_unroll_max_step", "ot", 0], ["unroll_explicit", "ot", 1]]}, "result": [[0.0006772753305439331, 0.0006772914853556486, 0.0006773086610878661], 0, 5.103065490722656, 1679978549.4410794], "version": 0.2, "tvm_version": "0.10.0"}
{"input": ["cuda -keys=cuda,gpu -arch=sm_86 -max_num_threads=1024 -thread_warp_size=32", "conv2d_nchw_winograd.cuda", [["TENSOR", [1, 3, 224, 224], "float32"], ["TENSOR", [64, 3, 3, 3], "float32"], [1, 1], [1, 1, 1, 1], [1, 1], "float32"], {}], "config": {"index": 86, "code_hash": null, "entity": [["tile_b", "sp", [-1, 1, 1, 1]], ["tile_y", "sp", [-1, 4, 1, 1]], ["tile_x", "sp", [-1, 2, 1, 1]], ["tile_rc", "sp", [-1, 1]], ["auto_unroll_max_step", "ot", 0], ["unroll_explicit", "ot", 0]]}, "result": [[0.0006736328791946309, 0.0006772969865771813, 0.0006773587919463087], 0, 4.902150392532349, 1679978550.3865504], "version": 0.2, "tvm_version": "0.10.0"}
{"input": ["cuda -keys=cuda,gpu -arch=sm_86 -max_num_threads=1024 -thread_warp_size=32", "conv2d_nchw_winograd.cuda", [["TENSOR", [1, 3, 224, 224], "float32"], ["TENSOR", [64, 3, 3, 3], "float32"], [1, 1], [1, 1, 1, 1], [1, 1], "float32"], {}], "config": {"index": 564566, "code_hash": null, "entity": [["tile_b", "sp", [-1, 1, 1, 1]], ["tile_y", "sp", [-1, 4, 1, 1]], ["tile_x", "sp", [-1, 2, 1, 1]], ["tile_rc", "sp", [-1, 1]], ["auto_unroll_max_step", "ot", 128], ["unroll_explicit", "ot", 1]]}, "result": [[0.0006643158319672132, 0.0006643535409836066, 0.0006644836762295082], 0, 5.26420259475708, 1679978551.7171056], "version": 0.2, "tvm_version": "0.10.0"}
{"input": ["cuda -keys=cuda,gpu -arch=sm_86 -max_num_threads=1024 -thread_warp_size=32", "conv2d_nchw_winograd.cuda", [["TENSOR", [1, 3, 224, 224], "float32"], ["TENSOR", [64, 3, 3, 3], "float32"], [1, 1], [1, 1, 1, 1], [1, 1], "float32"], {}], "config": {"index": 141206, "code_hash": null, "entity": [["tile_b", "sp", [-1, 1, 1, 1]], ["tile_y", "sp", [-1, 4, 1, 1]], ["tile_x", "sp", [-1, 2, 1, 1]], ["tile_rc", "sp", [-1, 1]], ["auto_unroll_max_step", "ot", 128], ["unroll_explicit", "ot", 0]]}, "result": [[0.0006772838870292887, 0.0006773695648535565, 0.0006775328158995816], 0, 5.158299446105957, 1679978552.9463367], "version": 0.2, "tvm_version": "0.10.0"}
{"input": ["cuda -keys=cuda,gpu -arch=sm_86 -max_num_threads=1024 -thread_warp_size=32", "conv2d_nchw_winograd.cuda", [["TENSOR", [1, 3, 224, 224], "float32"], ["TENSOR", [64, 3, 3, 3], "float32"], [1, 1], [1, 1, 1, 1], [1, 1], "float32"], {}], "config": {"index": 494090, "code_hash": null, "entity": [["tile_b", "sp", [-1, 1, 1, 1]], ["tile_y", "sp", [-1, 4, 1, 1]], ["tile_x", "sp", [-1, 4, 1, 1]], ["tile_rc", "sp", [-1, 3]], ["auto_unroll_max_step", "ot", 0], ["unroll_explicit", "ot", 1]]}, "result": [[0.0004438775068119891, 0.00044390261852861036, 0.00044624914713896455], 0, 5.245901346206665, 1679978554.2526102], "version": 0.2, "tvm_version": "0.10.0"}
{"input": ["cuda -keys=cuda,gpu -arch=sm_86 -max_num_threads=1024 -thread_warp_size=32", "conv2d_nchw_winograd.cuda", [["TENSOR", [1, 3, 224, 224], "float32"], ["TENSOR", [64, 3, 3, 3], "float32"], [1, 1], [1, 1, 1, 1], [1, 1], "float32"], {}], "config": {"index": 70730, "code_hash": null, "entity": [["tile_b", "sp", [-1, 1, 1, 1]], ["tile_y", "sp", [-1, 4, 1, 1]], ["tile_x", "sp", [-1, 4, 1, 1]], ["tile_rc", "sp", [-1, 3]], ["auto_unroll_max_step", "ot", 0], ["unroll_explicit", "ot", 0]]}, "result": [[0.00044068814912280705, 0.0004437467982456141, 0.00044388603508771935], 0, 4.863826513290405, 1679978555.1492398], "version": 0.2, "tvm_version": "0.10.0"}
{"input": ["cuda -keys=cuda,gpu -arch=sm_86 -max_num_threads=1024 -thread_warp_size=32", "conv2d_nchw_winograd.cuda", [["TENSOR", [1, 3, 224, 224], "float32"], ["TENSOR", [64, 3, 3, 3], "float32"], [1, 1], [1, 1, 1, 1], [1, 1], "float32"], {}], "config": {"index": 635210, "code_hash": null, "entity": [["tile_b", "sp", [-1, 1, 1, 1]], ["tile_y", "sp", [-1, 4, 1, 1]], ["tile_x", "sp", [-1, 4, 1, 1]], ["tile_rc", "sp", [-1, 3]], ["auto_unroll_max_step", "ot", 128], ["unroll_explicit", "ot", 1]]}, "result": [[0.00044062540789473686, 0.0004423635043859649, 0.00044389500438596493], 0, 4.8257012367248535, 1679978556.0208967], "version": 0.2, "tvm_version": "0.10.0"}
{"input": ["cuda -keys=cuda,gpu -arch=sm_86 -max_num_threads=1024 -thread_warp_size=32", "conv2d_nchw_winograd.cuda", [["TENSOR", [1, 3, 224, 224], "float32"], ["TENSOR", [64, 3, 3, 3], "float32"], [1, 1], [1, 1, 1, 1], [1, 1], "float32"], {}], "config": {"index": 211850, "code_hash": null, "entity": [["tile_b", "sp", [-1, 1, 1, 1]], ["tile_y", "sp", [-1, 4, 1, 1]], ["tile_x", "sp", [-1, 4, 1, 1]], ["tile_rc", "sp", [-1, 3]], ["auto_unroll_max_step", "ot", 128], ["unroll_explicit", "ot", 0]]}, "result": [[0.000440683798245614, 0.0004415275833333334, 0.0004439080526315789], 0, 4.821969509124756, 1679978556.8928473], "version": 0.2, "tvm_version": "0.10.0"}
{"input": ["cuda -keys=cuda,gpu -arch=sm_86 -max_num_threads=1024 -thread_warp_size=32", "conv2d_nchw_winograd.cuda", [["TENSOR", [1, 3, 224, 224], "float32"], ["TENSOR", [64, 3, 3, 3], "float32"], [1, 1], [1, 1, 1, 1], [1, 1], "float32"], {}], "config": {"index": 423530, "code_hash": null, "entity": [["tile_b", "sp", [-1, 1, 1, 1]], ["tile_y", "sp", [-1, 4, 1, 1]], ["tile_x", "sp", [-1, 4, 1, 1]], ["tile_rc", "sp", [-1, 1]], ["auto_unroll_max_step", "ot", 0], ["unroll_explicit", "ot", 1]]}, "result": [[0.0004724361046511628, 0.000473617284883721, 0.0004765886686046512], 0, 5.259800434112549, 1679978558.1856802], "version": 0.2, "tvm_version": "0.10.0"}
{"input": ["cuda -keys=cuda,gpu -arch=sm_86 -max_num_threads=1024 -thread_warp_size=32", "conv2d_nchw_winograd.cuda", [["TENSOR", [1, 3, 224, 224], "float32"], ["TENSOR", [64, 3, 3, 3], "float32"], [1, 1], [1, 1, 1, 1], [1, 1], "float32"], {}], "config": {"index": 170, "code_hash": null, "entity": [["tile_b", "sp", [-1, 1, 1, 1]], ["tile_y", "sp", [-1, 4, 1, 1]], ["tile_x", "sp", [-1, 4, 1, 1]], ["tile_rc", "sp", [-1, 1]], ["auto_unroll_max_step", "ot", 0], ["unroll_explicit", "ot", 0]]}, "result": [[0.0004752491337209303, 0.0004783449389534883, 0.0004800505959302326], 0, 5.249996185302734, 1679978559.4777339], "version": 0.2, "tvm_version": "0.10.0"}
{"input": ["cuda -keys=cuda,gpu -arch=sm_86 -max_num_threads=1024 -thread_warp_size=32", "conv2d_nchw_winograd.cuda", [["TENSOR", [1, 3, 224, 224], "float32"], ["TENSOR", [64, 3, 3, 3], "float32"], [1, 1], [1, 1, 1, 1], [1, 1], "float32"], {}], "config": {"index": 564650, "code_hash": null, "entity": [["tile_b", "sp", [-1, 1, 1, 1]], ["tile_y", "sp", [-1, 4, 1, 1]], ["tile_x", "sp", [-1, 4, 1, 1]], ["tile_rc", "sp", [-1, 1]], ["auto_unroll_max_step", "ot", 128], ["unroll_explicit", "ot", 1]]}, "result": [[0.0004645373778801843, 0.00046704308755760363, 0.00046706667741935485], 0, 4.848621129989624, 1679978560.3559434], "version": 0.2, "tvm_version": "0.10.0"}
{"input": ["cuda -keys=cuda,gpu -arch=sm_86 -max_num_threads=1024 -thread_warp_size=32", "conv2d_nchw_winograd.cuda", [["TENSOR", [1, 3, 224, 224], "float32"], ["TENSOR", [64, 3, 3, 3], "float32"], [1, 1], [1, 1, 1, 1], [1, 1], "float32"], {}], "config": {"index": 70813, "code_hash": null, "entity": [["tile_b", "sp", [-1, 1, 1, 1]], ["tile_y", "sp", [-1, 2, 1, 1]], ["tile_x", "sp", [-1, 7, 1, 1]], ["tile_rc", "sp", [-1, 3]], ["auto_unroll_max_step", "ot", 0], ["unroll_explicit", "ot", 0]]}, "result": [[0.0005276477935483872, 0.0005295169935483872, 0.0005333153], 0, 5.270289897918701, 1679978561.6913044], "version": 0.2, "tvm_version": "0.10.0"}
{"input": ["cuda -keys=cuda,gpu -arch=sm_86 -max_num_threads=1024 -thread_warp_size=32", "conv2d_nchw_winograd.cuda", [["TENSOR", [1, 3, 224, 224], "float32"], ["TENSOR", [64, 3, 3, 3], "float32"], [1, 1], [1, 1, 1, 1], [1, 1], "float32"], {}], "config": {"index": 494173, "code_hash": null, "entity": [["tile_b", "sp", [-1, 1, 1, 1]], ["tile_y", "sp", [-1, 2, 1, 1]], ["tile_x", "sp", [-1, 7, 1, 1]], ["tile_rc", "sp", [-1, 3]], ["auto_unroll_max_step", "ot", 0], ["unroll_explicit", "ot", 1]]}, "result": [[0.000522825515625, 0.000526010671875, 0.0005261386614583333], 0, 4.83772873878479, 1679978562.5773728], "version": 0.2, "tvm_version": "0.10.0"}
{"input": ["cuda -keys=cuda,gpu -arch=sm_86 -max_num_threads=1024 -thread_warp_size=32", "conv2d_nchw_winograd.cuda", [["TENSOR", [1, 3, 224, 224], "float32"], ["TENSOR", [64, 3, 3, 3], "float32"], [1, 1], [1, 1, 1, 1], [1, 1], "float32"], {}], "config": {"index": 211933, "code_hash": null, "entity": [["tile_b", "sp", [-1, 1, 1, 1]], ["tile_y", "sp", [-1, 2, 1, 1]], ["tile_x", "sp", [-1, 7, 1, 1]], ["tile_rc", "sp", [-1, 3]], ["auto_unroll_max_step", "ot", 128], ["unroll_explicit", "ot", 0]]}, "result": [[0.0005224001236363636, 0.0005225300727272728, 0.0005320704218181819], 0, 5.142305374145508, 1679978568.0197308], "version": 0.2, "tvm_version": "0.10.0"}
{"input": ["cuda -keys=cuda,gpu -arch=sm_86 -max_num_threads=1024 -thread_warp_size=32", "conv2d_nchw_winograd.cuda", [["TENSOR", [1, 3, 224, 224], "float32"], ["TENSOR", [64, 3, 3, 3], "float32"], [1, 1], [1, 1, 1, 1], [1, 1], "float32"], {}], "config": {"index": 635293, "code_hash": null, "entity": [["tile_b", "sp", [-1, 1, 1, 1]], ["tile_y", "sp", [-1, 2, 1, 1]], ["tile_x", "sp", [-1, 7, 1, 1]], ["tile_rc", "sp", [-1, 3]], ["auto_unroll_max_step", "ot", 128], ["unroll_explicit", "ot", 1]]}, "result": [[0.0005384323582887701, 0.0005384761336898396, 0.0005385360267379679], 0, 4.7831151485443115, 1679978568.9100611], "version": 0.2, "tvm_version": "0.10.0"}
{"input": ["cuda -keys=cuda,gpu -arch=sm_86 -max_num_threads=1024 -thread_warp_size=32", "conv2d_nchw_winograd.cuda", [["TENSOR", [1, 3, 224, 224], "float32"], ["TENSOR", [64, 3, 3, 3], "float32"], [1, 1], [1, 1, 1, 1], [1, 1], "float32"], {}], "config": {"index": 253, "code_hash": null, "entity": [["tile_b", "sp", [-1, 1, 1, 1]], ["tile_y", "sp", [-1, 2, 1, 1]], ["tile_x", "sp", [-1, 7, 1, 1]], ["tile_rc", "sp", [-1, 1]], ["auto_unroll_max_step", "ot", 0], ["unroll_explicit", "ot", 0]]}, "result": [[0.0005792170173410404, 0.0005800220289017341, 0.0005830063526011561], 0, 4.773340463638306, 1679978569.787008], "version": 0.2, "tvm_version": "0.10.0"}
{"input": ["cuda -keys=cuda,gpu -arch=sm_86 -max_num_threads=1024 -thread_warp_size=32", "conv2d_nchw_winograd.cuda", [["TENSOR", [1, 3, 224, 224], "float32"], ["TENSOR", [64, 3, 3, 3], "float32"], [1, 1], [1, 1, 1, 1], [1, 1], "float32"], {}], "config": {"index": 423613, "code_hash": null, "entity": [["tile_b", "sp", [-1, 1, 1, 1]], ["tile_y", "sp", [-1, 2, 1, 1]], ["tile_x", "sp", [-1, 7, 1, 1]], ["tile_rc", "sp", [-1, 1]], ["auto_unroll_max_step", "ot", 0], ["unroll_explicit", "ot", 1]]}, "result": [[0.0005791578323699421, 0.0005792752716763006, 0.0005831480057803467], 0, 4.7821197509765625, 1679978570.6660578], "version": 0.2, "tvm_version": "0.10.0"}
{"input": ["cuda -keys=cuda,gpu -arch=sm_86 -max_num_threads=1024 -thread_warp_size=32", "conv2d_nchw_winograd.cuda", [["TENSOR", [1, 3, 224, 224], "float32"], ["TENSOR", [64, 3, 3, 3], "float32"], [1, 1], [1, 1, 1, 1], [1, 1], "float32"], {}], "config": {"index": 141373, "code_hash": null, "entity": [["tile_b", "sp", [-1, 1, 1, 1]], ["tile_y", "sp", [-1, 2, 1, 1]], ["tile_x", "sp", [-1, 7, 1, 1]], ["tile_rc", "sp", [-1, 1]], ["auto_unroll_max_step", "ot", 128], ["unroll_explicit", "ot", 0]]}, "result": [[0.0005816083236994219, 0.000582993387283237, 0.000583094028901734], 0, 4.795241832733154, 1679978571.5490656], "version": 0.2, "tvm_version": "0.10.0"}
{"input": ["cuda -keys=cuda,gpu -arch=sm_86 -max_num_threads=1024 -thread_warp_size=32", "conv2d_nchw_winograd.cuda", [["TENSOR", [1, 3, 224, 224], "float32"], ["TENSOR", [64, 3, 3, 3], "float32"], [1, 1], [1, 1, 1, 1], [1, 1], "float32"], {}], "config": {"index": 564733, "code_hash": null, "entity": [["tile_b", "sp", [-1, 1, 1, 1]], ["tile_y", "sp", [-1, 2, 1, 1]], ["tile_x", "sp", [-1, 7, 1, 1]], ["tile_rc", "sp", [-1, 1]], ["auto_unroll_max_step", "ot", 128], ["unroll_explicit", "ot", 1]]}, "result": [[0.0005745288914285714, 0.0005752188514285714, 0.0005752656285714286], 0, 4.81978964805603, 1679978572.4289756], "version": 0.2, "tvm_version": "0.10.0"}
{"input": ["cuda -keys=cuda,gpu -arch=sm_86 -max_num_threads=1024 -thread_warp_size=32", "conv2d_nchw_winograd.cuda", [["TENSOR", [1, 3, 224, 224], "float32"], ["TENSOR", [64, 3, 3, 3], "float32"], [1, 1], [1, 1, 1, 1], [1, 1], "float32"], {}], "config": {"index": 70814, "code_hash": null, "entity": [["tile_b", "sp", [-1, 1, 1, 1]], ["tile_y", "sp", [-1, 4, 1, 1]], ["tile_x", "sp", [-1, 7, 1, 1]], ["tile_rc", "sp", [-1, 3]], ["auto_unroll_max_step", "ot", 0], ["unroll_explicit", "ot", 0]]}, "result": [[0.0003932155173745174, 0.00039323575289575293, 0.00039339390733590733], 0, 4.8582680225372314, 1679978573.3149178], "version": 0.2, "tvm_version": "0.10.0"}
{"input": ["cuda -keys=cuda,gpu -arch=sm_86 -max_num_threads=1024 -thread_warp_size=32", "conv2d_nchw_winograd.cuda", [["TENSOR", [1, 3, 224, 224], "float32"], ["TENSOR", [64, 3, 3, 3], "float32"], [1, 1], [1, 1, 1, 1], [1, 1], "float32"], {}], "config": {"index": 494174, "code_hash": null, "entity": [["tile_b", "sp", [-1, 1, 1, 1]], ["tile_y", "sp", [-1, 4, 1, 1]], ["tile_x", "sp", [-1, 7, 1, 1]], ["tile_rc", "sp", [-1, 3]], ["auto_unroll_max_step", "ot", 0], ["unroll_explicit", "ot", 1]]}, "result": [[0.00039319227413127416, 0.0003932121583011583, 0.00039343741698841695], 0, 4.848676919937134, 1679978574.1729379], "version": 0.2, "tvm_version": "0.10.0"}
{"input": ["cuda -keys=cuda,gpu -arch=sm_86 -max_num_threads=1024 -thread_warp_size=32", "conv2d_nchw_winograd.cuda", [["TENSOR", [1, 3, 224, 224], "float32"], ["TENSOR", [64, 3, 3, 3], "float32"], [1, 1], [1, 1, 1, 1], [1, 1], "float32"], {}], "config": {"index": 211934, "code_hash": null, "entity": [["tile_b", "sp", [-1, 1, 1, 1]], ["tile_y", "sp", [-1, 4, 1, 1]], ["tile_x", "sp", [-1, 7, 1, 1]], ["tile_rc", "sp", [-1, 3]], ["auto_unroll_max_step", "ot", 128], ["unroll_explicit", "ot", 0]]}, "result": [[0.00039348484169884174, 0.00039491224710424714, 0.00039591635135135134], 0, 4.854208707809448, 1679978575.066242], "version": 0.2, "tvm_version": "0.10.0"}
{"input": ["cuda -keys=cuda,gpu -arch=sm_86 -max_num_threads=1024 -thread_warp_size=32", "conv2d_nchw_winograd.cuda", [["TENSOR", [1, 3, 224, 224], "float32"], ["TENSOR", [64, 3, 3, 3], "float32"], [1, 1], [1, 1, 1, 1], [1, 1], "float32"], {}], "config": {"index": 635294, "code_hash": null, "entity": [["tile_b", "sp", [-1, 1, 1, 1]], ["tile_y", "sp", [-1, 4, 1, 1]], ["tile_x", "sp", [-1, 7, 1, 1]], ["tile_rc", "sp", [-1, 3]], ["auto_unroll_max_step", "ot", 128], ["unroll_explicit", "ot", 1]]}, "result": [[0.0003982267114624506, 0.00039938429644268775, 0.0004009142173913044], 0, 4.865784168243408, 1679978575.9489658], "version": 0.2, "tvm_version": "0.10.0"}
{"input": ["cuda -keys=cuda,gpu -arch=sm_86 -max_num_threads=1024 -thread_warp_size=32", "conv2d_nchw_winograd.cuda", [["TENSOR", [1, 3, 224, 224], "float32"], ["TENSOR", [64, 3, 3, 3], "float32"], [1, 1], [1, 1, 1, 1], [1, 1], "float32"], {}], "config": {"index": 254, "code_hash": null, "entity": [["tile_b", "sp", [-1, 1, 1, 1]], ["tile_y", "sp", [-1, 4, 1, 1]], ["tile_x", "sp", [-1, 7, 1, 1]], ["tile_rc", "sp", [-1, 1]], ["auto_unroll_max_step", "ot", 0], ["unroll_explicit", "ot", 0]]}, "result": [[0.00042091518749999996, 0.0004213802625, 0.00042208426666666665], 0, 4.965538740158081, 1679978576.830087], "version": 0.2, "tvm_version": "0.10.0"}
{"input": ["cuda -keys=cuda,gpu -arch=sm_86 -max_num_threads=1024 -thread_warp_size=32", "conv2d_nchw_winograd.cuda", [["TENSOR", [1, 3, 224, 224], "float32"], ["TENSOR", [64, 3, 3, 3], "float32"], [1, 1], [1, 1, 1, 1], [1, 1], "float32"], {}], "config": {"index": 423614, "code_hash": null, "entity": [["tile_b", "sp", [-1, 1, 1, 1]], ["tile_y", "sp", [-1, 4, 1, 1]], ["tile_x", "sp", [-1, 7, 1, 1]], ["tile_rc", "sp", [-1, 1]], ["auto_unroll_max_step", "ot", 0], ["unroll_explicit", "ot", 1]]}, "result": [[0.00042080825, 0.00042138878333333334, 0.000422100925], 0, 4.962355136871338, 1679978577.7084718], "version": 0.2, "tvm_version": "0.10.0"}
{"input": ["cuda -keys=cuda,gpu -arch=sm_86 -max_num_threads=1024 -thread_warp_size=32", "conv2d_nchw_winograd.cuda", [["TENSOR", [1, 3, 224, 224], "float32"], ["TENSOR", [64, 3, 3, 3], "float32"], [1, 1], [1, 1, 1, 1], [1, 1], "float32"], {}], "config": {"index": 141374, "code_hash": null, "entity": [["tile_b", "sp", [-1, 1, 1, 1]], ["tile_y", "sp", [-1, 4, 1, 1]], ["tile_x", "sp", [-1, 7, 1, 1]], ["tile_rc", "sp", [-1, 1]], ["auto_unroll_max_step", "ot", 128], ["unroll_explicit", "ot", 0]]}, "result": [[0.00042093267083333333, 0.00042348372083333334, 0.0004236159958333333], 0, 4.905106544494629, 1679978578.615381], "version": 0.2, "tvm_version": "0.10.0"}
{"input": ["cuda -keys=cuda,gpu -arch=sm_86 -max_num_threads=1024 -thread_warp_size=32", "conv2d_nchw_winograd.cuda", [["TENSOR", [1, 3, 224, 224], "float32"], ["TENSOR", [64, 3, 3, 3], "float32"], [1, 1], [1, 1, 1, 1], [1, 1], "float32"], {}], "config": {"index": 494091, "code_hash": null, "entity": [["tile_b", "sp", [-1, 1, 1, 1]], ["tile_y", "sp", [-1, 8, 1, 1]], ["tile_x", "sp", [-1, 4, 1, 1]], ["tile_rc", "sp", [-1, 3]], ["auto_unroll_max_step", "ot", 0], ["unroll_explicit", "ot", 1]]}, "result": [[0.00037777929962546817, 0.000379676872659176, 0.0003797230224719101], 0, 4.918846130371094, 1679978579.5235934], "version": 0.2, "tvm_version": "0.10.0"}
{"input": ["cuda -keys=cuda,gpu -arch=sm_86 -max_num_threads=1024 -thread_warp_size=32", "conv2d_nchw_winograd.cuda", [["TENSOR", [1, 3, 224, 224], "float32"], ["TENSOR", [64, 3, 3, 3], "float32"], [1, 1], [1, 1, 1, 1], [1, 1], "float32"], {}], "config": {"index": 70731, "code_hash": null, "entity": [["tile_b", "sp", [-1, 1, 1, 1]], ["tile_y", "sp", [-1, 8, 1, 1]], ["tile_x", "sp", [-1, 4, 1, 1]], ["tile_rc", "sp", [-1, 3]], ["auto_unroll_max_step", "ot", 0], ["unroll_explicit", "ot", 0]]}, "result": [[0.00037783642537313433, 0.0003796976828358209, 0.0003797053134328358], 0, 4.929332494735718, 1679978580.4373999], "version": 0.2, "tvm_version": "0.10.0"}
{"input": ["cuda -keys=cuda,gpu -arch=sm_86 -max_num_threads=1024 -thread_warp_size=32", "conv2d_nchw_winograd.cuda", [["TENSOR", [1, 3, 224, 224], "float32"], ["TENSOR", [64, 3, 3, 3], "float32"], [1, 1], [1, 1, 1, 1], [1, 1], "float32"], {}], "config": {"index": 635211, "code_hash": null, "entity": [["tile_b", "sp", [-1, 1, 1, 1]], ["tile_y", "sp", [-1, 8, 1, 1]], ["tile_x", "sp", [-1, 4, 1, 1]], ["tile_rc", "sp", [-1, 3]], ["auto_unroll_max_step", "ot", 128], ["unroll_explicit", "ot", 1]]}, "result": [[0.0003776458619402985, 0.0003797247835820896, 0.0003798466865671642], 0, 4.914710998535156, 1679978581.3397884], "version": 0.2, "tvm_version": "0.10.0"}
{"input": ["cuda -keys=cuda,gpu -arch=sm_86 -max_num_threads=1024 -thread_warp_size=32", "conv2d_nchw_winograd.cuda", [["TENSOR", [1, 3, 224, 224], "float32"], ["TENSOR", [64, 3, 3, 3], "float32"], [1, 1], [1, 1, 1, 1], [1, 1], "float32"], {}], "config": {"index": 211851, "code_hash": null, "entity": [["tile_b", "sp", [-1, 1, 1, 1]], ["tile_y", "sp", [-1, 8, 1, 1]], ["tile_x", "sp", [-1, 4, 1, 1]], ["tile_rc", "sp", [-1, 3]], ["auto_unroll_max_step", "ot", 128], ["unroll_explicit", "ot", 0]]}, "result": [[0.0003772303707571801, 0.00037736379634464753, 0.0003801205770234987], 0, 5.17509913444519, 1679978586.8608415], "version": 0.2, "tvm_version": "0.10.0"}
{"input": ["cuda -keys=cuda,gpu -arch=sm_86 -max_num_threads=1024 -thread_warp_size=32", "conv2d_nchw_winograd.cuda", [["TENSOR", [1, 3, 224, 224], "float32"], ["TENSOR", [64, 3, 3, 3], "float32"], [1, 1], [1, 1, 1, 1], [1, 1], "float32"], {}], "config": {"index": 423531, "code_hash": null, "entity": [["tile_b", "sp", [-1, 1, 1, 1]], ["tile_y", "sp", [-1, 8, 1, 1]], ["tile_x", "sp", [-1, 4, 1, 1]], ["tile_rc", "sp", [-1, 1]], ["auto_unroll_max_step", "ot", 0], ["unroll_explicit", "ot", 1]]}, "result": [[0.0003936327519379845, 0.00039363671705426356, 0.00039363671705426356], 0, 4.935434341430664, 1679978587.7344258], "version": 0.2, "tvm_version": "0.10.0"}
{"input": ["cuda -keys=cuda,gpu -arch=sm_86 -max_num_threads=1024 -thread_warp_size=32", "conv2d_nchw_winograd.cuda", [["TENSOR", [1, 3, 224, 224], "float32"], ["TENSOR", [64, 3, 3, 3], "float32"], [1, 1], [1, 1, 1, 1], [1, 1], "float32"], {}], "config": {"index": 171, "code_hash": null, "entity": [["tile_b", "sp", [-1, 1, 1, 1]], ["tile_y", "sp", [-1, 8, 1, 1]], ["tile_x", "sp", [-1, 4, 1, 1]], ["tile_rc", "sp", [-1, 1]], ["auto_unroll_max_step", "ot", 0], ["unroll_explicit", "ot", 0]]}, "result": [[0.00039362667953667953, 0.00039365881467181467, 0.0003938991274131274], 0, 4.992043733596802, 1679978588.649824], "version": 0.2, "tvm_version": "0.10.0"}
{"input": ["cuda -keys=cuda,gpu -arch=sm_86 -max_num_threads=1024 -thread_warp_size=32", "conv2d_nchw_winograd.cuda", [["TENSOR", [1, 3, 224, 224], "float32"], ["TENSOR", [64, 3, 3, 3], "float32"], [1, 1], [1, 1, 1, 1], [1, 1], "float32"], {}], "config": {"index": 564651, "code_hash": null, "entity": [["tile_b", "sp", [-1, 1, 1, 1]], ["tile_y", "sp", [-1, 8, 1, 1]], ["tile_x", "sp", [-1, 4, 1, 1]], ["tile_rc", "sp", [-1, 1]], ["auto_unroll_max_step", "ot", 128], ["unroll_explicit", "ot", 1]]}, "result": [[0.0003935890775193798, 0.0003937200465116279, 0.00039372403875969], 0, 4.943109750747681, 1679978589.5277495], "version": 0.2, "tvm_version": "0.10.0"}
{"input": ["cuda -keys=cuda,gpu -arch=sm_86 -max_num_threads=1024 -thread_warp_size=32", "conv2d_nchw_winograd.cuda", [["TENSOR", [1, 3, 224, 224], "float32"], ["TENSOR", [64, 3, 3, 3], "float32"], [1, 1], [1, 1, 1, 1], [1, 1], "float32"], {}], "config": {"index": 141291, "code_hash": null, "entity": [["tile_b", "sp", [-1, 1, 1, 1]], ["tile_y", "sp", [-1, 8, 1, 1]], ["tile_x", "sp", [-1, 4, 1, 1]], ["tile_rc", "sp", [-1, 1]], ["auto_unroll_max_step", "ot", 128], ["unroll_explicit", "ot", 0]]}, "result": [[0.00039372403875969, 0.0003937679224806201, 0.00039378753100775197], 0, 4.9222517013549805, 1679978590.4073653], "version": 0.2, "tvm_version": "0.10.0"}
{"input": ["cuda -keys=cuda,gpu -arch=sm_86 -max_num_threads=1024 -thread_warp_size=32", "conv2d_nchw_winograd.cuda", [["TENSOR", [1, 3, 224, 224], "float32"], ["TENSOR", [64, 3, 3, 3], "float32"], [1, 1], [1, 1, 1, 1], [1, 1], "float32"], {}], "config": {"index": 494175, "code_hash": null, "entity": [["tile_b", "sp", [-1, 1, 1, 1]], ["tile_y", "sp", [-1, 8, 1, 1]], ["tile_x", "sp", [-1, 7, 1, 1]], ["tile_rc", "sp", [-1, 3]], ["auto_unroll_max_step", "ot", 0], ["unroll_explicit", "ot", 1]]}, "result": [[0.0003270104711538461, 0.00032713845833333335, 0.00032720409294871794], 0, 4.956734657287598, 1679978591.2682445], "version": 0.2, "tvm_version": "0.10.0"}
{"input": ["cuda -keys=cuda,gpu -arch=sm_86 -max_num_threads=1024 -thread_warp_size=32", "conv2d_nchw_winograd.cuda", [["TENSOR", [1, 3, 224, 224], "float32"], ["TENSOR", [64, 3, 3, 3], "float32"], [1, 1], [1, 1, 1, 1], [1, 1], "float32"], {}], "config": {"index": 70815, "code_hash": null, "entity": [["tile_b", "sp", [-1, 1, 1, 1]], ["tile_y", "sp", [-1, 8, 1, 1]], ["tile_x", "sp", [-1, 7, 1, 1]], ["tile_rc", "sp", [-1, 3]], ["auto_unroll_max_step", "ot", 0], ["unroll_explicit", "ot", 0]]}, "result": [[0.00032715486858974355, 0.00032719425961538464, 0.0003272139455128205], 0, 4.961821794509888, 1679978592.1477728], "version": 0.2, "tvm_version": "0.10.0"}
{"input": ["cuda -keys=cuda,gpu -arch=sm_86 -max_num_threads=1024 -thread_warp_size=32", "conv2d_nchw_winograd.cuda", [["TENSOR", [1, 3, 224, 224], "float32"], ["TENSOR", [64, 3, 3, 3], "float32"], [1, 1], [1, 1, 1, 1], [1, 1], "float32"], {}], "config": {"index": 635295, "code_hash": null, "entity": [["tile_b", "sp", [-1, 1, 1, 1]], ["tile_y", "sp", [-1, 8, 1, 1]], ["tile_x", "sp", [-1, 7, 1, 1]], ["tile_rc", "sp", [-1, 3]], ["auto_unroll_max_step", "ot", 128], ["unroll_explicit", "ot", 1]]}, "result": [[0.0003272200096153846, 0.00032806398717948716, 0.00032921323717948717], 0, 4.9808924198150635, 1679978593.029964], "version": 0.2, "tvm_version": "0.10.0"}
{"input": ["cuda -keys=cuda,gpu -arch=sm_86 -max_num_threads=1024 -thread_warp_size=32", "conv2d_nchw_winograd.cuda", [["TENSOR", [1, 3, 224, 224], "float32"], ["TENSOR", [64, 3, 3, 3], "float32"], [1, 1], [1, 1, 1, 1], [1, 1], "float32"], {}], "config": {"index": 211935, "code_hash": null, "entity": [["tile_b", "sp", [-1, 1, 1, 1]], ["tile_y", "sp", [-1, 8, 1, 1]], ["tile_x", "sp", [-1, 7, 1, 1]], ["tile_rc", "sp", [-1, 3]], ["auto_unroll_max_step", "ot", 128], ["unroll_explicit", "ot", 0]]}, "result": [[0.00032709766134185307, 0.00032886429392971244, 0.0003292143674121405], 0, 4.99936580657959, 1679978593.909411], "version": 0.2, "tvm_version": "0.10.0"}
{"input": ["cuda -keys=cuda,gpu -arch=sm_86 -max_num_threads=1024 -thread_warp_size=32", "conv2d_nchw_winograd.cuda", [["TENSOR", [1, 3, 224, 224], "float32"], ["TENSOR", [64, 3, 3, 3], "float32"], [1, 1], [1, 1, 1, 1], [1, 1], "float32"], {}], "config": {"index": 423615, "code_hash": null, "entity": [["tile_b", "sp", [-1, 1, 1, 1]], ["tile_y", "sp", [-1, 8, 1, 1]], ["tile_x", "sp", [-1, 7, 1, 1]], ["tile_rc", "sp", [-1, 1]], ["auto_unroll_max_step", "ot", 0], ["unroll_explicit", "ot", 1]]}, "result": [[0.00033900886333333333, 0.00034019327666666665, 0.00034124117333333336], 0, 5.017046689987183, 1679978594.7906709], "version": 0.2, "tvm_version": "0.10.0"}
{"input": ["cuda -keys=cuda,gpu -arch=sm_86 -max_num_threads=1024 -thread_warp_size=32", "conv2d_nchw_winograd.cuda", [["TENSOR", [1, 3, 224, 224], "float32"], ["TENSOR", [64, 3, 3, 3], "float32"], [1, 1], [1, 1, 1, 1], [1, 1], "float32"], {}], "config": {"index": 255, "code_hash": null, "entity": [["tile_b", "sp", [-1, 1, 1, 1]], ["tile_y", "sp", [-1, 8, 1, 1]], ["tile_x", "sp", [-1, 7, 1, 1]], ["tile_rc", "sp", [-1, 1]], ["auto_unroll_max_step", "ot", 0], ["unroll_explicit", "ot", 0]]}, "result": [[0.0003389883666666667, 0.0003405550866666667, 0.0003411047333333333], 0, 5.000106334686279, 1679978595.7080328], "version": 0.2, "tvm_version": "0.10.0"}
{"input": ["cuda -keys=cuda,gpu -arch=sm_86 -max_num_threads=1024 -thread_warp_size=32", "conv2d_nchw_winograd.cuda", [["TENSOR", [1, 3, 224, 224], "float32"], ["TENSOR", [64, 3, 3, 3], "float32"], [1, 1], [1, 1, 1, 1], [1, 1], "float32"], {}], "config": {"index": 564735, "code_hash": null, "entity": [["tile_b", "sp", [-1, 1, 1, 1]], ["tile_y", "sp", [-1, 8, 1, 1]], ["tile_x", "sp", [-1, 7, 1, 1]], ["tile_rc", "sp", [-1, 1]], ["auto_unroll_max_step", "ot", 128], ["unroll_explicit", "ot", 1]]}, "result": [[0.00033933099665551836, 0.00034081390635451507, 0.00034106391638795983], 0, 4.958850145339966, 1679978596.591335], "version": 0.2, "tvm_version": "0.10.0"}
{"input": ["cuda -keys=cuda,gpu -arch=sm_86 -max_num_threads=1024 -thread_warp_size=32", "conv2d_nchw_winograd.cuda", [["TENSOR", [1, 3, 224, 224], "float32"], ["TENSOR", [64, 3, 3, 3], "float32"], [1, 1], [1, 1, 1, 1], [1, 1], "float32"], {}], "config": {"index": 494007, "code_hash": null, "entity": [["tile_b", "sp", [-1, 1, 1, 1]], ["tile_y", "sp", [-1, 8, 1, 1]], ["tile_x", "sp", [-1, 2, 1, 1]], ["tile_rc", "sp", [-1, 3]], ["auto_unroll_max_step", "ot", 0], ["unroll_explicit", "ot", 1]]}, "result": [[0.0005063911658291457, 0.0005069520251256281, 0.0005079142864321608], 0, 4.9456787109375, 1679978597.51925], "version": 0.2, "tvm_version": "0.10.0"}
{"input": ["cuda -keys=cuda,gpu -arch=sm_86 -max_num_threads=1024 -thread_warp_size=32", "conv2d_nchw_winograd.cuda", [["TENSOR", [1, 3, 224, 224], "float32"], ["TENSOR", [64, 3, 3, 3], "float32"], [1, 1], [1, 1, 1, 1], [1, 1], "float32"], {}], "config": {"index": 70647, "code_hash": null, "entity": [["tile_b", "sp", [-1, 1, 1, 1]], ["tile_y", "sp", [-1, 8, 1, 1]], ["tile_x", "sp", [-1, 2, 1, 1]], ["tile_rc", "sp", [-1, 3]], ["auto_unroll_max_step", "ot", 0], ["unroll_explicit", "ot", 0]]}, "result": [[0.000509119984375, 0.000512009475, 0.000514691209375], 0, 5.320720195770264, 1679978598.8228798], "version": 0.2, "tvm_version": "0.10.0"}
{"input": ["cuda -keys=cuda,gpu -arch=sm_86 -max_num_threads=1024 -thread_warp_size=32", "conv2d_nchw_winograd.cuda", [["TENSOR", [1, 3, 224, 224], "float32"], ["TENSOR", [64, 3, 3, 3], "float32"], [1, 1], [1, 1, 1, 1], [1, 1], "float32"], {}], "config": {"index": 423447, "code_hash": null, "entity": [["tile_b", "sp", [-1, 1, 1, 1]], ["tile_y", "sp", [-1, 8, 1, 1]], ["tile_x", "sp", [-1, 2, 1, 1]], ["tile_rc", "sp", [-1, 1]], ["auto_unroll_max_step", "ot", 0], ["unroll_explicit", "ot", 1]]}, "result": [[0.0005533865604395604, 0.0005546981868131868, 0.0005576117747252748], 0, 4.9380574226379395, 1679978599.7396195], "version": 0.2, "tvm_version": "0.10.0"}
{"input": ["cuda -keys=cuda,gpu -arch=sm_86 -max_num_threads=1024 -thread_warp_size=32", "conv2d_nchw_winograd.cuda", [["TENSOR", [1, 3, 224, 224], "float32"], ["TENSOR", [64, 3, 3, 3], "float32"], [1, 1], [1, 1, 1, 1], [1, 1], "float32"], {}], "config": {"index": 87, "code_hash": null, "entity": [["tile_b", "sp", [-1, 1, 1, 1]], ["tile_y", "sp", [-1, 8, 1, 1]], ["tile_x", "sp", [-1, 2, 1, 1]], ["tile_rc", "sp", [-1, 1]], ["auto_unroll_max_step", "ot", 0], ["unroll_explicit", "ot", 0]]}, "result": [[0.0005530219010989011, 0.0005565496153846154, 0.0005607300219780219], 0, 4.840353727340698, 1679978600.6374981], "version": 0.2, "tvm_version": "0.10.0"}
