src/tvm/results/cuda_gtx1650/inception_v3/xgb/cpu.log_layer_26.log
{"input": ["cuda -keys=cuda,gpu -arch=sm_75 -max_num_threads=1024 -thread_warp_size=32", "conv2d_nchw.cuda", [["TENSOR", [1, 128, 17, 17], "float32"], ["TENSOR", [192, 128, 7, 1], "float32"], [1, 1], [3, 0, 3, 0], [1, 1], "float32"], {}], "config": {"index": 190499, "code_hash": null, "entity": [["tile_f", "sp", [-1, 1, 1, 48]], ["tile_y", "sp", [-1, 1, 17, 1]], ["tile_x", "sp", [-1, 17, 1, 1]], ["tile_rc", "sp", [-1, 8]], ["tile_ry", "sp", [-1, 1]], ["tile_rx", "sp", [-1, 1]], ["auto_unroll_max_step", "ot", 1500], ["unroll_explicit", "ot", 0]]}, "result": [[0.009792170833333334, 0.00979261075, 0.00980053325], 0, 2.926995277404785, 1679186005.1363087], "version": 0.2, "tvm_version": "0.10.0"}
{"input": ["cuda -keys=cuda,gpu -arch=sm_75 -max_num_threads=1024 -thread_warp_size=32", "conv2d_nchw.cuda", [["TENSOR", [1, 128, 17, 17], "float32"], ["TENSOR", [192, 128, 7, 1], "float32"], [1, 1], [3, 0, 3, 0], [1, 1], "float32"], {}], "config": {"index": 210708, "code_hash": null, "entity": [["tile_f", "sp", [-1, 4, 4, 1]], ["tile_y", "sp", [-1, 1, 1, 17]], ["tile_x", "sp", [-1, 1, 1, 1]], ["tile_rc", "sp", [-1, 128]], ["tile_ry", "sp", [-1, 1]], ["tile_rx", "sp", [-1, 1]], ["auto_unroll_max_step", "ot", 1500], ["unroll_explicit", "ot", 0]]}, "result": [[0.0013758816575342467, 0.0013759649589041095, 0.0013765422739726025], 0, 3.1616923809051514, 1679186006.0264854], "version": 0.2, "tvm_version": "0.10.0"}
{"input": ["cuda -keys=cuda,gpu -arch=sm_75 -max_num_threads=1024 -thread_warp_size=32", "conv2d_nchw.cuda", [["TENSOR", [1, 128, 17, 17], "float32"], ["TENSOR", [192, 128, 7, 1], "float32"], [1, 1], [3, 0, 3, 0], [1, 1], "float32"], {}], "config": {"index": 23402, "code_hash": null, "entity": [["tile_f", "sp", [-1, 2, 24, 4]], ["tile_y", "sp", [-1, 17, 1, 1]], ["tile_x", "sp", [-1, 17, 1, 1]], ["tile_rc", "sp", [-1, 16]], ["tile_ry", "sp", [-1, 1]], ["tile_rx", "sp", [-1, 1]], ["auto_unroll_max_step", "ot", 0], ["unroll_explicit", "ot", 0]]}, "result": [[0.0221384704, 0.0221395782, 0.022143367], 0, 2.6115782260894775, 1679186007.029256], "version": 0.2, "tvm_version": "0.10.0"}
{"input": ["cuda -keys=cuda,gpu -arch=sm_75 -max_num_threads=1024 -thread_warp_size=32", "conv2d_nchw.cuda", [["TENSOR", [1, 128, 17, 17], "float32"], ["TENSOR", [192, 128, 7, 1], "float32"], [1, 1], [3, 0, 3, 0], [1, 1], "float32"], {}], "config": {"index": 281814, "code_hash": null, "entity": [["tile_f", "sp", [-1, 8, 1, 8]], ["tile_y", "sp", [-1, 1, 17, 1]], ["tile_x", "sp", [-1, 17, 1, 1]], ["tile_rc", "sp", [-1, 16]], ["tile_ry", "sp", [-1, 1]], ["tile_rx", "sp", [-1, 1]], ["auto_unroll_max_step", "ot", 0], ["unroll_explicit", "ot", 1]]}, "result": [[0.006813508066666666, 0.0068140884, 0.006825711], 0, 1.8020148277282715, 1679186007.940751], "version": 0.2, "tvm_version": "0.10.0"}
{"input": ["cuda -keys=cuda,gpu -arch=sm_75 -max_num_threads=1024 -thread_warp_size=32", "conv2d_nchw.cuda", [["TENSOR", [1, 128, 17, 17], "float32"], ["TENSOR", [192, 128, 7, 1], "float32"], [1, 1], [3, 0, 3, 0], [1, 1], "float32"], {}], "config": {"index": 189744, "code_hash": null, "entity": [["tile_f", "sp", [-1, 1, 32, 6]], ["tile_y", "sp", [-1, 1, 1, 1]], ["tile_x", "sp", [-1, 17, 1, 1]], ["tile_rc", "sp", [-1, 8]], ["tile_ry", "sp", [-1, 1]], ["tile_rx", "sp", [-1, 1]], ["auto_unroll_max_step", "ot", 1500], ["unroll_explicit", "ot", 0]]}, "result": [[0.00042504531481481477, 0.00042506836507936503, 0.0004250889126984126], 0, 1.8869714736938477, 1679186009.1910372], "version": 0.2, "tvm_version": "0.10.0"}
{"input": ["cuda -keys=cuda,gpu -arch=sm_75 -max_num_threads=1024 -thread_warp_size=32", "conv2d_nchw.cuda", [["TENSOR", [1, 128, 17, 17], "float32"], ["TENSOR", [192, 128, 7, 1], "float32"], [1, 1], [3, 0, 3, 0], [1, 1], "float32"], {}], "config": {"index": 145156, "code_hash": null, "entity": [["tile_f", "sp", [-1, 6, 1, 1]], ["tile_y", "sp", [-1, 1, 1, 1]], ["tile_x", "sp", [-1, 1, 1, 1]], ["tile_rc", "sp", [-1, 8]], ["tile_ry", "sp", [-1, 7]], ["tile_rx", "sp", [-1, 1]], ["auto_unroll_max_step", "ot", 512], ["unroll_explicit", "ot", 0]]}, "result": [[0.008211502615384616, 0.008212164615384616, 0.008217629615384615], 0, 2.056204319000244, 1679186010.0952196], "version": 0.2, "tvm_version": "0.10.0"}
{"input": ["cuda -keys=cuda,gpu -arch=sm_75 -max_num_threads=1024 -thread_warp_size=32", "conv2d_nchw.cuda", [["TENSOR", [1, 128, 17, 17], "float32"], ["TENSOR", [192, 128, 7, 1], "float32"], [1, 1], [3, 0, 3, 0], [1, 1], "float32"], {}], "config": {"index": 275614, "code_hash": null, "entity": [["tile_f", "sp", [-1, 48, 1, 2]], ["tile_y", "sp", [-1, 1, 1, 1]], ["tile_x", "sp", [-1, 17, 1, 1]], ["tile_rc", "sp", [-1, 8]], ["tile_ry", "sp", [-1, 1]], ["tile_rx", "sp", [-1, 1]], ["auto_unroll_max_step", "ot", 0], ["unroll_explicit", "ot", 1]]}, "result": [[0.1229208145, 0.1229301755, 0.12309438299999999], 0, 2.530514717102051, 1679186011.8343086], "version": 0.2, "tvm_version": "0.10.0"}
{"input": ["cuda -keys=cuda,gpu -arch=sm_75 -max_num_threads=1024 -thread_warp_size=32", "conv2d_nchw.cuda", [["TENSOR", [1, 128, 17, 17], "float32"], ["TENSOR", [192, 128, 7, 1], "float32"], [1, 1], [3, 0, 3, 0], [1, 1], "float32"], {}], "config": {"index": 290254, "code_hash": null, "entity": [["tile_f", "sp", [-1, 1, 1, 16]], ["tile_y", "sp", [-1, 1, 1, 17]], ["tile_x", "sp", [-1, 1, 1, 17]], ["tile_rc", "sp", [-1, 32]], ["tile_ry", "sp", [-1, 1]], ["tile_rx", "sp", [-1, 1]], ["auto_unroll_max_step", "ot", 0], ["unroll_explicit", "ot", 1]]}, "result": [[0.889401062, 0.8894228515, 0.889527832], 0, 12.622233629226685, 1679186021.9704738], "version": 0.2, "tvm_version": "0.10.0"}
{"input": ["cuda -keys=cuda,gpu -arch=sm_75 -max_num_threads=1024 -thread_warp_size=32", "conv2d_nchw.cuda", [["TENSOR", [1, 128, 17, 17], "float32"], ["TENSOR", [192, 128, 7, 1], "float32"], [1, 1], [3, 0, 3, 0], [1, 1], "float32"], {}], "config": {"index": 284888, "code_hash": null, "entity": [["tile_f", "sp", [-1, 1, 3, 16]], ["tile_y", "sp", [-1, 1, 1, 17]], ["tile_x", "sp", [-1, 1, 1, 17]], ["tile_rc", "sp", [-1, 16]], ["tile_ry", "sp", [-1, 1]], ["tile_rx", "sp", [-1, 1]], ["auto_unroll_max_step", "ot", 0], ["unroll_explicit", "ot", 1]]}, "result": [[0.782693298, 0.7827007445, 0.782777954], 0, 11.567214727401733, 1679186040.7169259], "version": 0.2, "tvm_version": "0.10.0"}
{"input": ["cuda -keys=cuda,gpu -arch=sm_75 -max_num_threads=1024 -thread_warp_size=32", "conv2d_nchw.cuda", [["TENSOR", [1, 128, 17, 17], "float32"], ["TENSOR", [192, 128, 7, 1], "float32"], [1, 1], [3, 0, 3, 0], [1, 1], "float32"], {}], "config": {"index": 44781, "code_hash": null, "entity": [["tile_f", "sp", [-1, 32, 1, 2]], ["tile_y", "sp", [-1, 17, 1, 1]], ["tile_x", "sp", [-1, 17, 1, 1]], ["tile_rc", "sp", [-1, 1]], ["tile_ry", "sp", [-1, 7]], ["tile_rx", "sp", [-1, 1]], ["auto_unroll_max_step", "ot", 0], ["unroll_explicit", "ot", 0]]}, "result": [[0.4157075195, 0.415819763, 0.41713406350000004], 0, 6.818442344665527, 1679186045.6825662], "version": 0.2, "tvm_version": "0.10.0"}
{"input": ["cuda -keys=cuda,gpu -arch=sm_75 -max_num_threads=1024 -thread_warp_size=32", "conv2d_nchw.cuda", [["TENSOR", [1, 128, 17, 17], "float32"], ["TENSOR", [192, 128, 7, 1], "float32"], [1, 1], [3, 0, 3, 0], [1, 1], "float32"], {}], "config": {"index": 4946, "code_hash": null, "entity": [["tile_f", "sp", [-1, 2, 1, 8]], ["tile_y", "sp", [-1, 1, 17, 1]], ["tile_x", "sp", [-1, 1, 1, 17]], ["tile_rc", "sp", [-1, 1]], ["tile_ry", "sp", [-1, 1]], ["tile_rx", "sp", [-1, 1]], ["auto_unroll_max_step", "ot", 0], ["unroll_explicit", "ot", 0]]}, "result": [[0.0012027262164179104, 0.0012028074104477615, 0.0012039290447761193], 0, 1.9359130859375, 1679186046.9134097], "version": 0.2, "tvm_version": "0.10.0"}
{"input": ["cuda -keys=cuda,gpu -arch=sm_75 -max_num_threads=1024 -thread_warp_size=32", "conv2d_nchw.cuda", [["TENSOR", [1, 128, 17, 17], "float32"], ["TENSOR", [192, 128, 7, 1], "float32"], [1, 1], [3, 0, 3, 0], [1, 1], "float32"], {}], "config": {"index": 140223, "code_hash": null, "entity": [["tile_f", "sp", [-1, 32, 3, 2]], ["tile_y", "sp", [-1, 17, 1, 1]], ["tile_x", "sp", [-1, 1, 1, 1]], ["tile_rc", "sp", [-1, 4]], ["tile_ry", "sp", [-1, 7]], ["tile_rx", "sp", [-1, 1]], ["auto_unroll_max_step", "ot", 512], ["unroll_explicit", "ot", 0]]}, "result": [[0.033809066666666665, 0.03391056033333333, 0.033922571666666665], 0, 2.2839341163635254, 1679186058.1147702], "version": 0.2, "tvm_version": "0.10.0"}
{"input": ["cuda -keys=cuda,gpu -arch=sm_75 -max_num_threads=1024 -thread_warp_size=32", "conv2d_nchw.cuda", [["TENSOR", [1, 128, 17, 17], "float32"], ["TENSOR", [192, 128, 7, 1], "float32"], [1, 1], [3, 0, 3, 0], [1, 1], "float32"], {}], "config": {"index": 493348, "code_hash": null, "entity": [["tile_f", "sp", [-1, 6, 2, 2]], ["tile_y", "sp", [-1, 1, 1, 1]], ["tile_x", "sp", [-1, 1, 1, 17]], ["tile_rc", "sp", [-1, 8]], ["tile_ry", "sp", [-1, 7]], ["tile_rx", "sp", [-1, 1]], ["auto_unroll_max_step", "ot", 1500], ["unroll_explicit", "ot", 1]]}, "result": [[0.0011494726928571429, 0.0011496235428571427, 0.0011496349540229885], 0, 8.865809679031372, 1679186069.525815], "version": 0.2, "tvm_version": "0.10.0"}
{"input": ["cuda -keys=cuda,gpu -arch=sm_75 -max_num_threads=1024 -thread_warp_size=32", "conv2d_nchw.cuda", [["TENSOR", [1, 128, 17, 17], "float32"], ["TENSOR", [192, 128, 7, 1], "float32"], [1, 1], [3, 0, 3, 0], [1, 1], "float32"], {}], "config": {"index": 8191, "code_hash": null, "entity": [["tile_f", "sp", [-1, 3, 8, 2]], ["tile_y", "sp", [-1, 1, 1, 1]], ["tile_x", "sp", [-1, 1, 17, 1]], ["tile_rc", "sp", [-1, 2]], ["tile_ry", "sp", [-1, 1]], ["tile_rx", "sp", [-1, 1]], ["auto_unroll_max_step", "ot", 0], ["unroll_explicit", "ot", 0]]}, "result": [[0.00037236234180138564, 0.00037241305311778295, 0.0003724163648960739], 0, 1.7078897953033447, 1679186070.7899623], "version": 0.2, "tvm_version": "0.10.0"}
{"input": ["cuda -keys=cuda,gpu -arch=sm_75 -max_num_threads=1024 -thread_warp_size=32", "conv2d_nchw.cuda", [["TENSOR", [1, 128, 17, 17], "float32"], ["TENSOR", [192, 128, 7, 1], "float32"], [1, 1], [3, 0, 3, 0], [1, 1], "float32"], {}], "config": {"index": 508129, "code_hash": null, "entity": [["tile_f", "sp", [-1, 2, 2, 2]], ["tile_y", "sp", [-1, 1, 1, 1]], ["tile_x", "sp", [-1, 1, 17, 1]], ["tile_rc", "sp", [-1, 64]], ["tile_ry", "sp", [-1, 7]], ["tile_rx", "sp", [-1, 1]], ["auto_unroll_max_step", "ot", 1500], ["unroll_explicit", "ot", 1]]}, "result": [[0.003984128175, 0.003984128175, 0.003986447125], 0, 6.6542065143585205, 1679186072.0318122], "version": 0.2, "tvm_version": "0.10.0"}
{"input": ["cuda -keys=cuda,gpu -arch=sm_75 -max_num_threads=1024 -thread_warp_size=32", "conv2d_nchw.cuda", [["TENSOR", [1, 128, 17, 17], "float32"], ["TENSOR", [192, 128, 7, 1], "float32"], [1, 1], [3, 0, 3, 0], [1, 1], "float32"], {}], "config": {"index": 287628, "code_hash": null, "entity": [["tile_f", "sp", [-1, 96, 1, 1]], ["tile_y", "sp", [-1, 1, 1, 1]], ["tile_x", "sp", [-1, 1, 17, 1]], ["tile_rc", "sp", [-1, 32]], ["tile_ry", "sp", [-1, 1]], ["tile_rx", "sp", [-1, 1]], ["auto_unroll_max_step", "ot", 0], ["unroll_explicit", "ot", 1]]}, "result": [[0.0017354741551724136, 0.0017362096034482758, 0.0017363437758620688], 0, 2.7598469257354736, 1679186072.8999908], "version": 0.2, "tvm_version": "0.10.0"}
{"input": ["cuda -keys=cuda,gpu -arch=sm_75 -max_num_threads=1024 -thread_warp_size=32", "conv2d_nchw.cuda", [["TENSOR", [1, 128, 17, 17], "float32"], ["TENSOR", [192, 128, 7, 1], "float32"], [1, 1], [3, 0, 3, 0], [1, 1], "float32"], {}], "config": {"index": 105321, "code_hash": null, "entity": [["tile_f", "sp", [-1, 64, 1, 3]], ["tile_y", "sp", [-1, 17, 1, 1]], ["tile_x", "sp", [-1, 1, 17, 1]], ["tile_rc", "sp", [-1, 8]], ["tile_ry", "sp", [-1, 1]], ["tile_rx", "sp", [-1, 1]], ["auto_unroll_max_step", "ot", 512], ["unroll_explicit", "ot", 0]]}, "result": [[0.0221928965, 0.022193481333333334, 0.022214986000000003], 0, 2.691352605819702, 1679186084.1378567], "version": 0.2, "tvm_version": "0.10.0"}
{"input": ["cuda -keys=cuda,gpu -arch=sm_75 -max_num_threads=1024 -thread_warp_size=32", "conv2d_nchw.cuda", [["TENSOR", [1, 128, 17, 17], "float32"], ["TENSOR", [192, 128, 7, 1], "float32"], [1, 1], [3, 0, 3, 0], [1, 1], "float32"], {}], "config": {"index": 388778, "code_hash": null, "entity": [["tile_f", "sp", [-1, 1, 3, 1]], ["tile_y", "sp", [-1, 17, 1, 1]], ["tile_x", "sp", [-1, 17, 1, 1]], ["tile_rc", "sp", [-1, 1]], ["tile_ry", "sp", [-1, 7]], ["tile_rx", "sp", [-1, 1]], ["auto_unroll_max_step", "ot", 512], ["unroll_explicit", "ot", 1]]}, "result": [[0.004349328739130434, 0.004352518826086956, 0.004352972608695652], 0, 3.546990156173706, 1679186084.959864], "version": 0.2, "tvm_version": "0.10.0"}
{"input": ["cuda -keys=cuda,gpu -arch=sm_75 -max_num_threads=1024 -thread_warp_size=32", "conv2d_nchw.cuda", [["TENSOR", [1, 128, 17, 17], "float32"], ["TENSOR", [192, 128, 7, 1], "float32"], [1, 1], [3, 0, 3, 0], [1, 1], "float32"], {}], "config": {"index": 236882, "code_hash": null, "entity": [["tile_f", "sp", [-1, 3, 1, 1]], ["tile_y", "sp", [-1, 17, 1, 1]], ["tile_x", "sp", [-1, 1, 1, 1]], ["tile_rc", "sp", [-1, 16]], ["tile_ry", "sp", [-1, 7]], ["tile_rx", "sp", [-1, 1]], ["auto_unroll_max_step", "ot", 1500], ["unroll_explicit", "ot", 0]]}, "result": [[0.0013483753361344538, 0.0013484243109243696, 0.0013490341512605042], 0, 2.925983428955078, 1679186086.1391208], "version": 0.2, "tvm_version": "0.10.0"}
{"input": ["cuda -keys=cuda,gpu -arch=sm_75 -max_num_threads=1024 -thread_warp_size=32", "conv2d_nchw.cuda", [["TENSOR", [1, 128, 17, 17], "float32"], ["TENSOR", [192, 128, 7, 1], "float32"], [1, 1], [3, 0, 3, 0], [1, 1], "float32"], {}], "config": {"index": 21046, "code_hash": null, "entity": [["tile_f", "sp", [-1, 4, 12, 4]], ["tile_y", "sp", [-1, 1, 17, 1]], ["tile_x", "sp", [-1, 1, 1, 17]], ["tile_rc", "sp", [-1, 8]], ["tile_ry", "sp", [-1, 1]], ["tile_rx", "sp", [-1, 1]], ["auto_unroll_max_step", "ot", 0], ["unroll_explicit", "ot", 0]]}, "result": [[0.0018016302857142856, 0.0018016703392857143, 0.0018016909107142856], 0, 1.6699566841125488, 1679186087.0317814], "version": 0.2, "tvm_version": "0.10.0"}
{"input": ["cuda -keys=cuda,gpu -arch=sm_75 -max_num_threads=1024 -thread_warp_size=32", "conv2d_nchw.cuda", [["TENSOR", [1, 128, 17, 17], "float32"], ["TENSOR", [192, 128, 7, 1], "float32"], [1, 1], [3, 0, 3, 0], [1, 1], "float32"], {}], "config": {"index": 361195, "code_hash": null, "entity": [["tile_f", "sp", [-1, 1, 3, 64]], ["tile_y", "sp", [-1, 1, 17, 1]], ["tile_x", "sp", [-1, 1, 1, 1]], ["tile_rc", "sp", [-1, 8]], ["tile_ry", "sp", [-1, 1]], ["tile_rx", "sp", [-1, 1]], ["auto_unroll_max_step", "ot", 512], ["unroll_explicit", "ot", 1]]}, "result": [[0.0005542568200692041, 0.0005543612560553633, 0.0005544259342560553], 0, 3.726163864135742, 1679186088.3205037], "version": 0.2, "tvm_version": "0.10.0"}
{"input": ["cuda -keys=cuda,gpu -arch=sm_75 -max_num_threads=1024 -thread_warp_size=32", "conv2d_nchw.cuda", [["TENSOR", [1, 128, 17, 17], "float32"], ["TENSOR", [192, 128, 7, 1], "float32"], [1, 1], [3, 0, 3, 0], [1, 1], "float32"], {}], "config": {"index": 131564, "code_hash": null, "entity": [["tile_f", "sp", [-1, 4, 2, 4]], ["tile_y", "sp", [-1, 1, 1, 17]], ["tile_x", "sp", [-1, 17, 1, 1]], ["tile_rc", "sp", [-1, 1]], ["tile_ry", "sp", [-1, 7]], ["tile_rx", "sp", [-1, 1]], ["auto_unroll_max_step", "ot", 512], ["unroll_explicit", "ot", 0]]}, "result": [[0.193256454, 0.19356057699999998, 0.1935850215], 0, 5.540881872177124, 1679186090.803182], "version": 0.2, "tvm_version": "0.10.0"}
{"input": ["cuda -keys=cuda,gpu -arch=sm_75 -max_num_threads=1024 -thread_warp_size=32", "conv2d_nchw.cuda", [["TENSOR", [1, 128, 17, 17], "float32"], ["TENSOR", [192, 128, 7, 1], "float32"], [1, 1], [3, 0, 3, 0], [1, 1], "float32"], {}], "config": {"index": 273604, "code_hash": null, "entity": [["tile_f", "sp", [-1, 6, 2, 2]], ["tile_y", "sp", [-1, 1, 17, 1]], ["tile_x", "sp", [-1, 1, 1, 17]], ["tile_rc", "sp", [-1, 4]], ["tile_ry", "sp", [-1, 1]], ["tile_rx", "sp", [-1, 1]], ["auto_unroll_max_step", "ot", 0], ["unroll_explicit", "ot", 1]]}, "result": [[0.0004129261696658097, 0.000412948059125964, 0.00041296417994858613], 0, 2.041755437850952, 1679186092.096132], "version": 0.2, "tvm_version": "0.10.0"}
{"input": ["cuda -keys=cuda,gpu -arch=sm_75 -max_num_threads=1024 -thread_warp_size=32", "conv2d_nchw.cuda", [["TENSOR", [1, 128, 17, 17], "float32"], ["TENSOR", [192, 128, 7, 1], "float32"], [1, 1], [3, 0, 3, 0], [1, 1], "float32"], {}], "config": {"index": 357929, "code_hash": null, "entity": [["tile_f", "sp", [-1, 8, 1, 2]], ["tile_y", "sp", [-1, 17, 1, 1]], ["tile_x", "sp", [-1, 1, 17, 1]], ["tile_rc", "sp", [-1, 4]], ["tile_ry", "sp", [-1, 1]], ["tile_rx", "sp", [-1, 1]], ["auto_unroll_max_step", "ot", 512], ["unroll_explicit", "ot", 1]]}, "result": [[0.0011438890575539568, 0.0011439219928057554, 0.0011440183741007195], 0, 2.9847476482391357, 1679186093.347937], "version": 0.2, "tvm_version": "0.10.0"}
{"input": ["cuda -keys=cuda,gpu -arch=sm_75 -max_num_threads=1024 -thread_warp_size=32", "conv2d_nchw.cuda", [["TENSOR", [1, 128, 17, 17], "float32"], ["TENSOR", [192, 128, 7, 1], "float32"], [1, 1], [3, 0, 3, 0], [1, 1], "float32"], {}], "config": {"index": 152100, "code_hash": null, "entity": [["tile_f", "sp", [-1, 4, 2, 6]], ["tile_y", "sp", [-1, 1, 1, 1]], ["tile_x", "sp", [-1, 17, 1, 1]], ["tile_rc", "sp", [-1, 16]], ["tile_ry", "sp", [-1, 7]], ["tile_rx", "sp", [-1, 1]], ["auto_unroll_max_step", "ot", 512], ["unroll_explicit", "ot", 0]]}, "result": [[0.0102412322, 0.0104976707, 0.010546406500000001], 0, 1.800997257232666, 1679186094.2241764], "version": 0.2, "tvm_version": "0.10.0"}
{"input": ["cuda -keys=cuda,gpu -arch=sm_75 -max_num_threads=1024 -thread_warp_size=32", "conv2d_nchw.cuda", [["TENSOR", [1, 128, 17, 17], "float32"], ["TENSOR", [192, 128, 7, 1], "float32"], [1, 1], [3, 0, 3, 0], [1, 1], "float32"], {}], "config": {"index": 407618, "code_hash": null, "entity": [["tile_f", "sp", [-1, 2, 8, 1]], ["tile_y", "sp", [-1, 17, 1, 1]], ["tile_x", "sp", [-1, 1, 1, 17]], ["tile_rc", "sp", [-1, 8]], ["tile_ry", "sp", [-1, 7]], ["tile_rx", "sp", [-1, 1]], ["auto_unroll_max_step", "ot", 512], ["unroll_explicit", "ot", 1]]}, "result": [[0.006283095, 0.0064409315, 0.006444591944444445], 0, 3.003507375717163, 1679186095.1792068], "version": 0.2, "tvm_version": "0.10.0"}
{"input": ["cuda -keys=cuda,gpu -arch=sm_75 -max_num_threads=1024 -thread_warp_size=32", "conv2d_nchw.cuda", [["TENSOR", [1, 128, 17, 17], "float32"], ["TENSOR", [192, 128, 7, 1], "float32"], [1, 1], [3, 0, 3, 0], [1, 1], "float32"], {}], "config": {"index": 312796, "code_hash": null, "entity": [["tile_f", "sp", [-1, 3, 1, 32]], ["tile_y", "sp", [-1, 1, 17, 1]], ["tile_x", "sp", [-1, 1, 1, 1]], ["tile_rc", "sp", [-1, 4]], ["tile_ry", "sp", [-1, 7]], ["tile_rx", "sp", [-1, 1]], ["auto_unroll_max_step", "ot", 0], ["unroll_explicit", "ot", 1]]}, "result": [[0.002352056627906977, 0.0023534146511627906, 0.002353540441860465], 0, 2.9479806423187256, 1679186096.074506], "version": 0.2, "tvm_version": "0.10.0"}
{"input": ["cuda -keys=cuda,gpu -arch=sm_75 -max_num_threads=1024 -thread_warp_size=32", "conv2d_nchw.cuda", [["TENSOR", [1, 128, 17, 17], "float32"], ["TENSOR", [192, 128, 7, 1], "float32"], [1, 1], [3, 0, 3, 0], [1, 1], "float32"], {}], "config": {"index": 30090, "code_hash": null, "entity": [["tile_f", "sp", [-1, 2, 2, 4]], ["tile_y", "sp", [-1, 17, 1, 1]], ["tile_x", "sp", [-1, 1, 17, 1]], ["tile_rc", "sp", [-1, 32]], ["tile_ry", "sp", [-1, 1]], ["tile_rx", "sp", [-1, 1]], ["auto_unroll_max_step", "ot", 0], ["unroll_explicit", "ot", 0]]}, "result": [[0.0005808890046511628, 0.0005810013860465116, 0.0006147893860465116], 0, 1.8193199634552002, 1679186099.860171], "version": 0.2, "tvm_version": "0.10.0"}
{"input": ["cuda -keys=cuda,gpu -arch=sm_75 -max_num_threads=1024 -thread_warp_size=32", "conv2d_nchw.cuda", [["TENSOR", [1, 128, 17, 17], "float32"], ["TENSOR", [192, 128, 7, 1], "float32"], [1, 1], [3, 0, 3, 0], [1, 1], "float32"], {}], "config": {"index": 276804, "code_hash": null, "entity": [["tile_f", "sp", [-1, 1, 2, 12]], ["tile_y", "sp", [-1, 1, 1, 17]], ["tile_x", "sp", [-1, 17, 1, 1]], ["tile_rc", "sp", [-1, 8]], ["tile_ry", "sp", [-1, 1]], ["tile_rx", "sp", [-1, 1]], ["auto_unroll_max_step", "ot", 0], ["unroll_explicit", "ot", 1]]}, "result": [[0.6156770014999999, 0.6157290645000001, 0.6158079830000001], 0, 9.472219467163086, 1679186107.001102], "version": 0.2, "tvm_version": "0.10.0"}
{"input": ["cuda -keys=cuda,gpu -arch=sm_75 -max_num_threads=1024 -thread_warp_size=32", "conv2d_nchw.cuda", [["TENSOR", [1, 128, 17, 17], "float32"], ["TENSOR", [192, 128, 7, 1], "float32"], [1, 1], [3, 0, 3, 0], [1, 1], "float32"], {}], "config": {"index": 198327, "code_hash": null, "entity": [["tile_f", "sp", [-1, 4, 1, 2]], ["tile_y", "sp", [-1, 1, 17, 1]], ["tile_x", "sp", [-1, 1, 1, 17]], ["tile_rc", "sp", [-1, 16]], ["tile_ry", "sp", [-1, 1]], ["tile_rx", "sp", [-1, 1]], ["auto_unroll_max_step", "ot", 1500], ["unroll_explicit", "ot", 0]]}, "result": [[0.0007952566587301588, 0.0007958473888888889, 0.000796330888888889], 0, 1.9236152172088623, 1679186107.8148632], "version": 0.2, "tvm_version": "0.10.0"}
{"input": ["cuda -keys=cuda,gpu -arch=sm_75 -max_num_threads=1024 -thread_warp_size=32", "conv2d_nchw.cuda", [["TENSOR", [1, 128, 17, 17], "float32"], ["TENSOR", [192, 128, 7, 1], "float32"], [1, 1], [3, 0, 3, 0], [1, 1], "float32"], {}], "config": {"index": 495108, "code_hash": null, "entity": [["tile_f", "sp", [-1, 8, 1, 4]], ["tile_y", "sp", [-1, 17, 1, 1]], ["tile_x", "sp", [-1, 1, 1, 1]], ["tile_rc", "sp", [-1, 16]], ["tile_ry", "sp", [-1, 7]], ["tile_rx", "sp", [-1, 1]], ["auto_unroll_max_step", "ot", 1500], ["unroll_explicit", "ot", 1]]}, "result": [[0.04374596133333333, 0.04393597900000001, 0.04398489366666666], 0, 3.6649296283721924, 1679186108.9749315], "version": 0.2, "tvm_version": "0.10.0"}
{"input": ["cuda -keys=cuda,gpu -arch=sm_75 -max_num_threads=1024 -thread_warp_size=32", "conv2d_nchw.cuda", [["TENSOR", [1, 128, 17, 17], "float32"], ["TENSOR", [192, 128, 7, 1], "float32"], [1, 1], [3, 0, 3, 0], [1, 1], "float32"], {}], "config": {"index": 108951, "code_hash": null, "entity": [["tile_f", "sp", [-1, 4, 1, 2]], ["tile_y", "sp", [-1, 1, 1, 1]], ["tile_x", "sp", [-1, 17, 1, 1]], ["tile_rc", "sp", [-1, 16]], ["tile_ry", "sp", [-1, 1]], ["tile_rx", "sp", [-1, 1]], ["auto_unroll_max_step", "ot", 512], ["unroll_explicit", "ot", 0]]}, "result": [[0.0018556775555555556, 0.001856407148148148, 0.0018572124814814816], 0, 1.93123197555542, 1679186109.8371375], "version": 0.2, "tvm_version": "0.10.0"}
{"input": ["cuda -keys=cuda,gpu -arch=sm_75 -max_num_threads=1024 -thread_warp_size=32", "conv2d_nchw.cuda", [["TENSOR", [1, 128, 17, 17], "float32"], ["TENSOR", [192, 128, 7, 1], "float32"], [1, 1], [3, 0, 3, 0], [1, 1], "float32"], {}], "config": {"index": 229921, "code_hash": null, "entity": [["tile_f", "sp", [-1, 2, 2, 2]], ["tile_y", "sp", [-1, 1, 1, 1]], ["tile_x", "sp", [-1, 1, 1, 17]], ["tile_rc", "sp", [-1, 4]], ["tile_ry", "sp", [-1, 7]], ["tile_rx", "sp", [-1, 1]], ["auto_unroll_max_step", "ot", 1500], ["unroll_explicit", "ot", 0]]}, "result": [[0.001280648911392405, 0.0012806651392405063, 0.0012806727721518987], 0, 2.1658999919891357, 1679186110.6976438], "version": 0.2, "tvm_version": "0.10.0"}
{"input": ["cuda -keys=cuda,gpu -arch=sm_75 -max_num_threads=1024 -thread_warp_size=32", "conv2d_nchw.cuda", [["TENSOR", [1, 128, 17, 17], "float32"], ["TENSOR", [192, 128, 7, 1], "float32"], [1, 1], [3, 0, 3, 0], [1, 1], "float32"], {}], "config": {"index": 45702, "code_hash": null, "entity": [["tile_f", "sp", [-1, 12, 1, 1]], ["tile_y", "sp", [-1, 1, 1, 1]], ["tile_x", "sp", [-1, 1, 17, 1]], ["tile_rc", "sp", [-1, 1]], ["tile_ry", "sp", [-1, 7]], ["tile_rx", "sp", [-1, 1]], ["auto_unroll_max_step", "ot", 0], ["unroll_explicit", "ot", 0]]}, "result": [[0.00034221445338983054, 0.00034226352754237284, 0.0003422965338983051], 0, 1.8325371742248535, 1679186111.9654987], "version": 0.2, "tvm_version": "0.10.0"}
{"input": ["cuda -keys=cuda,gpu -arch=sm_75 -max_num_threads=1024 -thread_warp_size=32", "conv2d_nchw.cuda", [["TENSOR", [1, 128, 17, 17], "float32"], ["TENSOR", [192, 128, 7, 1], "float32"], [1, 1], [3, 0, 3, 0], [1, 1], "float32"], {}], "config": {"index": 264531, "code_hash": null, "entity": [["tile_f", "sp", [-1, 4, 2, 2]], ["tile_y", "sp", [-1, 1, 1, 17]], ["tile_x", "sp", [-1, 1, 1, 1]], ["tile_rc", "sp", [-1, 2]], ["tile_ry", "sp", [-1, 1]], ["tile_rx", "sp", [-1, 1]], ["auto_unroll_max_step", "ot", 0], ["unroll_explicit", "ot", 1]]}, "result": [[0.000979297703030303, 0.0009793052848484848, 0.000979949393939394], 0, 2.0506038665771484, 1679186113.2450821], "version": 0.2, "tvm_version": "0.10.0"}
{"input": ["cuda -keys=cuda,gpu -arch=sm_75 -max_num_threads=1024 -thread_warp_size=32", "conv2d_nchw.cuda", [["TENSOR", [1, 128, 17, 17], "float32"], ["TENSOR", [192, 128, 7, 1], "float32"], [1, 1], [3, 0, 3, 0], [1, 1], "float32"], {}], "config": {"index": 288809, "code_hash": null, "entity": [["tile_f", "sp", [-1, 1, 2, 4]], ["tile_y", "sp", [-1, 1, 1, 17]], ["tile_x", "sp", [-1, 1, 17, 1]], ["tile_rc", "sp", [-1, 32]], ["tile_ry", "sp", [-1, 1]], ["tile_rx", "sp", [-1, 1]], ["auto_unroll_max_step", "ot", 0], ["unroll_explicit", "ot", 1]]}, "result": [[0.0009705561385542168, 0.000970828686746988, 0.0009710363313253012], 0, 1.7379136085510254, 1679186114.4241912], "version": 0.2, "tvm_version": "0.10.0"}
{"input": ["cuda -keys=cuda,gpu -arch=sm_75 -max_num_threads=1024 -thread_warp_size=32", "conv2d_nchw.cuda", [["TENSOR", [1, 128, 17, 17], "float32"], ["TENSOR", [192, 128, 7, 1], "float32"], [1, 1], [3, 0, 3, 0], [1, 1], "float32"], {}], "config": {"index": 306470, "code_hash": null, "entity": [["tile_f", "sp", [-1, 8, 4, 1]], ["tile_y", "sp", [-1, 1, 1, 1]], ["tile_x", "sp", [-1, 1, 1, 1]], ["tile_rc", "sp", [-1, 2]], ["tile_ry", "sp", [-1, 7]], ["tile_rx", "sp", [-1, 1]], ["auto_unroll_max_step", "ot", 0], ["unroll_explicit", "ot", 1]]}, "result": [[0.005748021388888889, 0.005750087277777777, 0.005751655111111111], 0, 1.346588373184204, 1679186115.282632], "version": 0.2, "tvm_version": "0.10.0"}
{"input": ["cuda -keys=cuda,gpu -arch=sm_75 -max_num_threads=1024 -thread_warp_size=32", "conv2d_nchw.cuda", [["TENSOR", [1, 128, 17, 17], "float32"], ["TENSOR", [192, 128, 7, 1], "float32"], [1, 1], [3, 0, 3, 0], [1, 1], "float32"], {}], "config": {"index": 196400, "code_hash": null, "entity": [["tile_f", "sp", [-1, 2, 1, 4]], ["tile_y", "sp", [-1, 1, 1, 1]], ["tile_x", "sp", [-1, 1, 17, 1]], ["tile_rc", "sp", [-1, 16]], ["tile_ry", "sp", [-1, 1]], ["tile_rx", "sp", [-1, 1]], ["auto_unroll_max_step", "ot", 1500], ["unroll_explicit", "ot", 0]]}, "result": [[0.00082709864, 0.0008290139733333334, 0.0008303633066666666], 0, 2.2348155975341797, 1679186194.4849095], "version": 0.2, "tvm_version": "0.10.0"}
{"input": ["cuda -keys=cuda,gpu -arch=sm_75 -max_num_threads=1024 -thread_warp_size=32", "conv2d_nchw.cuda", [["TENSOR", [1, 128, 17, 17], "float32"], ["TENSOR", [192, 128, 7, 1], "float32"], [1, 1], [3, 0, 3, 0], [1, 1], "float32"], {}], "config": {"index": 110384, "code_hash": null, "entity": [["tile_f", "sp", [-1, 2, 1, 4]], ["tile_y", "sp", [-1, 1, 1, 1]], ["tile_x", "sp", [-1, 1, 17, 1]], ["tile_rc", "sp", [-1, 16]], ["tile_ry", "sp", [-1, 1]], ["tile_rx", "sp", [-1, 1]], ["auto_unroll_max_step", "ot", 512], ["unroll_explicit", "ot", 0]]}, "result": [[0.0008224785609756097, 0.0008229796178861789, 0.0008247862357723577], 0, 1.6969077587127686, 1679186195.3146958], "version": 0.2, "tvm_version": "0.10.0"}
{"input": ["cuda -keys=cuda,gpu -arch=sm_75 -max_num_threads=1024 -thread_warp_size=32", "conv2d_nchw.cuda", [["TENSOR", [1, 128, 17, 17], "float32"], ["TENSOR", [192, 128, 7, 1], "float32"], [1, 1], [3, 0, 3, 0], [1, 1], "float32"], {}], "config": {"index": 24368, "code_hash": null, "entity": [["tile_f", "sp", [-1, 2, 1, 4]], ["tile_y", "sp", [-1, 1, 1, 1]], ["tile_x", "sp", [-1, 1, 17, 1]], ["tile_rc", "sp", [-1, 16]], ["tile_ry", "sp", [-1, 1]], ["tile_rx", "sp", [-1, 1]], ["auto_unroll_max_step", "ot", 0], ["unroll_explicit", "ot", 0]]}, "result": [[0.000822498593495935, 0.0008227377154471545, 0.0008237013089430895], 0, 1.7183732986450195, 1679186196.1831145], "version": 0.2, "tvm_version": "0.10.0"}
{"input": ["cuda -keys=cuda,gpu -arch=sm_75 -max_num_threads=1024 -thread_warp_size=32", "conv2d_nchw.cuda", [["TENSOR", [1, 128, 17, 17], "float32"], ["TENSOR", [192, 128, 7, 1], "float32"], [1, 1], [3, 0, 3, 0], [1, 1], "float32"], {}], "config": {"index": 16976, "code_hash": null, "entity": [["tile_f", "sp", [-1, 2, 1, 4]], ["tile_y", "sp", [-1, 1, 17, 1]], ["tile_x", "sp", [-1, 1, 1, 1]], ["tile_rc", "sp", [-1, 8]], ["tile_ry", "sp", [-1, 1]], ["tile_rx", "sp", [-1, 1]], ["auto_unroll_max_step", "ot", 0], ["unroll_explicit", "ot", 0]]}, "result": [[0.000725466628959276, 0.0007256674751131222, 0.0007259075429864253], 0, 1.9820177555084229, 1679186197.4144673], "version": 0.2, "tvm_version": "0.10.0"}
{"input": ["cuda -keys=cuda,gpu -arch=sm_75 -max_num_threads=1024 -thread_warp_size=32", "conv2d_nchw.cuda", [["TENSOR", [1, 128, 17, 17], "float32"], ["TENSOR", [192, 128, 7, 1], "float32"], [1, 1], [3, 0, 3, 0], [1, 1], "float32"], {}], "config": {"index": 102992, "code_hash": null, "entity": [["tile_f", "sp", [-1, 2, 1, 4]], ["tile_y", "sp", [-1, 1, 17, 1]], ["tile_x", "sp", [-1, 1, 1, 1]], ["tile_rc", "sp", [-1, 8]], ["tile_ry", "sp", [-1, 1]], ["tile_rx", "sp", [-1, 1]], ["auto_unroll_max_step", "ot", 512], ["unroll_explicit", "ot", 0]]}, "result": [[0.0007250000647482014, 0.0007252765323741007, 0.000726804273381295], 0, 1.6190223693847656, 1679186198.2632372], "version": 0.2, "tvm_version": "0.10.0"}
{"input": ["cuda -keys=cuda,gpu -arch=sm_75 -max_num_threads=1024 -thread_warp_size=32", "conv2d_nchw.cuda", [["TENSOR", [1, 128, 17, 17], "float32"], ["TENSOR", [192, 128, 7, 1], "float32"], [1, 1], [3, 0, 3, 0], [1, 1], "float32"], {}], "config": {"index": 189008, "code_hash": null, "entity": [["tile_f", "sp", [-1, 2, 1, 4]], ["tile_y", "sp", [-1, 1, 17, 1]], ["tile_x", "sp", [-1, 1, 1, 1]], ["tile_rc", "sp", [-1, 8]], ["tile_ry", "sp", [-1, 1]], ["tile_rx", "sp", [-1, 1]], ["auto_unroll_max_step", "ot", 1500], ["unroll_explicit", "ot", 0]]}, "result": [[0.000729162188405797, 0.0007296484782608697, 0.0007298972608695652], 0, 1.7932536602020264, 1679186199.1023903], "version": 0.2, "tvm_version": "0.10.0"}
{"input": ["cuda -keys=cuda,gpu -arch=sm_75 -max_num_threads=1024 -thread_warp_size=32", "conv2d_nchw.cuda", [["TENSOR", [1, 128, 17, 17], "float32"], ["TENSOR", [192, 128, 7, 1], "float32"], [1, 1], [3, 0, 3, 0], [1, 1], "float32"], {}], "config": {"index": 16975, "code_hash": null, "entity": [["tile_f", "sp", [-1, 1, 1, 4]], ["tile_y", "sp", [-1, 1, 17, 1]], ["tile_x", "sp", [-1, 1, 1, 1]], ["tile_rc", "sp", [-1, 8]], ["tile_ry", "sp", [-1, 1]], ["tile_rx", "sp", [-1, 1]], ["auto_unroll_max_step", "ot", 0], ["unroll_explicit", "ot", 0]]}, "result": [[0.0011035569560439561, 0.0011037063516483518, 0.0011042021758241758], 0, 1.5571818351745605, 1679186199.97596], "version": 0.2, "tvm_version": "0.10.0"}
{"input": ["cuda -keys=cuda,gpu -arch=sm_75 -max_num_threads=1024 -thread_warp_size=32", "conv2d_nchw.cuda", [["TENSOR", [1, 128, 17, 17], "float32"], ["TENSOR", [192, 128, 7, 1], "float32"], [1, 1], [3, 0, 3, 0], [1, 1], "float32"], {}], "config": {"index": 102991, "code_hash": null, "entity": [["tile_f", "sp", [-1, 1, 1, 4]], ["tile_y", "sp", [-1, 1, 17, 1]], ["tile_x", "sp", [-1, 1, 1, 1]], ["tile_rc", "sp", [-1, 8]], ["tile_ry", "sp", [-1, 1]], ["tile_rx", "sp", [-1, 1]], ["auto_unroll_max_step", "ot", 512], ["unroll_explicit", "ot", 0]]}, "result": [[0.0010939291564625849, 0.0010940214353741496, 0.0010944228367346937], 0, 2.096567392349243, 1679186201.2264035], "version": 0.2, "tvm_version": "0.10.0"}
{"input": ["cuda -keys=cuda,gpu -arch=sm_75 -max_num_threads=1024 -thread_warp_size=32", "conv2d_nchw.cuda", [["TENSOR", [1, 128, 17, 17], "float32"], ["TENSOR", [192, 128, 7, 1], "float32"], [1, 1], [3, 0, 3, 0], [1, 1], "float32"], {}], "config": {"index": 189007, "code_hash": null, "entity": [["tile_f", "sp", [-1, 1, 1, 4]], ["tile_y", "sp", [-1, 1, 17, 1]], ["tile_x", "sp", [-1, 1, 1, 1]], ["tile_rc", "sp", [-1, 8]], ["tile_ry", "sp", [-1, 1]], ["tile_rx", "sp", [-1, 1]], ["auto_unroll_max_step", "ot", 1500], ["unroll_explicit", "ot", 0]]}, "result": [[0.0010942031904761906, 0.0010942855102040816, 0.0010942938095238094], 0, 2.148531675338745, 1679186202.5038316], "version": 0.2, "tvm_version": "0.10.0"}
{"input": ["cuda -keys=cuda,gpu -arch=sm_75 -max_num_threads=1024 -thread_warp_size=32", "conv2d_nchw.cuda", [["TENSOR", [1, 128, 17, 17], "float32"], ["TENSOR", [192, 128, 7, 1], "float32"], [1, 1], [3, 0, 3, 0], [1, 1], "float32"], {}], "config": {"index": 188846, "code_hash": null, "entity": [["tile_f", "sp", [-1, 1, 2, 1]], ["tile_y", "sp", [-1, 1, 17, 1]], ["tile_x", "sp", [-1, 1, 1, 1]], ["tile_rc", "sp", [-1, 8]], ["tile_ry", "sp", [-1, 1]], ["tile_rx", "sp", [-1, 1]], ["auto_unroll_max_step", "ot", 1500], ["unroll_explicit", "ot", 0]]}, "result": [[0.0017500915517241378, 0.0017501571896551727, 0.0017501633620689654], 0, 3.014312267303467, 1679186203.381411], "version": 0.2, "tvm_version": "0.10.0"}
{"input": ["cuda -keys=cuda,gpu -arch=sm_75 -max_num_threads=1024 -thread_warp_size=32", "conv2d_nchw.cuda", [["TENSOR", [1, 128, 17, 17], "float32"], ["TENSOR", [192, 128, 7, 1], "float32"], [1, 1], [3, 0, 3, 0], [1, 1], "float32"], {}], "config": {"index": 16814, "code_hash": null, "entity": [["tile_f", "sp", [-1, 1, 2, 1]], ["tile_y", "sp", [-1, 1, 17, 1]], ["tile_x", "sp", [-1, 1, 1, 1]], ["tile_rc", "sp", [-1, 8]], ["tile_ry", "sp", [-1, 1]], ["tile_rx", "sp", [-1, 1]], ["auto_unroll_max_step", "ot", 0], ["unroll_explicit", "ot", 0]]}, "result": [[0.0016371447580645162, 0.0016374756451612903, 0.0016375829516129031], 0, 1.5567727088928223, 1679186204.2659445], "version": 0.2, "tvm_version": "0.10.0"}
{"input": ["cuda -keys=cuda,gpu -arch=sm_75 -max_num_threads=1024 -thread_warp_size=32", "conv2d_nchw.cuda", [["TENSOR", [1, 128, 17, 17], "float32"], ["TENSOR", [192, 128, 7, 1], "float32"], [1, 1], [3, 0, 3, 0], [1, 1], "float32"], {}], "config": {"index": 102830, "code_hash": null, "entity": [["tile_f", "sp", [-1, 1, 2, 1]], ["tile_y", "sp", [-1, 1, 17, 1]], ["tile_x", "sp", [-1, 1, 1, 1]], ["tile_rc", "sp", [-1, 8]], ["tile_ry", "sp", [-1, 1]], ["tile_rx", "sp", [-1, 1]], ["auto_unroll_max_step", "ot", 512], ["unroll_explicit", "ot", 0]]}, "result": [[0.0016188428225806452, 0.0016188526612903227, 0.0016190126451612902], 0, 1.539839744567871, 1679186205.1244693], "version": 0.2, "tvm_version": "0.10.0"}
{"input": ["cuda -keys=cuda,gpu -arch=sm_75 -max_num_threads=1024 -thread_warp_size=32", "conv2d_nchw.cuda", [["TENSOR", [1, 128, 17, 17], "float32"], ["TENSOR", [192, 128, 7, 1], "float32"], [1, 1], [3, 0, 3, 0], [1, 1], "float32"], {}], "config": {"index": 368432, "code_hash": null, "entity": [["tile_f", "sp", [-1, 2, 1, 4]], ["tile_y", "sp", [-1, 1, 1, 1]], ["tile_x", "sp", [-1, 1, 17, 1]], ["tile_rc", "sp", [-1, 16]], ["tile_ry", "sp", [-1, 1]], ["tile_rx", "sp", [-1, 1]], ["auto_unroll_max_step", "ot", 512], ["unroll_explicit", "ot", 1]]}, "result": [[0.00102209342, 0.0010229759900000001, 0.00102329116], 0, 1.856273889541626, 1679186206.01954], "version": 0.2, "tvm_version": "0.10.0"}
{"input": ["cuda -keys=cuda,gpu -arch=sm_75 -max_num_threads=1024 -thread_warp_size=32", "conv2d_nchw.cuda", [["TENSOR", [1, 128, 17, 17], "float32"], ["TENSOR", [192, 128, 7, 1], "float32"], [1, 1], [3, 0, 3, 0], [1, 1], "float32"], {}], "config": {"index": 282416, "code_hash": null, "entity": [["tile_f", "sp", [-1, 2, 1, 4]], ["tile_y", "sp", [-1, 1, 1, 1]], ["tile_x", "sp", [-1, 1, 17, 1]], ["tile_rc", "sp", [-1, 16]], ["tile_ry", "sp", [-1, 1]], ["tile_rx", "sp", [-1, 1]], ["auto_unroll_max_step", "ot", 0], ["unroll_explicit", "ot", 1]]}, "result": [[0.000823346368852459, 0.0008234302950819672, 0.0008236653032786885], 0, 1.7083306312561035, 1679186206.869374], "version": 0.2, "tvm_version": "0.10.0"}
{"input": ["cuda -keys=cuda,gpu -arch=sm_75 -max_num_threads=1024 -thread_warp_size=32", "conv2d_nchw.cuda", [["TENSOR", [1, 128, 17, 17], "float32"], ["TENSOR", [192, 128, 7, 1], "float32"], [1, 1], [3, 0, 3, 0], [1, 1], "float32"], {}], "config": {"index": 454448, "code_hash": null, "entity": [["tile_f", "sp", [-1, 2, 1, 4]], ["tile_y", "sp", [-1, 1, 1, 1]], ["tile_x", "sp", [-1, 1, 17, 1]], ["tile_rc", "sp", [-1, 16]], ["tile_ry", "sp", [-1, 1]], ["tile_rx", "sp", [-1, 1]], ["auto_unroll_max_step", "ot", 1500], ["unroll_explicit", "ot", 1]]}, "result": [[0.00101085182, 0.00101208061, 0.00101285598], 0, 2.631442070007324, 1679186207.7279303], "version": 0.2, "tvm_version": "0.10.0"}
{"input": ["cuda -keys=cuda,gpu -arch=sm_75 -max_num_threads=1024 -thread_warp_size=32", "conv2d_nchw.cuda", [["TENSOR", [1, 128, 17, 17], "float32"], ["TENSOR", [192, 128, 7, 1], "float32"], [1, 1], [3, 0, 3, 0], [1, 1], "float32"], {}], "config": {"index": 101486, "code_hash": null, "entity": [["tile_f", "sp", [-1, 1, 2, 1]], ["tile_y", "sp", [-1, 1, 17, 1]], ["tile_x", "sp", [-1, 1, 1, 17]], ["tile_rc", "sp", [-1, 4]], ["tile_ry", "sp", [-1, 1]], ["tile_rx", "sp", [-1, 1]], ["auto_unroll_max_step", "ot", 512], ["unroll_explicit", "ot", 0]]}, "result": [[0.0010684088829787234, 0.0010684112340425531, 0.0010685358191489362], 0, 1.7456552982330322, 1679186208.593989], "version": 0.2, "tvm_version": "0.10.0"}
{"input": ["cuda -keys=cuda,gpu -arch=sm_75 -max_num_threads=1024 -thread_warp_size=32", "conv2d_nchw.cuda", [["TENSOR", [1, 128, 17, 17], "float32"], ["TENSOR", [192, 128, 7, 1], "float32"], [1, 1], [3, 0, 3, 0], [1, 1], "float32"], {}], "config": {"index": 15470, "code_hash": null, "entity": [["tile_f", "sp", [-1, 1, 2, 1]], ["tile_y", "sp", [-1, 1, 17, 1]], ["tile_x", "sp", [-1, 1, 1, 17]], ["tile_rc", "sp", [-1, 4]], ["tile_ry", "sp", [-1, 1]], ["tile_rx", "sp", [-1, 1]], ["auto_unroll_max_step", "ot", 0], ["unroll_explicit", "ot", 0]]}, "result": [[0.0010662614152542375, 0.0010692306101694915, 0.001380026712328767], 0, 1.964228630065918, 1679186212.5220644], "version": 0.2, "tvm_version": "0.10.0"}
{"input": ["cuda -keys=cuda,gpu -arch=sm_75 -max_num_threads=1024 -thread_warp_size=32", "conv2d_nchw.cuda", [["TENSOR", [1, 128, 17, 17], "float32"], ["TENSOR", [192, 128, 7, 1], "float32"], [1, 1], [3, 0, 3, 0], [1, 1], "float32"], {}], "config": {"index": 103001, "code_hash": null, "entity": [["tile_f", "sp", [-1, 1, 2, 4]], ["tile_y", "sp", [-1, 1, 17, 1]], ["tile_x", "sp", [-1, 1, 1, 1]], ["tile_rc", "sp", [-1, 8]], ["tile_ry", "sp", [-1, 1]], ["tile_rx", "sp", [-1, 1]], ["auto_unroll_max_step", "ot", 512], ["unroll_explicit", "ot", 0]]}, "result": [[0.0006399648134920635, 0.0006400100436507937, 0.0006400487380952381], 0, 1.9870884418487549, 1679186213.7219396], "version": 0.2, "tvm_version": "0.10.0"}
{"input": ["cuda -keys=cuda,gpu -arch=sm_75 -max_num_threads=1024 -thread_warp_size=32", "conv2d_nchw.cuda", [["TENSOR", [1, 128, 17, 17], "float32"], ["TENSOR", [192, 128, 7, 1], "float32"], [1, 1], [3, 0, 3, 0], [1, 1], "float32"], {}], "config": {"index": 189017, "code_hash": null, "entity": [["tile_f", "sp", [-1, 1, 2, 4]], ["tile_y", "sp", [-1, 1, 17, 1]], ["tile_x", "sp", [-1, 1, 1, 1]], ["tile_rc", "sp", [-1, 8]], ["tile_ry", "sp", [-1, 1]], ["tile_rx", "sp", [-1, 1]], ["auto_unroll_max_step", "ot", 1500], ["unroll_explicit", "ot", 0]]}, "result": [[0.0006399931075949367, 0.0006400293734177215, 0.0006401172531645569], 0, 1.6512136459350586, 1679186214.5577216], "version": 0.2, "tvm_version": "0.10.0"}
{"input": ["cuda -keys=cuda,gpu -arch=sm_75 -max_num_threads=1024 -thread_warp_size=32", "conv2d_nchw.cuda", [["TENSOR", [1, 128, 17, 17], "float32"], ["TENSOR", [192, 128, 7, 1], "float32"], [1, 1], [3, 0, 3, 0], [1, 1], "float32"], {}], "config": {"index": 16985, "code_hash": null, "entity": [["tile_f", "sp", [-1, 1, 2, 4]], ["tile_y", "sp", [-1, 1, 17, 1]], ["tile_x", "sp", [-1, 1, 1, 1]], ["tile_rc", "sp", [-1, 8]], ["tile_ry", "sp", [-1, 1]], ["tile_rx", "sp", [-1, 1]], ["auto_unroll_max_step", "ot", 0], ["unroll_explicit", "ot", 0]]}, "result": [[0.0006489475341365463, 0.0006490206425702812, 0.0006490529357429718], 0, 2.0113167762756348, 1679186215.8531933], "version": 0.2, "tvm_version": "0.10.0"}
{"input": ["cuda -keys=cuda,gpu -arch=sm_75 -max_num_threads=1024 -thread_warp_size=32", "conv2d_nchw.cuda", [["TENSOR", [1, 128, 17, 17], "float32"], ["TENSOR", [192, 128, 7, 1], "float32"], [1, 1], [3, 0, 3, 0], [1, 1], "float32"], {}], "config": {"index": 447056, "code_hash": null, "entity": [["tile_f", "sp", [-1, 2, 1, 4]], ["tile_y", "sp", [-1, 1, 17, 1]], ["tile_x", "sp", [-1, 1, 1, 1]], ["tile_rc", "sp", [-1, 8]], ["tile_ry", "sp", [-1, 1]], ["tile_rx", "sp", [-1, 1]], ["auto_unroll_max_step", "ot", 1500], ["unroll_explicit", "ot", 1]]}, "result": [[0.000522506671875, 0.0005226993125, 0.0005227883229166668], 0, 1.9516568183898926, 1679186216.70974], "version": 0.2, "tvm_version": "0.10.0"}
{"input": ["cuda -keys=cuda,gpu -arch=sm_75 -max_num_threads=1024 -thread_warp_size=32", "conv2d_nchw.cuda", [["TENSOR", [1, 128, 17, 17], "float32"], ["TENSOR", [192, 128, 7, 1], "float32"], [1, 1], [3, 0, 3, 0], [1, 1], "float32"], {}], "config": {"index": 361040, "code_hash": null, "entity": [["tile_f", "sp", [-1, 2, 1, 4]], ["tile_y", "sp", [-1, 1, 17, 1]], ["tile_x", "sp", [-1, 1, 1, 1]], ["tile_rc", "sp", [-1, 8]], ["tile_ry", "sp", [-1, 1]], ["tile_rx", "sp", [-1, 1]], ["auto_unroll_max_step", "ot", 512], ["unroll_explicit", "ot", 1]]}, "result": [[0.0007258402262443438, 0.0007258942171945701, 0.0007264369049773756], 0, 2.073786497116089, 1679186217.9928765], "version": 0.2, "tvm_version": "0.10.0"}
{"input": ["cuda -keys=cuda,gpu -arch=sm_75 -max_num_threads=1024 -thread_warp_size=32", "conv2d_nchw.cuda", [["TENSOR", [1, 128, 17, 17], "float32"], ["TENSOR", [192, 128, 7, 1], "float32"], [1, 1], [3, 0, 3, 0], [1, 1], "float32"], {}], "config": {"index": 275024, "code_hash": null, "entity": [["tile_f", "sp", [-1, 2, 1, 4]], ["tile_y", "sp", [-1, 1, 17, 1]], ["tile_x", "sp", [-1, 1, 1, 1]], ["tile_rc", "sp", [-1, 8]], ["tile_ry", "sp", [-1, 1]], ["tile_rx", "sp", [-1, 1]], ["auto_unroll_max_step", "ot", 0], ["unroll_explicit", "ot", 1]]}, "result": [[0.0007253042286995516, 0.0007254052914798206, 0.0007254236322869957], 0, 1.9963223934173584, 1679186219.2427578], "version": 0.2, "tvm_version": "0.10.0"}
{"input": ["cuda -keys=cuda,gpu -arch=sm_75 -max_num_threads=1024 -thread_warp_size=32", "conv2d_nchw.cuda", [["TENSOR", [1, 128, 17, 17], "float32"], ["TENSOR", [192, 128, 7, 1], "float32"], [1, 1], [3, 0, 3, 0], [1, 1], "float32"], {}], "config": {"index": 275023, "code_hash": null, "entity": [["tile_f", "sp", [-1, 1, 1, 4]], ["tile_y", "sp", [-1, 1, 17, 1]], ["tile_x", "sp", [-1, 1, 1, 1]], ["tile_rc", "sp", [-1, 8]], ["tile_ry", "sp", [-1, 1]], ["tile_rx", "sp", [-1, 1]], ["auto_unroll_max_step", "ot", 0], ["unroll_explicit", "ot", 1]]}, "result": [[0.001103872021978022, 0.0011041533076923077, 0.001104542901098901], 0, 1.5798230171203613, 1679186220.128869], "version": 0.2, "tvm_version": "0.10.0"}
{"input": ["cuda -keys=cuda,gpu -arch=sm_75 -max_num_threads=1024 -thread_warp_size=32", "conv2d_nchw.cuda", [["TENSOR", [1, 128, 17, 17], "float32"], ["TENSOR", [192, 128, 7, 1], "float32"], [1, 1], [3, 0, 3, 0], [1, 1], "float32"], {}], "config": {"index": 361039, "code_hash": null, "entity": [["tile_f", "sp", [-1, 1, 1, 4]], ["tile_y", "sp", [-1, 1, 17, 1]], ["tile_x", "sp", [-1, 1, 1, 1]], ["tile_rc", "sp", [-1, 8]], ["tile_ry", "sp", [-1, 1]], ["tile_rx", "sp", [-1, 1]], ["auto_unroll_max_step", "ot", 512], ["unroll_explicit", "ot", 1]]}, "result": [[0.0007000423231441048, 0.0007003265764192139, 0.0007004696331877728], 0, 2.1699326038360596, 1679186221.3954217], "version": 0.2, "tvm_version": "0.10.0"}
{"input": ["cuda -keys=cuda,gpu -arch=sm_75 -max_num_threads=1024 -thread_warp_size=32", "conv2d_nchw.cuda", [["TENSOR", [1, 128, 17, 17], "float32"], ["TENSOR", [192, 128, 7, 1], "float32"], [1, 1], [3, 0, 3, 0], [1, 1], "float32"], {}], "config": {"index": 447055, "code_hash": null, "entity": [["tile_f", "sp", [-1, 1, 1, 4]], ["tile_y", "sp", [-1, 1, 17, 1]], ["tile_x", "sp", [-1, 1, 1, 1]], ["tile_rc", "sp", [-1, 8]], ["tile_ry", "sp", [-1, 1]], ["tile_rx", "sp", [-1, 1]], ["auto_unroll_max_step", "ot", 1500], ["unroll_explicit", "ot", 1]]}, "result": [[0.000699931055944056, 0.0007003987412587412, 0.0007005247622377622], 0, 1.7119061946868896, 1679186222.2133148], "version": 0.2, "tvm_version": "0.10.0"}
{"input": ["cuda -keys=cuda,gpu -arch=sm_75 -max_num_threads=1024 -thread_warp_size=32", "conv2d_nchw.cuda", [["TENSOR", [1, 128, 17, 17], "float32"], ["TENSOR", [192, 128, 7, 1], "float32"], [1, 1], [3, 0, 3, 0], [1, 1], "float32"], {}], "config": {"index": 17020, "code_hash": null, "entity": [["tile_f", "sp", [-1, 1, 1, 6]], ["tile_y", "sp", [-1, 1, 17, 1]], ["tile_x", "sp", [-1, 1, 1, 1]], ["tile_rc", "sp", [-1, 8]], ["tile_ry", "sp", [-1, 1]], ["tile_rx", "sp", [-1, 1]], ["auto_unroll_max_step", "ot", 0], ["unroll_explicit", "ot", 0]]}, "result": [[0.0008084281129032258, 0.0008084696451612904, 0.0008085168951612904], 0, 1.518662929534912, 1679186223.0202239], "version": 0.2, "tvm_version": "0.10.0"}
{"input": ["cuda -keys=cuda,gpu -arch=sm_75 -max_num_threads=1024 -thread_warp_size=32", "conv2d_nchw.cuda", [["TENSOR", [1, 128, 17, 17], "float32"], ["TENSOR", [192, 128, 7, 1], "float32"], [1, 1], [3, 0, 3, 0], [1, 1], "float32"], {}], "config": {"index": 103036, "code_hash": null, "entity": [["tile_f", "sp", [-1, 1, 1, 6]], ["tile_y", "sp", [-1, 1, 17, 1]], ["tile_x", "sp", [-1, 1, 1, 1]], ["tile_rc", "sp", [-1, 8]], ["tile_ry", "sp", [-1, 1]], ["tile_rx", "sp", [-1, 1]], ["auto_unroll_max_step", "ot", 512], ["unroll_explicit", "ot", 0]]}, "result": [[0.0008160697479674797, 0.0008162528536585366, 0.0008163192195121951], 0, 1.7621960639953613, 1679186223.9010487], "version": 0.2, "tvm_version": "0.10.0"}
{"input": ["cuda -keys=cuda,gpu -arch=sm_75 -max_num_threads=1024 -thread_warp_size=32", "conv2d_nchw.cuda", [["TENSOR", [1, 128, 17, 17], "float32"], ["TENSOR", [192, 128, 7, 1], "float32"], [1, 1], [3, 0, 3, 0], [1, 1], "float32"], {}], "config": {"index": 189052, "code_hash": null, "entity": [["tile_f", "sp", [-1, 1, 1, 6]], ["tile_y", "sp", [-1, 1, 17, 1]], ["tile_x", "sp", [-1, 1, 1, 1]], ["tile_rc", "sp", [-1, 8]], ["tile_ry", "sp", [-1, 1]], ["tile_rx", "sp", [-1, 1]], ["auto_unroll_max_step", "ot", 1500], ["unroll_explicit", "ot", 0]]}, "result": [[0.0008158865772357724, 0.0008159032032520325, 0.000815936512195122], 0, 1.7027215957641602, 1679186224.715517], "version": 0.2, "tvm_version": "0.10.0"}
{"input": ["cuda -keys=cuda,gpu -arch=sm_75 -max_num_threads=1024 -thread_warp_size=32", "conv2d_nchw.cuda", [["TENSOR", [1, 128, 17, 17], "float32"], ["TENSOR", [192, 128, 7, 1], "float32"], [1, 1], [3, 0, 3, 0], [1, 1], "float32"], {}], "config": {"index": 274862, "code_hash": null, "entity": [["tile_f", "sp", [-1, 1, 2, 1]], ["tile_y", "sp", [-1, 1, 17, 1]], ["tile_x", "sp", [-1, 1, 1, 1]], ["tile_rc", "sp", [-1, 8]], ["tile_ry", "sp", [-1, 1]], ["tile_rx", "sp", [-1, 1]], ["auto_unroll_max_step", "ot", 0], ["unroll_explicit", "ot", 1]]}, "result": [[0.0016372438225806453, 0.0016372485, 0.0016373295806451614], 0, 1.5677263736724854, 1679186225.603257], "version": 0.2, "tvm_version": "0.10.0"}
{"input": ["cuda -keys=cuda,gpu -arch=sm_75 -max_num_threads=1024 -thread_warp_size=32", "conv2d_nchw.cuda", [["TENSOR", [1, 128, 17, 17], "float32"], ["TENSOR", [192, 128, 7, 1], "float32"], [1, 1], [3, 0, 3, 0], [1, 1], "float32"], {}], "config": {"index": 360878, "code_hash": null, "entity": [["tile_f", "sp", [-1, 1, 2, 1]], ["tile_y", "sp", [-1, 1, 17, 1]], ["tile_x", "sp", [-1, 1, 1, 1]], ["tile_rc", "sp", [-1, 8]], ["tile_ry", "sp", [-1, 1]], ["tile_rx", "sp", [-1, 1]], ["auto_unroll_max_step", "ot", 512], ["unroll_explicit", "ot", 1]]}, "result": [[0.0012487904938271604, 0.0012488754567901235, 0.001248926037037037], 0, 1.6072020530700684, 1679186226.4385993], "version": 0.2, "tvm_version": "0.10.0"}
{"input": ["cuda -keys=cuda,gpu -arch=sm_75 -max_num_threads=1024 -thread_warp_size=32", "conv2d_nchw.cuda", [["TENSOR", [1, 128, 17, 17], "float32"], ["TENSOR", [192, 128, 7, 1], "float32"], [1, 1], [3, 0, 3, 0], [1, 1], "float32"], {}], "config": {"index": 446894, "code_hash": null, "entity": [["tile_f", "sp", [-1, 1, 2, 1]], ["tile_y", "sp", [-1, 1, 17, 1]], ["tile_x", "sp", [-1, 1, 1, 1]], ["tile_rc", "sp", [-1, 8]], ["tile_ry", "sp", [-1, 1]], ["tile_rx", "sp", [-1, 1]], ["auto_unroll_max_step", "ot", 1500], ["unroll_explicit", "ot", 1]]}, "result": [[0.0013298198289473683, 0.001329825644736842, 0.0013298804605263157], 0, 3.613032579421997, 1679186227.3283994], "version": 0.2, "tvm_version": "0.10.0"}
{"input": ["cuda -keys=cuda,gpu -arch=sm_75 -max_num_threads=1024 -thread_warp_size=32", "conv2d_nchw.cuda", [["TENSOR", [1, 128, 17, 17], "float32"], ["TENSOR", [192, 128, 7, 1], "float32"], [1, 1], [3, 0, 3, 0], [1, 1], "float32"], {}], "config": {"index": 187502, "code_hash": null, "entity": [["tile_f", "sp", [-1, 1, 2, 1]], ["tile_y", "sp", [-1, 1, 17, 1]], ["tile_x", "sp", [-1, 1, 1, 17]], ["tile_rc", "sp", [-1, 4]], ["tile_ry", "sp", [-1, 1]], ["tile_rx", "sp", [-1, 1]], ["auto_unroll_max_step", "ot", 1500], ["unroll_explicit", "ot", 0]]}, "result": [[0.0010733566266666666, 0.0010734381066666667, 0.0010735616000000002], 0, 2.3278040885925293, 1679186229.7711992], "version": 0.2, "tvm_version": "0.10.0"}
{"input": ["cuda -keys=cuda,gpu -arch=sm_75 -max_num_threads=1024 -thread_warp_size=32", "conv2d_nchw.cuda", [["TENSOR", [1, 128, 17, 17], "float32"], ["TENSOR", [192, 128, 7, 1], "float32"], [1, 1], [3, 0, 3, 0], [1, 1], "float32"], {}], "config": {"index": 99461, "code_hash": null, "entity": [["tile_f", "sp", [-1, 8, 1, 1]], ["tile_y", "sp", [-1, 1, 1, 1]], ["tile_x", "sp", [-1, 1, 17, 1]], ["tile_rc", "sp", [-1, 4]], ["tile_ry", "sp", [-1, 1]], ["tile_rx", "sp", [-1, 1]], ["auto_unroll_max_step", "ot", 512], ["unroll_explicit", "ot", 0]]}, "result": [[0.0005632341166666667, 0.0005632991777777777, 0.0005637992833333333], 0, 1.634300947189331, 1679186230.6238], "version": 0.2, "tvm_version": "0.10.0"}
{"input": ["cuda -keys=cuda,gpu -arch=sm_75 -max_num_threads=1024 -thread_warp_size=32", "conv2d_nchw.cuda", [["TENSOR", [1, 128, 17, 17], "float32"], ["TENSOR", [192, 128, 7, 1], "float32"], [1, 1], [3, 0, 3, 0], [1, 1], "float32"], {}], "config": {"index": 185477, "code_hash": null, "entity": [["tile_f", "sp", [-1, 8, 1, 1]], ["tile_y", "sp", [-1, 1, 1, 1]], ["tile_x", "sp", [-1, 1, 17, 1]], ["tile_rc", "sp", [-1, 4]], ["tile_ry", "sp", [-1, 1]], ["tile_rx", "sp", [-1, 1]], ["auto_unroll_max_step", "ot", 1500], ["unroll_explicit", "ot", 0]]}, "result": [[0.0005632221452513967, 0.0005636031061452514, 0.0005637591899441341], 0, 1.6198654174804688, 1679186231.472536], "version": 0.2, "tvm_version": "0.10.0"}
{"input": ["cuda -keys=cuda,gpu -arch=sm_75 -max_num_threads=1024 -thread_warp_size=32", "conv2d_nchw.cuda", [["TENSOR", [1, 128, 17, 17], "float32"], ["TENSOR", [192, 128, 7, 1], "float32"], [1, 1], [3, 0, 3, 0], [1, 1], "float32"], {}], "config": {"index": 13445, "code_hash": null, "entity": [["tile_f", "sp", [-1, 8, 1, 1]], ["tile_y", "sp", [-1, 1, 1, 1]], ["tile_x", "sp", [-1, 1, 17, 1]], ["tile_rc", "sp", [-1, 4]], ["tile_ry", "sp", [-1, 1]], ["tile_rx", "sp", [-1, 1]], ["auto_unroll_max_step", "ot", 0], ["unroll_explicit", "ot", 0]]}, "result": [[0.0005645199195804196, 0.0005646987587412587, 0.000564845104895105], 0, 1.9015662670135498, 1679186232.6723762], "version": 0.2, "tvm_version": "0.10.0"}
{"input": ["cuda -keys=cuda,gpu -arch=sm_75 -max_num_threads=1024 -thread_warp_size=32", "conv2d_nchw.cuda", [["TENSOR", [1, 128, 17, 17], "float32"], ["TENSOR", [192, 128, 7, 1], "float32"], [1, 1], [3, 0, 3, 0], [1, 1], "float32"], {}], "config": {"index": 275033, "code_hash": null, "entity": [["tile_f", "sp", [-1, 1, 2, 4]], ["tile_y", "sp", [-1, 1, 17, 1]], ["tile_x", "sp", [-1, 1, 1, 1]], ["tile_rc", "sp", [-1, 8]], ["tile_ry", "sp", [-1, 1]], ["tile_rx", "sp", [-1, 1]], ["auto_unroll_max_step", "ot", 0], ["unroll_explicit", "ot", 1]]}, "result": [[0.0006490415983935742, 0.0006491913052208835, 0.0006496640240963856], 0, 1.97172212600708, 1679186233.9267676], "version": 0.2, "tvm_version": "0.10.0"}
{"input": ["cuda -keys=cuda,gpu -arch=sm_75 -max_num_threads=1024 -thread_warp_size=32", "conv2d_nchw.cuda", [["TENSOR", [1, 128, 17, 17], "float32"], ["TENSOR", [192, 128, 7, 1], "float32"], [1, 1], [3, 0, 3, 0], [1, 1], "float32"], {}], "config": {"index": 447065, "code_hash": null, "entity": [["tile_f", "sp", [-1, 1, 2, 4]], ["tile_y", "sp", [-1, 1, 17, 1]], ["tile_x", "sp", [-1, 1, 1, 1]], ["tile_rc", "sp", [-1, 8]], ["tile_ry", "sp", [-1, 1]], ["tile_rx", "sp", [-1, 1]], ["auto_unroll_max_step", "ot", 1500], ["unroll_explicit", "ot", 1]]}, "result": [[0.0005445047297297297, 0.000544514472972973, 0.0005446497398648648], 0, 2.137084722518921, 1679186235.2149286], "version": 0.2, "tvm_version": "0.10.0"}
{"input": ["cuda -keys=cuda,gpu -arch=sm_75 -max_num_threads=1024 -thread_warp_size=32", "conv2d_nchw.cuda", [["TENSOR", [1, 128, 17, 17], "float32"], ["TENSOR", [192, 128, 7, 1], "float32"], [1, 1], [3, 0, 3, 0], [1, 1], "float32"], {}], "config": {"index": 361049, "code_hash": null, "entity": [["tile_f", "sp", [-1, 1, 2, 4]], ["tile_y", "sp", [-1, 1, 17, 1]], ["tile_x", "sp", [-1, 1, 1, 1]], ["tile_rc", "sp", [-1, 8]], ["tile_ry", "sp", [-1, 1]], ["tile_rx", "sp", [-1, 1]], ["auto_unroll_max_step", "ot", 512], ["unroll_explicit", "ot", 1]]}, "result": [[0.0005446458918918919, 0.0005447126594594594, 0.000544757118918919], 0, 1.714137077331543, 1679186236.0623574], "version": 0.2, "tvm_version": "0.10.0"}
{"input": ["cuda -keys=cuda,gpu -arch=sm_75 -max_num_threads=1024 -thread_warp_size=32", "conv2d_nchw.cuda", [["TENSOR", [1, 128, 17, 17], "float32"], ["TENSOR", [192, 128, 7, 1], "float32"], [1, 1], [3, 0, 3, 0], [1, 1], "float32"], {}], "config": {"index": 185489, "code_hash": null, "entity": [["tile_f", "sp", [-1, 4, 2, 1]], ["tile_y", "sp", [-1, 1, 1, 1]], ["tile_x", "sp", [-1, 1, 17, 1]], ["tile_rc", "sp", [-1, 4]], ["tile_ry", "sp", [-1, 1]], ["tile_rx", "sp", [-1, 1]], ["auto_unroll_max_step", "ot", 1500], ["unroll_explicit", "ot", 0]]}, "result": [[0.0004899311393939394, 0.0004899566636363636, 0.0004900536272727272], 0, 1.9812958240509033, 1679186237.3488712], "version": 0.2, "tvm_version": "0.10.0"}
{"input": ["cuda -keys=cuda,gpu -arch=sm_75 -max_num_threads=1024 -thread_warp_size=32", "conv2d_nchw.cuda", [["TENSOR", [1, 128, 17, 17], "float32"], ["TENSOR", [192, 128, 7, 1], "float32"], [1, 1], [3, 0, 3, 0], [1, 1], "float32"], {}], "config": {"index": 13457, "code_hash": null, "entity": [["tile_f", "sp", [-1, 4, 2, 1]], ["tile_y", "sp", [-1, 1, 1, 1]], ["tile_x", "sp", [-1, 1, 17, 1]], ["tile_rc", "sp", [-1, 4]], ["tile_ry", "sp", [-1, 1]], ["tile_rx", "sp", [-1, 1]], ["auto_unroll_max_step", "ot", 0], ["unroll_explicit", "ot", 0]]}, "result": [[0.0004916837256097561, 0.0004917121951219512, 0.0004917385274390244], 0, 1.8917477130889893, 1679186238.5871718], "version": 0.2, "tvm_version": "0.10.0"}
{"input": ["cuda -keys=cuda,gpu -arch=sm_75 -max_num_threads=1024 -thread_warp_size=32", "conv2d_nchw.cuda", [["TENSOR", [1, 128, 17, 17], "float32"], ["TENSOR", [192, 128, 7, 1], "float32"], [1, 1], [3, 0, 3, 0], [1, 1], "float32"], {}], "config": {"index": 99473, "code_hash": null, "entity": [["tile_f", "sp", [-1, 4, 2, 1]], ["tile_y", "sp", [-1, 1, 1, 1]], ["tile_x", "sp", [-1, 1, 17, 1]], ["tile_rc", "sp", [-1, 4]], ["tile_ry", "sp", [-1, 1]], ["tile_rx", "sp", [-1, 1]], ["auto_unroll_max_step", "ot", 512], ["unroll_explicit", "ot", 0]]}, "result": [[0.0004899691658536585, 0.0004900757951219512, 0.0004901216829268293], 0, 1.5471806526184082, 1679186239.4423642], "version": 0.2, "tvm_version": "0.10.0"}
{"input": ["cuda -keys=cuda,gpu -arch=sm_75 -max_num_threads=1024 -thread_warp_size=32", "conv2d_nchw.cuda", [["TENSOR", [1, 128, 17, 17], "float32"], ["TENSOR", [192, 128, 7, 1], "float32"], [1, 1], [3, 0, 3, 0], [1, 1], "float32"], {}], "config": {"index": 185488, "code_hash": null, "entity": [["tile_f", "sp", [-1, 3, 2, 1]], ["tile_y", "sp", [-1, 1, 1, 1]], ["tile_x", "sp", [-1, 1, 17, 1]], ["tile_rc", "sp", [-1, 4]], ["tile_ry", "sp", [-1, 1]], ["tile_rx", "sp", [-1, 1]], ["auto_unroll_max_step", "ot", 1500], ["unroll_explicit", "ot", 0]]}, "result": [[0.0005785777341040463, 0.0005786228901734103, 0.0005787322196531791], 0, 1.5144836902618408, 1679186240.2907636], "version": 0.2, "tvm_version": "0.10.0"}
{"input": ["cuda -keys=cuda,gpu -arch=sm_75 -max_num_threads=1024 -thread_warp_size=32", "conv2d_nchw.cuda", [["TENSOR", [1, 128, 17, 17], "float32"], ["TENSOR", [192, 128, 7, 1], "float32"], [1, 1], [3, 0, 3, 0], [1, 1], "float32"], {}], "config": {"index": 13456, "code_hash": null, "entity": [["tile_f", "sp", [-1, 3, 2, 1]], ["tile_y", "sp", [-1, 1, 1, 1]], ["tile_x", "sp", [-1, 1, 17, 1]], ["tile_rc", "sp", [-1, 4]], ["tile_ry", "sp", [-1, 1]], ["tile_rx", "sp", [-1, 1]], ["auto_unroll_max_step", "ot", 0], ["unroll_explicit", "ot", 0]]}, "result": [[0.0005804100693641618, 0.000580460387283237, 0.0005808516011560693], 0, 1.528186559677124, 1679186241.1393573], "version": 0.2, "tvm_version": "0.10.0"}
{"input": ["cuda -keys=cuda,gpu -arch=sm_75 -max_num_threads=1024 -thread_warp_size=32", "conv2d_nchw.cuda", [["TENSOR", [1, 128, 17, 17], "float32"], ["TENSOR", [192, 128, 7, 1], "float32"], [1, 1], [3, 0, 3, 0], [1, 1], "float32"], {}], "config": {"index": 99472, "code_hash": null, "entity": [["tile_f", "sp", [-1, 3, 2, 1]], ["tile_y", "sp", [-1, 1, 1, 1]], ["tile_x", "sp", [-1, 1, 17, 1]], ["tile_rc", "sp", [-1, 4]], ["tile_ry", "sp", [-1, 1]], ["tile_rx", "sp", [-1, 1]], ["auto_unroll_max_step", "ot", 512], ["unroll_explicit", "ot", 0]]}, "result": [[0.0005786329856115107, 0.0005787403992805755, 0.0005787743201438848], 0, 1.9408066272735596, 1679186242.4087162], "version": 0.2, "tvm_version": "0.10.0"}
{"input": ["cuda -keys=cuda,gpu -arch=sm_75 -max_num_threads=1024 -thread_warp_size=32", "conv2d_nchw.cuda", [["TENSOR", [1, 128, 17, 17], "float32"], ["TENSOR", [192, 128, 7, 1], "float32"], [1, 1], [3, 0, 3, 0], [1, 1], "float32"], {}], "config": {"index": 24367, "code_hash": null, "entity": [["tile_f", "sp", [-1, 1, 1, 4]], ["tile_y", "sp", [-1, 1, 1, 1]], ["tile_x", "sp", [-1, 1, 17, 1]], ["tile_rc", "sp", [-1, 16]], ["tile_ry", "sp", [-1, 1]], ["tile_rx", "sp", [-1, 1]], ["auto_unroll_max_step", "ot", 0], ["unroll_explicit", "ot", 0]]}, "result": [[0.0012642432124999998, 0.0012642687750000002, 0.0012649543749999998], 0, 1.5890262126922607, 1679186243.254692], "version": 0.2, "tvm_version": "0.10.0"}
{"input": ["cuda -keys=cuda,gpu -arch=sm_75 -max_num_threads=1024 -thread_warp_size=32", "conv2d_nchw.cuda", [["TENSOR", [1, 128, 17, 17], "float32"], ["TENSOR", [192, 128, 7, 1], "float32"], [1, 1], [3, 0, 3, 0], [1, 1], "float32"], {}], "config": {"index": 196399, "code_hash": null, "entity": [["tile_f", "sp", [-1, 1, 1, 4]], ["tile_y", "sp", [-1, 1, 1, 1]], ["tile_x", "sp", [-1, 1, 17, 1]], ["tile_rc", "sp", [-1, 16]], ["tile_ry", "sp", [-1, 1]], ["tile_rx", "sp", [-1, 1]], ["auto_unroll_max_step", "ot", 1500], ["unroll_explicit", "ot", 0]]}, "result": [[0.0012645883622047244, 0.0012645923228346459, 0.0012651326299212597], 0, 2.189415693283081, 1679186244.5032592], "version": 0.2, "tvm_version": "0.10.0"}
{"input": ["cuda -keys=cuda,gpu -arch=sm_75 -max_num_threads=1024 -thread_warp_size=32", "conv2d_nchw.cuda", [["TENSOR", [1, 128, 17, 17], "float32"], ["TENSOR", [192, 128, 7, 1], "float32"], [1, 1], [3, 0, 3, 0], [1, 1], "float32"], {}], "config": {"index": 110383, "code_hash": null, "entity": [["tile_f", "sp", [-1, 1, 1, 4]], ["tile_y", "sp", [-1, 1, 1, 1]], ["tile_x", "sp", [-1, 1, 17, 1]], ["tile_rc", "sp", [-1, 16]], ["tile_ry", "sp", [-1, 1]], ["tile_rx", "sp", [-1, 1]], ["auto_unroll_max_step", "ot", 512], ["unroll_explicit", "ot", 0]]}, "result": [[0.0012635663779527557, 0.0012640564645669291, 0.0012641038031496062], 0, 2.057267904281616, 1679186245.7869706], "version": 0.2, "tvm_version": "0.10.0"}
{"input": ["cuda -keys=cuda,gpu -arch=sm_75 -max_num_threads=1024 -thread_warp_size=32", "conv2d_nchw.cuda", [["TENSOR", [1, 128, 17, 17], "float32"], ["TENSOR", [192, 128, 7, 1], "float32"], [1, 1], [3, 0, 3, 0], [1, 1], "float32"], {}], "config": {"index": 15552, "code_hash": null, "entity": [["tile_f", "sp", [-1, 1, 2, 2]], ["tile_y", "sp", [-1, 1, 17, 1]], ["tile_x", "sp", [-1, 1, 1, 17]], ["tile_rc", "sp", [-1, 4]], ["tile_ry", "sp", [-1, 1]], ["tile_rx", "sp", [-1, 1]], ["auto_unroll_max_step", "ot", 0], ["unroll_explicit", "ot", 0]]}, "result": [[0.0005615041357466064, 0.0005615338280542987, 0.0005624790407239819], 0, 1.9373397827148438, 1679186248.7520592], "version": 0.2, "tvm_version": "0.10.0"}
{"input": ["cuda -keys=cuda,gpu -arch=sm_75 -max_num_threads=1024 -thread_warp_size=32", "conv2d_nchw.cuda", [["TENSOR", [1, 128, 17, 17], "float32"], ["TENSOR", [192, 128, 7, 1], "float32"], [1, 1], [3, 0, 3, 0], [1, 1], "float32"], {}], "config": {"index": 101568, "code_hash": null, "entity": [["tile_f", "sp", [-1, 1, 2, 2]], ["tile_y", "sp", [-1, 1, 17, 1]], ["tile_x", "sp", [-1, 1, 1, 17]], ["tile_rc", "sp", [-1, 4]], ["tile_ry", "sp", [-1, 1]], ["tile_rx", "sp", [-1, 1]], ["auto_unroll_max_step", "ot", 512], ["unroll_explicit", "ot", 0]]}, "result": [[0.0005674300915492958, 0.0005675342183098592, 0.0005675484014084507], 0, 2.0896224975585938, 1679186249.9838393], "version": 0.2, "tvm_version": "0.10.0"}
{"input": ["cuda -keys=cuda,gpu -arch=sm_75 -max_num_threads=1024 -thread_warp_size=32", "conv2d_nchw.cuda", [["TENSOR", [1, 128, 17, 17], "float32"], ["TENSOR", [192, 128, 7, 1], "float32"], [1, 1], [3, 0, 3, 0], [1, 1], "float32"], {}], "config": {"index": 18830, "code_hash": null, "entity": [["tile_f", "sp", [-1, 1, 2, 1]], ["tile_y", "sp", [-1, 1, 1, 1]], ["tile_x", "sp", [-1, 1, 17, 1]], ["tile_rc", "sp", [-1, 8]], ["tile_ry", "sp", [-1, 1]], ["tile_rx", "sp", [-1, 1]], ["auto_unroll_max_step", "ot", 0], ["unroll_explicit", "ot", 0]]}, "result": [[0.0014129180845070424, 0.0014130505774647886, 0.00141312], 0, 1.333421230316162, 1679186250.8744464], "version": 0.2, "tvm_version": "0.10.0"}
{"input": ["cuda -keys=cuda,gpu -arch=sm_75 -max_num_threads=1024 -thread_warp_size=32", "conv2d_nchw.cuda", [["TENSOR", [1, 128, 17, 17], "float32"], ["TENSOR", [192, 128, 7, 1], "float32"], [1, 1], [3, 0, 3, 0], [1, 1], "float32"], {}], "config": {"index": 190862, "code_hash": null, "entity": [["tile_f", "sp", [-1, 1, 2, 1]], ["tile_y", "sp", [-1, 1, 1, 1]], ["tile_x", "sp", [-1, 1, 17, 1]], ["tile_rc", "sp", [-1, 8]], ["tile_ry", "sp", [-1, 1]], ["tile_rx", "sp", [-1, 1]], ["auto_unroll_max_step", "ot", 1500], ["unroll_explicit", "ot", 0]]}, "result": [[0.0012539691875, 0.001254354, 0.0012543807875], 0, 2.5748445987701416, 1679186251.7256336], "version": 0.2, "tvm_version": "0.10.0"}
