src/tvm/results/cuda_rtx3080/mxnet/droplet/cpu.log_layer_21.log
{"input": ["cuda -keys=cuda,gpu -arch=sm_86 -max_num_threads=1024 -thread_warp_size=32", "conv2d_nchw.cuda", [["TENSOR", [1, 1024, 14, 14], "float32"], ["TENSOR", [2048, 1024, 1, 1], "float32"], [2, 2], [0, 0, 0, 0], [1, 1], "float32"], {}], "config": {"index": 0, "code_hash": null, "entity": [["tile_f", "sp", [-1, 1, 1, 1]], ["tile_y", "sp", [-1, 1, 1, 1]], ["tile_x", "sp", [-1, 1, 1, 1]], ["tile_rc", "sp", [-1, 1]], ["tile_ry", "sp", [-1, 1]], ["tile_rx", "sp", [-1, 1]], ["auto_unroll_max_step", "ot", 0], ["unroll_explicit", "ot", 0]]}, "result": [[0.0029684555882352943, 0.0029719161764705884, 0.0029897788529411762], 0, 0.9946920871734619, 1679298264.722066], "version": 0.2, "tvm_version": "0.10.0"}
{"input": ["cuda -keys=cuda,gpu -arch=sm_86 -max_num_threads=1024 -thread_warp_size=32", "conv2d_nchw.cuda", [["TENSOR", [1, 1024, 14, 14], "float32"], ["TENSOR", [2048, 1024, 1, 1], "float32"], [2, 2], [0, 0, 0, 0], [1, 1], "float32"], {}], "config": {"index": 192192, "code_hash": null, "entity": [["tile_f", "sp", [-1, 1, 1, 1]], ["tile_y", "sp", [-1, 1, 1, 1]], ["tile_x", "sp", [-1, 1, 1, 1]], ["tile_rc", "sp", [-1, 1]], ["tile_ry", "sp", [-1, 1]], ["tile_rx", "sp", [-1, 1]], ["auto_unroll_max_step", "ot", 0], ["unroll_explicit", "ot", 1]]}, "result": [[0.0029695039411764706, 0.002971765617647059, 0.002984929], 0, 1.166985034942627, 1679298266.0799637], "version": 0.2, "tvm_version": "0.10.0"}
{"input": ["cuda -keys=cuda,gpu -arch=sm_86 -max_num_threads=1024 -thread_warp_size=32", "conv2d_nchw.cuda", [["TENSOR", [1, 1024, 14, 14], "float32"], ["TENSOR", [2048, 1024, 1, 1], "float32"], [2, 2], [0, 0, 0, 0], [1, 1], "float32"], {}], "config": {"index": 64064, "code_hash": null, "entity": [["tile_f", "sp", [-1, 1, 1, 1]], ["tile_y", "sp", [-1, 1, 1, 1]], ["tile_x", "sp", [-1, 1, 1, 1]], ["tile_rc", "sp", [-1, 1]], ["tile_ry", "sp", [-1, 1]], ["tile_rx", "sp", [-1, 1]], ["auto_unroll_max_step", "ot", 512], ["unroll_explicit", "ot", 0]]}, "result": [[0.0029700216176470587, 0.002988995705882353, 0.0029908027647058823], 0, 1.2123703956604004, 1679298266.921964], "version": 0.2, "tvm_version": "0.10.0"}
{"input": ["cuda -keys=cuda,gpu -arch=sm_86 -max_num_threads=1024 -thread_warp_size=32", "conv2d_nchw.cuda", [["TENSOR", [1, 1024, 14, 14], "float32"], ["TENSOR", [2048, 1024, 1, 1], "float32"], [2, 2], [0, 0, 0, 0], [1, 1], "float32"], {}], "config": {"index": 5824, "code_hash": null, "entity": [["tile_f", "sp", [-1, 1, 1, 1]], ["tile_y", "sp", [-1, 1, 1, 1]], ["tile_x", "sp", [-1, 1, 1, 1]], ["tile_rc", "sp", [-1, 2]], ["tile_ry", "sp", [-1, 1]], ["tile_rx", "sp", [-1, 1]], ["auto_unroll_max_step", "ot", 0], ["unroll_explicit", "ot", 0]]}, "result": [[0.006935210666666666, 0.006935473066666666, 0.0069553492], 0, 1.306816577911377, 1679298267.8604698], "version": 0.2, "tvm_version": "0.10.0"}
{"input": ["cuda -keys=cuda,gpu -arch=sm_86 -max_num_threads=1024 -thread_warp_size=32", "conv2d_nchw.cuda", [["TENSOR", [1, 1024, 14, 14], "float32"], ["TENSOR", [2048, 1024, 1, 1], "float32"], [2, 2], [0, 0, 0, 0], [1, 1], "float32"], {}], "config": {"index": 1456, "code_hash": null, "entity": [["tile_f", "sp", [-1, 1, 1, 1]], ["tile_y", "sp", [-1, 1, 1, 1]], ["tile_x", "sp", [-1, 7, 1, 1]], ["tile_rc", "sp", [-1, 1]], ["tile_ry", "sp", [-1, 1]], ["tile_rx", "sp", [-1, 1]], ["auto_unroll_max_step", "ot", 0], ["unroll_explicit", "ot", 0]]}, "result": [[0.005971422058823529, 0.00597179094117647, 0.005971905823529412], 0, 1.2499616146087646, 1679298268.7296834], "version": 0.2, "tvm_version": "0.10.0"}
{"input": ["cuda -keys=cuda,gpu -arch=sm_86 -max_num_threads=1024 -thread_warp_size=32", "conv2d_nchw.cuda", [["TENSOR", [1, 1024, 14, 14], "float32"], ["TENSOR", [2048, 1024, 1, 1], "float32"], [2, 2], [0, 0, 0, 0], [1, 1], "float32"], {}], "config": {"index": 364, "code_hash": null, "entity": [["tile_f", "sp", [-1, 1, 1, 1]], ["tile_y", "sp", [-1, 7, 1, 1]], ["tile_x", "sp", [-1, 1, 1, 1]], ["tile_rc", "sp", [-1, 1]], ["tile_ry", "sp", [-1, 1]], ["tile_rx", "sp", [-1, 1]], ["auto_unroll_max_step", "ot", 0], ["unroll_explicit", "ot", 0]]}, "result": [[0.005969618823529412, 0.0059709364705882355, 0.006001483235294118], 0, 1.215437889099121, 1679298269.5934558], "version": 0.2, "tvm_version": "0.10.0"}
{"input": ["cuda -keys=cuda,gpu -arch=sm_86 -max_num_threads=1024 -thread_warp_size=32", "conv2d_nchw.cuda", [["TENSOR", [1, 1024, 14, 14], "float32"], ["TENSOR", [2048, 1024, 1, 1], "float32"], [2, 2], [0, 0, 0, 0], [1, 1], "float32"], {}], "config": {"index": 1, "code_hash": null, "entity": [["tile_f", "sp", [-1, 2, 1, 1]], ["tile_y", "sp", [-1, 1, 1, 1]], ["tile_x", "sp", [-1, 1, 1, 1]], ["tile_rc", "sp", [-1, 1]], ["tile_ry", "sp", [-1, 1]], ["tile_rx", "sp", [-1, 1]], ["auto_unroll_max_step", "ot", 0], ["unroll_explicit", "ot", 0]]}, "result": [[0.0065190958749999995, 0.006520383812500001, 0.0065204458125], 0, 1.2724056243896484, 1679298270.5043702], "version": 0.2, "tvm_version": "0.10.0"}
{"input": ["cuda -keys=cuda,gpu -arch=sm_86 -max_num_threads=1024 -thread_warp_size=32", "conv2d_nchw.cuda", [["TENSOR", [1, 1024, 14, 14], "float32"], ["TENSOR", [2048, 1024, 1, 1], "float32"], [2, 2], [0, 0, 0, 0], [1, 1], "float32"], {}], "config": {"index": 128128, "code_hash": null, "entity": [["tile_f", "sp", [-1, 1, 1, 1]], ["tile_y", "sp", [-1, 1, 1, 1]], ["tile_x", "sp", [-1, 1, 1, 1]], ["tile_rc", "sp", [-1, 1]], ["tile_ry", "sp", [-1, 1]], ["tile_rx", "sp", [-1, 1]], ["auto_unroll_max_step", "ot", 1500], ["unroll_explicit", "ot", 0]]}, "result": [[0.0029762833529411764, 0.002988632411764706, 0.0029892667647058824], 0, 1.2186634540557861, 1679298271.373728], "version": 0.2, "tvm_version": "0.10.0"}
{"input": ["cuda -keys=cuda,gpu -arch=sm_86 -max_num_threads=1024 -thread_warp_size=32", "conv2d_nchw.cuda", [["TENSOR", [1, 1024, 14, 14], "float32"], ["TENSOR", [2048, 1024, 1, 1], "float32"], [2, 2], [0, 0, 0, 0], [1, 1], "float32"], {}], "config": {"index": 11648, "code_hash": null, "entity": [["tile_f", "sp", [-1, 1, 1, 1]], ["tile_y", "sp", [-1, 1, 1, 1]], ["tile_x", "sp", [-1, 1, 1, 1]], ["tile_rc", "sp", [-1, 4]], ["tile_ry", "sp", [-1, 1]], ["tile_rx", "sp", [-1, 1]], ["auto_unroll_max_step", "ot", 0], ["unroll_explicit", "ot", 0]]}, "result": [[0.005453877894736842, 0.0054575427894736845, 0.005479959578947368], 0, 1.2428014278411865, 1679298272.2723775], "version": 0.2, "tvm_version": "0.10.0"}
{"input": ["cuda -keys=cuda,gpu -arch=sm_86 -max_num_threads=1024 -thread_warp_size=32", "conv2d_nchw.cuda", [["TENSOR", [1, 1024, 14, 14], "float32"], ["TENSOR", [2048, 1024, 1, 1], "float32"], [2, 2], [0, 0, 0, 0], [1, 1], "float32"], {}], "config": {"index": 2912, "code_hash": null, "entity": [["tile_f", "sp", [-1, 1, 1, 1]], ["tile_y", "sp", [-1, 1, 1, 1]], ["tile_x", "sp", [-1, 1, 7, 1]], ["tile_rc", "sp", [-1, 1]], ["tile_ry", "sp", [-1, 1]], ["tile_rx", "sp", [-1, 1]], ["auto_unroll_max_step", "ot", 0], ["unroll_explicit", "ot", 0]]}, "result": [[0.0021702263829787233, 0.00217024814893617, 0.002170967085106383], 0, 1.2532336711883545, 1679298273.1402247], "version": 0.2, "tvm_version": "0.10.0"}
{"input": ["cuda -keys=cuda,gpu -arch=sm_86 -max_num_threads=1024 -thread_warp_size=32", "conv2d_nchw.cuda", [["TENSOR", [1, 1024, 14, 14], "float32"], ["TENSOR", [2048, 1024, 1, 1], "float32"], [2, 2], [0, 0, 0, 0], [1, 1], "float32"], {}], "config": {"index": 728, "code_hash": null, "entity": [["tile_f", "sp", [-1, 1, 1, 1]], ["tile_y", "sp", [-1, 1, 7, 1]], ["tile_x", "sp", [-1, 1, 1, 1]], ["tile_rc", "sp", [-1, 1]], ["tile_ry", "sp", [-1, 1]], ["tile_rx", "sp", [-1, 1]], ["auto_unroll_max_step", "ot", 0], ["unroll_explicit", "ot", 0]]}, "result": [[0.002336206590909091, 0.002349986840909091, 0.00235387125], 0, 1.2458693981170654, 1679298274.019914], "version": 0.2, "tvm_version": "0.10.0"}
{"input": ["cuda -keys=cuda,gpu -arch=sm_86 -max_num_threads=1024 -thread_warp_size=32", "conv2d_nchw.cuda", [["TENSOR", [1, 1024, 14, 14], "float32"], ["TENSOR", [2048, 1024, 1, 1], "float32"], [2, 2], [0, 0, 0, 0], [1, 1], "float32"], {}], "config": {"index": 2, "code_hash": null, "entity": [["tile_f", "sp", [-1, 4, 1, 1]], ["tile_y", "sp", [-1, 1, 1, 1]], ["tile_x", "sp", [-1, 1, 1, 1]], ["tile_rc", "sp", [-1, 1]], ["tile_ry", "sp", [-1, 1]], ["tile_rx", "sp", [-1, 1]], ["auto_unroll_max_step", "ot", 0], ["unroll_explicit", "ot", 0]]}, "result": [[0.004264277416666667, 0.0042647854166666666, 0.004264831833333333], 0, 1.2474474906921387, 1679298274.8893547], "version": 0.2, "tvm_version": "0.10.0"}
{"input": ["cuda -keys=cuda,gpu -arch=sm_86 -max_num_threads=1024 -thread_warp_size=32", "conv2d_nchw.cuda", [["TENSOR", [1, 1024, 14, 14], "float32"], ["TENSOR", [2048, 1024, 1, 1], "float32"], [2, 2], [0, 0, 0, 0], [1, 1], "float32"], {}], "config": {"index": 17472, "code_hash": null, "entity": [["tile_f", "sp", [-1, 1, 1, 1]], ["tile_y", "sp", [-1, 1, 1, 1]], ["tile_x", "sp", [-1, 1, 1, 1]], ["tile_rc", "sp", [-1, 8]], ["tile_ry", "sp", [-1, 1]], ["tile_rx", "sp", [-1, 1]], ["auto_unroll_max_step", "ot", 0], ["unroll_explicit", "ot", 0]]}, "result": [[0.00506485745, 0.005065062300000001, 0.0050743217], 0, 1.2122254371643066, 1679298275.7558043], "version": 0.2, "tvm_version": "0.10.0"}
{"input": ["cuda -keys=cuda,gpu -arch=sm_86 -max_num_threads=1024 -thread_warp_size=32", "conv2d_nchw.cuda", [["TENSOR", [1, 1024, 14, 14], "float32"], ["TENSOR", [2048, 1024, 1, 1], "float32"], [2, 2], [0, 0, 0, 0], [1, 1], "float32"], {}], "config": {"index": 4368, "code_hash": null, "entity": [["tile_f", "sp", [-1, 1, 1, 1]], ["tile_y", "sp", [-1, 1, 1, 1]], ["tile_x", "sp", [-1, 1, 1, 7]], ["tile_rc", "sp", [-1, 1]], ["tile_ry", "sp", [-1, 1]], ["tile_rx", "sp", [-1, 1]], ["auto_unroll_max_step", "ot", 0], ["unroll_explicit", "ot", 0]]}, "result": [[0.0059719076470588234, 0.005973293058823529, 0.005974000764705882], 0, 1.2493915557861328, 1679298276.6414387], "version": 0.2, "tvm_version": "0.10.0"}
{"input": ["cuda -keys=cuda,gpu -arch=sm_86 -max_num_threads=1024 -thread_warp_size=32", "conv2d_nchw.cuda", [["TENSOR", [1, 1024, 14, 14], "float32"], ["TENSOR", [2048, 1024, 1, 1], "float32"], [2, 2], [0, 0, 0, 0], [1, 1], "float32"], {}], "config": {"index": 1092, "code_hash": null, "entity": [["tile_f", "sp", [-1, 1, 1, 1]], ["tile_y", "sp", [-1, 1, 1, 7]], ["tile_x", "sp", [-1, 1, 1, 1]], ["tile_rc", "sp", [-1, 1]], ["tile_ry", "sp", [-1, 1]], ["tile_rx", "sp", [-1, 1]], ["auto_unroll_max_step", "ot", 0], ["unroll_explicit", "ot", 0]]}, "result": [[0.005968944764705882, 0.005970341823529412, 0.005979256529411765], 0, 1.2225642204284668, 1679298277.501353], "version": 0.2, "tvm_version": "0.10.0"}
{"input": ["cuda -keys=cuda,gpu -arch=sm_86 -max_num_threads=1024 -thread_warp_size=32", "conv2d_nchw.cuda", [["TENSOR", [1, 1024, 14, 14], "float32"], ["TENSOR", [2048, 1024, 1, 1], "float32"], [2, 2], [0, 0, 0, 0], [1, 1], "float32"], {}], "config": {"index": 3, "code_hash": null, "entity": [["tile_f", "sp", [-1, 8, 1, 1]], ["tile_y", "sp", [-1, 1, 1, 1]], ["tile_x", "sp", [-1, 1, 1, 1]], ["tile_rc", "sp", [-1, 1]], ["tile_ry", "sp", [-1, 1]], ["tile_rx", "sp", [-1, 1]], ["auto_unroll_max_step", "ot", 0], ["unroll_explicit", "ot", 0]]}, "result": [[0.003294505193548387, 0.003294505193548387, 0.003294505193548387], 0, 1.2151730060577393, 1679298278.3551278], "version": 0.2, "tvm_version": "0.10.0"}
{"input": ["cuda -keys=cuda,gpu -arch=sm_86 -max_num_threads=1024 -thread_warp_size=32", "conv2d_nchw.cuda", [["TENSOR", [1, 1024, 14, 14], "float32"], ["TENSOR", [2048, 1024, 1, 1], "float32"], [2, 2], [0, 0, 0, 0], [1, 1], "float32"], {}], "config": {"index": 23296, "code_hash": null, "entity": [["tile_f", "sp", [-1, 1, 1, 1]], ["tile_y", "sp", [-1, 1, 1, 1]], ["tile_x", "sp", [-1, 1, 1, 1]], ["tile_rc", "sp", [-1, 16]], ["tile_ry", "sp", [-1, 1]], ["tile_rx", "sp", [-1, 1]], ["auto_unroll_max_step", "ot", 0], ["unroll_explicit", "ot", 0]]}, "result": [[0.0048584899523809524, 0.004858538666666667, 0.004878628666666667], 0, 1.2318933010101318, 1679298279.2258637], "version": 0.2, "tvm_version": "0.10.0"}
{"input": ["cuda -keys=cuda,gpu -arch=sm_86 -max_num_threads=1024 -thread_warp_size=32", "conv2d_nchw.cuda", [["TENSOR", [1, 1024, 14, 14], "float32"], ["TENSOR", [2048, 1024, 1, 1], "float32"], [2, 2], [0, 0, 0, 0], [1, 1], "float32"], {}], "config": {"index": 195104, "code_hash": null, "entity": [["tile_f", "sp", [-1, 1, 1, 1]], ["tile_y", "sp", [-1, 1, 1, 1]], ["tile_x", "sp", [-1, 1, 7, 1]], ["tile_rc", "sp", [-1, 1]], ["tile_ry", "sp", [-1, 1]], ["tile_rx", "sp", [-1, 1]], ["auto_unroll_max_step", "ot", 0], ["unroll_explicit", "ot", 1]]}, "result": [[0.002170437162162162, 0.0021707804864864863, 0.002177328364864865], 0, 1.5672931671142578, 1679298281.2038105], "version": 0.2, "tvm_version": "0.10.0"}
{"input": ["cuda -keys=cuda,gpu -arch=sm_86 -max_num_threads=1024 -thread_warp_size=32", "conv2d_nchw.cuda", [["TENSOR", [1, 1024, 14, 14], "float32"], ["TENSOR", [2048, 1024, 1, 1], "float32"], [2, 2], [0, 0, 0, 0], [1, 1], "float32"], {}], "config": {"index": 66976, "code_hash": null, "entity": [["tile_f", "sp", [-1, 1, 1, 1]], ["tile_y", "sp", [-1, 1, 1, 1]], ["tile_x", "sp", [-1, 1, 7, 1]], ["tile_rc", "sp", [-1, 1]], ["tile_ry", "sp", [-1, 1]], ["tile_rx", "sp", [-1, 1]], ["auto_unroll_max_step", "ot", 512], ["unroll_explicit", "ot", 0]]}, "result": [[0.002170265829787234, 0.0021705572127659572, 0.002171359276595745], 0, 1.2029290199279785, 1679298282.0723045], "version": 0.2, "tvm_version": "0.10.0"}
{"input": ["cuda -keys=cuda,gpu -arch=sm_86 -max_num_threads=1024 -thread_warp_size=32", "conv2d_nchw.cuda", [["TENSOR", [1, 1024, 14, 14], "float32"], ["TENSOR", [2048, 1024, 1, 1], "float32"], [2, 2], [0, 0, 0, 0], [1, 1], "float32"], {}], "config": {"index": 8736, "code_hash": null, "entity": [["tile_f", "sp", [-1, 1, 1, 1]], ["tile_y", "sp", [-1, 1, 1, 1]], ["tile_x", "sp", [-1, 1, 7, 1]], ["tile_rc", "sp", [-1, 2]], ["tile_ry", "sp", [-1, 1]], ["tile_rx", "sp", [-1, 1]], ["auto_unroll_max_step", "ot", 0], ["unroll_explicit", "ot", 0]]}, "result": [[0.0016082976666666666, 0.0016087333968253968, 0.0016111548253968254], 0, 1.2099149227142334, 1679298282.971656], "version": 0.2, "tvm_version": "0.10.0"}
{"input": ["cuda -keys=cuda,gpu -arch=sm_86 -max_num_threads=1024 -thread_warp_size=32", "conv2d_nchw.cuda", [["TENSOR", [1, 1024, 14, 14], "float32"], ["TENSOR", [2048, 1024, 1, 1], "float32"], [2, 2], [0, 0, 0, 0], [1, 1], "float32"], {}], "config": {"index": 3276, "code_hash": null, "entity": [["tile_f", "sp", [-1, 1, 1, 1]], ["tile_y", "sp", [-1, 7, 1, 1]], ["tile_x", "sp", [-1, 1, 7, 1]], ["tile_rc", "sp", [-1, 1]], ["tile_ry", "sp", [-1, 1]], ["tile_rx", "sp", [-1, 1]], ["auto_unroll_max_step", "ot", 0], ["unroll_explicit", "ot", 0]]}, "result": [[0.004609535909090909, 0.004609713454545455, 0.004609815409090909], 0, 1.2727406024932861, 1679298283.8756177], "version": 0.2, "tvm_version": "0.10.0"}
{"input": ["cuda -keys=cuda,gpu -arch=sm_86 -max_num_threads=1024 -thread_warp_size=32", "conv2d_nchw.cuda", [["TENSOR", [1, 1024, 14, 14], "float32"], ["TENSOR", [2048, 1024, 1, 1], "float32"], [2, 2], [0, 0, 0, 0], [1, 1], "float32"], {}], "config": {"index": 2913, "code_hash": null, "entity": [["tile_f", "sp", [-1, 2, 1, 1]], ["tile_y", "sp", [-1, 1, 1, 1]], ["tile_x", "sp", [-1, 1, 7, 1]], ["tile_rc", "sp", [-1, 1]], ["tile_ry", "sp", [-1, 1]], ["tile_rx", "sp", [-1, 1]], ["auto_unroll_max_step", "ot", 0], ["unroll_explicit", "ot", 0]]}, "result": [[0.0012150438554216867, 0.0012151672168674698, 0.0012151672168674698], 0, 1.2075257301330566, 1679298284.7412999], "version": 0.2, "tvm_version": "0.10.0"}
{"input": ["cuda -keys=cuda,gpu -arch=sm_86 -max_num_threads=1024 -thread_warp_size=32", "conv2d_nchw.cuda", [["TENSOR", [1, 1024, 14, 14], "float32"], ["TENSOR", [2048, 1024, 1, 1], "float32"], [2, 2], [0, 0, 0, 0], [1, 1], "float32"], {}], "config": {"index": 131040, "code_hash": null, "entity": [["tile_f", "sp", [-1, 1, 1, 1]], ["tile_y", "sp", [-1, 1, 1, 1]], ["tile_x", "sp", [-1, 1, 7, 1]], ["tile_rc", "sp", [-1, 1]], ["tile_ry", "sp", [-1, 1]], ["tile_rx", "sp", [-1, 1]], ["auto_unroll_max_step", "ot", 1500], ["unroll_explicit", "ot", 0]]}, "result": [[0.002170531404255319, 0.002170727489361702, 0.0021723397234042555], 0, 1.2115623950958252, 1679298285.609012], "version": 0.2, "tvm_version": "0.10.0"}
{"input": ["cuda -keys=cuda,gpu -arch=sm_86 -max_num_threads=1024 -thread_warp_size=32", "conv2d_nchw.cuda", [["TENSOR", [1, 1024, 14, 14], "float32"], ["TENSOR", [2048, 1024, 1, 1], "float32"], [2, 2], [0, 0, 0, 0], [1, 1], "float32"], {}], "config": {"index": 32032, "code_hash": null, "entity": [["tile_f", "sp", [-1, 1, 1, 1]], ["tile_y", "sp", [-1, 1, 1, 1]], ["tile_x", "sp", [-1, 1, 7, 1]], ["tile_rc", "sp", [-1, 32]], ["tile_ry", "sp", [-1, 1]], ["tile_rx", "sp", [-1, 1]], ["auto_unroll_max_step", "ot", 0], ["unroll_explicit", "ot", 0]]}, "result": [[0.001702912, 0.0017107103833333334, 0.0017107796833333334], 0, 1.2747974395751953, 1679298286.4843607], "version": 0.2, "tvm_version": "0.10.0"}
{"input": ["cuda -keys=cuda,gpu -arch=sm_86 -max_num_threads=1024 -thread_warp_size=32", "conv2d_nchw.cuda", [["TENSOR", [1, 1024, 14, 14], "float32"], ["TENSOR", [2048, 1024, 1, 1], "float32"], [2, 2], [0, 0, 0, 0], [1, 1], "float32"], {}], "config": {"index": 2917, "code_hash": null, "entity": [["tile_f", "sp", [-1, 32, 1, 1]], ["tile_y", "sp", [-1, 1, 1, 1]], ["tile_x", "sp", [-1, 1, 7, 1]], ["tile_rc", "sp", [-1, 1]], ["tile_ry", "sp", [-1, 1]], ["tile_rx", "sp", [-1, 1]], ["auto_unroll_max_step", "ot", 0], ["unroll_explicit", "ot", 0]]}, "result": [[0.0003738782314814815, 0.0003738851898148148, 0.000373895113425926], 0, 1.6252551078796387, 1679298287.741041], "version": 0.2, "tvm_version": "0.10.0"}
{"input": ["cuda -keys=cuda,gpu -arch=sm_86 -max_num_threads=1024 -thread_warp_size=32", "conv2d_nchw.cuda", [["TENSOR", [1, 1024, 14, 14], "float32"], ["TENSOR", [2048, 1024, 1, 1], "float32"], [2, 2], [0, 0, 0, 0], [1, 1], "float32"], {}], "config": {"index": 37856, "code_hash": null, "entity": [["tile_f", "sp", [-1, 1, 1, 1]], ["tile_y", "sp", [-1, 1, 1, 1]], ["tile_x", "sp", [-1, 1, 7, 1]], ["tile_rc", "sp", [-1, 64]], ["tile_ry", "sp", [-1, 1]], ["tile_rx", "sp", [-1, 1]], ["auto_unroll_max_step", "ot", 0], ["unroll_explicit", "ot", 0]]}, "result": [[0.0022949948636363637, 0.0022955055227272727, 0.0023076305227272727], 0, 1.24696683883667, 1679298288.6047332], "version": 0.2, "tvm_version": "0.10.0"}
{"input": ["cuda -keys=cuda,gpu -arch=sm_86 -max_num_threads=1024 -thread_warp_size=32", "conv2d_nchw.cuda", [["TENSOR", [1, 1024, 14, 14], "float32"], ["TENSOR", [2048, 1024, 1, 1], "float32"], [2, 2], [0, 0, 0, 0], [1, 1], "float32"], {}], "config": {"index": 3640, "code_hash": null, "entity": [["tile_f", "sp", [-1, 1, 1, 1]], ["tile_y", "sp", [-1, 1, 7, 1]], ["tile_x", "sp", [-1, 1, 7, 1]], ["tile_rc", "sp", [-1, 1]], ["tile_ry", "sp", [-1, 1]], ["tile_rx", "sp", [-1, 1]], ["auto_unroll_max_step", "ot", 0], ["unroll_explicit", "ot", 0]]}, "result": [[0.0009556791308411214, 0.0009595550093457944, 0.0009596315140186916], 0, 1.2017321586608887, 1679298289.4672253], "version": 0.2, "tvm_version": "0.10.0"}
{"input": ["cuda -keys=cuda,gpu -arch=sm_86 -max_num_threads=1024 -thread_warp_size=32", "conv2d_nchw.cuda", [["TENSOR", [1, 1024, 14, 14], "float32"], ["TENSOR", [2048, 1024, 1, 1], "float32"], [2, 2], [0, 0, 0, 0], [1, 1], "float32"], {}], "config": {"index": 2918, "code_hash": null, "entity": [["tile_f", "sp", [-1, 64, 1, 1]], ["tile_y", "sp", [-1, 1, 1, 1]], ["tile_x", "sp", [-1, 1, 7, 1]], ["tile_rc", "sp", [-1, 1]], ["tile_ry", "sp", [-1, 1]], ["tile_rx", "sp", [-1, 1]], ["auto_unroll_max_step", "ot", 0], ["unroll_explicit", "ot", 0]]}, "result": [[0.0004202891592689295, 0.00042031055352480414, 0.00042032127154046994], 0, 1.645294427871704, 1679298290.7176309], "version": 0.2, "tvm_version": "0.10.0"}
{"input": ["cuda -keys=cuda,gpu -arch=sm_86 -max_num_threads=1024 -thread_warp_size=32", "conv2d_nchw.cuda", [["TENSOR", [1, 1024, 14, 14], "float32"], ["TENSOR", [2048, 1024, 1, 1], "float32"], [2, 2], [0, 0, 0, 0], [1, 1], "float32"], {}], "config": {"index": 43680, "code_hash": null, "entity": [["tile_f", "sp", [-1, 1, 1, 1]], ["tile_y", "sp", [-1, 1, 1, 1]], ["tile_x", "sp", [-1, 1, 7, 1]], ["tile_rc", "sp", [-1, 128]], ["tile_ry", "sp", [-1, 1]], ["tile_rx", "sp", [-1, 1]], ["auto_unroll_max_step", "ot", 0], ["unroll_explicit", "ot", 0]]}, "result": [[0.0028363662222222223, 0.0028363929166666667, 0.002836565222222222], 0, 1.25286865234375, 1679298291.589108], "version": 0.2, "tvm_version": "0.10.0"}
{"input": ["cuda -keys=cuda,gpu -arch=sm_86 -max_num_threads=1024 -thread_warp_size=32", "conv2d_nchw.cuda", [["TENSOR", [1, 1024, 14, 14], "float32"], ["TENSOR", [2048, 1024, 1, 1], "float32"], [2, 2], [0, 0, 0, 0], [1, 1], "float32"], {}], "config": {"index": 4004, "code_hash": null, "entity": [["tile_f", "sp", [-1, 1, 1, 1]], ["tile_y", "sp", [-1, 1, 1, 7]], ["tile_x", "sp", [-1, 1, 7, 1]], ["tile_rc", "sp", [-1, 1]], ["tile_ry", "sp", [-1, 1]], ["tile_rx", "sp", [-1, 1]], ["auto_unroll_max_step", "ot", 0], ["unroll_explicit", "ot", 0]]}, "result": [[0.004617762818181818, 0.0046177745909090915, 0.0046180072727272726], 0, 1.224501609802246, 1679298292.4511733], "version": 0.2, "tvm_version": "0.10.0"}
{"input": ["cuda -keys=cuda,gpu -arch=sm_86 -max_num_threads=1024 -thread_warp_size=32", "conv2d_nchw.cuda", [["TENSOR", [1, 1024, 14, 14], "float32"], ["TENSOR", [2048, 1024, 1, 1], "float32"], [2, 2], [0, 0, 0, 0], [1, 1], "float32"], {}], "config": {"index": 2919, "code_hash": null, "entity": [["tile_f", "sp", [-1, 128, 1, 1]], ["tile_y", "sp", [-1, 1, 1, 1]], ["tile_x", "sp", [-1, 1, 7, 1]], ["tile_rc", "sp", [-1, 1]], ["tile_ry", "sp", [-1, 1]], ["tile_rx", "sp", [-1, 1]], ["auto_unroll_max_step", "ot", 0], ["unroll_explicit", "ot", 0]]}, "result": [[0.0006689382400000001, 0.0006689450533333333, 0.0006689859999999999], 0, 1.3192670345306396, 1679298293.3004978], "version": 0.2, "tvm_version": "0.10.0"}
{"input": ["cuda -keys=cuda,gpu -arch=sm_86 -max_num_threads=1024 -thread_warp_size=32", "conv2d_nchw.cuda", [["TENSOR", [1, 1024, 14, 14], "float32"], ["TENSOR", [2048, 1024, 1, 1], "float32"], [2, 2], [0, 0, 0, 0], [1, 1], "float32"], {}], "config": {"index": 49504, "code_hash": null, "entity": [["tile_f", "sp", [-1, 1, 1, 1]], ["tile_y", "sp", [-1, 1, 1, 1]], ["tile_x", "sp", [-1, 1, 7, 1]], ["tile_rc", "sp", [-1, 256]], ["tile_ry", "sp", [-1, 1]], ["tile_rx", "sp", [-1, 1]], ["auto_unroll_max_step", "ot", 0], ["unroll_explicit", "ot", 0]]}, "result": [[0.003813527703703704, 0.0038141725185185187, 0.003814394037037037], 0, 1.2784876823425293, 1679298294.175175], "version": 0.2, "tvm_version": "0.10.0"}
{"input": ["cuda -keys=cuda,gpu -arch=sm_86 -max_num_threads=1024 -thread_warp_size=32", "conv2d_nchw.cuda", [["TENSOR", [1, 1024, 14, 14], "float32"], ["TENSOR", [2048, 1024, 1, 1], "float32"], [2, 2], [0, 0, 0, 0], [1, 1], "float32"], {}], "config": {"index": 2920, "code_hash": null, "entity": [["tile_f", "sp", [-1, 256, 1, 1]], ["tile_y", "sp", [-1, 1, 1, 1]], ["tile_x", "sp", [-1, 1, 7, 1]], ["tile_rc", "sp", [-1, 1]], ["tile_ry", "sp", [-1, 1]], ["tile_rx", "sp", [-1, 1]], ["auto_unroll_max_step", "ot", 0], ["unroll_explicit", "ot", 0]]}, "result": [[0.0029683952058823532, 0.002968425294117647, 0.0029684555882352943], 0, 1.4715886116027832, 1679298295.0438883], "version": 0.2, "tvm_version": "0.10.0"}
{"input": ["cuda -keys=cuda,gpu -arch=sm_86 -max_num_threads=1024 -thread_warp_size=32", "conv2d_nchw.cuda", [["TENSOR", [1, 1024, 14, 14], "float32"], ["TENSOR", [2048, 1024, 1, 1], "float32"], [2, 2], [0, 0, 0, 0], [1, 1], "float32"], {}], "config": {"index": 195109, "code_hash": null, "entity": [["tile_f", "sp", [-1, 32, 1, 1]], ["tile_y", "sp", [-1, 1, 1, 1]], ["tile_x", "sp", [-1, 1, 7, 1]], ["tile_rc", "sp", [-1, 1]], ["tile_ry", "sp", [-1, 1]], ["tile_rx", "sp", [-1, 1]], ["auto_unroll_max_step", "ot", 0], ["unroll_explicit", "ot", 1]]}, "result": [[0.00037387141435185183, 0.0003738971273148148, 0.0003739022129629629], 0, 1.5917799472808838, 1679298296.9170249], "version": 0.2, "tvm_version": "0.10.0"}
{"input": ["cuda -keys=cuda,gpu -arch=sm_86 -max_num_threads=1024 -thread_warp_size=32", "conv2d_nchw.cuda", [["TENSOR", [1, 1024, 14, 14], "float32"], ["TENSOR", [2048, 1024, 1, 1], "float32"], [2, 2], [0, 0, 0, 0], [1, 1], "float32"], {}], "config": {"index": 66981, "code_hash": null, "entity": [["tile_f", "sp", [-1, 32, 1, 1]], ["tile_y", "sp", [-1, 1, 1, 1]], ["tile_x", "sp", [-1, 1, 7, 1]], ["tile_rc", "sp", [-1, 1]], ["tile_ry", "sp", [-1, 1]], ["tile_rx", "sp", [-1, 1]], ["auto_unroll_max_step", "ot", 512], ["unroll_explicit", "ot", 0]]}, "result": [[0.0003739136226851852, 0.0003739140810185185, 0.0003739306828703704], 0, 1.5971741676330566, 1679298298.166052], "version": 0.2, "tvm_version": "0.10.0"}
{"input": ["cuda -keys=cuda,gpu -arch=sm_86 -max_num_threads=1024 -thread_warp_size=32", "conv2d_nchw.cuda", [["TENSOR", [1, 1024, 14, 14], "float32"], ["TENSOR", [2048, 1024, 1, 1], "float32"], [2, 2], [0, 0, 0, 0], [1, 1], "float32"], {}], "config": {"index": 8741, "code_hash": null, "entity": [["tile_f", "sp", [-1, 32, 1, 1]], ["tile_y", "sp", [-1, 1, 1, 1]], ["tile_x", "sp", [-1, 1, 7, 1]], ["tile_rc", "sp", [-1, 2]], ["tile_ry", "sp", [-1, 1]], ["tile_rx", "sp", [-1, 1]], ["auto_unroll_max_step", "ot", 0], ["unroll_explicit", "ot", 0]]}, "result": [[0.00024937486089644513, 0.00024939702936630604, 0.0002494080896445131], 0, 1.628584384918213, 1679298299.4215171], "version": 0.2, "tvm_version": "0.10.0"}
{"input": ["cuda -keys=cuda,gpu -arch=sm_86 -max_num_threads=1024 -thread_warp_size=32", "conv2d_nchw.cuda", [["TENSOR", [1, 1024, 14, 14], "float32"], ["TENSOR", [2048, 1024, 1, 1], "float32"], [2, 2], [0, 0, 0, 0], [1, 1], "float32"], {}], "config": {"index": 4373, "code_hash": null, "entity": [["tile_f", "sp", [-1, 32, 1, 1]], ["tile_y", "sp", [-1, 1, 1, 1]], ["tile_x", "sp", [-1, 1, 1, 7]], ["tile_rc", "sp", [-1, 1]], ["tile_ry", "sp", [-1, 1]], ["tile_rx", "sp", [-1, 1]], ["auto_unroll_max_step", "ot", 0], ["unroll_explicit", "ot", 0]]}, "result": [[0.0007893991496062992, 0.0007894153070866142, 0.0007894153070866142], 0, 1.3270938396453857, 1679298300.2717586], "version": 0.2, "tvm_version": "0.10.0"}
{"input": ["cuda -keys=cuda,gpu -arch=sm_86 -max_num_threads=1024 -thread_warp_size=32", "conv2d_nchw.cuda", [["TENSOR", [1, 1024, 14, 14], "float32"], ["TENSOR", [2048, 1024, 1, 1], "float32"], [2, 2], [0, 0, 0, 0], [1, 1], "float32"], {}], "config": {"index": 1461, "code_hash": null, "entity": [["tile_f", "sp", [-1, 32, 1, 1]], ["tile_y", "sp", [-1, 1, 1, 1]], ["tile_x", "sp", [-1, 7, 1, 1]], ["tile_rc", "sp", [-1, 1]], ["tile_ry", "sp", [-1, 1]], ["tile_rx", "sp", [-1, 1]], ["auto_unroll_max_step", "ot", 0], ["unroll_explicit", "ot", 0]]}, "result": [[0.0007893024330708661, 0.000789318527559055, 0.0007894314094488189], 0, 1.3680963516235352, 1679298301.129167], "version": 0.2, "tvm_version": "0.10.0"}
{"input": ["cuda -keys=cuda,gpu -arch=sm_86 -max_num_threads=1024 -thread_warp_size=32", "conv2d_nchw.cuda", [["TENSOR", [1, 1024, 14, 14], "float32"], ["TENSOR", [2048, 1024, 1, 1], "float32"], [2, 2], [0, 0, 0, 0], [1, 1], "float32"], {}], "config": {"index": 3281, "code_hash": null, "entity": [["tile_f", "sp", [-1, 32, 1, 1]], ["tile_y", "sp", [-1, 7, 1, 1]], ["tile_x", "sp", [-1, 1, 7, 1]], ["tile_rc", "sp", [-1, 1]], ["tile_ry", "sp", [-1, 1]], ["tile_rx", "sp", [-1, 1]], ["auto_unroll_max_step", "ot", 0], ["unroll_explicit", "ot", 0]]}, "result": [[0.0034603784482758622, 0.003460484448275862, 0.003460554965517241], 0, 1.3294789791107178, 1679298301.9662623], "version": 0.2, "tvm_version": "0.10.0"}
{"input": ["cuda -keys=cuda,gpu -arch=sm_86 -max_num_threads=1024 -thread_warp_size=32", "conv2d_nchw.cuda", [["TENSOR", [1, 1024, 14, 14], "float32"], ["TENSOR", [2048, 1024, 1, 1], "float32"], [2, 2], [0, 0, 0, 0], [1, 1], "float32"], {}], "config": {"index": 2916, "code_hash": null, "entity": [["tile_f", "sp", [-1, 16, 1, 1]], ["tile_y", "sp", [-1, 1, 1, 1]], ["tile_x", "sp", [-1, 1, 7, 1]], ["tile_rc", "sp", [-1, 1]], ["tile_ry", "sp", [-1, 1]], ["tile_rx", "sp", [-1, 1]], ["auto_unroll_max_step", "ot", 0], ["unroll_explicit", "ot", 0]]}, "result": [[0.0003695207293577982, 0.0003695230733944954, 0.00036955597018348626], 0, 1.5757102966308594, 1679298303.2138915], "version": 0.2, "tvm_version": "0.10.0"}
{"input": ["cuda -keys=cuda,gpu -arch=sm_86 -max_num_threads=1024 -thread_warp_size=32", "conv2d_nchw.cuda", [["TENSOR", [1, 1024, 14, 14], "float32"], ["TENSOR", [2048, 1024, 1, 1], "float32"], [2, 2], [0, 0, 0, 0], [1, 1], "float32"], {}], "config": {"index": 2926, "code_hash": null, "entity": [["tile_f", "sp", [-1, 4, 2, 1]], ["tile_y", "sp", [-1, 1, 1, 1]], ["tile_x", "sp", [-1, 1, 7, 1]], ["tile_rc", "sp", [-1, 1]], ["tile_ry", "sp", [-1, 1]], ["tile_rx", "sp", [-1, 1]], ["auto_unroll_max_step", "ot", 0], ["unroll_explicit", "ot", 0]]}, "result": [[0.0004144140796915167, 0.0004144699357326478, 0.0004144804473007712], 0, 1.5974452495574951, 1679298304.472911], "version": 0.2, "tvm_version": "0.10.0"}
{"input": ["cuda -keys=cuda,gpu -arch=sm_86 -max_num_threads=1024 -thread_warp_size=32", "conv2d_nchw.cuda", [["TENSOR", [1, 1024, 14, 14], "float32"], ["TENSOR", [2048, 1024, 1, 1], "float32"], [2, 2], [0, 0, 0, 0], [1, 1], "float32"], {}], "config": {"index": 5, "code_hash": null, "entity": [["tile_f", "sp", [-1, 32, 1, 1]], ["tile_y", "sp", [-1, 1, 1, 1]], ["tile_x", "sp", [-1, 1, 1, 1]], ["tile_rc", "sp", [-1, 1]], ["tile_ry", "sp", [-1, 1]], ["tile_rx", "sp", [-1, 1]], ["auto_unroll_max_step", "ot", 0], ["unroll_explicit", "ot", 0]]}, "result": [[0.002769725655172414, 0.0027719502931034487, 0.002772956568965517], 0, 1.63655686378479, 1679298305.7567725], "version": 0.2, "tvm_version": "0.10.0"}
{"input": ["cuda -keys=cuda,gpu -arch=sm_86 -max_num_threads=1024 -thread_warp_size=32", "conv2d_nchw.cuda", [["TENSOR", [1, 1024, 14, 14], "float32"], ["TENSOR", [2048, 1024, 1, 1], "float32"], [2, 2], [0, 0, 0, 0], [1, 1], "float32"], {}], "config": {"index": 3645, "code_hash": null, "entity": [["tile_f", "sp", [-1, 32, 1, 1]], ["tile_y", "sp", [-1, 1, 7, 1]], ["tile_x", "sp", [-1, 1, 7, 1]], ["tile_rc", "sp", [-1, 1]], ["tile_ry", "sp", [-1, 1]], ["tile_rx", "sp", [-1, 1]], ["auto_unroll_max_step", "ot", 0], ["unroll_explicit", "ot", 0]]}, "result": [[0.00041001169720101784, 0.00041003515012722646, 0.0004100606972010178], 0, 1.5977330207824707, 1679298307.0135624], "version": 0.2, "tvm_version": "0.10.0"}
{"input": ["cuda -keys=cuda,gpu -arch=sm_86 -max_num_threads=1024 -thread_warp_size=32", "conv2d_nchw.cuda", [["TENSOR", [1, 1024, 14, 14], "float32"], ["TENSOR", [2048, 1024, 1, 1], "float32"], [2, 2], [0, 0, 0, 0], [1, 1], "float32"], {}], "config": {"index": 2927, "code_hash": null, "entity": [["tile_f", "sp", [-1, 8, 2, 1]], ["tile_y", "sp", [-1, 1, 1, 1]], ["tile_x", "sp", [-1, 1, 7, 1]], ["tile_rc", "sp", [-1, 1]], ["tile_ry", "sp", [-1, 1]], ["tile_rx", "sp", [-1, 1]], ["auto_unroll_max_step", "ot", 0], ["unroll_explicit", "ot", 0]]}, "result": [[0.00033549226041666664, 0.00033549865, 0.00033551365416666665], 0, 1.6096673011779785, 1679298308.271117], "version": 0.2, "tvm_version": "0.10.0"}
{"input": ["cuda -keys=cuda,gpu -arch=sm_86 -max_num_threads=1024 -thread_warp_size=32", "conv2d_nchw.cuda", [["TENSOR", [1, 1024, 14, 14], "float32"], ["TENSOR", [2048, 1024, 1, 1], "float32"], [2, 2], [0, 0, 0, 0], [1, 1], "float32"], {}], "config": {"index": 131045, "code_hash": null, "entity": [["tile_f", "sp", [-1, 32, 1, 1]], ["tile_y", "sp", [-1, 1, 1, 1]], ["tile_x", "sp", [-1, 1, 7, 1]], ["tile_rc", "sp", [-1, 1]], ["tile_ry", "sp", [-1, 1]], ["tile_rx", "sp", [-1, 1]], ["auto_unroll_max_step", "ot", 1500], ["unroll_explicit", "ot", 0]]}, "result": [[0.00037390458101851855, 0.0003739259143518519, 0.00037393541666666665], 0, 1.5505239963531494, 1679298309.5339239], "version": 0.2, "tvm_version": "0.10.0"}
{"input": ["cuda -keys=cuda,gpu -arch=sm_86 -max_num_threads=1024 -thread_warp_size=32", "conv2d_nchw.cuda", [["TENSOR", [1, 1024, 14, 14], "float32"], ["TENSOR", [2048, 1024, 1, 1], "float32"], [2, 2], [0, 0, 0, 0], [1, 1], "float32"], {}], "config": {"index": 4009, "code_hash": null, "entity": [["tile_f", "sp", [-1, 32, 1, 1]], ["tile_y", "sp", [-1, 1, 1, 7]], ["tile_x", "sp", [-1, 1, 7, 1]], ["tile_rc", "sp", [-1, 1]], ["tile_ry", "sp", [-1, 1]], ["tile_rx", "sp", [-1, 1]], ["auto_unroll_max_step", "ot", 0], ["unroll_explicit", "ot", 0]]}, "result": [[0.003460272413793103, 0.0034604492068965515, 0.003460519724137931], 0, 1.3487589359283447, 1679298310.3967268], "version": 0.2, "tvm_version": "0.10.0"}
{"input": ["cuda -keys=cuda,gpu -arch=sm_86 -max_num_threads=1024 -thread_warp_size=32", "conv2d_nchw.cuda", [["TENSOR", [1, 1024, 14, 14], "float32"], ["TENSOR", [2048, 1024, 1, 1], "float32"], [2, 2], [0, 0, 0, 0], [1, 1], "float32"], {}], "config": {"index": 2928, "code_hash": null, "entity": [["tile_f", "sp", [-1, 16, 2, 1]], ["tile_y", "sp", [-1, 1, 1, 1]], ["tile_x", "sp", [-1, 1, 7, 1]], ["tile_rc", "sp", [-1, 1]], ["tile_ry", "sp", [-1, 1]], ["tile_rx", "sp", [-1, 1]], ["auto_unroll_max_step", "ot", 0], ["unroll_explicit", "ot", 0]]}, "result": [[0.00035981445683453236, 0.0003598181330935252, 0.000359854964028777], 0, 1.105708122253418, 1679298311.2307181], "version": 0.2, "tvm_version": "0.10.0"}
{"input": ["cuda -keys=cuda,gpu -arch=sm_86 -max_num_threads=1024 -thread_warp_size=32", "conv2d_nchw.cuda", [["TENSOR", [1, 1024, 14, 14], "float32"], ["TENSOR", [2048, 1024, 1, 1], "float32"], [2, 2], [0, 0, 0, 0], [1, 1], "float32"], {}], "config": {"index": 200933, "code_hash": null, "entity": [["tile_f", "sp", [-1, 32, 1, 1]], ["tile_y", "sp", [-1, 1, 1, 1]], ["tile_x", "sp", [-1, 1, 7, 1]], ["tile_rc", "sp", [-1, 2]], ["tile_ry", "sp", [-1, 1]], ["tile_rx", "sp", [-1, 1]], ["auto_unroll_max_step", "ot", 0], ["unroll_explicit", "ot", 1]]}, "result": [[0.00024936869362363913, 0.0002493814136858476, 0.0002494146594090202], 0, 1.6163098812103271, 1679298313.2274234], "version": 0.2, "tvm_version": "0.10.0"}
{"input": ["cuda -keys=cuda,gpu -arch=sm_86 -max_num_threads=1024 -thread_warp_size=32", "conv2d_nchw.cuda", [["TENSOR", [1, 1024, 14, 14], "float32"], ["TENSOR", [2048, 1024, 1, 1], "float32"], [2, 2], [0, 0, 0, 0], [1, 1], "float32"], {}], "config": {"index": 72805, "code_hash": null, "entity": [["tile_f", "sp", [-1, 32, 1, 1]], ["tile_y", "sp", [-1, 1, 1, 1]], ["tile_x", "sp", [-1, 1, 7, 1]], ["tile_rc", "sp", [-1, 2]], ["tile_ry", "sp", [-1, 1]], ["tile_rx", "sp", [-1, 1]], ["auto_unroll_max_step", "ot", 512], ["unroll_explicit", "ot", 0]]}, "result": [[0.00024934638724727836, 0.00024937491135303266, 0.0002494005396578538], 0, 1.6326994895935059, 1679298314.4815323], "version": 0.2, "tvm_version": "0.10.0"}
{"input": ["cuda -keys=cuda,gpu -arch=sm_86 -max_num_threads=1024 -thread_warp_size=32", "conv2d_nchw.cuda", [["TENSOR", [1, 1024, 14, 14], "float32"], ["TENSOR", [2048, 1024, 1, 1], "float32"], [2, 2], [0, 0, 0, 0], [1, 1], "float32"], {}], "config": {"index": 14565, "code_hash": null, "entity": [["tile_f", "sp", [-1, 32, 1, 1]], ["tile_y", "sp", [-1, 1, 1, 1]], ["tile_x", "sp", [-1, 1, 7, 1]], ["tile_rc", "sp", [-1, 4]], ["tile_ry", "sp", [-1, 1]], ["tile_rx", "sp", [-1, 1]], ["auto_unroll_max_step", "ot", 0], ["unroll_explicit", "ot", 0]]}, "result": [[0.0002250999732770745, 0.00022511171308016879, 0.00022511716315049224], 0, 1.7121641635894775, 1679298315.7287624], "version": 0.2, "tvm_version": "0.10.0"}
{"input": ["cuda -keys=cuda,gpu -arch=sm_86 -max_num_threads=1024 -thread_warp_size=32", "conv2d_nchw.cuda", [["TENSOR", [1, 1024, 14, 14], "float32"], ["TENSOR", [2048, 1024, 1, 1], "float32"], [2, 2], [0, 0, 0, 0], [1, 1], "float32"], {}], "config": {"index": 10197, "code_hash": null, "entity": [["tile_f", "sp", [-1, 32, 1, 1]], ["tile_y", "sp", [-1, 1, 1, 1]], ["tile_x", "sp", [-1, 1, 1, 7]], ["tile_rc", "sp", [-1, 2]], ["tile_ry", "sp", [-1, 1]], ["tile_rx", "sp", [-1, 1]], ["auto_unroll_max_step", "ot", 0], ["unroll_explicit", "ot", 0]]}, "result": [[0.0007441540462962963, 0.0007441635833333334, 0.0007442915879629629], 0, 1.880157709121704, 1679298316.9886968], "version": 0.2, "tvm_version": "0.10.0"}
{"input": ["cuda -keys=cuda,gpu -arch=sm_86 -max_num_threads=1024 -thread_warp_size=32", "conv2d_nchw.cuda", [["TENSOR", [1, 1024, 14, 14], "float32"], ["TENSOR", [2048, 1024, 1, 1], "float32"], [2, 2], [0, 0, 0, 0], [1, 1], "float32"], {}], "config": {"index": 7285, "code_hash": null, "entity": [["tile_f", "sp", [-1, 32, 1, 1]], ["tile_y", "sp", [-1, 1, 1, 1]], ["tile_x", "sp", [-1, 7, 1, 1]], ["tile_rc", "sp", [-1, 2]], ["tile_ry", "sp", [-1, 1]], ["tile_rx", "sp", [-1, 1]], ["auto_unroll_max_step", "ot", 0], ["unroll_explicit", "ot", 0]]}, "result": [[0.0007441683148148149, 0.0007442108425925925, 0.000744433787037037], 0, 1.885995626449585, 1679298318.2365053], "version": 0.2, "tvm_version": "0.10.0"}
{"input": ["cuda -keys=cuda,gpu -arch=sm_86 -max_num_threads=1024 -thread_warp_size=32", "conv2d_nchw.cuda", [["TENSOR", [1, 1024, 14, 14], "float32"], ["TENSOR", [2048, 1024, 1, 1], "float32"], [2, 2], [0, 0, 0, 0], [1, 1], "float32"], {}], "config": {"index": 9105, "code_hash": null, "entity": [["tile_f", "sp", [-1, 32, 1, 1]], ["tile_y", "sp", [-1, 7, 1, 1]], ["tile_x", "sp", [-1, 1, 7, 1]], ["tile_rc", "sp", [-1, 2]], ["tile_ry", "sp", [-1, 1]], ["tile_rx", "sp", [-1, 1]], ["auto_unroll_max_step", "ot", 0], ["unroll_explicit", "ot", 0]]}, "result": [[0.0035303636551724136, 0.0035305401724137933, 0.0035305754482758624], 0, 1.4568698406219482, 1679298319.1020691], "version": 0.2, "tvm_version": "0.10.0"}
{"input": ["cuda -keys=cuda,gpu -arch=sm_86 -max_num_threads=1024 -thread_warp_size=32", "conv2d_nchw.cuda", [["TENSOR", [1, 1024, 14, 14], "float32"], ["TENSOR", [2048, 1024, 1, 1], "float32"], [2, 2], [0, 0, 0, 0], [1, 1], "float32"], {}], "config": {"index": 8742, "code_hash": null, "entity": [["tile_f", "sp", [-1, 64, 1, 1]], ["tile_y", "sp", [-1, 1, 1, 1]], ["tile_x", "sp", [-1, 1, 7, 1]], ["tile_rc", "sp", [-1, 2]], ["tile_ry", "sp", [-1, 1]], ["tile_rx", "sp", [-1, 1]], ["auto_unroll_max_step", "ot", 0], ["unroll_explicit", "ot", 0]]}, "result": [[0.0004143593598971722, 0.0004143616735218509, 0.0004143904652956298], 0, 1.711920976638794, 1679298320.357036], "version": 0.2, "tvm_version": "0.10.0"}
{"input": ["cuda -keys=cuda,gpu -arch=sm_86 -max_num_threads=1024 -thread_warp_size=32", "conv2d_nchw.cuda", [["TENSOR", [1, 1024, 14, 14], "float32"], ["TENSOR", [2048, 1024, 1, 1], "float32"], [2, 2], [0, 0, 0, 0], [1, 1], "float32"], {}], "config": {"index": 8740, "code_hash": null, "entity": [["tile_f", "sp", [-1, 16, 1, 1]], ["tile_y", "sp", [-1, 1, 1, 1]], ["tile_x", "sp", [-1, 1, 7, 1]], ["tile_rc", "sp", [-1, 2]], ["tile_ry", "sp", [-1, 1]], ["tile_rx", "sp", [-1, 1]], ["auto_unroll_max_step", "ot", 0], ["unroll_explicit", "ot", 0]]}, "result": [[0.00024562201225114853, 0.00024564199081163863, 0.0002456470842266462], 0, 1.6368799209594727, 1679298321.6033206], "version": 0.2, "tvm_version": "0.10.0"}
{"input": ["cuda -keys=cuda,gpu -arch=sm_86 -max_num_threads=1024 -thread_warp_size=32", "conv2d_nchw.cuda", [["TENSOR", [1, 1024, 14, 14], "float32"], ["TENSOR", [2048, 1024, 1, 1], "float32"], [2, 2], [0, 0, 0, 0], [1, 1], "float32"], {}], "config": {"index": 8753, "code_hash": null, "entity": [["tile_f", "sp", [-1, 32, 2, 1]], ["tile_y", "sp", [-1, 1, 1, 1]], ["tile_x", "sp", [-1, 1, 7, 1]], ["tile_rc", "sp", [-1, 2]], ["tile_ry", "sp", [-1, 1]], ["tile_rx", "sp", [-1, 1]], ["auto_unroll_max_step", "ot", 0], ["unroll_explicit", "ot", 0]]}, "result": [[0.0002595385169628433, 0.0002595464054927302, 0.0002595666187399031], 0, 1.6679894924163818, 1679298322.8611739], "version": 0.2, "tvm_version": "0.10.0"}
{"input": ["cuda -keys=cuda,gpu -arch=sm_86 -max_num_threads=1024 -thread_warp_size=32", "conv2d_nchw.cuda", [["TENSOR", [1, 1024, 14, 14], "float32"], ["TENSOR", [2048, 1024, 1, 1], "float32"], [2, 2], [0, 0, 0, 0], [1, 1], "float32"], {}], "config": {"index": 20389, "code_hash": null, "entity": [["tile_f", "sp", [-1, 32, 1, 1]], ["tile_y", "sp", [-1, 1, 1, 1]], ["tile_x", "sp", [-1, 1, 7, 1]], ["tile_rc", "sp", [-1, 8]], ["tile_ry", "sp", [-1, 1]], ["tile_rx", "sp", [-1, 1]], ["auto_unroll_max_step", "ot", 0], ["unroll_explicit", "ot", 0]]}, "result": [[0.0007262385797101449, 0.0007262608623188406, 0.0007263276449275362], 0, 1.322361946105957, 1679298323.7104394], "version": 0.2, "tvm_version": "0.10.0"}
{"input": ["cuda -keys=cuda,gpu -arch=sm_86 -max_num_threads=1024 -thread_warp_size=32", "conv2d_nchw.cuda", [["TENSOR", [1, 1024, 14, 14], "float32"], ["TENSOR", [2048, 1024, 1, 1], "float32"], [2, 2], [0, 0, 0, 0], [1, 1], "float32"], {}], "config": {"index": 8754, "code_hash": null, "entity": [["tile_f", "sp", [-1, 64, 2, 1]], ["tile_y", "sp", [-1, 1, 1, 1]], ["tile_x", "sp", [-1, 1, 7, 1]], ["tile_rc", "sp", [-1, 2]], ["tile_ry", "sp", [-1, 1]], ["tile_rx", "sp", [-1, 1]], ["auto_unroll_max_step", "ot", 0], ["unroll_explicit", "ot", 0]]}, "result": [[0.0003964721206896552, 0.00039648726847290634, 0.00039653518719211825], 0, 1.734311819076538, 1679298324.9644446], "version": 0.2, "tvm_version": "0.10.0"}
{"input": ["cuda -keys=cuda,gpu -arch=sm_86 -max_num_threads=1024 -thread_warp_size=32", "conv2d_nchw.cuda", [["TENSOR", [1, 1024, 14, 14], "float32"], ["TENSOR", [2048, 1024, 1, 1], "float32"], [2, 2], [0, 0, 0, 0], [1, 1], "float32"], {}], "config": {"index": 136869, "code_hash": null, "entity": [["tile_f", "sp", [-1, 32, 1, 1]], ["tile_y", "sp", [-1, 1, 1, 1]], ["tile_x", "sp", [-1, 1, 7, 1]], ["tile_rc", "sp", [-1, 2]], ["tile_ry", "sp", [-1, 1]], ["tile_rx", "sp", [-1, 1]], ["auto_unroll_max_step", "ot", 1500], ["unroll_explicit", "ot", 0]]}, "result": [[0.0002493775031152648, 0.00024938068691588783, 0.0002493994158878505], 0, 1.6570343971252441, 1679298326.2163427], "version": 0.2, "tvm_version": "0.10.0"}
{"input": ["cuda -keys=cuda,gpu -arch=sm_86 -max_num_threads=1024 -thread_warp_size=32", "conv2d_nchw.cuda", [["TENSOR", [1, 1024, 14, 14], "float32"], ["TENSOR", [2048, 1024, 1, 1], "float32"], [2, 2], [0, 0, 0, 0], [1, 1], "float32"], {}], "config": {"index": 26213, "code_hash": null, "entity": [["tile_f", "sp", [-1, 32, 1, 1]], ["tile_y", "sp", [-1, 1, 1, 1]], ["tile_x", "sp", [-1, 1, 7, 1]], ["tile_rc", "sp", [-1, 16]], ["tile_ry", "sp", [-1, 1]], ["tile_rx", "sp", [-1, 1]], ["auto_unroll_max_step", "ot", 0], ["unroll_explicit", "ot", 0]]}, "result": [[0.0009488712452830189, 0.0009488896698113208, 0.0009488905377358491], 0, 1.273972511291504, 1679298327.0660334], "version": 0.2, "tvm_version": "0.10.0"}
{"input": ["cuda -keys=cuda,gpu -arch=sm_86 -max_num_threads=1024 -thread_warp_size=32", "conv2d_nchw.cuda", [["TENSOR", [1, 1024, 14, 14], "float32"], ["TENSOR", [2048, 1024, 1, 1], "float32"], [2, 2], [0, 0, 0, 0], [1, 1], "float32"], {}], "config": {"index": 5829, "code_hash": null, "entity": [["tile_f", "sp", [-1, 32, 1, 1]], ["tile_y", "sp", [-1, 1, 1, 1]], ["tile_x", "sp", [-1, 1, 1, 1]], ["tile_rc", "sp", [-1, 2]], ["tile_ry", "sp", [-1, 1]], ["tile_rx", "sp", [-1, 1]], ["auto_unroll_max_step", "ot", 0], ["unroll_explicit", "ot", 0]]}, "result": [[0.0026329466052631575, 0.0026344016052631575, 0.002634536315789474], 0, 1.296487808227539, 1679298327.9286718], "version": 0.2, "tvm_version": "0.10.0"}
{"input": ["cuda -keys=cuda,gpu -arch=sm_86 -max_num_threads=1024 -thread_warp_size=32", "conv2d_nchw.cuda", [["TENSOR", [1, 1024, 14, 14], "float32"], ["TENSOR", [2048, 1024, 1, 1], "float32"], [2, 2], [0, 0, 0, 0], [1, 1], "float32"], {}], "config": {"index": 9469, "code_hash": null, "entity": [["tile_f", "sp", [-1, 32, 1, 1]], ["tile_y", "sp", [-1, 1, 7, 1]], ["tile_x", "sp", [-1, 1, 7, 1]], ["tile_rc", "sp", [-1, 2]], ["tile_ry", "sp", [-1, 1]], ["tile_rx", "sp", [-1, 1]], ["auto_unroll_max_step", "ot", 0], ["unroll_explicit", "ot", 0]]}, "result": [[0.000433019, 0.0004330719437229437, 0.00043312095670995665], 0, 1.2668607234954834, 1679298328.7806244], "version": 0.2, "tvm_version": "0.10.0"}
{"input": ["cuda -keys=cuda,gpu -arch=sm_86 -max_num_threads=1024 -thread_warp_size=32", "conv2d_nchw.cuda", [["TENSOR", [1, 1024, 14, 14], "float32"], ["TENSOR", [2048, 1024, 1, 1], "float32"], [2, 2], [0, 0, 0, 0], [1, 1], "float32"], {}], "config": {"index": 8755, "code_hash": null, "entity": [["tile_f", "sp", [-1, 128, 2, 1]], ["tile_y", "sp", [-1, 1, 1, 1]], ["tile_x", "sp", [-1, 1, 7, 1]], ["tile_rc", "sp", [-1, 2]], ["tile_ry", "sp", [-1, 1]], ["tile_rx", "sp", [-1, 1]], ["auto_unroll_max_step", "ot", 0], ["unroll_explicit", "ot", 0]]}, "result": [[0.0017661484736842105, 0.0017661484736842105, 0.0017662382807017544], 0, 1.3811495304107666, 1679298329.6482108], "version": 0.2, "tvm_version": "0.10.0"}
{"input": ["cuda -keys=cuda,gpu -arch=sm_86 -max_num_threads=1024 -thread_warp_size=32", "conv2d_nchw.cuda", [["TENSOR", [1, 1024, 14, 14], "float32"], ["TENSOR", [2048, 1024, 1, 1], "float32"], [2, 2], [0, 0, 0, 0], [1, 1], "float32"], {}], "config": {"index": 206757, "code_hash": null, "entity": [["tile_f", "sp", [-1, 32, 1, 1]], ["tile_y", "sp", [-1, 1, 1, 1]], ["tile_x", "sp", [-1, 1, 7, 1]], ["tile_rc", "sp", [-1, 4]], ["tile_ry", "sp", [-1, 1]], ["tile_rx", "sp", [-1, 1]], ["auto_unroll_max_step", "ot", 0], ["unroll_explicit", "ot", 1]]}, "result": [[0.00022499771167369903, 0.0002250020253164557, 0.00022502507454289733], 0, 1.6830532550811768, 1679298331.8181481], "version": 0.2, "tvm_version": "0.10.0"}
{"input": ["cuda -keys=cuda,gpu -arch=sm_86 -max_num_threads=1024 -thread_warp_size=32", "conv2d_nchw.cuda", [["TENSOR", [1, 1024, 14, 14], "float32"], ["TENSOR", [2048, 1024, 1, 1], "float32"], [2, 2], [0, 0, 0, 0], [1, 1], "float32"], {}], "config": {"index": 78629, "code_hash": null, "entity": [["tile_f", "sp", [-1, 32, 1, 1]], ["tile_y", "sp", [-1, 1, 1, 1]], ["tile_x", "sp", [-1, 1, 7, 1]], ["tile_rc", "sp", [-1, 4]], ["tile_ry", "sp", [-1, 1]], ["tile_rx", "sp", [-1, 1]], ["auto_unroll_max_step", "ot", 512], ["unroll_explicit", "ot", 0]]}, "result": [[0.0002409741736526946, 0.00024097878892215567, 0.00024098797155688623], 0, 1.7166035175323486, 1679298333.0825648], "version": 0.2, "tvm_version": "0.10.0"}
{"input": ["cuda -keys=cuda,gpu -arch=sm_86 -max_num_threads=1024 -thread_warp_size=32", "conv2d_nchw.cuda", [["TENSOR", [1, 1024, 14, 14], "float32"], ["TENSOR", [2048, 1024, 1, 1], "float32"], [2, 2], [0, 0, 0, 0], [1, 1], "float32"], {}], "config": {"index": 16021, "code_hash": null, "entity": [["tile_f", "sp", [-1, 32, 1, 1]], ["tile_y", "sp", [-1, 1, 1, 1]], ["tile_x", "sp", [-1, 1, 1, 7]], ["tile_rc", "sp", [-1, 4]], ["tile_ry", "sp", [-1, 1]], ["tile_rx", "sp", [-1, 1]], ["auto_unroll_max_step", "ot", 0], ["unroll_explicit", "ot", 0]]}, "result": [[0.003246242129032258, 0.0032464434516129032, 0.0032478967419354837], 0, 1.5339343547821045, 1679298333.952302], "version": 0.2, "tvm_version": "0.10.0"}
{"input": ["cuda -keys=cuda,gpu -arch=sm_86 -max_num_threads=1024 -thread_warp_size=32", "conv2d_nchw.cuda", [["TENSOR", [1, 1024, 14, 14], "float32"], ["TENSOR", [2048, 1024, 1, 1], "float32"], [2, 2], [0, 0, 0, 0], [1, 1], "float32"], {}], "config": {"index": 13109, "code_hash": null, "entity": [["tile_f", "sp", [-1, 32, 1, 1]], ["tile_y", "sp", [-1, 1, 1, 1]], ["tile_x", "sp", [-1, 7, 1, 1]], ["tile_rc", "sp", [-1, 4]], ["tile_ry", "sp", [-1, 1]], ["tile_rx", "sp", [-1, 1]], ["auto_unroll_max_step", "ot", 0], ["unroll_explicit", "ot", 0]]}, "result": [[0.0032437347741935485, 0.003243965870967742, 0.003245160225806452], 0, 1.538661241531372, 1679298334.8090045], "version": 0.2, "tvm_version": "0.10.0"}
{"input": ["cuda -keys=cuda,gpu -arch=sm_86 -max_num_threads=1024 -thread_warp_size=32", "conv2d_nchw.cuda", [["TENSOR", [1, 1024, 14, 14], "float32"], ["TENSOR", [2048, 1024, 1, 1], "float32"], [2, 2], [0, 0, 0, 0], [1, 1], "float32"], {}], "config": {"index": 14929, "code_hash": null, "entity": [["tile_f", "sp", [-1, 32, 1, 1]], ["tile_y", "sp", [-1, 7, 1, 1]], ["tile_x", "sp", [-1, 1, 7, 1]], ["tile_rc", "sp", [-1, 4]], ["tile_ry", "sp", [-1, 1]], ["tile_rx", "sp", [-1, 1]], ["auto_unroll_max_step", "ot", 0], ["unroll_explicit", "ot", 0]]}, "result": [[0.005439811263157895, 0.005439973105263157, 0.0054400807368421055], 0, 1.5548431873321533, 1679298335.6867616], "version": 0.2, "tvm_version": "0.10.0"}
{"input": ["cuda -keys=cuda,gpu -arch=sm_86 -max_num_threads=1024 -thread_warp_size=32", "conv2d_nchw.cuda", [["TENSOR", [1, 1024, 14, 14], "float32"], ["TENSOR", [2048, 1024, 1, 1], "float32"], [2, 2], [0, 0, 0, 0], [1, 1], "float32"], {}], "config": {"index": 14566, "code_hash": null, "entity": [["tile_f", "sp", [-1, 64, 1, 1]], ["tile_y", "sp", [-1, 1, 1, 1]], ["tile_x", "sp", [-1, 1, 7, 1]], ["tile_rc", "sp", [-1, 4]], ["tile_ry", "sp", [-1, 1]], ["tile_rx", "sp", [-1, 1]], ["auto_unroll_max_step", "ot", 0], ["unroll_explicit", "ot", 0]]}, "result": [[0.0010658526276595744, 0.001066038489361702, 0.0010660493723404255], 0, 1.356916904449463, 1679298336.542269], "version": 0.2, "tvm_version": "0.10.0"}
{"input": ["cuda -keys=cuda,gpu -arch=sm_86 -max_num_threads=1024 -thread_warp_size=32", "conv2d_nchw.cuda", [["TENSOR", [1, 1024, 14, 14], "float32"], ["TENSOR", [2048, 1024, 1, 1], "float32"], [2, 2], [0, 0, 0, 0], [1, 1], "float32"], {}], "config": {"index": 14564, "code_hash": null, "entity": [["tile_f", "sp", [-1, 16, 1, 1]], ["tile_y", "sp", [-1, 1, 1, 1]], ["tile_x", "sp", [-1, 1, 7, 1]], ["tile_rc", "sp", [-1, 4]], ["tile_ry", "sp", [-1, 1]], ["tile_rx", "sp", [-1, 1]], ["auto_unroll_max_step", "ot", 0], ["unroll_explicit", "ot", 0]]}, "result": [[0.00022168883425414363, 0.0002216931754143646, 0.00022170872928176796], 0, 1.6523571014404297, 1679298337.798788], "version": 0.2, "tvm_version": "0.10.0"}
{"input": ["cuda -keys=cuda,gpu -arch=sm_86 -max_num_threads=1024 -thread_warp_size=32", "conv2d_nchw.cuda", [["TENSOR", [1, 1024, 14, 14], "float32"], ["TENSOR", [2048, 1024, 1, 1], "float32"], [2, 2], [0, 0, 0, 0], [1, 1], "float32"], {}], "config": {"index": 37861, "code_hash": null, "entity": [["tile_f", "sp", [-1, 32, 1, 1]], ["tile_y", "sp", [-1, 1, 1, 1]], ["tile_x", "sp", [-1, 1, 7, 1]], ["tile_rc", "sp", [-1, 64]], ["tile_ry", "sp", [-1, 1]], ["tile_rx", "sp", [-1, 1]], ["auto_unroll_max_step", "ot", 0], ["unroll_explicit", "ot", 0]]}, "result": [[0.000980340387878788, 0.0009803587939393938, 0.000980445903030303], 0, 1.8451282978057861, 1679298339.0682268], "version": 0.2, "tvm_version": "0.10.0"}
{"input": ["cuda -keys=cuda,gpu -arch=sm_86 -max_num_threads=1024 -thread_warp_size=32", "conv2d_nchw.cuda", [["TENSOR", [1, 1024, 14, 14], "float32"], ["TENSOR", [2048, 1024, 1, 1], "float32"], [2, 2], [0, 0, 0, 0], [1, 1], "float32"], {}], "config": {"index": 15657, "code_hash": null, "entity": [["tile_f", "sp", [-1, 32, 1, 1]], ["tile_y", "sp", [-1, 1, 1, 7]], ["tile_x", "sp", [-1, 1, 7, 1]], ["tile_rc", "sp", [-1, 4]], ["tile_ry", "sp", [-1, 1]], ["tile_rx", "sp", [-1, 1]], ["auto_unroll_max_step", "ot", 0], ["unroll_explicit", "ot", 0]]}, "result": [[0.00544126647368421, 0.00544126647368421, 0.0054415242631578944], 0, 1.5510993003845215, 1679298339.948], "version": 0.2, "tvm_version": "0.10.0"}
{"input": ["cuda -keys=cuda,gpu -arch=sm_86 -max_num_threads=1024 -thread_warp_size=32", "conv2d_nchw.cuda", [["TENSOR", [1, 1024, 14, 14], "float32"], ["TENSOR", [2048, 1024, 1, 1], "float32"], [2, 2], [0, 0, 0, 0], [1, 1], "float32"], {}], "config": {"index": 14580, "code_hash": null, "entity": [["tile_f", "sp", [-1, 256, 2, 1]], ["tile_y", "sp", [-1, 1, 1, 1]], ["tile_x", "sp", [-1, 1, 7, 1]], ["tile_rc", "sp", [-1, 4]], ["tile_ry", "sp", [-1, 1]], ["tile_rx", "sp", [-1, 1]], ["auto_unroll_max_step", "ot", 0], ["unroll_explicit", "ot", 0]]}, "result": [[0.012699519999999999, 0.012700799875, 0.012700799875], 0, 1.6971848011016846, 1679298340.8472157], "version": 0.2, "tvm_version": "0.10.0"}
{"input": ["cuda -keys=cuda,gpu -arch=sm_86 -max_num_threads=1024 -thread_warp_size=32", "conv2d_nchw.cuda", [["TENSOR", [1, 1024, 14, 14], "float32"], ["TENSOR", [2048, 1024, 1, 1], "float32"], [2, 2], [0, 0, 0, 0], [1, 1], "float32"], {}], "config": {"index": 43685, "code_hash": null, "entity": [["tile_f", "sp", [-1, 32, 1, 1]], ["tile_y", "sp", [-1, 1, 1, 1]], ["tile_x", "sp", [-1, 1, 7, 1]], ["tile_rc", "sp", [-1, 128]], ["tile_ry", "sp", [-1, 1]], ["tile_rx", "sp", [-1, 1]], ["auto_unroll_max_step", "ot", 0], ["unroll_explicit", "ot", 0]]}, "result": [[0.0019258542264150944, 0.0019262598679245283, 0.0019275544339622643], 0, 1.2745494842529297, 1679298341.7125883], "version": 0.2, "tvm_version": "0.10.0"}
{"input": ["cuda -keys=cuda,gpu -arch=sm_86 -max_num_threads=1024 -thread_warp_size=32", "conv2d_nchw.cuda", [["TENSOR", [1, 1024, 14, 14], "float32"], ["TENSOR", [2048, 1024, 1, 1], "float32"], [2, 2], [0, 0, 0, 0], [1, 1], "float32"], {}], "config": {"index": 14581, "code_hash": null, "entity": [["tile_f", "sp", [-1, 512, 2, 1]], ["tile_y", "sp", [-1, 1, 1, 1]], ["tile_x", "sp", [-1, 1, 7, 1]], ["tile_rc", "sp", [-1, 4]], ["tile_ry", "sp", [-1, 1]], ["tile_rx", "sp", [-1, 1]], ["auto_unroll_max_step", "ot", 0], ["unroll_explicit", "ot", 0]]}, "result": [[0.014508160142857144, 0.014508762857142856, 0.014509920285714285], 0, 1.508359670639038, 1679298342.593009], "version": 0.2, "tvm_version": "0.10.0"}
{"input": ["cuda -keys=cuda,gpu -arch=sm_86 -max_num_threads=1024 -thread_warp_size=32", "conv2d_nchw.cuda", [["TENSOR", [1, 1024, 14, 14], "float32"], ["TENSOR", [2048, 1024, 1, 1], "float32"], [2, 2], [0, 0, 0, 0], [1, 1], "float32"], {}], "config": {"index": 142693, "code_hash": null, "entity": [["tile_f", "sp", [-1, 32, 1, 1]], ["tile_y", "sp", [-1, 1, 1, 1]], ["tile_x", "sp", [-1, 1, 7, 1]], ["tile_rc", "sp", [-1, 4]], ["tile_ry", "sp", [-1, 1]], ["tile_rx", "sp", [-1, 1]], ["auto_unroll_max_step", "ot", 1500], ["unroll_explicit", "ot", 0]]}, "result": [[0.0002411336152694611, 0.0002411412664670659, 0.0002411669880239521], 0, 1.730651617050171, 1679298343.837735], "version": 0.2, "tvm_version": "0.10.0"}
{"input": ["cuda -keys=cuda,gpu -arch=sm_86 -max_num_threads=1024 -thread_warp_size=32", "conv2d_nchw.cuda", [["TENSOR", [1, 1024, 14, 14], "float32"], ["TENSOR", [2048, 1024, 1, 1], "float32"], [2, 2], [0, 0, 0, 0], [1, 1], "float32"], {}], "config": {"index": 49509, "code_hash": null, "entity": [["tile_f", "sp", [-1, 32, 1, 1]], ["tile_y", "sp", [-1, 1, 1, 1]], ["tile_x", "sp", [-1, 1, 7, 1]], ["tile_rc", "sp", [-1, 256]], ["tile_ry", "sp", [-1, 1]], ["tile_rx", "sp", [-1, 1]], ["auto_unroll_max_step", "ot", 0], ["unroll_explicit", "ot", 0]]}, "result": [[0.002875070171428571, 0.0028752110000000003, 0.0028753042857142855], 0, 1.260667324066162, 1679298344.7072592], "version": 0.2, "tvm_version": "0.10.0"}
{"input": ["cuda -keys=cuda,gpu -arch=sm_86 -max_num_threads=1024 -thread_warp_size=32", "conv2d_nchw.cuda", [["TENSOR", [1, 1024, 14, 14], "float32"], ["TENSOR", [2048, 1024, 1, 1], "float32"], [2, 2], [0, 0, 0, 0], [1, 1], "float32"], {}], "config": {"index": 14582, "code_hash": null, "entity": [["tile_f", "sp", [-1, 1024, 2, 1]], ["tile_y", "sp", [-1, 1, 1, 1]], ["tile_x", "sp", [-1, 1, 7, 1]], ["tile_rc", "sp", [-1, 4]], ["tile_ry", "sp", [-1, 1]], ["tile_rx", "sp", [-1, 1]], ["auto_unroll_max_step", "ot", 0], ["unroll_explicit", "ot", 0]]}, "result": [[0.029632511, 0.029634304, 0.02963475975], 0, 1.5620691776275635, 1679298345.7395318], "version": 0.2, "tvm_version": "0.10.0"}
{"input": ["cuda -keys=cuda,gpu -arch=sm_86 -max_num_threads=1024 -thread_warp_size=32", "conv2d_nchw.cuda", [["TENSOR", [1, 1024, 14, 14], "float32"], ["TENSOR", [2048, 1024, 1, 1], "float32"], [2, 2], [0, 0, 0, 0], [1, 1], "float32"], {}], "config": {"index": 11653, "code_hash": null, "entity": [["tile_f", "sp", [-1, 32, 1, 1]], ["tile_y", "sp", [-1, 1, 1, 1]], ["tile_x", "sp", [-1, 1, 1, 1]], ["tile_rc", "sp", [-1, 4]], ["tile_ry", "sp", [-1, 1]], ["tile_rx", "sp", [-1, 1]], ["auto_unroll_max_step", "ot", 0], ["unroll_explicit", "ot", 0]]}, "result": [[0.0026269538974358973, 0.0026276890512820514, 0.0026284185384615384], 0, 1.2939820289611816, 1679298346.620129], "version": 0.2, "tvm_version": "0.10.0"}
{"input": ["cuda -keys=cuda,gpu -arch=sm_86 -max_num_threads=1024 -thread_warp_size=32", "conv2d_nchw.cuda", [["TENSOR", [1, 1024, 14, 14], "float32"], ["TENSOR", [2048, 1024, 1, 1], "float32"], [2, 2], [0, 0, 0, 0], [1, 1], "float32"], {}], "config": {"index": 15293, "code_hash": null, "entity": [["tile_f", "sp", [-1, 32, 1, 1]], ["tile_y", "sp", [-1, 1, 7, 1]], ["tile_x", "sp", [-1, 1, 7, 1]], ["tile_rc", "sp", [-1, 4]], ["tile_ry", "sp", [-1, 1]], ["tile_rx", "sp", [-1, 1]], ["auto_unroll_max_step", "ot", 0], ["unroll_explicit", "ot", 0]]}, "result": [[0.0005692173710247349, 0.0005692643851590106, 0.0005692933392226149], 0, 1.6386923789978027, 1679298348.4976437], "version": 0.2, "tvm_version": "0.10.0"}
{"input": ["cuda -keys=cuda,gpu -arch=sm_86 -max_num_threads=1024 -thread_warp_size=32", "conv2d_nchw.cuda", [["TENSOR", [1, 1024, 14, 14], "float32"], ["TENSOR", [2048, 1024, 1, 1], "float32"], [2, 2], [0, 0, 0, 0], [1, 1], "float32"], {}], "config": {"index": 206756, "code_hash": null, "entity": [["tile_f", "sp", [-1, 16, 1, 1]], ["tile_y", "sp", [-1, 1, 1, 1]], ["tile_x", "sp", [-1, 1, 7, 1]], ["tile_rc", "sp", [-1, 4]], ["tile_ry", "sp", [-1, 1]], ["tile_rx", "sp", [-1, 1]], ["auto_unroll_max_step", "ot", 0], ["unroll_explicit", "ot", 1]]}, "result": [[0.00022224582763337894, 0.00022224722571819426, 0.00022225125444596443], 0, 1.6555836200714111, 1679298349.7646894], "version": 0.2, "tvm_version": "0.10.0"}
{"input": ["cuda -keys=cuda,gpu -arch=sm_86 -max_num_threads=1024 -thread_warp_size=32", "conv2d_nchw.cuda", [["TENSOR", [1, 1024, 14, 14], "float32"], ["TENSOR", [2048, 1024, 1, 1], "float32"], [2, 2], [0, 0, 0, 0], [1, 1], "float32"], {}], "config": {"index": 78628, "code_hash": null, "entity": [["tile_f", "sp", [-1, 16, 1, 1]], ["tile_y", "sp", [-1, 1, 1, 1]], ["tile_x", "sp", [-1, 1, 7, 1]], ["tile_rc", "sp", [-1, 4]], ["tile_ry", "sp", [-1, 1]], ["tile_rx", "sp", [-1, 1]], ["auto_unroll_max_step", "ot", 512], ["unroll_explicit", "ot", 0]]}, "result": [[0.0002221938494475138, 0.0002221966947513812, 0.0002222037541436464], 0, 1.6719303131103516, 1679298351.0165043], "version": 0.2, "tvm_version": "0.10.0"}
{"input": ["cuda -keys=cuda,gpu -arch=sm_86 -max_num_threads=1024 -thread_warp_size=32", "conv2d_nchw.cuda", [["TENSOR", [1, 1024, 14, 14], "float32"], ["TENSOR", [2048, 1024, 1, 1], "float32"], [2, 2], [0, 0, 0, 0], [1, 1], "float32"], {}], "config": {"index": 20388, "code_hash": null, "entity": [["tile_f", "sp", [-1, 16, 1, 1]], ["tile_y", "sp", [-1, 1, 1, 1]], ["tile_x", "sp", [-1, 1, 7, 1]], ["tile_rc", "sp", [-1, 8]], ["tile_ry", "sp", [-1, 1]], ["tile_rx", "sp", [-1, 1]], ["auto_unroll_max_step", "ot", 0], ["unroll_explicit", "ot", 0]]}, "result": [[0.0003125770058365759, 0.000312582972762646, 0.0003126127178988327], 0, 1.700073003768921, 1679298352.2714288], "version": 0.2, "tvm_version": "0.10.0"}
{"input": ["cuda -keys=cuda,gpu -arch=sm_86 -max_num_threads=1024 -thread_warp_size=32", "conv2d_nchw.cuda", [["TENSOR", [1, 1024, 14, 14], "float32"], ["TENSOR", [2048, 1024, 1, 1], "float32"], [2, 2], [0, 0, 0, 0], [1, 1], "float32"], {}], "config": {"index": 16020, "code_hash": null, "entity": [["tile_f", "sp", [-1, 16, 1, 1]], ["tile_y", "sp", [-1, 1, 1, 1]], ["tile_x", "sp", [-1, 1, 1, 7]], ["tile_rc", "sp", [-1, 4]], ["tile_ry", "sp", [-1, 1]], ["tile_rx", "sp", [-1, 1]], ["auto_unroll_max_step", "ot", 0], ["unroll_explicit", "ot", 0]]}, "result": [[0.0009813457090909093, 0.0009815070848484847, 0.0009816492242424243], 0, 1.7696819305419922, 1679298353.5290563], "version": 0.2, "tvm_version": "0.10.0"}
{"input": ["cuda -keys=cuda,gpu -arch=sm_86 -max_num_threads=1024 -thread_warp_size=32", "conv2d_nchw.cuda", [["TENSOR", [1, 1024, 14, 14], "float32"], ["TENSOR", [2048, 1024, 1, 1], "float32"], [2, 2], [0, 0, 0, 0], [1, 1], "float32"], {}], "config": {"index": 13108, "code_hash": null, "entity": [["tile_f", "sp", [-1, 16, 1, 1]], ["tile_y", "sp", [-1, 1, 1, 1]], ["tile_x", "sp", [-1, 7, 1, 1]], ["tile_rc", "sp", [-1, 4]], ["tile_ry", "sp", [-1, 1]], ["tile_rx", "sp", [-1, 1]], ["auto_unroll_max_step", "ot", 0], ["unroll_explicit", "ot", 0]]}, "result": [[0.0009807510294117647, 0.0009808413921568628, 0.0009812022156862746], 0, 1.2747132778167725, 1679298354.3828614], "version": 0.2, "tvm_version": "0.10.0"}
{"input": ["cuda -keys=cuda,gpu -arch=sm_86 -max_num_threads=1024 -thread_warp_size=32", "conv2d_nchw.cuda", [["TENSOR", [1, 1024, 14, 14], "float32"], ["TENSOR", [2048, 1024, 1, 1], "float32"], [2, 2], [0, 0, 0, 0], [1, 1], "float32"], {}], "config": {"index": 14928, "code_hash": null, "entity": [["tile_f", "sp", [-1, 16, 1, 1]], ["tile_y", "sp", [-1, 7, 1, 1]], ["tile_x", "sp", [-1, 1, 7, 1]], ["tile_rc", "sp", [-1, 4]], ["tile_ry", "sp", [-1, 1]], ["tile_rx", "sp", [-1, 1]], ["auto_unroll_max_step", "ot", 0], ["unroll_explicit", "ot", 0]]}, "result": [[0.0032782533548387097, 0.003278286322580645, 0.0032783195483870966], 0, 1.3579907417297363, 1679298355.2515626], "version": 0.2, "tvm_version": "0.10.0"}
{"input": ["cuda -keys=cuda,gpu -arch=sm_86 -max_num_threads=1024 -thread_warp_size=32", "conv2d_nchw.cuda", [["TENSOR", [1, 1024, 14, 14], "float32"], ["TENSOR", [2048, 1024, 1, 1], "float32"], [2, 2], [0, 0, 0, 0], [1, 1], "float32"], {}], "config": {"index": 14563, "code_hash": null, "entity": [["tile_f", "sp", [-1, 8, 1, 1]], ["tile_y", "sp", [-1, 1, 1, 1]], ["tile_x", "sp", [-1, 1, 7, 1]], ["tile_rc", "sp", [-1, 4]], ["tile_ry", "sp", [-1, 1]], ["tile_rx", "sp", [-1, 1]], ["auto_unroll_max_step", "ot", 0], ["unroll_explicit", "ot", 0]]}, "result": [[0.00027377102702702707, 0.0002737969831081081, 0.00027387330236486486], 0, 1.6579616069793701, 1679298356.5202074], "version": 0.2, "tvm_version": "0.10.0"}
{"input": ["cuda -keys=cuda,gpu -arch=sm_86 -max_num_threads=1024 -thread_warp_size=32", "conv2d_nchw.cuda", [["TENSOR", [1, 1024, 14, 14], "float32"], ["TENSOR", [2048, 1024, 1, 1], "float32"], [2, 2], [0, 0, 0, 0], [1, 1], "float32"], {}], "config": {"index": 15656, "code_hash": null, "entity": [["tile_f", "sp", [-1, 16, 1, 1]], ["tile_y", "sp", [-1, 1, 1, 7]], ["tile_x", "sp", [-1, 1, 7, 1]], ["tile_rc", "sp", [-1, 4]], ["tile_ry", "sp", [-1, 1]], ["tile_rx", "sp", [-1, 1]], ["auto_unroll_max_step", "ot", 0], ["unroll_explicit", "ot", 0]]}, "result": [[0.0032784184838709676, 0.003278517677419355, 0.003278615612903226], 0, 1.3418796062469482, 1679298357.3870037], "version": 0.2, "tvm_version": "0.10.0"}
{"input": ["cuda -keys=cuda,gpu -arch=sm_86 -max_num_threads=1024 -thread_warp_size=32", "conv2d_nchw.cuda", [["TENSOR", [1, 1024, 14, 14], "float32"], ["TENSOR", [2048, 1024, 1, 1], "float32"], [2, 2], [0, 0, 0, 0], [1, 1], "float32"], {}], "config": {"index": 142692, "code_hash": null, "entity": [["tile_f", "sp", [-1, 16, 1, 1]], ["tile_y", "sp", [-1, 1, 1, 1]], ["tile_x", "sp", [-1, 1, 7, 1]], ["tile_rc", "sp", [-1, 4]], ["tile_ry", "sp", [-1, 1]], ["tile_rx", "sp", [-1, 1]], ["auto_unroll_max_step", "ot", 1500], ["unroll_explicit", "ot", 0]]}, "result": [[0.00022219812809917358, 0.0002222062837465565, 0.00022224325344352618], 0, 1.6588482856750488, 1679298358.6578226], "version": 0.2, "tvm_version": "0.10.0"}
