src/tvm/results/cuda_rtx3080/inception_v3/droplet/cpu.log_layer_34.log
{"input": ["cuda -keys=cuda,gpu -arch=sm_86 -max_num_threads=1024 -thread_warp_size=32", "conv2d_nchw.cuda", [["TENSOR", [1, 192, 17, 17], "float32"], ["TENSOR", [192, 192, 1, 7], "float32"], [1, 1], [0, 3, 0, 3], [1, 1], "float32"], {}], "config": {"index": 0, "code_hash": null, "entity": [["tile_f", "sp", [-1, 1, 1, 1]], ["tile_y", "sp", [-1, 1, 1, 1]], ["tile_x", "sp", [-1, 1, 1, 1]], ["tile_rc", "sp", [-1, 1]], ["tile_ry", "sp", [-1, 1]], ["tile_rx", "sp", [-1, 1]], ["auto_unroll_max_step", "ot", 0], ["unroll_explicit", "ot", 0]]}, "result": [[0.002129963638297872, 0.002130116063829787, 0.0021301378085106385], 0, 0.9768514633178711, 1679042769.367672], "version": 0.2, "tvm_version": "0.10.0"}
{"input": ["cuda -keys=cuda,gpu -arch=sm_86 -max_num_threads=1024 -thread_warp_size=32", "conv2d_nchw.cuda", [["TENSOR", [1, 192, 17, 17], "float32"], ["TENSOR", [192, 192, 1, 7], "float32"], [1, 1], [0, 3, 0, 3], [1, 1], "float32"], {}], "config": {"index": 451584, "code_hash": null, "entity": [["tile_f", "sp", [-1, 1, 1, 1]], ["tile_y", "sp", [-1, 1, 1, 1]], ["tile_x", "sp", [-1, 1, 1, 1]], ["tile_rc", "sp", [-1, 1]], ["tile_ry", "sp", [-1, 1]], ["tile_rx", "sp", [-1, 1]], ["auto_unroll_max_step", "ot", 0], ["unroll_explicit", "ot", 1]]}, "result": [[0.0021300071489361704, 0.002130028893617021, 0.0021300943191489364], 0, 1.144124984741211, 1679042770.7109108], "version": 0.2, "tvm_version": "0.10.0"}
{"input": ["cuda -keys=cuda,gpu -arch=sm_86 -max_num_threads=1024 -thread_warp_size=32", "conv2d_nchw.cuda", [["TENSOR", [1, 192, 17, 17], "float32"], ["TENSOR", [192, 192, 1, 7], "float32"], [1, 1], [0, 3, 0, 3], [1, 1], "float32"], {}], "config": {"index": 150528, "code_hash": null, "entity": [["tile_f", "sp", [-1, 1, 1, 1]], ["tile_y", "sp", [-1, 1, 1, 1]], ["tile_x", "sp", [-1, 1, 1, 1]], ["tile_rc", "sp", [-1, 1]], ["tile_ry", "sp", [-1, 1]], ["tile_rx", "sp", [-1, 1]], ["auto_unroll_max_step", "ot", 512], ["unroll_explicit", "ot", 0]]}, "result": [[0.0021298328085106386, 0.0021299798723404257, 0.0021300235319148936], 0, 1.187028408050537, 1679042771.534321], "version": 0.2, "tvm_version": "0.10.0"}
{"input": ["cuda -keys=cuda,gpu -arch=sm_86 -max_num_threads=1024 -thread_warp_size=32", "conv2d_nchw.cuda", [["TENSOR", [1, 192, 17, 17], "float32"], ["TENSOR", [192, 192, 1, 7], "float32"], [1, 1], [0, 3, 0, 3], [1, 1], "float32"], {}], "config": {"index": 75264, "code_hash": null, "entity": [["tile_f", "sp", [-1, 1, 1, 1]], ["tile_y", "sp", [-1, 1, 1, 1]], ["tile_x", "sp", [-1, 1, 1, 1]], ["tile_rc", "sp", [-1, 1]], ["tile_ry", "sp", [-1, 1]], ["tile_rx", "sp", [-1, 7]], ["auto_unroll_max_step", "ot", 0], ["unroll_explicit", "ot", 0]]}, "result": [[0.0045285286086956525, 0.004528573043478261, 0.004528662304347827], 0, 1.2165038585662842, 1679042772.395993], "version": 0.2, "tvm_version": "0.10.0"}
{"input": ["cuda -keys=cuda,gpu -arch=sm_86 -max_num_threads=1024 -thread_warp_size=32", "conv2d_nchw.cuda", [["TENSOR", [1, 192, 17, 17], "float32"], ["TENSOR", [192, 192, 1, 7], "float32"], [1, 1], [0, 3, 0, 3], [1, 1], "float32"], {}], "config": {"index": 5376, "code_hash": null, "entity": [["tile_f", "sp", [-1, 1, 1, 1]], ["tile_y", "sp", [-1, 1, 1, 1]], ["tile_x", "sp", [-1, 1, 1, 1]], ["tile_rc", "sp", [-1, 2]], ["tile_ry", "sp", [-1, 1]], ["tile_rx", "sp", [-1, 1]], ["auto_unroll_max_step", "ot", 0], ["unroll_explicit", "ot", 0]]}, "result": [[0.006031600941176471, 0.006031962176470588, 0.006032082941176471], 0, 1.2345044612884521, 1679042773.2512617], "version": 0.2, "tvm_version": "0.10.0"}
{"input": ["cuda -keys=cuda,gpu -arch=sm_86 -max_num_threads=1024 -thread_warp_size=32", "conv2d_nchw.cuda", [["TENSOR", [1, 192, 17, 17], "float32"], ["TENSOR", [192, 192, 1, 7], "float32"], [1, 1], [0, 3, 0, 3], [1, 1], "float32"], {}], "config": {"index": 1344, "code_hash": null, "entity": [["tile_f", "sp", [-1, 1, 1, 1]], ["tile_y", "sp", [-1, 1, 1, 1]], ["tile_x", "sp", [-1, 17, 1, 1]], ["tile_rc", "sp", [-1, 1]], ["tile_ry", "sp", [-1, 1]], ["tile_rx", "sp", [-1, 1]], ["auto_unroll_max_step", "ot", 0], ["unroll_explicit", "ot", 0]]}, "result": [[0.0010918734130434783, 0.0010918956413043478, 0.0010919958152173913], 0, 1.2344608306884766, 1679042774.0862944], "version": 0.2, "tvm_version": "0.10.0"}
{"input": ["cuda -keys=cuda,gpu -arch=sm_86 -max_num_threads=1024 -thread_warp_size=32", "conv2d_nchw.cuda", [["TENSOR", [1, 192, 17, 17], "float32"], ["TENSOR", [192, 192, 1, 7], "float32"], [1, 1], [0, 3, 0, 3], [1, 1], "float32"], {}], "config": {"index": 336, "code_hash": null, "entity": [["tile_f", "sp", [-1, 1, 1, 1]], ["tile_y", "sp", [-1, 17, 1, 1]], ["tile_x", "sp", [-1, 1, 1, 1]], ["tile_rc", "sp", [-1, 1]], ["tile_ry", "sp", [-1, 1]], ["tile_rx", "sp", [-1, 1]], ["auto_unroll_max_step", "ot", 0], ["unroll_explicit", "ot", 0]]}, "result": [[0.0023039999772727273, 0.002304674840909091, 0.002305461], 0, 1.2445452213287354, 1679042774.9211864], "version": 0.2, "tvm_version": "0.10.0"}
{"input": ["cuda -keys=cuda,gpu -arch=sm_86 -max_num_threads=1024 -thread_warp_size=32", "conv2d_nchw.cuda", [["TENSOR", [1, 192, 17, 17], "float32"], ["TENSOR", [192, 192, 1, 7], "float32"], [1, 1], [0, 3, 0, 3], [1, 1], "float32"], {}], "config": {"index": 1, "code_hash": null, "entity": [["tile_f", "sp", [-1, 2, 1, 1]], ["tile_y", "sp", [-1, 1, 1, 1]], ["tile_x", "sp", [-1, 1, 1, 1]], ["tile_rc", "sp", [-1, 1]], ["tile_ry", "sp", [-1, 1]], ["tile_rx", "sp", [-1, 1]], ["auto_unroll_max_step", "ot", 0], ["unroll_explicit", "ot", 0]]}, "result": [[0.004660968772727273, 0.004661015227272727, 0.004661061681818182], 0, 1.2240569591522217, 1679042775.7695014], "version": 0.2, "tvm_version": "0.10.0"}
{"input": ["cuda -keys=cuda,gpu -arch=sm_86 -max_num_threads=1024 -thread_warp_size=32", "conv2d_nchw.cuda", [["TENSOR", [1, 192, 17, 17], "float32"], ["TENSOR", [192, 192, 1, 7], "float32"], [1, 1], [0, 3, 0, 3], [1, 1], "float32"], {}], "config": {"index": 301056, "code_hash": null, "entity": [["tile_f", "sp", [-1, 1, 1, 1]], ["tile_y", "sp", [-1, 1, 1, 1]], ["tile_x", "sp", [-1, 1, 1, 1]], ["tile_rc", "sp", [-1, 1]], ["tile_ry", "sp", [-1, 1]], ["tile_rx", "sp", [-1, 1]], ["auto_unroll_max_step", "ot", 1500], ["unroll_explicit", "ot", 0]]}, "result": [[0.0021300506382978725, 0.0021300943191489364, 0.0021301595744680855], 0, 1.1866908073425293, 1679042776.591189], "version": 0.2, "tvm_version": "0.10.0"}
{"input": ["cuda -keys=cuda,gpu -arch=sm_86 -max_num_threads=1024 -thread_warp_size=32", "conv2d_nchw.cuda", [["TENSOR", [1, 192, 17, 17], "float32"], ["TENSOR", [192, 192, 1, 7], "float32"], [1, 1], [0, 3, 0, 3], [1, 1], "float32"], {}], "config": {"index": 10752, "code_hash": null, "entity": [["tile_f", "sp", [-1, 1, 1, 1]], ["tile_y", "sp", [-1, 1, 1, 1]], ["tile_x", "sp", [-1, 1, 1, 1]], ["tile_rc", "sp", [-1, 3]], ["tile_ry", "sp", [-1, 1]], ["tile_rx", "sp", [-1, 1]], ["auto_unroll_max_step", "ot", 0], ["unroll_explicit", "ot", 0]]}, "result": [[0.0051744255000000005, 0.00517468145, 0.00517473295], 0, 1.2281322479248047, 1679042777.4519994], "version": 0.2, "tvm_version": "0.10.0"}
{"input": ["cuda -keys=cuda,gpu -arch=sm_86 -max_num_threads=1024 -thread_warp_size=32", "conv2d_nchw.cuda", [["TENSOR", [1, 192, 17, 17], "float32"], ["TENSOR", [192, 192, 1, 7], "float32"], [1, 1], [0, 3, 0, 3], [1, 1], "float32"], {}], "config": {"index": 2688, "code_hash": null, "entity": [["tile_f", "sp", [-1, 1, 1, 1]], ["tile_y", "sp", [-1, 1, 1, 1]], ["tile_x", "sp", [-1, 1, 17, 1]], ["tile_rc", "sp", [-1, 1]], ["tile_ry", "sp", [-1, 1]], ["tile_rx", "sp", [-1, 1]], ["auto_unroll_max_step", "ot", 0], ["unroll_explicit", "ot", 0]]}, "result": [[0.000538771254180602, 0.0005388568862876254, 0.0005388904682274247], 0, 1.5838513374328613, 1679042778.6659734], "version": 0.2, "tvm_version": "0.10.0"}
{"input": ["cuda -keys=cuda,gpu -arch=sm_86 -max_num_threads=1024 -thread_warp_size=32", "conv2d_nchw.cuda", [["TENSOR", [1, 192, 17, 17], "float32"], ["TENSOR", [192, 192, 1, 7], "float32"], [1, 1], [0, 3, 0, 3], [1, 1], "float32"], {}], "config": {"index": 672, "code_hash": null, "entity": [["tile_f", "sp", [-1, 1, 1, 1]], ["tile_y", "sp", [-1, 1, 17, 1]], ["tile_x", "sp", [-1, 1, 1, 1]], ["tile_rc", "sp", [-1, 1]], ["tile_ry", "sp", [-1, 1]], ["tile_rx", "sp", [-1, 1]], ["auto_unroll_max_step", "ot", 0], ["unroll_explicit", "ot", 0]]}, "result": [[0.000569391038869258, 0.000571916664310954, 0.0005719636819787986], 0, 1.5960056781768799, 1679042779.8951576], "version": 0.2, "tvm_version": "0.10.0"}
{"input": ["cuda -keys=cuda,gpu -arch=sm_86 -max_num_threads=1024 -thread_warp_size=32", "conv2d_nchw.cuda", [["TENSOR", [1, 192, 17, 17], "float32"], ["TENSOR", [192, 192, 1, 7], "float32"], [1, 1], [0, 3, 0, 3], [1, 1], "float32"], {}], "config": {"index": 2, "code_hash": null, "entity": [["tile_f", "sp", [-1, 3, 1, 1]], ["tile_y", "sp", [-1, 1, 1, 1]], ["tile_x", "sp", [-1, 1, 1, 1]], ["tile_rc", "sp", [-1, 1]], ["tile_ry", "sp", [-1, 1]], ["tile_rx", "sp", [-1, 1]], ["auto_unroll_max_step", "ot", 0], ["unroll_explicit", "ot", 0]]}, "result": [[0.0037068763703703707, 0.0037069936666666668, 0.003707031814814815], 0, 1.2629578113555908, 1679042780.7847276], "version": 0.2, "tvm_version": "0.10.0"}
{"input": ["cuda -keys=cuda,gpu -arch=sm_86 -max_num_threads=1024 -thread_warp_size=32", "conv2d_nchw.cuda", [["TENSOR", [1, 192, 17, 17], "float32"], ["TENSOR", [192, 192, 1, 7], "float32"], [1, 1], [0, 3, 0, 3], [1, 1], "float32"], {}], "config": {"index": 16128, "code_hash": null, "entity": [["tile_f", "sp", [-1, 1, 1, 1]], ["tile_y", "sp", [-1, 1, 1, 1]], ["tile_x", "sp", [-1, 1, 1, 1]], ["tile_rc", "sp", [-1, 4]], ["tile_ry", "sp", [-1, 1]], ["tile_rx", "sp", [-1, 1]], ["auto_unroll_max_step", "ot", 0], ["unroll_explicit", "ot", 0]]}, "result": [[0.004949528238095239, 0.0049499184285714285, 0.0049501135238095234], 0, 1.2222135066986084, 1679042781.6373143], "version": 0.2, "tvm_version": "0.10.0"}
{"input": ["cuda -keys=cuda,gpu -arch=sm_86 -max_num_threads=1024 -thread_warp_size=32", "conv2d_nchw.cuda", [["TENSOR", [1, 192, 17, 17], "float32"], ["TENSOR", [192, 192, 1, 7], "float32"], [1, 1], [0, 3, 0, 3], [1, 1], "float32"], {}], "config": {"index": 4032, "code_hash": null, "entity": [["tile_f", "sp", [-1, 1, 1, 1]], ["tile_y", "sp", [-1, 1, 1, 1]], ["tile_x", "sp", [-1, 1, 1, 17]], ["tile_rc", "sp", [-1, 1]], ["tile_ry", "sp", [-1, 1]], ["tile_rx", "sp", [-1, 1]], ["auto_unroll_max_step", "ot", 0], ["unroll_explicit", "ot", 0]]}, "result": [[0.0010917843478260869, 0.0010917954565217393, 0.0010918935652173912], 0, 1.2151100635528564, 1679042782.4637685], "version": 0.2, "tvm_version": "0.10.0"}
{"input": ["cuda -keys=cuda,gpu -arch=sm_86 -max_num_threads=1024 -thread_warp_size=32", "conv2d_nchw.cuda", [["TENSOR", [1, 192, 17, 17], "float32"], ["TENSOR", [192, 192, 1, 7], "float32"], [1, 1], [0, 3, 0, 3], [1, 1], "float32"], {}], "config": {"index": 1008, "code_hash": null, "entity": [["tile_f", "sp", [-1, 1, 1, 1]], ["tile_y", "sp", [-1, 1, 1, 17]], ["tile_x", "sp", [-1, 1, 1, 1]], ["tile_rc", "sp", [-1, 1]], ["tile_ry", "sp", [-1, 1]], ["tile_rx", "sp", [-1, 1]], ["auto_unroll_max_step", "ot", 0], ["unroll_explicit", "ot", 0]]}, "result": [[0.002295226181818182, 0.0023077701136363636, 0.002309259568181818], 0, 1.2155330181121826, 1679042783.2941852], "version": 0.2, "tvm_version": "0.10.0"}
{"input": ["cuda -keys=cuda,gpu -arch=sm_86 -max_num_threads=1024 -thread_warp_size=32", "conv2d_nchw.cuda", [["TENSOR", [1, 192, 17, 17], "float32"], ["TENSOR", [192, 192, 1, 7], "float32"], [1, 1], [0, 3, 0, 3], [1, 1], "float32"], {}], "config": {"index": 3, "code_hash": null, "entity": [["tile_f", "sp", [-1, 4, 1, 1]], ["tile_y", "sp", [-1, 1, 1, 1]], ["tile_x", "sp", [-1, 1, 1, 1]], ["tile_rc", "sp", [-1, 1]], ["tile_ry", "sp", [-1, 1]], ["tile_rx", "sp", [-1, 1]], ["auto_unroll_max_step", "ot", 0], ["unroll_explicit", "ot", 0]]}, "result": [[0.003071689696969697, 0.003072124121212121, 0.0030724316060606062], 0, 1.2145311832427979, 1679042784.1335292], "version": 0.2, "tvm_version": "0.10.0"}
{"input": ["cuda -keys=cuda,gpu -arch=sm_86 -max_num_threads=1024 -thread_warp_size=32", "conv2d_nchw.cuda", [["TENSOR", [1, 192, 17, 17], "float32"], ["TENSOR", [192, 192, 1, 7], "float32"], [1, 1], [0, 3, 0, 3], [1, 1], "float32"], {}], "config": {"index": 454272, "code_hash": null, "entity": [["tile_f", "sp", [-1, 1, 1, 1]], ["tile_y", "sp", [-1, 1, 1, 1]], ["tile_x", "sp", [-1, 1, 17, 1]], ["tile_rc", "sp", [-1, 1]], ["tile_ry", "sp", [-1, 1]], ["tile_rx", "sp", [-1, 1]], ["auto_unroll_max_step", "ot", 0], ["unroll_explicit", "ot", 1]]}, "result": [[0.0005388466287625418, 0.0005388568862876254, 0.000538867043478261], 0, 1.5325608253479004, 1679042785.9814687], "version": 0.2, "tvm_version": "0.10.0"}
{"input": ["cuda -keys=cuda,gpu -arch=sm_86 -max_num_threads=1024 -thread_warp_size=32", "conv2d_nchw.cuda", [["TENSOR", [1, 192, 17, 17], "float32"], ["TENSOR", [192, 192, 1, 7], "float32"], [1, 1], [0, 3, 0, 3], [1, 1], "float32"], {}], "config": {"index": 153216, "code_hash": null, "entity": [["tile_f", "sp", [-1, 1, 1, 1]], ["tile_y", "sp", [-1, 1, 1, 1]], ["tile_x", "sp", [-1, 1, 17, 1]], ["tile_rc", "sp", [-1, 1]], ["tile_ry", "sp", [-1, 1]], ["tile_rx", "sp", [-1, 1]], ["auto_unroll_max_step", "ot", 512], ["unroll_explicit", "ot", 0]]}, "result": [[0.000538784983277592, 0.0005388054983277592, 0.0005388089163879599], 0, 1.5731019973754883, 1679042787.207328], "version": 0.2, "tvm_version": "0.10.0"}
{"input": ["cuda -keys=cuda,gpu -arch=sm_86 -max_num_threads=1024 -thread_warp_size=32", "conv2d_nchw.cuda", [["TENSOR", [1, 192, 17, 17], "float32"], ["TENSOR", [192, 192, 1, 7], "float32"], [1, 1], [0, 3, 0, 3], [1, 1], "float32"], {}], "config": {"index": 77952, "code_hash": null, "entity": [["tile_f", "sp", [-1, 1, 1, 1]], ["tile_y", "sp", [-1, 1, 1, 1]], ["tile_x", "sp", [-1, 1, 17, 1]], ["tile_rc", "sp", [-1, 1]], ["tile_ry", "sp", [-1, 1]], ["tile_rx", "sp", [-1, 7]], ["auto_unroll_max_step", "ot", 0], ["unroll_explicit", "ot", 0]]}, "result": [[0.0002613388929503917, 0.00026137934986945167, 0.0002613846892950392], 0, 1.1876847743988037, 1679042788.0235922], "version": 0.2, "tvm_version": "0.10.0"}
{"input": ["cuda -keys=cuda,gpu -arch=sm_86 -max_num_threads=1024 -thread_warp_size=32", "conv2d_nchw.cuda", [["TENSOR", [1, 192, 17, 17], "float32"], ["TENSOR", [192, 192, 1, 7], "float32"], [1, 1], [0, 3, 0, 3], [1, 1], "float32"], {}], "config": {"index": 8064, "code_hash": null, "entity": [["tile_f", "sp", [-1, 1, 1, 1]], ["tile_y", "sp", [-1, 1, 1, 1]], ["tile_x", "sp", [-1, 1, 17, 1]], ["tile_rc", "sp", [-1, 2]], ["tile_ry", "sp", [-1, 1]], ["tile_rx", "sp", [-1, 1]], ["auto_unroll_max_step", "ot", 0], ["unroll_explicit", "ot", 0]]}, "result": [[0.00038286949408983457, 0.0003831331134751773, 0.0003831696548463357], 0, 1.5985584259033203, 1679042789.246916], "version": 0.2, "tvm_version": "0.10.0"}
{"input": ["cuda -keys=cuda,gpu -arch=sm_86 -max_num_threads=1024 -thread_warp_size=32", "conv2d_nchw.cuda", [["TENSOR", [1, 192, 17, 17], "float32"], ["TENSOR", [192, 192, 1, 7], "float32"], [1, 1], [0, 3, 0, 3], [1, 1], "float32"], {}], "config": {"index": 3024, "code_hash": null, "entity": [["tile_f", "sp", [-1, 1, 1, 1]], ["tile_y", "sp", [-1, 17, 1, 1]], ["tile_x", "sp", [-1, 1, 17, 1]], ["tile_rc", "sp", [-1, 1]], ["tile_ry", "sp", [-1, 1]], ["tile_rx", "sp", [-1, 1]], ["auto_unroll_max_step", "ot", 0], ["unroll_explicit", "ot", 0]]}, "result": [[0.0002009331125, 0.00020096000625, 0.00020097888874999999], 0, 1.633779525756836, 1679042790.4747443], "version": 0.2, "tvm_version": "0.10.0"}
{"input": ["cuda -keys=cuda,gpu -arch=sm_86 -max_num_threads=1024 -thread_warp_size=32", "conv2d_nchw.cuda", [["TENSOR", [1, 192, 17, 17], "float32"], ["TENSOR", [192, 192, 1, 7], "float32"], [1, 1], [0, 3, 0, 3], [1, 1], "float32"], {}], "config": {"index": 2689, "code_hash": null, "entity": [["tile_f", "sp", [-1, 2, 1, 1]], ["tile_y", "sp", [-1, 1, 1, 1]], ["tile_x", "sp", [-1, 1, 17, 1]], ["tile_rc", "sp", [-1, 1]], ["tile_ry", "sp", [-1, 1]], ["tile_rx", "sp", [-1, 1]], ["auto_unroll_max_step", "ot", 0], ["unroll_explicit", "ot", 0]]}, "result": [[0.00030786954423076923, 0.0003078833346153846, 0.0003086316326923077], 0, 1.6027793884277344, 1679042791.6947298], "version": 0.2, "tvm_version": "0.10.0"}
{"input": ["cuda -keys=cuda,gpu -arch=sm_86 -max_num_threads=1024 -thread_warp_size=32", "conv2d_nchw.cuda", [["TENSOR", [1, 192, 17, 17], "float32"], ["TENSOR", [192, 192, 1, 7], "float32"], [1, 1], [0, 3, 0, 3], [1, 1], "float32"], {}], "config": {"index": 24192, "code_hash": null, "entity": [["tile_f", "sp", [-1, 1, 1, 1]], ["tile_y", "sp", [-1, 1, 1, 1]], ["tile_x", "sp", [-1, 1, 17, 1]], ["tile_rc", "sp", [-1, 6]], ["tile_ry", "sp", [-1, 1]], ["tile_rx", "sp", [-1, 1]], ["auto_unroll_max_step", "ot", 0], ["unroll_explicit", "ot", 0]]}, "result": [[0.0002793653263888889, 0.00027938310243055554, 0.00027939711631944444], 0, 1.6175103187561035, 1679042792.9165409], "version": 0.2, "tvm_version": "0.10.0"}
{"input": ["cuda -keys=cuda,gpu -arch=sm_86 -max_num_threads=1024 -thread_warp_size=32", "conv2d_nchw.cuda", [["TENSOR", [1, 192, 17, 17], "float32"], ["TENSOR", [192, 192, 1, 7], "float32"], [1, 1], [0, 3, 0, 3], [1, 1], "float32"], {}], "config": {"index": 2692, "code_hash": null, "entity": [["tile_f", "sp", [-1, 6, 1, 1]], ["tile_y", "sp", [-1, 1, 1, 1]], ["tile_x", "sp", [-1, 1, 17, 1]], ["tile_rc", "sp", [-1, 1]], ["tile_ry", "sp", [-1, 1]], ["tile_rx", "sp", [-1, 1]], ["auto_unroll_max_step", "ot", 0], ["unroll_explicit", "ot", 0]]}, "result": [[0.00013841785146804836, 0.00013841951122625217, 0.00013842039464594127], 0, 1.6048452854156494, 1679042794.1348565], "version": 0.2, "tvm_version": "0.10.0"}
{"input": ["cuda -keys=cuda,gpu -arch=sm_86 -max_num_threads=1024 -thread_warp_size=32", "conv2d_nchw.cuda", [["TENSOR", [1, 192, 17, 17], "float32"], ["TENSOR", [192, 192, 1, 7], "float32"], [1, 1], [0, 3, 0, 3], [1, 1], "float32"], {}], "config": {"index": 303744, "code_hash": null, "entity": [["tile_f", "sp", [-1, 1, 1, 1]], ["tile_y", "sp", [-1, 1, 1, 1]], ["tile_x", "sp", [-1, 1, 17, 1]], ["tile_rc", "sp", [-1, 1]], ["tile_ry", "sp", [-1, 1]], ["tile_rx", "sp", [-1, 1]], ["auto_unroll_max_step", "ot", 1500], ["unroll_explicit", "ot", 0]]}, "result": [[0.0005411812432432433, 0.0005412191027027027, 0.0005412642594594595], 0, 1.1942834854125977, 1679042794.9569263], "version": 0.2, "tvm_version": "0.10.0"}
{"input": ["cuda -keys=cuda,gpu -arch=sm_86 -max_num_threads=1024 -thread_warp_size=32", "conv2d_nchw.cuda", [["TENSOR", [1, 192, 17, 17], "float32"], ["TENSOR", [192, 192, 1, 7], "float32"], [1, 1], [0, 3, 0, 3], [1, 1], "float32"], {}], "config": {"index": 29568, "code_hash": null, "entity": [["tile_f", "sp", [-1, 1, 1, 1]], ["tile_y", "sp", [-1, 1, 1, 1]], ["tile_x", "sp", [-1, 1, 17, 1]], ["tile_rc", "sp", [-1, 8]], ["tile_ry", "sp", [-1, 1]], ["tile_rx", "sp", [-1, 1]], ["auto_unroll_max_step", "ot", 0], ["unroll_explicit", "ot", 0]]}, "result": [[0.0005315402171052632, 0.0005315503059210526, 0.0005315638059210526], 0, 1.6294004917144775, 1679042796.1880608], "version": 0.2, "tvm_version": "0.10.0"}
{"input": ["cuda -keys=cuda,gpu -arch=sm_86 -max_num_threads=1024 -thread_warp_size=32", "conv2d_nchw.cuda", [["TENSOR", [1, 192, 17, 17], "float32"], ["TENSOR", [192, 192, 1, 7], "float32"], [1, 1], [0, 3, 0, 3], [1, 1], "float32"], {}], "config": {"index": 2693, "code_hash": null, "entity": [["tile_f", "sp", [-1, 8, 1, 1]], ["tile_y", "sp", [-1, 1, 1, 1]], ["tile_x", "sp", [-1, 1, 17, 1]], ["tile_rc", "sp", [-1, 1]], ["tile_ry", "sp", [-1, 1]], ["tile_rx", "sp", [-1, 1]], ["auto_unroll_max_step", "ot", 0], ["unroll_explicit", "ot", 0]]}, "result": [[0.00012463977795152464, 0.0001246461845191556, 0.00012465098045347928], 0, 1.603276252746582, 1679042797.409249], "version": 0.2, "tvm_version": "0.10.0"}
{"input": ["cuda -keys=cuda,gpu -arch=sm_86 -max_num_threads=1024 -thread_warp_size=32", "conv2d_nchw.cuda", [["TENSOR", [1, 192, 17, 17], "float32"], ["TENSOR", [192, 192, 1, 7], "float32"], [1, 1], [0, 3, 0, 3], [1, 1], "float32"], {}], "config": {"index": 34944, "code_hash": null, "entity": [["tile_f", "sp", [-1, 1, 1, 1]], ["tile_y", "sp", [-1, 1, 1, 1]], ["tile_x", "sp", [-1, 1, 17, 1]], ["tile_rc", "sp", [-1, 12]], ["tile_ry", "sp", [-1, 1]], ["tile_rx", "sp", [-1, 1]], ["auto_unroll_max_step", "ot", 0], ["unroll_explicit", "ot", 0]]}, "result": [[0.0004567040085227273, 0.0004567214346590909, 0.0004567272869318182], 0, 1.6991379261016846, 1679042798.637354], "version": 0.2, "tvm_version": "0.10.0"}
{"input": ["cuda -keys=cuda,gpu -arch=sm_86 -max_num_threads=1024 -thread_warp_size=32", "conv2d_nchw.cuda", [["TENSOR", [1, 192, 17, 17], "float32"], ["TENSOR", [192, 192, 1, 7], "float32"], [1, 1], [0, 3, 0, 3], [1, 1], "float32"], {}], "config": {"index": 3360, "code_hash": null, "entity": [["tile_f", "sp", [-1, 1, 1, 1]], ["tile_y", "sp", [-1, 1, 17, 1]], ["tile_x", "sp", [-1, 1, 17, 1]], ["tile_rc", "sp", [-1, 1]], ["tile_ry", "sp", [-1, 1]], ["tile_rx", "sp", [-1, 1]], ["auto_unroll_max_step", "ot", 0], ["unroll_explicit", "ot", 0]]}, "result": [[0.00028477004432624114, 0.00028477548226950354, 0.00028477548226950354], 0, 1.5914294719696045, 1679042799.8571224], "version": 0.2, "tvm_version": "0.10.0"}
{"input": ["cuda -keys=cuda,gpu -arch=sm_86 -max_num_threads=1024 -thread_warp_size=32", "conv2d_nchw.cuda", [["TENSOR", [1, 192, 17, 17], "float32"], ["TENSOR", [192, 192, 1, 7], "float32"], [1, 1], [0, 3, 0, 3], [1, 1], "float32"], {}], "config": {"index": 2694, "code_hash": null, "entity": [["tile_f", "sp", [-1, 12, 1, 1]], ["tile_y", "sp", [-1, 1, 1, 1]], ["tile_x", "sp", [-1, 1, 17, 1]], ["tile_rc", "sp", [-1, 1]], ["tile_ry", "sp", [-1, 1]], ["tile_rx", "sp", [-1, 1]], ["auto_unroll_max_step", "ot", 0], ["unroll_explicit", "ot", 0]]}, "result": [[0.00011274299290780143, 0.00011275038439716311, 0.00011275329574468084], 0, 1.6103785037994385, 1679042801.0863364], "version": 0.2, "tvm_version": "0.10.0"}
{"input": ["cuda -keys=cuda,gpu -arch=sm_86 -max_num_threads=1024 -thread_warp_size=32", "conv2d_nchw.cuda", [["TENSOR", [1, 192, 17, 17], "float32"], ["TENSOR", [192, 192, 1, 7], "float32"], [1, 1], [0, 3, 0, 3], [1, 1], "float32"], {}], "config": {"index": 40320, "code_hash": null, "entity": [["tile_f", "sp", [-1, 1, 1, 1]], ["tile_y", "sp", [-1, 1, 1, 1]], ["tile_x", "sp", [-1, 1, 17, 1]], ["tile_rc", "sp", [-1, 16]], ["tile_ry", "sp", [-1, 1]], ["tile_rx", "sp", [-1, 1]], ["auto_unroll_max_step", "ot", 0], ["unroll_explicit", "ot", 0]]}, "result": [[0.0008367005000000001, 0.0008367274583333334, 0.000836735975], 0, 1.331268072128296, 1679042801.915949], "version": 0.2, "tvm_version": "0.10.0"}
{"input": ["cuda -keys=cuda,gpu -arch=sm_86 -max_num_threads=1024 -thread_warp_size=32", "conv2d_nchw.cuda", [["TENSOR", [1, 192, 17, 17], "float32"], ["TENSOR", [192, 192, 1, 7], "float32"], [1, 1], [0, 3, 0, 3], [1, 1], "float32"], {}], "config": {"index": 3696, "code_hash": null, "entity": [["tile_f", "sp", [-1, 1, 1, 1]], ["tile_y", "sp", [-1, 1, 1, 17]], ["tile_x", "sp", [-1, 1, 17, 1]], ["tile_rc", "sp", [-1, 1]], ["tile_ry", "sp", [-1, 1]], ["tile_rx", "sp", [-1, 1]], ["auto_unroll_max_step", "ot", 0], ["unroll_explicit", "ot", 0]]}, "result": [[0.00020095548362720402, 0.00020096194080604536, 0.00020097083879093197], 0, 1.611633539199829, 1679042803.1325514], "version": 0.2, "tvm_version": "0.10.0"}
{"input": ["cuda -keys=cuda,gpu -arch=sm_86 -max_num_threads=1024 -thread_warp_size=32", "conv2d_nchw.cuda", [["TENSOR", [1, 192, 17, 17], "float32"], ["TENSOR", [192, 192, 1, 7], "float32"], [1, 1], [0, 3, 0, 3], [1, 1], "float32"], {}], "config": {"index": 454278, "code_hash": null, "entity": [["tile_f", "sp", [-1, 12, 1, 1]], ["tile_y", "sp", [-1, 1, 1, 1]], ["tile_x", "sp", [-1, 1, 17, 1]], ["tile_rc", "sp", [-1, 1]], ["tile_ry", "sp", [-1, 1]], ["tile_rx", "sp", [-1, 1]], ["auto_unroll_max_step", "ot", 0], ["unroll_explicit", "ot", 1]]}, "result": [[0.00011220207551164432, 0.00011221362949894142, 0.0001122215878616796], 0, 1.5649428367614746, 1679042805.1920695], "version": 0.2, "tvm_version": "0.10.0"}
{"input": ["cuda -keys=cuda,gpu -arch=sm_86 -max_num_threads=1024 -thread_warp_size=32", "conv2d_nchw.cuda", [["TENSOR", [1, 192, 17, 17], "float32"], ["TENSOR", [192, 192, 1, 7], "float32"], [1, 1], [0, 3, 0, 3], [1, 1], "float32"], {}], "config": {"index": 153222, "code_hash": null, "entity": [["tile_f", "sp", [-1, 12, 1, 1]], ["tile_y", "sp", [-1, 1, 1, 1]], ["tile_x", "sp", [-1, 1, 17, 1]], ["tile_rc", "sp", [-1, 1]], ["tile_ry", "sp", [-1, 1]], ["tile_rx", "sp", [-1, 1]], ["auto_unroll_max_step", "ot", 512], ["unroll_explicit", "ot", 0]]}, "result": [[0.00011220496118560338, 0.00011220636132674663, 0.00011220857939308399], 0, 1.5812785625457764, 1679042806.390341], "version": 0.2, "tvm_version": "0.10.0"}
{"input": ["cuda -keys=cuda,gpu -arch=sm_86 -max_num_threads=1024 -thread_warp_size=32", "conv2d_nchw.cuda", [["TENSOR", [1, 192, 17, 17], "float32"], ["TENSOR", [192, 192, 1, 7], "float32"], [1, 1], [0, 3, 0, 3], [1, 1], "float32"], {}], "config": {"index": 77958, "code_hash": null, "entity": [["tile_f", "sp", [-1, 12, 1, 1]], ["tile_y", "sp", [-1, 1, 1, 1]], ["tile_x", "sp", [-1, 1, 17, 1]], ["tile_rc", "sp", [-1, 1]], ["tile_ry", "sp", [-1, 1]], ["tile_rx", "sp", [-1, 7]], ["auto_unroll_max_step", "ot", 0], ["unroll_explicit", "ot", 0]]}, "result": [[0.0001079768835477319, 0.00010797757549085984, 0.00010798034394041976], 0, 1.610471487045288, 1679042807.6069283], "version": 0.2, "tvm_version": "0.10.0"}
{"input": ["cuda -keys=cuda,gpu -arch=sm_86 -max_num_threads=1024 -thread_warp_size=32", "conv2d_nchw.cuda", [["TENSOR", [1, 192, 17, 17], "float32"], ["TENSOR", [192, 192, 1, 7], "float32"], [1, 1], [0, 3, 0, 3], [1, 1], "float32"], {}], "config": {"index": 8070, "code_hash": null, "entity": [["tile_f", "sp", [-1, 12, 1, 1]], ["tile_y", "sp", [-1, 1, 1, 1]], ["tile_x", "sp", [-1, 1, 17, 1]], ["tile_rc", "sp", [-1, 2]], ["tile_ry", "sp", [-1, 1]], ["tile_rx", "sp", [-1, 1]], ["auto_unroll_max_step", "ot", 0], ["unroll_explicit", "ot", 0]]}, "result": [[8.973566211604094e-05, 8.983648464163822e-05, 8.983881968145619e-05], 0, 1.6187679767608643, 1679042808.816224], "version": 0.2, "tvm_version": "0.10.0"}
{"input": ["cuda -keys=cuda,gpu -arch=sm_86 -max_num_threads=1024 -thread_warp_size=32", "conv2d_nchw.cuda", [["TENSOR", [1, 192, 17, 17], "float32"], ["TENSOR", [192, 192, 1, 7], "float32"], [1, 1], [0, 3, 0, 3], [1, 1], "float32"], {}], "config": {"index": 4038, "code_hash": null, "entity": [["tile_f", "sp", [-1, 12, 1, 1]], ["tile_y", "sp", [-1, 1, 1, 1]], ["tile_x", "sp", [-1, 1, 1, 17]], ["tile_rc", "sp", [-1, 1]], ["tile_ry", "sp", [-1, 1]], ["tile_rx", "sp", [-1, 1]], ["auto_unroll_max_step", "ot", 0], ["unroll_explicit", "ot", 0]]}, "result": [[0.000503068778125, 0.0005030746906250001, 0.000503075215625], 0, 1.7658970355987549, 1679042810.0369189], "version": 0.2, "tvm_version": "0.10.0"}
{"input": ["cuda -keys=cuda,gpu -arch=sm_86 -max_num_threads=1024 -thread_warp_size=32", "conv2d_nchw.cuda", [["TENSOR", [1, 192, 17, 17], "float32"], ["TENSOR", [192, 192, 1, 7], "float32"], [1, 1], [0, 3, 0, 3], [1, 1], "float32"], {}], "config": {"index": 1350, "code_hash": null, "entity": [["tile_f", "sp", [-1, 12, 1, 1]], ["tile_y", "sp", [-1, 1, 1, 1]], ["tile_x", "sp", [-1, 17, 1, 1]], ["tile_rc", "sp", [-1, 1]], ["tile_ry", "sp", [-1, 1]], ["tile_rx", "sp", [-1, 1]], ["auto_unroll_max_step", "ot", 0], ["unroll_explicit", "ot", 0]]}, "result": [[0.0005031030150753769, 0.000503108190954774, 0.0005031133266331658], 0, 1.37135648727417, 1679042810.8529153], "version": 0.2, "tvm_version": "0.10.0"}
{"input": ["cuda -keys=cuda,gpu -arch=sm_86 -max_num_threads=1024 -thread_warp_size=32", "conv2d_nchw.cuda", [["TENSOR", [1, 192, 17, 17], "float32"], ["TENSOR", [192, 192, 1, 7], "float32"], [1, 1], [0, 3, 0, 3], [1, 1], "float32"], {}], "config": {"index": 3030, "code_hash": null, "entity": [["tile_f", "sp", [-1, 12, 1, 1]], ["tile_y", "sp", [-1, 17, 1, 1]], ["tile_x", "sp", [-1, 1, 17, 1]], ["tile_rc", "sp", [-1, 1]], ["tile_ry", "sp", [-1, 1]], ["tile_rx", "sp", [-1, 1]], ["auto_unroll_max_step", "ot", 0], ["unroll_explicit", "ot", 0]]}, "result": [[0.0004256559497354498, 0.00042566434656084656, 0.0004256751640211641], 0, 2.0059618949890137, 1679042812.1146479], "version": 0.2, "tvm_version": "0.10.0"}
{"input": ["cuda -keys=cuda,gpu -arch=sm_86 -max_num_threads=1024 -thread_warp_size=32", "conv2d_nchw.cuda", [["TENSOR", [1, 192, 17, 17], "float32"], ["TENSOR", [192, 192, 1, 7], "float32"], [1, 1], [0, 3, 0, 3], [1, 1], "float32"], {}], "config": {"index": 303750, "code_hash": null, "entity": [["tile_f", "sp", [-1, 12, 1, 1]], ["tile_y", "sp", [-1, 1, 1, 1]], ["tile_x", "sp", [-1, 1, 17, 1]], ["tile_rc", "sp", [-1, 1]], ["tile_ry", "sp", [-1, 1]], ["tile_rx", "sp", [-1, 1]], ["auto_unroll_max_step", "ot", 1500], ["unroll_explicit", "ot", 0]]}, "result": [[0.00011220679690794097, 0.0001122096711173577, 0.00011221329515108924], 0, 1.626974105834961, 1679042813.3407624], "version": 0.2, "tvm_version": "0.10.0"}
{"input": ["cuda -keys=cuda,gpu -arch=sm_86 -max_num_threads=1024 -thread_warp_size=32", "conv2d_nchw.cuda", [["TENSOR", [1, 192, 17, 17], "float32"], ["TENSOR", [192, 192, 1, 7], "float32"], [1, 1], [0, 3, 0, 3], [1, 1], "float32"], {}], "config": {"index": 45702, "code_hash": null, "entity": [["tile_f", "sp", [-1, 12, 1, 1]], ["tile_y", "sp", [-1, 1, 1, 1]], ["tile_x", "sp", [-1, 1, 17, 1]], ["tile_rc", "sp", [-1, 24]], ["tile_ry", "sp", [-1, 1]], ["tile_rx", "sp", [-1, 1]], ["auto_unroll_max_step", "ot", 0], ["unroll_explicit", "ot", 0]]}, "result": [[8.810087185104054e-05, 8.813291018619933e-05, 8.813634446878422e-05], 0, 1.672945261001587, 1679042814.5708487], "version": 0.2, "tvm_version": "0.10.0"}
{"input": ["cuda -keys=cuda,gpu -arch=sm_86 -max_num_threads=1024 -thread_warp_size=32", "conv2d_nchw.cuda", [["TENSOR", [1, 192, 17, 17], "float32"], ["TENSOR", [192, 192, 1, 7], "float32"], [1, 1], [0, 3, 0, 3], [1, 1], "float32"], {}], "config": {"index": 2702, "code_hash": null, "entity": [["tile_f", "sp", [-1, 1, 2, 1]], ["tile_y", "sp", [-1, 1, 1, 1]], ["tile_x", "sp", [-1, 1, 17, 1]], ["tile_rc", "sp", [-1, 1]], ["tile_ry", "sp", [-1, 1]], ["tile_rx", "sp", [-1, 1]], ["auto_unroll_max_step", "ot", 0], ["unroll_explicit", "ot", 0]]}, "result": [[0.0005258923745928339, 0.000525895703583062, 0.0005259056938110749], 0, 1.622330665588379, 1679042815.804857], "version": 0.2, "tvm_version": "0.10.0"}
{"input": ["cuda -keys=cuda,gpu -arch=sm_86 -max_num_threads=1024 -thread_warp_size=32", "conv2d_nchw.cuda", [["TENSOR", [1, 192, 17, 17], "float32"], ["TENSOR", [192, 192, 1, 7], "float32"], [1, 1], [0, 3, 0, 3], [1, 1], "float32"], {}], "config": {"index": 51078, "code_hash": null, "entity": [["tile_f", "sp", [-1, 12, 1, 1]], ["tile_y", "sp", [-1, 1, 1, 1]], ["tile_x", "sp", [-1, 1, 17, 1]], ["tile_rc", "sp", [-1, 32]], ["tile_ry", "sp", [-1, 1]], ["tile_rx", "sp", [-1, 1]], ["auto_unroll_max_step", "ot", 0], ["unroll_explicit", "ot", 0]]}, "result": [[0.00013726846968403072, 0.00013727546712211786, 0.00013727895986336464], 0, 1.718390703201294, 1679042817.0298688], "version": 0.2, "tvm_version": "0.10.0"}
{"input": ["cuda -keys=cuda,gpu -arch=sm_86 -max_num_threads=1024 -thread_warp_size=32", "conv2d_nchw.cuda", [["TENSOR", [1, 192, 17, 17], "float32"], ["TENSOR", [192, 192, 1, 7], "float32"], [1, 1], [0, 3, 0, 3], [1, 1], "float32"], {}], "config": {"index": 2703, "code_hash": null, "entity": [["tile_f", "sp", [-1, 2, 2, 1]], ["tile_y", "sp", [-1, 1, 1, 1]], ["tile_x", "sp", [-1, 1, 17, 1]], ["tile_rc", "sp", [-1, 1]], ["tile_ry", "sp", [-1, 1]], ["tile_rx", "sp", [-1, 1]], ["auto_unroll_max_step", "ot", 0], ["unroll_explicit", "ot", 0]]}, "result": [[0.00026908215075376887, 0.00026908526800670013, 0.00026908879564489107], 0, 1.608095645904541, 1679042818.250233], "version": 0.2, "tvm_version": "0.10.0"}
{"input": ["cuda -keys=cuda,gpu -arch=sm_86 -max_num_threads=1024 -thread_warp_size=32", "conv2d_nchw.cuda", [["TENSOR", [1, 192, 17, 17], "float32"], ["TENSOR", [192, 192, 1, 7], "float32"], [1, 1], [0, 3, 0, 3], [1, 1], "float32"], {}], "config": {"index": 56454, "code_hash": null, "entity": [["tile_f", "sp", [-1, 12, 1, 1]], ["tile_y", "sp", [-1, 1, 1, 1]], ["tile_x", "sp", [-1, 1, 17, 1]], ["tile_rc", "sp", [-1, 48]], ["tile_ry", "sp", [-1, 1]], ["tile_rx", "sp", [-1, 1]], ["auto_unroll_max_step", "ot", 0], ["unroll_explicit", "ot", 0]]}, "result": [[0.0001819264255079007, 0.00018195532392776523, 0.00018196341873589168], 0, 1.6792311668395996, 1679042819.4727058], "version": 0.2, "tvm_version": "0.10.0"}
{"input": ["cuda -keys=cuda,gpu -arch=sm_86 -max_num_threads=1024 -thread_warp_size=32", "conv2d_nchw.cuda", [["TENSOR", [1, 192, 17, 17], "float32"], ["TENSOR", [192, 192, 1, 7], "float32"], [1, 1], [0, 3, 0, 3], [1, 1], "float32"], {}], "config": {"index": 6, "code_hash": null, "entity": [["tile_f", "sp", [-1, 12, 1, 1]], ["tile_y", "sp", [-1, 1, 1, 1]], ["tile_x", "sp", [-1, 1, 1, 1]], ["tile_rc", "sp", [-1, 1]], ["tile_ry", "sp", [-1, 1]], ["tile_rx", "sp", [-1, 1]], ["auto_unroll_max_step", "ot", 0], ["unroll_explicit", "ot", 0]]}, "result": [[0.0022180285217391306, 0.002218117586956522, 0.0022182957173913042], 0, 1.230842113494873, 1679042820.307725], "version": 0.2, "tvm_version": "0.10.0"}
{"input": ["cuda -keys=cuda,gpu -arch=sm_86 -max_num_threads=1024 -thread_warp_size=32", "conv2d_nchw.cuda", [["TENSOR", [1, 192, 17, 17], "float32"], ["TENSOR", [192, 192, 1, 7], "float32"], [1, 1], [0, 3, 0, 3], [1, 1], "float32"], {}], "config": {"index": 3366, "code_hash": null, "entity": [["tile_f", "sp", [-1, 12, 1, 1]], ["tile_y", "sp", [-1, 1, 17, 1]], ["tile_x", "sp", [-1, 1, 17, 1]], ["tile_rc", "sp", [-1, 1]], ["tile_ry", "sp", [-1, 1]], ["tile_rx", "sp", [-1, 1]], ["auto_unroll_max_step", "ot", 0], ["unroll_explicit", "ot", 0]]}, "result": [[0.000175621466083151, 0.00017562495514223195, 0.000175626090809628], 0, 1.6151537895202637, 1679042821.52768], "version": 0.2, "tvm_version": "0.10.0"}
{"input": ["cuda -keys=cuda,gpu -arch=sm_86 -max_num_threads=1024 -thread_warp_size=32", "conv2d_nchw.cuda", [["TENSOR", [1, 192, 17, 17], "float32"], ["TENSOR", [192, 192, 1, 7], "float32"], [1, 1], [0, 3, 0, 3], [1, 1], "float32"], {}], "config": {"index": 2704, "code_hash": null, "entity": [["tile_f", "sp", [-1, 3, 2, 1]], ["tile_y", "sp", [-1, 1, 1, 1]], ["tile_x", "sp", [-1, 1, 17, 1]], ["tile_rc", "sp", [-1, 1]], ["tile_ry", "sp", [-1, 1]], ["tile_rx", "sp", [-1, 1]], ["auto_unroll_max_step", "ot", 0], ["unroll_explicit", "ot", 0]]}, "result": [[0.0002548380507131537, 0.0002548526561014263, 0.00025485427733755944], 0, 1.608367681503296, 1679042822.7510428], "version": 0.2, "tvm_version": "0.10.0"}
{"input": ["cuda -keys=cuda,gpu -arch=sm_86 -max_num_threads=1024 -thread_warp_size=32", "conv2d_nchw.cuda", [["TENSOR", [1, 192, 17, 17], "float32"], ["TENSOR", [192, 192, 1, 7], "float32"], [1, 1], [0, 3, 0, 3], [1, 1], "float32"], {}], "config": {"index": 497286, "code_hash": null, "entity": [["tile_f", "sp", [-1, 12, 1, 1]], ["tile_y", "sp", [-1, 1, 1, 1]], ["tile_x", "sp", [-1, 1, 17, 1]], ["tile_rc", "sp", [-1, 24]], ["tile_ry", "sp", [-1, 1]], ["tile_rx", "sp", [-1, 1]], ["auto_unroll_max_step", "ot", 0], ["unroll_explicit", "ot", 1]]}, "result": [[8.798821480244853e-05, 8.812140845854202e-05, 8.813067278797997e-05], 0, 1.641240119934082, 1679042824.77551], "version": 0.2, "tvm_version": "0.10.0"}
{"input": ["cuda -keys=cuda,gpu -arch=sm_86 -max_num_threads=1024 -thread_warp_size=32", "conv2d_nchw.cuda", [["TENSOR", [1, 192, 17, 17], "float32"], ["TENSOR", [192, 192, 1, 7], "float32"], [1, 1], [0, 3, 0, 3], [1, 1], "float32"], {}], "config": {"index": 196230, "code_hash": null, "entity": [["tile_f", "sp", [-1, 12, 1, 1]], ["tile_y", "sp", [-1, 1, 1, 1]], ["tile_x", "sp", [-1, 1, 17, 1]], ["tile_rc", "sp", [-1, 24]], ["tile_ry", "sp", [-1, 1]], ["tile_rx", "sp", [-1, 1]], ["auto_unroll_max_step", "ot", 512], ["unroll_explicit", "ot", 0]]}, "result": [[8.9704125e-05, 8.971062386877827e-05, 8.971116742081447e-05], 0, 1.9359941482543945, 1679042825.9951725], "version": 0.2, "tvm_version": "0.10.0"}
{"input": ["cuda -keys=cuda,gpu -arch=sm_86 -max_num_threads=1024 -thread_warp_size=32", "conv2d_nchw.cuda", [["TENSOR", [1, 192, 17, 17], "float32"], ["TENSOR", [192, 192, 1, 7], "float32"], [1, 1], [0, 3, 0, 3], [1, 1], "float32"], {}], "config": {"index": 120966, "code_hash": null, "entity": [["tile_f", "sp", [-1, 12, 1, 1]], ["tile_y", "sp", [-1, 1, 1, 1]], ["tile_x", "sp", [-1, 1, 17, 1]], ["tile_rc", "sp", [-1, 24]], ["tile_ry", "sp", [-1, 1]], ["tile_rx", "sp", [-1, 7]], ["auto_unroll_max_step", "ot", 0], ["unroll_explicit", "ot", 0]]}, "result": [[0.0001602933346653347, 0.00016029845654345654, 0.0001603074955044955], 0, 1.8402574062347412, 1679042827.225907], "version": 0.2, "tvm_version": "0.10.0"}
{"input": ["cuda -keys=cuda,gpu -arch=sm_86 -max_num_threads=1024 -thread_warp_size=32", "conv2d_nchw.cuda", [["TENSOR", [1, 192, 17, 17], "float32"], ["TENSOR", [192, 192, 1, 7], "float32"], [1, 1], [0, 3, 0, 3], [1, 1], "float32"], {}], "config": {"index": 40326, "code_hash": null, "entity": [["tile_f", "sp", [-1, 12, 1, 1]], ["tile_y", "sp", [-1, 1, 1, 1]], ["tile_x", "sp", [-1, 1, 17, 1]], ["tile_rc", "sp", [-1, 16]], ["tile_ry", "sp", [-1, 1]], ["tile_rx", "sp", [-1, 1]], ["auto_unroll_max_step", "ot", 0], ["unroll_explicit", "ot", 0]]}, "result": [[9.841430572851806e-05, 9.85507509339975e-05, 9.856286488169364e-05], 0, 1.909602165222168, 1679042828.4699929], "version": 0.2, "tvm_version": "0.10.0"}
{"input": ["cuda -keys=cuda,gpu -arch=sm_86 -max_num_threads=1024 -thread_warp_size=32", "conv2d_nchw.cuda", [["TENSOR", [1, 192, 17, 17], "float32"], ["TENSOR", [192, 192, 1, 7], "float32"], [1, 1], [0, 3, 0, 3], [1, 1], "float32"], {}], "config": {"index": 47046, "code_hash": null, "entity": [["tile_f", "sp", [-1, 12, 1, 1]], ["tile_y", "sp", [-1, 1, 1, 1]], ["tile_x", "sp", [-1, 1, 1, 17]], ["tile_rc", "sp", [-1, 24]], ["tile_ry", "sp", [-1, 1]], ["tile_rx", "sp", [-1, 1]], ["auto_unroll_max_step", "ot", 0], ["unroll_explicit", "ot", 0]]}, "result": [[0.0006873359316239317, 0.0006873572564102564, 0.000687379688034188], 0, 1.8471457958221436, 1679042829.6917202], "version": 0.2, "tvm_version": "0.10.0"}
{"input": ["cuda -keys=cuda,gpu -arch=sm_86 -max_num_threads=1024 -thread_warp_size=32", "conv2d_nchw.cuda", [["TENSOR", [1, 192, 17, 17], "float32"], ["TENSOR", [192, 192, 1, 7], "float32"], [1, 1], [0, 3, 0, 3], [1, 1], "float32"], {}], "config": {"index": 44358, "code_hash": null, "entity": [["tile_f", "sp", [-1, 12, 1, 1]], ["tile_y", "sp", [-1, 1, 1, 1]], ["tile_x", "sp", [-1, 17, 1, 1]], ["tile_rc", "sp", [-1, 24]], ["tile_ry", "sp", [-1, 1]], ["tile_rx", "sp", [-1, 1]], ["auto_unroll_max_step", "ot", 0], ["unroll_explicit", "ot", 0]]}, "result": [[0.000684283690677966, 0.000684296686440678, 0.0006843010169491525], 0, 1.9045264720916748, 1679042830.958731], "version": 0.2, "tvm_version": "0.10.0"}
{"input": ["cuda -keys=cuda,gpu -arch=sm_86 -max_num_threads=1024 -thread_warp_size=32", "conv2d_nchw.cuda", [["TENSOR", [1, 192, 17, 17], "float32"], ["TENSOR", [192, 192, 1, 7], "float32"], [1, 1], [0, 3, 0, 3], [1, 1], "float32"], {}], "config": {"index": 46038, "code_hash": null, "entity": [["tile_f", "sp", [-1, 12, 1, 1]], ["tile_y", "sp", [-1, 17, 1, 1]], ["tile_x", "sp", [-1, 1, 17, 1]], ["tile_rc", "sp", [-1, 24]], ["tile_ry", "sp", [-1, 1]], ["tile_rx", "sp", [-1, 1]], ["auto_unroll_max_step", "ot", 0], ["unroll_explicit", "ot", 0]]}, "result": [[0.0015958471111111113, 0.0015959445873015873, 0.0015959603333333332], 0, 1.4185128211975098, 1679042831.789552], "version": 0.2, "tvm_version": "0.10.0"}
{"input": ["cuda -keys=cuda,gpu -arch=sm_86 -max_num_threads=1024 -thread_warp_size=32", "conv2d_nchw.cuda", [["TENSOR", [1, 192, 17, 17], "float32"], ["TENSOR", [192, 192, 1, 7], "float32"], [1, 1], [0, 3, 0, 3], [1, 1], "float32"], {}], "config": {"index": 45703, "code_hash": null, "entity": [["tile_f", "sp", [-1, 16, 1, 1]], ["tile_y", "sp", [-1, 1, 1, 1]], ["tile_x", "sp", [-1, 1, 17, 1]], ["tile_rc", "sp", [-1, 24]], ["tile_ry", "sp", [-1, 1]], ["tile_rx", "sp", [-1, 1]], ["auto_unroll_max_step", "ot", 0], ["unroll_explicit", "ot", 0]]}, "result": [[0.00019260630980861244, 0.0001926243791866029, 0.00019264777870813397], 0, 1.6910686492919922, 1679042833.0272138], "version": 0.2, "tvm_version": "0.10.0"}
{"input": ["cuda -keys=cuda,gpu -arch=sm_86 -max_num_threads=1024 -thread_warp_size=32", "conv2d_nchw.cuda", [["TENSOR", [1, 192, 17, 17], "float32"], ["TENSOR", [192, 192, 1, 7], "float32"], [1, 1], [0, 3, 0, 3], [1, 1], "float32"], {}], "config": {"index": 45701, "code_hash": null, "entity": [["tile_f", "sp", [-1, 8, 1, 1]], ["tile_y", "sp", [-1, 1, 1, 1]], ["tile_x", "sp", [-1, 1, 17, 1]], ["tile_rc", "sp", [-1, 24]], ["tile_ry", "sp", [-1, 1]], ["tile_rx", "sp", [-1, 1]], ["auto_unroll_max_step", "ot", 0], ["unroll_explicit", "ot", 0]]}, "result": [[0.00010227249106002554, 0.00010227314431673052, 0.00010227444955300127], 0, 1.6541190147399902, 1679042834.24252], "version": 0.2, "tvm_version": "0.10.0"}
{"input": ["cuda -keys=cuda,gpu -arch=sm_86 -max_num_threads=1024 -thread_warp_size=32", "conv2d_nchw.cuda", [["TENSOR", [1, 192, 17, 17], "float32"], ["TENSOR", [192, 192, 1, 7], "float32"], [1, 1], [0, 3, 0, 3], [1, 1], "float32"], {}], "config": {"index": 346758, "code_hash": null, "entity": [["tile_f", "sp", [-1, 12, 1, 1]], ["tile_y", "sp", [-1, 1, 1, 1]], ["tile_x", "sp", [-1, 1, 17, 1]], ["tile_rc", "sp", [-1, 24]], ["tile_ry", "sp", [-1, 1]], ["tile_rx", "sp", [-1, 1]], ["auto_unroll_max_step", "ot", 1500], ["unroll_explicit", "ot", 0]]}, "result": [[8.97059481981982e-05, 8.970897240990991e-05, 8.971358614864866e-05], 0, 1.9268097877502441, 1679042835.4595537], "version": 0.2, "tvm_version": "0.10.0"}
{"input": ["cuda -keys=cuda,gpu -arch=sm_86 -max_num_threads=1024 -thread_warp_size=32", "conv2d_nchw.cuda", [["TENSOR", [1, 192, 17, 17], "float32"], ["TENSOR", [192, 192, 1, 7], "float32"], [1, 1], [0, 3, 0, 3], [1, 1], "float32"], {}], "config": {"index": 29574, "code_hash": null, "entity": [["tile_f", "sp", [-1, 12, 1, 1]], ["tile_y", "sp", [-1, 1, 1, 1]], ["tile_x", "sp", [-1, 1, 17, 1]], ["tile_rc", "sp", [-1, 8]], ["tile_ry", "sp", [-1, 1]], ["tile_rx", "sp", [-1, 1]], ["auto_unroll_max_step", "ot", 0], ["unroll_explicit", "ot", 0]]}, "result": [[0.000111860670414617, 0.000111860670414617, 0.00011186354392129304], 0, 1.7828707695007324, 1679042836.7153933], "version": 0.2, "tvm_version": "0.10.0"}
{"input": ["cuda -keys=cuda,gpu -arch=sm_86 -max_num_threads=1024 -thread_warp_size=32", "conv2d_nchw.cuda", [["TENSOR", [1, 192, 17, 17], "float32"], ["TENSOR", [192, 192, 1, 7], "float32"], [1, 1], [0, 3, 0, 3], [1, 1], "float32"], {}], "config": {"index": 46710, "code_hash": null, "entity": [["tile_f", "sp", [-1, 12, 1, 1]], ["tile_y", "sp", [-1, 1, 1, 17]], ["tile_x", "sp", [-1, 1, 17, 1]], ["tile_rc", "sp", [-1, 24]], ["tile_ry", "sp", [-1, 1]], ["tile_rx", "sp", [-1, 1]], ["auto_unroll_max_step", "ot", 0], ["unroll_explicit", "ot", 0]]}, "result": [[0.0016063146349206351, 0.0016063308571428571, 0.0016063308571428571], 0, 1.455744981765747, 1679042837.551525], "version": 0.2, "tvm_version": "0.10.0"}
{"input": ["cuda -keys=cuda,gpu -arch=sm_86 -max_num_threads=1024 -thread_warp_size=32", "conv2d_nchw.cuda", [["TENSOR", [1, 192, 17, 17], "float32"], ["TENSOR", [192, 192, 1, 7], "float32"], [1, 1], [0, 3, 0, 3], [1, 1], "float32"], {}], "config": {"index": 45713, "code_hash": null, "entity": [["tile_f", "sp", [-1, 4, 2, 1]], ["tile_y", "sp", [-1, 1, 1, 1]], ["tile_x", "sp", [-1, 1, 17, 1]], ["tile_rc", "sp", [-1, 24]], ["tile_ry", "sp", [-1, 1]], ["tile_rx", "sp", [-1, 1]], ["auto_unroll_max_step", "ot", 0], ["unroll_explicit", "ot", 0]]}, "result": [[7.939457326097681e-05, 7.951525061667489e-05, 7.954413468179577e-05], 0, 1.752274513244629, 1679042838.7804956], "version": 0.2, "tvm_version": "0.10.0"}
{"input": ["cuda -keys=cuda,gpu -arch=sm_86 -max_num_threads=1024 -thread_warp_size=32", "conv2d_nchw.cuda", [["TENSOR", [1, 192, 17, 17], "float32"], ["TENSOR", [192, 192, 1, 7], "float32"], [1, 1], [0, 3, 0, 3], [1, 1], "float32"], {}], "config": {"index": 34950, "code_hash": null, "entity": [["tile_f", "sp", [-1, 12, 1, 1]], ["tile_y", "sp", [-1, 1, 1, 1]], ["tile_x", "sp", [-1, 1, 17, 1]], ["tile_rc", "sp", [-1, 12]], ["tile_ry", "sp", [-1, 1]], ["tile_rx", "sp", [-1, 1]], ["auto_unroll_max_step", "ot", 0], ["unroll_explicit", "ot", 0]]}, "result": [[6.61109255050505e-05, 6.640140109427611e-05, 6.644148106060606e-05], 0, 1.811966896057129, 1679042839.984057], "version": 0.2, "tvm_version": "0.10.0"}
{"input": ["cuda -keys=cuda,gpu -arch=sm_86 -max_num_threads=1024 -thread_warp_size=32", "conv2d_nchw.cuda", [["TENSOR", [1, 192, 17, 17], "float32"], ["TENSOR", [192, 192, 1, 7], "float32"], [1, 1], [0, 3, 0, 3], [1, 1], "float32"], {}], "config": {"index": 45714, "code_hash": null, "entity": [["tile_f", "sp", [-1, 6, 2, 1]], ["tile_y", "sp", [-1, 1, 1, 1]], ["tile_x", "sp", [-1, 1, 17, 1]], ["tile_rc", "sp", [-1, 24]], ["tile_ry", "sp", [-1, 1]], ["tile_rx", "sp", [-1, 1]], ["auto_unroll_max_step", "ot", 0], ["unroll_explicit", "ot", 0]]}, "result": [[8.26844530095037e-05, 8.268719218585007e-05, 8.269313780359029e-05], 0, 1.6608850955963135, 1679042841.2052817], "version": 0.2, "tvm_version": "0.10.0"}
{"input": ["cuda -keys=cuda,gpu -arch=sm_86 -max_num_threads=1024 -thread_warp_size=32", "conv2d_nchw.cuda", [["TENSOR", [1, 192, 17, 17], "float32"], ["TENSOR", [192, 192, 1, 7], "float32"], [1, 1], [0, 3, 0, 3], [1, 1], "float32"], {}], "config": {"index": 45715, "code_hash": null, "entity": [["tile_f", "sp", [-1, 8, 2, 1]], ["tile_y", "sp", [-1, 1, 1, 1]], ["tile_x", "sp", [-1, 1, 17, 1]], ["tile_rc", "sp", [-1, 24]], ["tile_ry", "sp", [-1, 1]], ["tile_rx", "sp", [-1, 1]], ["auto_unroll_max_step", "ot", 0], ["unroll_explicit", "ot", 0]]}, "result": [[9.633102188392007e-05, 9.680648334919125e-05, 9.680745575642245e-05], 0, 1.270343542098999, 1679042842.0312092], "version": 0.2, "tvm_version": "0.10.0"}
{"input": ["cuda -keys=cuda,gpu -arch=sm_86 -max_num_threads=1024 -thread_warp_size=32", "conv2d_nchw.cuda", [["TENSOR", [1, 192, 17, 17], "float32"], ["TENSOR", [192, 192, 1, 7], "float32"], [1, 1], [0, 3, 0, 3], [1, 1], "float32"], {}], "config": {"index": 486534, "code_hash": null, "entity": [["tile_f", "sp", [-1, 12, 1, 1]], ["tile_y", "sp", [-1, 1, 1, 1]], ["tile_x", "sp", [-1, 1, 17, 1]], ["tile_rc", "sp", [-1, 12]], ["tile_ry", "sp", [-1, 1]], ["tile_rx", "sp", [-1, 1]], ["auto_unroll_max_step", "ot", 0], ["unroll_explicit", "ot", 1]]}, "result": [[6.610488554720134e-05, 6.611387259816207e-05, 6.618829908103594e-05], 0, 1.8189589977264404, 1679042844.432093], "version": 0.2, "tvm_version": "0.10.0"}
{"input": ["cuda -keys=cuda,gpu -arch=sm_86 -max_num_threads=1024 -thread_warp_size=32", "conv2d_nchw.cuda", [["TENSOR", [1, 192, 17, 17], "float32"], ["TENSOR", [192, 192, 1, 7], "float32"], [1, 1], [0, 3, 0, 3], [1, 1], "float32"], {}], "config": {"index": 185478, "code_hash": null, "entity": [["tile_f", "sp", [-1, 12, 1, 1]], ["tile_y", "sp", [-1, 1, 1, 1]], ["tile_x", "sp", [-1, 1, 17, 1]], ["tile_rc", "sp", [-1, 12]], ["tile_ry", "sp", [-1, 1]], ["tile_rx", "sp", [-1, 1]], ["auto_unroll_max_step", "ot", 512], ["unroll_explicit", "ot", 0]]}, "result": [[8.968176104190262e-05, 8.96852174405436e-05, 8.968698018120045e-05], 0, 1.7160391807556152, 1679042845.6686053], "version": 0.2, "tvm_version": "0.10.0"}
{"input": ["cuda -keys=cuda,gpu -arch=sm_86 -max_num_threads=1024 -thread_warp_size=32", "conv2d_nchw.cuda", [["TENSOR", [1, 192, 17, 17], "float32"], ["TENSOR", [192, 192, 1, 7], "float32"], [1, 1], [0, 3, 0, 3], [1, 1], "float32"], {}], "config": {"index": 110214, "code_hash": null, "entity": [["tile_f", "sp", [-1, 12, 1, 1]], ["tile_y", "sp", [-1, 1, 1, 1]], ["tile_x", "sp", [-1, 1, 17, 1]], ["tile_rc", "sp", [-1, 12]], ["tile_ry", "sp", [-1, 1]], ["tile_rx", "sp", [-1, 7]], ["auto_unroll_max_step", "ot", 0], ["unroll_explicit", "ot", 0]]}, "result": [[0.00017282366989247313, 0.00017283467849462365, 0.00017284342365591398], 0, 1.7729597091674805, 1679042846.900283], "version": 0.2, "tvm_version": "0.10.0"}
{"input": ["cuda -keys=cuda,gpu -arch=sm_86 -max_num_threads=1024 -thread_warp_size=32", "conv2d_nchw.cuda", [["TENSOR", [1, 192, 17, 17], "float32"], ["TENSOR", [192, 192, 1, 7], "float32"], [1, 1], [0, 3, 0, 3], [1, 1], "float32"], {}], "config": {"index": 36294, "code_hash": null, "entity": [["tile_f", "sp", [-1, 12, 1, 1]], ["tile_y", "sp", [-1, 1, 1, 1]], ["tile_x", "sp", [-1, 1, 1, 17]], ["tile_rc", "sp", [-1, 12]], ["tile_ry", "sp", [-1, 1]], ["tile_rx", "sp", [-1, 1]], ["auto_unroll_max_step", "ot", 0], ["unroll_explicit", "ot", 0]]}, "result": [[0.0008613318770053477, 0.000862432550802139, 0.0008626515561497327], 0, 2.2976577281951904, 1679042848.1252728], "version": 0.2, "tvm_version": "0.10.0"}
{"input": ["cuda -keys=cuda,gpu -arch=sm_86 -max_num_threads=1024 -thread_warp_size=32", "conv2d_nchw.cuda", [["TENSOR", [1, 192, 17, 17], "float32"], ["TENSOR", [192, 192, 1, 7], "float32"], [1, 1], [0, 3, 0, 3], [1, 1], "float32"], {}], "config": {"index": 33606, "code_hash": null, "entity": [["tile_f", "sp", [-1, 12, 1, 1]], ["tile_y", "sp", [-1, 1, 1, 1]], ["tile_x", "sp", [-1, 17, 1, 1]], ["tile_rc", "sp", [-1, 12]], ["tile_ry", "sp", [-1, 1]], ["tile_rx", "sp", [-1, 1]], ["auto_unroll_max_step", "ot", 0], ["unroll_explicit", "ot", 0]]}, "result": [[0.0008612880588235294, 0.000862525801724138, 0.000864234064171123], 0, 2.247098684310913, 1679042849.304432], "version": 0.2, "tvm_version": "0.10.0"}
{"input": ["cuda -keys=cuda,gpu -arch=sm_86 -max_num_threads=1024 -thread_warp_size=32", "conv2d_nchw.cuda", [["TENSOR", [1, 192, 17, 17], "float32"], ["TENSOR", [192, 192, 1, 7], "float32"], [1, 1], [0, 3, 0, 3], [1, 1], "float32"], {}], "config": {"index": 35286, "code_hash": null, "entity": [["tile_f", "sp", [-1, 12, 1, 1]], ["tile_y", "sp", [-1, 17, 1, 1]], ["tile_x", "sp", [-1, 1, 17, 1]], ["tile_rc", "sp", [-1, 12]], ["tile_ry", "sp", [-1, 1]], ["tile_rx", "sp", [-1, 1]], ["auto_unroll_max_step", "ot", 0], ["unroll_explicit", "ot", 0]]}, "result": [[0.0009115229488636365, 0.0009116567215909092, 0.0009116741477272726], 0, 1.8122832775115967, 1679042850.5270486], "version": 0.2, "tvm_version": "0.10.0"}
{"input": ["cuda -keys=cuda,gpu -arch=sm_86 -max_num_threads=1024 -thread_warp_size=32", "conv2d_nchw.cuda", [["TENSOR", [1, 192, 17, 17], "float32"], ["TENSOR", [192, 192, 1, 7], "float32"], [1, 1], [0, 3, 0, 3], [1, 1], "float32"], {}], "config": {"index": 34951, "code_hash": null, "entity": [["tile_f", "sp", [-1, 16, 1, 1]], ["tile_y", "sp", [-1, 1, 1, 1]], ["tile_x", "sp", [-1, 1, 17, 1]], ["tile_rc", "sp", [-1, 12]], ["tile_ry", "sp", [-1, 1]], ["tile_rx", "sp", [-1, 1]], ["auto_unroll_max_step", "ot", 0], ["unroll_explicit", "ot", 0]]}, "result": [[9.033213550600342e-05, 9.034150543167524e-05, 9.034443682104059e-05], 0, 1.83683443069458, 1679042851.7316976], "version": 0.2, "tvm_version": "0.10.0"}
{"input": ["cuda -keys=cuda,gpu -arch=sm_86 -max_num_threads=1024 -thread_warp_size=32", "conv2d_nchw.cuda", [["TENSOR", [1, 192, 17, 17], "float32"], ["TENSOR", [192, 192, 1, 7], "float32"], [1, 1], [0, 3, 0, 3], [1, 1], "float32"], {}], "config": {"index": 34949, "code_hash": null, "entity": [["tile_f", "sp", [-1, 8, 1, 1]], ["tile_y", "sp", [-1, 1, 1, 1]], ["tile_x", "sp", [-1, 1, 17, 1]], ["tile_rc", "sp", [-1, 12]], ["tile_ry", "sp", [-1, 1]], ["tile_rx", "sp", [-1, 1]], ["auto_unroll_max_step", "ot", 0], ["unroll_explicit", "ot", 0]]}, "result": [[0.000110181832986833, 0.00011032944074844075, 0.00011033439986139986], 0, 1.863621473312378, 1679042852.97377], "version": 0.2, "tvm_version": "0.10.0"}
{"input": ["cuda -keys=cuda,gpu -arch=sm_86 -max_num_threads=1024 -thread_warp_size=32", "conv2d_nchw.cuda", [["TENSOR", [1, 192, 17, 17], "float32"], ["TENSOR", [192, 192, 1, 7], "float32"], [1, 1], [0, 3, 0, 3], [1, 1], "float32"], {}], "config": {"index": 336006, "code_hash": null, "entity": [["tile_f", "sp", [-1, 12, 1, 1]], ["tile_y", "sp", [-1, 1, 1, 1]], ["tile_x", "sp", [-1, 1, 17, 1]], ["tile_rc", "sp", [-1, 12]], ["tile_ry", "sp", [-1, 1]], ["tile_rx", "sp", [-1, 1]], ["auto_unroll_max_step", "ot", 1500], ["unroll_explicit", "ot", 0]]}, "result": [[6.626089941077442e-05, 6.626305723905723e-05, 6.627038510101011e-05], 0, 2.2494149208068848, 1679042854.1782978], "version": 0.2, "tvm_version": "0.10.0"}
{"input": ["cuda -keys=cuda,gpu -arch=sm_86 -max_num_threads=1024 -thread_warp_size=32", "conv2d_nchw.cuda", [["TENSOR", [1, 192, 17, 17], "float32"], ["TENSOR", [192, 192, 1, 7], "float32"], [1, 1], [0, 3, 0, 3], [1, 1], "float32"], {}], "config": {"index": 32262, "code_hash": null, "entity": [["tile_f", "sp", [-1, 12, 1, 1]], ["tile_y", "sp", [-1, 1, 1, 1]], ["tile_x", "sp", [-1, 1, 1, 1]], ["tile_rc", "sp", [-1, 12]], ["tile_ry", "sp", [-1, 1]], ["tile_rx", "sp", [-1, 1]], ["auto_unroll_max_step", "ot", 0], ["unroll_explicit", "ot", 0]]}, "result": [[0.0019393354423076924, 0.0019401255384615386, 0.0019408737884615385], 0, 1.2952783107757568, 1679042855.0490093], "version": 0.2, "tvm_version": "0.10.0"}
{"input": ["cuda -keys=cuda,gpu -arch=sm_86 -max_num_threads=1024 -thread_warp_size=32", "conv2d_nchw.cuda", [["TENSOR", [1, 192, 17, 17], "float32"], ["TENSOR", [192, 192, 1, 7], "float32"], [1, 1], [0, 3, 0, 3], [1, 1], "float32"], {}], "config": {"index": 35622, "code_hash": null, "entity": [["tile_f", "sp", [-1, 12, 1, 1]], ["tile_y", "sp", [-1, 1, 17, 1]], ["tile_x", "sp", [-1, 1, 17, 1]], ["tile_rc", "sp", [-1, 12]], ["tile_ry", "sp", [-1, 1]], ["tile_rx", "sp", [-1, 1]], ["auto_unroll_max_step", "ot", 0], ["unroll_explicit", "ot", 0]]}, "result": [[0.00012031805391040242, 0.00012032349962034928, 0.0001203242756264237], 0, 1.7550396919250488, 1679042856.2660346], "version": 0.2, "tvm_version": "0.10.0"}
{"input": ["cuda -keys=cuda,gpu -arch=sm_86 -max_num_threads=1024 -thread_warp_size=32", "conv2d_nchw.cuda", [["TENSOR", [1, 192, 17, 17], "float32"], ["TENSOR", [192, 192, 1, 7], "float32"], [1, 1], [0, 3, 0, 3], [1, 1], "float32"], {}], "config": {"index": 34964, "code_hash": null, "entity": [["tile_f", "sp", [-1, 12, 2, 1]], ["tile_y", "sp", [-1, 1, 1, 1]], ["tile_x", "sp", [-1, 1, 17, 1]], ["tile_rc", "sp", [-1, 12]], ["tile_ry", "sp", [-1, 1]], ["tile_rx", "sp", [-1, 1]], ["auto_unroll_max_step", "ot", 0], ["unroll_explicit", "ot", 0]]}, "result": [[9.508449133293485e-05, 9.508510280932457e-05, 9.508815839808728e-05], 0, 1.6539177894592285, 1679042857.4884052], "version": 0.2, "tvm_version": "0.10.0"}
{"input": ["cuda -keys=cuda,gpu -arch=sm_86 -max_num_threads=1024 -thread_warp_size=32", "conv2d_nchw.cuda", [["TENSOR", [1, 192, 17, 17], "float32"], ["TENSOR", [192, 192, 1, 7], "float32"], [1, 1], [0, 3, 0, 3], [1, 1], "float32"], {}], "config": {"index": 35958, "code_hash": null, "entity": [["tile_f", "sp", [-1, 12, 1, 1]], ["tile_y", "sp", [-1, 1, 1, 17]], ["tile_x", "sp", [-1, 1, 17, 1]], ["tile_rc", "sp", [-1, 12]], ["tile_ry", "sp", [-1, 1]], ["tile_rx", "sp", [-1, 1]], ["auto_unroll_max_step", "ot", 0], ["unroll_explicit", "ot", 0]]}, "result": [[0.0009115834272727272, 0.0009115909909090909, 0.0009116392636363637], 0, 1.3769752979278564, 1679042858.3232493], "version": 0.2, "tvm_version": "0.10.0"}
{"input": ["cuda -keys=cuda,gpu -arch=sm_86 -max_num_threads=1024 -thread_warp_size=32", "conv2d_nchw.cuda", [["TENSOR", [1, 192, 17, 17], "float32"], ["TENSOR", [192, 192, 1, 7], "float32"], [1, 1], [0, 3, 0, 3], [1, 1], "float32"], {}], "config": {"index": 34965, "code_hash": null, "entity": [["tile_f", "sp", [-1, 16, 2, 1]], ["tile_y", "sp", [-1, 1, 1, 1]], ["tile_x", "sp", [-1, 1, 17, 1]], ["tile_rc", "sp", [-1, 12]], ["tile_ry", "sp", [-1, 1]], ["tile_rx", "sp", [-1, 1]], ["auto_unroll_max_step", "ot", 0], ["unroll_explicit", "ot", 0]]}, "result": [[0.0001373137377472055, 0.0001373137377472055, 0.00013731461650902838], 0, 1.6510558128356934, 1679042859.5510974], "version": 0.2, "tvm_version": "0.10.0"}
{"input": ["cuda -keys=cuda,gpu -arch=sm_86 -max_num_threads=1024 -thread_warp_size=32", "conv2d_nchw.cuda", [["TENSOR", [1, 192, 17, 17], "float32"], ["TENSOR", [192, 192, 1, 7], "float32"], [1, 1], [0, 3, 0, 3], [1, 1], "float32"], {}], "config": {"index": 24198, "code_hash": null, "entity": [["tile_f", "sp", [-1, 12, 1, 1]], ["tile_y", "sp", [-1, 1, 1, 1]], ["tile_x", "sp", [-1, 1, 17, 1]], ["tile_rc", "sp", [-1, 6]], ["tile_ry", "sp", [-1, 1]], ["tile_rx", "sp", [-1, 1]], ["auto_unroll_max_step", "ot", 0], ["unroll_explicit", "ot", 0]]}, "result": [[0.00010450432809430257, 0.00010450768565815324, 0.00010465386836935166], 0, 1.7662689685821533, 1679042860.7714128], "version": 0.2, "tvm_version": "0.10.0"}
{"input": ["cuda -keys=cuda,gpu -arch=sm_86 -max_num_threads=1024 -thread_warp_size=32", "conv2d_nchw.cuda", [["TENSOR", [1, 192, 17, 17], "float32"], ["TENSOR", [192, 192, 1, 7], "float32"], [1, 1], [0, 3, 0, 3], [1, 1], "float32"], {}], "config": {"index": 34966, "code_hash": null, "entity": [["tile_f", "sp", [-1, 24, 2, 1]], ["tile_y", "sp", [-1, 1, 1, 1]], ["tile_x", "sp", [-1, 1, 17, 1]], ["tile_rc", "sp", [-1, 12]], ["tile_ry", "sp", [-1, 1]], ["tile_rx", "sp", [-1, 1]], ["auto_unroll_max_step", "ot", 0], ["unroll_explicit", "ot", 0]]}, "result": [[0.0003224799799599198, 0.00032248203006012027, 0.0003224840781563126], 0, 1.6683285236358643, 1679042862.0269659], "version": 0.2, "tvm_version": "0.10.0"}
{"input": ["cuda -keys=cuda,gpu -arch=sm_86 -max_num_threads=1024 -thread_warp_size=32", "conv2d_nchw.cuda", [["TENSOR", [1, 192, 17, 17], "float32"], ["TENSOR", [192, 192, 1, 7], "float32"], [1, 1], [0, 3, 0, 3], [1, 1], "float32"], {}], "config": {"index": 18822, "code_hash": null, "entity": [["tile_f", "sp", [-1, 12, 1, 1]], ["tile_y", "sp", [-1, 1, 1, 1]], ["tile_x", "sp", [-1, 1, 17, 1]], ["tile_rc", "sp", [-1, 4]], ["tile_ry", "sp", [-1, 1]], ["tile_rx", "sp", [-1, 1]], ["auto_unroll_max_step", "ot", 0], ["unroll_explicit", "ot", 0]]}, "result": [[8.920043186936938e-05, 8.934342286036038e-05, 8.962710247747747e-05], 0, 1.671609878540039, 1679042863.9435291], "version": 0.2, "tvm_version": "0.10.0"}
{"input": ["cuda -keys=cuda,gpu -arch=sm_86 -max_num_threads=1024 -thread_warp_size=32", "conv2d_nchw.cuda", [["TENSOR", [1, 192, 17, 17], "float32"], ["TENSOR", [192, 192, 1, 7], "float32"], [1, 1], [0, 3, 0, 3], [1, 1], "float32"], {}], "config": {"index": 34967, "code_hash": null, "entity": [["tile_f", "sp", [-1, 32, 2, 1]], ["tile_y", "sp", [-1, 1, 1, 1]], ["tile_x", "sp", [-1, 1, 17, 1]], ["tile_rc", "sp", [-1, 12]], ["tile_ry", "sp", [-1, 1]], ["tile_rx", "sp", [-1, 1]], ["auto_unroll_max_step", "ot", 0], ["unroll_explicit", "ot", 0]]}, "result": [[0.00041806862337662344, 0.00041808455584415585, 0.00041808455584415585], 0, 1.6678364276885986, 1679042865.1773093], "version": 0.2, "tvm_version": "0.10.0"}
{"input": ["cuda -keys=cuda,gpu -arch=sm_86 -max_num_threads=1024 -thread_warp_size=32", "conv2d_nchw.cuda", [["TENSOR", [1, 192, 17, 17], "float32"], ["TENSOR", [192, 192, 1, 7], "float32"], [1, 1], [0, 3, 0, 3], [1, 1], "float32"], {}], "config": {"index": 13446, "code_hash": null, "entity": [["tile_f", "sp", [-1, 12, 1, 1]], ["tile_y", "sp", [-1, 1, 1, 1]], ["tile_x", "sp", [-1, 1, 17, 1]], ["tile_rc", "sp", [-1, 3]], ["tile_ry", "sp", [-1, 1]], ["tile_rx", "sp", [-1, 1]], ["auto_unroll_max_step", "ot", 0], ["unroll_explicit", "ot", 0]]}, "result": [[8.158095410005158e-05, 8.188245487364621e-05, 8.197756472408458e-05], 0, 1.6433777809143066, 1679042866.3860972], "version": 0.2, "tvm_version": "0.10.0"}
{"input": ["cuda -keys=cuda,gpu -arch=sm_86 -max_num_threads=1024 -thread_warp_size=32", "conv2d_nchw.cuda", [["TENSOR", [1, 192, 17, 17], "float32"], ["TENSOR", [192, 192, 1, 7], "float32"], [1, 1], [0, 3, 0, 3], [1, 1], "float32"], {}], "config": {"index": 34968, "code_hash": null, "entity": [["tile_f", "sp", [-1, 48, 2, 1]], ["tile_y", "sp", [-1, 1, 1, 1]], ["tile_x", "sp", [-1, 1, 17, 1]], ["tile_rc", "sp", [-1, 12]], ["tile_ry", "sp", [-1, 1]], ["tile_rx", "sp", [-1, 1]], ["auto_unroll_max_step", "ot", 0], ["unroll_explicit", "ot", 0]]}, "result": [[0.0006646370264900663, 0.0006646437947019868, 0.0006646845165562914], 0, 1.3238940238952637, 1679042867.2521164], "version": 0.2, "tvm_version": "0.10.0"}
{"input": ["cuda -keys=cuda,gpu -arch=sm_86 -max_num_threads=1024 -thread_warp_size=32", "conv2d_nchw.cuda", [["TENSOR", [1, 192, 17, 17], "float32"], ["TENSOR", [192, 192, 1, 7], "float32"], [1, 1], [0, 3, 0, 3], [1, 1], "float32"], {}], "config": {"index": 61830, "code_hash": null, "entity": [["tile_f", "sp", [-1, 12, 1, 1]], ["tile_y", "sp", [-1, 1, 1, 1]], ["tile_x", "sp", [-1, 1, 17, 1]], ["tile_rc", "sp", [-1, 64]], ["tile_ry", "sp", [-1, 1]], ["tile_rx", "sp", [-1, 1]], ["auto_unroll_max_step", "ot", 0], ["unroll_explicit", "ot", 0]]}, "result": [[0.00012707245211930924, 0.00012709174725274725, 0.00012716890345368918], 0, 1.724196195602417, 1679042868.4818692], "version": 0.2, "tvm_version": "0.10.0"}
{"input": ["cuda -keys=cuda,gpu -arch=sm_86 -max_num_threads=1024 -thread_warp_size=32", "conv2d_nchw.cuda", [["TENSOR", [1, 192, 17, 17], "float32"], ["TENSOR", [192, 192, 1, 7], "float32"], [1, 1], [0, 3, 0, 3], [1, 1], "float32"], {}], "config": {"index": 34969, "code_hash": null, "entity": [["tile_f", "sp", [-1, 96, 2, 1]], ["tile_y", "sp", [-1, 1, 1, 1]], ["tile_x", "sp", [-1, 1, 17, 1]], ["tile_rc", "sp", [-1, 12]], ["tile_ry", "sp", [-1, 1]], ["tile_rx", "sp", [-1, 1]], ["auto_unroll_max_step", "ot", 0], ["unroll_explicit", "ot", 0]]}, "result": [[0.0010537930105263158, 0.0010538468947368421, 0.0010553451473684211], 0, 1.3379833698272705, 1679042869.3142316], "version": 0.2, "tvm_version": "0.10.0"}
{"input": ["cuda -keys=cuda,gpu -arch=sm_86 -max_num_threads=1024 -thread_warp_size=32", "conv2d_nchw.cuda", [["TENSOR", [1, 192, 17, 17], "float32"], ["TENSOR", [192, 192, 1, 7], "float32"], [1, 1], [0, 3, 0, 3], [1, 1], "float32"], {}], "config": {"index": 67206, "code_hash": null, "entity": [["tile_f", "sp", [-1, 12, 1, 1]], ["tile_y", "sp", [-1, 1, 1, 1]], ["tile_x", "sp", [-1, 1, 17, 1]], ["tile_rc", "sp", [-1, 96]], ["tile_ry", "sp", [-1, 1]], ["tile_rx", "sp", [-1, 1]], ["auto_unroll_max_step", "ot", 0], ["unroll_explicit", "ot", 0]]}, "result": [[0.00015478260019361083, 0.00015559447725072603, 0.00015560438915779285], 0, 1.7480170726776123, 1679042870.5323944], "version": 0.2, "tvm_version": "0.10.0"}
{"input": ["cuda -keys=cuda,gpu -arch=sm_86 -max_num_threads=1024 -thread_warp_size=32", "conv2d_nchw.cuda", [["TENSOR", [1, 192, 17, 17], "float32"], ["TENSOR", [192, 192, 1, 7], "float32"], [1, 1], [0, 3, 0, 3], [1, 1], "float32"], {}], "config": {"index": 34970, "code_hash": null, "entity": [["tile_f", "sp", [-1, 1, 3, 1]], ["tile_y", "sp", [-1, 1, 1, 1]], ["tile_x", "sp", [-1, 1, 17, 1]], ["tile_rc", "sp", [-1, 12]], ["tile_ry", "sp", [-1, 1]], ["tile_rx", "sp", [-1, 1]], ["auto_unroll_max_step", "ot", 0], ["unroll_explicit", "ot", 0]]}, "result": [[0.00013456428259041208, 0.00013468829100084101, 0.0001346917434819176], 0, 1.6174721717834473, 1679042871.7482715], "version": 0.2, "tvm_version": "0.10.0"}
