src/tvm/results/cuda_rtx3080/inception_v3/droplet/cpu.log_layer_4.log
{"input": ["cuda -keys=cuda,gpu -arch=sm_86 -max_num_threads=1024 -thread_warp_size=32", "conv2d_nchw_winograd.cuda", [["TENSOR", [1, 32, 147, 147], "float32"], ["TENSOR", [64, 32, 3, 3], "float32"], [1, 1], [1, 1, 1, 1], [1, 1], "float32"], {}], "config": {"index": 0, "code_hash": null, "entity": [["tile_b", "sp", [-1, 1, 1, 1]], ["tile_y", "sp", [-1, 1, 1, 1]], ["tile_x", "sp", [-1, 1, 1, 1]], ["tile_rc", "sp", [-1, 1]], ["auto_unroll_max_step", "ot", 0], ["unroll_explicit", "ot", 0]]}, "result": [[0.005451452526315789, 0.005462601894736842, 0.005492035263157895], 0, 1.2047524452209473, 1679035668.2972457], "version": 0.2, "tvm_version": "0.10.0"}
{"input": ["cuda -keys=cuda,gpu -arch=sm_86 -max_num_threads=1024 -thread_warp_size=32", "conv2d_nchw_winograd.cuda", [["TENSOR", [1, 32, 147, 147], "float32"], ["TENSOR", [64, 32, 3, 3], "float32"], [1, 1], [1, 1, 1, 1], [1, 1], "float32"], {}], "config": {"index": 151200, "code_hash": null, "entity": [["tile_b", "sp", [-1, 1, 1, 1]], ["tile_y", "sp", [-1, 1, 1, 1]], ["tile_x", "sp", [-1, 1, 1, 1]], ["tile_rc", "sp", [-1, 1]], ["auto_unroll_max_step", "ot", 0], ["unroll_explicit", "ot", 1]]}, "result": [[0.005492012851851851, 0.0059358268823529415, 0.006233268705882354], 0, 1.8161265850067139, 1679035671.5064135], "version": 0.2, "tvm_version": "0.10.0"}
{"input": ["cuda -keys=cuda,gpu -arch=sm_86 -max_num_threads=1024 -thread_warp_size=32", "conv2d_nchw_winograd.cuda", [["TENSOR", [1, 32, 147, 147], "float32"], ["TENSOR", [64, 32, 3, 3], "float32"], [1, 1], [1, 1, 1, 1], [1, 1], "float32"], {}], "config": {"index": 50400, "code_hash": null, "entity": [["tile_b", "sp", [-1, 1, 1, 1]], ["tile_y", "sp", [-1, 1, 1, 1]], ["tile_x", "sp", [-1, 1, 1, 1]], ["tile_rc", "sp", [-1, 1]], ["auto_unroll_max_step", "ot", 128], ["unroll_explicit", "ot", 0]]}, "result": [[0.005451398736842105, 0.005473441631578947, 0.005493591684210526], 0, 1.5793676376342773, 1679035672.3847072], "version": 0.2, "tvm_version": "0.10.0"}
{"input": ["cuda -keys=cuda,gpu -arch=sm_86 -max_num_threads=1024 -thread_warp_size=32", "conv2d_nchw_winograd.cuda", [["TENSOR", [1, 32, 147, 147], "float32"], ["TENSOR", [64, 32, 3, 3], "float32"], [1, 1], [1, 1, 1, 1], [1, 1], "float32"], {}], "config": {"index": 8400, "code_hash": null, "entity": [["tile_b", "sp", [-1, 1, 1, 1]], ["tile_y", "sp", [-1, 1, 1, 1]], ["tile_x", "sp", [-1, 1, 1, 1]], ["tile_rc", "sp", [-1, 2]], ["auto_unroll_max_step", "ot", 0], ["unroll_explicit", "ot", 0]]}, "result": [[0.011833443444444446, 0.01183345788888889, 0.01183345788888889], 0, 1.5678093433380127, 1679035673.271995], "version": 0.2, "tvm_version": "0.10.0"}
{"input": ["cuda -keys=cuda,gpu -arch=sm_86 -max_num_threads=1024 -thread_warp_size=32", "conv2d_nchw_winograd.cuda", [["TENSOR", [1, 32, 147, 147], "float32"], ["TENSOR", [64, 32, 3, 3], "float32"], [1, 1], [1, 1, 1, 1], [1, 1], "float32"], {}], "config": {"index": 84, "code_hash": null, "entity": [["tile_b", "sp", [-1, 1, 1, 1]], ["tile_y", "sp", [-1, 1, 1, 1]], ["tile_x", "sp", [-1, 2, 1, 1]], ["tile_rc", "sp", [-1, 1]], ["auto_unroll_max_step", "ot", 0], ["unroll_explicit", "ot", 0]]}, "result": [[0.011175022444444445, 0.011175022444444445, 0.01117502588888889], 0, 1.5931167602539062, 1679035674.159287], "version": 0.2, "tvm_version": "0.10.0"}
{"input": ["cuda -keys=cuda,gpu -arch=sm_86 -max_num_threads=1024 -thread_warp_size=32", "conv2d_nchw_winograd.cuda", [["TENSOR", [1, 32, 147, 147], "float32"], ["TENSOR", [64, 32, 3, 3], "float32"], [1, 1], [1, 1, 1, 1], [1, 1], "float32"], {}], "config": {"index": 1, "code_hash": null, "entity": [["tile_b", "sp", [-1, 1, 1, 1]], ["tile_y", "sp", [-1, 2, 1, 1]], ["tile_x", "sp", [-1, 1, 1, 1]], ["tile_rc", "sp", [-1, 1]], ["auto_unroll_max_step", "ot", 0], ["unroll_explicit", "ot", 0]]}, "result": [[0.011163192666666667, 0.011163420777777778, 0.011163420777777778], 0, 1.6031510829925537, 1679035675.058784], "version": 0.2, "tvm_version": "0.10.0"}
{"input": ["cuda -keys=cuda,gpu -arch=sm_86 -max_num_threads=1024 -thread_warp_size=32", "conv2d_nchw_winograd.cuda", [["TENSOR", [1, 32, 147, 147], "float32"], ["TENSOR", [64, 32, 3, 3], "float32"], [1, 1], [1, 1, 1, 1], [1, 1], "float32"], {}], "config": {"index": 100800, "code_hash": null, "entity": [["tile_b", "sp", [-1, 1, 1, 1]], ["tile_y", "sp", [-1, 1, 1, 1]], ["tile_x", "sp", [-1, 1, 1, 1]], ["tile_rc", "sp", [-1, 1]], ["auto_unroll_max_step", "ot", 1500], ["unroll_explicit", "ot", 0]]}, "result": [[0.005457652, 0.005489340526315789, 0.0054919276842105265], 0, 1.572425365447998, 1679035675.9376378], "version": 0.2, "tvm_version": "0.10.0"}
{"input": ["cuda -keys=cuda,gpu -arch=sm_86 -max_num_threads=1024 -thread_warp_size=32", "conv2d_nchw_winograd.cuda", [["TENSOR", [1, 32, 147, 147], "float32"], ["TENSOR", [64, 32, 3, 3], "float32"], [1, 1], [1, 1, 1, 1], [1, 1], "float32"], {}], "config": {"index": 16800, "code_hash": null, "entity": [["tile_b", "sp", [-1, 1, 1, 1]], ["tile_y", "sp", [-1, 1, 1, 1]], ["tile_x", "sp", [-1, 1, 1, 1]], ["tile_rc", "sp", [-1, 4]], ["auto_unroll_max_step", "ot", 0], ["unroll_explicit", "ot", 0]]}, "result": [[0.009610239818181819, 0.009652875636363635, 0.009653448545454545], 0, 1.612097978591919, 1679035676.865785], "version": 0.2, "tvm_version": "0.10.0"}
{"input": ["cuda -keys=cuda,gpu -arch=sm_86 -max_num_threads=1024 -thread_warp_size=32", "conv2d_nchw_winograd.cuda", [["TENSOR", [1, 32, 147, 147], "float32"], ["TENSOR", [64, 32, 3, 3], "float32"], [1, 1], [1, 1, 1, 1], [1, 1], "float32"], {}], "config": {"index": 168, "code_hash": null, "entity": [["tile_b", "sp", [-1, 1, 1, 1]], ["tile_y", "sp", [-1, 1, 1, 1]], ["tile_x", "sp", [-1, 4, 1, 1]], ["tile_rc", "sp", [-1, 1]], ["auto_unroll_max_step", "ot", 0], ["unroll_explicit", "ot", 0]]}, "result": [[0.007529835285714285, 0.007529911, 0.007543296214285715], 0, 1.6372499465942383, 1679035677.772918], "version": 0.2, "tvm_version": "0.10.0"}
{"input": ["cuda -keys=cuda,gpu -arch=sm_86 -max_num_threads=1024 -thread_warp_size=32", "conv2d_nchw_winograd.cuda", [["TENSOR", [1, 32, 147, 147], "float32"], ["TENSOR", [64, 32, 3, 3], "float32"], [1, 1], [1, 1, 1, 1], [1, 1], "float32"], {}], "config": {"index": 2, "code_hash": null, "entity": [["tile_b", "sp", [-1, 1, 1, 1]], ["tile_y", "sp", [-1, 4, 1, 1]], ["tile_x", "sp", [-1, 1, 1, 1]], ["tile_rc", "sp", [-1, 1]], ["auto_unroll_max_step", "ot", 0], ["unroll_explicit", "ot", 0]]}, "result": [[0.007596617, 0.0076003565, 0.007606626214285714], 0, 1.591628074645996, 1679035678.6773596], "version": 0.2, "tvm_version": "0.10.0"}
{"input": ["cuda -keys=cuda,gpu -arch=sm_86 -max_num_threads=1024 -thread_warp_size=32", "conv2d_nchw_winograd.cuda", [["TENSOR", [1, 32, 147, 147], "float32"], ["TENSOR", [64, 32, 3, 3], "float32"], [1, 1], [1, 1, 1, 1], [1, 1], "float32"], {}], "config": {"index": 25200, "code_hash": null, "entity": [["tile_b", "sp", [-1, 1, 1, 1]], ["tile_y", "sp", [-1, 1, 1, 1]], ["tile_x", "sp", [-1, 1, 1, 1]], ["tile_rc", "sp", [-1, 8]], ["auto_unroll_max_step", "ot", 0], ["unroll_explicit", "ot", 0]]}, "result": [[0.008958466833333333, 0.008967679916666667, 0.008967927916666667], 0, 1.6090831756591797, 1679035679.587363], "version": 0.2, "tvm_version": "0.10.0"}
{"input": ["cuda -keys=cuda,gpu -arch=sm_86 -max_num_threads=1024 -thread_warp_size=32", "conv2d_nchw_winograd.cuda", [["TENSOR", [1, 32, 147, 147], "float32"], ["TENSOR", [64, 32, 3, 3], "float32"], [1, 1], [1, 1, 1, 1], [1, 1], "float32"], {}], "config": {"index": 252, "code_hash": null, "entity": [["tile_b", "sp", [-1, 1, 1, 1]], ["tile_y", "sp", [-1, 1, 1, 1]], ["tile_x", "sp", [-1, 37, 1, 1]], ["tile_rc", "sp", [-1, 1]], ["auto_unroll_max_step", "ot", 0], ["unroll_explicit", "ot", 0]]}, "result": [[0.004585472090909091, 0.0045855098636363644, 0.004585512636363636], 0, 1.5797183513641357, 1679035680.4594116], "version": 0.2, "tvm_version": "0.10.0"}
{"input": ["cuda -keys=cuda,gpu -arch=sm_86 -max_num_threads=1024 -thread_warp_size=32", "conv2d_nchw_winograd.cuda", [["TENSOR", [1, 32, 147, 147], "float32"], ["TENSOR", [64, 32, 3, 3], "float32"], [1, 1], [1, 1, 1, 1], [1, 1], "float32"], {}], "config": {"index": 3, "code_hash": null, "entity": [["tile_b", "sp", [-1, 1, 1, 1]], ["tile_y", "sp", [-1, 8, 1, 1]], ["tile_x", "sp", [-1, 1, 1, 1]], ["tile_rc", "sp", [-1, 1]], ["auto_unroll_max_step", "ot", 0], ["unroll_explicit", "ot", 0]]}, "result": [[0.0058211555, 0.0058213225, 0.005821383111111111], 0, 1.5670270919799805, 1679035681.3257227], "version": 0.2, "tvm_version": "0.10.0"}
{"input": ["cuda -keys=cuda,gpu -arch=sm_86 -max_num_threads=1024 -thread_warp_size=32", "conv2d_nchw_winograd.cuda", [["TENSOR", [1, 32, 147, 147], "float32"], ["TENSOR", [64, 32, 3, 3], "float32"], [1, 1], [1, 1, 1, 1], [1, 1], "float32"], {}], "config": {"index": 33600, "code_hash": null, "entity": [["tile_b", "sp", [-1, 1, 1, 1]], ["tile_y", "sp", [-1, 1, 1, 1]], ["tile_x", "sp", [-1, 1, 1, 1]], ["tile_rc", "sp", [-1, 16]], ["auto_unroll_max_step", "ot", 0], ["unroll_explicit", "ot", 0]]}, "result": [[0.008658432, 0.008658432, 0.008658858583333333], 0, 1.6256630420684814, 1679035682.2269855], "version": 0.2, "tvm_version": "0.10.0"}
{"input": ["cuda -keys=cuda,gpu -arch=sm_86 -max_num_threads=1024 -thread_warp_size=32", "conv2d_nchw_winograd.cuda", [["TENSOR", [1, 32, 147, 147], "float32"], ["TENSOR", [64, 32, 3, 3], "float32"], [1, 1], [1, 1, 1, 1], [1, 1], "float32"], {}], "config": {"index": 336, "code_hash": null, "entity": [["tile_b", "sp", [-1, 1, 1, 1]], ["tile_y", "sp", [-1, 1, 1, 1]], ["tile_x", "sp", [-1, 74, 1, 1]], ["tile_rc", "sp", [-1, 1]], ["auto_unroll_max_step", "ot", 0], ["unroll_explicit", "ot", 0]]}, "result": [[0.0043622844347826085, 0.0043624542608695655, 0.004362507], 0, 1.9893362522125244, 1679035683.0967634], "version": 0.2, "tvm_version": "0.10.0"}
{"input": ["cuda -keys=cuda,gpu -arch=sm_86 -max_num_threads=1024 -thread_warp_size=32", "conv2d_nchw_winograd.cuda", [["TENSOR", [1, 32, 147, 147], "float32"], ["TENSOR", [64, 32, 3, 3], "float32"], [1, 1], [1, 1, 1, 1], [1, 1], "float32"], {}], "config": {"index": 4, "code_hash": null, "entity": [["tile_b", "sp", [-1, 1, 1, 1]], ["tile_y", "sp", [-1, 16, 1, 1]], ["tile_x", "sp", [-1, 1, 1, 1]], ["tile_rc", "sp", [-1, 1]], ["auto_unroll_max_step", "ot", 0], ["unroll_explicit", "ot", 0]]}, "result": [[0.00500700145, 0.0050070606, 0.00500709455], 0, 1.5270397663116455, 1679035683.9380736], "version": 0.2, "tvm_version": "0.10.0"}
{"input": ["cuda -keys=cuda,gpu -arch=sm_86 -max_num_threads=1024 -thread_warp_size=32", "conv2d_nchw_winograd.cuda", [["TENSOR", [1, 32, 147, 147], "float32"], ["TENSOR", [64, 32, 3, 3], "float32"], [1, 1], [1, 1, 1, 1], [1, 1], "float32"], {}], "config": {"index": 42000, "code_hash": null, "entity": [["tile_b", "sp", [-1, 1, 1, 1]], ["tile_y", "sp", [-1, 1, 1, 1]], ["tile_x", "sp", [-1, 1, 1, 1]], ["tile_rc", "sp", [-1, 32]], ["auto_unroll_max_step", "ot", 0], ["unroll_explicit", "ot", 0]]}, "result": [[0.008380416166666666, 0.008380501416666667, 0.008380586583333334], 0, 1.6149005889892578, 1679035684.8481884], "version": 0.2, "tvm_version": "0.10.0"}
{"input": ["cuda -keys=cuda,gpu -arch=sm_86 -max_num_threads=1024 -thread_warp_size=32", "conv2d_nchw_winograd.cuda", [["TENSOR", [1, 32, 147, 147], "float32"], ["TENSOR", [64, 32, 3, 3], "float32"], [1, 1], [1, 1, 1, 1], [1, 1], "float32"], {}], "config": {"index": 420, "code_hash": null, "entity": [["tile_b", "sp", [-1, 1, 1, 1]], ["tile_y", "sp", [-1, 1, 1, 1]], ["tile_x", "sp", [-1, 148, 1, 1]], ["tile_rc", "sp", [-1, 1]], ["auto_unroll_max_step", "ot", 0], ["unroll_explicit", "ot", 0]]}, "result": [[0.00571334652, 0.005713762799999999, 0.00572264464], 0, 1.9000611305236816, 1679035688.2629461], "version": 0.2, "tvm_version": "0.10.0"}
{"input": ["cuda -keys=cuda,gpu -arch=sm_86 -max_num_threads=1024 -thread_warp_size=32", "conv2d_nchw_winograd.cuda", [["TENSOR", [1, 32, 147, 147], "float32"], ["TENSOR", [64, 32, 3, 3], "float32"], [1, 1], [1, 1, 1, 1], [1, 1], "float32"], {}], "config": {"index": 151536, "code_hash": null, "entity": [["tile_b", "sp", [-1, 1, 1, 1]], ["tile_y", "sp", [-1, 1, 1, 1]], ["tile_x", "sp", [-1, 74, 1, 1]], ["tile_rc", "sp", [-1, 1]], ["auto_unroll_max_step", "ot", 0], ["unroll_explicit", "ot", 1]]}, "result": [[0.0043357012916666665, 0.00434641075, 0.004362410541666666], 0, 2.4080779552459717, 1679035689.153226], "version": 0.2, "tvm_version": "0.10.0"}
{"input": ["cuda -keys=cuda,gpu -arch=sm_86 -max_num_threads=1024 -thread_warp_size=32", "conv2d_nchw_winograd.cuda", [["TENSOR", [1, 32, 147, 147], "float32"], ["TENSOR", [64, 32, 3, 3], "float32"], [1, 1], [1, 1, 1, 1], [1, 1], "float32"], {}], "config": {"index": 50736, "code_hash": null, "entity": [["tile_b", "sp", [-1, 1, 1, 1]], ["tile_y", "sp", [-1, 1, 1, 1]], ["tile_x", "sp", [-1, 74, 1, 1]], ["tile_rc", "sp", [-1, 1]], ["auto_unroll_max_step", "ot", 128], ["unroll_explicit", "ot", 0]]}, "result": [[0.004368740217391304, 0.004368918347826088, 0.00436895847826087], 0, 1.5933029651641846, 1679035690.013263], "version": 0.2, "tvm_version": "0.10.0"}
{"input": ["cuda -keys=cuda,gpu -arch=sm_86 -max_num_threads=1024 -thread_warp_size=32", "conv2d_nchw_winograd.cuda", [["TENSOR", [1, 32, 147, 147], "float32"], ["TENSOR", [64, 32, 3, 3], "float32"], [1, 1], [1, 1, 1, 1], [1, 1], "float32"], {}], "config": {"index": 8736, "code_hash": null, "entity": [["tile_b", "sp", [-1, 1, 1, 1]], ["tile_y", "sp", [-1, 1, 1, 1]], ["tile_x", "sp", [-1, 74, 1, 1]], ["tile_rc", "sp", [-1, 2]], ["auto_unroll_max_step", "ot", 0], ["unroll_explicit", "ot", 0]]}, "result": [[0.004466420695652174, 0.004466554391304348, 0.004466688043478261], 0, 2.6693952083587646, 1679035690.8852067], "version": 0.2, "tvm_version": "0.10.0"}
{"input": ["cuda -keys=cuda,gpu -arch=sm_86 -max_num_threads=1024 -thread_warp_size=32", "conv2d_nchw_winograd.cuda", [["TENSOR", [1, 32, 147, 147], "float32"], ["TENSOR", [64, 32, 3, 3], "float32"], [1, 1], [1, 1, 1, 1], [1, 1], "float32"], {}], "config": {"index": 337, "code_hash": null, "entity": [["tile_b", "sp", [-1, 1, 1, 1]], ["tile_y", "sp", [-1, 2, 1, 1]], ["tile_x", "sp", [-1, 74, 1, 1]], ["tile_rc", "sp", [-1, 1]], ["auto_unroll_max_step", "ot", 0], ["unroll_explicit", "ot", 0]]}, "result": [[0.0038365108148148146, 0.0038365486666666667, 0.0038370417777777777], 0, 1.6260993480682373, 1679035691.7662785], "version": 0.2, "tvm_version": "0.10.0"}
{"input": ["cuda -keys=cuda,gpu -arch=sm_86 -max_num_threads=1024 -thread_warp_size=32", "conv2d_nchw_winograd.cuda", [["TENSOR", [1, 32, 147, 147], "float32"], ["TENSOR", [64, 32, 3, 3], "float32"], [1, 1], [1, 1, 1, 1], [1, 1], "float32"], {}], "config": {"index": 840, "code_hash": null, "entity": [["tile_b", "sp", [-1, 1, 1, 1]], ["tile_y", "sp", [-1, 1, 1, 1]], ["tile_x", "sp", [-1, 2, 2, 1]], ["tile_rc", "sp", [-1, 1]], ["auto_unroll_max_step", "ot", 0], ["unroll_explicit", "ot", 0]]}, "result": [[0.0072230033571428565, 0.007223138499999999, 0.007223223], 0, 1.525132656097412, 1679035692.6439106], "version": 0.2, "tvm_version": "0.10.0"}
{"input": ["cuda -keys=cuda,gpu -arch=sm_86 -max_num_threads=1024 -thread_warp_size=32", "conv2d_nchw_winograd.cuda", [["TENSOR", [1, 32, 147, 147], "float32"], ["TENSOR", [64, 32, 3, 3], "float32"], [1, 1], [1, 1, 1, 1], [1, 1], "float32"], {}], "config": {"index": 342, "code_hash": null, "entity": [["tile_b", "sp", [-1, 1, 1, 1]], ["tile_y", "sp", [-1, 64, 1, 1]], ["tile_x", "sp", [-1, 74, 1, 1]], ["tile_rc", "sp", [-1, 1]], ["auto_unroll_max_step", "ot", 0], ["unroll_explicit", "ot", 0]]}, "result": [[0.0700686565, 0.070097404, 0.0701358105], 0, 1.9862823486328125, 1679035693.7720273], "version": 0.2, "tvm_version": "0.10.0"}
{"input": ["cuda -keys=cuda,gpu -arch=sm_86 -max_num_threads=1024 -thread_warp_size=32", "conv2d_nchw_winograd.cuda", [["TENSOR", [1, 32, 147, 147], "float32"], ["TENSOR", [64, 32, 3, 3], "float32"], [1, 1], [1, 1, 1, 1], [1, 1], "float32"], {}], "config": {"index": 924, "code_hash": null, "entity": [["tile_b", "sp", [-1, 1, 1, 1]], ["tile_y", "sp", [-1, 1, 1, 1]], ["tile_x", "sp", [-1, 37, 2, 1]], ["tile_rc", "sp", [-1, 1]], ["auto_unroll_max_step", "ot", 0], ["unroll_explicit", "ot", 0]]}, "result": [[0.0040778546, 0.00407789428, 0.0040779776], 0, 1.5493683815002441, 1679035694.6455965], "version": 0.2, "tvm_version": "0.10.0"}
{"input": ["cuda -keys=cuda,gpu -arch=sm_86 -max_num_threads=1024 -thread_warp_size=32", "conv2d_nchw_winograd.cuda", [["TENSOR", [1, 32, 147, 147], "float32"], ["TENSOR", [64, 32, 3, 3], "float32"], [1, 1], [1, 1, 1, 1], [1, 1], "float32"], {}], "config": {"index": 343, "code_hash": null, "entity": [["tile_b", "sp", [-1, 1, 1, 1]], ["tile_y", "sp", [-1, 1, 2, 1]], ["tile_x", "sp", [-1, 74, 1, 1]], ["tile_rc", "sp", [-1, 1]], ["auto_unroll_max_step", "ot", 0], ["unroll_explicit", "ot", 0]]}, "result": [[0.0018166458749999997, 0.001816669113636364, 0.0018166807272727273], 0, 1.8848278522491455, 1679035695.8191044], "version": 0.2, "tvm_version": "0.10.0"}
{"input": ["cuda -keys=cuda,gpu -arch=sm_86 -max_num_threads=1024 -thread_warp_size=32", "conv2d_nchw_winograd.cuda", [["TENSOR", [1, 32, 147, 147], "float32"], ["TENSOR", [64, 32, 3, 3], "float32"], [1, 1], [1, 1, 1, 1], [1, 1], "float32"], {}], "config": {"index": 101136, "code_hash": null, "entity": [["tile_b", "sp", [-1, 1, 1, 1]], ["tile_y", "sp", [-1, 1, 1, 1]], ["tile_x", "sp", [-1, 74, 1, 1]], ["tile_rc", "sp", [-1, 1]], ["auto_unroll_max_step", "ot", 1500], ["unroll_explicit", "ot", 0]]}, "result": [[0.004368731913043478, 0.004368877869565218, 0.004368918347826088], 0, 1.595858097076416, 1679035696.6777022], "version": 0.2, "tvm_version": "0.10.0"}
{"input": ["cuda -keys=cuda,gpu -arch=sm_86 -max_num_threads=1024 -thread_warp_size=32", "conv2d_nchw_winograd.cuda", [["TENSOR", [1, 32, 147, 147], "float32"], ["TENSOR", [64, 32, 3, 3], "float32"], [1, 1], [1, 1, 1, 1], [1, 1], "float32"], {}], "config": {"index": 17136, "code_hash": null, "entity": [["tile_b", "sp", [-1, 1, 1, 1]], ["tile_y", "sp", [-1, 1, 1, 1]], ["tile_x", "sp", [-1, 74, 1, 1]], ["tile_rc", "sp", [-1, 4]], ["auto_unroll_max_step", "ot", 0], ["unroll_explicit", "ot", 0]]}, "result": [[0.004289663916666666, 0.0042897427500000005, 0.004289792041666666], 0, 2.874295234680176, 1679035697.5705736], "version": 0.2, "tvm_version": "0.10.0"}
{"input": ["cuda -keys=cuda,gpu -arch=sm_86 -max_num_threads=1024 -thread_warp_size=32", "conv2d_nchw_winograd.cuda", [["TENSOR", [1, 32, 147, 147], "float32"], ["TENSOR", [64, 32, 3, 3], "float32"], [1, 1], [1, 1, 1, 1], [1, 1], "float32"], {}], "config": {"index": 1008, "code_hash": null, "entity": [["tile_b", "sp", [-1, 1, 1, 1]], ["tile_y", "sp", [-1, 1, 1, 1]], ["tile_x", "sp", [-1, 74, 2, 1]], ["tile_rc", "sp", [-1, 1]], ["auto_unroll_max_step", "ot", 0], ["unroll_explicit", "ot", 0]]}, "result": [[0.00403197936, 0.00403197936, 0.00403206144], 0, 1.5525927543640137, 1679035698.4143796], "version": 0.2, "tvm_version": "0.10.0"}
{"input": ["cuda -keys=cuda,gpu -arch=sm_86 -max_num_threads=1024 -thread_warp_size=32", "conv2d_nchw_winograd.cuda", [["TENSOR", [1, 32, 147, 147], "float32"], ["TENSOR", [64, 32, 3, 3], "float32"], [1, 1], [1, 1, 1, 1], [1, 1], "float32"], {}], "config": {"index": 344, "code_hash": null, "entity": [["tile_b", "sp", [-1, 1, 1, 1]], ["tile_y", "sp", [-1, 2, 2, 1]], ["tile_x", "sp", [-1, 74, 1, 1]], ["tile_rc", "sp", [-1, 1]], ["auto_unroll_max_step", "ot", 0], ["unroll_explicit", "ot", 0]]}, "result": [[0.0010034278100000001, 0.0010035302699999999, 0.00100356864], 0, 1.6500370502471924, 1679035699.2793286], "version": 0.2, "tvm_version": "0.10.0"}
{"input": ["cuda -keys=cuda,gpu -arch=sm_86 -max_num_threads=1024 -thread_warp_size=32", "conv2d_nchw_winograd.cuda", [["TENSOR", [1, 32, 147, 147], "float32"], ["TENSOR", [64, 32, 3, 3], "float32"], [1, 1], [1, 1, 1, 1], [1, 1], "float32"], {}], "config": {"index": 25536, "code_hash": null, "entity": [["tile_b", "sp", [-1, 1, 1, 1]], ["tile_y", "sp", [-1, 1, 1, 1]], ["tile_x", "sp", [-1, 74, 1, 1]], ["tile_rc", "sp", [-1, 8]], ["auto_unroll_max_step", "ot", 0], ["unroll_explicit", "ot", 0]]}, "result": [[0.004281813291666666, 0.004281941375, 0.004281984], 0, 3.0355241298675537, 1679035700.1638749], "version": 0.2, "tvm_version": "0.10.0"}
{"input": ["cuda -keys=cuda,gpu -arch=sm_86 -max_num_threads=1024 -thread_warp_size=32", "conv2d_nchw_winograd.cuda", [["TENSOR", [1, 32, 147, 147], "float32"], ["TENSOR", [64, 32, 3, 3], "float32"], [1, 1], [1, 1, 1, 1], [1, 1], "float32"], {}], "config": {"index": 1092, "code_hash": null, "entity": [["tile_b", "sp", [-1, 1, 1, 1]], ["tile_y", "sp", [-1, 1, 1, 1]], ["tile_x", "sp", [-1, 1369, 2, 1]], ["tile_rc", "sp", [-1, 1]], ["auto_unroll_max_step", "ot", 0], ["unroll_explicit", "ot", 0]]}, "result": [[0.0214855682, 0.021489868000000002, 0.021518700999999998], 0, 1.6103568077087402, 1679035701.11905], "version": 0.2, "tvm_version": "0.10.0"}
{"input": ["cuda -keys=cuda,gpu -arch=sm_86 -max_num_threads=1024 -thread_warp_size=32", "conv2d_nchw_winograd.cuda", [["TENSOR", [1, 32, 147, 147], "float32"], ["TENSOR", [64, 32, 3, 3], "float32"], [1, 1], [1, 1, 1, 1], [1, 1], "float32"], {}], "config": {"index": 345, "code_hash": null, "entity": [["tile_b", "sp", [-1, 1, 1, 1]], ["tile_y", "sp", [-1, 4, 2, 1]], ["tile_x", "sp", [-1, 74, 1, 1]], ["tile_rc", "sp", [-1, 1]], ["auto_unroll_max_step", "ot", 0], ["unroll_explicit", "ot", 0]]}, "result": [[0.001602576238095238, 0.001602917619047619, 0.001603080142857143], 0, 1.764847755432129, 1679035701.9847956], "version": 0.2, "tvm_version": "0.10.0"}
{"input": ["cuda -keys=cuda,gpu -arch=sm_86 -max_num_threads=1024 -thread_warp_size=32", "conv2d_nchw_winograd.cuda", [["TENSOR", [1, 32, 147, 147], "float32"], ["TENSOR", [64, 32, 3, 3], "float32"], [1, 1], [1, 1, 1, 1], [1, 1], "float32"], {}], "config": {"index": 151544, "code_hash": null, "entity": [["tile_b", "sp", [-1, 1, 1, 1]], ["tile_y", "sp", [-1, 2, 2, 1]], ["tile_x", "sp", [-1, 74, 1, 1]], ["tile_rc", "sp", [-1, 1]], ["auto_unroll_max_step", "ot", 0], ["unroll_explicit", "ot", 1]]}, "result": [[0.0009981059405940595, 0.001003277613861386, 0.0010034084455445545], 0, 1.622091293334961, 1679035704.0422735], "version": 0.2, "tvm_version": "0.10.0"}
{"input": ["cuda -keys=cuda,gpu -arch=sm_86 -max_num_threads=1024 -thread_warp_size=32", "conv2d_nchw_winograd.cuda", [["TENSOR", [1, 32, 147, 147], "float32"], ["TENSOR", [64, 32, 3, 3], "float32"], [1, 1], [1, 1, 1, 1], [1, 1], "float32"], {}], "config": {"index": 50744, "code_hash": null, "entity": [["tile_b", "sp", [-1, 1, 1, 1]], ["tile_y", "sp", [-1, 2, 2, 1]], ["tile_x", "sp", [-1, 74, 1, 1]], ["tile_rc", "sp", [-1, 1]], ["auto_unroll_max_step", "ot", 128], ["unroll_explicit", "ot", 0]]}, "result": [[0.00100338691, 0.00100339584, 0.0010034381100000002], 0, 1.627997636795044, 1679035704.89743], "version": 0.2, "tvm_version": "0.10.0"}
{"input": ["cuda -keys=cuda,gpu -arch=sm_86 -max_num_threads=1024 -thread_warp_size=32", "conv2d_nchw_winograd.cuda", [["TENSOR", [1, 32, 147, 147], "float32"], ["TENSOR", [64, 32, 3, 3], "float32"], [1, 1], [1, 1, 1, 1], [1, 1], "float32"], {}], "config": {"index": 8744, "code_hash": null, "entity": [["tile_b", "sp", [-1, 1, 1, 1]], ["tile_y", "sp", [-1, 2, 2, 1]], ["tile_x", "sp", [-1, 74, 1, 1]], ["tile_rc", "sp", [-1, 2]], ["auto_unroll_max_step", "ot", 0], ["unroll_explicit", "ot", 0]]}, "result": [[0.001111859211111111, 0.001111972977777778, 0.0011144419333333332], 0, 1.7190494537353516, 1679035705.7569041], "version": 0.2, "tvm_version": "0.10.0"}
{"input": ["cuda -keys=cuda,gpu -arch=sm_86 -max_num_threads=1024 -thread_warp_size=32", "conv2d_nchw_winograd.cuda", [["TENSOR", [1, 32, 147, 147], "float32"], ["TENSOR", [64, 32, 3, 3], "float32"], [1, 1], [1, 1, 1, 1], [1, 1], "float32"], {}], "config": {"index": 428, "code_hash": null, "entity": [["tile_b", "sp", [-1, 1, 1, 1]], ["tile_y", "sp", [-1, 2, 2, 1]], ["tile_x", "sp", [-1, 148, 1, 1]], ["tile_rc", "sp", [-1, 1]], ["auto_unroll_max_step", "ot", 0], ["unroll_explicit", "ot", 0]]}, "result": [[0.002193430195652174, 0.0021936736521739127, 0.002193675152173913], 0, 1.7801222801208496, 1679035706.6294103], "version": 0.2, "tvm_version": "0.10.0"}
{"input": ["cuda -keys=cuda,gpu -arch=sm_86 -max_num_threads=1024 -thread_warp_size=32", "conv2d_nchw_winograd.cuda", [["TENSOR", [1, 32, 147, 147], "float32"], ["TENSOR", [64, 32, 3, 3], "float32"], [1, 1], [1, 1, 1, 1], [1, 1], "float32"], {}], "config": {"index": 260, "code_hash": null, "entity": [["tile_b", "sp", [-1, 1, 1, 1]], ["tile_y", "sp", [-1, 2, 2, 1]], ["tile_x", "sp", [-1, 37, 1, 1]], ["tile_rc", "sp", [-1, 1]], ["auto_unroll_max_step", "ot", 0], ["unroll_explicit", "ot", 0]]}, "result": [[0.0010844986351351352, 0.0010844990472972972, 0.0010845122432432432], 0, 1.9526748657226562, 1679035707.86396], "version": 0.2, "tvm_version": "0.10.0"}
{"input": ["cuda -keys=cuda,gpu -arch=sm_86 -max_num_threads=1024 -thread_warp_size=32", "conv2d_nchw_winograd.cuda", [["TENSOR", [1, 32, 147, 147], "float32"], ["TENSOR", [64, 32, 3, 3], "float32"], [1, 1], [1, 1, 1, 1], [1, 1], "float32"], {}], "config": {"index": 33944, "code_hash": null, "entity": [["tile_b", "sp", [-1, 1, 1, 1]], ["tile_y", "sp", [-1, 2, 2, 1]], ["tile_x", "sp", [-1, 74, 1, 1]], ["tile_rc", "sp", [-1, 16]], ["auto_unroll_max_step", "ot", 0], ["unroll_explicit", "ot", 0]]}, "result": [[0.001653894262295082, 0.0016540118196721313, 0.0016541120163934427], 0, 1.967627763748169, 1679035708.7270434], "version": 0.2, "tvm_version": "0.10.0"}
{"input": ["cuda -keys=cuda,gpu -arch=sm_86 -max_num_threads=1024 -thread_warp_size=32", "conv2d_nchw_winograd.cuda", [["TENSOR", [1, 32, 147, 147], "float32"], ["TENSOR", [64, 32, 3, 3], "float32"], [1, 1], [1, 1, 1, 1], [1, 1], "float32"], {}], "config": {"index": 1184, "code_hash": null, "entity": [["tile_b", "sp", [-1, 1, 1, 1]], ["tile_y", "sp", [-1, 2, 2, 1]], ["tile_x", "sp", [-1, 2738, 2, 1]], ["tile_rc", "sp", [-1, 1]], ["auto_unroll_max_step", "ot", 0], ["unroll_explicit", "ot", 0]]}, "result": [[0.016069778428571428, 0.01607080185714286, 0.01607197242857143], 0, 1.6385440826416016, 1679035709.6928666], "version": 0.2, "tvm_version": "0.10.0"}
{"input": ["cuda -keys=cuda,gpu -arch=sm_86 -max_num_threads=1024 -thread_warp_size=32", "conv2d_nchw_winograd.cuda", [["TENSOR", [1, 32, 147, 147], "float32"], ["TENSOR", [64, 32, 3, 3], "float32"], [1, 1], [1, 1, 1, 1], [1, 1], "float32"], {}], "config": {"index": 354, "code_hash": null, "entity": [["tile_b", "sp", [-1, 1, 1, 1]], ["tile_y", "sp", [-1, 1, 8, 1]], ["tile_x", "sp", [-1, 74, 1, 1]], ["tile_rc", "sp", [-1, 1]], ["auto_unroll_max_step", "ot", 0], ["unroll_explicit", "ot", 0]]}, "result": [[0.0002977230442804428, 0.0002977285904059041, 0.0002977705092250922], 0, 1.94093918800354, 1679035710.9609785], "version": 0.2, "tvm_version": "0.10.0"}
{"input": ["cuda -keys=cuda,gpu -arch=sm_86 -max_num_threads=1024 -thread_warp_size=32", "conv2d_nchw_winograd.cuda", [["TENSOR", [1, 32, 147, 147], "float32"], ["TENSOR", [64, 32, 3, 3], "float32"], [1, 1], [1, 1, 1, 1], [1, 1], "float32"], {}], "config": {"index": 101144, "code_hash": null, "entity": [["tile_b", "sp", [-1, 1, 1, 1]], ["tile_y", "sp", [-1, 2, 2, 1]], ["tile_x", "sp", [-1, 74, 1, 1]], ["tile_rc", "sp", [-1, 1]], ["auto_unroll_max_step", "ot", 1500], ["unroll_explicit", "ot", 0]]}, "result": [[0.00100336639, 0.00100340736, 0.00100340736], 0, 1.6568610668182373, 1679035711.8156052], "version": 0.2, "tvm_version": "0.10.0"}
{"input": ["cuda -keys=cuda,gpu -arch=sm_86 -max_num_threads=1024 -thread_warp_size=32", "conv2d_nchw_winograd.cuda", [["TENSOR", [1, 32, 147, 147], "float32"], ["TENSOR", [64, 32, 3, 3], "float32"], [1, 1], [1, 1, 1, 1], [1, 1], "float32"], {}], "config": {"index": 42344, "code_hash": null, "entity": [["tile_b", "sp", [-1, 1, 1, 1]], ["tile_y", "sp", [-1, 2, 2, 1]], ["tile_x", "sp", [-1, 74, 1, 1]], ["tile_rc", "sp", [-1, 32]], ["auto_unroll_max_step", "ot", 0], ["unroll_explicit", "ot", 0]]}, "result": [[0.001457270739130435, 0.0014573597536231885, 0.001457404304347826], 0, 1.7060623168945312, 1679035712.6649864], "version": 0.2, "tvm_version": "0.10.0"}
{"input": ["cuda -keys=cuda,gpu -arch=sm_86 -max_num_threads=1024 -thread_warp_size=32", "conv2d_nchw_winograd.cuda", [["TENSOR", [1, 32, 147, 147], "float32"], ["TENSOR", [64, 32, 3, 3], "float32"], [1, 1], [1, 1, 1, 1], [1, 1], "float32"], {}], "config": {"index": 1268, "code_hash": null, "entity": [["tile_b", "sp", [-1, 1, 1, 1]], ["tile_y", "sp", [-1, 2, 2, 1]], ["tile_x", "sp", [-1, 1, 4, 1]], ["tile_rc", "sp", [-1, 1]], ["auto_unroll_max_step", "ot", 0], ["unroll_explicit", "ot", 0]]}, "result": [[0.0015130373396226415, 0.0015130759150943397, 0.0015130759150943397], 0, 1.939368486404419, 1679035713.9468822], "version": 0.2, "tvm_version": "0.10.0"}
{"input": ["cuda -keys=cuda,gpu -arch=sm_86 -max_num_threads=1024 -thread_warp_size=32", "conv2d_nchw_winograd.cuda", [["TENSOR", [1, 32, 147, 147], "float32"], ["TENSOR", [64, 32, 3, 3], "float32"], [1, 1], [1, 1, 1, 1], [1, 1], "float32"], {}], "config": {"index": 355, "code_hash": null, "entity": [["tile_b", "sp", [-1, 1, 1, 1]], ["tile_y", "sp", [-1, 2, 8, 1]], ["tile_x", "sp", [-1, 74, 1, 1]], ["tile_rc", "sp", [-1, 1]], ["auto_unroll_max_step", "ot", 0], ["unroll_explicit", "ot", 0]]}, "result": [[0.0003277933073770492, 0.0003278038135245902, 0.00032780590983606556], 0, 2.027606964111328, 1679035715.2140803], "version": 0.2, "tvm_version": "0.10.0"}
{"input": ["cuda -keys=cuda,gpu -arch=sm_86 -max_num_threads=1024 -thread_warp_size=32", "conv2d_nchw_winograd.cuda", [["TENSOR", [1, 32, 147, 147], "float32"], ["TENSOR", [64, 32, 3, 3], "float32"], [1, 1], [1, 1, 1, 1], [1, 1], "float32"], {}], "config": {"index": 1352, "code_hash": null, "entity": [["tile_b", "sp", [-1, 1, 1, 1]], ["tile_y", "sp", [-1, 2, 2, 1]], ["tile_x", "sp", [-1, 37, 4, 1]], ["tile_rc", "sp", [-1, 1]], ["auto_unroll_max_step", "ot", 0], ["unroll_explicit", "ot", 0]]}, "result": [[0.00043305592761394107, 0.0004330888579088472, 0.0004333084959785522], 0, 1.9787559509277344, 1679035716.4765012], "version": 0.2, "tvm_version": "0.10.0"}
{"input": ["cuda -keys=cuda,gpu -arch=sm_86 -max_num_threads=1024 -thread_warp_size=32", "conv2d_nchw_winograd.cuda", [["TENSOR", [1, 32, 147, 147], "float32"], ["TENSOR", [64, 32, 3, 3], "float32"], [1, 1], [1, 1, 1, 1], [1, 1], "float32"], {}], "config": {"index": 356, "code_hash": null, "entity": [["tile_b", "sp", [-1, 1, 1, 1]], ["tile_y", "sp", [-1, 4, 8, 1]], ["tile_x", "sp", [-1, 74, 1, 1]], ["tile_rc", "sp", [-1, 1]], ["auto_unroll_max_step", "ot", 0], ["unroll_explicit", "ot", 0]]}, "result": [[0.0004535806412556054, 0.0004537054798206278, 0.0004537370269058296], 0, 1.785417079925537, 1679035717.3416557], "version": 0.2, "tvm_version": "0.10.0"}
{"input": ["cuda -keys=cuda,gpu -arch=sm_86 -max_num_threads=1024 -thread_warp_size=32", "conv2d_nchw_winograd.cuda", [["TENSOR", [1, 32, 147, 147], "float32"], ["TENSOR", [64, 32, 3, 3], "float32"], [1, 1], [1, 1, 1, 1], [1, 1], "float32"], {}], "config": {"index": 1436, "code_hash": null, "entity": [["tile_b", "sp", [-1, 1, 1, 1]], ["tile_y", "sp", [-1, 2, 2, 1]], ["tile_x", "sp", [-1, 1369, 4, 1]], ["tile_rc", "sp", [-1, 1]], ["auto_unroll_max_step", "ot", 0], ["unroll_explicit", "ot", 0]]}, "result": [[0.008622762666666667, 0.00862309325, 0.008625237083333332], 0, 1.556837797164917, 1679035718.2361622], "version": 0.2, "tvm_version": "0.10.0"}
{"input": ["cuda -keys=cuda,gpu -arch=sm_86 -max_num_threads=1024 -thread_warp_size=32", "conv2d_nchw_winograd.cuda", [["TENSOR", [1, 32, 147, 147], "float32"], ["TENSOR", [64, 32, 3, 3], "float32"], [1, 1], [1, 1, 1, 1], [1, 1], "float32"], {}], "config": {"index": 357, "code_hash": null, "entity": [["tile_b", "sp", [-1, 1, 1, 1]], ["tile_y", "sp", [-1, 8, 8, 1]], ["tile_x", "sp", [-1, 74, 1, 1]], ["tile_rc", "sp", [-1, 1]], ["auto_unroll_max_step", "ot", 0], ["unroll_explicit", "ot", 0]]}, "result": [[0.004706583181818182, 0.004710725954545455, 0.004720314], 0, 1.7811810970306396, 1679035719.1233916], "version": 0.2, "tvm_version": "0.10.0"}
{"input": ["cuda -keys=cuda,gpu -arch=sm_86 -max_num_threads=1024 -thread_warp_size=32", "conv2d_nchw_winograd.cuda", [["TENSOR", [1, 32, 147, 147], "float32"], ["TENSOR", [64, 32, 3, 3], "float32"], [1, 1], [1, 1, 1, 1], [1, 1], "float32"], {}], "config": {"index": 151554, "code_hash": null, "entity": [["tile_b", "sp", [-1, 1, 1, 1]], ["tile_y", "sp", [-1, 1, 8, 1]], ["tile_x", "sp", [-1, 74, 1, 1]], ["tile_rc", "sp", [-1, 1]], ["auto_unroll_max_step", "ot", 0], ["unroll_explicit", "ot", 1]]}, "result": [[0.0002977867962962963, 0.0002978171166666667, 0.0002987292518518519], 0, 1.9342856407165527, 1679035721.3940992], "version": 0.2, "tvm_version": "0.10.0"}
{"input": ["cuda -keys=cuda,gpu -arch=sm_86 -max_num_threads=1024 -thread_warp_size=32", "conv2d_nchw_winograd.cuda", [["TENSOR", [1, 32, 147, 147], "float32"], ["TENSOR", [64, 32, 3, 3], "float32"], [1, 1], [1, 1, 1, 1], [1, 1], "float32"], {}], "config": {"index": 50754, "code_hash": null, "entity": [["tile_b", "sp", [-1, 1, 1, 1]], ["tile_y", "sp", [-1, 1, 8, 1]], ["tile_x", "sp", [-1, 74, 1, 1]], ["tile_rc", "sp", [-1, 1]], ["auto_unroll_max_step", "ot", 128], ["unroll_explicit", "ot", 0]]}, "result": [[0.00029777091160221, 0.000298204650092081, 0.0002993021860036832], 0, 1.9388790130615234, 1679035722.6609278], "version": 0.2, "tvm_version": "0.10.0"}
{"input": ["cuda -keys=cuda,gpu -arch=sm_86 -max_num_threads=1024 -thread_warp_size=32", "conv2d_nchw_winograd.cuda", [["TENSOR", [1, 32, 147, 147], "float32"], ["TENSOR", [64, 32, 3, 3], "float32"], [1, 1], [1, 1, 1, 1], [1, 1], "float32"], {}], "config": {"index": 8754, "code_hash": null, "entity": [["tile_b", "sp", [-1, 1, 1, 1]], ["tile_y", "sp", [-1, 1, 8, 1]], ["tile_x", "sp", [-1, 74, 1, 1]], ["tile_rc", "sp", [-1, 2]], ["auto_unroll_max_step", "ot", 0], ["unroll_explicit", "ot", 0]]}, "result": [[0.0005306107830687831, 0.0005307028994708994, 0.0005307305132275132], 0, 1.5783677101135254, 1679035723.511893], "version": 0.2, "tvm_version": "0.10.0"}
{"input": ["cuda -keys=cuda,gpu -arch=sm_86 -max_num_threads=1024 -thread_warp_size=32", "conv2d_nchw_winograd.cuda", [["TENSOR", [1, 32, 147, 147], "float32"], ["TENSOR", [64, 32, 3, 3], "float32"], [1, 1], [1, 1, 1, 1], [1, 1], "float32"], {}], "config": {"index": 438, "code_hash": null, "entity": [["tile_b", "sp", [-1, 1, 1, 1]], ["tile_y", "sp", [-1, 1, 8, 1]], ["tile_x", "sp", [-1, 148, 1, 1]], ["tile_rc", "sp", [-1, 1]], ["auto_unroll_max_step", "ot", 0], ["unroll_explicit", "ot", 0]]}, "result": [[0.0003332397634854772, 0.0003332418858921162, 0.0003332950062240664], 0, 2.0155539512634277, 1679035724.7505634], "version": 0.2, "tvm_version": "0.10.0"}
{"input": ["cuda -keys=cuda,gpu -arch=sm_86 -max_num_threads=1024 -thread_warp_size=32", "conv2d_nchw_winograd.cuda", [["TENSOR", [1, 32, 147, 147], "float32"], ["TENSOR", [64, 32, 3, 3], "float32"], [1, 1], [1, 1, 1, 1], [1, 1], "float32"], {}], "config": {"index": 270, "code_hash": null, "entity": [["tile_b", "sp", [-1, 1, 1, 1]], ["tile_y", "sp", [-1, 1, 8, 1]], ["tile_x", "sp", [-1, 37, 1, 1]], ["tile_rc", "sp", [-1, 1]], ["auto_unroll_max_step", "ot", 0], ["unroll_explicit", "ot", 0]]}, "result": [[0.00032313114193548387, 0.00032320081612903224, 0.0003232173290322581], 0, 1.505964756011963, 1679035725.5984735], "version": 0.2, "tvm_version": "0.10.0"}
{"input": ["cuda -keys=cuda,gpu -arch=sm_86 -max_num_threads=1024 -thread_warp_size=32", "conv2d_nchw_winograd.cuda", [["TENSOR", [1, 32, 147, 147], "float32"], ["TENSOR", [64, 32, 3, 3], "float32"], [1, 1], [1, 1, 1, 1], [1, 1], "float32"], {}], "config": {"index": 353, "code_hash": null, "entity": [["tile_b", "sp", [-1, 1, 1, 1]], ["tile_y", "sp", [-1, 16, 4, 1]], ["tile_x", "sp", [-1, 74, 1, 1]], ["tile_rc", "sp", [-1, 1]], ["auto_unroll_max_step", "ot", 0], ["unroll_explicit", "ot", 0]]}, "result": [[0.015687077, 0.015689581714285715, 0.01570640442857143], 0, 1.6564741134643555, 1679035726.5453596], "version": 0.2, "tvm_version": "0.10.0"}
{"input": ["cuda -keys=cuda,gpu -arch=sm_86 -max_num_threads=1024 -thread_warp_size=32", "conv2d_nchw_winograd.cuda", [["TENSOR", [1, 32, 147, 147], "float32"], ["TENSOR", [64, 32, 3, 3], "float32"], [1, 1], [1, 1, 1, 1], [1, 1], "float32"], {}], "config": {"index": 101154, "code_hash": null, "entity": [["tile_b", "sp", [-1, 1, 1, 1]], ["tile_y", "sp", [-1, 1, 8, 1]], ["tile_x", "sp", [-1, 74, 1, 1]], ["tile_rc", "sp", [-1, 1]], ["auto_unroll_max_step", "ot", 1500], ["unroll_explicit", "ot", 0]]}, "result": [[0.00029914025276752765, 0.0002993910664206642, 0.00029939909040590406], 0, 1.9458179473876953, 1679035727.8170667], "version": 0.2, "tvm_version": "0.10.0"}
{"input": ["cuda -keys=cuda,gpu -arch=sm_86 -max_num_threads=1024 -thread_warp_size=32", "conv2d_nchw_winograd.cuda", [["TENSOR", [1, 32, 147, 147], "float32"], ["TENSOR", [64, 32, 3, 3], "float32"], [1, 1], [1, 1, 1, 1], [1, 1], "float32"], {}], "config": {"index": 17154, "code_hash": null, "entity": [["tile_b", "sp", [-1, 1, 1, 1]], ["tile_y", "sp", [-1, 1, 8, 1]], ["tile_x", "sp", [-1, 74, 1, 1]], ["tile_rc", "sp", [-1, 4]], ["auto_unroll_max_step", "ot", 0], ["unroll_explicit", "ot", 0]]}, "result": [[0.0003581530780141844, 0.0003591516631205674, 0.0003596130531914894], 0, 1.5923411846160889, 1679035728.6727808], "version": 0.2, "tvm_version": "0.10.0"}
{"input": ["cuda -keys=cuda,gpu -arch=sm_86 -max_num_threads=1024 -thread_warp_size=32", "conv2d_nchw_winograd.cuda", [["TENSOR", [1, 32, 147, 147], "float32"], ["TENSOR", [64, 32, 3, 3], "float32"], [1, 1], [1, 1, 1, 1], [1, 1], "float32"], {}], "config": {"index": 1530, "code_hash": null, "entity": [["tile_b", "sp", [-1, 1, 1, 1]], ["tile_y", "sp", [-1, 1, 8, 1]], ["tile_x", "sp", [-1, 1, 37, 1]], ["tile_rc", "sp", [-1, 1]], ["auto_unroll_max_step", "ot", 0], ["unroll_explicit", "ot", 0]]}, "result": [[0.0006143874171779142, 0.0006144062760736197, 0.0006144188220858895], 0, 1.5113229751586914, 1679035729.5282104], "version": 0.2, "tvm_version": "0.10.0"}
{"input": ["cuda -keys=cuda,gpu -arch=sm_86 -max_num_threads=1024 -thread_warp_size=32", "conv2d_nchw_winograd.cuda", [["TENSOR", [1, 32, 147, 147], "float32"], ["TENSOR", [64, 32, 3, 3], "float32"], [1, 1], [1, 1, 1, 1], [1, 1], "float32"], {}], "config": {"index": 368, "code_hash": null, "entity": [["tile_b", "sp", [-1, 1, 1, 1]], ["tile_y", "sp", [-1, 16, 1, 2]], ["tile_x", "sp", [-1, 74, 1, 1]], ["tile_rc", "sp", [-1, 1]], ["auto_unroll_max_step", "ot", 0], ["unroll_explicit", "ot", 0]]}, "result": [[0.065610748, 0.06572846199999999, 0.0657556455], 0, 1.8427722454071045, 1679035730.6098158], "version": 0.2, "tvm_version": "0.10.0"}
{"input": ["cuda -keys=cuda,gpu -arch=sm_86 -max_num_threads=1024 -thread_warp_size=32", "conv2d_nchw_winograd.cuda", [["TENSOR", [1, 32, 147, 147], "float32"], ["TENSOR", [64, 32, 3, 3], "float32"], [1, 1], [1, 1, 1, 1], [1, 1], "float32"], {}], "config": {"index": 340, "code_hash": null, "entity": [["tile_b", "sp", [-1, 1, 1, 1]], ["tile_y", "sp", [-1, 16, 1, 1]], ["tile_x", "sp", [-1, 74, 1, 1]], ["tile_rc", "sp", [-1, 1]], ["auto_unroll_max_step", "ot", 0], ["unroll_explicit", "ot", 0]]}, "result": [[0.03759854866666667, 0.03760639933333333, 0.037620351], 0, 1.746307134628296, 1679035731.6410818], "version": 0.2, "tvm_version": "0.10.0"}
{"input": ["cuda -keys=cuda,gpu -arch=sm_86 -max_num_threads=1024 -thread_warp_size=32", "conv2d_nchw_winograd.cuda", [["TENSOR", [1, 32, 147, 147], "float32"], ["TENSOR", [64, 32, 3, 3], "float32"], [1, 1], [1, 1, 1, 1], [1, 1], "float32"], {}], "config": {"index": 25554, "code_hash": null, "entity": [["tile_b", "sp", [-1, 1, 1, 1]], ["tile_y", "sp", [-1, 1, 8, 1]], ["tile_x", "sp", [-1, 74, 1, 1]], ["tile_rc", "sp", [-1, 8]], ["auto_unroll_max_step", "ot", 0], ["unroll_explicit", "ot", 0]]}, "result": [[0.0003038645177514793, 0.0003041521331360947, 0.0003041673905325444], 0, 1.6400678157806396, 1679035732.5037165], "version": 0.2, "tvm_version": "0.10.0"}
{"input": ["cuda -keys=cuda,gpu -arch=sm_86 -max_num_threads=1024 -thread_warp_size=32", "conv2d_nchw_winograd.cuda", [["TENSOR", [1, 32, 147, 147], "float32"], ["TENSOR", [64, 32, 3, 3], "float32"], [1, 1], [1, 1, 1, 1], [1, 1], "float32"], {}], "config": {"index": 1614, "code_hash": null, "entity": [["tile_b", "sp", [-1, 1, 1, 1]], ["tile_y", "sp", [-1, 1, 8, 1]], ["tile_x", "sp", [-1, 2, 37, 1]], ["tile_rc", "sp", [-1, 1]], ["auto_unroll_max_step", "ot", 0], ["unroll_explicit", "ot", 0]]}, "result": [[0.0003810735758293839, 0.0003810760331753554, 0.0003810884360189574], 0, 1.9162240028381348, 1679035733.7693448], "version": 0.2, "tvm_version": "0.10.0"}
{"input": ["cuda -keys=cuda,gpu -arch=sm_86 -max_num_threads=1024 -thread_warp_size=32", "conv2d_nchw_winograd.cuda", [["TENSOR", [1, 32, 147, 147], "float32"], ["TENSOR", [64, 32, 3, 3], "float32"], [1, 1], [1, 1, 1, 1], [1, 1], "float32"], {}], "config": {"index": 369, "code_hash": null, "entity": [["tile_b", "sp", [-1, 1, 1, 1]], ["tile_y", "sp", [-1, 32, 1, 2]], ["tile_x", "sp", [-1, 74, 1, 1]], ["tile_rc", "sp", [-1, 1]], ["auto_unroll_max_step", "ot", 0], ["unroll_explicit", "ot", 0]]}, "result": [[0.071049728, 0.071052803, 0.0710748135], 0, 2.0064918994903564, 1679035734.905839], "version": 0.2, "tvm_version": "0.10.0"}
{"input": ["cuda -keys=cuda,gpu -arch=sm_86 -max_num_threads=1024 -thread_warp_size=32", "conv2d_nchw_winograd.cuda", [["TENSOR", [1, 32, 147, 147], "float32"], ["TENSOR", [64, 32, 3, 3], "float32"], [1, 1], [1, 1, 1, 1], [1, 1], "float32"], {}], "config": {"index": 339, "code_hash": null, "entity": [["tile_b", "sp", [-1, 1, 1, 1]], ["tile_y", "sp", [-1, 8, 1, 1]], ["tile_x", "sp", [-1, 74, 1, 1]], ["tile_rc", "sp", [-1, 1]], ["auto_unroll_max_step", "ot", 0], ["unroll_explicit", "ot", 0]]}, "result": [[0.03725101966666666, 0.037261311666666665, 0.037261311666666665], 0, 1.928990364074707, 1679035735.9341083], "version": 0.2, "tvm_version": "0.10.0"}
{"input": ["cuda -keys=cuda,gpu -arch=sm_86 -max_num_threads=1024 -thread_warp_size=32", "conv2d_nchw_winograd.cuda", [["TENSOR", [1, 32, 147, 147], "float32"], ["TENSOR", [64, 32, 3, 3], "float32"], [1, 1], [1, 1, 1, 1], [1, 1], "float32"], {}], "config": {"index": 33954, "code_hash": null, "entity": [["tile_b", "sp", [-1, 1, 1, 1]], ["tile_y", "sp", [-1, 1, 8, 1]], ["tile_x", "sp", [-1, 74, 1, 1]], ["tile_rc", "sp", [-1, 16]], ["auto_unroll_max_step", "ot", 0], ["unroll_explicit", "ot", 0]]}, "result": [[0.0003705687488584475, 0.00037073708447488585, 0.0003708259178082192], 0, 2.0797221660614014, 1679035737.194521], "version": 0.2, "tvm_version": "0.10.0"}
{"input": ["cuda -keys=cuda,gpu -arch=sm_86 -max_num_threads=1024 -thread_warp_size=32", "conv2d_nchw_winograd.cuda", [["TENSOR", [1, 32, 147, 147], "float32"], ["TENSOR", [64, 32, 3, 3], "float32"], [1, 1], [1, 1, 1, 1], [1, 1], "float32"], {}], "config": {"index": 1698, "code_hash": null, "entity": [["tile_b", "sp", [-1, 1, 1, 1]], ["tile_y", "sp", [-1, 1, 8, 1]], ["tile_x", "sp", [-1, 4, 37, 1]], ["tile_rc", "sp", [-1, 1]], ["auto_unroll_max_step", "ot", 0], ["unroll_explicit", "ot", 0]]}, "result": [[0.0002640877037037037, 0.00026412189444444443, 0.0002677361648148148], 0, 1.8339908123016357, 1679035740.5959036], "version": 0.2, "tvm_version": "0.10.0"}
{"input": ["cuda -keys=cuda,gpu -arch=sm_86 -max_num_threads=1024 -thread_warp_size=32", "conv2d_nchw_winograd.cuda", [["TENSOR", [1, 32, 147, 147], "float32"], ["TENSOR", [64, 32, 3, 3], "float32"], [1, 1], [1, 1, 1, 1], [1, 1], "float32"], {}], "config": {"index": 370, "code_hash": null, "entity": [["tile_b", "sp", [-1, 1, 1, 1]], ["tile_y", "sp", [-1, 1, 2, 2]], ["tile_x", "sp", [-1, 74, 1, 1]], ["tile_rc", "sp", [-1, 1]], ["auto_unroll_max_step", "ot", 0], ["unroll_explicit", "ot", 0]]}, "result": [[0.0010010111900000001, 0.00100104194, 0.00100105216], 0, 1.6573190689086914, 1679035741.445132], "version": 0.2, "tvm_version": "0.10.0"}
{"input": ["cuda -keys=cuda,gpu -arch=sm_86 -max_num_threads=1024 -thread_warp_size=32", "conv2d_nchw_winograd.cuda", [["TENSOR", [1, 32, 147, 147], "float32"], ["TENSOR", [64, 32, 3, 3], "float32"], [1, 1], [1, 1, 1, 1], [1, 1], "float32"], {}], "config": {"index": 42354, "code_hash": null, "entity": [["tile_b", "sp", [-1, 1, 1, 1]], ["tile_y", "sp", [-1, 1, 8, 1]], ["tile_x", "sp", [-1, 74, 1, 1]], ["tile_rc", "sp", [-1, 32]], ["auto_unroll_max_step", "ot", 0], ["unroll_explicit", "ot", 0]]}, "result": [[0.00041808455584415585, 0.0004180925636363636, 0.00041809521818181815], 0, 2.248544931411743, 1679035742.7055862], "version": 0.2, "tvm_version": "0.10.0"}
{"input": ["cuda -keys=cuda,gpu -arch=sm_86 -max_num_threads=1024 -thread_warp_size=32", "conv2d_nchw_winograd.cuda", [["TENSOR", [1, 32, 147, 147], "float32"], ["TENSOR", [64, 32, 3, 3], "float32"], [1, 1], [1, 1, 1, 1], [1, 1], "float32"], {}], "config": {"index": 1782, "code_hash": null, "entity": [["tile_b", "sp", [-1, 1, 1, 1]], ["tile_y", "sp", [-1, 1, 8, 1]], ["tile_x", "sp", [-1, 37, 37, 1]], ["tile_rc", "sp", [-1, 1]], ["auto_unroll_max_step", "ot", 0], ["unroll_explicit", "ot", 0]]}, "result": [[0.00020727019334186938, 0.0002076910704225352, 0.00020783003969270165], 0, 1.9129512310028076, 1679035743.9770415], "version": 0.2, "tvm_version": "0.10.0"}
{"input": ["cuda -keys=cuda,gpu -arch=sm_86 -max_num_threads=1024 -thread_warp_size=32", "conv2d_nchw_winograd.cuda", [["TENSOR", [1, 32, 147, 147], "float32"], ["TENSOR", [64, 32, 3, 3], "float32"], [1, 1], [1, 1, 1, 1], [1, 1], "float32"], {}], "config": {"index": 371, "code_hash": null, "entity": [["tile_b", "sp", [-1, 1, 1, 1]], ["tile_y", "sp", [-1, 2, 2, 2]], ["tile_x", "sp", [-1, 74, 1, 1]], ["tile_rc", "sp", [-1, 1]], ["auto_unroll_max_step", "ot", 0], ["unroll_explicit", "ot", 0]]}, "result": [[0.0017272054655172412, 0.0017273467413793102, 0.001727435], 0, 1.7668430805206299, 1679035744.8284454], "version": 0.2, "tvm_version": "0.10.0"}
{"input": ["cuda -keys=cuda,gpu -arch=sm_86 -max_num_threads=1024 -thread_warp_size=32", "conv2d_nchw_winograd.cuda", [["TENSOR", [1, 32, 147, 147], "float32"], ["TENSOR", [64, 32, 3, 3], "float32"], [1, 1], [1, 1, 1, 1], [1, 1], "float32"], {}], "config": {"index": 1866, "code_hash": null, "entity": [["tile_b", "sp", [-1, 1, 1, 1]], ["tile_y", "sp", [-1, 1, 8, 1]], ["tile_x", "sp", [-1, 74, 37, 1]], ["tile_rc", "sp", [-1, 1]], ["auto_unroll_max_step", "ot", 0], ["unroll_explicit", "ot", 0]]}, "result": [[0.0002297345102974828, 0.00022975794050343246, 0.0002298376224256293], 0, 1.5742254257202148, 1679035745.6804345], "version": 0.2, "tvm_version": "0.10.0"}
{"input": ["cuda -keys=cuda,gpu -arch=sm_86 -max_num_threads=1024 -thread_warp_size=32", "conv2d_nchw_winograd.cuda", [["TENSOR", [1, 32, 147, 147], "float32"], ["TENSOR", [64, 32, 3, 3], "float32"], [1, 1], [1, 1, 1, 1], [1, 1], "float32"], {}], "config": {"index": 372, "code_hash": null, "entity": [["tile_b", "sp", [-1, 1, 1, 1]], ["tile_y", "sp", [-1, 4, 2, 2]], ["tile_x", "sp", [-1, 74, 1, 1]], ["tile_rc", "sp", [-1, 1]], ["auto_unroll_max_step", "ot", 0], ["unroll_explicit", "ot", 0]]}, "result": [[0.027392768749999998, 0.02739839925, 0.02739865675], 0, 3.0969345569610596, 1679035746.6584384], "version": 0.2, "tvm_version": "0.10.0"}
{"input": ["cuda -keys=cuda,gpu -arch=sm_86 -max_num_threads=1024 -thread_warp_size=32", "conv2d_nchw_winograd.cuda", [["TENSOR", [1, 32, 147, 147], "float32"], ["TENSOR", [64, 32, 3, 3], "float32"], [1, 1], [1, 1, 1, 1], [1, 1], "float32"], {}], "config": {"index": 1950, "code_hash": null, "entity": [["tile_b", "sp", [-1, 1, 1, 1]], ["tile_y", "sp", [-1, 1, 8, 1]], ["tile_x", "sp", [-1, 148, 37, 1]], ["tile_rc", "sp", [-1, 1]], ["auto_unroll_max_step", "ot", 0], ["unroll_explicit", "ot", 0]]}, "result": [[0.00026827086789297665, 0.00026829485284280937, 0.0002683479280936455], 0, 2.071629285812378, 1679035747.9213111], "version": 0.2, "tvm_version": "0.10.0"}
{"input": ["cuda -keys=cuda,gpu -arch=sm_86 -max_num_threads=1024 -thread_warp_size=32", "conv2d_nchw_winograd.cuda", [["TENSOR", [1, 32, 147, 147], "float32"], ["TENSOR", [64, 32, 3, 3], "float32"], [1, 1], [1, 1, 1, 1], [1, 1], "float32"], {}], "config": {"index": 373, "code_hash": null, "entity": [["tile_b", "sp", [-1, 1, 1, 1]], ["tile_y", "sp", [-1, 8, 2, 2]], ["tile_x", "sp", [-1, 74, 1, 1]], ["tile_rc", "sp", [-1, 1]], ["auto_unroll_max_step", "ot", 0], ["unroll_explicit", "ot", 0]]}, "result": [[0.030005504500000002, 0.030012472, 0.030019327000000002], 0, 2.4450650215148926, 1679035748.9709916], "version": 0.2, "tvm_version": "0.10.0"}
{"input": ["cuda -keys=cuda,gpu -arch=sm_86 -max_num_threads=1024 -thread_warp_size=32", "conv2d_nchw_winograd.cuda", [["TENSOR", [1, 32, 147, 147], "float32"], ["TENSOR", [64, 32, 3, 3], "float32"], [1, 1], [1, 1, 1, 1], [1, 1], "float32"], {}], "config": {"index": 2034, "code_hash": null, "entity": [["tile_b", "sp", [-1, 1, 1, 1]], ["tile_y", "sp", [-1, 1, 8, 1]], ["tile_x", "sp", [-1, 1, 74, 1]], ["tile_rc", "sp", [-1, 1]], ["auto_unroll_max_step", "ot", 0], ["unroll_explicit", "ot", 0]]}, "result": [[0.0006086879509433963, 0.0006086926716981132, 0.000608711962264151], 0, 1.9060008525848389, 1679035750.2289603], "version": 0.2, "tvm_version": "0.10.0"}
{"input": ["cuda -keys=cuda,gpu -arch=sm_86 -max_num_threads=1024 -thread_warp_size=32", "conv2d_nchw_winograd.cuda", [["TENSOR", [1, 32, 147, 147], "float32"], ["TENSOR", [64, 32, 3, 3], "float32"], [1, 1], [1, 1, 1, 1], [1, 1], "float32"], {}], "config": {"index": 374, "code_hash": null, "entity": [["tile_b", "sp", [-1, 1, 1, 1]], ["tile_y", "sp", [-1, 16, 2, 2]], ["tile_x", "sp", [-1, 74, 1, 1]], ["tile_rc", "sp", [-1, 1]], ["auto_unroll_max_step", "ot", 0], ["unroll_explicit", "ot", 0]]}, "result": [[0.032594913249999996, 0.03259848, 0.03260825725], 0, 1.9127671718597412, 1679035751.3344524], "version": 0.2, "tvm_version": "0.10.0"}
{"input": ["cuda -keys=cuda,gpu -arch=sm_86 -max_num_threads=1024 -thread_warp_size=32", "conv2d_nchw_winograd.cuda", [["TENSOR", [1, 32, 147, 147], "float32"], ["TENSOR", [64, 32, 3, 3], "float32"], [1, 1], [1, 1, 1, 1], [1, 1], "float32"], {}], "config": {"index": 2118, "code_hash": null, "entity": [["tile_b", "sp", [-1, 1, 1, 1]], ["tile_y", "sp", [-1, 1, 8, 1]], ["tile_x", "sp", [-1, 2, 74, 1]], ["tile_rc", "sp", [-1, 1]], ["auto_unroll_max_step", "ot", 0], ["unroll_explicit", "ot", 0]]}, "result": [[0.000373300162037037, 0.000373300162037037, 0.00037330245833333336], 0, 1.9569149017333984, 1679035752.6241674], "version": 0.2, "tvm_version": "0.10.0"}
{"input": ["cuda -keys=cuda,gpu -arch=sm_86 -max_num_threads=1024 -thread_warp_size=32", "conv2d_nchw_winograd.cuda", [["TENSOR", [1, 32, 147, 147], "float32"], ["TENSOR", [64, 32, 3, 3], "float32"], [1, 1], [1, 1, 1, 1], [1, 1], "float32"], {}], "config": {"index": 375, "code_hash": null, "entity": [["tile_b", "sp", [-1, 1, 1, 1]], ["tile_y", "sp", [-1, 1, 4, 2]], ["tile_x", "sp", [-1, 74, 1, 1]], ["tile_rc", "sp", [-1, 1]], ["auto_unroll_max_step", "ot", 0], ["unroll_explicit", "ot", 0]]}, "result": [[0.0006153095398773006, 0.0006153109018404908, 0.000615311509202454], 0, 1.61527419090271, 1679035753.479462], "version": 0.2, "tvm_version": "0.10.0"}
{"input": ["cuda -keys=cuda,gpu -arch=sm_86 -max_num_threads=1024 -thread_warp_size=32", "conv2d_nchw_winograd.cuda", [["TENSOR", [1, 32, 147, 147], "float32"], ["TENSOR", [64, 32, 3, 3], "float32"], [1, 1], [1, 1, 1, 1], [1, 1], "float32"], {}], "config": {"index": 2202, "code_hash": null, "entity": [["tile_b", "sp", [-1, 1, 1, 1]], ["tile_y", "sp", [-1, 1, 8, 1]], ["tile_x", "sp", [-1, 37, 74, 1]], ["tile_rc", "sp", [-1, 1]], ["auto_unroll_max_step", "ot", 0], ["unroll_explicit", "ot", 0]]}, "result": [[0.0002566793094098884, 0.00025670880382775124, 0.0002567202185007974], 0, 1.9126627445220947, 1679035754.7282255], "version": 0.2, "tvm_version": "0.10.0"}
{"input": ["cuda -keys=cuda,gpu -arch=sm_86 -max_num_threads=1024 -thread_warp_size=32", "conv2d_nchw_winograd.cuda", [["TENSOR", [1, 32, 147, 147], "float32"], ["TENSOR", [64, 32, 3, 3], "float32"], [1, 1], [1, 1, 1, 1], [1, 1], "float32"], {}], "config": {"index": 376, "code_hash": null, "entity": [["tile_b", "sp", [-1, 1, 1, 1]], ["tile_y", "sp", [-1, 2, 4, 2]], ["tile_x", "sp", [-1, 74, 1, 1]], ["tile_rc", "sp", [-1, 1]], ["auto_unroll_max_step", "ot", 0], ["unroll_explicit", "ot", 0]]}, "result": [[0.0007994349257425742, 0.0007995817722772277, 0.000800219112], 0, 2.0127179622650146, 1679035755.8617246], "version": 0.2, "tvm_version": "0.10.0"}
{"input": ["cuda -keys=cuda,gpu -arch=sm_86 -max_num_threads=1024 -thread_warp_size=32", "conv2d_nchw_winograd.cuda", [["TENSOR", [1, 32, 147, 147], "float32"], ["TENSOR", [64, 32, 3, 3], "float32"], [1, 1], [1, 1, 1, 1], [1, 1], "float32"], {}], "config": {"index": 2286, "code_hash": null, "entity": [["tile_b", "sp", [-1, 1, 1, 1]], ["tile_y", "sp", [-1, 1, 8, 1]], ["tile_x", "sp", [-1, 74, 74, 1]], ["tile_rc", "sp", [-1, 1]], ["auto_unroll_max_step", "ot", 0], ["unroll_explicit", "ot", 0]]}, "result": [[0.00023878773094170402, 0.00023883077130044844, 0.00023883229895366217], 0, 1.9589495658874512, 1679035757.122485], "version": 0.2, "tvm_version": "0.10.0"}
{"input": ["cuda -keys=cuda,gpu -arch=sm_86 -max_num_threads=1024 -thread_warp_size=32", "conv2d_nchw_winograd.cuda", [["TENSOR", [1, 32, 147, 147], "float32"], ["TENSOR", [64, 32, 3, 3], "float32"], [1, 1], [1, 1, 1, 1], [1, 1], "float32"], {}], "config": {"index": 152982, "code_hash": null, "entity": [["tile_b", "sp", [-1, 1, 1, 1]], ["tile_y", "sp", [-1, 1, 8, 1]], ["tile_x", "sp", [-1, 37, 37, 1]], ["tile_rc", "sp", [-1, 1]], ["auto_unroll_max_step", "ot", 0], ["unroll_explicit", "ot", 1]]}, "result": [[0.00020747724893314368, 0.00020787636415362732, 0.00021010790327169278], 0, 1.7969181537628174, 1679035760.4234147], "version": 0.2, "tvm_version": "0.10.0"}
{"input": ["cuda -keys=cuda,gpu -arch=sm_86 -max_num_threads=1024 -thread_warp_size=32", "conv2d_nchw_winograd.cuda", [["TENSOR", [1, 32, 147, 147], "float32"], ["TENSOR", [64, 32, 3, 3], "float32"], [1, 1], [1, 1, 1, 1], [1, 1], "float32"], {}], "config": {"index": 52182, "code_hash": null, "entity": [["tile_b", "sp", [-1, 1, 1, 1]], ["tile_y", "sp", [-1, 1, 8, 1]], ["tile_x", "sp", [-1, 37, 37, 1]], ["tile_rc", "sp", [-1, 1]], ["auto_unroll_max_step", "ot", 128], ["unroll_explicit", "ot", 0]]}, "result": [[0.00020678227086007704, 0.00020678885237483953, 0.00020747369576379972], 0, 1.964235544204712, 1679035761.723782], "version": 0.2, "tvm_version": "0.10.0"}
{"input": ["cuda -keys=cuda,gpu -arch=sm_86 -max_num_threads=1024 -thread_warp_size=32", "conv2d_nchw_winograd.cuda", [["TENSOR", [1, 32, 147, 147], "float32"], ["TENSOR", [64, 32, 3, 3], "float32"], [1, 1], [1, 1, 1, 1], [1, 1], "float32"], {}], "config": {"index": 10182, "code_hash": null, "entity": [["tile_b", "sp", [-1, 1, 1, 1]], ["tile_y", "sp", [-1, 1, 8, 1]], ["tile_x", "sp", [-1, 37, 37, 1]], ["tile_rc", "sp", [-1, 2]], ["auto_unroll_max_step", "ot", 0], ["unroll_explicit", "ot", 0]]}, "result": [[0.00023895394526627219, 0.00023898735207100594, 0.00023904795857988164], 0, 1.9628963470458984, 1679035762.9826663], "version": 0.2, "tvm_version": "0.10.0"}
{"input": ["cuda -keys=cuda,gpu -arch=sm_86 -max_num_threads=1024 -thread_warp_size=32", "conv2d_nchw_winograd.cuda", [["TENSOR", [1, 32, 147, 147], "float32"], ["TENSOR", [64, 32, 3, 3], "float32"], [1, 1], [1, 1, 1, 1], [1, 1], "float32"], {}], "config": {"index": 1783, "code_hash": null, "entity": [["tile_b", "sp", [-1, 1, 1, 1]], ["tile_y", "sp", [-1, 2, 8, 1]], ["tile_x", "sp", [-1, 37, 37, 1]], ["tile_rc", "sp", [-1, 1]], ["auto_unroll_max_step", "ot", 0], ["unroll_explicit", "ot", 0]]}, "result": [[0.00016194431859296486, 0.00016195145025125628, 0.00016198342412060301], 0, 1.9508616924285889, 1679035764.2396472], "version": 0.2, "tvm_version": "0.10.0"}
{"input": ["cuda -keys=cuda,gpu -arch=sm_86 -max_num_threads=1024 -thread_warp_size=32", "conv2d_nchw_winograd.cuda", [["TENSOR", [1, 32, 147, 147], "float32"], ["TENSOR", [64, 32, 3, 3], "float32"], [1, 1], [1, 1, 1, 1], [1, 1], "float32"], {}], "config": {"index": 1781, "code_hash": null, "entity": [["tile_b", "sp", [-1, 1, 1, 1]], ["tile_y", "sp", [-1, 16, 4, 1]], ["tile_x", "sp", [-1, 37, 37, 1]], ["tile_rc", "sp", [-1, 1]], ["auto_unroll_max_step", "ot", 0], ["unroll_explicit", "ot", 0]]}, "result": [[0.0030363152121212125, 0.003038642393939394, 0.0030391387878787876], 0, 1.756556510925293, 1679035765.106216], "version": 0.2, "tvm_version": "0.10.0"}
{"input": ["cuda -keys=cuda,gpu -arch=sm_86 -max_num_threads=1024 -thread_warp_size=32", "conv2d_nchw_winograd.cuda", [["TENSOR", [1, 32, 147, 147], "float32"], ["TENSOR", [64, 32, 3, 3], "float32"], [1, 1], [1, 1, 1, 1], [1, 1], "float32"], {}], "config": {"index": 3798, "code_hash": null, "entity": [["tile_b", "sp", [-1, 1, 1, 1]], ["tile_y", "sp", [-1, 1, 8, 1]], ["tile_x", "sp", [-1, 1, 37, 2]], ["tile_rc", "sp", [-1, 1]], ["auto_unroll_max_step", "ot", 0], ["unroll_explicit", "ot", 0]]}, "result": [[0.0003402565444915254, 0.0003402608771186441, 0.00034027390466101693], 0, 1.8841602802276611, 1679035766.360843], "version": 0.2, "tvm_version": "0.10.0"}
{"input": ["cuda -keys=cuda,gpu -arch=sm_86 -max_num_threads=1024 -thread_warp_size=32", "conv2d_nchw_winograd.cuda", [["TENSOR", [1, 32, 147, 147], "float32"], ["TENSOR", [64, 32, 3, 3], "float32"], [1, 1], [1, 1, 1, 1], [1, 1], "float32"], {}], "config": {"index": 1806, "code_hash": null, "entity": [["tile_b", "sp", [-1, 1, 1, 1]], ["tile_y", "sp", [-1, 8, 4, 2]], ["tile_x", "sp", [-1, 37, 37, 1]], ["tile_rc", "sp", [-1, 1]], ["auto_unroll_max_step", "ot", 0], ["unroll_explicit", "ot", 0]]}, "result": [[0.004899303571428572, 0.004899303571428572, 0.004899303571428572], 0, 2.8914847373962402, 1679035767.2448692], "version": 0.2, "tvm_version": "0.10.0"}
{"input": ["cuda -keys=cuda,gpu -arch=sm_86 -max_num_threads=1024 -thread_warp_size=32", "conv2d_nchw_winograd.cuda", [["TENSOR", [1, 32, 147, 147], "float32"], ["TENSOR", [64, 32, 3, 3], "float32"], [1, 1], [1, 1, 1, 1], [1, 1], "float32"], {}], "config": {"index": 3882, "code_hash": null, "entity": [["tile_b", "sp", [-1, 1, 1, 1]], ["tile_y", "sp", [-1, 1, 8, 1]], ["tile_x", "sp", [-1, 2, 37, 2]], ["tile_rc", "sp", [-1, 1]], ["auto_unroll_max_step", "ot", 0], ["unroll_explicit", "ot", 0]]}, "result": [[0.00022714654008438822, 0.00022715804219409282, 0.00022718109142053444], 0, 1.9168522357940674, 1679035768.5003657], "version": 0.2, "tvm_version": "0.10.0"}
{"input": ["cuda -keys=cuda,gpu -arch=sm_86 -max_num_threads=1024 -thread_warp_size=32", "conv2d_nchw_winograd.cuda", [["TENSOR", [1, 32, 147, 147], "float32"], ["TENSOR", [64, 32, 3, 3], "float32"], [1, 1], [1, 1, 1, 1], [1, 1], "float32"], {}], "config": {"index": 1807, "code_hash": null, "entity": [["tile_b", "sp", [-1, 1, 1, 1]], ["tile_y", "sp", [-1, 1, 8, 2]], ["tile_x", "sp", [-1, 37, 37, 1]], ["tile_rc", "sp", [-1, 1]], ["auto_unroll_max_step", "ot", 0], ["unroll_explicit", "ot", 0]]}, "result": [[0.00016143686013986015, 0.0001614533986013986, 0.00016146464835164835], 0, 1.9571475982666016, 1679035769.7624688], "version": 0.2, "tvm_version": "0.10.0"}
{"input": ["cuda -keys=cuda,gpu -arch=sm_86 -max_num_threads=1024 -thread_warp_size=32", "conv2d_nchw_winograd.cuda", [["TENSOR", [1, 32, 147, 147], "float32"], ["TENSOR", [64, 32, 3, 3], "float32"], [1, 1], [1, 1, 1, 1], [1, 1], "float32"], {}], "config": {"index": 102582, "code_hash": null, "entity": [["tile_b", "sp", [-1, 1, 1, 1]], ["tile_y", "sp", [-1, 1, 8, 1]], ["tile_x", "sp", [-1, 37, 37, 1]], ["tile_rc", "sp", [-1, 1]], ["auto_unroll_max_step", "ot", 1500], ["unroll_explicit", "ot", 0]]}, "result": [[0.0002045838712121212, 0.00020463438636363638, 0.00020505858838383838], 0, 2.4450435638427734, 1679035771.0256236], "version": 0.2, "tvm_version": "0.10.0"}
{"input": ["cuda -keys=cuda,gpu -arch=sm_86 -max_num_threads=1024 -thread_warp_size=32", "conv2d_nchw_winograd.cuda", [["TENSOR", [1, 32, 147, 147], "float32"], ["TENSOR", [64, 32, 3, 3], "float32"], [1, 1], [1, 1, 1, 1], [1, 1], "float32"], {}], "config": {"index": 18582, "code_hash": null, "entity": [["tile_b", "sp", [-1, 1, 1, 1]], ["tile_y", "sp", [-1, 1, 8, 1]], ["tile_x", "sp", [-1, 37, 37, 1]], ["tile_rc", "sp", [-1, 4]], ["auto_unroll_max_step", "ot", 0], ["unroll_explicit", "ot", 0]]}, "result": [[0.00023257922883295195, 0.0002325932814645309, 0.00023332627917620137], 0, 1.5450401306152344, 1679035771.8863115], "version": 0.2, "tvm_version": "0.10.0"}
{"input": ["cuda -keys=cuda,gpu -arch=sm_86 -max_num_threads=1024 -thread_warp_size=32", "conv2d_nchw_winograd.cuda", [["TENSOR", [1, 32, 147, 147], "float32"], ["TENSOR", [64, 32, 3, 3], "float32"], [1, 1], [1, 1, 1, 1], [1, 1], "float32"], {}], "config": {"index": 3966, "code_hash": null, "entity": [["tile_b", "sp", [-1, 1, 1, 1]], ["tile_y", "sp", [-1, 1, 8, 1]], ["tile_x", "sp", [-1, 37, 37, 2]], ["tile_rc", "sp", [-1, 1]], ["auto_unroll_max_step", "ot", 0], ["unroll_explicit", "ot", 0]]}, "result": [[0.00021922647413793103, 0.00021931034913793104, 0.00021972744827586206], 0, 1.5692238807678223, 1679035772.7435458], "version": 0.2, "tvm_version": "0.10.0"}
{"input": ["cuda -keys=cuda,gpu -arch=sm_86 -max_num_threads=1024 -thread_warp_size=32", "conv2d_nchw_winograd.cuda", [["TENSOR", [1, 32, 147, 147], "float32"], ["TENSOR", [64, 32, 3, 3], "float32"], [1, 1], [1, 1, 1, 1], [1, 1], "float32"], {}], "config": {"index": 1808, "code_hash": null, "entity": [["tile_b", "sp", [-1, 1, 1, 1]], ["tile_y", "sp", [-1, 2, 8, 2]], ["tile_x", "sp", [-1, 37, 37, 1]], ["tile_rc", "sp", [-1, 1]], ["auto_unroll_max_step", "ot", 0], ["unroll_explicit", "ot", 0]]}, "result": [[0.00014756861651376148, 0.000147568728440367, 0.0001477395990825688], 0, 1.9496088027954102, 1679035773.9962685], "version": 0.2, "tvm_version": "0.10.0"}
{"input": ["cuda -keys=cuda,gpu -arch=sm_86 -max_num_threads=1024 -thread_warp_size=32", "conv2d_nchw_winograd.cuda", [["TENSOR", [1, 32, 147, 147], "float32"], ["TENSOR", [64, 32, 3, 3], "float32"], [1, 1], [1, 1, 1, 1], [1, 1], "float32"], {}], "config": {"index": 26982, "code_hash": null, "entity": [["tile_b", "sp", [-1, 1, 1, 1]], ["tile_y", "sp", [-1, 1, 8, 1]], ["tile_x", "sp", [-1, 37, 37, 1]], ["tile_rc", "sp", [-1, 8]], ["auto_unroll_max_step", "ot", 0], ["unroll_explicit", "ot", 0]]}, "result": [[0.00022093529850746268, 0.00022157577340569876, 0.0002220829579375848], 0, 1.9455204010009766, 1679035775.2682476], "version": 0.2, "tvm_version": "0.10.0"}
{"input": ["cuda -keys=cuda,gpu -arch=sm_86 -max_num_threads=1024 -thread_warp_size=32", "conv2d_nchw_winograd.cuda", [["TENSOR", [1, 32, 147, 147], "float32"], ["TENSOR", [64, 32, 3, 3], "float32"], [1, 1], [1, 1, 1, 1], [1, 1], "float32"], {}], "config": {"index": 4050, "code_hash": null, "entity": [["tile_b", "sp", [-1, 1, 1, 1]], ["tile_y", "sp", [-1, 1, 8, 1]], ["tile_x", "sp", [-1, 74, 37, 2]], ["tile_rc", "sp", [-1, 1]], ["auto_unroll_max_step", "ot", 0], ["unroll_explicit", "ot", 0]]}, "result": [[0.00028562544346289755, 0.000285632667844523, 0.00028564172614840985], 0, 2.081141233444214, 1679035776.5240154], "version": 0.2, "tvm_version": "0.10.0"}
{"input": ["cuda -keys=cuda,gpu -arch=sm_86 -max_num_threads=1024 -thread_warp_size=32", "conv2d_nchw_winograd.cuda", [["TENSOR", [1, 32, 147, 147], "float32"], ["TENSOR", [64, 32, 3, 3], "float32"], [1, 1], [1, 1, 1, 1], [1, 1], "float32"], {}], "config": {"index": 1809, "code_hash": null, "entity": [["tile_b", "sp", [-1, 1, 1, 1]], ["tile_y", "sp", [-1, 4, 8, 2]], ["tile_x", "sp", [-1, 37, 37, 1]], ["tile_rc", "sp", [-1, 1]], ["auto_unroll_max_step", "ot", 0], ["unroll_explicit", "ot", 0]]}, "result": [[0.0016692378833333334, 0.0016695978666666667, 0.0016698538333333333], 0, 1.7161991596221924, 1679035777.3973215], "version": 0.2, "tvm_version": "0.10.0"}
