src/tvm/results/cuda_rtx3080/inception_v3/droplet/cpu.log_layer_41.log
{"input": ["cuda -keys=cuda,gpu -arch=sm_86 -max_num_threads=1024 -thread_warp_size=32", "conv2d_nchw.cuda", [["TENSOR", [1, 384, 8, 8], "float32"], ["TENSOR", [384, 384, 3, 1], "float32"], [1, 1], [1, 0, 1, 0], [1, 1], "float32"], {}], "config": {"index": 0, "code_hash": null, "entity": [["tile_f", "sp", [-1, 1, 1, 1]], ["tile_y", "sp", [-1, 1, 1, 1]], ["tile_x", "sp", [-1, 1, 1, 1]], ["tile_rc", "sp", [-1, 1]], ["tile_ry", "sp", [-1, 1]], ["tile_rx", "sp", [-1, 1]], ["auto_unroll_max_step", "ot", 0], ["unroll_explicit", "ot", 0]]}, "result": [[0.0008162778455284552, 0.0008163194715447155, 0.0008163361544715447], 0, 0.9992918968200684, 1679309039.8590498], "version": 0.2, "tvm_version": "0.10.0"}
{"input": ["cuda -keys=cuda,gpu -arch=sm_86 -max_num_threads=1024 -thread_warp_size=32", "conv2d_nchw.cuda", [["TENSOR", [1, 384, 8, 8], "float32"], ["TENSOR", [384, 384, 3, 1], "float32"], [1, 1], [1, 0, 1, 0], [1, 1], "float32"], {}], "config": {"index": 18432000, "code_hash": null, "entity": [["tile_f", "sp", [-1, 1, 1, 1]], ["tile_y", "sp", [-1, 1, 1, 1]], ["tile_x", "sp", [-1, 1, 1, 1]], ["tile_rc", "sp", [-1, 1]], ["tile_ry", "sp", [-1, 1]], ["tile_rx", "sp", [-1, 1]], ["auto_unroll_max_step", "ot", 0], ["unroll_explicit", "ot", 1]]}, "result": [[0.0008162612276422764, 0.0008163277804878049, 0.0008164277073170732], 0, 1.1479332447052002, 1679309041.201419], "version": 0.2, "tvm_version": "0.10.0"}
{"input": ["cuda -keys=cuda,gpu -arch=sm_86 -max_num_threads=1024 -thread_warp_size=32", "conv2d_nchw.cuda", [["TENSOR", [1, 384, 8, 8], "float32"], ["TENSOR", [384, 384, 3, 1], "float32"], [1, 1], [1, 0, 1, 0], [1, 1], "float32"], {}], "config": {"index": 6144000, "code_hash": null, "entity": [["tile_f", "sp", [-1, 1, 1, 1]], ["tile_y", "sp", [-1, 1, 1, 1]], ["tile_x", "sp", [-1, 1, 1, 1]], ["tile_rc", "sp", [-1, 1]], ["tile_ry", "sp", [-1, 1]], ["tile_rx", "sp", [-1, 1]], ["auto_unroll_max_step", "ot", 512], ["unroll_explicit", "ot", 0]]}, "result": [[0.0008161857398373984, 0.0008162362276422765, 0.0008162778455284552], 0, 1.2001848220825195, 1679309042.0260465], "version": 0.2, "tvm_version": "0.10.0"}
{"input": ["cuda -keys=cuda,gpu -arch=sm_86 -max_num_threads=1024 -thread_warp_size=32", "conv2d_nchw.cuda", [["TENSOR", [1, 384, 8, 8], "float32"], ["TENSOR", [384, 384, 3, 1], "float32"], [1, 1], [1, 0, 1, 0], [1, 1], "float32"], {}], "config": {"index": 3072000, "code_hash": null, "entity": [["tile_f", "sp", [-1, 1, 1, 1]], ["tile_y", "sp", [-1, 1, 1, 1]], ["tile_x", "sp", [-1, 1, 1, 1]], ["tile_rc", "sp", [-1, 1]], ["tile_ry", "sp", [-1, 3]], ["tile_rx", "sp", [-1, 1]], ["auto_unroll_max_step", "ot", 0], ["unroll_explicit", "ot", 0]]}, "result": [[0.0019640320392156864, 0.0019640921764705883, 0.001964313117647059], 0, 1.1926119327545166, 1679309042.8606768], "version": 0.2, "tvm_version": "0.10.0"}
{"input": ["cuda -keys=cuda,gpu -arch=sm_86 -max_num_threads=1024 -thread_warp_size=32", "conv2d_nchw.cuda", [["TENSOR", [1, 384, 8, 8], "float32"], ["TENSOR", [384, 384, 3, 1], "float32"], [1, 1], [1, 0, 1, 0], [1, 1], "float32"], {}], "config": {"index": 192000, "code_hash": null, "entity": [["tile_f", "sp", [-1, 1, 1, 1]], ["tile_y", "sp", [-1, 1, 1, 1]], ["tile_x", "sp", [-1, 1, 1, 1]], ["tile_rc", "sp", [-1, 2]], ["tile_ry", "sp", [-1, 1]], ["tile_rx", "sp", [-1, 1]], ["auto_unroll_max_step", "ot", 0], ["unroll_explicit", "ot", 0]]}, "result": [[0.0023043025454545455, 0.0023043724318181818, 0.002304415954545454], 0, 1.1852452754974365, 1679309043.6912434], "version": 0.2, "tvm_version": "0.10.0"}
{"input": ["cuda -keys=cuda,gpu -arch=sm_86 -max_num_threads=1024 -thread_warp_size=32", "conv2d_nchw.cuda", [["TENSOR", [1, 384, 8, 8], "float32"], ["TENSOR", [384, 384, 3, 1], "float32"], [1, 1], [1, 0, 1, 0], [1, 1], "float32"], {}], "config": {"index": 9600, "code_hash": null, "entity": [["tile_f", "sp", [-1, 1, 1, 1]], ["tile_y", "sp", [-1, 1, 1, 1]], ["tile_x", "sp", [-1, 2, 1, 1]], ["tile_rc", "sp", [-1, 1]], ["tile_ry", "sp", [-1, 1]], ["tile_rx", "sp", [-1, 1]], ["auto_unroll_max_step", "ot", 0], ["unroll_explicit", "ot", 0]]}, "result": [[0.002088085333333333, 0.002088678666666667, 0.0020888105833333334], 0, 1.1893970966339111, 1679309044.5199454], "version": 0.2, "tvm_version": "0.10.0"}
{"input": ["cuda -keys=cuda,gpu -arch=sm_86 -max_num_threads=1024 -thread_warp_size=32", "conv2d_nchw.cuda", [["TENSOR", [1, 384, 8, 8], "float32"], ["TENSOR", [384, 384, 3, 1], "float32"], [1, 1], [1, 0, 1, 0], [1, 1], "float32"], {}], "config": {"index": 480, "code_hash": null, "entity": [["tile_f", "sp", [-1, 1, 1, 1]], ["tile_y", "sp", [-1, 2, 1, 1]], ["tile_x", "sp", [-1, 1, 1, 1]], ["tile_rc", "sp", [-1, 1]], ["tile_ry", "sp", [-1, 1]], ["tile_rx", "sp", [-1, 1]], ["auto_unroll_max_step", "ot", 0], ["unroll_explicit", "ot", 0]]}, "result": [[0.0018956557924528303, 0.0018956557924528303, 0.0018958067924528302], 0, 1.1845600605010986, 1679309045.3442369], "version": 0.2, "tvm_version": "0.10.0"}
{"input": ["cuda -keys=cuda,gpu -arch=sm_86 -max_num_threads=1024 -thread_warp_size=32", "conv2d_nchw.cuda", [["TENSOR", [1, 384, 8, 8], "float32"], ["TENSOR", [384, 384, 3, 1], "float32"], [1, 1], [1, 0, 1, 0], [1, 1], "float32"], {}], "config": {"index": 1, "code_hash": null, "entity": [["tile_f", "sp", [-1, 2, 1, 1]], ["tile_y", "sp", [-1, 1, 1, 1]], ["tile_x", "sp", [-1, 1, 1, 1]], ["tile_rc", "sp", [-1, 1]], ["tile_ry", "sp", [-1, 1]], ["tile_rx", "sp", [-1, 1]], ["auto_unroll_max_step", "ot", 0], ["unroll_explicit", "ot", 0]]}, "result": [[0.0017927496607142855, 0.0017928228214285716, 0.001792877732142857], 0, 1.1807258129119873, 1679309046.1596212], "version": 0.2, "tvm_version": "0.10.0"}
{"input": ["cuda -keys=cuda,gpu -arch=sm_86 -max_num_threads=1024 -thread_warp_size=32", "conv2d_nchw.cuda", [["TENSOR", [1, 384, 8, 8], "float32"], ["TENSOR", [384, 384, 3, 1], "float32"], [1, 1], [1, 0, 1, 0], [1, 1], "float32"], {}], "config": {"index": 12288000, "code_hash": null, "entity": [["tile_f", "sp", [-1, 1, 1, 1]], ["tile_y", "sp", [-1, 1, 1, 1]], ["tile_x", "sp", [-1, 1, 1, 1]], ["tile_rc", "sp", [-1, 1]], ["tile_ry", "sp", [-1, 1]], ["tile_rx", "sp", [-1, 1]], ["auto_unroll_max_step", "ot", 1500], ["unroll_explicit", "ot", 0]]}, "result": [[0.0008162195447154471, 0.000816253406504065, 0.0008163194715447155], 0, 1.2020609378814697, 1679309046.9970417], "version": 0.2, "tvm_version": "0.10.0"}
{"input": ["cuda -keys=cuda,gpu -arch=sm_86 -max_num_threads=1024 -thread_warp_size=32", "conv2d_nchw.cuda", [["TENSOR", [1, 384, 8, 8], "float32"], ["TENSOR", [384, 384, 3, 1], "float32"], [1, 1], [1, 0, 1, 0], [1, 1], "float32"], {}], "config": {"index": 384000, "code_hash": null, "entity": [["tile_f", "sp", [-1, 1, 1, 1]], ["tile_y", "sp", [-1, 1, 1, 1]], ["tile_x", "sp", [-1, 1, 1, 1]], ["tile_rc", "sp", [-1, 3]], ["tile_ry", "sp", [-1, 1]], ["tile_rx", "sp", [-1, 1]], ["auto_unroll_max_step", "ot", 0], ["unroll_explicit", "ot", 0]]}, "result": [[0.001971722019607843, 0.0019717817058823527, 0.001971840039215686], 0, 1.1669166088104248, 1679309047.82161], "version": 0.2, "tvm_version": "0.10.0"}
{"input": ["cuda -keys=cuda,gpu -arch=sm_86 -max_num_threads=1024 -thread_warp_size=32", "conv2d_nchw.cuda", [["TENSOR", [1, 384, 8, 8], "float32"], ["TENSOR", [384, 384, 3, 1], "float32"], [1, 1], [1, 0, 1, 0], [1, 1], "float32"], {}], "config": {"index": 19200, "code_hash": null, "entity": [["tile_f", "sp", [-1, 1, 1, 1]], ["tile_y", "sp", [-1, 1, 1, 1]], ["tile_x", "sp", [-1, 4, 1, 1]], ["tile_rc", "sp", [-1, 1]], ["tile_ry", "sp", [-1, 1]], ["tile_rx", "sp", [-1, 1]], ["auto_unroll_max_step", "ot", 0], ["unroll_explicit", "ot", 0]]}, "result": [[0.0015724929531250001, 0.001572592015625, 0.001572896], 0, 1.2035431861877441, 1679309048.6607676], "version": 0.2, "tvm_version": "0.10.0"}
{"input": ["cuda -keys=cuda,gpu -arch=sm_86 -max_num_threads=1024 -thread_warp_size=32", "conv2d_nchw.cuda", [["TENSOR", [1, 384, 8, 8], "float32"], ["TENSOR", [384, 384, 3, 1], "float32"], [1, 1], [1, 0, 1, 0], [1, 1], "float32"], {}], "config": {"index": 960, "code_hash": null, "entity": [["tile_f", "sp", [-1, 1, 1, 1]], ["tile_y", "sp", [-1, 4, 1, 1]], ["tile_x", "sp", [-1, 1, 1, 1]], ["tile_rc", "sp", [-1, 1]], ["tile_ry", "sp", [-1, 1]], ["tile_rx", "sp", [-1, 1]], ["auto_unroll_max_step", "ot", 0], ["unroll_explicit", "ot", 0]]}, "result": [[0.001458397231884058, 0.0014583985652173914, 0.0014584579420289857], 0, 1.1719682216644287, 1679309049.4884427], "version": 0.2, "tvm_version": "0.10.0"}
{"input": ["cuda -keys=cuda,gpu -arch=sm_86 -max_num_threads=1024 -thread_warp_size=32", "conv2d_nchw.cuda", [["TENSOR", [1, 384, 8, 8], "float32"], ["TENSOR", [384, 384, 3, 1], "float32"], [1, 1], [1, 0, 1, 0], [1, 1], "float32"], {}], "config": {"index": 2, "code_hash": null, "entity": [["tile_f", "sp", [-1, 3, 1, 1]], ["tile_y", "sp", [-1, 1, 1, 1]], ["tile_x", "sp", [-1, 1, 1, 1]], ["tile_rc", "sp", [-1, 1]], ["tile_ry", "sp", [-1, 1]], ["tile_rx", "sp", [-1, 1]], ["auto_unroll_max_step", "ot", 0], ["unroll_explicit", "ot", 0]]}, "result": [[0.0014362624000000001, 0.0014363209285714288, 0.0014365257142857143], 0, 1.198467493057251, 1679309050.3224723], "version": 0.2, "tvm_version": "0.10.0"}
{"input": ["cuda -keys=cuda,gpu -arch=sm_86 -max_num_threads=1024 -thread_warp_size=32", "conv2d_nchw.cuda", [["TENSOR", [1, 384, 8, 8], "float32"], ["TENSOR", [384, 384, 3, 1], "float32"], [1, 1], [1, 0, 1, 0], [1, 1], "float32"], {}], "config": {"index": 576000, "code_hash": null, "entity": [["tile_f", "sp", [-1, 1, 1, 1]], ["tile_y", "sp", [-1, 1, 1, 1]], ["tile_x", "sp", [-1, 1, 1, 1]], ["tile_rc", "sp", [-1, 4]], ["tile_ry", "sp", [-1, 1]], ["tile_rx", "sp", [-1, 1]], ["auto_unroll_max_step", "ot", 0], ["unroll_explicit", "ot", 0]]}, "result": [[0.0018894345094339622, 0.0018894538113207549, 0.0018894713773584904], 0, 1.2002639770507812, 1679309051.158299], "version": 0.2, "tvm_version": "0.10.0"}
{"input": ["cuda -keys=cuda,gpu -arch=sm_86 -max_num_threads=1024 -thread_warp_size=32", "conv2d_nchw.cuda", [["TENSOR", [1, 384, 8, 8], "float32"], ["TENSOR", [384, 384, 3, 1], "float32"], [1, 1], [1, 0, 1, 0], [1, 1], "float32"], {}], "config": {"index": 28800, "code_hash": null, "entity": [["tile_f", "sp", [-1, 1, 1, 1]], ["tile_y", "sp", [-1, 1, 1, 1]], ["tile_x", "sp", [-1, 8, 1, 1]], ["tile_rc", "sp", [-1, 1]], ["tile_ry", "sp", [-1, 1]], ["tile_rx", "sp", [-1, 1]], ["auto_unroll_max_step", "ot", 0], ["unroll_explicit", "ot", 0]]}, "result": [[0.0012175976136363635, 0.0012176367954545456, 0.0012182729242424242], 0, 1.592383623123169, 1679309052.384685], "version": 0.2, "tvm_version": "0.10.0"}
{"input": ["cuda -keys=cuda,gpu -arch=sm_86 -max_num_threads=1024 -thread_warp_size=32", "conv2d_nchw.cuda", [["TENSOR", [1, 384, 8, 8], "float32"], ["TENSOR", [384, 384, 3, 1], "float32"], [1, 1], [1, 0, 1, 0], [1, 1], "float32"], {}], "config": {"index": 1440, "code_hash": null, "entity": [["tile_f", "sp", [-1, 1, 1, 1]], ["tile_y", "sp", [-1, 8, 1, 1]], ["tile_x", "sp", [-1, 1, 1, 1]], ["tile_rc", "sp", [-1, 1]], ["tile_ry", "sp", [-1, 1]], ["tile_rx", "sp", [-1, 1]], ["auto_unroll_max_step", "ot", 0], ["unroll_explicit", "ot", 0]]}, "result": [[0.0006317272078431372, 0.0006317598196078431, 0.0006317718470588235], 0, 1.583038568496704, 1679309053.6182337], "version": 0.2, "tvm_version": "0.10.0"}
{"input": ["cuda -keys=cuda,gpu -arch=sm_86 -max_num_threads=1024 -thread_warp_size=32", "conv2d_nchw.cuda", [["TENSOR", [1, 384, 8, 8], "float32"], ["TENSOR", [384, 384, 3, 1], "float32"], [1, 1], [1, 0, 1, 0], [1, 1], "float32"], {}], "config": {"index": 3, "code_hash": null, "entity": [["tile_f", "sp", [-1, 4, 1, 1]], ["tile_y", "sp", [-1, 1, 1, 1]], ["tile_x", "sp", [-1, 1, 1, 1]], ["tile_rc", "sp", [-1, 1]], ["tile_ry", "sp", [-1, 1]], ["tile_rx", "sp", [-1, 1]], ["auto_unroll_max_step", "ot", 0], ["unroll_explicit", "ot", 0]]}, "result": [[0.0011827542470588235, 0.0011827772235294117, 0.0011828615882352941], 0, 1.177729845046997, 1679309054.44353], "version": 0.2, "tvm_version": "0.10.0"}
{"input": ["cuda -keys=cuda,gpu -arch=sm_86 -max_num_threads=1024 -thread_warp_size=32", "conv2d_nchw.cuda", [["TENSOR", [1, 384, 8, 8], "float32"], ["TENSOR", [384, 384, 3, 1], "float32"], [1, 1], [1, 0, 1, 0], [1, 1], "float32"], {}], "config": {"index": 18433440, "code_hash": null, "entity": [["tile_f", "sp", [-1, 1, 1, 1]], ["tile_y", "sp", [-1, 8, 1, 1]], ["tile_x", "sp", [-1, 1, 1, 1]], ["tile_rc", "sp", [-1, 1]], ["tile_ry", "sp", [-1, 1]], ["tile_rx", "sp", [-1, 1]], ["auto_unroll_max_step", "ot", 0], ["unroll_explicit", "ot", 1]]}, "result": [[0.0006317150039215686, 0.0006317438431372549, 0.0006317879450980393], 0, 1.5575664043426514, 1679309056.2249174], "version": 0.2, "tvm_version": "0.10.0"}
{"input": ["cuda -keys=cuda,gpu -arch=sm_86 -max_num_threads=1024 -thread_warp_size=32", "conv2d_nchw.cuda", [["TENSOR", [1, 384, 8, 8], "float32"], ["TENSOR", [384, 384, 3, 1], "float32"], [1, 1], [1, 0, 1, 0], [1, 1], "float32"], {}], "config": {"index": 6145440, "code_hash": null, "entity": [["tile_f", "sp", [-1, 1, 1, 1]], ["tile_y", "sp", [-1, 8, 1, 1]], ["tile_x", "sp", [-1, 1, 1, 1]], ["tile_rc", "sp", [-1, 1]], ["tile_ry", "sp", [-1, 1]], ["tile_rx", "sp", [-1, 1]], ["auto_unroll_max_step", "ot", 512], ["unroll_explicit", "ot", 0]]}, "result": [[0.0006317316980392157, 0.0006317549137254901, 0.0006317592823529411], 0, 1.5669219493865967, 1679309057.4562225], "version": 0.2, "tvm_version": "0.10.0"}
{"input": ["cuda -keys=cuda,gpu -arch=sm_86 -max_num_threads=1024 -thread_warp_size=32", "conv2d_nchw.cuda", [["TENSOR", [1, 384, 8, 8], "float32"], ["TENSOR", [384, 384, 3, 1], "float32"], [1, 1], [1, 0, 1, 0], [1, 1], "float32"], {}], "config": {"index": 3073440, "code_hash": null, "entity": [["tile_f", "sp", [-1, 1, 1, 1]], ["tile_y", "sp", [-1, 8, 1, 1]], ["tile_x", "sp", [-1, 1, 1, 1]], ["tile_rc", "sp", [-1, 1]], ["tile_ry", "sp", [-1, 3]], ["tile_rx", "sp", [-1, 1]], ["auto_unroll_max_step", "ot", 0], ["unroll_explicit", "ot", 0]]}, "result": [[0.0003854221169451074, 0.00038542236992840096, 0.00038544403818615745], 0, 1.5710952281951904, 1679309058.6816802], "version": 0.2, "tvm_version": "0.10.0"}
{"input": ["cuda -keys=cuda,gpu -arch=sm_86 -max_num_threads=1024 -thread_warp_size=32", "conv2d_nchw.cuda", [["TENSOR", [1, 384, 8, 8], "float32"], ["TENSOR", [384, 384, 3, 1], "float32"], [1, 1], [1, 0, 1, 0], [1, 1], "float32"], {}], "config": {"index": 193440, "code_hash": null, "entity": [["tile_f", "sp", [-1, 1, 1, 1]], ["tile_y", "sp", [-1, 8, 1, 1]], ["tile_x", "sp", [-1, 1, 1, 1]], ["tile_rc", "sp", [-1, 2]], ["tile_ry", "sp", [-1, 1]], ["tile_rx", "sp", [-1, 1]], ["auto_unroll_max_step", "ot", 0], ["unroll_explicit", "ot", 0]]}, "result": [[0.000546547393442623, 0.000546547393442623, 0.0005466928907103825], 0, 1.2026035785675049, 1679309059.5116062], "version": 0.2, "tvm_version": "0.10.0"}
{"input": ["cuda -keys=cuda,gpu -arch=sm_86 -max_num_threads=1024 -thread_warp_size=32", "conv2d_nchw.cuda", [["TENSOR", [1, 384, 8, 8], "float32"], ["TENSOR", [384, 384, 3, 1], "float32"], [1, 1], [1, 0, 1, 0], [1, 1], "float32"], {}], "config": {"index": 11040, "code_hash": null, "entity": [["tile_f", "sp", [-1, 1, 1, 1]], ["tile_y", "sp", [-1, 8, 1, 1]], ["tile_x", "sp", [-1, 2, 1, 1]], ["tile_rc", "sp", [-1, 1]], ["tile_ry", "sp", [-1, 1]], ["tile_rx", "sp", [-1, 1]], ["auto_unroll_max_step", "ot", 0], ["unroll_explicit", "ot", 0]]}, "result": [[0.0005672056161971832, 0.0005672671338028169, 0.000567277985915493], 0, 1.5939970016479492, 1679309060.736543], "version": 0.2, "tvm_version": "0.10.0"}
{"input": ["cuda -keys=cuda,gpu -arch=sm_86 -max_num_threads=1024 -thread_warp_size=32", "conv2d_nchw.cuda", [["TENSOR", [1, 384, 8, 8], "float32"], ["TENSOR", [384, 384, 3, 1], "float32"], [1, 1], [1, 0, 1, 0], [1, 1], "float32"], {}], "config": {"index": 1920, "code_hash": null, "entity": [["tile_f", "sp", [-1, 1, 1, 1]], ["tile_y", "sp", [-1, 1, 2, 1]], ["tile_x", "sp", [-1, 1, 1, 1]], ["tile_rc", "sp", [-1, 1]], ["tile_ry", "sp", [-1, 1]], ["tile_rx", "sp", [-1, 1]], ["auto_unroll_max_step", "ot", 0], ["unroll_explicit", "ot", 0]]}, "result": [[0.0016723626333333334, 0.0016723626333333334, 0.0016724821666666665], 0, 1.1714856624603271, 1679309061.560116], "version": 0.2, "tvm_version": "0.10.0"}
{"input": ["cuda -keys=cuda,gpu -arch=sm_86 -max_num_threads=1024 -thread_warp_size=32", "conv2d_nchw.cuda", [["TENSOR", [1, 384, 8, 8], "float32"], ["TENSOR", [384, 384, 3, 1], "float32"], [1, 1], [1, 0, 1, 0], [1, 1], "float32"], {}], "config": {"index": 1441, "code_hash": null, "entity": [["tile_f", "sp", [-1, 2, 1, 1]], ["tile_y", "sp", [-1, 8, 1, 1]], ["tile_x", "sp", [-1, 1, 1, 1]], ["tile_rc", "sp", [-1, 1]], ["tile_ry", "sp", [-1, 1]], ["tile_rx", "sp", [-1, 1]], ["auto_unroll_max_step", "ot", 0], ["unroll_explicit", "ot", 0]]}, "result": [[0.0004938507055214724, 0.000493888291411043, 0.0004939355184049079], 0, 1.6051437854766846, 1679309062.7947414], "version": 0.2, "tvm_version": "0.10.0"}
{"input": ["cuda -keys=cuda,gpu -arch=sm_86 -max_num_threads=1024 -thread_warp_size=32", "conv2d_nchw.cuda", [["TENSOR", [1, 384, 8, 8], "float32"], ["TENSOR", [384, 384, 3, 1], "float32"], [1, 1], [1, 0, 1, 0], [1, 1], "float32"], {}], "config": {"index": 769440, "code_hash": null, "entity": [["tile_f", "sp", [-1, 1, 1, 1]], ["tile_y", "sp", [-1, 8, 1, 1]], ["tile_x", "sp", [-1, 1, 1, 1]], ["tile_rc", "sp", [-1, 6]], ["tile_ry", "sp", [-1, 1]], ["tile_rx", "sp", [-1, 1]], ["auto_unroll_max_step", "ot", 0], ["unroll_explicit", "ot", 0]]}, "result": [[0.0007235955874439462, 0.0007236003766816144, 0.0007236052331838564], 0, 1.636815071105957, 1679309064.0356414], "version": 0.2, "tvm_version": "0.10.0"}
{"input": ["cuda -keys=cuda,gpu -arch=sm_86 -max_num_threads=1024 -thread_warp_size=32", "conv2d_nchw.cuda", [["TENSOR", [1, 384, 8, 8], "float32"], ["TENSOR", [384, 384, 3, 1], "float32"], [1, 1], [1, 0, 1, 0], [1, 1], "float32"], {}], "config": {"index": 39840, "code_hash": null, "entity": [["tile_f", "sp", [-1, 1, 1, 1]], ["tile_y", "sp", [-1, 8, 1, 1]], ["tile_x", "sp", [-1, 1, 2, 1]], ["tile_rc", "sp", [-1, 1]], ["tile_ry", "sp", [-1, 1]], ["tile_rx", "sp", [-1, 1]], ["auto_unroll_max_step", "ot", 0], ["unroll_explicit", "ot", 0]]}, "result": [[0.0008173684796747967, 0.0008173934146341463, 0.0008174587317073172], 0, 1.2133746147155762, 1679309064.8596632], "version": 0.2, "tvm_version": "0.10.0"}
{"input": ["cuda -keys=cuda,gpu -arch=sm_86 -max_num_threads=1024 -thread_warp_size=32", "conv2d_nchw.cuda", [["TENSOR", [1, 384, 8, 8], "float32"], ["TENSOR", [384, 384, 3, 1], "float32"], [1, 1], [1, 0, 1, 0], [1, 1], "float32"], {}], "config": {"index": 3360, "code_hash": null, "entity": [["tile_f", "sp", [-1, 1, 1, 1]], ["tile_y", "sp", [-1, 1, 4, 1]], ["tile_x", "sp", [-1, 1, 1, 1]], ["tile_rc", "sp", [-1, 1]], ["tile_ry", "sp", [-1, 1]], ["tile_rx", "sp", [-1, 1]], ["auto_unroll_max_step", "ot", 0], ["unroll_explicit", "ot", 0]]}, "result": [[0.00084003734375, 0.0008400580052083333, 0.0008400639687500001], 0, 1.5763773918151855, 1679309066.095737], "version": 0.2, "tvm_version": "0.10.0"}
{"input": ["cuda -keys=cuda,gpu -arch=sm_86 -max_num_threads=1024 -thread_warp_size=32", "conv2d_nchw.cuda", [["TENSOR", [1, 384, 8, 8], "float32"], ["TENSOR", [384, 384, 3, 1], "float32"], [1, 1], [1, 0, 1, 0], [1, 1], "float32"], {}], "config": {"index": 1444, "code_hash": null, "entity": [["tile_f", "sp", [-1, 6, 1, 1]], ["tile_y", "sp", [-1, 8, 1, 1]], ["tile_x", "sp", [-1, 1, 1, 1]], ["tile_rc", "sp", [-1, 1]], ["tile_ry", "sp", [-1, 1]], ["tile_rx", "sp", [-1, 1]], ["auto_unroll_max_step", "ot", 0], ["unroll_explicit", "ot", 0]]}, "result": [[0.00021694940054127197, 0.00021695757645466847, 0.00021695912584573747], 0, 1.6543102264404297, 1679309067.3159552], "version": 0.2, "tvm_version": "0.10.0"}
{"input": ["cuda -keys=cuda,gpu -arch=sm_86 -max_num_threads=1024 -thread_warp_size=32", "conv2d_nchw.cuda", [["TENSOR", [1, 384, 8, 8], "float32"], ["TENSOR", [384, 384, 3, 1], "float32"], [1, 1], [1, 0, 1, 0], [1, 1], "float32"], {}], "config": {"index": 12289440, "code_hash": null, "entity": [["tile_f", "sp", [-1, 1, 1, 1]], ["tile_y", "sp", [-1, 8, 1, 1]], ["tile_x", "sp", [-1, 1, 1, 1]], ["tile_rc", "sp", [-1, 1]], ["tile_ry", "sp", [-1, 1]], ["tile_rx", "sp", [-1, 1]], ["auto_unroll_max_step", "ot", 1500], ["unroll_explicit", "ot", 0]]}, "result": [[0.0006317075803921569, 0.0006317156588235294, 0.0006317235607843137], 0, 1.576500415802002, 1679309068.532203], "version": 0.2, "tvm_version": "0.10.0"}
{"input": ["cuda -keys=cuda,gpu -arch=sm_86 -max_num_threads=1024 -thread_warp_size=32", "conv2d_nchw.cuda", [["TENSOR", [1, 384, 8, 8], "float32"], ["TENSOR", [384, 384, 3, 1], "float32"], [1, 1], [1, 0, 1, 0], [1, 1], "float32"], {}], "config": {"index": 961440, "code_hash": null, "entity": [["tile_f", "sp", [-1, 1, 1, 1]], ["tile_y", "sp", [-1, 8, 1, 1]], ["tile_x", "sp", [-1, 1, 1, 1]], ["tile_rc", "sp", [-1, 8]], ["tile_ry", "sp", [-1, 1]], ["tile_rx", "sp", [-1, 1]], ["auto_unroll_max_step", "ot", 0], ["unroll_explicit", "ot", 0]]}, "result": [[0.0007128626017699115, 0.000712867128318584, 0.0007128707743362831], 0, 1.6509649753570557, 1679309069.756622], "version": 0.2, "tvm_version": "0.10.0"}
{"input": ["cuda -keys=cuda,gpu -arch=sm_86 -max_num_threads=1024 -thread_warp_size=32", "conv2d_nchw.cuda", [["TENSOR", [1, 384, 8, 8], "float32"], ["TENSOR", [384, 384, 3, 1], "float32"], [1, 1], [1, 0, 1, 0], [1, 1], "float32"], {}], "config": {"index": 49440, "code_hash": null, "entity": [["tile_f", "sp", [-1, 1, 1, 1]], ["tile_y", "sp", [-1, 8, 1, 1]], ["tile_x", "sp", [-1, 2, 2, 1]], ["tile_rc", "sp", [-1, 1]], ["tile_ry", "sp", [-1, 1]], ["tile_rx", "sp", [-1, 1]], ["auto_unroll_max_step", "ot", 0], ["unroll_explicit", "ot", 0]]}, "result": [[0.0006943558620689656, 0.0006943778965517241, 0.000694404400862069], 0, 1.574324607849121, 1679309070.9316993], "version": 0.2, "tvm_version": "0.10.0"}
{"input": ["cuda -keys=cuda,gpu -arch=sm_86 -max_num_threads=1024 -thread_warp_size=32", "conv2d_nchw.cuda", [["TENSOR", [1, 384, 8, 8], "float32"], ["TENSOR", [384, 384, 3, 1], "float32"], [1, 1], [1, 0, 1, 0], [1, 1], "float32"], {}], "config": {"index": 3840, "code_hash": null, "entity": [["tile_f", "sp", [-1, 1, 1, 1]], ["tile_y", "sp", [-1, 2, 4, 1]], ["tile_x", "sp", [-1, 1, 1, 1]], ["tile_rc", "sp", [-1, 1]], ["tile_ry", "sp", [-1, 1]], ["tile_rx", "sp", [-1, 1]], ["auto_unroll_max_step", "ot", 0], ["unroll_explicit", "ot", 0]]}, "result": [[0.0005812596366906475, 0.0005812784064748201, 0.000581293118705036], 0, 1.578263759613037, 1679309072.1579764], "version": 0.2, "tvm_version": "0.10.0"}
{"input": ["cuda -keys=cuda,gpu -arch=sm_86 -max_num_threads=1024 -thread_warp_size=32", "conv2d_nchw.cuda", [["TENSOR", [1, 384, 8, 8], "float32"], ["TENSOR", [384, 384, 3, 1], "float32"], [1, 1], [1, 0, 1, 0], [1, 1], "float32"], {}], "config": {"index": 1445, "code_hash": null, "entity": [["tile_f", "sp", [-1, 8, 1, 1]], ["tile_y", "sp", [-1, 8, 1, 1]], ["tile_x", "sp", [-1, 1, 1, 1]], ["tile_rc", "sp", [-1, 1]], ["tile_ry", "sp", [-1, 1]], ["tile_rx", "sp", [-1, 1]], ["auto_unroll_max_step", "ot", 0], ["unroll_explicit", "ot", 0]]}, "result": [[0.0002447344375, 0.0002447372286585366, 0.00024474067073170734], 0, 1.6500425338745117, 1679309073.3833306], "version": 0.2, "tvm_version": "0.10.0"}
{"input": ["cuda -keys=cuda,gpu -arch=sm_86 -max_num_threads=1024 -thread_warp_size=32", "conv2d_nchw.cuda", [["TENSOR", [1, 384, 8, 8], "float32"], ["TENSOR", [384, 384, 3, 1], "float32"], [1, 1], [1, 0, 1, 0], [1, 1], "float32"], {}], "config": {"index": 18433444, "code_hash": null, "entity": [["tile_f", "sp", [-1, 6, 1, 1]], ["tile_y", "sp", [-1, 8, 1, 1]], ["tile_x", "sp", [-1, 1, 1, 1]], ["tile_rc", "sp", [-1, 1]], ["tile_ry", "sp", [-1, 1]], ["tile_rx", "sp", [-1, 1]], ["auto_unroll_max_step", "ot", 0], ["unroll_explicit", "ot", 1]]}, "result": [[0.00021695809041835356, 0.00021695949122807018, 0.00021696776923076926], 0, 1.6123836040496826, 1679309075.5913649], "version": 0.2, "tvm_version": "0.10.0"}
{"input": ["cuda -keys=cuda,gpu -arch=sm_86 -max_num_threads=1024 -thread_warp_size=32", "conv2d_nchw.cuda", [["TENSOR", [1, 384, 8, 8], "float32"], ["TENSOR", [384, 384, 3, 1], "float32"], [1, 1], [1, 0, 1, 0], [1, 1], "float32"], {}], "config": {"index": 6145444, "code_hash": null, "entity": [["tile_f", "sp", [-1, 6, 1, 1]], ["tile_y", "sp", [-1, 8, 1, 1]], ["tile_x", "sp", [-1, 1, 1, 1]], ["tile_rc", "sp", [-1, 1]], ["tile_ry", "sp", [-1, 1]], ["tile_rx", "sp", [-1, 1]], ["auto_unroll_max_step", "ot", 512], ["unroll_explicit", "ot", 0]]}, "result": [[0.0002482907078825348, 0.0002482907078825348, 0.0002482985378670788], 0, 1.6607577800750732, 1679309076.8260577], "version": 0.2, "tvm_version": "0.10.0"}
{"input": ["cuda -keys=cuda,gpu -arch=sm_86 -max_num_threads=1024 -thread_warp_size=32", "conv2d_nchw.cuda", [["TENSOR", [1, 384, 8, 8], "float32"], ["TENSOR", [384, 384, 3, 1], "float32"], [1, 1], [1, 0, 1, 0], [1, 1], "float32"], {}], "config": {"index": 3073444, "code_hash": null, "entity": [["tile_f", "sp", [-1, 6, 1, 1]], ["tile_y", "sp", [-1, 8, 1, 1]], ["tile_x", "sp", [-1, 1, 1, 1]], ["tile_rc", "sp", [-1, 1]], ["tile_ry", "sp", [-1, 3]], ["tile_rx", "sp", [-1, 1]], ["auto_unroll_max_step", "ot", 0], ["unroll_explicit", "ot", 0]]}, "result": [[0.0001854467508650519, 0.0001854585605536332, 0.00018546211534025377], 0, 1.651353359222412, 1679309078.0459642], "version": 0.2, "tvm_version": "0.10.0"}
{"input": ["cuda -keys=cuda,gpu -arch=sm_86 -max_num_threads=1024 -thread_warp_size=32", "conv2d_nchw.cuda", [["TENSOR", [1, 384, 8, 8], "float32"], ["TENSOR", [384, 384, 3, 1], "float32"], [1, 1], [1, 0, 1, 0], [1, 1], "float32"], {}], "config": {"index": 193444, "code_hash": null, "entity": [["tile_f", "sp", [-1, 6, 1, 1]], ["tile_y", "sp", [-1, 8, 1, 1]], ["tile_x", "sp", [-1, 1, 1, 1]], ["tile_rc", "sp", [-1, 2]], ["tile_ry", "sp", [-1, 1]], ["tile_rx", "sp", [-1, 1]], ["auto_unroll_max_step", "ot", 0], ["unroll_explicit", "ot", 0]]}, "result": [[0.0001993004527363184, 0.0001993004527363184, 0.00019930555721393034], 0, 1.6610331535339355, 1679309079.266949], "version": 0.2, "tvm_version": "0.10.0"}
{"input": ["cuda -keys=cuda,gpu -arch=sm_86 -max_num_threads=1024 -thread_warp_size=32", "conv2d_nchw.cuda", [["TENSOR", [1, 384, 8, 8], "float32"], ["TENSOR", [384, 384, 3, 1], "float32"], [1, 1], [1, 0, 1, 0], [1, 1], "float32"], {}], "config": {"index": 11044, "code_hash": null, "entity": [["tile_f", "sp", [-1, 6, 1, 1]], ["tile_y", "sp", [-1, 8, 1, 1]], ["tile_x", "sp", [-1, 2, 1, 1]], ["tile_rc", "sp", [-1, 1]], ["tile_ry", "sp", [-1, 1]], ["tile_rx", "sp", [-1, 1]], ["auto_unroll_max_step", "ot", 0], ["unroll_explicit", "ot", 0]]}, "result": [[0.0002535530583596214, 0.0002535692082018927, 0.00025357729495268137], 0, 1.7231426239013672, 1679309080.4943476], "version": 0.2, "tvm_version": "0.10.0"}
{"input": ["cuda -keys=cuda,gpu -arch=sm_86 -max_num_threads=1024 -thread_warp_size=32", "conv2d_nchw.cuda", [["TENSOR", [1, 384, 8, 8], "float32"], ["TENSOR", [384, 384, 3, 1], "float32"], [1, 1], [1, 0, 1, 0], [1, 1], "float32"], {}], "config": {"index": 1924, "code_hash": null, "entity": [["tile_f", "sp", [-1, 6, 1, 1]], ["tile_y", "sp", [-1, 1, 2, 1]], ["tile_x", "sp", [-1, 1, 1, 1]], ["tile_rc", "sp", [-1, 1]], ["tile_ry", "sp", [-1, 1]], ["tile_rx", "sp", [-1, 1]], ["auto_unroll_max_step", "ot", 0], ["unroll_explicit", "ot", 0]]}, "result": [[0.0005060524119496855, 0.000506067716981132, 0.0005061385408805032], 0, 1.5973525047302246, 1679309081.727838], "version": 0.2, "tvm_version": "0.10.0"}
{"input": ["cuda -keys=cuda,gpu -arch=sm_86 -max_num_threads=1024 -thread_warp_size=32", "conv2d_nchw.cuda", [["TENSOR", [1, 384, 8, 8], "float32"], ["TENSOR", [384, 384, 3, 1], "float32"], [1, 1], [1, 0, 1, 0], [1, 1], "float32"], {}], "config": {"index": 964, "code_hash": null, "entity": [["tile_f", "sp", [-1, 6, 1, 1]], ["tile_y", "sp", [-1, 4, 1, 1]], ["tile_x", "sp", [-1, 1, 1, 1]], ["tile_rc", "sp", [-1, 1]], ["tile_ry", "sp", [-1, 1]], ["tile_rx", "sp", [-1, 1]], ["auto_unroll_max_step", "ot", 0], ["unroll_explicit", "ot", 0]]}, "result": [[0.00042141476501305486, 0.00042144416710182764, 0.00042144416710182764], 0, 1.65116548538208, 1679309082.969969], "version": 0.2, "tvm_version": "0.10.0"}
{"input": ["cuda -keys=cuda,gpu -arch=sm_86 -max_num_threads=1024 -thread_warp_size=32", "conv2d_nchw.cuda", [["TENSOR", [1, 384, 8, 8], "float32"], ["TENSOR", [384, 384, 3, 1], "float32"], [1, 1], [1, 0, 1, 0], [1, 1], "float32"], {}], "config": {"index": 1443, "code_hash": null, "entity": [["tile_f", "sp", [-1, 4, 1, 1]], ["tile_y", "sp", [-1, 8, 1, 1]], ["tile_x", "sp", [-1, 1, 1, 1]], ["tile_rc", "sp", [-1, 1]], ["tile_ry", "sp", [-1, 1]], ["tile_rx", "sp", [-1, 1]], ["auto_unroll_max_step", "ot", 0], ["unroll_explicit", "ot", 0]]}, "result": [[0.00023154055763688762, 0.000231545, 0.00023155346397694525], 0, 1.634953260421753, 1679309084.193696], "version": 0.2, "tvm_version": "0.10.0"}
{"input": ["cuda -keys=cuda,gpu -arch=sm_86 -max_num_threads=1024 -thread_warp_size=32", "conv2d_nchw.cuda", [["TENSOR", [1, 384, 8, 8], "float32"], ["TENSOR", [384, 384, 3, 1], "float32"], [1, 1], [1, 0, 1, 0], [1, 1], "float32"], {}], "config": {"index": 1153444, "code_hash": null, "entity": [["tile_f", "sp", [-1, 6, 1, 1]], ["tile_y", "sp", [-1, 8, 1, 1]], ["tile_x", "sp", [-1, 1, 1, 1]], ["tile_rc", "sp", [-1, 12]], ["tile_ry", "sp", [-1, 1]], ["tile_rx", "sp", [-1, 1]], ["auto_unroll_max_step", "ot", 0], ["unroll_explicit", "ot", 0]]}, "result": [[0.000227436630834512, 0.00022743807779349365, 0.00022744530834512024], 0, 1.9040367603302002, 1679309085.4243884], "version": 0.2, "tvm_version": "0.10.0"}
{"input": ["cuda -keys=cuda,gpu -arch=sm_86 -max_num_threads=1024 -thread_warp_size=32", "conv2d_nchw.cuda", [["TENSOR", [1, 384, 8, 8], "float32"], ["TENSOR", [384, 384, 3, 1], "float32"], [1, 1], [1, 0, 1, 0], [1, 1], "float32"], {}], "config": {"index": 59044, "code_hash": null, "entity": [["tile_f", "sp", [-1, 6, 1, 1]], ["tile_y", "sp", [-1, 8, 1, 1]], ["tile_x", "sp", [-1, 4, 2, 1]], ["tile_rc", "sp", [-1, 1]], ["tile_ry", "sp", [-1, 1]], ["tile_rx", "sp", [-1, 1]], ["auto_unroll_max_step", "ot", 0], ["unroll_explicit", "ot", 0]]}, "result": [[0.0005350646524064171, 0.0005350701229946525, 0.0005350701229946525], 0, 1.655099630355835, 1679309086.2430751], "version": 0.2, "tvm_version": "0.10.0"}
{"input": ["cuda -keys=cuda,gpu -arch=sm_86 -max_num_threads=1024 -thread_warp_size=32", "conv2d_nchw.cuda", [["TENSOR", [1, 384, 8, 8], "float32"], ["TENSOR", [384, 384, 3, 1], "float32"], [1, 1], [1, 0, 1, 0], [1, 1], "float32"], {}], "config": {"index": 4324, "code_hash": null, "entity": [["tile_f", "sp", [-1, 6, 1, 1]], ["tile_y", "sp", [-1, 1, 8, 1]], ["tile_x", "sp", [-1, 1, 1, 1]], ["tile_rc", "sp", [-1, 1]], ["tile_ry", "sp", [-1, 1]], ["tile_rx", "sp", [-1, 1]], ["auto_unroll_max_step", "ot", 0], ["unroll_explicit", "ot", 0]]}, "result": [[0.00012599955256916996, 0.00012600056600790512, 0.00012600381106719368], 0, 1.582226037979126, 1679309087.4568598], "version": 0.2, "tvm_version": "0.10.0"}
{"input": ["cuda -keys=cuda,gpu -arch=sm_86 -max_num_threads=1024 -thread_warp_size=32", "conv2d_nchw.cuda", [["TENSOR", [1, 384, 8, 8], "float32"], ["TENSOR", [384, 384, 3, 1], "float32"], [1, 1], [1, 0, 1, 0], [1, 1], "float32"], {}], "config": {"index": 1450, "code_hash": null, "entity": [["tile_f", "sp", [-1, 48, 1, 1]], ["tile_y", "sp", [-1, 8, 1, 1]], ["tile_x", "sp", [-1, 1, 1, 1]], ["tile_rc", "sp", [-1, 1]], ["tile_ry", "sp", [-1, 1]], ["tile_rx", "sp", [-1, 1]], ["auto_unroll_max_step", "ot", 0], ["unroll_explicit", "ot", 0]]}, "result": [[0.0018516980689655175, 0.0018517215747126438, 0.0018517685747126437], 0, 1.9837613105773926, 1679309088.693122], "version": 0.2, "tvm_version": "0.10.0"}
{"input": ["cuda -keys=cuda,gpu -arch=sm_86 -max_num_threads=1024 -thread_warp_size=32", "conv2d_nchw.cuda", [["TENSOR", [1, 384, 8, 8], "float32"], ["TENSOR", [384, 384, 3, 1], "float32"], [1, 1], [1, 0, 1, 0], [1, 1], "float32"], {}], "config": {"index": 1345444, "code_hash": null, "entity": [["tile_f", "sp", [-1, 6, 1, 1]], ["tile_y", "sp", [-1, 8, 1, 1]], ["tile_x", "sp", [-1, 1, 1, 1]], ["tile_rc", "sp", [-1, 16]], ["tile_ry", "sp", [-1, 1]], ["tile_rx", "sp", [-1, 1]], ["auto_unroll_max_step", "ot", 0], ["unroll_explicit", "ot", 0]]}, "result": [[0.0002307834476327116, 0.00023080842754662838, 0.00023082605021520805], 0, 1.92561674118042, 1679309089.9096625], "version": 0.2, "tvm_version": "0.10.0"}
{"input": ["cuda -keys=cuda,gpu -arch=sm_86 -max_num_threads=1024 -thread_warp_size=32", "conv2d_nchw.cuda", [["TENSOR", [1, 384, 8, 8], "float32"], ["TENSOR", [384, 384, 3, 1], "float32"], [1, 1], [1, 0, 1, 0], [1, 1], "float32"], {}], "config": {"index": 68644, "code_hash": null, "entity": [["tile_f", "sp", [-1, 6, 1, 1]], ["tile_y", "sp", [-1, 8, 1, 1]], ["tile_x", "sp", [-1, 1, 4, 1]], ["tile_rc", "sp", [-1, 1]], ["tile_ry", "sp", [-1, 1]], ["tile_rx", "sp", [-1, 1]], ["auto_unroll_max_step", "ot", 0], ["unroll_explicit", "ot", 0]]}, "result": [[0.00018104444695259594, 0.0001810468916478555, 0.0001810514559819413], 0, 1.653362512588501, 1679309091.141244], "version": 0.2, "tvm_version": "0.10.0"}
{"input": ["cuda -keys=cuda,gpu -arch=sm_86 -max_num_threads=1024 -thread_warp_size=32", "conv2d_nchw.cuda", [["TENSOR", [1, 384, 8, 8], "float32"], ["TENSOR", [384, 384, 3, 1], "float32"], [1, 1], [1, 0, 1, 0], [1, 1], "float32"], {}], "config": {"index": 4804, "code_hash": null, "entity": [["tile_f", "sp", [-1, 6, 1, 1]], ["tile_y", "sp", [-1, 1, 1, 2]], ["tile_x", "sp", [-1, 1, 1, 1]], ["tile_rc", "sp", [-1, 1]], ["tile_ry", "sp", [-1, 1]], ["tile_rx", "sp", [-1, 1]], ["auto_unroll_max_step", "ot", 0], ["unroll_explicit", "ot", 0]]}, "result": [[0.0006455532435897435, 0.0006456779551282053, 0.0006458014423076923], 0, 1.2070481777191162, 1679309091.966419], "version": 0.2, "tvm_version": "0.10.0"}
{"input": ["cuda -keys=cuda,gpu -arch=sm_86 -max_num_threads=1024 -thread_warp_size=32", "conv2d_nchw.cuda", [["TENSOR", [1, 384, 8, 8], "float32"], ["TENSOR", [384, 384, 3, 1], "float32"], [1, 1], [1, 0, 1, 0], [1, 1], "float32"], {}], "config": {"index": 1451, "code_hash": null, "entity": [["tile_f", "sp", [-1, 64, 1, 1]], ["tile_y", "sp", [-1, 8, 1, 1]], ["tile_x", "sp", [-1, 1, 1, 1]], ["tile_rc", "sp", [-1, 1]], ["tile_ry", "sp", [-1, 1]], ["tile_rx", "sp", [-1, 1]], ["auto_unroll_max_step", "ot", 0], ["unroll_explicit", "ot", 0]]}, "result": [[0.0026958248305084744, 0.002696521813559322, 0.002696625779661017], 0, 2.1037251949310303, 1679309093.2094219], "version": 0.2, "tvm_version": "0.10.0"}
{"input": ["cuda -keys=cuda,gpu -arch=sm_86 -max_num_threads=1024 -thread_warp_size=32", "conv2d_nchw.cuda", [["TENSOR", [1, 384, 8, 8], "float32"], ["TENSOR", [384, 384, 3, 1], "float32"], [1, 1], [1, 0, 1, 0], [1, 1], "float32"], {}], "config": {"index": 18436324, "code_hash": null, "entity": [["tile_f", "sp", [-1, 6, 1, 1]], ["tile_y", "sp", [-1, 1, 8, 1]], ["tile_x", "sp", [-1, 1, 1, 1]], ["tile_rc", "sp", [-1, 1]], ["tile_ry", "sp", [-1, 1]], ["tile_rx", "sp", [-1, 1]], ["auto_unroll_max_step", "ot", 0], ["unroll_explicit", "ot", 1]]}, "result": [[0.00012600300237154151, 0.00012600866007905139, 0.00012600946798418974], 0, 1.5510177612304688, 1679309095.0126207], "version": 0.2, "tvm_version": "0.10.0"}
{"input": ["cuda -keys=cuda,gpu -arch=sm_86 -max_num_threads=1024 -thread_warp_size=32", "conv2d_nchw.cuda", [["TENSOR", [1, 384, 8, 8], "float32"], ["TENSOR", [384, 384, 3, 1], "float32"], [1, 1], [1, 0, 1, 0], [1, 1], "float32"], {}], "config": {"index": 6148324, "code_hash": null, "entity": [["tile_f", "sp", [-1, 6, 1, 1]], ["tile_y", "sp", [-1, 1, 8, 1]], ["tile_x", "sp", [-1, 1, 1, 1]], ["tile_rc", "sp", [-1, 1]], ["tile_ry", "sp", [-1, 1]], ["tile_rx", "sp", [-1, 1]], ["auto_unroll_max_step", "ot", 512], ["unroll_explicit", "ot", 0]]}, "result": [[0.00012600763228346457, 0.0001260116692913386, 0.00012601247401574804], 0, 1.6017639636993408, 1679309096.237459], "version": 0.2, "tvm_version": "0.10.0"}
{"input": ["cuda -keys=cuda,gpu -arch=sm_86 -max_num_threads=1024 -thread_warp_size=32", "conv2d_nchw.cuda", [["TENSOR", [1, 384, 8, 8], "float32"], ["TENSOR", [384, 384, 3, 1], "float32"], [1, 1], [1, 0, 1, 0], [1, 1], "float32"], {}], "config": {"index": 3076324, "code_hash": null, "entity": [["tile_f", "sp", [-1, 6, 1, 1]], ["tile_y", "sp", [-1, 1, 8, 1]], ["tile_x", "sp", [-1, 1, 1, 1]], ["tile_rc", "sp", [-1, 1]], ["tile_ry", "sp", [-1, 3]], ["tile_rx", "sp", [-1, 1]], ["auto_unroll_max_step", "ot", 0], ["unroll_explicit", "ot", 0]]}, "result": [[0.00012426845716510904, 0.00012427229595015577, 0.00012427404283489097], 0, 1.5782313346862793, 1679309097.451316], "version": 0.2, "tvm_version": "0.10.0"}
{"input": ["cuda -keys=cuda,gpu -arch=sm_86 -max_num_threads=1024 -thread_warp_size=32", "conv2d_nchw.cuda", [["TENSOR", [1, 384, 8, 8], "float32"], ["TENSOR", [384, 384, 3, 1], "float32"], [1, 1], [1, 0, 1, 0], [1, 1], "float32"], {}], "config": {"index": 196324, "code_hash": null, "entity": [["tile_f", "sp", [-1, 6, 1, 1]], ["tile_y", "sp", [-1, 1, 8, 1]], ["tile_x", "sp", [-1, 1, 1, 1]], ["tile_rc", "sp", [-1, 2]], ["tile_ry", "sp", [-1, 1]], ["tile_rx", "sp", [-1, 1]], ["auto_unroll_max_step", "ot", 0], ["unroll_explicit", "ot", 0]]}, "result": [[9.1763025921659e-05, 9.176361463133641e-05, 9.17642039170507e-05], 0, 1.5881690979003906, 1679309098.6712928], "version": 0.2, "tvm_version": "0.10.0"}
{"input": ["cuda -keys=cuda,gpu -arch=sm_86 -max_num_threads=1024 -thread_warp_size=32", "conv2d_nchw.cuda", [["TENSOR", [1, 384, 8, 8], "float32"], ["TENSOR", [384, 384, 3, 1], "float32"], [1, 1], [1, 0, 1, 0], [1, 1], "float32"], {}], "config": {"index": 13924, "code_hash": null, "entity": [["tile_f", "sp", [-1, 6, 1, 1]], ["tile_y", "sp", [-1, 1, 8, 1]], ["tile_x", "sp", [-1, 2, 1, 1]], ["tile_rc", "sp", [-1, 1]], ["tile_ry", "sp", [-1, 1]], ["tile_rx", "sp", [-1, 1]], ["auto_unroll_max_step", "ot", 0], ["unroll_explicit", "ot", 0]]}, "result": [[0.00011217297680955727, 0.00011217297680955727, 0.00011217873506676036], 0, 1.6016826629638672, 1679309099.8928418], "version": 0.2, "tvm_version": "0.10.0"}
{"input": ["cuda -keys=cuda,gpu -arch=sm_86 -max_num_threads=1024 -thread_warp_size=32", "conv2d_nchw.cuda", [["TENSOR", [1, 384, 8, 8], "float32"], ["TENSOR", [384, 384, 3, 1], "float32"], [1, 1], [1, 0, 1, 0], [1, 1], "float32"], {}], "config": {"index": 3844, "code_hash": null, "entity": [["tile_f", "sp", [-1, 6, 1, 1]], ["tile_y", "sp", [-1, 2, 4, 1]], ["tile_x", "sp", [-1, 1, 1, 1]], ["tile_rc", "sp", [-1, 1]], ["tile_ry", "sp", [-1, 1]], ["tile_rx", "sp", [-1, 1]], ["auto_unroll_max_step", "ot", 0], ["unroll_explicit", "ot", 0]]}, "result": [[0.0001468546587155963, 0.00014685569541284405, 0.00014685850917431193], 0, 1.6033141613006592, 1679309101.1158578], "version": 0.2, "tvm_version": "0.10.0"}
{"input": ["cuda -keys=cuda,gpu -arch=sm_86 -max_num_threads=1024 -thread_warp_size=32", "conv2d_nchw.cuda", [["TENSOR", [1, 384, 8, 8], "float32"], ["TENSOR", [384, 384, 3, 1], "float32"], [1, 1], [1, 0, 1, 0], [1, 1], "float32"], {}], "config": {"index": 4325, "code_hash": null, "entity": [["tile_f", "sp", [-1, 8, 1, 1]], ["tile_y", "sp", [-1, 1, 8, 1]], ["tile_x", "sp", [-1, 1, 1, 1]], ["tile_rc", "sp", [-1, 1]], ["tile_ry", "sp", [-1, 1]], ["tile_rx", "sp", [-1, 1]], ["auto_unroll_max_step", "ot", 0], ["unroll_explicit", "ot", 0]]}, "result": [[0.00011443353481694184, 0.00011443365541995693, 0.00011443806963388369], 0, 1.5796165466308594, 1679309102.332298], "version": 0.2, "tvm_version": "0.10.0"}
{"input": ["cuda -keys=cuda,gpu -arch=sm_86 -max_num_threads=1024 -thread_warp_size=32", "conv2d_nchw.cuda", [["TENSOR", [1, 384, 8, 8], "float32"], ["TENSOR", [384, 384, 3, 1], "float32"], [1, 1], [1, 0, 1, 0], [1, 1], "float32"], {}], "config": {"index": 4323, "code_hash": null, "entity": [["tile_f", "sp", [-1, 4, 1, 1]], ["tile_y", "sp", [-1, 1, 8, 1]], ["tile_x", "sp", [-1, 1, 1, 1]], ["tile_rc", "sp", [-1, 1]], ["tile_ry", "sp", [-1, 1]], ["tile_rx", "sp", [-1, 1]], ["auto_unroll_max_step", "ot", 0], ["unroll_explicit", "ot", 0]]}, "result": [[0.00014006025043782836, 0.00014006025043782836, 0.00014006285639229423], 0, 1.5834932327270508, 1679309103.5530083], "version": 0.2, "tvm_version": "0.10.0"}
{"input": ["cuda -keys=cuda,gpu -arch=sm_86 -max_num_threads=1024 -thread_warp_size=32", "conv2d_nchw.cuda", [["TENSOR", [1, 384, 8, 8], "float32"], ["TENSOR", [384, 384, 3, 1], "float32"], [1, 1], [1, 0, 1, 0], [1, 1], "float32"], {}], "config": {"index": 12292324, "code_hash": null, "entity": [["tile_f", "sp", [-1, 6, 1, 1]], ["tile_y", "sp", [-1, 1, 8, 1]], ["tile_x", "sp", [-1, 1, 1, 1]], ["tile_rc", "sp", [-1, 1]], ["tile_ry", "sp", [-1, 1]], ["tile_rx", "sp", [-1, 1]], ["auto_unroll_max_step", "ot", 1500], ["unroll_explicit", "ot", 0]]}, "result": [[0.00012600866007905139, 0.00012601109644268775, 0.00012601271304347826], 0, 1.5637192726135254, 1679309104.769932], "version": 0.2, "tvm_version": "0.10.0"}
{"input": ["cuda -keys=cuda,gpu -arch=sm_86 -max_num_threads=1024 -thread_warp_size=32", "conv2d_nchw.cuda", [["TENSOR", [1, 384, 8, 8], "float32"], ["TENSOR", [384, 384, 3, 1], "float32"], [1, 1], [1, 0, 1, 0], [1, 1], "float32"], {}], "config": {"index": 1540324, "code_hash": null, "entity": [["tile_f", "sp", [-1, 6, 1, 1]], ["tile_y", "sp", [-1, 1, 8, 1]], ["tile_x", "sp", [-1, 1, 1, 1]], ["tile_rc", "sp", [-1, 24]], ["tile_ry", "sp", [-1, 1]], ["tile_rx", "sp", [-1, 1]], ["auto_unroll_max_step", "ot", 0], ["unroll_explicit", "ot", 0]]}, "result": [[8.140773285198556e-05, 8.141090407426509e-05, 8.141248581743168e-05], 0, 1.6355950832366943, 1679309105.9813204], "version": 0.2, "tvm_version": "0.10.0"}
{"input": ["cuda -keys=cuda,gpu -arch=sm_86 -max_num_threads=1024 -thread_warp_size=32", "conv2d_nchw.cuda", [["TENSOR", [1, 384, 8, 8], "float32"], ["TENSOR", [384, 384, 3, 1], "float32"], [1, 1], [1, 0, 1, 0], [1, 1], "float32"], {}], "config": {"index": 81124, "code_hash": null, "entity": [["tile_f", "sp", [-1, 6, 1, 1]], ["tile_y", "sp", [-1, 1, 8, 1]], ["tile_x", "sp", [-1, 2, 4, 1]], ["tile_rc", "sp", [-1, 1]], ["tile_ry", "sp", [-1, 1]], ["tile_rx", "sp", [-1, 1]], ["auto_unroll_max_step", "ot", 0], ["unroll_explicit", "ot", 0]]}, "result": [[0.00010480896825396826, 0.00010481033068783068, 0.00010481235912698414], 0, 1.5724635124206543, 1679309107.1876807], "version": 0.2, "tvm_version": "0.10.0"}
{"input": ["cuda -keys=cuda,gpu -arch=sm_86 -max_num_threads=1024 -thread_warp_size=32", "conv2d_nchw.cuda", [["TENSOR", [1, 384, 8, 8], "float32"], ["TENSOR", [384, 384, 3, 1], "float32"], [1, 1], [1, 0, 1, 0], [1, 1], "float32"], {}], "config": {"index": 8164, "code_hash": null, "entity": [["tile_f", "sp", [-1, 6, 1, 1]], ["tile_y", "sp", [-1, 2, 1, 4]], ["tile_x", "sp", [-1, 1, 1, 1]], ["tile_rc", "sp", [-1, 1]], ["tile_ry", "sp", [-1, 1]], ["tile_rx", "sp", [-1, 1]], ["auto_unroll_max_step", "ot", 0], ["unroll_explicit", "ot", 0]]}, "result": [[0.00021812173505434784, 0.0002181231236413044, 0.0002181245135869565], 0, 1.6294846534729004, 1679309108.4167063], "version": 0.2, "tvm_version": "0.10.0"}
{"input": ["cuda -keys=cuda,gpu -arch=sm_86 -max_num_threads=1024 -thread_warp_size=32", "conv2d_nchw.cuda", [["TENSOR", [1, 384, 8, 8], "float32"], ["TENSOR", [384, 384, 3, 1], "float32"], [1, 1], [1, 0, 1, 0], [1, 1], "float32"], {}], "config": {"index": 484, "code_hash": null, "entity": [["tile_f", "sp", [-1, 6, 1, 1]], ["tile_y", "sp", [-1, 2, 1, 1]], ["tile_x", "sp", [-1, 1, 1, 1]], ["tile_rc", "sp", [-1, 1]], ["tile_ry", "sp", [-1, 1]], ["tile_rx", "sp", [-1, 1]], ["auto_unroll_max_step", "ot", 0], ["unroll_explicit", "ot", 0]]}, "result": [[0.0006456244038461538, 0.0006456398076923076, 0.000645932314102564], 0, 1.1996753215789795, 1679309109.2437181], "version": 0.2, "tvm_version": "0.10.0"}
{"input": ["cuda -keys=cuda,gpu -arch=sm_86 -max_num_threads=1024 -thread_warp_size=32", "conv2d_nchw.cuda", [["TENSOR", [1, 384, 8, 8], "float32"], ["TENSOR", [384, 384, 3, 1], "float32"], [1, 1], [1, 0, 1, 0], [1, 1], "float32"], {}], "config": {"index": 4332, "code_hash": null, "entity": [["tile_f", "sp", [-1, 96, 1, 1]], ["tile_y", "sp", [-1, 1, 8, 1]], ["tile_x", "sp", [-1, 1, 1, 1]], ["tile_rc", "sp", [-1, 1]], ["tile_ry", "sp", [-1, 1]], ["tile_rx", "sp", [-1, 1]], ["auto_unroll_max_step", "ot", 0], ["unroll_explicit", "ot", 0]]}, "result": [[0.00029134930379746835, 0.0002913548499095841, 0.0002913563670886076], 0, 1.682121753692627, 1679309110.4669034], "version": 0.2, "tvm_version": "0.10.0"}
{"input": ["cuda -keys=cuda,gpu -arch=sm_86 -max_num_threads=1024 -thread_warp_size=32", "conv2d_nchw.cuda", [["TENSOR", [1, 384, 8, 8], "float32"], ["TENSOR", [384, 384, 3, 1], "float32"], [1, 1], [1, 0, 1, 0], [1, 1], "float32"], {}], "config": {"index": 1732324, "code_hash": null, "entity": [["tile_f", "sp", [-1, 6, 1, 1]], ["tile_y", "sp", [-1, 1, 8, 1]], ["tile_x", "sp", [-1, 1, 1, 1]], ["tile_rc", "sp", [-1, 32]], ["tile_ry", "sp", [-1, 1]], ["tile_rx", "sp", [-1, 1]], ["auto_unroll_max_step", "ot", 0], ["unroll_explicit", "ot", 0]]}, "result": [[0.00010961196537396121, 0.00010961763988919667, 0.00010961976385041553], 0, 1.642862319946289, 1679309111.6830447], "version": 0.2, "tvm_version": "0.10.0"}
{"input": ["cuda -keys=cuda,gpu -arch=sm_86 -max_num_threads=1024 -thread_warp_size=32", "conv2d_nchw.cuda", [["TENSOR", [1, 384, 8, 8], "float32"], ["TENSOR", [384, 384, 3, 1], "float32"], [1, 1], [1, 0, 1, 0], [1, 1], "float32"], {}], "config": {"index": 90724, "code_hash": null, "entity": [["tile_f", "sp", [-1, 6, 1, 1]], ["tile_y", "sp", [-1, 1, 8, 1]], ["tile_x", "sp", [-1, 1, 8, 1]], ["tile_rc", "sp", [-1, 1]], ["tile_ry", "sp", [-1, 1]], ["tile_rx", "sp", [-1, 1]], ["auto_unroll_max_step", "ot", 0], ["unroll_explicit", "ot", 0]]}, "result": [[9.583242814009662e-05, 9.583242814009662e-05, 9.583242814009662e-05], 0, 1.5822463035583496, 1679309112.903809], "version": 0.2, "tvm_version": "0.10.0"}
{"input": ["cuda -keys=cuda,gpu -arch=sm_86 -max_num_threads=1024 -thread_warp_size=32", "conv2d_nchw.cuda", [["TENSOR", [1, 384, 8, 8], "float32"], ["TENSOR", [384, 384, 3, 1], "float32"], [1, 1], [1, 0, 1, 0], [1, 1], "float32"], {}], "config": {"index": 8644, "code_hash": null, "entity": [["tile_f", "sp", [-1, 6, 1, 1]], ["tile_y", "sp", [-1, 1, 2, 4]], ["tile_x", "sp", [-1, 1, 1, 1]], ["tile_rc", "sp", [-1, 1]], ["tile_ry", "sp", [-1, 1]], ["tile_rx", "sp", [-1, 1]], ["auto_unroll_max_step", "ot", 0], ["unroll_explicit", "ot", 0]]}, "result": [[0.0001994751925, 0.000199482555, 0.0001994892875], 0, 1.5725960731506348, 1679309114.930872], "version": 0.2, "tvm_version": "0.10.0"}
{"input": ["cuda -keys=cuda,gpu -arch=sm_86 -max_num_threads=1024 -thread_warp_size=32", "conv2d_nchw.cuda", [["TENSOR", [1, 384, 8, 8], "float32"], ["TENSOR", [384, 384, 3, 1], "float32"], [1, 1], [1, 0, 1, 0], [1, 1], "float32"], {}], "config": {"index": 4, "code_hash": null, "entity": [["tile_f", "sp", [-1, 6, 1, 1]], ["tile_y", "sp", [-1, 1, 1, 1]], ["tile_x", "sp", [-1, 1, 1, 1]], ["tile_rc", "sp", [-1, 1]], ["tile_ry", "sp", [-1, 1]], ["tile_rx", "sp", [-1, 1]], ["auto_unroll_max_step", "ot", 0], ["unroll_explicit", "ot", 0]]}, "result": [[0.0010243657142857143, 0.0010244493265306122, 0.0010246164693877551], 0, 1.170186996459961, 1679309115.7619967], "version": 0.2, "tvm_version": "0.10.0"}
{"input": ["cuda -keys=cuda,gpu -arch=sm_86 -max_num_threads=1024 -thread_warp_size=32", "conv2d_nchw.cuda", [["TENSOR", [1, 384, 8, 8], "float32"], ["TENSOR", [384, 384, 3, 1], "float32"], [1, 1], [1, 0, 1, 0], [1, 1], "float32"], {}], "config": {"index": 19972324, "code_hash": null, "entity": [["tile_f", "sp", [-1, 6, 1, 1]], ["tile_y", "sp", [-1, 1, 8, 1]], ["tile_x", "sp", [-1, 1, 1, 1]], ["tile_rc", "sp", [-1, 24]], ["tile_ry", "sp", [-1, 1]], ["tile_rx", "sp", [-1, 1]], ["auto_unroll_max_step", "ot", 0], ["unroll_explicit", "ot", 1]]}, "result": [[8.140511532547412e-05, 8.140773552024603e-05, 8.141613531522297e-05], 0, 1.6747210025787354, 1679309116.9818027], "version": 0.2, "tvm_version": "0.10.0"}
{"input": ["cuda -keys=cuda,gpu -arch=sm_86 -max_num_threads=1024 -thread_warp_size=32", "conv2d_nchw.cuda", [["TENSOR", [1, 384, 8, 8], "float32"], ["TENSOR", [384, 384, 3, 1], "float32"], [1, 1], [1, 0, 1, 0], [1, 1], "float32"], {}], "config": {"index": 7684324, "code_hash": null, "entity": [["tile_f", "sp", [-1, 6, 1, 1]], ["tile_y", "sp", [-1, 1, 8, 1]], ["tile_x", "sp", [-1, 1, 1, 1]], ["tile_rc", "sp", [-1, 24]], ["tile_ry", "sp", [-1, 1]], ["tile_rx", "sp", [-1, 1]], ["auto_unroll_max_step", "ot", 512], ["unroll_explicit", "ot", 0]]}, "result": [[5.19536326801727e-05, 5.1954311524410486e-05, 5.195903985386914e-05], 0, 1.6992568969726562, 1679309118.1892893], "version": 0.2, "tvm_version": "0.10.0"}
{"input": ["cuda -keys=cuda,gpu -arch=sm_86 -max_num_threads=1024 -thread_warp_size=32", "conv2d_nchw.cuda", [["TENSOR", [1, 384, 8, 8], "float32"], ["TENSOR", [384, 384, 3, 1], "float32"], [1, 1], [1, 0, 1, 0], [1, 1], "float32"], {}], "config": {"index": 4612324, "code_hash": null, "entity": [["tile_f", "sp", [-1, 6, 1, 1]], ["tile_y", "sp", [-1, 1, 8, 1]], ["tile_x", "sp", [-1, 1, 1, 1]], ["tile_rc", "sp", [-1, 24]], ["tile_ry", "sp", [-1, 3]], ["tile_rx", "sp", [-1, 1]], ["auto_unroll_max_step", "ot", 0], ["unroll_explicit", "ot", 0]]}, "result": [[5.230335122442134e-05, 5.2316746729285473e-05, 5.243388258973499e-05], 0, 1.636082410812378, 1679309119.3849998], "version": 0.2, "tvm_version": "0.10.0"}
{"input": ["cuda -keys=cuda,gpu -arch=sm_86 -max_num_threads=1024 -thread_warp_size=32", "conv2d_nchw.cuda", [["TENSOR", [1, 384, 8, 8], "float32"], ["TENSOR", [384, 384, 3, 1], "float32"], [1, 1], [1, 0, 1, 0], [1, 1], "float32"], {}], "config": {"index": 1348324, "code_hash": null, "entity": [["tile_f", "sp", [-1, 6, 1, 1]], ["tile_y", "sp", [-1, 1, 8, 1]], ["tile_x", "sp", [-1, 1, 1, 1]], ["tile_rc", "sp", [-1, 16]], ["tile_ry", "sp", [-1, 1]], ["tile_rx", "sp", [-1, 1]], ["auto_unroll_max_step", "ot", 0], ["unroll_explicit", "ot", 0]]}, "result": [[8.883630235162373e-05, 8.88380195968645e-05, 8.884146248600224e-05], 0, 1.6743955612182617, 1679309120.6415544], "version": 0.2, "tvm_version": "0.10.0"}
{"input": ["cuda -keys=cuda,gpu -arch=sm_86 -max_num_threads=1024 -thread_warp_size=32", "conv2d_nchw.cuda", [["TENSOR", [1, 384, 8, 8], "float32"], ["TENSOR", [384, 384, 3, 1], "float32"], [1, 1], [1, 0, 1, 0], [1, 1], "float32"], {}], "config": {"index": 1549924, "code_hash": null, "entity": [["tile_f", "sp", [-1, 6, 1, 1]], ["tile_y", "sp", [-1, 1, 8, 1]], ["tile_x", "sp", [-1, 2, 1, 1]], ["tile_rc", "sp", [-1, 24]], ["tile_ry", "sp", [-1, 1]], ["tile_rx", "sp", [-1, 1]], ["auto_unroll_max_step", "ot", 0], ["unroll_explicit", "ot", 0]]}, "result": [[6.312622347266881e-05, 6.312786093247588e-05, 6.312787339228297e-05], 0, 1.7687299251556396, 1679309121.8521397], "version": 0.2, "tvm_version": "0.10.0"}
{"input": ["cuda -keys=cuda,gpu -arch=sm_86 -max_num_threads=1024 -thread_warp_size=32", "conv2d_nchw.cuda", [["TENSOR", [1, 384, 8, 8], "float32"], ["TENSOR", [384, 384, 3, 1], "float32"], [1, 1], [1, 0, 1, 0], [1, 1], "float32"], {}], "config": {"index": 1540804, "code_hash": null, "entity": [["tile_f", "sp", [-1, 6, 1, 1]], ["tile_y", "sp", [-1, 1, 1, 2]], ["tile_x", "sp", [-1, 1, 1, 1]], ["tile_rc", "sp", [-1, 24]], ["tile_ry", "sp", [-1, 1]], ["tile_rx", "sp", [-1, 1]], ["auto_unroll_max_step", "ot", 0], ["unroll_explicit", "ot", 0]]}, "result": [[0.0005257289511400651, 0.000525825674267101, 0.0005258785081433225], 0, 1.7508485317230225, 1679309123.076887], "version": 0.2, "tvm_version": "0.10.0"}
{"input": ["cuda -keys=cuda,gpu -arch=sm_86 -max_num_threads=1024 -thread_warp_size=32", "conv2d_nchw.cuda", [["TENSOR", [1, 384, 8, 8], "float32"], ["TENSOR", [384, 384, 3, 1], "float32"], [1, 1], [1, 0, 1, 0], [1, 1], "float32"], {}], "config": {"index": 1539844, "code_hash": null, "entity": [["tile_f", "sp", [-1, 6, 1, 1]], ["tile_y", "sp", [-1, 2, 4, 1]], ["tile_x", "sp", [-1, 1, 1, 1]], ["tile_rc", "sp", [-1, 24]], ["tile_ry", "sp", [-1, 1]], ["tile_rx", "sp", [-1, 1]], ["auto_unroll_max_step", "ot", 0], ["unroll_explicit", "ot", 0]]}, "result": [[0.00011772769185619956, 0.000117733703595011, 0.0001177478657373441], 0, 1.6606762409210205, 1679309124.295016], "version": 0.2, "tvm_version": "0.10.0"}
{"input": ["cuda -keys=cuda,gpu -arch=sm_86 -max_num_threads=1024 -thread_warp_size=32", "conv2d_nchw.cuda", [["TENSOR", [1, 384, 8, 8], "float32"], ["TENSOR", [384, 384, 3, 1], "float32"], [1, 1], [1, 0, 1, 0], [1, 1], "float32"], {}], "config": {"index": 1540325, "code_hash": null, "entity": [["tile_f", "sp", [-1, 8, 1, 1]], ["tile_y", "sp", [-1, 1, 8, 1]], ["tile_x", "sp", [-1, 1, 1, 1]], ["tile_rc", "sp", [-1, 24]], ["tile_ry", "sp", [-1, 1]], ["tile_rx", "sp", [-1, 1]], ["auto_unroll_max_step", "ot", 0], ["unroll_explicit", "ot", 0]]}, "result": [[9.060612135088723e-05, 9.060670635374929e-05, 9.06072919290212e-05], 0, 1.6670420169830322, 1679309125.537831], "version": 0.2, "tvm_version": "0.10.0"}
{"input": ["cuda -keys=cuda,gpu -arch=sm_86 -max_num_threads=1024 -thread_warp_size=32", "conv2d_nchw.cuda", [["TENSOR", [1, 384, 8, 8], "float32"], ["TENSOR", [384, 384, 3, 1], "float32"], [1, 1], [1, 0, 1, 0], [1, 1], "float32"], {}], "config": {"index": 1540323, "code_hash": null, "entity": [["tile_f", "sp", [-1, 4, 1, 1]], ["tile_y", "sp", [-1, 1, 8, 1]], ["tile_x", "sp", [-1, 1, 1, 1]], ["tile_rc", "sp", [-1, 24]], ["tile_ry", "sp", [-1, 1]], ["tile_rx", "sp", [-1, 1]], ["auto_unroll_max_step", "ot", 0], ["unroll_explicit", "ot", 0]]}, "result": [[0.00010245282205029013, 0.0001024559896840748, 0.00010245611798839458], 0, 1.654317855834961, 1679309126.759966], "version": 0.2, "tvm_version": "0.10.0"}
{"input": ["cuda -keys=cuda,gpu -arch=sm_86 -max_num_threads=1024 -thread_warp_size=32", "conv2d_nchw.cuda", [["TENSOR", [1, 384, 8, 8], "float32"], ["TENSOR", [384, 384, 3, 1], "float32"], [1, 1], [1, 0, 1, 0], [1, 1], "float32"], {}], "config": {"index": 388324, "code_hash": null, "entity": [["tile_f", "sp", [-1, 6, 1, 1]], ["tile_y", "sp", [-1, 1, 8, 1]], ["tile_x", "sp", [-1, 1, 1, 1]], ["tile_rc", "sp", [-1, 3]], ["tile_ry", "sp", [-1, 1]], ["tile_rx", "sp", [-1, 1]], ["auto_unroll_max_step", "ot", 0], ["unroll_explicit", "ot", 0]]}, "result": [[8.749647440836545e-05, 8.750042982938911e-05, 8.750596367638965e-05], 0, 1.6167378425598145, 1679309127.9804792], "version": 0.2, "tvm_version": "0.10.0"}
{"input": ["cuda -keys=cuda,gpu -arch=sm_86 -max_num_threads=1024 -thread_warp_size=32", "conv2d_nchw.cuda", [["TENSOR", [1, 384, 8, 8], "float32"], ["TENSOR", [384, 384, 3, 1], "float32"], [1, 1], [1, 0, 1, 0], [1, 1], "float32"], {}], "config": {"index": 1636324, "code_hash": null, "entity": [["tile_f", "sp", [-1, 6, 1, 1]], ["tile_y", "sp", [-1, 1, 8, 1]], ["tile_x", "sp", [-1, 1, 1, 2]], ["tile_rc", "sp", [-1, 24]], ["tile_ry", "sp", [-1, 1]], ["tile_rx", "sp", [-1, 1]], ["auto_unroll_max_step", "ot", 0], ["unroll_explicit", "ot", 0]]}, "result": [[6.279948306098048e-05, 6.280315663611e-05, 6.280968832204066e-05], 0, 1.731719970703125, 1679309129.1926267], "version": 0.2, "tvm_version": "0.10.0"}
{"input": ["cuda -keys=cuda,gpu -arch=sm_86 -max_num_threads=1024 -thread_warp_size=32", "conv2d_nchw.cuda", [["TENSOR", [1, 384, 8, 8], "float32"], ["TENSOR", [384, 384, 3, 1], "float32"], [1, 1], [1, 0, 1, 0], [1, 1], "float32"], {}], "config": {"index": 1545124, "code_hash": null, "entity": [["tile_f", "sp", [-1, 6, 1, 1]], ["tile_y", "sp", [-1, 1, 1, 8]], ["tile_x", "sp", [-1, 1, 1, 1]], ["tile_rc", "sp", [-1, 24]], ["tile_ry", "sp", [-1, 1]], ["tile_rx", "sp", [-1, 1]], ["auto_unroll_max_step", "ot", 0], ["unroll_explicit", "ot", 0]]}, "result": [[0.0002865057588652482, 0.0002865220992907801, 0.00028653110992907796], 0, 1.7726256847381592, 1679309130.372573], "version": 0.2, "tvm_version": "0.10.0"}
{"input": ["cuda -keys=cuda,gpu -arch=sm_86 -max_num_threads=1024 -thread_warp_size=32", "conv2d_nchw.cuda", [["TENSOR", [1, 384, 8, 8], "float32"], ["TENSOR", [384, 384, 3, 1], "float32"], [1, 1], [1, 0, 1, 0], [1, 1], "float32"], {}], "config": {"index": 1540334, "code_hash": null, "entity": [["tile_f", "sp", [-1, 192, 1, 1]], ["tile_y", "sp", [-1, 1, 8, 1]], ["tile_x", "sp", [-1, 1, 1, 1]], ["tile_rc", "sp", [-1, 24]], ["tile_ry", "sp", [-1, 1]], ["tile_rx", "sp", [-1, 1]], ["auto_unroll_max_step", "ot", 0], ["unroll_explicit", "ot", 0]]}, "result": [[0.0007480090671641791, 0.0007480475, 0.0007480778432835821], 0, 1.5045781135559082, 1679309131.1962051], "version": 0.2, "tvm_version": "0.10.0"}
{"input": ["cuda -keys=cuda,gpu -arch=sm_86 -max_num_threads=1024 -thread_warp_size=32", "conv2d_nchw.cuda", [["TENSOR", [1, 384, 8, 8], "float32"], ["TENSOR", [384, 384, 3, 1], "float32"], [1, 1], [1, 0, 1, 0], [1, 1], "float32"], {}], "config": {"index": 13828324, "code_hash": null, "entity": [["tile_f", "sp", [-1, 6, 1, 1]], ["tile_y", "sp", [-1, 1, 8, 1]], ["tile_x", "sp", [-1, 1, 1, 1]], ["tile_rc", "sp", [-1, 24]], ["tile_ry", "sp", [-1, 1]], ["tile_rx", "sp", [-1, 1]], ["auto_unroll_max_step", "ot", 1500], ["unroll_explicit", "ot", 0]]}, "result": [[5.160708435735636e-05, 5.160708435735636e-05, 5.160844237794753e-05], 0, 1.8418731689453125, 1679309132.3854337], "version": 0.2, "tvm_version": "0.10.0"}
{"input": ["cuda -keys=cuda,gpu -arch=sm_86 -max_num_threads=1024 -thread_warp_size=32", "conv2d_nchw.cuda", [["TENSOR", [1, 384, 8, 8], "float32"], ["TENSOR", [384, 384, 3, 1], "float32"], [1, 1], [1, 0, 1, 0], [1, 1], "float32"], {}], "config": {"index": 580324, "code_hash": null, "entity": [["tile_f", "sp", [-1, 6, 1, 1]], ["tile_y", "sp", [-1, 1, 8, 1]], ["tile_x", "sp", [-1, 1, 1, 1]], ["tile_rc", "sp", [-1, 4]], ["tile_ry", "sp", [-1, 1]], ["tile_rx", "sp", [-1, 1]], ["auto_unroll_max_step", "ot", 0], ["unroll_explicit", "ot", 0]]}, "result": [[6.828442349371479e-05, 6.828530992631123e-05, 6.829013827481578e-05], 0, 1.531003713607788, 1679309134.9744716], "version": 0.2, "tvm_version": "0.10.0"}
{"input": ["cuda -keys=cuda,gpu -arch=sm_86 -max_num_threads=1024 -thread_warp_size=32", "conv2d_nchw.cuda", [["TENSOR", [1, 384, 8, 8], "float32"], ["TENSOR", [384, 384, 3, 1], "float32"], [1, 1], [1, 0, 1, 0], [1, 1], "float32"], {}], "config": {"index": 1645924, "code_hash": null, "entity": [["tile_f", "sp", [-1, 6, 1, 1]], ["tile_y", "sp", [-1, 1, 8, 1]], ["tile_x", "sp", [-1, 2, 1, 2]], ["tile_rc", "sp", [-1, 24]], ["tile_ry", "sp", [-1, 1]], ["tile_rx", "sp", [-1, 1]], ["auto_unroll_max_step", "ot", 0], ["unroll_explicit", "ot", 0]]}, "result": [[7.577944733044732e-05, 7.57808051948052e-05, 7.57818177008177e-05], 0, 1.9013636112213135, 1679309136.18991], "version": 0.2, "tvm_version": "0.10.0"}
{"input": ["cuda -keys=cuda,gpu -arch=sm_86 -max_num_threads=1024 -thread_warp_size=32", "conv2d_nchw.cuda", [["TENSOR", [1, 384, 8, 8], "float32"], ["TENSOR", [384, 384, 3, 1], "float32"], [1, 1], [1, 0, 1, 0], [1, 1], "float32"], {}], "config": {"index": 1536004, "code_hash": null, "entity": [["tile_f", "sp", [-1, 6, 1, 1]], ["tile_y", "sp", [-1, 1, 1, 1]], ["tile_x", "sp", [-1, 1, 1, 1]], ["tile_rc", "sp", [-1, 24]], ["tile_ry", "sp", [-1, 1]], ["tile_rx", "sp", [-1, 1]], ["auto_unroll_max_step", "ot", 0], ["unroll_explicit", "ot", 0]]}, "result": [[0.000795729253968254, 0.0007957536587301587, 0.0007957779999999999], 0, 1.2775115966796875, 1679309137.0121412], "version": 0.2, "tvm_version": "0.10.0"}
{"input": ["cuda -keys=cuda,gpu -arch=sm_86 -max_num_threads=1024 -thread_warp_size=32", "conv2d_nchw.cuda", [["TENSOR", [1, 384, 8, 8], "float32"], ["TENSOR", [384, 384, 3, 1], "float32"], [1, 1], [1, 0, 1, 0], [1, 1], "float32"], {}], "config": {"index": 32260324, "code_hash": null, "entity": [["tile_f", "sp", [-1, 6, 1, 1]], ["tile_y", "sp", [-1, 1, 8, 1]], ["tile_x", "sp", [-1, 1, 1, 1]], ["tile_rc", "sp", [-1, 24]], ["tile_ry", "sp", [-1, 1]], ["tile_rx", "sp", [-1, 1]], ["auto_unroll_max_step", "ot", 1500], ["unroll_explicit", "ot", 1]]}, "result": [[5.156559515111258e-05, 5.156729292593822e-05, 5.15686509465294e-05], 0, 2.014547824859619, 1679309138.2012854], "version": 0.2, "tvm_version": "0.10.0"}
{"input": ["cuda -keys=cuda,gpu -arch=sm_86 -max_num_threads=1024 -thread_warp_size=32", "conv2d_nchw.cuda", [["TENSOR", [1, 384, 8, 8], "float32"], ["TENSOR", [384, 384, 3, 1], "float32"], [1, 1], [1, 0, 1, 0], [1, 1], "float32"], {}], "config": {"index": 16900324, "code_hash": null, "entity": [["tile_f", "sp", [-1, 6, 1, 1]], ["tile_y", "sp", [-1, 1, 8, 1]], ["tile_x", "sp", [-1, 1, 1, 1]], ["tile_rc", "sp", [-1, 24]], ["tile_ry", "sp", [-1, 3]], ["tile_rx", "sp", [-1, 1]], ["auto_unroll_max_step", "ot", 1500], ["unroll_explicit", "ot", 0]]}, "result": [[5.284304062288422e-05, 5.28490067704807e-05, 5.2864952606635075e-05], 0, 1.930640459060669, 1679309139.4004748], "version": 0.2, "tvm_version": "0.10.0"}
{"input": ["cuda -keys=cuda,gpu -arch=sm_86 -max_num_threads=1024 -thread_warp_size=32", "conv2d_nchw.cuda", [["TENSOR", [1, 384, 8, 8], "float32"], ["TENSOR", [384, 384, 3, 1], "float32"], [1, 1], [1, 0, 1, 0], [1, 1], "float32"], {}], "config": {"index": 14020324, "code_hash": null, "entity": [["tile_f", "sp", [-1, 6, 1, 1]], ["tile_y", "sp", [-1, 1, 8, 1]], ["tile_x", "sp", [-1, 1, 1, 1]], ["tile_rc", "sp", [-1, 32]], ["tile_ry", "sp", [-1, 1]], ["tile_rx", "sp", [-1, 1]], ["auto_unroll_max_step", "ot", 1500], ["unroll_explicit", "ot", 0]]}, "result": [[5.458458127392969e-05, 5.468657570483815e-05, 5.485189975635224e-05], 0, 2.0254783630371094, 1679309140.6060975], "version": 0.2, "tvm_version": "0.10.0"}
{"input": ["cuda -keys=cuda,gpu -arch=sm_86 -max_num_threads=1024 -thread_warp_size=32", "conv2d_nchw.cuda", [["TENSOR", [1, 384, 8, 8], "float32"], ["TENSOR", [384, 384, 3, 1], "float32"], [1, 1], [1, 0, 1, 0], [1, 1], "float32"], {}], "config": {"index": 13636324, "code_hash": null, "entity": [["tile_f", "sp", [-1, 6, 1, 1]], ["tile_y", "sp", [-1, 1, 8, 1]], ["tile_x", "sp", [-1, 1, 1, 1]], ["tile_rc", "sp", [-1, 16]], ["tile_ry", "sp", [-1, 1]], ["tile_rx", "sp", [-1, 1]], ["auto_unroll_max_step", "ot", 1500], ["unroll_explicit", "ot", 0]]}, "result": [[5.341820514556534e-05, 5.346041740013542e-05, 5.370765741367638e-05], 0, 1.7594401836395264, 1679309141.832115], "version": 0.2, "tvm_version": "0.10.0"}
{"input": ["cuda -keys=cuda,gpu -arch=sm_86 -max_num_threads=1024 -thread_warp_size=32", "conv2d_nchw.cuda", [["TENSOR", [1, 384, 8, 8], "float32"], ["TENSOR", [384, 384, 3, 1], "float32"], [1, 1], [1, 0, 1, 0], [1, 1], "float32"], {}], "config": {"index": 13837924, "code_hash": null, "entity": [["tile_f", "sp", [-1, 6, 1, 1]], ["tile_y", "sp", [-1, 1, 8, 1]], ["tile_x", "sp", [-1, 2, 1, 1]], ["tile_rc", "sp", [-1, 24]], ["tile_ry", "sp", [-1, 1]], ["tile_rx", "sp", [-1, 1]], ["auto_unroll_max_step", "ot", 1500], ["unroll_explicit", "ot", 0]]}, "result": [[4.338850113895216e-05, 4.3392580865603644e-05, 4.360921924829157e-05], 0, 2.0490775108337402, 1679309143.0334356], "version": 0.2, "tvm_version": "0.10.0"}
