results/cuda_gtx1650/mobilenet/xgb/cpu.log_layer_2.log
{"input": ["cuda -keys=cuda,gpu -arch=sm_75 -max_num_threads=1024 -thread_warp_size=32", "conv2d_nchw.cuda", [["TENSOR", [1, 32, 112, 112], "float32"], ["TENSOR", [64, 32, 1, 1], "float32"], [1, 1], [0, 0, 0, 0], [1, 1], "float32"], {}], "config": {"index": 41938674, "code_hash": null, "entity": [["tile_f", "sp", [-1, 2, 2, 16]], ["tile_y", "sp", [-1, 1, 8, 1]], ["tile_x", "sp", [-1, 8, 7, 2]], ["tile_rc", "sp", [-1, 2]], ["tile_ry", "sp", [-1, 1]], ["tile_rx", "sp", [-1, 1]], ["auto_unroll_max_step", "ot", 512], ["unroll_explicit", "ot", 1]]}, "result": [[0.0008603238641304347, 0.0008604494130434782, 0.0008780241140350877], 0, 3.720252275466919, 1678934247.65956], "version": 0.2, "tvm_version": "0.10.0"}
{"input": ["cuda -keys=cuda,gpu -arch=sm_75 -max_num_threads=1024 -thread_warp_size=32", "conv2d_nchw.cuda", [["TENSOR", [1, 32, 112, 112], "float32"], ["TENSOR", [64, 32, 1, 1], "float32"], [1, 1], [0, 0, 0, 0], [1, 1], "float32"], {}], "config": {"index": 10512354, "code_hash": null, "entity": [["tile_f", "sp", [-1, 64, 1, 1]], ["tile_y", "sp", [-1, 1, 1, 16]], ["tile_x", "sp", [-1, 1, 2, 2]], ["tile_rc", "sp", [-1, 1]], ["tile_ry", "sp", [-1, 1]], ["tile_rx", "sp", [-1, 1]], ["auto_unroll_max_step", "ot", 512], ["unroll_explicit", "ot", 0]]}, "result": [[0.0284052485, 0.028435728, 0.0284639205], 0, 2.003821849822998, 1678934248.6662211], "version": 0.2, "tvm_version": "0.10.0"}
{"input": ["cuda -keys=cuda,gpu -arch=sm_75 -max_num_threads=1024 -thread_warp_size=32", "conv2d_nchw.cuda", [["TENSOR", [1, 32, 112, 112], "float32"], ["TENSOR", [64, 32, 1, 1], "float32"], [1, 1], [0, 0, 0, 0], [1, 1], "float32"], {}], "config": {"index": 14666225, "code_hash": null, "entity": [["tile_f", "sp", [-1, 1, 2, 16]], ["tile_y", "sp", [-1, 56, 2, 1]], ["tile_x", "sp", [-1, 1, 1, 16]], ["tile_rc", "sp", [-1, 4]], ["tile_ry", "sp", [-1, 1]], ["tile_rx", "sp", [-1, 1]], ["auto_unroll_max_step", "ot", 512], ["unroll_explicit", "ot", 0]]}, "result": [[0.012763372375, 0.012769280374999999, 0.01277286425], 0, 1.5197241306304932, 1678934249.5399964], "version": 0.2, "tvm_version": "0.10.0"}
{"input": ["cuda -keys=cuda,gpu -arch=sm_75 -max_num_threads=1024 -thread_warp_size=32", "conv2d_nchw.cuda", [["TENSOR", [1, 32, 112, 112], "float32"], ["TENSOR", [64, 32, 1, 1], "float32"], [1, 1], [0, 0, 0, 0], [1, 1], "float32"], {}], "config": {"index": 22083974, "code_hash": null, "entity": [["tile_f", "sp", [-1, 16, 2, 2]], ["tile_y", "sp", [-1, 1, 4, 14]], ["tile_x", "sp", [-1, 14, 2, 2]], ["tile_rc", "sp", [-1, 2]], ["tile_ry", "sp", [-1, 1]], ["tile_rx", "sp", [-1, 1]], ["auto_unroll_max_step", "ot", 1500], ["unroll_explicit", "ot", 0]]}, "result": [[0.0064377541249999995, 0.0064379000625, 0.0064406638125000006], 0, 4.749797344207764, 1678934250.4716327], "version": 0.2, "tvm_version": "0.10.0"}
{"input": ["cuda -keys=cuda,gpu -arch=sm_75 -max_num_threads=1024 -thread_warp_size=32", "conv2d_nchw.cuda", [["TENSOR", [1, 32, 112, 112], "float32"], ["TENSOR", [64, 32, 1, 1], "float32"], [1, 1], [0, 0, 0, 0], [1, 1], "float32"], {}], "config": {"index": 43866397, "code_hash": null, "entity": [["tile_f", "sp", [-1, 2, 1, 1]], ["tile_y", "sp", [-1, 2, 4, 1]], ["tile_x", "sp", [-1, 1, 14, 4]], ["tile_rc", "sp", [-1, 4]], ["tile_ry", "sp", [-1, 1]], ["tile_rx", "sp", [-1, 1]], ["auto_unroll_max_step", "ot", 512], ["unroll_explicit", "ot", 1]]}, "result": [[0.0009468843313609467, 0.000946941573964497, 0.0009470329467455622], 0, 1.840653419494629, 1678934251.774375], "version": 0.2, "tvm_version": "0.10.0"}
{"input": ["cuda -keys=cuda,gpu -arch=sm_75 -max_num_threads=1024 -thread_warp_size=32", "conv2d_nchw.cuda", [["TENSOR", [1, 32, 112, 112], "float32"], ["TENSOR", [64, 32, 1, 1], "float32"], [1, 1], [0, 0, 0, 0], [1, 1], "float32"], {}], "config": {"index": 50939914, "code_hash": null, "entity": [["tile_f", "sp", [-1, 1, 16, 2]], ["tile_y", "sp", [-1, 1, 7, 4]], ["tile_x", "sp", [-1, 2, 1, 28]], ["tile_rc", "sp", [-1, 1]], ["tile_ry", "sp", [-1, 1]], ["tile_rx", "sp", [-1, 1]], ["auto_unroll_max_step", "ot", 1500], ["unroll_explicit", "ot", 1]]}, "result": [[0.0008972861005586592, 0.0008974149888268156, 0.000897774122905028], 0, 3.5450990200042725, 1678934253.0785997], "version": 0.2, "tvm_version": "0.10.0"}
{"input": ["cuda -keys=cuda,gpu -arch=sm_75 -max_num_threads=1024 -thread_warp_size=32", "conv2d_nchw.cuda", [["TENSOR", [1, 32, 112, 112], "float32"], ["TENSOR", [64, 32, 1, 1], "float32"], [1, 1], [0, 0, 0, 0], [1, 1], "float32"], {}], "config": {"index": 24791035, "code_hash": null, "entity": [["tile_f", "sp", [-1, 8, 1, 2]], ["tile_y", "sp", [-1, 2, 2, 1]], ["tile_x", "sp", [-1, 56, 1, 1]], ["tile_rc", "sp", [-1, 8]], ["tile_ry", "sp", [-1, 1]], ["tile_rx", "sp", [-1, 1]], ["auto_unroll_max_step", "ot", 1500], ["unroll_explicit", "ot", 0]]}, "result": [[0.0278425445, 0.0278506965, 0.027858047249999997], 0, 10.87819242477417, 1678934254.1242266], "version": 0.2, "tvm_version": "0.10.0"}
{"input": ["cuda -keys=cuda,gpu -arch=sm_75 -max_num_threads=1024 -thread_warp_size=32", "conv2d_nchw.cuda", [["TENSOR", [1, 32, 112, 112], "float32"], ["TENSOR", [64, 32, 1, 1], "float32"], [1, 1], [0, 0, 0, 0], [1, 1], "float32"], {}], "config": {"index": 53128633, "code_hash": null, "entity": [["tile_f", "sp", [-1, 1, 8, 4]], ["tile_y", "sp", [-1, 2, 4, 7]], ["tile_x", "sp", [-1, 1, 16, 1]], ["tile_rc", "sp", [-1, 4]], ["tile_ry", "sp", [-1, 1]], ["tile_rx", "sp", [-1, 1]], ["auto_unroll_max_step", "ot", 1500], ["unroll_explicit", "ot", 1]]}, "result": [[6.711474755214986e-05, 6.713411792252023e-05, 6.715726266496382e-05], 0, 1.896507740020752, 1678934255.3954794], "version": 0.2, "tvm_version": "0.10.0"}
{"input": ["cuda -keys=cuda,gpu -arch=sm_75 -max_num_threads=1024 -thread_warp_size=32", "conv2d_nchw.cuda", [["TENSOR", [1, 32, 112, 112], "float32"], ["TENSOR", [64, 32, 1, 1], "float32"], [1, 1], [0, 0, 0, 0], [1, 1], "float32"], {}], "config": {"index": 28116946, "code_hash": null, "entity": [["tile_f", "sp", [-1, 1, 16, 2]], ["tile_y", "sp", [-1, 2, 4, 14]], ["tile_x", "sp", [-1, 1, 2, 1]], ["tile_rc", "sp", [-1, 32]], ["tile_ry", "sp", [-1, 1]], ["tile_rx", "sp", [-1, 1]], ["auto_unroll_max_step", "ot", 1500], ["unroll_explicit", "ot", 0]]}, "result": [[0.00021525000923076925, 0.00021544015692307692, 0.000249372092039801], 0, 1.6810054779052734, 1678934262.4680328], "version": 0.2, "tvm_version": "0.10.0"}
{"input": ["cuda -keys=cuda,gpu -arch=sm_75 -max_num_threads=1024 -thread_warp_size=32", "conv2d_nchw.cuda", [["TENSOR", [1, 32, 112, 112], "float32"], ["TENSOR", [64, 32, 1, 1], "float32"], [1, 1], [0, 0, 0, 0], [1, 1], "float32"], {}], "config": {"index": 50135770, "code_hash": null, "entity": [["tile_f", "sp", [-1, 1, 2, 2]], ["tile_y", "sp", [-1, 2, 14, 1]], ["tile_x", "sp", [-1, 1, 7, 2]], ["tile_rc", "sp", [-1, 1]], ["tile_ry", "sp", [-1, 1]], ["tile_rx", "sp", [-1, 1]], ["auto_unroll_max_step", "ot", 1500], ["unroll_explicit", "ot", 1]]}, "result": [[0.00019766087954110897, 0.00019785079732313575, 0.0001978546481835564], 0, 1.7827470302581787, 1678934263.3846025], "version": 0.2, "tvm_version": "0.10.0"}
{"input": ["cuda -keys=cuda,gpu -arch=sm_75 -max_num_threads=1024 -thread_warp_size=32", "conv2d_nchw.cuda", [["TENSOR", [1, 32, 112, 112], "float32"], ["TENSOR", [64, 32, 1, 1], "float32"], [1, 1], [0, 0, 0, 0], [1, 1], "float32"], {}], "config": {"index": 11200554, "code_hash": null, "entity": [["tile_f", "sp", [-1, 2, 2, 16]], ["tile_y", "sp", [-1, 1, 4, 2]], ["tile_x", "sp", [-1, 1, 2, 8]], ["tile_rc", "sp", [-1, 1]], ["tile_ry", "sp", [-1, 1]], ["tile_rx", "sp", [-1, 1]], ["auto_unroll_max_step", "ot", 512], ["unroll_explicit", "ot", 0]]}, "result": [[0.0011677845697674418, 0.0011678485348837208, 0.0011685027093023255], 0, 2.003903865814209, 1678934264.2786894], "version": 0.2, "tvm_version": "0.10.0"}
{"input": ["cuda -keys=cuda,gpu -arch=sm_75 -max_num_threads=1024 -thread_warp_size=32", "conv2d_nchw.cuda", [["TENSOR", [1, 32, 112, 112], "float32"], ["TENSOR", [64, 32, 1, 1], "float32"], [1, 1], [0, 0, 0, 0], [1, 1], "float32"], {}], "config": {"index": 10851099, "code_hash": null, "entity": [["tile_f", "sp", [-1, 1, 16, 4]], ["tile_y", "sp", [-1, 2, 2, 7]], ["tile_x", "sp", [-1, 2, 2, 4]], ["tile_rc", "sp", [-1, 1]], ["tile_ry", "sp", [-1, 1]], ["tile_rx", "sp", [-1, 1]], ["auto_unroll_max_step", "ot", 512], ["unroll_explicit", "ot", 0]]}, "result": [[0.0007268431231884058, 0.0007269215217391304, 0.0007270582971014493], 0, 1.9517972469329834, 1678934265.181836], "version": 0.2, "tvm_version": "0.10.0"}
{"input": ["cuda -keys=cuda,gpu -arch=sm_75 -max_num_threads=1024 -thread_warp_size=32", "conv2d_nchw.cuda", [["TENSOR", [1, 32, 112, 112], "float32"], ["TENSOR", [64, 32, 1, 1], "float32"], [1, 1], [0, 0, 0, 0], [1, 1], "float32"], {}], "config": {"index": 5781007, "code_hash": null, "entity": [["tile_f", "sp", [-1, 1, 8, 2]], ["tile_y", "sp", [-1, 1, 2, 4]], ["tile_x", "sp", [-1, 4, 14, 2]], ["tile_rc", "sp", [-1, 8]], ["tile_ry", "sp", [-1, 1]], ["tile_rx", "sp", [-1, 1]], ["auto_unroll_max_step", "ot", 0], ["unroll_explicit", "ot", 0]]}, "result": [[0.000248353887345679, 0.00024838167283950616, 0.00024838977314814816], 0, 1.8333868980407715, 1678934266.4552746], "version": 0.2, "tvm_version": "0.10.0"}
{"input": ["cuda -keys=cuda,gpu -arch=sm_75 -max_num_threads=1024 -thread_warp_size=32", "conv2d_nchw.cuda", [["TENSOR", [1, 32, 112, 112], "float32"], ["TENSOR", [64, 32, 1, 1], "float32"], [1, 1], [0, 0, 0, 0], [1, 1], "float32"], {}], "config": {"index": 47226246, "code_hash": null, "entity": [["tile_f", "sp", [-1, 1, 8, 1]], ["tile_y", "sp", [-1, 1, 1, 14]], ["tile_x", "sp", [-1, 4, 1, 7]], ["tile_rc", "sp", [-1, 16]], ["tile_ry", "sp", [-1, 1]], ["tile_rx", "sp", [-1, 1]], ["auto_unroll_max_step", "ot", 512], ["unroll_explicit", "ot", 1]]}, "result": [[0.0024560258292682926, 0.0024560507560975613, 0.0024574579268292684], 0, 3.06136417388916, 1678934267.303013], "version": 0.2, "tvm_version": "0.10.0"}
{"input": ["cuda -keys=cuda,gpu -arch=sm_75 -max_num_threads=1024 -thread_warp_size=32", "conv2d_nchw.cuda", [["TENSOR", [1, 32, 112, 112], "float32"], ["TENSOR", [64, 32, 1, 1], "float32"], [1, 1], [0, 0, 0, 0], [1, 1], "float32"], {}], "config": {"index": 1249238, "code_hash": null, "entity": [["tile_f", "sp", [-1, 1, 1, 16]], ["tile_y", "sp", [-1, 7, 8, 1]], ["tile_x", "sp", [-1, 2, 8, 7]], ["tile_rc", "sp", [-1, 1]], ["tile_ry", "sp", [-1, 1]], ["tile_rx", "sp", [-1, 1]], ["auto_unroll_max_step", "ot", 0], ["unroll_explicit", "ot", 0]]}, "result": [[0.00161352294, 0.00161440261, 0.0016145670999999997], 0, 2.2930054664611816, 1678934268.6177375], "version": 0.2, "tvm_version": "0.10.0"}
{"input": ["cuda -keys=cuda,gpu -arch=sm_75 -max_num_threads=1024 -thread_warp_size=32", "conv2d_nchw.cuda", [["TENSOR", [1, 32, 112, 112], "float32"], ["TENSOR", [64, 32, 1, 1], "float32"], [1, 1], [0, 0, 0, 0], [1, 1], "float32"], {}], "config": {"index": 40808310, "code_hash": null, "entity": [["tile_f", "sp", [-1, 1, 8, 1]], ["tile_y", "sp", [-1, 7, 2, 1]], ["tile_x", "sp", [-1, 7, 1, 8]], ["tile_rc", "sp", [-1, 1]], ["tile_ry", "sp", [-1, 1]], ["tile_rx", "sp", [-1, 1]], ["auto_unroll_max_step", "ot", 512], ["unroll_explicit", "ot", 1]]}, "result": [[0.002502592825, 0.0025036800249999998, 0.002503808775], 0, 3.024158477783203, 1678934269.5029187], "version": 0.2, "tvm_version": "0.10.0"}
{"input": ["cuda -keys=cuda,gpu -arch=sm_75 -max_num_threads=1024 -thread_warp_size=32", "conv2d_nchw.cuda", [["TENSOR", [1, 32, 112, 112], "float32"], ["TENSOR", [64, 32, 1, 1], "float32"], [1, 1], [0, 0, 0, 0], [1, 1], "float32"], {}], "config": {"index": 54682891, "code_hash": null, "entity": [["tile_f", "sp", [-1, 8, 1, 8]], ["tile_y", "sp", [-1, 1, 8, 14]], ["tile_x", "sp", [-1, 1, 8, 1]], ["tile_rc", "sp", [-1, 8]], ["tile_ry", "sp", [-1, 1]], ["tile_rx", "sp", [-1, 1]], ["auto_unroll_max_step", "ot", 1500], ["unroll_explicit", "ot", 1]]}, "result": [[0.0012077496785714286, 0.001208490642857143, 0.0012084944523809524], 0, 5.835112810134888, 1678934270.4155145], "version": 0.2, "tvm_version": "0.10.0"}
{"input": ["cuda -keys=cuda,gpu -arch=sm_75 -max_num_threads=1024 -thread_warp_size=32", "conv2d_nchw.cuda", [["TENSOR", [1, 32, 112, 112], "float32"], ["TENSOR", [64, 32, 1, 1], "float32"], [1, 1], [0, 0, 0, 0], [1, 1], "float32"], {}], "config": {"index": 54990803, "code_hash": null, "entity": [["tile_f", "sp", [-1, 2, 2, 2]], ["tile_y", "sp", [-1, 4, 2, 1]], ["tile_x", "sp", [-1, 7, 2, 2]], ["tile_rc", "sp", [-1, 8]], ["tile_ry", "sp", [-1, 1]], ["tile_rx", "sp", [-1, 1]], ["auto_unroll_max_step", "ot", 1500], ["unroll_explicit", "ot", 1]]}, "result": [[0.0007879769526315789, 0.0007893918473684212, 0.0008718231949152542], 0, 3.025825262069702, 1678934275.716574], "version": 0.2, "tvm_version": "0.10.0"}
{"input": ["cuda -keys=cuda,gpu -arch=sm_75 -max_num_threads=1024 -thread_warp_size=32", "conv2d_nchw.cuda", [["TENSOR", [1, 32, 112, 112], "float32"], ["TENSOR", [64, 32, 1, 1], "float32"], [1, 1], [0, 0, 0, 0], [1, 1], "float32"], {}], "config": {"index": 54982039, "code_hash": null, "entity": [["tile_f", "sp", [-1, 1, 2, 1]], ["tile_y", "sp", [-1, 7, 1, 2]], ["tile_x", "sp", [-1, 4, 2, 2]], ["tile_rc", "sp", [-1, 8]], ["tile_ry", "sp", [-1, 1]], ["tile_rx", "sp", [-1, 1]], ["auto_unroll_max_step", "ot", 1500], ["unroll_explicit", "ot", 1]]}, "result": [[0.0015890235238095237, 0.0015890915873015873, 0.0015891073174603173], 0, 4.947434663772583, 1678934276.6181078], "version": 0.2, "tvm_version": "0.10.0"}
{"input": ["cuda -keys=cuda,gpu -arch=sm_75 -max_num_threads=1024 -thread_warp_size=32", "conv2d_nchw.cuda", [["TENSOR", [1, 32, 112, 112], "float32"], ["TENSOR", [64, 32, 1, 1], "float32"], [1, 1], [0, 0, 0, 0], [1, 1], "float32"], {}], "config": {"index": 10709258, "code_hash": null, "entity": [["tile_f", "sp", [-1, 2, 4, 1]], ["tile_y", "sp", [-1, 2, 14, 4]], ["tile_x", "sp", [-1, 2, 14, 2]], ["tile_rc", "sp", [-1, 1]], ["tile_ry", "sp", [-1, 1]], ["tile_rx", "sp", [-1, 1]], ["auto_unroll_max_step", "ot", 512], ["unroll_explicit", "ot", 0]]}, "result": [[0.00039733984946236565, 0.00039784121505376344, 0.0003983212930107527], 0, 1.6417322158813477, 1678934277.8290832], "version": 0.2, "tvm_version": "0.10.0"}
{"input": ["cuda -keys=cuda,gpu -arch=sm_75 -max_num_threads=1024 -thread_warp_size=32", "conv2d_nchw.cuda", [["TENSOR", [1, 32, 112, 112], "float32"], ["TENSOR", [64, 32, 1, 1], "float32"], [1, 1], [0, 0, 0, 0], [1, 1], "float32"], {}], "config": {"index": 1744999, "code_hash": null, "entity": [["tile_f", "sp", [-1, 8, 1, 8]], ["tile_y", "sp", [-1, 1, 2, 2]], ["tile_x", "sp", [-1, 56, 1, 1]], ["tile_rc", "sp", [-1, 2]], ["tile_ry", "sp", [-1, 1]], ["tile_rx", "sp", [-1, 1]], ["auto_unroll_max_step", "ot", 0], ["unroll_explicit", "ot", 0]]}, "result": [[0.03041869525, 0.030427679000000003, 0.03044504725], 0, 2.7213335037231445, 1678934278.9310536], "version": 0.2, "tvm_version": "0.10.0"}
{"input": ["cuda -keys=cuda,gpu -arch=sm_75 -max_num_threads=1024 -thread_warp_size=32", "conv2d_nchw.cuda", [["TENSOR", [1, 32, 112, 112], "float32"], ["TENSOR", [64, 32, 1, 1], "float32"], [1, 1], [0, 0, 0, 0], [1, 1], "float32"], {}], "config": {"index": 43943673, "code_hash": null, "entity": [["tile_f", "sp", [-1, 2, 1, 32]], ["tile_y", "sp", [-1, 1, 2, 7]], ["tile_x", "sp", [-1, 8, 1, 7]], ["tile_rc", "sp", [-1, 4]], ["tile_ry", "sp", [-1, 1]], ["tile_rx", "sp", [-1, 1]], ["auto_unroll_max_step", "ot", 512], ["unroll_explicit", "ot", 1]]}, "result": [[0.019542053166666667, 0.0195440165, 0.019553722333333332], 0, 4.073239088058472, 1678934279.9510217], "version": 0.2, "tvm_version": "0.10.0"}
{"input": ["cuda -keys=cuda,gpu -arch=sm_75 -max_num_threads=1024 -thread_warp_size=32", "conv2d_nchw.cuda", [["TENSOR", [1, 32, 112, 112], "float32"], ["TENSOR", [64, 32, 1, 1], "float32"], [1, 1], [0, 0, 0, 0], [1, 1], "float32"], {}], "config": {"index": 50420999, "code_hash": null, "entity": [["tile_f", "sp", [-1, 1, 1, 64]], ["tile_y", "sp", [-1, 1, 14, 2]], ["tile_x", "sp", [-1, 1, 7, 4]], ["tile_rc", "sp", [-1, 1]], ["tile_ry", "sp", [-1, 1]], ["tile_rx", "sp", [-1, 1]], ["auto_unroll_max_step", "ot", 1500], ["unroll_explicit", "ot", 1]]}, "result": [[0.0009126434999999999, 0.000912775, 0.0009130542363636363], 0, 2.7822372913360596, 1678934280.841078], "version": 0.2, "tvm_version": "0.10.0"}
{"input": ["cuda -keys=cuda,gpu -arch=sm_75 -max_num_threads=1024 -thread_warp_size=32", "conv2d_nchw.cuda", [["TENSOR", [1, 32, 112, 112], "float32"], ["TENSOR", [64, 32, 1, 1], "float32"], [1, 1], [0, 0, 0, 0], [1, 1], "float32"], {}], "config": {"index": 19039546, "code_hash": null, "entity": [["tile_f", "sp", [-1, 1, 16, 1]], ["tile_y", "sp", [-1, 2, 1, 1]], ["tile_x", "sp", [-1, 14, 1, 4]], ["tile_rc", "sp", [-1, 32]], ["tile_ry", "sp", [-1, 1]], ["tile_rx", "sp", [-1, 1]], ["auto_unroll_max_step", "ot", 512], ["unroll_explicit", "ot", 0]]}, "result": [[0.0004850627358490567, 0.0004851259018867925, 0.0004866980188679245], 0, 2.2708818912506104, 1678934284.3851497], "version": 0.2, "tvm_version": "0.10.0"}
{"input": ["cuda -keys=cuda,gpu -arch=sm_75 -max_num_threads=1024 -thread_warp_size=32", "conv2d_nchw.cuda", [["TENSOR", [1, 32, 112, 112], "float32"], ["TENSOR", [64, 32, 1, 1], "float32"], [1, 1], [0, 0, 0, 0], [1, 1], "float32"], {}], "config": {"index": 41802273, "code_hash": null, "entity": [["tile_f", "sp", [-1, 4, 2, 1]], ["tile_y", "sp", [-1, 7, 4, 4]], ["tile_x", "sp", [-1, 2, 2, 2]], ["tile_rc", "sp", [-1, 2]], ["tile_ry", "sp", [-1, 1]], ["tile_rx", "sp", [-1, 1]], ["auto_unroll_max_step", "ot", 512], ["unroll_explicit", "ot", 1]]}, "result": [[0.0014568505652173913, 0.0014569752898550726, 0.0014581852753623187], 0, 3.193891763687134, 1678934285.2548208], "version": 0.2, "tvm_version": "0.10.0"}
{"input": ["cuda -keys=cuda,gpu -arch=sm_75 -max_num_threads=1024 -thread_warp_size=32", "conv2d_nchw.cuda", [["TENSOR", [1, 32, 112, 112], "float32"], ["TENSOR", [64, 32, 1, 1], "float32"], [1, 1], [0, 0, 0, 0], [1, 1], "float32"], {}], "config": {"index": 8362578, "code_hash": null, "entity": [["tile_f", "sp", [-1, 8, 4, 2]], ["tile_y", "sp", [-1, 8, 2, 1]], ["tile_x", "sp", [-1, 2, 2, 1]], ["tile_rc", "sp", [-1, 32]], ["tile_ry", "sp", [-1, 1]], ["tile_rx", "sp", [-1, 1]], ["auto_unroll_max_step", "ot", 0], ["unroll_explicit", "ot", 0]]}, "result": [[0.00031578475929549903, 0.00031634873776908024, 0.00031646593037974686], 0, 2.5184109210968018, 1678934286.4295192], "version": 0.2, "tvm_version": "0.10.0"}
{"input": ["cuda -keys=cuda,gpu -arch=sm_75 -max_num_threads=1024 -thread_warp_size=32", "conv2d_nchw.cuda", [["TENSOR", [1, 32, 112, 112], "float32"], ["TENSOR", [64, 32, 1, 1], "float32"], [1, 1], [0, 0, 0, 0], [1, 1], "float32"], {}], "config": {"index": 49310542, "code_hash": null, "entity": [["tile_f", "sp", [-1, 1, 16, 1]], ["tile_y", "sp", [-1, 1, 2, 1]], ["tile_x", "sp", [-1, 1, 2, 28]], ["tile_rc", "sp", [-1, 32]], ["tile_ry", "sp", [-1, 1]], ["tile_rx", "sp", [-1, 1]], ["auto_unroll_max_step", "ot", 512], ["unroll_explicit", "ot", 1]]}, "result": [[0.000251412905362776, 0.00025142580599369084, 0.00025147160567823344], 0, 1.8489863872528076, 1678934287.699129], "version": 0.2, "tvm_version": "0.10.0"}
{"input": ["cuda -keys=cuda,gpu -arch=sm_75 -max_num_threads=1024 -thread_warp_size=32", "conv2d_nchw.cuda", [["TENSOR", [1, 32, 112, 112], "float32"], ["TENSOR", [64, 32, 1, 1], "float32"], [1, 1], [0, 0, 0, 0], [1, 1], "float32"], {}], "config": {"index": 33009189, "code_hash": null, "entity": [["tile_f", "sp", [-1, 4, 8, 2]], ["tile_y", "sp", [-1, 1, 8, 14]], ["tile_x", "sp", [-1, 16, 1, 1]], ["tile_rc", "sp", [-1, 4]], ["tile_ry", "sp", [-1, 1]], ["tile_rx", "sp", [-1, 1]], ["auto_unroll_max_step", "ot", 0], ["unroll_explicit", "ot", 1]]}, "result": [[0.0018721867222222224, 0.001873330425925926, 0.0018735395185185185], 0, 1.5721721649169922, 1678934288.5857284], "version": 0.2, "tvm_version": "0.10.0"}
{"input": ["cuda -keys=cuda,gpu -arch=sm_75 -max_num_threads=1024 -thread_warp_size=32", "conv2d_nchw.cuda", [["TENSOR", [1, 32, 112, 112], "float32"], ["TENSOR", [64, 32, 1, 1], "float32"], [1, 1], [0, 0, 0, 0], [1, 1], "float32"], {}], "config": {"index": 1377226, "code_hash": null, "entity": [["tile_f", "sp", [-1, 1, 16, 2]], ["tile_y", "sp", [-1, 14, 2, 1]], ["tile_x", "sp", [-1, 1, 1, 14]], ["tile_rc", "sp", [-1, 1]], ["tile_ry", "sp", [-1, 1]], ["tile_rx", "sp", [-1, 1]], ["auto_unroll_max_step", "ot", 0], ["unroll_explicit", "ot", 0]]}, "result": [[0.0019964956249999997, 0.001996924775, 0.0019983467], 0, 2.487320899963379, 1678934289.856396], "version": 0.2, "tvm_version": "0.10.0"}
{"input": ["cuda -keys=cuda,gpu -arch=sm_75 -max_num_threads=1024 -thread_warp_size=32", "conv2d_nchw.cuda", [["TENSOR", [1, 32, 112, 112], "float32"], ["TENSOR", [64, 32, 1, 1], "float32"], [1, 1], [0, 0, 0, 0], [1, 1], "float32"], {}], "config": {"index": 43169381, "code_hash": null, "entity": [["tile_f", "sp", [-1, 16, 4, 1]], ["tile_y", "sp", [-1, 1, 2, 14]], ["tile_x", "sp", [-1, 2, 8, 1]], ["tile_rc", "sp", [-1, 4]], ["tile_ry", "sp", [-1, 1]], ["tile_rx", "sp", [-1, 1]], ["auto_unroll_max_step", "ot", 512], ["unroll_explicit", "ot", 1]]}, "result": [[0.001024480306122449, 0.0010246687040816327, 0.0010247314591836734], 0, 3.0387418270111084, 1678934290.707506], "version": 0.2, "tvm_version": "0.10.0"}
{"input": ["cuda -keys=cuda,gpu -arch=sm_75 -max_num_threads=1024 -thread_warp_size=32", "conv2d_nchw.cuda", [["TENSOR", [1, 32, 112, 112], "float32"], ["TENSOR", [64, 32, 1, 1], "float32"], [1, 1], [0, 0, 0, 0], [1, 1], "float32"], {}], "config": {"index": 31723615, "code_hash": null, "entity": [["tile_f", "sp", [-1, 1, 2, 1]], ["tile_y", "sp", [-1, 2, 2, 4]], ["tile_x", "sp", [-1, 1, 16, 1]], ["tile_rc", "sp", [-1, 2]], ["tile_ry", "sp", [-1, 1]], ["tile_rx", "sp", [-1, 1]], ["auto_unroll_max_step", "ot", 0], ["unroll_explicit", "ot", 1]]}, "result": [[0.0006076091463414634, 0.0006088345024390244, 0.0006156345609756097], 0, 1.7360658645629883, 1678934434.0135481], "version": 0.2, "tvm_version": "0.10.0"}
{"input": ["cuda -keys=cuda,gpu -arch=sm_75 -max_num_threads=1024 -thread_warp_size=32", "conv2d_nchw.cuda", [["TENSOR", [1, 32, 112, 112], "float32"], ["TENSOR", [64, 32, 1, 1], "float32"], [1, 1], [0, 0, 0, 0], [1, 1], "float32"], {}], "config": {"index": 51480415, "code_hash": null, "entity": [["tile_f", "sp", [-1, 1, 2, 1]], ["tile_y", "sp", [-1, 2, 2, 4]], ["tile_x", "sp", [-1, 1, 16, 1]], ["tile_rc", "sp", [-1, 2]], ["tile_ry", "sp", [-1, 1]], ["tile_rx", "sp", [-1, 1]], ["auto_unroll_max_step", "ot", 1500], ["unroll_explicit", "ot", 1]]}, "result": [[0.0006009048320895523, 0.0006009664365671642, 0.0006009674067164179], 0, 2.417428731918335, 1678934435.271052], "version": 0.2, "tvm_version": "0.10.0"}
{"input": ["cuda -keys=cuda,gpu -arch=sm_75 -max_num_threads=1024 -thread_warp_size=32", "conv2d_nchw.cuda", [["TENSOR", [1, 32, 112, 112], "float32"], ["TENSOR", [64, 32, 1, 1], "float32"], [1, 1], [0, 0, 0, 0], [1, 1], "float32"], {}], "config": {"index": 41602015, "code_hash": null, "entity": [["tile_f", "sp", [-1, 1, 2, 1]], ["tile_y", "sp", [-1, 2, 2, 4]], ["tile_x", "sp", [-1, 1, 16, 1]], ["tile_rc", "sp", [-1, 2]], ["tile_ry", "sp", [-1, 1]], ["tile_rx", "sp", [-1, 1]], ["auto_unroll_max_step", "ot", 512], ["unroll_explicit", "ot", 1]]}, "result": [[0.0006009370597014925, 0.0006009541380597016, 0.0006019744291044777], 0, 2.4099037647247314, 1678934436.5353084], "version": 0.2, "tvm_version": "0.10.0"}
{"input": ["cuda -keys=cuda,gpu -arch=sm_75 -max_num_threads=1024 -thread_warp_size=32", "conv2d_nchw.cuda", [["TENSOR", [1, 32, 112, 112], "float32"], ["TENSOR", [64, 32, 1, 1], "float32"], [1, 1], [0, 0, 0, 0], [1, 1], "float32"], {}], "config": {"index": 33324457, "code_hash": null, "entity": [["tile_f", "sp", [-1, 1, 8, 4]], ["tile_y", "sp", [-1, 2, 2, 7]], ["tile_x", "sp", [-1, 1, 14, 1]], ["tile_rc", "sp", [-1, 4]], ["tile_ry", "sp", [-1, 1]], ["tile_rx", "sp", [-1, 1]], ["auto_unroll_max_step", "ot", 0], ["unroll_explicit", "ot", 1]]}, "result": [[0.00010134052571428572, 0.00010136491047619047, 0.00010139046793650795], 0, 1.9574997425079346, 1678934437.8002167], "version": 0.2, "tvm_version": "0.10.0"}
{"input": ["cuda -keys=cuda,gpu -arch=sm_75 -max_num_threads=1024 -thread_warp_size=32", "conv2d_nchw.cuda", [["TENSOR", [1, 32, 112, 112], "float32"], ["TENSOR", [64, 32, 1, 1], "float32"], [1, 1], [0, 0, 0, 0], [1, 1], "float32"], {}], "config": {"index": 53081257, "code_hash": null, "entity": [["tile_f", "sp", [-1, 1, 8, 4]], ["tile_y", "sp", [-1, 2, 2, 7]], ["tile_x", "sp", [-1, 1, 14, 1]], ["tile_rc", "sp", [-1, 4]], ["tile_ry", "sp", [-1, 1]], ["tile_rx", "sp", [-1, 1]], ["auto_unroll_max_step", "ot", 1500], ["unroll_explicit", "ot", 1]]}, "result": [[0.00010121240789473683, 0.00010122201629072683, 0.00010138369674185464], 0, 2.118974447250366, 1678934439.015979], "version": 0.2, "tvm_version": "0.10.0"}
{"input": ["cuda -keys=cuda,gpu -arch=sm_75 -max_num_threads=1024 -thread_warp_size=32", "conv2d_nchw.cuda", [["TENSOR", [1, 32, 112, 112], "float32"], ["TENSOR", [64, 32, 1, 1], "float32"], [1, 1], [0, 0, 0, 0], [1, 1], "float32"], {}], "config": {"index": 48446350, "code_hash": null, "entity": [["tile_f", "sp", [-1, 1, 16, 1]], ["tile_y", "sp", [-1, 2, 2, 4]], ["tile_x", "sp", [-1, 1, 4, 2]], ["tile_rc", "sp", [-1, 32]], ["tile_ry", "sp", [-1, 1]], ["tile_rx", "sp", [-1, 1]], ["auto_unroll_max_step", "ot", 512], ["unroll_explicit", "ot", 1]]}, "result": [[0.0003198029345238095, 0.00031982119047619046, 0.00031983460317460316], 0, 3.033545970916748, 1678934440.292069], "version": 0.2, "tvm_version": "0.10.0"}
{"input": ["cuda -keys=cuda,gpu -arch=sm_75 -max_num_threads=1024 -thread_warp_size=32", "conv2d_nchw.cuda", [["TENSOR", [1, 32, 112, 112], "float32"], ["TENSOR", [64, 32, 1, 1], "float32"], [1, 1], [0, 0, 0, 0], [1, 1], "float32"], {}], "config": {"index": 57760294, "code_hash": null, "entity": [["tile_f", "sp", [-1, 1, 16, 2]], ["tile_y", "sp", [-1, 2, 2, 4]], ["tile_x", "sp", [-1, 2, 2, 1]], ["tile_rc", "sp", [-1, 32]], ["tile_ry", "sp", [-1, 1]], ["tile_rx", "sp", [-1, 1]], ["auto_unroll_max_step", "ot", 1500], ["unroll_explicit", "ot", 1]]}, "result": [[0.00019558000390625, 0.0001956068125, 0.000195644005859375], 0, 3.2557435035705566, 1678934441.1429029], "version": 0.2, "tvm_version": "0.10.0"}
{"input": ["cuda -keys=cuda,gpu -arch=sm_75 -max_num_threads=1024 -thread_warp_size=32", "conv2d_nchw.cuda", [["TENSOR", [1, 32, 112, 112], "float32"], ["TENSOR", [64, 32, 1, 1], "float32"], [1, 1], [0, 0, 0, 0], [1, 1], "float32"], {}], "config": {"index": 47881894, "code_hash": null, "entity": [["tile_f", "sp", [-1, 1, 16, 2]], ["tile_y", "sp", [-1, 2, 2, 4]], ["tile_x", "sp", [-1, 2, 2, 1]], ["tile_rc", "sp", [-1, 32]], ["tile_ry", "sp", [-1, 1]], ["tile_rx", "sp", [-1, 1]], ["auto_unroll_max_step", "ot", 512], ["unroll_explicit", "ot", 1]]}, "result": [[0.00019068441239570915, 0.0001907107282479142, 0.00019071583909415973], 0, 2.0449788570404053, 1678934442.4210877], "version": 0.2, "tvm_version": "0.10.0"}
{"input": ["cuda -keys=cuda,gpu -arch=sm_75 -max_num_threads=1024 -thread_warp_size=32", "conv2d_nchw.cuda", [["TENSOR", [1, 32, 112, 112], "float32"], ["TENSOR", [64, 32, 1, 1], "float32"], [1, 1], [0, 0, 0, 0], [1, 1], "float32"], {}], "config": {"index": 38003494, "code_hash": null, "entity": [["tile_f", "sp", [-1, 1, 16, 2]], ["tile_y", "sp", [-1, 2, 2, 4]], ["tile_x", "sp", [-1, 2, 2, 1]], ["tile_rc", "sp", [-1, 32]], ["tile_ry", "sp", [-1, 1]], ["tile_rx", "sp", [-1, 1]], ["auto_unroll_max_step", "ot", 0], ["unroll_explicit", "ot", 1]]}, "result": [[0.0001907057142857143, 0.00019074152774498229, 0.0001907540850059032], 0, 1.9729421138763428, 1678934443.720425], "version": 0.2, "tvm_version": "0.10.0"}
{"input": ["cuda -keys=cuda,gpu -arch=sm_75 -max_num_threads=1024 -thread_warp_size=32", "conv2d_nchw.cuda", [["TENSOR", [1, 32, 112, 112], "float32"], ["TENSOR", [64, 32, 1, 1], "float32"], [1, 1], [0, 0, 0, 0], [1, 1], "float32"], {}], "config": {"index": 38415073, "code_hash": null, "entity": [["tile_f", "sp", [-1, 1, 32, 1]], ["tile_y", "sp", [-1, 2, 2, 4]], ["tile_x", "sp", [-1, 2, 1, 2]], ["tile_rc", "sp", [-1, 32]], ["tile_ry", "sp", [-1, 1]], ["tile_rx", "sp", [-1, 1]], ["auto_unroll_max_step", "ot", 0], ["unroll_explicit", "ot", 1]]}, "result": [[0.00027356185675675676, 0.0002736139243243243, 0.0002737567162162162], 0, 1.5648725032806396, 1678934444.6083302], "version": 0.2, "tvm_version": "0.10.0"}
{"input": ["cuda -keys=cuda,gpu -arch=sm_75 -max_num_threads=1024 -thread_warp_size=32", "conv2d_nchw.cuda", [["TENSOR", [1, 32, 112, 112], "float32"], ["TENSOR", [64, 32, 1, 1], "float32"], [1, 1], [0, 0, 0, 0], [1, 1], "float32"], {}], "config": {"index": 33324370, "code_hash": null, "entity": [["tile_f", "sp", [-1, 1, 4, 4]], ["tile_y", "sp", [-1, 1, 2, 7]], ["tile_x", "sp", [-1, 1, 14, 1]], ["tile_rc", "sp", [-1, 4]], ["tile_ry", "sp", [-1, 1]], ["tile_rx", "sp", [-1, 1]], ["auto_unroll_max_step", "ot", 0], ["unroll_explicit", "ot", 1]]}, "result": [[0.00011598828922631959, 0.00011620289370932755, 0.00011621826319595084], 0, 1.9655413627624512, 1678934445.8816845], "version": 0.2, "tvm_version": "0.10.0"}
{"input": ["cuda -keys=cuda,gpu -arch=sm_75 -max_num_threads=1024 -thread_warp_size=32", "conv2d_nchw.cuda", [["TENSOR", [1, 32, 112, 112], "float32"], ["TENSOR", [64, 32, 1, 1], "float32"], [1, 1], [0, 0, 0, 0], [1, 1], "float32"], {}], "config": {"index": 53081170, "code_hash": null, "entity": [["tile_f", "sp", [-1, 1, 4, 4]], ["tile_y", "sp", [-1, 1, 2, 7]], ["tile_x", "sp", [-1, 1, 14, 1]], ["tile_rc", "sp", [-1, 4]], ["tile_ry", "sp", [-1, 1]], ["tile_rx", "sp", [-1, 1]], ["auto_unroll_max_step", "ot", 1500], ["unroll_explicit", "ot", 1]]}, "result": [[0.00011654706937269373, 0.00011656954686346864, 0.00011658032398523987], 0, 2.7572946548461914, 1678934447.1496122], "version": 0.2, "tvm_version": "0.10.0"}
{"input": ["cuda -keys=cuda,gpu -arch=sm_75 -max_num_threads=1024 -thread_warp_size=32", "conv2d_nchw.cuda", [["TENSOR", [1, 32, 112, 112], "float32"], ["TENSOR", [64, 32, 1, 1], "float32"], [1, 1], [0, 0, 0, 0], [1, 1], "float32"], {}], "config": {"index": 3655069, "code_hash": null, "entity": [["tile_f", "sp", [-1, 1, 8, 4]], ["tile_y", "sp", [-1, 1, 2, 8]], ["tile_x", "sp", [-1, 2, 8, 1]], ["tile_rc", "sp", [-1, 4]], ["tile_ry", "sp", [-1, 1]], ["tile_rx", "sp", [-1, 1]], ["auto_unroll_max_step", "ot", 0], ["unroll_explicit", "ot", 0]]}, "result": [[7.970312151898734e-05, 7.972174126582279e-05, 7.973390177215191e-05], 0, 1.924666404724121, 1678934448.4308317], "version": 0.2, "tvm_version": "0.10.0"}
{"input": ["cuda -keys=cuda,gpu -arch=sm_75 -max_num_threads=1024 -thread_warp_size=32", "conv2d_nchw.cuda", [["TENSOR", [1, 32, 112, 112], "float32"], ["TENSOR", [64, 32, 1, 1], "float32"], [1, 1], [0, 0, 0, 0], [1, 1], "float32"], {}], "config": {"index": 13568749, "code_hash": null, "entity": [["tile_f", "sp", [-1, 1, 8, 4]], ["tile_y", "sp", [-1, 1, 2, 8]], ["tile_x", "sp", [-1, 1, 14, 1]], ["tile_rc", "sp", [-1, 4]], ["tile_ry", "sp", [-1, 1]], ["tile_rx", "sp", [-1, 1]], ["auto_unroll_max_step", "ot", 512], ["unroll_explicit", "ot", 0]]}, "result": [[6.775313121019108e-05, 6.777344373673036e-05, 6.778053842887473e-05], 0, 1.953904628753662, 1678934449.6972644], "version": 0.2, "tvm_version": "0.10.0"}
{"input": ["cuda -keys=cuda,gpu -arch=sm_75 -max_num_threads=1024 -thread_warp_size=32", "conv2d_nchw.cuda", [["TENSOR", [1, 32, 112, 112], "float32"], ["TENSOR", [64, 32, 1, 1], "float32"], [1, 1], [0, 0, 0, 0], [1, 1], "float32"], {}], "config": {"index": 23447149, "code_hash": null, "entity": [["tile_f", "sp", [-1, 1, 8, 4]], ["tile_y", "sp", [-1, 1, 2, 8]], ["tile_x", "sp", [-1, 1, 14, 1]], ["tile_rc", "sp", [-1, 4]], ["tile_ry", "sp", [-1, 1]], ["tile_rx", "sp", [-1, 1]], ["auto_unroll_max_step", "ot", 1500], ["unroll_explicit", "ot", 0]]}, "result": [[7.018501831174632e-05, 7.02000250111657e-05, 7.031354935238945e-05], 0, 2.1014368534088135, 1678934450.94813], "version": 0.2, "tvm_version": "0.10.0"}
{"input": ["cuda -keys=cuda,gpu -arch=sm_75 -max_num_threads=1024 -thread_warp_size=32", "conv2d_nchw.cuda", [["TENSOR", [1, 32, 112, 112], "float32"], ["TENSOR", [64, 32, 1, 1], "float32"], [1, 1], [0, 0, 0, 0], [1, 1], "float32"], {}], "config": {"index": 3690349, "code_hash": null, "entity": [["tile_f", "sp", [-1, 1, 8, 4]], ["tile_y", "sp", [-1, 1, 2, 8]], ["tile_x", "sp", [-1, 1, 14, 1]], ["tile_rc", "sp", [-1, 4]], ["tile_ry", "sp", [-1, 1]], ["tile_rx", "sp", [-1, 1]], ["auto_unroll_max_step", "ot", 0], ["unroll_explicit", "ot", 0]]}, "result": [[6.834551335311572e-05, 6.862629673590504e-05, 6.867530733361594e-05], 0, 1.9634373188018799, 1678934452.2486663], "version": 0.2, "tvm_version": "0.10.0"}
{"input": ["cuda -keys=cuda,gpu -arch=sm_75 -max_num_threads=1024 -thread_warp_size=32", "conv2d_nchw.cuda", [["TENSOR", [1, 32, 112, 112], "float32"], ["TENSOR", [64, 32, 1, 1], "float32"], [1, 1], [0, 0, 0, 0], [1, 1], "float32"], {}], "config": {"index": 13533469, "code_hash": null, "entity": [["tile_f", "sp", [-1, 1, 8, 4]], ["tile_y", "sp", [-1, 1, 2, 8]], ["tile_x", "sp", [-1, 2, 8, 1]], ["tile_rc", "sp", [-1, 4]], ["tile_ry", "sp", [-1, 1]], ["tile_rx", "sp", [-1, 1]], ["auto_unroll_max_step", "ot", 512], ["unroll_explicit", "ot", 0]]}, "result": [[7.933990390576566e-05, 7.935523868567886e-05, 7.940209299442035e-05], 0, 1.8198189735412598, 1678934455.2497087], "version": 0.2, "tvm_version": "0.10.0"}
{"input": ["cuda -keys=cuda,gpu -arch=sm_75 -max_num_threads=1024 -thread_warp_size=32", "conv2d_nchw.cuda", [["TENSOR", [1, 32, 112, 112], "float32"], ["TENSOR", [64, 32, 1, 1], "float32"], [1, 1], [0, 0, 0, 0], [1, 1], "float32"], {}], "config": {"index": 23411869, "code_hash": null, "entity": [["tile_f", "sp", [-1, 1, 8, 4]], ["tile_y", "sp", [-1, 1, 2, 8]], ["tile_x", "sp", [-1, 2, 8, 1]], ["tile_rc", "sp", [-1, 4]], ["tile_ry", "sp", [-1, 1]], ["tile_rx", "sp", [-1, 1]], ["auto_unroll_max_step", "ot", 1500], ["unroll_explicit", "ot", 0]]}, "result": [[7.93343507014028e-05, 7.934152905811623e-05, 7.93936503006012e-05], 0, 2.0260255336761475, 1678934456.5111187], "version": 0.2, "tvm_version": "0.10.0"}
{"input": ["cuda -keys=cuda,gpu -arch=sm_75 -max_num_threads=1024 -thread_warp_size=32", "conv2d_nchw.cuda", [["TENSOR", [1, 32, 112, 112], "float32"], ["TENSOR", [64, 32, 1, 1], "float32"], [1, 1], [0, 0, 0, 0], [1, 1], "float32"], {}], "config": {"index": 33325549, "code_hash": null, "entity": [["tile_f", "sp", [-1, 1, 8, 4]], ["tile_y", "sp", [-1, 1, 2, 8]], ["tile_x", "sp", [-1, 1, 14, 1]], ["tile_rc", "sp", [-1, 4]], ["tile_ry", "sp", [-1, 1]], ["tile_rx", "sp", [-1, 1]], ["auto_unroll_max_step", "ot", 0], ["unroll_explicit", "ot", 1]]}, "result": [[6.818744001695635e-05, 6.852141288681644e-05, 6.855890970750318e-05], 0, 1.9445016384124756, 1678934457.8115382], "version": 0.2, "tvm_version": "0.10.0"}
{"input": ["cuda -keys=cuda,gpu -arch=sm_75 -max_num_threads=1024 -thread_warp_size=32", "conv2d_nchw.cuda", [["TENSOR", [1, 32, 112, 112], "float32"], ["TENSOR", [64, 32, 1, 1], "float32"], [1, 1], [0, 0, 0, 0], [1, 1], "float32"], {}], "config": {"index": 53082349, "code_hash": null, "entity": [["tile_f", "sp", [-1, 1, 8, 4]], ["tile_y", "sp", [-1, 1, 2, 8]], ["tile_x", "sp", [-1, 1, 14, 1]], ["tile_rc", "sp", [-1, 4]], ["tile_ry", "sp", [-1, 1]], ["tile_rx", "sp", [-1, 1]], ["auto_unroll_max_step", "ot", 1500], ["unroll_explicit", "ot", 1]]}, "result": [[7.035544686527345e-05, 7.038962827923522e-05, 7.043790128946198e-05], 0, 2.9982659816741943, 1678934459.0938032], "version": 0.2, "tvm_version": "0.10.0"}
{"input": ["cuda -keys=cuda,gpu -arch=sm_75 -max_num_threads=1024 -thread_warp_size=32", "conv2d_nchw.cuda", [["TENSOR", [1, 32, 112, 112], "float32"], ["TENSOR", [64, 32, 1, 1], "float32"], [1, 1], [0, 0, 0, 0], [1, 1], "float32"], {}], "config": {"index": 43168669, "code_hash": null, "entity": [["tile_f", "sp", [-1, 1, 8, 4]], ["tile_y", "sp", [-1, 1, 2, 8]], ["tile_x", "sp", [-1, 2, 8, 1]], ["tile_rc", "sp", [-1, 4]], ["tile_ry", "sp", [-1, 1]], ["tile_rx", "sp", [-1, 1]], ["auto_unroll_max_step", "ot", 512], ["unroll_explicit", "ot", 1]]}, "result": [[7.913191415885544e-05, 7.91428371978293e-05, 7.91461188949186e-05], 0, 2.2784883975982666, 1678934460.3611407], "version": 0.2, "tvm_version": "0.10.0"}
{"input": ["cuda -keys=cuda,gpu -arch=sm_75 -max_num_threads=1024 -thread_warp_size=32", "conv2d_nchw.cuda", [["TENSOR", [1, 32, 112, 112], "float32"], ["TENSOR", [64, 32, 1, 1], "float32"], [1, 1], [0, 0, 0, 0], [1, 1], "float32"], {}], "config": {"index": 53047069, "code_hash": null, "entity": [["tile_f", "sp", [-1, 1, 8, 4]], ["tile_y", "sp", [-1, 1, 2, 8]], ["tile_x", "sp", [-1, 2, 8, 1]], ["tile_rc", "sp", [-1, 4]], ["tile_ry", "sp", [-1, 1]], ["tile_rx", "sp", [-1, 1]], ["auto_unroll_max_step", "ot", 1500], ["unroll_explicit", "ot", 1]]}, "result": [[7.911172434607647e-05, 7.912306136820926e-05, 7.913823541247485e-05], 0, 2.2790372371673584, 1678934461.6441076], "version": 0.2, "tvm_version": "0.10.0"}
{"input": ["cuda -keys=cuda,gpu -arch=sm_75 -max_num_threads=1024 -thread_warp_size=32", "conv2d_nchw.cuda", [["TENSOR", [1, 32, 112, 112], "float32"], ["TENSOR", [64, 32, 1, 1], "float32"], [1, 1], [0, 0, 0, 0], [1, 1], "float32"], {}], "config": {"index": 43203949, "code_hash": null, "entity": [["tile_f", "sp", [-1, 1, 8, 4]], ["tile_y", "sp", [-1, 1, 2, 8]], ["tile_x", "sp", [-1, 1, 14, 1]], ["tile_rc", "sp", [-1, 4]], ["tile_ry", "sp", [-1, 1]], ["tile_rx", "sp", [-1, 1]], ["auto_unroll_max_step", "ot", 512], ["unroll_explicit", "ot", 1]]}, "result": [[6.797709102455546e-05, 6.801406223539374e-05, 6.804353979678239e-05], 0, 2.1206259727478027, 1678934462.9418094], "version": 0.2, "tvm_version": "0.10.0"}
{"input": ["cuda -keys=cuda,gpu -arch=sm_75 -max_num_threads=1024 -thread_warp_size=32", "conv2d_nchw.cuda", [["TENSOR", [1, 32, 112, 112], "float32"], ["TENSOR", [64, 32, 1, 1], "float32"], [1, 1], [0, 0, 0, 0], [1, 1], "float32"], {}], "config": {"index": 15109474, "code_hash": null, "entity": [["tile_f", "sp", [-1, 1, 4, 4]], ["tile_y", "sp", [-1, 1, 7, 8]], ["tile_x", "sp", [-1, 1, 7, 1]], ["tile_rc", "sp", [-1, 8]], ["tile_ry", "sp", [-1, 1]], ["tile_rx", "sp", [-1, 1]], ["auto_unroll_max_step", "ot", 512], ["unroll_explicit", "ot", 0]]}, "result": [[0.00016889202634351948, 0.00016892223919915702, 0.0001689374330874605], 0, 2.1053264141082764, 1678934464.217613], "version": 0.2, "tvm_version": "0.10.0"}
{"input": ["cuda -keys=cuda,gpu -arch=sm_75 -max_num_threads=1024 -thread_warp_size=32", "conv2d_nchw.cuda", [["TENSOR", [1, 32, 112, 112], "float32"], ["TENSOR", [64, 32, 1, 1], "float32"], [1, 1], [0, 0, 0, 0], [1, 1], "float32"], {}], "config": {"index": 24987874, "code_hash": null, "entity": [["tile_f", "sp", [-1, 1, 4, 4]], ["tile_y", "sp", [-1, 1, 7, 8]], ["tile_x", "sp", [-1, 1, 7, 1]], ["tile_rc", "sp", [-1, 8]], ["tile_ry", "sp", [-1, 1]], ["tile_rx", "sp", [-1, 1]], ["auto_unroll_max_step", "ot", 1500], ["unroll_explicit", "ot", 0]]}, "result": [[0.00016521338969072166, 0.00016521447525773194, 0.0001654541793814433], 0, 2.364635944366455, 1678934465.493784], "version": 0.2, "tvm_version": "0.10.0"}
{"input": ["cuda -keys=cuda,gpu -arch=sm_75 -max_num_threads=1024 -thread_warp_size=32", "conv2d_nchw.cuda", [["TENSOR", [1, 32, 112, 112], "float32"], ["TENSOR", [64, 32, 1, 1], "float32"], [1, 1], [0, 0, 0, 0], [1, 1], "float32"], {}], "config": {"index": 53128210, "code_hash": null, "entity": [["tile_f", "sp", [-1, 1, 4, 4]], ["tile_y", "sp", [-1, 1, 2, 7]], ["tile_x", "sp", [-1, 1, 16, 1]], ["tile_rc", "sp", [-1, 4]], ["tile_ry", "sp", [-1, 1]], ["tile_rx", "sp", [-1, 1]], ["auto_unroll_max_step", "ot", 1500], ["unroll_explicit", "ot", 1]]}, "result": [[6.509683669609079e-05, 6.51881973518285e-05, 6.522608890290038e-05], 0, 2.562678098678589, 1678934466.4088566], "version": 0.2, "tvm_version": "0.10.0"}
{"input": ["cuda -keys=cuda,gpu -arch=sm_75 -max_num_threads=1024 -thread_warp_size=32", "conv2d_nchw.cuda", [["TENSOR", [1, 32, 112, 112], "float32"], ["TENSOR", [64, 32, 1, 1], "float32"], [1, 1], [0, 0, 0, 0], [1, 1], "float32"], {}], "config": {"index": 43203946, "code_hash": null, "entity": [["tile_f", "sp", [-1, 1, 4, 4]], ["tile_y", "sp", [-1, 1, 2, 8]], ["tile_x", "sp", [-1, 1, 14, 1]], ["tile_rc", "sp", [-1, 4]], ["tile_ry", "sp", [-1, 1]], ["tile_rx", "sp", [-1, 1]], ["auto_unroll_max_step", "ot", 512], ["unroll_explicit", "ot", 1]]}, "result": [[9.962219810725552e-05, 9.962536529968454e-05, 9.978124542586752e-05], 0, 2.0676867961883545, 1678934467.663733], "version": 0.2, "tvm_version": "0.10.0"}
{"input": ["cuda -keys=cuda,gpu -arch=sm_75 -max_num_threads=1024 -thread_warp_size=32", "conv2d_nchw.cuda", [["TENSOR", [1, 32, 112, 112], "float32"], ["TENSOR", [64, 32, 1, 1], "float32"], [1, 1], [0, 0, 0, 0], [1, 1], "float32"], {}], "config": {"index": 33325546, "code_hash": null, "entity": [["tile_f", "sp", [-1, 1, 4, 4]], ["tile_y", "sp", [-1, 1, 2, 8]], ["tile_x", "sp", [-1, 1, 14, 1]], ["tile_rc", "sp", [-1, 4]], ["tile_ry", "sp", [-1, 1]], ["tile_rx", "sp", [-1, 1]], ["auto_unroll_max_step", "ot", 0], ["unroll_explicit", "ot", 1]]}, "result": [[0.00010222467647058822, 0.00010224026726342711, 0.00010251164705882352], 0, 1.9759175777435303, 1678934468.9637518], "version": 0.2, "tvm_version": "0.10.0"}
{"input": ["cuda -keys=cuda,gpu -arch=sm_75 -max_num_threads=1024 -thread_warp_size=32", "conv2d_nchw.cuda", [["TENSOR", [1, 32, 112, 112], "float32"], ["TENSOR", [64, 32, 1, 1], "float32"], [1, 1], [0, 0, 0, 0], [1, 1], "float32"], {}], "config": {"index": 43249810, "code_hash": null, "entity": [["tile_f", "sp", [-1, 1, 4, 4]], ["tile_y", "sp", [-1, 1, 2, 7]], ["tile_x", "sp", [-1, 1, 16, 1]], ["tile_rc", "sp", [-1, 4]], ["tile_ry", "sp", [-1, 1]], ["tile_rx", "sp", [-1, 1]], ["auto_unroll_max_step", "ot", 512], ["unroll_explicit", "ot", 1]]}, "result": [[6.599551192778853e-05, 6.599650032237267e-05, 6.616782978723405e-05], 0, 1.6905646324157715, 1678934469.8715615], "version": 0.2, "tvm_version": "0.10.0"}
{"input": ["cuda -keys=cuda,gpu -arch=sm_75 -max_num_threads=1024 -thread_warp_size=32", "conv2d_nchw.cuda", [["TENSOR", [1, 32, 112, 112], "float32"], ["TENSOR", [64, 32, 1, 1], "float32"], [1, 1], [0, 0, 0, 0], [1, 1], "float32"], {}], "config": {"index": 53082346, "code_hash": null, "entity": [["tile_f", "sp", [-1, 1, 4, 4]], ["tile_y", "sp", [-1, 1, 2, 8]], ["tile_x", "sp", [-1, 1, 14, 1]], ["tile_rc", "sp", [-1, 4]], ["tile_ry", "sp", [-1, 1]], ["tile_rx", "sp", [-1, 1]], ["auto_unroll_max_step", "ot", 1500], ["unroll_explicit", "ot", 1]]}, "result": [[0.00010028927749999999, 0.00010048142374999999, 0.00010085572187500001], 0, 3.0592682361602783, 1678934471.143918], "version": 0.2, "tvm_version": "0.10.0"}
{"input": ["cuda -keys=cuda,gpu -arch=sm_75 -max_num_threads=1024 -thread_warp_size=32", "conv2d_nchw.cuda", [["TENSOR", [1, 32, 112, 112], "float32"], ["TENSOR", [64, 32, 1, 1], "float32"], [1, 1], [0, 0, 0, 0], [1, 1], "float32"], {}], "config": {"index": 44744674, "code_hash": null, "entity": [["tile_f", "sp", [-1, 1, 4, 4]], ["tile_y", "sp", [-1, 1, 7, 8]], ["tile_x", "sp", [-1, 1, 7, 1]], ["tile_rc", "sp", [-1, 8]], ["tile_ry", "sp", [-1, 1]], ["tile_rx", "sp", [-1, 1]], ["auto_unroll_max_step", "ot", 512], ["unroll_explicit", "ot", 1]]}, "result": [[0.00020570359820282414, 0.00020573593709884467, 0.00020614281129653403], 0, 2.2518718242645264, 1678934472.430859], "version": 0.2, "tvm_version": "0.10.0"}
{"input": ["cuda -keys=cuda,gpu -arch=sm_75 -max_num_threads=1024 -thread_warp_size=32", "conv2d_nchw.cuda", [["TENSOR", [1, 32, 112, 112], "float32"], ["TENSOR", [64, 32, 1, 1], "float32"], [1, 1], [0, 0, 0, 0], [1, 1], "float32"], {}], "config": {"index": 34866274, "code_hash": null, "entity": [["tile_f", "sp", [-1, 1, 4, 4]], ["tile_y", "sp", [-1, 1, 7, 8]], ["tile_x", "sp", [-1, 1, 7, 1]], ["tile_rc", "sp", [-1, 8]], ["tile_ry", "sp", [-1, 1]], ["tile_rx", "sp", [-1, 1]], ["auto_unroll_max_step", "ot", 0], ["unroll_explicit", "ot", 1]]}, "result": [[0.00023429084757505775, 0.00023461942032332564, 0.0002346308036951501], 0, 1.5435235500335693, 1678934473.3014128], "version": 0.2, "tvm_version": "0.10.0"}
{"input": ["cuda -keys=cuda,gpu -arch=sm_75 -max_num_threads=1024 -thread_warp_size=32", "conv2d_nchw.cuda", [["TENSOR", [1, 32, 112, 112], "float32"], ["TENSOR", [64, 32, 1, 1], "float32"], [1, 1], [0, 0, 0, 0], [1, 1], "float32"], {}], "config": {"index": 54623074, "code_hash": null, "entity": [["tile_f", "sp", [-1, 1, 4, 4]], ["tile_y", "sp", [-1, 1, 7, 8]], ["tile_x", "sp", [-1, 1, 7, 1]], ["tile_rc", "sp", [-1, 8]], ["tile_ry", "sp", [-1, 1]], ["tile_rx", "sp", [-1, 1]], ["auto_unroll_max_step", "ot", 1500], ["unroll_explicit", "ot", 1]]}, "result": [[0.00016722069220779219, 0.00016722447662337661, 0.00017840477012987012], 0, 3.0157105922698975, 1678934476.4294393], "version": 0.2, "tvm_version": "0.10.0"}
{"input": ["cuda -keys=cuda,gpu -arch=sm_75 -max_num_threads=1024 -thread_warp_size=32", "conv2d_nchw.cuda", [["TENSOR", [1, 32, 112, 112], "float32"], ["TENSOR", [64, 32, 1, 1], "float32"], [1, 1], [0, 0, 0, 0], [1, 1], "float32"], {}], "config": {"index": 5230318, "code_hash": null, "entity": [["tile_f", "sp", [-1, 1, 4, 4]], ["tile_y", "sp", [-1, 1, 8, 7]], ["tile_x", "sp", [-1, 1, 7, 1]], ["tile_rc", "sp", [-1, 8]], ["tile_ry", "sp", [-1, 1]], ["tile_rx", "sp", [-1, 1]], ["auto_unroll_max_step", "ot", 0], ["unroll_explicit", "ot", 0]]}, "result": [[0.00023114558525345622, 0.00023126937788018432, 0.00023129186175115208], 0, 1.551769495010376, 1678934477.2633977], "version": 0.2, "tvm_version": "0.10.0"}
{"input": ["cuda -keys=cuda,gpu -arch=sm_75 -max_num_threads=1024 -thread_warp_size=32", "conv2d_nchw.cuda", [["TENSOR", [1, 32, 112, 112], "float32"], ["TENSOR", [64, 32, 1, 1], "float32"], [1, 1], [0, 0, 0, 0], [1, 1], "float32"], {}], "config": {"index": 15108718, "code_hash": null, "entity": [["tile_f", "sp", [-1, 1, 4, 4]], ["tile_y", "sp", [-1, 1, 8, 7]], ["tile_x", "sp", [-1, 1, 7, 1]], ["tile_rc", "sp", [-1, 8]], ["tile_ry", "sp", [-1, 1]], ["tile_rx", "sp", [-1, 1]], ["auto_unroll_max_step", "ot", 512], ["unroll_explicit", "ot", 0]]}, "result": [[0.0002311159140401146, 0.00023115406160458454, 0.00023124198567335243], 0, 1.9534435272216797, 1678934478.5354478], "version": 0.2, "tvm_version": "0.10.0"}
{"input": ["cuda -keys=cuda,gpu -arch=sm_75 -max_num_threads=1024 -thread_warp_size=32", "conv2d_nchw.cuda", [["TENSOR", [1, 32, 112, 112], "float32"], ["TENSOR", [64, 32, 1, 1], "float32"], [1, 1], [0, 0, 0, 0], [1, 1], "float32"], {}], "config": {"index": 24987118, "code_hash": null, "entity": [["tile_f", "sp", [-1, 1, 4, 4]], ["tile_y", "sp", [-1, 1, 8, 7]], ["tile_x", "sp", [-1, 1, 7, 1]], ["tile_rc", "sp", [-1, 8]], ["tile_ry", "sp", [-1, 1]], ["tile_rx", "sp", [-1, 1]], ["auto_unroll_max_step", "ot", 1500], ["unroll_explicit", "ot", 0]]}, "result": [[0.0002411063076923077, 0.00024121645673076921, 0.00024123153125], 0, 1.8339447975158691, 1678934479.4351914], "version": 0.2, "tvm_version": "0.10.0"}
{"input": ["cuda -keys=cuda,gpu -arch=sm_75 -max_num_threads=1024 -thread_warp_size=32", "conv2d_nchw.cuda", [["TENSOR", [1, 32, 112, 112], "float32"], ["TENSOR", [64, 32, 1, 1], "float32"], [1, 1], [0, 0, 0, 0], [1, 1], "float32"], {}], "config": {"index": 23445970, "code_hash": null, "entity": [["tile_f", "sp", [-1, 1, 4, 4]], ["tile_y", "sp", [-1, 1, 2, 7]], ["tile_x", "sp", [-1, 1, 14, 1]], ["tile_rc", "sp", [-1, 4]], ["tile_ry", "sp", [-1, 1]], ["tile_rx", "sp", [-1, 1]], ["auto_unroll_max_step", "ot", 1500], ["unroll_explicit", "ot", 0]]}, "result": [[0.0001165935860058309, 0.00011662702842565597, 0.00011663421282798834], 0, 2.193966865539551, 1678934480.728732], "version": 0.2, "tvm_version": "0.10.0"}
{"input": ["cuda -keys=cuda,gpu -arch=sm_75 -max_num_threads=1024 -thread_warp_size=32", "conv2d_nchw.cuda", [["TENSOR", [1, 32, 112, 112], "float32"], ["TENSOR", [64, 32, 1, 1], "float32"], [1, 1], [0, 0, 0, 0], [1, 1], "float32"], {}], "config": {"index": 3689170, "code_hash": null, "entity": [["tile_f", "sp", [-1, 1, 4, 4]], ["tile_y", "sp", [-1, 1, 2, 7]], ["tile_x", "sp", [-1, 1, 14, 1]], ["tile_rc", "sp", [-1, 4]], ["tile_ry", "sp", [-1, 1]], ["tile_rx", "sp", [-1, 1]], ["auto_unroll_max_step", "ot", 0], ["unroll_explicit", "ot", 0]]}, "result": [[0.00011589901666666666, 0.00011590047608695652, 0.00011590195797101449], 0, 1.9277446269989014, 1678934481.983503], "version": 0.2, "tvm_version": "0.10.0"}
{"input": ["cuda -keys=cuda,gpu -arch=sm_75 -max_num_threads=1024 -thread_warp_size=32", "conv2d_nchw.cuda", [["TENSOR", [1, 32, 112, 112], "float32"], ["TENSOR", [64, 32, 1, 1], "float32"], [1, 1], [0, 0, 0, 0], [1, 1], "float32"], {}], "config": {"index": 44743918, "code_hash": null, "entity": [["tile_f", "sp", [-1, 1, 4, 4]], ["tile_y", "sp", [-1, 1, 8, 7]], ["tile_x", "sp", [-1, 1, 7, 1]], ["tile_rc", "sp", [-1, 8]], ["tile_ry", "sp", [-1, 1]], ["tile_rx", "sp", [-1, 1]], ["auto_unroll_max_step", "ot", 512], ["unroll_explicit", "ot", 1]]}, "result": [[0.00022816519373219373, 0.00022822555555555553, 0.00022823681481481478], 0, 2.133821964263916, 1678934483.220821], "version": 0.2, "tvm_version": "0.10.0"}
{"input": ["cuda -keys=cuda,gpu -arch=sm_75 -max_num_threads=1024 -thread_warp_size=32", "conv2d_nchw.cuda", [["TENSOR", [1, 32, 112, 112], "float32"], ["TENSOR", [64, 32, 1, 1], "float32"], [1, 1], [0, 0, 0, 0], [1, 1], "float32"], {}], "config": {"index": 54622318, "code_hash": null, "entity": [["tile_f", "sp", [-1, 1, 4, 4]], ["tile_y", "sp", [-1, 1, 8, 7]], ["tile_x", "sp", [-1, 1, 7, 1]], ["tile_rc", "sp", [-1, 8]], ["tile_ry", "sp", [-1, 1]], ["tile_rx", "sp", [-1, 1]], ["auto_unroll_max_step", "ot", 1500], ["unroll_explicit", "ot", 1]]}, "result": [[0.00023413996480938418, 0.00023418567448680352, 0.0002343971935483871], 0, 2.820204019546509, 1678934484.5141897], "version": 0.2, "tvm_version": "0.10.0"}
{"input": ["cuda -keys=cuda,gpu -arch=sm_75 -max_num_threads=1024 -thread_warp_size=32", "conv2d_nchw.cuda", [["TENSOR", [1, 32, 112, 112], "float32"], ["TENSOR", [64, 32, 1, 1], "float32"], [1, 1], [0, 0, 0, 0], [1, 1], "float32"], {}], "config": {"index": 34865518, "code_hash": null, "entity": [["tile_f", "sp", [-1, 1, 4, 4]], ["tile_y", "sp", [-1, 1, 8, 7]], ["tile_x", "sp", [-1, 1, 7, 1]], ["tile_rc", "sp", [-1, 8]], ["tile_ry", "sp", [-1, 1]], ["tile_rx", "sp", [-1, 1]], ["auto_unroll_max_step", "ot", 0], ["unroll_explicit", "ot", 1]]}, "result": [[0.00023114507603686635, 0.00023131510138248848, 0.00023131547004608295], 0, 1.5940232276916504, 1678934485.4106688], "version": 0.2, "tvm_version": "0.10.0"}
{"input": ["cuda -keys=cuda,gpu -arch=sm_75 -max_num_threads=1024 -thread_warp_size=32", "conv2d_nchw.cuda", [["TENSOR", [1, 32, 112, 112], "float32"], ["TENSOR", [64, 32, 1, 1], "float32"], [1, 1], [0, 0, 0, 0], [1, 1], "float32"], {}], "config": {"index": 23494199, "code_hash": null, "entity": [["tile_f", "sp", [-1, 1, 4, 8]], ["tile_y", "sp", [-1, 1, 2, 8]], ["tile_x", "sp", [-1, 1, 16, 1]], ["tile_rc", "sp", [-1, 4]], ["tile_ry", "sp", [-1, 1]], ["tile_rx", "sp", [-1, 1]], ["auto_unroll_max_step", "ot", 1500], ["unroll_explicit", "ot", 0]]}, "result": [[7.04075019676432e-05, 7.043973414954088e-05, 7.050507958023611e-05], 0, 2.016294240951538, 1678934486.709051], "version": 0.2, "tvm_version": "0.10.0"}
{"input": ["cuda -keys=cuda,gpu -arch=sm_75 -max_num_threads=1024 -thread_warp_size=32", "conv2d_nchw.cuda", [["TENSOR", [1, 32, 112, 112], "float32"], ["TENSOR", [64, 32, 1, 1], "float32"], [1, 1], [0, 0, 0, 0], [1, 1], "float32"], {}], "config": {"index": 13615799, "code_hash": null, "entity": [["tile_f", "sp", [-1, 1, 4, 8]], ["tile_y", "sp", [-1, 1, 2, 8]], ["tile_x", "sp", [-1, 1, 16, 1]], ["tile_rc", "sp", [-1, 4]], ["tile_ry", "sp", [-1, 1]], ["tile_rx", "sp", [-1, 1]], ["auto_unroll_max_step", "ot", 512], ["unroll_explicit", "ot", 0]]}, "result": [[7.039015388026607e-05, 7.041305232815965e-05, 7.042992815964524e-05], 0, 2.0084917545318604, 1678934487.9968953], "version": 0.2, "tvm_version": "0.10.0"}
{"input": ["cuda -keys=cuda,gpu -arch=sm_75 -max_num_threads=1024 -thread_warp_size=32", "conv2d_nchw.cuda", [["TENSOR", [1, 32, 112, 112], "float32"], ["TENSOR", [64, 32, 1, 1], "float32"], [1, 1], [0, 0, 0, 0], [1, 1], "float32"], {}], "config": {"index": 3737399, "code_hash": null, "entity": [["tile_f", "sp", [-1, 1, 4, 8]], ["tile_y", "sp", [-1, 1, 2, 8]], ["tile_x", "sp", [-1, 1, 16, 1]], ["tile_rc", "sp", [-1, 4]], ["tile_ry", "sp", [-1, 1]], ["tile_rx", "sp", [-1, 1]], ["auto_unroll_max_step", "ot", 0], ["unroll_explicit", "ot", 0]]}, "result": [[7.102966288951841e-05, 7.104607223796035e-05, 7.107481232294618e-05], 0, 1.5614378452301025, 1678934488.8932629], "version": 0.2, "tvm_version": "0.10.0"}
{"input": ["cuda -keys=cuda,gpu -arch=sm_75 -max_num_threads=1024 -thread_warp_size=32", "conv2d_nchw.cuda", [["TENSOR", [1, 32, 112, 112], "float32"], ["TENSOR", [64, 32, 1, 1], "float32"], [1, 1], [0, 0, 0, 0], [1, 1], "float32"], {}], "config": {"index": 38573767, "code_hash": null, "entity": [["tile_f", "sp", [-1, 1, 8, 2]], ["tile_y", "sp", [-1, 2, 2, 1]], ["tile_x", "sp", [-1, 2, 4, 2]], ["tile_rc", "sp", [-1, 32]], ["tile_ry", "sp", [-1, 1]], ["tile_rx", "sp", [-1, 1]], ["auto_unroll_max_step", "ot", 0], ["unroll_explicit", "ot", 1]]}, "result": [[0.000252419209375, 0.000252425096875, 0.0002524359453125], 0, 1.965857744216919, 1678934490.1960719], "version": 0.2, "tvm_version": "0.10.0"}
{"input": ["cuda -keys=cuda,gpu -arch=sm_75 -max_num_threads=1024 -thread_warp_size=32", "conv2d_nchw.cuda", [["TENSOR", [1, 32, 112, 112], "float32"], ["TENSOR", [64, 32, 1, 1], "float32"], [1, 1], [0, 0, 0, 0], [1, 1], "float32"], {}], "config": {"index": 48452167, "code_hash": null, "entity": [["tile_f", "sp", [-1, 1, 8, 2]], ["tile_y", "sp", [-1, 2, 2, 1]], ["tile_x", "sp", [-1, 2, 4, 2]], ["tile_rc", "sp", [-1, 32]], ["tile_ry", "sp", [-1, 1]], ["tile_rx", "sp", [-1, 1]], ["auto_unroll_max_step", "ot", 512], ["unroll_explicit", "ot", 1]]}, "result": [[0.0002288583304964539, 0.00022888828510638298, 0.00022890834893617018], 0, 2.690908193588257, 1678934491.4992642], "version": 0.2, "tvm_version": "0.10.0"}
{"input": ["cuda -keys=cuda,gpu -arch=sm_75 -max_num_threads=1024 -thread_warp_size=32", "conv2d_nchw.cuda", [["TENSOR", [1, 32, 112, 112], "float32"], ["TENSOR", [64, 32, 1, 1], "float32"], [1, 1], [0, 0, 0, 0], [1, 1], "float32"], {}], "config": {"index": 58330567, "code_hash": null, "entity": [["tile_f", "sp", [-1, 1, 8, 2]], ["tile_y", "sp", [-1, 2, 2, 1]], ["tile_x", "sp", [-1, 2, 4, 2]], ["tile_rc", "sp", [-1, 32]], ["tile_ry", "sp", [-1, 1]], ["tile_rx", "sp", [-1, 1]], ["auto_unroll_max_step", "ot", 1500], ["unroll_explicit", "ot", 1]]}, "result": [[0.00022879130714285715, 0.00022879991714285715, 0.00022882204285714286], 0, 2.6482656002044678, 1678934492.799852], "version": 0.2, "tvm_version": "0.10.0"}
{"input": ["cuda -keys=cuda,gpu -arch=sm_75 -max_num_threads=1024 -thread_warp_size=32", "conv2d_nchw.cuda", [["TENSOR", [1, 32, 112, 112], "float32"], ["TENSOR", [64, 32, 1, 1], "float32"], [1, 1], [0, 0, 0, 0], [1, 1], "float32"], {}], "config": {"index": 53129399, "code_hash": null, "entity": [["tile_f", "sp", [-1, 1, 4, 8]], ["tile_y", "sp", [-1, 1, 2, 8]], ["tile_x", "sp", [-1, 1, 16, 1]], ["tile_rc", "sp", [-1, 4]], ["tile_ry", "sp", [-1, 1]], ["tile_rx", "sp", [-1, 1]], ["auto_unroll_max_step", "ot", 1500], ["unroll_explicit", "ot", 1]]}, "result": [[7.116963436518618e-05, 7.117548048452221e-05, 7.120130865859129e-05], 0, 2.236284017562866, 1678934494.0887513], "version": 0.2, "tvm_version": "0.10.0"}
{"input": ["cuda -keys=cuda,gpu -arch=sm_75 -max_num_threads=1024 -thread_warp_size=32", "conv2d_nchw.cuda", [["TENSOR", [1, 32, 112, 112], "float32"], ["TENSOR", [64, 32, 1, 1], "float32"], [1, 1], [0, 0, 0, 0], [1, 1], "float32"], {}], "config": {"index": 43098274, "code_hash": null, "entity": [["tile_f", "sp", [-1, 1, 4, 4]], ["tile_y", "sp", [-1, 1, 7, 8]], ["tile_x", "sp", [-1, 1, 7, 1]], ["tile_rc", "sp", [-1, 4]], ["tile_ry", "sp", [-1, 1]], ["tile_rx", "sp", [-1, 1]], ["auto_unroll_max_step", "ot", 512], ["unroll_explicit", "ot", 1]]}, "result": [[0.00014304164719358535, 0.00014305165406643756, 0.00014343976517754866], 0, 1.8414819240570068, 1678934497.1282067], "version": 0.2, "tvm_version": "0.10.0"}
{"input": ["cuda -keys=cuda,gpu -arch=sm_75 -max_num_threads=1024 -thread_warp_size=32", "conv2d_nchw.cuda", [["TENSOR", [1, 32, 112, 112], "float32"], ["TENSOR", [64, 32, 1, 1], "float32"], [1, 1], [0, 0, 0, 0], [1, 1], "float32"], {}], "config": {"index": 33219874, "code_hash": null, "entity": [["tile_f", "sp", [-1, 1, 4, 4]], ["tile_y", "sp", [-1, 1, 7, 8]], ["tile_x", "sp", [-1, 1, 7, 1]], ["tile_rc", "sp", [-1, 4]], ["tile_ry", "sp", [-1, 1]], ["tile_rx", "sp", [-1, 1]], ["auto_unroll_max_step", "ot", 0], ["unroll_explicit", "ot", 1]]}, "result": [[0.00014801415435606062, 0.0001480629659090909, 0.0001481000284090909], 0, 1.96677565574646, 1678934498.4098544], "version": 0.2, "tvm_version": "0.10.0"}
{"input": ["cuda -keys=cuda,gpu -arch=sm_75 -max_num_threads=1024 -thread_warp_size=32", "conv2d_nchw.cuda", [["TENSOR", [1, 32, 112, 112], "float32"], ["TENSOR", [64, 32, 1, 1], "float32"], [1, 1], [0, 0, 0, 0], [1, 1], "float32"], {}], "config": {"index": 52976674, "code_hash": null, "entity": [["tile_f", "sp", [-1, 1, 4, 4]], ["tile_y", "sp", [-1, 1, 7, 8]], ["tile_x", "sp", [-1, 1, 7, 1]], ["tile_rc", "sp", [-1, 4]], ["tile_ry", "sp", [-1, 1]], ["tile_rx", "sp", [-1, 1]], ["auto_unroll_max_step", "ot", 1500], ["unroll_explicit", "ot", 1]]}, "result": [[0.00014092768206039075, 0.0001409320586145648, 0.00014096249555950268], 0, 3.046980381011963, 1678934499.710835], "version": 0.2, "tvm_version": "0.10.0"}
{"input": ["cuda -keys=cuda,gpu -arch=sm_75 -max_num_threads=1024 -thread_warp_size=32", "conv2d_nchw.cuda", [["TENSOR", [1, 32, 112, 112], "float32"], ["TENSOR", [64, 32, 1, 1], "float32"], [1, 1], [0, 0, 0, 0], [1, 1], "float32"], {}], "config": {"index": 13568746, "code_hash": null, "entity": [["tile_f", "sp", [-1, 1, 4, 4]], ["tile_y", "sp", [-1, 1, 2, 8]], ["tile_x", "sp", [-1, 1, 14, 1]], ["tile_rc", "sp", [-1, 4]], ["tile_ry", "sp", [-1, 1]], ["tile_rx", "sp", [-1, 1]], ["auto_unroll_max_step", "ot", 512], ["unroll_explicit", "ot", 0]]}, "result": [[0.00010032987046307885, 0.0001004112728410513, 0.00010049836608260324], 0, 2.0201361179351807, 1678934501.008918], "version": 0.2, "tvm_version": "0.10.0"}
{"input": ["cuda -keys=cuda,gpu -arch=sm_75 -max_num_threads=1024 -thread_warp_size=32", "conv2d_nchw.cuda", [["TENSOR", [1, 32, 112, 112], "float32"], ["TENSOR", [64, 32, 1, 1], "float32"], [1, 1], [0, 0, 0, 0], [1, 1], "float32"], {}], "config": {"index": 3690346, "code_hash": null, "entity": [["tile_f", "sp", [-1, 1, 4, 4]], ["tile_y", "sp", [-1, 1, 2, 8]], ["tile_x", "sp", [-1, 1, 14, 1]], ["tile_rc", "sp", [-1, 4]], ["tile_ry", "sp", [-1, 1]], ["tile_rx", "sp", [-1, 1]], ["auto_unroll_max_step", "ot", 0], ["unroll_explicit", "ot", 0]]}, "result": [[0.00010224397530082331, 0.00010226640405319822, 0.00010245318176060798], 0, 1.998213529586792, 1678934502.3183181], "version": 0.2, "tvm_version": "0.10.0"}
{"input": ["cuda -keys=cuda,gpu -arch=sm_75 -max_num_threads=1024 -thread_warp_size=32", "conv2d_nchw.cuda", [["TENSOR", [1, 32, 112, 112], "float32"], ["TENSOR", [64, 32, 1, 1], "float32"], [1, 1], [0, 0, 0, 0], [1, 1], "float32"], {}], "config": {"index": 3736210, "code_hash": null, "entity": [["tile_f", "sp", [-1, 1, 4, 4]], ["tile_y", "sp", [-1, 1, 2, 7]], ["tile_x", "sp", [-1, 1, 16, 1]], ["tile_rc", "sp", [-1, 4]], ["tile_ry", "sp", [-1, 1]], ["tile_rx", "sp", [-1, 1]], ["auto_unroll_max_step", "ot", 0], ["unroll_explicit", "ot", 0]]}, "result": [[6.618246045016077e-05, 6.648542379421222e-05, 6.659358456591639e-05], 0, 1.4644975662231445, 1678934503.22483], "version": 0.2, "tvm_version": "0.10.0"}
{"input": ["cuda -keys=cuda,gpu -arch=sm_75 -max_num_threads=1024 -thread_warp_size=32", "conv2d_nchw.cuda", [["TENSOR", [1, 32, 112, 112], "float32"], ["TENSOR", [64, 32, 1, 1], "float32"], [1, 1], [0, 0, 0, 0], [1, 1], "float32"], {}], "config": {"index": 13614610, "code_hash": null, "entity": [["tile_f", "sp", [-1, 1, 4, 4]], ["tile_y", "sp", [-1, 1, 2, 7]], ["tile_x", "sp", [-1, 1, 16, 1]], ["tile_rc", "sp", [-1, 4]], ["tile_ry", "sp", [-1, 1]], ["tile_rx", "sp", [-1, 1]], ["auto_unroll_max_step", "ot", 512], ["unroll_explicit", "ot", 0]]}, "result": [[6.574454867827209e-05, 6.575009735654417e-05, 6.595458091553836e-05], 0, 1.543243169784546, 1678934504.1383123], "version": 0.2, "tvm_version": "0.10.0"}
{"input": ["cuda -keys=cuda,gpu -arch=sm_75 -max_num_threads=1024 -thread_warp_size=32", "conv2d_nchw.cuda", [["TENSOR", [1, 32, 112, 112], "float32"], ["TENSOR", [64, 32, 1, 1], "float32"], [1, 1], [0, 0, 0, 0], [1, 1], "float32"], {}], "config": {"index": 23493010, "code_hash": null, "entity": [["tile_f", "sp", [-1, 1, 4, 4]], ["tile_y", "sp", [-1, 1, 2, 7]], ["tile_x", "sp", [-1, 1, 16, 1]], ["tile_rc", "sp", [-1, 4]], ["tile_ry", "sp", [-1, 1]], ["tile_rx", "sp", [-1, 1]], ["auto_unroll_max_step", "ot", 1500], ["unroll_explicit", "ot", 0]]}, "result": [[6.517603870558376e-05, 6.519301649746192e-05, 6.543327918781726e-05], 0, 1.7159125804901123, 1678934504.9864404], "version": 0.2, "tvm_version": "0.10.0"}
{"input": ["cuda -keys=cuda,gpu -arch=sm_75 -max_num_threads=1024 -thread_warp_size=32", "conv2d_nchw.cuda", [["TENSOR", [1, 32, 112, 112], "float32"], ["TENSOR", [64, 32, 1, 1], "float32"], [1, 1], [0, 0, 0, 0], [1, 1], "float32"], {}], "config": {"index": 23447146, "code_hash": null, "entity": [["tile_f", "sp", [-1, 1, 4, 4]], ["tile_y", "sp", [-1, 1, 2, 8]], ["tile_x", "sp", [-1, 1, 14, 1]], ["tile_rc", "sp", [-1, 4]], ["tile_ry", "sp", [-1, 1]], ["tile_rx", "sp", [-1, 1]], ["auto_unroll_max_step", "ot", 1500], ["unroll_explicit", "ot", 0]]}, "result": [[0.00010104773797468356, 0.00010108694683544303, 0.00010179216392405062], 0, 2.2240726947784424, 1678934506.2889085], "version": 0.2, "tvm_version": "0.10.0"}
{"input": ["cuda -keys=cuda,gpu -arch=sm_75 -max_num_threads=1024 -thread_warp_size=32", "conv2d_nchw.cuda", [["TENSOR", [1, 32, 112, 112], "float32"], ["TENSOR", [64, 32, 1, 1], "float32"], [1, 1], [0, 0, 0, 0], [1, 1], "float32"], {}], "config": {"index": 31678325, "code_hash": null, "entity": [["tile_f", "sp", [-1, 1, 2, 16]], ["tile_y", "sp", [-1, 1, 4, 7]], ["tile_x", "sp", [-1, 1, 14, 1]], ["tile_rc", "sp", [-1, 2]], ["tile_ry", "sp", [-1, 1]], ["tile_rx", "sp", [-1, 1]], ["auto_unroll_max_step", "ot", 0], ["unroll_explicit", "ot", 1]]}, "result": [[9.276052389176741e-05, 9.277899769717903e-05, 9.280705584340818e-05], 0, 1.9942505359649658, 1678934507.584557], "version": 0.2, "tvm_version": "0.10.0"}
{"input": ["cuda -keys=cuda,gpu -arch=sm_75 -max_num_threads=1024 -thread_warp_size=32", "conv2d_nchw.cuda", [["TENSOR", [1, 32, 112, 112], "float32"], ["TENSOR", [64, 32, 1, 1], "float32"], [1, 1], [0, 0, 0, 0], [1, 1], "float32"], {}], "config": {"index": 41556725, "code_hash": null, "entity": [["tile_f", "sp", [-1, 1, 2, 16]], ["tile_y", "sp", [-1, 1, 4, 7]], ["tile_x", "sp", [-1, 1, 14, 1]], ["tile_rc", "sp", [-1, 2]], ["tile_ry", "sp", [-1, 1]], ["tile_rx", "sp", [-1, 1]], ["auto_unroll_max_step", "ot", 512], ["unroll_explicit", "ot", 1]]}, "result": [[9.162557481751824e-05, 9.1678424270073e-05, 9.169206113138686e-05], 0, 1.8301904201507568, 1678934508.4374902], "version": 0.2, "tvm_version": "0.10.0"}
