results/cuda_rtx3080/inception_v3/random/cpu.log_layer_28.log
{"input": ["cuda -keys=cuda,gpu -arch=sm_86 -max_num_threads=1024 -thread_warp_size=32", "conv2d_nchw.cuda", [["TENSOR", [1, 128, 17, 17], "float32"], ["TENSOR", [192, 128, 1, 7], "float32"], [1, 1], [0, 3, 0, 3], [1, 1], "float32"], {}], "config": {"index": 269472, "code_hash": null, "entity": [["tile_f", "sp", [-1, 1, 1, 1]], ["tile_y", "sp", [-1, 1, 17, 1]], ["tile_x", "sp", [-1, 1, 1, 1]], ["tile_rc", "sp", [-1, 4]], ["tile_ry", "sp", [-1, 1]], ["tile_rx", "sp", [-1, 1]], ["auto_unroll_max_step", "ot", 0], ["unroll_explicit", "ot", 1]]}, "result": [[0.00024674136642599277, 0.0002470205974729242, 0.00024763978880866424], 0, 1.5519940853118896, 1679194015.227819], "version": 0.2, "tvm_version": "0.10.0"}
{"input": ["cuda -keys=cuda,gpu -arch=sm_86 -max_num_threads=1024 -thread_warp_size=32", "conv2d_nchw.cuda", [["TENSOR", [1, 128, 17, 17], "float32"], ["TENSOR", [192, 128, 1, 7], "float32"], [1, 1], [0, 3, 0, 3], [1, 1], "float32"], {}], "config": {"index": 110318, "code_hash": null, "entity": [["tile_f", "sp", [-1, 16, 3, 2]], ["tile_y", "sp", [-1, 1, 1, 1]], ["tile_x", "sp", [-1, 1, 17, 1]], ["tile_rc", "sp", [-1, 16]], ["tile_ry", "sp", [-1, 1]], ["tile_rx", "sp", [-1, 1]], ["auto_unroll_max_step", "ot", 512], ["unroll_explicit", "ot", 0]]}, "result": [[0.00011758504068047336, 0.00011759034541420118, 0.00011759034541420118], 0, 2.3816707134246826, 1679194016.539333], "version": 0.2, "tvm_version": "0.10.0"}
{"input": ["cuda -keys=cuda,gpu -arch=sm_86 -max_num_threads=1024 -thread_warp_size=32", "conv2d_nchw.cuda", [["TENSOR", [1, 128, 17, 17], "float32"], ["TENSOR", [192, 128, 1, 7], "float32"], [1, 1], [0, 3, 0, 3], [1, 1], "float32"], {}], "config": {"index": 107172, "code_hash": null, "entity": [["tile_f", "sp", [-1, 2, 1, 48]], ["tile_y", "sp", [-1, 1, 17, 1]], ["tile_x", "sp", [-1, 1, 1, 17]], ["tile_rc", "sp", [-1, 8]], ["tile_ry", "sp", [-1, 1]], ["tile_rx", "sp", [-1, 1]], ["auto_unroll_max_step", "ot", 512], ["unroll_explicit", "ot", 0]]}, "result": [[0.011071897800000001, 0.0110733314, 0.0110733314], 0, 1.582927942276001, 1679194017.5313835], "version": 0.2, "tvm_version": "0.10.0"}
{"input": ["cuda -keys=cuda,gpu -arch=sm_86 -max_num_threads=1024 -thread_warp_size=32", "conv2d_nchw.cuda", [["TENSOR", [1, 128, 17, 17], "float32"], ["TENSOR", [192, 128, 1, 7], "float32"], [1, 1], [0, 3, 0, 3], [1, 1], "float32"], {}], "config": {"index": 451967, "code_hash": null, "entity": [["tile_f", "sp", [-1, 16, 6, 1]], ["tile_y", "sp", [-1, 17, 1, 1]], ["tile_x", "sp", [-1, 1, 1, 1]], ["tile_rc", "sp", [-1, 16]], ["tile_ry", "sp", [-1, 1]], ["tile_rx", "sp", [-1, 1]], ["auto_unroll_max_step", "ot", 1500], ["unroll_explicit", "ot", 1]]}, "result": [[0.0012298630534351145, 0.0012299569389312977, 0.0012299881526717557], 0, 3.06048846244812, 1679194018.8496847], "version": 0.2, "tvm_version": "0.10.0"}
{"input": ["cuda -keys=cuda,gpu -arch=sm_86 -max_num_threads=1024 -thread_warp_size=32", "conv2d_nchw.cuda", [["TENSOR", [1, 128, 17, 17], "float32"], ["TENSOR", [192, 128, 1, 7], "float32"], [1, 1], [0, 3, 0, 3], [1, 1], "float32"], {}], "config": {"index": 462785, "code_hash": null, "entity": [["tile_f", "sp", [-1, 2, 4, 2]], ["tile_y", "sp", [-1, 17, 1, 1]], ["tile_x", "sp", [-1, 1, 1, 1]], ["tile_rc", "sp", [-1, 64]], ["tile_ry", "sp", [-1, 1]], ["tile_rx", "sp", [-1, 1]], ["auto_unroll_max_step", "ot", 1500], ["unroll_explicit", "ot", 1]]}, "result": [[0.0001582027609126984, 0.0001582090128968254, 0.00015821205555555557], 0, 3.0558314323425293, 1679194020.1604254], "version": 0.2, "tvm_version": "0.10.0"}
{"input": ["cuda -keys=cuda,gpu -arch=sm_86 -max_num_threads=1024 -thread_warp_size=32", "conv2d_nchw.cuda", [["TENSOR", [1, 128, 17, 17], "float32"], ["TENSOR", [192, 128, 1, 7], "float32"], [1, 1], [0, 3, 0, 3], [1, 1], "float32"], {}], "config": {"index": 8712, "code_hash": null, "entity": [["tile_f", "sp", [-1, 2, 4, 24]], ["tile_y", "sp", [-1, 17, 1, 1]], ["tile_x", "sp", [-1, 1, 17, 1]], ["tile_rc", "sp", [-1, 2]], ["tile_ry", "sp", [-1, 1]], ["tile_rx", "sp", [-1, 1]], ["auto_unroll_max_step", "ot", 0], ["unroll_explicit", "ot", 0]]}, "result": [[0.020137356399999997, 0.0201377792, 0.0201379836], 0, 1.3469443321228027, 1679194021.130659], "version": 0.2, "tvm_version": "0.10.0"}
{"input": ["cuda -keys=cuda,gpu -arch=sm_86 -max_num_threads=1024 -thread_warp_size=32", "conv2d_nchw.cuda", [["TENSOR", [1, 128, 17, 17], "float32"], ["TENSOR", [192, 128, 1, 7], "float32"], [1, 1], [0, 3, 0, 3], [1, 1], "float32"], {}], "config": {"index": 302228, "code_hash": null, "entity": [["tile_f", "sp", [-1, 16, 4, 3]], ["tile_y", "sp", [-1, 1, 1, 17]], ["tile_x", "sp", [-1, 1, 1, 1]], ["tile_rc", "sp", [-1, 1]], ["tile_ry", "sp", [-1, 1]], ["tile_rx", "sp", [-1, 7]], ["auto_unroll_max_step", "ot", 0], ["unroll_explicit", "ot", 1]]}, "result": [[0.005700152888888889, 0.005701176944444445, 0.005701404555555556], 0, 2.937847852706909, 1679194022.0751655], "version": 0.2, "tvm_version": "0.10.0"}
{"input": ["cuda -keys=cuda,gpu -arch=sm_86 -max_num_threads=1024 -thread_warp_size=32", "conv2d_nchw.cuda", [["TENSOR", [1, 128, 17, 17], "float32"], ["TENSOR", [192, 128, 1, 7], "float32"], [1, 1], [0, 3, 0, 3], [1, 1], "float32"], {}], "config": {"index": 134744, "code_hash": null, "entity": [["tile_f", "sp", [-1, 24, 1, 1]], ["tile_y", "sp", [-1, 17, 1, 1]], ["tile_x", "sp", [-1, 1, 1, 1]], ["tile_rc", "sp", [-1, 2]], ["tile_ry", "sp", [-1, 1]], ["tile_rx", "sp", [-1, 7]], ["auto_unroll_max_step", "ot", 512], ["unroll_explicit", "ot", 0]]}, "result": [[0.0016674133166666668, 0.0016674303666666668, 0.0016674468833333333], 0, 2.3083512783050537, 1679194022.9981747], "version": 0.2, "tvm_version": "0.10.0"}
{"input": ["cuda -keys=cuda,gpu -arch=sm_86 -max_num_threads=1024 -thread_warp_size=32", "conv2d_nchw.cuda", [["TENSOR", [1, 128, 17, 17], "float32"], ["TENSOR", [192, 128, 1, 7], "float32"], [1, 1], [0, 3, 0, 3], [1, 1], "float32"], {}], "config": {"index": 366460, "code_hash": null, "entity": [["tile_f", "sp", [-1, 1, 1, 6]], ["tile_y", "sp", [-1, 1, 17, 1]], ["tile_x", "sp", [-1, 1, 1, 1]], ["tile_rc", "sp", [-1, 16]], ["tile_ry", "sp", [-1, 1]], ["tile_rx", "sp", [-1, 1]], ["auto_unroll_max_step", "ot", 512], ["unroll_explicit", "ot", 1]]}, "result": [[9.828924060150376e-05, 9.829243421052633e-05, 9.829694674185463e-05], 0, 1.7928993701934814, 1679194024.3061485], "version": 0.2, "tvm_version": "0.10.0"}
{"input": ["cuda -keys=cuda,gpu -arch=sm_86 -max_num_threads=1024 -thread_warp_size=32", "conv2d_nchw.cuda", [["TENSOR", [1, 128, 17, 17], "float32"], ["TENSOR", [192, 128, 1, 7], "float32"], [1, 1], [0, 3, 0, 3], [1, 1], "float32"], {}], "config": {"index": 88158, "code_hash": null, "entity": [["tile_f", "sp", [-1, 2, 8, 2]], ["tile_y", "sp", [-1, 1, 17, 1]], ["tile_x", "sp", [-1, 17, 1, 1]], ["tile_rc", "sp", [-1, 1]], ["tile_ry", "sp", [-1, 1]], ["tile_rx", "sp", [-1, 1]], ["auto_unroll_max_step", "ot", 512], ["unroll_explicit", "ot", 0]]}, "result": [[0.00042445070634920633, 0.0004244533306878306, 0.00042446136243386244], 0, 1.8217625617980957, 1679194025.6269374], "version": 0.2, "tvm_version": "0.10.0"}
{"input": ["cuda -keys=cuda,gpu -arch=sm_86 -max_num_threads=1024 -thread_warp_size=32", "conv2d_nchw.cuda", [["TENSOR", [1, 128, 17, 17], "float32"], ["TENSOR", [192, 128, 1, 7], "float32"], [1, 1], [0, 3, 0, 3], [1, 1], "float32"], {}], "config": {"index": 119552, "code_hash": null, "entity": [["tile_f", "sp", [-1, 2, 1, 12]], ["tile_y", "sp", [-1, 1, 1, 17]], ["tile_x", "sp", [-1, 1, 1, 1]], ["tile_rc", "sp", [-1, 64]], ["tile_ry", "sp", [-1, 1]], ["tile_rx", "sp", [-1, 1]], ["auto_unroll_max_step", "ot", 512], ["unroll_explicit", "ot", 0]]}, "result": [[0.00227584837704918, 0.0022825269836065573, 0.0022832681475409835], 0, 2.2192206382751465, 1679194030.4866803], "version": 0.2, "tvm_version": "0.10.0"}
{"input": ["cuda -keys=cuda,gpu -arch=sm_86 -max_num_threads=1024 -thread_warp_size=32", "conv2d_nchw.cuda", [["TENSOR", [1, 128, 17, 17], "float32"], ["TENSOR", [192, 128, 1, 7], "float32"], [1, 1], [0, 3, 0, 3], [1, 1], "float32"], {}], "config": {"index": 179246, "code_hash": null, "entity": [["tile_f", "sp", [-1, 16, 2, 3]], ["tile_y", "sp", [-1, 17, 1, 1]], ["tile_x", "sp", [-1, 17, 1, 1]], ["tile_rc", "sp", [-1, 2]], ["tile_ry", "sp", [-1, 1]], ["tile_rx", "sp", [-1, 1]], ["auto_unroll_max_step", "ot", 1500], ["unroll_explicit", "ot", 0]]}, "result": [[0.0797967375, 0.0797967375, 0.07981413999999999], 0, 3.238095760345459, 1679194031.7810743], "version": 0.2, "tvm_version": "0.10.0"}
{"input": ["cuda -keys=cuda,gpu -arch=sm_86 -max_num_threads=1024 -thread_warp_size=32", "conv2d_nchw.cuda", [["TENSOR", [1, 128, 17, 17], "float32"], ["TENSOR", [192, 128, 1, 7], "float32"], [1, 1], [0, 3, 0, 3], [1, 1], "float32"], {}], "config": {"index": 308025, "code_hash": null, "entity": [["tile_f", "sp", [-1, 1, 2, 8]], ["tile_y", "sp", [-1, 1, 1, 1]], ["tile_x", "sp", [-1, 17, 1, 1]], ["tile_rc", "sp", [-1, 2]], ["tile_ry", "sp", [-1, 1]], ["tile_rx", "sp", [-1, 7]], ["auto_unroll_max_step", "ot", 0], ["unroll_explicit", "ot", 1]]}, "result": [[0.0001613990274111675, 0.00016139905888324873, 0.00016140319492385786], 0, 1.9506652355194092, 1679194033.1003733], "version": 0.2, "tvm_version": "0.10.0"}
{"input": ["cuda -keys=cuda,gpu -arch=sm_86 -max_num_threads=1024 -thread_warp_size=32", "conv2d_nchw.cuda", [["TENSOR", [1, 128, 17, 17], "float32"], ["TENSOR", [192, 128, 1, 7], "float32"], [1, 1], [0, 3, 0, 3], [1, 1], "float32"], {}], "config": {"index": 27098, "code_hash": null, "entity": [["tile_f", "sp", [-1, 2, 24, 4]], ["tile_y", "sp", [-1, 1, 1, 1]], ["tile_x", "sp", [-1, 1, 1, 1]], ["tile_rc", "sp", [-1, 32]], ["tile_ry", "sp", [-1, 1]], ["tile_rx", "sp", [-1, 1]], ["auto_unroll_max_step", "ot", 0], ["unroll_explicit", "ot", 0]]}, "result": [[0.0008558357671957672, 0.0008563024126984127, 0.0008564920529100529], 0, 1.6329278945922852, 1679194034.3568058], "version": 0.2, "tvm_version": "0.10.0"}
{"input": ["cuda -keys=cuda,gpu -arch=sm_86 -max_num_threads=1024 -thread_warp_size=32", "conv2d_nchw.cuda", [["TENSOR", [1, 128, 17, 17], "float32"], ["TENSOR", [192, 128, 1, 7], "float32"], [1, 1], [0, 3, 0, 3], [1, 1], "float32"], {}], "config": {"index": 60519, "code_hash": null, "entity": [["tile_f", "sp", [-1, 12, 4, 1]], ["tile_y", "sp", [-1, 1, 1, 1]], ["tile_x", "sp", [-1, 17, 1, 1]], ["tile_rc", "sp", [-1, 8]], ["tile_ry", "sp", [-1, 1]], ["tile_rx", "sp", [-1, 7]], ["auto_unroll_max_step", "ot", 0], ["unroll_explicit", "ot", 0]]}, "result": [[0.0002878556945454545, 0.0002878892090909091, 0.00028790038909090913], 0, 2.0084598064422607, 1679194035.6821449], "version": 0.2, "tvm_version": "0.10.0"}
{"input": ["cuda -keys=cuda,gpu -arch=sm_86 -max_num_threads=1024 -thread_warp_size=32", "conv2d_nchw.cuda", [["TENSOR", [1, 128, 17, 17], "float32"], ["TENSOR", [192, 128, 1, 7], "float32"], [1, 1], [0, 3, 0, 3], [1, 1], "float32"], {}], "config": {"index": 225767, "code_hash": null, "entity": [["tile_f", "sp", [-1, 1, 4, 24]], ["tile_y", "sp", [-1, 1, 1, 17]], ["tile_x", "sp", [-1, 1, 1, 17]], ["tile_rc", "sp", [-1, 2]], ["tile_ry", "sp", [-1, 1]], ["tile_rx", "sp", [-1, 7]], ["auto_unroll_max_step", "ot", 1500], ["unroll_explicit", "ot", 0]]}, "result": [[0.5377689205, 0.53776947, 0.5378078000000001], 0, 9.816712856292725, 1679194042.025082], "version": 0.2, "tvm_version": "0.10.0"}
{"input": ["cuda -keys=cuda,gpu -arch=sm_86 -max_num_threads=1024 -thread_warp_size=32", "conv2d_nchw.cuda", [["TENSOR", [1, 128, 17, 17], "float32"], ["TENSOR", [192, 128, 1, 7], "float32"], [1, 1], [0, 3, 0, 3], [1, 1], "float32"], {}], "config": {"index": 438908, "code_hash": null, "entity": [["tile_f", "sp", [-1, 24, 1, 2]], ["tile_y", "sp", [-1, 1, 17, 1]], ["tile_x", "sp", [-1, 1, 17, 1]], ["tile_rc", "sp", [-1, 2]], ["tile_ry", "sp", [-1, 1]], ["tile_rx", "sp", [-1, 1]], ["auto_unroll_max_step", "ot", 1500], ["unroll_explicit", "ot", 1]]}, "result": [[0.0001837932399077278, 0.00018381450057670126, 0.00018383102652825835], 0, 2.2542333602905273, 1679194043.3326113], "version": 0.2, "tvm_version": "0.10.0"}
{"input": ["cuda -keys=cuda,gpu -arch=sm_86 -max_num_threads=1024 -thread_warp_size=32", "conv2d_nchw.cuda", [["TENSOR", [1, 128, 17, 17], "float32"], ["TENSOR", [192, 128, 1, 7], "float32"], [1, 1], [0, 3, 0, 3], [1, 1], "float32"], {}], "config": {"index": 444296, "code_hash": null, "entity": [["tile_f", "sp", [-1, 24, 2, 2]], ["tile_y", "sp", [-1, 1, 17, 1]], ["tile_x", "sp", [-1, 1, 17, 1]], ["tile_rc", "sp", [-1, 4]], ["tile_ry", "sp", [-1, 1]], ["tile_rx", "sp", [-1, 1]], ["auto_unroll_max_step", "ot", 1500], ["unroll_explicit", "ot", 1]]}, "result": [[0.00033513812916666664, 0.00033514668124999997, 0.0003351483979166667], 0, 3.4595885276794434, 1679194044.6479473], "version": 0.2, "tvm_version": "0.10.0"}
{"input": ["cuda -keys=cuda,gpu -arch=sm_86 -max_num_threads=1024 -thread_warp_size=32", "conv2d_nchw.cuda", [["TENSOR", [1, 128, 17, 17], "float32"], ["TENSOR", [192, 128, 1, 7], "float32"], [1, 1], [0, 3, 0, 3], [1, 1], "float32"], {}], "config": {"index": 434251, "code_hash": null, "entity": [["tile_f", "sp", [-1, 1, 24, 2]], ["tile_y", "sp", [-1, 1, 1, 1]], ["tile_x", "sp", [-1, 1, 1, 17]], ["tile_rc", "sp", [-1, 1]], ["tile_ry", "sp", [-1, 1]], ["tile_rx", "sp", [-1, 1]], ["auto_unroll_max_step", "ot", 1500], ["unroll_explicit", "ot", 1]]}, "result": [[0.00017845948944591027, 0.0001784758957783641, 0.00018265295778364116], 0, 1.7441058158874512, 1679194055.968441], "version": 0.2, "tvm_version": "0.10.0"}
{"input": ["cuda -keys=cuda,gpu -arch=sm_86 -max_num_threads=1024 -thread_warp_size=32", "conv2d_nchw.cuda", [["TENSOR", [1, 128, 17, 17], "float32"], ["TENSOR", [192, 128, 1, 7], "float32"], [1, 1], [0, 3, 0, 3], [1, 1], "float32"], {}], "config": {"index": 65412, "code_hash": null, "entity": [["tile_f", "sp", [-1, 4, 2, 6]], ["tile_y", "sp", [-1, 1, 17, 1]], ["tile_x", "sp", [-1, 1, 1, 1]], ["tile_rc", "sp", [-1, 16]], ["tile_ry", "sp", [-1, 1]], ["tile_rx", "sp", [-1, 7]], ["auto_unroll_max_step", "ot", 0], ["unroll_explicit", "ot", 0]]}, "result": [[0.00035145880043859645, 0.0003514607061403509, 0.0003514722850877193], 0, 1.656606674194336, 1679194057.3002348], "version": 0.2, "tvm_version": "0.10.0"}
{"input": ["cuda -keys=cuda,gpu -arch=sm_86 -max_num_threads=1024 -thread_warp_size=32", "conv2d_nchw.cuda", [["TENSOR", [1, 128, 17, 17], "float32"], ["TENSOR", [192, 128, 1, 7], "float32"], [1, 1], [0, 3, 0, 3], [1, 1], "float32"], {}], "config": {"index": 265713, "code_hash": null, "entity": [["tile_f", "sp", [-1, 4, 1, 12]], ["tile_y", "sp", [-1, 1, 17, 1]], ["tile_x", "sp", [-1, 17, 1, 1]], ["tile_rc", "sp", [-1, 2]], ["tile_ry", "sp", [-1, 1]], ["tile_rx", "sp", [-1, 1]], ["auto_unroll_max_step", "ot", 0], ["unroll_explicit", "ot", 1]]}, "result": [[0.004931388809523809, 0.004931388809523809, 0.004931632619047619], 0, 1.3743669986724854, 1679194058.2525673], "version": 0.2, "tvm_version": "0.10.0"}
{"input": ["cuda -keys=cuda,gpu -arch=sm_86 -max_num_threads=1024 -thread_warp_size=32", "conv2d_nchw.cuda", [["TENSOR", [1, 128, 17, 17], "float32"], ["TENSOR", [192, 128, 1, 7], "float32"], [1, 1], [0, 3, 0, 3], [1, 1], "float32"], {}], "config": {"index": 261333, "code_hash": null, "entity": [["tile_f", "sp", [-1, 3, 4, 8]], ["tile_y", "sp", [-1, 17, 1, 1]], ["tile_x", "sp", [-1, 1, 17, 1]], ["tile_rc", "sp", [-1, 1]], ["tile_ry", "sp", [-1, 1]], ["tile_rx", "sp", [-1, 1]], ["auto_unroll_max_step", "ot", 0], ["unroll_explicit", "ot", 1]]}, "result": [[0.012744704125, 0.012744815750000001, 0.012744832000000001], 0, 1.4100134372711182, 1679194059.2117352], "version": 0.2, "tvm_version": "0.10.0"}
{"input": ["cuda -keys=cuda,gpu -arch=sm_86 -max_num_threads=1024 -thread_warp_size=32", "conv2d_nchw.cuda", [["TENSOR", [1, 128, 17, 17], "float32"], ["TENSOR", [192, 128, 1, 7], "float32"], [1, 1], [0, 3, 0, 3], [1, 1], "float32"], {}], "config": {"index": 8919, "code_hash": null, "entity": [["tile_f", "sp", [-1, 24, 1, 4]], ["tile_y", "sp", [-1, 1, 17, 1]], ["tile_x", "sp", [-1, 1, 17, 1]], ["tile_rc", "sp", [-1, 2]], ["tile_ry", "sp", [-1, 1]], ["tile_rx", "sp", [-1, 1]], ["auto_unroll_max_step", "ot", 0], ["unroll_explicit", "ot", 0]]}, "result": [[0.0003927927921760391, 0.00039279536674816627, 0.0003928023422982885], 0, 1.8434579372406006, 1679194060.5312388], "version": 0.2, "tvm_version": "0.10.0"}
{"input": ["cuda -keys=cuda,gpu -arch=sm_86 -max_num_threads=1024 -thread_warp_size=32", "conv2d_nchw.cuda", [["TENSOR", [1, 128, 17, 17], "float32"], ["TENSOR", [192, 128, 1, 7], "float32"], [1, 1], [0, 3, 0, 3], [1, 1], "float32"], {}], "config": {"index": 286458, "code_hash": null, "entity": [["tile_f", "sp", [-1, 2, 2, 4]], ["tile_y", "sp", [-1, 1, 1, 1]], ["tile_x", "sp", [-1, 17, 1, 1]], ["tile_rc", "sp", [-1, 32]], ["tile_ry", "sp", [-1, 1]], ["tile_rx", "sp", [-1, 1]], ["auto_unroll_max_step", "ot", 0], ["unroll_explicit", "ot", 1]]}, "result": [[0.00035653591574279377, 0.0003568333436807095, 0.00035685151219512197], 0, 1.7375397682189941, 1679194061.844279], "version": 0.2, "tvm_version": "0.10.0"}
{"input": ["cuda -keys=cuda,gpu -arch=sm_86 -max_num_threads=1024 -thread_warp_size=32", "conv2d_nchw.cuda", [["TENSOR", [1, 128, 17, 17], "float32"], ["TENSOR", [192, 128, 1, 7], "float32"], [1, 1], [0, 3, 0, 3], [1, 1], "float32"], {}], "config": {"index": 95324, "code_hash": null, "entity": [["tile_f", "sp", [-1, 2, 8, 6]], ["tile_y", "sp", [-1, 1, 1, 17]], ["tile_x", "sp", [-1, 1, 17, 1]], ["tile_rc", "sp", [-1, 2]], ["tile_ry", "sp", [-1, 1]], ["tile_rx", "sp", [-1, 1]], ["auto_unroll_max_step", "ot", 512], ["unroll_explicit", "ot", 0]]}, "result": [[0.0005943167675276753, 0.0005943167675276753, 0.0005943205424354243], 0, 1.7355785369873047, 1679194063.1668758], "version": 0.2, "tvm_version": "0.10.0"}
{"input": ["cuda -keys=cuda,gpu -arch=sm_86 -max_num_threads=1024 -thread_warp_size=32", "conv2d_nchw.cuda", [["TENSOR", [1, 128, 17, 17], "float32"], ["TENSOR", [192, 128, 1, 7], "float32"], [1, 1], [0, 3, 0, 3], [1, 1], "float32"], {}], "config": {"index": 52002, "code_hash": null, "entity": [["tile_f", "sp", [-1, 8, 3, 8]], ["tile_y", "sp", [-1, 1, 17, 1]], ["tile_x", "sp", [-1, 1, 17, 1]], ["tile_rc", "sp", [-1, 2]], ["tile_ry", "sp", [-1, 1]], ["tile_rx", "sp", [-1, 7]], ["auto_unroll_max_step", "ot", 0], ["unroll_explicit", "ot", 0]]}, "result": [[0.0017792808070175438, 0.0017793526842105262, 0.0017793858771929822], 0, 1.3755950927734375, 1679194064.0888374], "version": 0.2, "tvm_version": "0.10.0"}
{"input": ["cuda -keys=cuda,gpu -arch=sm_86 -max_num_threads=1024 -thread_warp_size=32", "conv2d_nchw.cuda", [["TENSOR", [1, 128, 17, 17], "float32"], ["TENSOR", [192, 128, 1, 7], "float32"], [1, 1], [0, 3, 0, 3], [1, 1], "float32"], {}], "config": {"index": 393656, "code_hash": null, "entity": [["tile_f", "sp", [-1, 3, 4, 4]], ["tile_y", "sp", [-1, 1, 1, 17]], ["tile_x", "sp", [-1, 1, 1, 1]], ["tile_rc", "sp", [-1, 2]], ["tile_ry", "sp", [-1, 1]], ["tile_rx", "sp", [-1, 7]], ["auto_unroll_max_step", "ot", 512], ["unroll_explicit", "ot", 1]]}, "result": [[0.0004576656216216216, 0.000458094722972973, 0.00048722679391891894], 0, 2.962639093399048, 1679194067.1645975], "version": 0.2, "tvm_version": "0.10.0"}
{"input": ["cuda -keys=cuda,gpu -arch=sm_86 -max_num_threads=1024 -thread_warp_size=32", "conv2d_nchw.cuda", [["TENSOR", [1, 128, 17, 17], "float32"], ["TENSOR", [192, 128, 1, 7], "float32"], [1, 1], [0, 3, 0, 3], [1, 1], "float32"], {}], "config": {"index": 93727, "code_hash": null, "entity": [["tile_f", "sp", [-1, 3, 2, 32]], ["tile_y", "sp", [-1, 1, 17, 1]], ["tile_x", "sp", [-1, 17, 1, 1]], ["tile_rc", "sp", [-1, 2]], ["tile_ry", "sp", [-1, 1]], ["tile_rx", "sp", [-1, 1]], ["auto_unroll_max_step", "ot", 512], ["unroll_explicit", "ot", 0]]}, "result": [[0.015510820571428571, 0.015511387285714287, 0.015511391714285713], 0, 1.5034432411193848, 1679194068.1678827], "version": 0.2, "tvm_version": "0.10.0"}
{"input": ["cuda -keys=cuda,gpu -arch=sm_86 -max_num_threads=1024 -thread_warp_size=32", "conv2d_nchw.cuda", [["TENSOR", [1, 128, 17, 17], "float32"], ["TENSOR", [192, 128, 1, 7], "float32"], [1, 1], [0, 3, 0, 3], [1, 1], "float32"], {}], "config": {"index": 46308, "code_hash": null, "entity": [["tile_f", "sp", [-1, 1, 2, 12]], ["tile_y", "sp", [-1, 17, 1, 1]], ["tile_x", "sp", [-1, 1, 17, 1]], ["tile_rc", "sp", [-1, 1]], ["tile_ry", "sp", [-1, 1]], ["tile_rx", "sp", [-1, 7]], ["auto_unroll_max_step", "ot", 0], ["unroll_explicit", "ot", 0]]}, "result": [[0.00046500255491329484, 0.00046501141907514447, 0.00046505582947976875], 0, 1.8838715553283691, 1679194069.4818053], "version": 0.2, "tvm_version": "0.10.0"}
{"input": ["cuda -keys=cuda,gpu -arch=sm_86 -max_num_threads=1024 -thread_warp_size=32", "conv2d_nchw.cuda", [["TENSOR", [1, 128, 17, 17], "float32"], ["TENSOR", [192, 128, 1, 7], "float32"], [1, 1], [0, 3, 0, 3], [1, 1], "float32"], {}], "config": {"index": 101, "code_hash": null, "entity": [["tile_f", "sp", [-1, 8, 2, 2]], ["tile_y", "sp", [-1, 1, 1, 1]], ["tile_x", "sp", [-1, 1, 1, 1]], ["tile_rc", "sp", [-1, 1]], ["tile_ry", "sp", [-1, 1]], ["tile_rx", "sp", [-1, 1]], ["auto_unroll_max_step", "ot", 0], ["unroll_explicit", "ot", 0]]}, "result": [[0.0013308362368421051, 0.0013317120131578948, 0.0013318307763157894], 0, 1.3294010162353516, 1679194070.403227], "version": 0.2, "tvm_version": "0.10.0"}
{"input": ["cuda -keys=cuda,gpu -arch=sm_86 -max_num_threads=1024 -thread_warp_size=32", "conv2d_nchw.cuda", [["TENSOR", [1, 128, 17, 17], "float32"], ["TENSOR", [192, 128, 1, 7], "float32"], [1, 1], [0, 3, 0, 3], [1, 1], "float32"], {}], "config": {"index": 319220, "code_hash": null, "entity": [["tile_f", "sp", [-1, 12, 2, 1]], ["tile_y", "sp", [-1, 1, 17, 1]], ["tile_x", "sp", [-1, 17, 1, 1]], ["tile_rc", "sp", [-1, 8]], ["tile_ry", "sp", [-1, 1]], ["tile_rx", "sp", [-1, 7]], ["auto_unroll_max_step", "ot", 0], ["unroll_explicit", "ot", 1]]}, "result": [[0.0002928865018315019, 0.0002928937124542125, 0.00029292400732600733], 0, 2.1241090297698975, 1679194071.6905205], "version": 0.2, "tvm_version": "0.10.0"}
{"input": ["cuda -keys=cuda,gpu -arch=sm_86 -max_num_threads=1024 -thread_warp_size=32", "conv2d_nchw.cuda", [["TENSOR", [1, 128, 17, 17], "float32"], ["TENSOR", [192, 128, 1, 7], "float32"], [1, 1], [0, 3, 0, 3], [1, 1], "float32"], {}], "config": {"index": 23903, "code_hash": null, "entity": [["tile_f", "sp", [-1, 16, 6, 1]], ["tile_y", "sp", [-1, 1, 1, 17]], ["tile_x", "sp", [-1, 17, 1, 1]], ["tile_rc", "sp", [-1, 16]], ["tile_ry", "sp", [-1, 1]], ["tile_rx", "sp", [-1, 1]], ["auto_unroll_max_step", "ot", 0], ["unroll_explicit", "ot", 0]]}, "result": [[0.031397888, 0.03139808825, 0.031398143749999996], 0, 2.7046194076538086, 1679194072.818931], "version": 0.2, "tvm_version": "0.10.0"}
{"input": ["cuda -keys=cuda,gpu -arch=sm_86 -max_num_threads=1024 -thread_warp_size=32", "conv2d_nchw.cuda", [["TENSOR", [1, 128, 17, 17], "float32"], ["TENSOR", [192, 128, 1, 7], "float32"], [1, 1], [0, 3, 0, 3], [1, 1], "float32"], {}], "config": {"index": 217263, "code_hash": null, "entity": [["tile_f", "sp", [-1, 8, 6, 4]], ["tile_y", "sp", [-1, 1, 17, 1]], ["tile_x", "sp", [-1, 17, 1, 1]], ["tile_rc", "sp", [-1, 1]], ["tile_ry", "sp", [-1, 1]], ["tile_rx", "sp", [-1, 7]], ["auto_unroll_max_step", "ot", 1500], ["unroll_explicit", "ot", 0]]}, "result": [[0.00508380165, 0.00508416175, 0.0050844158], 0, 1.8366336822509766, 1679194073.7537835], "version": 0.2, "tvm_version": "0.10.0"}
{"input": ["cuda -keys=cuda,gpu -arch=sm_86 -max_num_threads=1024 -thread_warp_size=32", "conv2d_nchw.cuda", [["TENSOR", [1, 128, 17, 17], "float32"], ["TENSOR", [192, 128, 1, 7], "float32"], [1, 1], [0, 3, 0, 3], [1, 1], "float32"], {}], "config": {"index": 455517, "code_hash": null, "entity": [["tile_f", "sp", [-1, 4, 8, 6]], ["tile_y", "sp", [-1, 1, 1, 17]], ["tile_x", "sp", [-1, 1, 17, 1]], ["tile_rc", "sp", [-1, 16]], ["tile_ry", "sp", [-1, 1]], ["tile_rx", "sp", [-1, 1]], ["auto_unroll_max_step", "ot", 1500], ["unroll_explicit", "ot", 1]]}, "result": [[0.0030873211818181817, 0.0030874219696969698, 0.003088259818181818], 0, 2.5487046241760254, 1679194074.6878562], "version": 0.2, "tvm_version": "0.10.0"}
{"input": ["cuda -keys=cuda,gpu -arch=sm_86 -max_num_threads=1024 -thread_warp_size=32", "conv2d_nchw.cuda", [["TENSOR", [1, 128, 17, 17], "float32"], ["TENSOR", [192, 128, 1, 7], "float32"], [1, 1], [0, 3, 0, 3], [1, 1], "float32"], {}], "config": {"index": 274255, "code_hash": null, "entity": [["tile_f", "sp", [-1, 1, 64, 1]], ["tile_y", "sp", [-1, 1, 1, 1]], ["tile_x", "sp", [-1, 1, 1, 1]], ["tile_rc", "sp", [-1, 8]], ["tile_ry", "sp", [-1, 1]], ["tile_rx", "sp", [-1, 1]], ["auto_unroll_max_step", "ot", 0], ["unroll_explicit", "ot", 1]]}, "result": [[0.000522256015625, 0.0005227466770833333, 0.000523344], 0, 1.2306857109069824, 1679194075.611852], "version": 0.2, "tvm_version": "0.10.0"}
{"input": ["cuda -keys=cuda,gpu -arch=sm_86 -max_num_threads=1024 -thread_warp_size=32", "conv2d_nchw.cuda", [["TENSOR", [1, 128, 17, 17], "float32"], ["TENSOR", [192, 128, 1, 7], "float32"], [1, 1], [0, 3, 0, 3], [1, 1], "float32"], {}], "config": {"index": 447200, "code_hash": null, "entity": [["tile_f", "sp", [-1, 1, 3, 32]], ["tile_y", "sp", [-1, 1, 17, 1]], ["tile_x", "sp", [-1, 1, 1, 1]], ["tile_rc", "sp", [-1, 8]], ["tile_ry", "sp", [-1, 1]], ["tile_rx", "sp", [-1, 1]], ["auto_unroll_max_step", "ot", 1500], ["unroll_explicit", "ot", 1]]}, "result": [[0.0001924155410628019, 0.00019242418357487921, 0.00019242418357487921], 0, 2.0119357109069824, 1679194076.9233093], "version": 0.2, "tvm_version": "0.10.0"}
{"input": ["cuda -keys=cuda,gpu -arch=sm_86 -max_num_threads=1024 -thread_warp_size=32", "conv2d_nchw.cuda", [["TENSOR", [1, 128, 17, 17], "float32"], ["TENSOR", [192, 128, 1, 7], "float32"], [1, 1], [0, 3, 0, 3], [1, 1], "float32"], {}], "config": {"index": 103347, "code_hash": null, "entity": [["tile_f", "sp", [-1, 4, 3, 4]], ["tile_y", "sp", [-1, 1, 1, 17]], ["tile_x", "sp", [-1, 1, 1, 1]], ["tile_rc", "sp", [-1, 8]], ["tile_ry", "sp", [-1, 1]], ["tile_rx", "sp", [-1, 1]], ["auto_unroll_max_step", "ot", 512], ["unroll_explicit", "ot", 0]]}, "result": [[0.0007232082688172043, 0.0007233345268817204, 0.0007241826989247311], 0, 2.1709206104278564, 1679194084.8802624], "version": 0.2, "tvm_version": "0.10.0"}
{"input": ["cuda -keys=cuda,gpu -arch=sm_86 -max_num_threads=1024 -thread_warp_size=32", "conv2d_nchw.cuda", [["TENSOR", [1, 128, 17, 17], "float32"], ["TENSOR", [192, 128, 1, 7], "float32"], [1, 1], [0, 3, 0, 3], [1, 1], "float32"], {}], "config": {"index": 113752, "code_hash": null, "entity": [["tile_f", "sp", [-1, 48, 1, 4]], ["tile_y", "sp", [-1, 1, 17, 1]], ["tile_x", "sp", [-1, 1, 1, 1]], ["tile_rc", "sp", [-1, 32]], ["tile_ry", "sp", [-1, 1]], ["tile_rx", "sp", [-1, 1]], ["auto_unroll_max_step", "ot", 512], ["unroll_explicit", "ot", 0]]}, "result": [[0.00246461187804878, 0.002464618195121951, 0.002464618195121951], 0, 2.3529183864593506, 1679194085.80383], "version": 0.2, "tvm_version": "0.10.0"}
{"input": ["cuda -keys=cuda,gpu -arch=sm_86 -max_num_threads=1024 -thread_warp_size=32", "conv2d_nchw.cuda", [["TENSOR", [1, 128, 17, 17], "float32"], ["TENSOR", [192, 128, 1, 7], "float32"], [1, 1], [0, 3, 0, 3], [1, 1], "float32"], {}], "config": {"index": 52859, "code_hash": null, "entity": [["tile_f", "sp", [-1, 2, 3, 2]], ["tile_y", "sp", [-1, 17, 1, 1]], ["tile_x", "sp", [-1, 1, 1, 17]], ["tile_rc", "sp", [-1, 2]], ["tile_ry", "sp", [-1, 1]], ["tile_rx", "sp", [-1, 7]], ["auto_unroll_max_step", "ot", 0], ["unroll_explicit", "ot", 0]]}, "result": [[0.0108725181, 0.0108726272, 0.0108737503], 0, 2.473008632659912, 1679194086.8026187], "version": 0.2, "tvm_version": "0.10.0"}
{"input": ["cuda -keys=cuda,gpu -arch=sm_86 -max_num_threads=1024 -thread_warp_size=32", "conv2d_nchw.cuda", [["TENSOR", [1, 128, 17, 17], "float32"], ["TENSOR", [192, 128, 1, 7], "float32"], [1, 1], [0, 3, 0, 3], [1, 1], "float32"], {}], "config": {"index": 377806, "code_hash": null, "entity": [["tile_f", "sp", [-1, 1, 32, 2]], ["tile_y", "sp", [-1, 1, 1, 1]], ["tile_x", "sp", [-1, 17, 1, 1]], ["tile_rc", "sp", [-1, 64]], ["tile_ry", "sp", [-1, 1]], ["tile_rx", "sp", [-1, 1]], ["auto_unroll_max_step", "ot", 512], ["unroll_explicit", "ot", 1]]}, "result": [[0.00010748307619047618, 0.00010749265646258502, 0.00010749283333333332], 0, 2.0475776195526123, 1679194088.1121569], "version": 0.2, "tvm_version": "0.10.0"}
{"input": ["cuda -keys=cuda,gpu -arch=sm_86 -max_num_threads=1024 -thread_warp_size=32", "conv2d_nchw.cuda", [["TENSOR", [1, 128, 17, 17], "float32"], ["TENSOR", [192, 128, 1, 7], "float32"], [1, 1], [0, 3, 0, 3], [1, 1], "float32"], {}], "config": {"index": 313696, "code_hash": null, "entity": [["tile_f", "sp", [-1, 1, 8, 4]], ["tile_y", "sp", [-1, 17, 1, 1]], ["tile_x", "sp", [-1, 17, 1, 1]], ["tile_rc", "sp", [-1, 4]], ["tile_ry", "sp", [-1, 1]], ["tile_rx", "sp", [-1, 7]], ["auto_unroll_max_step", "ot", 0], ["unroll_explicit", "ot", 1]]}, "result": [[0.09585505650000001, 0.0958561245, 0.09592985500000001], 0, 3.6433215141296387, 1679194089.579531], "version": 0.2, "tvm_version": "0.10.0"}
{"input": ["cuda -keys=cuda,gpu -arch=sm_86 -max_num_threads=1024 -thread_warp_size=32", "conv2d_nchw.cuda", [["TENSOR", [1, 128, 17, 17], "float32"], ["TENSOR", [192, 128, 1, 7], "float32"], [1, 1], [0, 3, 0, 3], [1, 1], "float32"], {}], "config": {"index": 232116, "code_hash": null, "entity": [["tile_f", "sp", [-1, 1, 2, 12]], ["tile_y", "sp", [-1, 1, 17, 1]], ["tile_x", "sp", [-1, 1, 1, 1]], ["tile_rc", "sp", [-1, 8]], ["tile_ry", "sp", [-1, 1]], ["tile_rx", "sp", [-1, 7]], ["auto_unroll_max_step", "ot", 1500], ["unroll_explicit", "ot", 0]]}, "result": [[7.389898814041745e-05, 7.389935768500949e-05, 7.389940085388994e-05], 0, 2.9081709384918213, 1679194090.8647265], "version": 0.2, "tvm_version": "0.10.0"}
{"input": ["cuda -keys=cuda,gpu -arch=sm_86 -max_num_threads=1024 -thread_warp_size=32", "conv2d_nchw.cuda", [["TENSOR", [1, 128, 17, 17], "float32"], ["TENSOR", [192, 128, 1, 7], "float32"], [1, 1], [0, 3, 0, 3], [1, 1], "float32"], {}], "config": {"index": 497300, "code_hash": null, "entity": [["tile_f", "sp", [-1, 12, 2, 1]], ["tile_y", "sp", [-1, 1, 1, 1]], ["tile_x", "sp", [-1, 1, 17, 1]], ["tile_rc", "sp", [-1, 16]], ["tile_ry", "sp", [-1, 1]], ["tile_rx", "sp", [-1, 7]], ["auto_unroll_max_step", "ot", 1500], ["unroll_explicit", "ot", 1]]}, "result": [[5.9366705391040243e-05, 5.9367116552771445e-05, 5.936828701594533e-05], 0, 6.2351672649383545, 1679194092.1584759], "version": 0.2, "tvm_version": "0.10.0"}
{"input": ["cuda -keys=cuda,gpu -arch=sm_86 -max_num_threads=1024 -thread_warp_size=32", "conv2d_nchw.cuda", [["TENSOR", [1, 128, 17, 17], "float32"], ["TENSOR", [192, 128, 1, 7], "float32"], [1, 1], [0, 3, 0, 3], [1, 1], "float32"], {}], "config": {"index": 172690, "code_hash": null, "entity": [["tile_f", "sp", [-1, 1, 6, 32]], ["tile_y", "sp", [-1, 17, 1, 1]], ["tile_x", "sp", [-1, 1, 1, 1]], ["tile_rc", "sp", [-1, 1]], ["tile_ry", "sp", [-1, 1]], ["tile_rx", "sp", [-1, 1]], ["auto_unroll_max_step", "ot", 1500], ["unroll_explicit", "ot", 0]]}, "result": [[0.003966997236842105, 0.003967380315789473, 0.003994165921052632], 0, 2.2810566425323486, 1679194093.4334779], "version": 0.2, "tvm_version": "0.10.0"}
{"input": ["cuda -keys=cuda,gpu -arch=sm_86 -max_num_threads=1024 -thread_warp_size=32", "conv2d_nchw.cuda", [["TENSOR", [1, 128, 17, 17], "float32"], ["TENSOR", [192, 128, 1, 7], "float32"], [1, 1], [0, 3, 0, 3], [1, 1], "float32"], {}], "config": {"index": 286526, "code_hash": null, "entity": [["tile_f", "sp", [-1, 12, 2, 8]], ["tile_y", "sp", [-1, 1, 1, 1]], ["tile_x", "sp", [-1, 17, 1, 1]], ["tile_rc", "sp", [-1, 32]], ["tile_ry", "sp", [-1, 1]], ["tile_rx", "sp", [-1, 1]], ["auto_unroll_max_step", "ot", 0], ["unroll_explicit", "ot", 1]]}, "result": [[0.0105122589, 0.0105142272, 0.010514329499999999], 0, 2.244293212890625, 1679194094.4319818], "version": 0.2, "tvm_version": "0.10.0"}
{"input": ["cuda -keys=cuda,gpu -arch=sm_86 -max_num_threads=1024 -thread_warp_size=32", "conv2d_nchw.cuda", [["TENSOR", [1, 128, 17, 17], "float32"], ["TENSOR", [192, 128, 1, 7], "float32"], [1, 1], [0, 3, 0, 3], [1, 1], "float32"], {}], "config": {"index": 186498, "code_hash": null, "entity": [["tile_f", "sp", [-1, 6, 2, 1]], ["tile_y", "sp", [-1, 1, 1, 17]], ["tile_x", "sp", [-1, 1, 17, 1]], ["tile_rc", "sp", [-1, 4]], ["tile_ry", "sp", [-1, 1]], ["tile_rx", "sp", [-1, 1]], ["auto_unroll_max_step", "ot", 1500], ["unroll_explicit", "ot", 0]]}, "result": [[0.00011426761038961039, 0.00011426834776334777, 0.00011426983405483407], 0, 2.2244367599487305, 1679194095.7359126], "version": 0.2, "tvm_version": "0.10.0"}
{"input": ["cuda -keys=cuda,gpu -arch=sm_86 -max_num_threads=1024 -thread_warp_size=32", "conv2d_nchw.cuda", [["TENSOR", [1, 128, 17, 17], "float32"], ["TENSOR", [192, 128, 1, 7], "float32"], [1, 1], [0, 3, 0, 3], [1, 1], "float32"], {}], "config": {"index": 365280, "code_hash": null, "entity": [["tile_f", "sp", [-1, 32, 6, 1]], ["tile_y", "sp", [-1, 1, 1, 17]], ["tile_x", "sp", [-1, 1, 1, 17]], ["tile_rc", "sp", [-1, 8]], ["tile_ry", "sp", [-1, 1]], ["tile_rx", "sp", [-1, 1]], ["auto_unroll_max_step", "ot", 512], ["unroll_explicit", "ot", 1]]}, "result": [[0.15425843800000003, 0.154277893, 0.1542835235], 0, 8.656037092208862, 1679194097.8492734], "version": 0.2, "tvm_version": "0.10.0"}
{"input": ["cuda -keys=cuda,gpu -arch=sm_86 -max_num_threads=1024 -thread_warp_size=32", "conv2d_nchw.cuda", [["TENSOR", [1, 128, 17, 17], "float32"], ["TENSOR", [192, 128, 1, 7], "float32"], [1, 1], [0, 3, 0, 3], [1, 1], "float32"], {}], "config": {"index": 264941, "code_hash": null, "entity": [["tile_f", "sp", [-1, 2, 32, 3]], ["tile_y", "sp", [-1, 1, 1, 1]], ["tile_x", "sp", [-1, 17, 1, 1]], ["tile_rc", "sp", [-1, 2]], ["tile_ry", "sp", [-1, 1]], ["tile_rx", "sp", [-1, 1]], ["auto_unroll_max_step", "ot", 0], ["unroll_explicit", "ot", 1]]}, "result": [[0.000275134029209622, 0.00027513929896907214, 0.00027514105670103093], 0, 1.7488787174224854, 1679194099.1671796], "version": 0.2, "tvm_version": "0.10.0"}
{"input": ["cuda -keys=cuda,gpu -arch=sm_86 -max_num_threads=1024 -thread_warp_size=32", "conv2d_nchw.cuda", [["TENSOR", [1, 128, 17, 17], "float32"], ["TENSOR", [192, 128, 1, 7], "float32"], [1, 1], [0, 3, 0, 3], [1, 1], "float32"], {}], "config": {"index": 404923, "code_hash": null, "entity": [["tile_f", "sp", [-1, 1, 6, 1]], ["tile_y", "sp", [-1, 17, 1, 1]], ["tile_x", "sp", [-1, 17, 1, 1]], ["tile_rc", "sp", [-1, 8]], ["tile_ry", "sp", [-1, 1]], ["tile_rx", "sp", [-1, 7]], ["auto_unroll_max_step", "ot", 512], ["unroll_explicit", "ot", 1]]}, "result": [[0.0015789373908045973, 0.0015791257586206895, 0.0015791492643678162], 0, 2.883664608001709, 1679194104.879398], "version": 0.2, "tvm_version": "0.10.0"}
{"input": ["cuda -keys=cuda,gpu -arch=sm_86 -max_num_threads=1024 -thread_warp_size=32", "conv2d_nchw.cuda", [["TENSOR", [1, 128, 17, 17], "float32"], ["TENSOR", [192, 128, 1, 7], "float32"], [1, 1], [0, 3, 0, 3], [1, 1], "float32"], {}], "config": {"index": 316807, "code_hash": null, "entity": [["tile_f", "sp", [-1, 6, 2, 16]], ["tile_y", "sp", [-1, 1, 17, 1]], ["tile_x", "sp", [-1, 1, 1, 17]], ["tile_rc", "sp", [-1, 4]], ["tile_ry", "sp", [-1, 1]], ["tile_rx", "sp", [-1, 7]], ["auto_unroll_max_step", "ot", 0], ["unroll_explicit", "ot", 1]]}, "result": [[0.010720256000000001, 0.010735923, 0.0107366401], 0, 1.7403550148010254, 1679194105.8623776], "version": 0.2, "tvm_version": "0.10.0"}
{"input": ["cuda -keys=cuda,gpu -arch=sm_86 -max_num_threads=1024 -thread_warp_size=32", "conv2d_nchw.cuda", [["TENSOR", [1, 128, 17, 17], "float32"], ["TENSOR", [192, 128, 1, 7], "float32"], [1, 1], [0, 3, 0, 3], [1, 1], "float32"], {}], "config": {"index": 349559, "code_hash": null, "entity": [["tile_f", "sp", [-1, 24, 4, 2]], ["tile_y", "sp", [-1, 1, 1, 1]], ["tile_x", "sp", [-1, 1, 1, 1]], ["tile_rc", "sp", [-1, 2]], ["tile_ry", "sp", [-1, 1]], ["tile_rx", "sp", [-1, 1]], ["auto_unroll_max_step", "ot", 512], ["unroll_explicit", "ot", 1]]}, "result": [[0.0008742436182795698, 0.0008743253279569893, 0.0008743308279569892], 0, 2.049511671066284, 1679194107.193271], "version": 0.2, "tvm_version": "0.10.0"}
{"input": ["cuda -keys=cuda,gpu -arch=sm_86 -max_num_threads=1024 -thread_warp_size=32", "conv2d_nchw.cuda", [["TENSOR", [1, 128, 17, 17], "float32"], ["TENSOR", [192, 128, 1, 7], "float32"], [1, 1], [0, 3, 0, 3], [1, 1], "float32"], {}], "config": {"index": 443062, "code_hash": null, "entity": [["tile_f", "sp", [-1, 4, 12, 4]], ["tile_y", "sp", [-1, 1, 17, 1]], ["tile_x", "sp", [-1, 17, 1, 1]], ["tile_rc", "sp", [-1, 4]], ["tile_ry", "sp", [-1, 1]], ["tile_rx", "sp", [-1, 1]], ["auto_unroll_max_step", "ot", 1500], ["unroll_explicit", "ot", 1]]}, "result": [[0.002057278673469388, 0.002057299551020408, 0.0020573185510204084], 0, 3.063965320587158, 1679194108.1146615], "version": 0.2, "tvm_version": "0.10.0"}
{"input": ["cuda -keys=cuda,gpu -arch=sm_86 -max_num_threads=1024 -thread_warp_size=32", "conv2d_nchw.cuda", [["TENSOR", [1, 128, 17, 17], "float32"], ["TENSOR", [192, 128, 1, 7], "float32"], [1, 1], [0, 3, 0, 3], [1, 1], "float32"], {}], "config": {"index": 131767, "code_hash": null, "entity": [["tile_f", "sp", [-1, 12, 8, 1]], ["tile_y", "sp", [-1, 1, 1, 1]], ["tile_x", "sp", [-1, 1, 17, 1]], ["tile_rc", "sp", [-1, 1]], ["tile_ry", "sp", [-1, 1]], ["tile_rx", "sp", [-1, 7]], ["auto_unroll_max_step", "ot", 512], ["unroll_explicit", "ot", 0]]}, "result": [[0.00012676201681345077, 0.00012676283586869494, 0.00012676365412329864], 0, 1.649383544921875, 1679194109.4143944], "version": 0.2, "tvm_version": "0.10.0"}
{"input": ["cuda -keys=cuda,gpu -arch=sm_86 -max_num_threads=1024 -thread_warp_size=32", "conv2d_nchw.cuda", [["TENSOR", [1, 128, 17, 17], "float32"], ["TENSOR", [192, 128, 1, 7], "float32"], [1, 1], [0, 3, 0, 3], [1, 1], "float32"], {}], "config": {"index": 91231, "code_hash": null, "entity": [["tile_f", "sp", [-1, 1, 1, 4]], ["tile_y", "sp", [-1, 1, 1, 17]], ["tile_x", "sp", [-1, 1, 1, 17]], ["tile_rc", "sp", [-1, 1]], ["tile_ry", "sp", [-1, 1]], ["tile_rx", "sp", [-1, 1]], ["auto_unroll_max_step", "ot", 512], ["unroll_explicit", "ot", 0]]}, "result": [[0.044047358, 0.044305740333333336, 0.044330317], 0, 3.6310296058654785, 1679194110.635382], "version": 0.2, "tvm_version": "0.10.0"}
{"input": ["cuda -keys=cuda,gpu -arch=sm_86 -max_num_threads=1024 -thread_warp_size=32", "conv2d_nchw.cuda", [["TENSOR", [1, 128, 17, 17], "float32"], ["TENSOR", [192, 128, 1, 7], "float32"], [1, 1], [0, 3, 0, 3], [1, 1], "float32"], {}], "config": {"index": 65949, "code_hash": null, "entity": [["tile_f", "sp", [-1, 32, 1, 2]], ["tile_y", "sp", [-1, 1, 1, 1]], ["tile_x", "sp", [-1, 17, 1, 1]], ["tile_rc", "sp", [-1, 16]], ["tile_ry", "sp", [-1, 1]], ["tile_rx", "sp", [-1, 7]], ["auto_unroll_max_step", "ot", 0], ["unroll_explicit", "ot", 0]]}, "result": [[0.04300185633333334, 0.04305510433333334, 0.04421051533333333], 0, 2.3500683307647705, 1679194111.8345175], "version": 0.2, "tvm_version": "0.10.0"}
{"input": ["cuda -keys=cuda,gpu -arch=sm_86 -max_num_threads=1024 -thread_warp_size=32", "conv2d_nchw.cuda", [["TENSOR", [1, 128, 17, 17], "float32"], ["TENSOR", [192, 128, 1, 7], "float32"], [1, 1], [0, 3, 0, 3], [1, 1], "float32"], {}], "config": {"index": 391514, "code_hash": null, "entity": [["tile_f", "sp", [-1, 3, 32, 1]], ["tile_y", "sp", [-1, 17, 1, 1]], ["tile_x", "sp", [-1, 1, 1, 17]], ["tile_rc", "sp", [-1, 1]], ["tile_ry", "sp", [-1, 1]], ["tile_rx", "sp", [-1, 7]], ["auto_unroll_max_step", "ot", 512], ["unroll_explicit", "ot", 1]]}, "result": [[0.005844250555555556, 0.005844650666666666, 0.005844707444444445], 0, 1.4728126525878906, 1679194112.789428], "version": 0.2, "tvm_version": "0.10.0"}
{"input": ["cuda -keys=cuda,gpu -arch=sm_86 -max_num_threads=1024 -thread_warp_size=32", "conv2d_nchw.cuda", [["TENSOR", [1, 128, 17, 17], "float32"], ["TENSOR", [192, 128, 1, 7], "float32"], [1, 1], [0, 3, 0, 3], [1, 1], "float32"], {}], "config": {"index": 361498, "code_hash": null, "entity": [["tile_f", "sp", [-1, 4, 3, 16]], ["tile_y", "sp", [-1, 1, 1, 17]], ["tile_x", "sp", [-1, 1, 1, 1]], ["tile_rc", "sp", [-1, 8]], ["tile_ry", "sp", [-1, 1]], ["tile_rx", "sp", [-1, 1]], ["auto_unroll_max_step", "ot", 512], ["unroll_explicit", "ot", 1]]}, "result": [[0.007028394533333333, 0.007029555199999999, 0.007029555199999999], 0, 3.2134244441986084, 1679194113.752758], "version": 0.2, "tvm_version": "0.10.0"}
{"input": ["cuda -keys=cuda,gpu -arch=sm_86 -max_num_threads=1024 -thread_warp_size=32", "conv2d_nchw.cuda", [["TENSOR", [1, 128, 17, 17], "float32"], ["TENSOR", [192, 128, 1, 7], "float32"], [1, 1], [0, 3, 0, 3], [1, 1], "float32"], {}], "config": {"index": 387429, "code_hash": null, "entity": [["tile_f", "sp", [-1, 16, 2, 1]], ["tile_y", "sp", [-1, 17, 1, 1]], ["tile_x", "sp", [-1, 1, 1, 1]], ["tile_rc", "sp", [-1, 1]], ["tile_ry", "sp", [-1, 1]], ["tile_rx", "sp", [-1, 7]], ["auto_unroll_max_step", "ot", 512], ["unroll_explicit", "ot", 1]]}, "result": [[0.0009542217428571428, 0.0009542217428571428, 0.0009542314761904762], 0, 2.406046152114868, 1679194114.665067], "version": 0.2, "tvm_version": "0.10.0"}
{"input": ["cuda -keys=cuda,gpu -arch=sm_86 -max_num_threads=1024 -thread_warp_size=32", "conv2d_nchw.cuda", [["TENSOR", [1, 128, 17, 17], "float32"], ["TENSOR", [192, 128, 1, 7], "float32"], [1, 1], [0, 3, 0, 3], [1, 1], "float32"], {}], "config": {"index": 49215, "code_hash": null, "entity": [["tile_f", "sp", [-1, 32, 2, 3]], ["tile_y", "sp", [-1, 1, 17, 1]], ["tile_x", "sp", [-1, 1, 1, 1]], ["tile_rc", "sp", [-1, 2]], ["tile_ry", "sp", [-1, 1]], ["tile_rx", "sp", [-1, 7]], ["auto_unroll_max_step", "ot", 0], ["unroll_explicit", "ot", 0]]}, "result": [[0.0012476286124031006, 0.0012477796666666666, 0.0012477956356589147], 0, 1.9980418682098389, 1679194115.9805243], "version": 0.2, "tvm_version": "0.10.0"}
{"input": ["cuda -keys=cuda,gpu -arch=sm_86 -max_num_threads=1024 -thread_warp_size=32", "conv2d_nchw.cuda", [["TENSOR", [1, 128, 17, 17], "float32"], ["TENSOR", [192, 128, 1, 7], "float32"], [1, 1], [0, 3, 0, 3], [1, 1], "float32"], {}], "config": {"index": 487045, "code_hash": null, "entity": [["tile_f", "sp", [-1, 12, 1, 4]], ["tile_y", "sp", [-1, 17, 1, 1]], ["tile_x", "sp", [-1, 1, 17, 1]], ["tile_rc", "sp", [-1, 4]], ["tile_ry", "sp", [-1, 1]], ["tile_rx", "sp", [-1, 7]], ["auto_unroll_max_step", "ot", 1500], ["unroll_explicit", "ot", 1]]}, "result": [[0.008270217846153846, 0.008271005461538462, 0.008271477846153846], 0, 5.30926775932312, 1679194116.9471605], "version": 0.2, "tvm_version": "0.10.0"}
{"input": ["cuda -keys=cuda,gpu -arch=sm_86 -max_num_threads=1024 -thread_warp_size=32", "conv2d_nchw.cuda", [["TENSOR", [1, 128, 17, 17], "float32"], ["TENSOR", [192, 128, 1, 7], "float32"], [1, 1], [0, 3, 0, 3], [1, 1], "float32"], {}], "config": {"index": 316457, "code_hash": null, "entity": [["tile_f", "sp", [-1, 2, 4, 12]], ["tile_y", "sp", [-1, 17, 1, 1]], ["tile_x", "sp", [-1, 1, 1, 17]], ["tile_rc", "sp", [-1, 4]], ["tile_ry", "sp", [-1, 1]], ["tile_rx", "sp", [-1, 7]], ["auto_unroll_max_step", "ot", 0], ["unroll_explicit", "ot", 1]]}, "result": [[0.05312614399999999, 0.0532034415, 0.0532045745], 0, 2.309567451477051, 1679194128.1014955], "version": 0.2, "tvm_version": "0.10.0"}
{"input": ["cuda -keys=cuda,gpu -arch=sm_86 -max_num_threads=1024 -thread_warp_size=32", "conv2d_nchw.cuda", [["TENSOR", [1, 128, 17, 17], "float32"], ["TENSOR", [192, 128, 1, 7], "float32"], [1, 1], [0, 3, 0, 3], [1, 1], "float32"], {}], "config": {"index": 137676, "code_hash": null, "entity": [["tile_f", "sp", [-1, 4, 2, 8]], ["tile_y", "sp", [-1, 17, 1, 1]], ["tile_x", "sp", [-1, 1, 17, 1]], ["tile_rc", "sp", [-1, 2]], ["tile_ry", "sp", [-1, 1]], ["tile_rx", "sp", [-1, 7]], ["auto_unroll_max_step", "ot", 512], ["unroll_explicit", "ot", 0]]}, "result": [[0.004904423666666667, 0.004904667428571429, 0.00490842219047619], 0, 1.7623467445373535, 1679194129.0518348], "version": 0.2, "tvm_version": "0.10.0"}
{"input": ["cuda -keys=cuda,gpu -arch=sm_86 -max_num_threads=1024 -thread_warp_size=32", "conv2d_nchw.cuda", [["TENSOR", [1, 128, 17, 17], "float32"], ["TENSOR", [192, 128, 1, 7], "float32"], [1, 1], [0, 3, 0, 3], [1, 1], "float32"], {}], "config": {"index": 48310, "code_hash": null, "entity": [["tile_f", "sp", [-1, 6, 4, 8]], ["tile_y", "sp", [-1, 1, 1, 17]], ["tile_x", "sp", [-1, 1, 1, 17]], ["tile_rc", "sp", [-1, 1]], ["tile_ry", "sp", [-1, 1]], ["tile_rx", "sp", [-1, 7]], ["auto_unroll_max_step", "ot", 0], ["unroll_explicit", "ot", 0]]}, "result": [[0.0789754865, 0.0789944305, 0.0789949415], 0, 2.1339049339294434, 1679194130.3107097], "version": 0.2, "tvm_version": "0.10.0"}
{"input": ["cuda -keys=cuda,gpu -arch=sm_86 -max_num_threads=1024 -thread_warp_size=32", "conv2d_nchw.cuda", [["TENSOR", [1, 128, 17, 17], "float32"], ["TENSOR", [192, 128, 1, 7], "float32"], [1, 1], [0, 3, 0, 3], [1, 1], "float32"], {}], "config": {"index": 460052, "code_hash": null, "entity": [["tile_f", "sp", [-1, 1, 24, 1]], ["tile_y", "sp", [-1, 17, 1, 1]], ["tile_x", "sp", [-1, 1, 17, 1]], ["tile_rc", "sp", [-1, 32]], ["tile_ry", "sp", [-1, 1]], ["tile_rx", "sp", [-1, 1]], ["auto_unroll_max_step", "ot", 1500], ["unroll_explicit", "ot", 1]]}, "result": [[0.0003573281113585746, 0.0003573281113585746, 0.00035734636080178177], 0, 2.7410695552825928, 1679194131.632657], "version": 0.2, "tvm_version": "0.10.0"}
{"input": ["cuda -keys=cuda,gpu -arch=sm_86 -max_num_threads=1024 -thread_warp_size=32", "conv2d_nchw.cuda", [["TENSOR", [1, 128, 17, 17], "float32"], ["TENSOR", [192, 128, 1, 7], "float32"], [1, 1], [0, 3, 0, 3], [1, 1], "float32"], {}], "config": {"index": 224306, "code_hash": null, "entity": [["tile_f", "sp", [-1, 2, 3, 4]], ["tile_y", "sp", [-1, 1, 1, 17]], ["tile_x", "sp", [-1, 1, 17, 1]], ["tile_rc", "sp", [-1, 2]], ["tile_ry", "sp", [-1, 1]], ["tile_rx", "sp", [-1, 7]], ["auto_unroll_max_step", "ot", 1500], ["unroll_explicit", "ot", 0]]}, "result": [[0.0002510423642072214, 0.00025106646153846157, 0.00025107129984301414], 0, 1.972733974456787, 1679194132.9488218], "version": 0.2, "tvm_version": "0.10.0"}
{"input": ["cuda -keys=cuda,gpu -arch=sm_86 -max_num_threads=1024 -thread_warp_size=32", "conv2d_nchw.cuda", [["TENSOR", [1, 128, 17, 17], "float32"], ["TENSOR", [192, 128, 1, 7], "float32"], [1, 1], [0, 3, 0, 3], [1, 1], "float32"], {}], "config": {"index": 194806, "code_hash": null, "entity": [["tile_f", "sp", [-1, 6, 4, 8]], ["tile_y", "sp", [-1, 1, 1, 17]], ["tile_x", "sp", [-1, 1, 1, 1]], ["tile_rc", "sp", [-1, 16]], ["tile_ry", "sp", [-1, 1]], ["tile_rx", "sp", [-1, 1]], ["auto_unroll_max_step", "ot", 1500], ["unroll_explicit", "ot", 0]]}, "result": [[0.006898415066666666, 0.0068985514, 0.0068987564], 0, 3.7756187915802, 1679194133.8964133], "version": 0.2, "tvm_version": "0.10.0"}
{"input": ["cuda -keys=cuda,gpu -arch=sm_86 -max_num_threads=1024 -thread_warp_size=32", "conv2d_nchw.cuda", [["TENSOR", [1, 128, 17, 17], "float32"], ["TENSOR", [192, 128, 1, 7], "float32"], [1, 1], [0, 3, 0, 3], [1, 1], "float32"], {}], "config": {"index": 446685, "code_hash": null, "entity": [["tile_f", "sp", [-1, 4, 24, 2]], ["tile_y", "sp", [-1, 17, 1, 1]], ["tile_x", "sp", [-1, 1, 1, 1]], ["tile_rc", "sp", [-1, 8]], ["tile_ry", "sp", [-1, 1]], ["tile_rx", "sp", [-1, 1]], ["auto_unroll_max_step", "ot", 1500], ["unroll_explicit", "ot", 1]]}, "result": [[0.0003142857260273973, 0.0003142898454011742, 0.00031430788258317023], 0, 3.013782024383545, 1679194135.2184987], "version": 0.2, "tvm_version": "0.10.0"}
{"input": ["cuda -keys=cuda,gpu -arch=sm_86 -max_num_threads=1024 -thread_warp_size=32", "conv2d_nchw.cuda", [["TENSOR", [1, 128, 17, 17], "float32"], ["TENSOR", [192, 128, 1, 7], "float32"], [1, 1], [0, 3, 0, 3], [1, 1], "float32"], {}], "config": {"index": 10421, "code_hash": null, "entity": [["tile_f", "sp", [-1, 8, 1, 1]], ["tile_y", "sp", [-1, 1, 1, 17]], ["tile_x", "sp", [-1, 1, 1, 17]], ["tile_rc", "sp", [-1, 2]], ["tile_ry", "sp", [-1, 1]], ["tile_rx", "sp", [-1, 1]], ["auto_unroll_max_step", "ot", 0], ["unroll_explicit", "ot", 0]]}, "result": [[0.063821823, 0.06428825349999999, 0.064637329], 0, 2.277113676071167, 1679194136.3392231], "version": 0.2, "tvm_version": "0.10.0"}
{"input": ["cuda -keys=cuda,gpu -arch=sm_86 -max_num_threads=1024 -thread_warp_size=32", "conv2d_nchw.cuda", [["TENSOR", [1, 128, 17, 17], "float32"], ["TENSOR", [192, 128, 1, 7], "float32"], [1, 1], [0, 3, 0, 3], [1, 1], "float32"], {}], "config": {"index": 356552, "code_hash": null, "entity": [["tile_f", "sp", [-1, 24, 8, 1]], ["tile_y", "sp", [-1, 17, 1, 1]], ["tile_x", "sp", [-1, 17, 1, 1]], ["tile_rc", "sp", [-1, 4]], ["tile_ry", "sp", [-1, 1]], ["tile_rx", "sp", [-1, 1]], ["auto_unroll_max_step", "ot", 512], ["unroll_explicit", "ot", 1]]}, "result": [[0.039526741, 0.03955473066666667, 0.039566678333333334], 0, 10.604249238967896, 1679194137.4702675], "version": 0.2, "tvm_version": "0.10.0"}
{"input": ["cuda -keys=cuda,gpu -arch=sm_86 -max_num_threads=1024 -thread_warp_size=32", "conv2d_nchw.cuda", [["TENSOR", [1, 128, 17, 17], "float32"], ["TENSOR", [192, 128, 1, 7], "float32"], [1, 1], [0, 3, 0, 3], [1, 1], "float32"], {}], "config": {"index": 73982, "code_hash": null, "entity": [["tile_f", "sp", [-1, 1, 16, 1]], ["tile_y", "sp", [-1, 1, 1, 1]], ["tile_x", "sp", [-1, 1, 1, 17]], ["tile_rc", "sp", [-1, 32]], ["tile_ry", "sp", [-1, 1]], ["tile_rx", "sp", [-1, 7]], ["auto_unroll_max_step", "ot", 0], ["unroll_explicit", "ot", 0]]}, "result": [[6.774790941073e-05, 6.775061345646439e-05, 6.775106288478453e-05], 0, 1.6204290390014648, 1679194138.7583175], "version": 0.2, "tvm_version": "0.10.0"}
{"input": ["cuda -keys=cuda,gpu -arch=sm_86 -max_num_threads=1024 -thread_warp_size=32", "conv2d_nchw.cuda", [["TENSOR", [1, 128, 17, 17], "float32"], ["TENSOR", [192, 128, 1, 7], "float32"], [1, 1], [0, 3, 0, 3], [1, 1], "float32"], {}], "config": {"index": 488894, "code_hash": null, "entity": [["tile_f", "sp", [-1, 1, 2, 1]], ["tile_y", "sp", [-1, 1, 1, 17]], ["tile_x", "sp", [-1, 1, 1, 17]], ["tile_rc", "sp", [-1, 4]], ["tile_ry", "sp", [-1, 1]], ["tile_rx", "sp", [-1, 7]], ["auto_unroll_max_step", "ot", 1500], ["unroll_explicit", "ot", 1]]}, "result": [[0.0008851785935483872, 0.0008852116709677419, 0.0008854164322580645], 0, 4.457752704620361, 1679194149.017435], "version": 0.2, "tvm_version": "0.10.0"}
{"input": ["cuda -keys=cuda,gpu -arch=sm_86 -max_num_threads=1024 -thread_warp_size=32", "conv2d_nchw.cuda", [["TENSOR", [1, 128, 17, 17], "float32"], ["TENSOR", [192, 128, 1, 7], "float32"], [1, 1], [0, 3, 0, 3], [1, 1], "float32"], {}], "config": {"index": 474476, "code_hash": null, "entity": [["tile_f", "sp", [-1, 2, 6, 1]], ["tile_y", "sp", [-1, 1, 1, 1]], ["tile_x", "sp", [-1, 17, 1, 1]], ["tile_rc", "sp", [-1, 1]], ["tile_ry", "sp", [-1, 1]], ["tile_rx", "sp", [-1, 7]], ["auto_unroll_max_step", "ot", 1500], ["unroll_explicit", "ot", 1]]}, "result": [[5.875711384845092e-05, 5.8758640537514e-05, 5.8759346771183286e-05], 0, 1.624223232269287, 1679194150.3112645], "version": 0.2, "tvm_version": "0.10.0"}
{"input": ["cuda -keys=cuda,gpu -arch=sm_86 -max_num_threads=1024 -thread_warp_size=32", "conv2d_nchw.cuda", [["TENSOR", [1, 128, 17, 17], "float32"], ["TENSOR", [192, 128, 1, 7], "float32"], [1, 1], [0, 3, 0, 3], [1, 1], "float32"], {}], "config": {"index": 271554, "code_hash": null, "entity": [["tile_f", "sp", [-1, 6, 16, 1]], ["tile_y", "sp", [-1, 1, 1, 1]], ["tile_x", "sp", [-1, 1, 17, 1]], ["tile_rc", "sp", [-1, 4]], ["tile_ry", "sp", [-1, 1]], ["tile_rx", "sp", [-1, 1]], ["auto_unroll_max_step", "ot", 0], ["unroll_explicit", "ot", 1]]}, "result": [[9.835725501253135e-05, 9.835789598997493e-05, 9.835853634085212e-05], 0, 1.500868558883667, 1679194151.6063795], "version": 0.2, "tvm_version": "0.10.0"}
{"input": ["cuda -keys=cuda,gpu -arch=sm_86 -max_num_threads=1024 -thread_warp_size=32", "conv2d_nchw.cuda", [["TENSOR", [1, 128, 17, 17], "float32"], ["TENSOR", [192, 128, 1, 7], "float32"], [1, 1], [0, 3, 0, 3], [1, 1], "float32"], {}], "config": {"index": 237925, "code_hash": null, "entity": [["tile_f", "sp", [-1, 6, 4, 1]], ["tile_y", "sp", [-1, 1, 1, 1]], ["tile_x", "sp", [-1, 17, 1, 1]], ["tile_rc", "sp", [-1, 16]], ["tile_ry", "sp", [-1, 1]], ["tile_rx", "sp", [-1, 7]], ["auto_unroll_max_step", "ot", 1500], ["unroll_explicit", "ot", 0]]}, "result": [[0.00010300999545749514, 0.00010300999545749514, 0.00010301459961064243], 0, 3.0408618450164795, 1679194152.9212575], "version": 0.2, "tvm_version": "0.10.0"}
{"input": ["cuda -keys=cuda,gpu -arch=sm_86 -max_num_threads=1024 -thread_warp_size=32", "conv2d_nchw.cuda", [["TENSOR", [1, 128, 17, 17], "float32"], ["TENSOR", [192, 128, 1, 7], "float32"], [1, 1], [0, 3, 0, 3], [1, 1], "float32"], {}], "config": {"index": 160241, "code_hash": null, "entity": [["tile_f", "sp", [-1, 2, 1, 24]], ["tile_y", "sp", [-1, 1, 1, 1]], ["tile_x", "sp", [-1, 1, 1, 17]], ["tile_rc", "sp", [-1, 32]], ["tile_ry", "sp", [-1, 1]], ["tile_rx", "sp", [-1, 7]], ["auto_unroll_max_step", "ot", 512], ["unroll_explicit", "ot", 0]]}, "result": [[0.037938517, 0.03808460733333333, 0.038919850666666665], 0, 1.3762686252593994, 1679194164.256931], "version": 0.2, "tvm_version": "0.10.0"}
{"input": ["cuda -keys=cuda,gpu -arch=sm_86 -max_num_threads=1024 -thread_warp_size=32", "conv2d_nchw.cuda", [["TENSOR", [1, 128, 17, 17], "float32"], ["TENSOR", [192, 128, 1, 7], "float32"], [1, 1], [0, 3, 0, 3], [1, 1], "float32"], {}], "config": {"index": 189082, "code_hash": null, "entity": [["tile_f", "sp", [-1, 2, 2, 8]], ["tile_y", "sp", [-1, 1, 17, 1]], ["tile_x", "sp", [-1, 1, 1, 1]], ["tile_rc", "sp", [-1, 8]], ["tile_ry", "sp", [-1, 1]], ["tile_rx", "sp", [-1, 1]], ["auto_unroll_max_step", "ot", 1500], ["unroll_explicit", "ot", 0]]}, "result": [[7.407199331476322e-05, 7.428078774373259e-05, 7.648966573816156e-05], 0, 2.147273540496826, 1679194174.3292031], "version": 0.2, "tvm_version": "0.10.0"}
{"input": ["cuda -keys=cuda,gpu -arch=sm_86 -max_num_threads=1024 -thread_warp_size=32", "conv2d_nchw.cuda", [["TENSOR", [1, 128, 17, 17], "float32"], ["TENSOR", [192, 128, 1, 7], "float32"], [1, 1], [0, 3, 0, 3], [1, 1], "float32"], {}], "config": {"index": 94260, "code_hash": null, "entity": [["tile_f", "sp", [-1, 8, 1, 4]], ["tile_y", "sp", [-1, 1, 1, 1]], ["tile_x", "sp", [-1, 1, 17, 1]], ["tile_rc", "sp", [-1, 2]], ["tile_ry", "sp", [-1, 1]], ["tile_rx", "sp", [-1, 1]], ["auto_unroll_max_step", "ot", 512], ["unroll_explicit", "ot", 0]]}, "result": [[7.93785692153923e-05, 7.937867566216891e-05, 7.937867566216891e-05], 0, 1.9569246768951416, 1679194175.6340666], "version": 0.2, "tvm_version": "0.10.0"}
{"input": ["cuda -keys=cuda,gpu -arch=sm_86 -max_num_threads=1024 -thread_warp_size=32", "conv2d_nchw.cuda", [["TENSOR", [1, 128, 17, 17], "float32"], ["TENSOR", [192, 128, 1, 7], "float32"], [1, 1], [0, 3, 0, 3], [1, 1], "float32"], {}], "config": {"index": 489509, "code_hash": null, "entity": [["tile_f", "sp", [-1, 2, 2, 16]], ["tile_y", "sp", [-1, 1, 1, 1]], ["tile_x", "sp", [-1, 1, 1, 1]], ["tile_rc", "sp", [-1, 8]], ["tile_ry", "sp", [-1, 1]], ["tile_rx", "sp", [-1, 7]], ["auto_unroll_max_step", "ot", 1500], ["unroll_explicit", "ot", 1]]}, "result": [[0.0010724003510638297, 0.0010724095212765958, 0.0010725092765957447], 0, 1.9359681606292725, 1679194176.550255], "version": 0.2, "tvm_version": "0.10.0"}
{"input": ["cuda -keys=cuda,gpu -arch=sm_86 -max_num_threads=1024 -thread_warp_size=32", "conv2d_nchw.cuda", [["TENSOR", [1, 128, 17, 17], "float32"], ["TENSOR", [192, 128, 1, 7], "float32"], [1, 1], [0, 3, 0, 3], [1, 1], "float32"], {}], "config": {"index": 498817, "code_hash": null, "entity": [["tile_f", "sp", [-1, 1, 3, 4]], ["tile_y", "sp", [-1, 1, 1, 1]], ["tile_x", "sp", [-1, 1, 1, 17]], ["tile_rc", "sp", [-1, 16]], ["tile_ry", "sp", [-1, 1]], ["tile_rx", "sp", [-1, 7]], ["auto_unroll_max_step", "ot", 1500], ["unroll_explicit", "ot", 1]]}, "result": [[8.134874571873377e-05, 8.135080435910742e-05, 8.135299792423456e-05], 0, 4.256622552871704, 1679194177.8451924], "version": 0.2, "tvm_version": "0.10.0"}
{"input": ["cuda -keys=cuda,gpu -arch=sm_86 -max_num_threads=1024 -thread_warp_size=32", "conv2d_nchw.cuda", [["TENSOR", [1, 128, 17, 17], "float32"], ["TENSOR", [192, 128, 1, 7], "float32"], [1, 1], [0, 3, 0, 3], [1, 1], "float32"], {}], "config": {"index": 111568, "code_hash": null, "entity": [["tile_f", "sp", [-1, 3, 2, 1]], ["tile_y", "sp", [-1, 1, 1, 1]], ["tile_x", "sp", [-1, 1, 1, 17]], ["tile_rc", "sp", [-1, 16]], ["tile_ry", "sp", [-1, 1]], ["tile_rx", "sp", [-1, 1]], ["auto_unroll_max_step", "ot", 512], ["unroll_explicit", "ot", 0]]}, "result": [[0.00020289009923664123, 0.00020290052417302798, 0.0002029096284987277], 0, 2.0572876930236816, 1679194179.1504426], "version": 0.2, "tvm_version": "0.10.0"}
{"input": ["cuda -keys=cuda,gpu -arch=sm_86 -max_num_threads=1024 -thread_warp_size=32", "conv2d_nchw.cuda", [["TENSOR", [1, 128, 17, 17], "float32"], ["TENSOR", [192, 128, 1, 7], "float32"], [1, 1], [0, 3, 0, 3], [1, 1], "float32"], {}], "config": {"index": 486046, "code_hash": null, "entity": [["tile_f", "sp", [-1, 8, 2, 4]], ["tile_y", "sp", [-1, 1, 17, 1]], ["tile_x", "sp", [-1, 17, 1, 1]], ["tile_rc", "sp", [-1, 4]], ["tile_ry", "sp", [-1, 1]], ["tile_rx", "sp", [-1, 7]], ["auto_unroll_max_step", "ot", 1500], ["unroll_explicit", "ot", 1]]}, "result": [[0.0042847893750000005, 0.004285013166666666, 0.004285056083333333], 0, 3.814692974090576, 1679194180.0860636], "version": 0.2, "tvm_version": "0.10.0"}
{"input": ["cuda -keys=cuda,gpu -arch=sm_86 -max_num_threads=1024 -thread_warp_size=32", "conv2d_nchw.cuda", [["TENSOR", [1, 128, 17, 17], "float32"], ["TENSOR", [192, 128, 1, 7], "float32"], [1, 1], [0, 3, 0, 3], [1, 1], "float32"], {}], "config": {"index": 318160, "code_hash": null, "entity": [["tile_f", "sp", [-1, 1, 1, 24]], ["tile_y", "sp", [-1, 1, 17, 1]], ["tile_x", "sp", [-1, 1, 1, 1]], ["tile_rc", "sp", [-1, 8]], ["tile_ry", "sp", [-1, 1]], ["tile_rx", "sp", [-1, 7]], ["auto_unroll_max_step", "ot", 0], ["unroll_explicit", "ot", 1]]}, "result": [[0.00015223531447746883, 0.00015223550431447746, 0.0001522372895493768], 0, 1.9053866863250732, 1679194181.3923862], "version": 0.2, "tvm_version": "0.10.0"}
{"input": ["cuda -keys=cuda,gpu -arch=sm_86 -max_num_threads=1024 -thread_warp_size=32", "conv2d_nchw.cuda", [["TENSOR", [1, 128, 17, 17], "float32"], ["TENSOR", [192, 128, 1, 7], "float32"], [1, 1], [0, 3, 0, 3], [1, 1], "float32"], {}], "config": {"index": 52197, "code_hash": null, "entity": [["tile_f", "sp", [-1, 8, 4, 2]], ["tile_y", "sp", [-1, 1, 1, 17]], ["tile_x", "sp", [-1, 1, 17, 1]], ["tile_rc", "sp", [-1, 2]], ["tile_ry", "sp", [-1, 1]], ["tile_rx", "sp", [-1, 7]], ["auto_unroll_max_step", "ot", 0], ["unroll_explicit", "ot", 0]]}, "result": [[0.0008837570329670331, 0.000883802054945055, 0.000883802054945055], 0, 2.35024094581604, 1679194182.7043157], "version": 0.2, "tvm_version": "0.10.0"}
{"input": ["cuda -keys=cuda,gpu -arch=sm_86 -max_num_threads=1024 -thread_warp_size=32", "conv2d_nchw.cuda", [["TENSOR", [1, 128, 17, 17], "float32"], ["TENSOR", [192, 128, 1, 7], "float32"], [1, 1], [0, 3, 0, 3], [1, 1], "float32"], {}], "config": {"index": 26258, "code_hash": null, "entity": [["tile_f", "sp", [-1, 2, 8, 1]], ["tile_y", "sp", [-1, 1, 17, 1]], ["tile_x", "sp", [-1, 1, 1, 17]], ["tile_rc", "sp", [-1, 16]], ["tile_ry", "sp", [-1, 1]], ["tile_rx", "sp", [-1, 1]], ["auto_unroll_max_step", "ot", 0], ["unroll_explicit", "ot", 0]]}, "result": [[0.00015710170634920635, 0.00015710780654761903, 0.00015710780654761903], 0, 1.7400381565093994, 1679194184.0090168], "version": 0.2, "tvm_version": "0.10.0"}
{"input": ["cuda -keys=cuda,gpu -arch=sm_86 -max_num_threads=1024 -thread_warp_size=32", "conv2d_nchw.cuda", [["TENSOR", [1, 128, 17, 17], "float32"], ["TENSOR", [192, 128, 1, 7], "float32"], [1, 1], [0, 3, 0, 3], [1, 1], "float32"], {}], "config": {"index": 364845, "code_hash": null, "entity": [["tile_f", "sp", [-1, 1, 16, 12]], ["tile_y", "sp", [-1, 17, 1, 1]], ["tile_x", "sp", [-1, 1, 1, 17]], ["tile_rc", "sp", [-1, 8]], ["tile_ry", "sp", [-1, 1]], ["tile_rx", "sp", [-1, 1]], ["auto_unroll_max_step", "ot", 512], ["unroll_explicit", "ot", 1]]}, "result": [[0.2722349545, 0.2722739255, 0.2722846675], 0, 12.046867609024048, 1679194187.4129157], "version": 0.2, "tvm_version": "0.10.0"}
{"input": ["cuda -keys=cuda,gpu -arch=sm_86 -max_num_threads=1024 -thread_warp_size=32", "conv2d_nchw.cuda", [["TENSOR", [1, 128, 17, 17], "float32"], ["TENSOR", [192, 128, 1, 7], "float32"], [1, 1], [0, 3, 0, 3], [1, 1], "float32"], {}], "config": {"index": 450416, "code_hash": null, "entity": [["tile_f", "sp", [-1, 2, 1, 4]], ["tile_y", "sp", [-1, 1, 1, 1]], ["tile_x", "sp", [-1, 1, 1, 17]], ["tile_rc", "sp", [-1, 8]], ["tile_ry", "sp", [-1, 1]], ["tile_rx", "sp", [-1, 1]], ["auto_unroll_max_step", "ot", 1500], ["unroll_explicit", "ot", 1]]}, "result": [[0.0003921969878048781, 0.00039220447073170736, 0.00039222408292682924], 0, 3.2009541988372803, 1679194188.7216146], "version": 0.2, "tvm_version": "0.10.0"}
{"input": ["cuda -keys=cuda,gpu -arch=sm_86 -max_num_threads=1024 -thread_warp_size=32", "conv2d_nchw.cuda", [["TENSOR", [1, 128, 17, 17], "float32"], ["TENSOR", [192, 128, 1, 7], "float32"], [1, 1], [0, 3, 0, 3], [1, 1], "float32"], {}], "config": {"index": 16624, "code_hash": null, "entity": [["tile_f", "sp", [-1, 1, 4, 3]], ["tile_y", "sp", [-1, 17, 1, 1]], ["tile_x", "sp", [-1, 1, 1, 1]], ["tile_rc", "sp", [-1, 8]], ["tile_ry", "sp", [-1, 1]], ["tile_rx", "sp", [-1, 1]], ["auto_unroll_max_step", "ot", 0], ["unroll_explicit", "ot", 0]]}, "result": [[9.819677385377944e-05, 9.819980855018588e-05, 9.819995043370509e-05], 0, 2.0810766220092773, 1679194190.028707], "version": 0.2, "tvm_version": "0.10.0"}
{"input": ["cuda -keys=cuda,gpu -arch=sm_86 -max_num_threads=1024 -thread_warp_size=32", "conv2d_nchw.cuda", [["TENSOR", [1, 128, 17, 17], "float32"], ["TENSOR", [192, 128, 1, 7], "float32"], [1, 1], [0, 3, 0, 3], [1, 1], "float32"], {}], "config": {"index": 190354, "code_hash": null, "entity": [["tile_f", "sp", [-1, 4, 1, 4]], ["tile_y", "sp", [-1, 1, 17, 1]], ["tile_x", "sp", [-1, 17, 1, 1]], ["tile_rc", "sp", [-1, 8]], ["tile_ry", "sp", [-1, 1]], ["tile_rx", "sp", [-1, 1]], ["auto_unroll_max_step", "ot", 1500], ["unroll_explicit", "ot", 0]]}, "result": [[0.00073074965, 0.0007310289545454545, 0.0007313778954545453], 0, 2.2310070991516113, 1679194191.3381495], "version": 0.2, "tvm_version": "0.10.0"}
{"input": ["cuda -keys=cuda,gpu -arch=sm_86 -max_num_threads=1024 -thread_warp_size=32", "conv2d_nchw.cuda", [["TENSOR", [1, 128, 17, 17], "float32"], ["TENSOR", [192, 128, 1, 7], "float32"], [1, 1], [0, 3, 0, 3], [1, 1], "float32"], {}], "config": {"index": 233473, "code_hash": null, "entity": [["tile_f", "sp", [-1, 4, 1, 16]], ["tile_y", "sp", [-1, 1, 17, 1]], ["tile_x", "sp", [-1, 17, 1, 1]], ["tile_rc", "sp", [-1, 8]], ["tile_ry", "sp", [-1, 1]], ["tile_rx", "sp", [-1, 7]], ["auto_unroll_max_step", "ot", 1500], ["unroll_explicit", "ot", 0]]}, "result": [[0.012842636090909092, 0.012844031545454547, 0.012845335454545454], 0, 8.825368165969849, 1679194202.4326625], "version": 0.2, "tvm_version": "0.10.0"}
