src/tvm/results/cuda_gtx1650/mobilenet/droplet/cpu.log_layer_15.log
{"input": ["cuda -keys=cuda,gpu -arch=sm_75 -max_num_threads=1024 -thread_warp_size=32", "depthwise_conv2d_nchw.cuda", [["TENSOR", [1, 512, 14, 14], "float32"], ["TENSOR", [512, 1, 3, 3], "float32"], [2, 2], [1, 1, 1, 1], [1, 1], "float32"], {}], "config": {"index": 0, "code_hash": null, "entity": [["tile_f", "sp", [-1, 1, 1, 1]], ["tile_y", "sp", [-1, 1, 1, 1]], ["tile_x", "sp", [-1, 1, 1, 1]], ["auto_unroll_max_step", "ot", 0], ["unroll_explicit", "ot", 0]]}, "result": [[8.949932106455266e-05, 9.422092582417583e-05, 9.63929065934066e-05], 0, 1.3227243423461914, 1678613552.9844959], "version": 0.2, "tvm_version": "0.10.0"}
{"input": ["cuda -keys=cuda,gpu -arch=sm_75 -max_num_threads=1024 -thread_warp_size=32", "depthwise_conv2d_nchw.cuda", [["TENSOR", [1, 512, 14, 14], "float32"], ["TENSOR", [512, 1, 3, 3], "float32"], [2, 2], [1, 1, 1, 1], [1, 1], "float32"], {}], "config": {"index": 10560, "code_hash": null, "entity": [["tile_f", "sp", [-1, 1, 1, 1]], ["tile_y", "sp", [-1, 1, 1, 1]], ["tile_x", "sp", [-1, 1, 1, 1]], ["auto_unroll_max_step", "ot", 0], ["unroll_explicit", "ot", 1]]}, "result": [[8.946526640271494e-05, 8.94682007918552e-05, 8.947721097285068e-05], 0, 1.5709714889526367, 1678613554.6912282], "version": 0.2, "tvm_version": "0.10.0"}
{"input": ["cuda -keys=cuda,gpu -arch=sm_75 -max_num_threads=1024 -thread_warp_size=32", "depthwise_conv2d_nchw.cuda", [["TENSOR", [1, 512, 14, 14], "float32"], ["TENSOR", [512, 1, 3, 3], "float32"], [2, 2], [1, 1, 1, 1], [1, 1], "float32"], {}], "config": {"index": 3520, "code_hash": null, "entity": [["tile_f", "sp", [-1, 1, 1, 1]], ["tile_y", "sp", [-1, 1, 1, 1]], ["tile_x", "sp", [-1, 1, 1, 1]], ["auto_unroll_max_step", "ot", 256], ["unroll_explicit", "ot", 0]]}, "result": [[8.946053768278964e-05, 8.94611985376828e-05, 8.946695725534308e-05], 0, 1.5835278034210205, 1678613555.9644372], "version": 0.2, "tvm_version": "0.10.0"}
{"input": ["cuda -keys=cuda,gpu -arch=sm_75 -max_num_threads=1024 -thread_warp_size=32", "depthwise_conv2d_nchw.cuda", [["TENSOR", [1, 512, 14, 14], "float32"], ["TENSOR", [512, 1, 3, 3], "float32"], [2, 2], [1, 1, 1, 1], [1, 1], "float32"], {}], "config": {"index": 880, "code_hash": null, "entity": [["tile_f", "sp", [-1, 1, 1, 1]], ["tile_y", "sp", [-1, 1, 1, 1]], ["tile_x", "sp", [-1, 7, 1, 1]], ["auto_unroll_max_step", "ot", 0], ["unroll_explicit", "ot", 0]]}, "result": [[6.020809135896459e-05, 6.0208213170917404e-05, 6.020920060905976e-05], 0, 1.5694208145141602, 1678613557.2200122], "version": 0.2, "tvm_version": "0.10.0"}
{"input": ["cuda -keys=cuda,gpu -arch=sm_75 -max_num_threads=1024 -thread_warp_size=32", "depthwise_conv2d_nchw.cuda", [["TENSOR", [1, 512, 14, 14], "float32"], ["TENSOR", [512, 1, 3, 3], "float32"], [2, 2], [1, 1, 1, 1], [1, 1], "float32"], {}], "config": {"index": 220, "code_hash": null, "entity": [["tile_f", "sp", [-1, 1, 1, 1]], ["tile_y", "sp", [-1, 7, 1, 1]], ["tile_x", "sp", [-1, 1, 1, 1]], ["auto_unroll_max_step", "ot", 0], ["unroll_explicit", "ot", 0]]}, "result": [[8.287114841722885e-05, 8.287307265179035e-05, 8.287461650233523e-05], 0, 1.586643934249878, 1678613558.473732], "version": 0.2, "tvm_version": "0.10.0"}
{"input": ["cuda -keys=cuda,gpu -arch=sm_75 -max_num_threads=1024 -thread_warp_size=32", "depthwise_conv2d_nchw.cuda", [["TENSOR", [1, 512, 14, 14], "float32"], ["TENSOR", [512, 1, 3, 3], "float32"], [2, 2], [1, 1, 1, 1], [1, 1], "float32"], {}], "config": {"index": 1, "code_hash": null, "entity": [["tile_f", "sp", [-1, 2, 1, 1]], ["tile_y", "sp", [-1, 1, 1, 1]], ["tile_x", "sp", [-1, 1, 1, 1]], ["auto_unroll_max_step", "ot", 0], ["unroll_explicit", "ot", 0]]}, "result": [[8.767187892129884e-05, 8.767255090809026e-05, 8.767513758943314e-05], 0, 1.6283397674560547, 1678613559.747059], "version": 0.2, "tvm_version": "0.10.0"}
{"input": ["cuda -keys=cuda,gpu -arch=sm_75 -max_num_threads=1024 -thread_warp_size=32", "depthwise_conv2d_nchw.cuda", [["TENSOR", [1, 512, 14, 14], "float32"], ["TENSOR", [512, 1, 3, 3], "float32"], [2, 2], [1, 1, 1, 1], [1, 1], "float32"], {}], "config": {"index": 11440, "code_hash": null, "entity": [["tile_f", "sp", [-1, 1, 1, 1]], ["tile_y", "sp", [-1, 1, 1, 1]], ["tile_x", "sp", [-1, 7, 1, 1]], ["auto_unroll_max_step", "ot", 0], ["unroll_explicit", "ot", 1]]}, "result": [[6.020267034220532e-05, 6.020761330798479e-05, 6.0208901520912545e-05], 0, 1.5111289024353027, 1678613561.8047416], "version": 0.2, "tvm_version": "0.10.0"}
{"input": ["cuda -keys=cuda,gpu -arch=sm_75 -max_num_threads=1024 -thread_warp_size=32", "depthwise_conv2d_nchw.cuda", [["TENSOR", [1, 512, 14, 14], "float32"], ["TENSOR", [512, 1, 3, 3], "float32"], [2, 2], [1, 1, 1, 1], [1, 1], "float32"], {}], "config": {"index": 4400, "code_hash": null, "entity": [["tile_f", "sp", [-1, 1, 1, 1]], ["tile_y", "sp", [-1, 1, 1, 1]], ["tile_x", "sp", [-1, 7, 1, 1]], ["auto_unroll_max_step", "ot", 256], ["unroll_explicit", "ot", 0]]}, "result": [[4.6586835014836793e-05, 4.658738308605341e-05, 4.658739643916914e-05], 0, 1.552539587020874, 1678613563.0386767], "version": 0.2, "tvm_version": "0.10.0"}
{"input": ["cuda -keys=cuda,gpu -arch=sm_75 -max_num_threads=1024 -thread_warp_size=32", "depthwise_conv2d_nchw.cuda", [["TENSOR", [1, 512, 14, 14], "float32"], ["TENSOR", [512, 1, 3, 3], "float32"], [2, 2], [1, 1, 1, 1], [1, 1], "float32"], {}], "config": {"index": 1760, "code_hash": null, "entity": [["tile_f", "sp", [-1, 1, 1, 1]], ["tile_y", "sp", [-1, 1, 1, 1]], ["tile_x", "sp", [-1, 1, 7, 1]], ["auto_unroll_max_step", "ot", 0], ["unroll_explicit", "ot", 0]]}, "result": [[2.535374806520665e-05, 2.535398929688786e-05, 2.535532339864976e-05], 0, 1.5506618022918701, 1678613564.253797], "version": 0.2, "tvm_version": "0.10.0"}
{"input": ["cuda -keys=cuda,gpu -arch=sm_75 -max_num_threads=1024 -thread_warp_size=32", "depthwise_conv2d_nchw.cuda", [["TENSOR", [1, 512, 14, 14], "float32"], ["TENSOR", [512, 1, 3, 3], "float32"], [2, 2], [1, 1, 1, 1], [1, 1], "float32"], {}], "config": {"index": 1100, "code_hash": null, "entity": [["tile_f", "sp", [-1, 1, 1, 1]], ["tile_y", "sp", [-1, 7, 1, 1]], ["tile_x", "sp", [-1, 7, 1, 1]], ["auto_unroll_max_step", "ot", 0], ["unroll_explicit", "ot", 0]]}, "result": [[4.3102316154059294e-05, 4.310516154059296e-05, 4.310673843169853e-05], 0, 1.9748187065124512, 1678613565.4647462], "version": 0.2, "tvm_version": "0.10.0"}
{"input": ["cuda -keys=cuda,gpu -arch=sm_75 -max_num_threads=1024 -thread_warp_size=32", "depthwise_conv2d_nchw.cuda", [["TENSOR", [1, 512, 14, 14], "float32"], ["TENSOR", [512, 1, 3, 3], "float32"], [2, 2], [1, 1, 1, 1], [1, 1], "float32"], {}], "config": {"index": 881, "code_hash": null, "entity": [["tile_f", "sp", [-1, 2, 1, 1]], ["tile_y", "sp", [-1, 1, 1, 1]], ["tile_x", "sp", [-1, 7, 1, 1]], ["auto_unroll_max_step", "ot", 0], ["unroll_explicit", "ot", 0]]}, "result": [[4.7460354964114827e-05, 4.746068809808613e-05, 4.74618836722488e-05], 0, 1.6680231094360352, 1678613566.7018013], "version": 0.2, "tvm_version": "0.10.0"}
{"input": ["cuda -keys=cuda,gpu -arch=sm_75 -max_num_threads=1024 -thread_warp_size=32", "depthwise_conv2d_nchw.cuda", [["TENSOR", [1, 512, 14, 14], "float32"], ["TENSOR", [512, 1, 3, 3], "float32"], [2, 2], [1, 1, 1, 1], [1, 1], "float32"], {}], "config": {"index": 12320, "code_hash": null, "entity": [["tile_f", "sp", [-1, 1, 1, 1]], ["tile_y", "sp", [-1, 1, 1, 1]], ["tile_x", "sp", [-1, 1, 7, 1]], ["auto_unroll_max_step", "ot", 0], ["unroll_explicit", "ot", 1]]}, "result": [[2.5352312273774266e-05, 2.5352593451793353e-05, 2.535267620927937e-05], 0, 1.4946508407592773, 1678613568.319656], "version": 0.2, "tvm_version": "0.10.0"}
{"input": ["cuda -keys=cuda,gpu -arch=sm_75 -max_num_threads=1024 -thread_warp_size=32", "depthwise_conv2d_nchw.cuda", [["TENSOR", [1, 512, 14, 14], "float32"], ["TENSOR", [512, 1, 3, 3], "float32"], [2, 2], [1, 1, 1, 1], [1, 1], "float32"], {}], "config": {"index": 5280, "code_hash": null, "entity": [["tile_f", "sp", [-1, 1, 1, 1]], ["tile_y", "sp", [-1, 1, 1, 1]], ["tile_x", "sp", [-1, 1, 7, 1]], ["auto_unroll_max_step", "ot", 256], ["unroll_explicit", "ot", 0]]}, "result": [[2.5351040547222682e-05, 2.5352059172572936e-05, 2.5352318279215426e-05], 0, 1.5648062229156494, 1678613569.5450945], "version": 0.2, "tvm_version": "0.10.0"}
{"input": ["cuda -keys=cuda,gpu -arch=sm_75 -max_num_threads=1024 -thread_warp_size=32", "depthwise_conv2d_nchw.cuda", [["TENSOR", [1, 512, 14, 14], "float32"], ["TENSOR", [512, 1, 3, 3], "float32"], [2, 2], [1, 1, 1, 1], [1, 1], "float32"], {}], "config": {"index": 2640, "code_hash": null, "entity": [["tile_f", "sp", [-1, 1, 1, 1]], ["tile_y", "sp", [-1, 1, 1, 1]], ["tile_x", "sp", [-1, 1, 1, 7]], ["auto_unroll_max_step", "ot", 0], ["unroll_explicit", "ot", 0]]}, "result": [[6.023785224676313e-05, 6.024102513328256e-05, 6.024208263518659e-05], 0, 1.5977818965911865, 1678613570.8141282], "version": 0.2, "tvm_version": "0.10.0"}
{"input": ["cuda -keys=cuda,gpu -arch=sm_75 -max_num_threads=1024 -thread_warp_size=32", "depthwise_conv2d_nchw.cuda", [["TENSOR", [1, 512, 14, 14], "float32"], ["TENSOR", [512, 1, 3, 3], "float32"], [2, 2], [1, 1, 1, 1], [1, 1], "float32"], {}], "config": {"index": 1980, "code_hash": null, "entity": [["tile_f", "sp", [-1, 1, 1, 1]], ["tile_y", "sp", [-1, 7, 1, 1]], ["tile_x", "sp", [-1, 1, 7, 1]], ["auto_unroll_max_step", "ot", 0], ["unroll_explicit", "ot", 0]]}, "result": [[1.9348447721518986e-05, 1.934932658227848e-05, 1.9349471392405064e-05], 0, 1.569993257522583, 1678613572.0544505], "version": 0.2, "tvm_version": "0.10.0"}
{"input": ["cuda -keys=cuda,gpu -arch=sm_75 -max_num_threads=1024 -thread_warp_size=32", "depthwise_conv2d_nchw.cuda", [["TENSOR", [1, 512, 14, 14], "float32"], ["TENSOR", [512, 1, 3, 3], "float32"], [2, 2], [1, 1, 1, 1], [1, 1], "float32"], {}], "config": {"index": 1761, "code_hash": null, "entity": [["tile_f", "sp", [-1, 2, 1, 1]], ["tile_y", "sp", [-1, 1, 1, 1]], ["tile_x", "sp", [-1, 1, 7, 1]], ["auto_unroll_max_step", "ot", 0], ["unroll_explicit", "ot", 0]]}, "result": [[2.7677436824384193e-05, 2.7678967393230546e-05, 2.767901329080276e-05], 0, 1.5804264545440674, 1678613573.2998443], "version": 0.2, "tvm_version": "0.10.0"}
{"input": ["cuda -keys=cuda,gpu -arch=sm_75 -max_num_threads=1024 -thread_warp_size=32", "depthwise_conv2d_nchw.cuda", [["TENSOR", [1, 512, 14, 14], "float32"], ["TENSOR", [512, 1, 3, 3], "float32"], [2, 2], [1, 1, 1, 1], [1, 1], "float32"], {}], "config": {"index": 12540, "code_hash": null, "entity": [["tile_f", "sp", [-1, 1, 1, 1]], ["tile_y", "sp", [-1, 7, 1, 1]], ["tile_x", "sp", [-1, 1, 7, 1]], ["auto_unroll_max_step", "ot", 0], ["unroll_explicit", "ot", 1]]}, "result": [[1.9352055696202533e-05, 1.9352088607594935e-05, 1.9354377341772152e-05], 0, 1.506220817565918, 1678613574.9967978], "version": 0.2, "tvm_version": "0.10.0"}
{"input": ["cuda -keys=cuda,gpu -arch=sm_75 -max_num_threads=1024 -thread_warp_size=32", "depthwise_conv2d_nchw.cuda", [["TENSOR", [1, 512, 14, 14], "float32"], ["TENSOR", [512, 1, 3, 3], "float32"], [2, 2], [1, 1, 1, 1], [1, 1], "float32"], {}], "config": {"index": 5500, "code_hash": null, "entity": [["tile_f", "sp", [-1, 1, 1, 1]], ["tile_y", "sp", [-1, 7, 1, 1]], ["tile_x", "sp", [-1, 1, 7, 1]], ["auto_unroll_max_step", "ot", 256], ["unroll_explicit", "ot", 0]]}, "result": [[2.032697395348837e-05, 2.0327578205980068e-05, 2.032816026578073e-05], 0, 1.564302682876587, 1678613576.236557], "version": 0.2, "tvm_version": "0.10.0"}
{"input": ["cuda -keys=cuda,gpu -arch=sm_75 -max_num_threads=1024 -thread_warp_size=32", "depthwise_conv2d_nchw.cuda", [["TENSOR", [1, 512, 14, 14], "float32"], ["TENSOR", [512, 1, 3, 3], "float32"], [2, 2], [1, 1, 1, 1], [1, 1], "float32"], {}], "config": {"index": 2860, "code_hash": null, "entity": [["tile_f", "sp", [-1, 1, 1, 1]], ["tile_y", "sp", [-1, 7, 1, 1]], ["tile_x", "sp", [-1, 1, 1, 7]], ["auto_unroll_max_step", "ot", 0], ["unroll_explicit", "ot", 0]]}, "result": [[4.2905514689880305e-05, 4.290715859630033e-05, 4.2909346028291624e-05], 0, 1.672269582748413, 1678613577.5048146], "version": 0.2, "tvm_version": "0.10.0"}
{"input": ["cuda -keys=cuda,gpu -arch=sm_75 -max_num_threads=1024 -thread_warp_size=32", "depthwise_conv2d_nchw.cuda", [["TENSOR", [1, 512, 14, 14], "float32"], ["TENSOR", [512, 1, 3, 3], "float32"], [2, 2], [1, 1, 1, 1], [1, 1], "float32"], {}], "config": {"index": 2200, "code_hash": null, "entity": [["tile_f", "sp", [-1, 1, 1, 1]], ["tile_y", "sp", [-1, 1, 7, 1]], ["tile_x", "sp", [-1, 1, 7, 1]], ["auto_unroll_max_step", "ot", 0], ["unroll_explicit", "ot", 0]]}, "result": [[6.6826362733976175e-06, 6.6828194838343735e-06, 6.683299111363207e-06], 0, 1.4748332500457764, 1678613578.6344392], "version": 0.2, "tvm_version": "0.10.0"}
{"input": ["cuda -keys=cuda,gpu -arch=sm_75 -max_num_threads=1024 -thread_warp_size=32", "depthwise_conv2d_nchw.cuda", [["TENSOR", [1, 512, 14, 14], "float32"], ["TENSOR", [512, 1, 3, 3], "float32"], [2, 2], [1, 1, 1, 1], [1, 1], "float32"], {}], "config": {"index": 1981, "code_hash": null, "entity": [["tile_f", "sp", [-1, 2, 1, 1]], ["tile_y", "sp", [-1, 7, 1, 1]], ["tile_x", "sp", [-1, 1, 7, 1]], ["auto_unroll_max_step", "ot", 0], ["unroll_explicit", "ot", 0]]}, "result": [[2.8440929976107335e-05, 2.844165355633156e-05, 2.8442349016724863e-05], 0, 1.5903949737548828, 1678613579.8490899], "version": 0.2, "tvm_version": "0.10.0"}
{"input": ["cuda -keys=cuda,gpu -arch=sm_75 -max_num_threads=1024 -thread_warp_size=32", "depthwise_conv2d_nchw.cuda", [["TENSOR", [1, 512, 14, 14], "float32"], ["TENSOR", [512, 1, 3, 3], "float32"], [2, 2], [1, 1, 1, 1], [1, 1], "float32"], {}], "config": {"index": 12760, "code_hash": null, "entity": [["tile_f", "sp", [-1, 1, 1, 1]], ["tile_y", "sp", [-1, 1, 7, 1]], ["tile_x", "sp", [-1, 1, 7, 1]], ["auto_unroll_max_step", "ot", 0], ["unroll_explicit", "ot", 1]]}, "result": [[6.68289330210306e-06, 6.682910794378552e-06, 6.684730539220572e-06], 0, 1.4383974075317383, 1678613581.3996184], "version": 0.2, "tvm_version": "0.10.0"}
{"input": ["cuda -keys=cuda,gpu -arch=sm_75 -max_num_threads=1024 -thread_warp_size=32", "depthwise_conv2d_nchw.cuda", [["TENSOR", [1, 512, 14, 14], "float32"], ["TENSOR", [512, 1, 3, 3], "float32"], [2, 2], [1, 1, 1, 1], [1, 1], "float32"], {}], "config": {"index": 5720, "code_hash": null, "entity": [["tile_f", "sp", [-1, 1, 1, 1]], ["tile_y", "sp", [-1, 1, 7, 1]], ["tile_x", "sp", [-1, 1, 7, 1]], ["auto_unroll_max_step", "ot", 256], ["unroll_explicit", "ot", 0]]}, "result": [[6.681405998209491e-06, 6.6818218939620005e-06, 6.6818218939620005e-06], 0, 1.448958396911621, 1678613582.5063207], "version": 0.2, "tvm_version": "0.10.0"}
{"input": ["cuda -keys=cuda,gpu -arch=sm_75 -max_num_threads=1024 -thread_warp_size=32", "depthwise_conv2d_nchw.cuda", [["TENSOR", [1, 512, 14, 14], "float32"], ["TENSOR", [512, 1, 3, 3], "float32"], [2, 2], [1, 1, 1, 1], [1, 1], "float32"], {}], "config": {"index": 3080, "code_hash": null, "entity": [["tile_f", "sp", [-1, 1, 1, 1]], ["tile_y", "sp", [-1, 1, 7, 1]], ["tile_x", "sp", [-1, 1, 1, 7]], ["auto_unroll_max_step", "ot", 0], ["unroll_explicit", "ot", 0]]}, "result": [[1.9158186075949366e-05, 1.915827493670886e-05, 1.9158637974683544e-05], 0, 1.4601619243621826, 1678613583.6676085], "version": 0.2, "tvm_version": "0.10.0"}
{"input": ["cuda -keys=cuda,gpu -arch=sm_75 -max_num_threads=1024 -thread_warp_size=32", "depthwise_conv2d_nchw.cuda", [["TENSOR", [1, 512, 14, 14], "float32"], ["TENSOR", [512, 1, 3, 3], "float32"], [2, 2], [1, 1, 1, 1], [1, 1], "float32"], {}], "config": {"index": 1320, "code_hash": null, "entity": [["tile_f", "sp", [-1, 1, 1, 1]], ["tile_y", "sp", [-1, 1, 7, 1]], ["tile_x", "sp", [-1, 7, 1, 1]], ["auto_unroll_max_step", "ot", 0], ["unroll_explicit", "ot", 0]]}, "result": [[1.9162288393756298e-05, 1.9162545820745217e-05, 1.9162953046324273e-05], 0, 1.5786502361297607, 1678613584.9048119], "version": 0.2, "tvm_version": "0.10.0"}
{"input": ["cuda -keys=cuda,gpu -arch=sm_75 -max_num_threads=1024 -thread_warp_size=32", "depthwise_conv2d_nchw.cuda", [["TENSOR", [1, 512, 14, 14], "float32"], ["TENSOR", [512, 1, 3, 3], "float32"], [2, 2], [1, 1, 1, 1], [1, 1], "float32"], {}], "config": {"index": 2420, "code_hash": null, "entity": [["tile_f", "sp", [-1, 1, 1, 1]], ["tile_y", "sp", [-1, 1, 1, 7]], ["tile_x", "sp", [-1, 1, 7, 1]], ["auto_unroll_max_step", "ot", 0], ["unroll_explicit", "ot", 0]]}, "result": [[1.9359868787530346e-05, 1.936009492781398e-05, 1.936216340871343e-05], 0, 1.5203983783721924, 1678613586.1067035], "version": 0.2, "tvm_version": "0.10.0"}
{"input": ["cuda -keys=cuda,gpu -arch=sm_75 -max_num_threads=1024 -thread_warp_size=32", "depthwise_conv2d_nchw.cuda", [["TENSOR", [1, 512, 14, 14], "float32"], ["TENSOR", [512, 1, 3, 3], "float32"], [2, 2], [1, 1, 1, 1], [1, 1], "float32"], {}], "config": {"index": 2201, "code_hash": null, "entity": [["tile_f", "sp", [-1, 2, 1, 1]], ["tile_y", "sp", [-1, 1, 7, 1]], ["tile_x", "sp", [-1, 1, 7, 1]], ["auto_unroll_max_step", "ot", 0], ["unroll_explicit", "ot", 0]]}, "result": [[7.995414217361586e-06, 7.995552403736615e-06, 7.995964399635453e-06], 0, 1.4905660152435303, 1678613587.2676158], "version": 0.2, "tvm_version": "0.10.0"}
{"input": ["cuda -keys=cuda,gpu -arch=sm_75 -max_num_threads=1024 -thread_warp_size=32", "depthwise_conv2d_nchw.cuda", [["TENSOR", [1, 512, 14, 14], "float32"], ["TENSOR", [512, 1, 3, 3], "float32"], [2, 2], [1, 1, 1, 1], [1, 1], "float32"], {}], "config": {"index": 16280, "code_hash": null, "entity": [["tile_f", "sp", [-1, 1, 1, 1]], ["tile_y", "sp", [-1, 1, 7, 1]], ["tile_x", "sp", [-1, 1, 7, 1]], ["auto_unroll_max_step", "ot", 256], ["unroll_explicit", "ot", 1]]}, "result": [[5.51321667544784e-06, 5.5135650245872846e-06, 5.513576440112399e-06], 0, 1.2799232006072998, 1678613588.7800748], "version": 0.2, "tvm_version": "0.10.0"}
{"input": ["cuda -keys=cuda,gpu -arch=sm_75 -max_num_threads=1024 -thread_warp_size=32", "depthwise_conv2d_nchw.cuda", [["TENSOR", [1, 512, 14, 14], "float32"], ["TENSOR", [512, 1, 3, 3], "float32"], [2, 2], [1, 1, 1, 1], [1, 1], "float32"], {}], "config": {"index": 9240, "code_hash": null, "entity": [["tile_f", "sp", [-1, 1, 1, 1]], ["tile_y", "sp", [-1, 1, 7, 1]], ["tile_x", "sp", [-1, 1, 7, 1]], ["auto_unroll_max_step", "ot", 1500], ["unroll_explicit", "ot", 0]]}, "result": [[6.682388990224966e-06, 6.682907113792619e-06, 6.6832903512464335e-06], 0, 1.4890844821929932, 1678613589.935764], "version": 0.2, "tvm_version": "0.10.0"}
{"input": ["cuda -keys=cuda,gpu -arch=sm_75 -max_num_threads=1024 -thread_warp_size=32", "depthwise_conv2d_nchw.cuda", [["TENSOR", [1, 512, 14, 14], "float32"], ["TENSOR", [512, 1, 3, 3], "float32"], [2, 2], [1, 1, 1, 1], [1, 1], "float32"], {}], "config": {"index": 6600, "code_hash": null, "entity": [["tile_f", "sp", [-1, 1, 1, 1]], ["tile_y", "sp", [-1, 1, 7, 1]], ["tile_x", "sp", [-1, 1, 1, 7]], ["auto_unroll_max_step", "ot", 256], ["unroll_explicit", "ot", 0]]}, "result": [[2.0090630033222593e-05, 2.009080850498339e-05, 2.009198046511628e-05], 0, 1.560049057006836, 1678613591.1190429], "version": 0.2, "tvm_version": "0.10.0"}
{"input": ["cuda -keys=cuda,gpu -arch=sm_75 -max_num_threads=1024 -thread_warp_size=32", "depthwise_conv2d_nchw.cuda", [["TENSOR", [1, 512, 14, 14], "float32"], ["TENSOR", [512, 1, 3, 3], "float32"], [2, 2], [1, 1, 1, 1], [1, 1], "float32"], {}], "config": {"index": 4840, "code_hash": null, "entity": [["tile_f", "sp", [-1, 1, 1, 1]], ["tile_y", "sp", [-1, 1, 7, 1]], ["tile_x", "sp", [-1, 7, 1, 1]], ["auto_unroll_max_step", "ot", 256], ["unroll_explicit", "ot", 0]]}, "result": [[2.0091858870431895e-05, 2.009215495016611e-05, 2.0092580730897012e-05], 0, 1.6520261764526367, 1678613592.355566], "version": 0.2, "tvm_version": "0.10.0"}
{"input": ["cuda -keys=cuda,gpu -arch=sm_75 -max_num_threads=1024 -thread_warp_size=32", "depthwise_conv2d_nchw.cuda", [["TENSOR", [1, 512, 14, 14], "float32"], ["TENSOR", [512, 1, 3, 3], "float32"], [2, 2], [1, 1, 1, 1], [1, 1], "float32"], {}], "config": {"index": 5940, "code_hash": null, "entity": [["tile_f", "sp", [-1, 1, 1, 1]], ["tile_y", "sp", [-1, 1, 1, 7]], ["tile_x", "sp", [-1, 1, 7, 1]], ["auto_unroll_max_step", "ot", 256], ["unroll_explicit", "ot", 0]]}, "result": [[2.0325148970099666e-05, 2.0326229767441864e-05, 2.0326229767441864e-05], 0, 1.622957706451416, 1678613593.6010497], "version": 0.2, "tvm_version": "0.10.0"}
{"input": ["cuda -keys=cuda,gpu -arch=sm_75 -max_num_threads=1024 -thread_warp_size=32", "depthwise_conv2d_nchw.cuda", [["TENSOR", [1, 512, 14, 14], "float32"], ["TENSOR", [512, 1, 3, 3], "float32"], [2, 2], [1, 1, 1, 1], [1, 1], "float32"], {}], "config": {"index": 5721, "code_hash": null, "entity": [["tile_f", "sp", [-1, 2, 1, 1]], ["tile_y", "sp", [-1, 1, 7, 1]], ["tile_x", "sp", [-1, 1, 7, 1]], ["auto_unroll_max_step", "ot", 256], ["unroll_explicit", "ot", 0]]}, "result": [[7.995435388923815e-06, 7.995709207292679e-06, 7.996182774189861e-06], 0, 1.5042784214019775, 1678613594.7550647], "version": 0.2, "tvm_version": "0.10.0"}
{"input": ["cuda -keys=cuda,gpu -arch=sm_75 -max_num_threads=1024 -thread_warp_size=32", "depthwise_conv2d_nchw.cuda", [["TENSOR", [1, 512, 14, 14], "float32"], ["TENSOR", [512, 1, 3, 3], "float32"], [2, 2], [1, 1, 1, 1], [1, 1], "float32"], {}], "config": {"index": 19800, "code_hash": null, "entity": [["tile_f", "sp", [-1, 1, 1, 1]], ["tile_y", "sp", [-1, 1, 7, 1]], ["tile_x", "sp", [-1, 1, 7, 1]], ["auto_unroll_max_step", "ot", 1500], ["unroll_explicit", "ot", 1]]}, "result": [[5.512685750474983e-06, 5.512887397086763e-06, 5.5132140173105345e-06], 0, 1.3999860286712646, 1678613596.3349342], "version": 0.2, "tvm_version": "0.10.0"}
{"input": ["cuda -keys=cuda,gpu -arch=sm_75 -max_num_threads=1024 -thread_warp_size=32", "depthwise_conv2d_nchw.cuda", [["TENSOR", [1, 512, 14, 14], "float32"], ["TENSOR", [512, 1, 3, 3], "float32"], [2, 2], [1, 1, 1, 1], [1, 1], "float32"], {}], "config": {"index": 17160, "code_hash": null, "entity": [["tile_f", "sp", [-1, 1, 1, 1]], ["tile_y", "sp", [-1, 1, 7, 1]], ["tile_x", "sp", [-1, 1, 1, 7]], ["auto_unroll_max_step", "ot", 256], ["unroll_explicit", "ot", 1]]}, "result": [[6.709436832961034e-06, 6.709957210225862e-06, 6.7100670637875416e-06], 0, 1.5833406448364258, 1678613597.4754345], "version": 0.2, "tvm_version": "0.10.0"}
{"input": ["cuda -keys=cuda,gpu -arch=sm_75 -max_num_threads=1024 -thread_warp_size=32", "depthwise_conv2d_nchw.cuda", [["TENSOR", [1, 512, 14, 14], "float32"], ["TENSOR", [512, 1, 3, 3], "float32"], [2, 2], [1, 1, 1, 1], [1, 1], "float32"], {}], "config": {"index": 15400, "code_hash": null, "entity": [["tile_f", "sp", [-1, 1, 1, 1]], ["tile_y", "sp", [-1, 1, 7, 1]], ["tile_x", "sp", [-1, 7, 1, 1]], ["auto_unroll_max_step", "ot", 256], ["unroll_explicit", "ot", 1]]}, "result": [[6.720946162881754e-06, 6.721583202819107e-06, 6.721722836726703e-06], 0, 1.586681842803955, 1678613598.6102018], "version": 0.2, "tvm_version": "0.10.0"}
{"input": ["cuda -keys=cuda,gpu -arch=sm_75 -max_num_threads=1024 -thread_warp_size=32", "depthwise_conv2d_nchw.cuda", [["TENSOR", [1, 512, 14, 14], "float32"], ["TENSOR", [512, 1, 3, 3], "float32"], [2, 2], [1, 1, 1, 1], [1, 1], "float32"], {}], "config": {"index": 16500, "code_hash": null, "entity": [["tile_f", "sp", [-1, 1, 1, 1]], ["tile_y", "sp", [-1, 1, 1, 7]], ["tile_x", "sp", [-1, 1, 7, 1]], ["auto_unroll_max_step", "ot", 256], ["unroll_explicit", "ot", 1]]}, "result": [[6.956097266434238e-06, 6.9566454448991955e-06, 6.956721742206053e-06], 0, 1.5871100425720215, 1678613599.7663264], "version": 0.2, "tvm_version": "0.10.0"}
{"input": ["cuda -keys=cuda,gpu -arch=sm_75 -max_num_threads=1024 -thread_warp_size=32", "depthwise_conv2d_nchw.cuda", [["TENSOR", [1, 512, 14, 14], "float32"], ["TENSOR", [512, 1, 3, 3], "float32"], [2, 2], [1, 1, 1, 1], [1, 1], "float32"], {}], "config": {"index": 16060, "code_hash": null, "entity": [["tile_f", "sp", [-1, 1, 1, 1]], ["tile_y", "sp", [-1, 7, 1, 1]], ["tile_x", "sp", [-1, 1, 7, 1]], ["auto_unroll_max_step", "ot", 256], ["unroll_explicit", "ot", 1]]}, "result": [[6.96192836734694e-06, 6.962321530612244e-06, 6.962468622448979e-06], 0, 1.5435962677001953, 1678613600.862423], "version": 0.2, "tvm_version": "0.10.0"}
{"input": ["cuda -keys=cuda,gpu -arch=sm_75 -max_num_threads=1024 -thread_warp_size=32", "depthwise_conv2d_nchw.cuda", [["TENSOR", [1, 512, 14, 14], "float32"], ["TENSOR", [512, 1, 3, 3], "float32"], [2, 2], [1, 1, 1, 1], [1, 1], "float32"], {}], "config": {"index": 16281, "code_hash": null, "entity": [["tile_f", "sp", [-1, 2, 1, 1]], ["tile_y", "sp", [-1, 1, 7, 1]], ["tile_x", "sp", [-1, 1, 7, 1]], ["auto_unroll_max_step", "ot", 256], ["unroll_explicit", "ot", 1]]}, "result": [[5.26343549909879e-06, 5.263541284009957e-06, 5.263633250364776e-06], 0, 1.456709861755371, 1678613601.9199758], "version": 0.2, "tvm_version": "0.10.0"}
{"input": ["cuda -keys=cuda,gpu -arch=sm_75 -max_num_threads=1024 -thread_warp_size=32", "depthwise_conv2d_nchw.cuda", [["TENSOR", [1, 512, 14, 14], "float32"], ["TENSOR", [512, 1, 3, 3], "float32"], [2, 2], [1, 1, 1, 1], [1, 1], "float32"], {}], "config": {"index": 19801, "code_hash": null, "entity": [["tile_f", "sp", [-1, 2, 1, 1]], ["tile_y", "sp", [-1, 1, 7, 1]], ["tile_x", "sp", [-1, 1, 7, 1]], ["auto_unroll_max_step", "ot", 1500], ["unroll_explicit", "ot", 1]]}, "result": [[5.263570598006644e-06, 5.263637126245847e-06, 5.264403862126247e-06], 0, 1.4167485237121582, 1678613603.780558], "version": 0.2, "tvm_version": "0.10.0"}
{"input": ["cuda -keys=cuda,gpu -arch=sm_75 -max_num_threads=1024 -thread_warp_size=32", "depthwise_conv2d_nchw.cuda", [["TENSOR", [1, 512, 14, 14], "float32"], ["TENSOR", [512, 1, 3, 3], "float32"], [2, 2], [1, 1, 1, 1], [1, 1], "float32"], {}], "config": {"index": 12761, "code_hash": null, "entity": [["tile_f", "sp", [-1, 2, 1, 1]], ["tile_y", "sp", [-1, 1, 7, 1]], ["tile_x", "sp", [-1, 1, 7, 1]], ["auto_unroll_max_step", "ot", 0], ["unroll_explicit", "ot", 1]]}, "result": [[7.995326441102757e-06, 7.995329915698338e-06, 7.99621992481203e-06], 0, 1.5360069274902344, 1678613604.935745], "version": 0.2, "tvm_version": "0.10.0"}
{"input": ["cuda -keys=cuda,gpu -arch=sm_75 -max_num_threads=1024 -thread_warp_size=32", "depthwise_conv2d_nchw.cuda", [["TENSOR", [1, 512, 14, 14], "float32"], ["TENSOR", [512, 1, 3, 3], "float32"], [2, 2], [1, 1, 1, 1], [1, 1], "float32"], {}], "config": {"index": 17161, "code_hash": null, "entity": [["tile_f", "sp", [-1, 2, 1, 1]], ["tile_y", "sp", [-1, 1, 7, 1]], ["tile_x", "sp", [-1, 1, 1, 7]], ["auto_unroll_max_step", "ot", 256], ["unroll_explicit", "ot", 1]]}, "result": [[7.4108319663831515e-06, 7.410937019036048e-06, 7.412156844876468e-06], 0, 1.9087188243865967, 1678613606.1263294], "version": 0.2, "tvm_version": "0.10.0"}
{"input": ["cuda -keys=cuda,gpu -arch=sm_75 -max_num_threads=1024 -thread_warp_size=32", "depthwise_conv2d_nchw.cuda", [["TENSOR", [1, 512, 14, 14], "float32"], ["TENSOR", [512, 1, 3, 3], "float32"], [2, 2], [1, 1, 1, 1], [1, 1], "float32"], {}], "config": {"index": 15401, "code_hash": null, "entity": [["tile_f", "sp", [-1, 2, 1, 1]], ["tile_y", "sp", [-1, 1, 7, 1]], ["tile_x", "sp", [-1, 7, 1, 1]], ["auto_unroll_max_step", "ot", 256], ["unroll_explicit", "ot", 1]]}, "result": [[7.4435564479380274e-06, 7.443855434039644e-06, 7.444473399407609e-06], 0, 1.754868745803833, 1678613607.2010946], "version": 0.2, "tvm_version": "0.10.0"}
{"input": ["cuda -keys=cuda,gpu -arch=sm_75 -max_num_threads=1024 -thread_warp_size=32", "depthwise_conv2d_nchw.cuda", [["TENSOR", [1, 512, 14, 14], "float32"], ["TENSOR", [512, 1, 3, 3], "float32"], [2, 2], [1, 1, 1, 1], [1, 1], "float32"], {}], "config": {"index": 16501, "code_hash": null, "entity": [["tile_f", "sp", [-1, 2, 1, 1]], ["tile_y", "sp", [-1, 1, 1, 7]], ["tile_x", "sp", [-1, 1, 7, 1]], ["auto_unroll_max_step", "ot", 256], ["unroll_explicit", "ot", 1]]}, "result": [[7.730383284655134e-06, 7.730576949000225e-06, 7.730671253650866e-06], 0, 1.8185961246490479, 1678613608.314221], "version": 0.2, "tvm_version": "0.10.0"}
{"input": ["cuda -keys=cuda,gpu -arch=sm_75 -max_num_threads=1024 -thread_warp_size=32", "depthwise_conv2d_nchw.cuda", [["TENSOR", [1, 512, 14, 14], "float32"], ["TENSOR", [512, 1, 3, 3], "float32"], [2, 2], [1, 1, 1, 1], [1, 1], "float32"], {}], "config": {"index": 16061, "code_hash": null, "entity": [["tile_f", "sp", [-1, 2, 1, 1]], ["tile_y", "sp", [-1, 7, 1, 1]], ["tile_x", "sp", [-1, 1, 7, 1]], ["auto_unroll_max_step", "ot", 256], ["unroll_explicit", "ot", 1]]}, "result": [[7.735285600364547e-06, 7.735342105263158e-06, 7.735877477785373e-06], 0, 1.8443968296051025, 1678613609.4277942], "version": 0.2, "tvm_version": "0.10.0"}
{"input": ["cuda -keys=cuda,gpu -arch=sm_75 -max_num_threads=1024 -thread_warp_size=32", "depthwise_conv2d_nchw.cuda", [["TENSOR", [1, 512, 14, 14], "float32"], ["TENSOR", [512, 1, 3, 3], "float32"], [2, 2], [1, 1, 1, 1], [1, 1], "float32"], {}], "config": {"index": 16282, "code_hash": null, "entity": [["tile_f", "sp", [-1, 4, 1, 1]], ["tile_y", "sp", [-1, 1, 7, 1]], ["tile_x", "sp", [-1, 1, 7, 1]], ["auto_unroll_max_step", "ot", 256], ["unroll_explicit", "ot", 1]]}, "result": [[5.9699390803563405e-06, 5.969956897327455e-06, 5.971936200845857e-06], 0, 1.587099552154541, 1678613610.523157], "version": 0.2, "tvm_version": "0.10.0"}
{"input": ["cuda -keys=cuda,gpu -arch=sm_75 -max_num_threads=1024 -thread_warp_size=32", "depthwise_conv2d_nchw.cuda", [["TENSOR", [1, 512, 14, 14], "float32"], ["TENSOR", [512, 1, 3, 3], "float32"], [2, 2], [1, 1, 1, 1], [1, 1], "float32"], {}], "config": {"index": 14521, "code_hash": null, "entity": [["tile_f", "sp", [-1, 2, 1, 1]], ["tile_y", "sp", [-1, 1, 7, 1]], ["tile_x", "sp", [-1, 1, 1, 1]], ["auto_unroll_max_step", "ot", 256], ["unroll_explicit", "ot", 1]]}, "result": [[1.1920731819677524e-05, 1.1921185011516947e-05, 1.1921353158933858e-05], 0, 1.538334846496582, 1678613612.4308355], "version": 0.2, "tvm_version": "0.10.0"}
{"input": ["cuda -keys=cuda,gpu -arch=sm_75 -max_num_threads=1024 -thread_warp_size=32", "depthwise_conv2d_nchw.cuda", [["TENSOR", [1, 512, 14, 14], "float32"], ["TENSOR", [512, 1, 3, 3], "float32"], [2, 2], [1, 1, 1, 1], [1, 1], "float32"], {}], "config": {"index": 15841, "code_hash": null, "entity": [["tile_f", "sp", [-1, 2, 1, 1]], ["tile_y", "sp", [-1, 1, 1, 1]], ["tile_x", "sp", [-1, 1, 7, 1]], ["auto_unroll_max_step", "ot", 256], ["unroll_explicit", "ot", 1]]}, "result": [[1.1175066429235057e-05, 1.11751798544441e-05, 1.1175362960668938e-05], 0, 1.5466463565826416, 1678613613.5914853], "version": 0.2, "tvm_version": "0.10.0"}
{"input": ["cuda -keys=cuda,gpu -arch=sm_75 -max_num_threads=1024 -thread_warp_size=32", "depthwise_conv2d_nchw.cuda", [["TENSOR", [1, 512, 14, 14], "float32"], ["TENSOR", [512, 1, 3, 3], "float32"], [2, 2], [1, 1, 1, 1], [1, 1], "float32"], {}], "config": {"index": 16283, "code_hash": null, "entity": [["tile_f", "sp", [-1, 8, 1, 1]], ["tile_y", "sp", [-1, 1, 7, 1]], ["tile_x", "sp", [-1, 1, 7, 1]], ["auto_unroll_max_step", "ot", 256], ["unroll_explicit", "ot", 1]]}, "result": [[6.476006467462148e-06, 6.476067682743407e-06, 6.476184698686453e-06], 0, 1.6574323177337646, 1678613614.610581], "version": 0.2, "tvm_version": "0.10.0"}
{"input": ["cuda -keys=cuda,gpu -arch=sm_75 -max_num_threads=1024 -thread_warp_size=32", "depthwise_conv2d_nchw.cuda", [["TENSOR", [1, 512, 14, 14], "float32"], ["TENSOR", [512, 1, 3, 3], "float32"], [2, 2], [1, 1, 1, 1], [1, 1], "float32"], {}], "config": {"index": 16284, "code_hash": null, "entity": [["tile_f", "sp", [-1, 16, 1, 1]], ["tile_y", "sp", [-1, 1, 7, 1]], ["tile_x", "sp", [-1, 1, 7, 1]], ["auto_unroll_max_step", "ot", 256], ["unroll_explicit", "ot", 1]]}, "result": [[7.268976689716707e-06, 7.269874414454606e-06, 7.270544055320098e-06], 0, 2.2342402935028076, 1678613616.9540155], "version": 0.2, "tvm_version": "0.10.0"}
{"input": ["cuda -keys=cuda,gpu -arch=sm_75 -max_num_threads=1024 -thread_warp_size=32", "depthwise_conv2d_nchw.cuda", [["TENSOR", [1, 512, 14, 14], "float32"], ["TENSOR", [512, 1, 3, 3], "float32"], [2, 2], [1, 1, 1, 1], [1, 1], "float32"], {}], "config": {"index": 16285, "code_hash": null, "entity": [["tile_f", "sp", [-1, 32, 1, 1]], ["tile_y", "sp", [-1, 1, 7, 1]], ["tile_x", "sp", [-1, 1, 7, 1]], ["auto_unroll_max_step", "ot", 256], ["unroll_explicit", "ot", 1]]}, "result": [[1.0204916744621141e-05, 1.0205054536950422e-05, 1.057436220767072e-05], 0, 3.832415819168091, 1678613620.898586], "version": 0.2, "tvm_version": "0.10.0"}
{"input": ["cuda -keys=cuda,gpu -arch=sm_75 -max_num_threads=1024 -thread_warp_size=32", "depthwise_conv2d_nchw.cuda", [["TENSOR", [1, 512, 14, 14], "float32"], ["TENSOR", [512, 1, 3, 3], "float32"], [2, 2], [1, 1, 1, 1], [1, 1], "float32"], {}], "config": {"index": 16290, "code_hash": null, "entity": [["tile_f", "sp", [-1, 1, 2, 1]], ["tile_y", "sp", [-1, 1, 7, 1]], ["tile_x", "sp", [-1, 1, 7, 1]], ["auto_unroll_max_step", "ot", 256], ["unroll_explicit", "ot", 1]]}, "result": [[6.738429034187182e-06, 6.739436609189674e-06, 6.74007006877305e-06], 0, 1.44651198387146, 1678613622.6676767], "version": 0.2, "tvm_version": "0.10.0"}
{"input": ["cuda -keys=cuda,gpu -arch=sm_75 -max_num_threads=1024 -thread_warp_size=32", "depthwise_conv2d_nchw.cuda", [["TENSOR", [1, 512, 14, 14], "float32"], ["TENSOR", [512, 1, 3, 3], "float32"], [2, 2], [1, 1, 1, 1], [1, 1], "float32"], {}], "config": {"index": 16291, "code_hash": null, "entity": [["tile_f", "sp", [-1, 2, 2, 1]], ["tile_y", "sp", [-1, 1, 7, 1]], ["tile_x", "sp", [-1, 1, 7, 1]], ["auto_unroll_max_step", "ot", 256], ["unroll_explicit", "ot", 1]]}, "result": [[7.42535874960397e-06, 7.425887316506494e-06, 7.426352201922061e-06], 0, 1.4937164783477783, 1678613624.27113], "version": 0.2, "tvm_version": "0.10.0"}
{"input": ["cuda -keys=cuda,gpu -arch=sm_75 -max_num_threads=1024 -thread_warp_size=32", "depthwise_conv2d_nchw.cuda", [["TENSOR", [1, 512, 14, 14], "float32"], ["TENSOR", [512, 1, 3, 3], "float32"], [2, 2], [1, 1, 1, 1], [1, 1], "float32"], {}], "config": {"index": 16292, "code_hash": null, "entity": [["tile_f", "sp", [-1, 4, 2, 1]], ["tile_y", "sp", [-1, 1, 7, 1]], ["tile_x", "sp", [-1, 1, 7, 1]], ["auto_unroll_max_step", "ot", 256], ["unroll_explicit", "ot", 1]]}, "result": [[7.396166309307823e-06, 7.39719313871021e-06, 7.3974481829677286e-06], 0, 1.572866439819336, 1678613625.9545012], "version": 0.2, "tvm_version": "0.10.0"}
{"input": ["cuda -keys=cuda,gpu -arch=sm_75 -max_num_threads=1024 -thread_warp_size=32", "depthwise_conv2d_nchw.cuda", [["TENSOR", [1, 512, 14, 14], "float32"], ["TENSOR", [512, 1, 3, 3], "float32"], [2, 2], [1, 1, 1, 1], [1, 1], "float32"], {}], "config": {"index": 16293, "code_hash": null, "entity": [["tile_f", "sp", [-1, 8, 2, 1]], ["tile_y", "sp", [-1, 1, 7, 1]], ["tile_x", "sp", [-1, 1, 7, 1]], ["auto_unroll_max_step", "ot", 256], ["unroll_explicit", "ot", 1]]}, "result": [[8.243853670305808e-06, 8.244376440074793e-06, 8.245227758007119e-06], 0, 1.8722939491271973, 1678613627.9366488], "version": 0.2, "tvm_version": "0.10.0"}
{"input": ["cuda -keys=cuda,gpu -arch=sm_75 -max_num_threads=1024 -thread_warp_size=32", "depthwise_conv2d_nchw.cuda", [["TENSOR", [1, 512, 14, 14], "float32"], ["TENSOR", [512, 1, 3, 3], "float32"], [2, 2], [1, 1, 1, 1], [1, 1], "float32"], {}], "config": {"index": 16294, "code_hash": null, "entity": [["tile_f", "sp", [-1, 16, 2, 1]], ["tile_y", "sp", [-1, 1, 7, 1]], ["tile_x", "sp", [-1, 1, 7, 1]], ["auto_unroll_max_step", "ot", 256], ["unroll_explicit", "ot", 1]]}, "result": [[1.005347488260831e-05, 1.0065628422078497e-05, 1.0895284309382475e-05], 0, 2.6675617694854736, 1678613630.7169209], "version": 0.2, "tvm_version": "0.10.0"}
{"input": ["cuda -keys=cuda,gpu -arch=sm_75 -max_num_threads=1024 -thread_warp_size=32", "depthwise_conv2d_nchw.cuda", [["TENSOR", [1, 512, 14, 14], "float32"], ["TENSOR", [512, 1, 3, 3], "float32"], [2, 2], [1, 1, 1, 1], [1, 1], "float32"], {}], "config": {"index": 16299, "code_hash": null, "entity": [["tile_f", "sp", [-1, 1, 4, 1]], ["tile_y", "sp", [-1, 1, 7, 1]], ["tile_x", "sp", [-1, 1, 7, 1]], ["auto_unroll_max_step", "ot", 256], ["unroll_explicit", "ot", 1]]}, "result": [[7.609073763955343e-06, 7.609889895192527e-06, 7.6106651856915025e-06], 0, 1.3835985660552979, 1678613632.46342], "version": 0.2, "tvm_version": "0.10.0"}
{"input": ["cuda -keys=cuda,gpu -arch=sm_75 -max_num_threads=1024 -thread_warp_size=32", "depthwise_conv2d_nchw.cuda", [["TENSOR", [1, 512, 14, 14], "float32"], ["TENSOR", [512, 1, 3, 3], "float32"], [2, 2], [1, 1, 1, 1], [1, 1], "float32"], {}], "config": {"index": 16300, "code_hash": null, "entity": [["tile_f", "sp", [-1, 2, 4, 1]], ["tile_y", "sp", [-1, 1, 7, 1]], ["tile_x", "sp", [-1, 1, 7, 1]], ["auto_unroll_max_step", "ot", 256], ["unroll_explicit", "ot", 1]]}, "result": [[8.453290639228904e-06, 8.453564898586718e-06, 8.45432913488262e-06], 0, 1.5646719932556152, 1678613634.1395082], "version": 0.2, "tvm_version": "0.10.0"}
{"input": ["cuda -keys=cuda,gpu -arch=sm_75 -max_num_threads=1024 -thread_warp_size=32", "depthwise_conv2d_nchw.cuda", [["TENSOR", [1, 512, 14, 14], "float32"], ["TENSOR", [512, 1, 3, 3], "float32"], [2, 2], [1, 1, 1, 1], [1, 1], "float32"], {}], "config": {"index": 16301, "code_hash": null, "entity": [["tile_f", "sp", [-1, 4, 4, 1]], ["tile_y", "sp", [-1, 1, 7, 1]], ["tile_x", "sp", [-1, 1, 7, 1]], ["auto_unroll_max_step", "ot", 256], ["unroll_explicit", "ot", 1]]}, "result": [[8.591737900268884e-06, 8.591862869714005e-06, 8.592634013688585e-06], 0, 1.610353708267212, 1678613635.859213], "version": 0.2, "tvm_version": "0.10.0"}
{"input": ["cuda -keys=cuda,gpu -arch=sm_75 -max_num_threads=1024 -thread_warp_size=32", "depthwise_conv2d_nchw.cuda", [["TENSOR", [1, 512, 14, 14], "float32"], ["TENSOR", [512, 1, 3, 3], "float32"], [2, 2], [1, 1, 1, 1], [1, 1], "float32"], {}], "config": {"index": 16302, "code_hash": null, "entity": [["tile_f", "sp", [-1, 8, 4, 1]], ["tile_y", "sp", [-1, 1, 7, 1]], ["tile_x", "sp", [-1, 1, 7, 1]], ["auto_unroll_max_step", "ot", 256], ["unroll_explicit", "ot", 1]]}, "result": [[1.2363021735523478e-05, 1.2363407831425252e-05, 1.2364966152314584e-05], 0, 2.0548834800720215, 1678613638.0246623], "version": 0.2, "tvm_version": "0.10.0"}
{"input": ["cuda -keys=cuda,gpu -arch=sm_75 -max_num_threads=1024 -thread_warp_size=32", "depthwise_conv2d_nchw.cuda", [["TENSOR", [1, 512, 14, 14], "float32"], ["TENSOR", [512, 1, 3, 3], "float32"], [2, 2], [1, 1, 1, 1], [1, 1], "float32"], {}], "config": {"index": 16307, "code_hash": null, "entity": [["tile_f", "sp", [-1, 1, 8, 1]], ["tile_y", "sp", [-1, 1, 7, 1]], ["tile_x", "sp", [-1, 1, 7, 1]], ["auto_unroll_max_step", "ot", 256], ["unroll_explicit", "ot", 1]]}, "result": [[8.47318669029577e-06, 8.473726594964556e-06, 8.47373686140308e-06], 0, 1.4754798412322998, 1678613639.900265], "version": 0.2, "tvm_version": "0.10.0"}
{"input": ["cuda -keys=cuda,gpu -arch=sm_75 -max_num_threads=1024 -thread_warp_size=32", "depthwise_conv2d_nchw.cuda", [["TENSOR", [1, 512, 14, 14], "float32"], ["TENSOR", [512, 1, 3, 3], "float32"], [2, 2], [1, 1, 1, 1], [1, 1], "float32"], {}], "config": {"index": 16308, "code_hash": null, "entity": [["tile_f", "sp", [-1, 2, 8, 1]], ["tile_y", "sp", [-1, 1, 7, 1]], ["tile_x", "sp", [-1, 1, 7, 1]], ["auto_unroll_max_step", "ot", 256], ["unroll_explicit", "ot", 1]]}, "result": [[9.541473544973546e-06, 9.542569827346142e-06, 9.543360136452242e-06], 0, 1.5119800567626953, 1678613641.5227394], "version": 0.2, "tvm_version": "0.10.0"}
{"input": ["cuda -keys=cuda,gpu -arch=sm_75 -max_num_threads=1024 -thread_warp_size=32", "depthwise_conv2d_nchw.cuda", [["TENSOR", [1, 512, 14, 14], "float32"], ["TENSOR", [512, 1, 3, 3], "float32"], [2, 2], [1, 1, 1, 1], [1, 1], "float32"], {}], "config": {"index": 16309, "code_hash": null, "entity": [["tile_f", "sp", [-1, 4, 8, 1]], ["tile_y", "sp", [-1, 1, 7, 1]], ["tile_x", "sp", [-1, 1, 7, 1]], ["auto_unroll_max_step", "ot", 256], ["unroll_explicit", "ot", 1]]}, "result": [[9.872895204138702e-06, 9.872966652684563e-06, 9.873270693512304e-06], 0, 1.6689162254333496, 1678613643.3031132], "version": 0.2, "tvm_version": "0.10.0"}
{"input": ["cuda -keys=cuda,gpu -arch=sm_75 -max_num_threads=1024 -thread_warp_size=32", "depthwise_conv2d_nchw.cuda", [["TENSOR", [1, 512, 14, 14], "float32"], ["TENSOR", [512, 1, 3, 3], "float32"], [2, 2], [1, 1, 1, 1], [1, 1], "float32"], {}], "config": {"index": 16314, "code_hash": null, "entity": [["tile_f", "sp", [-1, 1, 16, 1]], ["tile_y", "sp", [-1, 1, 7, 1]], ["tile_x", "sp", [-1, 1, 7, 1]], ["auto_unroll_max_step", "ot", 256], ["unroll_explicit", "ot", 1]]}, "result": [[9.310021261785735e-06, 9.310090805543253e-06, 9.311918623046256e-06], 0, 1.5324642658233643, 1678613645.1799202], "version": 0.2, "tvm_version": "0.10.0"}
{"input": ["cuda -keys=cuda,gpu -arch=sm_75 -max_num_threads=1024 -thread_warp_size=32", "depthwise_conv2d_nchw.cuda", [["TENSOR", [1, 512, 14, 14], "float32"], ["TENSOR", [512, 1, 3, 3], "float32"], [2, 2], [1, 1, 1, 1], [1, 1], "float32"], {}], "config": {"index": 16315, "code_hash": null, "entity": [["tile_f", "sp", [-1, 2, 16, 1]], ["tile_y", "sp", [-1, 1, 7, 1]], ["tile_x", "sp", [-1, 1, 7, 1]], ["auto_unroll_max_step", "ot", 256], ["unroll_explicit", "ot", 1]]}, "result": [[1.0867790856622115e-05, 1.0868646035844473e-05, 1.0869875531591739e-05], 0, 1.5610086917877197, 1678613646.853397], "version": 0.2, "tvm_version": "0.10.0"}
{"input": ["cuda -keys=cuda,gpu -arch=sm_75 -max_num_threads=1024 -thread_warp_size=32", "depthwise_conv2d_nchw.cuda", [["TENSOR", [1, 512, 14, 14], "float32"], ["TENSOR", [512, 1, 3, 3], "float32"], [2, 2], [1, 1, 1, 1], [1, 1], "float32"], {}], "config": {"index": 16335, "code_hash": null, "entity": [["tile_f", "sp", [-1, 1, 1, 2]], ["tile_y", "sp", [-1, 1, 7, 1]], ["tile_x", "sp", [-1, 1, 7, 1]], ["auto_unroll_max_step", "ot", 256], ["unroll_explicit", "ot", 1]]}, "result": [[5.263709626297224e-06, 5.277168038443842e-06, 5.944605695005368e-06], 0, 1.3989953994750977, 1678613649.4991405], "version": 0.2, "tvm_version": "0.10.0"}
{"input": ["cuda -keys=cuda,gpu -arch=sm_75 -max_num_threads=1024 -thread_warp_size=32", "depthwise_conv2d_nchw.cuda", [["TENSOR", [1, 512, 14, 14], "float32"], ["TENSOR", [512, 1, 3, 3], "float32"], [2, 2], [1, 1, 1, 1], [1, 1], "float32"], {}], "config": {"index": 16336, "code_hash": null, "entity": [["tile_f", "sp", [-1, 2, 1, 2]], ["tile_y", "sp", [-1, 1, 7, 1]], ["tile_x", "sp", [-1, 1, 7, 1]], ["auto_unroll_max_step", "ot", 256], ["unroll_explicit", "ot", 1]]}, "result": [[5.9718583965426e-06, 5.972648394778621e-06, 5.973722349620744e-06], 0, 1.5677893161773682, 1678613651.1784294], "version": 0.2, "tvm_version": "0.10.0"}
{"input": ["cuda -keys=cuda,gpu -arch=sm_75 -max_num_threads=1024 -thread_warp_size=32", "depthwise_conv2d_nchw.cuda", [["TENSOR", [1, 512, 14, 14], "float32"], ["TENSOR", [512, 1, 3, 3], "float32"], [2, 2], [1, 1, 1, 1], [1, 1], "float32"], {}], "config": {"index": 16337, "code_hash": null, "entity": [["tile_f", "sp", [-1, 4, 1, 2]], ["tile_y", "sp", [-1, 1, 7, 1]], ["tile_x", "sp", [-1, 1, 7, 1]], ["auto_unroll_max_step", "ot", 256], ["unroll_explicit", "ot", 1]]}, "result": [[6.472435570952939e-06, 6.473328084225682e-06, 6.4738505354089795e-06], 0, 1.7825398445129395, 1678613653.069119], "version": 0.2, "tvm_version": "0.10.0"}
{"input": ["cuda -keys=cuda,gpu -arch=sm_75 -max_num_threads=1024 -thread_warp_size=32", "depthwise_conv2d_nchw.cuda", [["TENSOR", [1, 512, 14, 14], "float32"], ["TENSOR", [512, 1, 3, 3], "float32"], [2, 2], [1, 1, 1, 1], [1, 1], "float32"], {}], "config": {"index": 16338, "code_hash": null, "entity": [["tile_f", "sp", [-1, 8, 1, 2]], ["tile_y", "sp", [-1, 1, 7, 1]], ["tile_x", "sp", [-1, 1, 7, 1]], ["auto_unroll_max_step", "ot", 256], ["unroll_explicit", "ot", 1]]}, "result": [[7.29662639946833e-06, 7.29716461326108e-06, 7.297249629364552e-06], 0, 2.372084379196167, 1678613655.5534074], "version": 0.2, "tvm_version": "0.10.0"}
{"input": ["cuda -keys=cuda,gpu -arch=sm_75 -max_num_threads=1024 -thread_warp_size=32", "depthwise_conv2d_nchw.cuda", [["TENSOR", [1, 512, 14, 14], "float32"], ["TENSOR", [512, 1, 3, 3], "float32"], [2, 2], [1, 1, 1, 1], [1, 1], "float32"], {}], "config": {"index": 16339, "code_hash": null, "entity": [["tile_f", "sp", [-1, 16, 1, 2]], ["tile_y", "sp", [-1, 1, 7, 1]], ["tile_x", "sp", [-1, 1, 7, 1]], ["auto_unroll_max_step", "ot", 256], ["unroll_explicit", "ot", 1]]}, "result": [[1.0247785449615906e-05, 1.0252161048350655e-05, 1.0819785268865793e-05], 0, 4.321917295455933, 1678613659.988221], "version": 0.2, "tvm_version": "0.10.0"}
{"input": ["cuda -keys=cuda,gpu -arch=sm_75 -max_num_threads=1024 -thread_warp_size=32", "depthwise_conv2d_nchw.cuda", [["TENSOR", [1, 512, 14, 14], "float32"], ["TENSOR", [512, 1, 3, 3], "float32"], [2, 2], [1, 1, 1, 1], [1, 1], "float32"], {}], "config": {"index": 16344, "code_hash": null, "entity": [["tile_f", "sp", [-1, 1, 2, 2]], ["tile_y", "sp", [-1, 1, 7, 1]], ["tile_x", "sp", [-1, 1, 7, 1]], ["auto_unroll_max_step", "ot", 256], ["unroll_explicit", "ot", 1]]}, "result": [[6.579951042932362e-06, 6.580179728635074e-06, 6.5806494025921425e-06], 0, 1.4819667339324951, 1678613661.8471782], "version": 0.2, "tvm_version": "0.10.0"}
{"input": ["cuda -keys=cuda,gpu -arch=sm_75 -max_num_threads=1024 -thread_warp_size=32", "depthwise_conv2d_nchw.cuda", [["TENSOR", [1, 512, 14, 14], "float32"], ["TENSOR", [512, 1, 3, 3], "float32"], [2, 2], [1, 1, 1, 1], [1, 1], "float32"], {}], "config": {"index": 16345, "code_hash": null, "entity": [["tile_f", "sp", [-1, 2, 2, 2]], ["tile_y", "sp", [-1, 1, 7, 1]], ["tile_x", "sp", [-1, 1, 7, 1]], ["auto_unroll_max_step", "ot", 256], ["unroll_explicit", "ot", 1]]}, "result": [[6.452627693040991e-06, 6.45357316491897e-06, 6.454425548141087e-06], 0, 1.6393256187438965, 1678613663.599076], "version": 0.2, "tvm_version": "0.10.0"}
{"input": ["cuda -keys=cuda,gpu -arch=sm_75 -max_num_threads=1024 -thread_warp_size=32", "depthwise_conv2d_nchw.cuda", [["TENSOR", [1, 512, 14, 14], "float32"], ["TENSOR", [512, 1, 3, 3], "float32"], [2, 2], [1, 1, 1, 1], [1, 1], "float32"], {}], "config": {"index": 16346, "code_hash": null, "entity": [["tile_f", "sp", [-1, 4, 2, 2]], ["tile_y", "sp", [-1, 1, 7, 1]], ["tile_x", "sp", [-1, 1, 7, 1]], ["auto_unroll_max_step", "ot", 256], ["unroll_explicit", "ot", 1]]}, "result": [[7.3416658043654e-06, 7.342115602263542e-06, 7.342909188897871e-06], 0, 1.8742759227752686, 1678613665.5831697], "version": 0.2, "tvm_version": "0.10.0"}
{"input": ["cuda -keys=cuda,gpu -arch=sm_75 -max_num_threads=1024 -thread_warp_size=32", "depthwise_conv2d_nchw.cuda", [["TENSOR", [1, 512, 14, 14], "float32"], ["TENSOR", [512, 1, 3, 3], "float32"], [2, 2], [1, 1, 1, 1], [1, 1], "float32"], {}], "config": {"index": 16347, "code_hash": null, "entity": [["tile_f", "sp", [-1, 8, 2, 2]], ["tile_y", "sp", [-1, 1, 7, 1]], ["tile_x", "sp", [-1, 1, 7, 1]], ["auto_unroll_max_step", "ot", 256], ["unroll_explicit", "ot", 1]]}, "result": [[8.781527155519741e-06, 8.781975906526995e-06, 8.811077679290894e-06], 0, 2.5652194023132324, 1678613668.2607875], "version": 0.2, "tvm_version": "0.10.0"}
{"input": ["cuda -keys=cuda,gpu -arch=sm_75 -max_num_threads=1024 -thread_warp_size=32", "depthwise_conv2d_nchw.cuda", [["TENSOR", [1, 512, 14, 14], "float32"], ["TENSOR", [512, 1, 3, 3], "float32"], [2, 2], [1, 1, 1, 1], [1, 1], "float32"], {}], "config": {"index": 16352, "code_hash": null, "entity": [["tile_f", "sp", [-1, 1, 4, 2]], ["tile_y", "sp", [-1, 1, 7, 1]], ["tile_x", "sp", [-1, 1, 7, 1]], ["auto_unroll_max_step", "ot", 256], ["unroll_explicit", "ot", 1]]}, "result": [[7.60062968490879e-06, 7.601479104477613e-06, 7.601487562189054e-06], 0, 1.5263242721557617, 1678613670.2004993], "version": 0.2, "tvm_version": "0.10.0"}
{"input": ["cuda -keys=cuda,gpu -arch=sm_75 -max_num_threads=1024 -thread_warp_size=32", "depthwise_conv2d_nchw.cuda", [["TENSOR", [1, 512, 14, 14], "float32"], ["TENSOR", [512, 1, 3, 3], "float32"], [2, 2], [1, 1, 1, 1], [1, 1], "float32"], {}], "config": {"index": 16353, "code_hash": null, "entity": [["tile_f", "sp", [-1, 2, 4, 2]], ["tile_y", "sp", [-1, 1, 7, 1]], ["tile_x", "sp", [-1, 1, 7, 1]], ["auto_unroll_max_step", "ot", 256], ["unroll_explicit", "ot", 1]]}, "result": [[7.607476440085673e-06, 7.608193721113743e-06, 7.608374309547966e-06], 0, 1.6339547634124756, 1678613671.944809], "version": 0.2, "tvm_version": "0.10.0"}
{"input": ["cuda -keys=cuda,gpu -arch=sm_75 -max_num_threads=1024 -thread_warp_size=32", "depthwise_conv2d_nchw.cuda", [["TENSOR", [1, 512, 14, 14], "float32"], ["TENSOR", [512, 1, 3, 3], "float32"], [2, 2], [1, 1, 1, 1], [1, 1], "float32"], {}], "config": {"index": 16354, "code_hash": null, "entity": [["tile_f", "sp", [-1, 4, 4, 2]], ["tile_y", "sp", [-1, 1, 7, 1]], ["tile_x", "sp", [-1, 1, 7, 1]], ["auto_unroll_max_step", "ot", 256], ["unroll_explicit", "ot", 1]]}, "result": [[1.1217064620355412e-05, 1.1217308716055081e-05, 1.1217601046234328e-05], 0, 1.9490344524383545, 1678613674.0076625], "version": 0.2, "tvm_version": "0.10.0"}
{"input": ["cuda -keys=cuda,gpu -arch=sm_75 -max_num_threads=1024 -thread_warp_size=32", "depthwise_conv2d_nchw.cuda", [["TENSOR", [1, 512, 14, 14], "float32"], ["TENSOR", [512, 1, 3, 3], "float32"], [2, 2], [1, 1, 1, 1], [1, 1], "float32"], {}], "config": {"index": 16359, "code_hash": null, "entity": [["tile_f", "sp", [-1, 1, 8, 2]], ["tile_y", "sp", [-1, 1, 7, 1]], ["tile_x", "sp", [-1, 1, 7, 1]], ["auto_unroll_max_step", "ot", 256], ["unroll_explicit", "ot", 1]]}, "result": [[8.738685787724909e-06, 8.738774747664724e-06, 8.739868158736129e-06], 0, 1.560107946395874, 1678613675.9175017], "version": 0.2, "tvm_version": "0.10.0"}
{"input": ["cuda -keys=cuda,gpu -arch=sm_75 -max_num_threads=1024 -thread_warp_size=32", "depthwise_conv2d_nchw.cuda", [["TENSOR", [1, 512, 14, 14], "float32"], ["TENSOR", [512, 1, 3, 3], "float32"], [2, 2], [1, 1, 1, 1], [1, 1], "float32"], {}], "config": {"index": 16360, "code_hash": null, "entity": [["tile_f", "sp", [-1, 2, 8, 2]], ["tile_y", "sp", [-1, 1, 7, 1]], ["tile_x", "sp", [-1, 1, 7, 1]], ["auto_unroll_max_step", "ot", 256], ["unroll_explicit", "ot", 1]]}, "result": [[8.783696743093752e-06, 8.783969284963848e-06, 8.784073975650454e-06], 0, 1.6564171314239502, 1678613677.6854837], "version": 0.2, "tvm_version": "0.10.0"}
{"input": ["cuda -keys=cuda,gpu -arch=sm_75 -max_num_threads=1024 -thread_warp_size=32", "depthwise_conv2d_nchw.cuda", [["TENSOR", [1, 512, 14, 14], "float32"], ["TENSOR", [512, 1, 3, 3], "float32"], [2, 2], [1, 1, 1, 1], [1, 1], "float32"], {}], "config": {"index": 16365, "code_hash": null, "entity": [["tile_f", "sp", [-1, 1, 16, 2]], ["tile_y", "sp", [-1, 1, 7, 1]], ["tile_x", "sp", [-1, 1, 7, 1]], ["auto_unroll_max_step", "ot", 256], ["unroll_explicit", "ot", 1]]}, "result": [[9.829138330246097e-06, 9.829313971950252e-06, 9.830427361735909e-06], 0, 1.5378146171569824, 1678613679.5555966], "version": 0.2, "tvm_version": "0.10.0"}
{"input": ["cuda -keys=cuda,gpu -arch=sm_75 -max_num_threads=1024 -thread_warp_size=32", "depthwise_conv2d_nchw.cuda", [["TENSOR", [1, 512, 14, 14], "float32"], ["TENSOR", [512, 1, 3, 3], "float32"], [2, 2], [1, 1, 1, 1], [1, 1], "float32"], {}], "config": {"index": 16380, "code_hash": null, "entity": [["tile_f", "sp", [-1, 1, 1, 4]], ["tile_y", "sp", [-1, 1, 7, 1]], ["tile_x", "sp", [-1, 1, 7, 1]], ["auto_unroll_max_step", "ot", 256], ["unroll_explicit", "ot", 1]]}, "result": [[5.9730781558628116e-06, 5.97318023882205e-06, 5.9994084216196805e-06], 0, 1.5915913581848145, 1678613682.1397355], "version": 0.2, "tvm_version": "0.10.0"}
{"input": ["cuda -keys=cuda,gpu -arch=sm_75 -max_num_threads=1024 -thread_warp_size=32", "depthwise_conv2d_nchw.cuda", [["TENSOR", [1, 512, 14, 14], "float32"], ["TENSOR", [512, 1, 3, 3], "float32"], [2, 2], [1, 1, 1, 1], [1, 1], "float32"], {}], "config": {"index": 16381, "code_hash": null, "entity": [["tile_f", "sp", [-1, 2, 1, 4]], ["tile_y", "sp", [-1, 1, 7, 1]], ["tile_x", "sp", [-1, 1, 7, 1]], ["auto_unroll_max_step", "ot", 256], ["unroll_explicit", "ot", 1]]}, "result": [[6.4637911950892e-06, 6.4640231632457324e-06, 6.464070736619989e-06], 0, 1.7030034065246582, 1678613683.9543738], "version": 0.2, "tvm_version": "0.10.0"}
{"input": ["cuda -keys=cuda,gpu -arch=sm_75 -max_num_threads=1024 -thread_warp_size=32", "depthwise_conv2d_nchw.cuda", [["TENSOR", [1, 512, 14, 14], "float32"], ["TENSOR", [512, 1, 3, 3], "float32"], [2, 2], [1, 1, 1, 1], [1, 1], "float32"], {}], "config": {"index": 16382, "code_hash": null, "entity": [["tile_f", "sp", [-1, 4, 1, 4]], ["tile_y", "sp", [-1, 1, 7, 1]], ["tile_x", "sp", [-1, 1, 7, 1]], ["auto_unroll_max_step", "ot", 256], ["unroll_explicit", "ot", 1]]}, "result": [[7.321976975630749e-06, 7.322884017429663e-06, 7.3233986766367205e-06], 0, 2.3753271102905273, 1678613686.4383323], "version": 0.2, "tvm_version": "0.10.0"}
{"input": ["cuda -keys=cuda,gpu -arch=sm_75 -max_num_threads=1024 -thread_warp_size=32", "depthwise_conv2d_nchw.cuda", [["TENSOR", [1, 512, 14, 14], "float32"], ["TENSOR", [512, 1, 3, 3], "float32"], [2, 2], [1, 1, 1, 1], [1, 1], "float32"], {}], "config": {"index": 16383, "code_hash": null, "entity": [["tile_f", "sp", [-1, 8, 1, 4]], ["tile_y", "sp", [-1, 1, 7, 1]], ["tile_x", "sp", [-1, 1, 7, 1]], ["auto_unroll_max_step", "ot", 256], ["unroll_explicit", "ot", 1]]}, "result": [[1.0307201917600151e-05, 1.031905515473704e-05, 1.1015145054110498e-05], 0, 3.6802101135253906, 1678613690.232036], "version": 0.2, "tvm_version": "0.10.0"}
{"input": ["cuda -keys=cuda,gpu -arch=sm_75 -max_num_threads=1024 -thread_warp_size=32", "depthwise_conv2d_nchw.cuda", [["TENSOR", [1, 512, 14, 14], "float32"], ["TENSOR", [512, 1, 3, 3], "float32"], [2, 2], [1, 1, 1, 1], [1, 1], "float32"], {}], "config": {"index": 16388, "code_hash": null, "entity": [["tile_f", "sp", [-1, 1, 2, 4]], ["tile_y", "sp", [-1, 1, 7, 1]], ["tile_x", "sp", [-1, 1, 7, 1]], ["auto_unroll_max_step", "ot", 256], ["unroll_explicit", "ot", 1]]}, "result": [[6.386673366604093e-06, 6.386938143857882e-06, 6.387378966164552e-06], 0, 1.6073687076568604, 1678613692.2111583], "version": 0.2, "tvm_version": "0.10.0"}
{"input": ["cuda -keys=cuda,gpu -arch=sm_75 -max_num_threads=1024 -thread_warp_size=32", "depthwise_conv2d_nchw.cuda", [["TENSOR", [1, 512, 14, 14], "float32"], ["TENSOR", [512, 1, 3, 3], "float32"], [2, 2], [1, 1, 1, 1], [1, 1], "float32"], {}], "config": {"index": 16389, "code_hash": null, "entity": [["tile_f", "sp", [-1, 2, 2, 4]], ["tile_y", "sp", [-1, 1, 7, 1]], ["tile_x", "sp", [-1, 1, 7, 1]], ["auto_unroll_max_step", "ot", 256], ["unroll_explicit", "ot", 1]]}, "result": [[7.204988565759932e-06, 7.205379731634732e-06, 7.205703962825668e-06], 0, 1.8575470447540283, 1678613694.1775455], "version": 0.2, "tvm_version": "0.10.0"}
{"input": ["cuda -keys=cuda,gpu -arch=sm_75 -max_num_threads=1024 -thread_warp_size=32", "depthwise_conv2d_nchw.cuda", [["TENSOR", [1, 512, 14, 14], "float32"], ["TENSOR", [512, 1, 3, 3], "float32"], [2, 2], [1, 1, 1, 1], [1, 1], "float32"], {}], "config": {"index": 16390, "code_hash": null, "entity": [["tile_f", "sp", [-1, 4, 2, 4]], ["tile_y", "sp", [-1, 1, 7, 1]], ["tile_x", "sp", [-1, 1, 7, 1]], ["auto_unroll_max_step", "ot", 256], ["unroll_explicit", "ot", 1]]}, "result": [[8.560899807784719e-06, 8.56115337177639e-06, 8.607144241550535e-06], 0, 2.6009819507598877, 1678613696.888619], "version": 0.2, "tvm_version": "0.10.0"}
{"input": ["cuda -keys=cuda,gpu -arch=sm_75 -max_num_threads=1024 -thread_warp_size=32", "depthwise_conv2d_nchw.cuda", [["TENSOR", [1, 512, 14, 14], "float32"], ["TENSOR", [512, 1, 3, 3], "float32"], [2, 2], [1, 1, 1, 1], [1, 1], "float32"], {}], "config": {"index": 16395, "code_hash": null, "entity": [["tile_f", "sp", [-1, 1, 4, 4]], ["tile_y", "sp", [-1, 1, 7, 1]], ["tile_x", "sp", [-1, 1, 7, 1]], ["auto_unroll_max_step", "ot", 256], ["unroll_explicit", "ot", 1]]}, "result": [[7.537221071637194e-06, 7.5381488503000375e-06, 7.538245287026711e-06], 0, 1.6878180503845215, 1678613698.9658818], "version": 0.2, "tvm_version": "0.10.0"}
{"input": ["cuda -keys=cuda,gpu -arch=sm_75 -max_num_threads=1024 -thread_warp_size=32", "depthwise_conv2d_nchw.cuda", [["TENSOR", [1, 512, 14, 14], "float32"], ["TENSOR", [512, 1, 3, 3], "float32"], [2, 2], [1, 1, 1, 1], [1, 1], "float32"], {}], "config": {"index": 16396, "code_hash": null, "entity": [["tile_f", "sp", [-1, 2, 4, 4]], ["tile_y", "sp", [-1, 1, 7, 1]], ["tile_x", "sp", [-1, 1, 7, 1]], ["auto_unroll_max_step", "ot", 256], ["unroll_explicit", "ot", 1]]}, "result": [[1.1119550784538844e-05, 1.1119827631075392e-05, 1.1120332108687333e-05], 0, 2.008090019226074, 1678613701.0856664], "version": 0.2, "tvm_version": "0.10.0"}
{"input": ["cuda -keys=cuda,gpu -arch=sm_75 -max_num_threads=1024 -thread_warp_size=32", "depthwise_conv2d_nchw.cuda", [["TENSOR", [1, 512, 14, 14], "float32"], ["TENSOR", [512, 1, 3, 3], "float32"], [2, 2], [1, 1, 1, 1], [1, 1], "float32"], {}], "config": {"index": 16401, "code_hash": null, "entity": [["tile_f", "sp", [-1, 1, 8, 4]], ["tile_y", "sp", [-1, 1, 7, 1]], ["tile_x", "sp", [-1, 1, 7, 1]], ["auto_unroll_max_step", "ot", 256], ["unroll_explicit", "ot", 1]]}, "result": [[8.689981846135653e-06, 8.690078410502041e-06, 8.690602625510023e-06], 0, 1.730703353881836, 1678613703.1468682], "version": 0.2, "tvm_version": "0.10.0"}
{"input": ["cuda -keys=cuda,gpu -arch=sm_75 -max_num_threads=1024 -thread_warp_size=32", "depthwise_conv2d_nchw.cuda", [["TENSOR", [1, 512, 14, 14], "float32"], ["TENSOR", [512, 1, 3, 3], "float32"], [2, 2], [1, 1, 1, 1], [1, 1], "float32"], {}], "config": {"index": 16416, "code_hash": null, "entity": [["tile_f", "sp", [-1, 1, 1, 8]], ["tile_y", "sp", [-1, 1, 7, 1]], ["tile_x", "sp", [-1, 1, 7, 1]], ["auto_unroll_max_step", "ot", 256], ["unroll_explicit", "ot", 1]]}, "result": [[6.471652690676701e-06, 6.483332138804277e-06, 7.055127515976826e-06], 0, 1.691260576248169, 1678613705.856418], "version": 0.2, "tvm_version": "0.10.0"}
{"input": ["cuda -keys=cuda,gpu -arch=sm_75 -max_num_threads=1024 -thread_warp_size=32", "depthwise_conv2d_nchw.cuda", [["TENSOR", [1, 512, 14, 14], "float32"], ["TENSOR", [512, 1, 3, 3], "float32"], [2, 2], [1, 1, 1, 1], [1, 1], "float32"], {}], "config": {"index": 16417, "code_hash": null, "entity": [["tile_f", "sp", [-1, 2, 1, 8]], ["tile_y", "sp", [-1, 1, 7, 1]], ["tile_x", "sp", [-1, 1, 7, 1]], ["auto_unroll_max_step", "ot", 256], ["unroll_explicit", "ot", 1]]}, "result": [[7.299940396625396e-06, 7.300352525473869e-06, 7.300665169277967e-06], 0, 2.2770090103149414, 1678613708.2444239], "version": 0.2, "tvm_version": "0.10.0"}
{"input": ["cuda -keys=cuda,gpu -arch=sm_75 -max_num_threads=1024 -thread_warp_size=32", "depthwise_conv2d_nchw.cuda", [["TENSOR", [1, 512, 14, 14], "float32"], ["TENSOR", [512, 1, 3, 3], "float32"], [2, 2], [1, 1, 1, 1], [1, 1], "float32"], {}], "config": {"index": 16418, "code_hash": null, "entity": [["tile_f", "sp", [-1, 4, 1, 8]], ["tile_y", "sp", [-1, 1, 7, 1]], ["tile_x", "sp", [-1, 1, 7, 1]], ["auto_unroll_max_step", "ot", 256], ["unroll_explicit", "ot", 1]]}, "result": [[1.0305511581614187e-05, 1.0359466883821933e-05, 1.069955826999638e-05], 0, 3.4740231037139893, 1678613711.8290913], "version": 0.2, "tvm_version": "0.10.0"}
{"input": ["cuda -keys=cuda,gpu -arch=sm_75 -max_num_threads=1024 -thread_warp_size=32", "depthwise_conv2d_nchw.cuda", [["TENSOR", [1, 512, 14, 14], "float32"], ["TENSOR", [512, 1, 3, 3], "float32"], [2, 2], [1, 1, 1, 1], [1, 1], "float32"], {}], "config": {"index": 16423, "code_hash": null, "entity": [["tile_f", "sp", [-1, 1, 2, 8]], ["tile_y", "sp", [-1, 1, 7, 1]], ["tile_x", "sp", [-1, 1, 7, 1]], ["auto_unroll_max_step", "ot", 256], ["unroll_explicit", "ot", 1]]}, "result": [[7.191129107615636e-06, 7.193904739656337e-06, 7.194646161034108e-06], 0, 1.910942554473877, 1678613714.0657594], "version": 0.2, "tvm_version": "0.10.0"}
{"input": ["cuda -keys=cuda,gpu -arch=sm_75 -max_num_threads=1024 -thread_warp_size=32", "depthwise_conv2d_nchw.cuda", [["TENSOR", [1, 512, 14, 14], "float32"], ["TENSOR", [512, 1, 3, 3], "float32"], [2, 2], [1, 1, 1, 1], [1, 1], "float32"], {}], "config": {"index": 16424, "code_hash": null, "entity": [["tile_f", "sp", [-1, 2, 2, 8]], ["tile_y", "sp", [-1, 1, 7, 1]], ["tile_x", "sp", [-1, 1, 7, 1]], ["auto_unroll_max_step", "ot", 256], ["unroll_explicit", "ot", 1]]}, "result": [[8.427251394939998e-06, 8.427424596805014e-06, 8.444328441488956e-06], 0, 2.61326003074646, 1678613716.789614], "version": 0.2, "tvm_version": "0.10.0"}
{"input": ["cuda -keys=cuda,gpu -arch=sm_75 -max_num_threads=1024 -thread_warp_size=32", "depthwise_conv2d_nchw.cuda", [["TENSOR", [1, 512, 14, 14], "float32"], ["TENSOR", [512, 1, 3, 3], "float32"], [2, 2], [1, 1, 1, 1], [1, 1], "float32"], {}], "config": {"index": 16429, "code_hash": null, "entity": [["tile_f", "sp", [-1, 1, 4, 8]], ["tile_y", "sp", [-1, 1, 7, 1]], ["tile_x", "sp", [-1, 1, 7, 1]], ["auto_unroll_max_step", "ot", 256], ["unroll_explicit", "ot", 1]]}, "result": [[1.1079351827726263e-05, 1.1079430224538276e-05, 1.107990144838685e-05], 0, 2.012829065322876, 1678613719.1015406], "version": 0.2, "tvm_version": "0.10.0"}
{"input": ["cuda -keys=cuda,gpu -arch=sm_75 -max_num_threads=1024 -thread_warp_size=32", "depthwise_conv2d_nchw.cuda", [["TENSOR", [1, 512, 14, 14], "float32"], ["TENSOR", [512, 1, 3, 3], "float32"], [2, 2], [1, 1, 1, 1], [1, 1], "float32"], {}], "config": {"index": 16444, "code_hash": null, "entity": [["tile_f", "sp", [-1, 1, 1, 16]], ["tile_y", "sp", [-1, 1, 7, 1]], ["tile_x", "sp", [-1, 1, 7, 1]], ["auto_unroll_max_step", "ot", 256], ["unroll_explicit", "ot", 1]]}, "result": [[7.285205355993305e-06, 7.285708317239603e-06, 7.323439294450881e-06], 0, 2.289267063140869, 1678613722.367115], "version": 0.2, "tvm_version": "0.10.0"}
{"input": ["cuda -keys=cuda,gpu -arch=sm_75 -max_num_threads=1024 -thread_warp_size=32", "depthwise_conv2d_nchw.cuda", [["TENSOR", [1, 512, 14, 14], "float32"], ["TENSOR", [512, 1, 3, 3], "float32"], [2, 2], [1, 1, 1, 1], [1, 1], "float32"], {}], "config": {"index": 16445, "code_hash": null, "entity": [["tile_f", "sp", [-1, 2, 1, 16]], ["tile_y", "sp", [-1, 1, 7, 1]], ["tile_x", "sp", [-1, 1, 7, 1]], ["auto_unroll_max_step", "ot", 256], ["unroll_explicit", "ot", 1]]}, "result": [[1.0348066256767918e-05, 1.035050977333211e-05, 1.0820072772322658e-05], 0, 3.4617843627929688, 1678613725.9385648], "version": 0.2, "tvm_version": "0.10.0"}
{"input": ["cuda -keys=cuda,gpu -arch=sm_75 -max_num_threads=1024 -thread_warp_size=32", "depthwise_conv2d_nchw.cuda", [["TENSOR", [1, 512, 14, 14], "float32"], ["TENSOR", [512, 1, 3, 3], "float32"], [2, 2], [1, 1, 1, 1], [1, 1], "float32"], {}], "config": {"index": 16450, "code_hash": null, "entity": [["tile_f", "sp", [-1, 1, 2, 16]], ["tile_y", "sp", [-1, 1, 7, 1]], ["tile_x", "sp", [-1, 1, 7, 1]], ["auto_unroll_max_step", "ot", 256], ["unroll_explicit", "ot", 1]]}, "result": [[8.54506204434994e-06, 8.55204829890644e-06, 9.157426412515189e-06], 0, 2.6489830017089844, 1678613728.933878], "version": 0.2, "tvm_version": "0.10.0"}
{"input": ["cuda -keys=cuda,gpu -arch=sm_75 -max_num_threads=1024 -thread_warp_size=32", "depthwise_conv2d_nchw.cuda", [["TENSOR", [1, 512, 14, 14], "float32"], ["TENSOR", [512, 1, 3, 3], "float32"], [2, 2], [1, 1, 1, 1], [1, 1], "float32"], {}], "config": {"index": 16465, "code_hash": null, "entity": [["tile_f", "sp", [-1, 1, 1, 32]], ["tile_y", "sp", [-1, 1, 7, 1]], ["tile_x", "sp", [-1, 1, 7, 1]], ["auto_unroll_max_step", "ot", 256], ["unroll_explicit", "ot", 1]]}, "result": [[1.022709481726963e-05, 1.022790177667311e-05, 1.0286124827395747e-05], 0, 3.439206600189209, 1678613733.3789785], "version": 0.2, "tvm_version": "0.10.0"}
