results/cuda_rtx3080/inception_v3/droplet/cpu.log_layer_26.log
{"input": ["cuda -keys=cuda,gpu -arch=sm_86 -max_num_threads=1024 -thread_warp_size=32", "conv2d_nchw.cuda", [["TENSOR", [1, 128, 17, 17], "float32"], ["TENSOR", [192, 128, 7, 1], "float32"], [1, 1], [3, 0, 3, 0], [1, 1], "float32"], {}], "config": {"index": 0, "code_hash": null, "entity": [["tile_f", "sp", [-1, 1, 1, 1]], ["tile_y", "sp", [-1, 1, 1, 1]], ["tile_x", "sp", [-1, 1, 1, 1]], ["tile_rc", "sp", [-1, 1]], ["tile_ry", "sp", [-1, 1]], ["tile_rx", "sp", [-1, 1]], ["auto_unroll_max_step", "ot", 0], ["unroll_explicit", "ot", 0]]}, "result": [[0.0014238503661971832, 0.001423893661971831, 0.0014239513661971834], 0, 0.99349045753479, 1679305450.107361], "version": 0.2, "tvm_version": "0.10.0"}
{"input": ["cuda -keys=cuda,gpu -arch=sm_86 -max_num_threads=1024 -thread_warp_size=32", "conv2d_nchw.cuda", [["TENSOR", [1, 128, 17, 17], "float32"], ["TENSOR", [192, 128, 7, 1], "float32"], [1, 1], [3, 0, 3, 0], [1, 1], "float32"], {}], "config": {"index": 258048, "code_hash": null, "entity": [["tile_f", "sp", [-1, 1, 1, 1]], ["tile_y", "sp", [-1, 1, 1, 1]], ["tile_x", "sp", [-1, 1, 1, 1]], ["tile_rc", "sp", [-1, 1]], ["tile_ry", "sp", [-1, 1]], ["tile_rx", "sp", [-1, 1]], ["auto_unroll_max_step", "ot", 0], ["unroll_explicit", "ot", 1]]}, "result": [[0.001423576352112676, 0.0014236195492957748, 0.0014237061549295773], 0, 1.153501033782959, 1679305451.4398725], "version": 0.2, "tvm_version": "0.10.0"}
{"input": ["cuda -keys=cuda,gpu -arch=sm_86 -max_num_threads=1024 -thread_warp_size=32", "conv2d_nchw.cuda", [["TENSOR", [1, 128, 17, 17], "float32"], ["TENSOR", [192, 128, 7, 1], "float32"], [1, 1], [3, 0, 3, 0], [1, 1], "float32"], {}], "config": {"index": 86016, "code_hash": null, "entity": [["tile_f", "sp", [-1, 1, 1, 1]], ["tile_y", "sp", [-1, 1, 1, 1]], ["tile_x", "sp", [-1, 1, 1, 1]], ["tile_rc", "sp", [-1, 1]], ["tile_ry", "sp", [-1, 1]], ["tile_rx", "sp", [-1, 1]], ["auto_unroll_max_step", "ot", 512], ["unroll_explicit", "ot", 0]]}, "result": [[0.0014238359577464787, 0.0014271387323943662, 0.001428653014084507], 0, 1.2058889865875244, 1679305452.300552], "version": 0.2, "tvm_version": "0.10.0"}
{"input": ["cuda -keys=cuda,gpu -arch=sm_86 -max_num_threads=1024 -thread_warp_size=32", "conv2d_nchw.cuda", [["TENSOR", [1, 128, 17, 17], "float32"], ["TENSOR", [192, 128, 7, 1], "float32"], [1, 1], [3, 0, 3, 0], [1, 1], "float32"], {}], "config": {"index": 43008, "code_hash": null, "entity": [["tile_f", "sp", [-1, 1, 1, 1]], ["tile_y", "sp", [-1, 1, 1, 1]], ["tile_x", "sp", [-1, 1, 1, 1]], ["tile_rc", "sp", [-1, 1]], ["tile_ry", "sp", [-1, 7]], ["tile_rx", "sp", [-1, 1]], ["auto_unroll_max_step", "ot", 0], ["unroll_explicit", "ot", 0]]}, "result": [[0.0030199566764705886, 0.0030199605, 0.0030200168235294117], 0, 1.2026190757751465, 1679305453.166109], "version": 0.2, "tvm_version": "0.10.0"}
{"input": ["cuda -keys=cuda,gpu -arch=sm_86 -max_num_threads=1024 -thread_warp_size=32", "conv2d_nchw.cuda", [["TENSOR", [1, 128, 17, 17], "float32"], ["TENSOR", [192, 128, 7, 1], "float32"], [1, 1], [3, 0, 3, 0], [1, 1], "float32"], {}], "config": {"index": 5376, "code_hash": null, "entity": [["tile_f", "sp", [-1, 1, 1, 1]], ["tile_y", "sp", [-1, 1, 1, 1]], ["tile_x", "sp", [-1, 1, 1, 1]], ["tile_rc", "sp", [-1, 2]], ["tile_ry", "sp", [-1, 1]], ["tile_rx", "sp", [-1, 1]], ["auto_unroll_max_step", "ot", 0], ["unroll_explicit", "ot", 0]]}, "result": [[0.004023828399999999, 0.00402399228, 0.00402423796], 0, 1.2179863452911377, 1679305454.0038571], "version": 0.2, "tvm_version": "0.10.0"}
{"input": ["cuda -keys=cuda,gpu -arch=sm_86 -max_num_threads=1024 -thread_warp_size=32", "conv2d_nchw.cuda", [["TENSOR", [1, 128, 17, 17], "float32"], ["TENSOR", [192, 128, 7, 1], "float32"], [1, 1], [3, 0, 3, 0], [1, 1], "float32"], {}], "config": {"index": 1344, "code_hash": null, "entity": [["tile_f", "sp", [-1, 1, 1, 1]], ["tile_y", "sp", [-1, 1, 1, 1]], ["tile_x", "sp", [-1, 17, 1, 1]], ["tile_rc", "sp", [-1, 1]], ["tile_ry", "sp", [-1, 1]], ["tile_rx", "sp", [-1, 1]], ["auto_unroll_max_step", "ot", 0], ["unroll_explicit", "ot", 0]]}, "result": [[0.0015093759552238808, 0.0015104148059701494, 0.0015115615970149252], 0, 1.214726209640503, 1679305454.8274934], "version": 0.2, "tvm_version": "0.10.0"}
{"input": ["cuda -keys=cuda,gpu -arch=sm_86 -max_num_threads=1024 -thread_warp_size=32", "conv2d_nchw.cuda", [["TENSOR", [1, 128, 17, 17], "float32"], ["TENSOR", [192, 128, 7, 1], "float32"], [1, 1], [3, 0, 3, 0], [1, 1], "float32"], {}], "config": {"index": 336, "code_hash": null, "entity": [["tile_f", "sp", [-1, 1, 1, 1]], ["tile_y", "sp", [-1, 17, 1, 1]], ["tile_x", "sp", [-1, 1, 1, 1]], ["tile_rc", "sp", [-1, 1]], ["tile_ry", "sp", [-1, 1]], ["tile_rx", "sp", [-1, 1]], ["auto_unroll_max_step", "ot", 0], ["unroll_explicit", "ot", 0]]}, "result": [[0.0007444432546296296, 0.0007444527222222222, 0.0007444574537037036], 0, 1.6270992755889893, 1679305456.0561953], "version": 0.2, "tvm_version": "0.10.0"}
{"input": ["cuda -keys=cuda,gpu -arch=sm_86 -max_num_threads=1024 -thread_warp_size=32", "conv2d_nchw.cuda", [["TENSOR", [1, 128, 17, 17], "float32"], ["TENSOR", [192, 128, 7, 1], "float32"], [1, 1], [3, 0, 3, 0], [1, 1], "float32"], {}], "config": {"index": 1, "code_hash": null, "entity": [["tile_f", "sp", [-1, 2, 1, 1]], ["tile_y", "sp", [-1, 1, 1, 1]], ["tile_x", "sp", [-1, 1, 1, 1]], ["tile_rc", "sp", [-1, 1]], ["tile_ry", "sp", [-1, 1]], ["tile_rx", "sp", [-1, 1]], ["auto_unroll_max_step", "ot", 0], ["unroll_explicit", "ot", 0]]}, "result": [[0.0031130211515151512, 0.0031130220606060605, 0.0031130530606060603], 0, 1.2070276737213135, 1679305456.891392], "version": 0.2, "tvm_version": "0.10.0"}
{"input": ["cuda -keys=cuda,gpu -arch=sm_86 -max_num_threads=1024 -thread_warp_size=32", "conv2d_nchw.cuda", [["TENSOR", [1, 128, 17, 17], "float32"], ["TENSOR", [192, 128, 7, 1], "float32"], [1, 1], [3, 0, 3, 0], [1, 1], "float32"], {}], "config": {"index": 172032, "code_hash": null, "entity": [["tile_f", "sp", [-1, 1, 1, 1]], ["tile_y", "sp", [-1, 1, 1, 1]], ["tile_x", "sp", [-1, 1, 1, 1]], ["tile_rc", "sp", [-1, 1]], ["tile_ry", "sp", [-1, 1]], ["tile_rx", "sp", [-1, 1]], ["auto_unroll_max_step", "ot", 1500], ["unroll_explicit", "ot", 0]]}, "result": [[0.001423878732394366, 0.0014285665070422535, 0.0014285958450704224], 0, 1.1791365146636963, 1679305457.7197158], "version": 0.2, "tvm_version": "0.10.0"}
{"input": ["cuda -keys=cuda,gpu -arch=sm_86 -max_num_threads=1024 -thread_warp_size=32", "conv2d_nchw.cuda", [["TENSOR", [1, 128, 17, 17], "float32"], ["TENSOR", [192, 128, 7, 1], "float32"], [1, 1], [3, 0, 3, 0], [1, 1], "float32"], {}], "config": {"index": 10752, "code_hash": null, "entity": [["tile_f", "sp", [-1, 1, 1, 1]], ["tile_y", "sp", [-1, 1, 1, 1]], ["tile_x", "sp", [-1, 1, 1, 1]], ["tile_rc", "sp", [-1, 4]], ["tile_ry", "sp", [-1, 1]], ["tile_rx", "sp", [-1, 1]], ["auto_unroll_max_step", "ot", 0], ["unroll_explicit", "ot", 0]]}, "result": [[0.003308378870967742, 0.0033085770000000005, 0.0033087091612903226], 0, 1.2300634384155273, 1679305458.5888247], "version": 0.2, "tvm_version": "0.10.0"}
{"input": ["cuda -keys=cuda,gpu -arch=sm_86 -max_num_threads=1024 -thread_warp_size=32", "conv2d_nchw.cuda", [["TENSOR", [1, 128, 17, 17], "float32"], ["TENSOR", [192, 128, 7, 1], "float32"], [1, 1], [3, 0, 3, 0], [1, 1], "float32"], {}], "config": {"index": 2688, "code_hash": null, "entity": [["tile_f", "sp", [-1, 1, 1, 1]], ["tile_y", "sp", [-1, 1, 1, 1]], ["tile_x", "sp", [-1, 1, 17, 1]], ["tile_rc", "sp", [-1, 1]], ["tile_ry", "sp", [-1, 1]], ["tile_rx", "sp", [-1, 1]], ["auto_unroll_max_step", "ot", 0], ["unroll_explicit", "ot", 0]]}, "result": [[0.00036007772098214285, 0.00036009141294642856, 0.0003612320066964286], 0, 1.561537742614746, 1679305459.7840462], "version": 0.2, "tvm_version": "0.10.0"}
{"input": ["cuda -keys=cuda,gpu -arch=sm_86 -max_num_threads=1024 -thread_warp_size=32", "conv2d_nchw.cuda", [["TENSOR", [1, 128, 17, 17], "float32"], ["TENSOR", [192, 128, 7, 1], "float32"], [1, 1], [3, 0, 3, 0], [1, 1], "float32"], {}], "config": {"index": 672, "code_hash": null, "entity": [["tile_f", "sp", [-1, 1, 1, 1]], ["tile_y", "sp", [-1, 1, 17, 1]], ["tile_x", "sp", [-1, 1, 1, 1]], ["tile_rc", "sp", [-1, 1]], ["tile_ry", "sp", [-1, 1]], ["tile_rx", "sp", [-1, 1]], ["auto_unroll_max_step", "ot", 0], ["unroll_explicit", "ot", 0]]}, "result": [[0.00038017294562647753, 0.00038141215366430266, 0.0003818261252955083], 0, 1.6139154434204102, 1679305461.0318553], "version": 0.2, "tvm_version": "0.10.0"}
{"input": ["cuda -keys=cuda,gpu -arch=sm_86 -max_num_threads=1024 -thread_warp_size=32", "conv2d_nchw.cuda", [["TENSOR", [1, 128, 17, 17], "float32"], ["TENSOR", [192, 128, 7, 1], "float32"], [1, 1], [3, 0, 3, 0], [1, 1], "float32"], {}], "config": {"index": 2, "code_hash": null, "entity": [["tile_f", "sp", [-1, 3, 1, 1]], ["tile_y", "sp", [-1, 1, 1, 1]], ["tile_x", "sp", [-1, 1, 1, 1]], ["tile_rc", "sp", [-1, 1]], ["tile_ry", "sp", [-1, 1]], ["tile_rx", "sp", [-1, 1]], ["auto_unroll_max_step", "ot", 0], ["unroll_explicit", "ot", 0]]}, "result": [[0.002474208731707317, 0.0024745583658536585, 0.0024745833170731705], 0, 1.2273330688476562, 1679305461.9002464], "version": 0.2, "tvm_version": "0.10.0"}
{"input": ["cuda -keys=cuda,gpu -arch=sm_86 -max_num_threads=1024 -thread_warp_size=32", "conv2d_nchw.cuda", [["TENSOR", [1, 128, 17, 17], "float32"], ["TENSOR", [192, 128, 7, 1], "float32"], [1, 1], [3, 0, 3, 0], [1, 1], "float32"], {}], "config": {"index": 16128, "code_hash": null, "entity": [["tile_f", "sp", [-1, 1, 1, 1]], ["tile_y", "sp", [-1, 1, 1, 1]], ["tile_x", "sp", [-1, 1, 1, 1]], ["tile_rc", "sp", [-1, 8]], ["tile_ry", "sp", [-1, 1]], ["tile_rx", "sp", [-1, 1]], ["auto_unroll_max_step", "ot", 0], ["unroll_explicit", "ot", 0]]}, "result": [[0.0028489669999999996, 0.002848995611111111, 0.002849137833333333], 0, 1.2288451194763184, 1679305462.7481103], "version": 0.2, "tvm_version": "0.10.0"}
{"input": ["cuda -keys=cuda,gpu -arch=sm_86 -max_num_threads=1024 -thread_warp_size=32", "conv2d_nchw.cuda", [["TENSOR", [1, 128, 17, 17], "float32"], ["TENSOR", [192, 128, 7, 1], "float32"], [1, 1], [3, 0, 3, 0], [1, 1], "float32"], {}], "config": {"index": 4032, "code_hash": null, "entity": [["tile_f", "sp", [-1, 1, 1, 1]], ["tile_y", "sp", [-1, 1, 1, 1]], ["tile_x", "sp", [-1, 1, 1, 17]], ["tile_rc", "sp", [-1, 1]], ["tile_ry", "sp", [-1, 1]], ["tile_rx", "sp", [-1, 1]], ["auto_unroll_max_step", "ot", 0], ["unroll_explicit", "ot", 0]]}, "result": [[0.0015107820298507465, 0.0015141750597014926, 0.001515657567164179], 0, 1.2088348865509033, 1679305463.5775971], "version": 0.2, "tvm_version": "0.10.0"}
{"input": ["cuda -keys=cuda,gpu -arch=sm_86 -max_num_threads=1024 -thread_warp_size=32", "conv2d_nchw.cuda", [["TENSOR", [1, 128, 17, 17], "float32"], ["TENSOR", [192, 128, 7, 1], "float32"], [1, 1], [3, 0, 3, 0], [1, 1], "float32"], {}], "config": {"index": 1008, "code_hash": null, "entity": [["tile_f", "sp", [-1, 1, 1, 1]], ["tile_y", "sp", [-1, 1, 1, 17]], ["tile_x", "sp", [-1, 1, 1, 1]], ["tile_rc", "sp", [-1, 1]], ["tile_ry", "sp", [-1, 1]], ["tile_rx", "sp", [-1, 1]], ["auto_unroll_max_step", "ot", 0], ["unroll_explicit", "ot", 0]]}, "result": [[0.0007443199861111112, 0.0007444243240740741, 0.0007444290555555555], 0, 1.6049866676330566, 1679305464.798282], "version": 0.2, "tvm_version": "0.10.0"}
{"input": ["cuda -keys=cuda,gpu -arch=sm_86 -max_num_threads=1024 -thread_warp_size=32", "conv2d_nchw.cuda", [["TENSOR", [1, 128, 17, 17], "float32"], ["TENSOR", [192, 128, 7, 1], "float32"], [1, 1], [3, 0, 3, 0], [1, 1], "float32"], {}], "config": {"index": 3, "code_hash": null, "entity": [["tile_f", "sp", [-1, 4, 1, 1]], ["tile_y", "sp", [-1, 1, 1, 1]], ["tile_x", "sp", [-1, 1, 1, 1]], ["tile_rc", "sp", [-1, 1]], ["tile_ry", "sp", [-1, 1]], ["tile_rx", "sp", [-1, 1]], ["auto_unroll_max_step", "ot", 0], ["unroll_explicit", "ot", 0]]}, "result": [[0.0020521769591836736, 0.002052388551020408, 0.0020525766326530614], 0, 1.1928009986877441, 1679305465.6232498], "version": 0.2, "tvm_version": "0.10.0"}
{"input": ["cuda -keys=cuda,gpu -arch=sm_86 -max_num_threads=1024 -thread_warp_size=32", "conv2d_nchw.cuda", [["TENSOR", [1, 128, 17, 17], "float32"], ["TENSOR", [192, 128, 7, 1], "float32"], [1, 1], [3, 0, 3, 0], [1, 1], "float32"], {}], "config": {"index": 260736, "code_hash": null, "entity": [["tile_f", "sp", [-1, 1, 1, 1]], ["tile_y", "sp", [-1, 1, 1, 1]], ["tile_x", "sp", [-1, 1, 17, 1]], ["tile_rc", "sp", [-1, 1]], ["tile_ry", "sp", [-1, 1]], ["tile_rx", "sp", [-1, 1]], ["auto_unroll_max_step", "ot", 0], ["unroll_explicit", "ot", 1]]}, "result": [[0.0003600714641255605, 0.0003600783408071749, 0.00036010129596412554], 0, 1.5650746822357178, 1679305467.3886452], "version": 0.2, "tvm_version": "0.10.0"}
{"input": ["cuda -keys=cuda,gpu -arch=sm_86 -max_num_threads=1024 -thread_warp_size=32", "conv2d_nchw.cuda", [["TENSOR", [1, 128, 17, 17], "float32"], ["TENSOR", [192, 128, 7, 1], "float32"], [1, 1], [3, 0, 3, 0], [1, 1], "float32"], {}], "config": {"index": 88704, "code_hash": null, "entity": [["tile_f", "sp", [-1, 1, 1, 1]], ["tile_y", "sp", [-1, 1, 1, 1]], ["tile_x", "sp", [-1, 1, 17, 1]], ["tile_rc", "sp", [-1, 1]], ["tile_ry", "sp", [-1, 1]], ["tile_rx", "sp", [-1, 1]], ["auto_unroll_max_step", "ot", 512], ["unroll_explicit", "ot", 0]]}, "result": [[0.00036014262556053814, 0.0003616671704035875, 0.0003617337466367713], 0, 1.5849320888519287, 1679305468.6270041], "version": 0.2, "tvm_version": "0.10.0"}
{"input": ["cuda -keys=cuda,gpu -arch=sm_86 -max_num_threads=1024 -thread_warp_size=32", "conv2d_nchw.cuda", [["TENSOR", [1, 128, 17, 17], "float32"], ["TENSOR", [192, 128, 7, 1], "float32"], [1, 1], [3, 0, 3, 0], [1, 1], "float32"], {}], "config": {"index": 45696, "code_hash": null, "entity": [["tile_f", "sp", [-1, 1, 1, 1]], ["tile_y", "sp", [-1, 1, 1, 1]], ["tile_x", "sp", [-1, 1, 17, 1]], ["tile_rc", "sp", [-1, 1]], ["tile_ry", "sp", [-1, 7]], ["tile_rx", "sp", [-1, 1]], ["auto_unroll_max_step", "ot", 0], ["unroll_explicit", "ot", 0]]}, "result": [[0.00018028166441441443, 0.0001802954966216216, 0.0001803001024774775], 0, 1.610243558883667, 1679305469.8677394], "version": 0.2, "tvm_version": "0.10.0"}
{"input": ["cuda -keys=cuda,gpu -arch=sm_86 -max_num_threads=1024 -thread_warp_size=32", "conv2d_nchw.cuda", [["TENSOR", [1, 128, 17, 17], "float32"], ["TENSOR", [192, 128, 7, 1], "float32"], [1, 1], [3, 0, 3, 0], [1, 1], "float32"], {}], "config": {"index": 8064, "code_hash": null, "entity": [["tile_f", "sp", [-1, 1, 1, 1]], ["tile_y", "sp", [-1, 1, 1, 1]], ["tile_x", "sp", [-1, 1, 17, 1]], ["tile_rc", "sp", [-1, 2]], ["tile_ry", "sp", [-1, 1]], ["tile_rx", "sp", [-1, 1]], ["auto_unroll_max_step", "ot", 0], ["unroll_explicit", "ot", 0]]}, "result": [[0.00028511033747779754, 0.00028511898223801066, 0.0002851212593250444], 0, 1.5930428504943848, 1679305471.0886722], "version": 0.2, "tvm_version": "0.10.0"}
{"input": ["cuda -keys=cuda,gpu -arch=sm_86 -max_num_threads=1024 -thread_warp_size=32", "conv2d_nchw.cuda", [["TENSOR", [1, 128, 17, 17], "float32"], ["TENSOR", [192, 128, 7, 1], "float32"], [1, 1], [3, 0, 3, 0], [1, 1], "float32"], {}], "config": {"index": 3024, "code_hash": null, "entity": [["tile_f", "sp", [-1, 1, 1, 1]], ["tile_y", "sp", [-1, 17, 1, 1]], ["tile_x", "sp", [-1, 1, 17, 1]], ["tile_rc", "sp", [-1, 1]], ["tile_ry", "sp", [-1, 1]], ["tile_rx", "sp", [-1, 1]], ["auto_unroll_max_step", "ot", 0], ["unroll_explicit", "ot", 0]]}, "result": [[0.00019577666136919313, 0.00019577804156479218, 0.00019577929095354523], 0, 1.612480878829956, 1679305472.3032384], "version": 0.2, "tvm_version": "0.10.0"}
{"input": ["cuda -keys=cuda,gpu -arch=sm_86 -max_num_threads=1024 -thread_warp_size=32", "conv2d_nchw.cuda", [["TENSOR", [1, 128, 17, 17], "float32"], ["TENSOR", [192, 128, 7, 1], "float32"], [1, 1], [3, 0, 3, 0], [1, 1], "float32"], {}], "config": {"index": 2689, "code_hash": null, "entity": [["tile_f", "sp", [-1, 2, 1, 1]], ["tile_y", "sp", [-1, 1, 1, 1]], ["tile_x", "sp", [-1, 1, 17, 1]], ["tile_rc", "sp", [-1, 1]], ["tile_ry", "sp", [-1, 1]], ["tile_rx", "sp", [-1, 1]], ["auto_unroll_max_step", "ot", 0], ["unroll_explicit", "ot", 0]]}, "result": [[0.00020902933593749997, 0.00020903199869791664, 0.00020905174739583332], 0, 1.613365888595581, 1679305473.546481], "version": 0.2, "tvm_version": "0.10.0"}
{"input": ["cuda -keys=cuda,gpu -arch=sm_86 -max_num_threads=1024 -thread_warp_size=32", "conv2d_nchw.cuda", [["TENSOR", [1, 128, 17, 17], "float32"], ["TENSOR", [192, 128, 7, 1], "float32"], [1, 1], [3, 0, 3, 0], [1, 1], "float32"], {}], "config": {"index": 24192, "code_hash": null, "entity": [["tile_f", "sp", [-1, 1, 1, 1]], ["tile_y", "sp", [-1, 1, 1, 1]], ["tile_x", "sp", [-1, 1, 17, 1]], ["tile_rc", "sp", [-1, 16]], ["tile_ry", "sp", [-1, 1]], ["tile_rx", "sp", [-1, 1]], ["auto_unroll_max_step", "ot", 0], ["unroll_explicit", "ot", 0]]}, "result": [[0.00039454193366093366, 0.0003949168058968059, 0.0003949394496314496], 0, 1.6400911808013916, 1679305474.7655404], "version": 0.2, "tvm_version": "0.10.0"}
{"input": ["cuda -keys=cuda,gpu -arch=sm_86 -max_num_threads=1024 -thread_warp_size=32", "conv2d_nchw.cuda", [["TENSOR", [1, 128, 17, 17], "float32"], ["TENSOR", [192, 128, 7, 1], "float32"], [1, 1], [3, 0, 3, 0], [1, 1], "float32"], {}], "config": {"index": 2692, "code_hash": null, "entity": [["tile_f", "sp", [-1, 6, 1, 1]], ["tile_y", "sp", [-1, 1, 1, 1]], ["tile_x", "sp", [-1, 1, 17, 1]], ["tile_rc", "sp", [-1, 1]], ["tile_ry", "sp", [-1, 1]], ["tile_rx", "sp", [-1, 1]], ["auto_unroll_max_step", "ot", 0], ["unroll_explicit", "ot", 0]]}, "result": [[9.327977764705882e-05, 9.328206647058824e-05, 9.328218294117648e-05], 0, 1.590179681777954, 1679305475.9724987], "version": 0.2, "tvm_version": "0.10.0"}
{"input": ["cuda -keys=cuda,gpu -arch=sm_86 -max_num_threads=1024 -thread_warp_size=32", "conv2d_nchw.cuda", [["TENSOR", [1, 128, 17, 17], "float32"], ["TENSOR", [192, 128, 7, 1], "float32"], [1, 1], [3, 0, 3, 0], [1, 1], "float32"], {}], "config": {"index": 174720, "code_hash": null, "entity": [["tile_f", "sp", [-1, 1, 1, 1]], ["tile_y", "sp", [-1, 1, 1, 1]], ["tile_x", "sp", [-1, 1, 17, 1]], ["tile_rc", "sp", [-1, 1]], ["tile_ry", "sp", [-1, 1]], ["tile_rx", "sp", [-1, 1]], ["auto_unroll_max_step", "ot", 1500], ["unroll_explicit", "ot", 0]]}, "result": [[0.00036160137545126347, 0.00036171667148014443, 0.00036172336462093863], 0, 1.1745994091033936, 1679305476.7878394], "version": 0.2, "tvm_version": "0.10.0"}
{"input": ["cuda -keys=cuda,gpu -arch=sm_86 -max_num_threads=1024 -thread_warp_size=32", "conv2d_nchw.cuda", [["TENSOR", [1, 128, 17, 17], "float32"], ["TENSOR", [192, 128, 7, 1], "float32"], [1, 1], [3, 0, 3, 0], [1, 1], "float32"], {}], "config": {"index": 29568, "code_hash": null, "entity": [["tile_f", "sp", [-1, 1, 1, 1]], ["tile_y", "sp", [-1, 1, 1, 1]], ["tile_x", "sp", [-1, 1, 17, 1]], ["tile_rc", "sp", [-1, 32]], ["tile_ry", "sp", [-1, 1]], ["tile_rx", "sp", [-1, 1]], ["auto_unroll_max_step", "ot", 0], ["unroll_explicit", "ot", 0]]}, "result": [[0.000365097098540146, 0.00036522732846715325, 0.0003654072883211679], 0, 1.2026612758636475, 1679305477.5865679], "version": 0.2, "tvm_version": "0.10.0"}
{"input": ["cuda -keys=cuda,gpu -arch=sm_86 -max_num_threads=1024 -thread_warp_size=32", "conv2d_nchw.cuda", [["TENSOR", [1, 128, 17, 17], "float32"], ["TENSOR", [192, 128, 7, 1], "float32"], [1, 1], [3, 0, 3, 0], [1, 1], "float32"], {}], "config": {"index": 2693, "code_hash": null, "entity": [["tile_f", "sp", [-1, 8, 1, 1]], ["tile_y", "sp", [-1, 1, 1, 1]], ["tile_x", "sp", [-1, 1, 17, 1]], ["tile_rc", "sp", [-1, 1]], ["tile_ry", "sp", [-1, 1]], ["tile_rx", "sp", [-1, 1]], ["auto_unroll_max_step", "ot", 0], ["unroll_explicit", "ot", 0]]}, "result": [[8.293592130115424e-05, 8.293862749213013e-05, 8.294238982161595e-05], 0, 1.5902459621429443, 1679305478.793733], "version": 0.2, "tvm_version": "0.10.0"}
{"input": ["cuda -keys=cuda,gpu -arch=sm_86 -max_num_threads=1024 -thread_warp_size=32", "conv2d_nchw.cuda", [["TENSOR", [1, 128, 17, 17], "float32"], ["TENSOR", [192, 128, 7, 1], "float32"], [1, 1], [3, 0, 3, 0], [1, 1], "float32"], {}], "config": {"index": 34944, "code_hash": null, "entity": [["tile_f", "sp", [-1, 1, 1, 1]], ["tile_y", "sp", [-1, 1, 1, 1]], ["tile_x", "sp", [-1, 1, 17, 1]], ["tile_rc", "sp", [-1, 64]], ["tile_ry", "sp", [-1, 1]], ["tile_rx", "sp", [-1, 1]], ["auto_unroll_max_step", "ot", 0], ["unroll_explicit", "ot", 0]]}, "result": [[0.000396108186770428, 0.00039631590272373545, 0.0003972482334630351], 0, 1.2658400535583496, 1679305479.632194], "version": 0.2, "tvm_version": "0.10.0"}
{"input": ["cuda -keys=cuda,gpu -arch=sm_86 -max_num_threads=1024 -thread_warp_size=32", "conv2d_nchw.cuda", [["TENSOR", [1, 128, 17, 17], "float32"], ["TENSOR", [192, 128, 7, 1], "float32"], [1, 1], [3, 0, 3, 0], [1, 1], "float32"], {}], "config": {"index": 3360, "code_hash": null, "entity": [["tile_f", "sp", [-1, 1, 1, 1]], ["tile_y", "sp", [-1, 1, 17, 1]], ["tile_x", "sp", [-1, 1, 17, 1]], ["tile_rc", "sp", [-1, 1]], ["tile_ry", "sp", [-1, 1]], ["tile_rx", "sp", [-1, 1]], ["auto_unroll_max_step", "ot", 0], ["unroll_explicit", "ot", 0]]}, "result": [[0.0001906502948870392, 0.00019065494054696787, 0.0001906563733650416], 0, 1.616823673248291, 1679305480.8818114], "version": 0.2, "tvm_version": "0.10.0"}
{"input": ["cuda -keys=cuda,gpu -arch=sm_86 -max_num_threads=1024 -thread_warp_size=32", "conv2d_nchw.cuda", [["TENSOR", [1, 128, 17, 17], "float32"], ["TENSOR", [192, 128, 7, 1], "float32"], [1, 1], [3, 0, 3, 0], [1, 1], "float32"], {}], "config": {"index": 2694, "code_hash": null, "entity": [["tile_f", "sp", [-1, 12, 1, 1]], ["tile_y", "sp", [-1, 1, 1, 1]], ["tile_x", "sp", [-1, 1, 17, 1]], ["tile_rc", "sp", [-1, 1]], ["tile_ry", "sp", [-1, 1]], ["tile_rx", "sp", [-1, 1]], ["auto_unroll_max_step", "ot", 0], ["unroll_explicit", "ot", 0]]}, "result": [[0.00017576791868131867, 0.00017576791868131867, 0.00017576904285714285], 0, 1.5923478603363037, 1679305482.1014547], "version": 0.2, "tvm_version": "0.10.0"}
{"input": ["cuda -keys=cuda,gpu -arch=sm_86 -max_num_threads=1024 -thread_warp_size=32", "conv2d_nchw.cuda", [["TENSOR", [1, 128, 17, 17], "float32"], ["TENSOR", [192, 128, 7, 1], "float32"], [1, 1], [3, 0, 3, 0], [1, 1], "float32"], {}], "config": {"index": 40320, "code_hash": null, "entity": [["tile_f", "sp", [-1, 1, 1, 1]], ["tile_y", "sp", [-1, 1, 1, 1]], ["tile_x", "sp", [-1, 1, 17, 1]], ["tile_rc", "sp", [-1, 128]], ["tile_ry", "sp", [-1, 1]], ["tile_rx", "sp", [-1, 1]], ["auto_unroll_max_step", "ot", 0], ["unroll_explicit", "ot", 0]]}, "result": [[0.0004007037588932806, 0.0004010839644268775, 0.00040219725296442683], 0, 1.2668941020965576, 1679305482.9637809], "version": 0.2, "tvm_version": "0.10.0"}
{"input": ["cuda -keys=cuda,gpu -arch=sm_86 -max_num_threads=1024 -thread_warp_size=32", "conv2d_nchw.cuda", [["TENSOR", [1, 128, 17, 17], "float32"], ["TENSOR", [192, 128, 7, 1], "float32"], [1, 1], [3, 0, 3, 0], [1, 1], "float32"], {}], "config": {"index": 3696, "code_hash": null, "entity": [["tile_f", "sp", [-1, 1, 1, 1]], ["tile_y", "sp", [-1, 1, 1, 17]], ["tile_x", "sp", [-1, 1, 17, 1]], ["tile_rc", "sp", [-1, 1]], ["tile_ry", "sp", [-1, 1]], ["tile_rx", "sp", [-1, 1]], ["auto_unroll_max_step", "ot", 0], ["unroll_explicit", "ot", 0]]}, "result": [[0.00019494931051344743, 0.00019495182885085574, 0.00019495296699266503], 0, 1.6525983810424805, 1679305484.1950066], "version": 0.2, "tvm_version": "0.10.0"}
{"input": ["cuda -keys=cuda,gpu -arch=sm_86 -max_num_threads=1024 -thread_warp_size=32", "conv2d_nchw.cuda", [["TENSOR", [1, 128, 17, 17], "float32"], ["TENSOR", [192, 128, 7, 1], "float32"], [1, 1], [3, 0, 3, 0], [1, 1], "float32"], {}], "config": {"index": 260741, "code_hash": null, "entity": [["tile_f", "sp", [-1, 8, 1, 1]], ["tile_y", "sp", [-1, 1, 1, 1]], ["tile_x", "sp", [-1, 1, 17, 1]], ["tile_rc", "sp", [-1, 1]], ["tile_ry", "sp", [-1, 1]], ["tile_rx", "sp", [-1, 1]], ["auto_unroll_max_step", "ot", 0], ["unroll_explicit", "ot", 1]]}, "result": [[8.253960404774261e-05, 8.254067306694344e-05, 8.25432942397509e-05], 0, 1.554119348526001, 1679305486.1596477], "version": 0.2, "tvm_version": "0.10.0"}
{"input": ["cuda -keys=cuda,gpu -arch=sm_86 -max_num_threads=1024 -thread_warp_size=32", "conv2d_nchw.cuda", [["TENSOR", [1, 128, 17, 17], "float32"], ["TENSOR", [192, 128, 7, 1], "float32"], [1, 1], [3, 0, 3, 0], [1, 1], "float32"], {}], "config": {"index": 88709, "code_hash": null, "entity": [["tile_f", "sp", [-1, 8, 1, 1]], ["tile_y", "sp", [-1, 1, 1, 1]], ["tile_x", "sp", [-1, 1, 17, 1]], ["tile_rc", "sp", [-1, 1]], ["tile_ry", "sp", [-1, 1]], ["tile_rx", "sp", [-1, 1]], ["auto_unroll_max_step", "ot", 512], ["unroll_explicit", "ot", 0]]}, "result": [[8.245405345096004e-05, 8.245711001556823e-05, 8.24577197716658e-05], 0, 1.584418535232544, 1679305487.372704], "version": 0.2, "tvm_version": "0.10.0"}
{"input": ["cuda -keys=cuda,gpu -arch=sm_86 -max_num_threads=1024 -thread_warp_size=32", "conv2d_nchw.cuda", [["TENSOR", [1, 128, 17, 17], "float32"], ["TENSOR", [192, 128, 7, 1], "float32"], [1, 1], [3, 0, 3, 0], [1, 1], "float32"], {}], "config": {"index": 45701, "code_hash": null, "entity": [["tile_f", "sp", [-1, 8, 1, 1]], ["tile_y", "sp", [-1, 1, 1, 1]], ["tile_x", "sp", [-1, 1, 17, 1]], ["tile_rc", "sp", [-1, 1]], ["tile_ry", "sp", [-1, 7]], ["tile_rx", "sp", [-1, 1]], ["auto_unroll_max_step", "ot", 0], ["unroll_explicit", "ot", 0]]}, "result": [[4.9382862726098185e-05, 4.938352293281654e-05, 4.938916634366925e-05], 0, 1.6089985370635986, 1679305488.5863876], "version": 0.2, "tvm_version": "0.10.0"}
{"input": ["cuda -keys=cuda,gpu -arch=sm_86 -max_num_threads=1024 -thread_warp_size=32", "conv2d_nchw.cuda", [["TENSOR", [1, 128, 17, 17], "float32"], ["TENSOR", [192, 128, 7, 1], "float32"], [1, 1], [3, 0, 3, 0], [1, 1], "float32"], {}], "config": {"index": 8069, "code_hash": null, "entity": [["tile_f", "sp", [-1, 8, 1, 1]], ["tile_y", "sp", [-1, 1, 1, 1]], ["tile_x", "sp", [-1, 1, 17, 1]], ["tile_rc", "sp", [-1, 2]], ["tile_ry", "sp", [-1, 1]], ["tile_rx", "sp", [-1, 1]], ["auto_unroll_max_step", "ot", 0], ["unroll_explicit", "ot", 0]]}, "result": [[5.85717301231803e-05, 5.8573626726390447e-05, 5.8574788727137e-05], 0, 1.6099963188171387, 1679305489.8213885], "version": 0.2, "tvm_version": "0.10.0"}
{"input": ["cuda -keys=cuda,gpu -arch=sm_86 -max_num_threads=1024 -thread_warp_size=32", "conv2d_nchw.cuda", [["TENSOR", [1, 128, 17, 17], "float32"], ["TENSOR", [192, 128, 7, 1], "float32"], [1, 1], [3, 0, 3, 0], [1, 1], "float32"], {}], "config": {"index": 4037, "code_hash": null, "entity": [["tile_f", "sp", [-1, 8, 1, 1]], ["tile_y", "sp", [-1, 1, 1, 1]], ["tile_x", "sp", [-1, 1, 1, 17]], ["tile_rc", "sp", [-1, 1]], ["tile_ry", "sp", [-1, 1]], ["tile_rx", "sp", [-1, 1]], ["auto_unroll_max_step", "ot", 0], ["unroll_explicit", "ot", 0]]}, "result": [[0.00039106609708737864, 0.0003910760218446602, 0.0003910934296116505], 0, 1.6870944499969482, 1679305491.044796], "version": 0.2, "tvm_version": "0.10.0"}
{"input": ["cuda -keys=cuda,gpu -arch=sm_86 -max_num_threads=1024 -thread_warp_size=32", "conv2d_nchw.cuda", [["TENSOR", [1, 128, 17, 17], "float32"], ["TENSOR", [192, 128, 7, 1], "float32"], [1, 1], [3, 0, 3, 0], [1, 1], "float32"], {}], "config": {"index": 1349, "code_hash": null, "entity": [["tile_f", "sp", [-1, 8, 1, 1]], ["tile_y", "sp", [-1, 1, 1, 1]], ["tile_x", "sp", [-1, 17, 1, 1]], ["tile_rc", "sp", [-1, 1]], ["tile_ry", "sp", [-1, 1]], ["tile_rx", "sp", [-1, 1]], ["auto_unroll_max_step", "ot", 0], ["unroll_explicit", "ot", 0]]}, "result": [[0.0003894267053140096, 0.00038947122705314003, 0.00038949101932367146], 0, 1.7044622898101807, 1679305492.2858796], "version": 0.2, "tvm_version": "0.10.0"}
{"input": ["cuda -keys=cuda,gpu -arch=sm_86 -max_num_threads=1024 -thread_warp_size=32", "conv2d_nchw.cuda", [["TENSOR", [1, 128, 17, 17], "float32"], ["TENSOR", [192, 128, 7, 1], "float32"], [1, 1], [3, 0, 3, 0], [1, 1], "float32"], {}], "config": {"index": 3029, "code_hash": null, "entity": [["tile_f", "sp", [-1, 8, 1, 1]], ["tile_y", "sp", [-1, 17, 1, 1]], ["tile_x", "sp", [-1, 1, 17, 1]], ["tile_rc", "sp", [-1, 1]], ["tile_ry", "sp", [-1, 1]], ["tile_rx", "sp", [-1, 1]], ["auto_unroll_max_step", "ot", 0], ["unroll_explicit", "ot", 0]]}, "result": [[0.0002321994089595376, 0.00023220384104046242, 0.0002322082731213873], 0, 1.8404436111450195, 1679305493.504645], "version": 0.2, "tvm_version": "0.10.0"}
{"input": ["cuda -keys=cuda,gpu -arch=sm_86 -max_num_threads=1024 -thread_warp_size=32", "conv2d_nchw.cuda", [["TENSOR", [1, 128, 17, 17], "float32"], ["TENSOR", [192, 128, 7, 1], "float32"], [1, 1], [3, 0, 3, 0], [1, 1], "float32"], {}], "config": {"index": 174725, "code_hash": null, "entity": [["tile_f", "sp", [-1, 8, 1, 1]], ["tile_y", "sp", [-1, 1, 1, 1]], ["tile_x", "sp", [-1, 1, 17, 1]], ["tile_rc", "sp", [-1, 1]], ["tile_ry", "sp", [-1, 1]], ["tile_rx", "sp", [-1, 1]], ["auto_unroll_max_step", "ot", 1500], ["unroll_explicit", "ot", 0]]}, "result": [[8.244669170579029e-05, 8.244829160146061e-05, 8.245144340114763e-05], 0, 1.601879358291626, 1679305494.7100437], "version": 0.2, "tvm_version": "0.10.0"}
{"input": ["cuda -keys=cuda,gpu -arch=sm_86 -max_num_threads=1024 -thread_warp_size=32", "conv2d_nchw.cuda", [["TENSOR", [1, 128, 17, 17], "float32"], ["TENSOR", [192, 128, 7, 1], "float32"], [1, 1], [3, 0, 3, 0], [1, 1], "float32"], {}], "config": {"index": 2701, "code_hash": null, "entity": [["tile_f", "sp", [-1, 192, 1, 1]], ["tile_y", "sp", [-1, 1, 1, 1]], ["tile_x", "sp", [-1, 1, 17, 1]], ["tile_rc", "sp", [-1, 1]], ["tile_ry", "sp", [-1, 1]], ["tile_rx", "sp", [-1, 1]], ["auto_unroll_max_step", "ot", 0], ["unroll_explicit", "ot", 0]]}, "result": [[0.0004554109717514124, 0.00045543123163841804, 0.0004554341186440678], 0, 1.78572416305542, 1679305495.95823], "version": 0.2, "tvm_version": "0.10.0"}
{"input": ["cuda -keys=cuda,gpu -arch=sm_86 -max_num_threads=1024 -thread_warp_size=32", "conv2d_nchw.cuda", [["TENSOR", [1, 128, 17, 17], "float32"], ["TENSOR", [192, 128, 7, 1], "float32"], [1, 1], [3, 0, 3, 0], [1, 1], "float32"], {}], "config": {"index": 2702, "code_hash": null, "entity": [["tile_f", "sp", [-1, 1, 2, 1]], ["tile_y", "sp", [-1, 1, 1, 1]], ["tile_x", "sp", [-1, 1, 17, 1]], ["tile_rc", "sp", [-1, 1]], ["tile_ry", "sp", [-1, 1]], ["tile_rx", "sp", [-1, 1]], ["auto_unroll_max_step", "ot", 0], ["unroll_explicit", "ot", 0]]}, "result": [[0.0003824477432762837, 0.00038263801222493887, 0.00038265554523227385], 0, 1.5757367610931396, 1679305497.1557066], "version": 0.2, "tvm_version": "0.10.0"}
{"input": ["cuda -keys=cuda,gpu -arch=sm_86 -max_num_threads=1024 -thread_warp_size=32", "conv2d_nchw.cuda", [["TENSOR", [1, 128, 17, 17], "float32"], ["TENSOR", [192, 128, 7, 1], "float32"], [1, 1], [3, 0, 3, 0], [1, 1], "float32"], {}], "config": {"index": 13445, "code_hash": null, "entity": [["tile_f", "sp", [-1, 8, 1, 1]], ["tile_y", "sp", [-1, 1, 1, 1]], ["tile_x", "sp", [-1, 1, 17, 1]], ["tile_rc", "sp", [-1, 4]], ["tile_ry", "sp", [-1, 1]], ["tile_rx", "sp", [-1, 1]], ["auto_unroll_max_step", "ot", 0], ["unroll_explicit", "ot", 0]]}, "result": [[5.660885806220951e-05, 5.662891204862352e-05, 5.6631558097962105e-05], 0, 1.6075940132141113, 1679305498.3644927], "version": 0.2, "tvm_version": "0.10.0"}
{"input": ["cuda -keys=cuda,gpu -arch=sm_86 -max_num_threads=1024 -thread_warp_size=32", "conv2d_nchw.cuda", [["TENSOR", [1, 128, 17, 17], "float32"], ["TENSOR", [192, 128, 7, 1], "float32"], [1, 1], [3, 0, 3, 0], [1, 1], "float32"], {}], "config": {"index": 5, "code_hash": null, "entity": [["tile_f", "sp", [-1, 8, 1, 1]], ["tile_y", "sp", [-1, 1, 1, 1]], ["tile_x", "sp", [-1, 1, 1, 1]], ["tile_rc", "sp", [-1, 1]], ["tile_ry", "sp", [-1, 1]], ["tile_rx", "sp", [-1, 1]], ["auto_unroll_max_step", "ot", 0], ["unroll_explicit", "ot", 0]]}, "result": [[0.0016553547213114753, 0.0016556736557377049, 0.0016557240655737705], 0, 1.1979172229766846, 1679305499.1867487], "version": 0.2, "tvm_version": "0.10.0"}
{"input": ["cuda -keys=cuda,gpu -arch=sm_86 -max_num_threads=1024 -thread_warp_size=32", "conv2d_nchw.cuda", [["TENSOR", [1, 128, 17, 17], "float32"], ["TENSOR", [192, 128, 7, 1], "float32"], [1, 1], [3, 0, 3, 0], [1, 1], "float32"], {}], "config": {"index": 3365, "code_hash": null, "entity": [["tile_f", "sp", [-1, 8, 1, 1]], ["tile_y", "sp", [-1, 1, 17, 1]], ["tile_x", "sp", [-1, 1, 17, 1]], ["tile_rc", "sp", [-1, 1]], ["tile_ry", "sp", [-1, 1]], ["tile_rx", "sp", [-1, 1]], ["auto_unroll_max_step", "ot", 0], ["unroll_explicit", "ot", 0]]}, "result": [[0.0001037261960912052, 0.00010372752768729641, 0.00010372752768729641], 0, 1.6239988803863525, 1679305500.429171], "version": 0.2, "tvm_version": "0.10.0"}
{"input": ["cuda -keys=cuda,gpu -arch=sm_86 -max_num_threads=1024 -thread_warp_size=32", "conv2d_nchw.cuda", [["TENSOR", [1, 128, 17, 17], "float32"], ["TENSOR", [192, 128, 7, 1], "float32"], [1, 1], [3, 0, 3, 0], [1, 1], "float32"], {}], "config": {"index": 2703, "code_hash": null, "entity": [["tile_f", "sp", [-1, 2, 2, 1]], ["tile_y", "sp", [-1, 1, 1, 1]], ["tile_x", "sp", [-1, 1, 17, 1]], ["tile_rc", "sp", [-1, 1]], ["tile_ry", "sp", [-1, 1]], ["tile_rx", "sp", [-1, 1]], ["auto_unroll_max_step", "ot", 0], ["unroll_explicit", "ot", 0]]}, "result": [[0.0002022064735516373, 0.0002022191574307305, 0.00020221936901763224], 0, 1.5861201286315918, 1679305501.6449893], "version": 0.2, "tvm_version": "0.10.0"}
{"input": ["cuda -keys=cuda,gpu -arch=sm_86 -max_num_threads=1024 -thread_warp_size=32", "conv2d_nchw.cuda", [["TENSOR", [1, 128, 17, 17], "float32"], ["TENSOR", [192, 128, 7, 1], "float32"], [1, 1], [3, 0, 3, 0], [1, 1], "float32"], {}], "config": {"index": 18821, "code_hash": null, "entity": [["tile_f", "sp", [-1, 8, 1, 1]], ["tile_y", "sp", [-1, 1, 1, 1]], ["tile_x", "sp", [-1, 1, 17, 1]], ["tile_rc", "sp", [-1, 8]], ["tile_ry", "sp", [-1, 1]], ["tile_rx", "sp", [-1, 1]], ["auto_unroll_max_step", "ot", 0], ["unroll_explicit", "ot", 0]]}, "result": [[6.462773138626079e-05, 6.481824352118469e-05, 6.481865158371041e-05], 0, 1.6504721641540527, 1679305502.8390343], "version": 0.2, "tvm_version": "0.10.0"}
{"input": ["cuda -keys=cuda,gpu -arch=sm_86 -max_num_threads=1024 -thread_warp_size=32", "conv2d_nchw.cuda", [["TENSOR", [1, 128, 17, 17], "float32"], ["TENSOR", [192, 128, 7, 1], "float32"], [1, 1], [3, 0, 3, 0], [1, 1], "float32"], {}], "config": {"index": 3701, "code_hash": null, "entity": [["tile_f", "sp", [-1, 8, 1, 1]], ["tile_y", "sp", [-1, 1, 1, 17]], ["tile_x", "sp", [-1, 1, 17, 1]], ["tile_rc", "sp", [-1, 1]], ["tile_ry", "sp", [-1, 1]], ["tile_rx", "sp", [-1, 1]], ["auto_unroll_max_step", "ot", 0], ["unroll_explicit", "ot", 0]]}, "result": [[0.00023217671179039305, 0.0002321782227074236, 0.00023218566229985443], 0, 1.8577523231506348, 1679305504.0584486], "version": 0.2, "tvm_version": "0.10.0"}
{"input": ["cuda -keys=cuda,gpu -arch=sm_86 -max_num_threads=1024 -thread_warp_size=32", "conv2d_nchw.cuda", [["TENSOR", [1, 128, 17, 17], "float32"], ["TENSOR", [192, 128, 7, 1], "float32"], [1, 1], [3, 0, 3, 0], [1, 1], "float32"], {}], "config": {"index": 303749, "code_hash": null, "entity": [["tile_f", "sp", [-1, 8, 1, 1]], ["tile_y", "sp", [-1, 1, 1, 1]], ["tile_x", "sp", [-1, 1, 17, 1]], ["tile_rc", "sp", [-1, 1]], ["tile_ry", "sp", [-1, 7]], ["tile_rx", "sp", [-1, 1]], ["auto_unroll_max_step", "ot", 0], ["unroll_explicit", "ot", 1]]}, "result": [[4.926203477443609e-05, 4.937463533834586e-05, 4.937495551378447e-05], 0, 1.5598227977752686, 1679305505.9408503], "version": 0.2, "tvm_version": "0.10.0"}
{"input": ["cuda -keys=cuda,gpu -arch=sm_86 -max_num_threads=1024 -thread_warp_size=32", "conv2d_nchw.cuda", [["TENSOR", [1, 128, 17, 17], "float32"], ["TENSOR", [192, 128, 7, 1], "float32"], [1, 1], [3, 0, 3, 0], [1, 1], "float32"], {}], "config": {"index": 131717, "code_hash": null, "entity": [["tile_f", "sp", [-1, 8, 1, 1]], ["tile_y", "sp", [-1, 1, 1, 1]], ["tile_x", "sp", [-1, 1, 17, 1]], ["tile_rc", "sp", [-1, 1]], ["tile_ry", "sp", [-1, 7]], ["tile_rx", "sp", [-1, 1]], ["auto_unroll_max_step", "ot", 512], ["unroll_explicit", "ot", 0]]}, "result": [[4.937560087719299e-05, 4.93778045112782e-05, 4.93791287593985e-05], 0, 1.5866718292236328, 1679305507.1392705], "version": 0.2, "tvm_version": "0.10.0"}
{"input": ["cuda -keys=cuda,gpu -arch=sm_86 -max_num_threads=1024 -thread_warp_size=32", "conv2d_nchw.cuda", [["TENSOR", [1, 128, 17, 17], "float32"], ["TENSOR", [192, 128, 7, 1], "float32"], [1, 1], [3, 0, 3, 0], [1, 1], "float32"], {}], "config": {"index": 51077, "code_hash": null, "entity": [["tile_f", "sp", [-1, 8, 1, 1]], ["tile_y", "sp", [-1, 1, 1, 1]], ["tile_x", "sp", [-1, 1, 17, 1]], ["tile_rc", "sp", [-1, 2]], ["tile_ry", "sp", [-1, 7]], ["tile_rx", "sp", [-1, 1]], ["auto_unroll_max_step", "ot", 0], ["unroll_explicit", "ot", 0]]}, "result": [[5.076516721527321e-05, 5.076552402896643e-05, 5.077395194206715e-05], 0, 1.6198129653930664, 1679305508.3200872], "version": 0.2, "tvm_version": "0.10.0"}
{"input": ["cuda -keys=cuda,gpu -arch=sm_86 -max_num_threads=1024 -thread_warp_size=32", "conv2d_nchw.cuda", [["TENSOR", [1, 128, 17, 17], "float32"], ["TENSOR", [192, 128, 7, 1], "float32"], [1, 1], [3, 0, 3, 0], [1, 1], "float32"], {}], "config": {"index": 47045, "code_hash": null, "entity": [["tile_f", "sp", [-1, 8, 1, 1]], ["tile_y", "sp", [-1, 1, 1, 1]], ["tile_x", "sp", [-1, 1, 1, 17]], ["tile_rc", "sp", [-1, 1]], ["tile_ry", "sp", [-1, 7]], ["tile_rx", "sp", [-1, 1]], ["auto_unroll_max_step", "ot", 0], ["unroll_explicit", "ot", 0]]}, "result": [[0.0006823388435374149, 0.0006823532176870749, 0.0006823588775510203], 0, 1.3784825801849365, 1679305509.1416068], "version": 0.2, "tvm_version": "0.10.0"}
{"input": ["cuda -keys=cuda,gpu -arch=sm_86 -max_num_threads=1024 -thread_warp_size=32", "conv2d_nchw.cuda", [["TENSOR", [1, 128, 17, 17], "float32"], ["TENSOR", [192, 128, 7, 1], "float32"], [1, 1], [3, 0, 3, 0], [1, 1], "float32"], {}], "config": {"index": 44357, "code_hash": null, "entity": [["tile_f", "sp", [-1, 8, 1, 1]], ["tile_y", "sp", [-1, 1, 1, 1]], ["tile_x", "sp", [-1, 17, 1, 1]], ["tile_rc", "sp", [-1, 1]], ["tile_ry", "sp", [-1, 7]], ["tile_rx", "sp", [-1, 1]], ["auto_unroll_max_step", "ot", 0], ["unroll_explicit", "ot", 0]]}, "result": [[0.0006792663037974683, 0.0006792965654008439, 0.0006792965654008439], 0, 1.8185272216796875, 1679305510.3895943], "version": 0.2, "tvm_version": "0.10.0"}
{"input": ["cuda -keys=cuda,gpu -arch=sm_86 -max_num_threads=1024 -thread_warp_size=32", "conv2d_nchw.cuda", [["TENSOR", [1, 128, 17, 17], "float32"], ["TENSOR", [192, 128, 7, 1], "float32"], [1, 1], [3, 0, 3, 0], [1, 1], "float32"], {}], "config": {"index": 46037, "code_hash": null, "entity": [["tile_f", "sp", [-1, 8, 1, 1]], ["tile_y", "sp", [-1, 17, 1, 1]], ["tile_x", "sp", [-1, 1, 17, 1]], ["tile_rc", "sp", [-1, 1]], ["tile_ry", "sp", [-1, 7]], ["tile_rx", "sp", [-1, 1]], ["auto_unroll_max_step", "ot", 0], ["unroll_explicit", "ot", 0]]}, "result": [[0.0003217555711422845, 0.0003217637955911824, 0.00032179250901803605], 0, 1.7979552745819092, 1679305511.614854], "version": 0.2, "tvm_version": "0.10.0"}
{"input": ["cuda -keys=cuda,gpu -arch=sm_86 -max_num_threads=1024 -thread_warp_size=32", "conv2d_nchw.cuda", [["TENSOR", [1, 128, 17, 17], "float32"], ["TENSOR", [192, 128, 7, 1], "float32"], [1, 1], [3, 0, 3, 0], [1, 1], "float32"], {}], "config": {"index": 45702, "code_hash": null, "entity": [["tile_f", "sp", [-1, 12, 1, 1]], ["tile_y", "sp", [-1, 1, 1, 1]], ["tile_x", "sp", [-1, 1, 17, 1]], ["tile_rc", "sp", [-1, 1]], ["tile_ry", "sp", [-1, 7]], ["tile_rx", "sp", [-1, 1]], ["auto_unroll_max_step", "ot", 0], ["unroll_explicit", "ot", 0]]}, "result": [[7.775522843137255e-05, 7.777179607843136e-05, 7.780333872549019e-05], 0, 1.6275873184204102, 1679305512.8252985], "version": 0.2, "tvm_version": "0.10.0"}
{"input": ["cuda -keys=cuda,gpu -arch=sm_86 -max_num_threads=1024 -thread_warp_size=32", "conv2d_nchw.cuda", [["TENSOR", [1, 128, 17, 17], "float32"], ["TENSOR", [192, 128, 7, 1], "float32"], [1, 1], [3, 0, 3, 0], [1, 1], "float32"], {}], "config": {"index": 45700, "code_hash": null, "entity": [["tile_f", "sp", [-1, 6, 1, 1]], ["tile_y", "sp", [-1, 1, 1, 1]], ["tile_x", "sp", [-1, 1, 17, 1]], ["tile_rc", "sp", [-1, 1]], ["tile_ry", "sp", [-1, 7]], ["tile_rx", "sp", [-1, 1]], ["auto_unroll_max_step", "ot", 0], ["unroll_explicit", "ot", 0]]}, "result": [[4.970899936081815e-05, 4.970997954618089e-05, 4.971095973154363e-05], 0, 1.5823185443878174, 1679305514.0106728], "version": 0.2, "tvm_version": "0.10.0"}
{"input": ["cuda -keys=cuda,gpu -arch=sm_86 -max_num_threads=1024 -thread_warp_size=32", "conv2d_nchw.cuda", [["TENSOR", [1, 128, 17, 17], "float32"], ["TENSOR", [192, 128, 7, 1], "float32"], [1, 1], [3, 0, 3, 0], [1, 1], "float32"], {}], "config": {"index": 67205, "code_hash": null, "entity": [["tile_f", "sp", [-1, 8, 1, 1]], ["tile_y", "sp", [-1, 1, 1, 1]], ["tile_x", "sp", [-1, 1, 17, 1]], ["tile_rc", "sp", [-1, 16]], ["tile_ry", "sp", [-1, 7]], ["tile_rx", "sp", [-1, 1]], ["auto_unroll_max_step", "ot", 0], ["unroll_explicit", "ot", 0]]}, "result": [[0.00012486887412040658, 0.0001248695543393276, 0.0001248783588741204], 0, 1.713230848312378, 1679305515.229359], "version": 0.2, "tvm_version": "0.10.0"}
{"input": ["cuda -keys=cuda,gpu -arch=sm_86 -max_num_threads=1024 -thread_warp_size=32", "conv2d_nchw.cuda", [["TENSOR", [1, 128, 17, 17], "float32"], ["TENSOR", [192, 128, 7, 1], "float32"], [1, 1], [3, 0, 3, 0], [1, 1], "float32"], {}], "config": {"index": 45713, "code_hash": null, "entity": [["tile_f", "sp", [-1, 4, 2, 1]], ["tile_y", "sp", [-1, 1, 1, 1]], ["tile_x", "sp", [-1, 1, 17, 1]], ["tile_rc", "sp", [-1, 1]], ["tile_ry", "sp", [-1, 7]], ["tile_rx", "sp", [-1, 1]], ["auto_unroll_max_step", "ot", 0], ["unroll_explicit", "ot", 0]]}, "result": [[9.836528007402838e-05, 9.837228315854411e-05, 9.837978531770513e-05], 0, 1.5957179069519043, 1679305516.44554], "version": 0.2, "tvm_version": "0.10.0"}
{"input": ["cuda -keys=cuda,gpu -arch=sm_86 -max_num_threads=1024 -thread_warp_size=32", "conv2d_nchw.cuda", [["TENSOR", [1, 128, 17, 17], "float32"], ["TENSOR", [192, 128, 7, 1], "float32"], [1, 1], [3, 0, 3, 0], [1, 1], "float32"], {}], "config": {"index": 72581, "code_hash": null, "entity": [["tile_f", "sp", [-1, 8, 1, 1]], ["tile_y", "sp", [-1, 1, 1, 1]], ["tile_x", "sp", [-1, 1, 17, 1]], ["tile_rc", "sp", [-1, 32]], ["tile_ry", "sp", [-1, 7]], ["tile_rx", "sp", [-1, 1]], ["auto_unroll_max_step", "ot", 0], ["unroll_explicit", "ot", 0]]}, "result": [[0.00024036199095022625, 0.0002403743499245852, 0.00024041605279034693], 0, 1.7935454845428467, 1679305517.6659439], "version": 0.2, "tvm_version": "0.10.0"}
{"input": ["cuda -keys=cuda,gpu -arch=sm_86 -max_num_threads=1024 -thread_warp_size=32", "conv2d_nchw.cuda", [["TENSOR", [1, 128, 17, 17], "float32"], ["TENSOR", [192, 128, 7, 1], "float32"], [1, 1], [3, 0, 3, 0], [1, 1], "float32"], {}], "config": {"index": 45714, "code_hash": null, "entity": [["tile_f", "sp", [-1, 6, 2, 1]], ["tile_y", "sp", [-1, 1, 1, 1]], ["tile_x", "sp", [-1, 1, 17, 1]], ["tile_rc", "sp", [-1, 1]], ["tile_ry", "sp", [-1, 7]], ["tile_rx", "sp", [-1, 1]], ["auto_unroll_max_step", "ot", 0], ["unroll_explicit", "ot", 0]]}, "result": [[0.00010175774118387909, 0.00010176735957178842, 0.0001017763822418136], 0, 1.62504243850708, 1679305518.8979282], "version": 0.2, "tvm_version": "0.10.0"}
{"input": ["cuda -keys=cuda,gpu -arch=sm_86 -max_num_threads=1024 -thread_warp_size=32", "conv2d_nchw.cuda", [["TENSOR", [1, 128, 17, 17], "float32"], ["TENSOR", [192, 128, 7, 1], "float32"], [1, 1], [3, 0, 3, 0], [1, 1], "float32"], {}], "config": {"index": 217733, "code_hash": null, "entity": [["tile_f", "sp", [-1, 8, 1, 1]], ["tile_y", "sp", [-1, 1, 1, 1]], ["tile_x", "sp", [-1, 1, 17, 1]], ["tile_rc", "sp", [-1, 1]], ["tile_ry", "sp", [-1, 7]], ["tile_rx", "sp", [-1, 1]], ["auto_unroll_max_step", "ot", 1500], ["unroll_explicit", "ot", 0]]}, "result": [[4.937441163452419e-05, 4.937764875118558e-05, 4.938444577932343e-05], 0, 1.585690975189209, 1679305520.093467], "version": 0.2, "tvm_version": "0.10.0"}
{"input": ["cuda -keys=cuda,gpu -arch=sm_86 -max_num_threads=1024 -thread_warp_size=32", "conv2d_nchw.cuda", [["TENSOR", [1, 128, 17, 17], "float32"], ["TENSOR", [192, 128, 7, 1], "float32"], [1, 1], [3, 0, 3, 0], [1, 1], "float32"], {}], "config": {"index": 77957, "code_hash": null, "entity": [["tile_f", "sp", [-1, 8, 1, 1]], ["tile_y", "sp", [-1, 1, 1, 1]], ["tile_x", "sp", [-1, 1, 17, 1]], ["tile_rc", "sp", [-1, 64]], ["tile_ry", "sp", [-1, 7]], ["tile_rx", "sp", [-1, 1]], ["auto_unroll_max_step", "ot", 0], ["unroll_explicit", "ot", 0]]}, "result": [[0.00034530819999999997, 0.0003453104322580645, 0.00034531702795698925], 0, 1.6304876804351807, 1679305521.3121717], "version": 0.2, "tvm_version": "0.10.0"}
{"input": ["cuda -keys=cuda,gpu -arch=sm_86 -max_num_threads=1024 -thread_warp_size=32", "conv2d_nchw.cuda", [["TENSOR", [1, 128, 17, 17], "float32"], ["TENSOR", [192, 128, 7, 1], "float32"], [1, 1], [3, 0, 3, 0], [1, 1], "float32"], {}], "config": {"index": 43013, "code_hash": null, "entity": [["tile_f", "sp", [-1, 8, 1, 1]], ["tile_y", "sp", [-1, 1, 1, 1]], ["tile_x", "sp", [-1, 1, 1, 1]], ["tile_rc", "sp", [-1, 1]], ["tile_ry", "sp", [-1, 7]], ["tile_rx", "sp", [-1, 1]], ["auto_unroll_max_step", "ot", 0], ["unroll_explicit", "ot", 0]]}, "result": [[0.0013803379589041097, 0.001380420410958904, 0.0013804642054794521], 0, 1.2565374374389648, 1679305522.1372917], "version": 0.2, "tvm_version": "0.10.0"}
{"input": ["cuda -keys=cuda,gpu -arch=sm_86 -max_num_threads=1024 -thread_warp_size=32", "conv2d_nchw.cuda", [["TENSOR", [1, 128, 17, 17], "float32"], ["TENSOR", [192, 128, 7, 1], "float32"], [1, 1], [3, 0, 3, 0], [1, 1], "float32"], {}], "config": {"index": 46373, "code_hash": null, "entity": [["tile_f", "sp", [-1, 8, 1, 1]], ["tile_y", "sp", [-1, 1, 17, 1]], ["tile_x", "sp", [-1, 1, 17, 1]], ["tile_rc", "sp", [-1, 1]], ["tile_ry", "sp", [-1, 7]], ["tile_rx", "sp", [-1, 1]], ["auto_unroll_max_step", "ot", 0], ["unroll_explicit", "ot", 0]]}, "result": [[8.348665283613444e-05, 8.348712552521008e-05, 8.348988235294117e-05], 0, 1.5945234298706055, 1679305523.3435512], "version": 0.2, "tvm_version": "0.10.0"}
{"input": ["cuda -keys=cuda,gpu -arch=sm_86 -max_num_threads=1024 -thread_warp_size=32", "conv2d_nchw.cuda", [["TENSOR", [1, 128, 17, 17], "float32"], ["TENSOR", [192, 128, 7, 1], "float32"], [1, 1], [3, 0, 3, 0], [1, 1], "float32"], {}], "config": {"index": 389765, "code_hash": null, "entity": [["tile_f", "sp", [-1, 8, 1, 1]], ["tile_y", "sp", [-1, 1, 1, 1]], ["tile_x", "sp", [-1, 1, 17, 1]], ["tile_rc", "sp", [-1, 1]], ["tile_ry", "sp", [-1, 7]], ["tile_rx", "sp", [-1, 1]], ["auto_unroll_max_step", "ot", 512], ["unroll_explicit", "ot", 1]]}, "result": [[4.927935870927318e-05, 4.936950595238096e-05, 4.937720238095239e-05], 0, 1.6256074905395508, 1679305525.3310666], "version": 0.2, "tvm_version": "0.10.0"}
{"input": ["cuda -keys=cuda,gpu -arch=sm_86 -max_num_threads=1024 -thread_warp_size=32", "conv2d_nchw.cuda", [["TENSOR", [1, 128, 17, 17], "float32"], ["TENSOR", [192, 128, 7, 1], "float32"], [1, 1], [3, 0, 3, 0], [1, 1], "float32"], {}], "config": {"index": 137093, "code_hash": null, "entity": [["tile_f", "sp", [-1, 8, 1, 1]], ["tile_y", "sp", [-1, 1, 1, 1]], ["tile_x", "sp", [-1, 1, 17, 1]], ["tile_rc", "sp", [-1, 2]], ["tile_ry", "sp", [-1, 7]], ["tile_rx", "sp", [-1, 1]], ["auto_unroll_max_step", "ot", 512], ["unroll_explicit", "ot", 0]]}, "result": [[5.042997631578948e-05, 5.043503092105263e-05, 5.043603980263158e-05], 0, 1.5807154178619385, 1679305526.5651538], "version": 0.2, "tvm_version": "0.10.0"}
{"input": ["cuda -keys=cuda,gpu -arch=sm_86 -max_num_threads=1024 -thread_warp_size=32", "conv2d_nchw.cuda", [["TENSOR", [1, 128, 17, 17], "float32"], ["TENSOR", [192, 128, 7, 1], "float32"], [1, 1], [3, 0, 3, 0], [1, 1], "float32"], {}], "config": {"index": 133061, "code_hash": null, "entity": [["tile_f", "sp", [-1, 8, 1, 1]], ["tile_y", "sp", [-1, 1, 1, 1]], ["tile_x", "sp", [-1, 1, 1, 17]], ["tile_rc", "sp", [-1, 1]], ["tile_ry", "sp", [-1, 7]], ["tile_rx", "sp", [-1, 1]], ["auto_unroll_max_step", "ot", 512], ["unroll_explicit", "ot", 0]]}, "result": [[0.000418105049222798, 0.00041815280310880833, 0.0004182005569948186], 0, 1.8603711128234863, 1679305527.7946782], "version": 0.2, "tvm_version": "0.10.0"}
{"input": ["cuda -keys=cuda,gpu -arch=sm_86 -max_num_threads=1024 -thread_warp_size=32", "conv2d_nchw.cuda", [["TENSOR", [1, 128, 17, 17], "float32"], ["TENSOR", [192, 128, 7, 1], "float32"], [1, 1], [3, 0, 3, 0], [1, 1], "float32"], {}], "config": {"index": 130373, "code_hash": null, "entity": [["tile_f", "sp", [-1, 8, 1, 1]], ["tile_y", "sp", [-1, 1, 1, 1]], ["tile_x", "sp", [-1, 17, 1, 1]], ["tile_rc", "sp", [-1, 1]], ["tile_ry", "sp", [-1, 7]], ["tile_rx", "sp", [-1, 1]], ["auto_unroll_max_step", "ot", 512], ["unroll_explicit", "ot", 0]]}, "result": [[0.00041637539119170985, 0.00041637539119170985, 0.00041646026424870463], 0, 1.8963422775268555, 1679305529.013667], "version": 0.2, "tvm_version": "0.10.0"}
{"input": ["cuda -keys=cuda,gpu -arch=sm_86 -max_num_threads=1024 -thread_warp_size=32", "conv2d_nchw.cuda", [["TENSOR", [1, 128, 17, 17], "float32"], ["TENSOR", [192, 128, 7, 1], "float32"], [1, 1], [3, 0, 3, 0], [1, 1], "float32"], {}], "config": {"index": 132053, "code_hash": null, "entity": [["tile_f", "sp", [-1, 8, 1, 1]], ["tile_y", "sp", [-1, 17, 1, 1]], ["tile_x", "sp", [-1, 1, 17, 1]], ["tile_rc", "sp", [-1, 1]], ["tile_ry", "sp", [-1, 7]], ["tile_rx", "sp", [-1, 1]], ["auto_unroll_max_step", "ot", 512], ["unroll_explicit", "ot", 0]]}, "result": [[0.00014906391906976745, 0.0001490667153488372, 0.00014906772279069767], 0, 1.8466463088989258, 1679305530.2309988], "version": 0.2, "tvm_version": "0.10.0"}
{"input": ["cuda -keys=cuda,gpu -arch=sm_86 -max_num_threads=1024 -thread_warp_size=32", "conv2d_nchw.cuda", [["TENSOR", [1, 128, 17, 17], "float32"], ["TENSOR", [192, 128, 7, 1], "float32"], [1, 1], [3, 0, 3, 0], [1, 1], "float32"], {}], "config": {"index": 131718, "code_hash": null, "entity": [["tile_f", "sp", [-1, 12, 1, 1]], ["tile_y", "sp", [-1, 1, 1, 1]], ["tile_x", "sp", [-1, 1, 17, 1]], ["tile_rc", "sp", [-1, 1]], ["tile_ry", "sp", [-1, 7]], ["tile_rx", "sp", [-1, 1]], ["auto_unroll_max_step", "ot", 512], ["unroll_explicit", "ot", 0]]}, "result": [[7.776075588235294e-05, 7.778233529411765e-05, 7.780499166666666e-05], 0, 1.6141693592071533, 1679305531.4409418], "version": 0.2, "tvm_version": "0.10.0"}
{"input": ["cuda -keys=cuda,gpu -arch=sm_86 -max_num_threads=1024 -thread_warp_size=32", "conv2d_nchw.cuda", [["TENSOR", [1, 128, 17, 17], "float32"], ["TENSOR", [192, 128, 7, 1], "float32"], [1, 1], [3, 0, 3, 0], [1, 1], "float32"], {}], "config": {"index": 131716, "code_hash": null, "entity": [["tile_f", "sp", [-1, 6, 1, 1]], ["tile_y", "sp", [-1, 1, 1, 1]], ["tile_x", "sp", [-1, 1, 17, 1]], ["tile_rc", "sp", [-1, 1]], ["tile_ry", "sp", [-1, 7]], ["tile_rx", "sp", [-1, 1]], ["auto_unroll_max_step", "ot", 512], ["unroll_explicit", "ot", 0]]}, "result": [[4.970919076241696e-05, 4.971210629547612e-05, 4.971307655805124e-05], 0, 1.5694425106048584, 1679305532.6465845], "version": 0.2, "tvm_version": "0.10.0"}
{"input": ["cuda -keys=cuda,gpu -arch=sm_86 -max_num_threads=1024 -thread_warp_size=32", "conv2d_nchw.cuda", [["TENSOR", [1, 128, 17, 17], "float32"], ["TENSOR", [192, 128, 7, 1], "float32"], [1, 1], [3, 0, 3, 0], [1, 1], "float32"], {}], "config": {"index": 132725, "code_hash": null, "entity": [["tile_f", "sp", [-1, 8, 1, 1]], ["tile_y", "sp", [-1, 1, 1, 17]], ["tile_x", "sp", [-1, 1, 17, 1]], ["tile_rc", "sp", [-1, 1]], ["tile_ry", "sp", [-1, 7]], ["tile_rx", "sp", [-1, 1]], ["auto_unroll_max_step", "ot", 512], ["unroll_explicit", "ot", 0]]}, "result": [[0.00014992531021555764, 0.00014993490627928773, 0.0001499388388003749], 0, 1.8533365726470947, 1679305533.8840847], "version": 0.2, "tvm_version": "0.10.0"}
{"input": ["cuda -keys=cuda,gpu -arch=sm_86 -max_num_threads=1024 -thread_warp_size=32", "conv2d_nchw.cuda", [["TENSOR", [1, 128, 17, 17], "float32"], ["TENSOR", [192, 128, 7, 1], "float32"], [1, 1], [3, 0, 3, 0], [1, 1], "float32"], {}], "config": {"index": 131732, "code_hash": null, "entity": [["tile_f", "sp", [-1, 12, 2, 1]], ["tile_y", "sp", [-1, 1, 1, 1]], ["tile_x", "sp", [-1, 1, 17, 1]], ["tile_rc", "sp", [-1, 1]], ["tile_ry", "sp", [-1, 7]], ["tile_rx", "sp", [-1, 1]], ["auto_unroll_max_step", "ot", 512], ["unroll_explicit", "ot", 0]]}, "result": [[0.00011404607576840599, 0.00011405486704789135, 0.00011405764832022874], 0, 1.6503608226776123, 1679305535.101279], "version": 0.2, "tvm_version": "0.10.0"}
{"input": ["cuda -keys=cuda,gpu -arch=sm_86 -max_num_threads=1024 -thread_warp_size=32", "conv2d_nchw.cuda", [["TENSOR", [1, 128, 17, 17], "float32"], ["TENSOR", [192, 128, 7, 1], "float32"], [1, 1], [3, 0, 3, 0], [1, 1], "float32"], {}], "config": {"index": 131733, "code_hash": null, "entity": [["tile_f", "sp", [-1, 16, 2, 1]], ["tile_y", "sp", [-1, 1, 1, 1]], ["tile_x", "sp", [-1, 1, 17, 1]], ["tile_rc", "sp", [-1, 1]], ["tile_ry", "sp", [-1, 7]], ["tile_rx", "sp", [-1, 1]], ["auto_unroll_max_step", "ot", 512], ["unroll_explicit", "ot", 0]]}, "result": [[0.0001347874560810811, 0.00013479005912162164, 0.0001347909231418919], 0, 1.6653838157653809, 1679305536.3215964], "version": 0.2, "tvm_version": "0.10.0"}
{"input": ["cuda -keys=cuda,gpu -arch=sm_86 -max_num_threads=1024 -thread_warp_size=32", "conv2d_nchw.cuda", [["TENSOR", [1, 128, 17, 17], "float32"], ["TENSOR", [192, 128, 7, 1], "float32"], [1, 1], [3, 0, 3, 0], [1, 1], "float32"], {}], "config": {"index": 131734, "code_hash": null, "entity": [["tile_f", "sp", [-1, 24, 2, 1]], ["tile_y", "sp", [-1, 1, 1, 1]], ["tile_x", "sp", [-1, 1, 17, 1]], ["tile_rc", "sp", [-1, 1]], ["tile_ry", "sp", [-1, 7]], ["tile_rx", "sp", [-1, 1]], ["auto_unroll_max_step", "ot", 512], ["unroll_explicit", "ot", 0]]}, "result": [[0.00015091983600377002, 0.0001509372082940622, 0.00015094011310084825], 0, 1.7391893863677979, 1679305537.5435798], "version": 0.2, "tvm_version": "0.10.0"}
{"input": ["cuda -keys=cuda,gpu -arch=sm_86 -max_num_threads=1024 -thread_warp_size=32", "conv2d_nchw.cuda", [["TENSOR", [1, 128, 17, 17], "float32"], ["TENSOR", [192, 128, 7, 1], "float32"], [1, 1], [3, 0, 3, 0], [1, 1], "float32"], {}], "config": {"index": 142469, "code_hash": null, "entity": [["tile_f", "sp", [-1, 8, 1, 1]], ["tile_y", "sp", [-1, 1, 1, 1]], ["tile_x", "sp", [-1, 1, 17, 1]], ["tile_rc", "sp", [-1, 4]], ["tile_ry", "sp", [-1, 7]], ["tile_rx", "sp", [-1, 1]], ["auto_unroll_max_step", "ot", 512], ["unroll_explicit", "ot", 0]]}, "result": [[5.370998872950819e-05, 5.37145331284153e-05, 5.3721881147540975e-05], 0, 1.7484843730926514, 1679305538.745495], "version": 0.2, "tvm_version": "0.10.0"}
{"input": ["cuda -keys=cuda,gpu -arch=sm_86 -max_num_threads=1024 -thread_warp_size=32", "conv2d_nchw.cuda", [["TENSOR", [1, 128, 17, 17], "float32"], ["TENSOR", [192, 128, 7, 1], "float32"], [1, 1], [3, 0, 3, 0], [1, 1], "float32"], {}], "config": {"index": 129029, "code_hash": null, "entity": [["tile_f", "sp", [-1, 8, 1, 1]], ["tile_y", "sp", [-1, 1, 1, 1]], ["tile_x", "sp", [-1, 1, 1, 1]], ["tile_rc", "sp", [-1, 1]], ["tile_ry", "sp", [-1, 7]], ["tile_rx", "sp", [-1, 1]], ["auto_unroll_max_step", "ot", 512], ["unroll_explicit", "ot", 0]]}, "result": [[0.0013789773150684932, 0.0013790080410958905, 0.0013791027260273972], 0, 1.23640775680542, 1679305539.5905707], "version": 0.2, "tvm_version": "0.10.0"}
{"input": ["cuda -keys=cuda,gpu -arch=sm_86 -max_num_threads=1024 -thread_warp_size=32", "conv2d_nchw.cuda", [["TENSOR", [1, 128, 17, 17], "float32"], ["TENSOR", [192, 128, 7, 1], "float32"], [1, 1], [3, 0, 3, 0], [1, 1], "float32"], {}], "config": {"index": 132389, "code_hash": null, "entity": [["tile_f", "sp", [-1, 8, 1, 1]], ["tile_y", "sp", [-1, 1, 17, 1]], ["tile_x", "sp", [-1, 1, 17, 1]], ["tile_rc", "sp", [-1, 1]], ["tile_ry", "sp", [-1, 7]], ["tile_rx", "sp", [-1, 1]], ["auto_unroll_max_step", "ot", 512], ["unroll_explicit", "ot", 0]]}, "result": [[8.348776603575185e-05, 8.348830389064144e-05, 8.349153680336488e-05], 0, 1.5889787673950195, 1679305540.7975092], "version": 0.2, "tvm_version": "0.10.0"}
{"input": ["cuda -keys=cuda,gpu -arch=sm_86 -max_num_threads=1024 -thread_warp_size=32", "conv2d_nchw.cuda", [["TENSOR", [1, 128, 17, 17], "float32"], ["TENSOR", [192, 128, 7, 1], "float32"], [1, 1], [3, 0, 3, 0], [1, 1], "float32"], {}], "config": {"index": 131735, "code_hash": null, "entity": [["tile_f", "sp", [-1, 32, 2, 1]], ["tile_y", "sp", [-1, 1, 1, 1]], ["tile_x", "sp", [-1, 1, 17, 1]], ["tile_rc", "sp", [-1, 1]], ["tile_ry", "sp", [-1, 7]], ["tile_rx", "sp", [-1, 1]], ["auto_unroll_max_step", "ot", 512], ["unroll_explicit", "ot", 0]]}, "result": [[0.00018978632860520094, 0.00018979222695035463, 0.00018979464302600475], 0, 1.7689836025238037, 1679305542.0252483], "version": 0.2, "tvm_version": "0.10.0"}
{"input": ["cuda -keys=cuda,gpu -arch=sm_86 -max_num_threads=1024 -thread_warp_size=32", "conv2d_nchw.cuda", [["TENSOR", [1, 128, 17, 17], "float32"], ["TENSOR", [192, 128, 7, 1], "float32"], [1, 1], [3, 0, 3, 0], [1, 1], "float32"], {}], "config": {"index": 147845, "code_hash": null, "entity": [["tile_f", "sp", [-1, 8, 1, 1]], ["tile_y", "sp", [-1, 1, 1, 1]], ["tile_x", "sp", [-1, 1, 17, 1]], ["tile_rc", "sp", [-1, 8]], ["tile_ry", "sp", [-1, 7]], ["tile_rx", "sp", [-1, 1]], ["auto_unroll_max_step", "ot", 512], ["unroll_explicit", "ot", 0]]}, "result": [[8.181670102339182e-05, 8.183174195906433e-05, 9.184250073099415e-05], 0, 2.0182039737701416, 1679305553.0771792], "version": 0.2, "tvm_version": "0.10.0"}
{"input": ["cuda -keys=cuda,gpu -arch=sm_86 -max_num_threads=1024 -thread_warp_size=32", "conv2d_nchw.cuda", [["TENSOR", [1, 128, 17, 17], "float32"], ["TENSOR", [192, 128, 7, 1], "float32"], [1, 1], [3, 0, 3, 0], [1, 1], "float32"], {}], "config": {"index": 131736, "code_hash": null, "entity": [["tile_f", "sp", [-1, 48, 2, 1]], ["tile_y", "sp", [-1, 1, 1, 1]], ["tile_x", "sp", [-1, 1, 17, 1]], ["tile_rc", "sp", [-1, 1]], ["tile_ry", "sp", [-1, 7]], ["tile_rx", "sp", [-1, 1]], ["auto_unroll_max_step", "ot", 512], ["unroll_explicit", "ot", 0]]}, "result": [[0.00028975147661870505, 0.0002897569928057554, 0.00028976253776978416], 0, 1.9796245098114014, 1679305554.3037925], "version": 0.2, "tvm_version": "0.10.0"}
{"input": ["cuda -keys=cuda,gpu -arch=sm_86 -max_num_threads=1024 -thread_warp_size=32", "conv2d_nchw.cuda", [["TENSOR", [1, 128, 17, 17], "float32"], ["TENSOR", [192, 128, 7, 1], "float32"], [1, 1], [3, 0, 3, 0], [1, 1], "float32"], {}], "config": {"index": 153221, "code_hash": null, "entity": [["tile_f", "sp", [-1, 8, 1, 1]], ["tile_y", "sp", [-1, 1, 1, 1]], ["tile_x", "sp", [-1, 1, 17, 1]], ["tile_rc", "sp", [-1, 16]], ["tile_ry", "sp", [-1, 7]], ["tile_rx", "sp", [-1, 1]], ["auto_unroll_max_step", "ot", 512], ["unroll_explicit", "ot", 0]]}, "result": [[0.00034341630957683745, 0.0003440275122494432, 0.0003441597772828508], 0, 4.012976408004761, 1679305555.4924898], "version": 0.2, "tvm_version": "0.10.0"}
{"input": ["cuda -keys=cuda,gpu -arch=sm_86 -max_num_threads=1024 -thread_warp_size=32", "conv2d_nchw.cuda", [["TENSOR", [1, 128, 17, 17], "float32"], ["TENSOR", [192, 128, 7, 1], "float32"], [1, 1], [3, 0, 3, 0], [1, 1], "float32"], {}], "config": {"index": 131737, "code_hash": null, "entity": [["tile_f", "sp", [-1, 96, 2, 1]], ["tile_y", "sp", [-1, 1, 1, 1]], ["tile_x", "sp", [-1, 1, 17, 1]], ["tile_rc", "sp", [-1, 1]], ["tile_ry", "sp", [-1, 7]], ["tile_rx", "sp", [-1, 1]], ["auto_unroll_max_step", "ot", 512], ["unroll_explicit", "ot", 0]]}, "result": [[0.00037082217701149426, 0.00037083852413793104, 0.00037086167586206895], 0, 1.9735310077667236, 1679305556.713265], "version": 0.2, "tvm_version": "0.10.0"}
{"input": ["cuda -keys=cuda,gpu -arch=sm_86 -max_num_threads=1024 -thread_warp_size=32", "conv2d_nchw.cuda", [["TENSOR", [1, 128, 17, 17], "float32"], ["TENSOR", [192, 128, 7, 1], "float32"], [1, 1], [3, 0, 3, 0], [1, 1], "float32"], {}], "config": {"index": 158597, "code_hash": null, "entity": [["tile_f", "sp", [-1, 8, 1, 1]], ["tile_y", "sp", [-1, 1, 1, 1]], ["tile_x", "sp", [-1, 1, 17, 1]], ["tile_rc", "sp", [-1, 32]], ["tile_ry", "sp", [-1, 7]], ["tile_rx", "sp", [-1, 1]], ["auto_unroll_max_step", "ot", 512], ["unroll_explicit", "ot", 0]]}, "result": [[0.0008432179576719576, 0.0008432667195767196, 0.0008433046666666667], 0, 9.577137231826782, 1679305557.9378064], "version": 0.2, "tvm_version": "0.10.0"}
{"input": ["cuda -keys=cuda,gpu -arch=sm_86 -max_num_threads=1024 -thread_warp_size=32", "conv2d_nchw.cuda", [["TENSOR", [1, 128, 17, 17], "float32"], ["TENSOR", [192, 128, 7, 1], "float32"], [1, 1], [3, 0, 3, 0], [1, 1], "float32"], {}], "config": {"index": 131738, "code_hash": null, "entity": [["tile_f", "sp", [-1, 1, 3, 1]], ["tile_y", "sp", [-1, 1, 1, 1]], ["tile_x", "sp", [-1, 1, 17, 1]], ["tile_rc", "sp", [-1, 1]], ["tile_ry", "sp", [-1, 7]], ["tile_rx", "sp", [-1, 1]], ["auto_unroll_max_step", "ot", 512], ["unroll_explicit", "ot", 0]]}, "result": [[0.00011397348169418522, 0.00011397641708542713, 0.00011397702010050252], 0, 1.5989248752593994, 1679305559.14656], "version": 0.2, "tvm_version": "0.10.0"}
{"input": ["cuda -keys=cuda,gpu -arch=sm_86 -max_num_threads=1024 -thread_warp_size=32", "conv2d_nchw.cuda", [["TENSOR", [1, 128, 17, 17], "float32"], ["TENSOR", [192, 128, 7, 1], "float32"], [1, 1], [3, 0, 3, 0], [1, 1], "float32"], {}], "config": {"index": 131739, "code_hash": null, "entity": [["tile_f", "sp", [-1, 2, 3, 1]], ["tile_y", "sp", [-1, 1, 1, 1]], ["tile_x", "sp", [-1, 1, 17, 1]], ["tile_rc", "sp", [-1, 1]], ["tile_ry", "sp", [-1, 7]], ["tile_rx", "sp", [-1, 1]], ["auto_unroll_max_step", "ot", 512], ["unroll_explicit", "ot", 0]]}, "result": [[8.268239728884254e-05, 8.268666162669447e-05, 8.270641553701774e-05], 0, 1.5988178253173828, 1679305560.3679144], "version": 0.2, "tvm_version": "0.10.0"}
{"input": ["cuda -keys=cuda,gpu -arch=sm_86 -max_num_threads=1024 -thread_warp_size=32", "conv2d_nchw.cuda", [["TENSOR", [1, 128, 17, 17], "float32"], ["TENSOR", [192, 128, 7, 1], "float32"], [1, 1], [3, 0, 3, 0], [1, 1], "float32"], {}], "config": {"index": 131740, "code_hash": null, "entity": [["tile_f", "sp", [-1, 4, 3, 1]], ["tile_y", "sp", [-1, 1, 1, 1]], ["tile_x", "sp", [-1, 1, 17, 1]], ["tile_rc", "sp", [-1, 1]], ["tile_ry", "sp", [-1, 7]], ["tile_rx", "sp", [-1, 1]], ["auto_unroll_max_step", "ot", 512], ["unroll_explicit", "ot", 0]]}, "result": [[8.106016196822143e-05, 8.106069400307536e-05, 8.10671071245515e-05], 0, 1.5977025032043457, 1679305561.5702984], "version": 0.2, "tvm_version": "0.10.0"}
{"input": ["cuda -keys=cuda,gpu -arch=sm_86 -max_num_threads=1024 -thread_warp_size=32", "conv2d_nchw.cuda", [["TENSOR", [1, 128, 17, 17], "float32"], ["TENSOR", [192, 128, 7, 1], "float32"], [1, 1], [3, 0, 3, 0], [1, 1], "float32"], {}], "config": {"index": 131741, "code_hash": null, "entity": [["tile_f", "sp", [-1, 8, 3, 1]], ["tile_y", "sp", [-1, 1, 1, 1]], ["tile_x", "sp", [-1, 1, 17, 1]], ["tile_rc", "sp", [-1, 1]], ["tile_ry", "sp", [-1, 7]], ["tile_rx", "sp", [-1, 1]], ["auto_unroll_max_step", "ot", 512], ["unroll_explicit", "ot", 0]]}, "result": [[8.720681783159054e-05, 8.72085057787562e-05, 8.72107226197028e-05], 0, 1.6241817474365234, 1679305562.78597], "version": 0.2, "tvm_version": "0.10.0"}
