results/cuda_rtx3080/inception_v3/droplet/cpu.log_layer_14.log
{"input": ["cuda -keys=cuda,gpu -arch=sm_86 -max_num_threads=1024 -thread_warp_size=32", "conv2d_nchw.cuda", [["TENSOR", [1, 96, 35, 35], "float32"], ["TENSOR", [96, 96, 3, 3], "float32"], [1, 1], [1, 1, 1, 1], [1, 1], "float32"], {}], "config": {"index": 0, "code_hash": null, "entity": [["tile_f", "sp", [-1, 1, 1, 1]], ["tile_y", "sp", [-1, 1, 1, 1]], ["tile_x", "sp", [-1, 1, 1, 1]], ["tile_rc", "sp", [-1, 1]], ["tile_ry", "sp", [-1, 1]], ["tile_rx", "sp", [-1, 1]], ["auto_unroll_max_step", "ot", 0], ["unroll_explicit", "ot", 0]]}, "result": [[0.00408391692, 0.0040843673600000005, 0.00408535032], 0, 0.9891493320465088, 1679302653.9033957], "version": 0.2, "tvm_version": "0.10.0"}
{"input": ["cuda -keys=cuda,gpu -arch=sm_86 -max_num_threads=1024 -thread_warp_size=32", "conv2d_nchw.cuda", [["TENSOR", [1, 96, 35, 35], "float32"], ["TENSOR", [96, 96, 3, 3], "float32"], [1, 1], [1, 1, 1, 1], [1, 1], "float32"], {}], "config": {"index": 8257536, "code_hash": null, "entity": [["tile_f", "sp", [-1, 1, 1, 1]], ["tile_y", "sp", [-1, 1, 1, 1]], ["tile_x", "sp", [-1, 1, 1, 1]], ["tile_rc", "sp", [-1, 1]], ["tile_ry", "sp", [-1, 1]], ["tile_rx", "sp", [-1, 1]], ["auto_unroll_max_step", "ot", 0], ["unroll_explicit", "ot", 1]]}, "result": [[0.00408428556, 0.0040848602, 0.00408547332], 0, 1.1638622283935547, 1679302655.2498312], "version": 0.2, "tvm_version": "0.10.0"}
{"input": ["cuda -keys=cuda,gpu -arch=sm_86 -max_num_threads=1024 -thread_warp_size=32", "conv2d_nchw.cuda", [["TENSOR", [1, 96, 35, 35], "float32"], ["TENSOR", [96, 96, 3, 3], "float32"], [1, 1], [1, 1, 1, 1], [1, 1], "float32"], {}], "config": {"index": 2752512, "code_hash": null, "entity": [["tile_f", "sp", [-1, 1, 1, 1]], ["tile_y", "sp", [-1, 1, 1, 1]], ["tile_x", "sp", [-1, 1, 1, 1]], ["tile_rc", "sp", [-1, 1]], ["tile_ry", "sp", [-1, 1]], ["tile_rx", "sp", [-1, 1]], ["auto_unroll_max_step", "ot", 512], ["unroll_explicit", "ot", 0]]}, "result": [[0.004082565, 0.004083582759999999, 0.00408580108], 0, 1.1932334899902344, 1679302656.0988364], "version": 0.2, "tvm_version": "0.10.0"}
{"input": ["cuda -keys=cuda,gpu -arch=sm_86 -max_num_threads=1024 -thread_warp_size=32", "conv2d_nchw.cuda", [["TENSOR", [1, 96, 35, 35], "float32"], ["TENSOR", [96, 96, 3, 3], "float32"], [1, 1], [1, 1, 1, 1], [1, 1], "float32"], {}], "config": {"index": 1376256, "code_hash": null, "entity": [["tile_f", "sp", [-1, 1, 1, 1]], ["tile_y", "sp", [-1, 1, 1, 1]], ["tile_x", "sp", [-1, 1, 1, 1]], ["tile_rc", "sp", [-1, 1]], ["tile_ry", "sp", [-1, 1]], ["tile_rx", "sp", [-1, 3]], ["auto_unroll_max_step", "ot", 0], ["unroll_explicit", "ot", 0]]}, "result": [[0.007910626307692308, 0.00791393976923077, 0.007914653461538461], 0, 1.2132091522216797, 1679302656.9570396], "version": 0.2, "tvm_version": "0.10.0"}
{"input": ["cuda -keys=cuda,gpu -arch=sm_86 -max_num_threads=1024 -thread_warp_size=32", "conv2d_nchw.cuda", [["TENSOR", [1, 96, 35, 35], "float32"], ["TENSOR", [96, 96, 3, 3], "float32"], [1, 1], [1, 1, 1, 1], [1, 1], "float32"], {}], "config": {"index": 688128, "code_hash": null, "entity": [["tile_f", "sp", [-1, 1, 1, 1]], ["tile_y", "sp", [-1, 1, 1, 1]], ["tile_x", "sp", [-1, 1, 1, 1]], ["tile_rc", "sp", [-1, 1]], ["tile_ry", "sp", [-1, 3]], ["tile_rx", "sp", [-1, 1]], ["auto_unroll_max_step", "ot", 0], ["unroll_explicit", "ot", 0]]}, "result": [[0.007437880857142857, 0.007437897214285714, 0.007438189857142857], 0, 1.2244033813476562, 1679302657.8001132], "version": 0.2, "tvm_version": "0.10.0"}
{"input": ["cuda -keys=cuda,gpu -arch=sm_86 -max_num_threads=1024 -thread_warp_size=32", "conv2d_nchw.cuda", [["TENSOR", [1, 96, 35, 35], "float32"], ["TENSOR", [96, 96, 3, 3], "float32"], [1, 1], [1, 1, 1, 1], [1, 1], "float32"], {}], "config": {"index": 57344, "code_hash": null, "entity": [["tile_f", "sp", [-1, 1, 1, 1]], ["tile_y", "sp", [-1, 1, 1, 1]], ["tile_x", "sp", [-1, 1, 1, 1]], ["tile_rc", "sp", [-1, 2]], ["tile_ry", "sp", [-1, 1]], ["tile_rx", "sp", [-1, 1]], ["auto_unroll_max_step", "ot", 0], ["unroll_explicit", "ot", 0]]}, "result": [[0.008233668923076923, 0.008234141384615383, 0.008234693076923077], 0, 1.24202299118042, 1679302658.6762912], "version": 0.2, "tvm_version": "0.10.0"}
{"input": ["cuda -keys=cuda,gpu -arch=sm_86 -max_num_threads=1024 -thread_warp_size=32", "conv2d_nchw.cuda", [["TENSOR", [1, 96, 35, 35], "float32"], ["TENSOR", [96, 96, 3, 3], "float32"], [1, 1], [1, 1, 1, 1], [1, 1], "float32"], {}], "config": {"index": 3584, "code_hash": null, "entity": [["tile_f", "sp", [-1, 1, 1, 1]], ["tile_y", "sp", [-1, 1, 1, 1]], ["tile_x", "sp", [-1, 5, 1, 1]], ["tile_rc", "sp", [-1, 1]], ["tile_ry", "sp", [-1, 1]], ["tile_rx", "sp", [-1, 1]], ["auto_unroll_max_step", "ot", 0], ["unroll_explicit", "ot", 0]]}, "result": [[0.004757783363636364, 0.004758155454545454, 0.004758853909090909], 0, 1.2320294380187988, 1679302659.5327635], "version": 0.2, "tvm_version": "0.10.0"}
{"input": ["cuda -keys=cuda,gpu -arch=sm_86 -max_num_threads=1024 -thread_warp_size=32", "conv2d_nchw.cuda", [["TENSOR", [1, 96, 35, 35], "float32"], ["TENSOR", [96, 96, 3, 3], "float32"], [1, 1], [1, 1, 1, 1], [1, 1], "float32"], {}], "config": {"index": 224, "code_hash": null, "entity": [["tile_f", "sp", [-1, 1, 1, 1]], ["tile_y", "sp", [-1, 5, 1, 1]], ["tile_x", "sp", [-1, 1, 1, 1]], ["tile_rc", "sp", [-1, 1]], ["tile_ry", "sp", [-1, 1]], ["tile_rx", "sp", [-1, 1]], ["auto_unroll_max_step", "ot", 0], ["unroll_explicit", "ot", 0]]}, "result": [[0.0047573179545454545, 0.004758341681818181, 0.004758533818181818], 0, 1.2571284770965576, 1679302660.3945253], "version": 0.2, "tvm_version": "0.10.0"}
{"input": ["cuda -keys=cuda,gpu -arch=sm_86 -max_num_threads=1024 -thread_warp_size=32", "conv2d_nchw.cuda", [["TENSOR", [1, 96, 35, 35], "float32"], ["TENSOR", [96, 96, 3, 3], "float32"], [1, 1], [1, 1, 1, 1], [1, 1], "float32"], {}], "config": {"index": 1, "code_hash": null, "entity": [["tile_f", "sp", [-1, 2, 1, 1]], ["tile_y", "sp", [-1, 1, 1, 1]], ["tile_x", "sp", [-1, 1, 1, 1]], ["tile_rc", "sp", [-1, 1]], ["tile_ry", "sp", [-1, 1]], ["tile_rx", "sp", [-1, 1]], ["auto_unroll_max_step", "ot", 0], ["unroll_explicit", "ot", 0]]}, "result": [[0.0063280639375, 0.0063281921875, 0.0063284478125000005], 0, 1.2229442596435547, 1679302661.2419353], "version": 0.2, "tvm_version": "0.10.0"}
{"input": ["cuda -keys=cuda,gpu -arch=sm_86 -max_num_threads=1024 -thread_warp_size=32", "conv2d_nchw.cuda", [["TENSOR", [1, 96, 35, 35], "float32"], ["TENSOR", [96, 96, 3, 3], "float32"], [1, 1], [1, 1, 1, 1], [1, 1], "float32"], {}], "config": {"index": 5505024, "code_hash": null, "entity": [["tile_f", "sp", [-1, 1, 1, 1]], ["tile_y", "sp", [-1, 1, 1, 1]], ["tile_x", "sp", [-1, 1, 1, 1]], ["tile_rc", "sp", [-1, 1]], ["tile_ry", "sp", [-1, 1]], ["tile_rx", "sp", [-1, 1]], ["auto_unroll_max_step", "ot", 1500], ["unroll_explicit", "ot", 0]]}, "result": [[0.0040832614, 0.00408440824, 0.0040846054], 0, 1.2104485034942627, 1679302662.0808084], "version": 0.2, "tvm_version": "0.10.0"}
{"input": ["cuda -keys=cuda,gpu -arch=sm_86 -max_num_threads=1024 -thread_warp_size=32", "conv2d_nchw.cuda", [["TENSOR", [1, 96, 35, 35], "float32"], ["TENSOR", [96, 96, 3, 3], "float32"], [1, 1], [1, 1, 1, 1], [1, 1], "float32"], {}], "config": {"index": 114688, "code_hash": null, "entity": [["tile_f", "sp", [-1, 1, 1, 1]], ["tile_y", "sp", [-1, 1, 1, 1]], ["tile_x", "sp", [-1, 1, 1, 1]], ["tile_rc", "sp", [-1, 3]], ["tile_ry", "sp", [-1, 1]], ["tile_rx", "sp", [-1, 1]], ["auto_unroll_max_step", "ot", 0], ["unroll_explicit", "ot", 0]]}, "result": [[0.007041979933333334, 0.007042048133333334, 0.007042116266666666], 0, 1.238553762435913, 1679302662.9433181], "version": 0.2, "tvm_version": "0.10.0"}
{"input": ["cuda -keys=cuda,gpu -arch=sm_86 -max_num_threads=1024 -thread_warp_size=32", "conv2d_nchw.cuda", [["TENSOR", [1, 96, 35, 35], "float32"], ["TENSOR", [96, 96, 3, 3], "float32"], [1, 1], [1, 1, 1, 1], [1, 1], "float32"], {}], "config": {"index": 7168, "code_hash": null, "entity": [["tile_f", "sp", [-1, 1, 1, 1]], ["tile_y", "sp", [-1, 1, 1, 1]], ["tile_x", "sp", [-1, 7, 1, 1]], ["tile_rc", "sp", [-1, 1]], ["tile_ry", "sp", [-1, 1]], ["tile_rx", "sp", [-1, 1]], ["auto_unroll_max_step", "ot", 0], ["unroll_explicit", "ot", 0]]}, "result": [[0.004439040130434782, 0.004439663391304347, 0.0044398412173913045], 0, 1.2200393676757812, 1679302663.7642946], "version": 0.2, "tvm_version": "0.10.0"}
{"input": ["cuda -keys=cuda,gpu -arch=sm_86 -max_num_threads=1024 -thread_warp_size=32", "conv2d_nchw.cuda", [["TENSOR", [1, 96, 35, 35], "float32"], ["TENSOR", [96, 96, 3, 3], "float32"], [1, 1], [1, 1, 1, 1], [1, 1], "float32"], {}], "config": {"index": 448, "code_hash": null, "entity": [["tile_f", "sp", [-1, 1, 1, 1]], ["tile_y", "sp", [-1, 7, 1, 1]], ["tile_x", "sp", [-1, 1, 1, 1]], ["tile_rc", "sp", [-1, 1]], ["tile_ry", "sp", [-1, 1]], ["tile_rx", "sp", [-1, 1]], ["auto_unroll_max_step", "ot", 0], ["unroll_explicit", "ot", 0]]}, "result": [[0.0044526191304347824, 0.004453730695652174, 0.004454667130434783], 0, 1.2421553134918213, 1679302664.6060152], "version": 0.2, "tvm_version": "0.10.0"}
{"input": ["cuda -keys=cuda,gpu -arch=sm_86 -max_num_threads=1024 -thread_warp_size=32", "conv2d_nchw.cuda", [["TENSOR", [1, 96, 35, 35], "float32"], ["TENSOR", [96, 96, 3, 3], "float32"], [1, 1], [1, 1, 1, 1], [1, 1], "float32"], {}], "config": {"index": 2, "code_hash": null, "entity": [["tile_f", "sp", [-1, 3, 1, 1]], ["tile_y", "sp", [-1, 1, 1, 1]], ["tile_x", "sp", [-1, 1, 1, 1]], ["tile_rc", "sp", [-1, 1]], ["tile_ry", "sp", [-1, 1]], ["tile_rx", "sp", [-1, 1]], ["auto_unroll_max_step", "ot", 0], ["unroll_explicit", "ot", 0]]}, "result": [[0.00502712325, 0.00502717435, 0.00502753295], 0, 1.215641975402832, 1679302665.4339292], "version": 0.2, "tvm_version": "0.10.0"}
{"input": ["cuda -keys=cuda,gpu -arch=sm_86 -max_num_threads=1024 -thread_warp_size=32", "conv2d_nchw.cuda", [["TENSOR", [1, 96, 35, 35], "float32"], ["TENSOR", [96, 96, 3, 3], "float32"], [1, 1], [1, 1, 1, 1], [1, 1], "float32"], {}], "config": {"index": 172032, "code_hash": null, "entity": [["tile_f", "sp", [-1, 1, 1, 1]], ["tile_y", "sp", [-1, 1, 1, 1]], ["tile_x", "sp", [-1, 1, 1, 1]], ["tile_rc", "sp", [-1, 4]], ["tile_ry", "sp", [-1, 1]], ["tile_rx", "sp", [-1, 1]], ["auto_unroll_max_step", "ot", 0], ["unroll_explicit", "ot", 0]]}, "result": [[0.006745429466666667, 0.0067457026, 0.0067459752000000005], 0, 1.214442253112793, 1679302666.2621167], "version": 0.2, "tvm_version": "0.10.0"}
{"input": ["cuda -keys=cuda,gpu -arch=sm_86 -max_num_threads=1024 -thread_warp_size=32", "conv2d_nchw.cuda", [["TENSOR", [1, 96, 35, 35], "float32"], ["TENSOR", [96, 96, 3, 3], "float32"], [1, 1], [1, 1, 1, 1], [1, 1], "float32"], {}], "config": {"index": 10752, "code_hash": null, "entity": [["tile_f", "sp", [-1, 1, 1, 1]], ["tile_y", "sp", [-1, 1, 1, 1]], ["tile_x", "sp", [-1, 35, 1, 1]], ["tile_rc", "sp", [-1, 1]], ["tile_ry", "sp", [-1, 1]], ["tile_rx", "sp", [-1, 1]], ["auto_unroll_max_step", "ot", 0], ["unroll_explicit", "ot", 0]]}, "result": [[0.0033398255161290326, 0.003341047709677419, 0.0033415763548387094], 0, 1.2272822856903076, 1679302667.1065445], "version": 0.2, "tvm_version": "0.10.0"}
{"input": ["cuda -keys=cuda,gpu -arch=sm_86 -max_num_threads=1024 -thread_warp_size=32", "conv2d_nchw.cuda", [["TENSOR", [1, 96, 35, 35], "float32"], ["TENSOR", [96, 96, 3, 3], "float32"], [1, 1], [1, 1, 1, 1], [1, 1], "float32"], {}], "config": {"index": 672, "code_hash": null, "entity": [["tile_f", "sp", [-1, 1, 1, 1]], ["tile_y", "sp", [-1, 35, 1, 1]], ["tile_x", "sp", [-1, 1, 1, 1]], ["tile_rc", "sp", [-1, 1]], ["tile_ry", "sp", [-1, 1]], ["tile_rx", "sp", [-1, 1]], ["auto_unroll_max_step", "ot", 0], ["unroll_explicit", "ot", 0]]}, "result": [[0.00401469448, 0.00401748104, 0.00402100216], 0, 1.2262117862701416, 1679302667.9483037], "version": 0.2, "tvm_version": "0.10.0"}
{"input": ["cuda -keys=cuda,gpu -arch=sm_86 -max_num_threads=1024 -thread_warp_size=32", "conv2d_nchw.cuda", [["TENSOR", [1, 96, 35, 35], "float32"], ["TENSOR", [96, 96, 3, 3], "float32"], [1, 1], [1, 1, 1, 1], [1, 1], "float32"], {}], "config": {"index": 8268288, "code_hash": null, "entity": [["tile_f", "sp", [-1, 1, 1, 1]], ["tile_y", "sp", [-1, 1, 1, 1]], ["tile_x", "sp", [-1, 35, 1, 1]], ["tile_rc", "sp", [-1, 1]], ["tile_ry", "sp", [-1, 1]], ["tile_rx", "sp", [-1, 1]], ["auto_unroll_max_step", "ot", 0], ["unroll_explicit", "ot", 1]]}, "result": [[0.003341532023809524, 0.003342823571428572, 0.0033440428095238093], 0, 1.4821362495422363, 1679302671.2116094], "version": 0.2, "tvm_version": "0.10.0"}
{"input": ["cuda -keys=cuda,gpu -arch=sm_86 -max_num_threads=1024 -thread_warp_size=32", "conv2d_nchw.cuda", [["TENSOR", [1, 96, 35, 35], "float32"], ["TENSOR", [96, 96, 3, 3], "float32"], [1, 1], [1, 1, 1, 1], [1, 1], "float32"], {}], "config": {"index": 2763264, "code_hash": null, "entity": [["tile_f", "sp", [-1, 1, 1, 1]], ["tile_y", "sp", [-1, 1, 1, 1]], ["tile_x", "sp", [-1, 35, 1, 1]], ["tile_rc", "sp", [-1, 1]], ["tile_ry", "sp", [-1, 1]], ["tile_rx", "sp", [-1, 1]], ["auto_unroll_max_step", "ot", 512], ["unroll_explicit", "ot", 0]]}, "result": [[0.002784995583333333, 0.002785961777777778, 0.0027902861666666665], 0, 1.3379991054534912, 1679302672.043641], "version": 0.2, "tvm_version": "0.10.0"}
{"input": ["cuda -keys=cuda,gpu -arch=sm_86 -max_num_threads=1024 -thread_warp_size=32", "conv2d_nchw.cuda", [["TENSOR", [1, 96, 35, 35], "float32"], ["TENSOR", [96, 96, 3, 3], "float32"], [1, 1], [1, 1, 1, 1], [1, 1], "float32"], {}], "config": {"index": 1387008, "code_hash": null, "entity": [["tile_f", "sp", [-1, 1, 1, 1]], ["tile_y", "sp", [-1, 1, 1, 1]], ["tile_x", "sp", [-1, 35, 1, 1]], ["tile_rc", "sp", [-1, 1]], ["tile_ry", "sp", [-1, 1]], ["tile_rx", "sp", [-1, 3]], ["auto_unroll_max_step", "ot", 0], ["unroll_explicit", "ot", 0]]}, "result": [[0.0009748914303030304, 0.0009754251151515152, 0.0009756361515151515], 0, 1.643557071685791, 1679302673.2650774], "version": 0.2, "tvm_version": "0.10.0"}
{"input": ["cuda -keys=cuda,gpu -arch=sm_86 -max_num_threads=1024 -thread_warp_size=32", "conv2d_nchw.cuda", [["TENSOR", [1, 96, 35, 35], "float32"], ["TENSOR", [96, 96, 3, 3], "float32"], [1, 1], [1, 1, 1, 1], [1, 1], "float32"], {}], "config": {"index": 698880, "code_hash": null, "entity": [["tile_f", "sp", [-1, 1, 1, 1]], ["tile_y", "sp", [-1, 1, 1, 1]], ["tile_x", "sp", [-1, 35, 1, 1]], ["tile_rc", "sp", [-1, 1]], ["tile_ry", "sp", [-1, 3]], ["tile_rx", "sp", [-1, 1]], ["auto_unroll_max_step", "ot", 0], ["unroll_explicit", "ot", 0]]}, "result": [[0.007478491642857142, 0.007479881285714286, 0.007480836571428571], 0, 1.2750401496887207, 1679302674.1248205], "version": 0.2, "tvm_version": "0.10.0"}
{"input": ["cuda -keys=cuda,gpu -arch=sm_86 -max_num_threads=1024 -thread_warp_size=32", "conv2d_nchw.cuda", [["TENSOR", [1, 96, 35, 35], "float32"], ["TENSOR", [96, 96, 3, 3], "float32"], [1, 1], [1, 1, 1, 1], [1, 1], "float32"], {}], "config": {"index": 68096, "code_hash": null, "entity": [["tile_f", "sp", [-1, 1, 1, 1]], ["tile_y", "sp", [-1, 1, 1, 1]], ["tile_x", "sp", [-1, 35, 1, 1]], ["tile_rc", "sp", [-1, 2]], ["tile_ry", "sp", [-1, 1]], ["tile_rx", "sp", [-1, 1]], ["auto_unroll_max_step", "ot", 0], ["unroll_explicit", "ot", 0]]}, "result": [[0.0037649445555555557, 0.003765665111111111, 0.003775601703703704], 0, 1.4072484970092773, 1679302674.9587476], "version": 0.2, "tvm_version": "0.10.0"}
{"input": ["cuda -keys=cuda,gpu -arch=sm_86 -max_num_threads=1024 -thread_warp_size=32", "conv2d_nchw.cuda", [["TENSOR", [1, 96, 35, 35], "float32"], ["TENSOR", [96, 96, 3, 3], "float32"], [1, 1], [1, 1, 1, 1], [1, 1], "float32"], {}], "config": {"index": 14336, "code_hash": null, "entity": [["tile_f", "sp", [-1, 1, 1, 1]], ["tile_y", "sp", [-1, 1, 1, 1]], ["tile_x", "sp", [-1, 1, 5, 1]], ["tile_rc", "sp", [-1, 1]], ["tile_ry", "sp", [-1, 1]], ["tile_rx", "sp", [-1, 1]], ["auto_unroll_max_step", "ot", 0], ["unroll_explicit", "ot", 0]]}, "result": [[0.0023891138333333333, 0.0023893577857142857, 0.0023894994761904757], 0, 1.1917531490325928, 1679302675.7634249], "version": 0.2, "tvm_version": "0.10.0"}
{"input": ["cuda -keys=cuda,gpu -arch=sm_86 -max_num_threads=1024 -thread_warp_size=32", "conv2d_nchw.cuda", [["TENSOR", [1, 96, 35, 35], "float32"], ["TENSOR", [96, 96, 3, 3], "float32"], [1, 1], [1, 1, 1, 1], [1, 1], "float32"], {}], "config": {"index": 10976, "code_hash": null, "entity": [["tile_f", "sp", [-1, 1, 1, 1]], ["tile_y", "sp", [-1, 5, 1, 1]], ["tile_x", "sp", [-1, 35, 1, 1]], ["tile_rc", "sp", [-1, 1]], ["tile_ry", "sp", [-1, 1]], ["tile_rx", "sp", [-1, 1]], ["auto_unroll_max_step", "ot", 0], ["unroll_explicit", "ot", 0]]}, "result": [[0.017240234333333333, 0.017240367833333332, 0.0172416], 0, 1.467810869216919, 1679302676.6605606], "version": 0.2, "tvm_version": "0.10.0"}
{"input": ["cuda -keys=cuda,gpu -arch=sm_86 -max_num_threads=1024 -thread_warp_size=32", "conv2d_nchw.cuda", [["TENSOR", [1, 96, 35, 35], "float32"], ["TENSOR", [96, 96, 3, 3], "float32"], [1, 1], [1, 1, 1, 1], [1, 1], "float32"], {}], "config": {"index": 10753, "code_hash": null, "entity": [["tile_f", "sp", [-1, 2, 1, 1]], ["tile_y", "sp", [-1, 1, 1, 1]], ["tile_x", "sp", [-1, 35, 1, 1]], ["tile_rc", "sp", [-1, 1]], ["tile_ry", "sp", [-1, 1]], ["tile_rx", "sp", [-1, 1]], ["auto_unroll_max_step", "ot", 0], ["unroll_explicit", "ot", 0]]}, "result": [[0.002274804666666667, 0.002276465844444444, 0.0022786048], 0, 1.2605690956115723, 1679302677.4977612], "version": 0.2, "tvm_version": "0.10.0"}
{"input": ["cuda -keys=cuda,gpu -arch=sm_86 -max_num_threads=1024 -thread_warp_size=32", "conv2d_nchw.cuda", [["TENSOR", [1, 96, 35, 35], "float32"], ["TENSOR", [96, 96, 3, 3], "float32"], [1, 1], [1, 1, 1, 1], [1, 1], "float32"], {}], "config": {"index": 240128, "code_hash": null, "entity": [["tile_f", "sp", [-1, 1, 1, 1]], ["tile_y", "sp", [-1, 1, 1, 1]], ["tile_x", "sp", [-1, 35, 1, 1]], ["tile_rc", "sp", [-1, 6]], ["tile_ry", "sp", [-1, 1]], ["tile_rx", "sp", [-1, 1]], ["auto_unroll_max_step", "ot", 0], ["unroll_explicit", "ot", 0]]}, "result": [[0.0038162584444444447, 0.0038170168518518515, 0.003822206814814815], 0, 2.898200750350952, 1679302678.3410144], "version": 0.2, "tvm_version": "0.10.0"}
{"input": ["cuda -keys=cuda,gpu -arch=sm_86 -max_num_threads=1024 -thread_warp_size=32", "conv2d_nchw.cuda", [["TENSOR", [1, 96, 35, 35], "float32"], ["TENSOR", [96, 96, 3, 3], "float32"], [1, 1], [1, 1, 1, 1], [1, 1], "float32"], {}], "config": {"index": 25088, "code_hash": null, "entity": [["tile_f", "sp", [-1, 1, 1, 1]], ["tile_y", "sp", [-1, 1, 1, 1]], ["tile_x", "sp", [-1, 5, 7, 1]], ["tile_rc", "sp", [-1, 1]], ["tile_ry", "sp", [-1, 1]], ["tile_rx", "sp", [-1, 1]], ["auto_unroll_max_step", "ot", 0], ["unroll_explicit", "ot", 0]]}, "result": [[0.0010261734081632654, 0.0010262863775510206, 0.0010263091836734694], 0, 1.2639939785003662, 1679302679.2005727], "version": 0.2, "tvm_version": "0.10.0"}
{"input": ["cuda -keys=cuda,gpu -arch=sm_86 -max_num_threads=1024 -thread_warp_size=32", "conv2d_nchw.cuda", [["TENSOR", [1, 96, 35, 35], "float32"], ["TENSOR", [96, 96, 3, 3], "float32"], [1, 1], [1, 1, 1, 1], [1, 1], "float32"], {}], "config": {"index": 11648, "code_hash": null, "entity": [["tile_f", "sp", [-1, 1, 1, 1]], ["tile_y", "sp", [-1, 1, 5, 1]], ["tile_x", "sp", [-1, 35, 1, 1]], ["tile_rc", "sp", [-1, 1]], ["tile_ry", "sp", [-1, 1]], ["tile_rx", "sp", [-1, 1]], ["auto_unroll_max_step", "ot", 0], ["unroll_explicit", "ot", 0]]}, "result": [[0.0012861805384615384, 0.0012862112564102563, 0.001286274435897436], 0, 1.2283148765563965, 1679302680.0213528], "version": 0.2, "tvm_version": "0.10.0"}
{"input": ["cuda -keys=cuda,gpu -arch=sm_86 -max_num_threads=1024 -thread_warp_size=32", "conv2d_nchw.cuda", [["TENSOR", [1, 96, 35, 35], "float32"], ["TENSOR", [96, 96, 3, 3], "float32"], [1, 1], [1, 1, 1, 1], [1, 1], "float32"], {}], "config": {"index": 10756, "code_hash": null, "entity": [["tile_f", "sp", [-1, 6, 1, 1]], ["tile_y", "sp", [-1, 1, 1, 1]], ["tile_x", "sp", [-1, 35, 1, 1]], ["tile_rc", "sp", [-1, 1]], ["tile_ry", "sp", [-1, 1]], ["tile_rx", "sp", [-1, 1]], ["auto_unroll_max_step", "ot", 0], ["unroll_explicit", "ot", 0]]}, "result": [[0.0010422399791666667, 0.0010422486458333334, 0.0010423359791666667], 0, 1.347292184829712, 1679302680.8386483], "version": 0.2, "tvm_version": "0.10.0"}
{"input": ["cuda -keys=cuda,gpu -arch=sm_86 -max_num_threads=1024 -thread_warp_size=32", "conv2d_nchw.cuda", [["TENSOR", [1, 96, 35, 35], "float32"], ["TENSOR", [96, 96, 3, 3], "float32"], [1, 1], [1, 1, 1, 1], [1, 1], "float32"], {}], "config": {"index": 5515776, "code_hash": null, "entity": [["tile_f", "sp", [-1, 1, 1, 1]], ["tile_y", "sp", [-1, 1, 1, 1]], ["tile_x", "sp", [-1, 35, 1, 1]], ["tile_rc", "sp", [-1, 1]], ["tile_ry", "sp", [-1, 1]], ["tile_rx", "sp", [-1, 1]], ["auto_unroll_max_step", "ot", 1500], ["unroll_explicit", "ot", 0]]}, "result": [[0.0027853334166666665, 0.0027853955, 0.002792049805555556], 0, 1.4879884719848633, 1679302681.6654813], "version": 0.2, "tvm_version": "0.10.0"}
{"input": ["cuda -keys=cuda,gpu -arch=sm_86 -max_num_threads=1024 -thread_warp_size=32", "conv2d_nchw.cuda", [["TENSOR", [1, 96, 35, 35], "float32"], ["TENSOR", [96, 96, 3, 3], "float32"], [1, 1], [1, 1, 1, 1], [1, 1], "float32"], {}], "config": {"index": 297472, "code_hash": null, "entity": [["tile_f", "sp", [-1, 1, 1, 1]], ["tile_y", "sp", [-1, 1, 1, 1]], ["tile_x", "sp", [-1, 35, 1, 1]], ["tile_rc", "sp", [-1, 8]], ["tile_ry", "sp", [-1, 1]], ["tile_rx", "sp", [-1, 1]], ["auto_unroll_max_step", "ot", 0], ["unroll_explicit", "ot", 0]]}, "result": [[0.003717081962962963, 0.003718334441860465, 0.003720239674418605], 0, 2.3494741916656494, 1679302682.7612598], "version": 0.2, "tvm_version": "0.10.0"}
{"input": ["cuda -keys=cuda,gpu -arch=sm_86 -max_num_threads=1024 -thread_warp_size=32", "conv2d_nchw.cuda", [["TENSOR", [1, 96, 35, 35], "float32"], ["TENSOR", [96, 96, 3, 3], "float32"], [1, 1], [1, 1, 1, 1], [1, 1], "float32"], {}], "config": {"index": 28672, "code_hash": null, "entity": [["tile_f", "sp", [-1, 1, 1, 1]], ["tile_y", "sp", [-1, 1, 1, 1]], ["tile_x", "sp", [-1, 1, 35, 1]], ["tile_rc", "sp", [-1, 1]], ["tile_ry", "sp", [-1, 1]], ["tile_rx", "sp", [-1, 1]], ["auto_unroll_max_step", "ot", 0], ["unroll_explicit", "ot", 0]]}, "result": [[0.0006146324478527608, 0.0006146510736196319, 0.000614657582822086], 0, 1.1907217502593994, 1679302683.579679], "version": 0.2, "tvm_version": "0.10.0"}
{"input": ["cuda -keys=cuda,gpu -arch=sm_86 -max_num_threads=1024 -thread_warp_size=32", "conv2d_nchw.cuda", [["TENSOR", [1, 96, 35, 35], "float32"], ["TENSOR", [96, 96, 3, 3], "float32"], [1, 1], [1, 1, 1, 1], [1, 1], "float32"], {}], "config": {"index": 11872, "code_hash": null, "entity": [["tile_f", "sp", [-1, 1, 1, 1]], ["tile_y", "sp", [-1, 7, 5, 1]], ["tile_x", "sp", [-1, 35, 1, 1]], ["tile_rc", "sp", [-1, 1]], ["tile_ry", "sp", [-1, 1]], ["tile_rx", "sp", [-1, 1]], ["auto_unroll_max_step", "ot", 0], ["unroll_explicit", "ot", 0]]}, "result": [[0.015427875999999998, 0.015428740285714285, 0.015430916857142858], 0, 1.6236886978149414, 1679302684.4965153], "version": 0.2, "tvm_version": "0.10.0"}
{"input": ["cuda -keys=cuda,gpu -arch=sm_86 -max_num_threads=1024 -thread_warp_size=32", "conv2d_nchw.cuda", [["TENSOR", [1, 96, 35, 35], "float32"], ["TENSOR", [96, 96, 3, 3], "float32"], [1, 1], [1, 1, 1, 1], [1, 1], "float32"], {}], "config": {"index": 8286208, "code_hash": null, "entity": [["tile_f", "sp", [-1, 1, 1, 1]], ["tile_y", "sp", [-1, 1, 1, 1]], ["tile_x", "sp", [-1, 1, 35, 1]], ["tile_rc", "sp", [-1, 1]], ["tile_ry", "sp", [-1, 1]], ["tile_rx", "sp", [-1, 1]], ["auto_unroll_max_step", "ot", 0], ["unroll_explicit", "ot", 1]]}, "result": [[0.000614588073619632, 0.0006145884478527606, 0.0006146687668711656], 0, 1.1724400520324707, 1679302685.871416], "version": 0.2, "tvm_version": "0.10.0"}
{"input": ["cuda -keys=cuda,gpu -arch=sm_86 -max_num_threads=1024 -thread_warp_size=32", "conv2d_nchw.cuda", [["TENSOR", [1, 96, 35, 35], "float32"], ["TENSOR", [96, 96, 3, 3], "float32"], [1, 1], [1, 1, 1, 1], [1, 1], "float32"], {}], "config": {"index": 2781184, "code_hash": null, "entity": [["tile_f", "sp", [-1, 1, 1, 1]], ["tile_y", "sp", [-1, 1, 1, 1]], ["tile_x", "sp", [-1, 1, 35, 1]], ["tile_rc", "sp", [-1, 1]], ["tile_ry", "sp", [-1, 1]], ["tile_rx", "sp", [-1, 1]], ["auto_unroll_max_step", "ot", 512], ["unroll_explicit", "ot", 0]]}, "result": [[0.0006144879570552147, 0.0006145440736196318, 0.0006145759018404908], 0, 1.1990962028503418, 1679302686.697304], "version": 0.2, "tvm_version": "0.10.0"}
{"input": ["cuda -keys=cuda,gpu -arch=sm_86 -max_num_threads=1024 -thread_warp_size=32", "conv2d_nchw.cuda", [["TENSOR", [1, 96, 35, 35], "float32"], ["TENSOR", [96, 96, 3, 3], "float32"], [1, 1], [1, 1, 1, 1], [1, 1], "float32"], {}], "config": {"index": 1404928, "code_hash": null, "entity": [["tile_f", "sp", [-1, 1, 1, 1]], ["tile_y", "sp", [-1, 1, 1, 1]], ["tile_x", "sp", [-1, 1, 35, 1]], ["tile_rc", "sp", [-1, 1]], ["tile_ry", "sp", [-1, 1]], ["tile_rx", "sp", [-1, 3]], ["auto_unroll_max_step", "ot", 0], ["unroll_explicit", "ot", 0]]}, "result": [[0.0003159371827111984, 0.00031701519253438115, 0.0003174154872298625], 0, 1.5841515064239502, 1679302687.9143791], "version": 0.2, "tvm_version": "0.10.0"}
{"input": ["cuda -keys=cuda,gpu -arch=sm_86 -max_num_threads=1024 -thread_warp_size=32", "conv2d_nchw.cuda", [["TENSOR", [1, 96, 35, 35], "float32"], ["TENSOR", [96, 96, 3, 3], "float32"], [1, 1], [1, 1, 1, 1], [1, 1], "float32"], {}], "config": {"index": 716800, "code_hash": null, "entity": [["tile_f", "sp", [-1, 1, 1, 1]], ["tile_y", "sp", [-1, 1, 1, 1]], ["tile_x", "sp", [-1, 1, 35, 1]], ["tile_rc", "sp", [-1, 1]], ["tile_ry", "sp", [-1, 3]], ["tile_rx", "sp", [-1, 1]], ["auto_unroll_max_step", "ot", 0], ["unroll_explicit", "ot", 0]]}, "result": [[0.0003768894158878505, 0.00037716171962616827, 0.000377171738317757], 0, 1.628607988357544, 1679302689.1694205], "version": 0.2, "tvm_version": "0.10.0"}
{"input": ["cuda -keys=cuda,gpu -arch=sm_86 -max_num_threads=1024 -thread_warp_size=32", "conv2d_nchw.cuda", [["TENSOR", [1, 96, 35, 35], "float32"], ["TENSOR", [96, 96, 3, 3], "float32"], [1, 1], [1, 1, 1, 1], [1, 1], "float32"], {}], "config": {"index": 86016, "code_hash": null, "entity": [["tile_f", "sp", [-1, 1, 1, 1]], ["tile_y", "sp", [-1, 1, 1, 1]], ["tile_x", "sp", [-1, 1, 35, 1]], ["tile_rc", "sp", [-1, 2]], ["tile_ry", "sp", [-1, 1]], ["tile_rx", "sp", [-1, 1]], ["auto_unroll_max_step", "ot", 0], ["unroll_explicit", "ot", 0]]}, "result": [[0.0004614460951008645, 0.00046153773487031703, 0.0004615820172910663], 0, 1.607435941696167, 1679302690.3906255], "version": 0.2, "tvm_version": "0.10.0"}
{"input": ["cuda -keys=cuda,gpu -arch=sm_86 -max_num_threads=1024 -thread_warp_size=32", "conv2d_nchw.cuda", [["TENSOR", [1, 96, 35, 35], "float32"], ["TENSOR", [96, 96, 3, 3], "float32"], [1, 1], [1, 1, 1, 1], [1, 1], "float32"], {}], "config": {"index": 32256, "code_hash": null, "entity": [["tile_f", "sp", [-1, 1, 1, 1]], ["tile_y", "sp", [-1, 1, 1, 1]], ["tile_x", "sp", [-1, 1, 1, 5]], ["tile_rc", "sp", [-1, 1]], ["tile_ry", "sp", [-1, 1]], ["tile_rx", "sp", [-1, 1]], ["auto_unroll_max_step", "ot", 0], ["unroll_explicit", "ot", 0]]}, "result": [[0.004758340060606062, 0.004759210757575757, 0.0047606362727272734], 0, 1.5280036926269531, 1679302691.5490334], "version": 0.2, "tvm_version": "0.10.0"}
{"input": ["cuda -keys=cuda,gpu -arch=sm_86 -max_num_threads=1024 -thread_warp_size=32", "conv2d_nchw.cuda", [["TENSOR", [1, 96, 35, 35], "float32"], ["TENSOR", [96, 96, 3, 3], "float32"], [1, 1], [1, 1, 1, 1], [1, 1], "float32"], {}], "config": {"index": 28896, "code_hash": null, "entity": [["tile_f", "sp", [-1, 1, 1, 1]], ["tile_y", "sp", [-1, 5, 1, 1]], ["tile_x", "sp", [-1, 1, 35, 1]], ["tile_rc", "sp", [-1, 1]], ["tile_ry", "sp", [-1, 1]], ["tile_rx", "sp", [-1, 1]], ["auto_unroll_max_step", "ot", 0], ["unroll_explicit", "ot", 0]]}, "result": [[0.0003424735191489362, 0.00034364364255319146, 0.00034378730212765955], 0, 1.6012225151062012, 1679302692.776321], "version": 0.2, "tvm_version": "0.10.0"}
{"input": ["cuda -keys=cuda,gpu -arch=sm_86 -max_num_threads=1024 -thread_warp_size=32", "conv2d_nchw.cuda", [["TENSOR", [1, 96, 35, 35], "float32"], ["TENSOR", [96, 96, 3, 3], "float32"], [1, 1], [1, 1, 1, 1], [1, 1], "float32"], {}], "config": {"index": 28673, "code_hash": null, "entity": [["tile_f", "sp", [-1, 2, 1, 1]], ["tile_y", "sp", [-1, 1, 1, 1]], ["tile_x", "sp", [-1, 1, 35, 1]], ["tile_rc", "sp", [-1, 1]], ["tile_ry", "sp", [-1, 1]], ["tile_rx", "sp", [-1, 1]], ["auto_unroll_max_step", "ot", 0], ["unroll_explicit", "ot", 0]]}, "result": [[0.00035752195768374163, 0.000357578846325167, 0.00035760134298440984], 0, 1.5875649452209473, 1679302693.9898398], "version": 0.2, "tvm_version": "0.10.0"}
{"input": ["cuda -keys=cuda,gpu -arch=sm_86 -max_num_threads=1024 -thread_warp_size=32", "conv2d_nchw.cuda", [["TENSOR", [1, 96, 35, 35], "float32"], ["TENSOR", [96, 96, 3, 3], "float32"], [1, 1], [1, 1, 1, 1], [1, 1], "float32"], {}], "config": {"index": 372736, "code_hash": null, "entity": [["tile_f", "sp", [-1, 1, 1, 1]], ["tile_y", "sp", [-1, 1, 1, 1]], ["tile_x", "sp", [-1, 1, 35, 1]], ["tile_rc", "sp", [-1, 12]], ["tile_ry", "sp", [-1, 1]], ["tile_rx", "sp", [-1, 1]], ["auto_unroll_max_step", "ot", 0], ["unroll_explicit", "ot", 0]]}, "result": [[0.00037167022545454544, 0.00037518218909090906, 0.0003757856581818182], 0, 1.248640537261963, 1679302694.8251455], "version": 0.2, "tvm_version": "0.10.0"}
{"input": ["cuda -keys=cuda,gpu -arch=sm_86 -max_num_threads=1024 -thread_warp_size=32", "conv2d_nchw.cuda", [["TENSOR", [1, 96, 35, 35], "float32"], ["TENSOR", [96, 96, 3, 3], "float32"], [1, 1], [1, 1, 1, 1], [1, 1], "float32"], {}], "config": {"index": 50176, "code_hash": null, "entity": [["tile_f", "sp", [-1, 1, 1, 1]], ["tile_y", "sp", [-1, 1, 1, 1]], ["tile_x", "sp", [-1, 1, 5, 7]], ["tile_rc", "sp", [-1, 1]], ["tile_ry", "sp", [-1, 1]], ["tile_rx", "sp", [-1, 1]], ["auto_unroll_max_step", "ot", 0], ["unroll_explicit", "ot", 0]]}, "result": [[0.0011117909666666667, 0.0011118470888888889, 0.001111972977777778], 0, 1.1873705387115479, 1679302695.6294389], "version": 0.2, "tvm_version": "0.10.0"}
{"input": ["cuda -keys=cuda,gpu -arch=sm_86 -max_num_threads=1024 -thread_warp_size=32", "conv2d_nchw.cuda", [["TENSOR", [1, 96, 35, 35], "float32"], ["TENSOR", [96, 96, 3, 3], "float32"], [1, 1], [1, 1, 1, 1], [1, 1], "float32"], {}], "config": {"index": 30016, "code_hash": null, "entity": [["tile_f", "sp", [-1, 1, 1, 1]], ["tile_y", "sp", [-1, 1, 7, 1]], ["tile_x", "sp", [-1, 1, 35, 1]], ["tile_rc", "sp", [-1, 1]], ["tile_ry", "sp", [-1, 1]], ["tile_rx", "sp", [-1, 1]], ["auto_unroll_max_step", "ot", 0], ["unroll_explicit", "ot", 0]]}, "result": [[0.0003252511676767677, 0.0003252596444444445, 0.0003265687252525253], 0, 1.5802528858184814, 1679302696.8330276], "version": 0.2, "tvm_version": "0.10.0"}
{"input": ["cuda -keys=cuda,gpu -arch=sm_86 -max_num_threads=1024 -thread_warp_size=32", "conv2d_nchw.cuda", [["TENSOR", [1, 96, 35, 35], "float32"], ["TENSOR", [96, 96, 3, 3], "float32"], [1, 1], [1, 1, 1, 1], [1, 1], "float32"], {}], "config": {"index": 28678, "code_hash": null, "entity": [["tile_f", "sp", [-1, 12, 1, 1]], ["tile_y", "sp", [-1, 1, 1, 1]], ["tile_x", "sp", [-1, 1, 35, 1]], ["tile_rc", "sp", [-1, 1]], ["tile_ry", "sp", [-1, 1]], ["tile_rx", "sp", [-1, 1]], ["auto_unroll_max_step", "ot", 0], ["unroll_explicit", "ot", 0]]}, "result": [[9.061492510005717e-05, 9.082335677530019e-05, 9.083389594053745e-05], 0, 1.60683012008667, 1679302698.0539389], "version": 0.2, "tvm_version": "0.10.0"}
{"input": ["cuda -keys=cuda,gpu -arch=sm_86 -max_num_threads=1024 -thread_warp_size=32", "conv2d_nchw.cuda", [["TENSOR", [1, 96, 35, 35], "float32"], ["TENSOR", [96, 96, 3, 3], "float32"], [1, 1], [1, 1, 1, 1], [1, 1], "float32"], {}], "config": {"index": 430080, "code_hash": null, "entity": [["tile_f", "sp", [-1, 1, 1, 1]], ["tile_y", "sp", [-1, 1, 1, 1]], ["tile_x", "sp", [-1, 1, 35, 1]], ["tile_rc", "sp", [-1, 16]], ["tile_ry", "sp", [-1, 1]], ["tile_rx", "sp", [-1, 1]], ["auto_unroll_max_step", "ot", 0], ["unroll_explicit", "ot", 0]]}, "result": [[0.0006556745490196078, 0.0006566715555555555, 0.0006604732875816994], 0, 1.3208558559417725, 1679302698.9395676], "version": 0.2, "tvm_version": "0.10.0"}
{"input": ["cuda -keys=cuda,gpu -arch=sm_86 -max_num_threads=1024 -thread_warp_size=32", "conv2d_nchw.cuda", [["TENSOR", [1, 96, 35, 35], "float32"], ["TENSOR", [96, 96, 3, 3], "float32"], [1, 1], [1, 1, 1, 1], [1, 1], "float32"], {}], "config": {"index": 53760, "code_hash": null, "entity": [["tile_f", "sp", [-1, 1, 1, 1]], ["tile_y", "sp", [-1, 1, 1, 1]], ["tile_x", "sp", [-1, 1, 1, 35]], ["tile_rc", "sp", [-1, 1]], ["tile_ry", "sp", [-1, 1]], ["tile_rx", "sp", [-1, 1]], ["auto_unroll_max_step", "ot", 0], ["unroll_explicit", "ot", 0]]}, "result": [[0.0033405611666666667, 0.0033407231333333334, 0.003340834033333333], 0, 1.2422618865966797, 1679302699.79586], "version": 0.2, "tvm_version": "0.10.0"}
{"input": ["cuda -keys=cuda,gpu -arch=sm_86 -max_num_threads=1024 -thread_warp_size=32", "conv2d_nchw.cuda", [["TENSOR", [1, 96, 35, 35], "float32"], ["TENSOR", [96, 96, 3, 3], "float32"], [1, 1], [1, 1, 1, 1], [1, 1], "float32"], {}], "config": {"index": 30240, "code_hash": null, "entity": [["tile_f", "sp", [-1, 1, 1, 1]], ["tile_y", "sp", [-1, 5, 7, 1]], ["tile_x", "sp", [-1, 1, 35, 1]], ["tile_rc", "sp", [-1, 1]], ["tile_ry", "sp", [-1, 1]], ["tile_rx", "sp", [-1, 1]], ["auto_unroll_max_step", "ot", 0], ["unroll_explicit", "ot", 0]]}, "result": [[0.000278748006932409, 0.00027875160311958405, 0.00027875514731369157], 0, 1.619399070739746, 1679302701.0165753], "version": 0.2, "tvm_version": "0.10.0"}
{"input": ["cuda -keys=cuda,gpu -arch=sm_86 -max_num_threads=1024 -thread_warp_size=32", "conv2d_nchw.cuda", [["TENSOR", [1, 96, 35, 35], "float32"], ["TENSOR", [96, 96, 3, 3], "float32"], [1, 1], [1, 1, 1, 1], [1, 1], "float32"], {}], "config": {"index": 28679, "code_hash": null, "entity": [["tile_f", "sp", [-1, 16, 1, 1]], ["tile_y", "sp", [-1, 1, 1, 1]], ["tile_x", "sp", [-1, 1, 35, 1]], ["tile_rc", "sp", [-1, 1]], ["tile_ry", "sp", [-1, 1]], ["tile_rx", "sp", [-1, 1]], ["auto_unroll_max_step", "ot", 0], ["unroll_explicit", "ot", 0]]}, "result": [[8.961845045045045e-05, 8.962180123873874e-05, 8.989001576576576e-05], 0, 1.598701000213623, 1679302702.2265348], "version": 0.2, "tvm_version": "0.10.0"}
{"input": ["cuda -keys=cuda,gpu -arch=sm_86 -max_num_threads=1024 -thread_warp_size=32", "conv2d_nchw.cuda", [["TENSOR", [1, 96, 35, 35], "float32"], ["TENSOR", [96, 96, 3, 3], "float32"], [1, 1], [1, 1, 1, 1], [1, 1], "float32"], {}], "config": {"index": 8286215, "code_hash": null, "entity": [["tile_f", "sp", [-1, 16, 1, 1]], ["tile_y", "sp", [-1, 1, 1, 1]], ["tile_x", "sp", [-1, 1, 35, 1]], ["tile_rc", "sp", [-1, 1]], ["tile_ry", "sp", [-1, 1]], ["tile_rx", "sp", [-1, 1]], ["auto_unroll_max_step", "ot", 0], ["unroll_explicit", "ot", 1]]}, "result": [[8.961784065315315e-05, 8.961841610360361e-05, 8.961960191441441e-05], 0, 1.5535778999328613, 1679302704.1955018], "version": 0.2, "tvm_version": "0.10.0"}
{"input": ["cuda -keys=cuda,gpu -arch=sm_86 -max_num_threads=1024 -thread_warp_size=32", "conv2d_nchw.cuda", [["TENSOR", [1, 96, 35, 35], "float32"], ["TENSOR", [96, 96, 3, 3], "float32"], [1, 1], [1, 1, 1, 1], [1, 1], "float32"], {}], "config": {"index": 2781191, "code_hash": null, "entity": [["tile_f", "sp", [-1, 16, 1, 1]], ["tile_y", "sp", [-1, 1, 1, 1]], ["tile_x", "sp", [-1, 1, 35, 1]], ["tile_rc", "sp", [-1, 1]], ["tile_ry", "sp", [-1, 1]], ["tile_rx", "sp", [-1, 1]], ["auto_unroll_max_step", "ot", 512], ["unroll_explicit", "ot", 0]]}, "result": [[8.930518980963046e-05, 8.93053006718925e-05, 8.931332306830907e-05], 0, 1.6163411140441895, 1679302705.4190848], "version": 0.2, "tvm_version": "0.10.0"}
{"input": ["cuda -keys=cuda,gpu -arch=sm_86 -max_num_threads=1024 -thread_warp_size=32", "conv2d_nchw.cuda", [["TENSOR", [1, 96, 35, 35], "float32"], ["TENSOR", [96, 96, 3, 3], "float32"], [1, 1], [1, 1, 1, 1], [1, 1], "float32"], {}], "config": {"index": 1404935, "code_hash": null, "entity": [["tile_f", "sp", [-1, 16, 1, 1]], ["tile_y", "sp", [-1, 1, 1, 1]], ["tile_x", "sp", [-1, 1, 35, 1]], ["tile_rc", "sp", [-1, 1]], ["tile_ry", "sp", [-1, 1]], ["tile_rx", "sp", [-1, 3]], ["auto_unroll_max_step", "ot", 0], ["unroll_explicit", "ot", 0]]}, "result": [[0.00014238638014311272, 0.00014238729427549194, 0.00014238980500894455], 0, 1.6154868602752686, 1679302706.6431563], "version": 0.2, "tvm_version": "0.10.0"}
{"input": ["cuda -keys=cuda,gpu -arch=sm_86 -max_num_threads=1024 -thread_warp_size=32", "conv2d_nchw.cuda", [["TENSOR", [1, 96, 35, 35], "float32"], ["TENSOR", [96, 96, 3, 3], "float32"], [1, 1], [1, 1, 1, 1], [1, 1], "float32"], {}], "config": {"index": 716807, "code_hash": null, "entity": [["tile_f", "sp", [-1, 16, 1, 1]], ["tile_y", "sp", [-1, 1, 1, 1]], ["tile_x", "sp", [-1, 1, 35, 1]], ["tile_rc", "sp", [-1, 1]], ["tile_ry", "sp", [-1, 3]], ["tile_rx", "sp", [-1, 1]], ["auto_unroll_max_step", "ot", 0], ["unroll_explicit", "ot", 0]]}, "result": [[6.814347097053726e-05, 6.814968544194108e-05, 6.814968544194108e-05], 0, 1.6060223579406738, 1679302707.844448], "version": 0.2, "tvm_version": "0.10.0"}
{"input": ["cuda -keys=cuda,gpu -arch=sm_86 -max_num_threads=1024 -thread_warp_size=32", "conv2d_nchw.cuda", [["TENSOR", [1, 96, 35, 35], "float32"], ["TENSOR", [96, 96, 3, 3], "float32"], [1, 1], [1, 1, 1, 1], [1, 1], "float32"], {}], "config": {"index": 86023, "code_hash": null, "entity": [["tile_f", "sp", [-1, 16, 1, 1]], ["tile_y", "sp", [-1, 1, 1, 1]], ["tile_x", "sp", [-1, 1, 35, 1]], ["tile_rc", "sp", [-1, 2]], ["tile_ry", "sp", [-1, 1]], ["tile_rx", "sp", [-1, 1]], ["auto_unroll_max_step", "ot", 0], ["unroll_explicit", "ot", 0]]}, "result": [[9.933693146417445e-05, 9.933884236760124e-05, 9.934267414330219e-05], 0, 1.5892632007598877, 1679302709.0575929], "version": 0.2, "tvm_version": "0.10.0"}
{"input": ["cuda -keys=cuda,gpu -arch=sm_86 -max_num_threads=1024 -thread_warp_size=32", "conv2d_nchw.cuda", [["TENSOR", [1, 96, 35, 35], "float32"], ["TENSOR", [96, 96, 3, 3], "float32"], [1, 1], [1, 1, 1, 1], [1, 1], "float32"], {}], "config": {"index": 32263, "code_hash": null, "entity": [["tile_f", "sp", [-1, 16, 1, 1]], ["tile_y", "sp", [-1, 1, 1, 1]], ["tile_x", "sp", [-1, 1, 1, 5]], ["tile_rc", "sp", [-1, 1]], ["tile_ry", "sp", [-1, 1]], ["tile_rx", "sp", [-1, 1]], ["auto_unroll_max_step", "ot", 0], ["unroll_explicit", "ot", 0]]}, "result": [[0.000941840456140351, 0.0009418583918128655, 0.0009419179064327484], 0, 1.693207025527954, 1679302710.294872], "version": 0.2, "tvm_version": "0.10.0"}
{"input": ["cuda -keys=cuda,gpu -arch=sm_86 -max_num_threads=1024 -thread_warp_size=32", "conv2d_nchw.cuda", [["TENSOR", [1, 96, 35, 35], "float32"], ["TENSOR", [96, 96, 3, 3], "float32"], [1, 1], [1, 1, 1, 1], [1, 1], "float32"], {}], "config": {"index": 25095, "code_hash": null, "entity": [["tile_f", "sp", [-1, 16, 1, 1]], ["tile_y", "sp", [-1, 1, 1, 1]], ["tile_x", "sp", [-1, 5, 7, 1]], ["tile_rc", "sp", [-1, 1]], ["tile_ry", "sp", [-1, 1]], ["tile_rx", "sp", [-1, 1]], ["auto_unroll_max_step", "ot", 0], ["unroll_explicit", "ot", 0]]}, "result": [[0.00021246714795244385, 0.00021246714795244385, 0.00021247261030383092], 0, 1.6950364112854004, 1679302711.5257385], "version": 0.2, "tvm_version": "0.10.0"}
{"input": ["cuda -keys=cuda,gpu -arch=sm_86 -max_num_threads=1024 -thread_warp_size=32", "conv2d_nchw.cuda", [["TENSOR", [1, 96, 35, 35], "float32"], ["TENSOR", [96, 96, 3, 3], "float32"], [1, 1], [1, 1, 1, 1], [1, 1], "float32"], {}], "config": {"index": 28903, "code_hash": null, "entity": [["tile_f", "sp", [-1, 16, 1, 1]], ["tile_y", "sp", [-1, 5, 1, 1]], ["tile_x", "sp", [-1, 1, 35, 1]], ["tile_rc", "sp", [-1, 1]], ["tile_ry", "sp", [-1, 1]], ["tile_rx", "sp", [-1, 1]], ["auto_unroll_max_step", "ot", 0], ["unroll_explicit", "ot", 0]]}, "result": [[0.00015685851078431373, 0.00015685873529411767, 0.00015686074019607843], 0, 1.6914305686950684, 1679302712.7589889], "version": 0.2, "tvm_version": "0.10.0"}
{"input": ["cuda -keys=cuda,gpu -arch=sm_86 -max_num_threads=1024 -thread_warp_size=32", "conv2d_nchw.cuda", [["TENSOR", [1, 96, 35, 35], "float32"], ["TENSOR", [96, 96, 3, 3], "float32"], [1, 1], [1, 1, 1, 1], [1, 1], "float32"], {}], "config": {"index": 28680, "code_hash": null, "entity": [["tile_f", "sp", [-1, 24, 1, 1]], ["tile_y", "sp", [-1, 1, 1, 1]], ["tile_x", "sp", [-1, 1, 35, 1]], ["tile_rc", "sp", [-1, 1]], ["tile_ry", "sp", [-1, 1]], ["tile_rx", "sp", [-1, 1]], ["auto_unroll_max_step", "ot", 0], ["unroll_explicit", "ot", 0]]}, "result": [[8.685550054764513e-05, 8.685830832420593e-05, 8.686445837897043e-05], 0, 1.6016249656677246, 1679302713.971855], "version": 0.2, "tvm_version": "0.10.0"}
{"input": ["cuda -keys=cuda,gpu -arch=sm_86 -max_num_threads=1024 -thread_warp_size=32", "conv2d_nchw.cuda", [["TENSOR", [1, 96, 35, 35], "float32"], ["TENSOR", [96, 96, 3, 3], "float32"], [1, 1], [1, 1, 1, 1], [1, 1], "float32"], {}], "config": {"index": 5533703, "code_hash": null, "entity": [["tile_f", "sp", [-1, 16, 1, 1]], ["tile_y", "sp", [-1, 1, 1, 1]], ["tile_x", "sp", [-1, 1, 35, 1]], ["tile_rc", "sp", [-1, 1]], ["tile_ry", "sp", [-1, 1]], ["tile_rx", "sp", [-1, 1]], ["auto_unroll_max_step", "ot", 1500], ["unroll_explicit", "ot", 0]]}, "result": [[8.938205123873874e-05, 8.951870157657658e-05, 8.974068412162162e-05], 0, 1.604567527770996, 1679302715.180583], "version": 0.2, "tvm_version": "0.10.0"}
{"input": ["cuda -keys=cuda,gpu -arch=sm_86 -max_num_threads=1024 -thread_warp_size=32", "conv2d_nchw.cuda", [["TENSOR", [1, 96, 35, 35], "float32"], ["TENSOR", [96, 96, 3, 3], "float32"], [1, 1], [1, 1, 1, 1], [1, 1], "float32"], {}], "config": {"index": 487431, "code_hash": null, "entity": [["tile_f", "sp", [-1, 16, 1, 1]], ["tile_y", "sp", [-1, 1, 1, 1]], ["tile_x", "sp", [-1, 1, 35, 1]], ["tile_rc", "sp", [-1, 24]], ["tile_ry", "sp", [-1, 1]], ["tile_rx", "sp", [-1, 1]], ["auto_unroll_max_step", "ot", 0], ["unroll_explicit", "ot", 0]]}, "result": [[7.619531703775412e-05, 7.620819748305904e-05, 7.626262971926428e-05], 0, 1.852001428604126, 1679302716.4229603], "version": 0.2, "tvm_version": "0.10.0"}
{"input": ["cuda -keys=cuda,gpu -arch=sm_86 -max_num_threads=1024 -thread_warp_size=32", "conv2d_nchw.cuda", [["TENSOR", [1, 96, 35, 35], "float32"], ["TENSOR", [96, 96, 3, 3], "float32"], [1, 1], [1, 1, 1, 1], [1, 1], "float32"], {}], "config": {"index": 7, "code_hash": null, "entity": [["tile_f", "sp", [-1, 16, 1, 1]], ["tile_y", "sp", [-1, 1, 1, 1]], ["tile_x", "sp", [-1, 1, 1, 1]], ["tile_rc", "sp", [-1, 1]], ["tile_ry", "sp", [-1, 1]], ["tile_rx", "sp", [-1, 1]], ["auto_unroll_max_step", "ot", 0], ["unroll_explicit", "ot", 0]]}, "result": [[0.0028371910277777777, 0.0028373618611111113, 0.002837930666666667], 0, 1.2230327129364014, 1679302717.2623315], "version": 0.2, "tvm_version": "0.10.0"}
{"input": ["cuda -keys=cuda,gpu -arch=sm_86 -max_num_threads=1024 -thread_warp_size=32", "conv2d_nchw.cuda", [["TENSOR", [1, 96, 35, 35], "float32"], ["TENSOR", [96, 96, 3, 3], "float32"], [1, 1], [1, 1, 1, 1], [1, 1], "float32"], {}], "config": {"index": 28687, "code_hash": null, "entity": [["tile_f", "sp", [-1, 4, 2, 1]], ["tile_y", "sp", [-1, 1, 1, 1]], ["tile_x", "sp", [-1, 1, 35, 1]], ["tile_rc", "sp", [-1, 1]], ["tile_ry", "sp", [-1, 1]], ["tile_rx", "sp", [-1, 1]], ["auto_unroll_max_step", "ot", 0], ["unroll_explicit", "ot", 0]]}, "result": [[0.0002050589489144317, 0.00020507202426564496, 0.0002050756104725415], 0, 1.5866997241973877, 1679302718.4883716], "version": 0.2, "tvm_version": "0.10.0"}
{"input": ["cuda -keys=cuda,gpu -arch=sm_86 -max_num_threads=1024 -thread_warp_size=32", "conv2d_nchw.cuda", [["TENSOR", [1, 96, 35, 35], "float32"], ["TENSOR", [96, 96, 3, 3], "float32"], [1, 1], [1, 1, 1, 1], [1, 1], "float32"], {}], "config": {"index": 544775, "code_hash": null, "entity": [["tile_f", "sp", [-1, 16, 1, 1]], ["tile_y", "sp", [-1, 1, 1, 1]], ["tile_x", "sp", [-1, 1, 35, 1]], ["tile_rc", "sp", [-1, 32]], ["tile_ry", "sp", [-1, 1]], ["tile_rx", "sp", [-1, 1]], ["auto_unroll_max_step", "ot", 0], ["unroll_explicit", "ot", 0]]}, "result": [[0.00012497744392523364, 0.00012501014875389407, 0.0001250157219626168], 0, 1.8513844013214111, 1679302719.7043116], "version": 0.2, "tvm_version": "0.10.0"}
{"input": ["cuda -keys=cuda,gpu -arch=sm_86 -max_num_threads=1024 -thread_warp_size=32", "conv2d_nchw.cuda", [["TENSOR", [1, 96, 35, 35], "float32"], ["TENSOR", [96, 96, 3, 3], "float32"], [1, 1], [1, 1, 1, 1], [1, 1], "float32"], {}], "config": {"index": 3591, "code_hash": null, "entity": [["tile_f", "sp", [-1, 16, 1, 1]], ["tile_y", "sp", [-1, 1, 1, 1]], ["tile_x", "sp", [-1, 5, 1, 1]], ["tile_rc", "sp", [-1, 1]], ["tile_ry", "sp", [-1, 1]], ["tile_rx", "sp", [-1, 1]], ["auto_unroll_max_step", "ot", 0], ["unroll_explicit", "ot", 0]]}, "result": [[0.000946079396226415, 0.0009461349622641509, 0.0009463498773584905], 0, 1.2840380668640137, 1679302720.5260522], "version": 0.2, "tvm_version": "0.10.0"}
{"input": ["cuda -keys=cuda,gpu -arch=sm_86 -max_num_threads=1024 -thread_warp_size=32", "conv2d_nchw.cuda", [["TENSOR", [1, 96, 35, 35], "float32"], ["TENSOR", [96, 96, 3, 3], "float32"], [1, 1], [1, 1, 1, 1], [1, 1], "float32"], {}], "config": {"index": 30695, "code_hash": null, "entity": [["tile_f", "sp", [-1, 16, 1, 1]], ["tile_y", "sp", [-1, 1, 1, 5]], ["tile_x", "sp", [-1, 1, 35, 1]], ["tile_rc", "sp", [-1, 1]], ["tile_ry", "sp", [-1, 1]], ["tile_rx", "sp", [-1, 1]], ["auto_unroll_max_step", "ot", 0], ["unroll_explicit", "ot", 0]]}, "result": [[0.00015685873529411767, 0.00015686174215686274, 0.00015686259509803922], 0, 1.5547809600830078, 1679302722.7736106], "version": 0.2, "tvm_version": "0.10.0"}
{"input": ["cuda -keys=cuda,gpu -arch=sm_86 -max_num_threads=1024 -thread_warp_size=32", "conv2d_nchw.cuda", [["TENSOR", [1, 96, 35, 35], "float32"], ["TENSOR", [96, 96, 3, 3], "float32"], [1, 1], [1, 1, 1, 1], [1, 1], "float32"], {}], "config": {"index": 8974343, "code_hash": null, "entity": [["tile_f", "sp", [-1, 16, 1, 1]], ["tile_y", "sp", [-1, 1, 1, 1]], ["tile_x", "sp", [-1, 1, 35, 1]], ["tile_rc", "sp", [-1, 1]], ["tile_ry", "sp", [-1, 3]], ["tile_rx", "sp", [-1, 1]], ["auto_unroll_max_step", "ot", 0], ["unroll_explicit", "ot", 1]]}, "result": [[6.807155784946236e-05, 6.814246365591398e-05, 6.814378924731183e-05], 0, 1.5989892482757568, 1679302723.9829748], "version": 0.2, "tvm_version": "0.10.0"}
{"input": ["cuda -keys=cuda,gpu -arch=sm_86 -max_num_threads=1024 -thread_warp_size=32", "conv2d_nchw.cuda", [["TENSOR", [1, 96, 35, 35], "float32"], ["TENSOR", [96, 96, 3, 3], "float32"], [1, 1], [1, 1, 1, 1], [1, 1], "float32"], {}], "config": {"index": 3469319, "code_hash": null, "entity": [["tile_f", "sp", [-1, 16, 1, 1]], ["tile_y", "sp", [-1, 1, 1, 1]], ["tile_x", "sp", [-1, 1, 35, 1]], ["tile_rc", "sp", [-1, 1]], ["tile_ry", "sp", [-1, 3]], ["tile_rx", "sp", [-1, 1]], ["auto_unroll_max_step", "ot", 512], ["unroll_explicit", "ot", 0]]}, "result": [[6.472590901672787e-05, 6.473008649530804e-05, 6.473842880456957e-05], 0, 1.628157615661621, 1679302725.1885839], "version": 0.2, "tvm_version": "0.10.0"}
{"input": ["cuda -keys=cuda,gpu -arch=sm_86 -max_num_threads=1024 -thread_warp_size=32", "conv2d_nchw.cuda", [["TENSOR", [1, 96, 35, 35], "float32"], ["TENSOR", [96, 96, 3, 3], "float32"], [1, 1], [1, 1, 1, 1], [1, 1], "float32"], {}], "config": {"index": 2093063, "code_hash": null, "entity": [["tile_f", "sp", [-1, 16, 1, 1]], ["tile_y", "sp", [-1, 1, 1, 1]], ["tile_x", "sp", [-1, 1, 35, 1]], ["tile_rc", "sp", [-1, 1]], ["tile_ry", "sp", [-1, 3]], ["tile_rx", "sp", [-1, 3]], ["auto_unroll_max_step", "ot", 0], ["unroll_explicit", "ot", 0]]}, "result": [[8.357636133122028e-05, 8.357798151082937e-05, 8.35790618066561e-05], 0, 1.629072904586792, 1679302726.39171], "version": 0.2, "tvm_version": "0.10.0"}
{"input": ["cuda -keys=cuda,gpu -arch=sm_86 -max_num_threads=1024 -thread_warp_size=32", "conv2d_nchw.cuda", [["TENSOR", [1, 96, 35, 35], "float32"], ["TENSOR", [96, 96, 3, 3], "float32"], [1, 1], [1, 1, 1, 1], [1, 1], "float32"], {}], "config": {"index": 774151, "code_hash": null, "entity": [["tile_f", "sp", [-1, 16, 1, 1]], ["tile_y", "sp", [-1, 1, 1, 1]], ["tile_x", "sp", [-1, 1, 35, 1]], ["tile_rc", "sp", [-1, 2]], ["tile_ry", "sp", [-1, 3]], ["tile_rx", "sp", [-1, 1]], ["auto_unroll_max_step", "ot", 0], ["unroll_explicit", "ot", 0]]}, "result": [[7.456947147571899e-05, 7.457037812352664e-05, 7.4570471475719e-05], 0, 1.6605901718139648, 1679302727.6046414], "version": 0.2, "tvm_version": "0.10.0"}
{"input": ["cuda -keys=cuda,gpu -arch=sm_86 -max_num_threads=1024 -thread_warp_size=32", "conv2d_nchw.cuda", [["TENSOR", [1, 96, 35, 35], "float32"], ["TENSOR", [96, 96, 3, 3], "float32"], [1, 1], [1, 1, 1, 1], [1, 1], "float32"], {}], "config": {"index": 720391, "code_hash": null, "entity": [["tile_f", "sp", [-1, 16, 1, 1]], ["tile_y", "sp", [-1, 1, 1, 1]], ["tile_x", "sp", [-1, 1, 1, 5]], ["tile_rc", "sp", [-1, 1]], ["tile_ry", "sp", [-1, 3]], ["tile_rx", "sp", [-1, 1]], ["auto_unroll_max_step", "ot", 0], ["unroll_explicit", "ot", 0]]}, "result": [[0.0008465242842105264, 0.0008465246052631578, 0.000846546052631579], 0, 1.7655372619628906, 1679302728.8254318], "version": 0.2, "tvm_version": "0.10.0"}
{"input": ["cuda -keys=cuda,gpu -arch=sm_86 -max_num_threads=1024 -thread_warp_size=32", "conv2d_nchw.cuda", [["TENSOR", [1, 96, 35, 35], "float32"], ["TENSOR", [96, 96, 3, 3], "float32"], [1, 1], [1, 1, 1, 1], [1, 1], "float32"], {}], "config": {"index": 713223, "code_hash": null, "entity": [["tile_f", "sp", [-1, 16, 1, 1]], ["tile_y", "sp", [-1, 1, 1, 1]], ["tile_x", "sp", [-1, 5, 7, 1]], ["tile_rc", "sp", [-1, 1]], ["tile_ry", "sp", [-1, 3]], ["tile_rx", "sp", [-1, 1]], ["auto_unroll_max_step", "ot", 0], ["unroll_explicit", "ot", 0]]}, "result": [[0.0005136128849840255, 0.0005136258530351438, 0.0005136488626198083], 0, 1.6784307956695557, 1679302730.0422199], "version": 0.2, "tvm_version": "0.10.0"}
{"input": ["cuda -keys=cuda,gpu -arch=sm_86 -max_num_threads=1024 -thread_warp_size=32", "conv2d_nchw.cuda", [["TENSOR", [1, 96, 35, 35], "float32"], ["TENSOR", [96, 96, 3, 3], "float32"], [1, 1], [1, 1, 1, 1], [1, 1], "float32"], {}], "config": {"index": 717031, "code_hash": null, "entity": [["tile_f", "sp", [-1, 16, 1, 1]], ["tile_y", "sp", [-1, 5, 1, 1]], ["tile_x", "sp", [-1, 1, 35, 1]], ["tile_rc", "sp", [-1, 1]], ["tile_ry", "sp", [-1, 3]], ["tile_rx", "sp", [-1, 1]], ["auto_unroll_max_step", "ot", 0], ["unroll_explicit", "ot", 0]]}, "result": [[9.293699590163935e-05, 9.294658138173301e-05, 9.294716217798594e-05], 0, 1.7152690887451172, 1679302731.2510536], "version": 0.2, "tvm_version": "0.10.0"}
{"input": ["cuda -keys=cuda,gpu -arch=sm_86 -max_num_threads=1024 -thread_warp_size=32", "conv2d_nchw.cuda", [["TENSOR", [1, 96, 35, 35], "float32"], ["TENSOR", [96, 96, 3, 3], "float32"], [1, 1], [1, 1, 1, 1], [1, 1], "float32"], {}], "config": {"index": 716808, "code_hash": null, "entity": [["tile_f", "sp", [-1, 24, 1, 1]], ["tile_y", "sp", [-1, 1, 1, 1]], ["tile_x", "sp", [-1, 1, 35, 1]], ["tile_rc", "sp", [-1, 1]], ["tile_ry", "sp", [-1, 3]], ["tile_rx", "sp", [-1, 1]], ["auto_unroll_max_step", "ot", 0], ["unroll_explicit", "ot", 0]]}, "result": [[8.238315822454307e-05, 8.238788302872063e-05, 8.23899864229765e-05], 0, 1.6245310306549072, 1679302732.461498], "version": 0.2, "tvm_version": "0.10.0"}
{"input": ["cuda -keys=cuda,gpu -arch=sm_86 -max_num_threads=1024 -thread_warp_size=32", "conv2d_nchw.cuda", [["TENSOR", [1, 96, 35, 35], "float32"], ["TENSOR", [96, 96, 3, 3], "float32"], [1, 1], [1, 1, 1, 1], [1, 1], "float32"], {}], "config": {"index": 716806, "code_hash": null, "entity": [["tile_f", "sp", [-1, 12, 1, 1]], ["tile_y", "sp", [-1, 1, 1, 1]], ["tile_x", "sp", [-1, 1, 35, 1]], ["tile_rc", "sp", [-1, 1]], ["tile_ry", "sp", [-1, 3]], ["tile_rx", "sp", [-1, 1]], ["auto_unroll_max_step", "ot", 0], ["unroll_explicit", "ot", 0]]}, "result": [[6.610772268907563e-05, 6.611425546218486e-05, 6.611594159663866e-05], 0, 1.5964701175689697, 1679302733.6579807], "version": 0.2, "tvm_version": "0.10.0"}
{"input": ["cuda -keys=cuda,gpu -arch=sm_86 -max_num_threads=1024 -thread_warp_size=32", "conv2d_nchw.cuda", [["TENSOR", [1, 96, 35, 35], "float32"], ["TENSOR", [96, 96, 3, 3], "float32"], [1, 1], [1, 1, 1, 1], [1, 1], "float32"], {}], "config": {"index": 1290247, "code_hash": null, "entity": [["tile_f", "sp", [-1, 16, 1, 1]], ["tile_y", "sp", [-1, 1, 1, 1]], ["tile_x", "sp", [-1, 1, 35, 1]], ["tile_rc", "sp", [-1, 48]], ["tile_ry", "sp", [-1, 3]], ["tile_rx", "sp", [-1, 1]], ["auto_unroll_max_step", "ot", 0], ["unroll_explicit", "ot", 0]]}, "result": [[0.00023277300289855073, 0.00023282198695652172, 0.0002328308768115942], 0, 1.8270044326782227, 1679302734.8965034], "version": 0.2, "tvm_version": "0.10.0"}
{"input": ["cuda -keys=cuda,gpu -arch=sm_86 -max_num_threads=1024 -thread_warp_size=32", "conv2d_nchw.cuda", [["TENSOR", [1, 96, 35, 35], "float32"], ["TENSOR", [96, 96, 3, 3], "float32"], [1, 1], [1, 1, 1, 1], [1, 1], "float32"], {}], "config": {"index": 695303, "code_hash": null, "entity": [["tile_f", "sp", [-1, 16, 1, 1]], ["tile_y", "sp", [-1, 1, 1, 1]], ["tile_x", "sp", [-1, 7, 1, 1]], ["tile_rc", "sp", [-1, 1]], ["tile_ry", "sp", [-1, 3]], ["tile_rx", "sp", [-1, 1]], ["auto_unroll_max_step", "ot", 0], ["unroll_explicit", "ot", 0]]}, "result": [[0.0014009315694444445, 0.0014010026666666667, 0.001401727986111111], 0, 1.3621654510498047, 1679302735.742604], "version": 0.2, "tvm_version": "0.10.0"}
{"input": ["cuda -keys=cuda,gpu -arch=sm_86 -max_num_threads=1024 -thread_warp_size=32", "conv2d_nchw.cuda", [["TENSOR", [1, 96, 35, 35], "float32"], ["TENSOR", [96, 96, 3, 3], "float32"], [1, 1], [1, 1, 1, 1], [1, 1], "float32"], {}], "config": {"index": 719047, "code_hash": null, "entity": [["tile_f", "sp", [-1, 16, 1, 1]], ["tile_y", "sp", [-1, 7, 1, 5]], ["tile_x", "sp", [-1, 1, 35, 1]], ["tile_rc", "sp", [-1, 1]], ["tile_ry", "sp", [-1, 3]], ["tile_rx", "sp", [-1, 1]], ["auto_unroll_max_step", "ot", 0], ["unroll_explicit", "ot", 0]]}, "result": [[0.007205814857142856, 0.007205887928571428, 0.007205960928571428], 0, 1.7561163902282715, 1679302736.5684977], "version": 0.2, "tvm_version": "0.10.0"}
{"input": ["cuda -keys=cuda,gpu -arch=sm_86 -max_num_threads=1024 -thread_warp_size=32", "conv2d_nchw.cuda", [["TENSOR", [1, 96, 35, 35], "float32"], ["TENSOR", [96, 96, 3, 3], "float32"], [1, 1], [1, 1, 1, 1], [1, 1], "float32"], {}], "config": {"index": 716817, "code_hash": null, "entity": [["tile_f", "sp", [-1, 8, 2, 1]], ["tile_y", "sp", [-1, 1, 1, 1]], ["tile_x", "sp", [-1, 1, 35, 1]], ["tile_rc", "sp", [-1, 1]], ["tile_ry", "sp", [-1, 3]], ["tile_rx", "sp", [-1, 1]], ["auto_unroll_max_step", "ot", 0], ["unroll_explicit", "ot", 0]]}, "result": [[0.00013240524708818635, 0.00013241035024958404, 0.00013241886855241264], 0, 1.5963966846466064, 1679302737.787579], "version": 0.2, "tvm_version": "0.10.0"}
{"input": ["cuda -keys=cuda,gpu -arch=sm_86 -max_num_threads=1024 -thread_warp_size=32", "conv2d_nchw.cuda", [["TENSOR", [1, 96, 35, 35], "float32"], ["TENSOR", [96, 96, 3, 3], "float32"], [1, 1], [1, 1, 1, 1], [1, 1], "float32"], {}], "config": {"index": 6221831, "code_hash": null, "entity": [["tile_f", "sp", [-1, 16, 1, 1]], ["tile_y", "sp", [-1, 1, 1, 1]], ["tile_x", "sp", [-1, 1, 35, 1]], ["tile_rc", "sp", [-1, 1]], ["tile_ry", "sp", [-1, 3]], ["tile_rx", "sp", [-1, 1]], ["auto_unroll_max_step", "ot", 1500], ["unroll_explicit", "ot", 0]]}, "result": [[6.470376499388006e-05, 6.473677274581803e-05, 6.473708404732762e-05], 0, 1.647850513458252, 1679302739.0026731], "version": 0.2, "tvm_version": "0.10.0"}
{"input": ["cuda -keys=cuda,gpu -arch=sm_86 -max_num_threads=1024 -thread_warp_size=32", "conv2d_nchw.cuda", [["TENSOR", [1, 96, 35, 35], "float32"], ["TENSOR", [96, 96, 3, 3], "float32"], [1, 1], [1, 1, 1, 1], [1, 1], "float32"], {}], "config": {"index": 698887, "code_hash": null, "entity": [["tile_f", "sp", [-1, 16, 1, 1]], ["tile_y", "sp", [-1, 1, 1, 1]], ["tile_x", "sp", [-1, 35, 1, 1]], ["tile_rc", "sp", [-1, 1]], ["tile_ry", "sp", [-1, 3]], ["tile_rx", "sp", [-1, 1]], ["auto_unroll_max_step", "ot", 0], ["unroll_explicit", "ot", 0]]}, "result": [[0.047256830666666666, 0.047263041, 0.047265111], 0, 1.9551029205322266, 1679302741.386004], "version": 0.2, "tvm_version": "0.10.0"}
{"input": ["cuda -keys=cuda,gpu -arch=sm_86 -max_num_threads=1024 -thread_warp_size=32", "conv2d_nchw.cuda", [["TENSOR", [1, 96, 35, 35], "float32"], ["TENSOR", [96, 96, 3, 3], "float32"], [1, 1], [1, 1, 1, 1], [1, 1], "float32"], {}], "config": {"index": 719271, "code_hash": null, "entity": [["tile_f", "sp", [-1, 16, 1, 1]], ["tile_y", "sp", [-1, 1, 7, 5]], ["tile_x", "sp", [-1, 1, 35, 1]], ["tile_rc", "sp", [-1, 1]], ["tile_ry", "sp", [-1, 3]], ["tile_rx", "sp", [-1, 1]], ["auto_unroll_max_step", "ot", 0], ["unroll_explicit", "ot", 0]]}, "result": [[0.00033002806352459016, 0.0003300469487704918, 0.0003300490450819672], 0, 1.7703821659088135, 1679302742.6065073], "version": 0.2, "tvm_version": "0.10.0"}
{"input": ["cuda -keys=cuda,gpu -arch=sm_86 -max_num_threads=1024 -thread_warp_size=32", "conv2d_nchw.cuda", [["TENSOR", [1, 96, 35, 35], "float32"], ["TENSOR", [96, 96, 3, 3], "float32"], [1, 1], [1, 1, 1, 1], [1, 1], "float32"], {}], "config": {"index": 11726855, "code_hash": null, "entity": [["tile_f", "sp", [-1, 16, 1, 1]], ["tile_y", "sp", [-1, 1, 1, 1]], ["tile_x", "sp", [-1, 1, 35, 1]], ["tile_rc", "sp", [-1, 1]], ["tile_ry", "sp", [-1, 3]], ["tile_rx", "sp", [-1, 1]], ["auto_unroll_max_step", "ot", 512], ["unroll_explicit", "ot", 1]]}, "result": [[6.617931203007519e-05, 6.636195864661654e-05, 6.64847172096909e-05], 0, 1.7244229316711426, 1679302743.822249], "version": 0.2, "tvm_version": "0.10.0"}
{"input": ["cuda -keys=cuda,gpu -arch=sm_86 -max_num_threads=1024 -thread_warp_size=32", "conv2d_nchw.cuda", [["TENSOR", [1, 96, 35, 35], "float32"], ["TENSOR", [96, 96, 3, 3], "float32"], [1, 1], [1, 1, 1, 1], [1, 1], "float32"], {}], "config": {"index": 4845575, "code_hash": null, "entity": [["tile_f", "sp", [-1, 16, 1, 1]], ["tile_y", "sp", [-1, 1, 1, 1]], ["tile_x", "sp", [-1, 1, 35, 1]], ["tile_rc", "sp", [-1, 1]], ["tile_ry", "sp", [-1, 3]], ["tile_rx", "sp", [-1, 3]], ["auto_unroll_max_step", "ot", 512], ["unroll_explicit", "ot", 0]]}, "result": [[8.226328334198234e-05, 8.227545355474832e-05, 8.22755012973534e-05], 0, 1.6776442527770996, 1679302745.0407484], "version": 0.2, "tvm_version": "0.10.0"}
{"input": ["cuda -keys=cuda,gpu -arch=sm_86 -max_num_threads=1024 -thread_warp_size=32", "conv2d_nchw.cuda", [["TENSOR", [1, 96, 35, 35], "float32"], ["TENSOR", [96, 96, 3, 3], "float32"], [1, 1], [1, 1, 1, 1], [1, 1], "float32"], {}], "config": {"index": 3526663, "code_hash": null, "entity": [["tile_f", "sp", [-1, 16, 1, 1]], ["tile_y", "sp", [-1, 1, 1, 1]], ["tile_x", "sp", [-1, 1, 35, 1]], ["tile_rc", "sp", [-1, 2]], ["tile_ry", "sp", [-1, 3]], ["tile_rx", "sp", [-1, 1]], ["auto_unroll_max_step", "ot", 512], ["unroll_explicit", "ot", 0]]}, "result": [[6.170634523342488e-05, 6.170955982738328e-05, 6.171110435464887e-05], 0, 1.7290096282958984, 1679302746.2342412], "version": 0.2, "tvm_version": "0.10.0"}
{"input": ["cuda -keys=cuda,gpu -arch=sm_86 -max_num_threads=1024 -thread_warp_size=32", "conv2d_nchw.cuda", [["TENSOR", [1, 96, 35, 35], "float32"], ["TENSOR", [96, 96, 3, 3], "float32"], [1, 1], [1, 1, 1, 1], [1, 1], "float32"], {}], "config": {"index": 3472903, "code_hash": null, "entity": [["tile_f", "sp", [-1, 16, 1, 1]], ["tile_y", "sp", [-1, 1, 1, 1]], ["tile_x", "sp", [-1, 1, 1, 5]], ["tile_rc", "sp", [-1, 1]], ["tile_ry", "sp", [-1, 3]], ["tile_rx", "sp", [-1, 1]], ["auto_unroll_max_step", "ot", 512], ["unroll_explicit", "ot", 0]]}, "result": [[0.0008592941336898395, 0.0008593550053475936, 0.0008593604705882354], 0, 1.7728800773620605, 1679302747.5104914], "version": 0.2, "tvm_version": "0.10.0"}
{"input": ["cuda -keys=cuda,gpu -arch=sm_86 -max_num_threads=1024 -thread_warp_size=32", "conv2d_nchw.cuda", [["TENSOR", [1, 96, 35, 35], "float32"], ["TENSOR", [96, 96, 3, 3], "float32"], [1, 1], [1, 1, 1, 1], [1, 1], "float32"], {}], "config": {"index": 3465735, "code_hash": null, "entity": [["tile_f", "sp", [-1, 16, 1, 1]], ["tile_y", "sp", [-1, 1, 1, 1]], ["tile_x", "sp", [-1, 5, 7, 1]], ["tile_rc", "sp", [-1, 1]], ["tile_ry", "sp", [-1, 3]], ["tile_rx", "sp", [-1, 1]], ["auto_unroll_max_step", "ot", 512], ["unroll_explicit", "ot", 0]]}, "result": [[0.00017000440783898307, 0.00017000460169491527, 0.00017001433262711863], 0, 1.8313603401184082, 1679302748.7281232], "version": 0.2, "tvm_version": "0.10.0"}
{"input": ["cuda -keys=cuda,gpu -arch=sm_86 -max_num_threads=1024 -thread_warp_size=32", "conv2d_nchw.cuda", [["TENSOR", [1, 96, 35, 35], "float32"], ["TENSOR", [96, 96, 3, 3], "float32"], [1, 1], [1, 1, 1, 1], [1, 1], "float32"], {}], "config": {"index": 3469543, "code_hash": null, "entity": [["tile_f", "sp", [-1, 16, 1, 1]], ["tile_y", "sp", [-1, 5, 1, 1]], ["tile_x", "sp", [-1, 1, 35, 1]], ["tile_rc", "sp", [-1, 1]], ["tile_ry", "sp", [-1, 3]], ["tile_rx", "sp", [-1, 1]], ["auto_unroll_max_step", "ot", 512], ["unroll_explicit", "ot", 0]]}, "result": [[9.086159631972398e-05, 9.086509718228868e-05, 9.086689591719378e-05], 0, 1.772094964981079, 1679302749.940378], "version": 0.2, "tvm_version": "0.10.0"}
{"input": ["cuda -keys=cuda,gpu -arch=sm_86 -max_num_threads=1024 -thread_warp_size=32", "conv2d_nchw.cuda", [["TENSOR", [1, 96, 35, 35], "float32"], ["TENSOR", [96, 96, 3, 3], "float32"], [1, 1], [1, 1, 1, 1], [1, 1], "float32"], {}], "config": {"index": 3469320, "code_hash": null, "entity": [["tile_f", "sp", [-1, 24, 1, 1]], ["tile_y", "sp", [-1, 1, 1, 1]], ["tile_x", "sp", [-1, 1, 35, 1]], ["tile_rc", "sp", [-1, 1]], ["tile_ry", "sp", [-1, 3]], ["tile_rx", "sp", [-1, 1]], ["auto_unroll_max_step", "ot", 512], ["unroll_explicit", "ot", 0]]}, "result": [[7.648030784123911e-05, 7.648427395934173e-05, 7.673942642787996e-05], 0, 1.6707594394683838, 1679302751.1434312], "version": 0.2, "tvm_version": "0.10.0"}
{"input": ["cuda -keys=cuda,gpu -arch=sm_86 -max_num_threads=1024 -thread_warp_size=32", "conv2d_nchw.cuda", [["TENSOR", [1, 96, 35, 35], "float32"], ["TENSOR", [96, 96, 3, 3], "float32"], [1, 1], [1, 1, 1, 1], [1, 1], "float32"], {}], "config": {"index": 3469318, "code_hash": null, "entity": [["tile_f", "sp", [-1, 12, 1, 1]], ["tile_y", "sp", [-1, 1, 1, 1]], ["tile_x", "sp", [-1, 1, 35, 1]], ["tile_rc", "sp", [-1, 1]], ["tile_ry", "sp", [-1, 3]], ["tile_rx", "sp", [-1, 1]], ["auto_unroll_max_step", "ot", 512], ["unroll_explicit", "ot", 0]]}, "result": [[6.748689278086288e-05, 6.750745066211021e-05, 6.750874797095258e-05], 0, 1.6584248542785645, 1679302752.3737776], "version": 0.2, "tvm_version": "0.10.0"}
{"input": ["cuda -keys=cuda,gpu -arch=sm_86 -max_num_threads=1024 -thread_warp_size=32", "conv2d_nchw.cuda", [["TENSOR", [1, 96, 35, 35], "float32"], ["TENSOR", [96, 96, 3, 3], "float32"], [1, 1], [1, 1, 1, 1], [1, 1], "float32"], {}], "config": {"index": 3454983, "code_hash": null, "entity": [["tile_f", "sp", [-1, 16, 1, 1]], ["tile_y", "sp", [-1, 1, 1, 1]], ["tile_x", "sp", [-1, 1, 5, 1]], ["tile_rc", "sp", [-1, 1]], ["tile_ry", "sp", [-1, 3]], ["tile_rx", "sp", [-1, 1]], ["auto_unroll_max_step", "ot", 512], ["unroll_explicit", "ot", 0]]}, "result": [[0.0003221762424849699, 0.00032218037074148296, 0.0003222460220440882], 0, 1.7386398315429688, 1679302753.6330032], "version": 0.2, "tvm_version": "0.10.0"}
