results/cuda_gtx1650/bert/gridsearch/cpu.log_layer_0.log
{"input": ["cuda -keys=cuda,gpu -arch=sm_75 -max_num_threads=1024 -thread_warp_size=32", "batch_matmul.cuda", [["TENSOR", [1, 128, 768], "float32"], ["TENSOR", [1, 768, 768], "float32"], [1, 128, 768], "float32", 0, 0], {}], "config": {"index": 0, "code_hash": null, "entity": [["tile_y", "sp", [-1, 1, 1]], ["tile_x", "sp", [-1, 1, 1]], ["tile_k", "sp", [-1, 1]], ["auto_unroll_max_step", "ot", 8], ["unroll_explicit", "ot", 0]]}, "result": [[0.0620874555, 0.062105808000000005, 0.0621856], 0, 2.21425199508667, 1688580428.2507236], "version": 0.2, "tvm_version": "0.13.dev0"}
{"input": ["cuda -keys=cuda,gpu -arch=sm_75 -max_num_threads=1024 -thread_warp_size=32", "batch_matmul.cuda", [["TENSOR", [1, 128, 768], "float32"], ["TENSOR", [1, 768, 768], "float32"], [1, 128, 768], "float32", 0, 0], {}], "config": {"index": 1, "code_hash": null, "entity": [["tile_y", "sp", [-1, 2, 1]], ["tile_x", "sp", [-1, 1, 1]], ["tile_k", "sp", [-1, 1]], ["auto_unroll_max_step", "ot", 8], ["unroll_explicit", "ot", 0]]}, "result": [[0.039546539, 0.03954839566666667, 0.04020292133333333], 0, 1.8750028610229492, 1688580429.439921], "version": 0.2, "tvm_version": "0.13.dev0"}
{"input": ["cuda -keys=cuda,gpu -arch=sm_75 -max_num_threads=1024 -thread_warp_size=32", "batch_matmul.cuda", [["TENSOR", [1, 128, 768], "float32"], ["TENSOR", [1, 768, 768], "float32"], [1, 128, 768], "float32", 0, 0], {}], "config": {"index": 2, "code_hash": null, "entity": [["tile_y", "sp", [-1, 4, 1]], ["tile_x", "sp", [-1, 1, 1]], ["tile_k", "sp", [-1, 1]], ["auto_unroll_max_step", "ot", 8], ["unroll_explicit", "ot", 0]]}, "result": [[0.022882579, 0.0228835326, 0.0228856262], 0, 2.057630777359009, 1688580430.57861], "version": 0.2, "tvm_version": "0.13.dev0"}
{"input": ["cuda -keys=cuda,gpu -arch=sm_75 -max_num_threads=1024 -thread_warp_size=32", "batch_matmul.cuda", [["TENSOR", [1, 128, 768], "float32"], ["TENSOR", [1, 768, 768], "float32"], [1, 128, 768], "float32", 0, 0], {}], "config": {"index": 3, "code_hash": null, "entity": [["tile_y", "sp", [-1, 8, 1]], ["tile_x", "sp", [-1, 1, 1]], ["tile_k", "sp", [-1, 1]], ["auto_unroll_max_step", "ot", 8], ["unroll_explicit", "ot", 0]]}, "result": [[0.014549531000000001, 0.014553261857142856, 0.014554874857142857], 0, 1.8202013969421387, 1688580431.6151881], "version": 0.2, "tvm_version": "0.13.dev0"}
{"input": ["cuda -keys=cuda,gpu -arch=sm_75 -max_num_threads=1024 -thread_warp_size=32", "batch_matmul.cuda", [["TENSOR", [1, 128, 768], "float32"], ["TENSOR", [1, 768, 768], "float32"], [1, 128, 768], "float32", 0, 0], {}], "config": {"index": 4, "code_hash": null, "entity": [["tile_y", "sp", [-1, 16, 1]], ["tile_x", "sp", [-1, 1, 1]], ["tile_k", "sp", [-1, 1]], ["auto_unroll_max_step", "ot", 8], ["unroll_explicit", "ot", 0]]}, "result": [[0.010332521800000001, 0.010332959700000002, 0.010333023799999999], 0, 1.9050612449645996, 1688580432.6311266], "version": 0.2, "tvm_version": "0.13.dev0"}
{"input": ["cuda -keys=cuda,gpu -arch=sm_75 -max_num_threads=1024 -thread_warp_size=32", "batch_matmul.cuda", [["TENSOR", [1, 128, 768], "float32"], ["TENSOR", [1, 768, 768], "float32"], [1, 128, 768], "float32", 0, 0], {}], "config": {"index": 5, "code_hash": null, "entity": [["tile_y", "sp", [-1, 32, 1]], ["tile_x", "sp", [-1, 1, 1]], ["tile_k", "sp", [-1, 1]], ["auto_unroll_max_step", "ot", 8], ["unroll_explicit", "ot", 0]]}, "result": [[0.008208135153846155, 0.008208182076923077, 0.008209754923076924], 0, 1.9286987781524658, 1688580433.675128], "version": 0.2, "tvm_version": "0.13.dev0"}
{"input": ["cuda -keys=cuda,gpu -arch=sm_75 -max_num_threads=1024 -thread_warp_size=32", "batch_matmul.cuda", [["TENSOR", [1, 128, 768], "float32"], ["TENSOR", [1, 768, 768], "float32"], [1, 128, 768], "float32", 0, 0], {}], "config": {"index": 6, "code_hash": null, "entity": [["tile_y", "sp", [-1, 64, 1]], ["tile_x", "sp", [-1, 1, 1]], ["tile_k", "sp", [-1, 1]], ["auto_unroll_max_step", "ot", 8], ["unroll_explicit", "ot", 0]]}, "result": [[0.0076528183571428566, 0.0076528892142857146, 0.007655131142857143], 0, 1.7393009662628174, 1688580434.6985564], "version": 0.2, "tvm_version": "0.13.dev0"}
{"input": ["cuda -keys=cuda,gpu -arch=sm_75 -max_num_threads=1024 -thread_warp_size=32", "batch_matmul.cuda", [["TENSOR", [1, 128, 768], "float32"], ["TENSOR", [1, 768, 768], "float32"], [1, 128, 768], "float32", 0, 0], {}], "config": {"index": 7, "code_hash": null, "entity": [["tile_y", "sp", [-1, 128, 1]], ["tile_x", "sp", [-1, 1, 1]], ["tile_k", "sp", [-1, 1]], ["auto_unroll_max_step", "ot", 8], ["unroll_explicit", "ot", 0]]}, "result": [[0.007377773785714285, 0.007387382999999999, 0.0073901072857142855], 0, 1.7696325778961182, 1688580435.7113159], "version": 0.2, "tvm_version": "0.13.dev0"}
{"input": ["cuda -keys=cuda,gpu -arch=sm_75 -max_num_threads=1024 -thread_warp_size=32", "batch_matmul.cuda", [["TENSOR", [1, 128, 768], "float32"], ["TENSOR", [1, 768, 768], "float32"], [1, 128, 768], "float32", 0, 0], {}], "config": {"index": 8, "code_hash": null, "entity": [["tile_y", "sp", [-1, 1, 2]], ["tile_x", "sp", [-1, 1, 1]], ["tile_k", "sp", [-1, 1]], ["auto_unroll_max_step", "ot", 8], ["unroll_explicit", "ot", 0]]}, "result": [[0.03695755766666667, 0.036976501333333335, 0.036986368666666665], 0, 1.6388463973999023, 1688580436.8492005], "version": 0.2, "tvm_version": "0.13.dev0"}
{"input": ["cuda -keys=cuda,gpu -arch=sm_75 -max_num_threads=1024 -thread_warp_size=32", "batch_matmul.cuda", [["TENSOR", [1, 128, 768], "float32"], ["TENSOR", [1, 768, 768], "float32"], [1, 128, 768], "float32", 0, 0], {}], "config": {"index": 9, "code_hash": null, "entity": [["tile_y", "sp", [-1, 2, 2]], ["tile_x", "sp", [-1, 1, 1]], ["tile_k", "sp", [-1, 1]], ["auto_unroll_max_step", "ot", 8], ["unroll_explicit", "ot", 0]]}, "result": [[0.0228659972, 0.0228686782, 0.022869651600000002], 0, 1.8818507194519043, 1688580437.9654663], "version": 0.2, "tvm_version": "0.13.dev0"}
{"input": ["cuda -keys=cuda,gpu -arch=sm_75 -max_num_threads=1024 -thread_warp_size=32", "batch_matmul.cuda", [["TENSOR", [1, 128, 768], "float32"], ["TENSOR", [1, 768, 768], "float32"], [1, 128, 768], "float32", 0, 0], {}], "config": {"index": 10, "code_hash": null, "entity": [["tile_y", "sp", [-1, 4, 2]], ["tile_x", "sp", [-1, 1, 1]], ["tile_k", "sp", [-1, 1]], ["auto_unroll_max_step", "ot", 8], ["unroll_explicit", "ot", 0]]}, "result": [[0.014547826428571428, 0.014549860142857142, 0.014550605714285713], 0, 1.8432984352111816, 1688580438.992278], "version": 0.2, "tvm_version": "0.13.dev0"}
{"input": ["cuda -keys=cuda,gpu -arch=sm_75 -max_num_threads=1024 -thread_warp_size=32", "batch_matmul.cuda", [["TENSOR", [1, 128, 768], "float32"], ["TENSOR", [1, 768, 768], "float32"], [1, 128, 768], "float32", 0, 0], {}], "config": {"index": 11, "code_hash": null, "entity": [["tile_y", "sp", [-1, 8, 2]], ["tile_x", "sp", [-1, 1, 1]], ["tile_k", "sp", [-1, 1]], ["auto_unroll_max_step", "ot", 8], ["unroll_explicit", "ot", 0]]}, "result": [[0.010327024, 0.010327823600000001, 0.010333155], 0, 1.777585506439209, 1688580440.0071745], "version": 0.2, "tvm_version": "0.13.dev0"}
{"input": ["cuda -keys=cuda,gpu -arch=sm_75 -max_num_threads=1024 -thread_warp_size=32", "batch_matmul.cuda", [["TENSOR", [1, 128, 768], "float32"], ["TENSOR", [1, 768, 768], "float32"], [1, 128, 768], "float32", 0, 0], {}], "config": {"index": 12, "code_hash": null, "entity": [["tile_y", "sp", [-1, 16, 2]], ["tile_x", "sp", [-1, 1, 1]], ["tile_k", "sp", [-1, 1]], ["auto_unroll_max_step", "ot", 8], ["unroll_explicit", "ot", 0]]}, "result": [[0.008218107307692308, 0.008218938923076922, 0.008218938923076922], 0, 1.7313947677612305, 1688580441.0394664], "version": 0.2, "tvm_version": "0.13.dev0"}
{"input": ["cuda -keys=cuda,gpu -arch=sm_75 -max_num_threads=1024 -thread_warp_size=32", "batch_matmul.cuda", [["TENSOR", [1, 128, 768], "float32"], ["TENSOR", [1, 768, 768], "float32"], [1, 128, 768], "float32", 0, 0], {}], "config": {"index": 13, "code_hash": null, "entity": [["tile_y", "sp", [-1, 32, 2]], ["tile_x", "sp", [-1, 1, 1]], ["tile_k", "sp", [-1, 1]], ["auto_unroll_max_step", "ot", 8], ["unroll_explicit", "ot", 0]]}, "result": [[0.007350415857142857, 0.007354806571428571, 0.007357035499999999], 0, 1.7180702686309814, 1688580442.0403998], "version": 0.2, "tvm_version": "0.13.dev0"}
{"input": ["cuda -keys=cuda,gpu -arch=sm_75 -max_num_threads=1024 -thread_warp_size=32", "batch_matmul.cuda", [["TENSOR", [1, 128, 768], "float32"], ["TENSOR", [1, 768, 768], "float32"], [1, 128, 768], "float32", 0, 0], {}], "config": {"index": 14, "code_hash": null, "entity": [["tile_y", "sp", [-1, 64, 2]], ["tile_x", "sp", [-1, 1, 1]], ["tile_k", "sp", [-1, 1]], ["auto_unroll_max_step", "ot", 8], ["unroll_explicit", "ot", 0]]}, "result": [[0.007144397714285715, 0.007147065285714286, 0.007151586214285715], 0, 1.8602209091186523, 1688580443.1995044], "version": 0.2, "tvm_version": "0.13.dev0"}
{"input": ["cuda -keys=cuda,gpu -arch=sm_75 -max_num_threads=1024 -thread_warp_size=32", "batch_matmul.cuda", [["TENSOR", [1, 128, 768], "float32"], ["TENSOR", [1, 768, 768], "float32"], [1, 128, 768], "float32", 0, 0], {}], "config": {"index": 15, "code_hash": null, "entity": [["tile_y", "sp", [-1, 1, 4]], ["tile_x", "sp", [-1, 1, 1]], ["tile_k", "sp", [-1, 1]], ["auto_unroll_max_step", "ot", 8], ["unroll_explicit", "ot", 0]]}, "result": [[0.0230989822, 0.023101606599999998, 0.023102809], 0, 1.8345801830291748, 1688580444.318173], "version": 0.2, "tvm_version": "0.13.dev0"}
{"input": ["cuda -keys=cuda,gpu -arch=sm_75 -max_num_threads=1024 -thread_warp_size=32", "batch_matmul.cuda", [["TENSOR", [1, 128, 768], "float32"], ["TENSOR", [1, 768, 768], "float32"], [1, 128, 768], "float32", 0, 0], {}], "config": {"index": 16, "code_hash": null, "entity": [["tile_y", "sp", [-1, 2, 4]], ["tile_x", "sp", [-1, 1, 1]], ["tile_k", "sp", [-1, 1]], ["auto_unroll_max_step", "ot", 8], ["unroll_explicit", "ot", 0]]}, "result": [[0.014589074142857142, 0.014590807142857142, 0.014594047428571429], 0, 1.8238470554351807, 1688580446.3326073], "version": 0.2, "tvm_version": "0.13.dev0"}
{"input": ["cuda -keys=cuda,gpu -arch=sm_75 -max_num_threads=1024 -thread_warp_size=32", "batch_matmul.cuda", [["TENSOR", [1, 128, 768], "float32"], ["TENSOR", [1, 768, 768], "float32"], [1, 128, 768], "float32", 0, 0], {}], "config": {"index": 17, "code_hash": null, "entity": [["tile_y", "sp", [-1, 4, 4]], ["tile_x", "sp", [-1, 1, 1]], ["tile_k", "sp", [-1, 1]], ["auto_unroll_max_step", "ot", 8], ["unroll_explicit", "ot", 0]]}, "result": [[0.010342473599999999, 0.0103442428, 0.010344822600000001], 0, 1.8442943096160889, 1688580447.3537924], "version": 0.2, "tvm_version": "0.13.dev0"}
{"input": ["cuda -keys=cuda,gpu -arch=sm_75 -max_num_threads=1024 -thread_warp_size=32", "batch_matmul.cuda", [["TENSOR", [1, 128, 768], "float32"], ["TENSOR", [1, 768, 768], "float32"], [1, 128, 768], "float32", 0, 0], {}], "config": {"index": 18, "code_hash": null, "entity": [["tile_y", "sp", [-1, 8, 4]], ["tile_x", "sp", [-1, 1, 1]], ["tile_k", "sp", [-1, 1]], ["auto_unroll_max_step", "ot", 8], ["unroll_explicit", "ot", 0]]}, "result": [[0.008226028384615384, 0.008226478538461538, 0.008228864153846153], 0, 1.8746421337127686, 1688580448.397631], "version": 0.2, "tvm_version": "0.13.dev0"}
{"input": ["cuda -keys=cuda,gpu -arch=sm_75 -max_num_threads=1024 -thread_warp_size=32", "batch_matmul.cuda", [["TENSOR", [1, 128, 768], "float32"], ["TENSOR", [1, 768, 768], "float32"], [1, 128, 768], "float32", 0, 0], {}], "config": {"index": 19, "code_hash": null, "entity": [["tile_y", "sp", [-1, 16, 4]], ["tile_x", "sp", [-1, 1, 1]], ["tile_k", "sp", [-1, 1]], ["auto_unroll_max_step", "ot", 8], ["unroll_explicit", "ot", 0]]}, "result": [[0.0073843677857142855, 0.007387720857142858, 0.007390493642857142], 0, 1.8539471626281738, 1688580449.4287763], "version": 0.2, "tvm_version": "0.13.dev0"}
{"input": ["cuda -keys=cuda,gpu -arch=sm_75 -max_num_threads=1024 -thread_warp_size=32", "batch_matmul.cuda", [["TENSOR", [1, 128, 768], "float32"], ["TENSOR", [1, 768, 768], "float32"], [1, 128, 768], "float32", 0, 0], {}], "config": {"index": 20, "code_hash": null, "entity": [["tile_y", "sp", [-1, 32, 4]], ["tile_x", "sp", [-1, 1, 1]], ["tile_k", "sp", [-1, 1]], ["auto_unroll_max_step", "ot", 8], ["unroll_explicit", "ot", 0]]}, "result": [[0.007077717066666667, 0.0070812118, 0.007081437666666667], 0, 1.8447635173797607, 1688580450.4608166], "version": 0.2, "tvm_version": "0.13.dev0"}
{"input": ["cuda -keys=cuda,gpu -arch=sm_75 -max_num_threads=1024 -thread_warp_size=32", "batch_matmul.cuda", [["TENSOR", [1, 128, 768], "float32"], ["TENSOR", [1, 768, 768], "float32"], [1, 128, 768], "float32", 0, 0], {}], "config": {"index": 21, "code_hash": null, "entity": [["tile_y", "sp", [-1, 1, 8]], ["tile_x", "sp", [-1, 1, 1]], ["tile_k", "sp", [-1, 1]], ["auto_unroll_max_step", "ot", 8], ["unroll_explicit", "ot", 0]]}, "result": [[0.01625066914285714, 0.016252631, 0.016257335], 0, 1.923567295074463, 1688580451.5612268], "version": 0.2, "tvm_version": "0.13.dev0"}
{"input": ["cuda -keys=cuda,gpu -arch=sm_75 -max_num_threads=1024 -thread_warp_size=32", "batch_matmul.cuda", [["TENSOR", [1, 128, 768], "float32"], ["TENSOR", [1, 768, 768], "float32"], [1, 128, 768], "float32", 0, 0], {}], "config": {"index": 22, "code_hash": null, "entity": [["tile_y", "sp", [-1, 2, 8]], ["tile_x", "sp", [-1, 1, 1]], ["tile_k", "sp", [-1, 1]], ["auto_unroll_max_step", "ot", 8], ["unroll_explicit", "ot", 0]]}, "result": [[0.01113159088888889, 0.011132472555555556, 0.011135658222222223], 0, 1.8297703266143799, 1688580452.5817964], "version": 0.2, "tvm_version": "0.13.dev0"}
{"input": ["cuda -keys=cuda,gpu -arch=sm_75 -max_num_threads=1024 -thread_warp_size=32", "batch_matmul.cuda", [["TENSOR", [1, 128, 768], "float32"], ["TENSOR", [1, 768, 768], "float32"], [1, 128, 768], "float32", 0, 0], {}], "config": {"index": 23, "code_hash": null, "entity": [["tile_y", "sp", [-1, 4, 8]], ["tile_x", "sp", [-1, 1, 1]], ["tile_k", "sp", [-1, 1]], ["auto_unroll_max_step", "ot", 8], ["unroll_explicit", "ot", 0]]}, "result": [[0.00860632, 0.00860646375, 0.008608938833333333], 0, 1.8378043174743652, 1688580453.5966582], "version": 0.2, "tvm_version": "0.13.dev0"}
{"input": ["cuda -keys=cuda,gpu -arch=sm_75 -max_num_threads=1024 -thread_warp_size=32", "batch_matmul.cuda", [["TENSOR", [1, 128, 768], "float32"], ["TENSOR", [1, 768, 768], "float32"], [1, 128, 768], "float32", 0, 0], {}], "config": {"index": 24, "code_hash": null, "entity": [["tile_y", "sp", [-1, 8, 8]], ["tile_x", "sp", [-1, 1, 1]], ["tile_k", "sp", [-1, 1]], ["auto_unroll_max_step", "ot", 8], ["unroll_explicit", "ot", 0]]}, "result": [[0.0078045343076923075, 0.00780943, 0.007815810538461539], 0, 1.8424506187438965, 1688580454.6008902], "version": 0.2, "tvm_version": "0.13.dev0"}
{"input": ["cuda -keys=cuda,gpu -arch=sm_75 -max_num_threads=1024 -thread_warp_size=32", "batch_matmul.cuda", [["TENSOR", [1, 128, 768], "float32"], ["TENSOR", [1, 768, 768], "float32"], [1, 128, 768], "float32", 0, 0], {}], "config": {"index": 25, "code_hash": null, "entity": [["tile_y", "sp", [-1, 16, 8]], ["tile_x", "sp", [-1, 1, 1]], ["tile_k", "sp", [-1, 1]], ["auto_unroll_max_step", "ot", 8], ["unroll_explicit", "ot", 0]]}, "result": [[0.007506804285714285, 0.007511026071428571, 0.0075124592857142855], 0, 1.8374619483947754, 1688580455.6276486], "version": 0.2, "tvm_version": "0.13.dev0"}
{"input": ["cuda -keys=cuda,gpu -arch=sm_75 -max_num_threads=1024 -thread_warp_size=32", "batch_matmul.cuda", [["TENSOR", [1, 128, 768], "float32"], ["TENSOR", [1, 768, 768], "float32"], [1, 128, 768], "float32", 0, 0], {}], "config": {"index": 26, "code_hash": null, "entity": [["tile_y", "sp", [-1, 1, 16]], ["tile_x", "sp", [-1, 1, 1]], ["tile_k", "sp", [-1, 1]], ["auto_unroll_max_step", "ot", 8], ["unroll_explicit", "ot", 0]]}, "result": [[0.0128305635, 0.0128332795, 0.012835244124999999], 0, 1.83447265625, 1688580456.6622305], "version": 0.2, "tvm_version": "0.13.dev0"}
{"input": ["cuda -keys=cuda,gpu -arch=sm_75 -max_num_threads=1024 -thread_warp_size=32", "batch_matmul.cuda", [["TENSOR", [1, 128, 768], "float32"], ["TENSOR", [1, 768, 768], "float32"], [1, 128, 768], "float32", 0, 0], {}], "config": {"index": 27, "code_hash": null, "entity": [["tile_y", "sp", [-1, 2, 16]], ["tile_x", "sp", [-1, 1, 1]], ["tile_k", "sp", [-1, 1]], ["auto_unroll_max_step", "ot", 8], ["unroll_explicit", "ot", 0]]}, "result": [[0.009371967636363636, 0.009372718727272729, 0.009373696], 0, 1.8603489398956299, 1688580457.6913366], "version": 0.2, "tvm_version": "0.13.dev0"}
{"input": ["cuda -keys=cuda,gpu -arch=sm_75 -max_num_threads=1024 -thread_warp_size=32", "batch_matmul.cuda", [["TENSOR", [1, 128, 768], "float32"], ["TENSOR", [1, 768, 768], "float32"], [1, 128, 768], "float32", 0, 0], {}], "config": {"index": 28, "code_hash": null, "entity": [["tile_y", "sp", [-1, 4, 16]], ["tile_x", "sp", [-1, 1, 1]], ["tile_k", "sp", [-1, 1]], ["auto_unroll_max_step", "ot", 8], ["unroll_explicit", "ot", 0]]}, "result": [[0.008619824083333333, 0.008620525333333334, 0.008623138416666667], 0, 1.884951114654541, 1688580458.7047844], "version": 0.2, "tvm_version": "0.13.dev0"}
{"input": ["cuda -keys=cuda,gpu -arch=sm_75 -max_num_threads=1024 -thread_warp_size=32", "batch_matmul.cuda", [["TENSOR", [1, 128, 768], "float32"], ["TENSOR", [1, 768, 768], "float32"], [1, 128, 768], "float32", 0, 0], {}], "config": {"index": 29, "code_hash": null, "entity": [["tile_y", "sp", [-1, 8, 16]], ["tile_x", "sp", [-1, 1, 1]], ["tile_k", "sp", [-1, 1]], ["auto_unroll_max_step", "ot", 8], ["unroll_explicit", "ot", 0]]}, "result": [[0.008314017842105264, 0.008317606842105262, 0.008318377842105264], 0, 2.210963487625122, 1688580460.1003652], "version": 0.2, "tvm_version": "0.13.dev0"}
{"input": ["cuda -keys=cuda,gpu -arch=sm_75 -max_num_threads=1024 -thread_warp_size=32", "batch_matmul.cuda", [["TENSOR", [1, 128, 768], "float32"], ["TENSOR", [1, 768, 768], "float32"], [1, 128, 768], "float32", 0, 0], {}], "config": {"index": 30, "code_hash": null, "entity": [["tile_y", "sp", [-1, 1, 32]], ["tile_x", "sp", [-1, 1, 1]], ["tile_k", "sp", [-1, 1]], ["auto_unroll_max_step", "ot", 8], ["unroll_explicit", "ot", 0]]}, "result": [[0.011115225, 0.01111732988888889, 0.011117909666666669], 0, 1.852870225906372, 1688580461.114609], "version": 0.2, "tvm_version": "0.13.dev0"}
{"input": ["cuda -keys=cuda,gpu -arch=sm_75 -max_num_threads=1024 -thread_warp_size=32", "batch_matmul.cuda", [["TENSOR", [1, 128, 768], "float32"], ["TENSOR", [1, 768, 768], "float32"], [1, 128, 768], "float32", 0, 0], {}], "config": {"index": 31, "code_hash": null, "entity": [["tile_y", "sp", [-1, 2, 32]], ["tile_x", "sp", [-1, 1, 1]], ["tile_k", "sp", [-1, 1]], ["auto_unroll_max_step", "ot", 8], ["unroll_explicit", "ot", 0]]}, "result": [[0.0100957695, 0.0100974594, 0.0101004127], 0, 1.8758835792541504, 1688580462.128405], "version": 0.2, "tvm_version": "0.13.dev0"}
{"input": ["cuda -keys=cuda,gpu -arch=sm_75 -max_num_threads=1024 -thread_warp_size=32", "batch_matmul.cuda", [["TENSOR", [1, 128, 768], "float32"], ["TENSOR", [1, 768, 768], "float32"], [1, 128, 768], "float32", 0, 0], {}], "config": {"index": 32, "code_hash": null, "entity": [["tile_y", "sp", [-1, 4, 32]], ["tile_x", "sp", [-1, 1, 1]], ["tile_k", "sp", [-1, 1]], ["auto_unroll_max_step", "ot", 8], ["unroll_explicit", "ot", 0]]}, "result": [[0.00993035609090909, 0.009935653636363638, 0.009935779181818183], 0, 1.885857343673706, 1688580464.1942565], "version": 0.2, "tvm_version": "0.13.dev0"}
{"input": ["cuda -keys=cuda,gpu -arch=sm_75 -max_num_threads=1024 -thread_warp_size=32", "batch_matmul.cuda", [["TENSOR", [1, 128, 768], "float32"], ["TENSOR", [1, 768, 768], "float32"], [1, 128, 768], "float32", 0, 0], {}], "config": {"index": 33, "code_hash": null, "entity": [["tile_y", "sp", [-1, 1, 64]], ["tile_x", "sp", [-1, 1, 1]], ["tile_k", "sp", [-1, 1]], ["auto_unroll_max_step", "ot", 8], ["unroll_explicit", "ot", 0]]}, "result": [[0.0107038719, 0.010705029999999999, 0.0107130882], 0, 1.935086727142334, 1688580465.2511263], "version": 0.2, "tvm_version": "0.13.dev0"}
{"input": ["cuda -keys=cuda,gpu -arch=sm_75 -max_num_threads=1024 -thread_warp_size=32", "batch_matmul.cuda", [["TENSOR", [1, 128, 768], "float32"], ["TENSOR", [1, 768, 768], "float32"], [1, 128, 768], "float32", 0, 0], {}], "config": {"index": 34, "code_hash": null, "entity": [["tile_y", "sp", [-1, 2, 64]], ["tile_x", "sp", [-1, 1, 1]], ["tile_k", "sp", [-1, 1]], ["auto_unroll_max_step", "ot", 8], ["unroll_explicit", "ot", 0]]}, "result": [[0.009893515818181818, 0.009893701636363637, 0.009895563272727273], 0, 1.924647331237793, 1688580466.302257], "version": 0.2, "tvm_version": "0.13.dev0"}
{"input": ["cuda -keys=cuda,gpu -arch=sm_75 -max_num_threads=1024 -thread_warp_size=32", "batch_matmul.cuda", [["TENSOR", [1, 128, 768], "float32"], ["TENSOR", [1, 768, 768], "float32"], [1, 128, 768], "float32", 0, 0], {}], "config": {"index": 35, "code_hash": null, "entity": [["tile_y", "sp", [-1, 1, 128]], ["tile_x", "sp", [-1, 1, 1]], ["tile_k", "sp", [-1, 1]], ["auto_unroll_max_step", "ot", 8], ["unroll_explicit", "ot", 0]]}, "result": [[0.0105114204, 0.0105238784, 0.0105291778], 0, 1.938021183013916, 1688580467.3413746], "version": 0.2, "tvm_version": "0.13.dev0"}
{"input": ["cuda -keys=cuda,gpu -arch=sm_75 -max_num_threads=1024 -thread_warp_size=32", "batch_matmul.cuda", [["TENSOR", [1, 128, 768], "float32"], ["TENSOR", [1, 768, 768], "float32"], [1, 128, 768], "float32", 0, 0], {}], "config": {"index": 36, "code_hash": null, "entity": [["tile_y", "sp", [-1, 1, 1]], ["tile_x", "sp", [-1, 2, 1]], ["tile_k", "sp", [-1, 1]], ["auto_unroll_max_step", "ot", 8], ["unroll_explicit", "ot", 0]]}, "result": [[0.03652066033333334, 0.036521301, 0.036521952], 0, 1.9370217323303223, 1688580468.4809127], "version": 0.2, "tvm_version": "0.13.dev0"}
{"input": ["cuda -keys=cuda,gpu -arch=sm_75 -max_num_threads=1024 -thread_warp_size=32", "batch_matmul.cuda", [["TENSOR", [1, 128, 768], "float32"], ["TENSOR", [1, 768, 768], "float32"], [1, 128, 768], "float32", 0, 0], {}], "config": {"index": 37, "code_hash": null, "entity": [["tile_y", "sp", [-1, 2, 1]], ["tile_x", "sp", [-1, 2, 1]], ["tile_k", "sp", [-1, 1]], ["auto_unroll_max_step", "ot", 8], ["unroll_explicit", "ot", 0]]}, "result": [[0.019774805666666666, 0.019775477, 0.019785728333333332], 0, 1.9490597248077393, 1688580469.614099], "version": 0.2, "tvm_version": "0.13.dev0"}
{"input": ["cuda -keys=cuda,gpu -arch=sm_75 -max_num_threads=1024 -thread_warp_size=32", "batch_matmul.cuda", [["TENSOR", [1, 128, 768], "float32"], ["TENSOR", [1, 768, 768], "float32"], [1, 128, 768], "float32", 0, 0], {}], "config": {"index": 38, "code_hash": null, "entity": [["tile_y", "sp", [-1, 4, 1]], ["tile_x", "sp", [-1, 2, 1]], ["tile_k", "sp", [-1, 1]], ["auto_unroll_max_step", "ot", 8], ["unroll_explicit", "ot", 0]]}, "result": [[0.011449386555555555, 0.011449707, 0.011449863], 0, 1.8400990962982178, 1688580470.6471474], "version": 0.2, "tvm_version": "0.13.dev0"}
{"input": ["cuda -keys=cuda,gpu -arch=sm_75 -max_num_threads=1024 -thread_warp_size=32", "batch_matmul.cuda", [["TENSOR", [1, 128, 768], "float32"], ["TENSOR", [1, 768, 768], "float32"], [1, 128, 768], "float32", 0, 0], {}], "config": {"index": 39, "code_hash": null, "entity": [["tile_y", "sp", [-1, 8, 1]], ["tile_x", "sp", [-1, 2, 1]], ["tile_k", "sp", [-1, 1]], ["auto_unroll_max_step", "ot", 8], ["unroll_explicit", "ot", 0]]}, "result": [[0.007276283214285715, 0.007276338285714286, 0.0072787360714285715], 0, 1.837428092956543, 1688580471.664125], "version": 0.2, "tvm_version": "0.13.dev0"}
{"input": ["cuda -keys=cuda,gpu -arch=sm_75 -max_num_threads=1024 -thread_warp_size=32", "batch_matmul.cuda", [["TENSOR", [1, 128, 768], "float32"], ["TENSOR", [1, 768, 768], "float32"], [1, 128, 768], "float32", 0, 0], {}], "config": {"index": 40, "code_hash": null, "entity": [["tile_y", "sp", [-1, 16, 1]], ["tile_x", "sp", [-1, 2, 1]], ["tile_k", "sp", [-1, 1]], ["auto_unroll_max_step", "ot", 8], ["unroll_explicit", "ot", 0]]}, "result": [[0.0051679153, 0.00516802555, 0.00516820485], 0, 1.7993221282958984, 1688580472.6659749], "version": 0.2, "tvm_version": "0.13.dev0"}
{"input": ["cuda -keys=cuda,gpu -arch=sm_75 -max_num_threads=1024 -thread_warp_size=32", "batch_matmul.cuda", [["TENSOR", [1, 128, 768], "float32"], ["TENSOR", [1, 768, 768], "float32"], [1, 128, 768], "float32", 0, 0], {}], "config": {"index": 41, "code_hash": null, "entity": [["tile_y", "sp", [-1, 32, 1]], ["tile_x", "sp", [-1, 2, 1]], ["tile_k", "sp", [-1, 1]], ["auto_unroll_max_step", "ot", 8], ["unroll_explicit", "ot", 0]]}, "result": [[0.004604183181818182, 0.004605909863636363, 0.004607720772727273], 0, 1.8182110786437988, 1688580473.6681783], "version": 0.2, "tvm_version": "0.13.dev0"}
{"input": ["cuda -keys=cuda,gpu -arch=sm_75 -max_num_threads=1024 -thread_warp_size=32", "batch_matmul.cuda", [["TENSOR", [1, 128, 768], "float32"], ["TENSOR", [1, 768, 768], "float32"], [1, 128, 768], "float32", 0, 0], {}], "config": {"index": 42, "code_hash": null, "entity": [["tile_y", "sp", [-1, 64, 1]], ["tile_x", "sp", [-1, 2, 1]], ["tile_k", "sp", [-1, 1]], ["auto_unroll_max_step", "ot", 8], ["unroll_explicit", "ot", 0]]}, "result": [[0.004322952675675676, 0.004323051243243244, 0.004323604675675676], 0, 2.1984565258026123, 1688580475.056521], "version": 0.2, "tvm_version": "0.13.dev0"}
{"input": ["cuda -keys=cuda,gpu -arch=sm_75 -max_num_threads=1024 -thread_warp_size=32", "batch_matmul.cuda", [["TENSOR", [1, 128, 768], "float32"], ["TENSOR", [1, 768, 768], "float32"], [1, 128, 768], "float32", 0, 0], {}], "config": {"index": 43, "code_hash": null, "entity": [["tile_y", "sp", [-1, 128, 1]], ["tile_x", "sp", [-1, 2, 1]], ["tile_k", "sp", [-1, 1]], ["auto_unroll_max_step", "ot", 8], ["unroll_explicit", "ot", 0]]}, "result": [[0.004257207833333334, 0.004260448125, 0.004260863916666667], 0, 1.7890830039978027, 1688580476.0670617], "version": 0.2, "tvm_version": "0.13.dev0"}
{"input": ["cuda -keys=cuda,gpu -arch=sm_75 -max_num_threads=1024 -thread_warp_size=32", "batch_matmul.cuda", [["TENSOR", [1, 128, 768], "float32"], ["TENSOR", [1, 768, 768], "float32"], [1, 128, 768], "float32", 0, 0], {}], "config": {"index": 44, "code_hash": null, "entity": [["tile_y", "sp", [-1, 1, 2]], ["tile_x", "sp", [-1, 2, 1]], ["tile_k", "sp", [-1, 1]], ["auto_unroll_max_step", "ot", 8], ["unroll_explicit", "ot", 0]]}, "result": [[0.0213632506, 0.0213645248, 0.0216805434], 0, 2.070614814758301, 1688580477.255126], "version": 0.2, "tvm_version": "0.13.dev0"}
{"input": ["cuda -keys=cuda,gpu -arch=sm_75 -max_num_threads=1024 -thread_warp_size=32", "batch_matmul.cuda", [["TENSOR", [1, 128, 768], "float32"], ["TENSOR", [1, 768, 768], "float32"], [1, 128, 768], "float32", 0, 0], {}], "config": {"index": 45, "code_hash": null, "entity": [["tile_y", "sp", [-1, 2, 2]], ["tile_x", "sp", [-1, 2, 1]], ["tile_k", "sp", [-1, 1]], ["auto_unroll_max_step", "ot", 8], ["unroll_explicit", "ot", 0]]}, "result": [[0.012189766777777779, 0.012190606, 0.012190855222222222], 0, 1.877852439880371, 1688580478.3388658], "version": 0.2, "tvm_version": "0.13.dev0"}
{"input": ["cuda -keys=cuda,gpu -arch=sm_75 -max_num_threads=1024 -thread_warp_size=32", "batch_matmul.cuda", [["TENSOR", [1, 128, 768], "float32"], ["TENSOR", [1, 768, 768], "float32"], [1, 128, 768], "float32", 0, 0], {}], "config": {"index": 46, "code_hash": null, "entity": [["tile_y", "sp", [-1, 4, 2]], ["tile_x", "sp", [-1, 2, 1]], ["tile_k", "sp", [-1, 1]], ["auto_unroll_max_step", "ot", 8], ["unroll_explicit", "ot", 0]]}, "result": [[0.0076405187142857146, 0.007641808071428571, 0.007642102857142857], 0, 1.8283774852752686, 1688580479.3709764], "version": 0.2, "tvm_version": "0.13.dev0"}
{"input": ["cuda -keys=cuda,gpu -arch=sm_75 -max_num_threads=1024 -thread_warp_size=32", "batch_matmul.cuda", [["TENSOR", [1, 128, 768], "float32"], ["TENSOR", [1, 768, 768], "float32"], [1, 128, 768], "float32", 0, 0], {}], "config": {"index": 47, "code_hash": null, "entity": [["tile_y", "sp", [-1, 8, 2]], ["tile_x", "sp", [-1, 2, 1]], ["tile_k", "sp", [-1, 1]], ["auto_unroll_max_step", "ot", 8], ["unroll_explicit", "ot", 0]]}, "result": [[0.005354356052631579, 0.005354441947368421, 0.005354883263157895], 0, 1.83164381980896, 1688580480.3721712], "version": 0.2, "tvm_version": "0.13.dev0"}
{"input": ["cuda -keys=cuda,gpu -arch=sm_75 -max_num_threads=1024 -thread_warp_size=32", "batch_matmul.cuda", [["TENSOR", [1, 128, 768], "float32"], ["TENSOR", [1, 768, 768], "float32"], [1, 128, 768], "float32", 0, 0], {}], "config": {"index": 48, "code_hash": null, "entity": [["tile_y", "sp", [-1, 16, 2]], ["tile_x", "sp", [-1, 2, 1]], ["tile_k", "sp", [-1, 1]], ["auto_unroll_max_step", "ot", 8], ["unroll_explicit", "ot", 0]]}, "result": [[0.0042279173333333335, 0.0042281052083333335, 0.004228275916666667], 0, 1.762862205505371, 1688580482.2978911], "version": 0.2, "tvm_version": "0.13.dev0"}
{"input": ["cuda -keys=cuda,gpu -arch=sm_75 -max_num_threads=1024 -thread_warp_size=32", "batch_matmul.cuda", [["TENSOR", [1, 128, 768], "float32"], ["TENSOR", [1, 768, 768], "float32"], [1, 128, 768], "float32", 0, 0], {}], "config": {"index": 49, "code_hash": null, "entity": [["tile_y", "sp", [-1, 32, 2]], ["tile_x", "sp", [-1, 2, 1]], ["tile_k", "sp", [-1, 1]], ["auto_unroll_max_step", "ot", 8], ["unroll_explicit", "ot", 0]]}, "result": [[0.003952086192307692, 0.003956194346153846, 0.003957308230769231], 0, 1.8055763244628906, 1688580483.3116374], "version": 0.2, "tvm_version": "0.13.dev0"}
{"input": ["cuda -keys=cuda,gpu -arch=sm_75 -max_num_threads=1024 -thread_warp_size=32", "batch_matmul.cuda", [["TENSOR", [1, 128, 768], "float32"], ["TENSOR", [1, 768, 768], "float32"], [1, 128, 768], "float32", 0, 0], {}], "config": {"index": 50, "code_hash": null, "entity": [["tile_y", "sp", [-1, 64, 2]], ["tile_x", "sp", [-1, 2, 1]], ["tile_k", "sp", [-1, 1]], ["auto_unroll_max_step", "ot", 8], ["unroll_explicit", "ot", 0]]}, "result": [[0.0038729464999999997, 0.0038730817692307694, 0.0038760678076923075], 0, 1.7367258071899414, 1688580484.3066149], "version": 0.2, "tvm_version": "0.13.dev0"}
{"input": ["cuda -keys=cuda,gpu -arch=sm_75 -max_num_threads=1024 -thread_warp_size=32", "batch_matmul.cuda", [["TENSOR", [1, 128, 768], "float32"], ["TENSOR", [1, 768, 768], "float32"], [1, 128, 768], "float32", 0, 0], {}], "config": {"index": 51, "code_hash": null, "entity": [["tile_y", "sp", [-1, 1, 4]], ["tile_x", "sp", [-1, 2, 1]], ["tile_k", "sp", [-1, 1]], ["auto_unroll_max_step", "ot", 8], ["unroll_explicit", "ot", 0]]}, "result": [[0.0138255395, 0.0138269595, 0.013833764], 0, 1.8838074207305908, 1688580485.3877766], "version": 0.2, "tvm_version": "0.13.dev0"}
{"input": ["cuda -keys=cuda,gpu -arch=sm_75 -max_num_threads=1024 -thread_warp_size=32", "batch_matmul.cuda", [["TENSOR", [1, 128, 768], "float32"], ["TENSOR", [1, 768, 768], "float32"], [1, 128, 768], "float32", 0, 0], {}], "config": {"index": 52, "code_hash": null, "entity": [["tile_y", "sp", [-1, 2, 4]], ["tile_x", "sp", [-1, 2, 1]], ["tile_k", "sp", [-1, 1]], ["auto_unroll_max_step", "ot", 8], ["unroll_explicit", "ot", 0]]}, "result": [[0.008406063666666666, 0.008406632083333334, 0.008406698833333334], 0, 1.8113162517547607, 1688580486.4149537], "version": 0.2, "tvm_version": "0.13.dev0"}
{"input": ["cuda -keys=cuda,gpu -arch=sm_75 -max_num_threads=1024 -thread_warp_size=32", "batch_matmul.cuda", [["TENSOR", [1, 128, 768], "float32"], ["TENSOR", [1, 768, 768], "float32"], [1, 128, 768], "float32", 0, 0], {}], "config": {"index": 53, "code_hash": null, "entity": [["tile_y", "sp", [-1, 4, 4]], ["tile_x", "sp", [-1, 2, 1]], ["tile_k", "sp", [-1, 1]], ["auto_unroll_max_step", "ot", 8], ["unroll_explicit", "ot", 0]]}, "result": [[0.005725927111111111, 0.005726549333333334, 0.005728314666666666], 0, 1.8193268775939941, 1688580487.436873], "version": 0.2, "tvm_version": "0.13.dev0"}
{"input": ["cuda -keys=cuda,gpu -arch=sm_75 -max_num_threads=1024 -thread_warp_size=32", "batch_matmul.cuda", [["TENSOR", [1, 128, 768], "float32"], ["TENSOR", [1, 768, 768], "float32"], [1, 128, 768], "float32", 0, 0], {}], "config": {"index": 54, "code_hash": null, "entity": [["tile_y", "sp", [-1, 8, 4]], ["tile_x", "sp", [-1, 2, 1]], ["tile_k", "sp", [-1, 1]], ["auto_unroll_max_step", "ot", 8], ["unroll_explicit", "ot", 0]]}, "result": [[0.004425995173913044, 0.0044271512173913044, 0.004432243304347826], 0, 1.7791225910186768, 1688580488.4390905], "version": 0.2, "tvm_version": "0.13.dev0"}
{"input": ["cuda -keys=cuda,gpu -arch=sm_75 -max_num_threads=1024 -thread_warp_size=32", "batch_matmul.cuda", [["TENSOR", [1, 128, 768], "float32"], ["TENSOR", [1, 768, 768], "float32"], [1, 128, 768], "float32", 0, 0], {}], "config": {"index": 55, "code_hash": null, "entity": [["tile_y", "sp", [-1, 16, 4]], ["tile_x", "sp", [-1, 2, 1]], ["tile_k", "sp", [-1, 1]], ["auto_unroll_max_step", "ot", 8], ["unroll_explicit", "ot", 0]]}, "result": [[0.004026719959999999, 0.004027103880000001, 0.00402769924], 0, 1.7868976593017578, 1688580489.4361794], "version": 0.2, "tvm_version": "0.13.dev0"}
{"input": ["cuda -keys=cuda,gpu -arch=sm_75 -max_num_threads=1024 -thread_warp_size=32", "batch_matmul.cuda", [["TENSOR", [1, 128, 768], "float32"], ["TENSOR", [1, 768, 768], "float32"], [1, 128, 768], "float32", 0, 0], {}], "config": {"index": 56, "code_hash": null, "entity": [["tile_y", "sp", [-1, 32, 4]], ["tile_x", "sp", [-1, 2, 1]], ["tile_k", "sp", [-1, 1]], ["auto_unroll_max_step", "ot", 8], ["unroll_explicit", "ot", 0]]}, "result": [[0.003940273269230769, 0.003940273269230769, 0.003940667076923077], 0, 1.804093837738037, 1688580490.4414618], "version": 0.2, "tvm_version": "0.13.dev0"}
{"input": ["cuda -keys=cuda,gpu -arch=sm_75 -max_num_threads=1024 -thread_warp_size=32", "batch_matmul.cuda", [["TENSOR", [1, 128, 768], "float32"], ["TENSOR", [1, 768, 768], "float32"], [1, 128, 768], "float32", 0, 0], {}], "config": {"index": 57, "code_hash": null, "entity": [["tile_y", "sp", [-1, 1, 8]], ["tile_x", "sp", [-1, 2, 1]], ["tile_k", "sp", [-1, 1]], ["auto_unroll_max_step", "ot", 8], ["unroll_explicit", "ot", 0]]}, "result": [[0.0105102142, 0.010518521800000001, 0.010521167699999999], 0, 1.8306586742401123, 1688580491.4787345], "version": 0.2, "tvm_version": "0.13.dev0"}
{"input": ["cuda -keys=cuda,gpu -arch=sm_75 -max_num_threads=1024 -thread_warp_size=32", "batch_matmul.cuda", [["TENSOR", [1, 128, 768], "float32"], ["TENSOR", [1, 768, 768], "float32"], [1, 128, 768], "float32", 0, 0], {}], "config": {"index": 58, "code_hash": null, "entity": [["tile_y", "sp", [-1, 2, 8]], ["tile_x", "sp", [-1, 2, 1]], ["tile_k", "sp", [-1, 1]], ["auto_unroll_max_step", "ot", 8], ["unroll_explicit", "ot", 0]]}, "result": [[0.006725184066666667, 0.006726694199999999, 0.006727953066666667], 0, 1.7815115451812744, 1688580492.4884095], "version": 0.2, "tvm_version": "0.13.dev0"}
{"input": ["cuda -keys=cuda,gpu -arch=sm_75 -max_num_threads=1024 -thread_warp_size=32", "batch_matmul.cuda", [["TENSOR", [1, 128, 768], "float32"], ["TENSOR", [1, 768, 768], "float32"], [1, 128, 768], "float32", 0, 0], {}], "config": {"index": 59, "code_hash": null, "entity": [["tile_y", "sp", [-1, 4, 8]], ["tile_x", "sp", [-1, 2, 1]], ["tile_k", "sp", [-1, 1]], ["auto_unroll_max_step", "ot", 8], ["unroll_explicit", "ot", 0]]}, "result": [[0.00492197780952381, 0.004925441523809524, 0.004926902761904762], 0, 1.8227341175079346, 1688580493.5044684], "version": 0.2, "tvm_version": "0.13.dev0"}
{"input": ["cuda -keys=cuda,gpu -arch=sm_75 -max_num_threads=1024 -thread_warp_size=32", "batch_matmul.cuda", [["TENSOR", [1, 128, 768], "float32"], ["TENSOR", [1, 768, 768], "float32"], [1, 128, 768], "float32", 0, 0], {}], "config": {"index": 60, "code_hash": null, "entity": [["tile_y", "sp", [-1, 8, 8]], ["tile_x", "sp", [-1, 2, 1]], ["tile_k", "sp", [-1, 1]], ["auto_unroll_max_step", "ot", 8], ["unroll_explicit", "ot", 0]]}, "result": [[0.004510763971428571, 0.004512946428571429, 0.0045131325714285716], 0, 2.189687490463257, 1688580494.8918014], "version": 0.2, "tvm_version": "0.13.dev0"}
{"input": ["cuda -keys=cuda,gpu -arch=sm_75 -max_num_threads=1024 -thread_warp_size=32", "batch_matmul.cuda", [["TENSOR", [1, 128, 768], "float32"], ["TENSOR", [1, 768, 768], "float32"], [1, 128, 768], "float32", 0, 0], {}], "config": {"index": 61, "code_hash": null, "entity": [["tile_y", "sp", [-1, 16, 8]], ["tile_x", "sp", [-1, 2, 1]], ["tile_k", "sp", [-1, 1]], ["auto_unroll_max_step", "ot", 8], ["unroll_explicit", "ot", 0]]}, "result": [[0.004332571486486487, 0.004332887378378378, 0.004332933162162162], 0, 2.1847517490386963, 1688580496.28714], "version": 0.2, "tvm_version": "0.13.dev0"}
{"input": ["cuda -keys=cuda,gpu -arch=sm_75 -max_num_threads=1024 -thread_warp_size=32", "batch_matmul.cuda", [["TENSOR", [1, 128, 768], "float32"], ["TENSOR", [1, 768, 768], "float32"], [1, 128, 768], "float32", 0, 0], {}], "config": {"index": 62, "code_hash": null, "entity": [["tile_y", "sp", [-1, 1, 16]], ["tile_x", "sp", [-1, 2, 1]], ["tile_k", "sp", [-1, 1]], ["auto_unroll_max_step", "ot", 8], ["unroll_explicit", "ot", 0]]}, "result": [[0.008890879916666665, 0.00889123725, 0.008894770916666668], 0, 1.8338415622711182, 1688580497.331952], "version": 0.2, "tvm_version": "0.13.dev0"}
{"input": ["cuda -keys=cuda,gpu -arch=sm_75 -max_num_threads=1024 -thread_warp_size=32", "batch_matmul.cuda", [["TENSOR", [1, 128, 768], "float32"], ["TENSOR", [1, 768, 768], "float32"], [1, 128, 768], "float32", 0, 0], {}], "config": {"index": 63, "code_hash": null, "entity": [["tile_y", "sp", [-1, 2, 16]], ["tile_x", "sp", [-1, 2, 1]], ["tile_k", "sp", [-1, 1]], ["auto_unroll_max_step", "ot", 8], ["unroll_explicit", "ot", 0]]}, "result": [[0.00586698062962963, 0.005869275111111111, 0.005869940296296295], 0, 2.2081477642059326, 1688580498.722396], "version": 0.2, "tvm_version": "0.13.dev0"}
{"input": ["cuda -keys=cuda,gpu -arch=sm_75 -max_num_threads=1024 -thread_warp_size=32", "batch_matmul.cuda", [["TENSOR", [1, 128, 768], "float32"], ["TENSOR", [1, 768, 768], "float32"], [1, 128, 768], "float32", 0, 0], {}], "config": {"index": 64, "code_hash": null, "entity": [["tile_y", "sp", [-1, 4, 16]], ["tile_x", "sp", [-1, 2, 1]], ["tile_k", "sp", [-1, 1]], ["auto_unroll_max_step", "ot", 8], ["unroll_explicit", "ot", 0]]}, "result": [[0.0054791427894736846, 0.005481753263157895, 0.005482263631578947], 0, 1.8172001838684082, 1688580500.7615333], "version": 0.2, "tvm_version": "0.13.dev0"}
{"input": ["cuda -keys=cuda,gpu -arch=sm_75 -max_num_threads=1024 -thread_warp_size=32", "batch_matmul.cuda", [["TENSOR", [1, 128, 768], "float32"], ["TENSOR", [1, 768, 768], "float32"], [1, 128, 768], "float32", 0, 0], {}], "config": {"index": 65, "code_hash": null, "entity": [["tile_y", "sp", [-1, 8, 16]], ["tile_x", "sp", [-1, 2, 1]], ["tile_k", "sp", [-1, 1]], ["auto_unroll_max_step", "ot", 8], ["unroll_explicit", "ot", 0]]}, "result": [[0.005307318, 0.005309051105263158, 0.005309712842105263], 0, 1.8435733318328857, 1688580501.7638626], "version": 0.2, "tvm_version": "0.13.dev0"}
{"input": ["cuda -keys=cuda,gpu -arch=sm_75 -max_num_threads=1024 -thread_warp_size=32", "batch_matmul.cuda", [["TENSOR", [1, 128, 768], "float32"], ["TENSOR", [1, 768, 768], "float32"], [1, 128, 768], "float32", 0, 0], {}], "config": {"index": 66, "code_hash": null, "entity": [["tile_y", "sp", [-1, 1, 32]], ["tile_x", "sp", [-1, 2, 1]], ["tile_k", "sp", [-1, 1]], ["auto_unroll_max_step", "ot", 8], ["unroll_explicit", "ot", 0]]}, "result": [[0.008161910384615384, 0.008165976846153845, 0.008172544], 0, 1.8900706768035889, 1688580502.8215635], "version": 0.2, "tvm_version": "0.13.dev0"}
{"input": ["cuda -keys=cuda,gpu -arch=sm_75 -max_num_threads=1024 -thread_warp_size=32", "batch_matmul.cuda", [["TENSOR", [1, 128, 768], "float32"], ["TENSOR", [1, 768, 768], "float32"], [1, 128, 768], "float32", 0, 0], {}], "config": {"index": 67, "code_hash": null, "entity": [["tile_y", "sp", [-1, 2, 32]], ["tile_x", "sp", [-1, 2, 1]], ["tile_k", "sp", [-1, 1]], ["auto_unroll_max_step", "ot", 8], ["unroll_explicit", "ot", 0]]}, "result": [[0.007392198785714285, 0.007392640214285714, 0.007393718714285714], 0, 1.8579795360565186, 1688580503.841304], "version": 0.2, "tvm_version": "0.13.dev0"}
{"input": ["cuda -keys=cuda,gpu -arch=sm_75 -max_num_threads=1024 -thread_warp_size=32", "batch_matmul.cuda", [["TENSOR", [1, 128, 768], "float32"], ["TENSOR", [1, 768, 768], "float32"], [1, 128, 768], "float32", 0, 0], {}], "config": {"index": 68, "code_hash": null, "entity": [["tile_y", "sp", [-1, 4, 32]], ["tile_x", "sp", [-1, 2, 1]], ["tile_k", "sp", [-1, 1]], ["auto_unroll_max_step", "ot", 8], ["unroll_explicit", "ot", 0]]}, "result": [[0.007260018428571428, 0.0072610375, 0.0072638102857142854], 0, 1.8660991191864014, 1688580504.8533337], "version": 0.2, "tvm_version": "0.13.dev0"}
{"input": ["cuda -keys=cuda,gpu -arch=sm_75 -max_num_threads=1024 -thread_warp_size=32", "batch_matmul.cuda", [["TENSOR", [1, 128, 768], "float32"], ["TENSOR", [1, 768, 768], "float32"], [1, 128, 768], "float32", 0, 0], {}], "config": {"index": 69, "code_hash": null, "entity": [["tile_y", "sp", [-1, 1, 64]], ["tile_x", "sp", [-1, 2, 1]], ["tile_k", "sp", [-1, 1]], ["auto_unroll_max_step", "ot", 8], ["unroll_explicit", "ot", 0]]}, "result": [[0.007903950615384615, 0.007904236384615385, 0.007904644846153847], 0, 1.8847625255584717, 1688580505.8725333], "version": 0.2, "tvm_version": "0.13.dev0"}
{"input": ["cuda -keys=cuda,gpu -arch=sm_75 -max_num_threads=1024 -thread_warp_size=32", "batch_matmul.cuda", [["TENSOR", [1, 128, 768], "float32"], ["TENSOR", [1, 768, 768], "float32"], [1, 128, 768], "float32", 0, 0], {}], "config": {"index": 70, "code_hash": null, "entity": [["tile_y", "sp", [-1, 2, 64]], ["tile_x", "sp", [-1, 2, 1]], ["tile_k", "sp", [-1, 1]], ["auto_unroll_max_step", "ot", 8], ["unroll_explicit", "ot", 0]]}, "result": [[0.007269727928571429, 0.007270591714285715, 0.0072707405], 0, 1.9010236263275146, 1688580506.8950884], "version": 0.2, "tvm_version": "0.13.dev0"}
{"input": ["cuda -keys=cuda,gpu -arch=sm_75 -max_num_threads=1024 -thread_warp_size=32", "batch_matmul.cuda", [["TENSOR", [1, 128, 768], "float32"], ["TENSOR", [1, 768, 768], "float32"], [1, 128, 768], "float32", 0, 0], {}], "config": {"index": 71, "code_hash": null, "entity": [["tile_y", "sp", [-1, 1, 128]], ["tile_x", "sp", [-1, 2, 1]], ["tile_k", "sp", [-1, 1]], ["auto_unroll_max_step", "ot", 8], ["unroll_explicit", "ot", 0]]}, "result": [[0.007568479785714286, 0.007568530428571428, 0.0075702857857142865], 0, 1.9582698345184326, 1688580507.9319108], "version": 0.2, "tvm_version": "0.13.dev0"}
{"input": ["cuda -keys=cuda,gpu -arch=sm_75 -max_num_threads=1024 -thread_warp_size=32", "batch_matmul.cuda", [["TENSOR", [1, 128, 768], "float32"], ["TENSOR", [1, 768, 768], "float32"], [1, 128, 768], "float32", 0, 0], {}], "config": {"index": 72, "code_hash": null, "entity": [["tile_y", "sp", [-1, 1, 1]], ["tile_x", "sp", [-1, 3, 1]], ["tile_k", "sp", [-1, 1]], ["auto_unroll_max_step", "ot", 8], ["unroll_explicit", "ot", 0]]}, "result": [[0.0243802428, 0.024380773799999998, 0.0243920898], 0, 1.9627060890197754, 1688580509.102468], "version": 0.2, "tvm_version": "0.13.dev0"}
{"input": ["cuda -keys=cuda,gpu -arch=sm_75 -max_num_threads=1024 -thread_warp_size=32", "batch_matmul.cuda", [["TENSOR", [1, 128, 768], "float32"], ["TENSOR", [1, 768, 768], "float32"], [1, 128, 768], "float32", 0, 0], {}], "config": {"index": 73, "code_hash": null, "entity": [["tile_y", "sp", [-1, 2, 1]], ["tile_x", "sp", [-1, 3, 1]], ["tile_k", "sp", [-1, 1]], ["auto_unroll_max_step", "ot", 8], ["unroll_explicit", "ot", 0]]}, "result": [[0.013203559875, 0.0132060155, 0.013207012125], 0, 1.8709533214569092, 1688580510.1477244], "version": 0.2, "tvm_version": "0.13.dev0"}
{"input": ["cuda -keys=cuda,gpu -arch=sm_75 -max_num_threads=1024 -thread_warp_size=32", "batch_matmul.cuda", [["TENSOR", [1, 128, 768], "float32"], ["TENSOR", [1, 768, 768], "float32"], [1, 128, 768], "float32", 0, 0], {}], "config": {"index": 74, "code_hash": null, "entity": [["tile_y", "sp", [-1, 4, 1]], ["tile_x", "sp", [-1, 3, 1]], ["tile_k", "sp", [-1, 1]], ["auto_unroll_max_step", "ot", 8], ["unroll_explicit", "ot", 0]]}, "result": [[0.007644173714285715, 0.007647232000000001, 0.007651483214285715], 0, 1.857954740524292, 1688580511.2048416], "version": 0.2, "tvm_version": "0.13.dev0"}
{"input": ["cuda -keys=cuda,gpu -arch=sm_75 -max_num_threads=1024 -thread_warp_size=32", "batch_matmul.cuda", [["TENSOR", [1, 128, 768], "float32"], ["TENSOR", [1, 768, 768], "float32"], [1, 128, 768], "float32", 0, 0], {}], "config": {"index": 75, "code_hash": null, "entity": [["tile_y", "sp", [-1, 8, 1]], ["tile_x", "sp", [-1, 3, 1]], ["tile_k", "sp", [-1, 1]], ["auto_unroll_max_step", "ot", 8], ["unroll_explicit", "ot", 0]]}, "result": [[0.004863544238095238, 0.004865357523809523, 0.0048716067142857145], 0, 1.7881557941436768, 1688580512.210779], "version": 0.2, "tvm_version": "0.13.dev0"}
{"input": ["cuda -keys=cuda,gpu -arch=sm_75 -max_num_threads=1024 -thread_warp_size=32", "batch_matmul.cuda", [["TENSOR", [1, 128, 768], "float32"], ["TENSOR", [1, 768, 768], "float32"], [1, 128, 768], "float32", 0, 0], {}], "config": {"index": 76, "code_hash": null, "entity": [["tile_y", "sp", [-1, 16, 1]], ["tile_x", "sp", [-1, 3, 1]], ["tile_k", "sp", [-1, 1]], ["auto_unroll_max_step", "ot", 8], ["unroll_explicit", "ot", 0]]}, "result": [[0.00410837004, 0.0041086898799999995, 0.00411148284], 0, 1.841479778289795, 1688580513.2342281], "version": 0.2, "tvm_version": "0.13.dev0"}
{"input": ["cuda -keys=cuda,gpu -arch=sm_75 -max_num_threads=1024 -thread_warp_size=32", "batch_matmul.cuda", [["TENSOR", [1, 128, 768], "float32"], ["TENSOR", [1, 768, 768], "float32"], [1, 128, 768], "float32", 0, 0], {}], "config": {"index": 77, "code_hash": null, "entity": [["tile_y", "sp", [-1, 32, 1]], ["tile_x", "sp", [-1, 3, 1]], ["tile_k", "sp", [-1, 1]], ["auto_unroll_max_step", "ot", 8], ["unroll_explicit", "ot", 0]]}, "result": [[0.0034077802, 0.0034081387666666666, 0.003409233066666667], 0, 1.77950119972229, 1688580514.2412612], "version": 0.2, "tvm_version": "0.13.dev0"}
{"input": ["cuda -keys=cuda,gpu -arch=sm_75 -max_num_threads=1024 -thread_warp_size=32", "batch_matmul.cuda", [["TENSOR", [1, 128, 768], "float32"], ["TENSOR", [1, 768, 768], "float32"], [1, 128, 768], "float32", 0, 0], {}], "config": {"index": 78, "code_hash": null, "entity": [["tile_y", "sp", [-1, 64, 1]], ["tile_x", "sp", [-1, 3, 1]], ["tile_k", "sp", [-1, 1]], ["auto_unroll_max_step", "ot", 8], ["unroll_explicit", "ot", 0]]}, "result": [[0.0032407876129032257, 0.0032421975806451613, 0.0032438388709677417], 0, 1.7742929458618164, 1688580515.2325861], "version": 0.2, "tvm_version": "0.13.dev0"}
{"input": ["cuda -keys=cuda,gpu -arch=sm_75 -max_num_threads=1024 -thread_warp_size=32", "batch_matmul.cuda", [["TENSOR", [1, 128, 768], "float32"], ["TENSOR", [1, 768, 768], "float32"], [1, 128, 768], "float32", 0, 0], {}], "config": {"index": 79, "code_hash": null, "entity": [["tile_y", "sp", [-1, 128, 1]], ["tile_x", "sp", [-1, 3, 1]], ["tile_k", "sp", [-1, 1]], ["auto_unroll_max_step", "ot", 8], ["unroll_explicit", "ot", 0]]}, "result": [[0.003322197270833334, 0.0033238592083333334, 0.00332529925], 0, 2.1983840465545654, 1688580516.617853], "version": 0.2, "tvm_version": "0.13.dev0"}
{"input": ["cuda -keys=cuda,gpu -arch=sm_75 -max_num_threads=1024 -thread_warp_size=32", "batch_matmul.cuda", [["TENSOR", [1, 128, 768], "float32"], ["TENSOR", [1, 768, 768], "float32"], [1, 128, 768], "float32", 0, 0], {}], "config": {"index": 80, "code_hash": null, "entity": [["tile_y", "sp", [-1, 1, 2]], ["tile_x", "sp", [-1, 3, 1]], ["tile_k", "sp", [-1, 1]], ["auto_unroll_max_step", "ot", 8], ["unroll_explicit", "ot", 0]]}, "result": [[0.014267177181818181, 0.014268066363636365, 0.014274806545454545], 0, 2.157153367996216, 1688580518.9518604], "version": 0.2, "tvm_version": "0.13.dev0"}
{"input": ["cuda -keys=cuda,gpu -arch=sm_75 -max_num_threads=1024 -thread_warp_size=32", "batch_matmul.cuda", [["TENSOR", [1, 128, 768], "float32"], ["TENSOR", [1, 768, 768], "float32"], [1, 128, 768], "float32", 0, 0], {}], "config": {"index": 81, "code_hash": null, "entity": [["tile_y", "sp", [-1, 2, 2]], ["tile_x", "sp", [-1, 3, 1]], ["tile_k", "sp", [-1, 1]], ["auto_unroll_max_step", "ot", 8], ["unroll_explicit", "ot", 0]]}, "result": [[0.00815075446153846, 0.008155143076923076, 0.008159862153846155], 0, 1.7988429069519043, 1688580520.003499], "version": 0.2, "tvm_version": "0.13.dev0"}
{"input": ["cuda -keys=cuda,gpu -arch=sm_75 -max_num_threads=1024 -thread_warp_size=32", "batch_matmul.cuda", [["TENSOR", [1, 128, 768], "float32"], ["TENSOR", [1, 768, 768], "float32"], [1, 128, 768], "float32", 0, 0], {}], "config": {"index": 82, "code_hash": null, "entity": [["tile_y", "sp", [-1, 4, 2]], ["tile_x", "sp", [-1, 3, 1]], ["tile_k", "sp", [-1, 1]], ["auto_unroll_max_step", "ot", 8], ["unroll_explicit", "ot", 0]]}, "result": [[0.0051129585, 0.00511358715, 0.0051137870500000005], 0, 1.8194739818572998, 1688580521.0265298], "version": 0.2, "tvm_version": "0.13.dev0"}
{"input": ["cuda -keys=cuda,gpu -arch=sm_75 -max_num_threads=1024 -thread_warp_size=32", "batch_matmul.cuda", [["TENSOR", [1, 128, 768], "float32"], ["TENSOR", [1, 768, 768], "float32"], [1, 128, 768], "float32", 0, 0], {}], "config": {"index": 83, "code_hash": null, "entity": [["tile_y", "sp", [-1, 8, 2]], ["tile_x", "sp", [-1, 3, 1]], ["tile_k", "sp", [-1, 1]], ["auto_unroll_max_step", "ot", 8], ["unroll_explicit", "ot", 0]]}, "result": [[0.0037095325555555557, 0.0037112307777777778, 0.003711810333333333], 0, 1.7897896766662598, 1688580522.0310223], "version": 0.2, "tvm_version": "0.13.dev0"}
{"input": ["cuda -keys=cuda,gpu -arch=sm_75 -max_num_threads=1024 -thread_warp_size=32", "batch_matmul.cuda", [["TENSOR", [1, 128, 768], "float32"], ["TENSOR", [1, 768, 768], "float32"], [1, 128, 768], "float32", 0, 0], {}], "config": {"index": 84, "code_hash": null, "entity": [["tile_y", "sp", [-1, 16, 2]], ["tile_x", "sp", [-1, 3, 1]], ["tile_k", "sp", [-1, 1]], ["auto_unroll_max_step", "ot", 8], ["unroll_explicit", "ot", 0]]}, "result": [[0.003277658741935484, 0.0032805667741935486, 0.003282067548387097], 0, 1.795830488204956, 1688580523.0354276], "version": 0.2, "tvm_version": "0.13.dev0"}
{"input": ["cuda -keys=cuda,gpu -arch=sm_75 -max_num_threads=1024 -thread_warp_size=32", "batch_matmul.cuda", [["TENSOR", [1, 128, 768], "float32"], ["TENSOR", [1, 768, 768], "float32"], [1, 128, 768], "float32", 0, 0], {}], "config": {"index": 85, "code_hash": null, "entity": [["tile_y", "sp", [-1, 32, 2]], ["tile_x", "sp", [-1, 3, 1]], ["tile_k", "sp", [-1, 1]], ["auto_unroll_max_step", "ot", 8], ["unroll_explicit", "ot", 0]]}, "result": [[0.002934657145454545, 0.002934746745454545, 0.002934970090909091], 0, 2.2017982006073, 1688580524.4399683], "version": 0.2, "tvm_version": "0.13.dev0"}
{"input": ["cuda -keys=cuda,gpu -arch=sm_75 -max_num_threads=1024 -thread_warp_size=32", "batch_matmul.cuda", [["TENSOR", [1, 128, 768], "float32"], ["TENSOR", [1, 768, 768], "float32"], [1, 128, 768], "float32", 0, 0], {}], "config": {"index": 86, "code_hash": null, "entity": [["tile_y", "sp", [-1, 64, 2]], ["tile_x", "sp", [-1, 3, 1]], ["tile_k", "sp", [-1, 1]], ["auto_unroll_max_step", "ot", 8], ["unroll_explicit", "ot", 0]]}, "result": [[0.002893595428571429, 0.002894975057142857, 0.0028958088285714286], 0, 1.7998640537261963, 1688580525.4460063], "version": 0.2, "tvm_version": "0.13.dev0"}
{"input": ["cuda -keys=cuda,gpu -arch=sm_75 -max_num_threads=1024 -thread_warp_size=32", "batch_matmul.cuda", [["TENSOR", [1, 128, 768], "float32"], ["TENSOR", [1, 768, 768], "float32"], [1, 128, 768], "float32", 0, 0], {}], "config": {"index": 87, "code_hash": null, "entity": [["tile_y", "sp", [-1, 1, 4]], ["tile_x", "sp", [-1, 3, 1]], ["tile_k", "sp", [-1, 1]], ["auto_unroll_max_step", "ot", 8], ["unroll_explicit", "ot", 0]]}, "result": [[0.009243897818181817, 0.009244270272727272, 0.009244456818181819], 0, 1.7873430252075195, 1688580526.463982], "version": 0.2, "tvm_version": "0.13.dev0"}
{"input": ["cuda -keys=cuda,gpu -arch=sm_75 -max_num_threads=1024 -thread_warp_size=32", "batch_matmul.cuda", [["TENSOR", [1, 128, 768], "float32"], ["TENSOR", [1, 768, 768], "float32"], [1, 128, 768], "float32", 0, 0], {}], "config": {"index": 88, "code_hash": null, "entity": [["tile_y", "sp", [-1, 2, 4]], ["tile_x", "sp", [-1, 3, 1]], ["tile_k", "sp", [-1, 1]], ["auto_unroll_max_step", "ot", 8], ["unroll_explicit", "ot", 0]]}, "result": [[0.0056455022777777775, 0.005646236388888889, 0.005646593722222222], 0, 1.8056373596191406, 1688580527.4790914], "version": 0.2, "tvm_version": "0.13.dev0"}
{"input": ["cuda -keys=cuda,gpu -arch=sm_75 -max_num_threads=1024 -thread_warp_size=32", "batch_matmul.cuda", [["TENSOR", [1, 128, 768], "float32"], ["TENSOR", [1, 768, 768], "float32"], [1, 128, 768], "float32", 0, 0], {}], "config": {"index": 89, "code_hash": null, "entity": [["tile_y", "sp", [-1, 4, 4]], ["tile_x", "sp", [-1, 3, 1]], ["tile_k", "sp", [-1, 1]], ["auto_unroll_max_step", "ot", 8], ["unroll_explicit", "ot", 0]]}, "result": [[0.003968876153846154, 0.003969242961538461, 0.003971929961538462], 0, 1.7872400283813477, 1688580528.4922187], "version": 0.2, "tvm_version": "0.13.dev0"}
{"input": ["cuda -keys=cuda,gpu -arch=sm_75 -max_num_threads=1024 -thread_warp_size=32", "batch_matmul.cuda", [["TENSOR", [1, 128, 768], "float32"], ["TENSOR", [1, 768, 768], "float32"], [1, 128, 768], "float32", 0, 0], {}], "config": {"index": 90, "code_hash": null, "entity": [["tile_y", "sp", [-1, 8, 4]], ["tile_x", "sp", [-1, 3, 1]], ["tile_k", "sp", [-1, 1]], ["auto_unroll_max_step", "ot", 8], ["unroll_explicit", "ot", 0]]}, "result": [[0.003100569272727273, 0.003102573484848485, 0.0031047039393939393], 0, 1.815903902053833, 1688580529.5016816], "version": 0.2, "tvm_version": "0.13.dev0"}
{"input": ["cuda -keys=cuda,gpu -arch=sm_75 -max_num_threads=1024 -thread_warp_size=32", "batch_matmul.cuda", [["TENSOR", [1, 128, 768], "float32"], ["TENSOR", [1, 768, 768], "float32"], [1, 128, 768], "float32", 0, 0], {}], "config": {"index": 91, "code_hash": null, "entity": [["tile_y", "sp", [-1, 16, 4]], ["tile_x", "sp", [-1, 3, 1]], ["tile_k", "sp", [-1, 1]], ["auto_unroll_max_step", "ot", 8], ["unroll_explicit", "ot", 0]]}, "result": [[0.0030641056363636364, 0.003066296181818182, 0.0030702001212121214], 0, 1.78080415725708, 1688580530.4964592], "version": 0.2, "tvm_version": "0.13.dev0"}
{"input": ["cuda -keys=cuda,gpu -arch=sm_75 -max_num_threads=1024 -thread_warp_size=32", "batch_matmul.cuda", [["TENSOR", [1, 128, 768], "float32"], ["TENSOR", [1, 768, 768], "float32"], [1, 128, 768], "float32", 0, 0], {}], "config": {"index": 92, "code_hash": null, "entity": [["tile_y", "sp", [-1, 32, 4]], ["tile_x", "sp", [-1, 3, 1]], ["tile_k", "sp", [-1, 1]], ["auto_unroll_max_step", "ot", 8], ["unroll_explicit", "ot", 0]]}, "result": [[0.002969531323529412, 0.002971147176470588, 0.002972251205882353], 0, 1.7842836380004883, 1688580531.499404], "version": 0.2, "tvm_version": "0.13.dev0"}
{"input": ["cuda -keys=cuda,gpu -arch=sm_75 -max_num_threads=1024 -thread_warp_size=32", "batch_matmul.cuda", [["TENSOR", [1, 128, 768], "float32"], ["TENSOR", [1, 768, 768], "float32"], [1, 128, 768], "float32", 0, 0], {}], "config": {"index": 93, "code_hash": null, "entity": [["tile_y", "sp", [-1, 1, 8]], ["tile_x", "sp", [-1, 3, 1]], ["tile_k", "sp", [-1, 1]], ["auto_unroll_max_step", "ot", 8], ["unroll_explicit", "ot", 0]]}, "result": [[0.0070706985333333335, 0.0070715306, 0.007072318], 0, 1.7982478141784668, 1688580532.5309255], "version": 0.2, "tvm_version": "0.13.dev0"}
{"input": ["cuda -keys=cuda,gpu -arch=sm_75 -max_num_threads=1024 -thread_warp_size=32", "batch_matmul.cuda", [["TENSOR", [1, 128, 768], "float32"], ["TENSOR", [1, 768, 768], "float32"], [1, 128, 768], "float32", 0, 0], {}], "config": {"index": 94, "code_hash": null, "entity": [["tile_y", "sp", [-1, 2, 8]], ["tile_x", "sp", [-1, 3, 1]], ["tile_k", "sp", [-1, 1]], ["auto_unroll_max_step", "ot", 8], ["unroll_explicit", "ot", 0]]}, "result": [[0.004534773028571429, 0.0045375148, 0.004537566257142857], 0, 2.189229965209961, 1688580533.920611], "version": 0.2, "tvm_version": "0.13.dev0"}
{"input": ["cuda -keys=cuda,gpu -arch=sm_75 -max_num_threads=1024 -thread_warp_size=32", "batch_matmul.cuda", [["TENSOR", [1, 128, 768], "float32"], ["TENSOR", [1, 768, 768], "float32"], [1, 128, 768], "float32", 0, 0], {}], "config": {"index": 95, "code_hash": null, "entity": [["tile_y", "sp", [-1, 4, 8]], ["tile_x", "sp", [-1, 3, 1]], ["tile_k", "sp", [-1, 1]], ["auto_unroll_max_step", "ot", 8], ["unroll_explicit", "ot", 0]]}, "result": [[0.0034573064137931038, 0.0034583482068965515, 0.003458574206896552], 0, 1.7854382991790771, 1688580534.922887], "version": 0.2, "tvm_version": "0.13.dev0"}
{"input": ["cuda -keys=cuda,gpu -arch=sm_75 -max_num_threads=1024 -thread_warp_size=32", "batch_matmul.cuda", [["TENSOR", [1, 128, 768], "float32"], ["TENSOR", [1, 768, 768], "float32"], [1, 128, 768], "float32", 0, 0], {}], "config": {"index": 96, "code_hash": null, "entity": [["tile_y", "sp", [-1, 8, 8]], ["tile_x", "sp", [-1, 3, 1]], ["tile_k", "sp", [-1, 1]], ["auto_unroll_max_step", "ot", 8], ["unroll_explicit", "ot", 0]]}, "result": [[0.003138084875, 0.003138175, 0.0031418809687499996], 0, 1.7678332328796387, 1688580536.9333165], "version": 0.2, "tvm_version": "0.13.dev0"}
{"input": ["cuda -keys=cuda,gpu -arch=sm_75 -max_num_threads=1024 -thread_warp_size=32", "batch_matmul.cuda", [["TENSOR", [1, 128, 768], "float32"], ["TENSOR", [1, 768, 768], "float32"], [1, 128, 768], "float32", 0, 0], {}], "config": {"index": 97, "code_hash": null, "entity": [["tile_y", "sp", [-1, 16, 8]], ["tile_x", "sp", [-1, 3, 1]], ["tile_k", "sp", [-1, 1]], ["auto_unroll_max_step", "ot", 8], ["unroll_explicit", "ot", 0]]}, "result": [[0.003230147064516129, 0.003232117677419355, 0.0032338775806451613], 0, 1.7207720279693604, 1688580537.9241884], "version": 0.2, "tvm_version": "0.13.dev0"}
{"input": ["cuda -keys=cuda,gpu -arch=sm_75 -max_num_threads=1024 -thread_warp_size=32", "batch_matmul.cuda", [["TENSOR", [1, 128, 768], "float32"], ["TENSOR", [1, 768, 768], "float32"], [1, 128, 768], "float32", 0, 0], {}], "config": {"index": 98, "code_hash": null, "entity": [["tile_y", "sp", [-1, 1, 16]], ["tile_x", "sp", [-1, 3, 1]], ["tile_k", "sp", [-1, 1]], ["auto_unroll_max_step", "ot", 8], ["unroll_explicit", "ot", 0]]}, "result": [[0.0059903922941176475, 0.005996459470588236, 0.005998808411764706], 0, 1.830751657485962, 1688580538.9589207], "version": 0.2, "tvm_version": "0.13.dev0"}
{"input": ["cuda -keys=cuda,gpu -arch=sm_75 -max_num_threads=1024 -thread_warp_size=32", "batch_matmul.cuda", [["TENSOR", [1, 128, 768], "float32"], ["TENSOR", [1, 768, 768], "float32"], [1, 128, 768], "float32", 0, 0], {}], "config": {"index": 99, "code_hash": null, "entity": [["tile_y", "sp", [-1, 2, 16]], ["tile_x", "sp", [-1, 3, 1]], ["tile_k", "sp", [-1, 1]], ["auto_unroll_max_step", "ot", 8], ["unroll_explicit", "ot", 0]]}, "result": [[0.003985784125, 0.003986211, 0.00398638495], 0, 2.1790919303894043, 1688580540.3615537], "version": 0.2, "tvm_version": "0.13.dev0"}
{"input": ["cuda -keys=cuda,gpu -arch=sm_75 -max_num_threads=1024 -thread_warp_size=32", "batch_matmul.cuda", [["TENSOR", [1, 128, 768], "float32"], ["TENSOR", [1, 768, 768], "float32"], [1, 128, 768], "float32", 0, 0], {}], "config": {"index": 100, "code_hash": null, "entity": [["tile_y", "sp", [-1, 4, 16]], ["tile_x", "sp", [-1, 3, 1]], ["tile_k", "sp", [-1, 1]], ["auto_unroll_max_step", "ot", 8], ["unroll_explicit", "ot", 0]]}, "result": [[0.003861407923076923, 0.0038644837307692313, 0.003864654807692308], 0, 1.8157198429107666, 1688580541.3642907], "version": 0.2, "tvm_version": "0.13.dev0"}
{"input": ["cuda -keys=cuda,gpu -arch=sm_75 -max_num_threads=1024 -thread_warp_size=32", "batch_matmul.cuda", [["TENSOR", [1, 128, 768], "float32"], ["TENSOR", [1, 768, 768], "float32"], [1, 128, 768], "float32", 0, 0], {}], "config": {"index": 101, "code_hash": null, "entity": [["tile_y", "sp", [-1, 8, 16]], ["tile_x", "sp", [-1, 3, 1]], ["tile_k", "sp", [-1, 1]], ["auto_unroll_max_step", "ot", 8], ["unroll_explicit", "ot", 0]]}, "result": [[0.0038242013095238095, 0.003827892476190476, 0.0038380075952380945], 0, 2.2121224403381348, 1688580542.7714617], "version": 0.2, "tvm_version": "0.13.dev0"}
{"input": ["cuda -keys=cuda,gpu -arch=sm_75 -max_num_threads=1024 -thread_warp_size=32", "batch_matmul.cuda", [["TENSOR", [1, 128, 768], "float32"], ["TENSOR", [1, 768, 768], "float32"], [1, 128, 768], "float32", 0, 0], {}], "config": {"index": 102, "code_hash": null, "entity": [["tile_y", "sp", [-1, 1, 32]], ["tile_x", "sp", [-1, 3, 1]], ["tile_k", "sp", [-1, 1]], ["auto_unroll_max_step", "ot", 8], ["unroll_explicit", "ot", 0]]}, "result": [[0.005519368210526316, 0.0055193870526315785, 0.005519575368421053], 0, 1.8501193523406982, 1688580543.796193], "version": 0.2, "tvm_version": "0.13.dev0"}
{"input": ["cuda -keys=cuda,gpu -arch=sm_75 -max_num_threads=1024 -thread_warp_size=32", "batch_matmul.cuda", [["TENSOR", [1, 128, 768], "float32"], ["TENSOR", [1, 768, 768], "float32"], [1, 128, 768], "float32", 0, 0], {}], "config": {"index": 103, "code_hash": null, "entity": [["tile_y", "sp", [-1, 2, 32]], ["tile_x", "sp", [-1, 3, 1]], ["tile_k", "sp", [-1, 1]], ["auto_unroll_max_step", "ot", 8], ["unroll_explicit", "ot", 0]]}, "result": [[0.00505434415, 0.00505488315, 0.005057635100000001], 0, 1.877516508102417, 1688580544.810215], "version": 0.2, "tvm_version": "0.13.dev0"}
{"input": ["cuda -keys=cuda,gpu -arch=sm_75 -max_num_threads=1024 -thread_warp_size=32", "batch_matmul.cuda", [["TENSOR", [1, 128, 768], "float32"], ["TENSOR", [1, 768, 768], "float32"], [1, 128, 768], "float32", 0, 0], {}], "config": {"index": 104, "code_hash": null, "entity": [["tile_y", "sp", [-1, 4, 32]], ["tile_x", "sp", [-1, 3, 1]], ["tile_k", "sp", [-1, 1]], ["auto_unroll_max_step", "ot", 8], ["unroll_explicit", "ot", 0]]}, "result": [[0.005214867, 0.0052192543, 0.0052477455], 0, 1.8381166458129883, 1688580545.8366487], "version": 0.2, "tvm_version": "0.13.dev0"}
{"input": ["cuda -keys=cuda,gpu -arch=sm_75 -max_num_threads=1024 -thread_warp_size=32", "batch_matmul.cuda", [["TENSOR", [1, 128, 768], "float32"], ["TENSOR", [1, 768, 768], "float32"], [1, 128, 768], "float32", 0, 0], {}], "config": {"index": 105, "code_hash": null, "entity": [["tile_y", "sp", [-1, 1, 64]], ["tile_x", "sp", [-1, 3, 1]], ["tile_k", "sp", [-1, 1]], ["auto_unroll_max_step", "ot", 8], ["unroll_explicit", "ot", 0]]}, "result": [[0.005501240137931035, 0.005504035137931035, 0.005511553000000001], 0, 2.2443227767944336, 1688580547.24355], "version": 0.2, "tvm_version": "0.13.dev0"}
{"input": ["cuda -keys=cuda,gpu -arch=sm_75 -max_num_threads=1024 -thread_warp_size=32", "batch_matmul.cuda", [["TENSOR", [1, 128, 768], "float32"], ["TENSOR", [1, 768, 768], "float32"], [1, 128, 768], "float32", 0, 0], {}], "config": {"index": 106, "code_hash": null, "entity": [["tile_y", "sp", [-1, 2, 64]], ["tile_x", "sp", [-1, 3, 1]], ["tile_k", "sp", [-1, 1]], ["auto_unroll_max_step", "ot", 8], ["unroll_explicit", "ot", 0]]}, "result": [[0.0051439472, 0.0051551361, 0.005160571250000001], 0, 1.8523955345153809, 1688580548.2512953], "version": 0.2, "tvm_version": "0.13.dev0"}
