results/cuda_gtx1650/resnet-18/random/cpu.log_layer_0.log
{"input": ["cuda -keys=cuda,gpu -arch=sm_75 -max_num_threads=1024 -thread_warp_size=32", "conv2d_nchw.cuda", [["TENSOR", [1, 3, 224, 224], "float32"], ["TENSOR", [64, 3, 7, 7], "float32"], [2, 2], [3, 3, 3, 3], [1, 1], "float32"], {}], "config": {"index": 71998945, "code_hash": null, "entity": [["tile_f", "sp", [-1, 1, 32, 1]], ["tile_y", "sp", [-1, 14, 1, 2]], ["tile_x", "sp", [-1, 1, 4, 7]], ["tile_rc", "sp", [-1, 3]], ["tile_ry", "sp", [-1, 7]], ["tile_rx", "sp", [-1, 1]], ["auto_unroll_max_step", "ot", 1500], ["unroll_explicit", "ot", 1]]}, "result": [[0.001009735104166667, 0.0010102735069444447, 0.001169409415730337], 0, 6.784976243972778, 1678727686.6338775], "version": 0.2, "tvm_version": "0.10.0"}
{"input": ["cuda -keys=cuda,gpu -arch=sm_75 -max_num_threads=1024 -thread_warp_size=32", "conv2d_nchw.cuda", [["TENSOR", [1, 3, 224, 224], "float32"], ["TENSOR", [64, 3, 7, 7], "float32"], [2, 2], [3, 3, 3, 3], [1, 1], "float32"], {}], "config": {"index": 77479423, "code_hash": null, "entity": [["tile_f", "sp", [-1, 1, 2, 1]], ["tile_y", "sp", [-1, 2, 2, 2]], ["tile_x", "sp", [-1, 56, 1, 1]], ["tile_rc", "sp", [-1, 3]], ["tile_ry", "sp", [-1, 7]], ["tile_rx", "sp", [-1, 7]], ["auto_unroll_max_step", "ot", 1500], ["unroll_explicit", "ot", 1]]}, "result": [[0.011660384222222223, 0.011667345666666667, 0.011671964777777778], 0, 2.722235679626465, 1678727687.518375], "version": 0.2, "tvm_version": "0.10.0"}
{"input": ["cuda -keys=cuda,gpu -arch=sm_75 -max_num_threads=1024 -thread_warp_size=32", "conv2d_nchw.cuda", [["TENSOR", [1, 3, 224, 224], "float32"], ["TENSOR", [64, 3, 7, 7], "float32"], [2, 2], [3, 3, 3, 3], [1, 1], "float32"], {}], "config": {"index": 76127942, "code_hash": null, "entity": [["tile_f", "sp", [-1, 4, 1, 1]], ["tile_y", "sp", [-1, 4, 7, 2]], ["tile_x", "sp", [-1, 1, 14, 1]], ["tile_rc", "sp", [-1, 1]], ["tile_ry", "sp", [-1, 7]], ["tile_rx", "sp", [-1, 7]], ["auto_unroll_max_step", "ot", 1500], ["unroll_explicit", "ot", 1]]}, "result": [[0.0005080371911764706, 0.000508198568627451, 0.0005083167107843137], 0, 2.4838571548461914, 1678727688.4106154], "version": 0.2, "tvm_version": "0.10.0"}
{"input": ["cuda -keys=cuda,gpu -arch=sm_75 -max_num_threads=1024 -thread_warp_size=32", "conv2d_nchw.cuda", [["TENSOR", [1, 3, 224, 224], "float32"], ["TENSOR", [64, 3, 7, 7], "float32"], [2, 2], [3, 3, 3, 3], [1, 1], "float32"], {}], "config": {"index": 13916023, "code_hash": null, "entity": [["tile_f", "sp", [-1, 1, 4, 16]], ["tile_y", "sp", [-1, 2, 1, 2]], ["tile_x", "sp", [-1, 1, 7, 2]], ["tile_rc", "sp", [-1, 1]], ["tile_ry", "sp", [-1, 1]], ["tile_rx", "sp", [-1, 1]], ["auto_unroll_max_step", "ot", 512], ["unroll_explicit", "ot", 0]]}, "result": [[0.00044819502586206897, 0.000448504150862069, 0.0004487081379310345], 0, 1.5902864933013916, 1678727689.2818136], "version": 0.2, "tvm_version": "0.10.0"}
{"input": ["cuda -keys=cuda,gpu -arch=sm_75 -max_num_threads=1024 -thread_warp_size=32", "conv2d_nchw.cuda", [["TENSOR", [1, 3, 224, 224], "float32"], ["TENSOR", [64, 3, 7, 7], "float32"], [2, 2], [3, 3, 3, 3], [1, 1], "float32"], {}], "config": {"index": 56371173, "code_hash": null, "entity": [["tile_f", "sp", [-1, 32, 1, 2]], ["tile_y", "sp", [-1, 4, 7, 2]], ["tile_x", "sp", [-1, 1, 14, 1]], ["tile_rc", "sp", [-1, 1]], ["tile_ry", "sp", [-1, 7]], ["tile_rx", "sp", [-1, 1]], ["auto_unroll_max_step", "ot", 512], ["unroll_explicit", "ot", 1]]}, "result": [[0.004257515135135135, 0.004262426837837838, 0.004262884189189189], 0, 4.484286785125732, 1678727690.5628097], "version": 0.2, "tvm_version": "0.10.0"}
{"input": ["cuda -keys=cuda,gpu -arch=sm_75 -max_num_threads=1024 -thread_warp_size=32", "conv2d_nchw.cuda", [["TENSOR", [1, 3, 224, 224], "float32"], ["TENSOR", [64, 3, 7, 7], "float32"], [2, 2], [3, 3, 3, 3], [1, 1], "float32"], {}], "config": {"index": 62927369, "code_hash": null, "entity": [["tile_f", "sp", [-1, 2, 1, 2]], ["tile_y", "sp", [-1, 1, 4, 28]], ["tile_x", "sp", [-1, 2, 8, 1]], ["tile_rc", "sp", [-1, 1]], ["tile_ry", "sp", [-1, 7]], ["tile_rx", "sp", [-1, 7]], ["auto_unroll_max_step", "ot", 512], ["unroll_explicit", "ot", 1]]}, "result": [[0.0014602406338028169, 0.0014602857746478873, 0.0014614508169014085], 0, 7.61671781539917, 1678727691.419917], "version": 0.2, "tvm_version": "0.10.0"}
{"input": ["cuda -keys=cuda,gpu -arch=sm_75 -max_num_threads=1024 -thread_warp_size=32", "conv2d_nchw.cuda", [["TENSOR", [1, 3, 224, 224], "float32"], ["TENSOR", [64, 3, 7, 7], "float32"], [2, 2], [3, 3, 3, 3], [1, 1], "float32"], {}], "config": {"index": 33332620, "code_hash": null, "entity": [["tile_f", "sp", [-1, 4, 1, 16]], ["tile_y", "sp", [-1, 7, 2, 2]], ["tile_x", "sp", [-1, 2, 14, 1]], ["tile_rc", "sp", [-1, 1]], ["tile_ry", "sp", [-1, 1]], ["tile_rx", "sp", [-1, 7]], ["auto_unroll_max_step", "ot", 1500], ["unroll_explicit", "ot", 0]]}, "result": [[0.018693632125, 0.018701648625, 0.018705663625], 0, 2.7713351249694824, 1678727702.7147388], "version": 0.2, "tvm_version": "0.10.0"}
{"input": ["cuda -keys=cuda,gpu -arch=sm_75 -max_num_threads=1024 -thread_warp_size=32", "conv2d_nchw.cuda", [["TENSOR", [1, 3, 224, 224], "float32"], ["TENSOR", [64, 3, 7, 7], "float32"], [2, 2], [3, 3, 3, 3], [1, 1], "float32"], {}], "config": {"index": 6746227, "code_hash": null, "entity": [["tile_f", "sp", [-1, 2, 8, 1]], ["tile_y", "sp", [-1, 1, 28, 4]], ["tile_x", "sp", [-1, 7, 2, 1]], ["tile_rc", "sp", [-1, 1]], ["tile_ry", "sp", [-1, 1]], ["tile_rx", "sp", [-1, 7]], ["auto_unroll_max_step", "ot", 0], ["unroll_explicit", "ot", 0]]}, "result": [[0.0010759411170212765, 0.0010786601063829788, 0.0010844799574468084], 0, 1.3945813179016113, 1678727703.5819001], "version": 0.2, "tvm_version": "0.10.0"}
{"input": ["cuda -keys=cuda,gpu -arch=sm_75 -max_num_threads=1024 -thread_warp_size=32", "conv2d_nchw.cuda", [["TENSOR", [1, 3, 224, 224], "float32"], ["TENSOR", [64, 3, 7, 7], "float32"], [2, 2], [3, 3, 3, 3], [1, 1], "float32"], {}], "config": {"index": 65499694, "code_hash": null, "entity": [["tile_f", "sp", [-1, 1, 16, 1]], ["tile_y", "sp", [-1, 1, 2, 7]], ["tile_x", "sp", [-1, 2, 1, 8]], ["tile_rc", "sp", [-1, 3]], ["tile_ry", "sp", [-1, 7]], ["tile_rx", "sp", [-1, 7]], ["auto_unroll_max_step", "ot", 512], ["unroll_explicit", "ot", 1]]}, "result": [[0.0005988874550898204, 0.0005989299880239521, 0.0005990719820359282], 0, 6.108600616455078, 1678727704.416543], "version": 0.2, "tvm_version": "0.10.0"}
{"input": ["cuda -keys=cuda,gpu -arch=sm_75 -max_num_threads=1024 -thread_warp_size=32", "conv2d_nchw.cuda", [["TENSOR", [1, 3, 224, 224], "float32"], ["TENSOR", [64, 3, 7, 7], "float32"], [2, 2], [3, 3, 3, 3], [1, 1], "float32"], {}], "config": {"index": 46569966, "code_hash": null, "entity": [["tile_f", "sp", [-1, 4, 1, 2]], ["tile_y", "sp", [-1, 8, 1, 1]], ["tile_x", "sp", [-1, 2, 28, 1]], ["tile_rc", "sp", [-1, 1]], ["tile_ry", "sp", [-1, 1]], ["tile_rx", "sp", [-1, 7]], ["auto_unroll_max_step", "ot", 0], ["unroll_explicit", "ot", 1]]}, "result": [[0.0006953871586206896, 0.0006953962068965517, 0.0006956349862068965], 0, 1.7130181789398193, 1678727705.2487824], "version": 0.2, "tvm_version": "0.10.0"}
{"input": ["cuda -keys=cuda,gpu -arch=sm_75 -max_num_threads=1024 -thread_warp_size=32", "conv2d_nchw.cuda", [["TENSOR", [1, 3, 224, 224], "float32"], ["TENSOR", [64, 3, 7, 7], "float32"], [2, 2], [3, 3, 3, 3], [1, 1], "float32"], {}], "config": {"index": 74618057, "code_hash": null, "entity": [["tile_f", "sp", [-1, 16, 4, 1]], ["tile_y", "sp", [-1, 1, 2, 1]], ["tile_x", "sp", [-1, 1, 1, 2]], ["tile_rc", "sp", [-1, 3]], ["tile_ry", "sp", [-1, 1]], ["tile_rx", "sp", [-1, 7]], ["auto_unroll_max_step", "ot", 1500], ["unroll_explicit", "ot", 1]]}, "result": [[0.0028942336857142857, 0.0028944091714285716, 0.002894481314285714], 0, 2.706794261932373, 1678727706.1101592], "version": 0.2, "tvm_version": "0.10.0"}
{"input": ["cuda -keys=cuda,gpu -arch=sm_75 -max_num_threads=1024 -thread_warp_size=32", "conv2d_nchw.cuda", [["TENSOR", [1, 3, 224, 224], "float32"], ["TENSOR", [64, 3, 7, 7], "float32"], [2, 2], [3, 3, 3, 3], [1, 1], "float32"], {}], "config": {"index": 75045413, "code_hash": null, "entity": [["tile_f", "sp", [-1, 2, 1, 8]], ["tile_y", "sp", [-1, 14, 2, 2]], ["tile_x", "sp", [-1, 1, 2, 4]], ["tile_rc", "sp", [-1, 3]], ["tile_ry", "sp", [-1, 1]], ["tile_rx", "sp", [-1, 7]], ["auto_unroll_max_step", "ot", 1500], ["unroll_explicit", "ot", 1]]}, "result": [[0.031279552249999995, 0.03166665625, 0.0318802165], 0, 5.943543434143066, 1678727707.2177453], "version": 0.2, "tvm_version": "0.10.0"}
{"input": ["cuda -keys=cuda,gpu -arch=sm_75 -max_num_threads=1024 -thread_warp_size=32", "conv2d_nchw.cuda", [["TENSOR", [1, 3, 224, 224], "float32"], ["TENSOR", [64, 3, 7, 7], "float32"], [2, 2], [3, 3, 3, 3], [1, 1], "float32"], {}], "config": {"index": 50684263, "code_hash": null, "entity": [["tile_f", "sp", [-1, 1, 2, 1]], ["tile_y", "sp", [-1, 1, 4, 14]], ["tile_x", "sp", [-1, 2, 1, 8]], ["tile_rc", "sp", [-1, 1]], ["tile_ry", "sp", [-1, 7]], ["tile_rx", "sp", [-1, 7]], ["auto_unroll_max_step", "ot", 0], ["unroll_explicit", "ot", 1]]}, "result": [[0.0054725795263157895, 0.0054772226315789475, 0.005489832421052631], 0, 1.9492599964141846, 1678727708.1247008], "version": 0.2, "tvm_version": "0.10.0"}
{"input": ["cuda -keys=cuda,gpu -arch=sm_75 -max_num_threads=1024 -thread_warp_size=32", "conv2d_nchw.cuda", [["TENSOR", [1, 3, 224, 224], "float32"], ["TENSOR", [64, 3, 7, 7], "float32"], [2, 2], [3, 3, 3, 3], [1, 1], "float32"], {}], "config": {"index": 556269, "code_hash": null, "entity": [["tile_f", "sp", [-1, 8, 8, 1]], ["tile_y", "sp", [-1, 1, 56, 1]], ["tile_x", "sp", [-1, 4, 1, 2]], ["tile_rc", "sp", [-1, 1]], ["tile_ry", "sp", [-1, 1]], ["tile_rx", "sp", [-1, 1]], ["auto_unroll_max_step", "ot", 0], ["unroll_explicit", "ot", 0]]}, "result": [[0.0009301751870967742, 0.0009308170387096775, 0.0010457716770833332], 0, 1.6287825107574463, 1678727719.305587], "version": 0.2, "tvm_version": "0.10.0"}
{"input": ["cuda -keys=cuda,gpu -arch=sm_75 -max_num_threads=1024 -thread_warp_size=32", "conv2d_nchw.cuda", [["TENSOR", [1, 3, 224, 224], "float32"], ["TENSOR", [64, 3, 7, 7], "float32"], [2, 2], [3, 3, 3, 3], [1, 1], "float32"], {}], "config": {"index": 62777521, "code_hash": null, "entity": [["tile_f", "sp", [-1, 8, 2, 2]], ["tile_y", "sp", [-1, 7, 8, 1]], ["tile_x", "sp", [-1, 1, 4, 1]], ["tile_rc", "sp", [-1, 1]], ["tile_ry", "sp", [-1, 7]], ["tile_rx", "sp", [-1, 7]], ["auto_unroll_max_step", "ot", 512], ["unroll_explicit", "ot", 1]]}, "result": [[0.0001860494259259259, 0.0001862044425925926, 0.00018644763703703704], 0, 2.287576675415039, 1678727720.1911802], "version": 0.2, "tvm_version": "0.10.0"}
{"input": ["cuda -keys=cuda,gpu -arch=sm_75 -max_num_threads=1024 -thread_warp_size=32", "conv2d_nchw.cuda", [["TENSOR", [1, 3, 224, 224], "float32"], ["TENSOR", [64, 3, 7, 7], "float32"], [2, 2], [3, 3, 3, 3], [1, 1], "float32"], {}], "config": {"index": 17308447, "code_hash": null, "entity": [["tile_f", "sp", [-1, 1, 4, 16]], ["tile_y", "sp", [-1, 1, 2, 8]], ["tile_x", "sp", [-1, 4, 14, 2]], ["tile_rc", "sp", [-1, 1]], ["tile_ry", "sp", [-1, 7]], ["tile_rx", "sp", [-1, 1]], ["auto_unroll_max_step", "ot", 512], ["unroll_explicit", "ot", 0]]}, "result": [[0.006754935666666666, 0.0067590738666666655, 0.0067628691999999995], 0, 1.869359016418457, 1678727721.0920815], "version": 0.2, "tvm_version": "0.10.0"}
{"input": ["cuda -keys=cuda,gpu -arch=sm_75 -max_num_threads=1024 -thread_warp_size=32", "conv2d_nchw.cuda", [["TENSOR", [1, 3, 224, 224], "float32"], ["TENSOR", [64, 3, 7, 7], "float32"], [2, 2], [3, 3, 3, 3], [1, 1], "float32"], {}], "config": {"index": 20398970, "code_hash": null, "entity": [["tile_f", "sp", [-1, 1, 1, 16]], ["tile_y", "sp", [-1, 14, 2, 4]], ["tile_x", "sp", [-1, 2, 2, 2]], ["tile_rc", "sp", [-1, 1]], ["tile_ry", "sp", [-1, 1]], ["tile_rx", "sp", [-1, 7]], ["auto_unroll_max_step", "ot", 512], ["unroll_explicit", "ot", 0]]}, "result": [[0.123152275, 0.123401184, 0.1235044325], 0, 3.4333057403564453, 1678727722.8446612], "version": 0.2, "tvm_version": "0.10.0"}
{"input": ["cuda -keys=cuda,gpu -arch=sm_75 -max_num_threads=1024 -thread_warp_size=32", "conv2d_nchw.cuda", [["TENSOR", [1, 3, 224, 224], "float32"], ["TENSOR", [64, 3, 7, 7], "float32"], [2, 2], [3, 3, 3, 3], [1, 1], "float32"], {}], "config": {"index": 27950933, "code_hash": null, "entity": [["tile_f", "sp", [-1, 16, 4, 1]], ["tile_y", "sp", [-1, 2, 1, 8]], ["tile_x", "sp", [-1, 1, 1, 56]], ["tile_rc", "sp", [-1, 1]], ["tile_ry", "sp", [-1, 1]], ["tile_rx", "sp", [-1, 1]], ["auto_unroll_max_step", "ot", 1500], ["unroll_explicit", "ot", 0]]}, "result": [[0.0755179515, 0.0755481565, 0.076744705], 0, 2.396862030029297, 1678727724.025508], "version": 0.2, "tvm_version": "0.10.0"}
{"input": ["cuda -keys=cuda,gpu -arch=sm_75 -max_num_threads=1024 -thread_warp_size=32", "conv2d_nchw.cuda", [["TENSOR", [1, 3, 224, 224], "float32"], ["TENSOR", [64, 3, 7, 7], "float32"], [2, 2], [3, 3, 3, 3], [1, 1], "float32"], {}], "config": {"index": 56096161, "code_hash": null, "entity": [["tile_f", "sp", [-1, 8, 2, 2]], ["tile_y", "sp", [-1, 2, 2, 1]], ["tile_x", "sp", [-1, 1, 2, 1]], ["tile_rc", "sp", [-1, 1]], ["tile_ry", "sp", [-1, 7]], ["tile_rx", "sp", [-1, 1]], ["auto_unroll_max_step", "ot", 512], ["unroll_explicit", "ot", 1]]}, "result": [[0.0015204281515151514, 0.0015205256060606062, 0.0015207951818181817], 0, 1.8455297946929932, 1678727724.9065385], "version": 0.2, "tvm_version": "0.10.0"}
{"input": ["cuda -keys=cuda,gpu -arch=sm_75 -max_num_threads=1024 -thread_warp_size=32", "conv2d_nchw.cuda", [["TENSOR", [1, 3, 224, 224], "float32"], ["TENSOR", [64, 3, 7, 7], "float32"], [2, 2], [3, 3, 3, 3], [1, 1], "float32"], {}], "config": {"index": 36999491, "code_hash": null, "entity": [["tile_f", "sp", [-1, 16, 2, 1]], ["tile_y", "sp", [-1, 2, 8, 1]], ["tile_x", "sp", [-1, 8, 7, 2]], ["tile_rc", "sp", [-1, 1]], ["tile_ry", "sp", [-1, 7]], ["tile_rx", "sp", [-1, 7]], ["auto_unroll_max_step", "ot", 1500], ["unroll_explicit", "ot", 0]]}, "result": [[0.004534365086956521, 0.004534895173913043, 0.004535141652173913], 0, 2.7348713874816895, 1678727725.836558], "version": 0.2, "tvm_version": "0.10.0"}
{"input": ["cuda -keys=cuda,gpu -arch=sm_75 -max_num_threads=1024 -thread_warp_size=32", "conv2d_nchw.cuda", [["TENSOR", [1, 3, 224, 224], "float32"], ["TENSOR", [64, 3, 7, 7], "float32"], [2, 2], [3, 3, 3, 3], [1, 1], "float32"], {}], "config": {"index": 3899933, "code_hash": null, "entity": [["tile_f", "sp", [-1, 2, 1, 8]], ["tile_y", "sp", [-1, 1, 7, 4]], ["tile_x", "sp", [-1, 28, 1, 2]], ["tile_rc", "sp", [-1, 1]], ["tile_ry", "sp", [-1, 7]], ["tile_rx", "sp", [-1, 1]], ["auto_unroll_max_step", "ot", 0], ["unroll_explicit", "ot", 0]]}, "result": [[0.035304138, 0.03543447366666667, 0.035470708000000004], 0, 2.376476526260376, 1678727726.8376846], "version": 0.2, "tvm_version": "0.10.0"}
{"input": ["cuda -keys=cuda,gpu -arch=sm_75 -max_num_threads=1024 -thread_warp_size=32", "conv2d_nchw.cuda", [["TENSOR", [1, 3, 224, 224], "float32"], ["TENSOR", [64, 3, 7, 7], "float32"], [2, 2], [3, 3, 3, 3], [1, 1], "float32"], {}], "config": {"index": 16705802, "code_hash": null, "entity": [["tile_f", "sp", [-1, 2, 1, 4]], ["tile_y", "sp", [-1, 7, 1, 4]], ["tile_x", "sp", [-1, 4, 4, 1]], ["tile_rc", "sp", [-1, 1]], ["tile_ry", "sp", [-1, 7]], ["tile_rx", "sp", [-1, 1]], ["auto_unroll_max_step", "ot", 512], ["unroll_explicit", "ot", 0]]}, "result": [[0.0810591505, 0.08109178900000001, 0.0811550365], 0, 8.215385675430298, 1678727738.1952877], "version": 0.2, "tvm_version": "0.10.0"}
{"input": ["cuda -keys=cuda,gpu -arch=sm_75 -max_num_threads=1024 -thread_warp_size=32", "conv2d_nchw.cuda", [["TENSOR", [1, 3, 224, 224], "float32"], ["TENSOR", [64, 3, 7, 7], "float32"], [2, 2], [3, 3, 3, 3], [1, 1], "float32"], {}], "config": {"index": 56684749, "code_hash": null, "entity": [["tile_f", "sp", [-1, 8, 2, 2]], ["tile_y", "sp", [-1, 1, 4, 1]], ["tile_x", "sp", [-1, 2, 4, 2]], ["tile_rc", "sp", [-1, 1]], ["tile_ry", "sp", [-1, 7]], ["tile_rx", "sp", [-1, 1]], ["auto_unroll_max_step", "ot", 512], ["unroll_explicit", "ot", 1]]}, "result": [[0.0002484057751937984, 0.0002484507240310078, 0.0002484557395348837], 0, 2.432013750076294, 1678727739.470555], "version": 0.2, "tvm_version": "0.10.0"}
{"input": ["cuda -keys=cuda,gpu -arch=sm_75 -max_num_threads=1024 -thread_warp_size=32", "conv2d_nchw.cuda", [["TENSOR", [1, 3, 224, 224], "float32"], ["TENSOR", [64, 3, 7, 7], "float32"], [2, 2], [3, 3, 3, 3], [1, 1], "float32"], {}], "config": {"index": 40754245, "code_hash": null, "entity": [["tile_f", "sp", [-1, 1, 1, 4]], ["tile_y", "sp", [-1, 1, 14, 2]], ["tile_x", "sp", [-1, 1, 8, 7]], ["tile_rc", "sp", [-1, 1]], ["tile_ry", "sp", [-1, 1]], ["tile_rx", "sp", [-1, 1]], ["auto_unroll_max_step", "ot", 0], ["unroll_explicit", "ot", 1]]}, "result": [[0.009552660090909092, 0.009560133454545454, 0.009562429181818183], 0, 1.413785457611084, 1678727740.3984249], "version": 0.2, "tvm_version": "0.10.0"}
{"input": ["cuda -keys=cuda,gpu -arch=sm_75 -max_num_threads=1024 -thread_warp_size=32", "conv2d_nchw.cuda", [["TENSOR", [1, 3, 224, 224], "float32"], ["TENSOR", [64, 3, 7, 7], "float32"], [2, 2], [3, 3, 3, 3], [1, 1], "float32"], {}], "config": {"index": 21792964, "code_hash": null, "entity": [["tile_f", "sp", [-1, 16, 1, 1]], ["tile_y", "sp", [-1, 4, 4, 1]], ["tile_x", "sp", [-1, 1, 14, 1]], ["tile_rc", "sp", [-1, 3]], ["tile_ry", "sp", [-1, 1]], ["tile_rx", "sp", [-1, 7]], ["auto_unroll_max_step", "ot", 512], ["unroll_explicit", "ot", 0]]}, "result": [[0.000982369588235294, 0.000982442362745098, 0.0009828454509803921], 0, 2.08827805519104, 1678727741.2930934], "version": 0.2, "tvm_version": "0.10.0"}
{"input": ["cuda -keys=cuda,gpu -arch=sm_75 -max_num_threads=1024 -thread_warp_size=32", "conv2d_nchw.cuda", [["TENSOR", [1, 3, 224, 224], "float32"], ["TENSOR", [64, 3, 7, 7], "float32"], [2, 2], [3, 3, 3, 3], [1, 1], "float32"], {}], "config": {"index": 27503938, "code_hash": null, "entity": [["tile_f", "sp", [-1, 4, 2, 8]], ["tile_y", "sp", [-1, 1, 16, 7]], ["tile_x", "sp", [-1, 1, 2, 7]], ["tile_rc", "sp", [-1, 1]], ["tile_ry", "sp", [-1, 1]], ["tile_rx", "sp", [-1, 1]], ["auto_unroll_max_step", "ot", 1500], ["unroll_explicit", "ot", 0]]}, "result": [[0.04059654466666667, 0.040614880666666665, 0.04062176], 0, 2.8721702098846436, 1678727742.4045112], "version": 0.2, "tvm_version": "0.10.0"}
{"input": ["cuda -keys=cuda,gpu -arch=sm_75 -max_num_threads=1024 -thread_warp_size=32", "conv2d_nchw.cuda", [["TENSOR", [1, 3, 224, 224], "float32"], ["TENSOR", [64, 3, 7, 7], "float32"], [2, 2], [3, 3, 3, 3], [1, 1], "float32"], {}], "config": {"index": 1597439, "code_hash": null, "entity": [["tile_f", "sp", [-1, 16, 2, 1]], ["tile_y", "sp", [-1, 1, 1, 14]], ["tile_x", "sp", [-1, 1, 4, 28]], ["tile_rc", "sp", [-1, 1]], ["tile_ry", "sp", [-1, 1]], ["tile_rx", "sp", [-1, 1]], ["auto_unroll_max_step", "ot", 0], ["unroll_explicit", "ot", 0]]}, "result": [[0.057275470499999995, 0.0575027195, 0.057591808], 0, 2.1950857639312744, 1678727743.394989], "version": 0.2, "tvm_version": "0.10.0"}
{"input": ["cuda -keys=cuda,gpu -arch=sm_75 -max_num_threads=1024 -thread_warp_size=32", "conv2d_nchw.cuda", [["TENSOR", [1, 3, 224, 224], "float32"], ["TENSOR", [64, 3, 7, 7], "float32"], [2, 2], [3, 3, 3, 3], [1, 1], "float32"], {}], "config": {"index": 49204694, "code_hash": null, "entity": [["tile_f", "sp", [-1, 2, 4, 1]], ["tile_y", "sp", [-1, 1, 2, 1]], ["tile_x", "sp", [-1, 1, 4, 14]], ["tile_rc", "sp", [-1, 3]], ["tile_ry", "sp", [-1, 1]], ["tile_rx", "sp", [-1, 7]], ["auto_unroll_max_step", "ot", 0], ["unroll_explicit", "ot", 1]]}, "result": [[0.0006516082315789475, 0.0006516377052631579, 0.0006536794947368421], 0, 1.8082249164581299, 1678727754.6381269], "version": 0.2, "tvm_version": "0.10.0"}
{"input": ["cuda -keys=cuda,gpu -arch=sm_75 -max_num_threads=1024 -thread_warp_size=32", "conv2d_nchw.cuda", [["TENSOR", [1, 3, 224, 224], "float32"], ["TENSOR", [64, 3, 7, 7], "float32"], [2, 2], [3, 3, 3, 3], [1, 1], "float32"], {}], "config": {"index": 76842037, "code_hash": null, "entity": [["tile_f", "sp", [-1, 1, 4, 1]], ["tile_y", "sp", [-1, 4, 7, 1]], ["tile_x", "sp", [-1, 2, 1, 7]], ["tile_rc", "sp", [-1, 1]], ["tile_ry", "sp", [-1, 7]], ["tile_rx", "sp", [-1, 7]], ["auto_unroll_max_step", "ot", 1500], ["unroll_explicit", "ot", 1]]}, "result": [[0.0004023321604010025, 0.0004023687969924812, 0.00040263986215538847], 0, 3.6865530014038086, 1678727755.8834462], "version": 0.2, "tvm_version": "0.10.0"}
{"input": ["cuda -keys=cuda,gpu -arch=sm_75 -max_num_threads=1024 -thread_warp_size=32", "conv2d_nchw.cuda", [["TENSOR", [1, 3, 224, 224], "float32"], ["TENSOR", [64, 3, 7, 7], "float32"], [2, 2], [3, 3, 3, 3], [1, 1], "float32"], {}], "config": {"index": 36244030, "code_hash": null, "entity": [["tile_f", "sp", [-1, 1, 16, 2]], ["tile_y", "sp", [-1, 1, 1, 56]], ["tile_x", "sp", [-1, 2, 1, 1]], ["tile_rc", "sp", [-1, 1]], ["tile_ry", "sp", [-1, 7]], ["tile_rx", "sp", [-1, 7]], ["auto_unroll_max_step", "ot", 1500], ["unroll_explicit", "ot", 0]]}, "result": [[0.0036861724642857146, 0.003686665107142857, 0.003687772464285714], 0, 2.4248952865600586, 1678727756.8055322], "version": 0.2, "tvm_version": "0.10.0"}
{"input": ["cuda -keys=cuda,gpu -arch=sm_75 -max_num_threads=1024 -thread_warp_size=32", "conv2d_nchw.cuda", [["TENSOR", [1, 3, 224, 224], "float32"], ["TENSOR", [64, 3, 7, 7], "float32"], [2, 2], [3, 3, 3, 3], [1, 1], "float32"], {}], "config": {"index": 49941009, "code_hash": null, "entity": [["tile_f", "sp", [-1, 2, 2, 8]], ["tile_y", "sp", [-1, 4, 1, 7]], ["tile_x", "sp", [-1, 2, 1, 2]], ["tile_rc", "sp", [-1, 1]], ["tile_ry", "sp", [-1, 7]], ["tile_rx", "sp", [-1, 7]], ["auto_unroll_max_step", "ot", 0], ["unroll_explicit", "ot", 1]]}, "result": [[0.075062675, 0.075086845, 0.075174545], 0, 2.923962354660034, 1678727758.0158694], "version": 0.2, "tvm_version": "0.10.0"}
{"input": ["cuda -keys=cuda,gpu -arch=sm_75 -max_num_threads=1024 -thread_warp_size=32", "conv2d_nchw.cuda", [["TENSOR", [1, 3, 224, 224], "float32"], ["TENSOR", [64, 3, 7, 7], "float32"], [2, 2], [3, 3, 3, 3], [1, 1], "float32"], {}], "config": {"index": 18000942, "code_hash": null, "entity": [["tile_f", "sp", [-1, 2, 2, 16]], ["tile_y", "sp", [-1, 8, 1, 7]], ["tile_x", "sp", [-1, 1, 1, 28]], ["tile_rc", "sp", [-1, 1]], ["tile_ry", "sp", [-1, 7]], ["tile_rx", "sp", [-1, 1]], ["auto_unroll_max_step", "ot", 512], ["unroll_explicit", "ot", 0]]}, "result": [[0.05491024, 0.054943584000000004, 0.054952335], 0, 4.643643379211426, 1678727759.0098243], "version": 0.2, "tvm_version": "0.10.0"}
{"input": ["cuda -keys=cuda,gpu -arch=sm_75 -max_num_threads=1024 -thread_warp_size=32", "conv2d_nchw.cuda", [["TENSOR", [1, 3, 224, 224], "float32"], ["TENSOR", [64, 3, 7, 7], "float32"], [2, 2], [3, 3, 3, 3], [1, 1], "float32"], {}], "config": {"index": 42963820, "code_hash": null, "entity": [["tile_f", "sp", [-1, 16, 1, 1]], ["tile_y", "sp", [-1, 2, 2, 2]], ["tile_x", "sp", [-1, 7, 2, 1]], ["tile_rc", "sp", [-1, 1]], ["tile_ry", "sp", [-1, 7]], ["tile_rx", "sp", [-1, 1]], ["auto_unroll_max_step", "ot", 0], ["unroll_explicit", "ot", 1]]}, "result": [[0.063099632, 0.063109886, 0.0631490895], 0, 2.58137583732605, 1678727760.1056294], "version": 0.2, "tvm_version": "0.10.0"}
{"input": ["cuda -keys=cuda,gpu -arch=sm_75 -max_num_threads=1024 -thread_warp_size=32", "conv2d_nchw.cuda", [["TENSOR", [1, 3, 224, 224], "float32"], ["TENSOR", [64, 3, 7, 7], "float32"], [2, 2], [3, 3, 3, 3], [1, 1], "float32"], {}], "config": {"index": 36751404, "code_hash": null, "entity": [["tile_f", "sp", [-1, 4, 4, 4]], ["tile_y", "sp", [-1, 28, 2, 1]], ["tile_x", "sp", [-1, 1, 1, 2]], ["tile_rc", "sp", [-1, 1]], ["tile_ry", "sp", [-1, 7]], ["tile_rx", "sp", [-1, 7]], ["auto_unroll_max_step", "ot", 1500], ["unroll_explicit", "ot", 0]]}, "result": [[0.019495283125, 0.019500480625, 0.0204693496], 0, 5.5744781494140625, 1678727766.9537199], "version": 0.2, "tvm_version": "0.10.0"}
{"input": ["cuda -keys=cuda,gpu -arch=sm_75 -max_num_threads=1024 -thread_warp_size=32", "conv2d_nchw.cuda", [["TENSOR", [1, 3, 224, 224], "float32"], ["TENSOR", [64, 3, 7, 7], "float32"], [2, 2], [3, 3, 3, 3], [1, 1], "float32"], {}], "config": {"index": 49549787, "code_hash": null, "entity": [["tile_f", "sp", [-1, 2, 2, 2]], ["tile_y", "sp", [-1, 28, 2, 2]], ["tile_x", "sp", [-1, 7, 2, 1]], ["tile_rc", "sp", [-1, 1]], ["tile_ry", "sp", [-1, 7]], ["tile_rx", "sp", [-1, 7]], ["auto_unroll_max_step", "ot", 0], ["unroll_explicit", "ot", 1]]}, "result": [[0.032247543249999996, 0.03224843975, 0.03227942275], 0, 5.859848260879517, 1678727768.0541961], "version": 0.2, "tvm_version": "0.10.0"}
{"input": ["cuda -keys=cuda,gpu -arch=sm_75 -max_num_threads=1024 -thread_warp_size=32", "conv2d_nchw.cuda", [["TENSOR", [1, 3, 224, 224], "float32"], ["TENSOR", [64, 3, 7, 7], "float32"], [2, 2], [3, 3, 3, 3], [1, 1], "float32"], {}], "config": {"index": 62866034, "code_hash": null, "entity": [["tile_f", "sp", [-1, 2, 4, 1]], ["tile_y", "sp", [-1, 1, 8, 7]], ["tile_x", "sp", [-1, 2, 7, 1]], ["tile_rc", "sp", [-1, 1]], ["tile_ry", "sp", [-1, 7]], ["tile_rx", "sp", [-1, 7]], ["auto_unroll_max_step", "ot", 512], ["unroll_explicit", "ot", 1]]}, "result": [[0.000452289268907563, 0.00045234231372549025, 0.0004523563753501401], 0, 2.5846121311187744, 1678727769.294585], "version": 0.2, "tvm_version": "0.10.0"}
{"input": ["cuda -keys=cuda,gpu -arch=sm_75 -max_num_threads=1024 -thread_warp_size=32", "conv2d_nchw.cuda", [["TENSOR", [1, 3, 224, 224], "float32"], ["TENSOR", [64, 3, 7, 7], "float32"], [2, 2], [3, 3, 3, 3], [1, 1], "float32"], {}], "config": {"index": 10472927, "code_hash": null, "entity": [["tile_f", "sp", [-1, 2, 4, 4]], ["tile_y", "sp", [-1, 4, 1, 4]], ["tile_x", "sp", [-1, 14, 1, 2]], ["tile_rc", "sp", [-1, 1]], ["tile_ry", "sp", [-1, 7]], ["tile_rx", "sp", [-1, 7]], ["auto_unroll_max_step", "ot", 0], ["unroll_explicit", "ot", 0]]}, "result": [[0.0650771025, 0.065077423, 0.0653995665], 0, 3.9561731815338135, 1678727770.4021635], "version": 0.2, "tvm_version": "0.10.0"}
{"input": ["cuda -keys=cuda,gpu -arch=sm_75 -max_num_threads=1024 -thread_warp_size=32", "conv2d_nchw.cuda", [["TENSOR", [1, 3, 224, 224], "float32"], ["TENSOR", [64, 3, 7, 7], "float32"], [2, 2], [3, 3, 3, 3], [1, 1], "float32"], {}], "config": {"index": 53138111, "code_hash": null, "entity": [["tile_f", "sp", [-1, 2, 16, 2]], ["tile_y", "sp", [-1, 2, 1, 4]], ["tile_x", "sp", [-1, 7, 16, 1]], ["tile_rc", "sp", [-1, 1]], ["tile_ry", "sp", [-1, 1]], ["tile_rx", "sp", [-1, 1]], ["auto_unroll_max_step", "ot", 512], ["unroll_explicit", "ot", 1]]}, "result": [[0.0010011209799999999, 0.00100134269, 0.00100169731], 0, 2.2283852100372314, 1678727771.2618358], "version": 0.2, "tvm_version": "0.10.0"}
{"input": ["cuda -keys=cuda,gpu -arch=sm_75 -max_num_threads=1024 -thread_warp_size=32", "conv2d_nchw.cuda", [["TENSOR", [1, 3, 224, 224], "float32"], ["TENSOR", [64, 3, 7, 7], "float32"], [2, 2], [3, 3, 3, 3], [1, 1], "float32"], {}], "config": {"index": 57118435, "code_hash": null, "entity": [["tile_f", "sp", [-1, 8, 1, 2]], ["tile_y", "sp", [-1, 2, 1, 1]], ["tile_x", "sp", [-1, 16, 1, 7]], ["tile_rc", "sp", [-1, 1]], ["tile_ry", "sp", [-1, 7]], ["tile_rx", "sp", [-1, 1]], ["auto_unroll_max_step", "ot", 512], ["unroll_explicit", "ot", 1]]}, "result": [[0.27515405249999997, 0.275171356, 0.27522180150000003], 0, 8.042073249816895, 1678727774.639318], "version": 0.2, "tvm_version": "0.10.0"}
{"input": ["cuda -keys=cuda,gpu -arch=sm_75 -max_num_threads=1024 -thread_warp_size=32", "conv2d_nchw.cuda", [["TENSOR", [1, 3, 224, 224], "float32"], ["TENSOR", [64, 3, 7, 7], "float32"], [2, 2], [3, 3, 3, 3], [1, 1], "float32"], {}], "config": {"index": 65165030, "code_hash": null, "entity": [["tile_f", "sp", [-1, 2, 4, 1]], ["tile_y", "sp", [-1, 2, 14, 1]], ["tile_x", "sp", [-1, 1, 2, 4]], ["tile_rc", "sp", [-1, 3]], ["tile_ry", "sp", [-1, 7]], ["tile_rx", "sp", [-1, 7]], ["auto_unroll_max_step", "ot", 512], ["unroll_explicit", "ot", 1]]}, "result": [[0.0003547063818984548, 0.00035471089624724064, 0.0003547526975717439], 0, 2.7564187049865723, 1678727775.9008791], "version": 0.2, "tvm_version": "0.10.0"}
{"input": ["cuda -keys=cuda,gpu -arch=sm_75 -max_num_threads=1024 -thread_warp_size=32", "conv2d_nchw.cuda", [["TENSOR", [1, 3, 224, 224], "float32"], ["TENSOR", [64, 3, 7, 7], "float32"], [2, 2], [3, 3, 3, 3], [1, 1], "float32"], {}], "config": {"index": 14492730, "code_hash": null, "entity": [["tile_f", "sp", [-1, 8, 4, 2]], ["tile_y", "sp", [-1, 56, 1, 2]], ["tile_x", "sp", [-1, 1, 2, 8]], ["tile_rc", "sp", [-1, 1]], ["tile_ry", "sp", [-1, 1]], ["tile_rx", "sp", [-1, 1]], ["auto_unroll_max_step", "ot", 512], ["unroll_explicit", "ot", 0]]}, "result": [[0.0632950895, 0.0638213765, 0.063826942], 0, 5.415330171585083, 1678727776.953531], "version": 0.2, "tvm_version": "0.10.0"}
{"input": ["cuda -keys=cuda,gpu -arch=sm_75 -max_num_threads=1024 -thread_warp_size=32", "conv2d_nchw.cuda", [["TENSOR", [1, 3, 224, 224], "float32"], ["TENSOR", [64, 3, 7, 7], "float32"], [2, 2], [3, 3, 3, 3], [1, 1], "float32"], {}], "config": {"index": 18172552, "code_hash": null, "entity": [["tile_f", "sp", [-1, 4, 1, 16]], ["tile_y", "sp", [-1, 1, 28, 1]], ["tile_x", "sp", [-1, 14, 1, 1]], ["tile_rc", "sp", [-1, 3]], ["tile_ry", "sp", [-1, 7]], ["tile_rx", "sp", [-1, 1]], ["auto_unroll_max_step", "ot", 512], ["unroll_explicit", "ot", 0]]}, "result": [[0.011889778111111112, 0.011899221555555556, 0.011908835444444444], 0, 2.559439182281494, 1678727777.9203584], "version": 0.2, "tvm_version": "0.10.0"}
{"input": ["cuda -keys=cuda,gpu -arch=sm_75 -max_num_threads=1024 -thread_warp_size=32", "conv2d_nchw.cuda", [["TENSOR", [1, 3, 224, 224], "float32"], ["TENSOR", [64, 3, 7, 7], "float32"], [2, 2], [3, 3, 3, 3], [1, 1], "float32"], {}], "config": {"index": 44102917, "code_hash": null, "entity": [["tile_f", "sp", [-1, 1, 8, 4]], ["tile_y", "sp", [-1, 2, 14, 1]], ["tile_x", "sp", [-1, 7, 1, 8]], ["tile_rc", "sp", [-1, 1]], ["tile_ry", "sp", [-1, 7]], ["tile_rx", "sp", [-1, 1]], ["auto_unroll_max_step", "ot", 0], ["unroll_explicit", "ot", 1]]}, "result": [[0.006410078666666667, 0.006415425583333333, 0.006415707875], 0, 2.212001323699951, 1678727789.265637], "version": 0.2, "tvm_version": "0.10.0"}
{"input": ["cuda -keys=cuda,gpu -arch=sm_75 -max_num_threads=1024 -thread_warp_size=32", "conv2d_nchw.cuda", [["TENSOR", [1, 3, 224, 224], "float32"], ["TENSOR", [64, 3, 7, 7], "float32"], [2, 2], [3, 3, 3, 3], [1, 1], "float32"], {}], "config": {"index": 40672183, "code_hash": null, "entity": [["tile_f", "sp", [-1, 2, 2, 4]], ["tile_y", "sp", [-1, 1, 28, 2]], ["tile_x", "sp", [-1, 1, 2, 7]], ["tile_rc", "sp", [-1, 1]], ["tile_ry", "sp", [-1, 1]], ["tile_rx", "sp", [-1, 1]], ["auto_unroll_max_step", "ot", 0], ["unroll_explicit", "ot", 1]]}, "result": [[0.0029220864285714287, 0.002922671485714286, 0.002930625914285714], 0, 1.408623218536377, 1678727790.1738286], "version": 0.2, "tvm_version": "0.10.0"}
{"input": ["cuda -keys=cuda,gpu -arch=sm_75 -max_num_threads=1024 -thread_warp_size=32", "conv2d_nchw.cuda", [["TENSOR", [1, 3, 224, 224], "float32"], ["TENSOR", [64, 3, 7, 7], "float32"], [2, 2], [3, 3, 3, 3], [1, 1], "float32"], {}], "config": {"index": 25010072, "code_hash": null, "entity": [["tile_f", "sp", [-1, 1, 1, 32]], ["tile_y", "sp", [-1, 1, 2, 7]], ["tile_x", "sp", [-1, 4, 7, 1]], ["tile_rc", "sp", [-1, 3]], ["tile_ry", "sp", [-1, 7]], ["tile_rx", "sp", [-1, 7]], ["auto_unroll_max_step", "ot", 512], ["unroll_explicit", "ot", 0]]}, "result": [[0.012437294, 0.012438869, 0.012441109444444444], 0, 4.264666795730591, 1678727791.1565776], "version": 0.2, "tvm_version": "0.10.0"}
{"input": ["cuda -keys=cuda,gpu -arch=sm_75 -max_num_threads=1024 -thread_warp_size=32", "conv2d_nchw.cuda", [["TENSOR", [1, 3, 224, 224], "float32"], ["TENSOR", [64, 3, 7, 7], "float32"], [2, 2], [3, 3, 3, 3], [1, 1], "float32"], {}], "config": {"index": 41872822, "code_hash": null, "entity": [["tile_f", "sp", [-1, 1, 2, 32]], ["tile_y", "sp", [-1, 1, 4, 4]], ["tile_x", "sp", [-1, 2, 4, 2]], ["tile_rc", "sp", [-1, 3]], ["tile_ry", "sp", [-1, 1]], ["tile_rx", "sp", [-1, 1]], ["auto_unroll_max_step", "ot", 0], ["unroll_explicit", "ot", 1]]}, "result": [[0.0063943361875, 0.006402822, 0.006404213875], 0, 1.603996753692627, 1678727792.081992], "version": 0.2, "tvm_version": "0.10.0"}
{"input": ["cuda -keys=cuda,gpu -arch=sm_75 -max_num_threads=1024 -thread_warp_size=32", "conv2d_nchw.cuda", [["TENSOR", [1, 3, 224, 224], "float32"], ["TENSOR", [64, 3, 7, 7], "float32"], [2, 2], [3, 3, 3, 3], [1, 1], "float32"], {}], "config": {"index": 56291679, "code_hash": null, "entity": [["tile_f", "sp", [-1, 8, 1, 1]], ["tile_y", "sp", [-1, 2, 2, 7]], ["tile_x", "sp", [-1, 4, 7, 1]], ["tile_rc", "sp", [-1, 1]], ["tile_ry", "sp", [-1, 7]], ["tile_rx", "sp", [-1, 1]], ["auto_unroll_max_step", "ot", 512], ["unroll_explicit", "ot", 1]]}, "result": [[0.012432818000000002, 0.012436593777777777, 0.01245584011111111], 0, 10.789497375488281, 1678727793.0613468], "version": 0.2, "tvm_version": "0.10.0"}
{"input": ["cuda -keys=cuda,gpu -arch=sm_75 -max_num_threads=1024 -thread_warp_size=32", "conv2d_nchw.cuda", [["TENSOR", [1, 3, 224, 224], "float32"], ["TENSOR", [64, 3, 7, 7], "float32"], [2, 2], [3, 3, 3, 3], [1, 1], "float32"], {}], "config": {"index": 34242801, "code_hash": null, "entity": [["tile_f", "sp", [-1, 32, 1, 2]], ["tile_y", "sp", [-1, 1, 2, 8]], ["tile_x", "sp", [-1, 14, 1, 8]], ["tile_rc", "sp", [-1, 1]], ["tile_ry", "sp", [-1, 1]], ["tile_rx", "sp", [-1, 7]], ["auto_unroll_max_step", "ot", 1500], ["unroll_explicit", "ot", 0]]}, "result": [[0.12693401299999998, 0.12818202199999998, 0.1281905055], 0, 5.418533086776733, 1678727794.8018785], "version": 0.2, "tvm_version": "0.10.0"}
{"input": ["cuda -keys=cuda,gpu -arch=sm_75 -max_num_threads=1024 -thread_warp_size=32", "conv2d_nchw.cuda", [["TENSOR", [1, 3, 224, 224], "float32"], ["TENSOR", [64, 3, 7, 7], "float32"], [2, 2], [3, 3, 3, 3], [1, 1], "float32"], {}], "config": {"index": 28005405, "code_hash": null, "entity": [["tile_f", "sp", [-1, 8, 2, 4]], ["tile_y", "sp", [-1, 14, 2, 2]], ["tile_x", "sp", [-1, 2, 1, 1]], ["tile_rc", "sp", [-1, 3]], ["tile_ry", "sp", [-1, 1]], ["tile_rx", "sp", [-1, 1]], ["auto_unroll_max_step", "ot", 1500], ["unroll_explicit", "ot", 0]]}, "result": [[0.10080677, 0.1008220135, 0.1008261105], 0, 9.959945440292358, 1678727796.281729], "version": 0.2, "tvm_version": "0.10.0"}
{"input": ["cuda -keys=cuda,gpu -arch=sm_75 -max_num_threads=1024 -thread_warp_size=32", "conv2d_nchw.cuda", [["TENSOR", [1, 3, 224, 224], "float32"], ["TENSOR", [64, 3, 7, 7], "float32"], [2, 2], [3, 3, 3, 3], [1, 1], "float32"], {}], "config": {"index": 34510290, "code_hash": null, "entity": [["tile_f", "sp", [-1, 4, 1, 8]], ["tile_y", "sp", [-1, 2, 1, 4]], ["tile_x", "sp", [-1, 2, 2, 28]], ["tile_rc", "sp", [-1, 1]], ["tile_ry", "sp", [-1, 1]], ["tile_rx", "sp", [-1, 7]], ["auto_unroll_max_step", "ot", 1500], ["unroll_explicit", "ot", 0]]}, "result": [[0.0658984985, 0.06613505550000001, 0.06622386899999999], 0, 4.60764217376709, 1678727797.3718681], "version": 0.2, "tvm_version": "0.10.0"}
{"input": ["cuda -keys=cuda,gpu -arch=sm_75 -max_num_threads=1024 -thread_warp_size=32", "conv2d_nchw.cuda", [["TENSOR", [1, 3, 224, 224], "float32"], ["TENSOR", [64, 3, 7, 7], "float32"], [2, 2], [3, 3, 3, 3], [1, 1], "float32"], {}], "config": {"index": 67360146, "code_hash": null, "entity": [["tile_f", "sp", [-1, 8, 4, 2]], ["tile_y", "sp", [-1, 1, 8, 14]], ["tile_x", "sp", [-1, 1, 1, 16]], ["tile_rc", "sp", [-1, 1]], ["tile_ry", "sp", [-1, 1]], ["tile_rx", "sp", [-1, 1]], ["auto_unroll_max_step", "ot", 1500], ["unroll_explicit", "ot", 1]]}, "result": [[0.008597383352941176, 0.00860034088235294, 0.00919968890909091], 0, 8.038798332214355, 1678727808.6056101], "version": 0.2, "tvm_version": "0.10.0"}
{"input": ["cuda -keys=cuda,gpu -arch=sm_75 -max_num_threads=1024 -thread_warp_size=32", "conv2d_nchw.cuda", [["TENSOR", [1, 3, 224, 224], "float32"], ["TENSOR", [64, 3, 7, 7], "float32"], [2, 2], [3, 3, 3, 3], [1, 1], "float32"], {}], "config": {"index": 39634034, "code_hash": null, "entity": [["tile_f", "sp", [-1, 2, 8, 4]], ["tile_y", "sp", [-1, 1, 14, 1]], ["tile_x", "sp", [-1, 1, 2, 1]], ["tile_rc", "sp", [-1, 1]], ["tile_ry", "sp", [-1, 1]], ["tile_rx", "sp", [-1, 1]], ["auto_unroll_max_step", "ot", 0], ["unroll_explicit", "ot", 1]]}, "result": [[0.0008662699193548387, 0.0008664361236559139, 0.0008665248870967742], 0, 1.6755642890930176, 1678727809.8962898], "version": 0.2, "tvm_version": "0.10.0"}
{"input": ["cuda -keys=cuda,gpu -arch=sm_75 -max_num_threads=1024 -thread_warp_size=32", "conv2d_nchw.cuda", [["TENSOR", [1, 3, 224, 224], "float32"], ["TENSOR", [64, 3, 7, 7], "float32"], [2, 2], [3, 3, 3, 3], [1, 1], "float32"], {}], "config": {"index": 53779385, "code_hash": null, "entity": [["tile_f", "sp", [-1, 2, 1, 8]], ["tile_y", "sp", [-1, 1, 2, 1]], ["tile_x", "sp", [-1, 1, 1, 7]], ["tile_rc", "sp", [-1, 1]], ["tile_ry", "sp", [-1, 1]], ["tile_rx", "sp", [-1, 1]], ["auto_unroll_max_step", "ot", 512], ["unroll_explicit", "ot", 1]]}, "result": [[0.0039034265000000004, 0.0039044333076923075, 0.003904681846153846], 0, 1.8472480773925781, 1678727810.8071957], "version": 0.2, "tvm_version": "0.10.0"}
{"input": ["cuda -keys=cuda,gpu -arch=sm_75 -max_num_threads=1024 -thread_warp_size=32", "conv2d_nchw.cuda", [["TENSOR", [1, 3, 224, 224], "float32"], ["TENSOR", [64, 3, 7, 7], "float32"], [2, 2], [3, 3, 3, 3], [1, 1], "float32"], {}], "config": {"index": 23619421, "code_hash": null, "entity": [["tile_f", "sp", [-1, 1, 1, 4]], ["tile_y", "sp", [-1, 1, 7, 2]], ["tile_x", "sp", [-1, 7, 1, 2]], ["tile_rc", "sp", [-1, 1]], ["tile_ry", "sp", [-1, 7]], ["tile_rx", "sp", [-1, 7]], ["auto_unroll_max_step", "ot", 512], ["unroll_explicit", "ot", 0]]}, "result": [[0.0017755812105263156, 0.001775687894736842, 0.001776152754385965], 0, 2.4718985557556152, 1678727811.7034132], "version": 0.2, "tvm_version": "0.10.0"}
{"input": ["cuda -keys=cuda,gpu -arch=sm_75 -max_num_threads=1024 -thread_warp_size=32", "conv2d_nchw.cuda", [["TENSOR", [1, 3, 224, 224], "float32"], ["TENSOR", [64, 3, 7, 7], "float32"], [2, 2], [3, 3, 3, 3], [1, 1], "float32"], {}], "config": {"index": 5652021, "code_hash": null, "entity": [["tile_f", "sp", [-1, 2, 1, 32]], ["tile_y", "sp", [-1, 1, 4, 4]], ["tile_x", "sp", [-1, 2, 4, 2]], ["tile_rc", "sp", [-1, 3]], ["tile_ry", "sp", [-1, 7]], ["tile_rx", "sp", [-1, 1]], ["auto_unroll_max_step", "ot", 0], ["unroll_explicit", "ot", 0]]}, "result": [[0.007005789318181818, 0.0070120724545454545, 0.007018870954545456], 0, 2.3609397411346436, 1678727822.562833], "version": 0.2, "tvm_version": "0.10.0"}
{"input": ["cuda -keys=cuda,gpu -arch=sm_75 -max_num_threads=1024 -thread_warp_size=32", "conv2d_nchw.cuda", [["TENSOR", [1, 3, 224, 224], "float32"], ["TENSOR", [64, 3, 7, 7], "float32"], [2, 2], [3, 3, 3, 3], [1, 1], "float32"], {}], "config": {"index": 69185197, "code_hash": null, "entity": [["tile_f", "sp", [-1, 1, 32, 1]], ["tile_y", "sp", [-1, 7, 2, 1]], ["tile_x", "sp", [-1, 7, 1, 1]], ["tile_rc", "sp", [-1, 1]], ["tile_ry", "sp", [-1, 7]], ["tile_rx", "sp", [-1, 1]], ["auto_unroll_max_step", "ot", 1500], ["unroll_explicit", "ot", 1]]}, "result": [[0.0004130098, 0.0004130888285714286, 0.0004132858857142857], 0, 2.8378639221191406, 1678727823.8597233], "version": 0.2, "tvm_version": "0.10.0"}
{"input": ["cuda -keys=cuda,gpu -arch=sm_75 -max_num_threads=1024 -thread_warp_size=32", "conv2d_nchw.cuda", [["TENSOR", [1, 3, 224, 224], "float32"], ["TENSOR", [64, 3, 7, 7], "float32"], [2, 2], [3, 3, 3, 3], [1, 1], "float32"], {}], "config": {"index": 44244257, "code_hash": null, "entity": [["tile_f", "sp", [-1, 2, 1, 2]], ["tile_y", "sp", [-1, 1, 16, 1]], ["tile_x", "sp", [-1, 2, 2, 14]], ["tile_rc", "sp", [-1, 1]], ["tile_ry", "sp", [-1, 7]], ["tile_rx", "sp", [-1, 1]], ["auto_unroll_max_step", "ot", 0], ["unroll_explicit", "ot", 1]]}, "result": [[0.0038149238518518517, 0.0038204907777777777, 0.0038266109629629627], 0, 1.7257912158966064, 1678727824.7750866], "version": 0.2, "tvm_version": "0.10.0"}
{"input": ["cuda -keys=cuda,gpu -arch=sm_75 -max_num_threads=1024 -thread_warp_size=32", "conv2d_nchw.cuda", [["TENSOR", [1, 3, 224, 224], "float32"], ["TENSOR", [64, 3, 7, 7], "float32"], [2, 2], [3, 3, 3, 3], [1, 1], "float32"], {}], "config": {"index": 13814819, "code_hash": null, "entity": [["tile_f", "sp", [-1, 16, 2, 1]], ["tile_y", "sp", [-1, 1, 4, 7]], ["tile_x", "sp", [-1, 2, 2, 2]], ["tile_rc", "sp", [-1, 1]], ["tile_ry", "sp", [-1, 1]], ["tile_rx", "sp", [-1, 1]], ["auto_unroll_max_step", "ot", 512], ["unroll_explicit", "ot", 0]]}, "result": [[0.010110934399999999, 0.0101236961, 0.0101384193], 0, 2.8629002571105957, 1678727825.6982105], "version": 0.2, "tvm_version": "0.10.0"}
{"input": ["cuda -keys=cuda,gpu -arch=sm_75 -max_num_threads=1024 -thread_warp_size=32", "conv2d_nchw.cuda", [["TENSOR", [1, 3, 224, 224], "float32"], ["TENSOR", [64, 3, 7, 7], "float32"], [2, 2], [3, 3, 3, 3], [1, 1], "float32"], {}], "config": {"index": 31580433, "code_hash": null, "entity": [["tile_f", "sp", [-1, 4, 8, 2]], ["tile_y", "sp", [-1, 14, 2, 2]], ["tile_x", "sp", [-1, 2, 7, 1]], ["tile_rc", "sp", [-1, 3]], ["tile_ry", "sp", [-1, 7]], ["tile_rx", "sp", [-1, 1]], ["auto_unroll_max_step", "ot", 1500], ["unroll_explicit", "ot", 0]]}, "result": [[0.004861683761904762, 0.004862658904761905, 0.0048639998571428575], 0, 3.929309606552124, 1678727826.5940387], "version": 0.2, "tvm_version": "0.10.0"}
{"input": ["cuda -keys=cuda,gpu -arch=sm_75 -max_num_threads=1024 -thread_warp_size=32", "conv2d_nchw.cuda", [["TENSOR", [1, 3, 224, 224], "float32"], ["TENSOR", [64, 3, 7, 7], "float32"], [2, 2], [3, 3, 3, 3], [1, 1], "float32"], {}], "config": {"index": 42868676, "code_hash": null, "entity": [["tile_f", "sp", [-1, 16, 1, 2]], ["tile_y", "sp", [-1, 4, 28, 1]], ["tile_x", "sp", [-1, 14, 1, 1]], ["tile_rc", "sp", [-1, 1]], ["tile_ry", "sp", [-1, 7]], ["tile_rx", "sp", [-1, 1]], ["auto_unroll_max_step", "ot", 0], ["unroll_explicit", "ot", 1]]}, "result": [[0.009803217727272728, 0.00983861818181818, 0.009840081636363636], 0, 10.463165283203125, 1678727827.5237067], "version": 0.2, "tvm_version": "0.10.0"}
{"input": ["cuda -keys=cuda,gpu -arch=sm_75 -max_num_threads=1024 -thread_warp_size=32", "conv2d_nchw.cuda", [["TENSOR", [1, 3, 224, 224], "float32"], ["TENSOR", [64, 3, 7, 7], "float32"], [2, 2], [3, 3, 3, 3], [1, 1], "float32"], {}], "config": {"index": 5566660, "code_hash": null, "entity": [["tile_f", "sp", [-1, 1, 1, 8]], ["tile_y", "sp", [-1, 8, 1, 2]], ["tile_x", "sp", [-1, 1, 2, 2]], ["tile_rc", "sp", [-1, 3]], ["tile_ry", "sp", [-1, 7]], ["tile_rx", "sp", [-1, 1]], ["auto_unroll_max_step", "ot", 0], ["unroll_explicit", "ot", 0]]}, "result": [[0.022394496, 0.0224123518, 0.022444972200000003], 0, 2.295722484588623, 1678727828.5172808], "version": 0.2, "tvm_version": "0.10.0"}
{"input": ["cuda -keys=cuda,gpu -arch=sm_75 -max_num_threads=1024 -thread_warp_size=32", "conv2d_nchw.cuda", [["TENSOR", [1, 3, 224, 224], "float32"], ["TENSOR", [64, 3, 7, 7], "float32"], [2, 2], [3, 3, 3, 3], [1, 1], "float32"], {}], "config": {"index": 48187064, "code_hash": null, "entity": [["tile_f", "sp", [-1, 2, 8, 2]], ["tile_y", "sp", [-1, 1, 1, 4]], ["tile_x", "sp", [-1, 1, 16, 1]], ["tile_rc", "sp", [-1, 3]], ["tile_ry", "sp", [-1, 1]], ["tile_rx", "sp", [-1, 7]], ["auto_unroll_max_step", "ot", 0], ["unroll_explicit", "ot", 1]]}, "result": [[0.0002874205545617174, 0.00028744173703041146, 0.00028744569588550986], 0, 1.992549180984497, 1678727829.756586], "version": 0.2, "tvm_version": "0.10.0"}
{"input": ["cuda -keys=cuda,gpu -arch=sm_75 -max_num_threads=1024 -thread_warp_size=32", "conv2d_nchw.cuda", [["TENSOR", [1, 3, 224, 224], "float32"], ["TENSOR", [64, 3, 7, 7], "float32"], [2, 2], [3, 3, 3, 3], [1, 1], "float32"], {}], "config": {"index": 72963628, "code_hash": null, "entity": [["tile_f", "sp", [-1, 8, 1, 4]], ["tile_y", "sp", [-1, 2, 2, 2]], ["tile_x", "sp", [-1, 1, 112, 1]], ["tile_rc", "sp", [-1, 1]], ["tile_ry", "sp", [-1, 1]], ["tile_rx", "sp", [-1, 7]], ["auto_unroll_max_step", "ot", 1500], ["unroll_explicit", "ot", 1]]}, "result": [[0.00026806420770519266, 0.00026808902512562814, 0.00026811031658291457], 0, 3.3527305126190186, 1678727831.0377924], "version": 0.2, "tvm_version": "0.10.0"}
{"input": ["cuda -keys=cuda,gpu -arch=sm_75 -max_num_threads=1024 -thread_warp_size=32", "conv2d_nchw.cuda", [["TENSOR", [1, 3, 224, 224], "float32"], ["TENSOR", [64, 3, 7, 7], "float32"], [2, 2], [3, 3, 3, 3], [1, 1], "float32"], {}], "config": {"index": 4989010, "code_hash": null, "entity": [["tile_f", "sp", [-1, 1, 2, 32]], ["tile_y", "sp", [-1, 14, 8, 1]], ["tile_x", "sp", [-1, 8, 1, 1]], ["tile_rc", "sp", [-1, 3]], ["tile_ry", "sp", [-1, 7]], ["tile_rx", "sp", [-1, 1]], ["auto_unroll_max_step", "ot", 0], ["unroll_explicit", "ot", 0]]}, "result": [[0.013598208375, 0.013602408375, 0.01360811225], 0, 3.1700096130371094, 1678727832.008595], "version": 0.2, "tvm_version": "0.10.0"}
{"input": ["cuda -keys=cuda,gpu -arch=sm_75 -max_num_threads=1024 -thread_warp_size=32", "conv2d_nchw.cuda", [["TENSOR", [1, 3, 224, 224], "float32"], ["TENSOR", [64, 3, 7, 7], "float32"], [2, 2], [3, 3, 3, 3], [1, 1], "float32"], {}], "config": {"index": 14603666, "code_hash": null, "entity": [["tile_f", "sp", [-1, 2, 4, 1]], ["tile_y", "sp", [-1, 7, 2, 8]], ["tile_x", "sp", [-1, 1, 2, 14]], ["tile_rc", "sp", [-1, 1]], ["tile_ry", "sp", [-1, 1]], ["tile_rx", "sp", [-1, 1]], ["auto_unroll_max_step", "ot", 512], ["unroll_explicit", "ot", 0]]}, "result": [[0.088079582, 0.088278305, 0.0889538265], 0, 3.1810052394866943, 1678727833.3488731], "version": 0.2, "tvm_version": "0.10.0"}
{"input": ["cuda -keys=cuda,gpu -arch=sm_75 -max_num_threads=1024 -thread_warp_size=32", "conv2d_nchw.cuda", [["TENSOR", [1, 3, 224, 224], "float32"], ["TENSOR", [64, 3, 7, 7], "float32"], [2, 2], [3, 3, 3, 3], [1, 1], "float32"], {}], "config": {"index": 48954588, "code_hash": null, "entity": [["tile_f", "sp", [-1, 4, 4, 4]], ["tile_y", "sp", [-1, 1, 2, 8]], ["tile_x", "sp", [-1, 1, 4, 7]], ["tile_rc", "sp", [-1, 3]], ["tile_ry", "sp", [-1, 1]], ["tile_rx", "sp", [-1, 7]], ["auto_unroll_max_step", "ot", 0], ["unroll_explicit", "ot", 1]]}, "result": [[0.005719772333333333, 0.005726208111111112, 0.005727004555555556], 0, 2.1496639251708984, 1678727844.3019993], "version": 0.2, "tvm_version": "0.10.0"}
{"input": ["cuda -keys=cuda,gpu -arch=sm_75 -max_num_threads=1024 -thread_warp_size=32", "conv2d_nchw.cuda", [["TENSOR", [1, 3, 224, 224], "float32"], ["TENSOR", [64, 3, 7, 7], "float32"], [2, 2], [3, 3, 3, 3], [1, 1], "float32"], {}], "config": {"index": 54188830, "code_hash": null, "entity": [["tile_f", "sp", [-1, 8, 2, 1]], ["tile_y", "sp", [-1, 2, 4, 14]], ["tile_x", "sp", [-1, 1, 1, 16]], ["tile_rc", "sp", [-1, 1]], ["tile_ry", "sp", [-1, 1]], ["tile_rx", "sp", [-1, 1]], ["auto_unroll_max_step", "ot", 512], ["unroll_explicit", "ot", 1]]}, "result": [[0.03952583566666667, 0.039526677333333336, 0.03956887533333333], 0, 4.819819450378418, 1678727845.4192312], "version": 0.2, "tvm_version": "0.10.0"}
{"input": ["cuda -keys=cuda,gpu -arch=sm_75 -max_num_threads=1024 -thread_warp_size=32", "conv2d_nchw.cuda", [["TENSOR", [1, 3, 224, 224], "float32"], ["TENSOR", [64, 3, 7, 7], "float32"], [2, 2], [3, 3, 3, 3], [1, 1], "float32"], {}], "config": {"index": 32963623, "code_hash": null, "entity": [["tile_f", "sp", [-1, 1, 2, 1]], ["tile_y", "sp", [-1, 8, 1, 1]], ["tile_x", "sp", [-1, 7, 1, 1]], ["tile_rc", "sp", [-1, 1]], ["tile_ry", "sp", [-1, 1]], ["tile_rx", "sp", [-1, 7]], ["auto_unroll_max_step", "ot", 1500], ["unroll_explicit", "ot", 0]]}, "result": [[0.0749189145, 0.0751604305, 0.075267601], 0, 3.547816514968872, 1678727846.6215537], "version": 0.2, "tvm_version": "0.10.0"}
{"input": ["cuda -keys=cuda,gpu -arch=sm_75 -max_num_threads=1024 -thread_warp_size=32", "conv2d_nchw.cuda", [["TENSOR", [1, 3, 224, 224], "float32"], ["TENSOR", [64, 3, 7, 7], "float32"], [2, 2], [3, 3, 3, 3], [1, 1], "float32"], {}], "config": {"index": 11398584, "code_hash": null, "entity": [["tile_f", "sp", [-1, 4, 2, 2]], ["tile_y", "sp", [-1, 1, 16, 1]], ["tile_x", "sp", [-1, 1, 7, 16]], ["tile_rc", "sp", [-1, 1]], ["tile_ry", "sp", [-1, 7]], ["tile_rx", "sp", [-1, 7]], ["auto_unroll_max_step", "ot", 0], ["unroll_explicit", "ot", 0]]}, "result": [[0.0003190654314516129, 0.0003190940725806451, 0.0003191230201612903], 0, 1.8595447540283203, 1678727847.8523035], "version": 0.2, "tvm_version": "0.10.0"}
{"input": ["cuda -keys=cuda,gpu -arch=sm_75 -max_num_threads=1024 -thread_warp_size=32", "conv2d_nchw.cuda", [["TENSOR", [1, 3, 224, 224], "float32"], ["TENSOR", [64, 3, 7, 7], "float32"], [2, 2], [3, 3, 3, 3], [1, 1], "float32"], {}], "config": {"index": 63576731, "code_hash": null, "entity": [["tile_f", "sp", [-1, 1, 4, 8]], ["tile_y", "sp", [-1, 2, 7, 1]], ["tile_x", "sp", [-1, 7, 4, 4]], ["tile_rc", "sp", [-1, 1]], ["tile_ry", "sp", [-1, 7]], ["tile_rx", "sp", [-1, 7]], ["auto_unroll_max_step", "ot", 512], ["unroll_explicit", "ot", 1]]}, "result": [[0.0035043111034482755, 0.003507024551724138, 0.0035094862068965516], 0, 4.574716329574585, 1678727848.681322], "version": 0.2, "tvm_version": "0.10.0"}
{"input": ["cuda -keys=cuda,gpu -arch=sm_75 -max_num_threads=1024 -thread_warp_size=32", "conv2d_nchw.cuda", [["TENSOR", [1, 3, 224, 224], "float32"], ["TENSOR", [64, 3, 7, 7], "float32"], [2, 2], [3, 3, 3, 3], [1, 1], "float32"], {}], "config": {"index": 73879170, "code_hash": null, "entity": [["tile_f", "sp", [-1, 2, 2, 16]], ["tile_y", "sp", [-1, 1, 14, 1]], ["tile_x", "sp", [-1, 2, 2, 14]], ["tile_rc", "sp", [-1, 1]], ["tile_ry", "sp", [-1, 1]], ["tile_rx", "sp", [-1, 7]], ["auto_unroll_max_step", "ot", 1500], ["unroll_explicit", "ot", 1]]}, "result": [[0.006017430470588235, 0.006017987823529411, 0.006018755705882353], 0, 8.009193181991577, 1678727849.579732], "version": 0.2, "tvm_version": "0.10.0"}
{"input": ["cuda -keys=cuda,gpu -arch=sm_75 -max_num_threads=1024 -thread_warp_size=32", "conv2d_nchw.cuda", [["TENSOR", [1, 3, 224, 224], "float32"], ["TENSOR", [64, 3, 7, 7], "float32"], [2, 2], [3, 3, 3, 3], [1, 1], "float32"], {}], "config": {"index": 6898714, "code_hash": null, "entity": [["tile_f", "sp", [-1, 1, 16, 2]], ["tile_y", "sp", [-1, 1, 7, 4]], ["tile_x", "sp", [-1, 4, 7, 1]], ["tile_rc", "sp", [-1, 1]], ["tile_ry", "sp", [-1, 1]], ["tile_rx", "sp", [-1, 7]], ["auto_unroll_max_step", "ot", 0], ["unroll_explicit", "ot", 0]]}, "result": [[0.0007445159635036496, 0.0007445601240875913, 0.0007465775182481752], 0, 1.2817137241363525, 1678727850.4734185], "version": 0.2, "tvm_version": "0.10.0"}
{"input": ["cuda -keys=cuda,gpu -arch=sm_75 -max_num_threads=1024 -thread_warp_size=32", "conv2d_nchw.cuda", [["TENSOR", [1, 3, 224, 224], "float32"], ["TENSOR", [64, 3, 7, 7], "float32"], [2, 2], [3, 3, 3, 3], [1, 1], "float32"], {}], "config": {"index": 1689628, "code_hash": null, "entity": [["tile_f", "sp", [-1, 8, 1, 4]], ["tile_y", "sp", [-1, 2, 1, 7]], ["tile_x", "sp", [-1, 7, 1, 1]], ["tile_rc", "sp", [-1, 3]], ["tile_ry", "sp", [-1, 1]], ["tile_rx", "sp", [-1, 1]], ["auto_unroll_max_step", "ot", 0], ["unroll_explicit", "ot", 0]]}, "result": [[0.275900421, 0.2759413755, 0.276008972], 0, 5.92497181892395, 1678727863.989526], "version": 0.2, "tvm_version": "0.10.0"}
{"input": ["cuda -keys=cuda,gpu -arch=sm_75 -max_num_threads=1024 -thread_warp_size=32", "conv2d_nchw.cuda", [["TENSOR", [1, 3, 224, 224], "float32"], ["TENSOR", [64, 3, 7, 7], "float32"], [2, 2], [3, 3, 3, 3], [1, 1], "float32"], {}], "config": {"index": 16193579, "code_hash": null, "entity": [["tile_f", "sp", [-1, 2, 4, 4]], ["tile_y", "sp", [-1, 1, 1, 1]], ["tile_x", "sp", [-1, 1, 1, 14]], ["tile_rc", "sp", [-1, 3]], ["tile_ry", "sp", [-1, 1]], ["tile_rx", "sp", [-1, 1]], ["auto_unroll_max_step", "ot", 512], ["unroll_explicit", "ot", 0]]}, "result": [[0.0020379366329113923, 0.0020384295443037974, 0.0020391117468354434], 0, 1.8898744583129883, 1678727865.2047067], "version": 0.2, "tvm_version": "0.10.0"}
{"input": ["cuda -keys=cuda,gpu -arch=sm_75 -max_num_threads=1024 -thread_warp_size=32", "conv2d_nchw.cuda", [["TENSOR", [1, 3, 224, 224], "float32"], ["TENSOR", [64, 3, 7, 7], "float32"], [2, 2], [3, 3, 3, 3], [1, 1], "float32"], {}], "config": {"index": 3145036, "code_hash": null, "entity": [["tile_f", "sp", [-1, 4, 1, 16]], ["tile_y", "sp", [-1, 2, 4, 2]], ["tile_x", "sp", [-1, 1, 1, 16]], ["tile_rc", "sp", [-1, 3]], ["tile_ry", "sp", [-1, 1]], ["tile_rx", "sp", [-1, 1]], ["auto_unroll_max_step", "ot", 0], ["unroll_explicit", "ot", 0]]}, "result": [[0.0246062972, 0.024715551600000003, 0.024740634], 0, 2.486098527908325, 1678727866.243485], "version": 0.2, "tvm_version": "0.10.0"}
{"input": ["cuda -keys=cuda,gpu -arch=sm_75 -max_num_threads=1024 -thread_warp_size=32", "conv2d_nchw.cuda", [["TENSOR", [1, 3, 224, 224], "float32"], ["TENSOR", [64, 3, 7, 7], "float32"], [2, 2], [3, 3, 3, 3], [1, 1], "float32"], {}], "config": {"index": 2003929, "code_hash": null, "entity": [["tile_f", "sp", [-1, 1, 32, 1]], ["tile_y", "sp", [-1, 7, 2, 2]], ["tile_x", "sp", [-1, 2, 8, 1]], ["tile_rc", "sp", [-1, 3]], ["tile_ry", "sp", [-1, 1]], ["tile_rx", "sp", [-1, 1]], ["auto_unroll_max_step", "ot", 0], ["unroll_explicit", "ot", 0]]}, "result": [[0.0009366250373831776, 0.0009366405794392523, 0.0009372967102803738], 0, 1.44730806350708, 1678727867.0817456], "version": 0.2, "tvm_version": "0.10.0"}
{"input": ["cuda -keys=cuda,gpu -arch=sm_75 -max_num_threads=1024 -thread_warp_size=32", "conv2d_nchw.cuda", [["TENSOR", [1, 3, 224, 224], "float32"], ["TENSOR", [64, 3, 7, 7], "float32"], [2, 2], [3, 3, 3, 3], [1, 1], "float32"], {}], "config": {"index": 71515381, "code_hash": null, "entity": [["tile_f", "sp", [-1, 1, 1, 4]], ["tile_y", "sp", [-1, 1, 14, 1]], ["tile_x", "sp", [-1, 7, 4, 2]], ["tile_rc", "sp", [-1, 3]], ["tile_ry", "sp", [-1, 7]], ["tile_rx", "sp", [-1, 1]], ["auto_unroll_max_step", "ot", 1500], ["unroll_explicit", "ot", 1]]}, "result": [[0.004616106181818182, 0.004620218090909091, 0.004627383136363636], 0, 9.515711545944214, 1678727868.005249], "version": 0.2, "tvm_version": "0.10.0"}
{"input": ["cuda -keys=cuda,gpu -arch=sm_75 -max_num_threads=1024 -thread_warp_size=32", "conv2d_nchw.cuda", [["TENSOR", [1, 3, 224, 224], "float32"], ["TENSOR", [64, 3, 7, 7], "float32"], [2, 2], [3, 3, 3, 3], [1, 1], "float32"], {}], "config": {"index": 43127262, "code_hash": null, "entity": [["tile_f", "sp", [-1, 4, 1, 8]], ["tile_y", "sp", [-1, 1, 28, 1]], ["tile_x", "sp", [-1, 8, 7, 1]], ["tile_rc", "sp", [-1, 1]], ["tile_ry", "sp", [-1, 7]], ["tile_rx", "sp", [-1, 1]], ["auto_unroll_max_step", "ot", 0], ["unroll_explicit", "ot", 1]]}, "result": [[0.0026144467692307692, 0.002615091743589744, 0.002615481435897436], 0, 1.8058512210845947, 1678727868.8990026], "version": 0.2, "tvm_version": "0.10.0"}
{"input": ["cuda -keys=cuda,gpu -arch=sm_75 -max_num_threads=1024 -thread_warp_size=32", "conv2d_nchw.cuda", [["TENSOR", [1, 3, 224, 224], "float32"], ["TENSOR", [64, 3, 7, 7], "float32"], [2, 2], [3, 3, 3, 3], [1, 1], "float32"], {}], "config": {"index": 61675100, "code_hash": null, "entity": [["tile_f", "sp", [-1, 16, 1, 2]], ["tile_y", "sp", [-1, 1, 8, 2]], ["tile_x", "sp", [-1, 2, 7, 2]], ["tile_rc", "sp", [-1, 3]], ["tile_ry", "sp", [-1, 1]], ["tile_rx", "sp", [-1, 7]], ["auto_unroll_max_step", "ot", 512], ["unroll_explicit", "ot", 1]]}, "result": [[0.0012344013596491228, 0.0012386470526315788, 0.001411169338028169], 0, 6.347162961959839, 1678727880.887303], "version": 0.2, "tvm_version": "0.10.0"}
{"input": ["cuda -keys=cuda,gpu -arch=sm_75 -max_num_threads=1024 -thread_warp_size=32", "conv2d_nchw.cuda", [["TENSOR", [1, 3, 224, 224], "float32"], ["TENSOR", [64, 3, 7, 7], "float32"], [2, 2], [3, 3, 3, 3], [1, 1], "float32"], {}], "config": {"index": 52706676, "code_hash": null, "entity": [["tile_f", "sp", [-1, 4, 2, 2]], ["tile_y", "sp", [-1, 8, 1, 14]], ["tile_x", "sp", [-1, 2, 1, 1]], ["tile_rc", "sp", [-1, 1]], ["tile_ry", "sp", [-1, 1]], ["tile_rx", "sp", [-1, 1]], ["auto_unroll_max_step", "ot", 512], ["unroll_explicit", "ot", 1]]}, "result": [[0.1424517055, 0.142497238, 0.14251989699999998], 0, 8.333910465240479, 1678727882.7867966], "version": 0.2, "tvm_version": "0.10.0"}
{"input": ["cuda -keys=cuda,gpu -arch=sm_75 -max_num_threads=1024 -thread_warp_size=32", "conv2d_nchw.cuda", [["TENSOR", [1, 3, 224, 224], "float32"], ["TENSOR", [64, 3, 7, 7], "float32"], [2, 2], [3, 3, 3, 3], [1, 1], "float32"], {}], "config": {"index": 57733703, "code_hash": null, "entity": [["tile_f", "sp", [-1, 1, 1, 64]], ["tile_y", "sp", [-1, 1, 1, 2]], ["tile_x", "sp", [-1, 112, 1, 1]], ["tile_rc", "sp", [-1, 3]], ["tile_ry", "sp", [-1, 7]], ["tile_rx", "sp", [-1, 1]], ["auto_unroll_max_step", "ot", 512], ["unroll_explicit", "ot", 1]]}, "result": [[0.2155664215, 0.2156191555, 0.2156963805], 0, 7.863374948501587, 1678727885.556889], "version": 0.2, "tvm_version": "0.10.0"}
{"input": ["cuda -keys=cuda,gpu -arch=sm_75 -max_num_threads=1024 -thread_warp_size=32", "conv2d_nchw.cuda", [["TENSOR", [1, 3, 224, 224], "float32"], ["TENSOR", [64, 3, 7, 7], "float32"], [2, 2], [3, 3, 3, 3], [1, 1], "float32"], {}], "config": {"index": 30529202, "code_hash": null, "entity": [["tile_f", "sp", [-1, 1, 1, 16]], ["tile_y", "sp", [-1, 4, 1, 1]], ["tile_x", "sp", [-1, 2, 1, 4]], ["tile_rc", "sp", [-1, 1]], ["tile_ry", "sp", [-1, 7]], ["tile_rx", "sp", [-1, 1]], ["auto_unroll_max_step", "ot", 1500], ["unroll_explicit", "ot", 0]]}, "result": [[0.101905998, 0.101950096, 0.10196399649999999], 0, 3.09039306640625, 1678727887.07384], "version": 0.2, "tvm_version": "0.10.0"}
{"input": ["cuda -keys=cuda,gpu -arch=sm_75 -max_num_threads=1024 -thread_warp_size=32", "conv2d_nchw.cuda", [["TENSOR", [1, 3, 224, 224], "float32"], ["TENSOR", [64, 3, 7, 7], "float32"], [2, 2], [3, 3, 3, 3], [1, 1], "float32"], {}], "config": {"index": 55258318, "code_hash": null, "entity": [["tile_f", "sp", [-1, 8, 2, 1]], ["tile_y", "sp", [-1, 1, 1, 14]], ["tile_x", "sp", [-1, 7, 1, 4]], ["tile_rc", "sp", [-1, 3]], ["tile_ry", "sp", [-1, 1]], ["tile_rx", "sp", [-1, 1]], ["auto_unroll_max_step", "ot", 512], ["unroll_explicit", "ot", 1]]}, "result": [[0.1328179015, 0.1334374385, 0.1338312835], 0, 5.304044723510742, 1678727888.9272885], "version": 0.2, "tvm_version": "0.10.0"}
{"input": ["cuda -keys=cuda,gpu -arch=sm_75 -max_num_threads=1024 -thread_warp_size=32", "conv2d_nchw.cuda", [["TENSOR", [1, 3, 224, 224], "float32"], ["TENSOR", [64, 3, 7, 7], "float32"], [2, 2], [3, 3, 3, 3], [1, 1], "float32"], {}], "config": {"index": 50062380, "code_hash": null, "entity": [["tile_f", "sp", [-1, 4, 4, 4]], ["tile_y", "sp", [-1, 1, 1, 1]], ["tile_x", "sp", [-1, 14, 2, 2]], ["tile_rc", "sp", [-1, 1]], ["tile_ry", "sp", [-1, 7]], ["tile_rx", "sp", [-1, 7]], ["auto_unroll_max_step", "ot", 0], ["unroll_explicit", "ot", 1]]}, "result": [[0.02564090325, 0.025653791250000002, 0.025657911250000002], 0, 2.15615177154541, 1678727889.9173546], "version": 0.2, "tvm_version": "0.10.0"}
{"input": ["cuda -keys=cuda,gpu -arch=sm_75 -max_num_threads=1024 -thread_warp_size=32", "conv2d_nchw.cuda", [["TENSOR", [1, 3, 224, 224], "float32"], ["TENSOR", [64, 3, 7, 7], "float32"], [2, 2], [3, 3, 3, 3], [1, 1], "float32"], {}], "config": {"index": 23668276, "code_hash": null, "entity": [["tile_f", "sp", [-1, 8, 4, 1]], ["tile_y", "sp", [-1, 1, 4, 4]], ["tile_x", "sp", [-1, 56, 1, 2]], ["tile_rc", "sp", [-1, 1]], ["tile_ry", "sp", [-1, 7]], ["tile_rx", "sp", [-1, 7]], ["auto_unroll_max_step", "ot", 512], ["unroll_explicit", "ot", 0]]}, "result": [[0.017065935666666667, 0.0170679575, 0.017068373333333334], 0, 5.23712420463562, 1678727890.874491], "version": 0.2, "tvm_version": "0.10.0"}
{"input": ["cuda -keys=cuda,gpu -arch=sm_75 -max_num_threads=1024 -thread_warp_size=32", "conv2d_nchw.cuda", [["TENSOR", [1, 3, 224, 224], "float32"], ["TENSOR", [64, 3, 7, 7], "float32"], [2, 2], [3, 3, 3, 3], [1, 1], "float32"], {}], "config": {"index": 47263876, "code_hash": null, "entity": [["tile_f", "sp", [-1, 8, 4, 1]], ["tile_y", "sp", [-1, 14, 1, 1]], ["tile_x", "sp", [-1, 2, 2, 7]], ["tile_rc", "sp", [-1, 1]], ["tile_ry", "sp", [-1, 1]], ["tile_rx", "sp", [-1, 7]], ["auto_unroll_max_step", "ot", 0], ["unroll_explicit", "ot", 1]]}, "result": [[0.032735321, 0.03273788825, 0.032853614749999996], 0, 4.4632627964019775, 1678727902.12145], "version": 0.2, "tvm_version": "0.10.0"}
{"input": ["cuda -keys=cuda,gpu -arch=sm_75 -max_num_threads=1024 -thread_warp_size=32", "conv2d_nchw.cuda", [["TENSOR", [1, 3, 224, 224], "float32"], ["TENSOR", [64, 3, 7, 7], "float32"], [2, 2], [3, 3, 3, 3], [1, 1], "float32"], {}], "config": {"index": 8312768, "code_hash": null, "entity": [["tile_f", "sp", [-1, 2, 8, 2]], ["tile_y", "sp", [-1, 1, 2, 14]], ["tile_x", "sp", [-1, 16, 1, 1]], ["tile_rc", "sp", [-1, 3]], ["tile_ry", "sp", [-1, 1]], ["tile_rx", "sp", [-1, 7]], ["auto_unroll_max_step", "ot", 0], ["unroll_explicit", "ot", 0]]}, "result": [[0.01602640857142857, 0.01604471257142857, 0.016045828571428573], 0, 2.154146194458008, 1678727903.0717223], "version": 0.2, "tvm_version": "0.10.0"}
{"input": ["cuda -keys=cuda,gpu -arch=sm_75 -max_num_threads=1024 -thread_warp_size=32", "conv2d_nchw.cuda", [["TENSOR", [1, 3, 224, 224], "float32"], ["TENSOR", [64, 3, 7, 7], "float32"], [2, 2], [3, 3, 3, 3], [1, 1], "float32"], {}], "config": {"index": 52952608, "code_hash": null, "entity": [["tile_f", "sp", [-1, 8, 4, 1]], ["tile_y", "sp", [-1, 1, 1, 8]], ["tile_x", "sp", [-1, 14, 4, 1]], ["tile_rc", "sp", [-1, 1]], ["tile_ry", "sp", [-1, 1]], ["tile_rx", "sp", [-1, 1]], ["auto_unroll_max_step", "ot", 512], ["unroll_explicit", "ot", 1]]}, "result": [[0.018260106333333335, 0.01826550916666667, 0.018269184], 0, 4.685838937759399, 1678727904.031911], "version": 0.2, "tvm_version": "0.10.0"}
{"input": ["cuda -keys=cuda,gpu -arch=sm_75 -max_num_threads=1024 -thread_warp_size=32", "conv2d_nchw.cuda", [["TENSOR", [1, 3, 224, 224], "float32"], ["TENSOR", [64, 3, 7, 7], "float32"], [2, 2], [3, 3, 3, 3], [1, 1], "float32"], {}], "config": {"index": 40228476, "code_hash": null, "entity": [["tile_f", "sp", [-1, 4, 2, 2]], ["tile_y", "sp", [-1, 7, 1, 8]], ["tile_x", "sp", [-1, 2, 4, 2]], ["tile_rc", "sp", [-1, 1]], ["tile_ry", "sp", [-1, 1]], ["tile_rx", "sp", [-1, 1]], ["auto_unroll_max_step", "ot", 0], ["unroll_explicit", "ot", 1]]}, "result": [[0.0265692005, 0.0268338165, 0.02685696025], 0, 2.4361584186553955, 1678727906.6936007], "version": 0.2, "tvm_version": "0.10.0"}
{"input": ["cuda -keys=cuda,gpu -arch=sm_75 -max_num_threads=1024 -thread_warp_size=32", "conv2d_nchw.cuda", [["TENSOR", [1, 3, 224, 224], "float32"], ["TENSOR", [64, 3, 7, 7], "float32"], [2, 2], [3, 3, 3, 3], [1, 1], "float32"], {}], "config": {"index": 11765638, "code_hash": null, "entity": [["tile_f", "sp", [-1, 8, 2, 1]], ["tile_y", "sp", [-1, 1, 8, 2]], ["tile_x", "sp", [-1, 4, 4, 1]], ["tile_rc", "sp", [-1, 3]], ["tile_ry", "sp", [-1, 7]], ["tile_rx", "sp", [-1, 7]], ["auto_unroll_max_step", "ot", 0], ["unroll_explicit", "ot", 0]]}, "result": [[0.0003791742830188679, 0.0003793828113207547, 0.00037968024150943395], 0, 1.687648057937622, 1678727907.5338328], "version": 0.2, "tvm_version": "0.10.0"}
